drop database if exists test;
create database test;
use test;
drop snapshot if exists sp1;
drop snapshot if exists sp2;
create table t0 (a int, b int, primary key(a));
insert into t0 values (1,1),(2,2),(3,3);
data branch create table t1 from t0;
create snapshot sp1 for account sys;
insert into t1 values (4,4),(5,5);
create snapshot sp2 for account sys;
insert into t1 values (6,6),(7,7);
data branch pick t1 into t0 between snapshot sp1 and sp2;
select * from t0 order by a asc;
➤ a[4,32,0]  ¦  b[4,32,0]  𝄀
1  ¦  1  𝄀
2  ¦  2  𝄀
3  ¦  3  𝄀
4  ¦  4  𝄀
5  ¦  5
data branch diff t1 against t0;
➤ diff t1 against t0[12,0,0]  ¦  flag[12,0,0]  ¦  a[4,0,0]  ¦  b[4,0,0]  𝄀
t1  ¦  INSERT  ¦  6  ¦  6  𝄀
t1  ¦  INSERT  ¦  7  ¦  7
drop snapshot sp1;
drop snapshot sp2;
drop table t0;
drop table t1;
drop snapshot if exists sp1;
drop snapshot if exists sp2;
create table t0 (a int, b int, primary key(a));
insert into t0 values (1,1),(2,2),(3,3);
data branch create table t1 from t0;
create snapshot sp1 for account sys;
insert into t1 values (4,4),(5,5);
create snapshot sp2 for account sys;
insert into t1 values (6,6),(7,7);
data branch pick t1 into t0 between snapshot sp1 and sp2 keys(4);
select * from t0 order by a asc;
➤ a[4,32,0]  ¦  b[4,32,0]  𝄀
1  ¦  1  𝄀
2  ¦  2  𝄀
3  ¦  3  𝄀
4  ¦  4
drop snapshot sp1;
drop snapshot sp2;
drop table t0;
drop table t1;
drop snapshot if exists sp1;
drop snapshot if exists sp2;
create table t0 (a int, b int, primary key(a));
insert into t0 values (1,1),(2,2),(3,3);
data branch create table t1 from t0;
create snapshot sp1 for account sys;
create snapshot sp2 for account sys;
insert into t1 values (4,4);
data branch pick t1 into t0 between snapshot sp1 and sp2;
select * from t0 order by a asc;
➤ a[4,32,0]  ¦  b[4,32,0]  𝄀
1  ¦  1  𝄀
2  ¦  2  𝄀
3  ¦  3
drop snapshot sp1;
drop snapshot sp2;
drop table t0;
drop table t1;
drop snapshot if exists sp1;
drop snapshot if exists sp2;
create table t0 (a int, b int, primary key(a));
insert into t0 values (1,1),(2,2),(3,3),(4,4),(5,5);
data branch create table t1 from t0;
create snapshot sp1 for account sys;
delete from t1 where a=3;
insert into t1 values (6,6);
create snapshot sp2 for account sys;
data branch pick t1 into t0 between snapshot sp1 and sp2;
select * from t0 order by a asc;
➤ a[4,32,0]  ¦  b[4,32,0]  𝄀
1  ¦  1  𝄀
2  ¦  2  𝄀
4  ¦  4  𝄀
5  ¦  5  𝄀
6  ¦  6
drop snapshot sp1;
drop snapshot sp2;
drop table t0;
drop table t1;
drop snapshot if exists sp1;
drop snapshot if exists sp2;
create table t0 (a int, b int, primary key(a));
insert into t0 values (1,1);
data branch create table t1 from t0;
data branch create table t2 from t0;
create snapshot sp1 for account sys;
insert into t1 values (2,200);
insert into t2 values (2,20);
insert into t1 values (3,3);
create snapshot sp2 for account sys;
data branch pick t1 into t2 between snapshot sp1 and sp2 when conflict skip;
select * from t2 order by a asc;
➤ a[4,32,0]  ¦  b[4,32,0]  𝄀
1  ¦  1  𝄀
2  ¦  20  𝄀
3  ¦  3
drop snapshot sp1;
drop snapshot sp2;
drop table t0;
drop table t1;
drop table t2;
drop snapshot if exists sp1;
drop snapshot if exists sp2;
create table t1 (a int, b int, primary key(a));
insert into t1 values (1,1),(2,2);
create snapshot sp1 for account sys;
insert into t1 values (3,3),(4,4);
create snapshot sp2 for account sys;
insert into t1 values (5,5);
create table t2 (a int, b int, primary key(a));
data branch pick t1 into t2 between snapshot sp1 and sp2;
select * from t2 order by a asc;
➤ a[4,32,0]  ¦  b[4,32,0]  𝄀
3  ¦  3  𝄀
4  ¦  4
drop snapshot sp1;
drop snapshot sp2;
drop table t1;
drop table t2;
drop database test;
