drop database if exists test;
create database test;
use test;
create table t0 (a int, b int, primary key(a));
insert into t0 values (1,1),(2,2);
data branch create table t1 from t0;
insert into t1 values (3,30);
data branch create table t2 from t0;
insert into t2 values (3,40);
data branch pick t2 into t1 keys(3);
conflict key found
data branch pick t2 into t1 keys(3) when conflict skip;
select * from t1 order by a asc;
a    b
1    1
2    2
3    30
data branch pick t2 into t1 keys(3) when conflict accept;
select * from t1 order by a asc;
a    b
1    1
2    2
3    40
drop table t0;
drop table t1;
drop table t2;
create table t1 (a int, b int, primary key(a));
insert into t1 values (1,10),(2,20);
create table t2 (a int, b int, primary key(a));
insert into t2 values (1,100),(3,30);
data branch pick t2 into t1 keys(1);
conflict key found
data branch pick t2 into t1 keys(1) when conflict skip;
select * from t1 order by a asc;
a    b
1    10
2    20
data branch pick t2 into t1 keys(1) when conflict accept;
select * from t1 order by a asc;
a    b
1    100
2    20
data branch pick t2 into t1 keys(3);
select * from t1 order by a asc;
a    b
1    100
2    20
3    30
drop table t1;
drop table t2;
create table t0 (a int, b int, primary key(a));
insert into t0 values (1,1),(2,2),(3,3);
data branch create table t1 from t0;
update t1 set b = 10 where a = 1;
data branch create table t2 from t0;
update t2 set b = 20 where a = 1;
data branch pick t2 into t1 keys(1);
conflict key found
data branch pick t2 into t1 keys(1) when conflict skip;
select * from t1 order by a asc;
a    b
1    10
2    2
3    3
data branch pick t2 into t1 keys(1) when conflict accept;
select * from t1 order by a asc;
a    b
1    20
2    2
3    3
drop table t0;
drop table t1;
drop table t2;
drop database test;
