drop database if exists branch_pick_foreign_key_update;
create database branch_pick_foreign_key_update;
use branch_pick_foreign_key_update;
create table child_t (id int primary key, note varchar(32));
create table parent_t (
id int primary key,
child_id int,
constraint fk_parent_child foreign key (child_id) references child_t(id)
);
insert into child_t values (1, 'one'), (2, 'two');
insert into parent_t values (1, 1), (2, 2);
data branch create table leaf_pick from child_t;
update leaf_pick set note = 'leaf-pick-clean' where id = 1;
update leaf_pick set note = 'leaf-pick' where id = 2;
data branch pick leaf_pick into child_t keys(1) when conflict accept;
select id, note from child_t order by id;
➤ id[4,32,0]  ¦  note[12,32,0]  𝄀
1  ¦  leaf-pick-clean  𝄀
2  ¦  two
update child_t set note = 'direct-control' where id = 2;
select id, note from child_t order by id;
➤ id[4,32,0]  ¦  note[12,32,0]  𝄀
1  ¦  leaf-pick-clean  𝄀
2  ¦  direct-control
data branch pick leaf_pick into child_t keys(2) when conflict fail;
internal error: conflict: leaf_pick INSERT and child_t INSERT on pk(2) with different values
select id, note from child_t order by id;
➤ id[4,32,0]  ¦  note[12,32,0]  𝄀
1  ¦  leaf-pick-clean  𝄀
2  ¦  direct-control
data branch pick leaf_pick into child_t keys(2) when conflict accept;
select id, note from child_t order by id;
➤ id[4,32,0]  ¦  note[12,32,0]  𝄀
1  ¦  leaf-pick-clean  𝄀
2  ¦  leaf-pick
drop database branch_pick_foreign_key_update;
