drop database if exists test;
create database test;
use test;
create table t0 (a int, b int, primary key(a));
insert into t0 values (1,1),(2,2),(3,3);
data branch create table t1 from t0;
insert into t1 values (4,40);
data branch create table t2 from t0;
select * from t1 order by a asc;
a	b
1	1
2	2
3	3
4	40
data branch pick t2 into t1 keys(4);
select * from t1 order by a asc;
a	b
1	1
2	2
3	3
4	40
drop table t0;
drop table t1;
drop table t2;
create table t0 (a int, b int, primary key(a));
insert into t0 values (1,1),(2,2),(3,3);
data branch create table t1 from t0;
delete from t1 where a = 2;
data branch create table t2 from t0;
delete from t2 where a = 2;
select * from t1 order by a asc;
a	b
1	1
3	3
data branch pick t2 into t1 keys(2);
select * from t1 order by a asc;
a	b
1	1
3	3
drop table t0;
drop table t1;
drop table t2;
create table t0 (a int, b int, primary key(a));
insert into t0 values (1,1),(2,2),(3,3);
data branch create table t1 from t0;
data branch create table t2 from t0;
delete from t2 where a = 2;
select * from t1 order by a asc;
a	b
1	1
2	2
3	3
data branch pick t2 into t1 keys(2);
select * from t1 order by a asc;
a	b
1	1
3	3
drop table t0;
drop table t1;
drop table t2;
create table t0 (a int, b int, primary key(a));
insert into t0 values (1,1),(2,2),(3,3);
data branch create table t1 from t0;
delete from t1 where a = 2;
data branch create table t2 from t0;
update t2 set b = 200 where a = 2;
select * from t1 order by a asc;
a	b
1	1
3	3
data branch pick t2 into t1 keys(2) when conflict fail;
internal error: conflict: t2 INSERT and t1 INSERT on pk(2) with different values
data branch pick t2 into t1 keys(2) when conflict accept;
select * from t1 order by a asc;
a	b
1	1
2	200
3	3
drop table t0;
drop table t1;
drop table t2;
create table t0 (a int, b int, primary key(a));
insert into t0 values (1,1),(2,2),(3,3),(4,4),(5,5);
data branch create table t1 from t0;
update t1 set b = 10 where a = 1;
insert into t1 values (6,6);
data branch create table t2 from t0;
delete from t2 where a = 3;
select * from t1 order by a asc;
a	b
1	10
2	2
3	3
4	4
5	5
6	6
data branch pick t2 into t1 keys(3);
select * from t1 order by a asc;
a	b
1	10
2	2
4	4
5	5
6	6
drop table t0;
drop table t1;
drop table t2;
create table t1 (a int, b int, primary key(a));
insert into t1 values (1,1),(2,2),(3,3);
create table t2 (a int, b int, primary key(a));
insert into t2 values (1,1),(2,2);
data branch pick t2 into t1 keys(3);
select * from t1 order by a asc;
a	b
1	1
2	2
3	3
drop table t1;
drop table t2;
drop database test;
