drop database if exists test;
create database test;
use test;
create table t1 (name varchar(50), val int, primary key(name));
insert into t1 values ('alice',1),('bob',2),('charlie',3);
create table t2 (name varchar(50), val int, primary key(name));
insert into t2 values ('alice',1),('bob',2),('dave',4),('eve',5);
data branch diff t2 against t1;
diff t2 against t1	flag	name	val
t1	INSERT	charlie	3
t2	INSERT	dave	4
t2	INSERT	eve	5
data branch pick t2 into t1 keys('dave');
select * from t1 order by name asc;
name	val
alice	1
bob	2
charlie	3
dave	4
data branch pick t2 into t1 keys('eve');
select * from t1 order by name asc;
name	val
alice	1
bob	2
charlie	3
dave	4
eve	5
drop table t1;
drop table t2;
create table t1 (id bigint, data varchar(10), primary key(id));
insert into t1 values (1000000001,'a'),(1000000002,'b');
create table t2 (id bigint, data varchar(10), primary key(id));
insert into t2 values (1000000001,'a'),(1000000003,'c'),(1000000004,'d');
data branch pick t2 into t1 keys(1000000003);
select * from t1 order by id asc;
id	data
1000000001	a
1000000002	b
1000000003	c
drop table t1;
drop table t2;
create table t1 (
id int primary key,
name varchar(50),
score float,
active bool
);
insert into t1 values (1,'alice',95.5,true),(2,'bob',88.0,true);
create table t2 (
id int primary key,
name varchar(50),
score float,
active bool
);
insert into t2 values (1,'alice',95.5,true),(3,'charlie',92.0,false),(4,'dave',78.5,true);
data branch pick t2 into t1 keys(3,4);
select * from t1 order by id asc;
id	name	score	active
1	alice	95.5	true
2	bob	88.0	true
3	charlie	92.0	false
4	dave	78.5	true
drop table t1;
drop table t2;
create table t1 (a int, b int, primary key(a));
insert into t1 values (-5,1),(-3,2),(0,3);
create table t2 (a int, b int, primary key(a));
insert into t2 values (-5,1),(-4,2),(-2,3),(1,4);
data branch pick t2 into t1 keys(-4,-2);
select * from t1 order by a asc;
a	b
-5	1
-4	2
-3	2
-2	3
0	3
drop table t1;
drop table t2;
drop snapshot if exists sp_str;
create table t1 (name varchar(50), val int, primary key(name));
insert into t1 values ('alice',1),('bob',2),('charlie',3);
create snapshot sp_str for account sys;
update t1 set val = 999 where name = 'alice';
insert into t1 values ('dave', 4);
create table t2 (name varchar(50), val int, primary key(name));
data branch pick t1{snapshot=sp_str} into t2 keys('alice', 'bob', 'dave');
select * from t2 order by name;
name	val
alice	1
bob	2
drop snapshot sp_str;
drop table t1;
drop table t2;
create table t1 (
id int primary key,
amount decimal(10,2),
created date,
note varchar(50)
);
insert into t1 values
(1, 99.99, '2025-01-01', 'first'),
(2, 200.50, '2025-02-15', 'second');
create table t2 (
id int primary key,
amount decimal(10,2),
created date,
note varchar(50)
);
insert into t2 values
(1, 99.99, '2025-01-01', 'first'),
(3, 1234.56, '2025-03-20', 'third'),
(4, 0.01, '2025-12-31', 'tiny');
data branch pick t2 into t1 keys(3, 4);
select * from t1 order by id;
id	amount	created	note
1	99.99	2025-01-01	first
2	200.50	2025-02-15	second
3	1234.56	2025-03-20	third
4	0.01	2025-12-31	tiny
select id, amount from t1 where id in (3, 4) order by id;
id	amount
3	1234.56
4	0.01
drop table t1;
drop table t2;
create table t1 (a int, b varchar(200), primary key(a));
insert into t1 values (1, 'short');
create table t2 (a int, b varchar(200), primary key(a));
insert into t2 values
(1, 'short'),
(2, 'this is a moderately long string with numbers 12345 and special chars !@#$%'),
(3, ''),
(4, 'line1\nline2');
data branch pick t2 into t1 keys(2, 3, 4);
select a, length(b) from t1 order by a;
a	length(b)
1	5
2	75
3	0
4	11
drop table t1;
drop table t2;
drop database test;
