drop database if exists test;
create database test;
use test;
create table t0 (a int, b int, primary key(a));
insert into t0 values (1,1),(2,2);
data branch create table t1 from t0;
data branch create table t2 from t0;
insert into t2 values (3,3);
data branch pick t2 into t1 keys(99);
select * from t1 order by a asc;
➤ a[4,32,0]  ¦  b[4,32,0]  𝄀
1  ¦  1  𝄀
2  ¦  2
data branch pick t2 into t1 keys(3);
select * from t1 order by a asc;
➤ a[4,32,0]  ¦  b[4,32,0]  𝄀
1  ¦  1  𝄀
2  ¦  2  𝄀
3  ¦  3
drop table t0;
drop table t1;
drop table t2;
create table t0 (a int, b int, primary key(a));
insert into t0 values (1,1),(2,2);
data branch create table t1 from t0;
data branch create table t2 from t0;
insert into t2 values (3,3),(4,4),(5,5);
data branch pick t2 into t1 keys(3,4,5);
select * from t1 order by a asc;
➤ a[4,32,0]  ¦  b[4,32,0]  𝄀
1  ¦  1  𝄀
2  ¦  2  𝄀
3  ¦  3  𝄀
4  ¦  4  𝄀
5  ¦  5
data branch diff t2 against t1;
➤ diff t2 against t1[12,0,0]  ¦  flag[12,0,0]  ¦  a[4,0,0]  ¦  b[4,0,0]
drop table t0;
drop table t1;
drop table t2;
create table t1 (a int, b int, primary key(a));
insert into t1 values (1,1);
create table t2 (a int, b int, primary key(a));
insert into t2 values (1,1),(2,2),(3,3);
data branch pick t2 into t1 keys(2);
select * from t1 order by a asc;
➤ a[4,32,0]  ¦  b[4,32,0]  𝄀
1  ¦  1  𝄀
2  ¦  2
drop table t1;
drop table t2;
create table t0 (a int, b int, primary key(a));
insert into t0 values (1,1),(2,2);
data branch create table t1 from t0;
data branch create table t2 from t0;
insert into t2 values (3,3);
data branch pick t2 into t1 keys(3);
select * from t1 order by a asc;
➤ a[4,32,0]  ¦  b[4,32,0]  𝄀
1  ¦  1  𝄀
2  ¦  2  𝄀
3  ¦  3
data branch pick t2 into t1 keys(3) when conflict skip;
select * from t1 order by a asc;
➤ a[4,32,0]  ¦  b[4,32,0]  𝄀
1  ¦  1  𝄀
2  ¦  2  𝄀
3  ¦  3
drop table t0;
drop table t1;
drop table t2;
create table t1 (a int, b varchar(10), primary key(a));
insert into t1 values (1,'a'),(2,'b'),(3,'c');
create snapshot sp1 for table test t1;
create table t2 like t1;
insert into t2 values (1,'a'),(2,'b'),(4,'d'),(5,'e');
create snapshot sp2 for table test t2;
data branch pick t2{snapshot="sp2"} into t1{snapshot="sp1"} keys(4);
select * from t1 order by a asc;
➤ a[4,32,0]  ¦  b[12,-1,0]  𝄀
1  ¦  a  𝄀
2  ¦  b  𝄀
3  ¦  c  𝄀
4  ¦  d
drop snapshot sp1;
drop snapshot sp2;
drop table t1;
drop table t2;
drop snapshot if exists sp_v1;
drop snapshot if exists sp_v2;
drop snapshot if exists sp_v3;
create table t1 (a int, b varchar(20), primary key(a));
insert into t1 values (1, 'v0'), (2, 'v0'), (3, 'v0');
create snapshot sp_v1 for account sys;
update t1 set b = 'v1' where a = 1;
insert into t1 values (4, 'v1');
create snapshot sp_v2 for account sys;
update t1 set b = 'v2' where a = 2;
delete from t1 where a = 3;
insert into t1 values (5, 'v2');
create snapshot sp_v3 for account sys;
create table t2 (a int, b varchar(20), primary key(a));
data branch pick t1{snapshot=sp_v1} into t2 keys(1, 2, 3);
select * from t2 order by a;
➤ a[4,32,0]  ¦  b[12,-1,0]  𝄀
1  ¦  v0  𝄀
2  ¦  v0  𝄀
3  ¦  v0
drop table t2;
create table t2 (a int, b varchar(20), primary key(a));
data branch pick t1{snapshot=sp_v2} into t2 keys(1, 4);
select * from t2 order by a;
➤ a[4,32,0]  ¦  b[12,-1,0]  𝄀
1  ¦  v1  𝄀
4  ¦  v1
drop snapshot sp_v1;
drop snapshot sp_v2;
drop snapshot sp_v3;
drop table t1;
drop table t2;
drop snapshot if exists sp_100;
create table t1 (a int, b int, primary key(a));
insert into t1 select *, result * 3 from generate_series(1, 100) g;
create snapshot sp_100 for account sys;
delete from t1 where a > 80;
update t1 set b = 0 where a <= 20;
create table t2 (a int, b int, primary key(a));
data branch pick t1{snapshot=sp_100} into t2 keys(1, 50, 100);
select * from t2 order by a;
➤ a[4,32,0]  ¦  b[4,32,0]  𝄀
1  ¦  3  𝄀
50  ¦  150  𝄀
100  ¦  300
drop snapshot sp_100;
drop table t1;
drop table t2;
create table t1 (a int, b int, primary key(a));
insert into t1 values (1,1),(2,2),(3,3),(4,4),(5,5);
create table t2 (a int, b int, primary key(a));
insert into t2 values (10,10),(20,20),(30,30);
data branch pick t1 into t2 keys(1, 3, 5);
select * from t2 order by a;
➤ a[4,32,0]  ¦  b[4,32,0]  𝄀
1  ¦  1  𝄀
3  ¦  3  𝄀
5  ¦  5  𝄀
10  ¦  10  𝄀
20  ¦  20  𝄀
30  ¦  30
select count(*) from t2;
➤ count(*)[-5,64,0]  𝄀
6
drop table t1;
drop table t2;
drop database test;
