drop database if exists test;
create database test;
use test;
drop snapshot if exists sp1;
drop snapshot if exists sp2;
create table t0 (a int, b int, primary key(a));
insert into t0 values (1,1),(2,2),(3,3);
data branch create table t1 from t0;
create snapshot sp1 for account sys;
insert into t1 values (4,4),(5,5);
create snapshot sp2 for account sys;
insert into t1 values (6,6),(7,7);
data branch pick t1 into t0 between snapshot sp1 and sp2;
select * from t0 order by a asc;
➤ a[4,32,0]  ¦  b[4,32,0]  𝄀
1  ¦  1  𝄀
2  ¦  2  𝄀
3  ¦  3  𝄀
4  ¦  4  𝄀
5  ¦  5
data branch diff t1 against t0;
➤ diff t1 against t0[12,0,0]  ¦  flag[12,0,0]  ¦  a[4,0,0]  ¦  b[4,0,0]  𝄀
t1  ¦  INSERT  ¦  6  ¦  6  𝄀
t1  ¦  INSERT  ¦  7  ¦  7
drop snapshot sp1;
drop snapshot sp2;
drop table t0;
drop table t1;
drop snapshot if exists sp1;
drop snapshot if exists sp2;
create table t0 (a int, b int, primary key(a));
insert into t0 values (1,1),(2,2),(3,3);
data branch create table t1 from t0;
create snapshot sp1 for account sys;
insert into t1 values (4,4),(5,5);
create snapshot sp2 for account sys;
insert into t1 values (6,6),(7,7);
data branch pick t1 into t0 between snapshot sp1 and sp2 keys(4);
select * from t0 order by a asc;
➤ a[4,32,0]  ¦  b[4,32,0]  𝄀
1  ¦  1  𝄀
2  ¦  2  𝄀
3  ¦  3  𝄀
4  ¦  4
drop snapshot sp1;
drop snapshot sp2;
drop table t0;
drop table t1;
drop snapshot if exists sp1;
drop snapshot if exists sp2;
create table t0 (a int, b int, primary key(a));
insert into t0 values (1,1),(2,2),(3,3);
data branch create table t1 from t0;
create snapshot sp1 for account sys;
create snapshot sp2 for account sys;
insert into t1 values (4,4);
data branch pick t1 into t0 between snapshot sp1 and sp2;
select * from t0 order by a asc;
➤ a[4,32,0]  ¦  b[4,32,0]  𝄀
1  ¦  1  𝄀
2  ¦  2  𝄀
3  ¦  3
drop snapshot sp1;
drop snapshot sp2;
drop table t0;
drop table t1;
drop snapshot if exists sp1;
drop snapshot if exists sp2;
create table t0 (a int, b int, primary key(a));
insert into t0 values (1,1),(2,2),(3,3),(4,4),(5,5);
data branch create table t1 from t0;
create snapshot sp1 for account sys;
delete from t1 where a=3;
insert into t1 values (6,6);
create snapshot sp2 for account sys;
data branch pick t1 into t0 between snapshot sp1 and sp2;
select * from t0 order by a asc;
➤ a[4,32,0]  ¦  b[4,32,0]  𝄀
1  ¦  1  𝄀
2  ¦  2  𝄀
4  ¦  4  𝄀
5  ¦  5  𝄀
6  ¦  6
drop snapshot sp1;
drop snapshot sp2;
drop table t0;
drop table t1;
drop snapshot if exists sp1;
drop snapshot if exists sp2;
create table t0 (a int, b int, primary key(a));
insert into t0 values (1,1);
data branch create table t1 from t0;
data branch create table t2 from t0;
create snapshot sp1 for account sys;
insert into t1 values (2,200);
insert into t2 values (2,20);
insert into t1 values (3,3);
create snapshot sp2 for account sys;
data branch pick t1 into t2 between snapshot sp1 and sp2 when conflict skip;
select * from t2 order by a asc;
➤ a[4,32,0]  ¦  b[4,32,0]  𝄀
1  ¦  1  𝄀
2  ¦  20  𝄀
3  ¦  3
drop snapshot sp1;
drop snapshot sp2;
drop table t0;
drop table t1;
drop table t2;
drop snapshot if exists sp1;
drop snapshot if exists sp2;
create table t1 (a int, b int, primary key(a));
insert into t1 values (1,1),(2,2);
create snapshot sp1 for account sys;
insert into t1 values (3,3),(4,4);
create snapshot sp2 for account sys;
insert into t1 values (5,5);
create table t2 (a int, b int, primary key(a));
data branch pick t1 into t2 between snapshot sp1 and sp2;
select * from t2 order by a asc;
➤ a[4,32,0]  ¦  b[4,32,0]  𝄀
3  ¦  3  𝄀
4  ¦  4
drop snapshot sp1;
drop snapshot sp2;
drop table t1;
drop table t2;
drop snapshot if exists sp_schema_from;
drop snapshot if exists sp_schema_to;
create table t0 (a int, b int, primary key(a));
insert into t0 values (1,1);
data branch create table t1 from t0;
create snapshot sp_schema_from for account sys;
update t1 set b=10 where a=1;
alter table t1 add column c int default 7;
create snapshot sp_schema_to for account sys;
update t1 set b=20 where a=1;
data branch pick t1 into t0 between snapshot sp_schema_from and sp_schema_to;
select * from t0 order by a asc;
➤ a[4,32,0]  ¦  b[4,32,0]  𝄀
1  ¦  10
select * from t1 order by a asc;
➤ a[4,32,0]  ¦  b[4,32,0]  ¦  c[4,32,0]  𝄀
1  ¦  20  ¦  7
drop snapshot sp_schema_from;
drop snapshot sp_schema_to;
drop table t0;
drop table t1;
drop snapshot if exists sp_schema_from;
drop snapshot if exists sp_schema_to;
create table t0 (a int, b int, primary key(a));
insert into t0 values (1,1);
data branch create table t1 from t0;
create snapshot sp_schema_from for account sys;
update t1 set b=15 where a=1;
create snapshot sp_schema_to for account sys;
alter table t1 add column c int default 7;
update t1 set b=25 where a=1;
data branch pick t1 into t0 between snapshot sp_schema_from and sp_schema_to;
select * from t0 order by a asc;
➤ a[4,32,0]  ¦  b[4,32,0]  𝄀
1  ¦  15
select * from t1 order by a asc;
➤ a[4,32,0]  ¦  b[4,32,0]  ¦  c[4,32,0]  𝄀
1  ¦  25  ¦  7
drop snapshot sp_schema_from;
drop snapshot sp_schema_to;
drop table t0;
drop table t1;
drop snapshot if exists sp_nolca_from;
drop snapshot if exists sp_nolca_to;
create table t0 (a int, b int, primary key(a));
insert into t0 values (1,1),(2,2);
data branch create table t1 from t0;
create table t2 (a int, b int, c int default 7, primary key(a));
insert into t2 values (1,1,7),(2,200,7);
create snapshot sp_nolca_from for account sys;
update t1 set b=15 where a=1;
create snapshot sp_nolca_to for account sys;
alter table t1 add column c int default 7;
update t1 set b=25 where a=1;
data branch pick t1 into t2 between snapshot sp_nolca_from and sp_nolca_to when conflict accept;
select * from t2 order by a asc;
➤ a[4,32,0]  ¦  b[4,32,0]  ¦  c[4,32,0]  𝄀
1  ¦  15  ¦  null  𝄀
2  ¦  200  ¦  7
select * from t1 order by a asc;
➤ a[4,32,0]  ¦  b[4,32,0]  ¦  c[4,32,0]  𝄀
1  ¦  25  ¦  7  𝄀
2  ¦  2  ¦  7
drop snapshot sp_nolca_from;
drop snapshot sp_nolca_to;
drop table t2;
drop table t1;
drop table t0;
drop snapshot if exists sp_double_from;
drop snapshot if exists sp_double_to;
create table t0 (a int, b int, primary key(a));
insert into t0 values (1,1),(2,2);
data branch create table t1 from t0;
create table t2 (a int, b int, c int default 7, d int default 9, primary key(a));
insert into t2 values (1,100,70,90),(2,200,71,91);
create snapshot sp_double_from for account sys;
update t1 set b=10 where a=1;
alter table t1 add column c int default 7;
update t1 set b=15,c=8 where a=1;
create snapshot sp_double_to for account sys;
alter table t1 add column d int default 9;
update t1 set b=25,c=18,d=19 where a=1;
data branch pick t1 into t2 between snapshot sp_double_from and sp_double_to when conflict accept;
select * from t2 order by a asc;
➤ a[4,32,0]  ¦  b[4,32,0]  ¦  c[4,32,0]  ¦  d[4,32,0]  𝄀
1  ¦  15  ¦  8  ¦  null  𝄀
2  ¦  200  ¦  71  ¦  91
select * from t1 order by a asc;
➤ a[4,32,0]  ¦  b[4,32,0]  ¦  c[4,32,0]  ¦  d[4,32,0]  𝄀
1  ¦  25  ¦  18  ¦  19  𝄀
2  ¦  2  ¦  7  ¦  9
drop snapshot sp_double_from;
drop snapshot sp_double_to;
drop table t2;
drop table t1;
drop table t0;
drop database test;
