drop database if exists right_single_rf;
create database right_single_rf;
use right_single_rf;
create table big_pk(id bigint primary key, v bigint, flag int);
insert into big_pk
select result, result * 10, result % 2 from generate_series(1, 20000) g;
create table small_lookup(id bigint primary key, lookup_id bigint, min_v bigint);
insert into small_lookup values
(1, 1, 0),
(2, 5000, 49999),
(3, 30000, 0),
(4, null, 0);
select s.id, (select b.v from big_pk b where b.id = s.lookup_id) as scalar_v
from small_lookup s
order by s.id;
➤ id[-5,64,0]  ¦  scalar_v[-5,64,0]  𝄀
1  ¦  10  𝄀
2  ¦  50000  𝄀
3  ¦  null  𝄀
4  ¦  null
create table empty_lookup(id bigint primary key, lookup_id bigint);
select e.id, (select b.v from big_pk b where b.id = e.lookup_id) as scalar_v
from empty_lookup e
order by e.id;
➤ id[-5,64,0]  ¦  scalar_v[-5,64,0]
select s.id, (select b.v from big_pk b
where b.id = s.lookup_id and b.v > s.min_v) as scalar_v
from small_lookup s
order by s.id;
➤ id[-5,64,0]  ¦  scalar_v[-5,64,0]  𝄀
1  ¦  10  𝄀
2  ¦  50000  𝄀
3  ¦  null  𝄀
4  ¦  null
create table inner_dup(id bigint, v bigint);
insert into inner_dup values (1, 10), (1, 11);
select s.id, (select d.v from inner_dup d where d.id = s.lookup_id) as scalar_v
from small_lookup s
where s.id = 1;
Subquery returns more than 1 row
create table big_composite(a bigint, b bigint, v bigint, primary key(a, b));
insert into big_composite
select result, result + 1, result * 100 from generate_series(1, 20000) g;
create table small_composite(id bigint primary key, a bigint, b bigint);
insert into small_composite values (1, 1, 2), (2, 5000, 5001), (3, 30000, 30001);
select s.id, (select b.v from big_composite b where b.a = s.a and b.b = s.b) as scalar_v
from small_composite s
order by s.id;
➤ id[-5,64,0]  ¦  scalar_v[-5,64,0]  𝄀
1  ¦  100  𝄀
2  ¦  500000  𝄀
3  ¦  null
insert into big_composite values (1, 3, 101);
select s.id, (select b.v from big_composite b where b.a = s.a) as scalar_v
from small_composite s
where s.id = 1;
Subquery returns more than 1 row
create table update_target(id bigint primary key, lookup_id bigint, v bigint);
insert into update_target values (1, 1, -1), (2, 5000, -1), (3, 30000, -1);
update update_target t
set v = (select b.v from big_pk b where b.id = t.lookup_id);
select * from update_target order by id;
➤ id[-5,64,0]  ¦  lookup_id[-5,64,0]  ¦  v[-5,64,0]  𝄀
1  ¦  1  ¦  10  𝄀
2  ¦  5000  ¦  50000  𝄀
3  ¦  30000  ¦  null
create table insert_target(id bigint primary key, v bigint);
insert into insert_target
select s.id, (select b.v from big_pk b where b.id = s.lookup_id)
from small_lookup s;
select * from insert_target order by id;
➤ id[-5,64,0]  ¦  v[-5,64,0]  𝄀
1  ¦  10  𝄀
2  ¦  50000  𝄀
3  ¦  null  𝄀
4  ¦  null
create table delete_target(id bigint primary key, lookup_id bigint);
insert into delete_target values (1, 1), (2, 2), (3, 30000), (4, null);
delete from delete_target t
where (select b.flag from big_pk b where b.id = t.lookup_id) = 1;
select * from delete_target order by id;
➤ id[-5,64,0]  ¦  lookup_id[-5,64,0]  𝄀
2  ¦  2  𝄀
3  ¦  30000  𝄀
4  ¦  null
select *
from (
(select s.id, (select b.v from big_pk b where b.id = s.lookup_id) as scalar_v
from small_lookup s
limit 0)
union all
(select 99, 990)
) u
order by id;
➤ id[-5,64,0]  ¦  scalar_v[-5,64,0]  𝄀
99  ¦  990
drop database right_single_rf;
