drop database if exists test_subq_corr_project;
create database test_subq_corr_project;
use test_subq_corr_project;
create table t1 (a int, b int, c int);
create table t2 (d int);
insert into t1 values (1, 2, 3), (11, 22, 33);
select t1.*, (select t1.a from t2 where t2.d > t1.a) as x from t1 order by t1.a;
➤ a[4,32,0]  ¦  b[4,32,0]  ¦  c[4,32,0]  ¦  x[4,32,0]  𝄀
1  ¦  2  ¦  3  ¦  null  𝄀
11  ¦  22  ¦  33  ¦  null
select t1.*, (select distinct t1.a from t2) as x from t1 order by t1.a;
➤ a[4,32,0]  ¦  b[4,32,0]  ¦  c[4,32,0]  ¦  x[4,32,0]  𝄀
1  ¦  2  ¦  3  ¦  null  𝄀
11  ¦  22  ¦  33  ¦  null
select t1.*, (select t1.a from t2 limit 1) as x from t1 order by t1.a;
➤ a[4,32,0]  ¦  b[4,32,0]  ¦  c[4,32,0]  ¦  x[4,32,0]  𝄀
1  ¦  2  ¦  3  ¦  null  𝄀
11  ¦  22  ¦  33  ¦  null
insert into t2 values (99);
select t1.*, (select t1.a from t2 where t2.d > t1.a) as x from t1 order by t1.a;
➤ a[4,32,0]  ¦  b[4,32,0]  ¦  c[4,32,0]  ¦  x[4,32,0]  𝄀
1  ¦  2  ¦  3  ¦  1  𝄀
11  ¦  22  ¦  33  ¦  11
select t1.*, (select distinct t1.a from t2) as x from t1 order by t1.a;
➤ a[4,32,0]  ¦  b[4,32,0]  ¦  c[4,32,0]  ¦  x[4,32,0]  𝄀
1  ¦  2  ¦  3  ¦  1  𝄀
11  ¦  22  ¦  33  ¦  11
select t1.*, (select t1.a from t2 limit 1) as x from t1 order by t1.a;
➤ a[4,32,0]  ¦  b[4,32,0]  ¦  c[4,32,0]  ¦  x[4,32,0]  𝄀
1  ¦  2  ¦  3  ¦  1  𝄀
11  ¦  22  ¦  33  ¦  11
insert into t2 values (100);
select t1.*, (select t1.a from t2 where t2.d > t1.a) from t1;
Subquery returns more than 1 row
select t1.*, (select t1.a from t2 where t2.d > t1.a) as x from t1;
Subquery returns more than 1 row
select t1.*, (select distinct t1.a from t2 where t2.d > t1.a) as x from t1 order by t1.a;
➤ a[4,32,0]  ¦  b[4,32,0]  ¦  c[4,32,0]  ¦  x[4,32,0]  𝄀
1  ¦  2  ¦  3  ¦  1  𝄀
11  ¦  22  ¦  33  ¦  11
delete from t2;
insert into t2 values (5), (100);
select t1.*, (select t1.a from t2 where t2.d > t1.a order by t2.d limit 1) as x from t1 order by t1.a;
➤ a[4,32,0]  ¦  b[4,32,0]  ¦  c[4,32,0]  ¦  x[4,32,0]  𝄀
1  ¦  2  ¦  3  ¦  1  𝄀
11  ¦  22  ¦  33  ¦  11
drop database test_subq_corr_project;
