drop snapshot if exists issue26549_table_snapshot;
drop snapshot if exists issue26549_rollback_snapshot;
drop snapshot if exists issue26549_database_snapshot;
drop pitr if exists issue26549_table_pitr;
drop database if exists issue26549_alter_txn;
create database issue26549_alter_txn;
use issue26549_alter_txn;
create table snapshot_alter (
id varchar(36) primary key,
status tinyint not null default 1,
index idx_status (status)
);
insert into snapshot_alter values ('r-001', 1), ('r-002', 1), ('r-003', 1);
create snapshot issue26549_table_snapshot for table issue26549_alter_txn snapshot_alter;
begin;
insert into snapshot_alter values ('r-txn', 1);
alter table snapshot_alter add column a int not null default 0;
alter table snapshot_alter add column b int not null default 0;
commit;
insert into snapshot_alter (id, status) values ('r-new', 1);
select count(*) as indexed_count from snapshot_alter where status = 1;
➤ indexed_count[-5,64,0]  𝄀
5
select count(*) as base_scan_count from snapshot_alter where status + 0 = 1;
➤ base_scan_count[-5,64,0]  𝄀
5
select id, status, a, b from snapshot_alter order by id;
➤ id[12,-1,0]  ¦  status[-6,8,0]  ¦  a[4,32,0]  ¦  b[4,32,0]  𝄀
r-001  ¦  1  ¦  0  ¦  0  𝄀
r-002  ¦  1  ¦  0  ¦  0  𝄀
r-003  ¦  1  ¦  0  ¦  0  𝄀
r-new  ¦  1  ¦  0  ¦  0  𝄀
r-txn  ¦  1  ¦  0  ¦  0
select id, status from snapshot_alter {snapshot = 'issue26549_table_snapshot'} order by id;
➤ id[12,-1,0]  ¦  status[-6,8,0]  𝄀
r-001  ¦  1  𝄀
r-002  ¦  1  𝄀
r-003  ¦  1
drop snapshot issue26549_table_snapshot;
create table pitr_alter (
id int primary key,
payload int,
index idx_payload (payload)
);
insert into pitr_alter values (1, 10), (2, 20);
create pitr issue26549_table_pitr for table issue26549_alter_txn pitr_alter range 1 'h';
set autocommit = 0;
update pitr_alter set payload = 11 where id = 1;
alter table pitr_alter add column extra int not null default 5;
alter table pitr_alter modify column extra bigint not null default 5;
alter table pitr_alter rename column payload to score;
commit;
set autocommit = 1;
insert into pitr_alter values (3, 30, 7);
select id, score, extra from pitr_alter order by id;
➤ id[4,32,0]  ¦  score[4,32,0]  ¦  extra[-5,64,0]  𝄀
1  ¦  11  ¦  5  𝄀
2  ¦  20  ¦  5  𝄀
3  ¦  30  ¦  7
select count(*) as renamed_index_count from pitr_alter where score = 20;
➤ renamed_index_count[-5,64,0]  𝄀
1
select count(*) as renamed_base_count from pitr_alter where score + 0 = 20;
➤ renamed_base_count[-5,64,0]  𝄀
1
drop pitr issue26549_table_pitr;
create table rollback_alter (id int primary key, payload int);
insert into rollback_alter values (1, 10);
create snapshot issue26549_rollback_snapshot for table issue26549_alter_txn rollback_alter;
begin;
alter table rollback_alter add column rolled_back_a int default 1;
alter table rollback_alter add column rolled_back_b int default 2;
rollback;
select column_name
from information_schema.columns
where table_schema = 'issue26549_alter_txn' and table_name = 'rollback_alter'
order by ordinal_position;
➤ column_name[12,-1,0]  𝄀
id  𝄀
payload
select * from rollback_alter order by id;
➤ id[4,32,0]  ¦  payload[4,32,0]  𝄀
1  ¦  10
drop snapshot issue26549_rollback_snapshot;
create table multi_alter_a (id int primary key);
create table multi_alter_b (id int primary key);
insert into multi_alter_a values (1);
insert into multi_alter_b values (2);
create snapshot issue26549_database_snapshot for database issue26549_alter_txn;
begin;
alter table multi_alter_a add column a1 int default 11;
alter table multi_alter_b add column b1 int default 21;
alter table multi_alter_a add column a2 int default 12;
alter table multi_alter_b add column b2 int default 22;
commit;
select * from multi_alter_a order by id;
➤ id[4,32,0]  ¦  a1[4,32,0]  ¦  a2[4,32,0]  𝄀
1  ¦  11  ¦  12
select * from multi_alter_b order by id;
➤ id[4,32,0]  ¦  b1[4,32,0]  ¦  b2[4,32,0]  𝄀
2  ¦  21  ¦  22
drop snapshot issue26549_database_snapshot;
create table live_base (id int primary key, payload int);
insert into live_base values (1, 10);
data branch create table live_child from live_base;
alter table live_child add column child_generation int default 1;
begin;
alter table live_child add column rejected_child_generation int default 2;
-- @regex("ALTER on a data-branch lineage is not supported inside an explicit transaction", true)
not supported: ALTER on a data-branch lineage is not supported inside an explicit transaction
rollback;
alter table live_base add column base_generation int default 3;
begin;
alter table live_base add column rejected_base_generation int default 4;
-- @regex("ALTER on a data-branch lineage is not supported inside an explicit transaction", true)
not supported: ALTER on a data-branch lineage is not supported inside an explicit transaction
rollback;
select id, payload, child_generation from live_child order by id;
➤ id[4,32,0]  ¦  payload[4,32,0]  ¦  child_generation[4,32,0]  𝄀
1  ¦  10  ¦  1
select id, payload, base_generation from live_base order by id;
➤ id[4,32,0]  ¦  payload[4,32,0]  ¦  base_generation[4,32,0]  𝄀
1  ¦  10  ¦  3
data branch delete table live_child;
drop database issue26549_alter_txn;
