drop table if exists test_11;
create table test_11 (c int primary key,d int);
begin;
Insert into test_11 values(1,1);
Insert into test_11 values(2,2);
Rollback;
select * from test_11 ;
c    d
begin;
Insert into test_11 values(1,1);
Insert into test_11 values(2,2);
commit;
select * from test_11 ;
c    d
1    1
2    2
drop table if exists test_11;
create table test_11 (c int primary key,d int);
Insert into test_11 values(1,1);
Insert into test_11 values(2,2);
Insert into test_11 values(3,1);
Insert into test_11 values(4,2);
begin;
delete from test_11 where c < 3;
update test_11 set d = c + 1 where c >= 3;
rollback;
select * from test_11 ;
c    d
1    1
2    2
3    1
4    2
begin;
delete from test_11 where c <3;
update test_11 set d = c + 1 where c >= 3;
commit;
select * from test_11 ;
c    d
3    4
4    5
drop table if exists test_11;
begin;
create table test_11 (c int primary key,d int);
Insert into test_11 values(1,1);
Insert into test_11 values(2,2);
Insert into test_11 values(3,1);
Insert into test_11 values(4,2);
rollback;
select * from test_11 ;
SQL parser error: table "test_11" does not exist
begin;
create table test_11 (c int primary key,d int);
Insert into test_11 values(1,1);
Insert into test_11 values(2,2);
Insert into test_11 values(3,1);
Insert into test_11 values(4,2);
delete from test_11 where c <3;
update test_11 set d = c + 1 where c >= 3;
commit;
select * from test_11;
c    d
3    4
4    5
drop table if exists test_11;
create table test_11 (c int primary key,d int);
Insert into test_11 values(1,1);
Insert into test_11 values(2,2);
begin;
Insert into test_11 values(3,1);
Insert into test_11 values(4,2);
rollback;
select * from test_11;
c    d
1    1
2    2
drop table if exists test_11;
create table test_11 (c int primary key,d int);
Insert into test_11 values(1,1);
Insert into test_11 values(2,2);
begin;
Insert into test_11 values(3,1);
Insert into test_11 values(4,2);
commit;
drop table if exists test_11;
select * from test_11 ;
SQL parser error: table "test_11" does not exist
begin;
create table test_12(col1 int primary key,col2 varchar(25));
create unique index id_01 on test_12(col2);
select * from test_12;
col1    col2
show create table test_12;
Table    Create Table
test_12    CREATE TABLE `test_12` (\n`col1` INT NOT NULL,\n`col2` VARCHAR(25) DEFAULT NULL,\nPRIMARY KEY (`col1`),\nUNIQUE KEY `id_01` (`col2`)\n)
show create table test_12;
not connect to a database
rollback ;
show create table test_12;
no such table atomicity.test_12
select * from test_12;
SQL parser error: table "test_12" does not exist
start transaction;
create table test_12(col1 int primary key,col2 varchar(25));
insert into test_12 values(1,'a'),(2,'b');
use atomicity;
select * from test_12;
SQL parser error: table "test_12" does not exist
create table test_12(col1 int,col2 varchar(25));
table test_12 already exists
insert into test_12 values (90,'tt');
select * from test_12;
col1    col2
1    a
2    b
90    tt
show create table test_12;
Table    Create Table
test_12    CREATE TABLE `test_12` (\n`col1` INT NOT NULL,\n`col2` VARCHAR(25) DEFAULT NULL,\nPRIMARY KEY (`col1`)\n)
commit;
show create table test_12;
Table    Create Table
test_12    CREATE TABLE `test_12` (\n`col1` INT NOT NULL,\n`col2` VARCHAR(25) DEFAULT NULL,\nPRIMARY KEY (`col1`)\n)
select * from test_12;
col1    col2
1    a
2    b
90    tt
drop table test_12;
start transaction;
create table test_12(col1 int primary key auto_increment,col2 varchar(25));
insert into test_12(col2) values('c'),('d'),('e');
create index id_01 on test_12(col2);
select * from test_12;
col1    col2
1    c
2    d
3    e
show create table test_12;
Table    Create Table
test_12    CREATE TABLE `test_12` (\n`col1` INT NOT NULL AUTO_INCREMENT,\n`col2` VARCHAR(25) DEFAULT NULL,\nPRIMARY KEY (`col1`),\nKEY `id_01` (`col2`)\n)
commit;
show create table test_12;
Table    Create Table
test_12    CREATE TABLE `test_12` (\n`col1` INT NOT NULL AUTO_INCREMENT,\n`col2` VARCHAR(25) DEFAULT NULL,\nPRIMARY KEY (`col1`),\nKEY `id_01` (`col2`)\n)
select * from test_12;
col1    col2
1    c
2    d
3    e
create database s_db_1;
begin;
use s_db_1;
create table test_13(col1 int primary key,col2 varchar(25));
rollback;
drop database s_db_1;
use s_db_1;
invalid database s_db_1
select * from test_13;
not connect to a database
create database s_db_1;
start transaction ;
use s_db_1;
create table test_13(col1 int primary key,col2 varchar(25));
create database s_db_1;
database s_db_1 already exists
commit;
drop database s_db_1;
begin;
use atomicity;
create table test_14(col1 int primary key,col2 varchar(25), unique key col2(col2));
insert into test_14 values(1,'a'),(2,'b');
create view test_view_1 as select * from test_14;
use atomicity;
select * from test_view_1;
SQL parser error: table "test_view_1" does not exist
show create table test_14;
Table    Create Table
test_14    CREATE TABLE `test_14` (\n`col1` INT NOT NULL,\n`col2` VARCHAR(25) DEFAULT NULL,\nPRIMARY KEY (`col1`),\nUNIQUE KEY `col2` (`col2`)\n)
select  * from test_view_1;
col1    col2
1    a
2    b
rollback ;
select * from test_14;
SQL parser error: table "test_14" does not exist
select  * from test_view_1;
SQL parser error: table "test_view_1" does not exist
show create table test_14;
no such table atomicity.test_14
start transaction ;
use atomicity;
create temporary table test_15(col1 int,col2 float);
insert into test_15 values(1,20.98),(2,30.34);
use atomicity;
select * from test_15;
SQL parser error: table "test_15" does not exist
select * from test_15;
col1    col2
1    20.98
2    30.34
rollback ;
select * from test_15;
SQL parser error: table "test_15" does not exist
start transaction ;
use atomicity;
create external table test_ex_table_1(num_col1 tinyint,num_col2 smallint,num_col3 int,num_col4 bigint,num_col5 tinyint unsigned,num_col6 smallint unsigned,num_col7 int unsigned,num_col8 bigint unsigned ,num_col9 float(5,3),num_col10 double,num_col11 decimal(38,19)) infile{"filepath"='$resources/external_table_file/ex_table_number.csv'} fields terminated by ',' enclosed by '\"' lines terminated by '\n';
select num_col1 ,num_col2 from test_ex_table_1;
num_col1    num_col2
60    -1000
-128    -32768
127    32767
null    null
create table test_16(num_col1 tinyint,num_col2 smallint,num_col3 int,num_col4 bigint,num_col5 tinyint unsigned,num_col6 smallint unsigned,num_col7 int unsigned,num_col8 bigint unsigned ,num_col9 float(5,3),num_col10 double,num_col11 decimal(38,19));
insert into test_16 select * from test_ex_table_1;
rollback ;
select num_col1 ,num_col2  from test_ex_table_1;
SQL parser error: table "test_ex_table_1" does not exist
select num_col1 ,num_col2  from test_16;
SQL parser error: table "test_16" does not exist
begin;
use atomicity;
create external table test_ex_table_1(num_col1 tinyint,num_col2 smallint,num_col3 int,num_col4 bigint,num_col5 tinyint unsigned,num_col6 smallint unsigned,num_col7 int unsigned,num_col8 bigint unsigned ,num_col9 float(5,3),num_col10 double,num_col11 decimal(38,19)) infile{"filepath"='$resources/external_table_file/ex_table_number.csv'} fields terminated by ',' enclosed by '\"' lines terminated by '\n';
select num_col1 ,num_col2 from test_ex_table_1;
num_col1    num_col2
60    -1000
-128    -32768
127    32767
null    null
create table test_16(num_col1 tinyint,num_col2 smallint,num_col3 int,num_col4 bigint,num_col5 tinyint unsigned,num_col6 smallint unsigned,num_col7 int unsigned,num_col8 bigint unsigned ,num_col9 float(5,3),num_col10 double,num_col11 decimal(38,19));
insert into test_16 select * from test_ex_table_1;
use atomicity;
select num_col1 ,num_col2 from test_ex_table_1;
SQL parser error: table "test_ex_table_1" does not exist
commit;
select num_col1 ,num_col2 from test_ex_table_1;
num_col1    num_col2
60    -1000
-128    -32768
127    32767
null    null
select num_col1 ,num_col2 from test_16;
num_col1    num_col2
60    -1000
-128    -32768
127    32767
null    null
drop table if exists alter01;
create table alter01 (col1 int, col2 decimal);
show create table alter01;
Table    Create Table
alter01    CREATE TABLE `alter01` (\n`col1` INT DEFAULT NULL,\n`col2` DECIMAL(38,0) DEFAULT NULL\n)
insert into alter01 values(1, 3412.324);
insert into alter01 values (-10, 323943.2343);
begin;
alter table alter01 change col1 col1New float;
rollback;
show create table alter01;
Table    Create Table
alter01    CREATE TABLE `alter01` (\n`col1` INT DEFAULT NULL,\n`col2` DECIMAL(38,0) DEFAULT NULL\n)
select * from alter01;
col1    col2
1    3412
-10    323943
drop table alter01;
drop table if exists alter01;
create table alter01 (col1 int primary key, col2 decimal);
show create table alter01;
Table    Create Table
alter01    CREATE TABLE `alter01` (\n`col1` INT NOT NULL,\n`col2` DECIMAL(38,0) DEFAULT NULL,\nPRIMARY KEY (`col1`)\n)
insert into alter01 values(1, 3412.324);
insert into alter01 values (-10, 323943.2343);
begin;
alter table alter01 modify col1 float not null;
rollback;
show create table alter01;
Table    Create Table
alter01    CREATE TABLE `alter01` (\n`col1` INT NOT NULL,\n`col2` DECIMAL(38,0) DEFAULT NULL,\nPRIMARY KEY (`col1`)\n)
select * from alter01;
col1    col2
1    3412
-10    323943
drop table alter01;
drop table if exists alter01;
create table alter01 (col1 int primary key, col2 decimal);
show create table alter01;
Table    Create Table
alter01    CREATE TABLE `alter01` (\n`col1` INT NOT NULL,\n`col2` DECIMAL(38,0) DEFAULT NULL,\nPRIMARY KEY (`col1`)\n)
insert into alter01 values(1, 3412.324);
insert into alter01 values (-10, 323943.2343);
begin;
alter table alter01 change col1 col1New float not null;
rollback;
show create table alter01;
Table    Create Table
alter01    CREATE TABLE `alter01` (\n`col1` INT NOT NULL,\n`col2` DECIMAL(38,0) DEFAULT NULL,\nPRIMARY KEY (`col1`)\n)
select * from alter01;
col1    col2
1    3412
-10    323943
drop table alter01;
drop table if exists rename01;
create table rename01(c int primary key,d int);
begin;
insert into rename01 values(1,1);
insert into rename01 values(2,2);
alter table rename01 rename column c to `euwhbnfew`;
rollback;
select * from rename01;
c    d
show create table rename01;
Table    Create Table
rename01    CREATE TABLE `rename01` (\n`c` INT NOT NULL,\n`d` INT DEFAULT NULL,\nPRIMARY KEY (`c`)\n)
drop table rename01;
drop table if exists pri01;
create table pri01(col1 int ,col2 int);
begin;
insert into pri01 values(1,1);
insert into pri01 values(2,2);
alter table pri01 add constraint primary key(col1);
show create table pri01;
Table    Create Table
pri01    CREATE TABLE `pri01` (\n`col1` INT NOT NULL,\n`col2` INT DEFAULT NULL,\nPRIMARY KEY (`col1`)\n)
rollback;
select * from pri01;
col1    col2
show create table pri01;
Table    Create Table
pri01    CREATE TABLE `pri01` (\n`col1` INT DEFAULT NULL,\n`col2` INT DEFAULT NULL\n)
drop table pri01;
CREATE TABLE IF NOT EXISTS indup_07(
col1 INT primary key,
col2 VARCHAR(20) NOT NULL,
col3 VARCHAR(30) NOT NULL,
col4 BIGINT default 30
);
insert into indup_07 values(22,'11','33',1), (23,'22','55',2),(24,'66','77',1),(25,'99','88',1),(22,'11','33',1) on duplicate key update col1=col1+col2;
select * from indup_07;
col1    col2    col3    col4
23    22    55    2
24    66    77    1
25    99    88    1
33    11    33    1
insert into indup_07 values(24,'1','1',100) on duplicate key update col1=2147483649;
Data truncation: data out of range: data type int32, value '2147483649'
begin;
insert into indup_07 values(22,'11','33',1), (23,'22','55',2),(33,'66','77',1) on duplicate key update col1=col1+1,col2='888';
Duplicate entry '24' for key 'col1'
select * from indup_07;
col1    col2    col3    col4
23    22    55    2
24    66    77    1
25    99    88    1
33    11    33    1
rollback ;
select * from indup_07;
col1    col2    col3    col4
23    22    55    2
24    66    77    1
25    99    88    1
33    11    33    1
start transaction ;
insert into indup_07 values(22,'11','33',1), (23,'22','55',2),(33,'66','77',1) on duplicate key update col1=col1+1,col2='888';
Duplicate entry '24' for key 'col1'
select * from indup_07;
col1    col2    col3    col4
23    22    55    2
24    66    77    1
25    99    88    1
33    11    33    1
commit;
select * from indup_07;
col1    col2    col3    col4
23    22    55    2
24    66    77    1
25    99    88    1
33    11    33    1
