create table ct_01(a int primary key,b varchar(25));
insert into ct_01 values(1,'bell'),(2,'app'),(1,'com');
Duplicate entry '\d' for key 'a'
insert into ct_01 values(1,'bell'),(2,'app');
begin;
insert into ct_01 values(3,'oppo'),(3,'zow');
Duplicate entry '3' for key 'a'
use conflict_transaction;
start transaction ;
insert into ct_01 values(2,'yooo');
Duplicate entry '\d' for key 'a'
commit;
commit;
select * from ct_01;
a    b
1    bell
2    app
create table ct_02(a int primary key,b varchar(25));
insert into ct_02 values(1,'bell'),(2,'app'),(3,'com');
start transaction ;
update ct_02 set a=5 where b='app';
begin;
update ct_02 set a=5 where b='bell';
Duplicate entry '\d' for key 'a'
commit;
commit;
begin;
update ct_02 set a=3 where b='bell';
Duplicate entry '\d' for key 'a'
commit;
select * from ct_02;
a    b
1    bell
3    com
5    app
create table ct_03(a int primary key,b varchar(25));
insert into ct_03 values(1,'bell'),(2,'app'),(3,'com');
begin;
delete from ct_03 where a=1;
select * from ct_03;
a    b
2    app
3    com
begin;
update ct_03 set b='urea' where a=1;
select * from ct_03;
a    b
2    app
3    com
commit;
commit;
select * from ct_03;
a    b
2    app
3    com
create table ct_04_temp(a int,b varchar(25));
insert into ct_04_temp values (1,'bell'),(2,'app'),(1,'com');
create table ct_04(a int primary key,b varchar(25));
begin;
insert into ct_04 select * from ct_04_temp;
Duplicate entry '\d' for key 'a'
commit;
select * from ct_04;
a    b
create table ct_05(a int,b varchar(25) primary key);
begin;
load data infile '$resources/load_data/ct_file.csv' into table ct_05;
Duplicate entry 'apple' for key 'b'
commit;
select * from ct_05;
a    b
create table ct_06(a bigint,b varchar(25),c int, d varchar(25),primary key(a),unique index c(c),key b(b),key d(d));
start transaction ;
insert into ct_06 select 5678,'high',487,'comment test';
insert into ct_06 select 5679,'lower',487,'define';
Duplicate entry '487' for key '__mo_index_idx_col'
insert into ct_06 values (897,'number',908,'run tools'),(898,'string',908,'ffff'),(899,'string',918,'while'),(900,'string',948,'word file'),(901,'string',902,'oooo'),(902,'string',87,'dddd'),(903,'string',87,'eeee');
Duplicate entry '908' for key '__mo_index_idx_col'
select * from ct_06;
a    b    c    d
5678    high    487    comment test
commit;
select * from ct_06;
a    b    c    d
5678    high    487    comment test
begin;
insert into ct_06 values (500,'number1',908,'ooooffff');
start transaction ;
insert into ct_06 values (501,'number2',908,'zzzztttt');
Duplicate entry '908' for key '__mo_index_idx_col'
commit;
select * from ct_06;
a    b    c    d
500    number1    908    ooooffff
5678    high    487    comment test
commit;
select * from ct_06;
a    b    c    d
500    number1    908    ooooffff
5678    high    487    comment test
create table ct_07(a int,b varchar(25),c date, d double,primary key(a,c));
insert into ct_07 values (1,'901','2011-09-29',0.01),(2,'187','2011-09-29',1.31),(3,'90','2111-02-09',10.01);
begin;
insert into ct_07 values (3,'90','2111-02-09',10.01);
Duplicate entry '(3,2111-02-09)' for key '__mo_cpkey_col'
insert into ct_07 values (4,'11','2011-09-29',7.00),(2,'567','2011-09-29',1.31),(4,'90','2011-09-29',89.3);
(Duplicate entry) '\((\d+),(\d{4}-\d{2}-\d{2})\)' (for key '__mo_cpkey_col')
select * from ct_07;
a    b    c    d
1    901    2011-09-29    0.01
2    187    2011-09-29    1.31
3    90    2111-02-09    10.01
commit;
select * from ct_07;
a    b    c    d
1    901    2011-09-29    0.01
2    187    2011-09-29    1.31
3    90    2111-02-09    10.01