drop database if exists dupscope;
create database dupscope;
use dupscope;
create table t (a int primary key, b varchar(10));
insert into t values (1, 'one');
select @@mo_rollback_txn_on_duplicate_key;
➤ @@mo_rollback_txn_on_duplicate_key[-1,16383,0]  𝄀
0
insert into t values (1, 'dup');
Duplicate entry '1' for key 'a'
begin;
insert into t values (20, 'twenty');
insert into t values (1, 'dup');
Duplicate entry '1' for key 'a'
insert into t values (21, 'twentyone');
commit;
select a from t order by a;
➤ a[4,32,0]  𝄀
1  𝄀
20  𝄀
21
delete from t where a <> 1;
set mo_rollback_txn_on_duplicate_key = 1;
select @@mo_rollback_txn_on_duplicate_key;
➤ @@mo_rollback_txn_on_duplicate_key[-1,16383,0]  𝄀
1
begin;
insert into t values (30, 'thirty');
insert into t values (1, 'dup');
Duplicate entry '1' for key 'a'
select a from t order by a;
➤ a[4,32,0]  𝄀
1
commit;
select a as after_commit from t order by a;
➤ after_commit[4,32,0]  𝄀
1
begin;
insert into t values (40, 'forty');
select bad_column from t;
invalid input: column bad_column does not exist
insert into t values (41, 'fortyone');
commit;
select a as unrelated_error_txn_survives from t order by a;
➤ unrelated_error_txn_survives[4,32,0]  𝄀
1  𝄀
40  𝄀
41
set mo_rollback_txn_on_duplicate_key = 0;
delete from t where a <> 1;
begin;
insert into t values (50, 'fifty');
insert into t values (1, 'dup');
Duplicate entry '1' for key 'a'
commit;
select a as back_to_mysql from t order by a;
➤ back_to_mysql[4,32,0]  𝄀
1  𝄀
50
set global mo_rollback_txn_on_duplicate_key = 1;
select @@global.mo_rollback_txn_on_duplicate_key as global_value,
@@session.mo_rollback_txn_on_duplicate_key as this_session_unchanged;
➤ global_value[-1,16383,0]  ¦  this_session_unchanged[-1,16383,0]  𝄀
1  ¦  0
use dupscope;
select @@mo_rollback_txn_on_duplicate_key as inherited_by_a_new_session;
➤ inherited_by_a_new_session[-1,16383,0]  𝄀
1
delete from t where a <> 1;
begin;
insert into t values (60, 'sixty');
insert into t values (1, 'dup');
Duplicate entry '1' for key 'a'
commit;
select a as new_session_txn_discarded from t order by a;
➤ new_session_txn_discarded[4,32,0]  𝄀
1
set global mo_rollback_txn_on_duplicate_key = 0;
select @@global.mo_rollback_txn_on_duplicate_key as global_restored;
➤ global_restored[-1,16383,0]  𝄀
0
drop database if exists dupscope;
