drop table if exists dis_table_02;
create table dis_table_02(a int not null auto_increment,b varchar(25) not null,c datetime,primary key(a),key bstr (b),key cdate (c) );
insert into dis_table_02(b,c) values ('aaaa','2020-09-08');
insert into dis_table_02(b,c) values ('aaaa','2020-09-08');
begin;
update dis_table_02 set b='tittttt' where a>1;
use ww_conflict;
begin;
update dis_table_02 set b='dpqweoe' where a>1;
commit;
start transaction;
drop table if exists dis_table_02;
drop table if exists dis_table_02;
create table dis_table_02(a int not null auto_increment,b varchar(25) not null,c datetime,primary key(a),key bstr (b),key cdate (c) );
insert into dis_table_02(b,c) values ('aaaa','2020-09-08');
insert into dis_table_02(b,c) values ('aaaa','2020-09-08');
begin;
alter table dis_table_02 rename column a to newA;
use ww_conflict;
begin;
update dis_table_02 set b='dpqweoe' where a>1;
invalid input: column 'dis_table_02.a' does not exist
update dis_table_02 set b='dpqweoe' where newA>1;
commit;
select * from dis_table_02;
newa    b    c
1    aaaa    2020-09-08 00:00:00
2    dpqweoe    2020-09-08 00:00:00
select * from dis_table_02;
newa    b    c
1    aaaa    2020-09-08 00:00:00
2    dpqweoe    2020-09-08 00:00:00
drop table dis_table_02;
drop table if exists dis_table_02;
create table dis_table_02(a int not null default 10,b varchar(25) not null,c datetime);
insert into dis_table_02(b,c) values ('aaaa','2020-09-08');
insert into dis_table_02(b,c) values ('bbbb','2020-09-08');
begin;
alter table dis_table_02 add constraint primary key (b);
use ww_conflict;
begin;
update dis_table_02 set b='dpqweoe' where a>1;
Duplicate entry 'dpqweoe' for key 'b'
commit;
select * from dis_table_02;
a    b    c
10    aaaa    2020-09-08 00:00:00
10    bbbb    2020-09-08 00:00:00
select * from dis_table_02;
a    b    c
10    aaaa    2020-09-08 00:00:00
10    bbbb    2020-09-08 00:00:00
drop table dis_table_02;
drop table if exists dis_table_02;
create table dis_table_02(a int not null default 10,b varchar(25) not null,c datetime,primary key (b));
insert into dis_table_02(b,c) values ('aaaa','2020-09-08');
insert into dis_table_02(b,c) values ('bbbb','2020-09-08');
begin;
alter table dis_table_02 drop primary key;
use ww_conflict;
begin;
insert into dis_table_02 values(10, 'aaaa', '1998-09-12');
commit;
select * from dis_table_02;
a    b    c
10    aaaa    2020-09-08 00:00:00
10    bbbb    2020-09-08 00:00:00
10    aaaa    1998-09-12 00:00:00
select * from dis_table_02;
a    b    c
10    aaaa    2020-09-08 00:00:00
10    bbbb    2020-09-08 00:00:00
10    aaaa    1998-09-12 00:00:00
drop table dis_table_02;
