drop account if exists bvt_result_count;
create account bvt_result_count admin_name 'admin' identified by '111';
set disable_agg_statement = on;
begin;
rollback;
commit;
start transaction;
commit;
create database db1;
use db1;
create table t1(a int, b varchar);
/* cloud_user */insert into t1 values (1, 'a'),(1, 'b'),(3, 'c'),(4,'d'),(5,'e');
update t1 set b='xx' where a=5;
update t1 set b='yy' where a=1;
select * from t1;
a    b
3    c
4    d
5    xx
1    yy
1    yy
select * from t1 limit 3;
a    b
3    c
4    d
5    xx
delete from t1 where a=5;
delete from t1 where a=1;
create view v1 as select * from t1;
create view v2 as select * from t1 limit 1;
set @a=1;
prepare s1 from "select * from t1 where a>?";
prepare s2 from "select * from t1 where a=?";
execute s1 using @a;
a    b
3    c
4    d
execute s2 using @a;
a    b
deallocate prepare s2;
deallocate prepare s2;
show databases like 'mysql';
Database
mysql
show tables;
Tables_in_db1
t1
v1
v2
show create database db1;
Database    Create Database
db1    CREATE DATABASE `db1`
show create view v1;
View    Create View    character_set_client    collation_connection
v1    create view v1 as select * from t1;    utf8mb4    utf8mb4_general_ci
show create table t1;
Table    Create Table
t1    CREATE TABLE `t1` (\n  `a` INT DEFAULT NULL,\n  `b` VARCHAR(65535) DEFAULT NULL\n)
show columns from t1;
Field    Type    Null    Key    Default    Extra    Comment
a    INT(32)    YES        null        
b    VARCHAR(65535)    YES        null        
drop view v1;
drop table t1;
drop view v2;
drop database db1;
create role test_role;
create user user_name identified by 'password';
create database if not exists db1;
grant create table,drop table on database *.* to test_role;
revoke test_role from user_name;
drop user user_name;
drop role test_role;
drop database db1;
create database db2;
use db2;
create table t2(a int, b varchar);
begin;
insert into t2 values (1, 'a'),(1, 'b'),(3, 'c'),(4,'d'),(5,'e');
update t2 set b='xx' where a=5;
update t2 set b='yy' where a=1;
select * from t2;
a    b
3    c
4    d
5    xx
1    yy
1    yy
select * from t2 limit 3;
a    b
3    c
4    d
5    xx
delete from t2 where a=5;
delete from t2 where a=1;
commit;
drop database db2;
/* cloud_user */ create database db2;
/* cloud_user */ use db2;
/* cloud_user */ create table t2(a int, b varchar);
/* cloud_user */ insert into t2 values (1, 'a'),(1, 'b'),(3, 'c'),(4,'d'),(5,'e');
/* cloud_user */ update t2 set b='xx' where a=5;
/* cloud_user */ update t2 set b='yy' where a=1;
/* cloud_user */ select * from t2;
a    b
3    c
4    d
5    xx
1    yy
1    yy
/* cloud_user */ select * from t2 limit 3;
a    b
3    c
4    d
5    xx
/* cloud_user */ delete from t2 where a=5;
/* cloud_user */ delete from t2 where a=1;
/* cloud_user */ drop database db2;
select 1;
1
1
select 1 union select 2;
1
2
1
values row(1,1), row(2,2), row(3,3) order by column_0 desc;
column_0    column_1
3    3
2    2
1    1
WITH cte1 AS (SELECT 1),cte2 AS (SELECT 2) SELECT * FROM cte1 join cte2;
1    2
1    2
select * from unnest('{"a":1}') as f;
col    seq    key    path    index    value    this
UNNEST_DEFAULT    0    a    $.a    null    1    {"a": 1}
use system;
/* cloud_user */create account bvt_result_count_test_case2 admin_name 'test_account' identified by '111';
/* cloud_user */drop account bvt_result_count_test_case2;
drop account if exists bvt_result_count;
