drop account if exists bvt_result_count;
create account bvt_result_count admin_name 'admin' identified by '111';
begin;
rollback;
commit;
start transaction;
commit;
create database db1;
use db1;
create table t1(a int, b varchar);
insert into t1 values (1, 'a'),(1, 'b'),(3, 'c'),(4,'d'),(5,'e');
update t1 set b='xx' where a=5;
update t1 set b='yy' where a=1;
select * from t1;
a    b
3    c
4    d
5    xx
1    yy
1    yy
select * from t1 limit 3;
a    b
3    c
4    d
5    xx
delete from t1 where a=5;
delete from t1 where a=1;
create view v1 as select * from t1;
create view v2 as select * from t1 limit 1;
set @a=1;
prepare s1 from "select * from t1 where a>?";
prepare s2 from "select * from t1 where a=?";
execute s1 using @a;
a    b
3    c
4    d
execute s2 using @a;
a    b
deallocate prepare s2;
deallocate prepare s2;
show databases like 'mysql';
Database
mysql
show tables;
Tables_in_db1
t1
v1
v2
show create database db1;
Database    Create Database
db1    CREATE DATABASE `db1`
show create view v1;
View    Create View    character_set_client    collation_connection
v1    create view v1 as select * from t1;    utf8mb4    utf8mb4_general_ci
show create table t1;
Table    Create Table
t1    CREATE TABLE `t1` (\n`a` INT DEFAULT NULL,\n`b` VARCHAR(65535) DEFAULT NULL\n)
show columns from t1;
Field    Type    Null    Key    Default    Extra    Comment
a    INT(32)    YES        null        
b    VARCHAR(65535)    YES        null        
drop view v1;
drop table t1;
drop view v2;
drop database db1;
create role test_role;
create user user_name identified by 'password';
create database if not exists db1;
grant create table,drop table on database *.* to test_role;
revoke test_role from user_name;
drop user user_name;
drop role test_role;
drop database db1;
create database db2;
use db2;
create table t2(a int, b varchar);
begin;
insert into t2 values (1, 'a'),(1, 'b'),(3, 'c'),(4,'d'),(5,'e');
update t2 set b='xx' where a=5;
update t2 set b='yy' where a=1;
select * from t2;
a    b
3    c
4    d
5    xx
1    yy
1    yy
select * from t2 limit 3;
a    b
3    c
4    d
5    xx
delete from t2 where a=5;
delete from t2 where a=1;
commit;
drop database db2;
/* cloud_user */ create database db2;
/* cloud_user */ use db2;
/* cloud_user */ create table t2(a int, b varchar);
/* cloud_user */ insert into t2 values (1, 'a'),(1, 'b'),(3, 'c'),(4,'d'),(5,'e');
/* cloud_user */ update t2 set b='xx' where a=5;
/* cloud_user */ update t2 set b='yy' where a=1;
/* cloud_user */ select * from t2;
a    b
3    c
4    d
5    xx
1    yy
1    yy
/* cloud_user */ select * from t2 limit 3;
a    b
3    c
4    d
5    xx
/* cloud_user */ delete from t2 where a=5;
/* cloud_user */ delete from t2 where a=1;
/* cloud_user */ drop database db2;
select 1;
1
1
select 1 union select 2;
1
2
1
values row(1,1), row(2,2), row(3,3) order by column_0 desc;
column_0    column_1
3    3
2    2
1    1
WITH cte1 AS (SELECT 1),cte2 AS (SELECT 2) SELECT * FROM cte1 join cte2;
1    2
1    2
select * from unnest('{"a":1}') as f;
col    seq    key    path    index    value    this
UNNEST_DEFAULT    0    a    $.a    null    1    {"a": 1}
use system;
/* cloud_user */create account test_tenant_1 admin_name 'test_account' identified by '111';
/* cloud_user */drop account test_tenant_1;
select sleep(18) s;
s
0
use system;
select statement, result_count from statement_info where account="bvt_result_count" and statement not like '%mo_ctl%' and length(statement) > 0 and status != 'Running' and aggr_count < 1 order by request_at desc limit 50;
statement    result_count
use system    0
values row(1,1), row(2,2), row(3,3) order by column_0 desc    3
drop database db2    0
delete from t2 where a=1    0
delete from t2 where a=5    0
select * from t2 limit 3    3
select * from t2    5
update t2 set b='yy' where a=1    0
update t2 set b='xx' where a=5    0
insert into t2 values (1, 'a'),(1, 'b'),(3, 'c'),(4,'d'),(5,'e')    0
create table t2(a int, b varchar)    0
use db2    0
create database db2    0
drop database db2    0
commit    0
begin    0
create table t2(a int, b varchar)    0
use db2    0
create database db2    0
drop database db1    0
drop role test_role    0
drop user user_name    0
revoke test_role from user_name    0
grant create table,drop table on database *.* to test_role    0
create database if not exists db1    0
create user user_name identified by '******'    0
create role test_role    0
drop database db1    0
drop view v2    0
drop table t1    0
drop view v1    0
show columns from t1    2
show create table t1    1
show create view v1    1
show create database db1    1
show tables    3
show databases like 'mysql'    1
deallocate prepare s2    0
deallocate prepare s2    0
prepare s2 from "select * from t1 where a=?"    0
prepare s1 from "select * from t1 where a>?"    0
set @a=1    0
create view v2 as select * from t1 limit 1    0
create view v1 as select * from t1    0
create table t1(a int, b varchar)    0
use db1    0
create database db1    0
commit    0
start transaction    0
commit    0
select statement, result_count from statement_info where user="dump" and sql_source_type="cloud_user_sql" and status != 'Running' and aggr_count < 1 order by request_at desc limit 2;
statement    result_count
drop account test_tenant_1    0
create account test_tenant_1 admin_name 'test_account' identified by '******'    0
drop account if exists bvt_result_count;
