use mo_catalog;
create cluster table clu01(col1 int, col2 decimal);
insert into clu01 values(1,2,0);
drop snapshot if exists sp01;
create snapshot sp01 for cluster;
insert into clu01 values(2,3,0);
drop table clu01;
restore account sys from snapshot sp01;
select * from clu01;
col1    col2    account_id
1    2    0
drop table clu01;
drop snapshot sp01;
drop database if exists test;
create database test;
use test;
create table clu01(col1 int, col2 decimal);
insert into clu01 values(1,2);
drop snapshot if exists sp01;
create snapshot sp01 for cluster;
insert into clu01 values(2,3);
restore account sys from snapshot sp01;
select * from clu01;
col1    col2
1    2
select count(*) from clu01;
count(*)
1
drop table clu01;
drop database test;
drop snapshot sp01;
drop database if exists test01;
create database test01;
use test01;
drop table if exists rs01;
create table rs01 (col1 int, col2 decimal(6), col3 varchar(30));
insert into rs01 values (1, null, 'database');
insert into rs01 values (2, 38291.32132, 'database');
insert into rs01 values (3, null, 'database management system');
insert into rs01 values (4, 10, null);
insert into rs01 values (1, -321.321, null);
insert into rs01 values (2, -1, null);
select count(*) from rs01;
count(*)
6
drop snapshot if exists sp01;
create snapshot sp01 for cluster;
select count(*) from rs01 {snapshot = 'sp01'};
count(*)
6
insert into rs01 values (2, -1, null);
insert into rs01 values (1, -321.321, null);
select * from rs01;
col1    col2    col3
1    null    database
2    38291    database
3    null    database management system
4    10    null
1    -321    null
2    -1    null
2    -1    null
1    -321    null
select count(*) from mo_catalog.mo_tables{snapshot = 'sp01'} where reldatabase = 'test01';
count(*)
1
select * from mo_catalog.mo_database{snapshot = 'sp01'} where datname = 'test01';
dat_id    datname    dat_catalog_name    dat_createsql    owner    creator    created_time    account_id    dat_type
306623    test01    def    create database test01    0    1    2025-07-18 22:50:02    0    
select attname from mo_catalog.mo_columns{snapshot = 'sp01'} where att_database = 'test01';
attname
col1
col2
col3
__mo_fake_pk_col
__mo_rowid
restore account sys from snapshot sp01;
select count(*) from rs01 {snapshot = 'sp01'};
count(*)
6
select count(*) from rs01 {snapshot = 'sp01'};
count(*)
6
select count(*) from rs01 {snapshot = 'sp01'};
count(*)
6
select count(*) from rs01 {snapshot = 'sp01'};
count(*)
6
select count(*) from rs01 {snapshot = 'sp01'};
count(*)
6
select * from rs01 {snapshot = 'sp01'};
col1    col2    col3
1    null    database
2    38291    database
3    null    database management system
4    10    null
1    -321    null
2    -1    null
select count(*) from mo_catalog.mo_tables{snapshot = 'sp01'} where reldatabase = 'test01';
count(*)
1
select * from mo_catalog.mo_database{snapshot = 'sp01'} where datname = 'test01';
dat_id    datname    dat_catalog_name    dat_createsql    owner    creator    created_time    account_id    dat_type
306623    test01    def    create database test01    0    1    2025-07-18 22:50:02    0    
select attname from mo_catalog.mo_columns{snapshot = 'sp01'} where att_database = 'test01';
attname
col1
col2
col3
__mo_fake_pk_col
__mo_rowid
drop snapshot sp01;
drop database test01;
use mo_catalog;
drop table if exists cluster01;
create cluster table cluster01(col1 int,col2 bigint);
insert into cluster01 values(1,2,0);
insert into cluster01 values(2,3,0);
select * from cluster01;
col1    col2    account_id
1    2    0
2    3    0
drop database if exists test02;
create database test02;
use test02;
drop table if exists rs02;
create table rs02 (col1 int, col2 datetime);
insert into rs02 values (1, '2020-10-13 10:10:10');
insert into rs02 values (2, null);
insert into rs02 values (1, '2021-10-10 00:00:00');
insert into rs02 values (2, '2023-01-01 12:12:12');
insert into rs02 values (2, null);
insert into rs02 values (3, null);
insert into rs02 values (4, '2023-11-27 01:02:03');
select * from rs02;
col1    col2
1    2020-10-13 10:10:10
2    null
1    2021-10-10 00:00:00
2    2023-01-01 12:12:12
2    null
3    null
4    2023-11-27 01:02:03
drop table if exists rs03;
create table rs03 (col1 int, col2 float, col3 decimal, col4 enum('1','2','3','4'));
insert into rs03 values (1, 12.21, 32324.32131, 1);
insert into rs03 values (2, null, null, 2);
insert into rs03 values (2, -12.1, 34738, null);
insert into rs03 values (1, 90.2314, null, 4);
insert into rs03 values (1, 43425.4325, -7483.432, 2);
drop snapshot if exists sp02;
create snapshot sp02 for cluster;
select count(*) from mo_catalog.mo_tables{snapshot = 'sp02'} where reldatabase = 'test02';
count(*)
2
select * from mo_catalog.mo_database{snapshot = 'sp02'} where datname = 'test02';
dat_id    datname    dat_catalog_name    dat_createsql    owner    creator    created_time    account_id    dat_type
306651    test02    def    create database test02    0    1    2025-07-18 22:50:03    0    
select * from mo_catalog.mo_database{snapshot = 'sp02'} where datname = 'mo_catalog';
dat_id    datname    dat_catalog_name    dat_createsql    owner    creator    created_time    account_id    dat_type
1    mo_catalog    mo_catalog        0    0    2025-07-18 22:30:42    0    
use mo_catalog;
insert into cluster01 values(100,2,0);
insert into cluster01 values(200,3,0);
select count(*) from cluster01;
count(*)
4
select count(*) from cluster01{snapshot = 'sp02'};
count(*)
2
use test02;
insert into rs02 select * from rs02;
select count(*) from rs02;
count(*)
14
select count(*) from rs02{snapshot = 'sp02'};
count(*)
7
delete from rs03 where col1 = 1;
select count(*) from rs03;
count(*)
2
select count(*) from rs03{snapshot = 'sp02'};
count(*)
5
restore account sys from snapshot sp02;
show databases;
Database
cluster_level_snapshot_restore_to_sys_account
information_schema
mo_catalog
mo_debug
mo_task
mysql
system
system_metrics
test02
select count(*) from rs02;
count(*)
7
select count(*) from rs03;
count(*)
5
use mo_catalog;
select count(*) from cluster01;
count(*)
2
drop table cluster01;
use test02;
drop table rs02;
drop table rs03;
drop snapshot sp02;
drop database test02;
drop database if exists test03;
create database test03;
use test03;
drop table if exists pri01;
create table pri01(
deptno int unsigned comment '部门编号',
dname varchar(15) comment '部门名称',
loc varchar(50)  comment '部门所在位置',
primary key(deptno)
) comment='部门表';
insert into pri01 values (10,'ACCOUNTING','NEW YORK');
insert into pri01 values (20,'RESEARCH','DALLAS');
insert into pri01 values (30,'SALES','CHICAGO');
insert into pri01 values (40,'OPERATIONS','BOSTON');
drop table if exists aff01;
create table aff01(
empno int unsigned auto_increment COMMENT '雇员编号',
ename varchar(15) comment '雇员姓名',
job varchar(10) comment '雇员职位',
mgr int unsigned comment '雇员对应的领导的编号',
hiredate date comment '雇员的雇佣日期',
sal decimal(7,2) comment '雇员的基本工资',
comm decimal(7,2) comment '奖金',
deptno int unsigned comment '所在部门',
primary key(empno),
constraint `c1` foreign key (deptno) references pri01 (deptno)
);
insert into aff01 values (7369,'SMITH','CLERK',7902,'1980-12-17',800,NULL,20);
insert into aff01 values (7499,'ALLEN','SALESMAN',7698,'1981-02-20',1600,300,30);
insert into aff01 values (7521,'WARD','SALESMAN',7698,'1981-02-22',1250,500,30);
insert into aff01 values (7566,'JONES','MANAGER',7839,'1981-04-02',2975,NULL,20);
insert into aff01 values (7654,'MARTIN','SALESMAN',7698,'1981-09-28',1250,1400,30);
insert into aff01 values (7698,'BLAKE','MANAGER',7839,'1981-05-01',2850,NULL,30);
insert into aff01 values (7782,'CLARK','MANAGER',7839,'1981-06-09',2450,NULL,10);
insert into aff01 values (7788,'SCOTT','ANALYST',7566,'0087-07-13',3000,NULL,20);
insert into aff01 values (7839,'KING','PRESIDENT',NULL,'1981-11-17',5000,NULL,10);
insert into aff01 values (7844,'TURNER','SALESMAN',7698,'1981-09-08',1500,0,30);
insert into aff01 values (7876,'ADAMS','CLERK',7788,'0087-07-13',1100,NULL,20);
insert into aff01 values (7900,'JAMES','CLERK',7698,'1981-12-03',950,NULL,30);
insert into aff01 values (7902,'FORD','ANALYST',7566,'1981-12-03',3000,NULL,20);
insert into aff01 values (7934,'MILLER','CLERK',7782,'1982-01-23',1300,NULL,10);
select count(*) from pri01;
count(*)
4
select count(*) from aff01;
count(*)
14
show create table pri01;
Table    Create Table
pri01    CREATE TABLE `pri01` (\n  `deptno` int unsigned NOT NULL COMMENT '部门编号',\n  `dname` varchar(15) DEFAULT NULL COMMENT '部门名称',\n  `loc` varchar(50) DEFAULT NULL COMMENT '部门所在位置',\n  PRIMARY KEY (`deptno`)\n) COMMENT='部门表'
show create table aff01;
Table    Create Table
aff01    CREATE TABLE `aff01` (\n  `empno` int unsigned NOT NULL AUTO_INCREMENT COMMENT '雇员编号',\n  `ename` varchar(15) DEFAULT NULL COMMENT '雇员姓名',\n  `job` varchar(10) DEFAULT NULL COMMENT '雇员职位',\n  `mgr` int unsigned DEFAULT NULL COMMENT '雇员对应的领导的编号',\n  `hiredate` date DEFAULT NULL COMMENT '雇员的雇佣日期',\n  `sal` decimal(7,2) DEFAULT NULL COMMENT '雇员的基本工资',\n  `comm` decimal(7,2) DEFAULT NULL COMMENT '奖金',\n  `deptno` int unsigned DEFAULT NULL COMMENT '所在部门',\n  PRIMARY KEY (`empno`),\n  CONSTRAINT `c1` FOREIGN KEY (`deptno`) REFERENCES `pri01` (`deptno`) ON DELETE RESTRICT ON UPDATE RESTRICT\n)
drop snapshot if exists sp04;
create snapshot sp04 for cluster;
select count(*) from mo_catalog.mo_tables{snapshot = 'sp04'} where reldatabase = 'test03';
count(*)
2
select * from mo_catalog.mo_database{snapshot = 'sp04'} where datname = 'test03';
dat_id    datname    dat_catalog_name    dat_createsql    owner    creator    created_time    account_id    dat_type
306681    test03    def    create database test03    0    1    2025-07-18 22:50:03    0    
select attname from mo_catalog.mo_columns{snapshot = 'sp04'} where att_database = 'test03';
attname
empno
ename
job
mgr
hiredate
sal
comm
deptno
__mo_rowid
deptno
dname
loc
__mo_rowid
show snapshots where snapshot_name = 'sp04';
snapshot_name    timestamp    snapshot_level    account_name    database_name    table_name
sp04    2025-07-19 05:50:04.085836    cluster            
select * from aff01{snapshot = 'sp04'};
empno    ename    job    mgr    hiredate    sal    comm    deptno
7369    SMITH    CLERK    7902    1980-12-17    800.00    null    20
7499    ALLEN    SALESMAN    7698    1981-02-20    1600.00    300.00    30
7521    WARD    SALESMAN    7698    1981-02-22    1250.00    500.00    30
7566    JONES    MANAGER    7839    1981-04-02    2975.00    null    20
7654    MARTIN    SALESMAN    7698    1981-09-28    1250.00    1400.00    30
7698    BLAKE    MANAGER    7839    1981-05-01    2850.00    null    30
7782    CLARK    MANAGER    7839    1981-06-09    2450.00    null    10
7788    SCOTT    ANALYST    7566    0087-07-13    3000.00    null    20
7839    KING    PRESIDENT    null    1981-11-17    5000.00    null    10
7844    TURNER    SALESMAN    7698    1981-09-08    1500.00    0.00    30
7876    ADAMS    CLERK    7788    0087-07-13    1100.00    null    20
7900    JAMES    CLERK    7698    1981-12-03    950.00    null    30
7902    FORD    ANALYST    7566    1981-12-03    3000.00    null    20
7934    MILLER    CLERK    7782    1982-01-23    1300.00    null    10
select * from pri01{snapshot = 'sp04'};
deptno    dname    loc
10    ACCOUNTING    NEW YORK
20    RESEARCH    DALLAS
30    SALES    CHICAGO
40    OPERATIONS    BOSTON
drop database test03;
select * from test03.aff01{snapshot = 'sp04'};
empno    ename    job    mgr    hiredate    sal    comm    deptno
7369    SMITH    CLERK    7902    1980-12-17    800.00    null    20
7499    ALLEN    SALESMAN    7698    1981-02-20    1600.00    300.00    30
7521    WARD    SALESMAN    7698    1981-02-22    1250.00    500.00    30
7566    JONES    MANAGER    7839    1981-04-02    2975.00    null    20
7654    MARTIN    SALESMAN    7698    1981-09-28    1250.00    1400.00    30
7698    BLAKE    MANAGER    7839    1981-05-01    2850.00    null    30
7782    CLARK    MANAGER    7839    1981-06-09    2450.00    null    10
7788    SCOTT    ANALYST    7566    0087-07-13    3000.00    null    20
7839    KING    PRESIDENT    null    1981-11-17    5000.00    null    10
7844    TURNER    SALESMAN    7698    1981-09-08    1500.00    0.00    30
7876    ADAMS    CLERK    7788    0087-07-13    1100.00    null    20
7900    JAMES    CLERK    7698    1981-12-03    950.00    null    30
7902    FORD    ANALYST    7566    1981-12-03    3000.00    null    20
7934    MILLER    CLERK    7782    1982-01-23    1300.00    null    10
select * from test03.pri01{snapshot = 'sp04'};
deptno    dname    loc
10    ACCOUNTING    NEW YORK
20    RESEARCH    DALLAS
30    SALES    CHICAGO
40    OPERATIONS    BOSTON
select count(*) from test03.aff01{snapshot = 'sp04'};
count(*)
14
restore account sys from snapshot sp04;
use test03;
show create table aff01;
Table    Create Table
aff01    CREATE TABLE `aff01` (\n  `empno` int unsigned NOT NULL AUTO_INCREMENT COMMENT '雇员编号',\n  `ename` varchar(15) DEFAULT NULL COMMENT '雇员姓名',\n  `job` varchar(10) DEFAULT NULL COMMENT '雇员职位',\n  `mgr` int unsigned DEFAULT NULL COMMENT '雇员对应的领导的编号',\n  `hiredate` date DEFAULT NULL COMMENT '雇员的雇佣日期',\n  `sal` decimal(7,2) DEFAULT NULL COMMENT '雇员的基本工资',\n  `comm` decimal(7,2) DEFAULT NULL COMMENT '奖金',\n  `deptno` int unsigned DEFAULT NULL COMMENT '所在部门',\n  PRIMARY KEY (`empno`),\n  CONSTRAINT `c1` FOREIGN KEY (`deptno`) REFERENCES `pri01` (`deptno`) ON DELETE RESTRICT ON UPDATE RESTRICT\n)
show create table pri01;
Table    Create Table
pri01    CREATE TABLE `pri01` (\n  `deptno` int unsigned NOT NULL COMMENT '部门编号',\n  `dname` varchar(15) DEFAULT NULL COMMENT '部门名称',\n  `loc` varchar(50) DEFAULT NULL COMMENT '部门所在位置',\n  PRIMARY KEY (`deptno`)\n) COMMENT='部门表'
select count(*) from aff01;
count(*)
14
drop database test03;
drop snapshot sp04;
drop database if exists test01;
create database test01;
use test01;
create table t1(col1 int, col2 decimal);
insert into t1 values(1,2);
insert into t1 values(2,3);
insert into t1 values(3,4);
create table t2(cool1 int primary key , col2 decimal);
insert into t2 select * from t1;
create table t3 like t2;
select count(*) from t1;
count(*)
3
select count(*) from t2;
count(*)
3
select count(*) from t3;
count(*)
0
drop database if exists test02;
create database test02;
use test02;
create table t1(col1 int, col2 decimal);
insert into t1 values(1,2);
insert into t1 values(2,3);
insert into t1 values(3,4);
create table t2(col1 int primary key , col2 decimal);
insert into t2 select * from t1;
create table t3 like t2;
insert into t3 select * from t2;
select count(*) from t1;
count(*)
3
select count(*) from t2;
count(*)
3
select count(*) from t3;
count(*)
3
drop database if exists test03;
create database test03;
use test03;
create table t1(col1 int, col2 decimal);
insert into t1 values(1,2);
insert into t1 values(2,3);
insert into t1 values(3,4);
create table t2(cool1 int primary key , col2 decimal);
insert into t2 select * from t1;
create table t3 like t2;
insert into t3 select * from t2;
insert into t3 select * from t2;
Duplicate entry '1' for key 'cool1'
select count(*) from t1;
count(*)
3
select count(*) from t2;
count(*)
3
select count(*) from t3;
count(*)
3
drop snapshot if exists snap01;
create snapshot snap01 for cluster;
select count(*) from test01.t1 {snapshot = 'snap01'};
count(*)
3
select count(*) from test02.t2 {snapshot = 'snap01'};
count(*)
3
select count(*) from test03.t3 {snapshot = 'snap01'};
count(*)
3
drop database test01;
drop database test02;
show databases;
Database
cluster_level_snapshot_restore_to_sys_account
information_schema
mo_catalog
mo_debug
mo_task
mysql
system
system_metrics
test03
select * from test01.t1;
Unknown database test01
select count(*) from test03.t3;
count(*)
3
restore account sys from snapshot snap01;
show databases;
Database
cluster_level_snapshot_restore_to_sys_account
information_schema
mo_catalog
mo_debug
mo_task
mysql
system
system_metrics
test01
test02
test03
select count(*) from test01.t1;
count(*)
3
select * from test01.t1;
col1    col2
1    2
2    3
3    4
select count(*) from test02.t2;
count(*)
3
select * from test02.t2;
col1    col2
1    2
2    3
3    4
select count(*) from test03.t3;
count(*)
3
select * from test03.t3;
cool1    col2
1    2
2    3
3    4
show create table test01.t1;
Table    Create Table
t1    CREATE TABLE `t1` (\n  `col1` int DEFAULT NULL,\n  `col2` decimal(38,0) DEFAULT NULL\n)
show create table test02.t2;
Table    Create Table
t2    CREATE TABLE `t2` (\n  `col1` int NOT NULL,\n  `col2` decimal(38,0) DEFAULT NULL,\n  PRIMARY KEY (`col1`)\n)
show create table test03.t2;
Table    Create Table
t2    CREATE TABLE `t2` (\n  `cool1` int NOT NULL,\n  `col2` decimal(38,0) DEFAULT NULL,\n  PRIMARY KEY (`cool1`)\n)
drop database test01;
drop database test02;
drop database test03;
drop snapshot snap01;
drop snapshot if exists sp05;
create snapshot sp05 for cluster;
create database db01;
restore account sys FROM snapshot sp05;
show databases;
Database
cluster_level_snapshot_restore_to_sys_account
information_schema
mo_catalog
mo_debug
mo_task
mysql
system
system_metrics
drop snapshot sp05;
drop database if exists db01;
create database db01;
use db01;
drop table if exists table01;
create table table01(col1 int auto_increment , col2 decimal, col3 char, col4 varchar(20), col5 text, col6 double);
insert into table01 values (1, 2, 'a', '23eiojf', 'r23v324r23rer', 3923.324);
insert into table01 values (2, 3, 'b', '32r32r', 'database', 1111111);
drop table if exists table02;
create table table02 (col1 int unique key, col2 varchar(20));
insert into table02 (col1, col2) values (133, 'database');
drop snapshot if exists sp07;
create snapshot sp07 for cluster;
drop table table01;
insert into table02 values(134, 'database');
drop snapshot if exists sp08;
create snapshot sp08 for cluster;
show snapshots;
SNAPSHOT_NAME    TIMESTAMP    SNAPSHOT_LEVEL    ACCOUNT_NAME    DATABASE_NAME    TABLE_NAME
sp08    2025-07-19 05:50:05.133412    cluster            
sp07    2025-07-19 05:50:05.110286    cluster            
restore account sys from snapshot sp08;
select * from table02;
col1    col2
133    database
134    database
select * from db01.table01;
SQL parser error: table "table01" does not exist
select count(*) from table02;
count(*)
2
restore account sys from snapshot sp07;
select * from table01;
col1    col2    col3    col4    col5    col6
1    2    a    23eiojf    r23v324r23rer    3923.324
2    3    b    32r32r    database    1111111.0
select * from table02;
col1    col2
133    database
select count(*) from table01;
count(*)
2
select count(*) from table02;
count(*)
1
drop snapshot sp07;
drop snapshot sp08;
drop database db01;
drop database if exists db02;
create database db02;
use db02;
drop table if exists table01;
create table table01(col1 int primary key , col2 decimal unique key, col3 char, col4 varchar(20), col5 text, col6 double);
insert into table01 values (1, 2, 'a', '23eiojf', 'r23v324r23rer', 3923.324);
insert into table01 values (2, 3, 'b', '32r32r', 'database', 1111111);
drop table if exists table02;
create table table02 (col1 int unique key, col2 varchar(20));
insert into table02 (col1, col2) values (133, 'database');
drop snapshot if exists sp09;
create snapshot sp09 for cluster;
alter table table01 drop primary key;
insert into table02 values(134, 'database');
show create table table01;
Table    Create Table
table01    CREATE TABLE `table01` (\n  `col1` int NOT NULL,\n  `col2` decimal(38,0) DEFAULT NULL,\n  `col3` char(1) DEFAULT NULL,\n  `col4` varchar(20) DEFAULT NULL,\n  `col5` text DEFAULT NULL,\n  `col6` double DEFAULT NULL,\n  UNIQUE KEY `col2` (`col2`)\n)
drop snapshot if exists sp10;
create snapshot sp10 for cluster;
show snapshots;
SNAPSHOT_NAME    TIMESTAMP    SNAPSHOT_LEVEL    ACCOUNT_NAME    DATABASE_NAME    TABLE_NAME
sp10    2025-07-19 05:50:05.547588    cluster            
sp09    2025-07-19 05:50:05.524238    cluster            
restore account sys from snapshot sp09;
select * from table02;
col1    col2
133    database
select * from db02.table01;
col1    col2    col3    col4    col5    col6
1    2    a    23eiojf    r23v324r23rer    3923.324
2    3    b    32r32r    database    1111111.0
select count(*) from table02;
count(*)
1
select count(*) from table01;
count(*)
2
show create table table01;
Table    Create Table
table01    CREATE TABLE `table01` (\n  `col1` int NOT NULL,\n  `col2` decimal(38,0) DEFAULT NULL,\n  `col3` char(1) DEFAULT NULL,\n  `col4` varchar(20) DEFAULT NULL,\n  `col5` text DEFAULT NULL,\n  `col6` double DEFAULT NULL,\n  PRIMARY KEY (`col1`),\n  UNIQUE KEY `col2` (`col2`)\n)
restore account sys from snapshot sp10;
select * from db02.table01;
col1    col2    col3    col4    col5    col6
1    2    a    23eiojf    r23v324r23rer    3923.324
2    3    b    32r32r    database    1111111.0
select count(*) from table01;
count(*)
2
show create table db02.table01;
Table    Create Table
table01    CREATE TABLE `table01` (\n  `col1` int NOT NULL,\n  `col2` decimal(38,0) DEFAULT NULL,\n  `col3` char(1) DEFAULT NULL,\n  `col4` varchar(20) DEFAULT NULL,\n  `col5` text DEFAULT NULL,\n  `col6` double DEFAULT NULL,\n  UNIQUE KEY `col2` (`col2`)\n)
select * from db02.table02;
col1    col2
133    database
134    database
select count(*) from table02;
count(*)
2
drop snapshot sp09;
drop snapshot sp10;
drop database db02;
drop database if exists db03;
create database db03;
use db03;
drop table if exists ti1;
drop table if exists tm1;
drop table if exists ti2;
drop table if exists tm2;
create  table ti1(a INT not null, b INT, c INT);
create  table tm1(a INT not null, b INT, c INT);
create  table ti2(a INT primary key AUTO_INCREMENT, b INT, c INT);
create  table tm2(a INT primary key AUTO_INCREMENT, b INT, c INT);
show create table ti1;
Table    Create Table
ti1    CREATE TABLE `ti1` (\n  `a` int NOT NULL,\n  `b` int DEFAULT NULL,\n  `c` int DEFAULT NULL\n)
show create table tm1;
Table    Create Table
tm1    CREATE TABLE `tm1` (\n  `a` int NOT NULL,\n  `b` int DEFAULT NULL,\n  `c` int DEFAULT NULL\n)
show create table ti2;
Table    Create Table
ti2    CREATE TABLE `ti2` (\n  `a` int NOT NULL AUTO_INCREMENT,\n  `b` int DEFAULT NULL,\n  `c` int DEFAULT NULL,\n  PRIMARY KEY (`a`)\n)
show create table tm2;
Table    Create Table
tm2    CREATE TABLE `tm2` (\n  `a` int NOT NULL AUTO_INCREMENT,\n  `b` int DEFAULT NULL,\n  `c` int DEFAULT NULL,\n  PRIMARY KEY (`a`)\n)
drop snapshot if exists sp11;
create snapshot sp11 for cluster;
insert into ti1 values (1,1,1), (2,2,2);
insert into ti2 values (1,1,1), (2,2,2);
select * from ti1;
a    b    c
1    1    1
2    2    2
select * from tm1;
a    b    c
select * from ti2;
a    b    c
1    1    1
2    2    2
select * from tm2;
a    b    c
drop snapshot if exists sp12;
create snapshot sp12 for cluster;
insert into tm1 values (1,1,1), (2,2,2);
insert into tm2 values (1,1,1), (2,2,2);
select * from ti1 {snapshot = 'sp12'};
a    b    c
1    1    1
2    2    2
select * from tm1;
a    b    c
1    1    1
2    2    2
select * from ti2 {snapshot = 'sp12'};
a    b    c
1    1    1
2    2    2
select * from tm2;
a    b    c
1    1    1
2    2    2
drop snapshot if exists sp13;
create snapshot sp13 for cluster;
alter table ti1 add constraint fi1 foreign key (b) references ti2(a);
alter table tm1 add constraint fm1 foreign key (b) references tm2(a);
show create table ti1;
Table    Create Table
ti1    CREATE TABLE `ti1` (\n  `a` int NOT NULL,\n  `b` int DEFAULT NULL,\n  `c` int DEFAULT NULL,\n  CONSTRAINT `fi1` FOREIGN KEY (`b`) REFERENCES `ti2` (`a`) ON DELETE RESTRICT ON UPDATE RESTRICT\n)
show create table ti1{snapshot = 'sp13'};
Table    Create Table
ti1    CREATE TABLE `ti1` (\n  `a` int NOT NULL,\n  `b` int DEFAULT NULL,\n  `c` int DEFAULT NULL\n)
show create table tm1;
Table    Create Table
tm1    CREATE TABLE `tm1` (\n  `a` int NOT NULL,\n  `b` int DEFAULT NULL,\n  `c` int DEFAULT NULL,\n  CONSTRAINT `fm1` FOREIGN KEY (`b`) REFERENCES `tm2` (`a`) ON DELETE RESTRICT ON UPDATE RESTRICT\n)
show create table tm1{snapshot = 'sp13'};
Table    Create Table
tm1    CREATE TABLE `tm1` (\n  `a` int NOT NULL,\n  `b` int DEFAULT NULL,\n  `c` int DEFAULT NULL\n)
drop snapshot if exists sp14;
create snapshot sp14 for cluster;
show create table ti1 {snapshot = 'sp14'};
Table    Create Table
ti1    CREATE TABLE `ti1` (\n  `a` int NOT NULL,\n  `b` int DEFAULT NULL,\n  `c` int DEFAULT NULL,\n  CONSTRAINT `fi1` FOREIGN KEY (`b`) REFERENCES `ti2` (`a`) ON DELETE RESTRICT ON UPDATE RESTRICT\n)
show create table tm1 {snapshot = 'sp13'};
Table    Create Table
tm1    CREATE TABLE `tm1` (\n  `a` int NOT NULL,\n  `b` int DEFAULT NULL,\n  `c` int DEFAULT NULL\n)
show create table ti1 {snapshot = 'sp14'};
Table    Create Table
ti1    CREATE TABLE `ti1` (\n  `a` int NOT NULL,\n  `b` int DEFAULT NULL,\n  `c` int DEFAULT NULL,\n  CONSTRAINT `fi1` FOREIGN KEY (`b`) REFERENCES `ti2` (`a`) ON DELETE RESTRICT ON UPDATE RESTRICT\n)
show create table tm1 {snapshot = 'sp13'};
Table    Create Table
tm1    CREATE TABLE `tm1` (\n  `a` int NOT NULL,\n  `b` int DEFAULT NULL,\n  `c` int DEFAULT NULL\n)
alter table ti1 drop foreign key fi1;
alter table tm1 drop foreign key fm1;
truncate ti2;
truncate tm2;
drop snapshot if exists sp15;
create snapshot sp15 for cluster;
show create table ti1 {snapshot = 'sp14'};
Table    Create Table
ti1    CREATE TABLE `ti1` (\n  `a` int NOT NULL,\n  `b` int DEFAULT NULL,\n  `c` int DEFAULT NULL,\n  CONSTRAINT `fi1` FOREIGN KEY (`b`) REFERENCES `ti2` (`a`) ON DELETE RESTRICT ON UPDATE RESTRICT\n)
show create table tm1 {snapshot = 'sp15'};
Table    Create Table
tm1    CREATE TABLE `tm1` (\n  `a` int NOT NULL,\n  `b` int DEFAULT NULL,\n  `c` int DEFAULT NULL\n)
show create table ti1 {snapshot = 'sp14'};
Table    Create Table
ti1    CREATE TABLE `ti1` (\n  `a` int NOT NULL,\n  `b` int DEFAULT NULL,\n  `c` int DEFAULT NULL,\n  CONSTRAINT `fi1` FOREIGN KEY (`b`) REFERENCES `ti2` (`a`) ON DELETE RESTRICT ON UPDATE RESTRICT\n)
show create table tm1 {snapshot = 'sp15'};
Table    Create Table
tm1    CREATE TABLE `tm1` (\n  `a` int NOT NULL,\n  `b` int DEFAULT NULL,\n  `c` int DEFAULT NULL\n)
select count(*) from ti1;
count(*)
2
select count(*) from tm1;
count(*)
2
select count(*) from ti2;
count(*)
0
select count(*) from tm2;
count(*)
0
restore account sys from snapshot sp11;
show databases;
Database
cluster_level_snapshot_restore_to_sys_account
db03
information_schema
mo_catalog
mo_debug
mo_task
mysql
system
system_metrics
select * from db03.ti1;
a    b    c
select * from db03.tm1;
a    b    c
select * from db03.ti2;
a    b    c
select * from db03.tm2;
a    b    c
show create table db03.ti1;
Table    Create Table
ti1    CREATE TABLE `ti1` (\n  `a` int NOT NULL,\n  `b` int DEFAULT NULL,\n  `c` int DEFAULT NULL\n)
show create table db03.tm1;
Table    Create Table
tm1    CREATE TABLE `tm1` (\n  `a` int NOT NULL,\n  `b` int DEFAULT NULL,\n  `c` int DEFAULT NULL\n)
show create table db03.ti2;
Table    Create Table
ti2    CREATE TABLE `ti2` (\n  `a` int NOT NULL AUTO_INCREMENT,\n  `b` int DEFAULT NULL,\n  `c` int DEFAULT NULL,\n  PRIMARY KEY (`a`)\n)
show create table db03.tm2;
Table    Create Table
tm2    CREATE TABLE `tm2` (\n  `a` int NOT NULL AUTO_INCREMENT,\n  `b` int DEFAULT NULL,\n  `c` int DEFAULT NULL,\n  PRIMARY KEY (`a`)\n)
restore account sys from snapshot sp14;
show databases;
Database
cluster_level_snapshot_restore_to_sys_account
db03
information_schema
mo_catalog
mo_debug
mo_task
mysql
system
system_metrics
select * from db03.ti1;
a    b    c
1    1    1
2    2    2
select * from db03.tm1;
a    b    c
1    1    1
2    2    2
select * from db03.ti2;
a    b    c
1    1    1
2    2    2
select * from db03.tm2;
a    b    c
1    1    1
2    2    2
show create table db03.ti1;
Table    Create Table
ti1    CREATE TABLE `ti1` (\n  `a` int NOT NULL,\n  `b` int DEFAULT NULL,\n  `c` int DEFAULT NULL,\n  CONSTRAINT `fi1` FOREIGN KEY (`b`) REFERENCES `ti2` (`a`) ON DELETE RESTRICT ON UPDATE RESTRICT\n)
show create table db03.tm1;
Table    Create Table
tm1    CREATE TABLE `tm1` (\n  `a` int NOT NULL,\n  `b` int DEFAULT NULL,\n  `c` int DEFAULT NULL,\n  CONSTRAINT `fm1` FOREIGN KEY (`b`) REFERENCES `tm2` (`a`) ON DELETE RESTRICT ON UPDATE RESTRICT\n)
show create table db03.ti2;
Table    Create Table
ti2    CREATE TABLE `ti2` (\n  `a` int NOT NULL AUTO_INCREMENT,\n  `b` int DEFAULT NULL,\n  `c` int DEFAULT NULL,\n  PRIMARY KEY (`a`)\n)
show create table db03.tm2;
Table    Create Table
tm2    CREATE TABLE `tm2` (\n  `a` int NOT NULL AUTO_INCREMENT,\n  `b` int DEFAULT NULL,\n  `c` int DEFAULT NULL,\n  PRIMARY KEY (`a`)\n)
drop database db03;
drop snapshot sp15;
drop snapshot sp14;
drop snapshot sp13;
drop snapshot sp12;
drop snapshot sp11;
