drop database if exists db_ft_snap;
create database db_ft_snap;
use db_ft_snap;
drop table if exists ft_test;
create table ft_test (
id int primary key,
content text,
fulltext index ft_content (content) with parser ngram
);
insert into ft_test values (1, 'hello world');
insert into ft_test values (2, 'foo bar baz');
select id from ft_test where match(content) against('hello' in boolean mode);
➤ id[4,32,0]  𝄀
1
create snapshot ft_snap1 for account sys;
insert into ft_test values (3, 'new data after snapshot');
select id from ft_test where match(content) against('new' in boolean mode);
➤ id[4,32,0]  𝄀
3
delete from ft_test;
insert into ft_test select * from db_ft_snap.ft_test {snapshot = 'ft_snap1'};
select id, content from ft_test;
➤ id[4,32,0]  ¦  content[12,0,0]  𝄀
1  ¦  hello world  𝄀
2  ¦  foo bar baz
select id from ft_test where match(content) against('hello' in boolean mode);
➤ id[4,32,0]  𝄀
1
select id from ft_test where match(content) against('new' in boolean mode);
➤ id[4,32,0]
drop snapshot if exists ft_snap1;
drop table if exists ft_test;
drop table if exists ft_multi;
create table ft_multi (
id int primary key,
title varchar(200),
body text,
fulltext index ft_title (title) with parser ngram,
fulltext index ft_body (body) with parser ngram
);
insert into ft_multi values (1, 'database tutorial', 'learn how to use databases');
insert into ft_multi values (2, 'search engine', 'fulltext search is powerful');
create snapshot ft_snap2 for account sys;
update ft_multi set title = 'MODIFIED' where id = 1;
insert into ft_multi values (3, 'extra row', 'should not exist after restore');
delete from ft_multi;
insert into ft_multi select * from db_ft_snap.ft_multi {snapshot = 'ft_snap2'};
select id from ft_multi where match(title) against('database' in boolean mode);
➤ id[4,32,0]  𝄀
1
select id from ft_multi where match(body) against('search' in boolean mode);
➤ id[4,32,0]  𝄀
2
select id from ft_multi where match(title) against('extra' in boolean mode);
➤ id[4,32,0]
drop snapshot if exists ft_snap2;
drop table if exists ft_multi;
drop table if exists ft_restore;
create table ft_restore (
id int primary key,
doc text,
fulltext index ft_doc (doc) with parser ngram
);
insert into ft_restore values (1, 'alpha beta gamma');
insert into ft_restore values (2, 'delta epsilon zeta');
create snapshot ft_snap3 for account sys;
drop table ft_restore;
create table ft_restore (
id int primary key,
doc text,
fulltext index ft_doc (doc) with parser ngram
);
insert into ft_restore values (10, 'completely different');
delete from ft_restore;
insert into ft_restore select * from db_ft_snap.ft_restore {snapshot = 'ft_snap3'};
select id, doc from ft_restore;
➤ id[4,32,0]  ¦  doc[12,0,0]  𝄀
1  ¦  alpha beta gamma  𝄀
2  ¦  delta epsilon zeta
select id from ft_restore where match(doc) against('alpha' in boolean mode);
➤ id[4,32,0]  𝄀
1
select id from ft_restore where match(doc) against('different' in boolean mode);
➤ id[4,32,0]
drop snapshot if exists ft_snap3;
drop table if exists ft_restore;
drop database if exists db_ft_snap;
