drop database if exists snapshot_read;
create database if not exists snapshot_read;
use snapshot_read;
create table test_snapshot_read (a int);
INSERT INTO test_snapshot_read (a) VALUES(1), (2), (3), (4), (5),(6), (7), (8), (9), (10), (11), (12),(13), (14), (15), (16), (17), (18), (19), (20),(21), (22), (23), (24), (25), (26), (27), (28), (29), (30),(31), (32), (33), (34), (35), (36), (37), (38), (39), (40),(41), (42), (43), (44), (45), (46), (47), (48), (49), (50),(51), (52), (53), (54), (55), (56), (57), (58), (59), (60),(61), (62), (63), (64), (65), (66), (67), (68), (69), (70),(71), (72), (73), (74), (75), (76), (77), (78), (79), (80), (81), (82), (83), (84), (85), (86), (87), (88), (89), (90),(91), (92), (93), (94), (95), (96), (97), (98), (99), (100);
CREATE TABLE users (
id INT AUTO_INCREMENT PRIMARY KEY,
username VARCHAR(255) NOT NULL,
email VARCHAR(255) NOT NULL UNIQUE,
password VARCHAR(255) NOT NULL,
created_at TIMESTAMP DEFAULT CURRENT_TIMESTAMP
);
INSERT INTO users (username, email, password) VALUES ('john_doe', 'john@example.com', 'securepassword123');
INSERT INTO users (username, email, password) VALUES ('jane_smith', 'jane.smith@example.com', 'password123'),('alice_jones', 'alice.jones@gmail.com', 'ilovecats'),('bob_brown', 'bob.brown@yahoo.com', 'mysecretpassword'),('charlie_lee', 'charlie.lee@protonmail.ch', 'secure123'),('diana_wilson', 'diana.wilson@outlook.com', 'D1anaPass');
INSERT INTO users (username, email, password) VALUES ('emily_adams', 'emily.adams@icloud.com', 'Em1Ly123'), ('francis_nguyen', 'francis.nguyen@domain.com', 'fNguyenPass'), ('grace_parker', 'grace.parker@server.com', 'G1race123'), ('henry_miller', 'henry.miller@company.org', 'hMillerSecret'), ('isabella_grant', 'isabella.grant@university.edu', 'iGrantPass');
select count(*) from snapshot_read.test_snapshot_read;
count(*)
100
select count(*) from snapshot_read.users;
count(*)
11
drop snapshot if exists sp_01;
create snapshot sp_01 for database snapshot_read;
delete from test_snapshot_read where a <= 50;
DELETE FROM  users where email = 'john@example.com';
UPDATE users SET password = 'newsecurepassword123' WHERE email = 'alice.jones@gmail.com';
INSERT INTO test_snapshot_read (a) VALUES(1), (2), (3), (4), (5),(6), (7), (8), (9), (10), (11), (12),(13), (14), (15), (16), (17), (18), (19), (20),(21), (22), (23), (24), (25), (26), (27), (28), (29), (30),(31), (32), (33), (34), (35), (36), (37), (38), (39), (40);
select count(*) from snapshot_read.test_snapshot_read;
count(*)
90
select count(*) from snapshot_read.users;
count(*)
10
restore database sys.snapshot_read{snapshot="sp_01"};
restore account sys from snapshot sp_01;
internal error: can't restore account from db or table level snapshot
restore database sys.mo_catalog{snapshot="sp_01"};
internal error: can't restore db: mo_catalog
select count(*) from snapshot_read.test_snapshot_read;
count(*)
100
select count(*) from snapshot_read.users;
count(*)
11
drop database if exists snapshot_read;
drop snapshot if exists sp_01;
drop account if exists acc01;
create account acc01 admin_name = 'test_account' identified by '111';
drop database if exists snapshot_read;
create database if not exists snapshot_read;
use snapshot_read;
create table test_snapshot_read (a int);
INSERT INTO test_snapshot_read (a) VALUES(1), (2), (3), (4), (5),(6), (7), (8), (9), (10), (11), (12),(13), (14), (15), (16), (17), (18), (19), (20),(21), (22), (23), (24), (25), (26), (27), (28), (29), (30),(31), (32), (33), (34), (35), (36), (37), (38), (39), (40),(41), (42), (43), (44), (45), (46), (47), (48), (49), (50),(51), (52), (53), (54), (55), (56), (57), (58), (59), (60),(61), (62), (63), (64), (65), (66), (67), (68), (69), (70),(71), (72), (73), (74), (75), (76), (77), (78), (79), (80), (81), (82), (83), (84), (85), (86), (87), (88), (89), (90),(91), (92), (93), (94), (95), (96), (97), (98), (99), (100);
CREATE TABLE users (
id INT AUTO_INCREMENT PRIMARY KEY,
username VARCHAR(255) NOT NULL,
email VARCHAR(255) NOT NULL UNIQUE,
password VARCHAR(255) NOT NULL,
created_at TIMESTAMP DEFAULT CURRENT_TIMESTAMP
);
INSERT INTO users (username, email, password) VALUES ('john_doe', 'john@example.com', 'securepassword123');
INSERT INTO users (username, email, password) VALUES ('jane_smith', 'jane.smith@example.com', 'password123'),('alice_jones', 'alice.jones@gmail.com', 'ilovecats'),('bob_brown', 'bob.brown@yahoo.com', 'mysecretpassword'),('charlie_lee', 'charlie.lee@protonmail.ch', 'secure123'),('diana_wilson', 'diana.wilson@outlook.com', 'D1anaPass');
INSERT INTO users (username, email, password) VALUES ('emily_adams', 'emily.adams@icloud.com', 'Em1Ly123'), ('francis_nguyen', 'francis.nguyen@domain.com', 'fNguyenPass'), ('grace_parker', 'grace.parker@server.com', 'G1race123'), ('henry_miller', 'henry.miller@company.org', 'hMillerSecret'), ('isabella_grant', 'isabella.grant@university.edu', 'iGrantPass');
select count(*) from snapshot_read.test_snapshot_read;
count(*)
100
select count(*) from snapshot_read.users;
count(*)
11
drop snapshot if exists sp_01;
create snapshot sp_01 for database snapshot_read;
delete from test_snapshot_read where a <= 50;
DELETE FROM  users where email = 'john@example.com';
UPDATE users SET password = 'newsecurepassword123' WHERE email = 'alice.jones@gmail.com';
INSERT INTO test_snapshot_read (a) VALUES(1), (2), (3), (4), (5),(6), (7), (8), (9), (10), (11), (12),(13), (14), (15), (16), (17), (18), (19), (20),(21), (22), (23), (24), (25), (26), (27), (28), (29), (30),(31), (32), (33), (34), (35), (36), (37), (38), (39), (40);
select count(*) from snapshot_read.test_snapshot_read;
count(*)
90
select count(*) from snapshot_read.users;
count(*)
10
restore database acc01.snapshot_read{snapshot="sp_01"};
select count(*) from snapshot_read.test_snapshot_read;
count(*)
100
select count(*) from snapshot_read.users;
count(*)
11
drop database if exists snapshot_read;
drop snapshot if exists sp_01;
drop account if exists acc1;
drop database if exists snapshot_read;
create database if not exists snapshot_read;
use snapshot_read;
create table test_snapshot_read (a int);
INSERT INTO test_snapshot_read (a) VALUES(1), (2), (3), (4), (5),(6), (7), (8), (9), (10), (11), (12),(13), (14), (15), (16), (17), (18), (19), (20),(21), (22), (23), (24), (25), (26), (27), (28), (29), (30),(31), (32), (33), (34), (35), (36), (37), (38), (39), (40),(41), (42), (43), (44), (45), (46), (47), (48), (49), (50),(51), (52), (53), (54), (55), (56), (57), (58), (59), (60),(61), (62), (63), (64), (65), (66), (67), (68), (69), (70),(71), (72), (73), (74), (75), (76), (77), (78), (79), (80), (81), (82), (83), (84), (85), (86), (87), (88), (89), (90),(91), (92), (93), (94), (95), (96), (97), (98), (99), (100);
CREATE TABLE users (
id INT AUTO_INCREMENT PRIMARY KEY,
username VARCHAR(255) NOT NULL,
email VARCHAR(255) NOT NULL UNIQUE,
password VARCHAR(255) NOT NULL,
created_at TIMESTAMP DEFAULT CURRENT_TIMESTAMP
);
INSERT INTO users (username, email, password) VALUES ('john_doe', 'john@example.com', 'securepassword123');
INSERT INTO users (username, email, password) VALUES ('jane_smith', 'jane.smith@example.com', 'password123'),('alice_jones', 'alice.jones@gmail.com', 'ilovecats'),('bob_brown', 'bob.brown@yahoo.com', 'mysecretpassword'),('charlie_lee', 'charlie.lee@protonmail.ch', 'secure123'),('diana_wilson', 'diana.wilson@outlook.com', 'D1anaPass');
INSERT INTO users (username, email, password) VALUES ('emily_adams', 'emily.adams@icloud.com', 'Em1Ly123'), ('francis_nguyen', 'francis.nguyen@domain.com', 'fNguyenPass'), ('grace_parker', 'grace.parker@server.com', 'G1race123'), ('henry_miller', 'henry.miller@company.org', 'hMillerSecret'), ('isabella_grant', 'isabella.grant@university.edu', 'iGrantPass');
select count(*) from snapshot_read.test_snapshot_read;
count(*)
100
select count(*) from snapshot_read.users;
count(*)
11
drop snapshot if exists sp_01;
create snapshot sp_01 for database snapshot_read;
delete from test_snapshot_read where a <= 50;
DELETE FROM  users where email = 'john@example.com';
UPDATE users SET password = 'newsecurepassword123' WHERE email = 'alice.jones@gmail.com';
INSERT INTO test_snapshot_read (a) VALUES(1), (2), (3), (4), (5),(6), (7), (8), (9), (10), (11), (12),(13), (14), (15), (16), (17), (18), (19), (20),(21), (22), (23), (24), (25), (26), (27), (28), (29), (30),(31), (32), (33), (34), (35), (36), (37), (38), (39), (40);
select count(*) from snapshot_read.test_snapshot_read;
count(*)
90
select count(*) from snapshot_read.users;
count(*)
10
restore table sys.snapshot_read.test_snapshot_read{snapshot="sp_01"};
restore table sys.snapshot_read.users{snapshot="sp_01"};
select count(*) from snapshot_read.test_snapshot_read;
count(*)
100
select count(*) from snapshot_read.users;
count(*)
11
drop database if exists snapshot_read;
drop snapshot if exists sp_01;
drop account if exists acc01;
create account acc01 admin_name = 'test_account' identified by '111';
drop database if exists snapshot_read;
create database if not exists snapshot_read;
use snapshot_read;
create table test_snapshot_read (a int);
INSERT INTO test_snapshot_read (a) VALUES(1), (2), (3), (4), (5),(6), (7), (8), (9), (10), (11), (12),(13), (14), (15), (16), (17), (18), (19), (20),(21), (22), (23), (24), (25), (26), (27), (28), (29), (30),(31), (32), (33), (34), (35), (36), (37), (38), (39), (40),(41), (42), (43), (44), (45), (46), (47), (48), (49), (50),(51), (52), (53), (54), (55), (56), (57), (58), (59), (60),(61), (62), (63), (64), (65), (66), (67), (68), (69), (70),(71), (72), (73), (74), (75), (76), (77), (78), (79), (80), (81), (82), (83), (84), (85), (86), (87), (88), (89), (90),(91), (92), (93), (94), (95), (96), (97), (98), (99), (100);
CREATE TABLE users (
id INT AUTO_INCREMENT PRIMARY KEY,
username VARCHAR(255) NOT NULL,
email VARCHAR(255) NOT NULL UNIQUE,
password VARCHAR(255) NOT NULL,
created_at TIMESTAMP DEFAULT CURRENT_TIMESTAMP
);
INSERT INTO users (username, email, password) VALUES ('john_doe', 'john@example.com', 'securepassword123');
INSERT INTO users (username, email, password) VALUES ('jane_smith', 'jane.smith@example.com', 'password123'),('alice_jones', 'alice.jones@gmail.com', 'ilovecats'),('bob_brown', 'bob.brown@yahoo.com', 'mysecretpassword'),('charlie_lee', 'charlie.lee@protonmail.ch', 'secure123'),('diana_wilson', 'diana.wilson@outlook.com', 'D1anaPass');
INSERT INTO users (username, email, password) VALUES ('emily_adams', 'emily.adams@icloud.com', 'Em1Ly123'), ('francis_nguyen', 'francis.nguyen@domain.com', 'fNguyenPass'), ('grace_parker', 'grace.parker@server.com', 'G1race123'), ('henry_miller', 'henry.miller@company.org', 'hMillerSecret'), ('isabella_grant', 'isabella.grant@university.edu', 'iGrantPass');
select count(*) from snapshot_read.test_snapshot_read;
count(*)
100
select count(*) from snapshot_read.users;
count(*)
11
drop snapshot if exists sp_01;
create snapshot sp_01 for database snapshot_read;
delete from test_snapshot_read where a <= 50;
DELETE FROM  users where email = 'john@example.com';
UPDATE users SET password = 'newsecurepassword123' WHERE email = 'alice.jones@gmail.com';
INSERT INTO test_snapshot_read (a) VALUES(1), (2), (3), (4), (5),(6), (7), (8), (9), (10), (11), (12),(13), (14), (15), (16), (17), (18), (19), (20),(21), (22), (23), (24), (25), (26), (27), (28), (29), (30),(31), (32), (33), (34), (35), (36), (37), (38), (39), (40);
select count(*) from snapshot_read.test_snapshot_read;
count(*)
90
select count(*) from snapshot_read.users;
count(*)
10
restore table acc01.snapshot_read.test_snapshot_read{snapshot="sp_01"};
restore table acc01.snapshot_read.users{snapshot="sp_01"};
select count(*) from snapshot_read.test_snapshot_read;
count(*)
100
select count(*) from snapshot_read.users;
count(*)
11
drop database if exists snapshot_read;
drop snapshot if exists sp_01;
drop account if exists acc1;
drop database if exists snapshot_read;
create database if not exists snapshot_read;
use snapshot_read;
create table test_snapshot_read (a int);
INSERT INTO test_snapshot_read (a) VALUES(1), (2), (3), (4), (5),(6), (7), (8), (9), (10), (11), (12),(13), (14), (15), (16), (17), (18), (19), (20),(21), (22), (23), (24), (25), (26), (27), (28), (29), (30),(31), (32), (33), (34), (35), (36), (37), (38), (39), (40),(41), (42), (43), (44), (45), (46), (47), (48), (49), (50),(51), (52), (53), (54), (55), (56), (57), (58), (59), (60),(61), (62), (63), (64), (65), (66), (67), (68), (69), (70),(71), (72), (73), (74), (75), (76), (77), (78), (79), (80), (81), (82), (83), (84), (85), (86), (87), (88), (89), (90),(91), (92), (93), (94), (95), (96), (97), (98), (99), (100);
CREATE TABLE users (
id INT AUTO_INCREMENT PRIMARY KEY,
username VARCHAR(255) NOT NULL,
email VARCHAR(255) NOT NULL UNIQUE,
password VARCHAR(255) NOT NULL,
created_at TIMESTAMP DEFAULT CURRENT_TIMESTAMP
);
INSERT INTO users (username, email, password) VALUES ('john_doe', 'john@example.com', 'securepassword123');
INSERT INTO users (username, email, password) VALUES ('jane_smith', 'jane.smith@example.com', 'password123'),('alice_jones', 'alice.jones@gmail.com', 'ilovecats'),('bob_brown', 'bob.brown@yahoo.com', 'mysecretpassword'),('charlie_lee', 'charlie.lee@protonmail.ch', 'secure123'),('diana_wilson', 'diana.wilson@outlook.com', 'D1anaPass');
INSERT INTO users (username, email, password) VALUES ('emily_adams', 'emily.adams@icloud.com', 'Em1Ly123'), ('francis_nguyen', 'francis.nguyen@domain.com', 'fNguyenPass'), ('grace_parker', 'grace.parker@server.com', 'G1race123'), ('henry_miller', 'henry.miller@company.org', 'hMillerSecret'), ('isabella_grant', 'isabella.grant@university.edu', 'iGrantPass');
select count(*) from snapshot_read.test_snapshot_read;
count(*)
100
select count(*) from snapshot_read.users;
count(*)
11
drop snapshot if exists sp_01;
create snapshot sp_01 for table snapshot_read test_snapshot_read;
delete from test_snapshot_read where a <= 50;
DELETE FROM  users where email = 'john@example.com';
UPDATE users SET password = 'newsecurepassword123' WHERE email = 'alice.jones@gmail.com';
INSERT INTO test_snapshot_read (a) VALUES(1), (2), (3), (4), (5),(6), (7), (8), (9), (10), (11), (12),(13), (14), (15), (16), (17), (18), (19), (20),(21), (22), (23), (24), (25), (26), (27), (28), (29), (30),(31), (32), (33), (34), (35), (36), (37), (38), (39), (40);
select count(*) from snapshot_read.test_snapshot_read;
count(*)
90
select count(*) from snapshot_read.users;
count(*)
10
restore table sys.snapshot_read.test_snapshot_read{snapshot="sp_01"};
restore table sys.snapshot_read.users{snapshot="sp_01"};
internal error: tableName(users) does not match snapshot.tableName(test_snapshot_read)
restore database sys.mo_catalog{snapshot="sp_01"};
internal error: can't restore db: mo_catalog
restore account sys from snapshot sp_01;
internal error: can't restore account from db or table level snapshot
select count(*) from snapshot_read.test_snapshot_read;
count(*)
100
select count(*) from snapshot_read.users;
count(*)
10
drop database if exists snapshot_read;
drop snapshot if exists sp_01;
