create database if not exists snapshot_read;
use snapshot_read;
create table test_snapshot_read (a int);
INSERT INTO test_snapshot_read (a) VALUES(1), (2), (3), (4), (5),(6), (7), (8), (9), (10), (11), (12),(13), (14), (15), (16), (17), (18), (19), (20),(21), (22), (23), (24), (25), (26), (27), (28), (29), (30),(31), (32), (33), (34), (35), (36), (37), (38), (39), (40),(41), (42), (43), (44), (45), (46), (47), (48), (49), (50),(51), (52), (53), (54), (55), (56), (57), (58), (59), (60),(61), (62), (63), (64), (65), (66), (67), (68), (69), (70),(71), (72), (73), (74), (75), (76), (77), (78), (79), (80), (81), (82), (83), (84), (85), (86), (87), (88), (89), (90),(91), (92), (93), (94), (95), (96), (97), (98), (99), (100);
select count(*) from test_snapshot_read;
count(*)
100
select sleep(1);
sleep(1)
0
create snapshot snapshot_01 for account;
delete from test_snapshot_read where a <= 50;
select count(*) from test_snapshot_read;
count(*)
50
select count(*) from test_snapshot_read {snapshot = 'snapshot_01'};
count(*)
100
select sleep(1);
sleep(1)
0
create snapshot snapshot_02 for account;
INSERT INTO test_snapshot_read (a) VALUES(1), (2), (3), (4), (5),(6), (7), (8), (9), (10), (11), (12),(13), (14), (15), (16), (17), (18), (19), (20),(21), (22), (23), (24), (25), (26), (27), (28), (29), (30),(31), (32), (33), (34), (35), (36), (37), (38), (39), (40);
select count(*) from test_snapshot_read;
count(*)
90
select count(*) from test_snapshot_read{snapshot = 'snapshot_02'};
count(*)
50
create table test_snapshot_read2(b int);
INSERT INTO test_snapshot_read2 select * from test_snapshot_read{snapshot = 'snapshot_01'} where a <= 30;
select count(*) test_snapshot_read2;
test_snapshot_read2
1
select count(*) from mo_catalog.mo_tables where reldatabase = 'snapshot_read';
count(*)
2
select sleep(1);
sleep(1)
0
create snapshot snapshot_03 for account;
drop table if exists test_snapshot_read2;
select count(*) from mo_catalog.mo_tables where reldatabase = 'snapshot_read';
count(*)
1
select count(*) from mo_catalog.mo_tables{snapshot = 'snapshot_03'} where reldatabase = 'snapshot_read';
count(*)
2
drop table if exists test_snapshot_read;
drop database if exists snapshot_read;
drop snapshot snapshot_01;
drop snapshot snapshot_02;
drop snapshot snapshot_03;
create database if not exists snapshot_read;
use snapshot_read;
create table test_snapshot_read (a int);
INSERT INTO test_snapshot_read (a) VALUES(1), (2), (3), (4), (5),(6), (7), (8), (9), (10), (11), (12),(13), (14), (15), (16), (17), (18), (19), (20),(21), (22), (23), (24), (25), (26), (27), (28), (29), (30),(31), (32), (33), (34), (35), (36), (37), (38), (39), (40),(41), (42), (43), (44), (45), (46), (47), (48), (49), (50),(51), (52), (53), (54), (55), (56), (57), (58), (59), (60),(61), (62), (63), (64), (65), (66), (67), (68), (69), (70),(71), (72), (73), (74), (75), (76), (77), (78), (79), (80), (81), (82), (83), (84), (85), (86), (87), (88), (89), (90),(91), (92), (93), (94), (95), (96), (97), (98), (99), (100);
select count(*) from test_snapshot_read;
count(*)
100
create snapshot snapshot_01 for account;
delete from test_snapshot_read where a <= 50;
select count(*) from test_snapshot_read;
count(*)
50
select count(*) from test_snapshot_read {snapshot = 'snapshot_01'};
count(*)
100
create snapshot snapshot_02 for account;
INSERT INTO test_snapshot_read (a) VALUES(1), (2), (3), (4), (5),(6), (7), (8), (9), (10), (11), (12),(13), (14), (15), (16), (17), (18), (19), (20),(21), (22), (23), (24), (25), (26), (27), (28), (29), (30),(31), (32), (33), (34), (35), (36), (37), (38), (39), (40);
select count(*) from test_snapshot_read;
count(*)
90
select count(*) from test_snapshot_read{snapshot = 'snapshot_02'};
count(*)
50
create table test_snapshot_read2(b int);
INSERT INTO test_snapshot_read2 select * from test_snapshot_read{snapshot = 'snapshot_01'} where a <= 30;
select count(*) test_snapshot_read2;
test_snapshot_read2
1
select count(*) from mo_catalog.mo_tables where reldatabase = 'snapshot_read';
count(*)
2
create snapshot snapshot_03 for account;
drop table if exists test_snapshot_read2;
select count(*) from mo_catalog.mo_tables where reldatabase = 'snapshot_read';
count(*)
1
select count(*) from mo_catalog.mo_tables{snapshot = 'snapshot_03'} where reldatabase = 'snapshot_read';
count(*)
2
drop table if exists test_snapshot_read;
drop database if exists snapshot_read;
drop snapshot snapshot_01;
drop snapshot snapshot_02;
drop snapshot snapshot_03;
drop account if exists test_account;
create account test_account admin_name = 'test_user' identified by '111';
create database if not exists snapshot_read;
use snapshot_read;
create table test_snapshot_read (a int);
INSERT INTO test_snapshot_read (a) VALUES(1), (2), (3), (4), (5),(6), (7), (8), (9), (10), (11), (12),(13), (14), (15), (16), (17), (18), (19), (20),(21), (22), (23), (24), (25), (26), (27), (28), (29), (30),(31), (32), (33), (34), (35), (36), (37), (38), (39), (40),(41), (42), (43), (44), (45), (46), (47), (48), (49), (50),(51), (52), (53), (54), (55), (56), (57), (58), (59), (60),(61), (62), (63), (64), (65), (66), (67), (68), (69), (70),(71), (72), (73), (74), (75), (76), (77), (78), (79), (80), (81), (82), (83), (84), (85), (86), (87), (88), (89), (90),(91), (92), (93), (94), (95), (96), (97), (98), (99), (100);
select count(*) from test_snapshot_read;
count(*)
100
create snapshot snapshot_01 for account test_account;
delete from test_snapshot_read where a <= 50;
select count(*) from test_snapshot_read;
count(*)
50
select count(*) from test_snapshot_read {snapshot = 'snapshot_01'};
count(*)
100
create snapshot snapshot_02 for account test_account;
INSERT INTO test_snapshot_read (a) VALUES(1), (2), (3), (4), (5),(6), (7), (8), (9), (10), (11), (12),(13), (14), (15), (16), (17), (18), (19), (20),(21), (22), (23), (24), (25), (26), (27), (28), (29), (30),(31), (32), (33), (34), (35), (36), (37), (38), (39), (40);
select count(*) from test_snapshot_read;
count(*)
90
select count(*) from test_snapshot_read{snapshot = 'snapshot_02'};
count(*)
50
create table test_snapshot_read2(b int);
INSERT INTO test_snapshot_read2 select * from test_snapshot_read{snapshot = 'snapshot_01'} where a <= 30;
select count(*) test_snapshot_read2;
test_snapshot_read2
1
select count(*) from mo_catalog.mo_tables where reldatabase = 'snapshot_read';
count(*)
2
create snapshot snapshot_03 for account test_account;
drop table if exists test_snapshot_read2;
select count(*) from mo_catalog.mo_tables where reldatabase = 'snapshot_read';
count(*)
1
select count(*) from mo_catalog.mo_tables{snapshot = 'snapshot_03'} where reldatabase = 'snapshot_read';
count(*)
2
select count(*) from test_snapshot_read{timestamp = '3020-01-01 00:00:00'};
count(*)
90
drop table if exists test_snapshot_read;
drop database if exists snapshot_read;
drop snapshot snapshot_01;
drop snapshot snapshot_02;
drop snapshot snapshot_03;
drop account if exists test_account;
create database if not exists snapshot_read;
use snapshot_read;
CREATE TABLE users (
id INT AUTO_INCREMENT PRIMARY KEY,
username VARCHAR(255) NOT NULL,
email VARCHAR(255) NOT NULL UNIQUE,
password VARCHAR(255) NOT NULL,
created_at TIMESTAMP DEFAULT CURRENT_TIMESTAMP
);
INSERT INTO users (username, email, password) VALUES ('john_doe', 'john@example.com', 'securepassword123');
INSERT INTO users (username, email, password) VALUES ('jane_smith', 'jane.smith@example.com', 'password123'),('alice_jones', 'alice.jones@gmail.com', 'ilovecats'),('bob_brown', 'bob.brown@yahoo.com', 'mysecretpassword'),('charlie_lee', 'charlie.lee@protonmail.ch', 'secure123'),('diana_wilson', 'diana.wilson@outlook.com', 'D1anaPass');
INSERT INTO users (username, email, password) VALUES ('emily_adams', 'emily.adams@icloud.com', 'Em1Ly123'), ('francis_nguyen', 'francis.nguyen@domain.com', 'fNguyenPass'), ('grace_parker', 'grace.parker@server.com', 'G1race123'), ('henry_miller', 'henry.miller@company.org', 'hMillerSecret'), ('isabella_grant', 'isabella.grant@university.edu', 'iGrantPass');
select id, username, email from users where email = 'john@example.com';
id    username    email
1    john_doe    john@example.com
select id, username, email from users where email = 'alice.jones@gmail.com';
id    username    email
3    alice_jones    alice.jones@gmail.com
create snapshot sp_01 for account;
DELETE FROM  users where email = 'john@example.com';
UPDATE users SET password = 'newsecurepassword123' WHERE email = 'alice.jones@gmail.com';
select id, username, email from users where email = 'john@example.com';
id    username    email
select id, username, email from users where email = 'alice.jones@gmail.com';
id    username    email
3    alice_jones    alice.jones@gmail.com
select id, username, email from users{snapshot = 'sp_01'} where email = 'john@example.com';
id    username    email
1    john_doe    john@example.com
select id, username, email from users {snapshot = 'sp_01'} where email = 'alice.jones@gmail.com';
id    username    email
3    alice_jones    alice.jones@gmail.com
CREATE TABLE new_users (
id INT AUTO_INCREMENT PRIMARY KEY,
username VARCHAR(255) NOT NULL,
email VARCHAR(255) NOT NULL UNIQUE,
password VARCHAR(255) NOT NULL,
created_at TIMESTAMP DEFAULT CURRENT_TIMESTAMP
);
insert into new_users select * from users{snapshot = 'sp_01'} where email = 'john@example.com';
insert into new_users select * from users {snapshot = 'sp_01'} where email = 'alice.jones@gmail.com';
select id, username, email from new_users;
id    username    email
1    john_doe    john@example.com
3    alice_jones    alice.jones@gmail.com
drop snapshot sp_01;
drop database if exists snapshot_read;
drop account if exists test_account;
create account test_account admin_name = 'test_user' identified by '111';
create database if not exists snapshot_read;
use snapshot_read;
CREATE TABLE users (
id INT AUTO_INCREMENT PRIMARY KEY,
username VARCHAR(255) NOT NULL,
email VARCHAR(255) NOT NULL UNIQUE,
password VARCHAR(255) NOT NULL,
created_at TIMESTAMP DEFAULT CURRENT_TIMESTAMP
);
INSERT INTO users (username, email, password) VALUES ('john_doe', 'john@example.com', 'securepassword123');
INSERT INTO users (username, email, password) VALUES ('jane_smith', 'jane.smith@example.com', 'password123'),('alice_jones', 'alice.jones@gmail.com', 'ilovecats'),('bob_brown', 'bob.brown@yahoo.com', 'mysecretpassword'),('charlie_lee', 'charlie.lee@protonmail.ch', 'secure123'),('diana_wilson', 'diana.wilson@outlook.com', 'D1anaPass');
INSERT INTO users (username, email, password) VALUES ('emily_adams', 'emily.adams@icloud.com', 'Em1Ly123'), ('francis_nguyen', 'francis.nguyen@domain.com', 'fNguyenPass'), ('grace_parker', 'grace.parker@server.com', 'G1race123'), ('henry_miller', 'henry.miller@company.org', 'hMillerSecret'), ('isabella_grant', 'isabella.grant@university.edu', 'iGrantPass');
select id, username, email from users where email = 'john@example.com';
id    username    email
1    john_doe    john@example.com
select id, username, email from users where email = 'alice.jones@gmail.com';
id    username    email
3    alice_jones    alice.jones@gmail.com
create snapshot sp_01 for account test_account;
DELETE FROM  users where email = 'john@example.com';
UPDATE users SET password = 'newsecurepassword123' WHERE email = 'alice.jones@gmail.com';
select id, username, email from users where email = 'john@example.com';
id    username    email
select id, username, email from users where email = 'alice.jones@gmail.com';
id    username    email
3    alice_jones    alice.jones@gmail.com
select id, username, email from users{snapshot = 'sp_01'} where email = 'john@example.com';
id    username    email
1    john_doe    john@example.com
select id, username, email from users {snapshot = 'sp_01'} where email = 'alice.jones@gmail.com';
id    username    email
3    alice_jones    alice.jones@gmail.com
CREATE TABLE new_users (
id INT AUTO_INCREMENT PRIMARY KEY,
username VARCHAR(255) NOT NULL,
email VARCHAR(255) NOT NULL UNIQUE,
password VARCHAR(255) NOT NULL,
created_at TIMESTAMP DEFAULT CURRENT_TIMESTAMP
);
insert into new_users select * from users{snapshot = 'sp_01'} where email = 'john@example.com';
insert into new_users select * from users {snapshot = 'sp_01'} where email = 'alice.jones@gmail.com';
select id, username, email from new_users;
id    username    email
1    john_doe    john@example.com
3    alice_jones    alice.jones@gmail.com
drop snapshot sp_01;
drop database if exists snapshot_read;
drop account if exists test_account;
show snapshots;
SNAPSHOT_NAME    TIMESTAMP    SNAPSHOT_LEVEL    ACCOUNT_NAME    DATABASE_NAME    TABLE_NAME

create database if not exists snapshot_read;
use snapshot_read;
create table test_snapshot_read (a int);
INSERT INTO test_snapshot_read (a) VALUES(1), (2), (3), (4), (5),(6), (7), (8), (9), (10), (11), (12),(13), (14), (15), (16), (17), (18), (19), (20),(21), (22), (23), (24), (25), (26), (27), (28), (29), (30),(31), (32), (33), (34), (35), (36), (37), (38), (39), (40),(41), (42), (43), (44), (45), (46), (47), (48), (49), (50),(51), (52), (53), (54), (55), (56), (57), (58), (59), (60),(61), (62), (63), (64), (65), (66), (67), (68), (69), (70),(71), (72), (73), (74), (75), (76), (77), (78), (79), (80), (81), (82), (83), (84), (85), (86), (87), (88), (89), (90),(91), (92), (93), (94), (95), (96), (97), (98), (99), (100);
select count(*) from test_snapshot_read;
count(*)
100
create view test_snapshot_read_view as select * from test_snapshot_read;
create snapshot snapshot_01 for account;
show tables like'test%';
Tables_in_snapshot_read
test_snapshot_read
test_snapshot_read_view
show create table test_snapshot_read;
Table    Create Table
test_snapshot_read    CREATE TABLE `test_snapshot_read` (\n  `a` int DEFAULT NULL\n)
show create table test_snapshot_read_view;
View    Create View    character_set_client    collation_connection
test_snapshot_read_view    create view test_snapshot_read_view as select * from test_snapshot_read;    utf8mb4    utf8mb4_general_ci
drop table test_snapshot_read;
drop view test_snapshot_read_view;
select count(*) from snapshot_read.test_snapshot_read{snapshot = 'snapshot_01'};
count(*)
100
show tables like'test%';
Tables_in_snapshot_read
show create table test_snapshot_read;
no such table snapshot_read.test_snapshot_read
show create table test_snapshot_read_view;
no such table snapshot_read.test_snapshot_read_view
show tables like'test%' {snapshot = 'snapshot_01'};
Tables_in_snapshot_read
test_snapshot_read
test_snapshot_read_view
show create table test_snapshot_read {snapshot = 'snapshot_01'};
Table    Create Table
test_snapshot_read    CREATE TABLE `test_snapshot_read` (\n  `a` int DEFAULT NULL\n)
show create table test_snapshot_read_view {snapshot = 'snapshot_01'};
View    Create View    character_set_client    collation_connection
test_snapshot_read_view    create view test_snapshot_read_view as select * from test_snapshot_read;    utf8mb4    utf8mb4_general_ci
drop database if exists snapshot_read;
drop snapshot snapshot_01;
create database if not exists snapshot_read;
use snapshot_read;
create table test_snapshot_read (a int);
INSERT INTO test_snapshot_read (a) VALUES(1), (2), (3), (4), (5),(6), (7), (8), (9), (10), (11), (12),(13), (14), (15), (16), (17), (18), (19), (20),(21), (22), (23), (24), (25), (26), (27), (28), (29), (30),(31), (32), (33), (34), (35), (36), (37), (38), (39), (40),(41), (42), (43), (44), (45), (46), (47), (48), (49), (50),(51), (52), (53), (54), (55), (56), (57), (58), (59), (60),(61), (62), (63), (64), (65), (66), (67), (68), (69), (70),(71), (72), (73), (74), (75), (76), (77), (78), (79), (80), (81), (82), (83), (84), (85), (86), (87), (88), (89), (90),(91), (92), (93), (94), (95), (96), (97), (98), (99), (100);
select count(*) from test_snapshot_read;
count(*)
100
create view test_snapshot_read_view as select * from test_snapshot_read;
create snapshot snapshot_01 for account;
show tables like'test%';
Tables_in_snapshot_read
test_snapshot_read
test_snapshot_read_view
show create table test_snapshot_read;
Table    Create Table
test_snapshot_read    CREATE TABLE `test_snapshot_read` (\n  `a` int DEFAULT NULL\n)
show create table test_snapshot_read_view;
View    Create View    character_set_client    collation_connection
test_snapshot_read_view    create view test_snapshot_read_view as select * from test_snapshot_read;    utf8mb4    utf8mb4_general_ci
show databases like 'snapshot_read';
Database
snapshot_read
drop table test_snapshot_read;
drop view test_snapshot_read_view;
select count(*) from snapshot_read.test_snapshot_read{snapshot = 'snapshot_01'};
count(*)
100
show tables like'test%';
Tables_in_snapshot_read
show create table test_snapshot_read;
no such table snapshot_read.test_snapshot_read
show create table test_snapshot_read_view;
no such table snapshot_read.test_snapshot_read_view
show tables like'test%' {snapshot = 'snapshot_01'};
Tables_in_snapshot_read
test_snapshot_read
test_snapshot_read_view
show create table test_snapshot_read {snapshot = 'snapshot_01'};
Table    Create Table
test_snapshot_read    CREATE TABLE `test_snapshot_read` (\n  `a` int DEFAULT NULL\n)
show create table test_snapshot_read_view {snapshot = 'snapshot_01'};
View    Create View    character_set_client    collation_connection
test_snapshot_read_view    create view test_snapshot_read_view as select * from test_snapshot_read;    utf8mb4    utf8mb4_general_ci
show databases like 'snapshot_read';
Database
snapshot_read
drop database if exists snapshot_read;
show tables from snapshot_read like'test%' {snapshot = 'snapshot_01'};
Tables_in_snapshot_read
test_snapshot_read
test_snapshot_read_view
show create table snapshot_read.test_snapshot_read {snapshot = 'snapshot_01'};
Table    Create Table
test_snapshot_read    CREATE TABLE `test_snapshot_read` (\n  `a` int DEFAULT NULL\n)
show create table snapshot_read.test_snapshot_read_view {snapshot = 'snapshot_01'};
View    Create View    character_set_client    collation_connection
test_snapshot_read_view    create view test_snapshot_read_view as select * from test_snapshot_read;    utf8mb4    utf8mb4_general_ci
show databases like 'snapshot_read' {snapshot = 'snapshot_01'};
Database
snapshot_read
drop snapshot snapshot_01;
show snapshots;
SNAPSHOT_NAME    TIMESTAMP    SNAPSHOT_LEVEL    ACCOUNT_NAME    DATABASE_NAME    TABLE_NAME
