create database if not exists snapshot_read;
use snapshot_read;
create table test_snapshot_read (a int);
INSERT INTO test_snapshot_read (a) VALUES(1), (2), (3), (4), (5),(6), (7), (8), (9), (10), (11), (12),(13), (14), (15), (16), (17), (18), (19), (20),(21), (22), (23), (24), (25), (26), (27), (28), (29), (30),(31), (32), (33), (34), (35), (36), (37), (38), (39), (40),(41), (42), (43), (44), (45), (46), (47), (48), (49), (50),(51), (52), (53), (54), (55), (56), (57), (58), (59), (60),(61), (62), (63), (64), (65), (66), (67), (68), (69), (70),(71), (72), (73), (74), (75), (76), (77), (78), (79), (80), (81), (82), (83), (84), (85), (86), (87), (88), (89), (90),(91), (92), (93), (94), (95), (96), (97), (98), (99), (100);
select count(*) from snapshot_read.test_snapshot_read;
count(*)
100
create snapshot snapshot_01 for account;
delete from test_snapshot_read where a <= 50;
select count(*) from snapshot_read.test_snapshot_read;
count(*)
50
select count(*) from snapshot_read.test_snapshot_read {snapshot = 'snapshot_01'};
count(*)
100
create snapshot snapshot_02 for account;
INSERT INTO test_snapshot_read (a) VALUES(1), (2), (3), (4), (5),(6), (7), (8), (9), (10), (11), (12),(13), (14), (15), (16), (17), (18), (19), (20),(21), (22), (23), (24), (25), (26), (27), (28), (29), (30),(31), (32), (33), (34), (35), (36), (37), (38), (39), (40);
select count(*) from snapshot_read.test_snapshot_read;
count(*)
90
select count(*) from snapshot_read.test_snapshot_read{snapshot = 'snapshot_02'};
count(*)
50
restore table sys.snapshot_read.test_snapshot_read{snapshot="snapshot_01"};
select count(*) from snapshot_read.test_snapshot_read;
count(*)
100
restore table sys.snapshot_read.test_snapshot_read{snapshot="snapshot_02"};
select count(*) from snapshot_read.test_snapshot_read;
count(*)
50
drop database snapshot_read;
drop snapshot snapshot_01;
drop snapshot snapshot_02;
create database if not exists snapshot_read;
use snapshot_read;
CREATE TABLE users (
id INT AUTO_INCREMENT PRIMARY KEY,
username VARCHAR(255) NOT NULL,
email VARCHAR(255) NOT NULL UNIQUE,
password VARCHAR(255) NOT NULL,
created_at TIMESTAMP DEFAULT CURRENT_TIMESTAMP
);
INSERT INTO users (username, email, password) VALUES ('john_doe', 'john@example.com', 'securepassword123');
INSERT INTO users (username, email, password) VALUES ('jane_smith', 'jane.smith@example.com', 'password123'),('alice_jones', 'alice.jones@gmail.com', 'ilovecats'),('bob_brown', 'bob.brown@yahoo.com', 'mysecretpassword'),('charlie_lee', 'charlie.lee@protonmail.ch', 'secure123'),('diana_wilson', 'diana.wilson@outlook.com', 'D1anaPass');
INSERT INTO users (username, email, password) VALUES ('emily_adams', 'emily.adams@icloud.com', 'Em1Ly123'), ('francis_nguyen', 'francis.nguyen@domain.com', 'fNguyenPass'), ('grace_parker', 'grace.parker@server.com', 'G1race123'), ('henry_miller', 'henry.miller@company.org', 'hMillerSecret'), ('isabella_grant', 'isabella.grant@university.edu', 'iGrantPass');
select id, username, email from snapshot_read.users where email = 'john@example.com';
id    username    email
1    john_doe    john@example.com
select id, username, email from snapshot_read.users where email = 'alice.jones@gmail.com';
id    username    email
3    alice_jones    alice.jones@gmail.com
drop snapshot if exists sp_01;
create snapshot sp_01 for account;
DELETE FROM  users where email = 'john@example.com';
UPDATE users SET password = 'newsecurepassword123' WHERE email = 'alice.jones@gmail.com';
select id, username, email from snapshot_read.users where email = 'john@example.com';
id    username    email
select id, username, email from snapshot_read.users where email = 'alice.jones@gmail.com';
id    username    email
3    alice_jones    alice.jones@gmail.com
restore table sys.snapshot_read.users{snapshot="sp_01"};
select id, username, email from snapshot_read.users where email = 'john@example.com';
id    username    email
1    john_doe    john@example.com
select id, username, email from snapshot_read.users where email = 'alice.jones@gmail.com';
id    username    email
3    alice_jones    alice.jones@gmail.com
CREATE TABLE new_users (
id INT AUTO_INCREMENT PRIMARY KEY,
username VARCHAR(255) NOT NULL,
email VARCHAR(255) NOT NULL UNIQUE,
password VARCHAR(255) NOT NULL,
created_at TIMESTAMP DEFAULT CURRENT_TIMESTAMP
);
insert into new_users select * from snapshot_read.users where email = 'john@example.com';
insert into new_users select * from snapshot_read.users where email = 'alice.jones@gmail.com';
select id, username, email from snapshot_read.new_users;
id    username    email
1    john_doe    john@example.com
3    alice_jones    alice.jones@gmail.com
drop snapshot sp_01;
drop database if exists snapshot_read;
create database if not exists snapshot_read;
use snapshot_read;
CREATE TABLE users (
id INT AUTO_INCREMENT PRIMARY KEY,
username VARCHAR(255) NOT NULL,
email VARCHAR(255) NOT NULL UNIQUE,
password VARCHAR(255) NOT NULL,
created_at TIMESTAMP DEFAULT CURRENT_TIMESTAMP
);
INSERT INTO users (username, email, password) VALUES ('john_doe', 'john@example.com', 'securepassword123');
INSERT INTO users (username, email, password) VALUES ('jane_smith', 'jane.smith@example.com', 'password123'),('alice_jones', 'alice.jones@gmail.com', 'ilovecats'),('bob_brown', 'bob.brown@yahoo.com', 'mysecretpassword'),('charlie_lee', 'charlie.lee@protonmail.ch', 'secure123'),('diana_wilson', 'diana.wilson@outlook.com', 'D1anaPass');
INSERT INTO users (username, email, password) VALUES ('emily_adams', 'emily.adams@icloud.com', 'Em1Ly123'), ('francis_nguyen', 'francis.nguyen@domain.com', 'fNguyenPass'), ('grace_parker', 'grace.parker@server.com', 'G1race123'), ('henry_miller', 'henry.miller@company.org', 'hMillerSecret'), ('isabella_grant', 'isabella.grant@university.edu', 'iGrantPass');
select count(*) from snapshot_read.users;
count(*)
11
drop snapshot if exists sp_01;
create snapshot sp_01 for account;
drop table users;
select count(*) from snapshot_read.users;
SQL parser error: table "users" does not exist
restore table sys.snapshot_read.users{snapshot="sp_01"};
select count(*) from snapshot_read.users;
count(*)
11
drop snapshot sp_01;
drop database if exists snapshot_read;
create database if not exists snapshot_read;
use snapshot_read;
CREATE TABLE users (
id INT AUTO_INCREMENT PRIMARY KEY,
username VARCHAR(255) NOT NULL,
email VARCHAR(255) NOT NULL UNIQUE,
password VARCHAR(255) NOT NULL,
created_at TIMESTAMP DEFAULT CURRENT_TIMESTAMP
);
INSERT INTO users (username, email, password) VALUES ('john_doe', 'john@example.com', 'securepassword123');
INSERT INTO users (username, email, password) VALUES ('jane_smith', 'jane.smith@example.com', 'password123'),('alice_jones', 'alice.jones@gmail.com', 'ilovecats'),('bob_brown', 'bob.brown@yahoo.com', 'mysecretpassword'),('charlie_lee', 'charlie.lee@protonmail.ch', 'secure123'),('diana_wilson', 'diana.wilson@outlook.com', 'D1anaPass');
INSERT INTO users (username, email, password) VALUES ('emily_adams', 'emily.adams@icloud.com', 'Em1Ly123'), ('francis_nguyen', 'francis.nguyen@domain.com', 'fNguyenPass'), ('grace_parker', 'grace.parker@server.com', 'G1race123'), ('henry_miller', 'henry.miller@company.org', 'hMillerSecret'), ('isabella_grant', 'isabella.grant@university.edu', 'iGrantPass');
select count(*) from snapshot_read.users;
count(*)
11
drop snapshot if exists sp_01;
create snapshot sp_01 for account;
drop database snapshot_read;
select count(*) from snapshot_read.users;
Unknown database snapshot_read
restore table sys.snapshot_read.users{snapshot="sp_01"};
select count(*) from snapshot_read.users;
count(*)
11
drop snapshot sp_01;
drop database if exists snapshot_read;
create account test_account admin_name = 'test_user' identified by '111';
create database if not exists snapshot_read;
use snapshot_read;
create table test_snapshot_read (a int);
INSERT INTO test_snapshot_read (a) VALUES(1), (2), (3), (4), (5),(6), (7), (8), (9), (10), (11), (12),(13), (14), (15), (16), (17), (18), (19), (20),(21), (22), (23), (24), (25), (26), (27), (28), (29), (30),(31), (32), (33), (34), (35), (36), (37), (38), (39), (40),(41), (42), (43), (44), (45), (46), (47), (48), (49), (50),(51), (52), (53), (54), (55), (56), (57), (58), (59), (60),(61), (62), (63), (64), (65), (66), (67), (68), (69), (70),(71), (72), (73), (74), (75), (76), (77), (78), (79), (80), (81), (82), (83), (84), (85), (86), (87), (88), (89), (90),(91), (92), (93), (94), (95), (96), (97), (98), (99), (100);
select count(*) from snapshot_read.test_snapshot_read;
count(*)
100
create snapshot snapshot_01 for account test_account;
delete from test_snapshot_read where a <= 50;
select count(*) from snapshot_read.test_snapshot_read;
count(*)
50
select count(*) from snapshot_read.test_snapshot_read {snapshot = 'snapshot_01'};
count(*)
100
create snapshot snapshot_02 for account test_account;
INSERT INTO test_snapshot_read (a) VALUES(1), (2), (3), (4), (5),(6), (7), (8), (9), (10), (11), (12),(13), (14), (15), (16), (17), (18), (19), (20),(21), (22), (23), (24), (25), (26), (27), (28), (29), (30),(31), (32), (33), (34), (35), (36), (37), (38), (39), (40);
select count(*) from snapshot_read.test_snapshot_read;
count(*)
90
select count(*) from snapshot_read.test_snapshot_read{snapshot = 'snapshot_02'};
count(*)
50
restore table test_account.snapshot_read.test_snapshot_read{snapshot="snapshot_01"};
select count(*) from snapshot_read.test_snapshot_read;
count(*)
100
restore table test_account.snapshot_read.test_snapshot_read{snapshot="snapshot_02"};
select count(*) from snapshot_read.test_snapshot_read;
count(*)
50
drop database snapshot_read;
drop snapshot snapshot_01;
drop snapshot snapshot_02;
create database if not exists snapshot_read;
use snapshot_read;
CREATE TABLE users (
id INT AUTO_INCREMENT PRIMARY KEY,
username VARCHAR(255) NOT NULL,
email VARCHAR(255) NOT NULL UNIQUE,
password VARCHAR(255) NOT NULL,
created_at TIMESTAMP DEFAULT CURRENT_TIMESTAMP
);
INSERT INTO users (username, email, password) VALUES ('john_doe', 'john@example.com', 'securepassword123');
INSERT INTO users (username, email, password) VALUES ('jane_smith', 'jane.smith@example.com', 'password123'),('alice_jones', 'alice.jones@gmail.com', 'ilovecats'),('bob_brown', 'bob.brown@yahoo.com', 'mysecretpassword'),('charlie_lee', 'charlie.lee@protonmail.ch', 'secure123'),('diana_wilson', 'diana.wilson@outlook.com', 'D1anaPass');
INSERT INTO users (username, email, password) VALUES ('emily_adams', 'emily.adams@icloud.com', 'Em1Ly123'), ('francis_nguyen', 'francis.nguyen@domain.com', 'fNguyenPass'), ('grace_parker', 'grace.parker@server.com', 'G1race123'), ('henry_miller', 'henry.miller@company.org', 'hMillerSecret'), ('isabella_grant', 'isabella.grant@university.edu', 'iGrantPass');
select id, username, email from snapshot_read.users where email = 'john@example.com';
id    username    email
1    john_doe    john@example.com
select id, username, email from snapshot_read.users where email = 'alice.jones@gmail.com';
id    username    email
3    alice_jones    alice.jones@gmail.com
drop snapshot if exists sp_01;
create snapshot sp_01 for account test_account;
DELETE FROM users where email = 'john@example.com';
UPDATE users SET password = 'newsecurepassword123' WHERE email = 'alice.jones@gmail.com';
select id, username, email from snapshot_read.users where email = 'john@example.com';
id    username    email
select id, username, email from snapshot_read.users where email = 'alice.jones@gmail.com';
id    username    email
3    alice_jones    alice.jones@gmail.com
restore table test_account.snapshot_read.users{snapshot="sp_01"};
select id, username, email from snapshot_read.users where email = 'john@example.com';
id    username    email
1    john_doe    john@example.com
select id, username, email from snapshot_read.users where email = 'alice.jones@gmail.com';
id    username    email
3    alice_jones    alice.jones@gmail.com
CREATE TABLE new_users (
id INT AUTO_INCREMENT PRIMARY KEY,
username VARCHAR(255) NOT NULL,
email VARCHAR(255) NOT NULL UNIQUE,
password VARCHAR(255) NOT NULL,
created_at TIMESTAMP DEFAULT CURRENT_TIMESTAMP
);
insert into new_users select * from snapshot_read.users where email = 'john@example.com';
insert into new_users select * from snapshot_read.users where email = 'alice.jones@gmail.com';
select id, username, email from snapshot_read.new_users;
id    username    email
1    john_doe    john@example.com
3    alice_jones    alice.jones@gmail.com
drop snapshot sp_01;
drop database if exists snapshot_read;
create database if not exists snapshot_read;
use snapshot_read;
CREATE TABLE users (
id INT AUTO_INCREMENT PRIMARY KEY,
username VARCHAR(255) NOT NULL,
email VARCHAR(255) NOT NULL UNIQUE,
password VARCHAR(255) NOT NULL,
created_at TIMESTAMP DEFAULT CURRENT_TIMESTAMP
);
INSERT INTO users (username, email, password) VALUES ('john_doe', 'john@example.com', 'securepassword123');
INSERT INTO users (username, email, password) VALUES ('jane_smith', 'jane.smith@example.com', 'password123'),('alice_jones', 'alice.jones@gmail.com', 'ilovecats'),('bob_brown', 'bob.brown@yahoo.com', 'mysecretpassword'),('charlie_lee', 'charlie.lee@protonmail.ch', 'secure123'),('diana_wilson', 'diana.wilson@outlook.com', 'D1anaPass');
INSERT INTO users (username, email, password) VALUES ('emily_adams', 'emily.adams@icloud.com', 'Em1Ly123'), ('francis_nguyen', 'francis.nguyen@domain.com', 'fNguyenPass'), ('grace_parker', 'grace.parker@server.com', 'G1race123'), ('henry_miller', 'henry.miller@company.org', 'hMillerSecret'), ('isabella_grant', 'isabella.grant@university.edu', 'iGrantPass');
select count(*) from snapshot_read.users;
count(*)
11
drop snapshot if exists sp_01;
create snapshot sp_01 for account test_account;
drop table users;
select count(*) from snapshot_read.users;
SQL parser error: table "users" does not exist
restore table test_account.snapshot_read.users{snapshot="sp_01"};
select count(*) from snapshot_read.users;
count(*)
11
drop snapshot sp_01;
drop database if exists snapshot_read;
create database if not exists snapshot_read;
use snapshot_read;
CREATE TABLE users (
id INT AUTO_INCREMENT PRIMARY KEY,
username VARCHAR(255) NOT NULL,
email VARCHAR(255) NOT NULL UNIQUE,
password VARCHAR(255) NOT NULL,
created_at TIMESTAMP DEFAULT CURRENT_TIMESTAMP
);
INSERT INTO users (username, email, password) VALUES ('john_doe', 'john@example.com', 'securepassword123');
INSERT INTO users (username, email, password) VALUES ('jane_smith', 'jane.smith@example.com', 'password123'),('alice_jones', 'alice.jones@gmail.com', 'ilovecats'),('bob_brown', 'bob.brown@yahoo.com', 'mysecretpassword'),('charlie_lee', 'charlie.lee@protonmail.ch', 'secure123'),('diana_wilson', 'diana.wilson@outlook.com', 'D1anaPass');
INSERT INTO users (username, email, password) VALUES ('emily_adams', 'emily.adams@icloud.com', 'Em1Ly123'), ('francis_nguyen', 'francis.nguyen@domain.com', 'fNguyenPass'), ('grace_parker', 'grace.parker@server.com', 'G1race123'), ('henry_miller', 'henry.miller@company.org', 'hMillerSecret'), ('isabella_grant', 'isabella.grant@university.edu', 'iGrantPass');
select count(*) from snapshot_read.users;
count(*)
11
drop snapshot if exists sp_01;
create snapshot sp_01 for account test_account;
drop database snapshot_read;
select count(*) from snapshot_read.users;
Unknown database snapshot_read
restore table test_account.snapshot_read.users{snapshot="sp_01"};
select count(*) from snapshot_read.users;
count(*)
11
drop snapshot sp_01;
drop database if exists snapshot_read;
create account test_account admin_name = 'test_user' identified by '111';
internal error: do not have privilege to execute the statement
create database if not exists snapshot_read;
use snapshot_read;
create table test_snapshot_read (a int);
insert into test_snapshot_read (a) values(1), (2), (3), (4), (5),(6), (7), (8), (9), (10), (11), (12),(13), (14), (15), (16), (17), (18), (19), (20),(21), (22), (23), (24), (25), (26), (27), (28), (29), (30),(31), (32), (33), (34), (35), (36), (37), (38), (39), (40),(41), (42), (43), (44), (45), (46), (47), (48), (49), (50),(51), (52), (53), (54), (55), (56), (57), (58), (59), (60),(61), (62), (63), (64), (65), (66), (67), (68), (69), (70),(71), (72), (73), (74), (75), (76), (77), (78), (79), (80), (81), (82), (83), (84), (85), (86), (87), (88), (89), (90),(91), (92), (93), (94), (95), (96), (97), (98), (99), (100);
select count(*) from snapshot_read.test_snapshot_read;
count(*)
100
CREATE TABLE users (
id INT AUTO_INCREMENT PRIMARY KEY,
username VARCHAR(255) NOT NULL,
email VARCHAR(255) NOT NULL UNIQUE,
password VARCHAR(255) NOT NULL,
created_at TIMESTAMP DEFAULT CURRENT_TIMESTAMP
);
INSERT INTO users (username, email, password) VALUES ('john_doe', 'john@example.com', 'securepassword123');
INSERT INTO users (username, email, password) VALUES ('jane_smith', 'jane.smith@example.com', 'password123'),('alice_jones', 'alice.jones@gmail.com', 'ilovecats'),('bob_brown', 'bob.brown@yahoo.com', 'mysecretpassword'),('charlie_lee', 'charlie.lee@protonmail.ch', 'secure123'),('diana_wilson', 'diana.wilson@outlook.com', 'D1anaPass');
INSERT INTO users (username, email, password) VALUES ('emily_adams', 'emily.adams@icloud.com', 'Em1Ly123'), ('francis_nguyen', 'francis.nguyen@domain.com', 'fNguyenPass'), ('grace_parker', 'grace.parker@server.com', 'G1race123'), ('henry_miller', 'henry.miller@company.org', 'hMillerSecret'), ('isabella_grant', 'isabella.grant@university.edu', 'iGrantPass');
select count(*) from snapshot_read.users;
count(*)
11
drop snapshot if exists sp_01;
create snapshot sp_01 for account test_account;
DELETE FROM snapshot_read.users;
select count(*) from snapshot_read.users;
count(*)
0
restore table test_account.snapshot_read.users{snapshot="sp_01"};
internal error: can't restore table from other account's snapshot
restore account test_account from snapshot sp_01;
select count(*) from snapshot_read.users;
count(*)
11
drop snapshot sp_01;
drop account test_account;
create database if not exists snapshot_read;
use snapshot_read;
create table test_snapshot_read (a int);
INSERT INTO test_snapshot_read (a) VALUES(1), (2), (3), (4), (5),(6), (7), (8), (9), (10), (11), (12),(13), (14), (15), (16), (17), (18), (19), (20),(21), (22), (23), (24), (25), (26), (27), (28), (29), (30),(31), (32), (33), (34), (35), (36), (37), (38), (39), (40),(41), (42), (43), (44), (45), (46), (47), (48), (49), (50),(51), (52), (53), (54), (55), (56), (57), (58), (59), (60),(61), (62), (63), (64), (65), (66), (67), (68), (69), (70),(71), (72), (73), (74), (75), (76), (77), (78), (79), (80), (81), (82), (83), (84), (85), (86), (87), (88), (89), (90),(91), (92), (93), (94), (95), (96), (97), (98), (99), (100);
select count(*) from snapshot_read.test_snapshot_read;
count(*)
100
CREATE TABLE users (
id INT AUTO_INCREMENT PRIMARY KEY,
username VARCHAR(255) NOT NULL,
email VARCHAR(255) NOT NULL UNIQUE,
password VARCHAR(255) NOT NULL,
created_at TIMESTAMP DEFAULT CURRENT_TIMESTAMP
);
INSERT INTO users (username, email, password) VALUES ('john_doe', 'john@example.com', 'securepassword123');
INSERT INTO users (username, email, password) VALUES ('jane_smith', 'jane.smith@example.com', 'password123'),('alice_jones', 'alice.jones@gmail.com', 'ilovecats'),('bob_brown', 'bob.brown@yahoo.com', 'mysecretpassword'),('charlie_lee', 'charlie.lee@protonmail.ch', 'secure123'),('diana_wilson', 'diana.wilson@outlook.com', 'D1anaPass');
INSERT INTO users (username, email, password) VALUES ('emily_adams', 'emily.adams@icloud.com', 'Em1Ly123'), ('francis_nguyen', 'francis.nguyen@domain.com', 'fNguyenPass'), ('grace_parker', 'grace.parker@server.com', 'G1race123'), ('henry_miller', 'henry.miller@company.org', 'hMillerSecret'), ('isabella_grant', 'isabella.grant@university.edu', 'iGrantPass');
select count(*) from snapshot_read.users;
count(*)
11
drop snapshot if exists sp_01;
create snapshot sp_01 for account;
delete from test_snapshot_read where a <= 50;
select count(*) from snapshot_read.test_snapshot_read;
count(*)
50
restore table sys.snapshot_read.test_snapshot_read{snapshot="sp_01"};
select count(*) from snapshot_read.test_snapshot_read;
count(*)
100
drop database snapshot_read;
drop snapshot sp_01;
create account test_account admin_name = 'test_user' identified by '111';
create database if not exists snapshot_read;
use snapshot_read;
create table test_snapshot_read (a int);
insert into test_snapshot_read (a) values(1), (2), (3), (4), (5),(6), (7), (8), (9), (10), (11), (12),(13), (14), (15), (16), (17), (18), (19), (20),(21), (22), (23), (24), (25), (26), (27), (28), (29), (30),(31), (32), (33), (34), (35), (36), (37), (38), (39), (40),(41), (42), (43), (44), (45), (46), (47), (48), (49), (50),(51), (52), (53), (54), (55), (56), (57), (58), (59), (60),(61), (62), (63), (64), (65), (66), (67), (68), (69), (70),(71), (72), (73), (74), (75), (76), (77), (78), (79), (80), (81), (82), (83), (84), (85), (86), (87), (88), (89), (90),(91), (92), (93), (94), (95), (96), (97), (98), (99), (100);
select count(*) from snapshot_read.test_snapshot_read;
count(*)
100
CREATE TABLE users (
id INT AUTO_INCREMENT PRIMARY KEY,
username VARCHAR(255) NOT NULL,
email VARCHAR(255) NOT NULL UNIQUE,
password VARCHAR(255) NOT NULL,
created_at TIMESTAMP DEFAULT CURRENT_TIMESTAMP
);
INSERT INTO users (username, email, password) VALUES ('john_doe', 'john@example.com', 'securepassword123');
INSERT INTO users (username, email, password) VALUES ('jane_smith', 'jane.smith@example.com', 'password123'),('alice_jones', 'alice.jones@gmail.com', 'ilovecats'),('bob_brown', 'bob.brown@yahoo.com', 'mysecretpassword'),('charlie_lee', 'charlie.lee@protonmail.ch', 'secure123'),('diana_wilson', 'diana.wilson@outlook.com', 'D1anaPass');
INSERT INTO users (username, email, password) VALUES ('emily_adams', 'emily.adams@icloud.com', 'Em1Ly123'), ('francis_nguyen', 'francis.nguyen@domain.com', 'fNguyenPass'), ('grace_parker', 'grace.parker@server.com', 'G1race123'), ('henry_miller', 'henry.miller@company.org', 'hMillerSecret'), ('isabella_grant', 'isabella.grant@university.edu', 'iGrantPass');
select count(*) from snapshot_read.users;
count(*)
11
drop snapshot if exists sp_01;
create snapshot sp_01 for account test_account;
DELETE FROM snapshot_read.users;
select count(*) from snapshot_read.users;
count(*)
0
create account test_account_2 admin_name = 'test_user' identified by '111';
restore account test_account from snapshot sp_01 to account test_account_2;
select count(*) from snapshot_read.users;
count(*)
11
drop snapshot sp_01;
drop account test_account;
drop account test_account_2;
show snapshots;
SNAPSHOT_NAME    TIMESTAMP    SNAPSHOT_LEVEL    ACCOUNT_NAME    DATABASE_NAME    TABLE_NAME
