use mo_catalog;
[unknown result because it is related to issue#15954]
create cluster table clu01(col1 int, col2 decimal);
[unknown result because it is related to issue#15954]
insert into clu01 values(1,2,0);
[unknown result because it is related to issue#15954]
drop snapshot if exists sp01;
[unknown result because it is related to issue#15954]
create snapshot sp01 for account sys;
[unknown result because it is related to issue#15954]
insert into clu01 values(2,3,0);
[unknown result because it is related to issue#15954]
restore account sys from snapshot sp01;
[unknown result because it is related to issue#15954]
select * from clu01;
[unknown result because it is related to issue#15954]
drop table clu01;
[unknown result because it is related to issue#15954]
drop database if exists test;
create database test;
use test;
create table clu01(col1 int, col2 decimal);
insert into clu01 values(1,2);
drop snapshot if exists sp01;
create snapshot sp01 for account sys;
insert into clu01 values(2,3);
restore account sys from snapshot sp01;
select * from clu01;
col1    col2
1    2
select count(*) from clu01;
count(*)
1
drop table clu01;
drop database test;
drop database if exists test01;
create database test01;
use test01;
drop table if exists rs01;
create table rs01 (col1 int, col2 decimal(6), col3 varchar(30));
insert into rs01 values (1, null, 'database');
insert into rs01 values (2, 38291.32132, 'database');
insert into rs01 values (3, null, 'database management system');
insert into rs01 values (4, 10, null);
insert into rs01 values (1, -321.321, null);
insert into rs01 values (2, -1, null);
select count(*) from rs01;
count(*)
6
drop snapshot if exists sp01;
create snapshot sp01 for account sys;
select count(*) from rs01 {snapshot = 'sp01'};
count(*)
6
insert into rs01 values (2, -1, null);
insert into rs01 values (1, -321.321, null);
select * from rs01;
col1    col2    col3
1    null    database
2    38291    database
3    null    database management system
4    10    null
1    -321    null
2    -1    null
2    -1    null
1    -321    null
select count(*) from mo_catalog.mo_tables{snapshot = 'sp01'} where reldatabase = 'test01';
count(*)
1
select * from mo_catalog.mo_database{snapshot = 'sp01'} where datname = 'test01';
dat_id    datname    dat_catalog_name    dat_createsql    owner    creator    created_time    account_id    dat_type
276165    test01    def    create database test01    0    1    2024-05-13 15:18:52    0    
select attname from mo_catalog.mo_columns{snapshot = 'sp01'} where att_database = 'test01';
attname
__mo_fake_pk_col
__mo_rowid
col1
col2
col3
restore account sys from snapshot sp01;
select count(*) from rs01 {snapshot = 'sp01'};
count(*)
6
select * from rs01 {snapshot = 'sp01'};
col1    col2    col3
1    null    database
2    38291    database
3    null    database management system
4    10    null
1    -321    null
2    -1    null
select count(*) from mo_catalog.mo_tables{snapshot = 'sp01'} where reldatabase = 'test01';
count(*)
1
select * from mo_catalog.mo_database{snapshot = 'sp01'} where datname = 'test01';
dat_id    datname    dat_catalog_name    dat_createsql    owner    creator    created_time    account_id    dat_type
276165    test01    def    create database test01    0    1    2024-05-13 15:18:52    0    
select attname from mo_catalog.mo_columns{snapshot = 'sp01'} where att_database = 'test01';
attname
__mo_fake_pk_col
__mo_rowid
col1
col2
col3
drop snapshot sp01;
drop database test01;
use mo_catalog;
drop table if exists cluster01;
create cluster table cluster01(col1 int,col2 bigint);
insert into cluster01 values(1,2,0);
insert into cluster01 values(2,3,0);
select * from cluster01;
col1    col2    account_id
1    2    0
2    3    0
drop database if exists test02;
create database test02;
use test02;
drop table if exists rs02;
create table rs02 (col1 int, col2 datetime);
insert into rs02 values (1, '2020-10-13 10:10:10');
insert into rs02 values (2, null);
insert into rs02 values (1, '2021-10-10 00:00:00');
insert into rs02 values (2, '2023-01-01 12:12:12');
insert into rs02 values (2, null);
insert into rs02 values (3, null);
insert into rs02 values (4, '2023-11-27 01:02:03');
select * from rs02;
col1    col2
1    2020-10-13 10:10:10
2    null
1    2021-10-10 00:00:00
2    2023-01-01 12:12:12
2    null
3    null
4    2023-11-27 01:02:03
drop table if exists rs03;
create table rs03 (col1 int, col2 float, col3 decimal, col4 enum('1','2','3','4'));
insert into rs03 values (1, 12.21, 32324.32131, 1);
insert into rs03 values (2, null, null, 2);
insert into rs03 values (2, -12.1, 34738, null);
insert into rs03 values (1, 90.2314, null, 4);
insert into rs03 values (1, 43425.4325, -7483.432, 2);
drop snapshot if exists sp02;
create snapshot sp02 for account sys;
select count(*) from mo_catalog.mo_tables{snapshot = 'sp02'} where reldatabase = 'test02';
count(*)
2
select * from mo_catalog.mo_database{snapshot = 'sp02'} where datname = 'test02';
dat_id    datname    dat_catalog_name    dat_createsql    owner    creator    created_time    account_id    dat_type
276171    test02    def    create database test02    0    1    2024-05-13 15:18:53    0    
select * from mo_catalog.mo_database{snapshot = 'sp02'} where datname = 'mo_catalog';
dat_id    datname    dat_catalog_name    dat_createsql    owner    creator    created_time    account_id    dat_type
1    mo_catalog    mo_catalog        0    0    2024-05-11 22:28:24    0    
select attname from mo_catalog.mo_columns{snapshot = 'sp02'} where att_database = 'test02';
attname
__mo_fake_pk_col
__mo_rowid
col1
col2
__mo_fake_pk_col
__mo_rowid
col1
col2
col3
col4
use mo_catalog;
insert into cluster01 values(100,2,0);
insert into cluster01 values(200,3,0);
select count(*) from cluster01;
count(*)
4
select count(*) from cluster01{snapshot = 'sp02'};
count(*)
2
use test02;
insert into rs02 select * from rs02;
select count(*) from rs02;
count(*)
14
select count(*) from rs02{snapshot = 'sp02'};
count(*)
7
delete from rs03 where col1 = 1;
select count(*) from rs03;
count(*)
2
select count(*) from rs03{snapshot = 'sp02'};
count(*)
5
restore account sys from snapshot sp02;
show databases;
Database
information_schema
mo_catalog
mo_debug
mo_task
mysql
sys_restore_to_sys_account
system
system_metrics
test02
select count(*) from rs02;
count(*)
7
select count(*) from rs03;
count(*)
5
use mo_catalog;
select count(*) from cluster01;
count(*)
4
drop table cluster01;
use test02;
drop table rs02;
drop table rs03;
drop snapshot sp02;
drop database test02;
drop database if exists test03;
create database test03;
use test03;
drop table if exists pri01;
create table pri01(
deptno int unsigned comment '部门编号',
dname varchar(15) comment '部门名称',
loc varchar(50)  comment '部门所在位置',
primary key(deptno)
) comment='部门表';
insert into pri01 values (10,'ACCOUNTING','NEW YORK');
insert into pri01 values (20,'RESEARCH','DALLAS');
insert into pri01 values (30,'SALES','CHICAGO');
insert into pri01 values (40,'OPERATIONS','BOSTON');
drop table if exists aff01;
create table aff01(
empno int unsigned auto_increment COMMENT '雇员编号',
ename varchar(15) comment '雇员姓名',
job varchar(10) comment '雇员职位',
mgr int unsigned comment '雇员对应的领导的编号',
hiredate date comment '雇员的雇佣日期',
sal decimal(7,2) comment '雇员的基本工资',
comm decimal(7,2) comment '奖金',
deptno int unsigned comment '所在部门',
primary key(empno),
constraint `c1` foreign key (deptno) references pri01 (deptno)
);
insert into aff01 values (7369,'SMITH','CLERK',7902,'1980-12-17',800,NULL,20);
insert into aff01 values (7499,'ALLEN','SALESMAN',7698,'1981-02-20',1600,300,30);
insert into aff01 values (7521,'WARD','SALESMAN',7698,'1981-02-22',1250,500,30);
insert into aff01 values (7566,'JONES','MANAGER',7839,'1981-04-02',2975,NULL,20);
insert into aff01 values (7654,'MARTIN','SALESMAN',7698,'1981-09-28',1250,1400,30);
insert into aff01 values (7698,'BLAKE','MANAGER',7839,'1981-05-01',2850,NULL,30);
insert into aff01 values (7782,'CLARK','MANAGER',7839,'1981-06-09',2450,NULL,10);
insert into aff01 values (7788,'SCOTT','ANALYST',7566,'0087-07-13',3000,NULL,20);
insert into aff01 values (7839,'KING','PRESIDENT',NULL,'1981-11-17',5000,NULL,10);
insert into aff01 values (7844,'TURNER','SALESMAN',7698,'1981-09-08',1500,0,30);
insert into aff01 values (7876,'ADAMS','CLERK',7788,'0087-07-13',1100,NULL,20);
insert into aff01 values (7900,'JAMES','CLERK',7698,'1981-12-03',950,NULL,30);
insert into aff01 values (7902,'FORD','ANALYST',7566,'1981-12-03',3000,NULL,20);
insert into aff01 values (7934,'MILLER','CLERK',7782,'1982-01-23',1300,NULL,10);
select count(*) from pri01;
count(*)
4
select count(*) from aff01;
count(*)
14
show create table pri01;
Table    Create Table
pri01    CREATE TABLE `pri01` (\n`deptno` INT UNSIGNED NOT NULL COMMENT '部门编号',\n`dname` VARCHAR(15) DEFAULT NULL COMMENT '部门名称',\n`loc` VARCHAR(50) DEFAULT NULL COMMENT '部门所在位置',\nPRIMARY KEY (`deptno`)\n) COMMENT='部门表'
show create table aff01;
Table    Create Table
aff01    CREATE TABLE `aff01` (\n`empno` INT UNSIGNED NOT NULL AUTO_INCREMENT COMMENT '雇员编号',\n`ename` VARCHAR(15) DEFAULT NULL COMMENT '雇员姓名',\n`job` VARCHAR(10) DEFAULT NULL COMMENT '雇员职位',\n`mgr` INT UNSIGNED DEFAULT NULL COMMENT '雇员对应的领导的编号',\n`hiredate` DATE DEFAULT NULL COMMENT '雇员的雇佣日期',\n`sal` DECIMAL(7,2) DEFAULT NULL COMMENT '雇员的基本工资',\n`comm` DECIMAL(7,2) DEFAULT NULL COMMENT '奖金',\n`deptno` INT UNSIGNED DEFAULT NULL COMMENT '所在部门',\nPRIMARY KEY (`empno`),\nCONSTRAINT `c1` FOREIGN KEY (`deptno`) REFERENCES `pri01` (`deptno`) ON DELETE RESTRICT ON UPDATE RESTRICT\n)
select count(*) from mo_catalog.mo_tables{snapshot = 'sp04'} where reldatabase = 'test03';
internal error: find 0 snapshotRecords by name, expect only 1
select * from mo_catalog.mo_database{snapshot = 'sp04'} where datname = 'test03';
internal error: find 0 snapshotRecords by name, expect only 1
select attname from mo_catalog.mo_columns{snapshot = 'sp04'} where att_database = 'test03';
internal error: find 0 snapshotRecords by name, expect only 1
drop snapshot if exists sp04;
create snapshot sp04 for account sys;
show snapshots where snapshot_name = 'sp04';
snapshot_name    timestamp    snapshot_level    account_name    database_name    table_name
sp04    2024-05-13 07:18:55.197576    account    sys        
select * from aff01{snapshot = 'sp04'};
empno    ename    job    mgr    hiredate    sal    comm    deptno
7369    SMITH    CLERK    7902    1980-12-17    800.00    null    20
7499    ALLEN    SALESMAN    7698    1981-02-20    1600.00    300.00    30
7521    WARD    SALESMAN    7698    1981-02-22    1250.00    500.00    30
7566    JONES    MANAGER    7839    1981-04-02    2975.00    null    20
7654    MARTIN    SALESMAN    7698    1981-09-28    1250.00    1400.00    30
7698    BLAKE    MANAGER    7839    1981-05-01    2850.00    null    30
7782    CLARK    MANAGER    7839    1981-06-09    2450.00    null    10
7788    SCOTT    ANALYST    7566    0087-07-13    3000.00    null    20
7839    KING    PRESIDENT    null    1981-11-17    5000.00    null    10
7844    TURNER    SALESMAN    7698    1981-09-08    1500.00    0.00    30
7876    ADAMS    CLERK    7788    0087-07-13    1100.00    null    20
7900    JAMES    CLERK    7698    1981-12-03    950.00    null    30
7902    FORD    ANALYST    7566    1981-12-03    3000.00    null    20
7934    MILLER    CLERK    7782    1982-01-23    1300.00    null    10
select * from pri01{snapshot = 'sp04'};
deptno    dname    loc
10    ACCOUNTING    NEW YORK
20    RESEARCH    DALLAS
30    SALES    CHICAGO
40    OPERATIONS    BOSTON
drop database test03;
select * from test03.aff01{snapshot = 'sp04'};
empno    ename    job    mgr    hiredate    sal    comm    deptno
7369    SMITH    CLERK    7902    1980-12-17    800.00    null    20
7499    ALLEN    SALESMAN    7698    1981-02-20    1600.00    300.00    30
7521    WARD    SALESMAN    7698    1981-02-22    1250.00    500.00    30
7566    JONES    MANAGER    7839    1981-04-02    2975.00    null    20
7654    MARTIN    SALESMAN    7698    1981-09-28    1250.00    1400.00    30
7698    BLAKE    MANAGER    7839    1981-05-01    2850.00    null    30
7782    CLARK    MANAGER    7839    1981-06-09    2450.00    null    10
7788    SCOTT    ANALYST    7566    0087-07-13    3000.00    null    20
7839    KING    PRESIDENT    null    1981-11-17    5000.00    null    10
7844    TURNER    SALESMAN    7698    1981-09-08    1500.00    0.00    30
7876    ADAMS    CLERK    7788    0087-07-13    1100.00    null    20
7900    JAMES    CLERK    7698    1981-12-03    950.00    null    30
7902    FORD    ANALYST    7566    1981-12-03    3000.00    null    20
7934    MILLER    CLERK    7782    1982-01-23    1300.00    null    10
select * from test03.pri01{snapshot = 'sp04'};
deptno    dname    loc
10    ACCOUNTING    NEW YORK
20    RESEARCH    DALLAS
30    SALES    CHICAGO
40    OPERATIONS    BOSTON
select count(*) from test03.aff01{snapshot = 'sp04'};
count(*)
14
restore account sys from snapshot sp04;

show create table aff01;

show create table pri01;

select count(*) from aff01;

drop database if exists test01;
create database test01;
use test01;
create table t1(col1 int, col2 decimal);
insert into t1 values(1,2);
insert into t1 values(2,3);
insert into t1 values(3,4);
create table t2(cool1 int primary key , col2 decimal);
insert into t2 select * from t1;
create table t3 like t2;
select count(*) from t1;
count(*)
3
select count(*) from t2;
count(*)
3
select count(*) from t3;
count(*)
0
drop database if exists test02;
create database test02;
use test02;
create table t1(col1 int, col2 decimal);
insert into t1 values(1,2);
insert into t1 values(2,3);
insert into t1 values(3,4);
create table t2(col1 int primary key , col2 decimal);
insert into t2 select * from t1;
create table t3 like t2;
insert into t3 select * from t2;
select count(*) from t1;
count(*)
3
select count(*) from t2;
count(*)
3
select count(*) from t3;
count(*)
3
drop database if exists test03;
create database test03;
use test03;
create table t1(col1 int, col2 decimal);
insert into t1 values(1,2);
insert into t1 values(2,3);
insert into t1 values(3,4);
create table t2(cool1 int primary key , col2 decimal);
insert into t2 select * from t1;
create table t3 like t2;
insert into t3 select * from t2;
insert into t3 select * from t2;
Duplicate entry '1' for key 'cool1'
select count(*) from t1;
count(*)
3
select count(*) from t2;
count(*)
3
select count(*) from t3;
count(*)
3
drop snapshot if exists snap01;
create snapshot snap01 for account sys;
select count(*) from test01.t1 {snapshot = 'snap01'};
count(*)
3
select count(*) from test02.t2 {snapshot = 'snap01'};
count(*)
3
select count(*) from test03.t3 {snapshot = 'snap01'};
count(*)
3
drop database test01;
drop database test02;
show databases;
Database
information_schema
mo_catalog
mo_debug
mo_task
mysql
sys_restore_to_sys_account
system
system_metrics
test03
select * from test01.t1;
invalid database test01
select count(*) from test03.t3;
count(*)
3
restore account sys from snapshot snap01;
show databases;
Database
information_schema
mo_catalog
mo_debug
mo_task
mysql
sys_restore_to_sys_account
system
system_metrics
test01
test02
test03
select count(*) from test01.t1;
count(*)
3
select * from test01.t1;
col1    col2
1    2
2    3
3    4
select count(*) from test02.t2;
count(*)
3
select * from test02.t2;
col1    col2
1    2
2    3
3    4
select count(*) from test03.t3;
count(*)
3
select * from test03.t3;
cool1    col2
1    2
2    3
3    4
show create table test01.t1;
Table    Create Table
t1    CREATE TABLE `t1` (\n`col1` INT DEFAULT null,\n`col2` DECIMAL(38,0) DEFAULT null\n)
show create table test02.t2;
Table    Create Table
t2    CREATE TABLE `t2` (\n`col1` INT NOT NULL,\n`col2` DECIMAL(38,0) DEFAULT null,\nPRIMARY KEY (`col1`)\n)
show create table test03.t2;
Table    Create Table
t2    CREATE TABLE `t2` (\n`cool1` INT NOT NULL,\n`col2` DECIMAL(38,0) DEFAULT null,\nPRIMARY KEY (`cool1`)\n)
drop database test01;
drop database test02;
drop database test03;
Can't drop database 'test03'; database doesn't exist
drop snapshot sp04;
drop database if exists test01;
create database test01;
use test01;
create table t1(col1 int, col2 decimal);
insert into t1 values(1,2);
insert into t1 values(2,3);
insert into t1 values(3,4);
create table t2(cool1 int primary key , col2 decimal);
insert into t2 select * from t1;
create table t3 like t2;
select count(*) from t1;
count(*)
3
select count(*) from t2;
count(*)
3
select count(*) from t3;
count(*)
0
drop database if exists test02;
create database test02;
use test02;
create table t1(col1 int, col2 decimal);
insert into t1 values(1,2);
insert into t1 values(2,3);
insert into t1 values(3,4);
create table t2(col1 int primary key , col2 decimal);
insert into t2 select * from t1;
create table t3 like t2;
insert into t3 select * from t2;
select count(*) from t1;
count(*)
3
select count(*) from t2;
count(*)
3
select count(*) from t3;
count(*)
3
drop database if exists test03;
create database test03;
use test03;
create table t1(col1 int, col2 decimal);
insert into t1 values(1,2);
insert into t1 values(2,3);
insert into t1 values(3,4);
create table t2(cool1 int primary key , col2 decimal);
insert into t2 select * from t1;
create table t3 like t2;
insert into t3 select * from t2;
insert into t3 select * from t2;
Duplicate entry '1' for key 'cool1'
select count(*) from t1;
count(*)
3
select count(*) from t2;
count(*)
3
select count(*) from t3;
count(*)
3
drop snapshot if exists snap01;
create snapshot snap01 for account sys;
select count(*) from test01.t1 {snapshot = 'snap01'};
count(*)
3
select count(*) from test02.t2 {snapshot = 'snap01'};
count(*)
3
select count(*) from test03.t3 {snapshot = 'snap01'};
count(*)
3
drop database test01;
drop database test02;
show databases;
Database
information_schema
mo_catalog
mo_debug
mo_task
mysql
sys_restore_to_sys_account
system
system_metrics
test03
select * from test01.t1;
invalid database test01
select count(*) from test03.t3;
count(*)
3
restore account sys from snapshot snap01;
show databases;
Database
information_schema
mo_catalog
mo_debug
mo_task
mysql
sys_restore_to_sys_account
system
system_metrics
test01
test02
test03
select count(*) from test01.t1;
count(*)
3
select * from test01.t1;
col1    col2
1    2
2    3
3    4
select count(*) from test02.t2;
count(*)
3
select * from test02.t2;
col1    col2
1    2
2    3
3    4
select count(*) from test03.t3;
count(*)
3
select * from test03.t3;
cool1    col2
1    2
2    3
3    4
show create table test01.t1;
Table    Create Table
t1    CREATE TABLE `t1` (\n`col1` INT DEFAULT null,\n`col2` DECIMAL(38,0) DEFAULT null\n)
show create table test02.t2;
Table    Create Table
t2    CREATE TABLE `t2` (\n`col1` INT NOT NULL,\n`col2` DECIMAL(38,0) DEFAULT null,\nPRIMARY KEY (`col1`)\n)
show create table test03.t2;
Table    Create Table
t2    CREATE TABLE `t2` (\n`cool1` INT NOT NULL,\n`col2` DECIMAL(38,0) DEFAULT null,\nPRIMARY KEY (`cool1`)\n)
drop database test01;
drop database test02;
drop database test03;
drop snapshot snap01;
drop snapshot if exists sp05;

create snapshot sp05 for account sys;

create database db01;

restore account sys FROM snapshot sp05;

show databases;

drop database if exists db01;
create database db01;
use db01;
drop table if exists table01;
create table table01(col1 int primary key , col2 decimal, col3 char, col4 varchar(20), col5 text, col6 double);
insert into table01 values (1, 2, 'a', '23eiojf', 'r23v324r23rer', 3923.324);
insert into table01 values (2, 3, 'b', '32r32r', 'database', 1111111);
drop table if exists table02;
create table table02 (col1 int unique key, col2 varchar(20));
insert into table02 (col1, col2) values (133, 'database');
drop snapshot if exists sp07;
create snapshot sp07 for account sys;
drop table table01;
insert into table02 values(134, 'database');
drop snapshot if exists sp08;
create snapshot sp08 for account sys;
show snapshots;
SNAPSHOT_NAME    TIMESTAMP    SNAPSHOT_LEVEL    ACCOUNT_NAME    DATABASE_NAME    TABLE_NAME
sp08    2024-05-13 07:18:57.161927    account    sys        
sp07    2024-05-13 07:18:57.071829    account    sys        
restore account sys from snapshot sp08;
select * from table02;
col1    col2
133    database
134    database
select * from db01.table01;
SQL parser error: table "table01" does not exist
select count(*) from table02;
count(*)
2
restore account sys from snapshot sp07;
select * from table01;
col1    col2    col3    col4    col5    col6
1    2    a    23eiojf    r23v324r23rer    3923.324
2    3    b    32r32r    database    1111111.0
select * from table02;
col1    col2
133    database
select count(*) from table01;
count(*)
2
select count(*) from table02;
count(*)
1
drop snapshot sp07;
drop snapshot sp08;
drop database db01;
drop database if exists db02;
create database db02;
use db02;
drop table if exists table01;
create table table01(col1 int primary key , col2 decimal, col3 char, col4 varchar(20), col5 text, col6 double);
insert into table01 values (1, 2, 'a', '23eiojf', 'r23v324r23rer', 3923.324);
insert into table01 values (2, 3, 'b', '32r32r', 'database', 1111111);
drop table if exists table02;
create table table02 (col1 int unique key, col2 varchar(20));
insert into table02 (col1, col2) values (133, 'database');
drop snapshot if exists sp09;
create snapshot sp09 for account sys;
alter table table01 drop primary key;
insert into table02 values(134, 'database');
drop snapshot if exists sp10;
create snapshot sp10 for account sys;
show snapshots;
SNAPSHOT_NAME    TIMESTAMP    SNAPSHOT_LEVEL    ACCOUNT_NAME    DATABASE_NAME    TABLE_NAME
sp10    2024-05-13 07:18:57.833974    account    sys        
sp09    2024-05-13 07:18:57.677651    account    sys        
restore account sys from snapshot sp09;
select * from table02;
col1    col2
133    database
select * from db02.table01;
col1    col2    col3    col4    col5    col6
1    2    a    23eiojf    r23v324r23rer    3923.324
2    3    b    32r32r    database    1111111.0
select count(*) from table02;
count(*)
1
select count(*) from table01;
count(*)
2
restore account sys from snapshot sp10;
select * from db02.table01;
col1    col2    col3    col4    col5    col6
1    2    a    23eiojf    r23v324r23rer    3923.324
2    3    b    32r32r    database    1111111.0
select count(*) from table01;
count(*)
2
show create table db02.table01;
Table    Create Table
table01    CREATE TABLE `table01` (\n`col1` INT NOT NULL,\n`col2` DECIMAL(38,0) DEFAULT null,\n`col3` CHAR(1) DEFAULT null,\n`col4` VARCHAR(20) DEFAULT null,\n`col5` TEXT DEFAULT null,\n`col6` DOUBLE DEFAULT null\n)
select * from db02.table02;
col1    col2
133    database
134    database
select count(*) from table02;
count(*)
2
drop snapshot sp09;
drop snapshot sp10;
drop database db02;
drop database if exists db03;
create database db03;
use db03;
drop table if exists ti1;
drop table if exists tm1;
drop table if exists ti2;
drop table if exists tm2;
create  table ti1(a INT not null, b INT, c INT);
create  table tm1(a INT not null, b INT, c INT);
create  table ti2(a INT primary key AUTO_INCREMENT, b INT, c INT);
create  table tm2(a INT primary key AUTO_INCREMENT, b INT, c INT);
show create table ti1;
Table    Create Table
ti1    CREATE TABLE `ti1` (\n`a` INT NOT NULL,\n`b` INT DEFAULT NULL,\n`c` INT DEFAULT NULL\n)
show create table tm1;
Table    Create Table
tm1    CREATE TABLE `tm1` (\n`a` INT NOT NULL,\n`b` INT DEFAULT NULL,\n`c` INT DEFAULT NULL\n)
show create table ti2;
Table    Create Table
ti2    CREATE TABLE `ti2` (\n`a` INT NOT NULL AUTO_INCREMENT,\n`b` INT DEFAULT NULL,\n`c` INT DEFAULT NULL,\nPRIMARY KEY (`a`)\n)
show create table tm2;
Table    Create Table
tm2    CREATE TABLE `tm2` (\n`a` INT NOT NULL AUTO_INCREMENT,\n`b` INT DEFAULT NULL,\n`c` INT DEFAULT NULL,\nPRIMARY KEY (`a`)\n)
drop snapshot if exists sp11;
create snapshot sp11 for account sys;
insert into ti1 values (1,1,1), (2,2,2);
insert into ti2 values (1,1,1), (2,2,2);
select * from ti1;
a    b    c
1    1    1
2    2    2
select * from tm1;
a    b    c
select * from ti2;
a    b    c
1    1    1
2    2    2
select * from tm2;
a    b    c
drop snapshot if exists sp12;
create snapshot sp12 for account sys;
insert into tm1 values (1,1,1), (2,2,2);
insert into tm2 values (1,1,1), (2,2,2);
select * from ti1 {snapshot = 'sp12'};
a    b    c
1    1    1
2    2    2
select * from tm1;
a    b    c
1    1    1
2    2    2
select * from ti2 {snapshot = 'sp12'};
a    b    c
1    1    1
2    2    2
select * from tm2;
a    b    c
1    1    1
2    2    2
drop snapshot if exists sp13;
create snapshot sp13 for account sys;
alter table ti1 add constraint fi1 foreign key (b) references ti2(a);
alter table tm1 add constraint fm1 foreign key (b) references tm2(a);
drop snapshot if exists sp14;
create snapshot sp14 for account sys;
show create table ti1 {snapshot = 'sp14'};
Table    Create Table
ti1    CREATE TABLE `ti1` (\n`a` INT NOT NULL,\n`b` INT DEFAULT NULL,\n`c` INT DEFAULT NULL,\nCONSTRAINT `fi1` FOREIGN KEY (`b`) REFERENCES `ti2` (`a`) ON DELETE RESTRICT ON UPDATE RESTRICT\n)
show create table tm1 {snapshot = 'sp13'};
Table    Create Table
tm1    CREATE TABLE `tm1` (\n`a` INT NOT NULL,\n`b` INT DEFAULT NULL,\n`c` INT DEFAULT NULL\n)
show create table ti1 {snapshot = 'sp14'};
Table    Create Table
ti1    CREATE TABLE `ti1` (\n`a` INT NOT NULL,\n`b` INT DEFAULT NULL,\n`c` INT DEFAULT NULL,\nCONSTRAINT `fi1` FOREIGN KEY (`b`) REFERENCES `ti2` (`a`) ON DELETE RESTRICT ON UPDATE RESTRICT\n)
show create table tm1 {snapshot = 'sp13'};
Table    Create Table
tm1    CREATE TABLE `tm1` (\n`a` INT NOT NULL,\n`b` INT DEFAULT NULL,\n`c` INT DEFAULT NULL\n)
alter table ti1 drop foreign key fi1;
alter table tm1 drop foreign key fm1;
truncate ti2;
truncate tm2;
drop snapshot if exists sp15;
create snapshot sp15 for account sys;
show create table ti1 {snapshot = 'sp14'};
internal error: panic runtime error: invalid memory address or nil pointer dereference: 
runtime.panicmem
	/opt/homebrew/Cellar/go/1.22.0/libexec/src/runtime/panic.go:261
runtime.sigpanic
	/opt/homebrew/Cellar/go/1.22.0/libexec/src/runtime/signal_unix.go:881
github.com/matrixorigin/matrixone/pkg/sql/plan.buildShowCreateTable
	/Users/ariznawl/wl_123/matrixone/pkg/sql/plan/build_show.go:332
github.com/matrixorigin/matrixone/pkg/sql/plan.BuildPlan
	/Users/ariznawl/wl_123/matrixone/pkg/sql/plan/build.go:140
github.com/matrixorigin/matrixone/pkg/sql/plan.(*BaseOptimizer).Optimize
	/Users/ariznawl/wl_123/matrixone/pkg/sql/plan/optimize.go:56
github.com/matrixorigin/matrixone/pkg/frontend.buildPlan
	/Users/ariznawl/wl_123/matrixone/pkg/frontend/mysql_cmd_executor.go:1963
github.com/matrixorigin/matrixone/pkg/frontend.(*TxnComputationWrapper).Compile
	/Users/ariznawl/wl_123/matrixone/pkg/frontend/computation_wrapper.go:244
github.com/matrixorigin/matrixone/pkg/frontend.executeStmt
	/Users/ariznawl/wl_123/matrixone/pkg/frontend/mysql_cmd_executor.go:2627
github.com/matrixorigin/matrixone/pkg/frontend.dispatchStmt
	/Users/ariznawl/wl_123/matrixone/pkg/frontend/mysql_cmd_executor.go:2527
github.com/matrixorigin/matrixone/pkg/frontend.executeStmtWithIncrStmt
	/Users/ariznawl/wl_123/matrixone/pkg/frontend/mysql_cmd_executor.go:2498
github.com/matrixorigin/matrixone/pkg/frontend.executeStmtWithWorkspace
	/Users/ariznawl/wl_123/matrixone/pkg/frontend/mysql_cmd_executor.go:2468
github.com/matrixorigin/matrixone/pkg/frontend.executeStmtWithTxn
	/Users/ariznawl/wl_123/matrixone/pkg/frontend/mysql_cmd_executor.go:2382
github.com/matrixorigin/matrixone/pkg/frontend.executeStmtWithResponse
	/Users/ariznawl/wl_123/matrixone/pkg/frontend/mysql_cmd_executor.go:2351
github.com/matrixorigin/matrixone/pkg/frontend.doComQuery
	/Users/ariznawl/wl_123/matrixone/pkg/frontend/mysql_cmd_executor.go:2896
github.com/matrixorigin/matrixone/pkg/frontend.ExecRequest
	/Users/ariznawl/wl_123/matrixone/pkg/frontend/mysql_cmd_executor.go:2970
github.com/matrixorigin/matrixone/pkg/frontend.(*Routine).handleRequest
	/Users/ariznawl/wl_123/matrixone/pkg/frontend/routine.go:285
github.com/matrixorigin/matrixone/pkg/frontend.(*RoutineManager).Handler
	/Users/ariznawl/wl_123/matrixone/pkg/frontend/routine_manager.go:516
github.com/matrixorigin/matrixone/pkg/frontend.(*MOServer).handleMessage
	/Users/ariznawl/wl_123/matrixone/pkg/frontend/server.go:187
github.com/fagongzi/goetty/v2.(*server).doStart.func2.1
	/Users/ariznawl/go/pkg/mod/github.com/matrixorigin/goetty/v2@v2.0.0-20231122095211-6a25dc9130ca/application.go:356
runtime.goexit
	/opt/homebrew/Cellar/go/1.22.0/libexec/src/runtime/asm_arm64.s:1222
show create table tm1 {snapshot = 'sp15'};
Table    Create Table
tm1    CREATE TABLE `tm1` (\n`a` INT NOT NULL,\n`b` INT DEFAULT NULL,\n`c` INT DEFAULT NULL\n)
show create table ti1 {snapshot = 'sp14'};
internal error: panic runtime error: invalid memory address or nil pointer dereference: 
runtime.panicmem
	/opt/homebrew/Cellar/go/1.22.0/libexec/src/runtime/panic.go:261
runtime.sigpanic
	/opt/homebrew/Cellar/go/1.22.0/libexec/src/runtime/signal_unix.go:881
github.com/matrixorigin/matrixone/pkg/sql/plan.buildShowCreateTable
	/Users/ariznawl/wl_123/matrixone/pkg/sql/plan/build_show.go:332
github.com/matrixorigin/matrixone/pkg/sql/plan.BuildPlan
	/Users/ariznawl/wl_123/matrixone/pkg/sql/plan/build.go:140
github.com/matrixorigin/matrixone/pkg/sql/plan.(*BaseOptimizer).Optimize
	/Users/ariznawl/wl_123/matrixone/pkg/sql/plan/optimize.go:56
github.com/matrixorigin/matrixone/pkg/frontend.buildPlan
	/Users/ariznawl/wl_123/matrixone/pkg/frontend/mysql_cmd_executor.go:1963
github.com/matrixorigin/matrixone/pkg/frontend.(*TxnComputationWrapper).Compile
	/Users/ariznawl/wl_123/matrixone/pkg/frontend/computation_wrapper.go:244
github.com/matrixorigin/matrixone/pkg/frontend.executeStmt
	/Users/ariznawl/wl_123/matrixone/pkg/frontend/mysql_cmd_executor.go:2627
github.com/matrixorigin/matrixone/pkg/frontend.dispatchStmt
	/Users/ariznawl/wl_123/matrixone/pkg/frontend/mysql_cmd_executor.go:2527
github.com/matrixorigin/matrixone/pkg/frontend.executeStmtWithIncrStmt
	/Users/ariznawl/wl_123/matrixone/pkg/frontend/mysql_cmd_executor.go:2498
github.com/matrixorigin/matrixone/pkg/frontend.executeStmtWithWorkspace
	/Users/ariznawl/wl_123/matrixone/pkg/frontend/mysql_cmd_executor.go:2468
github.com/matrixorigin/matrixone/pkg/frontend.executeStmtWithTxn
	/Users/ariznawl/wl_123/matrixone/pkg/frontend/mysql_cmd_executor.go:2382
github.com/matrixorigin/matrixone/pkg/frontend.executeStmtWithResponse
	/Users/ariznawl/wl_123/matrixone/pkg/frontend/mysql_cmd_executor.go:2351
github.com/matrixorigin/matrixone/pkg/frontend.doComQuery
	/Users/ariznawl/wl_123/matrixone/pkg/frontend/mysql_cmd_executor.go:2896
github.com/matrixorigin/matrixone/pkg/frontend.ExecRequest
	/Users/ariznawl/wl_123/matrixone/pkg/frontend/mysql_cmd_executor.go:2970
github.com/matrixorigin/matrixone/pkg/frontend.(*Routine).handleRequest
	/Users/ariznawl/wl_123/matrixone/pkg/frontend/routine.go:285
github.com/matrixorigin/matrixone/pkg/frontend.(*RoutineManager).Handler
	/Users/ariznawl/wl_123/matrixone/pkg/frontend/routine_manager.go:516
github.com/matrixorigin/matrixone/pkg/frontend.(*MOServer).handleMessage
	/Users/ariznawl/wl_123/matrixone/pkg/frontend/server.go:187
github.com/fagongzi/goetty/v2.(*server).doStart.func2.1
	/Users/ariznawl/go/pkg/mod/github.com/matrixorigin/goetty/v2@v2.0.0-20231122095211-6a25dc9130ca/application.go:356
runtime.goexit
	/opt/homebrew/Cellar/go/1.22.0/libexec/src/runtime/asm_arm64.s:1222
show create table tm1 {snapshot = 'sp15'};
Table    Create Table
tm1    CREATE TABLE `tm1` (\n`a` INT NOT NULL,\n`b` INT DEFAULT NULL,\n`c` INT DEFAULT NULL\n)
select count(*) from ti1;
count(*)
2
select count(*) from tm1;
count(*)
2
select count(*) from ti2;
count(*)
0
select count(*) from tm2;
count(*)
0
restore account sys from snapshot sp11;
show databases;
Database
db03
information_schema
mo_catalog
mo_debug
mo_task
mysql
sys_restore_to_sys_account
system
system_metrics
select * from db03.ti1;
a    b    c
select * from db03.tm1;
a    b    c
select * from db03.ti2;
a    b    c
select * from db03.tm2;
a    b    c
show create table db03.ti1;
Table    Create Table
ti1    CREATE TABLE `ti1` (\n`a` INT NOT NULL,\n`b` INT DEFAULT null,\n`c` INT DEFAULT null\n)
show create table db03.tm1;
Table    Create Table
tm1    CREATE TABLE `tm1` (\n`a` INT NOT NULL,\n`b` INT DEFAULT null,\n`c` INT DEFAULT null\n)
show create table db03.ti2;
Table    Create Table
ti2    CREATE TABLE `ti2` (\n`a` INT NOT NULL AUTO_INCREMENT,\n`b` INT DEFAULT null,\n`c` INT DEFAULT null,\nPRIMARY KEY (`a`)\n)
show create table db03.tm2;
Table    Create Table
tm2    CREATE TABLE `tm2` (\n`a` INT NOT NULL AUTO_INCREMENT,\n`b` INT DEFAULT null,\n`c` INT DEFAULT null,\nPRIMARY KEY (`a`)\n)
restore account sys from snapshot sp14;

show databases;

select * from db03.ti1;

select * from db03.tm1;

select * from db03.ti2;

select * from db03.tm2;

show create table db03.ti1;

show create table db03.tm1;

show create table db03.ti2;

show create table db03.tm2;

drop database db03;
drop snapshot sp15;
drop snapshot sp14;
drop snapshot sp13;
drop snapshot sp12;
drop snapshot sp11;
drop database if exists db04;
create database db04;
use db04;
create table table01(col1 int primary key );
insert into table01 values (1);
insert into table01 values (2);
drop database if exists db05;
create database db05;
use db05;
create table table01(col1 int primary key );
insert into table01 values (1);
insert into table01 values (2);
drop database if exists db06;
create database db06;
use db06;
create table table01(col1 int primary key );
insert into table01 values (1);
insert into table01 values (2);
select * from db04.table01;
col1
1
2
select * from db05.table01;
col1
1
2
select * from db06.table01;
col1
1
2
drop snapshot if exists sp13;
create snapshot sp13 for account sys;
insert into db04.table01 values (200);
insert into db05.table01 values (400);
restore account sys database db04 from snapshot sp13;
show databases;
Database
db04
db05
db06
information_schema
mo_catalog
mo_debug
mo_task
mysql
sys_restore_to_sys_account
system
system_metrics
use db04;
select count(*) from db04.table01;
count(*)
2
select * from db04.table01;
col1
1
2
use db05;
select count(*) from db05.table01;
count(*)
3
select * from db05.table01;
col1
1
2
400
use db06;
select count(*) from db06.table01;
count(*)
2
select * from db06.table01;
col1
1
2
drop snapshot sp13;
drop database db04;
drop database db05;
drop database db06;
drop database if exists db07;
create database db07;
use db07;
create table table01 (col1 int, col2 enum ('a','b','c'));
insert into table01 values(1,'a');
insert into table01 values(2, 'b');
create table table02 (col1 int, col2 enum ('a','b','c'));
insert into table02 values(1,'a');
insert into table02 values(2, 'b');
drop database if exists db08;
create database db08;
use db08;
create table index01(col1 int,key key1(col1));
insert into index01 values (1);
insert into index01 values (2);
show create table db07.table02;
Table    Create Table
table02    CREATE TABLE `table02` (\n`col1` INT DEFAULT NULL,\n`col2` ENUM('a','b','c') DEFAULT NULL\n)
drop snapshot if exists sp14;
create snapshot sp14 for account sys;
use db07;
drop table table01;
alter table table02 add column newC int first;
show create table table02;
Table    Create Table
table02    CREATE TABLE `table02` (\n`newc` INT DEFAULT NULL,\n`col1` INT DEFAULT NULL,\n`col2` ENUM('a','b','c') DEFAULT NULL\n)
show create table table02 {snapshot = 'sp14'};
Table    Create Table
table02    CREATE TABLE `table02` (\n`col1` INT DEFAULT NULL,\n`col2` ENUM('a','b','c') DEFAULT NULL\n)
drop database db08;
drop snapshot if exists sp15;
create snapshot sp15 for account sys;
restore account sys database db07 from snapshot sp15;
restore account sys database db08 from snapshot sp15;
invalid database db08
show databases;

use db07;

show tables;

show create table table01 {snapshot = 'sp14'};

show create table table01;

select * from table01;

show snapshots;
SNAPSHOT_NAME    TIMESTAMP    SNAPSHOT_LEVEL    ACCOUNT_NAME    DATABASE_NAME    TABLE_NAME
sp15    2024-05-13 07:19:00.54944    account    sys        
sp14    2024-05-13 07:19:00.377505    account    sys        
drop snapshot sp14;
drop snapshot sp15;
drop database db07;
drop database db08;
Can't drop database 'db08'; database doesn't exist
drop database if exists db08;
create database db08;
use db08;
create table db08 (col1 int);
insert into db08 values(1), (100), (20000);
drop snapshot if exists sp15;
create snapshot sp15 for account sys;
insert into db08 (col1) values (3000);
restore account sys database db from snapshot sp15;
invalid database db
drop snapshot sp15;
drop database db08;
drop database if exists db09;
create database db09;
use db09;
drop table if exists index01;
create table index01(
col1 int not null,
col2 date not null,
col3 varchar(16) not null,
col4 int unsigned not null,
primary key (col1)
);
insert into index01 values(1, '1980-12-17','Abby', 21);
insert into index01 values(2, '1981-02-20','Bob', 22);
insert into index01 values(3, '1981-02-20','Bob', 22);
select count(*) from index01;
count(*)
3
drop table if exists index02;
create table index02(col1 char, col2 int, col3 binary);
insert into index02 values('a', 33, 1);
insert into index02 values('c', 231, 0);
alter table index02 add key pk(col1) comment 'primary key';
select count(*) from index02;
count(*)
2
drop database if exists db10;
create database db10;
use db10;
drop table if exists index03;
create table index03 (
emp_no      int             not null,
birth_date  date            not null,
first_name  varchar(14)     not null,
last_name   varchar(16)     not null,
gender      varchar(5)      not null,
hire_date   date            not null,
primary key (emp_no)
) partition by range columns (emp_no)(
partition p01 values less than (100001),
partition p02 values less than (200001),
partition p03 values less than (300001),
partition p04 values less than (400001)
);
insert into index03 values (9001,'1980-12-17', 'SMITH', 'CLERK', 'F', '2008-12-17'),
(9002,'1981-02-20', 'ALLEN', 'SALESMAN', 'F', '2008-02-20');
drop snapshot if exists sp16;
create snapshot sp16 for account sys;
use db09;
delete from index02 where col1 = 'a';
select * from index02;
col1    col2    col3
c    231    0
update index01 set col1 = 1000 where col1 = 1;
select * from index01;
col1    col2    col3    col4
2    1981-02-20    Bob    22
3    1981-02-20    Bob    22
1000    1980-12-17    Abby    21
use db10;
truncate index03;
restore account sys database db09 table index01 from snapshot sp16;
restore account sys database db10 table index03 from snapshot sp16;
use db09;
select * from index02;
col1    col2    col3
c    231    0
select * from index01;
col1    col2    col3    col4
1    1980-12-17    Abby    21
2    1981-02-20    Bob    22
3    1981-02-20    Bob    22
show create table index01;
Table    Create Table
index01    CREATE TABLE `index01` (\n`col1` INT NOT NULL,\n`col2` DATE NOT NULL,\n`col3` VARCHAR(16) NOT NULL,\n`col4` INT UNSIGNED NOT NULL,\nPRIMARY KEY (`col1`)\n)
show create table index02;
Table    Create Table
index02    CREATE TABLE `index02` (\n`col1` CHAR(1) DEFAULT NULL,\n`col2` INT DEFAULT NULL,\n`col3` BINARY(1) DEFAULT NULL,\nKEY `pk` (`col1`) COMMENT 'primary key'\n)
use db10;
select * from index03;
emp_no    birth_date    first_name    last_name    gender    hire_date
show snapshots;
SNAPSHOT_NAME    TIMESTAMP    SNAPSHOT_LEVEL    ACCOUNT_NAME    DATABASE_NAME    TABLE_NAME
sp16    2024-05-13 07:19:01.560046    account    sys        
drop database db09;
drop database db10;
drop snapshot sp16;
drop database if exists db11;
create database db11;
use db11;
drop table if exists pri01;
create table pri01 (col1 int, col2 decimal);
insert into pri01 (col1, col2) values (1,2378.328839842);
insert into pri01 values (234, -3923.2342342);
select * from pri01;
col1    col2
1    2378
234    -3923
drop snapshot if exists sp17;
create snapshot sp17 for account sys;
alter table pri01 add constraint primary key(col1);
insert into pri01 values (23423, 32432543.3242);
insert into pri01 values (234222, -3923.2342342);
drop snapshot if exists sp18;
create snapshot sp18 for account sys;
restore account sys database db11 table pri01 from snapshot sp18;
show create table pri01;
Table    Create Table
pri01    CREATE TABLE `pri01` (\n`col1` INT NOT NULL,\n`col2` DECIMAL(38,0) DEFAULT null,\nPRIMARY KEY (`col1`)\n)
select * from pri01;
col1    col2
1    2378
234    -3923
23423    32432543
234222    -3923
select count(*) from pri01;
count(*)
4
restore account sys database db11 table pri01 from snapshot sp17;
show create table pri01;
Table    Create Table
pri01    CREATE TABLE `pri01` (\n`col1` INT DEFAULT null,\n`col2` DECIMAL(38,0) DEFAULT null\n)
select * from pri01;
col1    col2
1    2378
234    -3923
select count(*) from pri01;
count(*)
2
restore account sys database db11 table pri01 from snapshot sp18;
show create table pri01;
Table    Create Table
pri01    CREATE TABLE `pri01` (\n`col1` INT NOT NULL,\n`col2` DECIMAL(38,0) DEFAULT null,\nPRIMARY KEY (`col1`)\n)
select * from pri01;
col1    col2
1    2378
234    -3923
23423    32432543
234222    -3923
select count(*) from pri01;
count(*)
4
insert into pri01 values(23420, 32432543.3242);
select * from pri01;
col1    col2
1    2378
234    -3923
23423    32432543
234222    -3923
23420    32432543
show columns from pri01;
Field    Type    Null    Key    Default    Extra    Comment
col1    INT(32)    NO    PRI    null        
col2    DECIMAL128(38)    YES        null        
select count(*) from mo_catalog.mo_tables{snapshot = 'sp18'} where reldatabase = 'db11';
count(*)
1
select * from mo_catalog.mo_database{snapshot = 'sp18'} where datname = 'db11';
dat_id    datname    dat_catalog_name    dat_createsql    owner    creator    created_time    account_id    dat_type
276293    db11    def    create database db11    0    1    2024-05-13 15:19:02    0    
select attname from mo_catalog.mo_columns{snapshot = 'sp18'} where att_database = 'db11';
attname
__mo_rowid
col1
col2
drop database db11;
drop snapshot sp18;
drop snapshot sp17;
