create table table01(a TINYINT primary key, b SMALLINT SIGNED, c INT UNSIGNED,d BIGINT not null , e FLOAT,f DOUBLE, g CHAR(10), h VARCHAR(20));
create table table15 (a varchar(5) default 'abcde');
create temporary table table05 ( a int, b char(10));
create table table06 (a int primary key, b varchar(10));
create table table10 (a int primary key, b varchar(10));
create table `测试表` (`测试1` int);
create table `table11 ` (a int);
create table table12 (`a ` int);
create table `a/a` (a int);
create table `aaaaaaaaaaaaaaaaaaaaaaaaaaaaaaaaaaaaaaaaaaaaaaaaaaaaaaaaaaaaaaaaaaa` (aaaaaaaaaaaaaaaaaaaaaaaaaaaaaaaaaaaaaaaaaaaaaaaaaaaaaaaaaaaaaaaaaa int);
create table table14 (`aaaaaaaaaaaaaaaaaaaaaaaaaaaaaaaaaaaaaaaaaaaaaaaaaaaaaaaaaaaaaaaaaa` int);
create table table16 (1a20 int,1e int);
create table $table18 (a$1 int, $b int, c$ int);
create table table19$ (a int);
create table table17 (`index` int);
create table account(a int);
show tables;
Tables_in_create_table
table01
table15
table06
table10
测试表
table11 
table12
a/a
aaaaaaaaaaaaaaaaaaaaaaaaaaaaaaaaaaaaaaaaaaaaaaaaaaaaaaaaaaaaaaaaaaa
table14
table16
$table18
table19$
table17
account
create table test01(a int primary key, b int) cluster by a;
not supported: cluster by with primary key is not support
create table test01(a int, b int) cluster by a;
create table test02(a int, b int) cluster by b;
insert into test01 values(1,1),(2,2),(3,null),(null,4);

select * from test01;
a    b
1    1
2    2
3    null
null    4
insert into test02 select * from test01;

select * from test02;
a    b
1    1
2    2
3    null
null    4
update test02 set b=null where a=1;

select * from test02;
a    b
2    2
3    null
null    4
1    null
create table test03(a int, b int) cluster by c;
invalid input: column 'c' doesn't exist in table
create table test04(a int, b int, c varchar(10), unique key(a)) cluster by (b,c,a);
insert into test04 values(11,3,'bb');
insert into test04 values(1,2,'a');
insert into test04 values(2,2,'');
insert into test04 values(3,2,null);

select * from test04;
a    b    c
11    3    bb
1    2    a
2    2    
create table test06(a int, b int, c varchar(10)) cluster by (b,a,c);
insert into test06 select * from test04;
select * from test06;
a    b    c
11    3    bb
1    2    a
2    2    
update test06 set c=null where a=11;

select * from test06;
a    b    c
11    3    bb
1    2    a
2    2    
insert into test06 select * from test04;
select * from test06;
a    b    c
11    3    bb
1    2    a
2    2    
11    3    bb
1    2    a
2    2    
update test06 set c=a where b=2;
select * from test06;
a    b    c
11    3    bb
11    3    bb
1    2    1
2    2    2
1    2    1
2    2    2
create table test05(a int, b int, c varchar(10)) cluster by (b,c,d);
invalid input: column 'd' doesn't exist in table
create temporary table test05(a int, b int, c varchar(10)) cluster by (b,c);
not supported: cluster by with temporary table is not support
show create table test01;
Table    Create Table
test01    CREATE TABLE `test01` (\n`a` INT DEFAULT NULL,\n`b` INT DEFAULT NULL\n) CLUSTER BY (`a`)
show create table test02;
Table    Create Table
test02    CREATE TABLE `test02` (\n`a` INT DEFAULT NULL,\n`b` INT DEFAULT NULL\n) CLUSTER BY (`b`)
show create table test04;
Table    Create Table
test04    CREATE TABLE `test04` (\n`a` INT DEFAULT NULL,\n`b` INT DEFAULT NULL,\n`c` VARCHAR(10) DEFAULT NULL,\nUNIQUE KEY `a` (`a`)\n) CLUSTER BY (`b`, `c`, `a`)
show create table test06;
Table    Create Table
test06    CREATE TABLE `test06` (\n`a` INT DEFAULT NULL,\n`b` INT DEFAULT NULL,\n`c` VARCHAR(10) DEFAULT NULL\n) CLUSTER BY (`b`, `a`, `c`)
desc test01;
Field    Type    Null    Key    Default    Extra    Comment
a    INT    YES        NULL        
b    INT    YES        NULL        
desc test02;
Field    Type    Null    Key    Default    Extra    Comment
a    INT    YES        NULL        
b    INT    YES        NULL        
desc test04;
Field    Type    Null    Key    Default    Extra    Comment
a    INT    YES        NULL        
b    INT    YES        NULL        
c    VARCHAR(10)    YES        NULL        
__mo_cbkey_001b001c001a    VARCHAR(65535)    YES        NULL        
desc test06;
Field    Type    Null    Key    Default    Extra    Comment
__mo_cbkey_001b001a001c    VARCHAR(65535)    YES        NULL        
a    INT    YES        NULL        
b    INT    YES        NULL        
c    VARCHAR(10)    YES        NULL        
drop table test01;
drop table test02;
drop table test04;
drop table test06;
drop table if exists t1;
create table t1(a int, b int, unique key(a), unique key(a, b));
show create table t1;
Table    Create Table
t1    CREATE TABLE `t1` (\n`a` INT DEFAULT NULL,\n`b` INT DEFAULT NULL,\nUNIQUE KEY `a` (`a`),\nUNIQUE KEY `a_2` (`a`,`b`)\n)
drop table if exists t1;
create table t1(a int unique, b int unique key, unique key(a));
show create table t1;
Table    Create Table
t1    CREATE TABLE `t1` (\n`a` INT DEFAULT NULL,\n`b` INT DEFAULT NULL,\nUNIQUE KEY `a` (`a`),\nUNIQUE KEY `b` (`b`),\nUNIQUE KEY `a_2` (`a`)\n)
drop table t1;
create table test (`a` varchar(255) DEFAULT b'0');
insert into test values (), ();
select * from test;
a
0
0
