create table table01(a TINYINT primary key, b SMALLINT SIGNED, c INT UNSIGNED,d BIGINT not null , e FLOAT,f DOUBLE, g CHAR(10), h VARCHAR(20));
create table table15 (a varchar(5) default 'abcde');
create temporary table table05 ( a int, b char(10));
create table table06 (a int primary key, b varchar(10));
create table table10 (a int primary key, b varchar(10));
create table `测试表` (`测试1` int);
create table `table11 ` (a int);
create table table12 (`a ` int);
create table `a/a` (a int);
create table `aaaaaaaaaaaaaaaaaaaaaaaaaaaaaaaaaaaaaaaaaaaaaaaaaaaaaaaaaaaaaaaaaaa` (aaaaaaaaaaaaaaaaaaaaaaaaaaaaaaaaaaaaaaaaaaaaaaaaaaaaaaaaaaaaaaaaaa int);
create table table14 (`aaaaaaaaaaaaaaaaaaaaaaaaaaaaaaaaaaaaaaaaaaaaaaaaaaaaaaaaaaaaaaaaaa` int);
create table table16 (1a20 int,1e int);
create table $table18 (a$1 int, $b int, c$ int);
create table table19$ (a int);
create table table17 (`index` int);
create table account(a int);
show tables;
Tables_in_create_table
table01
table15
table06
table10
测试表
table11 
table12
a/a
aaaaaaaaaaaaaaaaaaaaaaaaaaaaaaaaaaaaaaaaaaaaaaaaaaaaaaaaaaaaaaaaaaa
table14
table16
$table18
table19$
table17
account
create table test01(a int primary key, b int) cluster by a;
not supported: cluster by with primary key is not support
create table test01(a int, b int) cluster by a;
create table test02(a int, b int) cluster by b;
insert into test01 values(1,1),(2,2),(3,null),(null,4);
select * from test01;
a    b
1    1
2    2
3    null
null    4
insert into test02 select * from test01;
select * from test02;
a    b
1    1
2    2
3    null
null    4
update test02 set b=null where a=1;
select * from test02;
a    b
2    2
3    null
null    4
1    null
create table test03(a int, b int) cluster by c;
invalid input: column 'c' doesn't exist in table
create table test04(a int, b int, c varchar(10), unique key(a)) cluster by (b,c,a);
insert into test04 values(11,3,'bb');
insert into test04 values(1,2,'a');
insert into test04 values(2,2,'');
insert into test04 values(3,2,null);
select * from test04;
a    b    c
11    3    bb
1    2    a
2    2    
3    2    null
create table test06(a int, b int, c varchar(10)) cluster by (b,a,c);
insert into test06 select * from test04;
select * from test06;
a    b    c
11    3    bb
1    2    a
2    2    
3    2    null
update test06 set c=null where a=11;
select * from test06;
a    b    c
1    2    a
2    2    
3    2    null
11    3    null
insert into test06 select * from test04;
select * from test06;
a    b    c
1    2    a
2    2    
3    2    null
11    3    null
11    3    bb
1    2    a
2    2    
3    2    null
update test06 set c=a where b=2;
select * from test06;
a    b    c
11    3    null
11    3    bb
1    2    1
2    2    2
3    2    3
1    2    1
2    2    2
3    2    3
create table test05(a int, b int, c varchar(10)) cluster by (b,c,d);
invalid input: column 'd' doesn't exist in table
create temporary table test05(a int, b int, c varchar(10)) cluster by (b,c);
not supported: cluster by with temporary table is not support
show create table test01;
Table    Create Table
test01    CREATE TABLE `test01` (\n`a` INT DEFAULT NULL,\n`b` INT DEFAULT NULL\n) CLUSTER BY (`a`)
show create table test02;
Table    Create Table
test02    CREATE TABLE `test02` (\n`a` INT DEFAULT NULL,\n`b` INT DEFAULT NULL\n) CLUSTER BY (`b`)
show create table test04;
Table    Create Table
test04    CREATE TABLE `test04` (\n`a` INT DEFAULT NULL,\n`b` INT DEFAULT NULL,\n`c` VARCHAR(10) DEFAULT NULL,\nUNIQUE KEY `a` (`a`)\n) CLUSTER BY (`b`, `c`, `a`)
show create table test06;
Table    Create Table
test06    CREATE TABLE `test06` (\n`a` INT DEFAULT NULL,\n`b` INT DEFAULT NULL,\n`c` VARCHAR(10) DEFAULT NULL\n) CLUSTER BY (`b`, `a`, `c`)
desc test01;
Field    Type    Null    Key    Default    Extra    Comment
a    INT(32)    YES        null        
b    INT(32)    YES        null        
desc test02;
Field    Type    Null    Key    Default    Extra    Comment
a    INT(32)    YES        null        
b    INT(32)    YES        null        
desc test04;
Field    Type    Null    Key    Default    Extra    Comment
a    INT(32)    YES        null        
b    INT(32)    YES        null        
c    VARCHAR(10)    YES        null        
desc test06;
Field    Type    Null    Key    Default    Extra    Comment
a    INT(32)    YES        null        
b    INT(32)    YES        null        
c    VARCHAR(10)    YES        null        
drop table test01;
drop table test02;
drop table test04;
drop table test06;
drop table if exists t1;
create table t1(a int, b int, unique key(a), unique key(a, b));
show create table t1;
Table    Create Table
t1    CREATE TABLE `t1` (\n`a` INT DEFAULT NULL,\n`b` INT DEFAULT NULL,\nUNIQUE KEY `a` (`a`),\nUNIQUE KEY `a_2` (`a`,`b`)\n)
drop table if exists t1;
create table t1(a int unique, b int unique key, unique key(a));
show create table t1;
Table    Create Table
t1    CREATE TABLE `t1` (\n`a` INT DEFAULT NULL,\n`b` INT DEFAULT NULL,\nUNIQUE KEY `a` (`a`),\nUNIQUE KEY `b` (`b`),\nUNIQUE KEY `a_2` (`a`)\n)
drop table t1;
drop table if exists t1;
CREATE TABLE t1 (
col1 INT NOT NULL,
col2 DATE NOT NULL unique key,
col3 INT NOT NULL,
col4 INT NOT NULL,
PRIMARY KEY (col1),
unique key col2 (col3)
);
duplicate key name 'col2'
drop table t1;
no such table create_table.t1
drop table if exists t1;
CREATE TABLE t1 (
col1 INT NOT NULL,
col2 DATE NOT NULL,
col3 INT NOT NULL,
col4 INT NOT NULL,
PRIMARY KEY (col1),
unique key idx_sp1 (col2),
unique key idx_sp1 (col3)
);
duplicate key name 'idx_sp1'
drop table t1;
no such table create_table.t1
drop table if exists t1;
CREATE TABLE t1 (
col1 INT NOT NULL,
col2 DATE NOT NULL,
col3 INT NOT NULL,
col4 INT NOT NULL,
PRIMARY KEY (col1),
unique key idx_sp1 (col2),
key idx_sp1 (col3)
);
duplicate key name 'idx_sp1'
drop table t1;
no such table create_table.t1
drop table if exists t1;
CREATE TABLE t1 (
col1 INT NOT NULL,
col2 DATE NOT NULL UNIQUE KEY,
col3 INT NOT NULL,
col4 INT NOT NULL,
PRIMARY KEY (col1),
KEY col2 (col3)
);
duplicate key name 'col2'
drop table t1;
no such table create_table.t1
drop table if exists t1;
CREATE TABLE t1 (
col1 INT NOT NULL KEY,
col2 DATE NOT NULL KEY,
col3 INT NOT NULL,
col4 INT NOT NULL
);
invalid input: more than one primary key defined
drop table t1;
no such table create_table.t1
drop table if exists t2;
CREATE TABLE t2 (
`PRIMARY` INT NOT NULL,
col2 DATE NOT NULL,
col3 INT NOT NULL,
col4 INT NOT NULL,
UNIQUE KEY (`PRIMARY`),
UNIQUE KEY (`PRIMARY`, col3)
);
drop table t2;
create table test (`a` varchar(255) DEFAULT b'0');
insert into test values (), ();
select * from test;
a
0
0
drop table if exists products;
create table products (
pid int not null,
pname varchar(50) not null,
description varchar(20) not null,
price decimal(9,2) not null);
desc products;
Field    Type    Null    Key    Default    Extra    Comment
pid    INT(32)    NO        null        
pname    VARCHAR(50)    NO        null        
description    VARCHAR(20)    NO        null        
price    DECIMAL64(9)    NO        null        
drop table products;
drop database if exists test_creatsql;
create database test_creatsql;
use test_creatsql;
/*comments*/create table /*comments*/ t(a int)/*comments*/;select 1;
select rel_createsql from mo_catalog.mo_tables where relname = 't' and reldatabase = 'test_creatsql';
rel_createsql
create table t (a int)
drop database test_creatsql;
