drop database if exists mv_identity;
create database mv_identity;
use mv_identity;
create table ordinary(a int primary key) comment='matrixone materialized view state';
insert into ordinary values(1);
update ordinary set a=2;
select a=2 as ok from ordinary;
➤ ok[-7,1,0]  𝄀
1
delete from ordinary;
drop table ordinary;
create table spoof(a int) properties('mv_materialized'='true');
invalid input: materialized view properties are reserved
create table __mo_mv_state_spoof(a int);
not supported: table name __mo_mv_state_spoof is reserved for materialized view state
create table src(k int primary key,v int);
insert into src values(7,5);
create materialized view mv refresh complete on demand as select k,sum(v) s from src group by k;
refresh materialized view mv;
select sum(s)=5 as ok from mv;
➤ ok[-7,1,0]  𝄀
1
prepare read_mv from 'select sum(s)=5 as ok from mv';
execute read_mv;
➤ ok[-7,1,0]  𝄀
1
begin;
insert into src values(8,11);
refresh materialized view mv;
select sum(s)=16 as ok from mv;
➤ ok[-7,1,0]  𝄀
1
rollback;
select sum(s)=5 as ok from mv;
➤ ok[-7,1,0]  𝄀
1
select sum(v)=5 as ok from src;
➤ ok[-7,1,0]  𝄀
1
set @source_id=(select rel_id from mo_catalog.mo_tables where reldatabase='mv_identity' and relname='src');
delete from src;
select rel_id=@source_id as ok from mo_catalog.mo_tables where reldatabase='mv_identity' and relname='src';
➤ ok[-7,1,0]  𝄀
1
select sum(s)=5 as ok from mv;
➤ ok[-7,1,0]  𝄀
1
refresh materialized view mv;
select count(*)=0 as ok from mv;
➤ ok[-7,1,0]  𝄀
1
insert into src values(7,5);
refresh materialized view mv;
execute read_mv;
➤ ok[-7,1,0]  𝄀
1
insert into mv values(1,1);
unsupported DML: materialized views can only be written by their refresh
update mv set s=0;
unsupported DML: materialized views can only be written by their refresh
delete from mv;
unsupported DML: materialized views can only be written by their refresh
truncate table mv;
invalid materialized view dependency generation: ALTER, RENAME and TRUNCATE require dropping and recreating the materialized view
alter table mv add column x int;
invalid materialized view dependency generation: ALTER, RENAME and TRUNCATE require dropping and recreating the materialized view
alter table mv rename to other;
invalid materialized view dependency generation: ALTER, RENAME and TRUNCATE require dropping and recreating the materialized view
drop table src;
create table src(k int primary key,v int);
insert into src values(99,99);
select * from mv;
invalid materialized view dependency generation: source mv_identity.src changed; recreate this view
execute read_mv;
invalid materialized view dependency generation: source mv_identity.src changed; recreate this view
refresh materialized view mv;
invalid materialized view dependency generation: source mv_identity.src changed; recreate this view
deallocate prepare read_mv;
drop materialized view mv;
create materialized view mv refresh complete on demand as select k,count(*) c from src group by k;
refresh materialized view mv;
truncate table src;
select * from mv;
invalid materialized view dependency generation: source mv_identity.src changed; recreate this view
refresh materialized view mv;
invalid materialized view dependency generation: source mv_identity.src changed; recreate this view
drop materialized view mv;
create materialized view mv refresh complete on demand as select k,count(*) c from src group by k;
refresh materialized view mv;
alter table src add column x int;
select * from mv;
invalid materialized view dependency generation: source mv_identity.src changed; recreate this view
refresh materialized view mv;
invalid materialized view dependency generation: source mv_identity.src changed; recreate this view
drop materialized view mv;
insert into src(k,v) values(1,10);
create materialized view fast refresh fast on change as select v%2 k,count(*) c,sum(v) s,count(distinct v) d from src group by v%2;
select sum(s)=10 as ok from fast;
➤ ok[-7,1,0]  𝄀
1
alter table src rename to renamed;
select * from fast;
invalid materialized view dependency generation: source mv_identity.src changed; recreate this view
drop materialized view fast;
select count(*)=0 as ok from mo_catalog.mo_iscp_log where json_extract(job_spec,'$.DBName')='mv_identity' and drop_at is null;
➤ ok[-7,1,0]  𝄀
1
select count(*)=0 as ok from mo_catalog.mo_tables where reldatabase='mv_identity' and relname like '__mo_mv_state_%';
➤ ok[-7,1,0]  𝄀
1
drop database mv_identity;
