drop database if exists insert_str_width;
create database insert_str_width;
use insert_str_width;
set @old_sql_mode = @@sql_mode;
create table t (c varchar(3));
set session sql_mode = 'STRICT_TRANS_TABLES';
insert into t values ('abcd');
internal error: Can't cast 'abcd' from VARCHAR type to VARCHAR type. Src length 4 is larger than Dest length 3
insert into t values ('abc   ');
select c, char_length(c) from t;
➤ c[12,-1,0]  ¦  char_length(c)[-5,64,0]  𝄀
abc  ¦  3
set session sql_mode = '';
insert into t values ('wxyz');
select c, char_length(c) from t order by c;
➤ c[12,-1,0]  ¦  char_length(c)[-5,64,0]  𝄀
abc  ¦  3  𝄀
wxy  ¦  3
set session sql_mode = 'STRICT_TRANS_TABLES';
truncate table t;
insert ignore into t values ('abcd');
select c, char_length(c) from t;
➤ c[12,-1,0]  ¦  char_length(c)[-5,64,0]  𝄀
abc  ¦  3
truncate table t;
insert ignore into t values (repeat('x', 4));
select c, char_length(c) from t;
➤ c[12,-1,0]  ¦  char_length(c)[-5,64,0]  𝄀
xxx  ¦  3
truncate table t;
set session sql_mode = 'STRICT_TRANS_TABLES';
prepare stmt_width_lenient from 'insert into t values (''prep'')';
set session sql_mode = '';
execute stmt_width_lenient;
select c, char_length(c) from t;
➤ c[12,-1,0]  ¦  char_length(c)[-5,64,0]  𝄀
pre  ¦  3
deallocate prepare stmt_width_lenient;
truncate table t;
set session sql_mode = '';
prepare stmt_width_strict from 'insert into t values (''fail'')';
set session sql_mode = 'STRICT_TRANS_TABLES';
execute stmt_width_strict;
internal error: Can't cast 'fail' from VARCHAR type to VARCHAR type. Src length 4 is larger than Dest length 3
select count(*) from t;
➤ count(*)[-5,64,0]  𝄀
0
deallocate prepare stmt_width_strict;
create table src (c varchar(10));
insert into src values ('1234567');
truncate table t;
set session sql_mode = 'STRICT_TRANS_TABLES';
insert into t select c from src;
internal error: Can't cast column from VARCHAR type to VARCHAR type because of one or more values in that column. Src length 7 is larger than Dest length 3
set session sql_mode = '';
insert into t select c from src;
select c, char_length(c) from t;
➤ c[12,-1,0]  ¦  char_length(c)[-5,64,0]  𝄀
123  ¦  3
truncate table t;
set session sql_mode = '';
insert into t values ('ab');
set session sql_mode = 'STRICT_TRANS_TABLES';
update t set c = 'abcd';
internal error: Can't cast 'abcd' from VARCHAR type to VARCHAR type. Src length 4 is larger than Dest length 3
set session sql_mode = '';
update t set c = 'abcd';
select c, char_length(c) from t;
➤ c[12,-1,0]  ¦  char_length(c)[-5,64,0]  𝄀
abc  ¦  3
create table p (id int primary key, c varchar(3));
insert into p values (1, 'ab');
set session sql_mode = 'STRICT_TRANS_TABLES';
insert into p values (1, 'xx') on duplicate key update c = 'abcd';
internal error: Can't cast 'abcd' from VARCHAR type to VARCHAR type. Src length 4 is larger than Dest length 3
set session sql_mode = '';
insert into p values (1, 'xx') on duplicate key update c = 'abcd';
select id, c, char_length(c) from p;
➤ id[4,32,0]  ¦  c[12,-1,0]  ¦  char_length(c)[-5,64,0]  𝄀
1  ¦  abc  ¦  3
set session sql_mode = '';
create table d (c varchar(3) default 'abcd');
internal error: Can't cast 'abcd' from VARCHAR type to VARCHAR type. Src length 4 is larger than Dest length 3
set session sql_mode = 'STRICT_TRANS_TABLES';
create table d (c varchar(3) default 'abcd');
internal error: Can't cast 'abcd' from VARCHAR type to VARCHAR type. Src length 4 is larger than Dest length 3
drop database insert_str_width;
set session sql_mode = @old_sql_mode;
select @@sql_mode = @old_sql_mode;
➤ @@sql_mode = @old_sql_mode[-7,1,0]  𝄀
1
