drop database if exists insert_str_width;
create database insert_str_width;
use insert_str_width;
create table t (c varchar(3));
set session sql_mode = 'STRICT_TRANS_TABLES';
insert into t values ('abcd');
internal error: Can't cast 'abcd' to VARCHAR type. Src length 4 is larger than Dest length 3
insert into t values ('abc   ');
select c, char_length(c) from t;
c    char_length(c)
abc    3
set session sql_mode = '';
insert into t values ('wxyz');
select c, char_length(c) from t order by c;
c    char_length(c)
abc    3
wxy    3
set session sql_mode = 'STRICT_TRANS_TABLES';
truncate table t;
insert ignore into t values ('abcd');
select c, char_length(c) from t;
c    char_length(c)
abc    3
create table src (c varchar(10));
insert into src values ('1234567');
truncate table t;
set session sql_mode = 'STRICT_TRANS_TABLES';
insert into t select c from src;
internal error: Can't cast column from VARCHAR type to VARCHAR type because of one or more values in that column. Src length 7 is larger than Dest length 3
set session sql_mode = '';
insert into t select c from src;
select c, char_length(c) from t;
c    char_length(c)
123    3
truncate table t;
set session sql_mode = '';
insert into t values ('ab');
set session sql_mode = 'STRICT_TRANS_TABLES';
update t set c = 'abcd';
internal error: Can't cast 'abcd' from VARCHAR type to VARCHAR type. Src length 4 is larger than Dest length 3
set session sql_mode = '';
update t set c = 'abcd';
select c, char_length(c) from t;
c    char_length(c)
abc    3
create table p (id int primary key, c varchar(3));
insert into p values (1, 'ab');
set session sql_mode = 'STRICT_TRANS_TABLES';
insert into p values (1, 'xx') on duplicate key update c = 'abcd';
internal error: Can't cast 'abcd' from VARCHAR type to VARCHAR type. Src length 4 is larger than Dest length 3
set session sql_mode = '';
insert into p values (1, 'xx') on duplicate key update c = 'abcd';
select id, c, char_length(c) from p;
id    c    char_length(c)
1    abc    3
set session sql_mode = '';
create table d (c varchar(3) default 'abcd');
internal error: Can't cast 'abcd' from VARCHAR type to VARCHAR type. Src length 4 is larger than Dest length 3
set session sql_mode = 'STRICT_TRANS_TABLES';
create table d (c varchar(3) default 'abcd');
internal error: Can't cast 'abcd' from VARCHAR type to VARCHAR type. Src length 4 is larger than Dest length 3
set session sql_mode = 'STRICT_TRANS_TABLES';
drop database insert_str_width;
