DROP DATABASE IF EXISTS integer_assignment_rounding;
CREATE DATABASE integer_assignment_rounding;
USE integer_assignment_rounding;
CREATE TABLE dst(id INT PRIMARY KEY, v BIGINT);
INSERT INTO dst VALUES (1,2.5),(2,-2.5),(3,3.5),(4,-3.5);
SELECT * FROM dst ORDER BY id;
➤ id[4,32,0]  ¦  v[-5,64,0]  𝄀
1  ¦  3  𝄀
2  ¦  -3  𝄀
3  ¦  4  𝄀
4  ¦  -4
INSERT INTO dst VALUES (1,2.5E0),(2,-2.5E0),(3,3.5E0),(4,-3.5E0)
ON DUPLICATE KEY UPDATE v=VALUES(v);
SELECT * FROM dst ORDER BY id;
➤ id[4,32,0]  ¦  v[-5,64,0]  𝄀
1  ¦  2  𝄀
2  ¦  -2  𝄀
3  ¦  4  𝄀
4  ¦  -4
PREPARE p FROM 'INSERT INTO dst VALUES (5,?)';
SET @v=2.5;
EXECUTE p USING @v;
SELECT v FROM dst WHERE id=5;
➤ v[-5,64,0]  𝄀
3
DELETE FROM dst WHERE id=5;
SET @v=CAST(2.5 AS DOUBLE);
EXECUTE p USING @v;
SELECT v FROM dst WHERE id=5;
➤ v[-5,64,0]  𝄀
2
DELETE FROM dst WHERE id=5;
SET @v=CAST(-2.5 AS DECIMAL(5,1));
EXECUTE p USING @v;
SELECT v FROM dst WHERE id=5;
➤ v[-5,64,0]  𝄀
-3
DELETE FROM dst WHERE id=5;
SET @v=7;
EXECUTE p USING @v;
SELECT v FROM dst WHERE id=5;
➤ v[-5,64,0]  𝄀
7
DEALLOCATE PREPARE p;
INSERT INTO dst SELECT 6,CAST(2.5 AS DECIMAL(5,1));
UPDATE dst SET v=CAST(-2.5 AS DOUBLE) WHERE id=6;
SELECT v FROM dst WHERE id=6;
➤ v[-5,64,0]  𝄀
-2
SELECT CAST(2.5 AS SIGNED),CAST(-2.5 AS SIGNED),CAST(2.5E0 AS SIGNED),CAST(-2.5E0 AS SIGNED);
➤ cast(2.5 as signed)[-5,64,0]  ¦  cast(-2.5 as signed)[-5,64,0]  ¦  cast(2.5e0 as signed)[-5,64,0]  ¦  cast(-2.5e0 as signed)[-5,64,0]  𝄀
3  ¦  -3  ¦  2  ¦  -2
CREATE TABLE unsigned_dst(v BIGINT UNSIGNED);
INSERT INTO unsigned_dst VALUES (2.5),(CAST(2.5 AS DECIMAL(30,1))),(CAST(2.5 AS DECIMAL(65,1)));
SELECT v FROM unsigned_dst ORDER BY v;
➤ v[-5,64,0]  𝄀
3  𝄀
3  𝄀
3
CREATE TABLE tiny_unsigned_dst(v TINYINT UNSIGNED);
INSERT INTO tiny_unsigned_dst VALUES (2.5),(255.5);
Data truncation: data out of range: data type TINYINT UNSIGNED, value 256
SELECT COUNT(*) FROM tiny_unsigned_dst;
➤ COUNT(*)[-5,64,0]  𝄀
0
CREATE TABLE no_key_dst(v BIGINT);
INSERT INTO no_key_dst VALUES ((2.5)),((-2.5)) ON DUPLICATE KEY UPDATE v=VALUES(v);
SELECT v FROM no_key_dst ORDER BY v;
➤ v[-5,64,0]  𝄀
-3  𝄀
3
DROP DATABASE integer_assignment_rounding;
