drop database if exists issue_28254_ignore_warnings;
create database issue_28254_ignore_warnings;
use issue_28254_ignore_warnings;
create table uq(id int primary key, v int unique);
insert into uq values (1, 10);
insert ignore into uq values (1, 11), (2, 10), (3, 30);
show warnings;
➤ Level[12,0,0]  ¦  Code[5,0,0]  ¦  Message[12,0,0]  𝄀
Warning  ¦  1062  ¦  Duplicate entry '10' for key 'v'  𝄀
Warning  ¦  1062  ¦  Duplicate entry '1' for key 'id'
select * from uq order by id;
➤ id[4,32,0]  ¦  v[4,32,0]  𝄀
1  ¦  10  𝄀
3  ¦  30
insert ignore into uq values (4, 40), (4, 41), (5, 50), (5, 50);
show warnings;
➤ Level[12,0,0]  ¦  Code[5,0,0]  ¦  Message[12,0,0]  𝄀
Warning  ¦  1062  ¦  Duplicate entry '5' for key 'id'  𝄀
Warning  ¦  1062  ¦  Duplicate entry '4' for key 'id'
select * from uq order by id;
➤ id[4,32,0]  ¦  v[4,32,0]  𝄀
1  ¦  10  𝄀
3  ¦  30  𝄀
4  ¦  40  𝄀
5  ¦  50
create table single_pk(id int primary key);
insert into single_pk values (1);
insert ignore into single_pk values (1), (2), (1);
show warnings;
➤ Level[12,0,0]  ¦  Code[5,0,0]  ¦  Message[12,0,0]  𝄀
Warning  ¦  1062  ¦  Duplicate entry '1' for key 'id'  𝄀
Warning  ¦  1062  ¦  Duplicate entry '1' for key 'id'
select * from single_pk order by id;
➤ id[4,32,0]  𝄀
1  𝄀
2
update ignore uq set v = 10 where id = 3;
show warnings;
➤ Level[12,0,0]  ¦  Code[5,0,0]  ¦  Message[12,0,0]  𝄀
Warning  ¦  1062  ¦  Duplicate entry '10' for key 'v'
select * from uq order by id;
➤ id[4,32,0]  ¦  v[4,32,0]  𝄀
1  ¦  10  𝄀
3  ¦  30  𝄀
4  ¦  40  𝄀
5  ¦  50
update ignore uq set id = 1 where id = 3;
show warnings;
➤ Level[12,0,0]  ¦  Code[5,0,0]  ¦  Message[12,0,0]  𝄀
Warning  ¦  1062  ¦  Duplicate entry '1' for key 'id'
select * from uq order by id;
➤ id[4,32,0]  ¦  v[4,32,0]  𝄀
1  ¦  10  𝄀
3  ¦  30  𝄀
4  ¦  40  𝄀
5  ¦  50
create table ck(
id int primary key,
v int,
constraint ck_pos check(v > 0)
);
insert ignore into ck values (1, -1), (2, 2), (3, -3);
show warnings;
➤ Level[12,0,0]  ¦  Code[5,0,0]  ¦  Message[12,0,0]  𝄀
Warning  ¦  3819  ¦  Check constraint 'ck_pos' is violated  𝄀
Warning  ¦  3819  ¦  Check constraint 'ck_pos' is violated
select * from ck order by id;
➤ id[4,32,0]  ¦  v[4,32,0]  𝄀
2  ¦  2
create table ck_const(
id int primary key,
constraint ck_never check (1 = 0)
);
insert ignore into ck_const values (1), (2), (3);
show warnings;
➤ Level[12,0,0]  ¦  Code[5,0,0]  ¦  Message[12,0,0]  𝄀
Warning  ¦  3819  ¦  Check constraint 'ck_never' is violated  𝄀
Warning  ¦  3819  ¦  Check constraint 'ck_never' is violated  𝄀
Warning  ¦  3819  ¦  Check constraint 'ck_never' is violated
select * from ck_const order by id;
➤ id[4,32,0]
update ignore ck set v = -v;
show warnings;
➤ Level[12,0,0]  ¦  Code[5,0,0]  ¦  Message[12,0,0]  𝄀
Warning  ¦  3819  ¦  Check constraint 'ck_pos' is violated
select * from ck order by id;
➤ id[4,32,0]  ¦  v[4,32,0]  𝄀
2  ¦  2
drop database issue_28254_ignore_warnings;
