drop database if exists mi_skew;
create database mi_skew;
use mi_skew;
create table src (id int primary key, cat int, val bigint, pad varchar(600));
insert into src select result, result % 7, result * 11, repeat('p', 500) from generate_series(1, 300000) g;
select count(*) from src;
➤ count(*)[-5,64,0]  𝄀
300000
create table t_all  (id int primary key, cat int, val bigint, pad varchar(600), unique key uk_val(val), key ik_cat(cat));
create table t_few  (id int primary key, cat int, val bigint, pad varchar(600), unique key uk_val(val));
create table t_one  (id int primary key, cat int, val bigint, pad varchar(600));
create table t_none (id int primary key, cat int, val bigint, pad varchar(600), unique key uk_val(val), key ik_cat(cat));
create table t_else (id int primary key, cat int, val bigint, pad varchar(600));
insert first
when id in (1, 2, 3)   then into t_few  (id, cat, val, pad) values (id, cat, val, pad)
when id = 300000       then into t_one  (id, cat, val, pad) values (id, cat, val, pad)
when id > 0            then into t_all  (id, cat, val, pad) values (id, cat, val, pad)
when id < 0            then into t_none (id, cat, val, pad) values (id, cat, val, pad)
else                        into t_else (id, cat, val, pad) values (id, cat, val, pad)
select id, cat, val, pad from src;
select count(*), min(id), max(id), sum(val) from t_all;
➤ count(*)[-5,64,0]  ¦  min(id)[4,32,0]  ¦  max(id)[4,32,0]  ¦  sum(val)[3,38,0]  𝄀
299996  ¦  4  ¦  299999  ¦  494998349934
select count(*), min(id), max(id) from t_few;
➤ count(*)[-5,64,0]  ¦  min(id)[4,32,0]  ¦  max(id)[4,32,0]  𝄀
3  ¦  1  ¦  3
select count(*), min(id), max(id) from t_one;
➤ count(*)[-5,64,0]  ¦  min(id)[4,32,0]  ¦  max(id)[4,32,0]  𝄀
1  ¦  300000  ¦  300000
select count(*) from t_none;
➤ count(*)[-5,64,0]  𝄀
0
select count(*) from t_else;
➤ count(*)[-5,64,0]  𝄀
0
select (select count(*) from t_all) + (select count(*) from t_few) + (select count(*) from t_one) = 300000 as covers_source_once;
➤ covers_source_once[-7,1,0]  𝄀
1
select count(*) > 0 as has_objects, sum(rows_cnt) from metadata_scan('mi_skew.t_all', 'id') g;
➤ has_objects[-7,1,0]  ¦  sum(rows_cnt)[3,38,0]  𝄀
1  ¦  299996
select count(*) > 0 as has_objects from metadata_scan('mi_skew.t_none', 'id') g;
➤ has_objects[-7,1,0]  𝄀
0
select count(*) > 0 as has_objects from metadata_scan('mi_skew.t_else', 'id') g;
➤ has_objects[-7,1,0]  𝄀
0
select id from t_all where val = 11 * 299997;
➤ id[4,32,0]  𝄀
299997
select count(*) from t_all where cat = 6;
➤ count(*)[-5,64,0]  𝄀
42857
select count(*) from t_none where cat = 6;
➤ count(*)[-5,64,0]  𝄀
0
select count(*) from t_none where val = 11;
➤ count(*)[-5,64,0]  𝄀
0
delete from t_all; delete from t_few; delete from t_one; delete from t_none; delete from t_else;
insert all
when cat >= 0       then into t_all  (id, cat, val, pad) values (id, cat, val, pad)
when cat > 100      then into t_none (id, cat, val, pad) values (id, cat, val, pad)
when pad is null    then into t_few  (id, cat, val, pad) values (id, cat, val, pad)
select id, cat, val, pad from src;
select count(*), sum(val) from t_all;
➤ count(*)[-5,64,0]  ¦  sum(val)[3,38,0]  𝄀
300000  ¦  495001650000
select count(*) from t_none;
➤ count(*)[-5,64,0]  𝄀
0
select count(*) from t_few;
➤ count(*)[-5,64,0]  𝄀
0
select count(*) > 0 as has_objects, sum(rows_cnt) from metadata_scan('mi_skew.t_all', 'id') g;
➤ has_objects[-7,1,0]  ¦  sum(rows_cnt)[3,38,0]  𝄀
1  ¦  300000
select count(*) > 0 as has_objects from metadata_scan('mi_skew.t_none', 'id') g;
➤ has_objects[-7,1,0]  𝄀
0
delete from t_all; delete from t_few; delete from t_one; delete from t_none; delete from t_else;
insert first
when cat < 0  then into t_none (id, cat, val, pad) values (id, cat, val, pad)
when id = 0   then into t_one  (id, cat, val, pad) values (id, cat, val, pad)
else               into t_else (id, cat, val, pad) values (id, cat, val, pad)
select id, cat, val, pad from src;
select count(*), sum(val) from t_else;
➤ count(*)[-5,64,0]  ¦  sum(val)[3,38,0]  𝄀
300000  ¦  495001650000
select count(*) from t_none;
➤ count(*)[-5,64,0]  𝄀
0
select count(*) from t_one;
➤ count(*)[-5,64,0]  𝄀
0
select count(*) > 0 as has_objects, sum(rows_cnt) from metadata_scan('mi_skew.t_else', 'id') g;
➤ has_objects[-7,1,0]  ¦  sum(rows_cnt)[3,38,0]  𝄀
1  ¦  300000
select count(*) > 0 as has_objects from metadata_scan('mi_skew.t_none', 'id') g;
➤ has_objects[-7,1,0]  𝄀
0
delete from t_all; delete from t_few; delete from t_one; delete from t_none; delete from t_else;
insert all
when cat < 0 then into t_all  (id, cat, val, pad) values (id, cat, val, pad)
when id = 0  then into t_none (id, cat, val, pad) values (id, cat, val, pad)
select id, cat, val, pad from src;
select count(*) from t_all;
➤ count(*)[-5,64,0]  𝄀
0
select count(*) from t_none;
➤ count(*)[-5,64,0]  𝄀
0
insert first
when cat < 0 then into t_all (id, cat, val, pad) values (id, cat, val, pad)
select id, cat, val, pad from src;
select count(*) from t_all;
➤ count(*)[-5,64,0]  𝄀
0
insert all
into t_all  (id, cat, val, pad) values (id, cat, val, pad)
into t_none (id, cat, val, pad) values (id, cat, val, pad)
into t_else (id, cat, val, pad) values (id, cat, val, pad)
select id, cat, val, pad from src where id > 1000000;
select count(*) from t_all;
➤ count(*)[-5,64,0]  𝄀
0
select count(*) from t_none;
➤ count(*)[-5,64,0]  𝄀
0
select count(*) from t_else;
➤ count(*)[-5,64,0]  𝄀
0
create table t_narrow (id int primary key, cat int);
insert first
when id = 150000 then into t_all    (id, cat, val, pad) values (id, cat, val, pad)
else                  into t_narrow (id, cat) values (id, cat)
select id, cat, val, pad from src;
select count(*), min(id) from t_all;
➤ count(*)[-5,64,0]  ¦  min(id)[4,32,0]  𝄀
1  ¦  150000
select count(*), sum(cat) from t_narrow;
➤ count(*)[-5,64,0]  ¦  sum(cat)[-5,64,0]  𝄀
299999  ¦  899994
select count(*) > 0 as has_objects, sum(rows_cnt) from metadata_scan('mi_skew.t_narrow', 'id') g;
➤ has_objects[-7,1,0]  ¦  sum(rows_cnt)[3,38,0]  𝄀
1  ¦  299999
delete from t_all; delete from t_narrow;
insert all
when cat >= 0 then into t_all (id, cat, val, pad) values (id, cat, val, pad)
when cat < 0  then into t_all (id, cat, val, pad) values (id + 1000000, cat, val, pad)
select id, cat, val, pad from src;
select count(*), max(id) from t_all;
➤ count(*)[-5,64,0]  ¦  max(id)[4,32,0]  𝄀
300000  ¦  300000
select count(*) > 0 as has_objects, sum(rows_cnt) from metadata_scan('mi_skew.t_all', 'id') g;
➤ has_objects[-7,1,0]  ¦  sum(rows_cnt)[3,38,0]  𝄀
1  ¦  300000
insert into t_none values (7, 0, 77, 'seven');
insert first
when id = 7 then into t_none (id, cat, val, pad) values (id, cat, val, pad)
else             into t_narrow (id, cat) values (id + 1000000, cat)
select id, cat, val, pad from src where id <= 10;
Duplicate entry '7' for key 'id'
select count(*) from t_none;
➤ count(*)[-5,64,0]  𝄀
1
select count(*) from t_narrow where id > 1000000;
➤ count(*)[-5,64,0]  𝄀
0
create table s_src (id int primary key, k int);
insert into s_src values (1, 1), (2, 1), (3, 1), (4, 1), (5, 2);
create table s_a (id int primary key, k int);
create table s_b (id int primary key, k int);
create table s_c (id int primary key, k int);
insert first
when k = 1 then into s_a (id, k) values (id, k)
when k = 2 then into s_b (id, k) values (id, k)
else            into s_c (id, k) values (id, k)
select id, k from s_src;
select * from s_a order by id;
➤ id[4,32,0]  ¦  k[4,32,0]  𝄀
1  ¦  1  𝄀
2  ¦  1  𝄀
3  ¦  1  𝄀
4  ¦  1
select * from s_b order by id;
➤ id[4,32,0]  ¦  k[4,32,0]  𝄀
5  ¦  2
select count(*) from s_c;
➤ count(*)[-5,64,0]  𝄀
0
delete from s_a; delete from s_b;
insert all
when k = 3 then into s_a (id, k) values (id, k)
when k = 4 then into s_b (id, k) values (id, k)
else            into s_c (id, k) values (id, k)
select id, k from s_src;
select count(*) from s_a;
➤ count(*)[-5,64,0]  𝄀
0
select count(*) from s_b;
➤ count(*)[-5,64,0]  𝄀
0
select * from s_c order by id;
➤ id[4,32,0]  ¦  k[4,32,0]  𝄀
1  ¦  1  𝄀
2  ¦  1  𝄀
3  ¦  1  𝄀
4  ¦  1  𝄀
5  ¦  2
delete from s_c;
insert first
when k = 1 then into s_a (id, k) values (id, k)
select id, k from s_src;
select count(*) from s_a;
➤ count(*)[-5,64,0]  𝄀
4
select count(*) from s_b;
➤ count(*)[-5,64,0]  𝄀
0
select count(*) from s_c;
➤ count(*)[-5,64,0]  𝄀
0
drop database mi_skew;
