drop table if exists t_odku_fakepk;
create table t_odku_fakepk (a int, b varchar(20), unique key(a));
insert into t_odku_fakepk values (1, 'x');
insert into t_odku_fakepk values (1, 'y') on duplicate key update b = 'updated';
select * from t_odku_fakepk order by a;
➤ a[4,32,0]  ¦  b[12,-1,0]  𝄀
1  ¦  updated
insert into t_odku_fakepk values (2, 'new') on duplicate key update b = 'z';
select * from t_odku_fakepk order by a;
➤ a[4,32,0]  ¦  b[12,-1,0]  𝄀
1  ¦  updated  𝄀
2  ¦  new
insert into t_odku_fakepk values (1, 'fromvalues') on duplicate key update b = values(b);
select * from t_odku_fakepk order by a;
➤ a[4,32,0]  ¦  b[12,-1,0]  𝄀
1  ¦  fromvalues  𝄀
2  ¦  new
insert into t_odku_fakepk values (1, 'b1'), (3, 'b3'), (2, 'b2')
on duplicate key update b = values(b);
select * from t_odku_fakepk order by a;
➤ a[4,32,0]  ¦  b[12,-1,0]  𝄀
1  ¦  b1  𝄀
2  ¦  b2  𝄀
3  ¦  b3
drop table if exists t_odku_fakepk;
drop table if exists t_odku_fakepk_multi;
create table t_odku_fakepk_multi (a int, b int, c varchar(20), unique key(a, b));
insert into t_odku_fakepk_multi values (1, 1, 'first');
insert into t_odku_fakepk_multi values (1, 1, 'dup') on duplicate key update c = 'merged';
select * from t_odku_fakepk_multi order by a, b;
➤ a[4,32,0]  ¦  b[4,32,0]  ¦  c[12,-1,0]  𝄀
1  ¦  1  ¦  merged
insert into t_odku_fakepk_multi values (1, 2, 'second') on duplicate key update c = 'should_not_apply';
select * from t_odku_fakepk_multi order by a, b;
➤ a[4,32,0]  ¦  b[4,32,0]  ¦  c[12,-1,0]  𝄀
1  ¦  1  ¦  merged  𝄀
1  ¦  2  ¦  second
drop table if exists t_odku_fakepk_multi;
drop table if exists t_odku_nopk;
create table t_odku_nopk (a int, b varchar(20));
insert into t_odku_nopk values (1, 'one');
insert into t_odku_nopk values (1, 'two') on duplicate key update b = 'never';
select * from t_odku_nopk order by a, b;
➤ a[4,32,0]  ¦  b[12,-1,0]  𝄀
1  ¦  one  𝄀
1  ¦  two
drop table if exists t_odku_nopk;
drop table if exists t_odku_child;
drop table if exists t_odku_parent;
create table t_odku_parent (id int primary key, name varchar(20));
create table t_odku_child (
cid int primary key,
pid int,
v int,
foreign key (pid) references t_odku_parent(id)
);
insert into t_odku_parent values (1, 'p1'), (2, 'p2');
insert into t_odku_child values (10, 1, 100);
insert into t_odku_child values (10, 1, 999) on duplicate key update v = 999;
select * from t_odku_child order by cid;
➤ cid[4,32,0]  ¦  pid[4,32,0]  ¦  v[4,32,0]  𝄀
10  ¦  1  ¦  999
insert into t_odku_child values (20, 2, 200) on duplicate key update v = 200;
select * from t_odku_child order by cid;
➤ cid[4,32,0]  ¦  pid[4,32,0]  ¦  v[4,32,0]  𝄀
10  ¦  1  ¦  999  𝄀
20  ¦  2  ¦  200
insert into t_odku_child values (30, 99, 300) on duplicate key update v = 300;
internal error: Cannot add or update a child row: a foreign key constraint fails
select * from t_odku_child order by cid;
➤ cid[4,32,0]  ¦  pid[4,32,0]  ¦  v[4,32,0]  𝄀
10  ¦  1  ¦  999  𝄀
20  ¦  2  ¦  200
insert into t_odku_child values (40, 1, 400);
select * from t_odku_child order by cid;
➤ cid[4,32,0]  ¦  pid[4,32,0]  ¦  v[4,32,0]  𝄀
10  ¦  1  ¦  999  𝄀
20  ¦  2  ¦  200  𝄀
40  ¦  1  ¦  400
insert into t_odku_child values (50, 99, 500);
internal error: Cannot add or update a child row: a foreign key constraint fails
select * from t_odku_child order by cid;
➤ cid[4,32,0]  ¦  pid[4,32,0]  ¦  v[4,32,0]  𝄀
10  ¦  1  ¦  999  𝄀
20  ¦  2  ¦  200  𝄀
40  ¦  1  ¦  400
drop table if exists t_odku_child;
drop table if exists t_odku_parent;
drop table if exists t_odku_realpk;
create table t_odku_realpk (
id int primary key,
uk1 int unique,
uk2 int unique,
val int
);
insert into t_odku_realpk values (1, 10, 100, 1000), (2, 20, 200, 2000);
insert into t_odku_realpk values (1, 99, 999, 5) on duplicate key update val = val + 1;
select * from t_odku_realpk order by id;
➤ id[4,32,0]  ¦  uk1[4,32,0]  ¦  uk2[4,32,0]  ¦  val[4,32,0]  𝄀
1  ¦  10  ¦  100  ¦  1001  𝄀
2  ¦  20  ¦  200  ¦  2000
insert into t_odku_realpk values (3, 10, 888, 5) on duplicate key update val = val + 1;
select * from t_odku_realpk order by id;
➤ id[4,32,0]  ¦  uk1[4,32,0]  ¦  uk2[4,32,0]  ¦  val[4,32,0]  𝄀
1  ¦  10  ¦  100  ¦  1002  𝄀
2  ¦  20  ¦  200  ¦  2000
insert into t_odku_realpk values (4, 10, 200, 5) on duplicate key update val = val + 1;
select * from t_odku_realpk order by id;
➤ id[4,32,0]  ¦  uk1[4,32,0]  ¦  uk2[4,32,0]  ¦  val[4,32,0]  𝄀
1  ¦  10  ¦  100  ¦  1003  𝄀
2  ¦  20  ¦  200  ¦  2000
insert into t_odku_realpk values (2, 10, 222, 5) on duplicate key update val = val + 1;
select * from t_odku_realpk order by id;
➤ id[4,32,0]  ¦  uk1[4,32,0]  ¦  uk2[4,32,0]  ¦  val[4,32,0]  𝄀
1  ¦  10  ¦  100  ¦  1003  𝄀
2  ¦  20  ¦  200  ¦  2001
insert into t_odku_realpk values (5, NULL, NULL, 5) on duplicate key update val = val + 1;
select * from t_odku_realpk order by id;
➤ id[4,32,0]  ¦  uk1[4,32,0]  ¦  uk2[4,32,0]  ¦  val[4,32,0]  𝄀
1  ¦  10  ¦  100  ¦  1003  𝄀
2  ¦  20  ¦  200  ¦  2001  𝄀
5  ¦  null  ¦  null  ¦  5
insert into t_odku_realpk values (20, 77, 701, 5), (21, 77, 702, 5) on duplicate key update val = val + 1;
select * from t_odku_realpk order by id;
➤ id[4,32,0]  ¦  uk1[4,32,0]  ¦  uk2[4,32,0]  ¦  val[4,32,0]  𝄀
1  ¦  10  ¦  100  ¦  1003  𝄀
2  ¦  20  ¦  200  ¦  2001  𝄀
5  ¦  null  ¦  null  ¦  5  𝄀
20  ¦  77  ¦  701  ¦  6
drop table if exists t_odku_realpk;
set experimental_fulltext_index = 1;
drop table if exists t_odku_ft;
create table t_odku_ft(id int primary key, uk int unique, body text, embedding vecf32(3), val int);
insert into t_odku_ft values (1, 10, 'hello world', '[1,2,3]', 100), (2, 20, 'foo bar', '[4,5,6]', 200);
create fulltext index ftidx on t_odku_ft(body);
select id from t_odku_ft where match(body) against('hello') order by id;
➤ id[4,32,0]  𝄀
1
insert into t_odku_ft values (1, 99, 'changed', '[7,8,9]', 5) on duplicate key update val = val + 1;
select id, uk, val from t_odku_ft order by id;
➤ id[4,32,0]  ¦  uk[4,32,0]  ¦  val[4,32,0]  𝄀
1  ¦  10  ¦  101  𝄀
2  ¦  20  ¦  200
select id from t_odku_ft where match(body) against('hello') order by id;
➤ id[4,32,0]  𝄀
1
insert into t_odku_ft values (3, 10, 'new', '[1,1,1]', 5) on duplicate key update val = val + 1;
select id, uk, val from t_odku_ft order by id;
➤ id[4,32,0]  ¦  uk[4,32,0]  ¦  val[4,32,0]  𝄀
1  ¦  10  ¦  102  𝄀
2  ¦  20  ¦  200
select id from t_odku_ft where match(body) against('hello') order by id;
➤ id[4,32,0]  𝄀
1
insert into t_odku_ft values (1, 99, 'ignored', '[9,9,9]', 5), (3, 30, 'fresh token', '[3,3,3]', 300) on duplicate key update val = val + 1;
select id, uk, val from t_odku_ft order by id;
➤ id[4,32,0]  ¦  uk[4,32,0]  ¦  val[4,32,0]  𝄀
1  ¦  10  ¦  103  𝄀
2  ¦  20  ¦  200  𝄀
3  ¦  30  ¦  300
select id from t_odku_ft where match(body) against('hello') order by id;
➤ id[4,32,0]  𝄀
1
select id from t_odku_ft where match(body) against('fresh') order by id;
➤ id[4,32,0]  𝄀
3
drop table if exists t_odku_ft;
drop table if exists t_odku_ft2;
create table t_odku_ft2(id int primary key, body text);
create fulltext index ftidx2 on t_odku_ft2(body);
insert into t_odku_ft2 values (1, 'hello world'), (2, 'foo bar');
insert into t_odku_ft2 values (1, 'ignored') on duplicate key update body = 'alpha beta';
select id, body from t_odku_ft2 order by id;
➤ id[4,32,0]  ¦  body[12,0,0]  𝄀
1  ¦  alpha beta  𝄀
2  ¦  foo bar
select id from t_odku_ft2 where match(body) against('alpha') order by id;
➤ id[4,32,0]  𝄀
1
select id from t_odku_ft2 where match(body) against('hello') order by id;
➤ id[4,32,0]
select id from t_odku_ft2 where match(body) against('foo') order by id;
➤ id[4,32,0]  𝄀
2
begin;
insert into t_odku_ft2 values (1, 'ignored') on duplicate key update body = 'rollback token';
rollback;
select id from t_odku_ft2 where match(body) against('rollback') order by id;
➤ id[4,32,0]
select id from t_odku_ft2 where match(body) against('alpha') order by id;
➤ id[4,32,0]  𝄀
1
insert into t_odku_ft2 values (1, 'ignored') on duplicate key update body = 'alpha beta';
select id from t_odku_ft2 where match(body) against('alpha') order by id;
➤ id[4,32,0]  𝄀
1
insert into t_odku_ft2 values (3, 'gamma delta') on duplicate key update body = 'nope';
select id from t_odku_ft2 where match(body) against('gamma') order by id;
➤ id[4,32,0]  𝄀
3
drop table if exists t_odku_ft2;
drop table if exists t_odku_ft_value_noop;
create table t_odku_ft_value_noop(id int primary key, body text, payload int);
create fulltext index ftidx_value_noop on t_odku_ft_value_noop(body);
insert into t_odku_ft_value_noop values (1, 'same posting', 10), (2, 'untouched token', 20);
insert into t_odku_ft_value_noop values (1, 'same posting', 11) on duplicate key update body = values(body), payload = values(payload);
select id, body, payload from t_odku_ft_value_noop order by id;
➤ id[4,32,0]  ¦  body[12,0,0]  ¦  payload[4,32,0]  𝄀
1  ¦  same posting  ¦  11  𝄀
2  ¦  untouched token  ¦  20
insert into t_odku_ft_value_noop values (1, 'same posting', 12), (3, 'fresh token', 30) on duplicate key update body = values(body), payload = values(payload);
select id, body, payload from t_odku_ft_value_noop order by id;
➤ id[4,32,0]  ¦  body[12,0,0]  ¦  payload[4,32,0]  𝄀
1  ¦  same posting  ¦  12  𝄀
2  ¦  untouched token  ¦  20  𝄀
3  ¦  fresh token  ¦  30
select id from t_odku_ft_value_noop where match(body) against('same') order by id;
➤ id[4,32,0]  𝄀
1
select id from t_odku_ft_value_noop where match(body) against('untouched') order by id;
➤ id[4,32,0]  𝄀
2
select id from t_odku_ft_value_noop where match(body) against('fresh') order by id;
➤ id[4,32,0]  𝄀
3
drop table if exists t_odku_ft_value_noop;
drop table if exists t_odku_ft_nulls;
create table t_odku_ft_nulls(id int primary key, body text);
insert into t_odku_ft_nulls values (1, NULL), (2, 'oldtoken');
create fulltext index ftidx_nulls on t_odku_ft_nulls(body);
insert into t_odku_ft_nulls values (1, NULL) on duplicate key update body = values(body);
select id, body from t_odku_ft_nulls order by id;
➤ id[4,32,0]  ¦  body[12,0,0]  𝄀
1  ¦  null  𝄀
2  ¦  oldtoken
insert into t_odku_ft_nulls values (1, 'newtoken') on duplicate key update body = values(body);
select id from t_odku_ft_nulls where match(body) against('newtoken') order by id;
➤ id[4,32,0]  𝄀
1
insert into t_odku_ft_nulls values (2, NULL) on duplicate key update body = values(body);
select id from t_odku_ft_nulls where match(body) against('oldtoken') order by id;
➤ id[4,32,0]
select id, body from t_odku_ft_nulls order by id;
➤ id[4,32,0]  ¦  body[12,0,0]  𝄀
1  ¦  newtoken  𝄀
2  ¦  null
drop table if exists t_odku_ft_nulls;
drop table if exists t_odku_ft_multi;
create table t_odku_ft_multi(id int primary key, title text, body text, payload int);
insert into t_odku_ft_multi values (1, 'alpha title', 'beta body', 10), (2, 'stable title', 'stable body', 20);
create fulltext index ftidx_multi on t_odku_ft_multi(title, body);
insert into t_odku_ft_multi values (1, 'alpha title', 'beta body', 11) on duplicate key update title = values(title), body = values(body), payload = values(payload);
select id, title, body, payload from t_odku_ft_multi order by id;
➤ id[4,32,0]  ¦  title[12,0,0]  ¦  body[12,0,0]  ¦  payload[4,32,0]  𝄀
1  ¦  alpha title  ¦  beta body  ¦  11  𝄀
2  ¦  stable title  ¦  stable body  ¦  20
select id from t_odku_ft_multi where match(title, body) against('beta') order by id;
➤ id[4,32,0]  𝄀
1
insert into t_odku_ft_multi values (1, 'alpha title', 'gamma body', 12) on duplicate key update title = values(title), body = values(body), payload = values(payload);
select id from t_odku_ft_multi where match(title, body) against('alpha') order by id;
➤ id[4,32,0]  𝄀
1
select id from t_odku_ft_multi where match(title, body) against('beta') order by id;
➤ id[4,32,0]
select id from t_odku_ft_multi where match(title, body) against('gamma') order by id;
➤ id[4,32,0]  𝄀
1
drop table if exists t_odku_ft_multi;
drop table if exists t_odku_vec;
create table t_odku_vec(id int primary key, uk int unique, embedding vecf32(3), val int);
insert into t_odku_vec values (1, 10, '[1,2,3]', 100), (2, 20, '[4,5,6]', 200);
create index idx_vec using ivfflat on t_odku_vec(embedding) lists = 2 op_type 'vector_l2_ops';
insert into t_odku_vec values (1, 99, '[7,8,9]', 5) on duplicate key update val = val + 1;
select id, uk, val from t_odku_vec order by id;
➤ id[4,32,0]  ¦  uk[4,32,0]  ¦  val[4,32,0]  𝄀
1  ¦  10  ¦  101  𝄀
2  ¦  20  ¦  200
insert into t_odku_vec values (3, 10, '[1,1,1]', 5) on duplicate key update val = val + 1;
select id, uk, val from t_odku_vec order by id;
➤ id[4,32,0]  ¦  uk[4,32,0]  ¦  val[4,32,0]  𝄀
1  ¦  10  ¦  102  𝄀
2  ¦  20  ¦  200
insert into t_odku_vec values (4, 40, '[2,2,2]', 400) on duplicate key update val = val + 1;
select id, uk, val from t_odku_vec order by id;
➤ id[4,32,0]  ¦  uk[4,32,0]  ¦  val[4,32,0]  𝄀
1  ¦  10  ¦  102  𝄀
2  ¦  20  ¦  200  𝄀
4  ¦  40  ¦  400
drop table if exists t_odku_vec;
drop table if exists t_odku_vec2;
create table t_odku_vec2(id int primary key, embedding vecf32(3));
insert into t_odku_vec2 values (1, '[1,1,1]'), (2, '[9,9,9]');
create index idx2 using ivfflat on t_odku_vec2(embedding) lists = 2 op_type 'vector_l2_ops';
insert into t_odku_vec2 values (1, '[0,0,0]') on duplicate key update embedding = '[100,100,100]';
select id, embedding from t_odku_vec2 order by id;
➤ id[4,32,0]  ¦  embedding[12,3,0]  𝄀
1  ¦  [100, 100, 100]  𝄀
2  ¦  [9, 9, 9]
select id from t_odku_vec2 order by l2_distance(embedding, '[100,100,100]') asc limit 1;
➤ id[4,32,0]  𝄀
1
select id from t_odku_vec2 order by l2_distance(embedding, '[1,1,1]') asc limit 1;
➤ id[4,32,0]  𝄀
2
drop table if exists t_odku_vec2;
drop table if exists t_odku_prefix;
create table t_odku_prefix(id int primary key, body varchar(64), v int, unique key u(body(4)));
insert into t_odku_prefix values (1, 'abcdxxxx', 10);
insert into t_odku_prefix values (2, 'abcdyyyy', 20) on duplicate key update v = v + 100;
select id, body, v from t_odku_prefix order by id;
➤ id[4,32,0]  ¦  body[12,-1,0]  ¦  v[4,32,0]  𝄀
1  ¦  abcdxxxx  ¦  110
insert into t_odku_prefix values (3, 'wxyzzzzz', 30) on duplicate key update v = v + 100;
select id, body, v from t_odku_prefix order by id;
➤ id[4,32,0]  ¦  body[12,-1,0]  ¦  v[4,32,0]  𝄀
1  ¦  abcdxxxx  ¦  110  𝄀
3  ¦  wxyzzzzz  ¦  30
drop table if exists t_odku_prefix;
drop table if exists t_odku_fk_child;
drop table if exists t_odku_fk_parent;
create table t_odku_fk_parent(pid int primary key, pname varchar(20));
create table t_odku_fk_child(
cid int primary key,
pid int,
val int not null,
constraint ck_odku_fk_action check(val >= 0),
foreign key(pid) references t_odku_fk_parent(pid)
);
insert into t_odku_fk_parent values (1, 'P1'), (2, 'P2');
insert into t_odku_fk_child values (1, 1, 100);
set foreign_key_checks=0;
insert into t_odku_fk_child values (2, 99, 200);
insert into t_odku_fk_child values (1, 999, 100)
on duplicate key update val = values(val);
select cid, pid, val from t_odku_fk_child where cid = 1;
➤ cid[4,32,0]  ¦  pid[4,32,0]  ¦  val[4,32,0]  𝄀
1  ¦  1  ¦  100
insert into t_odku_fk_child values (1, 999, -1)
on duplicate key update val = values(val);
constraint violation: Check constraint 'ck_odku_fk_action' is violated
select cid, pid, val from t_odku_fk_child where cid = 1;
➤ cid[4,32,0]  ¦  pid[4,32,0]  ¦  val[4,32,0]  𝄀
1  ¦  1  ¦  100
insert into t_odku_fk_child values (1, 999, 102)
on duplicate key update val = if(values(val) = 102, null, values(val));
constraint violation: Column 'val' cannot be null
select cid, pid, val from t_odku_fk_child where cid = 1;
➤ cid[4,32,0]  ¦  pid[4,32,0]  ¦  val[4,32,0]  𝄀
1  ¦  1  ¦  100
set foreign_key_checks=1;
insert into t_odku_fk_child values (2, 99, 0) on duplicate key update val = val;
select row_count(), cid, pid, val from t_odku_fk_child where cid = 2;
➤ row_count()[-5,64,0]  ¦  cid[4,32,0]  ¦  pid[4,32,0]  ¦  val[4,32,0]  𝄀
1  ¦  2  ¦  99  ¦  200
insert into t_odku_fk_child values (2, 99, 0) on duplicate key update pid = pid;
select row_count(), cid, pid, val from t_odku_fk_child where cid = 2;
➤ row_count()[-5,64,0]  ¦  cid[4,32,0]  ¦  pid[4,32,0]  ¦  val[4,32,0]  𝄀
1  ¦  2  ¦  99  ¦  200
insert into t_odku_fk_child values (2, 99, 0) on duplicate key update val = val + 1;
select row_count(), cid, pid, val from t_odku_fk_child where cid = 2;
➤ row_count()[-5,64,0]  ¦  cid[4,32,0]  ¦  pid[4,32,0]  ¦  val[4,32,0]  𝄀
2  ¦  2  ¦  99  ¦  201
insert into t_odku_fk_child values (2, 99, 0), (4, 2, 400) on duplicate key update val = val;
select row_count(), cid, pid, val from t_odku_fk_child order by cid;
➤ row_count()[-5,64,0]  ¦  cid[4,32,0]  ¦  pid[4,32,0]  ¦  val[4,32,0]  𝄀
2  ¦  1  ¦  1  ¦  100  𝄀
2  ¦  2  ¦  99  ¦  201  𝄀
2  ¦  4  ¦  2  ¦  400
insert into t_odku_fk_child values (1, 1, 5) on duplicate key update val = val + 1;
select cid, pid, val from t_odku_fk_child order by cid;
➤ cid[4,32,0]  ¦  pid[4,32,0]  ¦  val[4,32,0]  𝄀
1  ¦  1  ¦  101  𝄀
2  ¦  99  ¦  201  𝄀
4  ¦  2  ¦  400
insert into t_odku_fk_child values (1, 1, 5) on duplicate key update pid = 999;
internal error: Cannot add or update a child row: a foreign key constraint fails
insert into t_odku_fk_child values (3, 888, 1) on duplicate key update val = val + 1;
internal error: Cannot add or update a child row: a foreign key constraint fails
select cid, pid, val from t_odku_fk_child order by cid;
➤ cid[4,32,0]  ¦  pid[4,32,0]  ¦  val[4,32,0]  𝄀
1  ¦  1  ¦  101  𝄀
2  ¦  99  ¦  201  𝄀
4  ¦  2  ¦  400
insert into t_odku_fk_child values (2, 99, 0) on duplicate key update pid = 2;
select row_count(), cid, pid, val from t_odku_fk_child where cid = 2;
➤ row_count()[-5,64,0]  ¦  cid[4,32,0]  ¦  pid[4,32,0]  ¦  val[4,32,0]  𝄀
2  ¦  2  ¦  2  ¦  201
insert into t_odku_fk_child values (1, 999, 0), (1, 1, 0)
on duplicate key update pid = values(pid);
internal error: Cannot add or update a child row: a foreign key constraint fails
select cid, pid, val from t_odku_fk_child where cid = 1;
➤ cid[4,32,0]  ¦  pid[4,32,0]  ¦  val[4,32,0]  𝄀
1  ¦  1  ¦  101
insert into t_odku_fk_child values (5, 999, 0), (5, 1, 0)
on duplicate key update pid = values(pid);
internal error: Cannot add or update a child row: a foreign key constraint fails
select count(*) from t_odku_fk_child where cid = 5;
➤ count(*)[5,64,0]  𝄀
0
drop table if exists t_odku_fk_child;
drop table if exists t_odku_fk_parent;
drop table if exists t_odku_action_check;
create table t_odku_action_check(id int primary key, v int, constraint ck_action check(v >= 0));
insert into t_odku_action_check values (1, 1);
insert into t_odku_action_check values (1, -1), (1, 2)
on duplicate key update v = values(v);
constraint violation: Check constraint 'ck_action' is violated
select * from t_odku_action_check;
➤ id[4,32,0]  ¦  v[4,32,0]  𝄀
1  ¦  1
insert into t_odku_action_check values (2, -1), (2, 2)
on duplicate key update v = values(v);
constraint violation: Check constraint 'ck_action' is violated
select count(*) from t_odku_action_check where id = 2;
➤ count(*)[5,64,0]  𝄀
0
insert into t_odku_action_check values (1, 3), (1, 4)
on duplicate key update v = values(v);
select * from t_odku_action_check;
➤ id[4,32,0]  ¦  v[4,32,0]  𝄀
1  ¦  4
drop table t_odku_action_check;
drop table if exists t_odku_final_insert_check;
create table t_odku_final_insert_check(
id int primary key,
pid int,
v int,
constraint ck_final_insert_pid check(pid > 0),
constraint ck_final_insert_v check(v >= 0)
);
insert into t_odku_final_insert_check values (1, -1, 0), (1, 10, 1)
on duplicate key update v = values(v);
constraint violation: Check constraint 'ck_final_insert_pid' is violated
select count(*) from t_odku_final_insert_check;
➤ count(*)[5,64,0]  𝄀
0
insert into t_odku_final_insert_check values (2, 1, 0), (2, 10, 1)
on duplicate key update v = values(v);
select id, pid, v from t_odku_final_insert_check;
➤ id[4,32,0]  ¦  pid[4,32,0]  ¦  v[4,32,0]  𝄀
2  ¦  1  ¦  1
drop table t_odku_final_insert_check;
drop table if exists t_odku_final_insert_fk_child;
drop table if exists t_odku_final_insert_fk_parent;
create table t_odku_final_insert_fk_parent(id int primary key);
create table t_odku_final_insert_fk_child(
id int primary key,
pid int,
v int,
constraint ck_final_insert_fk_v check(v >= 0),
foreign key(pid) references t_odku_final_insert_fk_parent(id)
);
insert into t_odku_final_insert_fk_parent values (1);
insert into t_odku_final_insert_fk_child values (1, 999, 0), (1, 1, 1)
on duplicate key update v = values(v);
internal error: Cannot add or update a child row: a foreign key constraint fails
select count(*) from t_odku_final_insert_fk_child;
➤ count(*)[5,64,0]  𝄀
0
insert into t_odku_final_insert_fk_child values (2, 1, 0), (2, 999, 1)
on duplicate key update v = values(v);
select id, pid, v from t_odku_final_insert_fk_child;
➤ id[4,32,0]  ¦  pid[4,32,0]  ¦  v[4,32,0]  𝄀
2  ¦  1  ¦  1
drop table t_odku_final_insert_fk_child;
drop table t_odku_final_insert_fk_parent;
drop table if exists t_ign_fk_child;
drop table if exists t_ign_fk_parent;
create table t_ign_fk_parent(pid int primary key, pname varchar(20));
create table t_ign_fk_child(cid int primary key, pid int, foreign key(pid) references t_ign_fk_parent(pid));
insert into t_ign_fk_parent values (1, 'P1'), (2, 'P2'), (3, 'P3');
insert ignore into t_ign_fk_child values (10, 1), (11, 2), (12, 4), (13, 1), (14, NULL);
select cid, pid from t_ign_fk_child order by cid;
➤ cid[4,32,0]  ¦  pid[4,32,0]  𝄀
10  ¦  1  𝄀
11  ¦  2  𝄀
13  ¦  1  𝄀
14  ¦  null
drop table if exists t_ign_fk_child;
drop table if exists t_ign_fk_parent;
drop table if exists t_odku_mfk_child;
drop table if exists t_odku_mfk_p1;
drop table if exists t_odku_mfk_p2;
create table t_odku_mfk_p1(id int primary key);
create table t_odku_mfk_p2(id int primary key);
create table t_odku_mfk_child(cid int primary key, a int, b int, foreign key(a) references t_odku_mfk_p1(id), foreign key(b) references t_odku_mfk_p2(id));
insert into t_odku_mfk_p1 values (1);
insert into t_odku_mfk_p2 values (1);
insert into t_odku_mfk_child values (1, 1, 1);
insert into t_odku_mfk_child values (1, 1, 1) on duplicate key update a = NULL, b = 999;
internal error: Cannot add or update a child row: a foreign key constraint fails
insert into t_odku_mfk_child values (1, 1, 1) on duplicate key update a = NULL, b = 1;
select cid, a, b from t_odku_mfk_child order by cid;
➤ cid[4,32,0]  ¦  a[4,32,0]  ¦  b[4,32,0]  𝄀
1  ¦  null  ¦  1
drop table if exists t_odku_mfk_child;
drop table if exists t_odku_mfk_p1;
drop table if exists t_odku_mfk_p2;
drop table if exists t_odku_onupdate;
create table t_odku_onupdate (
id int primary key,
v int,
updated_at timestamp default current_timestamp on update current_timestamp
);
insert into t_odku_onupdate(id, v) values (1, 10);
set @ts0 = (select updated_at from t_odku_onupdate where id = 1);
select sleep(2);
➤ sleep(2)[-6,8,0]  𝄀
0
insert into t_odku_onupdate(id, v) values (1, 10) on duplicate key update v = v;
select updated_at = @ts0 as ts_unchanged from t_odku_onupdate where id = 1;
➤ ts_unchanged[-7,1,0]  𝄀
1
insert into t_odku_onupdate(id, v) values (1, 99) on duplicate key update v = values(v);
select v, updated_at > @ts0 as ts_advanced from t_odku_onupdate where id = 1;
➤ v[4,32,0]  ¦  ts_advanced[-7,1,0]  𝄀
99  ¦  1
drop table if exists t_odku_onupdate;
drop table if exists t_odku_char_pad;
drop table if exists t_odku_json_equal;
create table t_odku_json_equal (
id int primary key,
j json,
updated_at timestamp default '2000-01-01 00:00:00' on update current_timestamp
);
insert into t_odku_json_equal values (1, '1', '2000-01-01 00:00:00');
insert into t_odku_json_equal(id, j) values (1, '1.0')
on duplicate key update j = values(j);
select row_count(), json_type(j), updated_at = '2000-01-01 00:00:00' as auto_unchanged
from t_odku_json_equal;
➤ row_count()[-5,64,0]  ¦  json_type(j)[12,-1,0]  ¦  auto_unchanged[-7,1,0]  𝄀
1  ¦  INTEGER  ¦  1
drop table t_odku_json_equal;
create table t_odku_char_pad (
id int primary key,
c char(4),
v varchar(4),
updated_at timestamp default '2000-01-01 00:00:00' on update current_timestamp
);
insert into t_odku_char_pad values (1, 'a', 'a', '2000-01-01 00:00:00');
insert into t_odku_char_pad(id, c, v) values (1, 'a   ', 'zzzz')
on duplicate key update c = values(c);
select row_count(), hex(c), hex(v), updated_at = '2000-01-01 00:00:00' as auto_unchanged
from t_odku_char_pad;
➤ row_count()[-5,64,0]  ¦  hex(c)[12,-1,0]  ¦  hex(v)[12,-1,0]  ¦  auto_unchanged[-7,1,0]  𝄀
1  ¦  61  ¦  61  ¦  1
insert into t_odku_char_pad(id, c, v) values (1, 'zzzz', 'a ')
on duplicate key update v = values(v);
select row_count(), hex(c), hex(v), updated_at > '2000-01-01 00:00:00' as auto_updated
from t_odku_char_pad;
➤ row_count()[-5,64,0]  ¦  hex(c)[12,-1,0]  ¦  hex(v)[12,-1,0]  ¦  auto_updated[-7,1,0]  𝄀
2  ¦  61  ¦  6120  ¦  1
drop table if exists t_odku_char_pad;
drop table if exists t_odku_onupdate_check;
create table t_odku_onupdate_check (
id int primary key,
v int,
updated_at timestamp default '2000-01-01 00:00:00' on update current_timestamp,
constraint chk_old_timestamp check (updated_at < '2020-01-01 00:00:00')
);
insert into t_odku_onupdate_check(id, v) values (1, 10);
insert into t_odku_onupdate_check(id, v) values (1, 10) on duplicate key update v = v;
select row_count(), id, v, updated_at from t_odku_onupdate_check order by id;
➔ row_count()[-5,64,0]  ¦  id[4,32,0]  ¦  v[4,32,0]  ¦  updated_at[13,0,0]  𝄀
1  ¦  1  ¦  10  ¦  2000-01-01 00:00:00
insert into t_odku_onupdate_check(id, v) values (1, 10), (2, 20) on duplicate key update v = v;
select row_count(), id, v, updated_at from t_odku_onupdate_check order by id;
➔ row_count()[-5,64,0]  ¦  id[4,32,0]  ¦  v[4,32,0]  ¦  updated_at[13,0,0]  𝄀
2  ¦  1  ¦  10  ¦  2000-01-01 00:00:00  𝄀
2  ¦  2  ¦  20  ¦  2000-01-01 00:00:00
insert into t_odku_onupdate_check(id, v) values (1, 11) on duplicate key update v = values(v);
constraint violation: Check constraint 'chk_old_timestamp' is violated
select id, v, updated_at from t_odku_onupdate_check order by id;
➔ id[4,32,0]  ¦  v[4,32,0]  ¦  updated_at[13,0,0]  𝄀
1  ¦  10  ¦  2000-01-01 00:00:00  𝄀
2  ¦  20  ¦  2000-01-01 00:00:00
drop table if exists t_odku_onupdate_check;
drop table if exists t_odku_onupdate_gen;
create table t_odku_onupdate_gen (
id int primary key,
v int,
updated_at timestamp default current_timestamp on update current_timestamp,
g timestamp as (updated_at) stored
);
insert into t_odku_onupdate_gen(id, v) values (1, 10);
set @g0 = (select g from t_odku_onupdate_gen where id = 1);
select sleep(2);
➤ sleep(2)[-6,8,0]  𝄀
0
insert into t_odku_onupdate_gen(id, v) values (1, 10) on duplicate key update v = v;
select updated_at = @g0 as ts_unchanged, g = @g0 as g_unchanged from t_odku_onupdate_gen where id = 1;
➤ ts_unchanged[-7,1,0]  ¦  g_unchanged[-7,1,0]  𝄀
1  ¦  1
insert into t_odku_onupdate_gen(id, v) values (1, 99) on duplicate key update v = values(v);
select v, g > @g0 as g_advanced from t_odku_onupdate_gen where id = 1;
➤ v[4,32,0]  ¦  g_advanced[-7,1,0]  𝄀
99  ¦  1
drop table if exists t_odku_onupdate_gen;
drop table if exists t_odku_null_unique;
create table t_odku_null_unique (a int unique key, b int);
insert into t_odku_null_unique values (null, null) on duplicate key update b = values(b);
select count(*) as after_first from t_odku_null_unique;
➤ after_first[-5,64,0]  𝄀
1
insert into t_odku_null_unique values (null, null) on duplicate key update b = values(b);
select count(*) as after_second from t_odku_null_unique;
➤ after_second[-5,64,0]  𝄀
2
select a, b from t_odku_null_unique;
➤ a[4,32,0]  ¦  b[4,32,0]  𝄀
null  ¦  null  𝄀
null  ¦  null
insert into t_odku_null_unique values (1, 10) on duplicate key update b = values(b);
insert into t_odku_null_unique values (1, 20) on duplicate key update b = values(b);
select a, b from t_odku_null_unique where a = 1;
➤ a[4,32,0]  ¦  b[4,32,0]  𝄀
1  ¦  20
insert into t_odku_null_unique values (1, 20) on duplicate key update b = values(b);
select a, b from t_odku_null_unique where a = 1;
➤ a[4,32,0]  ¦  b[4,32,0]  𝄀
1  ¦  20
drop table if exists t_odku_null_unique;
drop table if exists t_odku_sec_uk;
create table t_odku_sec_uk (
id int primary key,
u int unique,
v int,
updated_at timestamp default current_timestamp on update current_timestamp
);
insert into t_odku_sec_uk(id, u, v) values (1, 10, 5);
set @ts_sec = (select updated_at from t_odku_sec_uk where u = 10);
select sleep(2);
➤ sleep(2)[-6,8,0]  𝄀
0
insert into t_odku_sec_uk(id, u, v) values (2, 10, 99) on duplicate key update v = v;
select id, u, v, updated_at = @ts_sec as ts_unchanged from t_odku_sec_uk order by id;
➤ id[4,32,0]  ¦  u[4,32,0]  ¦  v[4,32,0]  ¦  ts_unchanged[-7,1,0]  𝄀
1  ¦  10  ¦  5  ¦  1
insert into t_odku_sec_uk(id, u, v) values (3, 10, 5) on duplicate key update v = v + 1;
select id, u, v, updated_at > @ts_sec as ts_advanced from t_odku_sec_uk order by id;
➤ id[4,32,0]  ¦  u[4,32,0]  ¦  v[4,32,0]  ¦  ts_advanced[-7,1,0]  𝄀
1  ¦  10  ¦  6  ¦  1
drop table if exists t_odku_sec_uk;
drop table if exists t_odku_fk_uk_child;
drop table if exists t_odku_fk_uk_parent;
drop table if exists t_odku_order_count;
create table t_odku_order_count(id int primary key, a int, b int);
insert into t_odku_order_count values (1, 10, 20);
insert into t_odku_order_count values (1, 100, 200)
on duplicate key update a = a + 1, b = a;
select row_count(), id, a, b from t_odku_order_count;
➤ row_count()[-5,64,0]  ¦  id[4,32,0]  ¦  a[4,32,0]  ¦  b[4,32,0]  𝄀
2  ¦  1  ¦  11  ¦  11
update t_odku_order_count set a = 10, b = 20 where id = 1;
insert into t_odku_order_count values (1, 100, 200)
on duplicate key update a = a + 1, a = a + 1;
select row_count(), id, a, b from t_odku_order_count;
➤ row_count()[-5,64,0]  ¦  id[4,32,0]  ¦  a[4,32,0]  ¦  b[4,32,0]  𝄀
2  ¦  1  ¦  12  ¦  20
drop table t_odku_order_count;
drop table if exists t_odku_repeat_count;
create table t_odku_repeat_count(id int primary key, v int, key iv(v));
insert into t_odku_repeat_count values (1, 10);
insert into t_odku_repeat_count values (1, 11), (1, 12), (1, 13)
on duplicate key update v = values(v);
select row_count(), id, v from t_odku_repeat_count;
➤ row_count()[-5,64,0]  ¦  id[4,32,0]  ¦  v[4,32,0]  𝄀
6  ¦  1  ¦  13
truncate table t_odku_repeat_count;
insert into t_odku_repeat_count values (1, 11), (1, 12), (1, 13)
on duplicate key update v = values(v);
select row_count(), id, v from t_odku_repeat_count;
➤ row_count()[-5,64,0]  ¦  id[4,32,0]  ¦  v[4,32,0]  𝄀
5  ¦  1  ¦  13
truncate table t_odku_repeat_count;
insert into t_odku_repeat_count values (1, 10);
insert into t_odku_repeat_count values (1, 11), (1, 10)
on duplicate key update v = values(v);
select row_count(), id, v from t_odku_repeat_count;
➤ row_count()[-5,64,0]  ¦  id[4,32,0]  ¦  v[4,32,0]  𝄀
4  ¦  1  ¦  10
insert into t_odku_repeat_count values (1, 10)
on duplicate key update v = values(v);
select row_count(), id, v from t_odku_repeat_count;
➤ row_count()[-5,64,0]  ¦  id[4,32,0]  ¦  v[4,32,0]  𝄀
1  ¦  1  ¦  10
select count(*) from t_odku_repeat_count force index(iv) where v = 10;
➤ count(*)[-5,64,0]  𝄀
1
drop table t_odku_repeat_count;
drop table if exists t_odku_statement_keys;
create table t_odku_statement_keys(id int primary key, u int unique, v int);
insert into t_odku_statement_keys values (1, 10, 1), (1, 11, 2)
on duplicate key update v = values(v);
select row_count(), id, u, v from t_odku_statement_keys order by id;
➤ row_count()[-5,64,0]  ¦  id[4,32,0]  ¦  u[4,32,0]  ¦  v[4,32,0]  𝄀
3  ¦  1  ¦  10  ¦  2
truncate table t_odku_statement_keys;
insert into t_odku_statement_keys values (1, 10, 1), (2, 10, 2)
on duplicate key update v = values(v);
select row_count(), id, u, v from t_odku_statement_keys order by id;
➤ row_count()[-5,64,0]  ¦  id[4,32,0]  ¦  u[4,32,0]  ¦  v[4,32,0]  𝄀
3  ¦  1  ¦  10  ¦  2
truncate table t_odku_statement_keys;
insert into t_odku_statement_keys values (1, 10, 1), (2, 10, 2), (2, 20, 3)
on duplicate key update v = values(v);
select row_count(), id, u, v from t_odku_statement_keys order by id;
➤ row_count()[-5,64,0]  ¦  id[4,32,0]  ¦  u[4,32,0]  ¦  v[4,32,0]  𝄀
4  ¦  1  ¦  10  ¦  2  𝄀
4  ¦  2  ¦  20  ¦  3
truncate table t_odku_statement_keys;
insert into t_odku_statement_keys values (1, 10, 1), (2, 20, 2);
insert into t_odku_statement_keys values (1, 20, 99)
on duplicate key update v = values(v);
select row_count(), id, u, v from t_odku_statement_keys order by id;
➤ row_count()[-5,64,0]  ¦  id[4,32,0]  ¦  u[4,32,0]  ¦  v[4,32,0]  𝄀
2  ¦  1  ¦  10  ¦  99  𝄀
2  ¦  2  ¦  20  ¦  2
drop table t_odku_statement_keys;
drop table if exists t_odku_statement_fake_pk;
create table t_odku_statement_fake_pk(u int unique, v int);
insert into t_odku_statement_fake_pk values (10, 1), (10, 2)
on duplicate key update v = values(v);
select row_count(), u, v from t_odku_statement_fake_pk;
➤ row_count()[-5,64,0]  ¦  u[4,32,0]  ¦  v[4,32,0]  𝄀
3  ¦  10  ¦  2
drop table t_odku_statement_fake_pk;
drop table if exists t_odku_statement_composite;
create table t_odku_statement_composite(
id int primary key,
a int,
b int,
v int,
unique key uk_ab(a, b)
);
insert into t_odku_statement_composite values (1, 10, 20, 1), (2, 10, 20, 2)
on duplicate key update v = values(v);
select row_count(), id, a, b, v from t_odku_statement_composite;
➤ row_count()[-5,64,0]  ¦  id[4,32,0]  ¦  a[4,32,0]  ¦  b[4,32,0]  ¦  v[4,32,0]  𝄀
3  ¦  1  ¦  10  ¦  20  ¦  2
drop table t_odku_statement_composite;
drop table if exists t_odku_order_generated;
create table t_odku_order_generated(
id int primary key,
a int,
b int,
g int as (a + b),
constraint ck_odku_order check(a = b),
key ig(g)
);
insert into t_odku_order_generated(id, a, b) values (1, 10, 10);
insert into t_odku_order_generated(id, a, b) values (1, 99, 99)
on duplicate key update a = a + 1, b = a;
select row_count(), id, a, b, g from t_odku_order_generated;
➤ row_count()[-5,64,0]  ¦  id[4,32,0]  ¦  a[4,32,0]  ¦  b[4,32,0]  ¦  g[4,32,0]  𝄀
2  ¦  1  ¦  11  ¦  11  ¦  22
insert into t_odku_order_generated(id, a, b) values (2, 20, 20), (1, 99, 99)
on duplicate key update a = a + 1, b = a + 2;
constraint violation: Check constraint 'ck_odku_order' is violated
select count(*) from t_odku_order_generated;
➤ count(*)[-5,64,0]  𝄀
1
select count(*) from t_odku_order_generated force index(ig) where g = 22;
➤ count(*)[-5,64,0]  𝄀
1
drop table t_odku_order_generated;
drop table if exists t_odku_repeat_onupdate;
create table t_odku_repeat_onupdate(
id int primary key,
v int,
updated_at timestamp(6) default '2000-01-01 00:00:00.000000'
on update current_timestamp(6)
);
insert into t_odku_repeat_onupdate values (1, 10, '2000-01-01 00:00:00.000000');
insert into t_odku_repeat_onupdate(id, v) values (1, 11), (1, 10)
on duplicate key update v = values(v);
select row_count(), v, updated_at > '2000-01-01 00:00:00.000000' as auto_updated
from t_odku_repeat_onupdate;
➤ row_count()[-5,64,0]  ¦  v[4,32,0]  ¦  auto_updated[-7,1,0]  𝄀
4  ¦  10  ¦  1
update t_odku_repeat_onupdate set updated_at = '2000-01-01 00:00:00.000000';
insert into t_odku_repeat_onupdate(id, v) values (1, 10)
on duplicate key update v = values(v);
select row_count(), v, updated_at = '2000-01-01 00:00:00.000000' as auto_unchanged
from t_odku_repeat_onupdate;
➤ row_count()[-5,64,0]  ¦  v[4,32,0]  ¦  auto_unchanged[-7,1,0]  𝄀
1  ¦  10  ¦  1
drop table t_odku_repeat_onupdate;
drop table if exists t_odku_action_not_null;
create table t_odku_action_not_null(id int primary key, v int not null, selector int);
insert into t_odku_action_not_null values (1, 10, 0);
insert into t_odku_action_not_null values (1, 10, 1), (1, 10, 2)
on duplicate key update
v = if(values(selector) = 1, null, 20),
selector = values(selector);
constraint violation: Column 'v' cannot be null
select id, v, selector from t_odku_action_not_null;
➤ id[4,32,0]  ¦  v[4,32,0]  ¦  selector[4,32,0]  𝄀
1  ¦  10  ¦  0
drop table t_odku_action_not_null;
create table t_odku_fk_uk_parent(pid int primary key);
create table t_odku_fk_uk_child(
id bigint auto_increment primary key,
pid int not null,
attr_id int not null,
val varchar(20),
unique key uk_pid_attr(pid, attr_id),
foreign key(pid) references t_odku_fk_uk_parent(pid)
);
insert into t_odku_fk_uk_parent values (1);
insert into t_odku_fk_uk_child(pid, attr_id, val) values (1, 5, 'old');
insert into t_odku_fk_uk_child(pid, attr_id, val) values (1, 5, 'new')
on duplicate key update val = values(val);
select id, pid, attr_id, val from t_odku_fk_uk_child order by id;
➤ id[-5,64,0]  ¦  pid[4,32,0]  ¦  attr_id[4,32,0]  ¦  val[12,20,0]  𝄀
1  ¦  1  ¦  5  ¦  new
drop table if exists t_odku_fk_uk_child;
drop table if exists t_odku_fk_uk_parent;
