create table t1(a int primary key, b int);
delete from t1;
insert into t1 values (1,1);
insert into t1 values (1,2), (2,2) on duplicate key update b=b+10;
select * from t1;
a    b
1    11
2    2
delete from t1;
insert into t1 values (1,1);
insert into t1 values (1,2), (2,2) on duplicate key update b=values(b)+10;
select * from t1;
a    b
1    12
2    2
delete from t1;
insert into t1 values (1,1);
insert into t1 values (1,11), (2,22), (3,33) on duplicate key update a=a+1,b=100;
select * from t1;
a    b
4    100
delete from t1;
insert into t1 values (1,1);
insert into t1 values (1,2), (1,22) on duplicate key update b=b+10;
select * from t1;
a    b
1    21
delete from t1;
insert into t1 values (1,1),(3,3);
insert into t1 values (1,2),(2,22) on duplicate key update a=a+1;
Duplicate entry '3' for key 'a'
delete from t1;
insert into t1 values (1,1),(3,3);
insert into t1 values (1,2),(2,22),(3,33) on duplicate key update a=a+1;
constraint violation: Duplicate entry for key 'a'
drop table t1;
create table t1(a int, b int, c int, primary key(a, b));
delete from t1;
insert into t1 values (1,1,1);
insert into t1 values (1,1,2), (2,2,2) on duplicate key update c=c+10;
select * from t1;
a    b    c
1    1    11
2    2    2
delete from t1;
insert into t1 values (1,1,1);
insert into t1 values (1,1,2), (2,2,2) on duplicate key update c=values(c)+10;
select * from t1;
a    b    c
1    1    12
2    2    2
drop table t1;
create table t1(a int unique key, b int);
delete from t1;
insert into t1 values (1,1);
insert into t1 values (1,2), (2,2) on duplicate key update b=b+10;
select * from t1;
a    b
1    11
2    2
delete from t1;
insert into t1 values (1,1);
insert into t1 values (1,2), (2,2) on duplicate key update b=values(b)+10;
select * from t1;
a    b
1    12
2    2
delete from t1;
insert into t1 values (1,1);
insert into t1 values (1,11), (2,22), (3,33) on duplicate key update a=a+1,b=100;
select * from t1;
a    b
4    100
delete from t1;
insert into t1 values (1,1);
insert into t1 values (1,2), (1,22) on duplicate key update b=b+10;
select * from t1;
a    b
1    21
delete from t1;
insert into t1 values (1,1),(3,3);
insert into t1 values (1,2),(2,22) on duplicate key update a=a+1;
Duplicate entry '3' for key '__mo_index_idx_col'
delete from t1;
insert into t1 values (1,1),(3,3);
insert into t1 values (1,2),(2,22),(3,33) on duplicate key update a=a+1;
constraint violation: Duplicate entry for key 'a'
drop table t1;
create table t1(a int, b int, c int, unique key(a, b));
delete from t1;
insert into t1 values (1,1,1);
insert into t1 values (1,1,2), (2,2,2) on duplicate key update c=c+10;
select * from t1;
a    b    c
1    1    11
2    2    2
delete from t1;
insert into t1 values (1,1,1);
insert into t1 values (1,1,2), (2,2,2) on duplicate key update c=values(c)+10;
select * from t1;
a    b    c
1    1    12
2    2    2
CREATE TABLE IF NOT EXISTS indup(
col1 INT primary key,
col2 VARCHAR(20) NOT NULL,
col3 VARCHAR(30) NOT NULL,
col4 BIGINT default 30
);
insert into indup values(22,'11','33',1), (23,'22','55',2),(24,'66','77',1),(25,'99','88',1),(22,'11','33',1) on duplicate key update col1=col1+col2;
select * from indup;
col1    col2    col3    col4
33    11    33    1
23    22    55    2
24    66    77    1
25    99    88    1
insert into indup values(24,'1','1',100) on duplicate key update col1=2147483649;
Data truncation: data out of range: data type int32, value '2147483649'
select * from indup;
col1    col2    col3    col4
33    11    33    1
23    22    55    2
24    66    77    1
25    99    88    1
