drop database if exists d_indomain;
create database d_indomain;
use d_indomain;
create table t1(a int primary key, b int);
insert into t1 select result, result from generate_series(20) g;
select a from t1 where a in (1,2,3,4) and a not in (2,3) order by a;
a
1
4
explain select a from t1 where a in (1,2,3,4) and a not in (2,3);
TP QUERY PLAN
Project
  ->  Table Scan on d_indomain.t1
        Filter Cond: t1.a in ([1 4])
select a from t1 where a in (1,2,3,4) and a != 2 and a != 3 order by a;
a
1
4
explain select a from t1 where a in (1,2,3,4) and a != 2 and a != 3;
TP QUERY PLAN
Project
  ->  Table Scan on d_indomain.t1
        Filter Cond: t1.a in ([1 4])
select a from t1 where a in (1,2) and a not in (1,2);
a
explain select a from t1 where a in (1,2) and a not in (1,2);
TP QUERY PLAN
Project
  ->  Table Scan on d_indomain.t1
        Filter Cond: false
select a from t1 where a = 2 and a in (1,2,3);
a
2
explain select a from t1 where a = 2 and a in (1,2,3);
TP QUERY PLAN
Project
  ->  Table Scan on d_indomain.t1
        Filter Cond: (t1.a = 2)
select a from t1 where a in (1,2) and a in (3,4);
a
explain select a from t1 where a in (1,2) and a in (3,4);
TP QUERY PLAN
Project
  ->  Table Scan on d_indomain.t1
        Filter Cond: false
select a from t1 where a in (1,2,3,4) and (a not in (2,3) or a = 99) order by a;
a
1
4
explain select a from t1 where a in (1,2,3,4) and (a not in (2,3) or a = 99);
TP QUERY PLAN
Project
  ->  Table Scan on d_indomain.t1
        Filter Cond: t1.a in ([1 4 99]), t1.a in ([1 2 3 4])
select a from t1 where a in (1,2,3,4,5,6,7,8) and a between 3 and 6 order by a;
a
3
4
5
6
explain select a from t1 where a in (1,2,3,4,5,6,7,8) and a between 3 and 6;
TP QUERY PLAN
Project
  ->  Table Scan on d_indomain.t1
        Filter Cond: t1.a BETWEEN 3 AND 6, t1.a in ([1 2 3 4 5 6 7 8])
insert into t1 values (101, 2);
insert into t1 values (102, 2);
select a,b from t1 where a in (1,101,102) and b != 2 order by a;
a    b
1    1
explain select a,b from t1 where a in (1,101,102) and b != 2;
TP QUERY PLAN
Project
  ->  Table Scan on d_indomain.t1
        Filter Cond: (t1.b <> 2), t1.a in ([1 101 102])
delete from t1 where a in (101, 102);
create table t2(a int, b int);
insert into t2 values (1,1),(2,2),(null,3);
select * from t2 where a in (1,2,3) and a is null;
a    b
explain select * from t2 where a in (1,2,3) and a is null;
TP QUERY PLAN
Project
  ->  Table Scan on d_indomain.t2
        Filter Cond: false
select a from t1 where a in (1,2,3,4) and (a <> 2 or a = 99) order by a;
a
1
3
4
explain select a from t1 where a in (1,2,3,4) and (a <> 2 or a = 99);
TP QUERY PLAN
Project
  ->  Table Scan on d_indomain.t1
        Filter Cond: t1.a in ([1 3 4 99]), t1.a in ([1 2 3 4])
select a from t1 where a in (1,2,3,4) and ((a not in (2,3) and a <> 3) or a = 99) order by a;
a
1
4
explain select a from t1 where a in (1,2,3,4) and ((a not in (2,3) and a <> 3) or a = 99);
TP QUERY PLAN
Project
  ->  Table Scan on d_indomain.t1
        Filter Cond: t1.a in ([1 4 99]), t1.a in ([1 2 3 4])
select a from t1 where a in (1,2,3,4) and a not in (2, null) order by a;
a
select a from t1 where a in (1,2,3,4) and (a not in (2, null) or a = 99) order by a;
a
explain select a from t1 where a in (1,2,3,4) and a not in (2, null);
TP QUERY PLAN
Project
  ->  Table Scan on d_indomain.t1
        Filter Cond: t1.a in ([1 3 4]), (t1.a != (null))
drop database if exists d_indomain;
