drop table if exists insert_t1;
create table insert_t1(a int, b int unique key);
explain insert into insert_t1(a) values (1);
TP QUERY PLAN
Multi Update
  ->  PreInsert on insert.insert_t1
        ->  Project
              ->  Values Scan "*VALUES*" 
drop table if exists insert_t2;
create table insert_t2(a int, b int, c int, unique key(b, c));
explain insert into insert_t2(a) values (1);
TP QUERY PLAN
Multi Update
  ->  PreInsert on insert.insert_t2
        ->  Project
              ->  Values Scan "*VALUES*" 
drop table if exists insert_t3;
create table insert_t3(a int auto_increment, b int, unique key(a));
insert into insert_t3(b) values (1);
insert into insert_t3(a) values (1);
Duplicate entry '1' for key '(.*)'
drop table if exists insert_t4;
create table insert_t4(a int auto_increment, b int auto_increment, unique key(a, b));
insert into insert_t4(b) values (1);
insert into insert_t4(a) values (2);
drop table insert_t1;
drop table insert_t2;
drop table insert_t3;
drop table insert_t4;
drop table if exists insert_t5;
create table insert_t5(col1 bool);
insert into insert_t5 values("true");
select * from insert_t5;
col1
true
delete from insert_t5;;
insert into insert_t5 values("false");
select * from insert_t5;
col1
false
drop table insert_t5;
drop table if exists insert_t6;
create table insert_t6(col1 timestamp);
insert into insert_t6 values(2022);
select count(*) from insert_t6;
count(*)
1
drop table insert_t6;
drop table if exists insert_t7;
create table insert_t7(col1 bit(10));
insert into insert_t7 values(111111);
invalid input: data too long, type width = 10, val = 11011001000000111
drop table insert_t7;
