create table t1(a int, b int unique key);
explain insert into t1(a) values (1);
TP QUERY PLAN
Multi Update
  ->  Project
        ->  PreInsert on insert.t1
              ->  Project
                    ->  Values Scan "*VALUES*" 
create table t2(a int, b int, c int, unique key(b, c));
explain insert into t2(a) values (1);
TP QUERY PLAN
Multi Update
  ->  Project
        ->  PreInsert on insert.t2
              ->  Project
                    ->  Values Scan "*VALUES*" 
create table t3(a int auto_increment, b int, unique key(a));
insert into t3(b) values (1);
insert into t3(a) values (1);
Duplicate entry '1' for key 'a'
create table t4(a int auto_increment, b int auto_increment, unique key(a, b));
insert into t4(b) values (1);
insert into t4(a) values (2);
drop table if exists insert_t5;
create table insert_t5(col1 bool);
insert into insert_t5 values("true");
select * from insert_t5;
col1
true
delete from insert_t5;;
insert into insert_t5 values("false");
select * from insert_t5;
col1
false
drop table insert_t5;
