drop database if exists d1;
create database d1;
use d1;
drop table if exists t1;
drop table if exists t2;
create table t1(c1 int not null, c2 int not null, c3 int not null) cluster by c1;
create table t2(c1 int not null, c2 int not null, c3 int not null) cluster by c1;
insert into t1
select result * 50 + result % 50, result * 50 + result % 50, result * 50 + result % 50
from generate_series(100000) g;
insert into t2
select result * 50 + result % 50, result * 50 + result % 50, result * 50 + result % 50
from generate_series(80000) g;
select mo_ctl('dn', 'flush', 'd1.t1');
➤ mo_ctl(dn, flush, d1.t1)[12,65535,0]  𝄀
{
  "method": "Flush",
  "result": [
    {
      "returnStr": "OK"
    }
  ]
}

select mo_ctl('dn', 'flush', 'd1.t2');
➤ mo_ctl(dn, flush, d1.t2)[12,65535,0]  𝄀
{
  "method": "Flush",
  "result": [
    {
      "returnStr": "OK"
    }
  ]
}

set @shuffle_t1_stats = '{"table_cnt":5000000,"block_number":640,"accurate_object_number":40,"approx_object_number":40,"ndv_map":{"c1":5000000,"c2":5000000,"c3":5000000},"min_val_map":{"c1":1,"c2":1,"c3":1},"max_val_map":{"c1":5000000,"c2":5000000,"c3":5000000},"shuffle_range_map":{"c1":{"overlap":0.1,"uniform":1,"result":[1,1250000,2500000,3750000,5000000]},"c2":{"overlap":0.1,"uniform":1,"result":[1,1250000,2500000,3750000,5000000]},"c3":{"overlap":0.1,"uniform":1,"result":[1,1250000,2500000,3750000,5000000]}}}';
set @shuffle_t2_stats = '{"table_cnt":4000000,"block_number":520,"accurate_object_number":33,"approx_object_number":33,"ndv_map":{"c1":4000000,"c2":4000000,"c3":4000000},"min_val_map":{"c1":1,"c2":1,"c3":1},"max_val_map":{"c1":4000000,"c2":4000000,"c3":4000000},"shuffle_range_map":{"c1":{"overlap":0.1,"uniform":1,"result":[1,1000000,2000000,3000000,4000000]},"c2":{"overlap":0.1,"uniform":1,"result":[1,1000000,2000000,3000000,4000000]},"c3":{"overlap":0.1,"uniform":1,"result":[1,1000000,2000000,3000000,4000000]}}}';
select table_cnt from table_stats(
'd1.t1',
'patch',
@shuffle_t1_stats
) g;
➤ table_cnt[8,53,31]  𝄀
5000000.0
select table_cnt from table_stats(
'd1.t2',
'patch',
@shuffle_t2_stats
) g;
➤ table_cnt[8,53,31]  𝄀
4000000.0
explain (check '["Join Type: INNER", "shuffle: range"]')
select count(*) from t1,t2 where t1.c1=t2.c1;
-- @regex("(?i)ap query plan on multicn", true)
➤ AP QUERY PLAN ON MULTICN(16 core)[12,-1,0]  𝄀
Project  𝄀
  ->  Aggregate  𝄀
        Aggregate Functions: starcount(1)  𝄀
        ->  Join  𝄀
              Join Type: INNER  𝄀
              Join Cond: (t1.c1 = t2.c1) shuffle: range(t1.c1)  𝄀
              ->  Table Scan on d1.t1  𝄀
              ->  Table Scan on d1.t2
select count(*) from t1,t2 where t1.c1=t2.c1;
➤ count(*)[-5,64,0]  𝄀
80000
explain (check '["Group Key: t1.c1 shuffle: REUSE", "Join Type: INNER", "shuffle: range"]')
select count(*) as cnt from t1,t2 where t1.c1=t2.c1 group by t1.c1 having cnt>1;
➤ AP QUERY PLAN ON MULTICN(16 core)[12,-1,0]  𝄀
Project  𝄀
  ->  Aggregate  𝄀
        Group Key: t1.c1 shuffle: REUSE  𝄀
        Aggregate Functions: starcount(1)  𝄀
        Filter Cond: (count(*) > 1)  𝄀
        ->  Join  𝄀
              Join Type: INNER  𝄀
              Join Cond: (t1.c1 = t2.c1) shuffle: range(t1.c1)  𝄀
              ->  Table Scan on d1.t1  𝄀
              ->  Table Scan on d1.t2
select count(*) as cnt from t1,t2 where t1.c1=t2.c1 group by t1.c1 having cnt>1;
➤ cnt[-5,64,0]
explain (check '["Join Type: INNER", "shuffle: range"]')
select count(*) from t1,t2 where t1.c1=t2.c2;
➤ AP QUERY PLAN ON MULTICN(16 core)[12,-1,0]  𝄀
Project  𝄀
  ->  Aggregate  𝄀
        Aggregate Functions: starcount(1)  𝄀
        ->  Join  𝄀
              Join Type: INNER  𝄀
              Join Cond: (t1.c1 = t2.c2) shuffle: range(t1.c1)  𝄀
              ->  Table Scan on d1.t1  𝄀
              ->  Table Scan on d1.t2
select count(*) from t1,t2 where t1.c1=t2.c2;
➤ count(*)[-5,64,0]  𝄀
80000
explain (check '["Join Type: INNER", "shuffle: range"]')
select count(*) from t1,t2 where t1.c2=t2.c1;
➤ AP QUERY PLAN ON MULTICN(16 core)[12,-1,0]  𝄀
Project  𝄀
  ->  Aggregate  𝄀
        Aggregate Functions: starcount(1)  𝄀
        ->  Join  𝄀
              Join Type: INNER  𝄀
              Join Cond: (t1.c2 = t2.c1) shuffle: range(t1.c2)  𝄀
              ->  Table Scan on d1.t1  𝄀
              ->  Table Scan on d1.t2
select count(*) from t1,t2 where t1.c2=t2.c1;
➤ count(*)[-5,64,0]  𝄀
80000
explain (check '["Join Type: INNER", "shuffle: range"]')
select count(*) from t1,t2 where t1.c2=t2.c2;
➤ AP QUERY PLAN ON MULTICN(16 core)[12,-1,0]  𝄀
Project  𝄀
  ->  Aggregate  𝄀
        Aggregate Functions: starcount(1)  𝄀
        ->  Join  𝄀
              Join Type: INNER  𝄀
              Join Cond: (t1.c2 = t2.c2) shuffle: range(t1.c2)  𝄀
              ->  Table Scan on d1.t1  𝄀
              ->  Table Scan on d1.t2
select count(*) from t1,t2 where t1.c2=t2.c2;
➤ count(*)[-5,64,0]  𝄀
80000
explain select count(*) from t1,t2 where t1.c2=t2.c2 and t2.c3<500000;
[unknown result because it is related to issue#19733]
select count(*) from t1,t2 where t1.c2=t2.c2 and t2.c3<500000;
➤ count(*)[-5,64,0]  𝄀
9999
explain select count(*) from t1,t2 where t1.c2=t2.c2 and t2.c3<1500000;
[unknown result because it is related to issue#19733]
select count(*) from t1,t2 where t1.c2=t2.c2 and t2.c3<1500000;
➤ count(*)[-5,64,0]  𝄀
29999
explain (check '["Group Key: t1.c1 shuffle: range"]')
select count(*) from t1 group by c1 limit 5;
➤ AP QUERY PLAN ON MULTICN(16 core)[12,-1,0]  𝄀
Project  𝄀
  Limit: 5  𝄀
  ->  Aggregate  𝄀
        Group Key: t1.c1 shuffle: range(t1.c1)  𝄀
        Aggregate Functions: starcount(1)  𝄀
        ->  Table Scan on d1.t1
select count(*) from t1 group by c1 limit 5;
➤ count(*)[-5,64,0]  𝄀
1  𝄀
1  𝄀
1  𝄀
1  𝄀
1
explain (check '["Group Key: t1.c2 shuffle: range"]')
select count(*) from t1 group by c2 limit 5;
➤ AP QUERY PLAN ON MULTICN(16 core)[12,-1,0]  𝄀
Project  𝄀
  Limit: 5  𝄀
  ->  Aggregate  𝄀
        Group Key: t1.c2 shuffle: range(t1.c2)  𝄀
        Aggregate Functions: starcount(1)  𝄀
        ->  Table Scan on d1.t1
select count(*) from t1 group by c2 limit 5;
➤ count(*)[-5,64,0]  𝄀
1  𝄀
1  𝄀
1  𝄀
1  𝄀
1
explain select count(*) from t1 where t1.c2 in ( select c2 from t2 where t2.c3>100000 );
[unknown result because it is related to issue#19733]
select table_cnt from table_stats('d1.t1', 'patch', @shuffle_t1_stats) g;
➤ table_cnt[8,53,31]  𝄀
5000000.0
select table_cnt from table_stats('d1.t2', 'patch', @shuffle_t2_stats) g;
➤ table_cnt[8,53,31]  𝄀
4000000.0
explain (check '["Join Type: SEMI", "shuffle: range"]')
select count(*) from t1 where t1.c2 in ( select c2 from t2 where t2.c3>100000 );
➤ AP QUERY PLAN ON MULTICN(16 core)[12,-1,0]  𝄀
Project  𝄀
  ->  Aggregate  𝄀
        Aggregate Functions: starcount(1)  𝄀
        ->  Join  𝄀
              Join Type: SEMI  𝄀
              Join Cond: (t1.c2 = t2.c2) shuffle: range(t1.c2)  𝄀
              ->  Table Scan on d1.t1  𝄀
              ->  Table Scan on d1.t2  𝄀
                    Filter Cond: (t2.c3 > 100000)  𝄀
                    Block Filter Cond: (t2.c3 > 100000)
select count(*) from t1 where t1.c2 in ( select c2 from t2 where t2.c3>100000 );
➤ count(*)[-5,64,0]  𝄀
78000
explain select count(*) from t1 where t1.c2 not in ( select c3 from t2 where t2.c3 between 100 and 700000 );
[unknown result because it is related to issue#19733]
select table_cnt from table_stats('d1.t1', 'patch', @shuffle_t1_stats) g;
➤ table_cnt[8,53,31]  𝄀
5000000.0
select table_cnt from table_stats('d1.t2', 'patch', @shuffle_t2_stats) g;
➤ table_cnt[8,53,31]  𝄀
4000000.0
explain (check '["Join Type: ANTI", "shuffle: range"]')
select count(*) from t1 where t1.c2 not in ( select c3 from t2 where t2.c3 between 100 and 700000 );
➤ AP QUERY PLAN ON MULTICN(16 core)[12,-1,0]  𝄀
Project  𝄀
  ->  Aggregate  𝄀
        Aggregate Functions: starcount(1)  𝄀
        ->  Join  𝄀
              Join Type: ANTI  𝄀
              Join Cond: (t1.c2 = t2.c3) shuffle: range(t1.c2)  𝄀
              ->  Table Scan on d1.t1  𝄀
              ->  Table Scan on d1.t2  𝄀
                    Filter Cond: t2.c3 BETWEEN 100 AND 700000  𝄀
                    Block Filter Cond: t2.c3 BETWEEN 100 AND 700000
select count(*) from t1 where t1.c2 not in ( select c3 from t2 where t2.c3 between 100 and 700000 );
➤ count(*)[-5,64,0]  𝄀
86001
explain select count(*) from t1 where t1.c3<800000 and t1.c2 not in ( select c3 from t2 where t2.c3 between 10000 and 600000 );
[unknown result because it is related to issue#19733]
select table_cnt from table_stats('d1.t1', 'patch', @shuffle_t1_stats) g;
➤ table_cnt[8,53,31]  𝄀
5000000.0
select table_cnt from table_stats('d1.t2', 'patch', @shuffle_t2_stats) g;
➤ table_cnt[8,53,31]  𝄀
4000000.0
explain (check '["Join Type: ANTI", "shuffle: range"]')
select count(*) from t1 where t1.c3<800000 and t1.c2 not in ( select c3 from t2 where t2.c3 between 10000 and 600000 );
➤ AP QUERY PLAN ON ONE CN(16 core)[12,-1,0]  𝄀
Project  𝄀
  ->  Aggregate  𝄀
        Aggregate Functions: starcount(1)  𝄀
        ->  Join  𝄀
              Join Type: ANTI  𝄀
              Join Cond: (t1.c2 = t2.c3) shuffle: range(t1.c2)  𝄀
              ->  Table Scan on d1.t1  𝄀
                    Filter Cond: (t1.c3 < 800000)  𝄀
                    Block Filter Cond: (t1.c3 < 800000)  𝄀
              ->  Table Scan on d1.t2  𝄀
                    Filter Cond: t2.c3 BETWEEN 10000 AND 600000  𝄀
                    Block Filter Cond: t2.c3 BETWEEN 10000 AND 600000
select count(*) from t1 where  t1.c3<800000 and t1.c2 not in ( select c3 from t2 where t2.c3 between 10000 and 600000 );
➤ count(*)[-5,64,0]  𝄀
4198
explain select count(*) from t1 where t1.c1 <300000 and  t1.c2 in ( select c2 from t2 where t2.c3>100000 );
[unknown result because it is related to issue#19733]
select count(*) from t1 where t1.c1 <300000 and  t1.c2 in ( select c2 from t2 where t2.c3>100000 );
➤ count(*)[-5,64,0]  𝄀
3999
explain select count(*) from t1 left join t2 on t1.c1=t2.c1 where t1.c3 >5000000;
[unknown result because it is related to issue#19733]
select count(*) from t1 left join t2 on t1.c1=t2.c1 where t1.c3 >5000000;
➤ count(*)[-5,64,0]  𝄀
0
explain (check '["Join Type: LEFT", "shuffle: range"]')
select count(*) from t1 left join t2 on t1.c1=t2.c1 and t1.c3 >t2.c3;
➤ AP QUERY PLAN ON MULTICN(16 core)[12,-1,0]  𝄀
Project  𝄀
  ->  Aggregate  𝄀
        Aggregate Functions: starcount(1)  𝄀
        ->  Join  𝄀
              Join Type: LEFT  𝄀
              Join Cond: (t1.c1 = t2.c1), (t1.c3 > t2.c3) shuffle: range(t1.c1)  𝄀
              ->  Table Scan on d1.t1  𝄀
              ->  Table Scan on d1.t2
select count(*) from t1 left join t2 on t1.c1=t2.c1 and t1.c3 >t2.c3;
➤ count(*)[-5,64,0]  𝄀
100000
explain (check '["Join Type: FULL OUTER", "shuffle: range"]')
select count(*) from t1 full join t2 on t1.c1=t2.c1;
➤ AP QUERY PLAN ON MULTICN(16 core)[12,-1,0]  𝄀
Project  𝄀
  ->  Aggregate  𝄀
        Aggregate Functions: starcount(1)  𝄀
        ->  Join  𝄀
              Join Type: FULL OUTER  𝄀
              Join Cond: (t2.c1 = t1.c1) shuffle: range(t2.c1)  𝄀
              ->  Table Scan on d1.t2  𝄀
              ->  Table Scan on d1.t1
select count(*) from t1 full join t2 on t1.c1=t2.c1;
➤ count(*)[-5,64,0]  𝄀
100000
explain (check '["Join Type: FULL OUTER", "shuffle: range"]')
select count(*) from t1 full outer join t2 on t1.c2=t2.c2;
➤ AP QUERY PLAN ON MULTICN(16 core)[12,-1,0]  𝄀
Project  𝄀
  ->  Aggregate  𝄀
        Aggregate Functions: starcount(1)  𝄀
        ->  Join  𝄀
              Join Type: FULL OUTER  𝄀
              Join Cond: (t2.c2 = t1.c2) shuffle: range(t2.c2)  𝄀
              ->  Table Scan on d1.t2  𝄀
              ->  Table Scan on d1.t1
select count(*) from t1 full outer join t2 on t1.c2=t2.c2;
➤ count(*)[-5,64,0]  𝄀
100000
explain (check '["Window", "Partition Top N", "Join Type: FULL OUTER", "shuffle: range"]')
with
l as (
select c2 as k from t1 where c2 % 100 = 0
),
r as (
select c2 as k from t2 where c2 % 100 = 0
),
joined as (
select case
when l.k is not null and r.k is not null then 'both'
when l.k is not null then 'left_only'
else 'right_only'
end as join_side,
coalesce(l.k, r.k) as k
from l full outer join r on l.k = r.k
),
ranked as (
select join_side,
row_number() over (partition by join_side order by k) as rn
from joined
)
select join_side, count(*) as cnt
from ranked
where rn <= 2
group by join_side
order by join_side;
➤ AP QUERY PLAN ON MULTICN(16 core)[12,-1,0]  𝄀
Project  𝄀
  ->  Sort  𝄀
        Sort Key: ranked.join_side INTERNAL  𝄀
        ->  Aggregate  𝄀
              Group Key: joined.join_side  𝄀
              Aggregate Functions: starcount(1)  𝄀
              ->  Window  𝄀
                    Window Function: row_number(); Partition By: joined.join_side; Order By: joined.k  𝄀
                    Filter Cond: (row_number() over (partition by joined.join_side order by joined.k range unbounded preceding) <= 2)  𝄀
                    ->  Partition Top N  𝄀
                          Partition Key: joined.join_side INTERNAL  𝄀
                          Sort Key: joined.k INTERNAL  𝄀
                          Limit: 2  𝄀
                          ->  Project  𝄀
                                ->  Join  𝄀
                                      Join Type: FULL OUTER  𝄀
                                      Join Cond: (t2.c2 = t1.c2) shuffle: range(t2.c2)  𝄀
                                      ->  Table Scan on d1.t2  𝄀
                                            Filter Cond: ((cast(t2.c2 AS BIGINT) % 100) = 0)  𝄀
                                      ->  Table Scan on d1.t1  𝄀
                                            Filter Cond: ((cast(t1.c2 AS BIGINT) % 100) = 0)
with
l as (
select c2 as k from t1 where c2 % 100 = 0
),
r as (
select c2 as k from t2 where c2 % 100 = 0
),
joined as (
select case
when l.k is not null and r.k is not null then 'both'
when l.k is not null then 'left_only'
else 'right_only'
end as join_side,
coalesce(l.k, r.k) as k
from l full outer join r on l.k = r.k
),
ranked as (
select join_side,
row_number() over (partition by join_side order by k) as rn
from joined
)
select join_side, count(*) as cnt
from ranked
where rn <= 2
group by join_side
order by join_side;
➤ join_side[12,10,0]  ¦  cnt[-5,64,0]  𝄀
both  ¦  2  𝄀
left_only  ¦  2
create table t3(c1 int not null, c2 int not null)cluster by c1;
insert into t3
select result * 5 + result % 5, result * 5 + result % 5
from generate_series(1,200000)g;
select mo_ctl('dn', 'flush', 'd1.t3');
➤ mo_ctl(dn, flush, d1.t3)[12,65535,0]  𝄀
{
  "method": "Flush",
  "result": [
    {
      "returnStr": "OK"
    }
  ]
}

explain select count(*) from t3 where t3.c2 in (select c3 from t1 where t1.c2!=20000 and  t1.c2 not in ( select c2 from t2 where t2.c3>150000 ));
[unknown result because it is related to issue#19733]
select count(*) from t3 where t3.c2 in (select c3 from t1 where t1.c2!=20000 and  t1.c2 not in ( select c2 from t2 where t2.c3>150000 ));
➤ count(*)[-5,64,0]  𝄀
599
select count(*) from t3 where t3.c1<100000 and t3.c2 not in (select c3 from t1 where t1.c2!=30000 and  t1.c2  in ( select c2 from t2 where t2.c3<850000 ));
➤ count(*)[-5,64,0]  𝄀
19601
select count(*) from t1,t2,t3 where t1.c1=t2.c1 and t1.c2=t3.c2 and t2.c2<900000 and t3.c1<500000;
➤ count(*)[-5,64,0]  𝄀
1999
explain select count(*) from (select c1 from t1 group by c1) s1, t2 where s1.c1=t2.c1 and t2.c2<1000000;
[unknown result because it is related to issue#19733]
select table_cnt from table_stats('d1.t1', 'patch', @shuffle_t1_stats) g;
➤ table_cnt[8,53,31]  𝄀
5000000.0
select table_cnt from table_stats('d1.t2', 'patch', @shuffle_t2_stats) g;
➤ table_cnt[8,53,31]  𝄀
4000000.0
explain (check '["Join Type: INNER", "shuffle: REUSE", "Group Key: t1.c1 shuffle: range"]')
select count(*) from (select c1 from t1 group by c1) s1, t2 where s1.c1=t2.c1 and t2.c2<1000000;
➤ AP QUERY PLAN ON MULTICN(16 core)[12,-1,0]  𝄀
Project  𝄀
  ->  Aggregate  𝄀
        Aggregate Functions: starcount(1)  𝄀
        ->  Join  𝄀
              Join Type: INNER  𝄀
              Join Cond: (t1.c1 = t2.c1) shuffle: REUSE  𝄀
              ->  Aggregate  𝄀
                    Group Key: t1.c1 shuffle: range(t1.c1)  𝄀
                    ->  Table Scan on d1.t1  𝄀
              ->  Table Scan on d1.t2  𝄀
                    Filter Cond: (t2.c2 < 1000000)  𝄀
                    Block Filter Cond: (t2.c2 < 1000000)
select count(*) from (select c1 from t1 group by c1) s1, t2 where s1.c1=t2.c1 and t2.c2<1000000;
➤ count(*)[-5,64,0]  𝄀
19999
delete from t1 where c3%5=1;
insert into t1 values(-1,-2,-3);
insert into t1 values(10,11,12);
select count(*) from t1 where c3!=0;
➤ count(*)[-5,64,0]  𝄀
80002
drop table t3;
create table t4(c1 int not null, c2  int unsigned) cluster by c1;
insert into t4
select result * 10 + result % 10, result * 10 + result % 10
from generate_series(100000) g;
insert into t4
select result * 10 + result % 10 + 10000000, result * 10 + result % 10 + 10000000
from generate_series(100000) g;
select mo_ctl('dn', 'flush', 'd1.t4');
➤ mo_ctl(dn, flush, d1.t4)[12,65535,0]  𝄀
{
  "method": "Flush",
  "result": [
    {
      "returnStr": "OK"
    }
  ]
}

explain (check '["Group Key: t4.c1 shuffle: range"]')
select count(*) as cnt from t4 group by c1 having cnt>1;
➤ AP QUERY PLAN ON ONE CN(16 core)[12,-1,0]  𝄀
Project  𝄀
  ->  Aggregate  𝄀
        Group Key: t4.c1 shuffle: range(t4.c1)  𝄀
        Aggregate Functions: starcount(1)  𝄀
        Filter Cond: (count(*) > 1)  𝄀
        ->  Table Scan on d1.t4
select count(*) as cnt from t4 group by c1 having cnt>1;
➤ cnt[-5,64,0]
explain (check '["Group Key: t4.c2 shuffle: range"]')
select count(*) as cnt from t4 group by c2 having cnt>1;
➤ AP QUERY PLAN ON ONE CN(16 core)[12,-1,0]  𝄀
Project  𝄀
  ->  Aggregate  𝄀
        Group Key: t4.c2 shuffle: range(t4.c2)  𝄀
        Aggregate Functions: starcount(1)  𝄀
        Filter Cond: (count(*) > 1)  𝄀
        ->  Table Scan on d1.t4
select count(*) as cnt from t4 group by c2 having cnt>1;
➤ cnt[-5,64,0]
drop database if exists d1;
