drop database if exists d1;
create database d1;
use d1;
drop table if exists t1;
drop table if exists t2;
create table t1(c1 int not null, c2 int not null, c3 int not null) cluster by c1;
create table t2(c1 int not null, c2 int not null, c3 int not null) cluster by c1;
insert into t1 select *,*,* from generate_series(5000000) g;
insert into t2 select *,*,* from generate_series(4000000) g;
select mo_ctl('dn', 'flush', 'd1.t1');
➤ mo_ctl(dn, flush, d1.t1)[12,-1,0]  𝄀
{
  "method": "Flush",
  "result": [
    {
      "returnStr": "OK"
    }
  ]
}

select mo_ctl('dn', 'flush', 'd1.t2');
➤ mo_ctl(dn, flush, d1.t2)[12,-1,0]  𝄀
{
  "method": "Flush",
  "result": [
    {
      "returnStr": "OK"
    }
  ]
}

select Sleep(1);
➤ Sleep(1)[-6,8,0]  𝄀
0
explain select count(*) from t1,t2 where t1.c1=t2.c1;
➤ AP QUERY PLAN ON MULTICN(4 core)[12,0,0]  𝄀
Project  𝄀
  ->  Aggregate  𝄀
        Aggregate Functions: starcount(1)  𝄀
        ->  Join  𝄀
              Join Type: INNER  𝄀
              Join Cond: (t1.c1 = t2.c1) shuffle: range(t1.c1)  𝄀
              ->  Table Scan on d1.t1  𝄀
              ->  Table Scan on d1.t2
select count(*) from t1,t2 where t1.c1=t2.c1;
➤ count(*)[-5,64,0]  𝄀
4000000
explain select count(*) as cnt from t1,t2 where t1.c1=t2.c1 group by t1.c1 having cnt>1;
➤ AP QUERY PLAN ON MULTICN(4 core)[12,0,0]  𝄀
Project  𝄀
  ->  Aggregate  𝄀
        Group Key: t1.c1 shuffle: REUSE  𝄀
        Aggregate Functions: starcount(1)  𝄀
        Filter Cond: (count(*) > 1)  𝄀
        ->  Join  𝄀
              Join Type: INNER  𝄀
              Join Cond: (t1.c1 = t2.c1) shuffle: range(t1.c1)  𝄀
              ->  Table Scan on d1.t1  𝄀
              ->  Table Scan on d1.t2
select count(*) as cnt from t1,t2 where t1.c1=t2.c1 group by t1.c1 having cnt>1;
➤ cnt[-5,64,0]
explain select count(*) from t1,t2 where t1.c1=t2.c2;
➤ AP QUERY PLAN ON MULTICN(4 core)[12,0,0]  𝄀
Project  𝄀
  ->  Aggregate  𝄀
        Aggregate Functions: starcount(1)  𝄀
        ->  Join  𝄀
              Join Type: INNER  𝄀
              Join Cond: (t1.c1 = t2.c2) shuffle: range(t1.c1)  𝄀
              ->  Table Scan on d1.t1  𝄀
              ->  Table Scan on d1.t2
select count(*) from t1,t2 where t1.c1=t2.c2;
➤ count(*)[-5,64,0]  𝄀
4000000
explain select count(*) from t1,t2 where t1.c2=t2.c1;
➤ AP QUERY PLAN ON MULTICN(4 core)[12,0,0]  𝄀
Project  𝄀
  ->  Aggregate  𝄀
        Aggregate Functions: starcount(1)  𝄀
        ->  Join  𝄀
              Join Type: INNER  𝄀
              Join Cond: (t1.c2 = t2.c1) shuffle: range(t1.c2)  𝄀
              ->  Table Scan on d1.t1  𝄀
              ->  Table Scan on d1.t2
select count(*) from t1,t2 where t1.c2=t2.c1;
➤ count(*)[-5,64,0]  𝄀
4000000
explain select count(*) from t1,t2 where t1.c2=t2.c2;
➤ AP QUERY PLAN ON MULTICN(4 core)[12,0,0]  𝄀
Project  𝄀
  ->  Aggregate  𝄀
        Aggregate Functions: starcount(1)  𝄀
        ->  Join  𝄀
              Join Type: INNER  𝄀
              Join Cond: (t1.c2 = t2.c2) shuffle: range(t1.c2)  𝄀
              ->  Table Scan on d1.t1  𝄀
              ->  Table Scan on d1.t2
select count(*) from t1,t2 where t1.c2=t2.c2;
➤ count(*)[-5,64,0]  𝄀
4000000
explain select count(*) from t1,t2 where t1.c2=t2.c2 and t2.c3<500000;
➤ AP QUERY PLAN ON MULTICN(4 core)[12,0,0]  𝄀
Project  𝄀
  ->  Aggregate  𝄀
        Aggregate Functions: starcount(1)  𝄀
        ->  Join  𝄀
              Join Type: INNER  𝄀
              Join Cond: (t1.c2 = t2.c2) shuffle: range(t1.c2)  𝄀
              ->  Table Scan on d1.t1  𝄀
              ->  Table Scan on d1.t2  𝄀
                    Filter Cond: (t2.c3 < 500000)  𝄀
                    Block Filter Cond: (t2.c3 < 500000)
select count(*) from t1,t2 where t1.c2=t2.c2 and t2.c3<500000;
➤ count(*)[-5,64,0]  𝄀
499999
explain select count(*) from t1,t2 where t1.c2=t2.c2 and t2.c3<1500000;
➤ AP QUERY PLAN ON MULTICN(4 core)[12,0,0]  𝄀
Project  𝄀
  ->  Aggregate  𝄀
        Aggregate Functions: starcount(1)  𝄀
        ->  Join  𝄀
              Join Type: INNER  𝄀
              Join Cond: (t1.c2 = t2.c2) shuffle: range(t1.c2)  𝄀
              ->  Table Scan on d1.t1  𝄀
              ->  Table Scan on d1.t2  𝄀
                    Filter Cond: (t2.c3 < 1500000)  𝄀
                    Block Filter Cond: (t2.c3 < 1500000)
select count(*) from t1,t2 where t1.c2=t2.c2 and t2.c3<1500000;
➤ count(*)[-5,64,0]  𝄀
1499999
explain select count(*) from t1 group by c1 limit 5;
➤ AP QUERY PLAN ON MULTICN(4 core)[12,0,0]  𝄀
Project  𝄀
  Limit: 5  𝄀
  ->  Aggregate  𝄀
        Group Key: t1.c1 shuffle: range(t1.c1)  𝄀
        Aggregate Functions: starcount(1)  𝄀
        ->  Table Scan on d1.t1
select count(*) from t1 group by c1 limit 5;
➤ count(*)[-5,64,0]  𝄀
1  𝄀
1  𝄀
1  𝄀
1  𝄀
1
explain select count(*) from t1 group by c2 limit 5;
➤ AP QUERY PLAN ON MULTICN(4 core)[12,0,0]  𝄀
Project  𝄀
  Limit: 5  𝄀
  ->  Aggregate  𝄀
        Group Key: t1.c2 shuffle: range(t1.c2)  𝄀
        Aggregate Functions: starcount(1)  𝄀
        ->  Table Scan on d1.t1
select count(*) from t1 group by c2 limit 5;
➤ count(*)[-5,64,0]  𝄀
1  𝄀
1  𝄀
1  𝄀
1  𝄀
1
explain select count(*) from t1 where t1.c2 in ( select c2 from t2 where t2.c3>100000 );
➤ AP QUERY PLAN ON MULTICN(4 core)[12,0,0]  𝄀
Project  𝄀
  ->  Aggregate  𝄀
        Aggregate Functions: starcount(1)  𝄀
        ->  Join  𝄀
              Join Type: SEMI  𝄀
              Join Cond: (t1.c2 = t2.c2) shuffle: range(t1.c2)  𝄀
              ->  Table Scan on d1.t1  𝄀
              ->  Table Scan on d1.t2  𝄀
                    Filter Cond: (t2.c3 > 100000)  𝄀
                    Block Filter Cond: (t2.c3 > 100000)
select count(*) from t1 where t1.c2 in ( select c2 from t2 where t2.c3>100000 );
➤ count(*)[-5,64,0]  𝄀
3900000
explain select count(*) from t1 where t1.c2 not in ( select c3 from t2 where t2.c3 between 100 and 700000 );
➤ AP QUERY PLAN ON MULTICN(4 core)[12,0,0]  𝄀
Project  𝄀
  ->  Aggregate  𝄀
        Aggregate Functions: starcount(1)  𝄀
        ->  Join  𝄀
              Join Type: ANTI  𝄀
              Join Cond: (t1.c2 = t2.c3) shuffle: range(t1.c2)  𝄀
              ->  Table Scan on d1.t1  𝄀
              ->  Table Scan on d1.t2  𝄀
                    Filter Cond: t2.c3 BETWEEN 100 AND 700000  𝄀
                    Block Filter Cond: t2.c3 BETWEEN 100 AND 700000
select count(*) from t1 where t1.c2 not in ( select c3 from t2 where t2.c3 between 100 and 700000 );
➤ count(*)[-5,64,0]  𝄀
4300099
explain select count(*) from t1 where t1.c3<800000 and t1.c2 not in ( select c3 from t2 where t2.c3 between 10000 and 600000 );
➤ AP QUERY PLAN ON ONE CN(4 core)[12,0,0]  𝄀
Project  𝄀
  ->  Aggregate  𝄀
        Aggregate Functions: starcount(1)  𝄀
        ->  Join  𝄀
              Join Type: ANTI  𝄀
              Join Cond: (t1.c2 = t2.c3) shuffle: range(t1.c2)  𝄀
              ->  Table Scan on d1.t1  𝄀
                    Filter Cond: (t1.c3 < 800000)  𝄀
                    Block Filter Cond: (t1.c3 < 800000)  𝄀
              ->  Table Scan on d1.t2  𝄀
                    Filter Cond: t2.c3 BETWEEN 10000 AND 600000  𝄀
                    Block Filter Cond: t2.c3 BETWEEN 10000 AND 600000
select count(*) from t1 where  t1.c3<800000 and t1.c2 not in ( select c3 from t2 where t2.c3 between 10000 and 600000 );
➤ count(*)[-5,64,0]  𝄀
209998
explain select count(*) from t1 where t1.c1 <300000 and  t1.c2 in ( select c2 from t2 where t2.c3>100000 );
➤ AP QUERY PLAN ON ONE CN(4 core)[12,0,0]  𝄀
Project  𝄀
  ->  Aggregate  𝄀
        Aggregate Functions: starcount(1)  𝄀
        ->  Join  𝄀
              Join Type: RIGHT SEMI  𝄀
              Join Cond: (t2.c2 = t1.c2) shuffle: range(t2.c2)  𝄀
              ->  Table Scan on d1.t2  𝄀
                    Filter Cond: (t2.c3 > 100000)  𝄀
                    Block Filter Cond: (t2.c3 > 100000)  𝄀
              ->  Table Scan on d1.t1  𝄀
                    Filter Cond: (t1.c1 < 300000)  𝄀
                    Block Filter Cond: (t1.c1 < 300000)
select count(*) from t1 where t1.c1 <300000 and  t1.c2 in ( select c2 from t2 where t2.c3>100000 );
➤ count(*)[-5,64,0]  𝄀
199999
explain select count(*) from t1 left join t2 on t1.c1=t2.c1 where t1.c3 >5000000;
➤ TP QUERY PLAN[12,0,0]  𝄀
Project  𝄀
  ->  Aggregate  𝄀
        Aggregate Functions: starcount(1)  𝄀
        ->  Join  𝄀
              Join Type: RIGHT  𝄀
              Join Cond: (t2.c1 = t1.c1)  𝄀
              Runtime Filter Build: #[-1,0]  𝄀
              ->  Table Scan on d1.t2 [ForceOneCN]  𝄀
                    Runtime Filter Probe: t2.c1  𝄀
              ->  Table Scan on d1.t1 [ForceOneCN]  𝄀
                    Filter Cond: (t1.c3 > 5000000)  𝄀
                    Block Filter Cond: (t1.c3 > 5000000)
select count(*) from t1 left join t2 on t1.c1=t2.c1 where t1.c3 >5000000;
➤ count(*)[-5,64,0]  𝄀
0
explain select count(*) from t1 left join t2 on t1.c1=t2.c1 and t1.c3 >t2.c3;
➤ AP QUERY PLAN ON MULTICN(4 core)[12,0,0]  𝄀
Project  𝄀
  ->  Aggregate  𝄀
        Aggregate Functions: starcount(1)  𝄀
        ->  Join  𝄀
              Join Type: LEFT  𝄀
              Join Cond: (t1.c1 = t2.c1), (t1.c3 > t2.c3) shuffle: range(t1.c1)  𝄀
              ->  Table Scan on d1.t1  𝄀
              ->  Table Scan on d1.t2
select count(*) from t1 left join t2 on t1.c1=t2.c1 and t1.c3 >t2.c3;
➤ count(*)[-5,64,0]  𝄀
5000000
explain select count(*) from t1 full join t2 on t1.c1=t2.c1;
➤ AP QUERY PLAN ON MULTICN(4 core)[12,0,0]  𝄀
Project  𝄀
  ->  Aggregate  𝄀
        Aggregate Functions: starcount(1)  𝄀
        ->  Join  𝄀
              Join Type: FULL OUTER  𝄀
              Join Cond: (t2.c1 = t1.c1) shuffle: range(t2.c1)  𝄀
              ->  Table Scan on d1.t2  𝄀
              ->  Table Scan on d1.t1
select count(*) from t1 full join t2 on t1.c1=t2.c1;
➤ count(*)[-5,64,0]  𝄀
5000000
explain select count(*) from t1 full outer join t2 on t1.c2=t2.c2;
➤ AP QUERY PLAN ON MULTICN(4 core)[12,0,0]  𝄀
Project  𝄀
  ->  Aggregate  𝄀
        Aggregate Functions: starcount(1)  𝄀
        ->  Join  𝄀
              Join Type: FULL OUTER  𝄀
              Join Cond: (t2.c2 = t1.c2) shuffle: range(t2.c2)  𝄀
              ->  Table Scan on d1.t2  𝄀
              ->  Table Scan on d1.t1
select count(*) from t1 full outer join t2 on t1.c2=t2.c2;
➤ count(*)[-5,64,0]  𝄀
5000000
create table t3(c1 int not null, c2 int not null)cluster by c1;
insert into t3 select *,* from generate_series(1,1000000)g;
select mo_ctl('dn', 'flush', 'd1.t3');
➤ mo_ctl(dn, flush, d1.t3)[12,-1,0]  𝄀
{
  "method": "Flush",
  "result": [
    {
      "returnStr": "OK"
    }
  ]
}

explain select count(*) from t3 where t3.c2 in (select c3 from t1 where t1.c2!=20000 and  t1.c2 not in ( select c2 from t2 where t2.c3>150000 ));
➤ AP QUERY PLAN ON MULTICN(4 core)[12,0,0]  𝄀
Project  𝄀
  ->  Aggregate  𝄀
        Aggregate Functions: starcount(1)  𝄀
        ->  Join  𝄀
              Join Type: SEMI  𝄀
              Join Cond: (t3.c2 = t1.c3)  𝄀
              Runtime Filter Build: #[-1,0]  𝄀
              ->  Table Scan on d1.t3  𝄀
                    Runtime Filter Probe: t3.c2  𝄀
              ->  Join  𝄀
                    Join Type: ANTI  𝄀
                    Join Cond: (t1.c2 = t2.c2) shuffle: range(t1.c2)  𝄀
                    ->  Table Scan on d1.t1  𝄀
                          Filter Cond: (t1.c2 <> 20000)  𝄀
                    ->  Table Scan on d1.t2  𝄀
                          Filter Cond: (t2.c3 > 150000)  𝄀
                          Block Filter Cond: (t2.c3 > 150000)
select count(*) from t3 where t3.c2 in (select c3 from t1 where t1.c2!=20000 and  t1.c2 not in ( select c2 from t2 where t2.c3>150000 ));
➤ count(*)[-5,64,0]  𝄀
149999
select count(*) from t3 where t3.c1<100000 and t3.c2 not in (select c3 from t1 where t1.c2!=30000 and  t1.c2  in ( select c2 from t2 where t2.c3<850000 ));
➤ count(*)[-5,64,0]  𝄀
1
select count(*) from t1,t2,t3 where t1.c1=t2.c1 and t1.c2=t3.c2 and t2.c2<900000 and t3.c1<500000;
➤ count(*)[-5,64,0]  𝄀
499999
explain select count(*) from (select c1 from t1 group by c1) s1, t2 where s1.c1=t2.c1 and t2.c2<1000000;
➤ AP QUERY PLAN ON MULTICN(4 core)[12,0,0]  𝄀
Project  𝄀
  ->  Aggregate  𝄀
        Aggregate Functions: starcount(1)  𝄀
        ->  Join  𝄀
              Join Type: INNER  𝄀
              Join Cond: (t1.c1 = t2.c1) shuffle: REUSE  𝄀
              ->  Aggregate  𝄀
                    Group Key: t1.c1 shuffle: range(t1.c1)  𝄀
                    ->  Table Scan on d1.t1  𝄀
              ->  Table Scan on d1.t2  𝄀
                    Filter Cond: (t2.c2 < 1000000)  𝄀
                    Block Filter Cond: (t2.c2 < 1000000)
select count(*) from (select c1 from t1 group by c1) s1, t2 where s1.c1=t2.c1 and t2.c2<1000000;
➤ count(*)[-5,64,0]  𝄀
999999
delete from t1 where c3%5=1;
insert into t1 values(-1,-2,-3);
insert into t1 values(10,11,12);
select count(*) from t1 where c3!=0;
➤ count(*)[-5,64,0]  𝄀
4000002
drop table t3;
create table t4(c1 int not null, c2  int unsigned) cluster by c1;
insert into t4 select *,* from generate_series(1000000) g;
insert into t4 select result+10000000,result+10000000 from generate_series(1000000) g;
select mo_ctl('dn', 'flush', 'd1.t4');
➤ mo_ctl(dn, flush, d1.t4)[12,-1,0]  𝄀
{
  "method": "Flush",
  "result": [
    {
      "returnStr": "OK"
    }
  ]
}

explain select count(*) as cnt from t4 group by c1 having cnt>1;
➤ AP QUERY PLAN ON ONE CN(4 core)[12,0,0]  𝄀
Project  𝄀
  ->  Aggregate  𝄀
        Group Key: t4.c1 shuffle: range(t4.c1)  𝄀
        Aggregate Functions: starcount(1)  𝄀
        Filter Cond: (count(*) > 1)  𝄀
        ->  Table Scan on d1.t4
select count(*) as cnt from t4 group by c1 having cnt>1;
➤ cnt[-5,64,0]
explain select count(*) as cnt from t4 group by c2 having cnt>1;
➤ AP QUERY PLAN ON ONE CN(4 core)[12,0,0]  𝄀
Project  𝄀
  ->  Aggregate  𝄀
        Group Key: t4.c2 shuffle: range(t4.c2)  𝄀
        Aggregate Functions: starcount(1)  𝄀
        Filter Cond: (count(*) > 1)  𝄀
        ->  Table Scan on d1.t4
select count(*) as cnt from t4 group by c2 having cnt>1;
➤ cnt[-5,64,0]
drop database if exists d1;
drop database if exists test;
create database test;
use test;
create table t1(a int primary key, b int);
select enable_fault_injection();
➤ enable_fault_injection()[-7,1,0]  𝄀
1
select add_fault_point('fj/cn/flush_small_objs',':::','echo',40,'test.t1');
➤ add_fault_point(fj/cn/flush_small_objs, :::, echo, 40, test.t1)[-7,1,0]  𝄀
1
insert into t1 select *, 1 from generate_series(1, 1000*1000*10)g;
select sum(b) from t1;
➤ sum(b)[-5,64,0]  𝄀
10000000
update t1 set b = b + 1 where a mod 100 = 0;
select sum(b) from t1;
➤ sum(b)[-5,64,0]  𝄀
10100000
select disable_fault_injection();
➤ disable_fault_injection()[-7,1,0]  𝄀
1
drop database if exists test;
