SELECT 'a' LIKE 'ae';
a like ae
false
SELECT 'ae' LIKE 'a';
ae like a
false
SELECT 'MYSQL' LIKE 'mysql';
MYSQL like mysql
false
SELECT 'David!' LIKE 'David_';
David! like David_
true
SELECT 'David!' LIKE '%D%v%';
David! like %D%v%
true
SELECT 'David!' LIKE 'David\_';
David! like David\_
false
SELECT 'David_' LIKE 'David\_';
David_ like David\_
false
DROP TABLE IF EXISTS like_test;
CREATE TABLE like_test(
str1 VARCHAR(50)
);
INSERT INTO like_test VALUES('D:');
INSERT INTO like_test VALUES('D:\\');
INSERT INTO like_test VALUES('D:\\System_files');
INSERT INTO like_test VALUES('D:\\System_files\\');
INSERT INTO like_test VALUES(NULL);
INSERT INTO like_test VALUES('NULL');
INSERT INTO like_test VALUES('  A');
INSERT INTO like_test VALUES('s _');
SELECT * FROM like_test WHERE str1 LIKE '%:';
str1
D:
SELECT * FROM like_test WHERE str1 LIKE '%\_%';
str1
D:\System_files
D:\System_files\
s _
SELECT * FROM like_test WHERE str1 LIKE '___';
str1
D:\
  A
s _
SELECT * FROM like_test WHERE str1 LIKE ' %';
str1
  A
SELECT * FROM like_test WHERE str1 LIKE NULL;
str1
SELECT * FROM like_test WHERE str1 LIKE '_:%';
str1
D:
D:\
D:\System_files
D:\System_files\
SELECT * FROM like_test WHERE str1 LIKE 's__';
str1
s _
SELECT * FROM like_test WHERE str1 LIKE '%s';
str1
D:\System_files
SELECT * FROM like_test WHERE str1 LIKE 'd%';
str1
SELECT * FROM like_test WHERE str1 LIKE '%%';
str1
D:
D:\
D:\System_files
D:\System_files\
NULL
  A
s _
SELECT * FROM like_test WHERE str1 IS NULL;
str1
null
SELECT * FROM like_test WHERE str1 LIKE '%U%';
str1
NULL
SELECT * FROM like_test WHERE str1 LIKE '%:%' AND str1 LIKE '%s%';
str1
D:\System_files
D:\System_files\
SELECT * FROM like_test WHERE str1 LIKE '' AND str1 LIKE 's%';
str1
SELECT * FROM like_test WHERE str1 LIKE '% %' AND str1 LIKE '%N%';
str1
SELECT * FROM like_test WHERE str1 LIKE '%L' OR str1 LIKE '%s%';
str1
D:\System_files
D:\System_files\
NULL
s _
SELECT * FROM like_test WHERE str1 LIKE '% %' OR str1 LIKE '%N%';
str1
NULL
  A
s _
SELECT * FROM (SELECT * FROM like_test WHERE str1 LIKE 'D%') AS a WHERE LENGTH(str1) > 4;
str1
D:\System_files
D:\System_files\
SELECT str1 FROM (SELECT * FROM like_test WHERE str1 LIKE '_:%') AS T WHERE str1 LIKE '%S%';
str1
D:\System_files
D:\System_files\
SELECT * FROM like_test WHERE str1 NOT LIKE '___';
str1
D:
D:\System_files
D:\System_files\
NULL
SELECT * FROM like_test WHERE str1 NOT LIKE 'D%';
str1
NULL
  A
s _
SELECT * FROM like_test WHERE str1 NOT LIKE '%\_%';
str1
D:
D:\
NULL
  A
SELECT * FROM like_test WHERE str1 NOT LIKE 'NULL';
str1
D:
D:\
D:\System_files
D:\System_files\
  A
s _
SELECT * FROM like_test WHERE str1 NOT LIKE NULL;
str1
SELECT * FROM like_test WHERE str1 NOT LIKE '';
str1
D:
D:\
D:\System_files
D:\System_files\
NULL
  A
s _
SELECT COUNT(*) FROM like_test WHERE str1 LIKE '%baz%';
count(*)
0
SELECT COUNT(*) FROM like_test WHERE str1 NOT LIKE '%baz%';
count(*)
7
SELECT COUNT(*) FROM like_test WHERE str1 NOT LIKE '%baz%' OR str1 IS NULL;
count(*)
8
SELECT str1, str1 LIKE '%\\' FROM like_test;
str1    str1 like %\\
D:    false
D:\    true
D:\System_files    false
D:\System_files\    true
null    null
NULL    false
  A    false
s _    false
SELECT str1, str1 LIKE '%\\\\' FROM like_test;
[unknown result because it is related to issue#5078]
DELETE FROM like_test;
INSERT INTO like_test VALUES('99.9');
INSERT INTO like_test VALUES('88');
INSERT INTO like_test VALUES('89.88');
INSERT INTO like_test VALUES(19.88);
INSERT INTO like_test VALUES(2887.08);
SELECT * FROM like_test WHERE str1 LIKE '9%';
str1
99.9
SELECT * FROM like_test WHERE str1 LIKE '%9';
str1
99.9
SELECT * FROM like_test WHERE str1 LIKE '%88';
str1
88
89.88
19.88
SELECT * FROM like_test WHERE str1 NOT LIKE '%88';
str1
99.9
2887.08
DELETE FROM like_test;
INSERT INTO like_test VALUES('ABC1_23D');
INSERT INTO like_test VALUES('123ABCD\\');
INSERT INTO like_test VALUES('ABCD\\123');
INSERT INTO like_test VALUES(' ');
SELECT * FROM like_test WHERE str1 LIKE '%D\\%';
str1
SELECT * FROM like_test WHERE str1 LIKE '% ';
str1
 
SELECT * FROM like_test WHERE str1 LIKE '%3_';
str1
ABC1_23D
DROP TABLE IF EXISTS like_test;
CREATE TABLE like_test(
str1 VARCHAR(50),
str2 CHAR(50)
);
INSERT INTO like_test(str1, str2) VALUES('CHINA IS OUR HOMELAND', 'BEIJING IS THE CAPITAL');
INSERT INTO like_test(str1, str2) VALUES('DHINA IS OUR HOMELAN ', 'THIS MAN PUSH HIM');
INSERT INTO like_test(str1, str2) VALUES(' HINA IS OUR HOMELAND%', 'HE LIKE WHORE');
INSERT INTO like_test(str1, str2) VALUES('THE UNITED OF AMERICAN_', 'NORTH AMERICA');
INSERT INTO like_test(str1, str2) VALUES('AB%CDE', 'PDFXLXDOC');
INSERT INTO like_test(str1, str2) VALUES('THE UNITED OF ENGLAND\\', "KINGDOM'");
INSERT INTO like_test(str1, str2) VALUES(' ', '');
INSERT INTO like_test(str1, str2) VALUES('', NULL);
INSERT INTO like_test(str1, str2) VALUES('法的萨菲厄张三三三三三', '考虑理论可看见年年年年年年');
SELECT NULL LIKE 'ABC', 'ABC' LIKE NULL;
null like ABC    ABC like null
null    null
SELECT * FROM like_test WHERE str1 LIKE 'C%';
str1    str2
CHINA IS OUR HOMELAND    BEIJING IS THE CAPITAL
SELECT * FROM like_test WHERE str1 LIKE '% ';
str1    str2
DHINA IS OUR HOMELAN     THIS MAN PUSH HIM
     
SELECT * FROM like_test WHERE str1 LIKE '%s%';
str1    str2
SELECT * FROM like_test WHERE str1 LIKE '%C%' AND str1 LIKE '%D%';
str1    str2
CHINA IS OUR HOMELAND    BEIJING IS THE CAPITAL
THE UNITED OF AMERICAN_    NORTH AMERICA
AB%CDE    PDFXLXDOC
SELECT * FROM like_test WHERE str2 LIKE '__I%';
str1    str2
CHINA IS OUR HOMELAND    BEIJING IS THE CAPITAL
DHINA IS OUR HOMELAN     THIS MAN PUSH HIM
SELECT * FROM like_test WHERE str2 LIKE '__ %';
str1    str2
 HINA IS OUR HOMELAND%    HE LIKE WHORE
SELECT * FROM like_test WHERE str2 LIKE '';
str1    str2
     
SELECT * FROM like_test WHERE str2 LIKE NULL;
str1    str2
SELECT * FROM like_test WHERE str1 LIKE '%\\';
str1    str2
THE UNITED OF ENGLAND\    KINGDOM'
SELECT * FROM like_test WHERE str2 LIKE '%\'';
str1    str2
THE UNITED OF ENGLAND\    KINGDOM'
SELECT * FROM like_test WHERE str1 LIKE '%三__';
str1    str2
法的萨菲厄张三三三三三    考虑理论可看见年年年年年年
SELECT * FROM like_test WHERE str1 LIKE '%\%';
[unknown result because it is related to issue#5056]
SELECT * FROM like_test WHERE str1 NOT LIKE 'D%';
str1    str2
CHINA IS OUR HOMELAND    BEIJING IS THE CAPITAL
 HINA IS OUR HOMELAND%    HE LIKE WHORE
THE UNITED OF AMERICAN_    NORTH AMERICA
AB%CDE    PDFXLXDOC
THE UNITED OF ENGLAND\    KINGDOM'
     
    null
法的萨菲厄张三三三三三    考虑理论可看见年年年年年年
SELECT * FROM like_test WHERE str1 NOT LIKE '%E';
str1    str2
CHINA IS OUR HOMELAND    BEIJING IS THE CAPITAL
DHINA IS OUR HOMELAN     THIS MAN PUSH HIM
 HINA IS OUR HOMELAND%    HE LIKE WHORE
THE UNITED OF AMERICAN_    NORTH AMERICA
THE UNITED OF ENGLAND\    KINGDOM'
     
    null
法的萨菲厄张三三三三三    考虑理论可看见年年年年年年
DELETE FROM like_test;
DROP TABLE like_test;
DROP TABLE IF EXISTS chinese_test;
CREATE TABLE chinese_test(
name VARCHAR(50),
home VARCHAR(100),
job VARCHAR(20)
);
INSERT INTO chinese_test VALUES('张三', '河南省信阳市桥东区广平小区', '软件工程师');
INSERT INTO chinese_test VALUES('张飞', '北京市朝阳区天宫苑桥东街道', '教师');
INSERT INTO chinese_test VALUES('里斯', '广东省广州村', '学生教师');
INSERT INTO chinese_test VALUES('刘五', '%%%江苏省南京市金区陵新村', '%%工人');
SELECT name FROM chinese_test WHERE home LIKE '%桥东%';
name
张三
张飞
SELECT * FROM chinese_test WHERE name LIKE '张%';
name    home    job
张三    河南省信阳市桥东区广平小区    软件工程师
张飞    北京市朝阳区天宫苑桥东街道    教师
SELECT * FROM (SELECT * FROM chinese_test WHERE name LIKE '张%') AS a WHERE home LIKE '%广%';
name    home    job
张三    河南省信阳市桥东区广平小区    软件工程师
SELECT * FROm (SELECT * FROM chinese_test WHERE job LIKE '%师') AS a WHERE home LIKE '%市%';
name    home    job
张三    河南省信阳市桥东区广平小区    软件工程师
张飞    北京市朝阳区天宫苑桥东街道    教师
SELECT name FROM chinese_test WHERE home LIKE '\%%' AND job LIKE '\%%';
name
刘五
SELECT * FROM chinese_test WHERE home LIKE '%省%区';
name    home    job
张三    河南省信阳市桥东区广平小区    软件工程师
DROP TABLE chinese_test;
CREATE TABLE stu(
id INT PRIMARY KEY,
name VARCHAR(20),
class INT,
sex VARCHAR(2),
address VARCHAR(50)
);
CREATE TABLE score(
id INT PRIMARY KEY,
name VARCHAR(20),
chinese FLOAT,
math FLOAT,
english FLOAT
);
INSERT INTO stu VALUES('1001', 'JACK', 7, 'M', 'US');
INSERT INTO stu VALUES('1002', 'TOM', 7, '', 'UK');
INSERT INTO stu VALUES('1005', 'ROMMY', 8, 'F', 'CHINA');
INSERT INTO stu VALUES('1006', 'RACK', 8, 'M', 'ITALY');
INSERT INTO score VALUES('1001', 'JACK', 89.5, 45.2, 67.5);
INSERT INTO score VALUES('1002', 'TOM', 58.5, 76, 78);
INSERT INTO score VALUES('1005', 'ROMMY', 68, 55, 69);
SELECT * FROM stu INNER JOIN score ON stu.id = score.id WHERE stu.name LIKE '_O%';
id    name    class    sex    address    id    name    chinese    math    english
1002    TOM    7        UK    1002    TOM    58.5    76.0    78.0
1005    ROMMY    8    F    CHINA    1005    ROMMY    68.0    55.0    69.0
SELECT * FROM stu INNER JOIN score ON stu.id = score.id WHERE score.math > 60 AND stu.address LIKE 'U%_';
id    name    class    sex    address    id    name    chinese    math    english
1002    TOM    7        UK    1002    TOM    58.5    76.0    78.0
SELECT * FROM stu RIGHT JOIN score ON stu.id = score.id WHERE score.english > 65 AND stu.sex LIKE '%';
id    name    class    sex    address    id    name    chinese    math    english
1001    JACK    7    M    US    1001    JACK    89.5    45.2    67.5
1002    TOM    7        UK    1002    TOM    58.5    76.0    78.0
1005    ROMMY    8    F    CHINA    1005    ROMMY    68.0    55.0    69.0
SELECT * FROM stu WHERE address LIKE '%A%' AND name LIKE '%R%';
id    name    class    sex    address
1005    ROMMY    8    F    CHINA
1006    RACK    8    M    ITALY
SELECT * FROM stu INNER JOIN score ON stu.id = score.id WHERE stu.address NOT LIKE 'CH%';
id    name    class    sex    address    id    name    chinese    math    english
1001    JACK    7    M    US    1001    JACK    89.5    45.2    67.5
1002    TOM    7        UK    1002    TOM    58.5    76.0    78.0
SELECT * FROM stu WHERE name NOT LIKE '%A%';
id    name    class    sex    address
1002    TOM    7        UK
1005    ROMMY    8    F    CHINA
SELECT
stu.id, stu.name, stu.address, a.chinese, a.english
FROM
(SELECT * FROM score WHERE math < 60 AND name LIKE '%M__') AS a,stu
WHERE
a.id = stu.id AND stu.address LIKE '%H%';
id    name    address    chinese    english
1005    ROMMY    CHINA    68.0    69.0
SELECT
stu.name, stu.address
FROM
(SELECT * FROm score WHERE chinese BETWEEN 60 AND 70) AS a, stu
WHERE
a.id = stu.id AND address LIKE SUBSTRING('THE CHINA',5);
name    address
ROMMY    CHINA
SELECT
stu.id, stu.name, stu.address, score.english
FROM
stu
INNER JOIN
score
ON
stu.id = score.id
WHERE stu.sex NOT LIKE '';
id    name    address    english
1001    JACK    US    67.5
1005    ROMMY    CHINA    69.0
DROP TABLE IF EXISTS stu;
DROP TABLE IF EXISTS score;

create table t1(a tinyint, b smallint, c int, d bigint);
insert into t1 values(121, 121, 121, 121);
select * from t1 where (a like '%2%' and b like '%2%' and c like '%2%' and d like '%2%');
a    b    c    d
121    121    121    121
drop table t1;

create table t1(a tinyint unsigned, b smallint unsigned, c int unsigned, d bigint unsigned);
insert into t1 values(121, 121, 121, 121);
select * from t1 where (a like '%2%' and b like '%2%' and c like '%2%' and d like '%2%');
a    b    c    d
121    121    121    121
