drop table if exists trun_table_01;
drop table if exists trun_table_02;
drop table if exists trun_table_03;
create table trun_table_01(clo1 tinyint AUTO_INCREMENT,clo2 smallint not null,clo3 int,clo4 bigint,clo5 tinyint unsigned,clo6 smallint unsigned,clo7 int unsigned,clo8 bigint unsigned,col9 float,col10 double,col11 varchar(255) default 'style',col12 Date,col13 DateTime,col14 timestamp,col15 bool,col16 decimal(5,2),col17 text,col18 json,primary key(clo3,col12),unique key uk1 (col16),key k1 (clo1));
insert into trun_table_01 values (1,-2,3,56,9,8,10,50,99.0,82.99,'yellllow','1999-11-11','1999-11-11 12:00:00','2010-11-11 11:00:00.00',false,23.98430943,'tttext','{"a": "3","b": [0,1,2]}');
insert into trun_table_01 values (2,-2,90,56,9,8,10,50,99.0,82.99,'yellllow','2011-01-21','1999-11-11 12:00:00','2010-11-11 11:00:00.00',false,98.23,'tttext','{"a": "3","b": [0,1,2]}');
insert into trun_table_01 values (3,-2,100,56,9,8,10,50,99.0,82.99,'yellllow','2021-01-21','1999-11-11 12:00:00','2010-11-11 11:00:00.00',false,77.3,'tttext','{"a": "3","b": [0,1,2]}');
insert into trun_table_01 values (4,-2,102,56,9,8,10,50,99.0,82.99,'yellllow','2022-10-11','1999-11-11 12:00:00','2010-11-11 11:00:00.00',false,209.43,'tttext','{"a": "3","b": [0,1,2]}');
select * from trun_table_01;
clo1    clo2    clo3    clo4    clo5    clo6    clo7    clo8    col9    col10    col11    col12    col13    col14    col15    col16    col17    col18
1    -2    3    56    9    8    10    50    99.0    82.99    yellllow    1999-11-11    1999-11-11 12:00:00    2010-11-11 11:00:00    false    23.98    tttext    {"a": "3", "b": [0, 1, 2]}
2    -2    90    56    9    8    10    50    99.0    82.99    yellllow    2011-01-21    1999-11-11 12:00:00    2010-11-11 11:00:00    false    98.23    tttext    {"a": "3", "b": [0, 1, 2]}
3    -2    100    56    9    8    10    50    99.0    82.99    yellllow    2021-01-21    1999-11-11 12:00:00    2010-11-11 11:00:00    false    77.30    tttext    {"a": "3", "b": [0, 1, 2]}
4    -2    102    56    9    8    10    50    99.0    82.99    yellllow    2022-10-11    1999-11-11 12:00:00    2010-11-11 11:00:00    false    209.43    tttext    {"a": "3", "b": [0, 1, 2]}
truncate table trun_table_01;
select * from trun_table_01;
clo1    clo2    clo3    clo4    clo5    clo6    clo7    clo8    col9    col10    col11    col12    col13    col14    col15    col16    col17    col18
truncate table trun_table_01;
select * from trun_table_01;
clo1    clo2    clo3    clo4    clo5    clo6    clo7    clo8    col9    col10    col11    col12    col13    col14    col15    col16    col17    col18
insert into trun_table_01(clo2 ,clo3 ,clo4,clo5,clo6,clo7,clo8 ,col9,col10,col11,col12,col13,col14,col15,col16,col17,col18) values (-2,3,56,9,8,10,50,99.0,82.99,'yellllow','1999-11-11','1999-11-11 12:00:00','2010-11-11 11:00:00.00',false,54.3,'tttext','{"a": "3","b": [0,1,2]}');
insert into trun_table_01(clo2 ,clo3 ,clo4,clo5,clo6,clo7,clo8 ,col9,col10,col11,col12,col13,col14,col15,col16,col17,col18) values (-2,90,56,9,8,10,50,99.0,82.99,'yellllow','2011-01-21','1999-11-11 12:00:00','2010-11-11 11:00:00.00',false,11.43,'tttext','{"a": "3","b": [0,1,2]}');
select * from trun_table_01;
clo1    clo2    clo3    clo4    clo5    clo6    clo7    clo8    col9    col10    col11    col12    col13    col14    col15    col16    col17    col18
1    -2    3    56    9    8    10    50    99.0    82.99    yellllow    1999-11-11    1999-11-11 12:00:00    2010-11-11 11:00:00    false    54.30    tttext    {"a": "3", "b": [0, 1, 2]}
2    -2    90    56    9    8    10    50    99.0    82.99    yellllow    2011-01-21    1999-11-11 12:00:00    2010-11-11 11:00:00    false    11.43    tttext    {"a": "3", "b": [0, 1, 2]}
update trun_table_01 set clo3=90 ,col12='2011-01-21' where clo1=1;
Duplicate entry '3a155a41170b33cd' for key '__mo_cpkey_004clo3005col12'
update trun_table_01 set clo3=66 ,col12='2011-01-21' where clo1=1;
select * from trun_table_01;
clo1    clo2    clo3    clo4    clo5    clo6    clo7    clo8    col9    col10    col11    col12    col13    col14    col15    col16    col17    col18
2    -2    90    56    9    8    10    50    99.0    82.99    yellllow    2011-01-21    1999-11-11 12:00:00    2010-11-11 11:00:00    false    11.43    tttext    {"a": "3", "b": [0, 1, 2]}
1    -2    66    56    9    8    10    50    99.0    82.99    yellllow    2011-01-21    1999-11-11 12:00:00    2010-11-11 11:00:00    false    54.30    tttext    {"a": "3", "b": [0, 1, 2]}
truncate  table trun_table_01;
select * from trun_table_01;
clo1    clo2    clo3    clo4    clo5    clo6    clo7    clo8    col9    col10    col11    col12    col13    col14    col15    col16    col17    col18
delete from  trun_table_01 where clo1=2;
select * from trun_table_01;
clo1    clo2    clo3    clo4    clo5    clo6    clo7    clo8    col9    col10    col11    col12    col13    col14    col15    col16    col17    col18
insert into trun_table_01(clo2,clo3,col12) select 36,118,'2002-12-03';
insert into trun_table_01(clo2,clo3,col12) select 45,108,'2012-02-23';
select * from trun_table_01;
clo1    clo2    clo3    clo4    clo5    clo6    clo7    clo8    col9    col10    col11    col12    col13    col14    col15    col16    col17    col18
1    36    118    null    null    null    null    null    null    null    style    2002-12-03    null    null    null    null    null    null
2    45    108    null    null    null    null    null    null    null    style    2012-02-23    null    null    null    null    null    null
truncate table trun_table_01;
select * from trun_table_01;
clo1    clo2    clo3    clo4    clo5    clo6    clo7    clo8    col9    col10    col11    col12    col13    col14    col15    col16    col17    col18
drop table trun_table_01;
create table trun_table_01(clo1 tinyint AUTO_INCREMENT,clo2 smallint not null,clo3 int,clo4 bigint,clo5 tinyint unsigned,clo6 smallint unsigned,clo7 int unsigned,clo8 bigint unsigned,col9 float,col10 double,col11 varchar(255) default 'style',col12 Date,col13 DateTime,col14 timestamp,col15 bool,col16 decimal(5,2),col17 text,col18 json,primary key(clo3,col12),unique key uk1 (col16),key k1 (clo1));
insert into trun_table_01 values (1,-2,3,56,9,8,10,50,99.0,82.99,'yellllow','1999-11-11','1999-11-11 12:00:00','2010-11-11 11:00:00.00',false,23.98430943,'tttext','{"a": "3","b": [0,1,2]}');
select * from trun_table_01;
clo1    clo2    clo3    clo4    clo5    clo6    clo7    clo8    col9    col10    col11    col12    col13    col14    col15    col16    col17    col18
1    -2    3    56    9    8    10    50    99.0    82.99    yellllow    1999-11-11    1999-11-11 12:00:00    2010-11-11 11:00:00    false    23.98    tttext    {"a": "3", "b": [0, 1, 2]}
create temporary table trun_table_02(clo1 tinyint AUTO_INCREMENT,clo2 smallint not null,clo3 int,clo4 bigint,clo5 tinyint unsigned,clo6 smallint unsigned,clo7 int unsigned,clo8 bigint unsigned,col9 float,col10 double,col11 varchar(255) default 'style',col12 Date,col13 DateTime,col14 timestamp,col15 bool,col16 decimal(5,2),col17 text,col18 json,primary key(clo3,col12),unique key uk1 (col16),key k1 (clo1));
insert into trun_table_02 values (1,-2,3,56,9,8,10,50,99.0,82.99,'yellllow','1999-11-11','1999-11-11 12:00:00','2010-11-11 11:00:00.00',false,23.98430943,'tttext','{"a": "3","b": [0,1,2]}');
insert into trun_table_02 values (2,-2,90,56,9,8,10,50,99.0,82.99,'yellllow','2011-01-21','1999-11-11 12:00:00','2010-11-11 11:00:00.00',false,98.23,'tttext','{"a": "3","b": [0,1,2]}');
insert into trun_table_02 values (3,-2,100,56,9,8,10,50,99.0,82.99,'yellllow','2021-01-21','1999-11-11 12:00:00','2010-11-11 11:00:00.00',false,77.3,'tttext','{"a": "3","b": [0,1,2]}');
insert into trun_table_02 values (4,-2,102,56,9,8,10,50,99.0,82.99,'yellllow','2022-10-11','1999-11-11 12:00:00','2010-11-11 11:00:00.00',false,209.43,'tttext','{"a": "3","b": [0,1,2]}');
select * from trun_table_02;
clo1    clo2    clo3    clo4    clo5    clo6    clo7    clo8    col9    col10    col11    col12    col13    col14    col15    col16    col17    col18
1    -2    3    56    9    8    10    50    99.0    82.99    yellllow    1999-11-11    1999-11-11 12:00:00    2010-11-11 11:00:00    false    23.98    tttext    {"a": "3", "b": [0, 1, 2]}
2    -2    90    56    9    8    10    50    99.0    82.99    yellllow    2011-01-21    1999-11-11 12:00:00    2010-11-11 11:00:00    false    98.23    tttext    {"a": "3", "b": [0, 1, 2]}
3    -2    100    56    9    8    10    50    99.0    82.99    yellllow    2021-01-21    1999-11-11 12:00:00    2010-11-11 11:00:00    false    77.30    tttext    {"a": "3", "b": [0, 1, 2]}
4    -2    102    56    9    8    10    50    99.0    82.99    yellllow    2022-10-11    1999-11-11 12:00:00    2010-11-11 11:00:00    false    209.43    tttext    {"a": "3", "b": [0, 1, 2]}
truncate table trun_table_02;
select * from trun_table_02;
clo1    clo2    clo3    clo4    clo5    clo6    clo7    clo8    col9    col10    col11    col12    col13    col14    col15    col16    col17    col18
delete from trun_table_02 where clo1=1;
insert into trun_table_02 values (3,-2,100,56,9,8,10,50,99.0,82.99,'yellllow','2021-01-21','1999-11-11 12:00:00','2010-11-11 11:00:00.00',false,23.98430943,'tttext','{"a": "3","b": [0,1,2]}');
insert into trun_table_02 values (4,-2,102,56,9,8,10,50,99.0,82.99,'yellllow','2022-10-11','1999-11-11 12:00:00','2010-11-11 11:00:00.00',false,2.43,'tttext','{"a": "3","b": [0,1,2]}');
select * from trun_table_02;
clo1    clo2    clo3    clo4    clo5    clo6    clo7    clo8    col9    col10    col11    col12    col13    col14    col15    col16    col17    col18
3    -2    100    56    9    8    10    50    99.0    82.99    yellllow    2021-01-21    1999-11-11 12:00:00    2010-11-11 11:00:00    false    23.98    tttext    {"a": "3", "b": [0, 1, 2]}
4    -2    102    56    9    8    10    50    99.0    82.99    yellllow    2022-10-11    1999-11-11 12:00:00    2010-11-11 11:00:00    false    2.43    tttext    {"a": "3", "b": [0, 1, 2]}
delete from trun_table_02 where clo1=3;
select * from trun_table_02;
clo1    clo2    clo3    clo4    clo5    clo6    clo7    clo8    col9    col10    col11    col12    col13    col14    col15    col16    col17    col18
4    -2    102    56    9    8    10    50    99.0    82.99    yellllow    2022-10-11    1999-11-11 12:00:00    2010-11-11 11:00:00    false    2.43    tttext    {"a": "3", "b": [0, 1, 2]}
truncate table trun_table_02;
select * from trun_table_02;
clo1    clo2    clo3    clo4    clo5    clo6    clo7    clo8    col9    col10    col11    col12    col13    col14    col15    col16    col17    col18
insert into trun_table_02 select * from trun_table_01;
select * from trun_table_02;
clo1    clo2    clo3    clo4    clo5    clo6    clo7    clo8    col9    col10    col11    col12    col13    col14    col15    col16    col17    col18
1    -2    3    56    9    8    10    50    99.0    82.99    yellllow    1999-11-11    1999-11-11 12:00:00    2010-11-11 11:00:00    false    23.98    tttext    {"a": "3", "b": [0, 1, 2]}
update trun_table_02 set clo3=90 where clo1=1;
select * from trun_table_02;
clo1    clo2    clo3    clo4    clo5    clo6    clo7    clo8    col9    col10    col11    col12    col13    col14    col15    col16    col17    col18
1    -2    90    56    9    8    10    50    99.0    82.99    yellllow    1999-11-11    1999-11-11 12:00:00    2010-11-11 11:00:00    false    23.98    tttext    {"a": "3", "b": [0, 1, 2]}
update trun_table_02 set clo3=90, col12='1992-11-01' where clo1=1;
select * from trun_table_02;
clo1    clo2    clo3    clo4    clo5    clo6    clo7    clo8    col9    col10    col11    col12    col13    col14    col15    col16    col17    col18
1    -2    90    56    9    8    10    50    99.0    82.99    yellllow    1992-11-01    1999-11-11 12:00:00    2010-11-11 11:00:00    false    23.98    tttext    {"a": "3", "b": [0, 1, 2]}
truncate table trun_table_02;
select * from trun_table_02;
clo1    clo2    clo3    clo4    clo5    clo6    clo7    clo8    col9    col10    col11    col12    col13    col14    col15    col16    col17    col18
drop table trun_table_02;
create external table trun_table_03(clo1 tinyint AUTO_INCREMENT,clo2 smallint not null,clo3 int,clo4 bigint,clo5 tinyint unsigned,clo6 smallint unsigned,clo7 int unsigned,clo8 bigint unsigned,col9 float,col10 double,col11 varchar(255) default 'style',col12 Date,col13 DateTime,col14 timestamp,col15 bool,col16 decimal(5,2),col17 text,col18 json)infile{"filepath"='$resources/external_table_file/trun_table.csv'} fields terminated by '|' lines terminated by '\n';
select * from  trun_table_03;
clo1    clo2    clo3    clo4    clo5    clo6    clo7    clo8    col9    col10    col11    col12    col13    col14    col15    col16    col17    col18
1    -2    3    56    9    8    10    50    99.0    82.99    yellllow    1999-11-11    1999-11-11 12:00:00    2010-11-11 19:00:00    false    23.98    tttext    {"a": "3", "b": [0, 1, 2]}
2    -2    90    56    9    8    10    50    99.0    82.99    yellllow    2011-01-21    1999-11-11 12:00:00    2010-11-11 19:00:00    false    23.98    tttext    {"a": "3", "b": [0, 1, 2]}
3    -2    100    56    9    8    10    50    99.0    82.99    yellllow    2021-01-21    1999-11-11 12:00:00    2010-11-11 19:00:00    false    23.98    tttext    {"a": "3", "b": [0, 1, 2]}
4    -2    102    56    9    8    10    50    99.0    82.99    yellllow    2022-10-11    1999-11-11 12:00:00    2010-11-11 19:00:00    false    23.98    tttext    {"a": "3", "b": [0, 1, 2]}
truncate table trun_table_03;
select * from  trun_table_03;
clo1    clo2    clo3    clo4    clo5    clo6    clo7    clo8    col9    col10    col11    col12    col13    col14    col15    col16    col17    col18
1    -2    3    56    9    8    10    50    99.0    82.99    yellllow    1999-11-11    1999-11-11 12:00:00    2010-11-11 19:00:00    false    23.98    tttext    {"a": "3", "b": [0, 1, 2]}
2    -2    90    56    9    8    10    50    99.0    82.99    yellllow    2011-01-21    1999-11-11 12:00:00    2010-11-11 19:00:00    false    23.98    tttext    {"a": "3", "b": [0, 1, 2]}
3    -2    100    56    9    8    10    50    99.0    82.99    yellllow    2021-01-21    1999-11-11 12:00:00    2010-11-11 19:00:00    false    23.98    tttext    {"a": "3", "b": [0, 1, 2]}
4    -2    102    56    9    8    10    50    99.0    82.99    yellllow    2022-10-11    1999-11-11 12:00:00    2010-11-11 19:00:00    false    23.98    tttext    {"a": "3", "b": [0, 1, 2]}
truncate table trun_table_03;
drop table trun_table_03;
create external table trun_table_03(clo1 tinyint AUTO_INCREMENT,clo2 smallint not null,clo3 int,clo4 bigint,clo5 tinyint unsigned,clo6 smallint unsigned,clo7 int unsigned,clo8 bigint unsigned,col9 float,col10 double,col11 varchar(255) default 'style',col12 Date,col13 DateTime,col14 timestamp,col15 bool,col16 decimal(5,2),col17 text,col18 json)infile{"filepath"='$resources/external_table_file/trun_table.csv'} fields terminated by '|'  lines terminated by '\n';
drop table trun_table_03;
use mo_catalog;
truncate table mo_database;
internal error: do not have privilege to execute the statement
truncate table mo_tables;
internal error: do not have privilege to execute the statement
truncate table mo_account;
internal error: do not have privilege to execute the statement
truncate table mo_role;
internal error: do not have privilege to execute the statement
truncate table mo_user_grant;
internal error: do not have privilege to execute the statement
truncate table mo_role_grant;
internal error: do not have privilege to execute the statement
truncate table mo_role_privs;
internal error: do not have privilege to execute the statement
use system ;
truncate table statement_info;
internal error: do not have privilege to execute the statement
truncate table rawlog;
internal error: do not have privilege to execute the statement
truncate table log_info;
internal error: do not have privilege to execute the statement
truncate table error_info;
internal error: do not have privilege to execute the statement
truncate table span_info;
internal error: do not have privilege to execute the statement
use information_schema;
truncate table key_column_usage ;
internal error: do not have privilege to execute the statement
truncate table columns;
no such table information_schema.columns
truncate table profiling;
internal error: do not have privilege to execute the statement
truncate table `PROCESSLIST`;
internal error: do not have privilege to execute the statement
truncate table user_privileges;
internal error: do not have privilege to execute the statement
truncate table schemata;
internal error: do not have privilege to execute the statement
truncate table character_sets;
internal error: do not have privilege to execute the statement
truncate table triggers;
internal error: do not have privilege to execute the statement
truncate table tables;
internal error: do not have privilege to execute the statement
truncate table engines;
internal error: do not have privilege to execute the statement
use truncate_table_2;
drop table if exists trun_table_01;
drop table if exists trun_table_02;
drop table if exists trun_table_03;
