select mo_ctl('cn', 'task', 'disable');
mo_ctl(cn, task, disable)
{\n  "method": "Task",\n  "result": "OK"\n}\n
create database if not exists db;
use db;
drop table if exists t;
create table t (a int, b int, primary key (a));
insert into t values (1, 1), (2, 2), (3, 3), (4,4), (5, 5);
select mo_ctl('dn', 'inspect', 'addc -d db -b t -n aplus -t samllint -p 2');
mo_ctl(dn, inspect, addc -d db -b t -n aplus -t samllint -p 2)
{\n  "method": "Inspect",\n  "result": [\n    {\n      "msg": "add column success"\n    }\n  ]\n}\n
show columns from t;
Field    Type    Null    Key    Default    Extra    Comment
a    INT(32)    NO    PRI    null        
b    INT(32)    YES        null        
aplus    INT UNSIGNED(0)    YES        null        
select * from t;
a    b    aplus
1    1    null
2    2    null
3    3    null
4    4    null
5    5    null
insert into t values (6, 6,6), (7,7,7);
select mo_ctl('dn', 'flush', 'db.t');
mo_ctl(dn, flush, db.t)
{\n  "method": "Flush",\n  "result": [\n    {\n      "returnStr": "OK"\n    }\n  ]\n}\n
select aplus from t;
aplus
null
null
null
null
null
6
7
update t set aplus = 11 where a = 1;
update t set aplus = 61 where a = 6;
select * from t;
a    b    aplus
1    1    11
6    6    61
7    7    7
2    2    null
3    3    null
4    4    null
5    5    null
select mo_ctl('dn', 'inspect', 'dropc -d db -b t -p 2');
mo_ctl(dn, inspect, dropc -d db -b t -p 2)
{\n  "method": "Inspect",\n  "result": [\n    {\n      "msg": "drop column success"\n    }\n  ]\n}\n
select mo_ctl('dn', 'inspect', 'addc -d db -b t -n aminus -t samllint -p 0');
mo_ctl(dn, inspect, addc -d db -b t -n aminus -t samllint -p 0)
{\n  "method": "Inspect",\n  "result": [\n    {\n      "msg": "add column success"\n    }\n  ]\n}\n
show columns from t;
Field    Type    Null    Key    Default    Extra    Comment
aminus    INT UNSIGNED(0)    YES        null        
a    INT(32)    NO    PRI    null        
b    INT(32)    YES        null        
insert into t values (12, 12, 12);
select * from t;
aminus    a    b
null    1    1
null    6    6
12    12    12
null    2    2
null    3    3
null    4    4
null    5    5
null    7    7
