set experimental_fulltext_index = 1;
drop database if exists fulltext_update_consistency;
create database fulltext_update_consistency;
use fulltext_update_consistency;
create table ft_sync(id int primary key, k int unique, body text, fulltext ft_body(body));
insert into ft_sync values (1, 1, 'sync old token'), (2, 2, 'sync peer token');
select id from ft_sync where match(body) against('old') order by id;
➤ id[4,32,0]  𝄀
1
update ft_sync set body = 'sync new token' where id = 1;
select id from ft_sync where match(body) against('old') order by id;
➤ id[4,32,0]
select id from ft_sync where match(body) against('new') order by id;
➤ id[4,32,0]  𝄀
1
begin;
update ft_sync set body = 'sync rollback token' where id = 1;
rollback;
select id from ft_sync where match(body) against('rollback') order by id;
➤ id[4,32,0]
select id from ft_sync where match(body) against('new') order by id;
➤ id[4,32,0]  𝄀
1
update ft_sync set id = 3, body = 'sync failed token' where id = 1;
unsupported DML: update primary key on a table with a synchronous full-text/vector index
select id, k, body from ft_sync order by id;
➤ id[4,32,0]  ¦  k[4,32,0]  ¦  body[12,0,0]  𝄀
1  ¦  1  ¦  sync new token  𝄀
2  ¦  2  ¦  sync peer token
select id from ft_sync where match(body) against('failed') order by id;
➤ id[4,32,0]
select id from ft_sync where match(body) against('new') order by id;
➤ id[4,32,0]  𝄀
1
create table ft_async_pk(
id bigint primary key,
body text,
fulltext ft_body(body) async
);
insert into ft_async_pk values (10, 'async identity token');
select id from ft_async_pk where match(body) against('identity') order by id;
➤ id[-5,64,0]  𝄀
10
update ft_async_pk set id = 20 where id = 10;
select id from ft_async_pk where match(body) against('identity') order by id;
➤ id[-5,64,0]  𝄀
20
begin;
update ft_async_pk set id = 30 where id = 20;
rollback;
select id from ft_async_pk where match(body) against('identity') order by id;
➤ id[-5,64,0]  𝄀
20
create table ft_async_composite(
tenant varchar(20),
id bigint,
body text,
primary key(tenant, id),
fulltext ft_body(body) async
);
insert into ft_async_composite values ('a', 1, 'composite identity token');
select tenant, id from ft_async_composite where match(body) against('composite') order by tenant, id;
➤ tenant[12,-1,0]  ¦  id[-5,64,0]  𝄀
a  ¦  1
update ft_async_composite set tenant = 'b', id = 2 where tenant = 'a' and id = 1;
select tenant, id from ft_async_composite where match(body) against('composite') order by tenant, id;
➤ tenant[12,-1,0]  ¦  id[-5,64,0]  𝄀
b  ¦  2
create table ft_null_default(id int primary key, left_text text, right_text text);
insert into ft_null_default values
(1, null, 'defaultrighttoken'),
(2, 'defaultlefttoken', null),
(3, null, null);
create fulltext index ft_body on ft_null_default(left_text, right_text);
select id from ft_null_default where match(left_text, right_text) against('defaultrighttoken') order by id;
➤ id[4,32,0]  𝄀
1
select id from ft_null_default where match(left_text, right_text) against('defaultlefttoken') order by id;
➤ id[4,32,0]  𝄀
2
create table ft_null_ngram(id int primary key, left_text text, right_text text);
insert into ft_null_ngram values (1, null, '風月無情'), (2, '神雕俠侶', null), (3, null, null);
create fulltext index ft_body on ft_null_ngram(left_text, right_text) with parser ngram;
select id from ft_null_ngram where match(left_text, right_text) against('風月無情') order by id;
➤ id[4,32,0]  𝄀
1
select id from ft_null_ngram where match(left_text, right_text) against('神雕俠侶') order by id;
➤ id[4,32,0]  𝄀
2
create table ft_null_gojieba(id int primary key, left_text text, right_text text);
insert into ft_null_gojieba values (1, null, '清华大学'), (2, '北京', null), (3, null, null);
create fulltext index ft_body on ft_null_gojieba(left_text, right_text) with parser gojieba;
select id from ft_null_gojieba where match(left_text, right_text) against('清华大学') order by id;
➤ id[4,32,0]  𝄀
1
select id from ft_null_gojieba where match(left_text, right_text) against('北京') order by id;
➤ id[4,32,0]  𝄀
2
create table ft_null_json(id int primary key, left_doc json, right_doc json);
insert into ft_null_json values
(1, null, '{"k":"jsonrighttoken"}'),
(2, '{"k":"jsonlefttoken"}', null),
(3, null, null);
create fulltext index ft_body on ft_null_json(left_doc, right_doc) with parser json;
select id from ft_null_json where match(left_doc, right_doc) against('jsonrighttoken') order by id;
➤ id[4,32,0]  𝄀
1
select id from ft_null_json where match(left_doc, right_doc) against('jsonlefttoken') order by id;
➤ id[4,32,0]  𝄀
2
create table ft_null_json_value(id int primary key, left_doc json, right_doc json);
insert into ft_null_json_value values
(1, null, '{"k":"jsonvaluerighttoken"}'),
(2, '{"k":"jsonvaluelefttoken"}', null),
(3, null, null);
create fulltext index ft_body on ft_null_json_value(left_doc, right_doc) with parser json_value;
select id from ft_null_json_value where match(left_doc, right_doc) against('jsonvaluerighttoken') order by id;
➤ id[4,32,0]  𝄀
1
select id from ft_null_json_value where match(left_doc, right_doc) against('jsonvaluelefttoken') order by id;
➤ id[4,32,0]  𝄀
2
create table ft_null_dml(
id int primary key,
left_text text,
right_text text,
fulltext ft_body(left_text, right_text)
);
insert into ft_null_dml(id, right_text) values (1, 'insertrighttoken');
select id from ft_null_dml where match(left_text, right_text) against('insertrighttoken') order by id;
➤ id[4,32,0]  𝄀
1
update ft_null_dml set left_text = 'updatelefttoken', right_text = null where id = 1;
select id from ft_null_dml where match(left_text, right_text) against('insertrighttoken') order by id;
➤ id[4,32,0]
select id from ft_null_dml where match(left_text, right_text) against('updatelefttoken') order by id;
➤ id[4,32,0]  𝄀
1
update ft_null_dml set left_text = null, right_text = null where id = 1;
select id from ft_null_dml where match(left_text, right_text) against('updatelefttoken') order by id;
➤ id[4,32,0]
update ft_null_dml set right_text = 'reviverighttoken' where id = 1;
select id from ft_null_dml where match(left_text, right_text) against('reviverighttoken') order by id;
➤ id[4,32,0]  𝄀
1
delete from ft_null_dml where id = 1;
select id from ft_null_dml where match(left_text, right_text) against('reviverighttoken') order by id;
➤ id[4,32,0]
create table ft_null_async(
id int primary key,
left_text text,
right_text text,
fulltext ft_body(left_text, right_text) async
);
insert into ft_null_async(id, right_text) values (1, 'asyncrighttoken');
select id from ft_null_async where match(left_text, right_text) against('asyncrighttoken') order by id;
➤ id[4,32,0]  𝄀
1
drop database fulltext_update_consistency;
