set experimental_fulltext_index = 1;
set experimental_ivf_index = 1;
drop database if exists db25617;
create database db25617;
use db25617;
create table ft (id bigint primary key, body text, tag int, fulltext fti(body));
insert into ft values (1, 'alpha one', 0), (2, 'beta two', 0);
update ft set id = 5 where id = 1;
unsupported DML: update primary key on a table with a synchronous full-text/vector index
select id from ft order by id;
id
1
2
update ft set tag = 7 where id = 1;
select id, tag from ft order by id;
id    tag
1    7
2    0
create table iv (id bigint primary key, v vecf32(3));
create index ix using ivfflat on iv(v) lists = 2 op_type 'vector_l2_ops';
insert into iv values (1, '[1,1,1]'), (2, '[9,9,9]');
update iv set id = 5 where id = 1;
unsupported DML: update primary key on a table with a synchronous full-text/vector index
select id from iv order by id;
id
1
2
create table plain (id bigint primary key, x int);
insert into plain values (1, 1);
update plain set id = 9 where id = 1;
select id from plain order by id;
id
9
drop database db25617;
