set experimental_fulltext_index = 1;
drop database if exists fulltext_update_consistency;
create database fulltext_update_consistency;
use fulltext_update_consistency;
create table ft_sync(id int primary key, k int unique, body text, fulltext ft_body(body));
insert into ft_sync values (1, 1, 'sync old token'), (2, 2, 'sync peer token');
select id from ft_sync where match(body) against('old') order by id;
➤ id[4,32,0]  𝄀
1
update ft_sync set body = 'sync new token' where id = 1;
select id from ft_sync where match(body) against('old') order by id;
➤ id[4,32,0]
select id from ft_sync where match(body) against('new') order by id;
➤ id[4,32,0]  𝄀
1
begin;
update ft_sync set body = 'sync rollback token' where id = 1;
rollback;
select id from ft_sync where match(body) against('rollback') order by id;
➤ id[4,32,0]
select id from ft_sync where match(body) against('new') order by id;
➤ id[4,32,0]  𝄀
1
update ft_sync set id = 3, body = 'sync failed token' where id = 1;
unsupported DML: update primary key on a table with a synchronous full-text/vector index
select id, k, body from ft_sync order by id;
➤ id[4,32,0]  ¦  k[4,32,0]  ¦  body[12,0,0]  𝄀
1  ¦  1  ¦  sync new token  𝄀
2  ¦  2  ¦  sync peer token
select id from ft_sync where match(body) against('failed') order by id;
➤ id[4,32,0]
select id from ft_sync where match(body) against('new') order by id;
➤ id[4,32,0]  𝄀
1
create table ft_async_pk(
id bigint primary key,
body text,
fulltext ft_body(body) async
);
insert into ft_async_pk values (10, 'async identity token');
select id from ft_async_pk where match(body) against('identity') order by id;
➤ id[-5,64,0]  𝄀
10
update ft_async_pk set id = 20 where id = 10;
select id from ft_async_pk where match(body) against('identity') order by id;
➤ id[-5,64,0]  𝄀
20
begin;
update ft_async_pk set id = 30 where id = 20;
rollback;
select id from ft_async_pk where match(body) against('identity') order by id;
➤ id[-5,64,0]  𝄀
20
create table ft_async_composite(
tenant varchar(20),
id bigint,
body text,
primary key(tenant, id),
fulltext ft_body(body) async
);
insert into ft_async_composite values ('a', 1, 'composite identity token');
select tenant, id from ft_async_composite where match(body) against('composite') order by tenant, id;
➤ tenant[12,-1,0]  ¦  id[-5,64,0]  𝄀
a  ¦  1
update ft_async_composite set tenant = 'b', id = 2 where tenant = 'a' and id = 1;
select tenant, id from ft_async_composite where match(body) against('composite') order by tenant, id;
➤ tenant[12,-1,0]  ¦  id[-5,64,0]  𝄀
b  ¦  2
drop database fulltext_update_consistency;
