drop database if exists ft_merge;
create database ft_merge;
use ft_merge;
create table t (id bigint primary key, txt text);
insert into t values (1,'apple red'),(2,'apple green'),(3,'apple blue');
create fulltext index ft on t(txt) with parser retrieval;
select id from t where match(txt) against('apple' in retrieval mode) order by id;
id
1
2
3
insert into t values (4,'apple yellow');
delete from t where id=2;
select sleep(20);
sleep(20)
0
select id from t where match(txt) against('apple' in retrieval mode) order by id;
id
1
3
4
alter table t alter reindex ft fulltext merge;
select id from t where match(txt) against('apple' in retrieval mode) order by id;
id
1
3
4
select id from t where match(txt) against('green' in retrieval mode) order by id;
id
insert into t values (5,'apple pink');
update t set txt='apple orange' where id=4;
select sleep(20);
sleep(20)
0
alter table t alter reindex ft fulltext merge;
select id from t where match(txt) against('apple' in retrieval mode) order by id;
id
1
3
4
5
select id from t where match(txt) against('orange' in retrieval mode) order by id;
id
4
select id from t where match(txt) against('yellow' in retrieval mode) order by id;
id
alter table t alter reindex ft fulltext;
select id from t where match(txt) against('apple' in retrieval mode) order by id;
id
1
3
4
5
create table n (id bigint primary key, txt text);
insert into n values (1,'hello world');
create fulltext index fn on n(txt);
alter table n alter reindex fn fulltext merge;
not supported: ALTER ... REINDEX ... MERGE is only supported for retrieval fulltext indexes
drop database ft_merge;
