set experimental_fulltext_index = 1;
drop database if exists ft_gojieba_precise;
create database ft_gojieba_precise;
use ft_gojieba_precise;
select f.pos, f.word
from (
select cast(column_0 as bigint) as id, column_1 as body
from (values row(1, '我来到北京清华大学'))
) as src
cross apply fulltext_index_tokenize('{"parser":"gojieba"}', 23, id, body) as f;
➤ pos[4,32,0]  ¦  word[12,-1,0]  𝄀
0  ¦  我  𝄀
3  ¦  来到  𝄀
9  ¦  北京  𝄀
15  ¦  清华大学  𝄀
4  ¦  __DocLen
select f.pos, f.word
from (
select cast(column_0 as bigint) as id, column_1 as body
from (values row(1, 'Hello, WORLD! MatrixOne数据库'))
) as src
cross apply fulltext_index_tokenize('{"parser":"gojieba"}', 23, id, body) as f;
➤ pos[4,32,0]  ¦  word[12,-1,0]  𝄀
0  ¦  hello  𝄀
7  ¦  world  𝄀
14  ¦  matrixone  𝄀
23  ¦  数据库  𝄀
4  ¦  __DocLen
select f.pos, f.word
from (
select cast(column_0 as bigint) as id, column_1 as body
from (values row(1, 'abcdefghijklmnopqrstuvwxyzabcd'))
) as src
cross apply fulltext_index_tokenize('{"parser":"gojieba"}', 23, id, body) as f;
➤ pos[4,32,0]  ¦  word[12,-1,0]  𝄀
0  ¦  abcdefghijklmnopqrstuvw  𝄀
1  ¦  __DocLen
select f.pos, f.word
from (
select cast(column_0 as bigint) as id, column_1 as body
from (values row(1, 'red red red'))
) as src
cross apply fulltext_index_tokenize('{"parser":"gojieba"}', 23, id, body) as f;
➤ pos[4,32,0]  ¦  word[12,-1,0]  𝄀
0  ¦  red  𝄀
4  ¦  red  𝄀
8  ¦  red  𝄀
3  ¦  __DocLen
select f.pos, f.word
from (
select cast(column_0 as bigint) as id, column_1 as body, column_2 as title
from (values row(1, '我来到北京', 'MatrixOne 数据库'))
) as src
cross apply fulltext_index_tokenize('{"parser":"gojieba"}', 23, id, body, title) as f;
➤ pos[4,32,0]  ¦  word[12,-1,0]  𝄀
0  ¦  我  𝄀
3  ¦  来到  𝄀
9  ¦  北京  𝄀
16  ¦  matrixone  𝄀
26  ¦  数据库  𝄀
5  ¦  __DocLen
create table docs (
id int primary key,
title varchar(255),
body text
);
insert into docs values
(1, 'TitleOnlyToken', ''),
(2, 'NullTitleToken', null),
(3, '', 'BodyOnlyToken'),
(4, null, 'NullBodyToken'),
(5, '校园', '我来到北京'),
(6, null, null);
create fulltext index ft_docs on docs(title, body) with parser gojieba;
select id from docs
where match(title, body) against('+titleonlytoken' in boolean mode)
order by id;
➤ id[4,32,0]  𝄀
1
select id from docs
where match(title, body) against('+nulltitletoken' in boolean mode)
order by id;
➤ id[4,32,0]
select id from docs
where match(title, body) against('+bodyonlytoken' in boolean mode)
order by id;
➤ id[4,32,0]  𝄀
3
select id from docs
where match(title, body) against('+nullbodytoken' in boolean mode)
order by id;
➤ id[4,32,0]
select id from docs
where match(title, body) against('"校园我来到"' in boolean mode)
order by id;
➤ id[4,32,0]
update docs set title = 'LifecycleTitle', body = 'LifecycleBody' where id = 6;
select id from docs
where match(title, body) against('+lifecycletitle +lifecyclebody' in boolean mode);
➤ id[4,32,0]  𝄀
6
update docs set title = null where id = 6;
select id from docs
where match(title, body) against('+lifecyclebody' in boolean mode);
➤ id[4,32,0]
update docs set title = '' where id = 6;
select id from docs
where match(title, body) against('+lifecyclebody' in boolean mode);
➤ id[4,32,0]  𝄀
6
drop database ft_gojieba_precise;
