drop database if exists ft_ret_async;
create database ft_ret_async;
use ft_ret_async;
create table t (id bigint primary key, txt text);
create fulltext index ft on t(txt) with parser retrieval;
insert into t values (1, '营养 早餐'), (2, '视频 文案');
select sleep(20);
sleep(20)
0
select id from t where match(txt) against('营养') order by id;
id
1
insert into t values (3, '营养 健康 食谱');
select sleep(20);
sleep(20)
0
select id from t where match(txt) against('营养') order by id;
id
1
3
delete from t where id = 1;
select sleep(20);
sleep(20)
0
select id from t where match(txt) against('营养') order by id;
id
3
drop database ft_ret_async;
