set experimental_fulltext2_index = 1;
drop database if exists ft2_json_partial;
create database ft2_json_partial;
use ft2_json_partial;
create table t (id bigint primary key, j json, content varchar(64));
create fulltext2 index ftj on t(j) with parser json;
insert into t values
(1, '{"foo":"needle"}', 'c1'),
(2, '{"foo":"hay"}', 'c2'),
(3, '{"foo":"needle"}', 'c3');
set @ftj = (select index_table_name from mo_catalog.mo_indexes where name = 'ftj' and algo_table_type = 'ftv2_index' and table_id in (select rel_id from mo_catalog.mo_tables where reldatabase = database() and relname = 't') limit 1);
set @wait_ftj_sql = concat('select coalesce(max(chunk_id), -1) >= 0 as ready from `', database(), '`.`', @ftj, '` where index_id = ''cdc_tail'' and tag = 1');
prepare wait_ftj from @wait_ftj_sql;
execute wait_ftj;
➤ ready[-7,1,0]  𝄀
1
deallocate prepare wait_ftj;
insert into t values (4, '{"foo":"needle"}', 'c4'), (5, '{"foo":"hay"}', 'c5');
select id from t where json_extract_string(j,'$.foo') = 'needle' order by id;
➤ id[-5,64,0]  𝄀
1  𝄀
3  𝄀
4
update t set j = '{"foo":"needle","v":2}' where id = 1;
select id from t where json_extract_string(j,'$.foo') = 'needle' order by id;
➤ id[-5,64,0]  𝄀
1  𝄀
3  𝄀
4
update t set j = '{"foo":"hay"}' where id = 3;
select id from t where json_extract_string(j,'$.foo') = 'needle' order by id;
➤ id[-5,64,0]  𝄀
1  𝄀
4
update t set j = '{"foo":"needle"}' where id = 2;
select id from t where json_extract_string(j,'$.foo') = 'needle' order by id;
➤ id[-5,64,0]  𝄀
1  𝄀
2  𝄀
4
delete from t where id = 1;
select id from t where json_extract_string(j,'$.foo') = 'needle' order by id;
➤ id[-5,64,0]  𝄀
2  𝄀
4
insert into t values (6, '{"foo":"needle"}', 'c6'), (7, '{"foo":"needle"}', 'other');
select id from t where json_extract_string(j,'$.foo') = 'needle' and content = 'c6' order by id;
➤ id[-5,64,0]  𝄀
6
drop database ft2_json_partial;
