create table src (id bigint primary key, body varchar, title text, FULLTEXT2 ftidx (body, title));
insert into src values (0, 'color is red', 't1'), (1, 'car is yellow', 'crazy car'), (2, 'sky is blue', 'no limit'), (3, 'blue is not red', 'colorful'),
(4, '遠東兒童中文是針對6到9歲的小朋友精心設計的中文學習教材，共三冊，目前已出版一、二冊。', '遠東兒童中文'),
(5, '每冊均採用近百張全幅彩圖及照片，生動活潑、自然真實，加深兒童學習印象，洋溢學習樂趣。', '遠東兒童中文'),
(6, '各個單元主題內容涵蓋中華文化及生活應用的介紹。本套教材含課本、教學指引、生字卡、學生作業本與CD，中英對照，精美大字版。本系列有繁體字及簡體字兩種版本印行。', '中文短篇小說'),
(7, '59個簡單的英文和中文短篇小說', '適合初學者'),
(8, NULL, 'NOT INCLUDED'),
(9, 'NOT INCLUDED BODY', NULL),
(10, NULL, NULL);
create table src2 (id1 varchar, id2 bigint, body char(128), title text, primary key (id1, id2), FULLTEXT2 ftidx(body, title));
insert into src2 values ('id0', 0, 'red', 't1'), ('id1', 1, 'yellow', 't2'), ('id2', 2, 'blue', 't3'), ('id3', 3, 'blue red', 't4'), ('id4', 4, 'bright red null', NULL);
select sleep(30);
sleep(30)
0
select id from src where match(body, title) against('red') order by id;
id
0
3
show create table src;
Table    Create Table
src    CREATE TABLE `src` (\n  `id` bigint NOT NULL,\n  `body` varchar(65535) DEFAULT NULL,\n  `title` text DEFAULT NULL,\n  PRIMARY KEY (`id`),\n FULLTEXT2 `ftidx`(`body`,`title`) WITH PARSER ngram\n)
select id1, id2 from src2 where match(body, title) against('red') order by id1;
id1    id2
id0    0
id3    3
show create table src2;
Table    Create Table
src2    CREATE TABLE `src2` (\n  `id1` varchar(65535) NOT NULL,\n  `id2` bigint NOT NULL,\n  `body` char(128) DEFAULT NULL,\n  `title` text DEFAULT NULL,\n  PRIMARY KEY (`id1`,`id2`),\n FULLTEXT2 `ftidx`(`body`,`title`) WITH PARSER ngram\n)
update src set body = 'color is green' where id = 0;
delete from src where id = 3;
select sleep(30);
sleep(30)
0
select id from src where match(body, title) against('red') order by id;
id
select id from src where match(body, title) against('green') order by id;
id
0
alter table src rename to src1;
select id from src1 where match(body, title) against('green') order by id;
id
0
drop table src1;
drop table src2;
