set experimental_fulltext2_index = 1;
create table src (id bigint primary key, body varchar, title text, FULLTEXT2 ftidx (body, title));
insert into src values (0, 'color is red', 't1'), (1, 'car is yellow', 'crazy car'), (2, 'sky is blue', 'no limit'), (3, 'blue is not red', 'colorful'),
(4, '遠東兒童中文是針對6到9歲的小朋友精心設計的中文學習教材，共三冊，目前已出版一、二冊。', '遠東兒童中文'),
(5, '每冊均採用近百張全幅彩圖及照片，生動活潑、自然真實，加深兒童學習印象，洋溢學習樂趣。', '遠東兒童中文'),
(6, '各個單元主題內容涵蓋中華文化及生活應用的介紹。本套教材含課本、教學指引、生字卡、學生作業本與CD，中英對照，精美大字版。本系列有繁體字及簡體字兩種版本印行。', '中文短篇小說'),
(7, '59個簡單的英文和中文短篇小說', '適合初學者'),
(8, NULL, 'NOT INCLUDED'),
(9, 'NOT INCLUDED BODY', NULL),
(10, NULL, NULL);
create table src2 (id1 varchar, id2 bigint, body char(128), title text, primary key (id1, id2), FULLTEXT2 ftidx(body, title));
insert into src2 values ('id0', 0, 'red', 't1'), ('id1', 1, 'yellow', 't2'), ('id2', 2, 'blue', 't3'), ('id3', 3, 'blue red', 't4'), ('id4', 4, 'bright red null', NULL);
set @src_ft2_index = (
select index_table_name from mo_catalog.mo_indexes
where name = 'ftidx' and algo = 'fulltext2' and algo_table_type = 'ftv2_index'
and table_id in (select rel_id from mo_catalog.mo_tables where reldatabase = database() and relname = 'src')
limit 1
);
set @src2_ft2_index = (
select index_table_name from mo_catalog.mo_indexes
where name = 'ftidx' and algo = 'fulltext2' and algo_table_type = 'ftv2_index'
and table_id in (select rel_id from mo_catalog.mo_tables where reldatabase = database() and relname = 'src2')
limit 1
);
set @wait_initial_ft2_sql = concat(
'select ',
'(select coalesce(max(chunk_id), -1) >= 0 from `', database(), '`.`', @src_ft2_index,
'` where index_id = ''cdc_tail'' and tag = 1) as src_ready, ',
'(select coalesce(max(chunk_id), -1) >= 0 from `', database(), '`.`', @src2_ft2_index,
'` where index_id = ''cdc_tail'' and tag = 1) as src2_ready'
);
prepare wait_initial_ft2 from @wait_initial_ft2_sql;
execute wait_initial_ft2;
➤ src_ready[-7,1,0]  ¦  src2_ready[-7,1,0]  𝄀
1  ¦  1
deallocate prepare wait_initial_ft2;
drop table if exists json_null_cdc;
create table json_null_cdc(id bigint primary key, left_doc json, right_doc json);
create fulltext2 index ftv on json_null_cdc(left_doc, right_doc) with parser json_value;
set @json_ft2_index = (
select index_table_name from mo_catalog.mo_indexes
where name = 'ftv' and algo = 'fulltext2' and algo_table_type = 'ftv2_index'
and table_id in (select rel_id from mo_catalog.mo_tables where reldatabase = database() and relname = 'json_null_cdc')
limit 1
);
insert into json_null_cdc values
(1,'{"k":"leftboth"}','{"k":"rightboth"}'),
(2,NULL,'{"k":"onlyrighttoken"}'),
(3,'{"k":"onlylefttoken"}',NULL),
(4,NULL,NULL),
(5,'null','{"k":"literalcontrol"}'),
(6,'"null"',NULL);
set @wait_json_sql = concat(
'select coalesce(max(chunk_id), -1) >= 0 as json_ready from `', database(), '`.`', @json_ft2_index,
'` where index_id = ''cdc_tail'' and tag = 1'
);
prepare wait_json from @wait_json_sql;
execute wait_json;
➤ json_ready[-7,1,0]  𝄀
1
deallocate prepare wait_json;
select id from json_null_cdc where match(left_doc, right_doc) against('onlyrighttoken' in boolean mode) order by id;
id
2
select id from json_null_cdc where match(left_doc, right_doc) against('onlylefttoken' in boolean mode) order by id;
id
3
select id from json_null_cdc where match(left_doc, right_doc) against('+leftboth +rightboth' in boolean mode) order by id;
id
1
select id from json_null_cdc where match(left_doc, right_doc) against('literalcontrol' in boolean mode) order by id;
id
5
select id from json_null_cdc where match(left_doc, right_doc) against('null' in boolean mode) order by id;
id
6
drop table json_null_cdc;

create table warm_refresh (id bigint primary key, body text);
insert into warm_refresh values (1, 'refreshmarker baseline'), (2, 'unrelated control');
create fulltext2 index ft_refresh on warm_refresh(body);
select id from warm_refresh where match(body) against('refreshmarker' in boolean mode) order by id;
id
1
set @warm_storage = (select index_table_name from mo_catalog.mo_indexes where name = 'ft_refresh' and algo = 'fulltext2' and algo_table_type = 'ftv2_index' and table_id in (select rel_id from mo_catalog.mo_tables where reldatabase = database() and relname = 'warm_refresh') limit 1);
insert into warm_refresh values (101, 'refreshmarker committed');
set @warm_tail_sql = concat('select count(*) > 0 as tail_ready from `', database(), '`.`', @warm_storage, '` where index_id = ''cdc_tail'' and tag = 1');
prepare warm_tail from @warm_tail_sql;
execute warm_tail;
➤ tail_ready[-7,1,0]  𝄀
1
deallocate prepare warm_tail;
select id from warm_refresh where match(body) against('refreshmarker' in boolean mode) order by id;
id
1
101
drop table warm_refresh;
create table json_null_cdc(id bigint primary key, left_doc json, right_doc json);
create fulltext2 index ftv on json_null_cdc(left_doc, right_doc) with parser json_value;
set @json_ft2_index = (
select index_table_name from mo_catalog.mo_indexes
where name = 'ftv' and algo = 'fulltext2' and algo_table_type = 'ftv2_index'
and table_id in (select rel_id from mo_catalog.mo_tables where reldatabase = database() and relname = 'json_null_cdc')
limit 1
);
insert into json_null_cdc values
(1,'{"k":"leftboth"}','{"k":"rightboth"}'),
(2,NULL,'{"k":"onlyrighttoken"}'),
(3,'{"k":"onlylefttoken"}',NULL),
(4,NULL,NULL),
(5,'null','{"k":"literalcontrol"}'),
(6,'"null"',NULL);
set @wait_json_sql = concat(
'select coalesce(max(chunk_id), -1) >= 0 as json_ready from `', database(), '`.`', @json_ft2_index,
'` where index_id = ''cdc_tail'' and tag = 1'
);
prepare wait_json from @wait_json_sql;
execute wait_json;
➤ json_ready[-7,1,0]  𝄀
1
deallocate prepare wait_json;
set @capture_json_tail_sql = concat(
'select coalesce(max(chunk_id), -1) into @json_tail_before from `', database(), '`.`', @json_ft2_index,
'` where index_id = ''cdc_tail'' and tag = 1'
);
prepare capture_json_tail from @capture_json_tail_sql;
execute capture_json_tail;
deallocate prepare capture_json_tail;
update json_null_cdc set left_doc = NULL where id = 1;
set @wait_json_sql = concat(
'select coalesce(max(chunk_id), -1) > ', @json_tail_before,
' as json_update_ready from `', database(), '`.`', @json_ft2_index,
'` where index_id = ''cdc_tail'' and tag = 1'
);
prepare wait_json from @wait_json_sql;
execute wait_json;
➤ json_update_ready[-7,1,0]  𝄀
1
deallocate prepare wait_json;
select id from json_null_cdc where match(left_doc, right_doc) against('leftboth' in boolean mode) order by id;
id
select id from json_null_cdc where match(left_doc, right_doc) against('rightboth' in boolean mode) order by id;
id
1
drop table json_null_cdc;
create table json_null_cdc(id bigint primary key, left_doc json, right_doc json);
create fulltext2 index ftv on json_null_cdc(left_doc, right_doc) with parser json_value;
set @json_ft2_index = (
select index_table_name from mo_catalog.mo_indexes
where name = 'ftv' and algo = 'fulltext2' and algo_table_type = 'ftv2_index'
and table_id in (select rel_id from mo_catalog.mo_tables where reldatabase = database() and relname = 'json_null_cdc')
limit 1
);
insert into json_null_cdc values
(1,NULL,'{"k":"rightboth"}'),
(2,NULL,'{"k":"onlyrighttoken"}'),
(3,'{"k":"onlylefttoken"}',NULL),
(4,NULL,NULL),
(5,'null','{"k":"literalcontrol"}'),
(6,'"null"',NULL);
set @wait_json_sql = concat(
'select coalesce(max(chunk_id), -1) >= 0 as json_ready from `', database(), '`.`', @json_ft2_index,
'` where index_id = ''cdc_tail'' and tag = 1'
);
prepare wait_json from @wait_json_sql;
execute wait_json;
➤ json_ready[-7,1,0]  𝄀
1
deallocate prepare wait_json;
set @capture_json_tail_sql = concat(
'select coalesce(max(chunk_id), -1) into @json_tail_before from `', database(), '`.`', @json_ft2_index,
'` where index_id = ''cdc_tail'' and tag = 1'
);
prepare capture_json_tail from @capture_json_tail_sql;
execute capture_json_tail;
deallocate prepare capture_json_tail;
update json_null_cdc set right_doc = NULL, left_doc = '{"k":"newleft"}' where id = 1;
set @wait_json_sql = concat(
'select coalesce(max(chunk_id), -1) > ', @json_tail_before,
' as json_update_ready from `', database(), '`.`', @json_ft2_index,
'` where index_id = ''cdc_tail'' and tag = 1'
);
prepare wait_json from @wait_json_sql;
execute wait_json;
➤ json_update_ready[-7,1,0]  𝄀
1
deallocate prepare wait_json;
select id from json_null_cdc where match(left_doc, right_doc) against('rightboth' in boolean mode) order by id;
id
select id from json_null_cdc where match(left_doc, right_doc) against('newleft' in boolean mode) order by id;
id
1
drop table json_null_cdc;
create table json_null_cdc(id bigint primary key, left_doc json, right_doc json);
create fulltext2 index ftv on json_null_cdc(left_doc, right_doc) with parser json_value;
set @json_ft2_index = (
select index_table_name from mo_catalog.mo_indexes
where name = 'ftv' and algo = 'fulltext2' and algo_table_type = 'ftv2_index'
and table_id in (select rel_id from mo_catalog.mo_tables where reldatabase = database() and relname = 'json_null_cdc')
limit 1
);
insert into json_null_cdc values
(1,'{"k":"newleft"}',NULL),
(2,NULL,'{"k":"onlyrighttoken"}'),
(3,'{"k":"onlylefttoken"}',NULL),
(4,NULL,NULL),
(5,'null','{"k":"literalcontrol"}'),
(6,'"null"',NULL);
set @wait_json_sql = concat(
'select coalesce(max(chunk_id), -1) >= 0 as json_ready from `', database(), '`.`', @json_ft2_index,
'` where index_id = ''cdc_tail'' and tag = 1'
);
prepare wait_json from @wait_json_sql;
execute wait_json;
➤ json_ready[-7,1,0]  𝄀
1
deallocate prepare wait_json;
set @capture_json_tail_sql = concat(
'select coalesce(max(chunk_id), -1) into @json_tail_before from `', database(), '`.`', @json_ft2_index,
'` where index_id = ''cdc_tail'' and tag = 1'
);
prepare capture_json_tail from @capture_json_tail_sql;
execute capture_json_tail;
deallocate prepare capture_json_tail;
update json_null_cdc set left_doc = NULL where id = 1;
set @wait_json_sql = concat(
'select coalesce(max(chunk_id), -1) > ', @json_tail_before,
' as json_update_ready from `', database(), '`.`', @json_ft2_index,
'` where index_id = ''cdc_tail'' and tag = 1'
);
prepare wait_json from @wait_json_sql;
execute wait_json;
➤ json_update_ready[-7,1,0]  𝄀
1
deallocate prepare wait_json;
select id from json_null_cdc where id = 1;
id
1
select id from json_null_cdc where match(left_doc, right_doc) against('newleft' in boolean mode) order by id;
id
select id from json_null_cdc where match(left_doc, right_doc) against('onlyrighttoken' in boolean mode) order by id;
id
2
select id from json_null_cdc where match(left_doc, right_doc) against('onlylefttoken' in boolean mode) order by id;
id
3
select id from json_null_cdc where match(left_doc, right_doc) against('+leftboth +rightboth' in boolean mode) order by id;
id
select id from json_null_cdc where match(left_doc, right_doc) against('literalcontrol' in boolean mode) order by id;
id
5
select id from json_null_cdc where match(left_doc, right_doc) against('null' in boolean mode) order by id;
id
6
alter table json_null_cdc alter reindex ftv fulltext2 merge force_sync;
select id from json_null_cdc where match(left_doc, right_doc) against('newleft' in boolean mode) order by id;
id
select id from json_null_cdc where match(left_doc, right_doc) against('onlyrighttoken' in boolean mode) order by id;
id
2
select id from json_null_cdc where match(left_doc, right_doc) against('onlylefttoken' in boolean mode) order by id;
id
3
select id from json_null_cdc where match(left_doc, right_doc) against('+leftboth +rightboth' in boolean mode) order by id;
id
select id from json_null_cdc where match(left_doc, right_doc) against('literalcontrol' in boolean mode) order by id;
id
5
select id from json_null_cdc where match(left_doc, right_doc) against('null' in boolean mode) order by id;
id
6
alter table json_null_cdc alter reindex ftv fulltext2 force_sync;
select id from json_null_cdc where match(left_doc, right_doc) against('newleft' in boolean mode) order by id;
id
select id from json_null_cdc where match(left_doc, right_doc) against('onlyrighttoken' in boolean mode) order by id;
id
2
select id from json_null_cdc where match(left_doc, right_doc) against('onlylefttoken' in boolean mode) order by id;
id
3
select id from json_null_cdc where match(left_doc, right_doc) against('+leftboth +rightboth' in boolean mode) order by id;
id
select id from json_null_cdc where match(left_doc, right_doc) against('literalcontrol' in boolean mode) order by id;
id
5
select id from json_null_cdc where match(left_doc, right_doc) against('null' in boolean mode) order by id;
id
6
drop table json_null_cdc;
create table json_null_cdc(id bigint primary key, left_doc json, right_doc json);
create fulltext2 index ftv on json_null_cdc(left_doc, right_doc) with parser json_value;
set @json_ft2_index = (
select index_table_name from mo_catalog.mo_indexes
where name = 'ftv' and algo = 'fulltext2' and algo_table_type = 'ftv2_index'
and table_id in (select rel_id from mo_catalog.mo_tables where reldatabase = database() and relname = 'json_null_cdc')
limit 1
);
insert into json_null_cdc values
(1,NULL,NULL),
(2,NULL,'{"k":"onlyrighttoken"}'),
(3,'{"k":"onlylefttoken"}',NULL),
(4,NULL,NULL),
(5,'null','{"k":"literalcontrol"}'),
(6,'"null"',NULL);
set @wait_json_sql = concat(
'select coalesce(max(chunk_id), -1) >= 0 as json_ready from `', database(), '`.`', @json_ft2_index,
'` where index_id = ''cdc_tail'' and tag = 1'
);
prepare wait_json from @wait_json_sql;
execute wait_json;
➤ json_ready[-7,1,0]  𝄀
1
deallocate prepare wait_json;
set @capture_json_tail_sql = concat(
'select coalesce(max(chunk_id), -1) into @json_tail_before from `', database(), '`.`', @json_ft2_index,
'` where index_id = ''cdc_tail'' and tag = 1'
);
prepare capture_json_tail from @capture_json_tail_sql;
execute capture_json_tail;
deallocate prepare capture_json_tail;
update json_null_cdc set right_doc = '{"k":"revived"}' where id = 1;
set @wait_json_sql = concat(
'select coalesce(max(chunk_id), -1) > ', @json_tail_before,
' as json_update_ready from `', database(), '`.`', @json_ft2_index,
'` where index_id = ''cdc_tail'' and tag = 1'
);
prepare wait_json from @wait_json_sql;
execute wait_json;
➤ json_update_ready[-7,1,0]  𝄀
1
deallocate prepare wait_json;
select id from json_null_cdc where match(left_doc, right_doc) against('revived' in boolean mode) order by id;
id
1
select id from json_null_cdc where match(left_doc, right_doc) against('onlyrighttoken' in boolean mode) order by id;
id
2
select id from json_null_cdc where match(left_doc, right_doc) against('onlylefttoken' in boolean mode) order by id;
id
3
select id from json_null_cdc where match(left_doc, right_doc) against('literalcontrol' in boolean mode) order by id;
id
5
select id from json_null_cdc where match(left_doc, right_doc) against('null' in boolean mode) order by id;
id
6
drop table json_null_cdc;
create table json_null_cdc(id bigint primary key, left_doc json, right_doc json);
create fulltext2 index ftv on json_null_cdc(left_doc, right_doc) with parser json_value;
set @json_ft2_index = (
select index_table_name from mo_catalog.mo_indexes
where name = 'ftv' and algo = 'fulltext2' and algo_table_type = 'ftv2_index'
and table_id in (select rel_id from mo_catalog.mo_tables where reldatabase = database() and relname = 'json_null_cdc')
limit 1
);
insert into json_null_cdc values
(1,NULL,'{"k":"revived"}'),
(2,NULL,'{"k":"onlyrighttoken"}'),
(3,'{"k":"onlylefttoken"}',NULL),
(4,NULL,NULL),
(5,'null','{"k":"literalcontrol"}'),
(6,'"null"',NULL);
set @wait_json_sql = concat(
'select coalesce(max(chunk_id), -1) >= 0 as json_ready from `', database(), '`.`', @json_ft2_index,
'` where index_id = ''cdc_tail'' and tag = 1'
);
prepare wait_json from @wait_json_sql;
execute wait_json;
➤ json_ready[-7,1,0]  𝄀
1
deallocate prepare wait_json;
set @capture_json_tail_sql = concat(
'select coalesce(max(chunk_id), -1) into @json_tail_before from `', database(), '`.`', @json_ft2_index,
'` where index_id = ''cdc_tail'' and tag = 1'
);
prepare capture_json_tail from @capture_json_tail_sql;
execute capture_json_tail;
deallocate prepare capture_json_tail;
delete from json_null_cdc where id = 1;
set @wait_json_sql = concat(
'select coalesce(max(chunk_id), -1) > ', @json_tail_before,
' as json_delete_ready from `', database(), '`.`', @json_ft2_index,
'` where index_id = ''cdc_tail'' and tag = 1'
);
prepare wait_json from @wait_json_sql;
execute wait_json;
➤ json_delete_ready[-7,1,0]  𝄀
1
deallocate prepare wait_json;
select id from json_null_cdc where match(left_doc, right_doc) against('revived' in boolean mode) order by id;
id
select id from json_null_cdc where match(left_doc, right_doc) against('onlyrighttoken' in boolean mode) order by id;
id
2
select id from json_null_cdc where match(left_doc, right_doc) against('onlylefttoken' in boolean mode) order by id;
id
3
select id from json_null_cdc where match(left_doc, right_doc) against('literalcontrol' in boolean mode) order by id;
id
5
select id from json_null_cdc where match(left_doc, right_doc) against('null' in boolean mode) order by id;
id
6
drop table json_null_cdc;
create table json_null_cdc(id bigint primary key, left_doc json, right_doc json);
create fulltext2 index ftv on json_null_cdc(left_doc, right_doc) with parser json_value;
set @json_ft2_index = (
select index_table_name from mo_catalog.mo_indexes
where name = 'ftv' and algo = 'fulltext2' and algo_table_type = 'ftv2_index'
and table_id in (select rel_id from mo_catalog.mo_tables where reldatabase = database() and relname = 'json_null_cdc')
limit 1
);
insert into json_null_cdc values
(1,NULL,'{"k":"revived"}'),
(2,NULL,'{"k":"onlyrighttoken"}'),
(3,'{"k":"onlylefttoken"}',NULL),
(4,NULL,NULL),
(5,'null','{"k":"literalcontrol"}'),
(6,'"null"',NULL);
set @wait_json_sql = concat(
'select coalesce(max(chunk_id), -1) >= 0 as json_ready from `', database(), '`.`', @json_ft2_index,
'` where index_id = ''cdc_tail'' and tag = 1'
);
prepare wait_json from @wait_json_sql;
execute wait_json;
➤ json_ready[-7,1,0]  𝄀
1
deallocate prepare wait_json;
set @capture_json_tail_sql = concat(
'select coalesce(max(chunk_id), -1) into @json_tail_before from `', database(), '`.`', @json_ft2_index,
'` where index_id = ''cdc_tail'' and tag = 1'
);
prepare capture_json_tail from @capture_json_tail_sql;
execute capture_json_tail;
deallocate prepare capture_json_tail;
delete from json_null_cdc where id = 1;
set @wait_json_sql = concat(
'select coalesce(max(chunk_id), -1) > ', @json_tail_before,
' as json_delete_ready from `', database(), '`.`', @json_ft2_index,
'` where index_id = ''cdc_tail'' and tag = 1'
);
prepare wait_json from @wait_json_sql;
execute wait_json;
➤ json_delete_ready[-7,1,0]  𝄀
1
deallocate prepare wait_json;
set @capture_json_tail_sql = concat(
'select coalesce(max(chunk_id), -1) into @json_tail_before from `', database(), '`.`', @json_ft2_index,
'` where index_id = ''cdc_tail'' and tag = 1'
);
prepare capture_json_tail from @capture_json_tail_sql;
execute capture_json_tail;
deallocate prepare capture_json_tail;
insert into json_null_cdc values (1,NULL,'{"k":"reinserted"}');
set @wait_json_sql = concat(
'select coalesce(max(chunk_id), -1) > ', @json_tail_before,
' as json_reinsert_ready from `', database(), '`.`', @json_ft2_index,
'` where index_id = ''cdc_tail'' and tag = 1'
);
prepare wait_json from @wait_json_sql;
execute wait_json;
➤ json_reinsert_ready[-7,1,0]  𝄀
1
deallocate prepare wait_json;
select id from json_null_cdc where match(left_doc, right_doc) against('reinserted' in boolean mode) order by id;
id
1
select id from json_null_cdc where match(left_doc, right_doc) against('revived' in boolean mode) order by id;
id
select id from json_null_cdc where match(left_doc, right_doc) against('onlyrighttoken' in boolean mode) order by id;
id
2
select id from json_null_cdc where match(left_doc, right_doc) against('onlylefttoken' in boolean mode) order by id;
id
3
select id from json_null_cdc where match(left_doc, right_doc) against('literalcontrol' in boolean mode) order by id;
id
5
select id from json_null_cdc where match(left_doc, right_doc) against('null' in boolean mode) order by id;
id
6
show create table src;
Table    Create Table
src    CREATE TABLE `src` (\n  `id` bigint NOT NULL,\n  `body` varchar(65535) DEFAULT NULL,\n  `title` text DEFAULT NULL,\n  PRIMARY KEY (`id`),\n FULLTEXT2 `ftidx`(`body`,`title`) WITH PARSER ngram\n)
select id1, id2 from src2 where match(body, title) against('red') order by id1;
id1    id2
id0    0
id3    3
id4    4
show create table src2;
Table    Create Table
src2    CREATE TABLE `src2` (\n  `id1` varchar(65535) NOT NULL,\n  `id2` bigint NOT NULL,\n  `body` char(128) DEFAULT NULL,\n  `title` text DEFAULT NULL,\n  PRIMARY KEY (`id1`,`id2`),\n FULLTEXT2 `ftidx`(`body`,`title`) WITH PARSER ngram\n)
set @capture_src_tail_sql = concat(
'select coalesce(max(chunk_id), -1) into @src_tail_before_mutation from `', database(), '`.`', @src_ft2_index,
'` where index_id = ''cdc_tail'' and tag = 1'
);
prepare capture_src_tail from @capture_src_tail_sql;
execute capture_src_tail;
deallocate prepare capture_src_tail;
update src set body = 'color is green' where id = 0;
set @wait_src_mutation_sql = concat(
'select coalesce(max(chunk_id), -1) > ', @src_tail_before_mutation,
' as src_update_ready from `', database(), '`.`', @src_ft2_index,
'` where index_id = ''cdc_tail'' and tag = 1'
);
prepare wait_src_mutation from @wait_src_mutation_sql;
execute wait_src_mutation;
➤ src_update_ready[-7,1,0]  𝄀
1
deallocate prepare wait_src_mutation;
set @capture_src_tail_sql = concat(
'select coalesce(max(chunk_id), -1) into @src_tail_before_mutation from `', database(), '`.`', @src_ft2_index,
'` where index_id = ''cdc_tail'' and tag = 1'
);
prepare capture_src_tail from @capture_src_tail_sql;
execute capture_src_tail;
deallocate prepare capture_src_tail;
delete from src where id = 3;
set @wait_src_mutation_sql = concat(
'select coalesce(max(chunk_id), -1) > ', @src_tail_before_mutation,
' as src_delete_ready from `', database(), '`.`', @src_ft2_index,
'` where index_id = ''cdc_tail'' and tag = 1'
);
prepare wait_src_mutation from @wait_src_mutation_sql;
execute wait_src_mutation;
➤ src_delete_ready[-7,1,0]  𝄀
1
deallocate prepare wait_src_mutation;
select id from src where match(body, title) against('red') order by id;
id
select id from src where match(body, title) against('green') order by id;
id
0
alter table src rename to src1;
select id from src1 where match(body, title) against('green') order by id;
id
0
drop table src1;
drop table src2;
drop table json_null_cdc;
