set experimental_fulltext2_index = 1;
drop database if exists ft2_posfree_cdc;
create database ft2_posfree_cdc;
use ft2_posfree_cdc;
create table t (id bigint primary key, body text);
insert into t values (1,'我家有三个人'),(2,'三个人都住在我家'),(3,'我家的花园很漂亮');
create fulltext2 index ft on t(body) with parser gojieba position_free = true;
insert into t values (4,'教室里有三个人'),(5,'昨天我家有三个人来吃饭');
delete from t where id = 3;
select sleep(30);
sleep(30)
0
select id from t where match(body) against('我家' in bm25 mode) order by id;
id
1
2
5
select id from t where match(body) against('教室' in bm25 mode) order by id;
id
4
alter table t alter reindex ft fulltext2 merge;
select algo_params from mo_catalog.mo_indexes where name = 'ft' and algo_params like '%parser%' limit 1;
algo_params
{"parser":"gojieba","position_free":"true"}
select id from t where match(body) against('我家' in bm25 mode) order by id;
id
1
2
5
select id from t where match(body) against('我家' in boolean mode) order by id;
invalid input: fulltext2 index "ft" is POSITION_FREE (bag-of-words only): query it with MATCH(...) AGAINST(... IN BM25 MODE); it has no positions for natural-language / boolean phrase matching
insert into t values (6,'我家门口有三个人');
update t set body = '教室里没有人' where id = 4;
select sleep(30);
sleep(30)
0
alter table t alter reindex ft fulltext2;
select algo_params from mo_catalog.mo_indexes where name = 'ft' and algo_params like '%parser%' limit 1;
algo_params
{"parser":"gojieba","position_free":"true"}
select id from t where match(body) against('我家' in bm25 mode) order by id;
id
1
2
5
select id from t where match(body) against('三个人' in bm25 mode) order by id;
id
1
2
4
5
6
select id from t where match(body) against('我家' in boolean mode) order by id;
invalid input: fulltext2 index "ft" is POSITION_FREE (bag-of-words only): query it with MATCH(...) AGAINST(... IN BM25 MODE); it has no positions for natural-language / boolean phrase matching
drop database ft2_posfree_cdc;
