drop table if exists atomic_table_1;
drop table if exists atomic_table_2;
drop table if exists atomic_table_3;
drop table if exists atomic_view_1;
drop table if exists atomic_view_2;
drop table if exists t_code_rule_2;
create table atomic_table_2(a bigint ,b varchar(200),c double);
begin;
create table atomic_table_1(a bigint not null,b varchar(200),c double,primary key(a,b));
insert into atomic_table_1 select 1,"gooooooge",8092.9;
insert into atomic_table_1 select 2,"caaaaaate",92.09;
commit;
select * from atomic_table_1;
a    b    c
1    gooooooge    8092.9
2    caaaaaate    92.09
start transaction ;
insert into atomic_table_2 select * from atomic_table_1;
select * from atomic_table_2;
a    b    c
1    gooooooge    8092.9
2    caaaaaate    92.09
rollback ;
select * from atomic_table_2;
a    b    c
begin;
insert into atomic_table_2 select * from atomic_table_1;
commit;
select * from atomic_table_2;
a    b    c
1    gooooooge    8092.9
2    caaaaaate    92.09
begin;
create view atomic_view_1 as select * from atomic_table_1;
insert into atomic_table_1 select 10,"eeeeee",20.3;
commit;
select * from atomic_view_1;
a    b    c
1    gooooooge    8092.9
2    caaaaaate    92.09
10    eeeeee    20.3
start transaction ;
insert into atomic_table_1 select 10,"eeeeee",20.3;
insert into atomic_table_1 select 11,"ffff",2.3;
commit;
Duplicate entry '3b150a460165656565656500' for key '__mo_cpkey_col'
select * from atomic_table_1;
a    b    c
1    gooooooge    8092.9
2    caaaaaate    92.09
10    eeeeee    20.3
select * from atomic_view_1;
a    b    c
1    gooooooge    8092.9
2    caaaaaate    92.09
10    eeeeee    20.3
begin;
create view atomic_view_2 as select * from atomic_table_2;
rollback ;
select * from atomic_view_2;
SQL parser error: table "atomic_view_2" does not exist
show create table atomic_view_2;
no such table atomicity_1.atomic_view_2
begin;
drop view atomic_view_2;
internal error: Only CREATE of DDL is supported in transactions
commit ;
drop view atomic_view_2;
invalid view 'atomicity_1.atomic_view_2'
create table atomic_table_3a(col1 tinyint,col2 smallint,col3 int,clo4 bigint,col5 tinyint unsigned,col6 smallint unsigned,col7 int unsigned,col8 bigint unsigned,col9 float,col10 double,col11 varchar(255),col12 Date,col13 DateTime,col14 timestamp,col15 bool,col16 decimal(5,2),col17 text,col18 varchar(255),col19 varchar(255),col20 text,primary key(col1))partition by hash(col1)partitions 4;
begin;
[unknown result because it is related to issue#5941]
load data infile '$resources/external_table_file/pt_table_data.csv' into table  atomic_table_3a;
[unknown result because it is related to issue#5941]
select col1,col2 from atomic_table_3a;
[unknown result because it is related to issue#5941]
update atomic_table_3a set col1=400;
[unknown result because it is related to issue#5941]
rollback;
[unknown result because it is related to issue#5941]
select col1 from atomic_table_3a;
[unknown result because it is related to issue#5941]
start transaction ;
[unknown result because it is related to issue#5941]
load data infile '$resources/external_table_file/pt_table_data.csv' into table  atomic_table_3a;
[unknown result because it is related to issue#5941]
select count(*) from atomic_table_3a;
[unknown result because it is related to issue#5941]
update atomic_table_3a set col1=100;
[unknown result because it is related to issue#5941]
commit;
[unknown result because it is related to issue#5941]
select col1 from atomic_table_3a;
[unknown result because it is related to issue#5941]
create table atomic_table_3(col1 tinyint,col2 smallint,col3 int,clo4 bigint,col5 tinyint unsigned,col6 smallint unsigned,col7 int unsigned,col8 bigint unsigned,col9 float,col10 double,col11 varchar(255),col12 Date,col13 DateTime,col14 timestamp,col15 bool,col16 decimal(5,2),col17 text,col18 varchar(255),col19 varchar(255),col20 text,primary key(col1))partition by hash(col1)partitions 4;
load data infile '$resources/external_table_file/pt_table_data.csv' into table  atomic_table_3;
start transaction ;
update  atomic_table_3 set col2=20;
select  col1,col2 from atomic_table_3;
col1    col2
-62    20
91    20
33    20
121    20
40    20
-8    20
-75    20
21    20
-93    20
110    20
122    20
show create table atomic_table_3;
Table    Create Table
atomic_table_3    CREATE TABLE `atomic_table_3` (\n`col1` TINYINT NOT NULL,\n`col2` SMALLINT DEFAULT NULL,\n`col3` INT DEFAULT NULL,\n`clo4` BIGINT DEFAULT NULL,\n`col5` TINYINT UNSIGNED DEFAULT NULL,\n`col6` SMALLINT UNSIGNED DEFAULT NULL,\n`col7` INT UNSIGNED DEFAULT NULL,\n`col8` BIGINT UNSIGNED DEFAULT NULL,\n`col9` FLOAT DEFAULT NULL,\n`col10` DOUBLE DEFAULT NULL,\n`col11` VARCHAR(255) DEFAULT NULL,\n`col12` DATE DEFAULT NULL,\n`col13` DATETIME DEFAULT NULL,\n`col14` TIMESTAMP DEFAULT NULL,\n`col15` BOOL DEFAULT NULL,\n`col16` DECIMAL(5,2) DEFAULT NULL,\n`col17` TEXT DEFAULT NULL,\n`col18` VARCHAR(255) DEFAULT NULL,\n`col19` VARCHAR(255) DEFAULT NULL,\n`col20` TEXT DEFAULT NULL,\nPRIMARY KEY (`col1`)\n) partition by hash (col1) partitions 4
rollback ;
select  col1,col2 from atomic_table_3;
col1    col2
-62    5807
91    19514
33    4300
121    -22564
40    30792
-8    -30001
-75    11896
21    775
-93    -18596
110    -23777
122    19053
begin;
create external table atomic_ex_table(num_col1 tinyint,num_col2 smallint,num_col3 int,num_col4 bigint,num_col5 tinyint unsigned,num_col6 smallint unsigned,num_col7 int unsigned,num_col8 bigint unsigned ,num_col9 float(5,3),num_col10 double(6,5),num_col11 decimal(38,19)) infile{"filepath"='$resources/external_table_file/ex_table_number.csv'} fields terminated by ',' enclosed by '\"' lines terminated by '\n';
select num_col1  from  atomic_ex_table;
num_col1
60
-128
127
null
rollback ;
select num_col1  from  atomic_ex_table;
SQL parser error: table "atomic_ex_table" does not exist
show create table atomic_ex_table;
no such table atomicity_1.atomic_ex_table
desc atomic_ex_table;
no such table atomicity_1.atomic_ex_table
create TEMPORARY TABLE atomic_temp(a int);
begin;
insert into atomic_temp values (5);
rollback ;
select * from atomic_temp;
a
drop table atomic_temp;
start transaction ;
create TEMPORARY TABLE atomic_temp(a int);
insert into atomic_temp values (5);
select * from atomic_temp;
a
5
rollback ;
select * from atomic_temp;
SQL parser error: table "atomic_temp" does not exist
show create table atomic_temp;
no such table atomicity_1.atomic_temp
start transaction ;
create TEMPORARY TABLE atomic_temp(a int);
insert into atomic_temp values (5);
commit ;
select * from atomic_temp;
a
5
CREATE TABLE `t_code_rule` (
`code_id` bigint(20) NOT NULL AUTO_INCREMENT,
`code_no` varchar(50) NOT NULL,
`org_no` varchar(50) NOT NULL,
`org_name` varchar(50) NOT NULL,
`code_type` int(11) NOT NULL DEFAULT '0',
PRIMARY KEY (`code_id`),
UNIQUE KEY `code_type` (`code_type`),
KEY `code_no` (`code_no`),
KEY `org_no` (`org_no`)
);
start transaction ;
insert into t_code_rule values (18373453,'aaaaaa','fffff','ccccc',10);
insert into t_code_rule values (18373453,'aaaaaa','fffff','ccccc',20);
Duplicate entry '18373453' for key 'code_id'
Previous DML conflicts with existing constraints or data format. This transaction has to be aborted
commit ;
select * from t_code_rule;
code_id    code_no    org_no    org_name    code_type
begin;
insert into t_code_rule values (18373453,'aaaaaa','fffff','ccccc',5);
delete from t_code_rule where code_id=18373453;
select * from t_code_rule;
code_id    code_no    org_no    org_name    code_type
rollback ;
select * from t_code_rule;
code_id    code_no    org_no    org_name    code_type
insert into t_code_rule values (18373453,'aaaaaa','fffff','ccccc',5);
begin ;
delete from t_code_rule where code_id=18373453;
commit ;
begin;
insert into t_code_rule(code_no,org_no,org_name,code_type) values ('',null,'ccccc',5);
constraint violation: Column 'org_no' cannot be null
Previous DML conflicts with existing constraints or data format. This transaction has to be aborted
commit ;
select * from t_code_rule;
code_id    code_no    org_no    org_name    code_type
insert into t_code_rule values (18373453,'aaaaaa','fffff','ccccc',5);
Duplicate entry '5' for key 'code_type'
begin;
update t_code_rule set org_name=NULL where code_id=18373453;
constraint violation: Column 'org_name' cannot be null
Previous DML conflicts with existing constraints or data format. This transaction has to be aborted
commit ;
select * from t_code_rule;
code_id    code_no    org_no    org_name    code_type
18373453    aaaaaa    fffff    ccccc    5
begin ;
create account aname admin_name 'admin' identified by '111';
internal error: administrative command is unsupported in transactions
create role role1,role2;
internal error: administrative command is unsupported in transactions
grant role1 to role2;
internal error: administrative command is unsupported in transactions
grant create table ,drop table on database * to role1;
internal error: administrative command is unsupported in transactions
truncate table  t_code_rule;
internal error: Only CREATE of DDL is supported in transactions
drop table t_code_rule;
internal error: Only CREATE of DDL is supported in transactions
drop database atomic_1;
internal error: Only CREATE of DDL is supported in transactions
drop role role1,role2;
internal error: administrative command is unsupported in transactions
commit;
