drop database if exists test_temporary;
create database test_temporary;
use test_temporary;
create temporary table t1(
col1 tinyint,
col2 smallint,
col3 int,
col4 bigint,
col5 tinyint unsigned,
col6 smallint unsigned,
col7 int unsigned,
col8 bigint unsigned
);
import data infile '$resources/load_data/integer_numbers_1.csv' into table t1;
select * from t1;
col1    col2    col3    col4    col5    col6    col7    col8
127    32767    2147483647    9223372036854775807    255    65535    4294967295    18446744073709551615
-128    -32768    -2147483648    -9223372036854775808    0    0    0    0
0    0    0    0    0    0    0    0
null    null    null    null    null    null    null    null
1    null    null    0    0    0    null    null
null    null    null    null    null    null    null    null
127    32767    2147483647    9223372036854775807    255    65535    4294967295    18446744073709551615
select * from t1 into outfile '$resources/into_outfile_2/outfile_integer_numbers_2.csv';
col1    col2    col3    col4    col5    col6    col7    col8
delete from t1;
import data infile '$resources/into_outfile_2/outfile_integer_numbers_2.csv' into table t1 ignore 1 lines;
select * from t1;
col1    col2    col3    col4    col5    col6    col7    col8
127    32767    2147483647    9223372036854775807    255    65535    4294967295    18446744073709551615
-128    -32768    -2147483648    -9223372036854775808    0    0    0    0
0    0    0    0    0    0    0    0
null    null    null    null    null    null    null    null
1    null    null    0    0    0    null    null
null    null    null    null    null    null    null    null
127    32767    2147483647    9223372036854775807    255    65535    4294967295    18446744073709551615
delete from t1;
import data infile '$resources/load_data/integer_numbers_2.csv' into table t1 fields terminated by'*';
select * from t1;
col1    col2    col3    col4    col5    col6    col7    col8
127    32767    2147483647    9223372036854775807    255    65535    4294967295    18446744073709551615
-128    -32768    -2147483648    -9223372036854775808    0    0    0    0
0    0    0    0    0    0    0    0
null    null    null    null    null    null    null    null
1    null    null    0    0    0    null    null
null    null    null    null    null    null    null    null
127    32767    2147483647    9223372036854775807    255    65535    4294967295    18446744073709551615
delete from t1;
drop table t1;