DROP TABLE IF EXISTS multi_update_target_a;
DROP TABLE IF EXISTS multi_update_target_b;
CREATE TABLE multi_update_target_a (
id INT PRIMARY KEY,
grp INT,
x INT,
y INT,
UNIQUE KEY ux_a (id, x),
KEY iy_a (y)
);
CREATE TABLE multi_update_target_b (
id INT PRIMARY KEY,
grp INT,
x INT,
y INT,
UNIQUE KEY ux_b (id, x),
KEY iy_b (y)
);
INSERT INTO multi_update_target_a VALUES
(1, 1, 0, 0),
(2, 1, 0, 0),
(3, 2, 0, 0);
INSERT INTO multi_update_target_b VALUES
(10, 1, 0, 0),
(20, 1, 0, 0),
(30, 3, 0, 0);
UPDATE multi_update_target_a a
JOIN multi_update_target_b b ON a.grp = b.grp
SET
a.x = b.id,
a.y = b.id,
b.x = a.id,
b.y = a.id;
SELECT COUNT(*) FROM multi_update_target_a WHERE x <> y;
➤ COUNT(*)[-5,64,0]  𝄀
0
SELECT COUNT(*) FROM multi_update_target_b WHERE x <> y;
➤ COUNT(*)[-5,64,0]  𝄀
0
SELECT COUNT(*) FROM multi_update_target_a WHERE grp = 1 AND x = 0;
➤ COUNT(*)[-5,64,0]  𝄀
0
SELECT COUNT(*) FROM multi_update_target_b WHERE grp = 1 AND x = 0;
➤ COUNT(*)[-5,64,0]  𝄀
0
UPDATE multi_update_target_a a
LEFT JOIN multi_update_target_b b ON a.grp = b.grp
SET
a.x = 7,
b.x = 9;
UPDATE multi_update_target_a a
RIGHT JOIN multi_update_target_b b ON a.grp = b.grp
SET
a.y = 11,
b.y = 13;
SELECT id, x, y FROM multi_update_target_a ORDER BY id;
➤ id[4,32,0]  ¦  x[4,32,0]  ¦  y[4,32,0]  𝄀
1  ¦  7  ¦  11  𝄀
2  ¦  7  ¦  11  𝄀
3  ¦  7  ¦  0
SELECT id, x, y FROM multi_update_target_b ORDER BY id;
➤ id[4,32,0]  ¦  x[4,32,0]  ¦  y[4,32,0]  𝄀
10  ¦  9  ¦  13  𝄀
20  ¦  9  ¦  13  𝄀
30  ¦  0  ¦  13
DROP TABLE multi_update_target_a;
DROP TABLE multi_update_target_b;
DROP TABLE IF EXISTS multi_update_alias_target;
CREATE TABLE multi_update_alias_target (
id INT PRIMARY KEY,
x INT,
y INT,
z INT
);
INSERT INTO multi_update_alias_target VALUES (1, 0, 0, 0), (2, 0, 0, 0);
UPDATE multi_update_alias_target a
JOIN multi_update_alias_target b ON a.id = b.id
SET
a.x = 1,
b.y = 2;
SELECT ROW_COUNT();
➤ ROW_COUNT()[-5,64,0]  𝄀
4
SELECT id, x, y FROM multi_update_alias_target ORDER BY id;
➤ id[4,32,0]  ¦  x[4,32,0]  ¦  y[4,32,0]  𝄀
1  ¦  1  ¦  2  𝄀
2  ¦  1  ¦  2
UPDATE multi_update_alias_target a
JOIN multi_update_alias_target b ON a.id = 1 AND b.id = 1
SET
a.x = 3,
b.y = 4;
SELECT id, x, y FROM multi_update_alias_target ORDER BY id;
➤ id[4,32,0]  ¦  x[4,32,0]  ¦  y[4,32,0]  𝄀
1  ¦  3  ¦  4  𝄀
2  ¦  1  ¦  2
UPDATE multi_update_alias_target SET x = 0, y = 0;
UPDATE multi_update_alias_target a
JOIN multi_update_alias_target b ON a.id <> b.id
SET
a.x = 1,
b.y = 2;
SELECT ROW_COUNT();
➤ ROW_COUNT()[-5,64,0]  𝄀
4
SELECT id, x, y FROM multi_update_alias_target ORDER BY id;
➤ id[4,32,0]  ¦  x[4,32,0]  ¦  y[4,32,0]  𝄀
1  ¦  1  ¦  2  𝄀
2  ¦  1  ¦  2
CREATE TABLE multi_update_alias_source (
target_id INT,
source_x INT,
source_y INT
);
INSERT INTO multi_update_alias_source VALUES
(1, NULL, 1),
(1, 2, 2),
(2, NULL, 1),
(2, 2, 2);
UPDATE multi_update_alias_target SET x = 0, y = 0;
UPDATE multi_update_alias_target a
JOIN multi_update_alias_target b ON a.id = b.id
JOIN multi_update_alias_source s ON s.target_id = a.id
SET
a.x = s.source_x,
a.y = s.source_y,
b.z = b.z;
SELECT COUNT(*) AS mixed_source_rows
FROM multi_update_alias_target
WHERE NOT ((x IS NULL AND y = 1) OR (x = 2 AND y = 2));
➤ mixed_source_rows[-5,64,0]  𝄀
0
CREATE TABLE multi_update_third_target (
id INT PRIMARY KEY,
z INT
);
INSERT INTO multi_update_third_target VALUES (1, 0), (2, 0);
UPDATE multi_update_alias_target SET x = 0, y = 0;
UPDATE multi_update_alias_target a
JOIN multi_update_alias_target b ON a.id <> b.id
JOIN multi_update_third_target u ON u.id = a.id
SET
a.x = 1,
b.y = 2,
u.z = 3;
SELECT ROW_COUNT();
➤ ROW_COUNT()[-5,64,0]  𝄀
6
SELECT id, x, y FROM multi_update_alias_target ORDER BY id;
➤ id[4,32,0]  ¦  x[4,32,0]  ¦  y[4,32,0]  𝄀
1  ¦  1  ¦  2  𝄀
2  ¦  1  ¦  2
SELECT id, z FROM multi_update_third_target ORDER BY id;
➤ id[4,32,0]  ¦  z[4,32,0]  𝄀
1  ¦  3  𝄀
2  ¦  3
DROP TABLE multi_update_third_target;
DROP TABLE multi_update_alias_source;
DROP TABLE multi_update_alias_target;
DROP TABLE IF EXISTS multi_update_three_alias;
CREATE TABLE multi_update_three_alias (
id INT PRIMARY KEY,
x INT,
y INT
);
INSERT INTO multi_update_three_alias VALUES (1, 0, 0), (2, 0, 0), (3, 0, 0);
UPDATE multi_update_three_alias a
JOIN multi_update_three_alias b ON a.id = 1 AND b.id = 2
JOIN multi_update_three_alias c ON c.id = 3
SET
a.x = 1,
b.y = 2,
c.x = 3;
SELECT ROW_COUNT();
➤ ROW_COUNT()[-5,64,0]  𝄀
3
SELECT * FROM multi_update_three_alias ORDER BY id;
➤ id[4,32,0]  ¦  x[4,32,0]  ¦  y[4,32,0]  𝄀
1  ¦  1  ¦  0  𝄀
2  ¦  0  ¦  2  𝄀
3  ¦  3  ¦  0
DROP TABLE multi_update_three_alias;
DROP DATABASE IF EXISTS multi_update_db_a;
DROP DATABASE IF EXISTS multi_update_db_b;
CREATE DATABASE multi_update_db_a;
CREATE DATABASE multi_update_db_b;
CREATE TABLE multi_update_db_a.t (id INT PRIMARY KEY, v INT);
CREATE TABLE multi_update_db_b.t (id INT PRIMARY KEY, v INT);
INSERT INTO multi_update_db_a.t VALUES (1, 10);
INSERT INTO multi_update_db_b.t VALUES (1, 20);
UPDATE multi_update_db_a.t a
JOIN multi_update_db_b.t b ON a.id = b.id
SET
a.v = 11,
b.v = 21;
SELECT * FROM multi_update_db_a.t;
➤ id[4,32,0]  ¦  v[4,32,0]  𝄀
1  ¦  11
SELECT * FROM multi_update_db_b.t;
➤ id[4,32,0]  ¦  v[4,32,0]  𝄀
1  ¦  21
DROP DATABASE multi_update_db_a;
DROP DATABASE multi_update_db_b;
DROP TABLE IF EXISTS multi_update_ignore_a;
DROP TABLE IF EXISTS multi_update_ignore_b;
CREATE TABLE multi_update_ignore_a (
id INT PRIMARY KEY,
u INT UNIQUE
);
CREATE TABLE multi_update_ignore_b (
id INT PRIMARY KEY,
v INT
);
INSERT INTO multi_update_ignore_a VALUES (1, 1), (2, 2);
INSERT INTO multi_update_ignore_b VALUES (1, 0);
UPDATE IGNORE multi_update_ignore_a a
JOIN multi_update_ignore_b b ON a.id = b.id
SET
a.u = 2,
b.v = 9;
SELECT ROW_COUNT();
➤ ROW_COUNT()[-5,64,0]  𝄀
1
SELECT * FROM multi_update_ignore_a ORDER BY id;
➤ id[4,32,0]  ¦  u[4,32,0]  𝄀
1  ¦  1  𝄀
2  ¦  2
SELECT * FROM multi_update_ignore_b ORDER BY id;
➤ id[4,32,0]  ¦  v[4,32,0]  𝄀
1  ¦  9
DROP TABLE multi_update_ignore_a;
DROP TABLE multi_update_ignore_b;
DROP TABLE IF EXISTS multi_update_ignore_alias;
CREATE TABLE multi_update_ignore_alias (
id INT PRIMARY KEY,
u INT UNIQUE,
x INT,
y INT
);
INSERT INTO multi_update_ignore_alias VALUES (1, 1, 0, 0), (2, 2, 0, 0);
UPDATE IGNORE multi_update_ignore_alias a
JOIN multi_update_ignore_alias b ON a.id = b.id
SET
a.u = a.u + 1,
b.x = 1;
SELECT ROW_COUNT();
➤ ROW_COUNT()[-5,64,0]  𝄀
3
SELECT * FROM multi_update_ignore_alias ORDER BY id;
➤ id[4,32,0]  ¦  u[4,32,0]  ¦  x[4,32,0]  ¦  y[4,32,0]  𝄀
1  ¦  1  ¦  1  ¦  0  𝄀
2  ¦  3  ¦  1  ¦  0
TRUNCATE TABLE multi_update_ignore_alias;
INSERT INTO multi_update_ignore_alias VALUES (1, 1, 0, 0), (2, 2, 0, 0);
UPDATE IGNORE multi_update_ignore_alias a
JOIN multi_update_ignore_alias b ON a.id = b.id
SET
a.x = 1,
b.u = b.u + 1;
SELECT ROW_COUNT();
➤ ROW_COUNT()[-5,64,0]  𝄀
3
SELECT * FROM multi_update_ignore_alias ORDER BY id;
➤ id[4,32,0]  ¦  u[4,32,0]  ¦  x[4,32,0]  ¦  y[4,32,0]  𝄀
1  ¦  1  ¦  1  ¦  0  𝄀
2  ¦  3  ¦  1  ¦  0
TRUNCATE TABLE multi_update_ignore_alias;
INSERT INTO multi_update_ignore_alias VALUES (1, 1, 0, 0), (2, 2, 0, 0);
UPDATE IGNORE multi_update_ignore_alias a
JOIN multi_update_ignore_alias b ON a.id = b.id
JOIN multi_update_ignore_alias c ON b.id = c.id
SET
a.u = a.u + 1,
b.x = 1,
c.y = 1;
SELECT ROW_COUNT();
➤ ROW_COUNT()[-5,64,0]  𝄀
5
SELECT * FROM multi_update_ignore_alias ORDER BY id;
➤ id[4,32,0]  ¦  u[4,32,0]  ¦  x[4,32,0]  ¦  y[4,32,0]  𝄀
1  ¦  1  ¦  1  ¦  1  𝄀
2  ¦  3  ¦  1  ¦  1
TRUNCATE TABLE multi_update_ignore_alias;
INSERT INTO multi_update_ignore_alias VALUES (1, 1, 0, 0), (2, 2, 0, 0);
PREPARE multi_update_ignore_stmt FROM
'UPDATE IGNORE multi_update_ignore_alias a JOIN multi_update_ignore_alias b ON a.id = b.id SET a.u = a.u + 1, b.x = ?';
SET @multi_update_ignore_x = 1;
EXECUTE multi_update_ignore_stmt USING @multi_update_ignore_x;
SELECT ROW_COUNT();
➤ ROW_COUNT()[-5,64,0]  𝄀
3
SELECT * FROM multi_update_ignore_alias ORDER BY id;
➤ id[4,32,0]  ¦  u[4,32,0]  ¦  x[4,32,0]  ¦  y[4,32,0]  𝄀
1  ¦  1  ¦  1  ¦  0  𝄀
2  ¦  3  ¦  1  ¦  0
DEALLOCATE PREPARE multi_update_ignore_stmt;
DROP TABLE multi_update_ignore_alias;
DROP TABLE IF EXISTS multi_update_ignore_composite;
CREATE TABLE multi_update_ignore_composite (
id INT PRIMARY KEY,
u INT,
v INT,
w INT,
UNIQUE KEY uk_uv_w (u, v, w)
);
INSERT INTO multi_update_ignore_composite VALUES (1, 1, 1, 1), (2, 2, 2, 1);
UPDATE IGNORE multi_update_ignore_composite a
JOIN multi_update_ignore_composite b ON a.id = b.id
SET
a.u = 2,
b.v = 2
WHERE a.id = 1;
SELECT ROW_COUNT();
➤ ROW_COUNT()[-5,64,0]  𝄀
1
SELECT * FROM multi_update_ignore_composite ORDER BY id;
➤ id[4,32,0]  ¦  u[4,32,0]  ¦  v[4,32,0]  ¦  w[4,32,0]  𝄀
1  ¦  2  ¦  1  ¦  1  𝄀
2  ¦  2  ¦  2  ¦  1
TRUNCATE TABLE multi_update_ignore_composite;
INSERT INTO multi_update_ignore_composite VALUES (1, 1, 1, 1), (2, 2, 1, 1);
UPDATE IGNORE multi_update_ignore_composite a
JOIN multi_update_ignore_composite b ON a.id = b.id
SET
a.u = 2,
b.v = 2
WHERE a.id = 1;
SELECT ROW_COUNT();
➤ ROW_COUNT()[-5,64,0]  𝄀
2
SELECT * FROM multi_update_ignore_composite ORDER BY id;
➤ id[4,32,0]  ¦  u[4,32,0]  ¦  v[4,32,0]  ¦  w[4,32,0]  𝄀
1  ¦  2  ¦  2  ¦  1  𝄀
2  ¦  2  ¦  1  ¦  1
TRUNCATE TABLE multi_update_ignore_composite;
INSERT INTO multi_update_ignore_composite VALUES (1, 1, 1, 1), (2, 2, 2, 2);
UPDATE IGNORE multi_update_ignore_composite a
JOIN multi_update_ignore_composite b ON a.id = b.id
JOIN multi_update_ignore_composite c ON b.id = c.id
SET
a.u = 2,
b.v = 2,
c.w = 2
WHERE a.id = 1;
SELECT ROW_COUNT();
➤ ROW_COUNT()[-5,64,0]  𝄀
2
SELECT * FROM multi_update_ignore_composite ORDER BY id;
➤ id[4,32,0]  ¦  u[4,32,0]  ¦  v[4,32,0]  ¦  w[4,32,0]  𝄀
1  ¦  2  ¦  2  ¦  1  𝄀
2  ¦  2  ¦  2  ¦  2
TRUNCATE TABLE multi_update_ignore_composite;
INSERT INTO multi_update_ignore_composite VALUES (1, 1, 1, 1), (2, 2, 2, 1);
PREPARE multi_update_ignore_composite_stmt FROM
'UPDATE IGNORE multi_update_ignore_composite a JOIN multi_update_ignore_composite b ON a.id = b.id SET a.u = ?, b.v = ? WHERE a.id = 1';
SET @multi_update_ignore_u = 2;
SET @multi_update_ignore_v = 2;
EXECUTE multi_update_ignore_composite_stmt USING @multi_update_ignore_u, @multi_update_ignore_v;
SELECT ROW_COUNT();
➤ ROW_COUNT()[-5,64,0]  𝄀
1
SELECT * FROM multi_update_ignore_composite ORDER BY id;
➤ id[4,32,0]  ¦  u[4,32,0]  ¦  v[4,32,0]  ¦  w[4,32,0]  𝄀
1  ¦  2  ¦  1  ¦  1  𝄀
2  ¦  2  ¦  2  ¦  1
DEALLOCATE PREPARE multi_update_ignore_composite_stmt;
DROP TABLE multi_update_ignore_composite;
DROP TABLE IF EXISTS multi_update_ignore_generated;
CREATE TABLE multi_update_ignore_generated (
id INT PRIMARY KEY,
u INT,
v INT,
x INT,
gv INT GENERATED ALWAYS AS (u + v) STORED
);
INSERT INTO multi_update_ignore_generated (id, u, v, x) VALUES
(1, 1, 1, 0),
(2, 2, 2, 0);
UPDATE IGNORE multi_update_ignore_generated a
JOIN multi_update_ignore_generated b ON a.id = b.id
SET
a.u = 10,
b.x = 1
WHERE a.id = 1;
SELECT ROW_COUNT();
➤ ROW_COUNT()[-5,64,0]  𝄀
2
SELECT id, u, v, x, gv FROM multi_update_ignore_generated ORDER BY id;
➤ id[4,32,0]  ¦  u[4,32,0]  ¦  v[4,32,0]  ¦  x[4,32,0]  ¦  gv[4,32,0]  𝄀
1  ¦  10  ¦  1  ¦  1  ¦  11  𝄀
2  ¦  2  ¦  2  ¦  0  ¦  4
TRUNCATE TABLE multi_update_ignore_generated;
INSERT INTO multi_update_ignore_generated (id, u, v, x) VALUES
(1, 1, 1, 0),
(2, 2, 2, 0);
UPDATE IGNORE multi_update_ignore_generated a
JOIN multi_update_ignore_generated b ON a.id = b.id
SET
b.v = 20,
a.u = 10
WHERE a.id = 1;
SELECT ROW_COUNT();
➤ ROW_COUNT()[-5,64,0]  𝄀
2
SELECT id, u, v, x, gv FROM multi_update_ignore_generated ORDER BY id;
➤ id[4,32,0]  ¦  u[4,32,0]  ¦  v[4,32,0]  ¦  x[4,32,0]  ¦  gv[4,32,0]  𝄀
1  ¦  10  ¦  20  ¦  0  ¦  30  𝄀
2  ¦  2  ¦  2  ¦  0  ¦  4
DROP TABLE multi_update_ignore_generated;
DROP TABLE IF EXISTS multi_update_ignore_mixed_repeated;
DROP TABLE IF EXISTS multi_update_ignore_mixed_singleton;
CREATE TABLE multi_update_ignore_mixed_repeated (
id INT PRIMARY KEY,
u INT UNIQUE,
x INT,
y INT
);
CREATE TABLE multi_update_ignore_mixed_singleton (id INT PRIMARY KEY, v INT);
INSERT INTO multi_update_ignore_mixed_repeated VALUES (1, 1, 0, 0), (2, 2, 0, 0);
INSERT INTO multi_update_ignore_mixed_singleton VALUES (1, 0), (2, 0);
UPDATE IGNORE multi_update_ignore_mixed_repeated a
JOIN multi_update_ignore_mixed_repeated b ON a.id = b.id
JOIN multi_update_ignore_mixed_singleton c ON c.id = a.id
SET
a.u = a.u + 1,
b.x = b.x + 1,
c.v = c.v + 1;
SELECT ROW_COUNT();
➤ ROW_COUNT()[-5,64,0]  𝄀
5
SELECT * FROM multi_update_ignore_mixed_repeated ORDER BY id;
➤ id[4,32,0]  ¦  u[4,32,0]  ¦  x[4,32,0]  ¦  y[4,32,0]  𝄀
1  ¦  1  ¦  1  ¦  0  𝄀
2  ¦  3  ¦  1  ¦  0
SELECT * FROM multi_update_ignore_mixed_singleton ORDER BY id;
➤ id[4,32,0]  ¦  v[4,32,0]  𝄀
1  ¦  1  𝄀
2  ¦  1
TRUNCATE TABLE multi_update_ignore_mixed_repeated;
TRUNCATE TABLE multi_update_ignore_mixed_singleton;
INSERT INTO multi_update_ignore_mixed_repeated VALUES (1, 1, 0, 0), (2, 2, 0, 0);
INSERT INTO multi_update_ignore_mixed_singleton VALUES (1, 0), (2, 0);
UPDATE IGNORE multi_update_ignore_mixed_repeated a
JOIN multi_update_ignore_mixed_repeated b ON a.id = b.id
JOIN multi_update_ignore_mixed_singleton c ON c.id = a.id
SET
a.x = a.x + 1,
b.u = b.u + 1,
c.v = c.v + 1;
SELECT ROW_COUNT();
➤ ROW_COUNT()[-5,64,0]  𝄀
5
SELECT * FROM multi_update_ignore_mixed_repeated ORDER BY id;
➤ id[4,32,0]  ¦  u[4,32,0]  ¦  x[4,32,0]  ¦  y[4,32,0]  𝄀
1  ¦  1  ¦  1  ¦  0  𝄀
2  ¦  3  ¦  1  ¦  0
SELECT * FROM multi_update_ignore_mixed_singleton ORDER BY id;
➤ id[4,32,0]  ¦  v[4,32,0]  𝄀
1  ¦  1  𝄀
2  ¦  1
TRUNCATE TABLE multi_update_ignore_mixed_repeated;
TRUNCATE TABLE multi_update_ignore_mixed_singleton;
INSERT INTO multi_update_ignore_mixed_repeated VALUES (1, 1, 0, 0), (2, 2, 0, 0);
INSERT INTO multi_update_ignore_mixed_singleton VALUES (1, 0), (2, 0);
UPDATE IGNORE multi_update_ignore_mixed_repeated a
JOIN multi_update_ignore_mixed_repeated b ON a.id = b.id
JOIN multi_update_ignore_mixed_repeated c ON b.id = c.id
JOIN multi_update_ignore_mixed_singleton d ON d.id = a.id
SET
a.u = a.u + 1,
b.x = b.x + 1,
c.y = c.y + 1,
d.v = d.v + 1;
SELECT ROW_COUNT();
➤ ROW_COUNT()[-5,64,0]  𝄀
7
SELECT * FROM multi_update_ignore_mixed_repeated ORDER BY id;
➤ id[4,32,0]  ¦  u[4,32,0]  ¦  x[4,32,0]  ¦  y[4,32,0]  𝄀
1  ¦  1  ¦  1  ¦  1  𝄀
2  ¦  3  ¦  1  ¦  1
SELECT * FROM multi_update_ignore_mixed_singleton ORDER BY id;
➤ id[4,32,0]  ¦  v[4,32,0]  𝄀
1  ¦  1  𝄀
2  ¦  1
DROP TABLE multi_update_ignore_mixed_repeated;
DROP TABLE multi_update_ignore_mixed_singleton;
DROP TABLE IF EXISTS multi_update_auto_a;
DROP TABLE IF EXISTS multi_update_auto_b;
CREATE TABLE multi_update_auto_a (
id INT PRIMARY KEY,
seq INT AUTO_INCREMENT
);
CREATE TABLE multi_update_auto_b (
id INT PRIMARY KEY,
seq INT AUTO_INCREMENT
);
INSERT INTO multi_update_auto_a (id) VALUES (1);
INSERT INTO multi_update_auto_b (id) VALUES (1);
UPDATE multi_update_auto_a a
JOIN multi_update_auto_b b ON a.id = b.id
SET
a.seq = DEFAULT,
b.seq = DEFAULT;
SELECT * FROM multi_update_auto_a;
➤ id[4,32,0]  ¦  seq[4,32,0]  𝄀
1  ¦  2
SELECT * FROM multi_update_auto_b;
➤ id[4,32,0]  ¦  seq[4,32,0]  𝄀
1  ¦  2
DROP TABLE multi_update_auto_a;
DROP TABLE multi_update_auto_b;
DROP TABLE IF EXISTS multi_update_partition_target;
DROP TABLE IF EXISTS multi_update_plain_target;
CREATE TABLE multi_update_partition_target (
id INT PRIMARY KEY,
x INT,
y INT
) PARTITION BY RANGE (id) (
PARTITION p0 VALUES LESS THAN (2),
PARTITION p1 VALUES LESS THAN (MAXVALUE)
);
CREATE TABLE multi_update_plain_target (
id INT PRIMARY KEY,
x INT
);
INSERT INTO multi_update_partition_target VALUES (1, 0, 0), (2, 0, 0);
INSERT INTO multi_update_plain_target VALUES (1, 0), (2, 0);
UPDATE multi_update_partition_target p
JOIN multi_update_plain_target n ON p.id = n.id
SET
p.x = p.x + 1,
n.x = n.x + 2;
SELECT id, x FROM multi_update_partition_target ORDER BY id;
➤ id[4,32,0]  ¦  x[4,32,0]  𝄀
1  ¦  1  𝄀
2  ¦  1
SELECT id, x FROM multi_update_plain_target ORDER BY id;
➤ id[4,32,0]  ¦  x[4,32,0]  𝄀
1  ¦  2  𝄀
2  ¦  2
UPDATE multi_update_plain_target n
JOIN multi_update_partition_target p ON n.id = p.id
SET
n.x = n.x + 2,
p.x = p.x + 1;
SELECT id, x FROM multi_update_partition_target ORDER BY id;
➤ id[4,32,0]  ¦  x[4,32,0]  𝄀
1  ¦  2  𝄀
2  ¦  2
SELECT id, x FROM multi_update_plain_target ORDER BY id;
➤ id[4,32,0]  ¦  x[4,32,0]  𝄀
1  ¦  4  𝄀
2  ¦  4
UPDATE multi_update_partition_target p
JOIN multi_update_plain_target n ON p.id = n.id
SET
p.id = p.id + 10,
n.x = 9
WHERE p.id = 1;
SELECT ROW_COUNT();
➤ ROW_COUNT()[-5,64,0]  𝄀
2
SELECT id, x FROM multi_update_partition_target ORDER BY id;
➤ id[4,32,0]  ¦  x[4,32,0]  𝄀
2  ¦  2  𝄀
11  ¦  2
SELECT id, x FROM multi_update_plain_target ORDER BY id;
➤ id[4,32,0]  ¦  x[4,32,0]  𝄀
1  ¦  9  𝄀
2  ¦  4
UPDATE multi_update_partition_target a
JOIN multi_update_partition_target b ON a.id = b.id
SET
a.x = 7,
b.y = 8;
SELECT ROW_COUNT();
➤ ROW_COUNT()[-5,64,0]  𝄀
4
SELECT id, x, y FROM multi_update_partition_target ORDER BY id;
➤ id[4,32,0]  ¦  x[4,32,0]  ¦  y[4,32,0]  𝄀
2  ¦  7  ¦  8  𝄀
11  ¦  7  ¦  8
DROP TABLE multi_update_partition_target;
DROP TABLE multi_update_plain_target;
DROP TABLE IF EXISTS multi_update_on_update;
CREATE TABLE multi_update_on_update (
id INT PRIMARY KEY,
x INT,
y INT,
updated_at TIMESTAMP DEFAULT '2000-01-01 00:00:00' ON UPDATE CURRENT_TIMESTAMP,
KEY idx_updated_at (updated_at)
);
INSERT INTO multi_update_on_update (id, x, y) VALUES (1, 0, 0), (2, 0, 0);
UPDATE multi_update_on_update a
JOIN multi_update_on_update b ON a.id = b.id
SET
a.x = 1,
b.y = 2;
SELECT id, x, y FROM multi_update_on_update ORDER BY id;
➤ id[4,32,0]  ¦  x[4,32,0]  ¦  y[4,32,0]  𝄀
1  ¦  1  ¦  2  𝄀
2  ¦  1  ¦  2
SELECT COUNT(*) FROM multi_update_on_update WHERE updated_at = '2000-01-01 00:00:00';
➤ COUNT(*)[-5,64,0]  𝄀
0
SELECT COUNT(*) FROM multi_update_on_update WHERE updated_at IS NULL;
➤ COUNT(*)[-5,64,0]  𝄀
0
SELECT COUNT(*) FROM multi_update_on_update FORCE INDEX (idx_updated_at) WHERE updated_at IS NULL;
➤ COUNT(*)[-5,64,0]  𝄀
0
DROP TABLE multi_update_on_update;
DROP TABLE IF EXISTS multi_update_master_target;
DROP TABLE IF EXISTS multi_update_master_plain;
CREATE TABLE multi_update_master_target (
id VARCHAR(30) PRIMARY KEY,
a VARCHAR(30),
b VARCHAR(30),
c INT
);
CREATE INDEX idx_multi_update_master USING MASTER ON multi_update_master_target(a, b);
CREATE TABLE multi_update_master_plain (
id VARCHAR(30) PRIMARY KEY,
v VARCHAR(30)
);
INSERT INTO multi_update_master_target VALUES ('1', 'old', 'value', 0);
INSERT INTO multi_update_master_plain VALUES ('1', 'old');
UPDATE multi_update_master_target m1
JOIN multi_update_master_target m2 ON m1.id = m2.id
JOIN multi_update_master_plain p ON m1.id = p.id
SET
m1.a = 'changed',
m2.c = 1,
p.v = 'z';
SELECT * FROM multi_update_master_target WHERE a = 'changed' AND b = 'value';
➤ id[12,30,0]  ¦  a[12,30,0]  ¦  b[12,30,0]  ¦  c[4,32,0]  𝄀
1  ¦  changed  ¦  value  ¦  1
SELECT COUNT(*) FROM multi_update_master_target WHERE a = 'old' AND b = 'value';
➤ COUNT(*)[-5,64,0]  𝄀
0
SELECT * FROM multi_update_master_plain ORDER BY id;
➤ id[12,30,0]  ¦  v[12,30,0]  𝄀
1  ¦  z
SET @multi_update_master_table = (
SELECT index_table_name
FROM mo_catalog.mo_indexes
WHERE name = 'idx_multi_update_master'
AND table_id = (
SELECT rel_id FROM mo_catalog.mo_tables
WHERE relname = 'multi_update_master_target' AND reldatabase = DATABASE()
)
LIMIT 1
);
SET @multi_update_master_count_sql = CONCAT(
'SELECT COUNT(*) FROM `', @multi_update_master_table, '`'
);
PREPARE multi_update_master_count FROM @multi_update_master_count_sql;
EXECUTE multi_update_master_count;
➤ COUNT(*)[-5,64,0]  𝄀
2
DEALLOCATE PREPARE multi_update_master_count;
UPDATE multi_update_master_target m
JOIN multi_update_master_plain p ON m.id = p.id
SET
m.id = '2',
p.v = 'pk-updated';
SELECT * FROM multi_update_master_target WHERE a = 'changed' AND b = 'value';
➤ id[12,30,0]  ¦  a[12,30,0]  ¦  b[12,30,0]  ¦  c[4,32,0]  𝄀
2  ¦  changed  ¦  value  ¦  1
SELECT * FROM multi_update_master_plain ORDER BY id;
➤ id[12,30,0]  ¦  v[12,30,0]  𝄀
1  ¦  pk-updated
DROP TABLE multi_update_master_target;
DROP TABLE multi_update_master_plain;
DROP TABLE IF EXISTS multi_update_auto_child;
DROP TABLE IF EXISTS multi_update_auto_plain;
DROP TABLE IF EXISTS multi_update_auto_parent;
CREATE TABLE multi_update_auto_parent (pid INT PRIMARY KEY);
CREATE TABLE multi_update_auto_child (
id INT PRIMARY KEY,
pid INT AUTO_INCREMENT,
FOREIGN KEY (pid) REFERENCES multi_update_auto_parent(pid)
);
CREATE TABLE multi_update_auto_plain (id INT PRIMARY KEY, v INT);
INSERT INTO multi_update_auto_parent VALUES (1), (2);
INSERT INTO multi_update_auto_child (id, pid) VALUES (1, 1);
INSERT INTO multi_update_auto_plain VALUES (1, 0);
UPDATE multi_update_auto_child c
JOIN multi_update_auto_plain p ON c.id = p.id
SET
c.pid = DEFAULT,
p.v = 9;
SELECT id, pid FROM multi_update_auto_child;
➤ id[4,32,0]  ¦  pid[4,32,0]  𝄀
1  ¦  2
SELECT id, v FROM multi_update_auto_plain;
➤ id[4,32,0]  ¦  v[4,32,0]  𝄀
1  ¦  9
DROP TABLE multi_update_auto_child;
DROP TABLE multi_update_auto_plain;
DROP TABLE multi_update_auto_parent;
DROP TABLE IF EXISTS multi_update_outer_auto_child;
DROP TABLE IF EXISTS multi_update_outer_auto_plain;
CREATE TABLE multi_update_outer_auto_child (
id INT PRIMARY KEY,
seq INT AUTO_INCREMENT,
v INT NOT NULL
);
CREATE TABLE multi_update_outer_auto_plain (id INT PRIMARY KEY, v INT);
INSERT INTO multi_update_outer_auto_child (id, v) VALUES (1, 1);
INSERT INTO multi_update_outer_auto_plain VALUES (2, 0);
UPDATE multi_update_outer_auto_child c
RIGHT JOIN multi_update_outer_auto_plain p ON c.id = p.id
SET
c.seq = DEFAULT,
p.v = 9;
SELECT ROW_COUNT();
➤ ROW_COUNT()[-5,64,0]  𝄀
1
SELECT * FROM multi_update_outer_auto_plain;
➤ id[4,32,0]  ¦  v[4,32,0]  𝄀
2  ¦  9
INSERT INTO multi_update_outer_auto_child (id, v) VALUES (2, 2);
SELECT id, seq, v FROM multi_update_outer_auto_child ORDER BY id;
➤ id[4,32,0]  ¦  seq[4,32,0]  ¦  v[4,32,0]  𝄀
1  ¦  1  ¦  1  𝄀
2  ¦  2  ¦  2
DROP TABLE multi_update_outer_auto_child;
DROP TABLE multi_update_outer_auto_plain;
DROP TABLE IF EXISTS multi_update_cascade_child;
DROP TABLE IF EXISTS multi_update_cascade_parent;
DROP TABLE IF EXISTS multi_update_cascade_plain;
DROP TABLE IF EXISTS multi_update_cascade_source;
CREATE TABLE multi_update_cascade_parent (id INT AUTO_INCREMENT PRIMARY KEY);
CREATE TABLE multi_update_cascade_child (
id INT PRIMARY KEY,
parent_id INT,
FOREIGN KEY (parent_id) REFERENCES multi_update_cascade_parent(id) ON UPDATE CASCADE
);
CREATE TABLE multi_update_cascade_plain (id INT PRIMARY KEY, v INT);
CREATE TABLE multi_update_cascade_source (id INT);
INSERT INTO multi_update_cascade_parent VALUES (1);
INSERT INTO multi_update_cascade_child VALUES (1, 1);
INSERT INTO multi_update_cascade_plain VALUES (1, 0);
INSERT INTO multi_update_cascade_source VALUES (1), (1);
UPDATE multi_update_cascade_parent p
JOIN multi_update_cascade_source s ON p.id = s.id
JOIN multi_update_cascade_plain o ON o.id = s.id
SET
p.id = 2,
o.v = 8;
SELECT ROW_COUNT();
➤ ROW_COUNT()[-5,64,0]  𝄀
2
SELECT * FROM multi_update_cascade_parent;
➤ id[4,32,0]  𝄀
2
SELECT * FROM multi_update_cascade_child;
➤ id[4,32,0]  ¦  parent_id[4,32,0]  𝄀
1  ¦  2
SELECT * FROM multi_update_cascade_plain;
➤ id[4,32,0]  ¦  v[4,32,0]  𝄀
1  ¦  8
DROP TABLE multi_update_cascade_child;
DROP TABLE multi_update_cascade_parent;
DROP TABLE multi_update_cascade_plain;
DROP TABLE multi_update_cascade_source;
DROP TABLE IF EXISTS multi_update_fulltext_target;
DROP TABLE IF EXISTS multi_update_fulltext_source;
DROP TABLE IF EXISTS multi_update_fulltext_plain;
CREATE TABLE multi_update_fulltext_target (id INT PRIMARY KEY, body TEXT, v INT);
CREATE FULLTEXT INDEX idx_multi_update_fulltext ON multi_update_fulltext_target(body);
CREATE TABLE multi_update_fulltext_source (id INT);
CREATE TABLE multi_update_fulltext_plain (id INT PRIMARY KEY, v INT);
INSERT INTO multi_update_fulltext_target VALUES (1, 'old token', 0);
INSERT INTO multi_update_fulltext_source VALUES (1), (1);
INSERT INTO multi_update_fulltext_plain VALUES (1, 0);
UPDATE multi_update_fulltext_target f1
JOIN multi_update_fulltext_target f2 ON f1.id = f2.id
JOIN multi_update_fulltext_source s ON f1.id = s.id
JOIN multi_update_fulltext_plain p ON p.id = s.id
SET
f1.body = 'new token',
f2.v = 1,
p.v = 7;
SELECT COUNT(*) FROM multi_update_fulltext_target
WHERE MATCH(body) AGAINST('new' IN NATURAL LANGUAGE MODE);
➤ COUNT(*)[-5,64,0]  𝄀
1
SELECT COUNT(*) FROM multi_update_fulltext_target
WHERE MATCH(body) AGAINST('old' IN NATURAL LANGUAGE MODE);
➤ COUNT(*)[-5,64,0]  𝄀
0
SET @multi_update_fulltext_table = (
SELECT index_table_name
FROM mo_catalog.mo_indexes
WHERE name = 'idx_multi_update_fulltext'
AND table_id = (
SELECT rel_id FROM mo_catalog.mo_tables
WHERE relname = 'multi_update_fulltext_target' AND reldatabase = DATABASE()
)
LIMIT 1
);
SET @multi_update_fulltext_count_sql = CONCAT(
'SELECT COUNT(*) FROM `', @multi_update_fulltext_table, '`'
);
PREPARE multi_update_fulltext_count FROM @multi_update_fulltext_count_sql;
EXECUTE multi_update_fulltext_count;
➤ COUNT(*)[-5,64,0]  𝄀
3
DEALLOCATE PREPARE multi_update_fulltext_count;
DROP TABLE multi_update_fulltext_target;
DROP TABLE multi_update_fulltext_source;
DROP TABLE multi_update_fulltext_plain;
