drop table if exists auto_increment01;
create table auto_increment01(col1 int auto_increment primary key)auto_increment = 0;
select * from auto_increment01;
col1
Insert into auto_increment01 values();
select last_insert_id();
last_insert_id()
1
Select * from auto_increment01;
col1
1
Insert into auto_increment01 values(1);
Duplicate entry '1' for key 'col1'
Select * from auto_increment01;
col1
1
drop table auto_increment01;
Drop table if exists auto_increment02;
[unknown result because it is related to issue#10836]
Create table auto_increment02(col1 int auto_increment unique key)auto_increment = 10;
[unknown result because it is related to issue#10836]
Insert into auto_increment02 values();
[unknown result because it is related to issue#10836]
Select * from auto_increment02;
[unknown result because it is related to issue#10836]
Insert into auto_increment02 values(10);
[unknown result because it is related to issue#10836]
insert into auto_increment02 values(100);
[unknown result because it is related to issue#10836]
select last_insert_id();
[unknown result because it is related to issue#10836]
Select * from auto_increment02;
[unknown result because it is related to issue#10836]
Drop table auto_increment02;
[unknown result because it is related to issue#10836]
Drop table if exists auto_increment03;
create table auto_increment03(col1 int auto_increment primary key) auto_increment = 10000;
Insert into auto_increment03 values();
select last_insert_id();
last_insert_id()
10000
Insert into auto_increment03 values(10000);
Duplicate entry '10000' for key 'col1'
Insert into auto_increment03 values(10000);
Duplicate entry '10000' for key 'col1'
Select * from auto_increment03;
col1
10000
Drop table auto_increment03;
Drop table if exists auto_increment04;
Create table auto_increment04(col1 int primary key auto_increment) auto_increment = 10;
insert into auto_increment04 values();
Select * from auto_increment04;
col1
10
Insert into auto_increment04 values();
select last_insert_id();
last_insert_id()
11
Insert into auto_increment04 values(100);
Insert into auto_increment04 values(200);
Insert into auto_increment04 values(10);
Duplicate entry '10' for key 'col1'
Insert into auto_increment04 values(11);
Duplicate entry '11' for key 'col1'
Select * from auto_increment04;
col1
10
11
100
200
Drop table auto_increment04;
Drop table if exists auto_increment05;
Create table auto_increment05(col1 int unique key auto_increment) auto_increment = 10000;
Insert into auto_increment05 values();
Insert into auto_increment05 values();
Insert into auto_increment05 values();
select last_insert_id();
last_insert_id()
10002
Select * from auto_increment05;
col1
10000
10001
10002
Insert into auto_increment05 values(10001);
Duplicate entry '10001' for key '__mo_index_idx_col'
Insert into auto_increment05 values(10002);
Duplicate entry '10002' for key '__mo_index_idx_col'
Select * from auto_increment05;
col1
10000
10001
10002
Drop table auto_increment05;
Drop table if exists auto_increment06;
Create table auto_increment06(col1 int auto_increment primary key) auto_increment = 2147483646;
Insert into auto_increment06 values();
Insert into auto_increment06 values();
Insert into auto_increment06 values();
Data truncation: data out of range: data type int, value 2147483648
select last_insert_id();
last_insert_id()
2147483647
Select * from auto_increment06;
col1
2147483646
2147483647
Insert into auto_increment06 values(10001);
Insert into auto_increment06 values(10002);
Select * from auto_increment06;
col1
2147483646
2147483647
10001
10002
Drop table auto_increment06;
Drop table if exists auto_increment07;
Create table auto_increment07(col1 smallint auto_increment primary key) auto_increment = 32766;
Insert into auto_increment07 values();
Insert into auto_increment07 values();
Insert into auto_increment07 values();
Data truncation: data out of range: data type smallint, value 32768
select last_insert_id();
last_insert_id()
32767
Select * from auto_increment07;
col1
32766
32767
Drop table auto_increment07;
Drop table if exists auto_increment08;
Create table auto_increment08(col1 bigint auto_increment primary key) auto_increment = 9223372036854775806;
Insert into auto_increment08 values();
Insert into auto_increment08 values();
Insert into auto_increment08 values();
Data truncation: data out of range: data type bigint, value 9223372036854775808
select last_insert_id();
last_insert_id()
9223372036854775807
Select * from auto_increment08;
col1
9223372036854775806
9223372036854775807
Drop table auto_increment08;
Drop table if exists auto_increment09;
Create table auto_increment09(col1 tinyint unsigned auto_increment primary key) auto_increment = 254;
Insert into auto_increment09 values();
Insert into auto_increment09 values();
Insert into auto_increment09 values();
Data truncation: data out of range: data type tinyint unsigned, value 256
select last_insert_id();
last_insert_id()
255
Select * from auto_increment09;
col1
254
255
Drop table auto_increment09;
Drop table if exists auto_increment10;
[unknown result because it is related to issue#10834]
Create table auto_increment10(col1 int auto_increment, col2 int, unique index(col1)) auto_increment = 254;
[unknown result because it is related to issue#10834]
Insert into auto_increment10(col2) values(100);
[unknown result because it is related to issue#10834]
Insert into auto_increment10(col2) values(200);
[unknown result because it is related to issue#10834]
insert into auto_increment10(col2) values(100);
[unknown result because it is related to issue#10834]
select last_insert_id();
[unknown result because it is related to issue#10834]
Select * from auto_increment10;
[unknown result because it is related to issue#10834]
Drop table auto_increment10;
[unknown result because it is related to issue#10834]
Drop table if exists auto_increment11;
Create table auto_increment11(col1 int auto_increment primary key) auto_increment = 100;
insert into auto_increment11 values();
Insert into auto_increment11 values();
Insert into auto_increment11 values();
select last_insert_id();
last_insert_id()
102
Select * from auto_increment11;
col1
100
101
102
Delete from auto_increment11 where col1 = 100;
Update auto_increment11 set col1 = 200 where col1 = 101;
Select * from auto_increment11;
col1
102
200
Drop table auto_increment11;
Drop table if exists auto_increment12;
[unknown result because it is related to issue#10842]
create table auto_increment12(col1 int auto_increment primary key)auto_increment = 10;
[unknown result because it is related to issue#10842]
Insert into auto_increment12 values();
[unknown result because it is related to issue#10842]
Insert into auto_increment12 values();
[unknown result because it is related to issue#10842]
Select * from auto_increment12;
[unknown result because it is related to issue#10842]
Insert into auto_increment12 values(16.898291);
[unknown result because it is related to issue#10842]
insert into auto_increment12 values(124312.4321424324);
[unknown result because it is related to issue#10842]
insert into auto_increment12 values();
[unknown result because it is related to issue#10842]
select last_insert_id();
[unknown result because it is related to issue#10842]
Select * from auto_increment12;
[unknown result because it is related to issue#10842]
Drop table auto_increment12;
[unknown result because it is related to issue#10842]
Drop table if exists auto_increment10;
Create table auto_increment13(col1 int auto_increment primary key)auto_increment = 30000;
Insert into auto_increment13 values();
Insert into auto_increment13 values();
select * from auto_increment13;
col1
30000
30001
Truncate table auto_increment13;
Insert into auto_increment13 values();
select last_insert_id();
last_insert_id()
1
Insert into auto_increment13 values(10000);
Select * from auto_increment13;
col1
1
10000
Drop table auto_increment13;
Drop table if exists auto_increment14;
Create table auto_increment14(col1 int primary key auto_increment, col2 varchar(10))auto_increment = 100;
insert into auto_increment14 values (-2147483648, 'aaa');
select * from auto_increment14 order by c;
invalid input: column c does not exist
insert into auto_increment14 values (-2147483649, 'aaa');
Data truncation: data out of range: data type int32, value '-2147483649'
Insert into auto_increment14 values();
Insert into auto_increment14 values();
Select last_insert_id();
last_insert_id()
101
insert into auto_increment14(col2) values ('22222');
select * from auto_increment14 order by col1;
col1    col2
-2147483648    aaa
100    null
101    null
102    22222
select * from auto_increment14 order by col1 desc;
col1    col2
102    22222
101    null
100    null
-2147483648    aaa
Drop table auto_increment14;
drop table if exists auto_increment15;
create table auto_increment15(
a int primary key auto_increment,
b bigint auto_increment,
c int auto_increment,
d int auto_increment,
e bigint auto_increment
);
show create table auto_increment15;
Table    Create Table
auto_increment15    CREATE TABLE `auto_increment15` (\n`a` INT NOT NULL AUTO_INCREMENT,\n`b` BIGINT NOT NULL AUTO_INCREMENT,\n`c` INT NOT NULL AUTO_INCREMENT,\n`d` INT NOT NULL AUTO_INCREMENT,\n`e` BIGINT NOT NULL AUTO_INCREMENT,\nPRIMARY KEY (`a`)\n)
insert into auto_increment15 values (),(),(),();
select * from auto_increment15 order by a;
a    b    c    d    e
1    1    1    1    1
2    2    2    2    2
3    3    3    3    3
4    4    4    4    4
insert into auto_increment15 values (NULL, NULL, NULL, NULL, NULL);
select * from auto_increment15 order by a;
a    b    c    d    e
1    1    1    1    1
2    2    2    2    2
3    3    3    3    3
4    4    4    4    4
5    5    5    5    5
insert into auto_increment15(b,c,d) values (NULL,NULL,NULL);
select * from auto_increment15 order by a;
a    b    c    d    e
1    1    1    1    1
2    2    2    2    2
3    3    3    3    3
4    4    4    4    4
5    5    5    5    5
6    6    6    6    6
insert into auto_increment15(a,b) values (100, 400);
select * from auto_increment15 order by a;
a    b    c    d    e
1    1    1    1    1
2    2    2    2    2
3    3    3    3    3
4    4    4    4    4
5    5    5    5    5
6    6    6    6    6
100    400    7    7    7
insert into auto_increment15(c,d,e) values (200, 200, 200);
select * from auto_increment15;
a    b    c    d    e
1    1    1    1    1
2    2    2    2    2
3    3    3    3    3
4    4    4    4    4
5    5    5    5    5
6    6    6    6    6
100    400    7    7    7
101    401    200    200    200
insert into auto_increment15(c,d,e) values (200, 400, 600);
select * from auto_increment15;
a    b    c    d    e
1    1    1    1    1
2    2    2    2    2
3    3    3    3    3
4    4    4    4    4
5    5    5    5    5
6    6    6    6    6
100    400    7    7    7
101    401    200    200    200
102    402    200    400    600
Drop table auto_increment15;
Drop table if exists auto_increment16;
Create table auto_increment16(col1 int auto_increment)auto_increment < 0;
SQL parser error: You have an error in your SQL syntax; check the manual that corresponds to your MatrixOne server version for the right syntax to use. syntax error at line 1 column 70 near " < 0;";
Drop table auto_increment16;
no such table auto_increment.auto_increment16
drop table if exists auto_increment01;
create temporary table auto_increment01(col1 int auto_increment primary key)auto_increment = 0;
select * from auto_increment01;
col1
Insert into auto_increment01 values();
select last_insert_id();
last_insert_id()
1
Select * from auto_increment01;
col1
1
Insert into auto_increment01 values(1);
tae data: duplicate
Select * from auto_increment01;
col1
1
drop table auto_increment01;
Drop table if exists auto_increment02;
[unknown result because it is related to issue#10836]
Create temporary table auto_increment02(col1 int auto_increment unique key)auto_increment = 10;
[unknown result because it is related to issue#10836]
Insert into auto_increment02 values();
[unknown result because it is related to issue#10836]
select last_insert_id();
[unknown result because it is related to issue#10836]
Select * from auto_increment02;
[unknown result because it is related to issue#10836]
Insert into auto_increment02 values(10);
[unknown result because it is related to issue#10836]
insert into auto_increment02 values(100);
[unknown result because it is related to issue#10836]
Select * from auto_increment02;
[unknown result because it is related to issue#10836]
Drop table auto_increment02;
[unknown result because it is related to issue#10836]
Drop table if exists auto_increment03;
create temporary table auto_increment03(col1 int auto_increment primary key) auto_increment = 10000;
Insert into auto_increment03 values();
Insert into auto_increment03 values(10000);
tae data: duplicate
Insert into auto_increment03 values(10000);
tae data: duplicate
Insert into auto_increment03 values();
select last_insert_id();
last_insert_id()
10001
Select * from auto_increment03;
col1
10000
10001
Drop table auto_increment03;
Drop table if exists auto_increment04;
Create temporary table auto_increment04(col1 int primary key auto_increment) auto_increment = 10;
insert into auto_increment04 values();
Select * from auto_increment04;
col1
10
Insert into auto_increment04 values();
select last_insert_id();
last_insert_id()
11
Insert into auto_increment04 values(100);
Duplicate entry '100' for key 'col1'
Insert into auto_increment04 values(200);
Insert into auto_increment04 values(10);
tae data: duplicate
Insert into auto_increment04 values(11);
tae data: duplicate
Select * from auto_increment04;
col1
10
11
200
Drop table auto_increment04;
Drop table if exists auto_increment05;
[unknown result because it is related to issue#10834]
Create temporary table auto_increment05(col1 int unique key auto_increment) auto_increment = 10000;
[unknown result because it is related to issue#10834]
Insert into auto_increment05 values();
[unknown result because it is related to issue#10834]
Insert into auto_increment05 values();
[unknown result because it is related to issue#10834]
Insert into auto_increment05 values();
[unknown result because it is related to issue#10834]
select last_insert_id();
[unknown result because it is related to issue#10834]
Select * from auto_increment05;
[unknown result because it is related to issue#10834]
Insert into auto_increment05 values(10001);
[unknown result because it is related to issue#10834]
Insert into auto_increment05 values(10002);
[unknown result because it is related to issue#10834]
Select * from auto_increment05;
[unknown result because it is related to issue#10834]
Drop table auto_increment05;
[unknown result because it is related to issue#10834]
Drop table if exists auto_increment06;
[unknown result because it is related to issue#10834]
Create temporary table auto_increment06(col1 int unsigned auto_increment primary key) auto_increment = 2147483646;
[unknown result because it is related to issue#10834]
Insert into auto_increment06 values();
[unknown result because it is related to issue#10834]
Insert into auto_increment06 values();
[unknown result because it is related to issue#10834]
Insert into auto_increment06 values();
[unknown result because it is related to issue#10834]
select last_insert_id();
[unknown result because it is related to issue#10834]
Select * from auto_increment06;
[unknown result because it is related to issue#10834]
Insert into auto_increment06 values(10001);
[unknown result because it is related to issue#10834]
Insert into auto_increment06 values(10002);
[unknown result because it is related to issue#10834]
Select * from auto_increment06;
[unknown result because it is related to issue#10834]
Drop table auto_increment06;
[unknown result because it is related to issue#10834]
Drop table if exists auto_increment07;
[unknown result because it is related to issue#10834]
Create table auto_increment07(col1 smallint unsigned auto_increment primary key) auto_increment = 65534;
[unknown result because it is related to issue#10834]
Insert into auto_increment07 values();
[unknown result because it is related to issue#10834]
Insert into auto_increment07 values();
[unknown result because it is related to issue#10834]
Insert into auto_increment07 values();
[unknown result because it is related to issue#10834]
Insert into auto_increment07 values();
[unknown result because it is related to issue#10834]
select last_insert_id();
[unknown result because it is related to issue#10834]
Select * from auto_increment07;
[unknown result because it is related to issue#10834]
Drop table auto_increment07;
[unknown result because it is related to issue#10834]
Drop table if exists auto_increment08;
[unknown result because it is related to issue#10834]
Create table auto_increment08(col1 bigint unsigned auto_increment primary key) auto_increment = 9223372036854775806;
[unknown result because it is related to issue#10834]
Insert into auto_increment08 values();
[unknown result because it is related to issue#10834]
Insert into auto_increment08 values();
[unknown result because it is related to issue#10834]
Insert into auto_increment08 values();
[unknown result because it is related to issue#10834]
select last_insert_id();
[unknown result because it is related to issue#10834]
Select * from auto_increment08;
[unknown result because it is related to issue#10834]
Drop table auto_increment08;
[unknown result because it is related to issue#10834]
Drop table if exists auto_increment09;
[unknown result because it is related to issue#10834]
Create table auto_increment09(col1 tinyint auto_increment primary key) auto_increment = 254;
[unknown result because it is related to issue#10834]
Insert into auto_increment09 values();
[unknown result because it is related to issue#10834]
Insert into auto_increment09 values();
[unknown result because it is related to issue#10834]
Insert into auto_increment09 values();
[unknown result because it is related to issue#10834]
select last_insert_id();
[unknown result because it is related to issue#10834]
Select * from auto_increment09;
[unknown result because it is related to issue#10834]
Drop table auto_increment09;
[unknown result because it is related to issue#10834]
Drop table if exists auto_increment10;
[unknown result because it is related to issue#10834]
Create temporary table auto_increment10(col1 int auto_increment, col2 int, unique index(col1)) auto_increment = 3267183;
[unknown result because it is related to issue#10834]
Insert into auto_increment10(col2) values(100);
[unknown result because it is related to issue#10834]
Insert into auto_increment10(col2) values(200);
[unknown result because it is related to issue#10834]
insert into auto_increment10(col2) values(100);
[unknown result because it is related to issue#10834]
select last_insert_id();
[unknown result because it is related to issue#10834]
Select * from auto_increment10;
[unknown result because it is related to issue#10834]
Drop table auto_increment10;
[unknown result because it is related to issue#10834]
Drop table if exists auto_increment11;
Create temporary table auto_increment11(col1 int auto_increment primary key) auto_increment = 100;
insert into auto_increment11 values();
Insert into auto_increment11 values();
Insert into auto_increment11 values();
select last_insert_id();
last_insert_id()
102
Select * from auto_increment11;
col1
100
101
102
Delete from auto_increment11 where col1 = 100;
Update auto_increment11 set col1 = 200 where col1 = 101;
[unknown result because it is related to issue#10834]
Select * from auto_increment11;
col1
101
102
Drop table auto_increment11;
Drop table if exists auto_increment12;
[unknown result because it is related to issue#10842]
create temporary table auto_increment12(col1 int auto_increment primary key)auto_increment = 10;
[unknown result because it is related to issue#10842]
Insert into auto_increment12 values();
[unknown result because it is related to issue#10842]
Insert into auto_increment12 values();
[unknown result because it is related to issue#10842]
Select * from auto_increment12;
[unknown result because it is related to issue#10842]
Insert into auto_increment12 values(16.898291);
[unknown result because it is related to issue#10842]
insert into auto_increment12 values();
[unknown result because it is related to issue#10842]
select last_insert_id();
[unknown result because it is related to issue#10842]
Select * from auto_increment12;
[unknown result because it is related to issue#10842]
Drop table auto_increment12;
[unknown result because it is related to issue#10842]
Drop table if exists auto_increment13;
Create table auto_increment13(col1 int auto_increment primary key)auto_increment = 30000;
Insert into auto_increment13 values();
Insert into auto_increment13 values();
select * from auto_increment13;
col1
30000
30001
Truncate table auto_increment13;
Insert into auto_increment13 values();
select last_insert_id();
last_insert_id()
1
Insert into auto_increment13 values(10000);
Select * from auto_increment13;
col1
1
10000
Drop table auto_increment13;
Drop table if exists auto_increment14;
Create table auto_increment14(col1 int primary key auto_increment, col2 varchar(10))auto_increment = 100;
insert into auto_increment14 values (-2147483648, 'aaa');
select * from auto_increment14 order by c;
invalid input: column c does not exist
insert into auto_increment14 values (-2147483649, 'aaa');
Data truncation: data out of range: data type int32, value '-2147483649'
Insert into auto_increment14 values();
Insert into auto_increment14 values();
Select last_insert_id();
last_insert_id()
101
insert into auto_increment14(col2) values ('22222');
select * from auto_increment14 order by col1;
col1    col2
-2147483648    aaa
100    null
101    null
102    22222
select * from auto_increment14 order by col1 desc;
col1    col2
102    22222
101    null
100    null
-2147483648    aaa
Drop table auto_increment14;
drop table if exists auto_increment15;
create temporary table auto_increment15(
a int primary key auto_increment,
b bigint auto_increment,
c int auto_increment,
d int auto_increment,
e bigint auto_increment
)auto_increment = 100;
show create table auto_increment15;
Table    Create Table
auto_increment15    CREATE TABLE `auto_increment15` (\n`a` INT NOT NULL AUTO_INCREMENT,\n`b` BIGINT NOT NULL AUTO_INCREMENT,\n`c` INT NOT NULL AUTO_INCREMENT,\n`d` INT NOT NULL AUTO_INCREMENT,\n`e` BIGINT NOT NULL AUTO_INCREMENT,\nPRIMARY KEY (`a`)\n)
insert into auto_increment15 values (),(),(),();
select * from auto_increment15 order by a;
a    b    c    d    e
100    100    100    100    100
101    101    101    101    101
102    102    102    102    102
103    103    103    103    103
insert into auto_increment15 values (NULL, NULL, NULL, NULL, NULL);
select * from auto_increment15 order by a;
a    b    c    d    e
100    100    100    100    100
101    101    101    101    101
102    102    102    102    102
103    103    103    103    103
104    104    104    104    104
insert into auto_increment15(b,c,d) values (NULL,NULL,NULL);
select * from auto_increment15 order by a;
a    b    c    d    e
100    100    100    100    100
101    101    101    101    101
102    102    102    102    102
103    103    103    103    103
104    104    104    104    104
105    105    105    105    105
insert into auto_increment15(a,b) values (100, 400);
tae data: duplicate
select * from auto_increment15 order by a;
a    b    c    d    e
100    100    100    100    100
101    101    101    101    101
102    102    102    102    102
103    103    103    103    103
104    104    104    104    104
105    105    105    105    105
insert into auto_increment15(c,d,e) values (200, 200, 200);
select * from auto_increment15;
a    b    c    d    e
100    100    100    100    100
101    101    101    101    101
102    102    102    102    102
103    103    103    103    103
104    104    104    104    104
105    105    105    105    105
106    401    200    200    200
insert into auto_increment15(c,d,e) values (200, 400, 600);
select * from auto_increment15;
a    b    c    d    e
100    100    100    100    100
101    101    101    101    101
102    102    102    102    102
103    103    103    103    103
104    104    104    104    104
105    105    105    105    105
106    401    200    200    200
107    402    200    400    600
Drop table auto_increment15;
Drop table if exists auto_increment16;
Create temporary table auto_increment16(col1 int auto_increment)auto_increment < 0;
SQL parser error: You have an error in your SQL syntax; check the manual that corresponds to your MatrixOne server version for the right syntax to use. syntax error at line 1 column 80 near " < 0;";
Drop table auto_increment16;
no such table auto_increment.auto_increment16
