drop database if exists sql_task_case;
create database sql_task_case;
use sql_task_case;
drop task if exists sql_task_cron;
drop task if exists sql_task_manual;
drop task if exists sql_task_gate;
drop task if exists sql_task_literal_strings;
drop task if exists sql_task_rows_success;
drop task if exists sql_task_failfast_heartbeat;
drop task if exists sql_task_zero_row_insert;
drop task if exists sql_task_mini_pipeline;
drop task if exists sql_task_multistmt;
drop task if exists sql_task_timeout;
drop task if exists sql_task_retry;
drop task if exists sql_task_overlap;
drop task if exists sql_task_build_silver;
drop task if exists sql_task_build_gold;
drop task if exists sql_task_validate;
drop task if exists sql_task_literal_preserve;
create table scheduled_events(
marker varchar(32) not null,
created_at timestamp default current_timestamp
);
create table manual_events(id int primary key);
create table gate_source(id int primary key);
create table gate_sink(tag varchar(32) primary key);
create table literal_readings(pump int, engine_rpm int, pump_rate int, label varchar(32));
create table literal_classified(pump int, state varchar(32));
create table literal_matched(label varchar(32));
create table literal_quotes(label varchar(32));
create table rows_success_target(v int);
create table rows_success_heartbeat(tag varchar(16));
create table ms_target(v int);
create table failfast_target(v int);
create table failfast_heartbeat(tag varchar(16));
create table zero_row_src(id int primary key);
create table zero_row_sink(id int primary key);
create table zero_row_heartbeat(tag varchar(16));
create table pipeline_readings(pump int, engine_rpm int, pump_rate int);
create table pipeline_classified(pump int, state varchar(32));
create table pipeline_run_log(task_name varchar(64), status varchar(16));
create table timeout_sink(v int);
create table retry_target(v int);
create table overlap_sink(v int);
create table ingest_meta(batch_id int primary key, ready int not null);
create table raw_orders(order_id int primary key, amount int not null);
create table silver_orders(order_id int primary key, amount int not null);
create table gold_summary(summary_id int primary key, total_orders int not null, total_amount int not null);
create table validate_results(result_id int primary key, status varchar(16) not null);
create table literal_status_source(id int primary key, status varchar(16), rpm int, rate int);
create table literal_status_target(id int primary key, state_label varchar(32));
create task sql_task_cron schedule '0 0 0 1 1 *' timezone 'UTC' as begin insert into scheduled_events(marker) values ('cron'); end;
create task sql_task_manual as begin insert into manual_events select 1 where not exists (select 1 from manual_events where id = 1); end;
select sleep(2);
sleep(2)
0
select count(*) from scheduled_events;
count(*)
0
select count(*) from manual_events;
count(*)
0
alter task sql_task_cron set schedule '0 0 0 1 1 *' timezone 'UTC';
execute task sql_task_cron;
select sleep(1);
sleep(1)
0
select count(*) from scheduled_events;
count(*)
1
select status from mo_task.sql_task_run where task_name = 'sql_task_cron' and trigger_type = 'MANUAL' order by run_id desc limit 1;
status
SUCCESS
execute task sql_task_manual;
select sleep(1);
sleep(1)
0
select count(*) from manual_events;
count(*)
1
show task runs for sql_task_cron limit 1;
run_id    task_name    trigger_type    status    started_at    finished_at    duration    attempt    rows_affected    error_message
7    sql_task_cron    MANUAL    SUCCESS    2026-05-26 15:06:11 +0800 CST    2026-05-26 15:06:11 +0800 CST    0.022465    1    1    
show task runs for sql_task_manual limit 1;
run_id    task_name    trigger_type    status    started_at    finished_at    duration    attempt    rows_affected    error_message
8    sql_task_manual    MANUAL    SUCCESS    2026-05-26 15:06:12 +0800 CST    2026-05-26 15:06:12 +0800 CST    0.0264925    1    1    
alter task sql_task_cron suspend;
alter task sql_task_cron resume;
execute task sql_task_cron;
select sleep(1);
sleep(1)
0
select count(*) from scheduled_events;
count(*)
2
select status from mo_task.sql_task_run where task_name = 'sql_task_cron' order by run_id desc limit 2;
status
SUCCESS
SUCCESS
create task sql_task_gate when (exists(select 1 from gate_source where id = 1)) as begin insert into gate_sink select 'gate-ok' where not exists (select 1 from gate_sink where tag = 'gate-ok'); end;
execute task sql_task_gate;
select sleep(1);
sleep(1)
0
select count(*) from gate_sink;
count(*)
0
insert into gate_source values (1);
execute task sql_task_gate;
select sleep(1);
sleep(1)
0
select count(*) from gate_sink;
count(*)
1
select status
from mo_task.sql_task_run
where task_name = 'sql_task_gate'
order by run_id desc
limit 2;
status
SUCCESS
SKIPPED
insert into literal_readings values
(1, null, 0, 'UNKNOWN'),
(2, 900, 10, 'PUMPING'),
(3, 700, 0, 'IDLE'),
(4, 500, 0, 'OFF'),
(5, 900, 0, 'OTHER');
create task sql_task_literal_strings as begin insert into literal_classified select pump, case when engine_rpm is null then 'UNKNOWN' when engine_rpm >= 800 and pump_rate > 0 then 'PUMPING' when engine_rpm >= 600 and engine_rpm < 800 then 'IDLE' when engine_rpm < 600 then 'OFF' else 'UNKNOWN' end as state from literal_readings; insert into literal_matched select label from literal_readings where label in ('PUMPING', 'IDLE', 'OFF') and label <> 'UNKNOWN'; insert into literal_quotes values ('O''Brien'); end;
execute task sql_task_literal_strings;
select sleep(1);
sleep(1)
0
select state, count(*), hex(state) from literal_classified group by state order by state;
state    count(*)    hex(state)
IDLE    1    49444C45
OFF    1    4F4646
PUMPING    1    50554D50494E47
UNKNOWN    2    554E4B4E4F574E
select label, hex(label) from literal_matched order by label;
label    hex(label)
IDLE    49444C45
OFF    4F4646
PUMPING    50554D50494E47
select label, hex(label) from literal_quotes;
label    hex(label)
O'Brien    4F27427269656E
select status, rows_affected from mo_task.sql_task_run where task_name = 'sql_task_literal_strings' order by run_id desc limit 1;
status    rows_affected
SUCCESS    9
create task sql_task_rows_success as begin insert into rows_success_target values (1), (2), (3); insert into rows_success_heartbeat values ('done'); end;
execute task sql_task_rows_success;
select sleep(1);
sleep(1)
0
select count(*) from rows_success_target;
count(*)
3
select count(*) from rows_success_heartbeat;
count(*)
1
select status, rows_affected from mo_task.sql_task_run where task_name = 'sql_task_rows_success' order by run_id desc limit 1;
status    rows_affected
SUCCESS    4
create task sql_task_failfast_heartbeat
as begin
insert into failfast_target values (1);
insert into no_such_failfast_table values (1);
insert into failfast_target values (2);
insert into failfast_heartbeat values ('done');
end
execute task sql_task_failfast_heartbeat;
no such table sql_task_case.no_such_failfast_table
select sleep(1);
sleep(1)
0
select count(*), min(v), max(v) from failfast_target;
count(*)    min(v)    max(v)
1    1    1
select count(*) from failfast_heartbeat;
count(*)
0
select status, rows_affected, error_message from mo_task.sql_task_run where task_name = 'sql_task_failfast_heartbeat' order by run_id desc limit 1;
status    rows_affected    error_message
FAILED    1    no such table sql_task_case.no_such_failfast_table
insert into zero_row_src values (1);
create task sql_task_zero_row_insert
as begin
insert into zero_row_sink
select id from zero_row_src where id = 999;
insert into zero_row_heartbeat values ('done');
end
execute task sql_task_zero_row_insert;
select sleep(1);
sleep(1)
0
select count(*) from zero_row_sink;
count(*)
0
select count(*) from zero_row_heartbeat;
count(*)
1
select status, rows_affected from mo_task.sql_task_run where task_name = 'sql_task_zero_row_insert' order by run_id desc limit 1;
status    rows_affected
SUCCESS    1
insert into pipeline_readings values
(1, null, 0),
(2, 900, 10),
(3, 700, 0);
create task sql_task_mini_pipeline
as begin
delete from pipeline_classified;
insert into pipeline_classified
select pump,
case
when engine_rpm is null then 'UNKNOWN'
when engine_rpm >= 800 and pump_rate > 0 then 'PUMPING'
else 'IDLE'
end as state
from pipeline_readings;
delete from pipeline_run_log where task_name = 'sql_task_mini_pipeline';
insert into pipeline_run_log values ('sql_task_mini_pipeline', 'SUCCESS');
end
execute task sql_task_mini_pipeline;
select sleep(1);
sleep(1)
0
select state, count(*), hex(state) from pipeline_classified group by state order by state;
state    count(*)    hex(state)
IDLE    1    49444C45
PUMPING    1    50554D50494E47
UNKNOWN    1    554E4B4E4F574E
select task_name, status, hex(status) from pipeline_run_log;
task_name    status    hex(status)
sql_task_mini_pipeline    SUCCESS    53554343455353
select status, rows_affected from mo_task.sql_task_run where task_name = 'sql_task_mini_pipeline' order by run_id desc limit 1;
status    rows_affected
SUCCESS    4
create task sql_task_multistmt
as begin
insert into ms_target values (1);
insert into no_such_table values (1);
insert into ms_target values (2);
end
execute task sql_task_multistmt;
no such table sql_task_case.no_such_table
select sleep(1);
sleep(1)
0
select count(*), min(v), max(v) from ms_target;
count(*)    min(v)    max(v)
1    1    1
select status, rows_affected, error_message from mo_task.sql_task_run where task_name = 'sql_task_multistmt' order by run_id desc limit 1;
status    rows_affected    error_message
FAILED    1    no such table sql_task_case.no_such_table
create task sql_task_timeout timeout '1s' as begin insert into timeout_sink select sleep(2); end;
execute task sql_task_timeout;
context deadline exceeded
internal error: internal executor exec
select sleep(2);
sleep(2)
0
select count(*) from timeout_sink;
count(*)
0
select status from mo_task.sql_task_run where task_name = 'sql_task_timeout' order by run_id desc limit 1;
status
TIMEOUT
create task sql_task_retry retry 1 as begin insert into retry_target values (1); insert into no_such_retry_table values (1); end;
execute task sql_task_retry;
no such table sql_task_case.no_such_retry_table
select sleep(1);
sleep(1)
0
select count(*) from retry_target;
count(*)
2
select status from mo_task.sql_task_run where task_name = 'sql_task_retry' order by run_id desc limit 2;
status
FAILED
FAILED
create task sql_task_overlap as begin insert into overlap_sink select sleep(4); end;
use sql_task_case;
execute task sql_task_overlap;
select sleep(1);
sleep(1)
0
execute task sql_task_overlap;
select sleep(5);
sleep(5)
0
select count(*) from overlap_sink;
count(*)
2
select status from mo_task.sql_task_run where task_name = 'sql_task_overlap' order by run_id desc limit 2;
status
SUCCESS
SUCCESS
use sql_task_case;
drop task if exists sql_task_build_silver;
drop task if exists sql_task_build_gold;
drop task if exists sql_task_validate;
insert into raw_orders values (1, 10), (2, 20);
create task sql_task_build_silver when (exists(select 1 from ingest_meta where batch_id = 1 and ready = 1)) as begin insert into silver_orders select r.order_id, r.amount from raw_orders r where not exists ( select 1 from silver_orders s where s.order_id = r.order_id ); end;
create task sql_task_build_gold when (exists(select 1 from silver_orders)) as begin delete from gold_summary where summary_id = 1; insert into gold_summary select 1, count(*), sum(amount) from silver_orders; end;
create task sql_task_validate when (exists(select 1 from gold_summary where summary_id = 1)) as begin delete from validate_results where result_id = 1; insert into validate_results select 1, case when total_orders = 2 and total_amount = 30 then 'PASS' else 'FAIL' end from gold_summary where summary_id = 1; end;
execute task sql_task_validate;
execute task sql_task_build_gold;
execute task sql_task_build_silver;
insert into ingest_meta values (1, 1);
execute task sql_task_build_silver;
execute task sql_task_build_gold;
execute task sql_task_validate;
execute task sql_task_validate;
select sleep(2);
sleep(2)
0
select count(*) from silver_orders;
count(*)
2
select total_orders, total_amount from gold_summary where summary_id = 1;
total_orders    total_amount
2    30
select status from validate_results where result_id = 1;
status
PASS
select status from mo_task.sql_task_run where task_name = 'sql_task_build_silver' and trigger_type = 'MANUAL' order by run_id desc limit 1;
status
SUCCESS
select status from mo_task.sql_task_run where task_name = 'sql_task_build_gold' and trigger_type = 'MANUAL' order by run_id desc limit 1;
status
SUCCESS
select status from mo_task.sql_task_run where task_name = 'sql_task_validate' and trigger_type = 'MANUAL' order by run_id desc limit 1;
status
SUCCESS
select count(*) from validate_results;
count(*)
1
show task runs for sql_task_validate limit 3;
run_id    task_name    trigger_type    status    started_at    finished_at    duration    attempt    rows_affected    error_message
29    sql_task_validate    MANUAL    SUCCESS    2026-05-26 15:06:42 +0800 CST    2026-05-26 15:06:42 +0800 CST    0.027591917    1    2    
28    sql_task_validate    MANUAL    SUCCESS    2026-05-26 15:06:41 +0800 CST    2026-05-26 15:06:41 +0800 CST    0.027222625    1    1    
23    sql_task_validate    MANUAL    SKIPPED    2026-05-26 15:06:41 +0800 CST    2026-05-26 15:06:41 +0800 CST    0.015653958    1    0    
insert into literal_status_source values
(1, 'SUCCESS', 850, 12),
(2, 'SUCCESS', 700, 0),
(3, 'SUCCESS', 500, 0),
(4, 'FAILED', 900, 10),
(5, 'SUCCESS', null, 0);
create task sql_task_literal_preserve when (exists(select 1 from literal_status_source where status = 'SUCCESS')) as begin insert into literal_status_target select id, case when rpm >= 800 and rate > 0 then 'PUMPING' when rpm >= 600 then 'IDLE' when rpm < 600 then 'OFF' else 'UNKNOWN' end as state_label from literal_status_source where status = 'SUCCESS'; end;
select instr(gate_condition, '''SUCCESS''') > 0 as gate_success_literal,
instr(sql_body, '''PUMPING''') > 0 as pumping_literal,
instr(sql_body, '''IDLE''') > 0 as idle_literal,
instr(sql_body, '''OFF''') > 0 as off_literal,
instr(sql_body, '''UNKNOWN''') > 0 as unknown_literal
from mo_task.sql_task
where task_name = 'sql_task_literal_preserve';
gate_success_literal    pumping_literal    idle_literal    off_literal    unknown_literal
1    1    1    1    1
execute task sql_task_literal_preserve;
select state_label, count(*), hex(state_label) from literal_status_target group by state_label order by state_label;
state_label    count(*)    hex(state_label)
IDLE    1    49444C45
OFF    1    4F4646
PUMPING    1    50554D50494E47
UNKNOWN    1    554E4B4E4F574E
select status from mo_task.sql_task_run where task_name = 'sql_task_literal_preserve' and trigger_type = 'MANUAL' order by run_id desc limit 1;
status
SUCCESS
select rows_affected from mo_task.sql_task_run where task_name = 'sql_task_literal_preserve' and trigger_type = 'MANUAL' order by run_id desc limit 1;
rows_affected
4
drop account if exists sql_task_tenant;
create account sql_task_tenant admin_name 'admin' identified by '111';
create database if not exists tenant_task_case;
use tenant_task_case;
create table tenant_sink(v int primary key);
create task tenant_task_show schedule '0 0 0 1 1 *' timezone 'UTC' when (1) timeout '30s' as begin insert into tenant_sink select 1 where not exists (select 1 from tenant_sink where v = 1); end;
execute task tenant_task_show;
select sleep(1);
sleep(1)
0
alter task tenant_task_show set when (0);
execute task tenant_task_show;
select sleep(1);
sleep(1)
0
show tasks;
task_name    schedule    enabled    gate_condition    retry_limit    timeout    created_at    last_run_status    last_run_time
tenant_task_show    CRON_TZ=UTC 0 0 0 1 1 *    1    0    0    30s    2026-05-26 15:06:44 +0800 CST    SKIPPED    2026-05-26 15:06:45 +0800 CST
show task runs for tenant_task_show limit 2;
run_id    task_name    trigger_type    status    started_at    finished_at    duration    attempt    rows_affected    error_message
31    tenant_task_show    MANUAL    SKIPPED    2026-05-26 15:06:45 +0800 CST    2026-05-26 15:06:45 +0800 CST    0.0163025    1    0    
30    tenant_task_show    MANUAL    SUCCESS    2026-05-26 15:06:44 +0800 CST    2026-05-26 15:06:44 +0800 CST    0.022766792    1    1    
select count(*) from tenant_sink;
count(*)
1
drop task if exists tenant_task_show;
drop database if exists tenant_task_case;
drop task if exists sql_task_validate;
drop task if exists sql_task_build_gold;
drop task if exists sql_task_build_silver;
drop task if exists sql_task_literal_preserve;
drop task if exists sql_task_overlap;
drop task if exists sql_task_retry;
drop task if exists sql_task_timeout;
drop task if exists sql_task_mini_pipeline;
drop task if exists sql_task_zero_row_insert;
drop task if exists sql_task_failfast_heartbeat;
drop task if exists sql_task_multistmt;
drop task if exists sql_task_rows_success;
drop task if exists sql_task_literal_strings;
drop task if exists sql_task_gate;
drop task if exists sql_task_manual;
drop task if exists sql_task_cron;
drop database if exists sql_task_case;
drop account if exists sql_task_tenant;
