drop database if exists sql_task_phase6;
create database sql_task_phase6;
use sql_task_phase6;
drop task if exists task_phase6_cron;
drop task if exists task_phase6_manual;
drop task if exists task_phase6_gate;
drop task if exists task_phase6_multistmt;
drop task if exists task_phase6_timeout;
drop task if exists task_phase6_retry;
drop task if exists task_phase6_overlap;
drop task if exists task_build_silver;
drop task if exists task_build_gold;
drop task if exists task_validate;
create table scheduled_events(
marker varchar(32) not null,
created_at timestamp default current_timestamp
);
create table manual_events(id int primary key);
create table gate_source(id int primary key);
create table gate_sink(tag varchar(32) primary key);
create table ms_target(v int);
create table timeout_sink(v int);
create table retry_target(v int);
create table overlap_sink(v int);
create table suspend_snapshot(cnt bigint);
create table ingest_meta(batch_id int primary key, ready int not null);
create table raw_orders(order_id int primary key, amount int not null);
create table silver_orders(order_id int primary key, amount int not null);
create table gold_summary(summary_id int primary key, total_orders int not null, total_amount int not null);
create table validate_results(result_id int primary key, status varchar(16) not null);
create task task_phase6_cron
schedule '0 0 0 1 1 *'
timezone 'UTC'
as begin
insert into scheduled_events(marker) values ('cron');
SQL parser error: You have an error in your SQL syntax; check the manual that corresponds to your MatrixOne server version for the right syntax to use. syntax error at line 6 column 54 near "";
end;
SQL parser error: You have an error in your SQL syntax; check the manual that corresponds to your MatrixOne server version for the right syntax to use. syntax error at line 1 column 3 near "end;";
create task task_phase6_manual
as begin
insert into manual_events
select 1
where not exists (select 1 from manual_events where id = 1);
SQL parser error: You have an error in your SQL syntax; check the manual that corresponds to your MatrixOne server version for the right syntax to use. syntax error at line 6 column 61 near "";
end;
SQL parser error: You have an error in your SQL syntax; check the manual that corresponds to your MatrixOne server version for the right syntax to use. syntax error at line 1 column 3 near "end;";
select sleep(2);
sleep(2)
0
select count(*) from scheduled_events;
count(*)
0
select count(*) from manual_events;
count(*)
0
select count(*) from mo_task.sql_task_run where task_name = 'task_phase6_cron';
count(*)
0
select count(*) from mo_task.sql_task_run where task_name = 'task_phase6_manual';
count(*)
0
alter task task_phase6_cron set schedule '*/1 * * * * *' timezone 'UTC';
internal error: sql task task_phase6_cron not found
select sleep(7);
sleep(7)
0
select count(*) >= 1 from scheduled_events;
count(*) >= 1
false
select count(*) >= 1 from mo_task.sql_task_run where task_name = 'task_phase6_cron' and trigger_type = 'SCHEDULED' and status = 'SUCCESS';
count(*) >= 1
false
execute task task_phase6_manual;
internal error: sql task task_phase6_manual not found
select count(*) from manual_events;
count(*)
0
show tasks;
task_name    schedule    enabled    gate_condition    retry_limit    timeout    created_at    last_run_status    last_run_time
show task runs for task_phase6_cron limit 1;
run_id    task_name    trigger_type    status    started_at    finished_at    duration    attempt    rows_affected    error_message
show task runs for task_phase6_manual limit 1;
run_id    task_name    trigger_type    status    started_at    finished_at    duration    attempt    rows_affected    error_message
alter task task_phase6_cron suspend;
internal error: sql task task_phase6_cron not found
truncate table suspend_snapshot;
insert into suspend_snapshot select count(*) from scheduled_events;
select sleep(4);
sleep(4)
0
select (select cnt from suspend_snapshot limit 1) = (select count(*) from scheduled_events);
(select cnt from suspend_snapshot limit 1) = (select count(*) from scheduled_events)
true
alter task task_phase6_cron set schedule '0 0 0 1 1 *' timezone 'UTC';
internal error: sql task task_phase6_cron not found
truncate table suspend_snapshot;
insert into suspend_snapshot select count(*) from scheduled_events;
alter task task_phase6_cron resume;
internal error: sql task task_phase6_cron not found
select sleep(4);
sleep(4)
0
select (select cnt from suspend_snapshot limit 1) = (select count(*) from scheduled_events);
(select cnt from suspend_snapshot limit 1) = (select count(*) from scheduled_events)
true
create task task_phase6_gate
when (exists(select 1 from gate_source where id = 1))
as begin
insert into gate_sink
select 'gate-ok'
where not exists (select 1 from gate_sink where tag = 'gate-ok');
SQL parser error: You have an error in your SQL syntax; check the manual that corresponds to your MatrixOne server version for the right syntax to use. syntax error at line 7 column 66 near "";
end;
SQL parser error: You have an error in your SQL syntax; check the manual that corresponds to your MatrixOne server version for the right syntax to use. syntax error at line 1 column 3 near "end;";
execute task task_phase6_gate;
internal error: sql task task_phase6_gate not found
select count(*) from gate_sink;
count(*)
0
insert into gate_source values (1);
execute task task_phase6_gate;
internal error: sql task task_phase6_gate not found
select count(*) from gate_sink;
count(*)
0
select trigger_type, status, count(*)
from mo_task.sql_task_run
where task_name = 'task_phase6_gate'
group by trigger_type, status;
trigger_type    status    count(*)
create task task_phase6_multistmt
as begin
insert into ms_target values (1);
SQL parser error: You have an error in your SQL syntax; check the manual that corresponds to your MatrixOne server version for the right syntax to use. syntax error at line 4 column 34 near "";
insert into no_such_table values (1);
no such table sql_task_phase6.no_such_table
insert into ms_target values (2);
end;
SQL parser error: You have an error in your SQL syntax; check the manual that corresponds to your MatrixOne server version for the right syntax to use. syntax error at line 1 column 3 near "end;";
execute task task_phase6_multistmt;
internal error: sql task task_phase6_multistmt not found
select count(*), min(v), max(v) from ms_target;
count(*)    min(v)    max(v)
1    2    2
select status, count(*) from mo_task.sql_task_run where task_name = 'task_phase6_multistmt' group by status order by status;
status    count(*)
create task task_phase6_timeout
timeout '1s'
as begin
insert into timeout_sink select sleep(2);
SQL parser error: You have an error in your SQL syntax; check the manual that corresponds to your MatrixOne server version for the right syntax to use. syntax error at line 5 column 42 near "";
end;
SQL parser error: You have an error in your SQL syntax; check the manual that corresponds to your MatrixOne server version for the right syntax to use. syntax error at line 1 column 3 near "end;";
execute task task_phase6_timeout;
internal error: sql task task_phase6_timeout not found
select count(*) from timeout_sink;
count(*)
0
select status, count(*) from mo_task.sql_task_run where task_name = 'task_phase6_timeout' group by status order by status;
status    count(*)
create task task_phase6_retry
retry 1
as begin
insert into retry_target values (1);
SQL parser error: You have an error in your SQL syntax; check the manual that corresponds to your MatrixOne server version for the right syntax to use. syntax error at line 5 column 37 near "";
insert into no_such_retry_table values (1);
no such table sql_task_phase6.no_such_retry_table
end;
SQL parser error: You have an error in your SQL syntax; check the manual that corresponds to your MatrixOne server version for the right syntax to use. syntax error at line 1 column 3 near "end;";
execute task task_phase6_retry;
internal error: sql task task_phase6_retry not found
select count(*) from retry_target;
count(*)
0
select status, count(*) from mo_task.sql_task_run where task_name = 'task_phase6_retry' group by status order by status;
status    count(*)
create task task_phase6_overlap
as begin
insert into overlap_sink select sleep(4);
SQL parser error: You have an error in your SQL syntax; check the manual that corresponds to your MatrixOne server version for the right syntax to use. syntax error at line 4 column 42 near "";
end;
SQL parser error: You have an error in your SQL syntax; check the manual that corresponds to your MatrixOne server version for the right syntax to use. syntax error at line 1 column 3 near "end;";
use sql_task_phase6;
execute task task_phase6_overlap;
internal error: sql task task_phase6_overlap not found
select sleep(1);
sleep(1)
0
execute task task_phase6_overlap;
internal error: sql task task_phase6_overlap not found
select sleep(5);
sleep(5)
0
select count(*) from overlap_sink;
count(*)
0
select status, count(*) from mo_task.sql_task_run where task_name = 'task_phase6_overlap' group by status order by status;
status    count(*)
insert into raw_orders values (1, 10), (2, 20);
create task task_build_silver
when (exists(select 1 from ingest_meta where batch_id = 1 and ready = 1))
as begin
insert into silver_orders
select r.order_id, r.amount
from raw_orders r
where not exists (
select 1 from silver_orders s where s.order_id = r.order_id
);
SQL parser error: You have an error in your SQL syntax; check the manual that corresponds to your MatrixOne server version for the right syntax to use. syntax error at line 10 column 3 near "";
end;
SQL parser error: You have an error in your SQL syntax; check the manual that corresponds to your MatrixOne server version for the right syntax to use. syntax error at line 1 column 3 near "end;";
create task task_build_gold
when (exists(select 1 from silver_orders))
as begin
delete from gold_summary where summary_id = 1;
SQL parser error: You have an error in your SQL syntax; check the manual that corresponds to your MatrixOne server version for the right syntax to use. syntax error at line 5 column 47 near "";
insert into gold_summary
select 1, count(*), sum(amount) from silver_orders;
constraint violation: Column 'total_amount' cannot be null
end;
SQL parser error: You have an error in your SQL syntax; check the manual that corresponds to your MatrixOne server version for the right syntax to use. syntax error at line 1 column 3 near "end;";
create task task_validate
when (exists(select 1 from gold_summary where summary_id = 1))
as begin
delete from validate_results where result_id = 1;
SQL parser error: You have an error in your SQL syntax; check the manual that corresponds to your MatrixOne server version for the right syntax to use. syntax error at line 5 column 50 near "";
insert into validate_results
select 1, case when total_orders = 2 and total_amount = 30 then 'PASS' else 'FAIL' end
from gold_summary
where summary_id = 1;
end;
SQL parser error: You have an error in your SQL syntax; check the manual that corresponds to your MatrixOne server version for the right syntax to use. syntax error at line 1 column 3 near "end;";
execute task task_validate;
internal error: sql task task_validate not found
execute task task_build_gold;
internal error: sql task task_build_gold not found
execute task task_build_silver;
internal error: sql task task_build_silver not found
insert into ingest_meta values (1, 1);
execute task task_build_silver;
internal error: sql task task_build_silver not found
execute task task_build_gold;
internal error: sql task task_build_gold not found
execute task task_validate;
internal error: sql task task_validate not found
execute task task_validate;
internal error: sql task task_validate not found
select count(*) from silver_orders;
count(*)
0
select total_orders, total_amount from gold_summary where summary_id = 1;
total_orders    total_amount
select status from validate_results where result_id = 1;
status
select task_name, status, count(*)
from mo_task.sql_task_run
where task_name in ('task_build_silver', 'task_build_gold', 'task_validate')
group by task_name, status;
task_name    status    count(*)
select count(*) from validate_results;
count(*)
0
show tasks;
task_name    schedule    enabled    gate_condition    retry_limit    timeout    created_at    last_run_status    last_run_time
show task runs for task_validate limit 3;
run_id    task_name    trigger_type    status    started_at    finished_at    duration    attempt    rows_affected    error_message
