drop database if exists mo_vec_demo;
create database mo_vec_demo;
use mo_vec_demo;
set experimental_hnsw_index=1;
drop table if exists items;
create table items (
id        bigint primary key,
title     varchar(64),
category  varchar(16),
price     float,
emb       vecf32(4)
);
drop table if exists items_v2;
create table items_v2 (
id        bigint primary key,
title     varchar(64),
category  varchar(16),
price     float,
emb       vecf32(8)
);
insert into items (id,title,category,price,emb) values
(1,'doc-1','a',10.5,'[0.10,0.20,0.30,0.40]'),
(2,'doc-2','b',20.0,'[0.05,0.21,0.28,0.33]'),
(3,'doc-3','a',12.0,'[0.20,0.10,0.00,0.60]');
select id,title,category,price,emb from items order by id;
id    title    category    price    emb
1    doc-1    a    10.5    [0.1, 0.2, 0.3, 0.4]
2    doc-2    b    20.0    [0.05, 0.21, 0.28, 0.33]
3    doc-3    a    12.0    [0.2, 0.1, 0, 0.6]
update items set price=18.8 where id=2;
select * from items;
id    title    category    price    emb
1    doc-1    a    10.5    [0.1, 0.2, 0.3, 0.4]
3    doc-3    a    12.0    [0.2, 0.1, 0, 0.6]
2    doc-2    b    18.8    [0.05, 0.21, 0.28, 0.33]
update items set emb='[0.12,0.22,0.32,0.42]' where id=1;
delete from items where id=3;
select * from items;
id    title    category    price    emb
2    doc-2    b    18.8    [0.05, 0.21, 0.28, 0.33]
1    doc-1    a    10.5    [0.12, 0.22, 0.32, 0.42]
insert into items (id,title,category,price,emb)
values (3,'doc-3','a',11.1,'[0.20,0.12,0.01,0.55]');
select * from items;
id    title    category    price    emb
2    doc-2    b    18.8    [0.05, 0.21, 0.28, 0.33]
1    doc-1    a    10.5    [0.12, 0.22, 0.32, 0.42]
3    doc-3    a    11.1    [0.2, 0.12, 0.01, 0.55]
drop index if exists idx_items_emb on items;
internal error: not found index: idx_items_emb
create index idx_items_emb using hnsw on items (emb) op_type "vector_l2_ops" m 48 ef_construction 64 ef_search 64;
show create table items;
Table    Create Table
items    CREATE TABLE `items` (\n  `id` bigint NOT NULL,\n  `title` varchar(64) DEFAULT NULL,\n  `category` varchar(16) DEFAULT NULL,\n  `price` float DEFAULT NULL,\n  `emb` vecf32(4) DEFAULT NULL,\n  PRIMARY KEY (`id`),\n  KEY `idx_items_emb` USING hnsw (`emb`) m = 48  ef_construction = 64  ef_search = 64  op_type 'vector_l2_ops' \n)
drop index idx_items_emb on items;
show create table items;
Table    Create Table
items    CREATE TABLE `items` (\n  `id` bigint NOT NULL,\n  `title` varchar(64) DEFAULT NULL,\n  `category` varchar(16) DEFAULT NULL,\n  `price` float DEFAULT NULL,\n  `emb` vecf32(4) DEFAULT NULL,\n  PRIMARY KEY (`id`)\n)
alter table items add column tags varchar(64);
show create table items;
Table    Create Table
items    CREATE TABLE `items` (\n  `id` bigint NOT NULL,\n  `title` varchar(64) DEFAULT NULL,\n  `category` varchar(16) DEFAULT NULL,\n  `price` float DEFAULT NULL,\n  `emb` vecf32(4) DEFAULT NULL,\n  `tags` varchar(64) DEFAULT NULL,\n  PRIMARY KEY (`id`)\n)
alter table items drop column tags;
show create table items;
Table    Create Table
items    CREATE TABLE `items` (\n  `id` bigint NOT NULL,\n  `title` varchar(64) DEFAULT NULL,\n  `category` varchar(16) DEFAULT NULL,\n  `price` float DEFAULT NULL,\n  `emb` vecf32(4) DEFAULT NULL,\n  PRIMARY KEY (`id`)\n)
insert into items_v2 (id,title,category,price,emb)
select id,title,category,price,
'[0.10,0.20,0.30,0.40,0.01,0.02,0.03,0.04]'
from items;
start transaction;
insert into items values (10,'tx-doc','b',9.9,'[0.01,0.02,0.03,0.04]');
update items set price=19.9 where id=2;
select id, l2_distance(emb,'[0.01,0.02,0.03,0.04]') as dist
from items order by dist asc limit 1;
id    dist
10    0.0
rollback;
select * from items where id=10 or id=2;
id    title    category    price    emb
2    doc-2    b    18.8    [0.05, 0.21, 0.28, 0.33]
insert into items values (100,'bad','x',0.1,'[0.1,0.2,0.3]');
invalid input: expected vector dimension 4 != actual dimension 3.
insert into items values (11,'null-vec','a',8.8,null);
select id,
emb is null as is_null
from items
order by id;
id    is_null
1    false
2    false
3    false
11    true
drop table if exists items;
create table items (
id bigint primary key,
name varchar(100),
description text,
image_vector vecf32(4),
text_vector vecf32(10),
category varchar(50),
created_at timestamp default now()
);
insert into items (id, name, description, image_vector, text_vector, category)
values (
1,
'示例产品',
'这是一个测试产品的描述',
'[0.1, 0.2, 0.3, 0.4]',
'[0.12, -0.23, 0.33, 0.67, 0.22, 0.99, 10.11, 12.00, 0.12, 0.99]',
'electronics'
);
insert into items (id, name, image_vector, text_vector, category) values
(2, '产品a', '[0.15, 0.25, 0.35, 0.45]', '[0.15, -0.25, 0.35, -1.00, -8.89, -12.11, 12.11, 9.11, 22.0, 0.75]', 'books'),
(3, '产品b', '[0.05, 0.15, 0.25, 0.35]', '[0.05, -0.15, 0.25, 0.25, -0.35, 0.45, 0.25, -0.35, 0.45, 0.65]', 'electronics'),
(4, '产品c', '[0.25, 0.35, 0.45, 0.55]', '[0.25, -0.35, 0.45, 0.15, -0.25, 0.35, -1.00, -8.89, -12.11, 12.11]', 'clothing');
select * from items;
id    name    description    image_vector    text_vector    category    created_at
1    示例产品    这是一个测试产品的描述    [0.1, 0.2, 0.3, 0.4]    [0.12, -0.23, 0.33, 0.67, 0.22, 0.99, 10.11, 12, 0.12, 0.99]    electronics    2025-11-05 16:58:09
2    产品a    null    [0.15, 0.25, 0.35, 0.45]    [0.15, -0.25, 0.35, -1, -8.89, -12.11, 12.11, 9.11, 22, 0.75]    books    2025-11-05 16:58:09
3    产品b    null    [0.05, 0.15, 0.25, 0.35]    [0.05, -0.15, 0.25, 0.25, -0.35, 0.45, 0.25, -0.35, 0.45, 0.65]    electronics    2025-11-05 16:58:09
4    产品c    null    [0.25, 0.35, 0.45, 0.55]    [0.25, -0.35, 0.45, 0.15, -0.25, 0.35, -1, -8.89, -12.11, 12.11]    clothing    2025-11-05 16:58:09
select
id,
name,
text_vector,
l2_distance(text_vector, '[0.12, -0.23, 0.33, 0.67, 1.11, 2.13, 3.14, -0.99, 10.11, 11.00]') as dist
from items
order by dist asc
limit 3;
id    name    text_vector    dist
3    产品b    [0.05, -0.15, 0.25, 0.25, -0.35, 0.45, 0.25, -0.35, 0.45, 0.65]    14.640625
1    示例产品    [0.12, -0.23, 0.33, 0.67, 0.22, 0.99, 10.11, 12, 0.12, 0.99]    20.479572296142578
4    产品c    [0.25, -0.35, 0.45, 0.15, -0.25, 0.35, -1, -8.89, -12.11, 12.11]    24.079954147338867
update items
set image_vector = '[0.18, 0.28, 0.38, 0.48]', name = '更新后的产品a'
where id = 2;
delete from items where id = 3;
insert into items (id, name, image_vector, text_vector, category)
values (
3,
'重新插入的产品b',
'[0.05, 0.15, 0.25, 0.35]',
'[0.05, -0.15, 0.25, 0.25, -0.35, 0.45, 0.25, -0.35, 0.45, 0.65]',
'electronics'
);
create index idx_items_text_vector_ivf using hnsw on items(text_vector) op_type "vector_l2_ops" m 48 ef_construction 64 ef_search 64;
create index idx_items_image_vector_hnsw using hnsw on items(image_vector) op_type "vector_l2_ops" m 48 ef_construction 64 ef_search 64;
show create table items;
Table    Create Table
items    CREATE TABLE `items` (\n  `id` bigint NOT NULL,\n  `name` varchar(100) DEFAULT NULL,\n  `description` text DEFAULT NULL,\n  `image_vector` vecf32(4) DEFAULT NULL,\n  `text_vector` vecf32(10) DEFAULT NULL,\n  `category` varchar(50) DEFAULT NULL,\n  `created_at` timestamp DEFAULT now(),\n  PRIMARY KEY (`id`),\n  KEY `idx_items_text_vector_ivf` USING hnsw (`text_vector`) m = 48  ef_construction = 64  ef_search = 64  op_type 'vector_l2_ops' ,\n  KEY `idx_items_image_vector_hnsw` USING hnsw (`image_vector`) m = 48  ef_construction = 64  ef_search = 64  op_type 'vector_l2_ops' \n)
desc items;
Field    Type    Null    Key    Default    Extra    Comment
id    BIGINT(64)    NO    PRI    null        
name    VARCHAR(100)    YES        null        
description    TEXT(0)    YES        null        
image_vector    VECF32(4)    YES    MUL    null        
text_vector    VECF32(10)    YES    MUL    null        
category    VARCHAR(50)    YES        null        
created_at    TIMESTAMP(0)    YES        now()        
drop index idx_items_text_vector_ivf on items;
drop index idx_items_image_vector_hnsw on items;
select
id,
name,
cosine_similarity(text_vector, '[0.12, -0.23, 0.33, 0.67, -10.11, 111.11, -90.1, 89.00, -10.11, 0.11]') as similarity
from items
where category = 'electronics'
order by similarity desc
limit 5;
id    name    similarity
1    示例产品    0.09911856887925075
3    重新插入的产品b    -0.022562179191808914
start transaction;
insert into items (id, name, image_vector, text_vector) values (10, '事务产品a', '[0.1, 0.1, 0.1, 0.1]', '[0.12, -0.23, 0.33, 0.67, -10.11, 111.11, -90.1, 89.00, -10.11, 0.11]');
update items set name = '事务更新' where id = 2;
select * from items;
id    name    description    image_vector    text_vector    category    created_at
10    事务产品a    null    [0.1, 0.1, 0.1, 0.1]    [0.12, -0.23, 0.33, 0.67, -10.11, 111.11, -90.1, 89, -10.11, 0.11]    null    2025-11-05 16:58:10
2    事务更新    null    [0.18, 0.28, 0.38, 0.48]    [0.15, -0.25, 0.35, -1, -8.89, -12.11, 12.11, 9.11, 22, 0.75]    books    2025-11-05 16:58:09
1    示例产品    这是一个测试产品的描述    [0.1, 0.2, 0.3, 0.4]    [0.12, -0.23, 0.33, 0.67, 0.22, 0.99, 10.11, 12, 0.12, 0.99]    electronics    2025-11-05 16:58:09
4    产品c    null    [0.25, 0.35, 0.45, 0.55]    [0.25, -0.35, 0.45, 0.15, -0.25, 0.35, -1, -8.89, -12.11, 12.11]    clothing    2025-11-05 16:58:09
3    重新插入的产品b    null    [0.05, 0.15, 0.25, 0.35]    [0.05, -0.15, 0.25, 0.25, -0.35, 0.45, 0.25, -0.35, 0.45, 0.65]    electronics    2025-11-05 16:58:09
commit;
start transaction;
insert into items (id, name, image_vector, text_vector) values (12, '事务产品a', '[0.1, 0.1, 0.1, 0.1]', '[0.12, -0.23, 0.33, 0.67, -10.11, 111.11, -90.1, 89.00, -10.11, 0.11]');
delete from items where id = 4;
select * from items;
id    name    description    image_vector    text_vector    category    created_at
12    事务产品a    null    [0.1, 0.1, 0.1, 0.1]    [0.12, -0.23, 0.33, 0.67, -10.11, 111.11, -90.1, 89, -10.11, 0.11]    null    2025-11-05 16:58:10
1    示例产品    这是一个测试产品的描述    [0.1, 0.2, 0.3, 0.4]    [0.12, -0.23, 0.33, 0.67, 0.22, 0.99, 10.11, 12, 0.12, 0.99]    electronics    2025-11-05 16:58:09
3    重新插入的产品b    null    [0.05, 0.15, 0.25, 0.35]    [0.05, -0.15, 0.25, 0.25, -0.35, 0.45, 0.25, -0.35, 0.45, 0.65]    electronics    2025-11-05 16:58:09
10    事务产品a    null    [0.1, 0.1, 0.1, 0.1]    [0.12, -0.23, 0.33, 0.67, -10.11, 111.11, -90.1, 89, -10.11, 0.11]    null    2025-11-05 16:58:10
2    事务更新    null    [0.18, 0.28, 0.38, 0.48]    [0.15, -0.25, 0.35, -1, -8.89, -12.11, 12.11, 9.11, 22, 0.75]    books    2025-11-05 16:58:09
rollback;
select * from items;
id    name    description    image_vector    text_vector    category    created_at
1    示例产品    这是一个测试产品的描述    [0.1, 0.2, 0.3, 0.4]    [0.12, -0.23, 0.33, 0.67, 0.22, 0.99, 10.11, 12, 0.12, 0.99]    electronics    2025-11-05 16:58:09
4    产品c    null    [0.25, 0.35, 0.45, 0.55]    [0.25, -0.35, 0.45, 0.15, -0.25, 0.35, -1, -8.89, -12.11, 12.11]    clothing    2025-11-05 16:58:09
3    重新插入的产品b    null    [0.05, 0.15, 0.25, 0.35]    [0.05, -0.15, 0.25, 0.25, -0.35, 0.45, 0.25, -0.35, 0.45, 0.65]    electronics    2025-11-05 16:58:09
10    事务产品a    null    [0.1, 0.1, 0.1, 0.1]    [0.12, -0.23, 0.33, 0.67, -10.11, 111.11, -90.1, 89, -10.11, 0.11]    null    2025-11-05 16:58:10
2    事务更新    null    [0.18, 0.28, 0.38, 0.48]    [0.15, -0.25, 0.35, -1, -8.89, -12.11, 12.11, 9.11, 22, 0.75]    books    2025-11-05 16:58:09
insert into items (id, name, image_vector, text_vector) values (5, '空向量测试', null, null);
insert into items (id, name, image_vector) values (6, '错误维度', '[0.1, 0.2]'); -- 应为4维
invalid input: expected vector dimension 4 != actual dimension 2.
create table items_new (
id int primary key,
name varchar(100),
description text,
image_vector vecf32(5),
text_vector vecf32(10),
category varchar(50),
created_at timestamp default now()
);
insert into items_new (id, name, description, image_vector, text_vector, category, created_at)
select
id,
name,
description,
image_vector,
text_vector,
category,
created_at
from items;
alter table items drop column image_vector;
select * from items;
id    name    description    text_vector    category    created_at
1    示例产品    这是一个测试产品的描述    [0.12, -0.23, 0.33, 0.67, 0.22, 0.99, 10.11, 12, 0.12, 0.99]    electronics    2025-11-05 16:58:09
4    产品c    null    [0.25, -0.35, 0.45, 0.15, -0.25, 0.35, -1, -8.89, -12.11, 12.11]    clothing    2025-11-05 16:58:09
3    重新插入的产品b    null    [0.05, -0.15, 0.25, 0.25, -0.35, 0.45, 0.25, -0.35, 0.45, 0.65]    electronics    2025-11-05 16:58:09
10    事务产品a    null    [0.12, -0.23, 0.33, 0.67, -10.11, 111.11, -90.1, 89, -10.11, 0.11]    null    2025-11-05 16:58:10
2    事务更新    null    [0.15, -0.25, 0.35, -1, -8.89, -12.11, 12.11, 9.11, 22, 0.75]    books    2025-11-05 16:58:09
5    空向量测试    null    null    null    2025-11-05 16:58:10
desc items;
Field    Type    Null    Key    Default    Extra    Comment
id    BIGINT(64)    NO    PRI    null        
name    VARCHAR(100)    YES        null        
description    TEXT(0)    YES        null        
text_vector    VECF32(10)    YES        null        
category    VARCHAR(50)    YES        null        
created_at    TIMESTAMP(0)    YES        now()        
show create table items;
Table    Create Table
items    CREATE TABLE `items` (\n  `id` bigint NOT NULL,\n  `name` varchar(100) DEFAULT NULL,\n  `description` text DEFAULT NULL,\n  `text_vector` vecf32(10) DEFAULT NULL,\n  `category` varchar(50) DEFAULT NULL,\n  `created_at` timestamp DEFAULT now(),\n  PRIMARY KEY (`id`)\n)
drop table items;
alter table items_new rename to items;
drop database if exists mo_vec_demo;
