SET probe_limit=10;
create table nbf(a int primary key, v vecbf16(4));
insert into nbf values (1,'[1,1,1,1]'),(2,'[3,3,3,3]'),(3,'[5,5,5,5]'),(4,'[50,50,50,50]'),(5,'[52,52,52,52]'),(6,'[54,54,54,54]');
create index xbf using ivfflat on nbf(v) lists=2 op_type 'vector_l2_ops' ASYNC;
create table nhf(a int primary key, v vecf16(4));
insert into nhf values (1,'[1,1,1,1]'),(2,'[3,3,3,3]'),(3,'[5,5,5,5]'),(4,'[50,50,50,50]'),(5,'[52,52,52,52]'),(6,'[54,54,54,54]');
create index xhf using ivfflat on nhf(v) lists=2 op_type 'vector_l2_ops' ASYNC;
create table ni8(a int primary key, v vecint8(4));
insert into ni8 values (1,'[1,1,1,1]'),(2,'[3,3,3,3]'),(3,'[5,5,5,5]'),(4,'[50,50,50,50]'),(5,'[52,52,52,52]'),(6,'[54,54,54,54]');
create index xi8 using ivfflat on ni8(v) lists=2 op_type 'vector_l2_ops' ASYNC;
create table nu8(a int primary key, v vecuint8(4));
insert into nu8 values (1,'[1,1,1,1]'),(2,'[3,3,3,3]'),(3,'[5,5,5,5]'),(4,'[50,50,50,50]'),(5,'[52,52,52,52]'),(6,'[54,54,54,54]');
create index xu8 using ivfflat on nu8(v) lists=2 op_type 'vector_l2_ops' ASYNC;
set @nbf_entries = (select index_table_name from mo_catalog.mo_indexes where name = 'xbf' and algo = 'ivfflat' and algo_table_type = 'entries' and table_id in (select rel_id from mo_catalog.mo_tables where reldatabase = database() and relname = 'nbf') limit 1);
set @nbf_metadata = (select index_table_name from mo_catalog.mo_indexes where name = 'xbf' and algo = 'ivfflat' and algo_table_type = 'metadata' and table_id in (select rel_id from mo_catalog.mo_tables where reldatabase = database() and relname = 'nbf') limit 1);
set @nhf_entries = (select index_table_name from mo_catalog.mo_indexes where name = 'xhf' and algo = 'ivfflat' and algo_table_type = 'entries' and table_id in (select rel_id from mo_catalog.mo_tables where reldatabase = database() and relname = 'nhf') limit 1);
set @nhf_metadata = (select index_table_name from mo_catalog.mo_indexes where name = 'xhf' and algo = 'ivfflat' and algo_table_type = 'metadata' and table_id in (select rel_id from mo_catalog.mo_tables where reldatabase = database() and relname = 'nhf') limit 1);
set @ni8_entries = (select index_table_name from mo_catalog.mo_indexes where name = 'xi8' and algo = 'ivfflat' and algo_table_type = 'entries' and table_id in (select rel_id from mo_catalog.mo_tables where reldatabase = database() and relname = 'ni8') limit 1);
set @ni8_metadata = (select index_table_name from mo_catalog.mo_indexes where name = 'xi8' and algo = 'ivfflat' and algo_table_type = 'metadata' and table_id in (select rel_id from mo_catalog.mo_tables where reldatabase = database() and relname = 'ni8') limit 1);
set @nu8_entries = (select index_table_name from mo_catalog.mo_indexes where name = 'xu8' and algo = 'ivfflat' and algo_table_type = 'entries' and table_id in (select rel_id from mo_catalog.mo_tables where reldatabase = database() and relname = 'nu8') limit 1);
set @nu8_metadata = (select index_table_name from mo_catalog.mo_indexes where name = 'xu8' and algo = 'ivfflat' and algo_table_type = 'metadata' and table_id in (select rel_id from mo_catalog.mo_tables where reldatabase = database() and relname = 'nu8') limit 1);
set @wait_narrow_entries_sql = concat(
'select ',
'(select count(*) from `', database(), '`.`', @nbf_entries, '` where `__mo_index_centroid_fk_version` = (select cast(`__mo_index_val` as bigint) from `', database(), '`.`', @nbf_metadata, '` where `__mo_index_key` = ''version'')) = @expected_ivf_entries as nbf_ready, ',
'(select count(*) from `', database(), '`.`', @nhf_entries, '` where `__mo_index_centroid_fk_version` = (select cast(`__mo_index_val` as bigint) from `', database(), '`.`', @nhf_metadata, '` where `__mo_index_key` = ''version'')) = @expected_ivf_entries as nhf_ready, ',
'(select count(*) from `', database(), '`.`', @ni8_entries, '` where `__mo_index_centroid_fk_version` = (select cast(`__mo_index_val` as bigint) from `', database(), '`.`', @ni8_metadata, '` where `__mo_index_key` = ''version'')) = @expected_ivf_entries as ni8_ready, ',
'(select count(*) from `', database(), '`.`', @nu8_entries, '` where `__mo_index_centroid_fk_version` = (select cast(`__mo_index_val` as bigint) from `', database(), '`.`', @nu8_metadata, '` where `__mo_index_key` = ''version'')) = @expected_ivf_entries as nu8_ready'
);
prepare wait_narrow_entries from @wait_narrow_entries_sql;
set @expected_ivf_entries = 6;
execute wait_narrow_entries;
nbf_ready    nhf_ready    ni8_ready    nu8_ready
1    1    1    1
select a from nbf order by l2_distance(v,'[1,1,1,1]') limit 3;
➤ a[4,32,0]  𝄀
1  𝄀
2  𝄀
3
select a from nbf order by l2_distance(v,'[54,54,54,54]') limit 3;
➤ a[4,32,0]  𝄀
6  𝄀
5  𝄀
4
select a from nhf order by l2_distance(v,'[1,1,1,1]') limit 3;
➤ a[4,32,0]  𝄀
1  𝄀
2  𝄀
3
select a from nhf order by l2_distance(v,'[54,54,54,54]') limit 3;
➤ a[4,32,0]  𝄀
6  𝄀
5  𝄀
4
select a from ni8 order by l2_distance(v,'[1,1,1,1]') limit 3;
➤ a[4,32,0]  𝄀
1  𝄀
2  𝄀
3
select a from ni8 order by l2_distance(v,'[54,54,54,54]') limit 3;
➤ a[4,32,0]  𝄀
6  𝄀
5  𝄀
4
select a from nu8 order by l2_distance(v,'[1,1,1,1]') limit 3;
➤ a[4,32,0]  𝄀
1  𝄀
2  𝄀
3
select a from nu8 order by l2_distance(v,'[54,54,54,54]') limit 3;
➤ a[4,32,0]  𝄀
6  𝄀
5  𝄀
4
insert into nbf values (7,'[2,2,2,2]'),(8,'[53,53,53,53]');
insert into nhf values (7,'[2,2,2,2]'),(8,'[53,53,53,53]');
insert into ni8 values (7,'[2,2,2,2]'),(8,'[53,53,53,53]');
insert into nu8 values (7,'[2,2,2,2]'),(8,'[53,53,53,53]');
set @expected_ivf_entries = 8;
execute wait_narrow_entries;
nbf_ready    nhf_ready    ni8_ready    nu8_ready
1    1    1    1
select a from nbf order by l2_distance(v,'[1,1,1,1]') limit 3;
➤ a[4,32,0]  𝄀
1  𝄀
7  𝄀
2
select a from nbf order by l2_distance(v,'[54,54,54,54]') limit 3;
➤ a[4,32,0]  𝄀
6  𝄀
8  𝄀
5
select a from nhf order by l2_distance(v,'[1,1,1,1]') limit 3;
➤ a[4,32,0]  𝄀
1  𝄀
7  𝄀
2
select a from nhf order by l2_distance(v,'[54,54,54,54]') limit 3;
➤ a[4,32,0]  𝄀
6  𝄀
8  𝄀
5
select a from ni8 order by l2_distance(v,'[1,1,1,1]') limit 3;
➤ a[4,32,0]  𝄀
1  𝄀
7  𝄀
2
select a from ni8 order by l2_distance(v,'[54,54,54,54]') limit 3;
➤ a[4,32,0]  𝄀
6  𝄀
8  𝄀
5
select a from nu8 order by l2_distance(v,'[1,1,1,1]') limit 3;
➤ a[4,32,0]  𝄀
1  𝄀
7  𝄀
2
select a from nu8 order by l2_distance(v,'[54,54,54,54]') limit 3;
➤ a[4,32,0]  𝄀
6  𝄀
8  𝄀
5
update nbf set v = '[55,55,55,55]' where a = 1;
update nhf set v = '[55,55,55,55]' where a = 1;
update ni8 set v = '[55,55,55,55]' where a = 1;
update nu8 set v = '[55,55,55,55]' where a = 1;
select a from nbf order by l2_distance(v,'[1,1,1,1]') limit 3;
➤ a[4,32,0]  𝄀
7  𝄀
2  𝄀
3
select a from nhf order by l2_distance(v,'[1,1,1,1]') limit 3;
➤ a[4,32,0]  𝄀
7  𝄀
2  𝄀
3
select a from ni8 order by l2_distance(v,'[1,1,1,1]') limit 3;
➤ a[4,32,0]  𝄀
7  𝄀
2  𝄀
3
select a from nu8 order by l2_distance(v,'[1,1,1,1]') limit 3;
➤ a[4,32,0]  𝄀
7  𝄀
2  𝄀
3
deallocate prepare wait_narrow_entries;
drop table nbf;
drop table nhf;
drop table ni8;
drop table nu8;
