drop database if exists test;
create database test;
use test;
create table t0(a int, b int, primary key(a));
insert into t0 values(1,1),(2,2),(3,3);
create snapshot sp0 for table test t0;
data branch create table t1 from t0{snapshot="sp0"};
alter table t1 add column c int default 0;
update t1 set c=10 where a=1;
insert into t1 values(4,4,40);
create snapshot sp1 for table test t1;
data branch merge t1 into t0;
select * from t0 order by a;
a    b
1    1
2    2
3    3
4    4
drop snapshot sp1;
drop snapshot sp0;
drop table t0;
drop table t1;
create table t0(a int, b int, primary key(a));
insert into t0 values(1,1),(2,2),(3,3);
create snapshot sp0 for table test t0;
data branch create table t1 from t0{snapshot="sp0"};
alter table t1 add column c int default 0;
update t1 set b=99, c=10 where a=1;
insert into t1 values(4,4,40);
create snapshot sp1 for table test t1;
data branch merge t1 into t0 when conflict accept;
select * from t0 order by a;
a    b
1    99
2    2
3    3
4    4
drop snapshot sp1;
drop snapshot sp0;
drop table t0;
drop table t1;
create table t0(a int, b int, primary key(a));
insert into t0 values(1,1),(2,2),(3,3);
create snapshot sp0 for table test t0;
data branch create table t1 from t0{snapshot="sp0"};
alter table t1 add column c int default 0;
delete from t1 where a=2;
create snapshot sp1 for table test t1;
data branch merge t1 into t0;
select * from t0 order by a;
a    b
1    1
3    3
drop snapshot sp1;
drop snapshot sp0;
drop table t0;
drop table t1;
create table t0(a int, b int, c int, primary key(a,b));
insert into t0 values(1,1,10),(2,2,20);
create snapshot sp0 for table test t0;
data branch create table t1 from t0{snapshot="sp0"};
alter table t1 add column d int default 0;
update t1 set c=99 where a=1 and b=1;
insert into t1 values(3,3,30,300);
create snapshot sp1 for table test t1;
data branch merge t1 into t0 when conflict accept;
select * from t0 order by a;
a    b    c
1    1    99
2    2    20
3    3    30
drop snapshot sp1;
drop snapshot sp0;
drop table t0;
drop table t1;
create table t0(a int, b int, primary key(a));
insert into t0 values(1,1),(2,2);
create snapshot sp0 for table test t0;
data branch create table t1 from t0{snapshot="sp0"};
alter table t1 add column c int default 0;
insert into t1 values(3,3,30);
create snapshot sp1 for table test t1;
data branch merge t1 into t0;
select * from t0 order by a;
a    b
1    1
2    2
3    3
data branch merge t1 into t0;
select * from t0 order by a;
a    b
1    1
2    2
3    3
drop snapshot sp1;
drop snapshot sp0;
drop table t0;
drop table t1;
drop database test;
