set time_zone = 'SYSTEM';
drop table if exists t1;
create table t1(col1 bool,col2 int,col3 varchar(100), col4 date,col5 datetime,col6 timestamp,col7 decimal,col8 float,col9 json,col10 text,col11 json,col12 bool);
load data infile {'filepath'='$resources/load_data/jsonline_object.jl','format'='jsonline','jsondata'='object'} into table t1;
select * from t1;
col1    col2    col3    col4    col5    col6    col7    col8    col9    col10    col11    col12
true    1    var    2020-09-07    2020-09-07 00:00:00    2020-09-07 00:00:00    18    121.11    ["1", 2, null, false, true, {"q": 1}]    1qaz    null    null
true    1    var    2020-09-07    2020-09-07 00:00:00    2020-09-07 00:00:00    18    121.11    {"b": ["a", "b", {"q": 4}], "c": 1}    1aza    null    null
true    1    var    2020-09-07    2020-09-07 00:00:00    2020-09-07 00:00:00    18    121.11    ["1", 2, null, false, true, {"q": 1}]    1az    null    null
true    1    var    2020-09-07    2020-09-07 00:00:00    2020-09-07 00:00:00    18    121.11    {"b": ["a", "b", {"q": 4}], "c": 1}    1qaz    null    null
delete from t1;
load data infile {'filepath'='$resources/load_data/jsonline_array.jl','format'='jsonline','jsondata'='array'} into table t1;
load data infile {'filepath'='$resources/load_data/jsonline_array.jl.bz2','format'='jsonline','jsondata'='array','compression'='bzip2'} into table t1;
load data infile {'filepath'='$resources/load_data/jsonline_array.jl.gz','format'='jsonline','jsondata'='array','compression'='gzip'} into table t1;
load data infile {'filepath'='$resources/load_data/jsonline_array.jl.bz2','jsondata'='array'} into table t1;
load data infile {'filepath'='$resources/load_data/jsonline_array.jl.gz','jsondata'='array'} into table t1;
select * from t1;
col1    col2    col3    col4    col5    col6    col7    col8    col9    col10    col11    col12
true    1    var    2020-09-07    2020-09-07 00:00:00    2020-09-07 00:00:00    18    121.11    ["1", 2, null, false, true, {"q": 1}]    1qaz    null    null
true    1    var    2020-09-07    2020-09-07 00:00:00    2020-09-07 00:00:00    18    121.11    {"b": ["a", "b", {"q": 4}], "c": 1}    1aza    null    null
true    1    var    2020-09-07    2020-09-07 00:00:00    2020-09-07 00:00:00    18    121.11    ["1", 2, null, false, true, {"q": 1}]    1qaz    null    null
true    1    var    2020-09-07    2020-09-07 00:00:00    2020-09-07 00:00:00    18    121.11    {"b": ["a", "b", {"q": 4}], "c": 1}    1aza    null    null
true    1    var    2020-09-07    2020-09-07 00:00:00    2020-09-07 00:00:00    18    121.11    ["1", 2, null, false, true, {"q": 1}]    1qaz    null    null
true    1    var    2020-09-07    2020-09-07 00:00:00    2020-09-07 00:00:00    18    121.11    {"b": ["a", "b", {"q": 4}], "c": 1}    1aza    null    null
true    1    var    2020-09-07    2020-09-07 00:00:00    2020-09-07 00:00:00    18    121.11    ["1", 2, null, false, true, {"q": 1}]    1qaz    null    null
true    1    var    2020-09-07    2020-09-07 00:00:00    2020-09-07 00:00:00    18    121.11    {"b": ["a", "b", {"q": 4}], "c": 1}    1aza    null    null
true    1    var    2020-09-07    2020-09-07 00:00:00    2020-09-07 00:00:00    18    121.11    ["1", 2, null, false, true, {"q": 1}]    1qaz    null    null
true    1    var    2020-09-07    2020-09-07 00:00:00    2020-09-07 00:00:00    18    121.11    {"b": ["a", "b", {"q": 4}], "c": 1}    1aza    null    null
