set time_zone = 'SYSTEM';
drop table if exists t1;
create table t1(col1 bool,col2 int,col3 varchar(100), col4 date,col5 datetime,col6 timestamp,col7 decimal,col8 float,col9 json,col10 text,col11 json,col12 bool);
load data infile {'filepath'='$resources/load_data/jsonline_object.jl','format'='jsonline','jsondata'='object'} into table t1;
select * from t1;
col1    col2    col3    col4    col5    col6    col7    col8    col9    col10    col11    col12
true    1    var    2020-09-07    2020-09-07 00:00:00    2020-09-07 00:00:00    18    121.11    ["1", 2, null, false, true, {"q": 1}]    1qaz    null    null
true    1    var    2020-09-07    2020-09-07 00:00:00    2020-09-07 00:00:00    18    121.11    {"b": ["a", "b", {"q": 4}], "c": 1}    1aza    null    null
true    1    var    2020-09-07    2020-09-07 00:00:00    2020-09-07 00:00:00    18    121.11    ["1", 2, null, false, true, {"q": 1}]    1az    null    null
true    1    var    2020-09-07    2020-09-07 00:00:00    2020-09-07 00:00:00    18    121.11    {"b": ["a", "b", {"q": 4}], "c": 1}    1qaz    null    null
delete from t1;
load data infile {'filepath'='$resources/load_data/jsonline_array.jl','format'='jsonline','jsondata'='array'} into table t1;
load data infile {'filepath'='$resources/load_data/jsonline_array.jl.bz2','format'='jsonline','jsondata'='array','compression'='bzip2'} into table t1;
load data infile {'filepath'='$resources/load_data/jsonline_array.jl.gz','format'='jsonline','jsondata'='array','compression'='gzip'} into table t1;
load data infile {'filepath'='$resources/load_data/jsonline_array.jl.bz2','jsondata'='array'} into table t1;
load data infile {'filepath'='$resources/load_data/jsonline_array.jl.gz','jsondata'='array'} into table t1;
select * from t1;
col1    col2    col3    col4    col5    col6    col7    col8    col9    col10    col11    col12
true    1    var    2020-09-07    2020-09-07 00:00:00    2020-09-07 00:00:00    18    121.11    ["1", 2, null, false, true, {"q": 1}]    1qaz    null    null
true    1    var    2020-09-07    2020-09-07 00:00:00    2020-09-07 00:00:00    18    121.11    {"b": ["a", "b", {"q": 4}], "c": 1}    1aza    null    null
true    1    var    2020-09-07    2020-09-07 00:00:00    2020-09-07 00:00:00    18    121.11    ["1", 2, null, false, true, {"q": 1}]    1qaz    null    null
true    1    var    2020-09-07    2020-09-07 00:00:00    2020-09-07 00:00:00    18    121.11    {"b": ["a", "b", {"q": 4}], "c": 1}    1aza    null    null
true    1    var    2020-09-07    2020-09-07 00:00:00    2020-09-07 00:00:00    18    121.11    ["1", 2, null, false, true, {"q": 1}]    1qaz    null    null
true    1    var    2020-09-07    2020-09-07 00:00:00    2020-09-07 00:00:00    18    121.11    {"b": ["a", "b", {"q": 4}], "c": 1}    1aza    null    null
true    1    var    2020-09-07    2020-09-07 00:00:00    2020-09-07 00:00:00    18    121.11    ["1", 2, null, false, true, {"q": 1}]    1qaz    null    null
true    1    var    2020-09-07    2020-09-07 00:00:00    2020-09-07 00:00:00    18    121.11    {"b": ["a", "b", {"q": 4}], "c": 1}    1aza    null    null
true    1    var    2020-09-07    2020-09-07 00:00:00    2020-09-07 00:00:00    18    121.11    ["1", 2, null, false, true, {"q": 1}]    1qaz    null    null
true    1    var    2020-09-07    2020-09-07 00:00:00    2020-09-07 00:00:00    18    121.11    {"b": ["a", "b", {"q": 4}], "c": 1}    1aza    null    null
drop table if exists jsonline_t1;
create table jsonline_t1(
col1 tinyint,
col2 smallint,
col3 int,
col4 bigint,
col5 tinyint unsigned,
col6 smallint unsigned,
col7 int unsigned,
col8 bigint unsigned
);
load data infile{'filepath'='$resources/load_data/integer_numbers_1.jl','format'='jsonline','jsondata'='object'}into table jsonline_t1;
select * from jsonline_t1;
col1    col2    col3    col4    col5    col6    col7    col8
127    32767    2147483647    9223372036854775807    255    65535    4294967295    18446744073709551615
-128    -32768    -2147483648    -9223372036854775808    0    0    0    0
40    0    60    50    100    0    90    20
null    null    null    null    null    null    null    null
select * from jsonline_t1 into outfile '$resources/into_outfile/json_outfile_integer_numbers_1.csv';
select * from jsonline_t1;
col1    col2    col3    col4    col5    col6    col7    col8
127    32767    2147483647    9223372036854775807    255    65535    4294967295    18446744073709551615
-128    -32768    -2147483648    -9223372036854775808    0    0    0    0
40    0    60    50    100    0    90    20
null    null    null    null    null    null    null    null
delete from jsonline_t1;
load data infile '$resources/into_outfile/json_outfile_integer_numbers_1.csv' into table jsonline_t1 ignore 1 lines;
select * from jsonline_t1;
col1    col2    col3    col4    col5    col6    col7    col8
127    32767    2147483647    9223372036854775807    255    65535    4294967295    18446744073709551615
-128    -32768    -2147483648    -9223372036854775808    0    0    0    0
40    0    60    50    100    0    90    20
null    null    null    null    null    null    null    null
delete from jsonline_t1;
load data infile{'filepath'='$resources/load_data/integer_numbers_1_array.jl','format'='jsonline','jsondata'='array'}into table jsonline_t1;
select * from jsonline_t1;
col1    col2    col3    col4    col5    col6    col7    col8
127    32767    2147483647    9223372036854775807    255    65535    4294967295    18446744073709551615
-128    -32768    -2147483648    -9223372036854775808    0    0    0    0
0    0    0    0    0    0    0    0
null    null    null    null    null    null    null    null
127    32767    2147483647    9223372036854775807    255    65535    4294967295    18446744073709551615
drop table if exists jsonline_t2;
create table jsonline_t2(
col1 char(225),
col2 varchar(225),
col3 text,
col4 varchar(225)
);
load data infile{'filepath'='$resources/load_data/char_varchar_1.jl','format'='jsonline','jsondata'='object'}into table jsonline_t2;
select * from jsonline_t2;
col1    col2    col3    col4
a    中文    #¥%……&#    234cccc重要
"a"    "b"    "c"    "d"
'd'    '123456'    'b'    'a'
"'a'"    "'b'"    "'c'"    abc
 123f fff     yeah     红tu    bb"
"aa""""    aa"    "bb""""    bb"
null         null
null    null    null    null
select * from jsonline_t2 into outfile '$resources/into_outfile/json_outfile_char_varchar_1.csv';
select * from jsonline_t2;
col1    col2    col3    col4
a    中文    #¥%……&#    234cccc重要
"a"    "b"    "c"    "d"
'd'    '123456'    'b'    'a'
"'a'"    "'b'"    "'c'"    abc
 123f fff     yeah     红tu    bb"
"aa""""    aa"    "bb""""    bb"
null         null
null    null    null    null
delete from jsonline_t2;
load data infile '$resources/into_outfile/json_outfile_char_varchar_1.csv' into table jsonline_t2 ignore 1 lines;
select * from jsonline_t2;
col1    col2    col3    col4
a    中文    #¥%……&#    234cccc重要
"a"    "b"    "c"    "d"
'd'    '123456'    'b'    'a'
"'a'"    "'b'"    "'c'"    abc
 123f fff     yeah     红tu    bb"
"aa""""    aa"    "bb""""    bb"
null         null
null    null    null    null
delete from jsonline_t2;
load data infile{'filepath'='$resources/load_data/char_varchar_1_array.json','format'='jsonline','jsondata'='array'}into table jsonline_t2;
select * from jsonline_t2;
col1    col2    col3    col4
a    重工    4546    @#¥%……&*()
'a'    'b'    'c'    'd'
aa,aa    bb,bb    [20 50 <nil> map[col:9] <nil>]    dd,dd
null     e f g          fff
aa',',,aa    _yeah_123    1111111111uuuuuuuuuhhhhzzzzzzzzffff    dd',',,dd
null    null    null    null
drop table if exists jsonline_t3;
create table jsonline_t3(
col1 float,
col2 double,
col3 decimal(38,16),
col4 decimal(38,16)
);
load data infile{'filepath'='$resources/load_data/float_1.json','format'='jsonline','jsondata'='object'}into table jsonline_t3;
select * from jsonline_t3;
col1    col2    col3    col4
1.3    5.0    2.0000000000000000    0.4000000000000000
1.0    null    635437923742.3333333330000000    1.0000000000000000
null    null    null    40.0200000000000000
-1.763835E21    -1.0E-14    1.2345600000000000    3.9800000000000000
-345.34244    -1.1118772349834299E73    8349538974359357.0000000000000000    3.9484359854839584
truncate table jsonline_t3;
load data infile{'filepath'='$resources/load_data/float_1_array.jl','format'='jsonline','jsondata'='array'}into table jsonline_t3;
select * from jsonline_t3;
col1    col2    col3    col4
1.3    5.0    2.0000000000000000    0.4000000000000000
1.0    null    635437923742.3333333330000000    1.0000000000000000
null    null    null    40.0200000000000000
-1.7638359E25    -1.9348593579835793    1.2345600000000000    3.9800000000000000
-345.34244    -1.1118772349834298    83495389743593573.0000000000000000    9484359854839584.0000000000000000
drop table if exists jsonline_t4;
create table jsonline_t4(
col1 date,
col2 datetime(6),
col3 timestamp(3),
col4 bool
);
set time_zone = 'SYSTEM';
load data infile{'filepath'='$resources/load_data/time_date_1.jl','format'='jsonline','jsondata'='object'}into table jsonline_t4;
select * from jsonline_t4;
col1    col2    col3    col4
1000-01-01    0001-01-01 00:00:00    1970-01-01 00:00:01    false
9999-12-31    9999-12-31 00:00:00    2038-01-19 00:00:00    true
1000-01-01    0001-01-01 00:00:00    null    false
1000-01-01    0001-01-01 00:00:00    null    true
1000-01-01    0001-01-01 00:00:00.000001000    null    false
null    null    null    null
null    null    null    null
9999-12-31    9999-12-30 23:59:59.999999000    null    false
select * from jsonline_t4 into outfile '$resources/into_outfile/json_outfile_time_date_1.csv';
load data infile '$resources/into_outfile/json_outfile_time_date_1.csv' into table jsonline_t4 ignore 1 lines;
select * from jsonline_t4;
col1    col2    col3    col4
1000-01-01    0001-01-01 00:00:00    1970-01-01 00:00:01    false
9999-12-31    9999-12-31 00:00:00    2038-01-19 00:00:00    true
1000-01-01    0001-01-01 00:00:00    null    false
1000-01-01    0001-01-01 00:00:00    null    true
1000-01-01    0001-01-01 00:00:00.000001000    null    false
null    null    null    null
null    null    null    null
9999-12-31    9999-12-30 23:59:59.999999000    null    false
1000-01-01    0001-01-01 00:00:00    1970-01-01 00:00:01    false
9999-12-31    9999-12-31 00:00:00    2038-01-19 00:00:00    true
1000-01-01    0001-01-01 00:00:00    null    false
1000-01-01    0001-01-01 00:00:00    null    true
1000-01-01    0001-01-01 00:00:00.000001000    null    false
null    null    null    null
null    null    null    null
9999-12-31    9999-12-30 23:59:59.999999000    null    false
truncate table jsonline_t4;
load data infile{'filepath'='$resources/load_data/time_date_1_array.jl','format'='jsonline','jsondata'='array'}into table jsonline_t4;
select * from jsonline_t4;
col1    col2    col3    col4
1000-01-01    0001-01-01 00:00:00    null    false
1000-01-01    0001-01-01 00:00:00    2023-01-12 10:02:34    true
1000-01-01    0001-01-01 00:00:00    2022-09-10 00:00:00    true
9999-12-31    9999-12-30 23:59:59.999999000    2023-01-12 10:02:34.093000000    false
null    null    null    null
create table jsonline_t5 (a char(225),b varchar(225),c text,d varchar(225));
load data infile{'filepath'='$resources/load_data/char_varchar_1.jl','format'='jsonline','jsondata'='object'}into table jsonline_t5;
invalid input: the attr a is not in json
select * from jsonline_t5;
a    b    c    d
drop table jsonline_t5;
create table jsonline_t5 (col1 char(225),col2 varchar(225),col3 text,col4 varchar(225),col5 int default 10);
load data infile{'filepath'='$resources/load_data/char_varchar_1.jl','format'='jsonline','jsondata'='object'}into table jsonline_t5;
internal error: the table column is larger than input data column
create table jsonline_t6 (col1 char(225),col2 varchar(225),col4 varchar(225));
load data infile{'filepath'='$resources/load_data/char_varchar_1.jl','format'='jsonline','jsondata'='object'}into table jsonline_t6;
select * from jsonline_t6 where col1='a';
col1    col2    col4
a    中文    234cccc重要
create table  jsonline_t7 (col1 char(225),col2 varchar(225),col3 text,col4 varchar(225));
load data infile{'filepath'='$resources/load_data/char1.jl','format'='jsonline','jsondata'='object'}into table jsonline_t7;
invalid input: the file does not exist in load flow
load data infile{'filepath'='','format'='jsonline','jsondata'='object'}into table jsonline_t7;
invalid configuration: the filepath must be specified
load data infile{'filepath'='$resources/load_data/char_varchar_1.jl','format'='jsonline','jsondata'='array'}into table jsonline_t7;
json: cannot unmarshal object into Go value of type []interface {}
load data infile{'filepath'='$resources/load_data/char_varchar_1.jl','format'='jsonline'}into table jsonline_t7;
invalid configuration: the jsondata must be specified
load data infile{'filepath'='$resources/load_data/char_varchar_1.jl','format'='jsonline','compression'='none','jsondata'='object'}into table jsonline_t7;
load data infile{'filepath'='$resources/load_data/char_varchar_1.jl','format'='jsonline','compression'='gzip','jsondata'='object'}into table jsonline_t7;
gzip: invalid header
load data infile{'filepath'='$resources/load_data/char_varchar_1.jl','jsondata'='object'}into table jsonline_t7;
drop table jsonline_t7;
create table jsonline_t7(col1 float,col2 double,col3 decimal(38,16),col4 decimal(38,16));
load data infile{'filepath'='$resources/load_data/float_1.json','format'='csv'}into table jsonline_t7;
internal error: the input value '{"col1": "1.3"' is not float32 type for column 0
load data infile{'filepath'='$resources/load_data/char_varchar_1.jl','format'='jsonline','jsondata'='object'}into table jsonline_t7;
internal error: the input value 'a' is not float32 type for column 0
create table jsonline_t8(
col1 tinyint not null primary key,
col2 smallint,
col3 int,
col4 bigint,
col5 tinyint unsigned,
col6 smallint unsigned,
col7 int unsigned,
col8 bigint unsigned
);
load data infile{'filepath'='$resources/load_data/integer_numbers_1.jl','format'='jsonline','jsondata'='object'}into table jsonline_t8;
constraint violation: Column 'col1' cannot be null
drop table jsonline_t8;
create table jsonline_t8(
col1 tinyint default 10,
col2 smallint,
col3 int,
col4 bigint,
col5 tinyint unsigned,
col6 smallint unsigned,
col7 int unsigned,
col8 bigint unsigned
);
load data infile{'filepath'='$resources/load_data/integer_numbers_1.jl','format'='jsonline','jsondata'='object'}into table jsonline_t8;
drop table jsonline_t8;
create table jsonline_t8(
col1 tinyint primary key,
col2 smallint,
col3 int,
col4 bigint,
col5 tinyint unsigned,
col6 smallint unsigned,
col7 int unsigned,
col8 bigint unsigned
);
load data infile{'filepath'='$resources/load_data/integer_numbers_1.jl','format'='jsonline','jsondata'='object'}into table jsonline_t8;
constraint violation: Column 'col1' cannot be null
drop table jsonline_t8;
create table jsonline_gzip(col1 char(225),col2 varchar(225),col3 text,col4 varchar(225));
load data infile{'filepath'='$resources/load_data/char_varchar_1_array.json.gz','format'='jsonline','compression'='gzip','jsondata'='array'}into table jsonline_gzip;
select * from jsonline_gzip;
col1    col2    col3    col4
a    重工    4546    @#¥%……&*()
'a'    'b'    'c'    'd'
aa,aa    bb,bb    [20 50 <nil> map[col:9] <nil>]    dd,dd
null     e f g          fff
aa',',,aa    _yeah_123    1111111111uuuuuuuuuhhhhzzzzzzzzffff    dd',',,dd
null    null    null    null
truncate table jsonline_gzip;
create table jsonline_bzip2(col1 tinyint,col2 smallint,col3 int,col4 bigint,col5 tinyint unsigned,col6 smallint unsigned,col7 int unsigned,col8 bigint unsigned);
load data infile{'filepath'='$resources/load_data/integer_numbers_1.jl.bz2','format'='jsonline','compression'='bz2','jsondata'='object'}into table jsonline_bzip2;
select * from jsonline_bzip2;
col1    col2    col3    col4    col5    col6    col7    col8
127    32767    2147483647    9223372036854775807    255    65535    4294967295    18446744073709551615
-128    -32768    -2147483648    -9223372036854775808    0    0    0    0
40    0    60    50    100    0    90    20
null    null    null    null    null    null    null    null
create table jsonline_lz4(col1 float,col2 double,col3 decimal(38,16),col4 decimal(38,16));
load data infile{'filepath'='$resources/load_data/float_1.json.lz4','format'='jsonline','compression'='lz4','jsondata'='object'}into table jsonline_lz4;
select * from jsonline_lz4;
col1    col2    col3    col4
1.3    5.0    2.0000000000000000    0.4000000000000000
1.0    null    635437923742.3333333330000000    1.0000000000000000
null    null    null    40.0200000000000000
-1.763835E21    -1.0E-14    1.2345600000000000    3.9800000000000000
-345.34244    -1.1118772349834299E73    8349538974359357.0000000000000000    3.9484359854839584