SET experimental_hnsw_index = 1;
create database if not exists hnsw_cdc;
use hnsw_cdc;
create table vector_index_01(a bigint primary key, b vecf32(3),c int,key c_k(c));
create index idx01 using hnsw on vector_index_01(b) op_type "vector_l2_ops" M 48 EF_CONSTRUCTION 64 EF_SEARCH 64;
insert into vector_index_01 values (0, "[1,2,3]", 1);
select * from vector_index_01 order by  L2_DISTANCE(b,"[1,2,3]") ASC LIMIT 10;
a    b    c
select hnsw_cdc_update('hnsw_cdc', 'vector_index_01', 3, '{"start":"", "end":"", "cdc":[{"t":"U", "pk":0, "v":[1,2,3]}]}');
hnsw_cdc_update(hnsw_cdc, vector_index_01, 3, {"start":"", "end":"", "cdc":[{"t":"U", "pk":0, "v":[1,2,3]}]})
0
select * from vector_index_01 order by  L2_DISTANCE(b,"[1,2,3]") ASC LIMIT 10;
a    b    c
0    [1, 2, 3]    1
DELETE FROM vector_index_01 WHERE a=0;
select hnsw_cdc_update('hnsw_cdc', 'vector_index_01', 3, '{"start":"", "end":"", "cdc":[{"t":"D", "pk":0}]}');
hnsw_cdc_update(hnsw_cdc, vector_index_01, 3, {"start":"", "end":"", "cdc":[{"t":"D", "pk":0}]})
0
select * from vector_index_01 order by  L2_DISTANCE(b,"[1,2,3]") ASC LIMIT 10;
a    b    c
insert into vector_index_01 values (1, "[2,3,4]", 1);
select hnsw_cdc_update('hnsw_cdc', 'vector_index_01', 3, '{"start":"", "end":"", "cdc":[{"t":"I", "pk":1, "v":[2,3,4]}]}');
hnsw_cdc_update(hnsw_cdc, vector_index_01, 3, {"start":"", "end":"", "cdc":[{"t":"I", "pk":1, "v":[2,3,4]}]})
0
select * from vector_index_01 order by  L2_DISTANCE(b,"[2,3,4]") ASC LIMIT 10;
a    b    c
1    [2, 3, 4]    1
drop database hnsw_cdc;
