create table vtab1(id int primary key auto_increment,`vecf32` vecf32(0));
Data truncation: data out of range: data type vecf32,  typeLen cannot be less than 1
create table vtab1(id int primary key auto_increment,`vecf32` vecf32(-1));
SQL parser error: You have an error in your SQL syntax; check the manual that corresponds to your MatrixOne server version for the right syntax to use. syntax error at line 1 column 70 near "-1));";
create table vtab2(a int primary key,b vecf32(3) primary key,c vecf64(3));
not supported: VECTOR column 'b' cannot be in primary key
create table vtab32(id int primary key auto_increment,`vecf32_3` vecf32(3),`vecf32_5` vecf32(5));
create table vtab64(id int primary key auto_increment,`vecf64_3` vecf64(3),`vecf64_5` vecf64(5));
insert into vtab32(vecf32_3,vecf32_5) values("[0.8166459,NULL,0.4886152]",NULL);
internal error: error while casting NULL to FLOAT
insert into vtab32(vecf32_3,vecf32_5) values(NULL,NULL);
insert into vtab32(vecf32_3,vecf32_5) values("[0.8166459,0.66616553,0.4886152]",NULL);
insert into vtab32(vecf32_3,vecf32_5) values("0.1726299,3.29088557,30.4330937","0.1726299,3.29088557,30.4330937");
internal error: malformed vector input: 0.1726299,3.29088557,30.4330937
insert into vtab32(vecf32_3,vecf32_5) values ("[0.1726299,3.29088557,30.4330937]","[0.45052445,2.19845265,9.579752,123.48039162,4635.89423394]");
insert into vtab32(vecf32_3,vecf32_5) values ("[8.5606893,6.7903588,821.977768]","[0.46323407,23.49801546,563.9229458,56.07673508,8732.9583881]");
insert into vtab64(vecf64_3,vecf64_5) values("[0.8166459,NULL,0.4886152]",NULL);
internal error: error while casting NULL to DOUBLE
insert into vtab64(vecf64_3,vecf64_5) values(NULL,NULL);
insert into vtab64(vecf64_3,vecf64_5) values("[0.8166459,0.66616553,0.4886152]",NULL);
insert into vtab64(vecf64_3,vecf64_5) values ("[8.5606893,6.7903588,821.977768]","[0.46323407,23.49801546,563.9229458,56.07673508,8732.9583881]");
insert into vtab64(vecf64_3,vecf64_5) values ("[0.9260021,0.26637346,0.06567037]","[0.45756745,65.2996871,321.623636,3.60082066,87.58445764]");
select * from vtab32;
id    vecf32_3    vecf32_5
1    null    null
2    [0.8166459, 0.66616553, 0.4886152]    null
3    [0.1726299, 3.2908857, 30.433094]    [0.45052445, 2.1984527, 9.579752, 123.48039, 4635.894]
4    [8.560689, 6.790359, 821.9778]    [0.46323407, 23.498016, 563.923, 56.076736, 8732.958]
select * from vtab32 where vecf32_3 > "[1,1,1]";
id    vecf32_3    vecf32_5
4    [8.560689, 6.790359, 821.9778]    [0.46323407, 23.498016, 563.923, 56.076736, 8732.958]
select * from vtab32 where vecf32_3 >= "[0.8166459, 0.66616553, 0.4886152]";
id    vecf32_3    vecf32_5
2    [0.8166459, 0.66616553, 0.4886152]    null
4    [8.560689, 6.790359, 821.9778]    [0.46323407, 23.498016, 563.923, 56.076736, 8732.958]
select * from vtab32 where vecf32_5 <= "[0.45052445,2.19845265,9.579752,123.48039162,4635.89423394]";
id    vecf32_3    vecf32_5
3    [0.1726299, 3.2908857, 30.433094]    [0.45052445, 2.1984527, 9.579752, 123.48039, 4635.894]
select * from vtab32 where vecf32_5 <= "[0.4505244500,002.19845265,9.579752,123.48039162,4635.89423394]";
id    vecf32_3    vecf32_5
3    [0.1726299, 3.2908857, 30.433094]    [0.45052445, 2.1984527, 9.579752, 123.48039, 4635.894]
select * from vtab32 where vecf32_5 < "[0.45052445,02.19845265,9.579752,123.48039162,4635.89423394]";
id    vecf32_3    vecf32_5
select * from vtab32 order by vecf32_3;
id    vecf32_3    vecf32_5
1    null    null
3    [0.1726299, 3.2908857, 30.433094]    [0.45052445, 2.1984527, 9.579752, 123.48039, 4635.894]
2    [0.8166459, 0.66616553, 0.4886152]    null
4    [8.560689, 6.790359, 821.9778]    [0.46323407, 23.498016, 563.923, 56.076736, 8732.958]
select * from vtab64 order by vecf64_5 desc;
id    vecf64_3    vecf64_5
3    [8.5606893, 6.7903588, 821.977768]    [0.46323407, 23.49801546, 563.9229458, 56.07673508, 8732.9583881]
4    [0.9260021, 0.26637346, 0.06567037]    [0.45756745, 65.2996871, 321.623636, 3.60082066, 87.58445764]
1    null    null
2    [0.8166459, 0.66616553, 0.4886152]    null
select vecf32_3,count(*) from vtab32 group by vecf32_3 order by vecf32_3;
vecf32_3    count(*)
null    1
[0.1726299, 3.2908857, 30.433094]    1
[0.8166459, 0.66616553, 0.4886152]    1
[8.560689, 6.790359, 821.9778]    1
select * from vtab64;
id    vecf64_3    vecf64_5
1    null    null
2    [0.8166459, 0.66616553, 0.4886152]    null
3    [8.5606893, 6.7903588, 821.977768]    [0.46323407, 23.49801546, 563.9229458, 56.07673508, 8732.9583881]
4    [0.9260021, 0.26637346, 0.06567037]    [0.45756745, 65.2996871, 321.623636, 3.60082066, 87.58445764]
select * from vtab32 where id = 1;
id    vecf32_3    vecf32_5
1    null    null
select * from vtab32 where vecf32_3 = "[0.1726299,3.29088557,30.4330937]";
id    vecf32_3    vecf32_5
3    [0.1726299, 3.2908857, 30.433094]    [0.45052445, 2.1984527, 9.579752, 123.48039, 4635.894]
select * from vtab32 where vecf32_3 is null;
id    vecf32_3    vecf32_5
1    null    null
select * from vtab32 where vecf32_3 is not null;
id    vecf32_3    vecf32_5
2    [0.8166459, 0.66616553, 0.4886152]    null
3    [0.1726299, 3.2908857, 30.433094]    [0.45052445, 2.1984527, 9.579752, 123.48039, 4635.894]
4    [8.560689, 6.790359, 821.9778]    [0.46323407, 23.498016, 563.923, 56.076736, 8732.958]
select * from vtab64 where id = 2;
id    vecf64_3    vecf64_5
2    [0.8166459, 0.66616553, 0.4886152]    null
select * from vtab64 where vecf64_5 = "[0.46323407,23.49801546,563.9229458,56.07673508,8732.9583881]";
id    vecf64_3    vecf64_5
3    [8.5606893, 6.7903588, 821.977768]    [0.46323407, 23.49801546, 563.9229458, 56.07673508, 8732.9583881]
select * from vtab64 where vecf64_5 is null;
id    vecf64_3    vecf64_5
1    null    null
2    [0.8166459, 0.66616553, 0.4886152]    null
select * from vtab64 where vecf64_5 is not null;
id    vecf64_3    vecf64_5
3    [8.5606893, 6.7903588, 821.977768]    [0.46323407, 23.49801546, 563.9229458, 56.07673508, 8732.9583881]
4    [0.9260021, 0.26637346, 0.06567037]    [0.45756745, 65.2996871, 321.623636, 3.60082066, 87.58445764]
select a.id,a.vecf32_3, a.vecf32_5, b.id, b.vecf64_3, b.vecf64_5 from vtab32 a, vtab64 b where a.id = b.id;
id    vecf32_3    vecf32_5    id    vecf64_3    vecf64_5
1    null    null    1    null    null
2    [0.8166459, 0.66616553, 0.4886152]    null    2    [0.8166459, 0.66616553, 0.4886152]    null
3    [0.1726299, 3.2908857, 30.433094]    [0.45052445, 2.1984527, 9.579752, 123.48039, 4635.894]    3    [8.5606893, 6.7903588, 821.977768]    [0.46323407, 23.49801546, 563.9229458, 56.07673508, 8732.9583881]
4    [8.560689, 6.790359, 821.9778]    [0.46323407, 23.498016, 563.923, 56.076736, 8732.958]    4    [0.9260021, 0.26637346, 0.06567037]    [0.45756745, 65.2996871, 321.623636, 3.60082066, 87.58445764]
select * from vtab64 join vtab32 on vtab64.vecf32_3 = vtab32.vecf32_3;
invalid input: column 'vtab64.vecf32_3' does not exist
select * from vtab32 left join vtab64 on vtab64.vecf32_5 = vtab32.vecf32_5;
invalid input: column 'vtab64.vecf32_5' does not exist
select count(*), SUMMATION(vecf32_3) from vtab32 group by SUMMATION(vecf32_3) order by SUMMATION(vecf32_3);
count(*)    summation(vecf32_3)
1    null
1    1.9714266657829285
1    33.89660960435867
1    837.3288311958313
select id,vecf32_3 + vecf32_3, vecf32_5 + vecf32_5 from vtab32;
id    vecf32_3 + vecf32_3    vecf32_5 + vecf32_5
1    null    null
2    [1.6332918, 1.3323311, 0.9772304]    null
3    [0.3452598, 6.5817714, 60.866188]    [0.9010489, 4.3969054, 19.159504, 246.96078, 9271.788]
4    [17.121378, 13.580718, 1643.9556]    [0.92646813, 46.996033, 1127.846, 112.15347, 17465.916]
select id,vecf32_3 + "[1,1,1]", vecf32_5 + vecf32_5 from vtab32;
id    vecf32_3 + [1,1,1]    vecf32_5 + vecf32_5
1    null    null
2    [1.8166459, 1.6661656, 1.4886153]    null
3    [1.1726298, 4.290886, 31.433094]    [0.9010489, 4.3969054, 19.159504, 246.96078, 9271.788]
4    [9.560689, 7.790359, 822.9778]    [0.92646813, 46.996033, 1127.846, 112.15347, 17465.916]
select id,vecf32_3 - vecf32_3, vecf32_5 - vecf32_5 from vtab32;
id    vecf32_3 - vecf32_3    vecf32_5 - vecf32_5
1    null    null
2    [0, 0, 0]    null
3    [0, 0, 0]    [0, 0, 0, 0, 0]
4    [0, 0, 0]    [0, 0, 0, 0, 0]
select id,vecf32_3 * vecf32_3, vecf32_5 * vecf32_5 from vtab32;
id    vecf32_3 * vecf32_3    vecf32_5 * vecf32_5
1    null    null
2    [0.6669106, 0.44377652, 0.23874483]    null
3    [0.02980108, 10.829928, 926.1732]    [0.20297228, 4.8331943, 91.771645, 15247.407, 21491514]
4    [73.28539, 46.108974, 675647.5]    [0.2145858, 552.1568, 318009.12, 3144.6003, 76264550]
select id,vecf32_3 / vecf32_3, vecf32_5 / vecf32_5 from vtab32;
id    vecf32_3 / vecf32_3    vecf32_5 / vecf32_5
1    null    null
2    [1, 1, 1]    null
3    [1, 1, 1]    [1, 1, 1, 1, 1]
4    [1, 1, 1]    [1, 1, 1, 1, 1]
select id,vecf64_3 + vecf64_3, vecf64_5 + vecf64_5 from vtab64;
id    vecf64_3 + vecf64_3    vecf64_5 + vecf64_5
1    null    null
2    [1.6332918, 1.33233106, 0.9772304]    null
3    [17.1213786, 13.5807176, 1643.955536]    [0.92646814, 46.99603092, 1127.8458916, 112.15347016, 17465.9167762]
4    [1.8520042, 0.53274692, 0.13134074]    [0.9151349, 130.5993742, 643.247272, 7.20164132, 175.16891528]
select id,vecf64_3 + "[1,1,1]", vecf64_5 + vecf64_5 from vtab64;
id    vecf64_3 + [1,1,1]    vecf64_5 + vecf64_5
1    null    null
2    [1.8166459000000001, 1.66616553, 1.4886152]    null
3    [9.5606893, 7.7903588, 822.977768]    [0.92646814, 46.99603092, 1127.8458916, 112.15347016, 17465.9167762]
4    [1.9260021, 1.26637346, 1.06567037]    [0.9151349, 130.5993742, 643.247272, 7.20164132, 175.16891528]
select id,vecf64_3 - vecf64_3, vecf64_5 - vecf64_5 from vtab64;
id    vecf64_3 - vecf64_3    vecf64_5 - vecf64_5
1    null    null
2    [0, 0, 0]    null
3    [0, 0, 0]    [0, 0, 0, 0, 0]
4    [0, 0, 0]    [0, 0, 0, 0, 0]
select id,vecf64_3 * vecf64_3, vecf64_5 * vecf64_5 from vtab64;
id    vecf64_3 * vecf64_3    vecf64_5 * vecf64_5
1    null    null
2    [0.6669105259868101, 0.4437765133601809, 0.23874481367104003]    null
3    [73.28540129113449, 46.10897263273744, 675647.4510862618]    [0.2145858036087649, 552.1567305583991, 318009.08879974973, 3144.6002172325025, 76264562.20828615]
4    [0.8574798892044101, 0.0709548201923716, 0.0043125974959369005]    [0.2093679712995025, 4264.049135357906, 103441.76323386047, 12.965909425482836, 7671.037220092954]
select id,vecf64_3 / vecf64_3, vecf64_5 / vecf64_5 from vtab64;
id    vecf64_3 / vecf64_3    vecf64_5 / vecf64_5
1    null    null
2    [1, 1, 1]    null
3    [1, 1, 1]    [1, 1, 1, 1, 1]
4    [1, 1, 1]    [1, 1, 1, 1, 1]
select a.id,a.vecf32_3 + b.vecf64_3, a.vecf32_5 + b.vecf64_5 from vtab32 a, vtab64 b where a.id = b.id;
id    a.vecf32_3 + b.vecf64_3    a.vecf32_5 + b.vecf64_5
1    null    null
2    [1.633291820276642, 1.3323310606816101, 0.9772304148246765]    null
3    [8.73331919282608, 10.08124448687439, 852.4108620246582]    [0.9137585193484496, 25.696468171105348, 573.5026977683838, 179.55712753605468, 13368.85243106875]
4    [9.486691072473144, 7.056732480233154, 822.043453573125]    [0.9208015169631958, 88.79770345742187, 885.5466096328125, 59.67755711019531, 8820.5424654525]
select a.id,a.vecf32_3 + b.vecf64_3, a.vecf32_5 + b.vecf64_5 from vtab32 a, vtab64 b where a.vecf32_3 is not null;
id    a.vecf32_3 + b.vecf64_3    a.vecf32_5 + b.vecf64_5
2    null    null
3    null    null
4    null    null
2    [1.633291820276642, 1.3323310606816101, 0.9772304148246765]    null
3    [0.9892757928260804, 3.9570512168743894, 30.921709224658205]    null
4    [9.377334872473144, 7.456524550233154, 822.466398403125]    null
2    [9.377335220276642, 7.45652433068161, 822.4663832148246]    null
3    [8.73331919282608, 10.08124448687439, 852.4108620246582]    [0.9137585193484496, 25.696468171105348, 573.5026977683838, 179.55712753605468, 13368.85243106875]
4    [17.121378272473144, 13.580717820233154, 1643.955551203125]    [0.9264681369631957, 46.99603181742188, 1127.8459194328125, 112.1534715301953, 17465.9163959125]
2    [1.742648020276642, 0.9325389906816102, 0.5542855848246765]    null
3    [1.0986319928260804, 3.5572591468743897, 30.498764394658203]    [0.9080918993484497, 67.49813981110535, 331.20338796838377, 127.08121311605468, 4723.47850060875]
4    [9.486691072473144, 7.056732480233154, 822.043453573125]    [0.9208015169631958, 88.79770345742187, 885.5466096328125, 59.67755711019531, 8820.5424654525]
select a.id,a.vecf32_3 + b.vecf64_3, a.vecf32_5 + b.vecf64_5 from vtab32 a, vtab64 b where a.vecf32_3 is null;
id    a.vecf32_3 + b.vecf64_3    a.vecf32_5 + b.vecf64_5
1    null    null
1    null    null
1    null    null
1    null    null
update vtab32 set vecf32_3 = '0.752072,0.41402978,0.058849692' where id = 1;
internal error: malformed vector input: 0.752072,0.41402978,0.058849692
select * from vtab32;
id    vecf32_3    vecf32_5
1    null    null
2    [0.8166459, 0.66616553, 0.4886152]    null
3    [0.1726299, 3.2908857, 30.433094]    [0.45052445, 2.1984527, 9.579752, 123.48039, 4635.894]
4    [8.560689, 6.790359, 821.9778]    [0.46323407, 23.498016, 563.923, 56.076736, 8732.958]
update vtab64 set vecf64_3 = NULL where id = 1;
select * from vtab32;
id    vecf32_3    vecf32_5
1    null    null
2    [0.8166459, 0.66616553, 0.4886152]    null
3    [0.1726299, 3.2908857, 30.433094]    [0.45052445, 2.1984527, 9.579752, 123.48039, 4635.894]
4    [8.560689, 6.790359, 821.9778]    [0.46323407, 23.498016, 563.923, 56.076736, 8732.958]
update vtab32 set vecf32_3 = '[5.33816308, 78.35970277, 982.7183621]' where id = 1;
select vecf32_3 from vtab32;
vecf32_3
[0.8166459, 0.66616553, 0.4886152]
[0.1726299, 3.2908857, 30.433094]
[8.560689, 6.790359, 821.9778]
[5.338163, 78.3597, 982.7184]
update vtab64 set vecf64_5 = '[43234.87576795,32.8673464,12312.5788535,0.30837893,22.21907276]';
select vecf64_5 from vtab64;
vecf64_5
[43234.87576795, 32.8673464, 12312.5788535, 0.30837893, 22.21907276]
[43234.87576795, 32.8673464, 12312.5788535, 0.30837893, 22.21907276]
[43234.87576795, 32.8673464, 12312.5788535, 0.30837893, 22.21907276]
[43234.87576795, 32.8673464, 12312.5788535, 0.30837893, 22.21907276]
delete from vtab32 where vecf32_3 = '[5.33816308, 78.35970277, 982.7183621]';
create table vtab64_1(id int primary key auto_increment,`vecf64_3` vecf64(3),`vecf64_5` vecf64(5));
load data infile '$resources/vector/vector.csv' into table vtab64_1 fields terminated by ',';
select * from vtab64_1;
id    vecf64_3    vecf64_5
1    null    null
2    [0.8166459, 0.66616553, 0.4886152]    null
3    [8.5606893, 6.7903588, 821.977768]    [0.46323407, 23.49801546, 563.9229458, 56.07673508, 8732.9583881]
4    [0.9260021, 0.26637346, 0.06567037]    [0.45756745, 65.2996871, 321.623636, 3.60082066, 87.58445764]
(select * from vtab64) except (select * from vtab64_1);
id    vecf64_3    vecf64_5
2    [0.8166459, 0.66616553, 0.4886152]    [43234.87576795, 32.8673464, 12312.5788535, 0.30837893, 22.21907276]
3    [8.5606893, 6.7903588, 821.977768]    [43234.87576795, 32.8673464, 12312.5788535, 0.30837893, 22.21907276]
4    [0.9260021, 0.26637346, 0.06567037]    [43234.87576795, 32.8673464, 12312.5788535, 0.30837893, 22.21907276]
1    null    [43234.87576795, 32.8673464, 12312.5788535, 0.30837893, 22.21907276]
create table vector_exp_01(c1 int,c2 vecf32(5),c3 tinyint unsigned,c4 bigint,c5 decimal(4,2),c6 float,c7 double);
insert into vector_exp_01 values(10 ,"[1, 0, 1, 6, 6]",3,10,7.1,0.36,2.10),(60,"[6, 0, 8, 10,129]",2,5,3.26,4.89,1.26),(20,"[ 9, 18, 1, 4, 132]",6,1,9.36,6.9,5.6);
insert into vector_exp_01 values(34, "[995.3, 0.005, 0, 85.36, 5.12]",30,52,61.1,9.36,20.10),(102,"[50.01, 4.417, 930.21, 20.14, 15.02]",90,120,30.1,74.36,72.10);
select c2 from vector_exp_01;
c2
[1, 0, 1, 6, 6]
[6, 0, 8, 10, 129]
[9, 18, 1, 4, 132]
[995.3, 0.005, 0, 85.36, 5.12]
[50.01, 4.417, 930.21, 20.14, 15.02]
select c2+2364 from vector_exp_01;
c2 + 2364
[2365, 2364, 2365, 2370, 2370]
[2370, 2364, 2372, 2374, 2493]
[2373, 2382, 2365, 2368, 2496]
[3359.3, 2364.005, 2364, 2449.36, 2369.12]
[2414.01, 2368.417, 3294.21, 2384.14, 2379.02]
select c2-4 from vector_exp_01;
c2 - 4
[-3, -4, -3, 2, 2]
[2, -4, 4, 6, 125]
[5, 14, -3, 0, 128]
[991.3, -3.995, -4, 81.36, 1.1199999]
[46.01, 0.41699982, 926.21, 16.14, 11.02]
select c2*25 from vector_exp_01;
c2 * 25
[25, 0, 25, 150, 150]
[150, 0, 200, 250, 3225]
[225, 450, 25, 100, 3300]
[24882.5, 0.125, 0, 2134, 128]
[1250.25, 110.424995, 23255.25, 503.5, 375.5]
select c2/5 from vector_exp_01;
c2 / 5
[0.2, 0, 0.2, 1.2, 1.2]
[1.2, 0, 1.6, 2, 25.8]
[1.8, 3.6, 0.2, 0.8, 26.4]
[199.06, 0.0009999999, 0, 17.072, 1.0239999]
[10.002, 0.88339996, 186.042, 4.028, 3.0040002]
select c2/0 from vector_exp_01;
Data truncation: division by zero
select c2+63.2548 from vector_exp_01;
c2 + 63.2548
[64.2548, 63.2548, 64.2548, 69.2548, 69.2548]
[69.2548, 63.2548, 71.2548, 73.2548, 192.25479]
[72.2548, 81.2548, 64.2548, 67.2548, 195.25479]
[1058.5548, 63.2598, 63.2548, 148.6148, 68.3748]
[113.2648, 67.6718, 993.46484, 83.3948, 78.274796]
select c2-0.1258 from vector_exp_01;
c2 - 0.1258
[0.8742, -0.1258, 0.8742, 5.8742, 5.8742]
[5.8742, -0.1258, 7.8742, 9.8742, 128.8742]
[8.8742, 17.8742, 0.8742, 3.8742, 131.8742]
[995.1742, -0.120799996, -0.1258, 85.2342, 4.9941998]
[49.884197, 4.2911997, 930.0842, 20.0142, 14.8942]
select c2*2.698 from vector_exp_01;
c2 * 2.698
[2.698, 0, 2.698, 16.188, 16.188]
[16.188, 0, 21.584, 26.98, 348.042]
[24.282, 48.564, 2.698, 10.792, 356.136]
[2685.3193, 0.01349, 0, 230.30128, 13.81376]
[134.92697, 11.917066, 2509.7065, 54.33772, 40.52396]
select c2/2.41 from vector_exp_01;
c2 / 2.41
[0.41493773, 0, 0.41493773, 2.4896264, 2.4896264]
[2.4896264, 0, 3.3195019, 4.1493773, 53.52697]
[3.7344396, 7.468879, 0.41493773, 1.6597509, 54.771782]
[412.98752, 0.0020746887, 0, 35.419086, 2.1244812]
[20.751036, 1.8327799, 385.97925, 8.356846, 6.232365]
select c2/0.0 from vector_exp_01;
Data truncation: division by zero
select c2+c1 from vector_exp_01;
c2 + c1
[11, 10, 11, 16, 16]
[66, 60, 68, 70, 189]
[29, 38, 21, 24, 152]
[1029.3, 34.005, 34, 119.36, 39.12]
[152.01, 106.417, 1032.21, 122.14, 117.020004]
select c2-c1 from vector_exp_01;
c2 - c1
[-9, -10, -9, -4, -4]
[-54, -60, -52, -50, 69]
[-11, -2, -19, -16, 112]
[961.3, -33.995, -34, 51.36, -28.880001]
[-51.99, -97.583, 828.21, -81.86, -86.979996]
select c2*c1 from vector_exp_01;
c2 * c1
[10, 0, 10, 60, 60]
[360, 0, 480, 600, 7740]
[180, 360, 20, 80, 2640]
[33840.2, 0.17, 0, 2902.24, 174.08]
[5101.02, 450.534, 94881.42, 2054.28, 1532.04]
select c2/c1 from vector_exp_01;
c2 / c1
[0.1, 0, 0.1, 0.6, 0.6]
[0.1, 0, 0.13333334, 0.16666667, 2.15]
[0.45, 0.9, 0.05, 0.2, 6.6]
[29.27353, 0.00014705882, 0, 2.5105882, 0.15058823]
[0.4902941, 0.043303918, 9.119706, 0.19745098, 0.1472549]
select c2+c3 from vector_exp_01;
invalid argument operator +, bad value [VECF32 TINYINT UNSIGNED]
select c2-c3 from vector_exp_01;
invalid argument operator -, bad value [VECF32 TINYINT UNSIGNED]
select c2*c3 from vector_exp_01;
invalid argument operator *, bad value [VECF32 TINYINT UNSIGNED]
select c2/c3 from vector_exp_01;
invalid argument operator /, bad value [VECF32 TINYINT UNSIGNED]
select c2+c4 from vector_exp_01;
c2 + c4
[11, 10, 11, 16, 16]
[11, 5, 13, 15, 134]
[10, 19, 2, 5, 133]
[1047.3, 52.005, 52, 137.36, 57.12]
[170.01, 124.417, 1050.21, 140.14, 135.02]
select c2-c4 from vector_exp_01;
c2 - c4
[-9, -10, -9, -4, -4]
[1, -5, 3, 5, 124]
[8, 17, 0, 3, 131]
[943.3, -51.995, -52, 33.36, -46.88]
[-69.990005, -115.583, 810.21, -99.86, -104.979996]
select c2*c4 from vector_exp_01;
c2 * c4
[10, 0, 10, 60, 60]
[30, 0, 40, 50, 645]
[9, 18, 1, 4, 132]
[51755.598, 0.26, 0, 4438.72, 266.24]
[6001.1997, 530.04, 111625.2, 2416.7998, 1802.4]
select c2/c4 from vector_exp_01;
c2 / c4
[0.1, 0, 0.1, 0.6, 0.6]
[1.2, 0, 1.6, 2, 25.8]
[9, 18, 1, 4, 132]
[19.140385, 0.000096153846, 0, 1.6415385, 0.09846154]
[0.41674998, 0.03680833, 7.75175, 0.16783333, 0.12516667]
select c2+c5 from vector_exp_01;
c2 + c5
[8.1, 7.1, 8.1, 13.1, 13.1]
[9.26, 3.26, 11.26, 13.26, 132.26]
[18.36, 27.36, 10.36, 13.36, 141.36]
[1056.4, 61.105, 61.1, 146.45999, 66.22]
[80.11, 34.517, 960.31, 50.239998, 45.120003]
select c2-c5 from vector_exp_01;
c2 - c5
[-6.1, -7.1, -6.1, -1.0999999, -1.0999999]
[2.74, -3.26, 4.74, 6.74, 125.74]
[-0.35999966, 8.64, -8.36, -5.3599997, 122.64]
[934.2, -61.094997, -61.1, 24.260002, -55.98]
[19.909998, -25.683, 900.11005, -9.960001, -15.08]
select c2*c5 from vector_exp_01;
c2 * c5
[7.1, 0, 7.1, 42.6, 42.6]
[19.56, 0, 26.08, 32.6, 420.54]
[84.24, 168.48, 9.36, 37.44, 1235.5199]
[60812.83, 0.30549997, 0, 5215.496, 312.83197]
[1505.301, 132.95169, 27999.322, 606.214, 452.10202]
select c2/c5 from vector_exp_01;
c2 / c5
[0.14084508, 0, 0.14084508, 0.8450704, 0.8450704]
[1.8404908, 0, 2.4539878, 3.0674846, 39.570553]
[0.9615385, 1.923077, 0.10683761, 0.42735043, 14.102565]
[16.28969, 0.00008183306, 0, 1.3970541, 0.08379705]
[1.6614617, 0.14674418, 30.903988, 0.66910297, 0.49900332]
select c2+c6,c2+c7 from vector_exp_01;
c2 + c6    c2 + c7
[1.36, 0.36, 1.36, 6.36, 6.36]    [3.1, 2.1, 3.1, 8.1, 8.1]
[10.889999, 4.89, 12.889999, 14.889999, 133.89]    [7.26, 1.26, 9.26, 11.26, 130.26]
[15.9, 24.9, 7.9, 10.9, 138.9]    [14.6, 23.6, 6.6, 9.6, 137.6]
[1004.66, 9.365, 9.36, 94.72, 14.48]    [1015.39996, 20.105, 20.1, 105.46, 25.220001]
[124.369995, 78.777, 1004.57, 94.5, 89.380005]    [122.11, 76.517, 1002.31, 92.24, 87.119995]
select c2-c6,c2-c7 from vector_exp_01;
c2 - c6    c2 - c7
[0.64, -0.36, 0.64, 5.64, 5.64]    [-1.0999999, -2.1, -1.0999999, 3.9, 3.9]
[1.1100001, -4.89, 3.1100001, 5.11, 124.11]    [4.74, -1.26, 6.74, 8.74, 127.74]
[2.1, 11.1, -5.9, -2.9, 125.1]    [3.4, 12.4, -4.6, -1.5999999, 126.4]
[985.94, -9.355, -9.36, 76, -4.24]    [975.2, -20.095001, -20.1, 65.26, -14.9800005]
[-24.350002, -69.943, 855.85004, -54.22, -59.34]    [-22.09, -67.683, 858.11005, -51.96, -57.079998]
select c2*c6,c2*c7 from vector_exp_01;
c2 * c6    c2 * c7
[0.36, 0, 0.36, 2.16, 2.16]    [2.1, 0, 2.1, 12.599999, 12.599999]
[29.34, 0, 39.12, 48.899998, 630.81]    [7.56, 0, 10.08, 12.6, 162.54]
[62.100002, 124.200005, 6.9, 27.6, 910.8]    [50.399998, 100.799995, 5.6, 22.4, 739.2]
[9316.008, 0.0468, 0, 798.9696, 47.9232]    [20005.53, 0.1005, 0, 1715.7361, 102.912]
[3718.7434, 328.44812, 69170.414, 1497.6104, 1116.8872]    [3605.7207, 318.46567, 67068.14, 1452.0939, 1082.942]
select c2/c6,c2/c7 from vector_exp_01;
c2 / c6    c2 / c7
[2.7777777, 0, 2.7777777, 16.666666, 16.666666]    [0.4761905, 0, 0.4761905, 2.857143, 2.857143]
[1.2269939, 0, 1.6359918, 2.0449898, 26.38037]    [4.7619047, 0, 6.3492064, 7.936508, 102.38095]
[1.3043478, 2.6086955, 0.14492753, 0.5797101, 19.130434]    [1.6071429, 3.2142859, 0.17857143, 0.71428573, 23.571428]
[106.33547, 0.00053418806, 0, 9.119658, 0.5470086]    [49.51741, 0.0002487562, 0, 4.246766, 0.25472635]
[0.672539, 0.059400212, 12.509548, 0.27084452, 0.20199032]    [0.69361997, 0.061262134, 12.901665, 0.27933425, 0.20832178]
select cast("[76875768584509877574546435800000005,8955885757767774774774774456466]" as vecf32(2)) *623;
cast([76875768584509877574546435800000005,8955885757767774774774774456466] as vecf32(2)) * 623
[47893604000000000000000000000000000000, 5579517000000000000000000000000000]
