SET experimental_hnsw_index = 1;
CREATE TABLE vector_empty(a bigint primary key, b vecf32(32), KEY `idxname` USING HNSW(b) M = 48 EF_CONSTRUCTION = 64 EF_SEARCH = 64 OP_TYPE "vector_l2_ops");
DROP TABLE vector_empty;
create table vector_index_01(a bigint primary key, b vecf32(128),c int,key c_k(c));
create index idx01 using hnsw on vector_index_01(b) op_type "vector_l2_ops" M 48 EF_CONSTRUCTION 64 EF_SEARCH 64;
insert into vector_index_01 values(9774 ,"[1, 0, 1, 6, 6, 17, 47, 39, 2, 0, 1, 25, 27, 10, 56, 130, 18, 5, 2, 6, 15, 2, 19, 130, 42, 28, 1, 1, 2, 1, 0, 5, 0, 2, 4, 4, 31, 34, 44, 35, 9, 3, 8, 11, 33, 12, 61, 130, 130, 17, 0, 1, 6, 2, 9, 130, 111, 36, 0, 0, 11, 9, 1, 12, 2, 100, 130, 28, 7, 2, 6, 7, 9, 27, 130, 83, 5, 0, 1, 18, 130, 130, 84, 9, 0, 0, 2, 24, 111, 24, 0, 1, 37, 24, 2, 10, 12, 62, 33, 3, 0, 0, 0, 1, 3, 16, 106, 28, 0, 0, 0, 0, 17, 46, 85, 10, 0, 0, 1, 4, 11, 4, 2, 2, 9, 14, 8, 8]",3),(9775,"[0, 1, 1, 3, 0, 3, 46, 20, 1, 4, 17, 9, 1, 17, 108, 15, 0, 3, 37, 17, 6, 15, 116, 16, 6, 1, 4, 7, 7, 7, 9, 6, 0, 8, 10, 4, 26, 129, 27, 9, 0, 0, 5, 2, 11, 129, 129, 12, 103, 4, 0, 0, 2, 31, 129, 129, 94, 4, 0, 0, 0, 3, 13, 42, 0, 15, 38, 2, 70, 129, 1, 0, 5, 10, 40, 12, 74, 129, 6, 1, 129, 39, 6, 1, 2, 22, 9, 33, 122, 13, 0, 0, 0, 0, 5, 23, 4, 11, 9, 12, 45, 38, 1, 0, 0, 4, 36, 38, 57, 32, 0, 0, 82, 22, 9, 5, 13, 11, 3, 94, 35, 3, 0, 0, 0, 1, 16, 97]",5),(9776,"[10, 3, 8, 5, 48, 26, 5, 16, 17, 0, 0, 2, 132, 53, 1, 16, 112, 6, 0, 0, 7, 2, 1, 48, 48, 15, 18, 31, 3, 0, 0, 9, 6, 10, 19, 27, 50, 46, 17, 9, 18, 1, 4, 48, 132, 23, 3, 5, 132, 9, 4, 3, 11, 0, 2, 46, 84, 12, 10, 10, 1, 0, 12, 76, 26, 22, 16, 26, 35, 15, 3, 16, 15, 1, 51, 132, 125, 8, 1, 2, 132, 51, 67, 91, 8, 0, 0, 30, 126, 39, 32, 38, 4, 0, 1, 12, 24, 2, 2, 2, 4, 7, 2, 19, 93, 19, 70, 92, 2, 3, 1, 21, 36, 58, 132, 94, 0, 0, 0, 0, 21, 25, 57, 48, 1, 0, 0, 1]",3);
insert into vector_index_01 values(9777, " [16, 15, 0, 0, 5, 46, 5, 5, 4, 0, 0, 0, 28, 118, 12, 5, 75, 44, 5, 0, 6, 32, 6, 49, 41, 74, 9, 1, 0, 0, 0, 9, 1, 9, 16, 41, 71, 80, 3, 0, 0, 4, 3, 5, 51, 106, 11, 3, 112, 28, 13, 1, 4, 8, 3, 104, 118, 14, 1, 1, 0, 0, 0, 88, 3, 27, 46, 118, 108, 49, 2, 0, 1, 46, 118, 118, 27, 12, 0, 0, 33, 118, 118, 8, 0, 0, 0, 4, 118, 95, 40, 0, 0, 0, 1, 11, 27, 38, 12, 12, 18, 29, 3, 2, 13, 30, 94, 78, 30, 19, 9, 3, 31, 45, 70, 42, 15, 1, 3, 12, 14, 22, 16, 2, 3, 17, 24, 13]",4),(9778,"[41, 0, 0, 7, 1, 1, 20, 67, 9, 0, 0, 0, 0, 31, 120, 61, 25, 0, 0, 0, 0, 10, 120, 90, 32, 0, 0, 1, 13, 11, 22, 50, 4, 0, 2, 93, 40, 15, 37, 18, 12, 2, 2, 19, 8, 44, 120, 25, 120, 5, 0, 0, 0, 2, 48, 97, 102, 14, 3, 3, 11, 9, 34, 41, 0, 0, 4, 120, 56, 3, 4, 5, 6, 15, 37, 116, 28, 0, 0, 3, 120, 120, 24, 6, 2, 0, 1, 28, 53, 90, 51, 11, 11, 2, 12, 14, 8, 6, 4, 30, 9, 1, 4, 22, 25, 79, 120, 66, 5, 0, 0, 6, 42, 120, 91, 43, 15, 2, 4, 39, 12, 9, 9, 12, 15, 5, 24, 36]",4);
show create table vector_index_01;
Table    Create Table
vector_index_01    CREATE TABLE `vector_index_01` (\n  `a` bigint NOT NULL,\n  `b` vecf32(128) DEFAULT NULL,\n  `c` int DEFAULT NULL,\n  PRIMARY KEY (`a`),\n  KEY `c_k` (`c`),\n  KEY `idx01` USING hnsw (`b`) m = 48  ef_construction = 64  ef_search = 64  op_type 'vector_l2_ops' \n)
desc vector_index_01;
Field    Type    Null    Key    Default    Extra    Comment
a    BIGINT(64)    NO    PRI    null        
b    VECF32(128)    YES    MUL    null        
c    INT(32)    YES    MUL    null        
select * from vector_index_01 order by  L2_DISTANCE(b, "[16, 15, 0, 0, 5, 46, 5, 5, 4, 0, 0, 0, 28, 118, 12, 5, 75, 44, 5, 0, 6, 32, 6, 49, 41, 74, 9, 1, 0, 0, 0, 9, 1, 9, 16, 41, 71, 80, 3, 0, 0, 4, 3, 5, 51, 106, 11, 3, 112, 28, 13, 1, 4, 8, 3, 104, 118, 14, 1, 1, 0, 0, 0, 88, 3, 27, 46, 118, 108, 49, 2, 0, 1, 46, 118, 118, 27, 12, 0, 0, 33, 118, 118, 8, 0, 0, 0, 4, 118, 95, 40, 0, 0, 0, 1, 11, 27, 38, 12, 12, 18, 29, 3, 2, 13, 30, 94, 78, 30, 19, 9, 3, 31, 45, 70, 42, 15, 1, 3, 12, 14, 22, 16, 2, 3, 17, 24, 13]") ASC LIMIT 2;
a    b    c
select * from vector_index_01 where a>9774 order by  L2_DISTANCE(b, "[4, 6, 1, 42, 119, 4, 1, 0, 9, 96, 58, 2, 14, 0, 0, 0, 0, 57, 119, 24, 15, 2, 0, 0, 0, 0, 48, 26, 26, 7, 0, 0, 66, 21, 0, 4, 107, 92, 42, 7, 119, 119, 45, 2, 21, 18, 0, 9, 0, 39, 67, 43, 101, 66, 0, 0, 0, 3, 38, 75, 76, 17, 0, 0, 89, 0, 0, 0, 6, 26, 21, 20, 119, 1, 0, 0, 10, 43, 72, 92, 2, 8, 22, 25, 22, 46, 119, 60, 1, 13, 45, 48, 75, 69, 45, 15, 13, 0, 0, 2, 6, 0, 1, 11, 24, 0, 0, 0, 0, 24, 92, 49, 0, 0, 0, 0, 0, 18, 119, 40, 0, 0, 0, 0, 4, 47, 81, 10]") desc limit 2;
a    b    c
create table vector_index_02(a bigint primary key, b vecf32(128),c int,key c_k(c));
insert into vector_index_02 values(9774 ,"[1, 0, 1, 6, 6, 17, 47, 39, 2, 0, 1, 25, 27, 10, 56, 130, 18, 5, 2, 6, 15, 2, 19, 130, 42, 28, 1, 1, 2, 1, 0, 5, 0, 2, 4, 4, 31, 34, 44, 35, 9, 3, 8, 11, 33, 12, 61, 130, 130, 17, 0, 1, 6, 2, 9, 130, 111, 36, 0, 0, 11, 9, 1, 12, 2, 100, 130, 28, 7, 2, 6, 7, 9, 27, 130, 83, 5, 0, 1, 18, 130, 130, 84, 9, 0, 0, 2, 24, 111, 24, 0, 1, 37, 24, 2, 10, 12, 62, 33, 3, 0, 0, 0, 1, 3, 16, 106, 28, 0, 0, 0, 0, 17, 46, 85, 10, 0, 0, 1, 4, 11, 4, 2, 2, 9, 14, 8, 8]",3),(9775,"[0, 1, 1, 3, 0, 3, 46, 20, 1, 4, 17, 9, 1, 17, 108, 15, 0, 3, 37, 17, 6, 15, 116, 16, 6, 1, 4, 7, 7, 7, 9, 6, 0, 8, 10, 4, 26, 129, 27, 9, 0, 0, 5, 2, 11, 129, 129, 12, 103, 4, 0, 0, 2, 31, 129, 129, 94, 4, 0, 0, 0, 3, 13, 42, 0, 15, 38, 2, 70, 129, 1, 0, 5, 10, 40, 12, 74, 129, 6, 1, 129, 39, 6, 1, 2, 22, 9, 33, 122, 13, 0, 0, 0, 0, 5, 23, 4, 11, 9, 12, 45, 38, 1, 0, 0, 4, 36, 38, 57, 32, 0, 0, 82, 22, 9, 5, 13, 11, 3, 94, 35, 3, 0, 0, 0, 1, 16, 97]",5),(9776,"[10, 3, 8, 5, 48, 26, 5, 16, 17, 0, 0, 2, 132, 53, 1, 16, 112, 6, 0, 0, 7, 2, 1, 48, 48, 15, 18, 31, 3, 0, 0, 9, 6, 10, 19, 27, 50, 46, 17, 9, 18, 1, 4, 48, 132, 23, 3, 5, 132, 9, 4, 3, 11, 0, 2, 46, 84, 12, 10, 10, 1, 0, 12, 76, 26, 22, 16, 26, 35, 15, 3, 16, 15, 1, 51, 132, 125, 8, 1, 2, 132, 51, 67, 91, 8, 0, 0, 30, 126, 39, 32, 38, 4, 0, 1, 12, 24, 2, 2, 2, 4, 7, 2, 19, 93, 19, 70, 92, 2, 3, 1, 21, 36, 58, 132, 94, 0, 0, 0, 0, 21, 25, 57, 48, 1, 0, 0, 1]",3);
insert into vector_index_02 values(9777, "[16, 15, 0, 0, 5, 46, 5, 5, 4, 0, 0, 0, 28, 118, 12, 5, 75, 44, 5, 0, 6, 32, 6, 49, 41, 74, 9, 1, 0, 0, 0, 9, 1, 9, 16, 41, 71, 80, 3, 0, 0, 4, 3, 5, 51, 106, 11, 3, 112, 28, 13, 1, 4, 8, 3, 104, 118, 14, 1, 1, 0, 0, 0, 88, 3, 27, 46, 118, 108, 49, 2, 0, 1, 46, 118, 118, 27, 12, 0, 0, 33, 118, 118, 8, 0, 0, 0, 4, 118, 95, 40, 0, 0, 0, 1, 11, 27, 38, 12, 12, 18, 29, 3, 2, 13, 30, 94, 78, 30, 19, 9, 3, 31, 45, 70, 42, 15, 1, 3, 12, 14, 22, 16, 2, 3, 17, 24, 13]",4),(9778,"[41, 0, 0, 7, 1, 1, 20, 67, 9, 0, 0, 0, 0, 31, 120, 61, 25, 0, 0, 0, 0, 10, 120, 90, 32, 0, 0, 1, 13, 11, 22, 50, 4, 0, 2, 93, 40, 15, 37, 18, 12, 2, 2, 19, 8, 44, 120, 25, 120, 5, 0, 0, 0, 2, 48, 97, 102, 14, 3, 3, 11, 9, 34, 41, 0, 0, 4, 120, 56, 3, 4, 5, 6, 15, 37, 116, 28, 0, 0, 3, 120, 120, 24, 6, 2, 0, 1, 28, 53, 90, 51, 11, 11, 2, 12, 14, 8, 6, 4, 30, 9, 1, 4, 22, 25, 79, 120, 66, 5, 0, 0, 6, 42, 120, 91, 43, 15, 2, 4, 39, 12, 9, 9, 12, 15, 5, 24, 36]",4);
create index idx01 using hnsw on vector_index_02(b) op_type "vector_l2_ops";
show create table vector_index_02;
Table    Create Table
vector_index_02    CREATE TABLE `vector_index_02` (\n  `a` bigint NOT NULL,\n  `b` vecf32(128) DEFAULT NULL,\n  `c` int DEFAULT NULL,\n  PRIMARY KEY (`a`),\n  KEY `c_k` (`c`),\n  KEY `idx01` USING hnsw (`b`) op_type 'vector_l2_ops' \n)
desc vector_index_02;
Field    Type    Null    Key    Default    Extra    Comment
a    BIGINT(64)    NO    PRI    null        
b    VECF32(128)    YES    MUL    null        
c    INT(32)    YES    MUL    null        
select * from vector_index_02 order by  L2_DISTANCE(b, "[16, 15, 0, 0, 5, 46, 5, 5, 4, 0, 0, 0, 28, 118, 12, 5, 75, 44, 5, 0, 6, 32, 6, 49, 41, 74, 9, 1, 0, 0, 0, 9, 1, 9, 16, 41, 71, 80, 3, 0, 0, 4, 3, 5, 51, 106, 11, 3, 112, 28, 13, 1, 4, 8, 3, 104, 118, 14, 1, 1, 0, 0, 0, 88, 3, 27, 46, 118, 108, 49, 2, 0, 1, 46, 118, 118, 27, 12, 0, 0, 33, 118, 118, 8, 0, 0, 0, 4, 118, 95, 40, 0, 0, 0, 1, 11, 27, 38, 12, 12, 18, 29, 3, 2, 13, 30, 94, 78, 30, 19, 9, 3, 31, 45, 70, 42, 15, 1, 3, 12, 14, 22, 16, 2, 3, 17, 24, 13]") ASC LIMIT 2;
a    b    c
9777    [16, 15, 0, 0, 5, 46, 5, 5, 4, 0, 0, 0, 28, 118, 12, 5, 75, 44, 5, 0, 6, 32, 6, 49, 41, 74, 9, 1, 0, 0, 0, 9, 1, 9, 16, 41, 71, 80, 3, 0, 0, 4, 3, 5, 51, 106, 11, 3, 112, 28, 13, 1, 4, 8, 3, 104, 118, 14, 1, 1, 0, 0, 0, 88, 3, 27, 46, 118, 108, 49, 2, 0, 1, 46, 118, 118, 27, 12, 0, 0, 33, 118, 118, 8, 0, 0, 0, 4, 118, 95, 40, 0, 0, 0, 1, 11, 27, 38, 12, 12, 18, 29, 3, 2, 13, 30, 94, 78, 30, 19, 9, 3, 31, 45, 70, 42, 15, 1, 3, 12, 14, 22, 16, 2, 3, 17, 24, 13]    4
9776    [10, 3, 8, 5, 48, 26, 5, 16, 17, 0, 0, 2, 132, 53, 1, 16, 112, 6, 0, 0, 7, 2, 1, 48, 48, 15, 18, 31, 3, 0, 0, 9, 6, 10, 19, 27, 50, 46, 17, 9, 18, 1, 4, 48, 132, 23, 3, 5, 132, 9, 4, 3, 11, 0, 2, 46, 84, 12, 10, 10, 1, 0, 12, 76, 26, 22, 16, 26, 35, 15, 3, 16, 15, 1, 51, 132, 125, 8, 1, 2, 132, 51, 67, 91, 8, 0, 0, 30, 126, 39, 32, 38, 4, 0, 1, 12, 24, 2, 2, 2, 4, 7, 2, 19, 93, 19, 70, 92, 2, 3, 1, 21, 36, 58, 132, 94, 0, 0, 0, 0, 21, 25, 57, 48, 1, 0, 0, 1]    3
select * from vector_index_02 order by  L2_DISTANCE(b, "[1, 15, 15, 0, 5, 7, 5, 5, 4, 0, 0, 0, 28, 1, 12, 5, 75, 20, 5, 0, 6, 32, 6, 49, 41, 74, 9, 1, 0, 0, 0, 9, 1, 9, 16, 41, 71, 80, 3, 0, 0, 4, 3, 5, 51, 106, 11, 3, 112, 28, 13, 1, 4, 8, 3, 104, 118, 14, 1, 1, 0, 0, 0, 88, 3, 27, 46, 118, 108, 49, 2, 0, 1, 46, 118, 118, 27, 12, 0, 0, 33, 118, 118, 8, 0, 0, 0, 4, 118, 95, 40, 0, 0, 0, 1, 11, 27, 38, 12, 12, 18, 29, 3, 2, 13, 30, 94, 78, 30, 19, 9, 3, 31, 45, 70, 42, 15, 1, 3, 12, 14, 22, 16, 2, 3, 17, 24, 13]") ASC LIMIT 2;
a    b    c
9777    [16, 15, 0, 0, 5, 46, 5, 5, 4, 0, 0, 0, 28, 118, 12, 5, 75, 44, 5, 0, 6, 32, 6, 49, 41, 74, 9, 1, 0, 0, 0, 9, 1, 9, 16, 41, 71, 80, 3, 0, 0, 4, 3, 5, 51, 106, 11, 3, 112, 28, 13, 1, 4, 8, 3, 104, 118, 14, 1, 1, 0, 0, 0, 88, 3, 27, 46, 118, 108, 49, 2, 0, 1, 46, 118, 118, 27, 12, 0, 0, 33, 118, 118, 8, 0, 0, 0, 4, 118, 95, 40, 0, 0, 0, 1, 11, 27, 38, 12, 12, 18, 29, 3, 2, 13, 30, 94, 78, 30, 19, 9, 3, 31, 45, 70, 42, 15, 1, 3, 12, 14, 22, 16, 2, 3, 17, 24, 13]    4
9776    [10, 3, 8, 5, 48, 26, 5, 16, 17, 0, 0, 2, 132, 53, 1, 16, 112, 6, 0, 0, 7, 2, 1, 48, 48, 15, 18, 31, 3, 0, 0, 9, 6, 10, 19, 27, 50, 46, 17, 9, 18, 1, 4, 48, 132, 23, 3, 5, 132, 9, 4, 3, 11, 0, 2, 46, 84, 12, 10, 10, 1, 0, 12, 76, 26, 22, 16, 26, 35, 15, 3, 16, 15, 1, 51, 132, 125, 8, 1, 2, 132, 51, 67, 91, 8, 0, 0, 30, 126, 39, 32, 38, 4, 0, 1, 12, 24, 2, 2, 2, 4, 7, 2, 19, 93, 19, 70, 92, 2, 3, 1, 21, 36, 58, 132, 94, 0, 0, 0, 0, 21, 25, 57, 48, 1, 0, 0, 1]    3
create index idx01 using hnsw on vector_index_02(b) op_type "vector_l2_ops";
duplicate key name 'idx01'
create index idx01 using hnsw on vector_index_03(b) op_type "vector_l2_ops";
no such table vector_hnsw.vector_index_03
create table vector_index_03(a bigint primary key, b vecf32(3));
insert into vector_index_03 values(1,"[56,23,6]"),(2,"[77,45,3]"),(3,"[8,56,3]");
create index add using hnsw on vector_index_03(b) op_type "vector_l2_ops";
SQL parser error: You have an error in your SQL syntax; check the manual that corresponds to your MatrixOne server version for the right syntax to use. syntax error at line 1 column 16 near " add using hnsw on vector_index_03(b) op_type "vector_l2_ops";";
create index `add` using hnsw on vector_index_03(b) op_type "vector_l2_ops";
show create table vector_index_03;
Table    Create Table
vector_index_03    CREATE TABLE `vector_index_03` (\n  `a` bigint NOT NULL,\n  `b` vecf32(3) DEFAULT NULL,\n  PRIMARY KEY (`a`),\n  KEY `add` USING hnsw (`b`) op_type 'vector_l2_ops' \n)
create index idx02 using hnsw on vector_index_03(a) op_type "vector_l2_ops";
not supported: HNSW only supports VECF32 column types
create index idx02 using hnsw on vector_index_03(c) op_type "vector_l2_ops";
invalid input: column 'c' is not exist
create index idx02 using hnsw on vector_index_03(b) op_type "vector_l2_ops";
not supported: Multiple HNSW indexes are not allowed to use the same column
create index idx02 using hnsw on vector_index_03(b) ;
not supported: Multiple HNSW indexes are not allowed to use the same column
create index idx03 using hnsw on vector_index_03(b) op_type "vector_l2";
not supported: Multiple HNSW indexes are not allowed to use the same column
create table vector_index_04(a bigint primary key, b vecf32(3),c vecf32(4));
insert into vector_index_04 values(1,"[56,23,6]","[0.25,0.14,0.88,0.0001]"),(2,"[77,45,3]","[1.25,5.25,8.699,4.25]"),(3,"[8,56,3]","[9.66,5.22,1.22,7.02]");
create index idx01 using hnsw on vector_index_04(b) op_type "vector_l2_ops";
create index idx02 using hnsw on vector_index_04(c) op_type "vector_l2_ops";
show create table vector_index_04;
Table    Create Table
vector_index_04    CREATE TABLE `vector_index_04` (\n  `a` bigint NOT NULL,\n  `b` vecf32(3) DEFAULT NULL,\n  `c` vecf32(4) DEFAULT NULL,\n  PRIMARY KEY (`a`),\n  KEY `idx01` USING hnsw (`b`) op_type 'vector_l2_ops' ,\n  KEY `idx02` USING hnsw (`c`) op_type 'vector_l2_ops' \n)
desc vector_index_04;
Field    Type    Null    Key    Default    Extra    Comment
a    BIGINT(64)    NO    PRI    null        
b    VECF32(3)    YES    MUL    null        
c    VECF32(4)    YES    MUL    null        
insert into vector_index_04 values(4,"[156,213,61]","[10.25,0.14,0.88,10.0001]"),(5,"[177,425,30]","[11.25,51.25,80.699,44.25]"),(6,"[80,56,3]","[90.686,5.212,19.22,7.02]");
insert into vector_index_04 values(7,"[5.6,2.13,6.1]","[1.25,8.14,4.88,18.0001]"),(8,"[17.7,4.25,3.0]","[1.215,5.25,8.9,47.25]"),(9,"[8,5.6,13]","[9.6,57.22,19.2,78.02]");
alter table vector_index_04 alter reindex idx01 hnsw;
alter table vector_index_04 alter reindex idx02 hnsw;
show create table vector_index_04;
Table    Create Table
vector_index_04    CREATE TABLE `vector_index_04` (\n  `a` bigint NOT NULL,\n  `b` vecf32(3) DEFAULT NULL,\n  `c` vecf32(4) DEFAULT NULL,\n  PRIMARY KEY (`a`),\n  KEY `idx01` USING hnsw (`b`) op_type 'vector_l2_ops' ,\n  KEY `idx02` USING hnsw (`c`) op_type 'vector_l2_ops' \n)
desc vector_index_04;
Field    Type    Null    Key    Default    Extra    Comment
a    BIGINT(64)    NO    PRI    null        
b    VECF32(3)    YES    MUL    null        
c    VECF32(4)    YES    MUL    null        
select * from vector_index_04 order by L2_DISTANCE(c,"[9.6,57.22,19.2,78.02]") limit 3;
a    b    c
9    [8, 5.6, 13]    [9.6, 57.22, 19.2, 78.02]
8    [17.7, 4.25, 3]    [1.215, 5.25, 8.9, 47.25]
5    [177, 425, 30]    [11.25, 51.25, 80.699, 44.25]
alter table vector_index_04 alter reindex idx01 hnsw;
create table vector_index_05(a bigint primary key, b vecf32(3),c vecf32(4));
create index idx01 using hnsw on vector_index_05(c) op_type "vector_l2_ops";
show create table vector_index_05;
Table    Create Table
vector_index_05    CREATE TABLE `vector_index_05` (\n  `a` bigint NOT NULL,\n  `b` vecf32(3) DEFAULT NULL,\n  `c` vecf32(4) DEFAULT NULL,\n  PRIMARY KEY (`a`),\n  KEY `idx01` USING hnsw (`c`) op_type 'vector_l2_ops' \n)
alter table vector_index_05 alter reindex idx01 hnsw;
show create table vector_index_05;
Table    Create Table
vector_index_05    CREATE TABLE `vector_index_05` (\n  `a` bigint NOT NULL,\n  `b` vecf32(3) DEFAULT NULL,\n  `c` vecf32(4) DEFAULT NULL,\n  PRIMARY KEY (`a`),\n  KEY `idx01` USING hnsw (`c`) op_type 'vector_l2_ops' \n)
create table vector_index_06(a bigint primary key, b vecf32(3),c vecf32(4));
insert into vector_index_06 values(4,"[156,213,61]","[10.25,0.14,0.88,10.0001]"),(5,"[177,425,30]","[11.25,51.25,80.699,44.25]"),(6,"[80,56,3]","[90.686,5.212,19.22,7.02]");
alter table vector_index_06 alter reindex idx01 hnsw;
internal error: Can't REINDEX 'idx01'; check that column/key exists
create index idx01 using hnsw on vector_index_06(c) op_type "vector_l2_ops";
alter table vector_index_06 alter reindex idx hnsw;
internal error: Can't REINDEX 'idx'; check that column/key exists
alter table vector_index_07 alter reindex idx01 hnsw;
no such table vector_hnsw.vector_index_07
create table vector_index_07(a bigint primary key, b vecf32(128),c int,key c_k(c));
insert into vector_index_07 values(9774 ,"[1, 0, 1, 6, 6, 17, 47, 39, 2, 0, 1, 25, 27, 10, 56, 130, 18, 5, 2, 6, 15, 2, 19, 130, 42, 28, 1, 1, 2, 1, 0, 5, 0, 2, 4, 4, 31, 34, 44, 35, 9, 3, 8, 11, 33, 12, 61, 130, 130, 17, 0, 1, 6, 2, 9, 130, 111, 36, 0, 0, 11, 9, 1, 12, 2, 100, 130, 28, 7, 2, 6, 7, 9, 27, 130, 83, 5, 0, 1, 18, 130, 130, 84, 9, 0, 0, 2, 24, 111, 24, 0, 1, 37, 24, 2, 10, 12, 62, 33, 3, 0, 0, 0, 1, 3, 16, 106, 28, 0, 0, 0, 0, 17, 46, 85, 10, 0, 0, 1, 4, 11, 4, 2, 2, 9, 14, 8, 8]",3),(9775,"[0, 1, 1, 3, 0, 3, 46, 20, 1, 4, 17, 9, 1, 17, 108, 15, 0, 3, 37, 17, 6, 15, 116, 16, 6, 1, 4, 7, 7, 7, 9, 6, 0, 8, 10, 4, 26, 129, 27, 9, 0, 0, 5, 2, 11, 129, 129, 12, 103, 4, 0, 0, 2, 31, 129, 129, 94, 4, 0, 0, 0, 3, 13, 42, 0, 15, 38, 2, 70, 129, 1, 0, 5, 10, 40, 12, 74, 129, 6, 1, 129, 39, 6, 1, 2, 22, 9, 33, 122, 13, 0, 0, 0, 0, 5, 23, 4, 11, 9, 12, 45, 38, 1, 0, 0, 4, 36, 38, 57, 32, 0, 0, 82, 22, 9, 5, 13, 11, 3, 94, 35, 3, 0, 0, 0, 1, 16, 97]",5),(9776,"[10, 3, 8, 5, 48, 26, 5, 16, 17, 0, 0, 2, 132, 53, 1, 16, 112, 6, 0, 0, 7, 2, 1, 48, 48, 15, 18, 31, 3, 0, 0, 9, 6, 10, 19, 27, 50, 46, 17, 9, 18, 1, 4, 48, 132, 23, 3, 5, 132, 9, 4, 3, 11, 0, 2, 46, 84, 12, 10, 10, 1, 0, 12, 76, 26, 22, 16, 26, 35, 15, 3, 16, 15, 1, 51, 132, 125, 8, 1, 2, 132, 51, 67, 91, 8, 0, 0, 30, 126, 39, 32, 38, 4, 0, 1, 12, 24, 2, 2, 2, 4, 7, 2, 19, 93, 19, 70, 92, 2, 3, 1, 21, 36, 58, 132, 94, 0, 0, 0, 0, 21, 25, 57, 48, 1, 0, 0, 1]",3);
insert into vector_index_07 values(9777, " [16, 15, 0, 0, 5, 46, 5, 5, 4, 0, 0, 0, 28, 118, 12, 5, 75, 44, 5, 0, 6, 32, 6, 49, 41, 74, 9, 1, 0, 0, 0, 9, 1, 9, 16, 41, 71, 80, 3, 0, 0, 4, 3, 5, 51, 106, 11, 3, 112, 28, 13, 1, 4, 8, 3, 104, 118, 14, 1, 1, 0, 0, 0, 88, 3, 27, 46, 118, 108, 49, 2, 0, 1, 46, 118, 118, 27, 12, 0, 0, 33, 118, 118, 8, 0, 0, 0, 4, 118, 95, 40, 0, 0, 0, 1, 11, 27, 38, 12, 12, 18, 29, 3, 2, 13, 30, 94, 78, 30, 19, 9, 3, 31, 45, 70, 42, 15, 1, 3, 12, 14, 22, 16, 2, 3, 17, 24, 13]",4),(9778,"[41, 0, 0, 7, 1, 1, 20, 67, 9, 0, 0, 0, 0, 31, 120, 61, 25, 0, 0, 0, 0, 10, 120, 90, 32, 0, 0, 1, 13, 11, 22, 50, 4, 0, 2, 93, 40, 15, 37, 18, 12, 2, 2, 19, 8, 44, 120, 25, 120, 5, 0, 0, 0, 2, 48, 97, 102, 14, 3, 3, 11, 9, 34, 41, 0, 0, 4, 120, 56, 3, 4, 5, 6, 15, 37, 116, 28, 0, 0, 3, 120, 120, 24, 6, 2, 0, 1, 28, 53, 90, 51, 11, 11, 2, 12, 14, 8, 6, 4, 30, 9, 1, 4, 22, 25, 79, 120, 66, 5, 0, 0, 6, 42, 120, 91, 43, 15, 2, 4, 39, 12, 9, 9, 12, 15, 5, 24, 36]",4);
create index idx01 using hnsw on vector_index_07(b) op_type "vector_l2_ops";
select * from vector_index_07 order by  L2_DISTANCE(a, "[16, 15, 0, 0, 5, 46, 5, 5, 4, 0, 0, 0, 28, 118, 12, 5, 75, 44, 5, 0, 6, 32, 6, 49, 41, 74, 9, 1, 0, 0, 0, 9, 1, 9, 16, 41, 71, 80, 3, 0, 0, 4, 3, 5, 51, 106, 11, 3, 112, 28, 13, 1, 4, 8, 3, 104, 118, 14, 1, 1, 0, 0, 0, 88, 3, 27, 46, 118, 108, 49, 2, 0, 1, 46, 118, 118, 27, 12, 0, 0, 33, 118, 118, 8, 0, 0, 0, 4, 118, 95, 40, 0, 0, 0, 1, 11, 27, 38, 12, 12, 18, 29, 3, 2, 13, 30, 94, 78, 30, 19, 9, 3, 31, 45, 70, 42, 15, 1, 3, 12, 14, 22, 16, 2, 3, 17, 24, 13]") ASC LIMIT 2;
invalid argument function l2_distance, bad value [BIGINT VARCHAR]
select * from vector_index_07 order by  L2_DISTANCE(b, "[16, 15, 3, 0, 0, 4, 3, 5, 51]") ASC LIMIT 2;
invalid input: vector ops between different dimensions (128, 9) is not permitted.
select * from vector_index_07 order by  L2_DISTANCE(b, "abc") ASC LIMIT 2;
internal error: malformed vector input: abc
create table vector_index_08(a bigint auto_increment primary key, b vecf32(128),c int,key c_k(c));
insert into vector_index_08 values(9774 ,"[1, 0, 1, 6, 6, 17, 47, 39, 2, 0, 1, 25, 27, 10, 56, 130, 18, 5, 2, 6, 15, 2, 19, 130, 42, 28, 1, 1, 2, 1, 0, 5, 0, 2, 4, 4, 31, 34, 44, 35, 9, 3, 8, 11, 33, 12, 61, 130, 130, 17, 0, 1, 6, 2, 9, 130, 111, 36, 0, 0, 11, 9, 1, 12, 2, 100, 130, 28, 7, 2, 6, 7, 9, 27, 130, 83, 5, 0, 1, 18, 130, 130, 84, 9, 0, 0, 2, 24, 111, 24, 0, 1, 37, 24, 2, 10, 12, 62, 33, 3, 0, 0, 0, 1, 3, 16, 106, 28, 0, 0, 0, 0, 17, 46, 85, 10, 0, 0, 1, 4, 11, 4, 2, 2, 9, 14, 8, 8]",3),(9775,"[0, 1, 1, 3, 0, 3, 46, 20, 1, 4, 17, 9, 1, 17, 108, 15, 0, 3, 37, 17, 6, 15, 116, 16, 6, 1, 4, 7, 7, 7, 9, 6, 0, 8, 10, 4, 26, 129, 27, 9, 0, 0, 5, 2, 11, 129, 129, 12, 103, 4, 0, 0, 2, 31, 129, 129, 94, 4, 0, 0, 0, 3, 13, 42, 0, 15, 38, 2, 70, 129, 1, 0, 5, 10, 40, 12, 74, 129, 6, 1, 129, 39, 6, 1, 2, 22, 9, 33, 122, 13, 0, 0, 0, 0, 5, 23, 4, 11, 9, 12, 45, 38, 1, 0, 0, 4, 36, 38, 57, 32, 0, 0, 82, 22, 9, 5, 13, 11, 3, 94, 35, 3, 0, 0, 0, 1, 16, 97]",5),(9776,"[10, 3, 8, 5, 48, 26, 5, 16, 17, 0, 0, 2, 132, 53, 1, 16, 112, 6, 0, 0, 7, 2, 1, 48, 48, 15, 18, 31, 3, 0, 0, 9, 6, 10, 19, 27, 50, 46, 17, 9, 18, 1, 4, 48, 132, 23, 3, 5, 132, 9, 4, 3, 11, 0, 2, 46, 84, 12, 10, 10, 1, 0, 12, 76, 26, 22, 16, 26, 35, 15, 3, 16, 15, 1, 51, 132, 125, 8, 1, 2, 132, 51, 67, 91, 8, 0, 0, 30, 126, 39, 32, 38, 4, 0, 1, 12, 24, 2, 2, 2, 4, 7, 2, 19, 93, 19, 70, 92, 2, 3, 1, 21, 36, 58, 132, 94, 0, 0, 0, 0, 21, 25, 57, 48, 1, 0, 0, 1]",3);
insert into vector_index_08 values(9777, "[16, 15, 0, 0, 5, 46, 5, 5, 4, 0, 0, 0, 28, 118, 12, 5, 75, 44, 5, 0, 6, 32, 6, 49, 41, 74, 9, 1, 0, 0, 0, 9, 1, 9, 16, 41, 71, 80, 3, 0, 0, 4, 3, 5, 51, 106, 11, 3, 112, 28, 13, 1, 4, 8, 3, 104, 118, 14, 1, 1, 0, 0, 0, 88, 3, 27, 46, 118, 108, 49, 2, 0, 1, 46, 118, 118, 27, 12, 0, 0, 33, 118, 118, 8, 0, 0, 0, 4, 118, 95, 40, 0, 0, 0, 1, 11, 27, 38, 12, 12, 18, 29, 3, 2, 13, 30, 94, 78, 30, 19, 9, 3, 31, 45, 70, 42, 15, 1, 3, 12, 14, 22, 16, 2, 3, 17, 24, 13]",4),(9778,"[41, 0, 0, 7, 1, 1, 20, 67, 9, 0, 0, 0, 0, 31, 120, 61, 25, 0, 0, 0, 0, 10, 120, 90, 32, 0, 0, 1, 13, 11, 22, 50, 4, 0, 2, 93, 40, 15, 37, 18, 12, 2, 2, 19, 8, 44, 120, 25, 120, 5, 0, 0, 0, 2, 48, 97, 102, 14, 3, 3, 11, 9, 34, 41, 0, 0, 4, 120, 56, 3, 4, 5, 6, 15, 37, 116, 28, 0, 0, 3, 120, 120, 24, 6, 2, 0, 1, 28, 53, 90, 51, 11, 11, 2, 12, 14, 8, 6, 4, 30, 9, 1, 4, 22, 25, 79, 120, 66, 5, 0, 0, 6, 42, 120, 91, 43, 15, 2, 4, 39, 12, 9, 9, 12, 15, 5, 24, 36]",4);
create index idx01 using hnsw on vector_index_08(b) op_type "vector_l2_ops";
select * from  vector_index_08 ;
a    b    c
9774    [1, 0, 1, 6, 6, 17, 47, 39, 2, 0, 1, 25, 27, 10, 56, 130, 18, 5, 2, 6, 15, 2, 19, 130, 42, 28, 1, 1, 2, 1, 0, 5, 0, 2, 4, 4, 31, 34, 44, 35, 9, 3, 8, 11, 33, 12, 61, 130, 130, 17, 0, 1, 6, 2, 9, 130, 111, 36, 0, 0, 11, 9, 1, 12, 2, 100, 130, 28, 7, 2, 6, 7, 9, 27, 130, 83, 5, 0, 1, 18, 130, 130, 84, 9, 0, 0, 2, 24, 111, 24, 0, 1, 37, 24, 2, 10, 12, 62, 33, 3, 0, 0, 0, 1, 3, 16, 106, 28, 0, 0, 0, 0, 17, 46, 85, 10, 0, 0, 1, 4, 11, 4, 2, 2, 9, 14, 8, 8]    3
9775    [0, 1, 1, 3, 0, 3, 46, 20, 1, 4, 17, 9, 1, 17, 108, 15, 0, 3, 37, 17, 6, 15, 116, 16, 6, 1, 4, 7, 7, 7, 9, 6, 0, 8, 10, 4, 26, 129, 27, 9, 0, 0, 5, 2, 11, 129, 129, 12, 103, 4, 0, 0, 2, 31, 129, 129, 94, 4, 0, 0, 0, 3, 13, 42, 0, 15, 38, 2, 70, 129, 1, 0, 5, 10, 40, 12, 74, 129, 6, 1, 129, 39, 6, 1, 2, 22, 9, 33, 122, 13, 0, 0, 0, 0, 5, 23, 4, 11, 9, 12, 45, 38, 1, 0, 0, 4, 36, 38, 57, 32, 0, 0, 82, 22, 9, 5, 13, 11, 3, 94, 35, 3, 0, 0, 0, 1, 16, 97]    5
9776    [10, 3, 8, 5, 48, 26, 5, 16, 17, 0, 0, 2, 132, 53, 1, 16, 112, 6, 0, 0, 7, 2, 1, 48, 48, 15, 18, 31, 3, 0, 0, 9, 6, 10, 19, 27, 50, 46, 17, 9, 18, 1, 4, 48, 132, 23, 3, 5, 132, 9, 4, 3, 11, 0, 2, 46, 84, 12, 10, 10, 1, 0, 12, 76, 26, 22, 16, 26, 35, 15, 3, 16, 15, 1, 51, 132, 125, 8, 1, 2, 132, 51, 67, 91, 8, 0, 0, 30, 126, 39, 32, 38, 4, 0, 1, 12, 24, 2, 2, 2, 4, 7, 2, 19, 93, 19, 70, 92, 2, 3, 1, 21, 36, 58, 132, 94, 0, 0, 0, 0, 21, 25, 57, 48, 1, 0, 0, 1]    3
9777    [16, 15, 0, 0, 5, 46, 5, 5, 4, 0, 0, 0, 28, 118, 12, 5, 75, 44, 5, 0, 6, 32, 6, 49, 41, 74, 9, 1, 0, 0, 0, 9, 1, 9, 16, 41, 71, 80, 3, 0, 0, 4, 3, 5, 51, 106, 11, 3, 112, 28, 13, 1, 4, 8, 3, 104, 118, 14, 1, 1, 0, 0, 0, 88, 3, 27, 46, 118, 108, 49, 2, 0, 1, 46, 118, 118, 27, 12, 0, 0, 33, 118, 118, 8, 0, 0, 0, 4, 118, 95, 40, 0, 0, 0, 1, 11, 27, 38, 12, 12, 18, 29, 3, 2, 13, 30, 94, 78, 30, 19, 9, 3, 31, 45, 70, 42, 15, 1, 3, 12, 14, 22, 16, 2, 3, 17, 24, 13]    4
9778    [41, 0, 0, 7, 1, 1, 20, 67, 9, 0, 0, 0, 0, 31, 120, 61, 25, 0, 0, 0, 0, 10, 120, 90, 32, 0, 0, 1, 13, 11, 22, 50, 4, 0, 2, 93, 40, 15, 37, 18, 12, 2, 2, 19, 8, 44, 120, 25, 120, 5, 0, 0, 0, 2, 48, 97, 102, 14, 3, 3, 11, 9, 34, 41, 0, 0, 4, 120, 56, 3, 4, 5, 6, 15, 37, 116, 28, 0, 0, 3, 120, 120, 24, 6, 2, 0, 1, 28, 53, 90, 51, 11, 11, 2, 12, 14, 8, 6, 4, 30, 9, 1, 4, 22, 25, 79, 120, 66, 5, 0, 0, 6, 42, 120, 91, 43, 15, 2, 4, 39, 12, 9, 9, 12, 15, 5, 24, 36]    4
update vector_index_08 set b="[16, 15, 0, 0, 5, 46, 5, 5, 4, 0, 0, 0, 28, 118, 12, 5, 75, 44, 5, 0, 6, 32, 6, 49, 41, 74, 9, 1, 0, 0, 0, 9, 1, 9, 16, 41, 71, 80, 3, 0, 0, 4, 3, 5, 51, 106, 11, 3, 112, 28, 13, 1, 4, 8, 3, 104, 118, 14, 1, 1, 0, 0, 0, 88, 3, 27, 46, 118, 108, 49, 2, 0, 1, 46, 118, 118, 27, 12, 0, 0, 33, 118, 118, 8, 0, 0, 0, 4, 118, 95, 40, 0, 0, 0, 1, 11, 27, 38, 12, 12, 18, 29, 3, 2, 13, 30, 94, 78, 30, 19, 9, 3, 31, 45, 70, 42, 15, 1, 3, 12, 14, 22, 16, 2, 3, 17, 24, 13]" where a=9774;
select * from  vector_index_08 where a=9774;
a    b    c
9774    [16, 15, 0, 0, 5, 46, 5, 5, 4, 0, 0, 0, 28, 118, 12, 5, 75, 44, 5, 0, 6, 32, 6, 49, 41, 74, 9, 1, 0, 0, 0, 9, 1, 9, 16, 41, 71, 80, 3, 0, 0, 4, 3, 5, 51, 106, 11, 3, 112, 28, 13, 1, 4, 8, 3, 104, 118, 14, 1, 1, 0, 0, 0, 88, 3, 27, 46, 118, 108, 49, 2, 0, 1, 46, 118, 118, 27, 12, 0, 0, 33, 118, 118, 8, 0, 0, 0, 4, 118, 95, 40, 0, 0, 0, 1, 11, 27, 38, 12, 12, 18, 29, 3, 2, 13, 30, 94, 78, 30, 19, 9, 3, 31, 45, 70, 42, 15, 1, 3, 12, 14, 22, 16, 2, 3, 17, 24, 13]    3
delete from vector_index_08 where a=9777;
select * from  vector_index_08 where a=9777;
a    b    c
truncate table vector_index_08;
select * from  vector_index_08;
a    b    c
insert into vector_index_08 values(9774 ,"[1, 0, 1, 6, 6, 17, 47, 39, 2, 0, 1, 25, 27, 10, 56, 130, 18, 5, 2, 6, 15, 2, 19, 130, 42, 28, 1, 1, 2, 1, 0, 5, 0, 2, 4, 4, 31, 34, 44, 35, 9, 3, 8, 11, 33, 12, 61, 130, 130, 17, 0, 1, 6, 2, 9, 130, 111, 36, 0, 0, 11, 9, 1, 12, 2, 100, 130, 28, 7, 2, 6, 7, 9, 27, 130, 83, 5, 0, 1, 18, 130, 130, 84, 9, 0, 0, 2, 24, 111, 24, 0, 1, 37, 24, 2, 10, 12, 62, 33, 3, 0, 0, 0, 1, 3, 16, 106, 28, 0, 0, 0, 0, 17, 46, 85, 10, 0, 0, 1, 4, 11, 4, 2, 2, 9, 14, 8, 8]",3),(9775,"[0, 1, 1, 3, 0, 3, 46, 20, 1, 4, 17, 9, 1, 17, 108, 15, 0, 3, 37, 17, 6, 15, 116, 16, 6, 1, 4, 7, 7, 7, 9, 6, 0, 8, 10, 4, 26, 129, 27, 9, 0, 0, 5, 2, 11, 129, 129, 12, 103, 4, 0, 0, 2, 31, 129, 129, 94, 4, 0, 0, 0, 3, 13, 42, 0, 15, 38, 2, 70, 129, 1, 0, 5, 10, 40, 12, 74, 129, 6, 1, 129, 39, 6, 1, 2, 22, 9, 33, 122, 13, 0, 0, 0, 0, 5, 23, 4, 11, 9, 12, 45, 38, 1, 0, 0, 4, 36, 38, 57, 32, 0, 0, 82, 22, 9, 5, 13, 11, 3, 94, 35, 3, 0, 0, 0, 1, 16, 97]",5),(9776,"[10, 3, 8, 5, 48, 26, 5, 16, 17, 0, 0, 2, 132, 53, 1, 16, 112, 6, 0, 0, 7, 2, 1, 48, 48, 15, 18, 31, 3, 0, 0, 9, 6, 10, 19, 27, 50, 46, 17, 9, 18, 1, 4, 48, 132, 23, 3, 5, 132, 9, 4, 3, 11, 0, 2, 46, 84, 12, 10, 10, 1, 0, 12, 76, 26, 22, 16, 26, 35, 15, 3, 16, 15, 1, 51, 132, 125, 8, 1, 2, 132, 51, 67, 91, 8, 0, 0, 30, 126, 39, 32, 38, 4, 0, 1, 12, 24, 2, 2, 2, 4, 7, 2, 19, 93, 19, 70, 92, 2, 3, 1, 21, 36, 58, 132, 94, 0, 0, 0, 0, 21, 25, 57, 48, 1, 0, 0, 1]",3);
alter table vector_index_08 add column d vecf32(3) not null after c;
create index idx02 using hnsw on vector_index_08(d) op_type "vector_l2_ops";
show create table vector_index_08;
Table    Create Table
vector_index_08    CREATE TABLE `vector_index_08` (\n  `a` bigint NOT NULL AUTO_INCREMENT,\n  `b` vecf32(128) DEFAULT NULL,\n  `c` int DEFAULT NULL,\n  `d` vecf32(3) NOT NULL,\n  PRIMARY KEY (`a`),\n  KEY `c_k` (`c`),\n  KEY `idx01` USING hnsw (`b`) op_type 'vector_l2_ops' ,\n  KEY `idx02` USING hnsw (`d`) op_type 'vector_l2_ops' \n)
insert into vector_index_08(d) values ("[2.36,5.021,9.222]");
insert into vector_index_08(d) values ("[8.555,2.11,7.22]");
alter table vector_index_08 alter reindex idx02 hnsw;
select * from vector_index_08 order by  L2_DISTANCE(d,"[2.36,5.021,9.222]") desc limit 1;
a    b    c    d
9777    null    null    [2.36, 5.021, 9.222]
alter table vector_index_08 rename column d to e;
select * from vector_index_08 order by  L2_DISTANCE(e,"[2.36,5.021,9.222]") desc limit 1;
a    b    c    e
9777    null    null    [2.36, 5.021, 9.222]
alter table vector_index_08 drop column e;
select * from vector_index_08;
a    b    c
9774    [1, 0, 1, 6, 6, 17, 47, 39, 2, 0, 1, 25, 27, 10, 56, 130, 18, 5, 2, 6, 15, 2, 19, 130, 42, 28, 1, 1, 2, 1, 0, 5, 0, 2, 4, 4, 31, 34, 44, 35, 9, 3, 8, 11, 33, 12, 61, 130, 130, 17, 0, 1, 6, 2, 9, 130, 111, 36, 0, 0, 11, 9, 1, 12, 2, 100, 130, 28, 7, 2, 6, 7, 9, 27, 130, 83, 5, 0, 1, 18, 130, 130, 84, 9, 0, 0, 2, 24, 111, 24, 0, 1, 37, 24, 2, 10, 12, 62, 33, 3, 0, 0, 0, 1, 3, 16, 106, 28, 0, 0, 0, 0, 17, 46, 85, 10, 0, 0, 1, 4, 11, 4, 2, 2, 9, 14, 8, 8]    3
9775    [0, 1, 1, 3, 0, 3, 46, 20, 1, 4, 17, 9, 1, 17, 108, 15, 0, 3, 37, 17, 6, 15, 116, 16, 6, 1, 4, 7, 7, 7, 9, 6, 0, 8, 10, 4, 26, 129, 27, 9, 0, 0, 5, 2, 11, 129, 129, 12, 103, 4, 0, 0, 2, 31, 129, 129, 94, 4, 0, 0, 0, 3, 13, 42, 0, 15, 38, 2, 70, 129, 1, 0, 5, 10, 40, 12, 74, 129, 6, 1, 129, 39, 6, 1, 2, 22, 9, 33, 122, 13, 0, 0, 0, 0, 5, 23, 4, 11, 9, 12, 45, 38, 1, 0, 0, 4, 36, 38, 57, 32, 0, 0, 82, 22, 9, 5, 13, 11, 3, 94, 35, 3, 0, 0, 0, 1, 16, 97]    5
9776    [10, 3, 8, 5, 48, 26, 5, 16, 17, 0, 0, 2, 132, 53, 1, 16, 112, 6, 0, 0, 7, 2, 1, 48, 48, 15, 18, 31, 3, 0, 0, 9, 6, 10, 19, 27, 50, 46, 17, 9, 18, 1, 4, 48, 132, 23, 3, 5, 132, 9, 4, 3, 11, 0, 2, 46, 84, 12, 10, 10, 1, 0, 12, 76, 26, 22, 16, 26, 35, 15, 3, 16, 15, 1, 51, 132, 125, 8, 1, 2, 132, 51, 67, 91, 8, 0, 0, 30, 126, 39, 32, 38, 4, 0, 1, 12, 24, 2, 2, 2, 4, 7, 2, 19, 93, 19, 70, 92, 2, 3, 1, 21, 36, 58, 132, 94, 0, 0, 0, 0, 21, 25, 57, 48, 1, 0, 0, 1]    3
9777    null    null
9778    null    null
create table vector_index_09(a bigint primary key, b vecf32(128),c int,key c_k(c));
create index idx01 using hnsw on vector_index_09(b) op_type "vector_l2_ops";
insert into vector_index_09 values(9774 ,NULL,3),(9775,NULL,10);
insert into vector_index_09(a,c) values(9777,4),(9778,9);
select * from vector_index_09;
a    b    c
9774    null    3
9775    null    10
9777    null    4
9778    null    9
select * from vector_index_09 order by  L2_DISTANCE(b,"[1, 0, 1, 6, 6, 17, 47]");
a    b    c
9774    null    3
9775    null    10
9777    null    4
9778    null    9
select * from vector_index_09 order by  L2_DISTANCE(b,NULL);
a    b    c
9774    null    3
9775    null    10
9777    null    4
9778    null    9
drop table vector_index_09;
create table vector_index_09(a bigint primary key, b vecf32(128),c int,key c_k(c));
insert into vector_index_09 values(9774 ,NULL,3),(9775,NULL,10);
insert into vector_index_09(a,c) values(9777,4),(9778,9);
create index idx01 using hnsw on vector_index_09(b) op_type "vector_l2_ops";
select * from vector_index_09 order by  L2_DISTANCE(b,"[1, 0, 1, 6, 6, 17, 47]");
a    b    c
9774    null    3
9775    null    10
9777    null    4
9778    null    9
insert into vector_index_09 values(97741 ,"[1, 0, 1, 6, 6, 17, 47, 39, 2, 0, 1, 25, 27, 10, 56, 130, 18, 5, 2, 6, 15, 2, 19, 130, 42, 28, 1, 1, 2, 1, 0, 5, 0, 2, 4, 4, 31, 34, 44, 35, 9, 3, 8, 11, 33, 12, 61, 130, 130, 17, 0, 1, 6, 2, 9, 130, 111, 36, 0, 0, 11, 9, 1, 12, 2, 100, 130, 28, 7, 2, 6, 7, 9, 27, 130, 83, 5, 0, 1, 18, 130, 130, 84, 9, 0, 0, 2, 24, 111, 24, 0, 1, 37, 24, 2, 10, 12, 62, 33, 3, 0, 0, 0, 1, 3, 16, 106, 28, 0, 0, 0, 0, 17, 46, 85, 10, 0, 0, 1, 4, 11, 4, 2, 2, 9, 14, 8, 8]",3),(97751,"[0, 1, 1, 3, 0, 3, 46, 20, 1, 4, 17, 9, 1, 17, 108, 15, 0, 3, 37, 17, 6, 15, 116, 16, 6, 1, 4, 7, 7, 7, 9, 6, 0, 8, 10, 4, 26, 129, 27, 9, 0, 0, 5, 2, 11, 129, 129, 12, 103, 4, 0, 0, 2, 31, 129, 129, 94, 4, 0, 0, 0, 3, 13, 42, 0, 15, 38, 2, 70, 129, 1, 0, 5, 10, 40, 12, 74, 129, 6, 1, 129, 39, 6, 1, 2, 22, 9, 33, 122, 13, 0, 0, 0, 0, 5, 23, 4, 11, 9, 12, 45, 38, 1, 0, 0, 4, 36, 38, 57, 32, 0, 0, 82, 22, 9, 5, 13, 11, 3, 94, 35, 3, 0, 0, 0, 1, 16, 97]",5),(9776,"[10, 3, 8, 5, 48, 26, 5, 16, 17, 0, 0, 2, 132, 53, 1, 16, 112, 6, 0, 0, 7, 2, 1, 48, 48, 15, 18, 31, 3, 0, 0, 9, 6, 10, 19, 27, 50, 46, 17, 9, 18, 1, 4, 48, 132, 23, 3, 5, 132, 9, 4, 3, 11, 0, 2, 46, 84, 12, 10, 10, 1, 0, 12, 76, 26, 22, 16, 26, 35, 15, 3, 16, 15, 1, 51, 132, 125, 8, 1, 2, 132, 51, 67, 91, 8, 0, 0, 30, 126, 39, 32, 38, 4, 0, 1, 12, 24, 2, 2, 2, 4, 7, 2, 19, 93, 19, 70, 92, 2, 3, 1, 21, 36, 58, 132, 94, 0, 0, 0, 0, 21, 25, 57, 48, 1, 0, 0, 1]",3);
insert into vector_index_09 values(97771, "[16, 15, 0, 0, 5, 46, 5, 5, 4, 0, 0, 0, 28, 118, 12, 5, 75, 44, 5, 0, 6, 32, 6, 49, 41, 74, 9, 1, 0, 0, 0, 9, 1, 9, 16, 41, 71, 80, 3, 0, 0, 4, 3, 5, 51, 106, 11, 3, 112, 28, 13, 1, 4, 8, 3, 104, 118, 14, 1, 1, 0, 0, 0, 88, 3, 27, 46, 118, 108, 49, 2, 0, 1, 46, 118, 118, 27, 12, 0, 0, 33, 118, 118, 8, 0, 0, 0, 4, 118, 95, 40, 0, 0, 0, 1, 11, 27, 38, 12, 12, 18, 29, 3, 2, 13, 30, 94, 78, 30, 19, 9, 3, 31, 45, 70, 42, 15, 1, 3, 12, 14, 22, 16, 2, 3, 17, 24, 13]",4),(97781,"[41, 0, 0, 7, 1, 1, 20, 67, 9, 0, 0, 0, 0, 31, 120, 61, 25, 0, 0, 0, 0, 10, 120, 90, 32, 0, 0, 1, 13, 11, 22, 50, 4, 0, 2, 93, 40, 15, 37, 18, 12, 2, 2, 19, 8, 44, 120, 25, 120, 5, 0, 0, 0, 2, 48, 97, 102, 14, 3, 3, 11, 9, 34, 41, 0, 0, 4, 120, 56, 3, 4, 5, 6, 15, 37, 116, 28, 0, 0, 3, 120, 120, 24, 6, 2, 0, 1, 28, 53, 90, 51, 11, 11, 2, 12, 14, 8, 6, 4, 30, 9, 1, 4, 22, 25, 79, 120, 66, 5, 0, 0, 6, 42, 120, 91, 43, 15, 2, 4, 39, 12, 9, 9, 12, 15, 5, 24, 36]",4);
alter table vector_index_09 alter reindex idx01 hnsw;
select * from vector_index_09 order by  L2_DISTANCE(b,"[1, 0, 1, 6, 6, 17, 47]");
invalid input: vector ops between different dimensions (128, 7) is not permitted.
alter table vector_index_09 drop index idx01;
show create table vector_index_09;
Table    Create Table
vector_index_09    CREATE TABLE `vector_index_09` (\n  `a` bigint NOT NULL,\n  `b` vecf32(128) DEFAULT NULL,\n  `c` int DEFAULT NULL,\n  PRIMARY KEY (`a`),\n  KEY `c_k` (`c`)\n)
create table vector_index_10(a bigint primary key, b vecf32(128),c int,key c_k(c));
set autocommit=0;
create index idx01 using hnsw on vector_index_10(b) op_type "vector_l2_ops";
show create table vector_index_10;
Table    Create Table
vector_index_10    CREATE TABLE `vector_index_10` (\n  `a` bigint NOT NULL,\n  `b` vecf32(128) DEFAULT NULL,\n  `c` int DEFAULT NULL,\n  PRIMARY KEY (`a`),\n  KEY `c_k` (`c`),\n  KEY `idx01` USING hnsw (`b`) op_type 'vector_l2_ops' \n)
insert into vector_index_10 values(97741 ,"[1, 0, 1, 6, 6, 17, 47, 39, 2, 0, 1, 25, 27, 10, 56, 130, 18, 5, 2, 6, 15, 2, 19, 130, 42, 28, 1, 1, 2, 1, 0, 5, 0, 2, 4, 4, 31, 34, 44, 35, 9, 3, 8, 11, 33, 12, 61, 130, 130, 17, 0, 1, 6, 2, 9, 130, 111, 36, 0, 0, 11, 9, 1, 12, 2, 100, 130, 28, 7, 2, 6, 7, 9, 27, 130, 83, 5, 0, 1, 18, 130, 130, 84, 9, 0, 0, 2, 24, 111, 24, 0, 1, 37, 24, 2, 10, 12, 62, 33, 3, 0, 0, 0, 1, 3, 16, 106, 28, 0, 0, 0, 0, 17, 46, 85, 10, 0, 0, 1, 4, 11, 4, 2, 2, 9, 14, 8, 8]",3),(97751,"[0, 1, 1, 3, 0, 3, 46, 20, 1, 4, 17, 9, 1, 17, 108, 15, 0, 3, 37, 17, 6, 15, 116, 16, 6, 1, 4, 7, 7, 7, 9, 6, 0, 8, 10, 4, 26, 129, 27, 9, 0, 0, 5, 2, 11, 129, 129, 12, 103, 4, 0, 0, 2, 31, 129, 129, 94, 4, 0, 0, 0, 3, 13, 42, 0, 15, 38, 2, 70, 129, 1, 0, 5, 10, 40, 12, 74, 129, 6, 1, 129, 39, 6, 1, 2, 22, 9, 33, 122, 13, 0, 0, 0, 0, 5, 23, 4, 11, 9, 12, 45, 38, 1, 0, 0, 4, 36, 38, 57, 32, 0, 0, 82, 22, 9, 5, 13, 11, 3, 94, 35, 3, 0, 0, 0, 1, 16, 97]",5),(9776,"[10, 3, 8, 5, 48, 26, 5, 16, 17, 0, 0, 2, 132, 53, 1, 16, 112, 6, 0, 0, 7, 2, 1, 48, 48, 15, 18, 31, 3, 0, 0, 9, 6, 10, 19, 27, 50, 46, 17, 9, 18, 1, 4, 48, 132, 23, 3, 5, 132, 9, 4, 3, 11, 0, 2, 46, 84, 12, 10, 10, 1, 0, 12, 76, 26, 22, 16, 26, 35, 15, 3, 16, 15, 1, 51, 132, 125, 8, 1, 2, 132, 51, 67, 91, 8, 0, 0, 30, 126, 39, 32, 38, 4, 0, 1, 12, 24, 2, 2, 2, 4, 7, 2, 19, 93, 19, 70, 92, 2, 3, 1, 21, 36, 58, 132, 94, 0, 0, 0, 0, 21, 25, 57, 48, 1, 0, 0, 1]",3);
alter table vector_index_10 alter reindex idx01 hnsw;
show create table vector_index_10;
Table    Create Table
vector_index_10    CREATE TABLE `vector_index_10` (\n  `a` bigint NOT NULL,\n  `b` vecf32(128) DEFAULT NULL,\n  `c` int DEFAULT NULL,\n  PRIMARY KEY (`a`),\n  KEY `c_k` (`c`),\n  KEY `idx01` USING hnsw (`b`) op_type 'vector_l2_ops' \n)
use vector_index;
Unknown database vector_index
show create table vector_index_10;
No database selected
rollback;
show create table vector_index_10;
Table    Create Table
vector_index_10    CREATE TABLE `vector_index_10` (\n  `a` bigint NOT NULL,\n  `b` vecf32(128) DEFAULT NULL,\n  `c` int DEFAULT NULL,\n  PRIMARY KEY (`a`),\n  KEY `c_k` (`c`)\n)
drop table vector_index_10;
set autocommit=1;
create table vector_index_10(a bigint primary key, b vecf32(128),c int,key c_k(c));
begin;
create index idx01 using hnsw on vector_index_10(b) op_type "vector_l2_ops";
show create table vector_index_10;
Table    Create Table
vector_index_10    CREATE TABLE `vector_index_10` (\n  `a` bigint NOT NULL,\n  `b` vecf32(128) DEFAULT NULL,\n  `c` int DEFAULT NULL,\n  PRIMARY KEY (`a`),\n  KEY `c_k` (`c`),\n  KEY `idx01` USING hnsw (`b`) op_type 'vector_l2_ops' \n)
insert into vector_index_10 values(97741 ,"[1, 0, 1, 6, 6, 17, 47, 39, 2, 0, 1, 25, 27, 10, 56, 130, 18, 5, 2, 6, 15, 2, 19, 130, 42, 28, 1, 1, 2, 1, 0, 5, 0, 2, 4, 4, 31, 34, 44, 35, 9, 3, 8, 11, 33, 12, 61, 130, 130, 17, 0, 1, 6, 2, 9, 130, 111, 36, 0, 0, 11, 9, 1, 12, 2, 100, 130, 28, 7, 2, 6, 7, 9, 27, 130, 83, 5, 0, 1, 18, 130, 130, 84, 9, 0, 0, 2, 24, 111, 24, 0, 1, 37, 24, 2, 10, 12, 62, 33, 3, 0, 0, 0, 1, 3, 16, 106, 28, 0, 0, 0, 0, 17, 46, 85, 10, 0, 0, 1, 4, 11, 4, 2, 2, 9, 14, 8, 8]",3),(97751,"[0, 1, 1, 3, 0, 3, 46, 20, 1, 4, 17, 9, 1, 17, 108, 15, 0, 3, 37, 17, 6, 15, 116, 16, 6, 1, 4, 7, 7, 7, 9, 6, 0, 8, 10, 4, 26, 129, 27, 9, 0, 0, 5, 2, 11, 129, 129, 12, 103, 4, 0, 0, 2, 31, 129, 129, 94, 4, 0, 0, 0, 3, 13, 42, 0, 15, 38, 2, 70, 129, 1, 0, 5, 10, 40, 12, 74, 129, 6, 1, 129, 39, 6, 1, 2, 22, 9, 33, 122, 13, 0, 0, 0, 0, 5, 23, 4, 11, 9, 12, 45, 38, 1, 0, 0, 4, 36, 38, 57, 32, 0, 0, 82, 22, 9, 5, 13, 11, 3, 94, 35, 3, 0, 0, 0, 1, 16, 97]",5),(9776,"[10, 3, 8, 5, 48, 26, 5, 16, 17, 0, 0, 2, 132, 53, 1, 16, 112, 6, 0, 0, 7, 2, 1, 48, 48, 15, 18, 31, 3, 0, 0, 9, 6, 10, 19, 27, 50, 46, 17, 9, 18, 1, 4, 48, 132, 23, 3, 5, 132, 9, 4, 3, 11, 0, 2, 46, 84, 12, 10, 10, 1, 0, 12, 76, 26, 22, 16, 26, 35, 15, 3, 16, 15, 1, 51, 132, 125, 8, 1, 2, 132, 51, 67, 91, 8, 0, 0, 30, 126, 39, 32, 38, 4, 0, 1, 12, 24, 2, 2, 2, 4, 7, 2, 19, 93, 19, 70, 92, 2, 3, 1, 21, 36, 58, 132, 94, 0, 0, 0, 0, 21, 25, 57, 48, 1, 0, 0, 1]",3);
alter table vector_index_10 alter reindex idx01 hnsw;
show create table vector_index_10;
Table    Create Table
vector_index_10    CREATE TABLE `vector_index_10` (\n  `a` bigint NOT NULL,\n  `b` vecf32(128) DEFAULT NULL,\n  `c` int DEFAULT NULL,\n  PRIMARY KEY (`a`),\n  KEY `c_k` (`c`),\n  KEY `idx01` USING hnsw (`b`) op_type 'vector_l2_ops' \n)
use vector_index;
Unknown database vector_index
show create table vector_index_10;
No database selected
commit;
show create table vector_index_10;
Table    Create Table
vector_index_10    CREATE TABLE `vector_index_10` (\n  `a` bigint NOT NULL,\n  `b` vecf32(128) DEFAULT NULL,\n  `c` int DEFAULT NULL,\n  PRIMARY KEY (`a`),\n  KEY `c_k` (`c`),\n  KEY `idx01` USING hnsw (`b`) op_type 'vector_l2_ops' \n)
drop table vector_index_10;
DROP TABLE IF EXISTS `t3`;
CREATE TABLE `t3` (
`a` BIGINT PRIMARY KEY,
`b` VECF32(128) DEFAULT NULL
);
create index idx01 using hnsw on t3(b) op_type "vector_l2_ops";
INSERT INTO `t3` select result,'[0, 0, 0, 0, 0, 12, 146, 26, 2, 0, 0, 0, 0, 146, 146, 15, 43, 0, 0, 5, 26, 115, 79, 65, 1, 0, 0, 23, 58, 20, 0, 4, 0, 0, 0, 0, 0, 25, 146, 14, 26, 1, 0, 0, 0, 99, 146, 30, 146, 3, 0, 6, 13, 20, 23, 115, 19, 0, 1, 30, 80, 34, 3, 12, 0, 0, 0, 1, 3, 10, 12, 0, 63, 5, 0, 1, 1, 4, 11, 10, 146, 13, 0, 0, 8, 3, 0, 44, 30, 3, 1, 13, 83, 29, 3, 17, 0, 1, 3, 4, 3, 0, 0, 0, 56, 8, 3, 4, 6, 0, 0, 1, 146, 14, 0, 0, 1, 2, 2, 19, 13, 1, 0, 6, 28, 26, 7, 15]' from generate_series(1,81920) g;
SELECT a FROM t3 ORDER BY l2_distance(b,'[1.0,3.0,11.0,110.0,62.0,22.0,4.0,0.0,43.0,21.0,22.0,18.0,6.0,28.0,64.0,9.0,11.0,1.0,0.0,0.0,1.0,40.0,101.0,21.0,20.0,2.0,4.0,2.0,2.0,9.0,18.0,35.0,1.0,1.0,7.0,25.0,108.0,116.0,63.0,2.0,0.0,0.0,11.0,74.0,40.0,101.0,116.0,3.0,33.0,1.0,1.0,11.0,14.0,18.0,116.0,116.0,68.0,12.0,5.0,4.0,2.0,2.0,9.0,102.0,17.0,3.0,10.0,18.0,8.0,15.0,67.0,63.0,15.0,0.0,14.0,116.0,80.0,0.0,2.0,22.0,96.0,37.0,28.0,88.0,43.0,1.0,4.0,18.0,116.0,51.0,5.0,11.0,32.0,14.0,8.0,23.0,44.0,17.0,12.0,9.0,0.0,0.0,19.0,37.0,85.0,18.0,16.0,104.0,22.0,6.0,2.0,26.0,12.0,58.0,67.0,82.0,25.0,12.0,2.0,2.0,25.0,18.0,8.0,2.0,19.0,42.0,48.0,11.0]') ASC LIMIT 1;
a
drop table if exists vector_ip_01;
create table vector_ip_01(a bigint primary key, b vecf32(128), c int, key c_k(c));
insert into vector_ip_01 values(9774 ,normalize_l2("[1, 0, 1, 6, 6, 17, 47, 39, 2, 0, 1, 25, 27, 10, 56, 130, 18, 5, 2, 6, 15, 2, 19, 130, 42, 28, 1, 1, 2, 1, 0, 5, 0, 2, 4, 4, 31, 34, 44, 35, 9, 3, 8, 11, 33, 12, 61, 130, 130, 17, 0, 1, 6, 2, 9, 130, 111, 36, 0, 0, 11, 9, 1, 12, 2, 100, 130, 28, 7, 2, 6, 7, 9, 27, 130, 83, 5, 0, 1, 18, 130, 130, 84, 9, 0, 0, 2, 24, 111, 24, 0, 1, 37, 24, 2, 10, 12, 62, 33, 3, 0, 0, 0, 1, 3, 16, 106, 28, 0, 0, 0, 0, 17, 46, 85, 10, 0, 0, 1, 4, 11, 4, 2, 2, 9, 14, 8, 8]"),3),(9775,normalize_l2("[0, 1, 1, 3, 0, 3, 46, 20, 1, 4, 17, 9, 1, 17, 108, 15, 0, 3, 37, 17, 6, 15, 116, 16, 6, 1, 4, 7, 7, 7, 9, 6, 0, 8, 10, 4, 26, 129, 27, 9, 0, 0, 5, 2, 11, 129, 129, 12, 103, 4, 0, 0, 2, 31, 129, 129, 94, 4, 0, 0, 0, 3, 13, 42, 0, 15, 38, 2, 70, 129, 1, 0, 5, 10, 40, 12, 74, 129, 6, 1, 129, 39, 6, 1, 2, 22, 9, 33, 122, 13, 0, 0, 0, 0, 5, 23, 4, 11, 9, 12, 45, 38, 1, 0, 0, 4, 36, 38, 57, 32, 0, 0, 82, 22, 9, 5, 13, 11, 3, 94, 35, 3, 0, 0, 0, 1, 16, 97]"),5),(9776,normalize_l2("[10, 3, 8, 5, 48, 26, 5, 16, 17, 0, 0, 2, 132, 53, 1, 16, 112, 6, 0, 0, 7, 2, 1, 48, 48, 15, 18, 31, 3, 0, 0, 9, 6, 10, 19, 27, 50, 46, 17, 9, 18, 1, 4, 48, 132, 23, 3, 5, 132, 9, 4, 3, 11, 0, 2, 46, 84, 12, 10, 10, 1, 0, 12, 76, 26, 22, 16, 26, 35, 15, 3, 16, 15, 1, 51, 132, 125, 8, 1, 2, 132, 51, 67, 91, 8, 0, 0, 30, 126, 39, 32, 38, 4, 0, 1, 12, 24, 2, 2, 2, 4, 7, 2, 19, 93, 19, 70, 92, 2, 3, 1, 21, 36, 58, 132, 94, 0, 0, 0, 0, 21, 25, 57, 48, 1, 0, 0, 1]"),3);
insert into vector_ip_01 values(9777, normalize_l2("[16, 15, 0, 0, 5, 46, 5, 5, 4, 0, 0, 0, 28, 118, 12, 5, 75, 44, 5, 0, 6, 32, 6, 49, 41, 74, 9, 1, 0, 0, 0, 9, 1, 9, 16, 41, 71, 80, 3, 0, 0, 4, 3, 5, 51, 106, 11, 3, 112, 28, 13, 1, 4, 8, 3, 104, 118, 14, 1, 1, 0, 0, 0, 88, 3, 27, 46, 118, 108, 49, 2, 0, 1, 46, 118, 118, 27, 12, 0, 0, 33, 118, 118, 8, 0, 0, 0, 4, 118, 95, 40, 0, 0, 0, 1, 11, 27, 38, 12, 12, 18, 29, 3, 2, 13, 30, 94, 78, 30, 19, 9, 3, 31, 45, 70, 42, 15, 1, 3, 12, 14, 22, 16, 2, 3, 17, 24, 13]"),4),(9778,normalize_l2("[41, 0, 0, 7, 1, 1, 20, 67, 9, 0, 0, 0, 0, 31, 120, 61, 25, 0, 0, 0, 0, 10, 120, 90, 32, 0, 0, 1, 13, 11, 22, 50, 4, 0, 2, 93, 40, 15, 37, 18, 12, 2, 2, 19, 8, 44, 120, 25, 120, 5, 0, 0, 0, 2, 48, 97, 102, 14, 3, 3, 11, 9, 34, 41, 0, 0, 4, 120, 56, 3, 4, 5, 6, 15, 37, 116, 28, 0, 0, 3, 120, 120, 24, 6, 2, 0, 1, 28, 53, 90, 51, 11, 11, 2, 12, 14, 8, 6, 4, 30, 9, 1, 4, 22, 25, 79, 120, 66, 5, 0, 0, 6, 42, 120, 91, 43, 15, 2, 4, 39, 12, 9, 9, 12, 15, 5, 24, 36]"),4);
create index idx01 using hnsw on vector_ip_01(b) op_type "vector_ip_ops";
show create table vector_ip_01;
Table    Create Table
vector_ip_01    CREATE TABLE `vector_ip_01` (\n  `a` bigint NOT NULL,\n  `b` vecf32(128) DEFAULT NULL,\n  `c` int DEFAULT NULL,\n  PRIMARY KEY (`a`),\n  KEY `c_k` (`c`),\n  KEY `idx01` USING hnsw (`b`) op_type 'vector_ip_ops' \n)
desc vector_ip_01;
Field    Type    Null    Key    Default    Extra    Comment
a    BIGINT(64)    NO    PRI    null        
b    VECF32(128)    YES    MUL    null        
c    INT(32)    YES    MUL    null        
select * from vector_ip_01 order by  inner_product(b,  normalize_l2("[1, 0, 1, 6, 6, 17, 47, 39, 2, 0, 1, 25, 27, 10, 56, 130, 18, 5, 2, 6, 15, 2, 19, 130, 42, 28, 1, 1, 2, 1, 0, 5, 0, 2, 4, 4, 31, 34, 44, 35, 9, 3, 8, 11, 33, 12, 61, 130, 130, 17, 0, 1, 6, 2, 9, 130, 111, 36, 0, 0, 11, 9, 1, 12, 2, 100, 130, 28, 7, 2, 6, 7, 9, 27, 130, 83, 5, 0, 1, 18, 130, 130, 84, 9, 0, 0, 2, 24, 111, 24, 0, 1, 37, 24, 2, 10, 12, 62, 33, 3, 0, 0, 0, 1, 3, 16, 106, 28, 0, 0, 0, 0, 17, 46, 85, 10, 0, 0, 1, 4, 11, 4, 2, 2, 9, 14, 8, 8]")) ASC LIMIT 2;
a    b    c
9774    [0.0019665654, 0, 0.0019665654, 0.011799393, 0.011799393, 0.033431612, 0.09242858, 0.07669605, 0.0039331308, 0, 0.0019665654, 0.04916414, 0.053097267, 0.019665655, 0.110127665, 0.2556535, 0.035398178, 0.009832827, 0.0039331308, 0.011799393, 0.029498482, 0.0039331308, 0.037364744, 0.2556535, 0.08259575, 0.055063833, 0.0019665654, 0.0019665654, 0.0039331308, 0.0019665654, 0, 0.009832827, 0, 0.0039331308, 0.0078662615, 0.0078662615, 0.06096353, 0.066863224, 0.08652888, 0.06882979, 0.017699089, 0.0058996966, 0.015732523, 0.02163222, 0.06489666, 0.023598786, 0.119960494, 0.2556535, 0.2556535, 0.033431612, 0, 0.0019665654, 0.011799393, 0.0039331308, 0.017699089, 0.2556535, 0.21828876, 0.070796356, 0, 0, 0.02163222, 0.017699089, 0.0019665654, 0.023598786, 0.0039331308, 0.19665655, 0.2556535, 0.055063833, 0.013765958, 0.0039331308, 0.011799393, 0.013765958, 0.017699089, 0.053097267, 0.2556535, 0.16322494, 0.009832827, 0, 0.0019665654, 0.035398178, 0.2556535, 0.2556535, 0.1651915, 0.017699089, 0, 0, 0.0039331308, 0.047197573, 0.21828876, 0.047197573, 0, 0.0019665654, 0.07276292, 0.047197573, 0.0039331308, 0.019665655, 0.023598786, 0.12192706, 0.06489666, 0.0058996966, 0, 0, 0, 0.0019665654, 0.0058996966, 0.031465046, 0.20845594, 0.055063833, 0, 0, 0, 0, 0.033431612, 0.090462014, 0.16715807, 0.019665655, 0, 0, 0.0019665654, 0.0078662615, 0.02163222, 0.0078662615, 0.0039331308, 0.0039331308, 0.017699089, 0.027531916, 0.015732523, 0.015732523]    3
9778    [0.08063698, 0, 0, 0.01376729, 0.0019667556, 0.0019667556, 0.039335113, 0.13177262, 0.0177008, 0, 0, 0, 0, 0.060969424, 0.23601067, 0.119972095, 0.049168892, 0, 0, 0, 0, 0.019667557, 0.23601067, 0.177008, 0.06293618, 0, 0, 0.0019667556, 0.025567824, 0.021634312, 0.043268625, 0.098337784, 0.007867022, 0, 0.003933511, 0.18290828, 0.078670226, 0.029501334, 0.07276996, 0.0354016, 0.023601068, 0.003933511, 0.003933511, 0.037368357, 0.015734045, 0.08653725, 0.23601067, 0.049168892, 0.23601067, 0.009833778, 0, 0, 0, 0.003933511, 0.09440427, 0.1907753, 0.20060907, 0.02753458, 0.005900267, 0.005900267, 0.021634312, 0.0177008, 0.06686969, 0.08063698, 0, 0, 0.007867022, 0.23601067, 0.11013832, 0.005900267, 0.007867022, 0.009833778, 0.011800534, 0.029501334, 0.07276996, 0.22814366, 0.05506916, 0, 0, 0.005900267, 0.23601067, 0.23601067, 0.047202136, 0.011800534, 0.003933511, 0, 0.0019667556, 0.05506916, 0.10423805, 0.177008, 0.10030454, 0.021634312, 0.021634312, 0.003933511, 0.023601068, 0.02753458, 0.015734045, 0.011800534, 0.007867022, 0.059002668, 0.0177008, 0.0019667556, 0.007867022, 0.043268625, 0.049168892, 0.15537369, 0.23601067, 0.12980588, 0.009833778, 0, 0, 0.011800534, 0.08260374, 0.23601067, 0.17897476, 0.08457049, 0.029501334, 0.003933511, 0.007867022, 0.076703474, 0.023601068, 0.0177008, 0.0177008, 0.023601068, 0.029501334, 0.009833778, 0.047202136, 0.0708032]    4
select * from vector_ip_01 order by  inner_product(b, normalize_l2('[41, 0, 0, 7, 1, 1, 20, 67, 9, 0, 0, 0, 0, 31, 120, 61, 25, 0, 0, 0, 0, 10, 120, 90, 32, 0, 0, 1, 13, 11, 22, 50, 4, 0, 2, 93, 40, 15, 37, 18, 12, 2, 2, 19, 8, 44, 120, 25, 120, 5, 0, 0, 0, 2, 48, 97, 102, 14, 3, 3, 11, 9, 34, 41, 0, 0, 4, 120, 56, 3, 4, 5, 6, 15, 37, 116, 28, 0, 0, 3, 120, 120, 24, 6, 2, 0, 1, 28, 53, 90, 51, 11, 11, 2, 12, 14, 8, 6, 4, 30, 9, 1, 4, 22, 25, 79, 120, 66, 5, 0, 0, 6, 42, 120, 91, 43, 15, 2, 4, 39, 12, 9, 9, 12, 15, 5, 24, 36]')) ASC LIMIT 2;
a    b    c
9778    [0.08063698, 0, 0, 0.01376729, 0.0019667556, 0.0019667556, 0.039335113, 0.13177262, 0.0177008, 0, 0, 0, 0, 0.060969424, 0.23601067, 0.119972095, 0.049168892, 0, 0, 0, 0, 0.019667557, 0.23601067, 0.177008, 0.06293618, 0, 0, 0.0019667556, 0.025567824, 0.021634312, 0.043268625, 0.098337784, 0.007867022, 0, 0.003933511, 0.18290828, 0.078670226, 0.029501334, 0.07276996, 0.0354016, 0.023601068, 0.003933511, 0.003933511, 0.037368357, 0.015734045, 0.08653725, 0.23601067, 0.049168892, 0.23601067, 0.009833778, 0, 0, 0, 0.003933511, 0.09440427, 0.1907753, 0.20060907, 0.02753458, 0.005900267, 0.005900267, 0.021634312, 0.0177008, 0.06686969, 0.08063698, 0, 0, 0.007867022, 0.23601067, 0.11013832, 0.005900267, 0.007867022, 0.009833778, 0.011800534, 0.029501334, 0.07276996, 0.22814366, 0.05506916, 0, 0, 0.005900267, 0.23601067, 0.23601067, 0.047202136, 0.011800534, 0.003933511, 0, 0.0019667556, 0.05506916, 0.10423805, 0.177008, 0.10030454, 0.021634312, 0.021634312, 0.003933511, 0.023601068, 0.02753458, 0.015734045, 0.011800534, 0.007867022, 0.059002668, 0.0177008, 0.0019667556, 0.007867022, 0.043268625, 0.049168892, 0.15537369, 0.23601067, 0.12980588, 0.009833778, 0, 0, 0.011800534, 0.08260374, 0.23601067, 0.17897476, 0.08457049, 0.029501334, 0.003933511, 0.007867022, 0.076703474, 0.023601068, 0.0177008, 0.0177008, 0.023601068, 0.029501334, 0.009833778, 0.047202136, 0.0708032]    4
9774    [0.0019665654, 0, 0.0019665654, 0.011799393, 0.011799393, 0.033431612, 0.09242858, 0.07669605, 0.0039331308, 0, 0.0019665654, 0.04916414, 0.053097267, 0.019665655, 0.110127665, 0.2556535, 0.035398178, 0.009832827, 0.0039331308, 0.011799393, 0.029498482, 0.0039331308, 0.037364744, 0.2556535, 0.08259575, 0.055063833, 0.0019665654, 0.0019665654, 0.0039331308, 0.0019665654, 0, 0.009832827, 0, 0.0039331308, 0.0078662615, 0.0078662615, 0.06096353, 0.066863224, 0.08652888, 0.06882979, 0.017699089, 0.0058996966, 0.015732523, 0.02163222, 0.06489666, 0.023598786, 0.119960494, 0.2556535, 0.2556535, 0.033431612, 0, 0.0019665654, 0.011799393, 0.0039331308, 0.017699089, 0.2556535, 0.21828876, 0.070796356, 0, 0, 0.02163222, 0.017699089, 0.0019665654, 0.023598786, 0.0039331308, 0.19665655, 0.2556535, 0.055063833, 0.013765958, 0.0039331308, 0.011799393, 0.013765958, 0.017699089, 0.053097267, 0.2556535, 0.16322494, 0.009832827, 0, 0.0019665654, 0.035398178, 0.2556535, 0.2556535, 0.1651915, 0.017699089, 0, 0, 0.0039331308, 0.047197573, 0.21828876, 0.047197573, 0, 0.0019665654, 0.07276292, 0.047197573, 0.0039331308, 0.019665655, 0.023598786, 0.12192706, 0.06489666, 0.0058996966, 0, 0, 0, 0.0019665654, 0.0058996966, 0.031465046, 0.20845594, 0.055063833, 0, 0, 0, 0, 0.033431612, 0.090462014, 0.16715807, 0.019665655, 0, 0, 0.0019665654, 0.0078662615, 0.02163222, 0.0078662615, 0.0039331308, 0.0039331308, 0.017699089, 0.027531916, 0.015732523, 0.015732523]    3
drop table vector_ip_01;
drop table if exists vector_cos_01;
create table vector_cos_01(a bigint primary key, b vecf32(128),c int,key c_k(c));
insert into vector_cos_01 values(9774 ,"[1, 0, 1, 6, 6, 17, 47, 39, 2, 0, 1, 25, 27, 10, 56, 130, 18, 5, 2, 6, 15, 2, 19, 130, 42, 28, 1, 1, 2, 1, 0, 5, 0, 2, 4, 4, 31, 34, 44, 35, 9, 3, 8, 11, 33, 12, 61, 130, 130, 17, 0, 1, 6, 2, 9, 130, 111, 36, 0, 0, 11, 9, 1, 12, 2, 100, 130, 28, 7, 2, 6, 7, 9, 27, 130, 83, 5, 0, 1, 18, 130, 130, 84, 9, 0, 0, 2, 24, 111, 24, 0, 1, 37, 24, 2, 10, 12, 62, 33, 3, 0, 0, 0, 1, 3, 16, 106, 28, 0, 0, 0, 0, 17, 46, 85, 10, 0, 0, 1, 4, 11, 4, 2, 2, 9, 14, 8, 8]",3),(9775,"[0, 1, 1, 3, 0, 3, 46, 20, 1, 4, 17, 9, 1, 17, 108, 15, 0, 3, 37, 17, 6, 15, 116, 16, 6, 1, 4, 7, 7, 7, 9, 6, 0, 8, 10, 4, 26, 129, 27, 9, 0, 0, 5, 2, 11, 129, 129, 12, 103, 4, 0, 0, 2, 31, 129, 129, 94, 4, 0, 0, 0, 3, 13, 42, 0, 15, 38, 2, 70, 129, 1, 0, 5, 10, 40, 12, 74, 129, 6, 1, 129, 39, 6, 1, 2, 22, 9, 33, 122, 13, 0, 0, 0, 0, 5, 23, 4, 11, 9, 12, 45, 38, 1, 0, 0, 4, 36, 38, 57, 32, 0, 0, 82, 22, 9, 5, 13, 11, 3, 94, 35, 3, 0, 0, 0, 1, 16, 97]",5),(9776,"[10, 3, 8, 5, 48, 26, 5, 16, 17, 0, 0, 2, 132, 53, 1, 16, 112, 6, 0, 0, 7, 2, 1, 48, 48, 15, 18, 31, 3, 0, 0, 9, 6, 10, 19, 27, 50, 46, 17, 9, 18, 1, 4, 48, 132, 23, 3, 5, 132, 9, 4, 3, 11, 0, 2, 46, 84, 12, 10, 10, 1, 0, 12, 76, 26, 22, 16, 26, 35, 15, 3, 16, 15, 1, 51, 132, 125, 8, 1, 2, 132, 51, 67, 91, 8, 0, 0, 30, 126, 39, 32, 38, 4, 0, 1, 12, 24, 2, 2, 2, 4, 7, 2, 19, 93, 19, 70, 92, 2, 3, 1, 21, 36, 58, 132, 94, 0, 0, 0, 0, 21, 25, 57, 48, 1, 0, 0, 1]",3);
insert into vector_cos_01 values(9777, "[16, 15, 0, 0, 5, 46, 5, 5, 4, 0, 0, 0, 28, 118, 12, 5, 75, 44, 5, 0, 6, 32, 6, 49, 41, 74, 9, 1, 0, 0, 0, 9, 1, 9, 16, 41, 71, 80, 3, 0, 0, 4, 3, 5, 51, 106, 11, 3, 112, 28, 13, 1, 4, 8, 3, 104, 118, 14, 1, 1, 0, 0, 0, 88, 3, 27, 46, 118, 108, 49, 2, 0, 1, 46, 118, 118, 27, 12, 0, 0, 33, 118, 118, 8, 0, 0, 0, 4, 118, 95, 40, 0, 0, 0, 1, 11, 27, 38, 12, 12, 18, 29, 3, 2, 13, 30, 94, 78, 30, 19, 9, 3, 31, 45, 70, 42, 15, 1, 3, 12, 14, 22, 16, 2, 3, 17, 24, 13]",4),(9778,"[41, 0, 0, 7, 1, 1, 20, 67, 9, 0, 0, 0, 0, 31, 120, 61, 25, 0, 0, 0, 0, 10, 120, 90, 32, 0, 0, 1, 13, 11, 22, 50, 4, 0, 2, 93, 40, 15, 37, 18, 12, 2, 2, 19, 8, 44, 120, 25, 120, 5, 0, 0, 0, 2, 48, 97, 102, 14, 3, 3, 11, 9, 34, 41, 0, 0, 4, 120, 56, 3, 4, 5, 6, 15, 37, 116, 28, 0, 0, 3, 120, 120, 24, 6, 2, 0, 1, 28, 53, 90, 51, 11, 11, 2, 12, 14, 8, 6, 4, 30, 9, 1, 4, 22, 25, 79, 120, 66, 5, 0, 0, 6, 42, 120, 91, 43, 15, 2, 4, 39, 12, 9, 9, 12, 15, 5, 24, 36]",4);
create index idx01 using hnsw on vector_cos_01(b) op_type "vector_cosine_ops";
show create table vector_cos_01;
Table    Create Table
vector_cos_01    CREATE TABLE `vector_cos_01` (\n  `a` bigint NOT NULL,\n  `b` vecf32(128) DEFAULT NULL,\n  `c` int DEFAULT NULL,\n  PRIMARY KEY (`a`),\n  KEY `c_k` (`c`),\n  KEY `idx01` USING hnsw (`b`) op_type 'vector_cosine_ops' \n)
desc vector_cos_01;
Field    Type    Null    Key    Default    Extra    Comment
a    BIGINT(64)    NO    PRI    null        
b    VECF32(128)    YES    MUL    null        
c    INT(32)    YES    MUL    null        
select * from vector_cos_01 order by  cosine_distance(b, "[16, 15, 0, 0, 5, 46, 5, 5, 4, 0, 0, 0, 28, 118, 12, 5, 75, 44, 5, 0, 6, 32, 6, 49, 41, 74, 9, 1, 0, 0, 0, 9, 1, 9, 16, 41, 71, 80, 3, 0, 0, 4, 3, 5, 51, 106, 11, 3, 112, 28, 13, 1, 4, 8, 3, 104, 118, 14, 1, 1, 0, 0, 0, 88, 3, 27, 46, 118, 108, 49, 2, 0, 1, 46, 118, 118, 27, 12, 0, 0, 33, 118, 118, 8, 0, 0, 0, 4, 118, 95, 40, 0, 0, 0, 1, 11, 27, 38, 12, 12, 18, 29, 3, 2, 13, 30, 94, 78, 30, 19, 9, 3, 31, 45, 70, 42, 15, 1, 3, 12, 14, 22, 16, 2, 3, 17, 24, 13]") ASC LIMIT 2;
a    b    c
9777    [16, 15, 0, 0, 5, 46, 5, 5, 4, 0, 0, 0, 28, 118, 12, 5, 75, 44, 5, 0, 6, 32, 6, 49, 41, 74, 9, 1, 0, 0, 0, 9, 1, 9, 16, 41, 71, 80, 3, 0, 0, 4, 3, 5, 51, 106, 11, 3, 112, 28, 13, 1, 4, 8, 3, 104, 118, 14, 1, 1, 0, 0, 0, 88, 3, 27, 46, 118, 108, 49, 2, 0, 1, 46, 118, 118, 27, 12, 0, 0, 33, 118, 118, 8, 0, 0, 0, 4, 118, 95, 40, 0, 0, 0, 1, 11, 27, 38, 12, 12, 18, 29, 3, 2, 13, 30, 94, 78, 30, 19, 9, 3, 31, 45, 70, 42, 15, 1, 3, 12, 14, 22, 16, 2, 3, 17, 24, 13]    4
9776    [10, 3, 8, 5, 48, 26, 5, 16, 17, 0, 0, 2, 132, 53, 1, 16, 112, 6, 0, 0, 7, 2, 1, 48, 48, 15, 18, 31, 3, 0, 0, 9, 6, 10, 19, 27, 50, 46, 17, 9, 18, 1, 4, 48, 132, 23, 3, 5, 132, 9, 4, 3, 11, 0, 2, 46, 84, 12, 10, 10, 1, 0, 12, 76, 26, 22, 16, 26, 35, 15, 3, 16, 15, 1, 51, 132, 125, 8, 1, 2, 132, 51, 67, 91, 8, 0, 0, 30, 126, 39, 32, 38, 4, 0, 1, 12, 24, 2, 2, 2, 4, 7, 2, 19, 93, 19, 70, 92, 2, 3, 1, 21, 36, 58, 132, 94, 0, 0, 0, 0, 21, 25, 57, 48, 1, 0, 0, 1]    3
select * from vector_cos_01 order by  cosine_distance(b, "[1, 15, 15, 0, 5, 7, 5, 5, 4, 0, 0, 0, 28, 1, 12, 5, 75, 20, 5, 0, 6, 32, 6, 49, 41, 74, 9, 1, 0, 0, 0, 9, 1, 9, 16, 41, 71, 80, 3, 0, 0, 4, 3, 5, 51, 106, 11, 3, 112, 28, 13, 1, 4, 8, 3, 104, 118, 14, 1, 1, 0, 0, 0, 88, 3, 27, 46, 118, 108, 49, 2, 0, 1, 46, 118, 118, 27, 12, 0, 0, 33, 118, 118, 8, 0, 0, 0, 4, 118, 95, 40, 0, 0, 0, 1, 11, 27, 38, 12, 12, 18, 29, 3, 2, 13, 30, 94, 78, 30, 19, 9, 3, 31, 45, 70, 42, 15, 1, 3, 12, 14, 22, 16, 2, 3, 17, 24, 13]") ASC LIMIT 2;
a    b    c
9777    [16, 15, 0, 0, 5, 46, 5, 5, 4, 0, 0, 0, 28, 118, 12, 5, 75, 44, 5, 0, 6, 32, 6, 49, 41, 74, 9, 1, 0, 0, 0, 9, 1, 9, 16, 41, 71, 80, 3, 0, 0, 4, 3, 5, 51, 106, 11, 3, 112, 28, 13, 1, 4, 8, 3, 104, 118, 14, 1, 1, 0, 0, 0, 88, 3, 27, 46, 118, 108, 49, 2, 0, 1, 46, 118, 118, 27, 12, 0, 0, 33, 118, 118, 8, 0, 0, 0, 4, 118, 95, 40, 0, 0, 0, 1, 11, 27, 38, 12, 12, 18, 29, 3, 2, 13, 30, 94, 78, 30, 19, 9, 3, 31, 45, 70, 42, 15, 1, 3, 12, 14, 22, 16, 2, 3, 17, 24, 13]    4
9776    [10, 3, 8, 5, 48, 26, 5, 16, 17, 0, 0, 2, 132, 53, 1, 16, 112, 6, 0, 0, 7, 2, 1, 48, 48, 15, 18, 31, 3, 0, 0, 9, 6, 10, 19, 27, 50, 46, 17, 9, 18, 1, 4, 48, 132, 23, 3, 5, 132, 9, 4, 3, 11, 0, 2, 46, 84, 12, 10, 10, 1, 0, 12, 76, 26, 22, 16, 26, 35, 15, 3, 16, 15, 1, 51, 132, 125, 8, 1, 2, 132, 51, 67, 91, 8, 0, 0, 30, 126, 39, 32, 38, 4, 0, 1, 12, 24, 2, 2, 2, 4, 7, 2, 19, 93, 19, 70, 92, 2, 3, 1, 21, 36, 58, 132, 94, 0, 0, 0, 0, 21, 25, 57, 48, 1, 0, 0, 1]    3
drop table vector_cos_01;
SET experimental_hnsw_index = 0;
