create table vector_index_01(a int primary key, b vecf32(128),c int,key c_k(c));
create index idx01 using ivfflat on vector_index_01(b) lists=5 op_type "vector_l2_ops";
insert into vector_index_01 values(9774 ,"[1, 0, 1, 6, 6, 17, 47, 39, 2, 0, 1, 25, 27, 10, 56, 130, 18, 5, 2, 6, 15, 2, 19, 130, 42, 28, 1, 1, 2, 1, 0, 5, 0, 2, 4, 4, 31, 34, 44, 35, 9, 3, 8, 11, 33, 12, 61, 130, 130, 17, 0, 1, 6, 2, 9, 130, 111, 36, 0, 0, 11, 9, 1, 12, 2, 100, 130, 28, 7, 2, 6, 7, 9, 27, 130, 83, 5, 0, 1, 18, 130, 130, 84, 9, 0, 0, 2, 24, 111, 24, 0, 1, 37, 24, 2, 10, 12, 62, 33, 3, 0, 0, 0, 1, 3, 16, 106, 28, 0, 0, 0, 0, 17, 46, 85, 10, 0, 0, 1, 4, 11, 4, 2, 2, 9, 14, 8, 8]",3),(9775,"[0, 1, 1, 3, 0, 3, 46, 20, 1, 4, 17, 9, 1, 17, 108, 15, 0, 3, 37, 17, 6, 15, 116, 16, 6, 1, 4, 7, 7, 7, 9, 6, 0, 8, 10, 4, 26, 129, 27, 9, 0, 0, 5, 2, 11, 129, 129, 12, 103, 4, 0, 0, 2, 31, 129, 129, 94, 4, 0, 0, 0, 3, 13, 42, 0, 15, 38, 2, 70, 129, 1, 0, 5, 10, 40, 12, 74, 129, 6, 1, 129, 39, 6, 1, 2, 22, 9, 33, 122, 13, 0, 0, 0, 0, 5, 23, 4, 11, 9, 12, 45, 38, 1, 0, 0, 4, 36, 38, 57, 32, 0, 0, 82, 22, 9, 5, 13, 11, 3, 94, 35, 3, 0, 0, 0, 1, 16, 97]",5),(9776,"[10, 3, 8, 5, 48, 26, 5, 16, 17, 0, 0, 2, 132, 53, 1, 16, 112, 6, 0, 0, 7, 2, 1, 48, 48, 15, 18, 31, 3, 0, 0, 9, 6, 10, 19, 27, 50, 46, 17, 9, 18, 1, 4, 48, 132, 23, 3, 5, 132, 9, 4, 3, 11, 0, 2, 46, 84, 12, 10, 10, 1, 0, 12, 76, 26, 22, 16, 26, 35, 15, 3, 16, 15, 1, 51, 132, 125, 8, 1, 2, 132, 51, 67, 91, 8, 0, 0, 30, 126, 39, 32, 38, 4, 0, 1, 12, 24, 2, 2, 2, 4, 7, 2, 19, 93, 19, 70, 92, 2, 3, 1, 21, 36, 58, 132, 94, 0, 0, 0, 0, 21, 25, 57, 48, 1, 0, 0, 1]",3);
insert into vector_index_01 values(9777, " [16, 15, 0, 0, 5, 46, 5, 5, 4, 0, 0, 0, 28, 118, 12, 5, 75, 44, 5, 0, 6, 32, 6, 49, 41, 74, 9, 1, 0, 0, 0, 9, 1, 9, 16, 41, 71, 80, 3, 0, 0, 4, 3, 5, 51, 106, 11, 3, 112, 28, 13, 1, 4, 8, 3, 104, 118, 14, 1, 1, 0, 0, 0, 88, 3, 27, 46, 118, 108, 49, 2, 0, 1, 46, 118, 118, 27, 12, 0, 0, 33, 118, 118, 8, 0, 0, 0, 4, 118, 95, 40, 0, 0, 0, 1, 11, 27, 38, 12, 12, 18, 29, 3, 2, 13, 30, 94, 78, 30, 19, 9, 3, 31, 45, 70, 42, 15, 1, 3, 12, 14, 22, 16, 2, 3, 17, 24, 13]",4),(9778,"[41, 0, 0, 7, 1, 1, 20, 67, 9, 0, 0, 0, 0, 31, 120, 61, 25, 0, 0, 0, 0, 10, 120, 90, 32, 0, 0, 1, 13, 11, 22, 50, 4, 0, 2, 93, 40, 15, 37, 18, 12, 2, 2, 19, 8, 44, 120, 25, 120, 5, 0, 0, 0, 2, 48, 97, 102, 14, 3, 3, 11, 9, 34, 41, 0, 0, 4, 120, 56, 3, 4, 5, 6, 15, 37, 116, 28, 0, 0, 3, 120, 120, 24, 6, 2, 0, 1, 28, 53, 90, 51, 11, 11, 2, 12, 14, 8, 6, 4, 30, 9, 1, 4, 22, 25, 79, 120, 66, 5, 0, 0, 6, 42, 120, 91, 43, 15, 2, 4, 39, 12, 9, 9, 12, 15, 5, 24, 36]",4);
show create table vector_index_01;
Table    Create Table
vector_index_01    CREATE TABLE `vector_index_01` (\n`a` INT NOT NULL,\n`b` VECF32(128) DEFAULT NULL,\n`c` INT DEFAULT NULL,\nPRIMARY KEY (`a`),\nKEY `c_k` (`c`),\nKEY `idx01` USING ivfflat (`b`) lists = 5  op_type 'vector_l2_ops' \n)
desc vector_index_01;
Field    Type    Null    Key    Default    Extra    Comment
a    INT(32)    NO    PRI    null        
b    VECF32(128)    YES    MUL    null        
c    INT(32)    YES    MUL    null        
select * from vector_index_01 order by  L2_DISTANCE(b, "[16, 15, 0, 0, 5, 46, 5, 5, 4, 0, 0, 0, 28, 118, 12, 5, 75, 44, 5, 0, 6, 32, 6, 49, 41, 74, 9, 1, 0, 0, 0, 9, 1, 9, 16, 41, 71, 80, 3, 0, 0, 4, 3, 5, 51, 106, 11, 3, 112, 28, 13, 1, 4, 8, 3, 104, 118, 14, 1, 1, 0, 0, 0, 88, 3, 27, 46, 118, 108, 49, 2, 0, 1, 46, 118, 118, 27, 12, 0, 0, 33, 118, 118, 8, 0, 0, 0, 4, 118, 95, 40, 0, 0, 0, 1, 11, 27, 38, 12, 12, 18, 29, 3, 2, 13, 30, 94, 78, 30, 19, 9, 3, 31, 45, 70, 42, 15, 1, 3, 12, 14, 22, 16, 2, 3, 17, 24, 13]") ASC LIMIT 2;
a    b    c
9777    [16, 15, 0, 0, 5, 46, 5, 5, 4, 0, 0, 0, 28, 118, 12, 5, 75, 44, 5, 0, 6, 32, 6, 49, 41, 74, 9, 1, 0, 0, 0, 9, 1, 9, 16, 41, 71, 80, 3, 0, 0, 4, 3, 5, 51, 106, 11, 3, 112, 28, 13, 1, 4, 8, 3, 104, 118, 14, 1, 1, 0, 0, 0, 88, 3, 27, 46, 118, 108, 49, 2, 0, 1, 46, 118, 118, 27, 12, 0, 0, 33, 118, 118, 8, 0, 0, 0, 4, 118, 95, 40, 0, 0, 0, 1, 11, 27, 38, 12, 12, 18, 29, 3, 2, 13, 30, 94, 78, 30, 19, 9, 3, 31, 45, 70, 42, 15, 1, 3, 12, 14, 22, 16, 2, 3, 17, 24, 13]    4
9776    [10, 3, 8, 5, 48, 26, 5, 16, 17, 0, 0, 2, 132, 53, 1, 16, 112, 6, 0, 0, 7, 2, 1, 48, 48, 15, 18, 31, 3, 0, 0, 9, 6, 10, 19, 27, 50, 46, 17, 9, 18, 1, 4, 48, 132, 23, 3, 5, 132, 9, 4, 3, 11, 0, 2, 46, 84, 12, 10, 10, 1, 0, 12, 76, 26, 22, 16, 26, 35, 15, 3, 16, 15, 1, 51, 132, 125, 8, 1, 2, 132, 51, 67, 91, 8, 0, 0, 30, 126, 39, 32, 38, 4, 0, 1, 12, 24, 2, 2, 2, 4, 7, 2, 19, 93, 19, 70, 92, 2, 3, 1, 21, 36, 58, 132, 94, 0, 0, 0, 0, 21, 25, 57, 48, 1, 0, 0, 1]    3
select * from vector_index_01 where a>9774 order by  L2_DISTANCE(b, "[4, 6, 1, 42, 119, 4, 1, 0, 9, 96, 58, 2, 14, 0, 0, 0, 0, 57, 119, 24, 15, 2, 0, 0, 0, 0, 48, 26, 26, 7, 0, 0, 66, 21, 0, 4, 107, 92, 42, 7, 119, 119, 45, 2, 21, 18, 0, 9, 0, 39, 67, 43, 101, 66, 0, 0, 0, 3, 38, 75, 76, 17, 0, 0, 89, 0, 0, 0, 6, 26, 21, 20, 119, 1, 0, 0, 10, 43, 72, 92, 2, 8, 22, 25, 22, 46, 119, 60, 1, 13, 45, 48, 75, 69, 45, 15, 13, 0, 0, 2, 6, 0, 1, 11, 24, 0, 0, 0, 0, 24, 92, 49, 0, 0, 0, 0, 0, 18, 119, 40, 0, 0, 0, 0, 4, 47, 81, 10]") desc limit 2;
a    b    c
9778    [41, 0, 0, 7, 1, 1, 20, 67, 9, 0, 0, 0, 0, 31, 120, 61, 25, 0, 0, 0, 0, 10, 120, 90, 32, 0, 0, 1, 13, 11, 22, 50, 4, 0, 2, 93, 40, 15, 37, 18, 12, 2, 2, 19, 8, 44, 120, 25, 120, 5, 0, 0, 0, 2, 48, 97, 102, 14, 3, 3, 11, 9, 34, 41, 0, 0, 4, 120, 56, 3, 4, 5, 6, 15, 37, 116, 28, 0, 0, 3, 120, 120, 24, 6, 2, 0, 1, 28, 53, 90, 51, 11, 11, 2, 12, 14, 8, 6, 4, 30, 9, 1, 4, 22, 25, 79, 120, 66, 5, 0, 0, 6, 42, 120, 91, 43, 15, 2, 4, 39, 12, 9, 9, 12, 15, 5, 24, 36]    4
9777    [16, 15, 0, 0, 5, 46, 5, 5, 4, 0, 0, 0, 28, 118, 12, 5, 75, 44, 5, 0, 6, 32, 6, 49, 41, 74, 9, 1, 0, 0, 0, 9, 1, 9, 16, 41, 71, 80, 3, 0, 0, 4, 3, 5, 51, 106, 11, 3, 112, 28, 13, 1, 4, 8, 3, 104, 118, 14, 1, 1, 0, 0, 0, 88, 3, 27, 46, 118, 108, 49, 2, 0, 1, 46, 118, 118, 27, 12, 0, 0, 33, 118, 118, 8, 0, 0, 0, 4, 118, 95, 40, 0, 0, 0, 1, 11, 27, 38, 12, 12, 18, 29, 3, 2, 13, 30, 94, 78, 30, 19, 9, 3, 31, 45, 70, 42, 15, 1, 3, 12, 14, 22, 16, 2, 3, 17, 24, 13]    4
create table vector_index_02(a int primary key, b vecf32(128),c int,key c_k(c));
insert into vector_index_02 values(9774 ,"[1, 0, 1, 6, 6, 17, 47, 39, 2, 0, 1, 25, 27, 10, 56, 130, 18, 5, 2, 6, 15, 2, 19, 130, 42, 28, 1, 1, 2, 1, 0, 5, 0, 2, 4, 4, 31, 34, 44, 35, 9, 3, 8, 11, 33, 12, 61, 130, 130, 17, 0, 1, 6, 2, 9, 130, 111, 36, 0, 0, 11, 9, 1, 12, 2, 100, 130, 28, 7, 2, 6, 7, 9, 27, 130, 83, 5, 0, 1, 18, 130, 130, 84, 9, 0, 0, 2, 24, 111, 24, 0, 1, 37, 24, 2, 10, 12, 62, 33, 3, 0, 0, 0, 1, 3, 16, 106, 28, 0, 0, 0, 0, 17, 46, 85, 10, 0, 0, 1, 4, 11, 4, 2, 2, 9, 14, 8, 8]",3),(9775,"[0, 1, 1, 3, 0, 3, 46, 20, 1, 4, 17, 9, 1, 17, 108, 15, 0, 3, 37, 17, 6, 15, 116, 16, 6, 1, 4, 7, 7, 7, 9, 6, 0, 8, 10, 4, 26, 129, 27, 9, 0, 0, 5, 2, 11, 129, 129, 12, 103, 4, 0, 0, 2, 31, 129, 129, 94, 4, 0, 0, 0, 3, 13, 42, 0, 15, 38, 2, 70, 129, 1, 0, 5, 10, 40, 12, 74, 129, 6, 1, 129, 39, 6, 1, 2, 22, 9, 33, 122, 13, 0, 0, 0, 0, 5, 23, 4, 11, 9, 12, 45, 38, 1, 0, 0, 4, 36, 38, 57, 32, 0, 0, 82, 22, 9, 5, 13, 11, 3, 94, 35, 3, 0, 0, 0, 1, 16, 97]",5),(9776,"[10, 3, 8, 5, 48, 26, 5, 16, 17, 0, 0, 2, 132, 53, 1, 16, 112, 6, 0, 0, 7, 2, 1, 48, 48, 15, 18, 31, 3, 0, 0, 9, 6, 10, 19, 27, 50, 46, 17, 9, 18, 1, 4, 48, 132, 23, 3, 5, 132, 9, 4, 3, 11, 0, 2, 46, 84, 12, 10, 10, 1, 0, 12, 76, 26, 22, 16, 26, 35, 15, 3, 16, 15, 1, 51, 132, 125, 8, 1, 2, 132, 51, 67, 91, 8, 0, 0, 30, 126, 39, 32, 38, 4, 0, 1, 12, 24, 2, 2, 2, 4, 7, 2, 19, 93, 19, 70, 92, 2, 3, 1, 21, 36, 58, 132, 94, 0, 0, 0, 0, 21, 25, 57, 48, 1, 0, 0, 1]",3);
insert into vector_index_02 values(9777, "[16, 15, 0, 0, 5, 46, 5, 5, 4, 0, 0, 0, 28, 118, 12, 5, 75, 44, 5, 0, 6, 32, 6, 49, 41, 74, 9, 1, 0, 0, 0, 9, 1, 9, 16, 41, 71, 80, 3, 0, 0, 4, 3, 5, 51, 106, 11, 3, 112, 28, 13, 1, 4, 8, 3, 104, 118, 14, 1, 1, 0, 0, 0, 88, 3, 27, 46, 118, 108, 49, 2, 0, 1, 46, 118, 118, 27, 12, 0, 0, 33, 118, 118, 8, 0, 0, 0, 4, 118, 95, 40, 0, 0, 0, 1, 11, 27, 38, 12, 12, 18, 29, 3, 2, 13, 30, 94, 78, 30, 19, 9, 3, 31, 45, 70, 42, 15, 1, 3, 12, 14, 22, 16, 2, 3, 17, 24, 13]",4),(9778,"[41, 0, 0, 7, 1, 1, 20, 67, 9, 0, 0, 0, 0, 31, 120, 61, 25, 0, 0, 0, 0, 10, 120, 90, 32, 0, 0, 1, 13, 11, 22, 50, 4, 0, 2, 93, 40, 15, 37, 18, 12, 2, 2, 19, 8, 44, 120, 25, 120, 5, 0, 0, 0, 2, 48, 97, 102, 14, 3, 3, 11, 9, 34, 41, 0, 0, 4, 120, 56, 3, 4, 5, 6, 15, 37, 116, 28, 0, 0, 3, 120, 120, 24, 6, 2, 0, 1, 28, 53, 90, 51, 11, 11, 2, 12, 14, 8, 6, 4, 30, 9, 1, 4, 22, 25, 79, 120, 66, 5, 0, 0, 6, 42, 120, 91, 43, 15, 2, 4, 39, 12, 9, 9, 12, 15, 5, 24, 36]",4);
create index idx01 using ivfflat on vector_index_02(b) lists=5 op_type "vector_l2_ops";
show create table vector_index_02;
Table    Create Table
vector_index_02    CREATE TABLE `vector_index_02` (\n`a` INT NOT NULL,\n`b` VECF32(128) DEFAULT NULL,\n`c` INT DEFAULT NULL,\nPRIMARY KEY (`a`),\nKEY `c_k` (`c`),\nKEY `idx01` USING ivfflat (`b`) lists = 5  op_type 'vector_l2_ops' \n)
desc vector_index_02;
Field    Type    Null    Key    Default    Extra    Comment
a    INT(32)    NO    PRI    null        
b    VECF32(128)    YES    MUL    null        
c    INT(32)    YES    MUL    null        
select * from vector_index_02 order by  L2_DISTANCE(b, "[16, 15, 0, 0, 5, 46, 5, 5, 4, 0, 0, 0, 28, 118, 12, 5, 75, 44, 5, 0, 6, 32, 6, 49, 41, 74, 9, 1, 0, 0, 0, 9, 1, 9, 16, 41, 71, 80, 3, 0, 0, 4, 3, 5, 51, 106, 11, 3, 112, 28, 13, 1, 4, 8, 3, 104, 118, 14, 1, 1, 0, 0, 0, 88, 3, 27, 46, 118, 108, 49, 2, 0, 1, 46, 118, 118, 27, 12, 0, 0, 33, 118, 118, 8, 0, 0, 0, 4, 118, 95, 40, 0, 0, 0, 1, 11, 27, 38, 12, 12, 18, 29, 3, 2, 13, 30, 94, 78, 30, 19, 9, 3, 31, 45, 70, 42, 15, 1, 3, 12, 14, 22, 16, 2, 3, 17, 24, 13]") ASC LIMIT 2;
a    b    c
9777    [16, 15, 0, 0, 5, 46, 5, 5, 4, 0, 0, 0, 28, 118, 12, 5, 75, 44, 5, 0, 6, 32, 6, 49, 41, 74, 9, 1, 0, 0, 0, 9, 1, 9, 16, 41, 71, 80, 3, 0, 0, 4, 3, 5, 51, 106, 11, 3, 112, 28, 13, 1, 4, 8, 3, 104, 118, 14, 1, 1, 0, 0, 0, 88, 3, 27, 46, 118, 108, 49, 2, 0, 1, 46, 118, 118, 27, 12, 0, 0, 33, 118, 118, 8, 0, 0, 0, 4, 118, 95, 40, 0, 0, 0, 1, 11, 27, 38, 12, 12, 18, 29, 3, 2, 13, 30, 94, 78, 30, 19, 9, 3, 31, 45, 70, 42, 15, 1, 3, 12, 14, 22, 16, 2, 3, 17, 24, 13]    4
select * from vector_index_02 order by  L2_DISTANCE(b, "[1, 15, 15, 0, 5, 7, 5, 5, 4, 0, 0, 0, 28, 1, 12, 5, 75, 20, 5, 0, 6, 32, 6, 49, 41, 74, 9, 1, 0, 0, 0, 9, 1, 9, 16, 41, 71, 80, 3, 0, 0, 4, 3, 5, 51, 106, 11, 3, 112, 28, 13, 1, 4, 8, 3, 104, 118, 14, 1, 1, 0, 0, 0, 88, 3, 27, 46, 118, 108, 49, 2, 0, 1, 46, 118, 118, 27, 12, 0, 0, 33, 118, 118, 8, 0, 0, 0, 4, 118, 95, 40, 0, 0, 0, 1, 11, 27, 38, 12, 12, 18, 29, 3, 2, 13, 30, 94, 78, 30, 19, 9, 3, 31, 45, 70, 42, 15, 1, 3, 12, 14, 22, 16, 2, 3, 17, 24, 13]") ASC LIMIT 2;
a    b    c
9777    [16, 15, 0, 0, 5, 46, 5, 5, 4, 0, 0, 0, 28, 118, 12, 5, 75, 44, 5, 0, 6, 32, 6, 49, 41, 74, 9, 1, 0, 0, 0, 9, 1, 9, 16, 41, 71, 80, 3, 0, 0, 4, 3, 5, 51, 106, 11, 3, 112, 28, 13, 1, 4, 8, 3, 104, 118, 14, 1, 1, 0, 0, 0, 88, 3, 27, 46, 118, 108, 49, 2, 0, 1, 46, 118, 118, 27, 12, 0, 0, 33, 118, 118, 8, 0, 0, 0, 4, 118, 95, 40, 0, 0, 0, 1, 11, 27, 38, 12, 12, 18, 29, 3, 2, 13, 30, 94, 78, 30, 19, 9, 3, 31, 45, 70, 42, 15, 1, 3, 12, 14, 22, 16, 2, 3, 17, 24, 13]    4
create index idx01 using ivfflat on vector_index_02(b) lists=5 op_type "vector_l2_ops";
duplicate key name 'idx01'
create index idx01 using ivfflat on vector_index_03(b) lists=5 op_type "vector_l2_ops";
no such table vector_index.vector_index_03
create table vector_index_03(a int primary key, b vecf32(3));
insert into vector_index_03 values(1,"[56,23,6]"),(2,"[77,45,3]"),(3,"[8,56,3]");
create index add using ivfflat on vector_index_03(b) lists=5 op_type "vector_l2_ops";
SQL parser error: You have an error in your SQL syntax; check the manual that corresponds to your MatrixOne server version for the right syntax to use. syntax error at line 1 column 16 near " add using ivfflat on vector_index_03(b) lists=5 op_type "vector_l2_ops";";
create index `add` using ivfflat on vector_index_03(b) lists=5 op_type "vector_l2_ops";
show create table vector_index_03;
Table    Create Table
vector_index_03    CREATE TABLE `vector_index_03` (\n`a` INT NOT NULL,\n`b` VECF32(3) DEFAULT NULL,\nPRIMARY KEY (`a`),\nKEY `add` USING ivfflat (`b`) lists = 5  op_type 'vector_l2_ops' \n)
create index idx02 using ivf on vector_index_03(b) lists=5 op_type "vector_l2_ops";
SQL parser error: You have an error in your SQL syntax; check the manual that corresponds to your MatrixOne server version for the right syntax to use. syntax error at line 1 column 28 near " ivf on vector_index_03(b) lists=5 op_type "vector_l2_ops";";
create index idx02 using ivfflat on vector_index_03(a) lists=5 op_type "vector_l2_ops";
not supported: IVFFLAT only supports VECFXX column types
create index idx02 using ivfflat on vector_index_03(c) lists=5 op_type "vector_l2_ops";
invalid input: column 'c' is not exist
create index idx02 using ivfflat on vector_index_03(b)  op_type "vector_l2_ops";
create index idx02 using ivfflat on vector_index_03(b) lists=0 op_type "vector_l2_ops";
SQL parser error: You have an error in your SQL syntax; check the manual that corresponds to your MatrixOne server version for the right syntax to use. LISTS should be greater than 0 at line 1 column 62 near "0 op_type "vector_l2_ops";";
create index idx02 using ivfflat on vector_index_03(b) lists=1 ;
duplicate key name 'idx02'
create index idx03 using ivfflat on vector_index_03(b) lists=3 op_type "vector_l2";
internal error: invalid op_type. not of type 'vector_l2_ops'
create table vector_index_04(a int primary key, b vecf32(3),c vecf32(4));
insert into vector_index_04 values(1,"[56,23,6]","[0.25,0.14,0.88,0.0001]"),(2,"[77,45,3]","[1.25,5.25,8.699,4.25]"),(3,"[8,56,3]","[9.66,5.22,1.22,7.02]");
create index idx01 using ivfflat on vector_index_04(c) lists=5 op_type "vector_l2_ops";
create index idx02 using ivfflat on vector_index_04(c) lists=4 op_type "vector_l2_ops";
show create table vector_index_04;
Table    Create Table
vector_index_04    CREATE TABLE `vector_index_04` (\n`a` INT NOT NULL,\n`b` VECF32(3) DEFAULT NULL,\n`c` VECF32(4) DEFAULT NULL,\nPRIMARY KEY (`a`),\nKEY `idx01` USING ivfflat (`c`) lists = 5  op_type 'vector_l2_ops' ,\nKEY `idx02` USING ivfflat (`c`) lists = 4  op_type 'vector_l2_ops' \n)
desc vector_index_04;
Field    Type    Null    Key    Default    Extra    Comment
a    INT(32)    NO    PRI    null        
b    VECF32(3)    YES        null        
c    VECF32(4)    YES    MUL    null        
insert into vector_index_04 values(4,"[156,213,61]","[10.25,0.14,0.88,10.0001]"),(5,"[177,425,30]","[11.25,51.25,80.699,44.25]"),(6,"[80,56,3]","[90.686,5.212,19.22,7.02]");
insert into vector_index_04 values(7,"[5.6,2.13,6.1]","[1.25,8.14,4.88,18.0001]"),(8,"[17.7,4.25,3.0]","[1.215,5.25,8.9,47.25]"),(9,"[8,5.6,13]","[9.6,57.22,19.2,78.02]");
alter table vector_index_04 alter reindex idx ivfflat lists=8;
internal error: Can't REINDEX 'idx'; check that column/key exists
alter table vector_index_04 alter reindex idx01 ivfflat lists=8;
show create table vector_index_04;
Table    Create Table
vector_index_04    CREATE TABLE `vector_index_04` (\n`a` INT NOT NULL,\n`b` VECF32(3) DEFAULT NULL,\n`c` VECF32(4) DEFAULT NULL,\nPRIMARY KEY (`a`),\nKEY `idx01` USING ivfflat (`c`) lists = 8  op_type 'vector_l2_ops' ,\nKEY `idx02` USING ivfflat (`c`) lists = 4  op_type 'vector_l2_ops' \n)
desc vector_index_04;
Field    Type    Null    Key    Default    Extra    Comment
a    INT(32)    NO    PRI    null        
b    VECF32(3)    YES        null        
c    VECF32(4)    YES    MUL    null        
SET @probe_limit = 3;
select * from vector_index_04 order by L2_DISTANCE(c,"[9.6,57.22,19.2,78.02]") limit 3;
a    b    c
9    [8, 5.6, 13]    [9.6, 57.22, 19.2, 78.02]
8    [17.7, 4.25, 3]    [1.215, 5.25, 8.9, 47.25]
9    [8, 5.6, 13]    [9.6, 57.22, 19.2, 78.02]
SET @probe_limit = 1;
alter table vector_index_04 alter reindex idx01 ivfflat lists=3;
create table vector_index_05(a int primary key, b vecf32(3),c vecf32(4));
create index idx01 using ivfflat on vector_index_05(c) lists=4 op_type "vector_l2_ops";
show create table vector_index_05;
Table    Create Table
vector_index_05    CREATE TABLE `vector_index_05` (\n`a` INT NOT NULL,\n`b` VECF32(3) DEFAULT NULL,\n`c` VECF32(4) DEFAULT NULL,\nPRIMARY KEY (`a`),\nKEY `idx01` USING ivfflat (`c`) lists = 4  op_type 'vector_l2_ops' \n)
alter table vector_index_05 alter reindex idx01 ivfflat lists=3;
show create table vector_index_05;
Table    Create Table
vector_index_05    CREATE TABLE `vector_index_05` (\n`a` INT NOT NULL,\n`b` VECF32(3) DEFAULT NULL,\n`c` VECF32(4) DEFAULT NULL,\nPRIMARY KEY (`a`),\nKEY `idx01` USING ivfflat (`c`) lists = 3  op_type 'vector_l2_ops' \n)
create table vector_index_06(a int primary key, b vecf32(3),c vecf32(4));
insert into vector_index_06 values(4,"[156,213,61]","[10.25,0.14,0.88,10.0001]"),(5,"[177,425,30]","[11.25,51.25,80.699,44.25]"),(6,"[80,56,3]","[90.686,5.212,19.22,7.02]");
alter table vector_index_06 alter reindex idx01 ivfflat lists=3;
internal error: Can't REINDEX 'idx01'; check that column/key exists
create index idx01 using ivfflat on vector_index_06(c) lists=4 op_type "vector_l2_ops";
alter table vector_index_06 alter reindex idx ivfflat lists=3;
internal error: Can't REINDEX 'idx'; check that column/key exists
alter table vector_index_07 alter reindex idx01 ivfflat lists=3;
no such table vector_index.vector_index_07
alter table vector_index_06 alter rindex idx01 ivfflat lists=3;
SQL parser error: You have an error in your SQL syntax; check the manual that corresponds to your MatrixOne server version for the right syntax to use. syntax error at line 1 column 46 near " idx01 ivfflat lists=3;";
alter table vector_index_06 alter reindex idx01 ivfflat;
SQL parser error: You have an error in your SQL syntax; check the manual that corresponds to your MatrixOne server version for the right syntax to use. syntax error at line 1 column 56 near ";";
alter table vector_index_06 alter reindex idx01 lists=3;
SQL parser error: You have an error in your SQL syntax; check the manual that corresponds to your MatrixOne server version for the right syntax to use. syntax error at line 1 column 53 near " lists=3;";
alter table vector_index_06 alter reindex idx01 flat lists=3;
SQL parser error: You have an error in your SQL syntax; check the manual that corresponds to your MatrixOne server version for the right syntax to use. syntax error at line 1 column 52 near " flat lists=3;";
create table vector_index_07(a int primary key, b vecf32(128),c int,key c_k(c));
insert into vector_index_07 values(9774 ,"[1, 0, 1, 6, 6, 17, 47, 39, 2, 0, 1, 25, 27, 10, 56, 130, 18, 5, 2, 6, 15, 2, 19, 130, 42, 28, 1, 1, 2, 1, 0, 5, 0, 2, 4, 4, 31, 34, 44, 35, 9, 3, 8, 11, 33, 12, 61, 130, 130, 17, 0, 1, 6, 2, 9, 130, 111, 36, 0, 0, 11, 9, 1, 12, 2, 100, 130, 28, 7, 2, 6, 7, 9, 27, 130, 83, 5, 0, 1, 18, 130, 130, 84, 9, 0, 0, 2, 24, 111, 24, 0, 1, 37, 24, 2, 10, 12, 62, 33, 3, 0, 0, 0, 1, 3, 16, 106, 28, 0, 0, 0, 0, 17, 46, 85, 10, 0, 0, 1, 4, 11, 4, 2, 2, 9, 14, 8, 8]",3),(9775,"[0, 1, 1, 3, 0, 3, 46, 20, 1, 4, 17, 9, 1, 17, 108, 15, 0, 3, 37, 17, 6, 15, 116, 16, 6, 1, 4, 7, 7, 7, 9, 6, 0, 8, 10, 4, 26, 129, 27, 9, 0, 0, 5, 2, 11, 129, 129, 12, 103, 4, 0, 0, 2, 31, 129, 129, 94, 4, 0, 0, 0, 3, 13, 42, 0, 15, 38, 2, 70, 129, 1, 0, 5, 10, 40, 12, 74, 129, 6, 1, 129, 39, 6, 1, 2, 22, 9, 33, 122, 13, 0, 0, 0, 0, 5, 23, 4, 11, 9, 12, 45, 38, 1, 0, 0, 4, 36, 38, 57, 32, 0, 0, 82, 22, 9, 5, 13, 11, 3, 94, 35, 3, 0, 0, 0, 1, 16, 97]",5),(9776,"[10, 3, 8, 5, 48, 26, 5, 16, 17, 0, 0, 2, 132, 53, 1, 16, 112, 6, 0, 0, 7, 2, 1, 48, 48, 15, 18, 31, 3, 0, 0, 9, 6, 10, 19, 27, 50, 46, 17, 9, 18, 1, 4, 48, 132, 23, 3, 5, 132, 9, 4, 3, 11, 0, 2, 46, 84, 12, 10, 10, 1, 0, 12, 76, 26, 22, 16, 26, 35, 15, 3, 16, 15, 1, 51, 132, 125, 8, 1, 2, 132, 51, 67, 91, 8, 0, 0, 30, 126, 39, 32, 38, 4, 0, 1, 12, 24, 2, 2, 2, 4, 7, 2, 19, 93, 19, 70, 92, 2, 3, 1, 21, 36, 58, 132, 94, 0, 0, 0, 0, 21, 25, 57, 48, 1, 0, 0, 1]",3);
insert into vector_index_07 values(9777, " [16, 15, 0, 0, 5, 46, 5, 5, 4, 0, 0, 0, 28, 118, 12, 5, 75, 44, 5, 0, 6, 32, 6, 49, 41, 74, 9, 1, 0, 0, 0, 9, 1, 9, 16, 41, 71, 80, 3, 0, 0, 4, 3, 5, 51, 106, 11, 3, 112, 28, 13, 1, 4, 8, 3, 104, 118, 14, 1, 1, 0, 0, 0, 88, 3, 27, 46, 118, 108, 49, 2, 0, 1, 46, 118, 118, 27, 12, 0, 0, 33, 118, 118, 8, 0, 0, 0, 4, 118, 95, 40, 0, 0, 0, 1, 11, 27, 38, 12, 12, 18, 29, 3, 2, 13, 30, 94, 78, 30, 19, 9, 3, 31, 45, 70, 42, 15, 1, 3, 12, 14, 22, 16, 2, 3, 17, 24, 13]",4),(9778,"[41, 0, 0, 7, 1, 1, 20, 67, 9, 0, 0, 0, 0, 31, 120, 61, 25, 0, 0, 0, 0, 10, 120, 90, 32, 0, 0, 1, 13, 11, 22, 50, 4, 0, 2, 93, 40, 15, 37, 18, 12, 2, 2, 19, 8, 44, 120, 25, 120, 5, 0, 0, 0, 2, 48, 97, 102, 14, 3, 3, 11, 9, 34, 41, 0, 0, 4, 120, 56, 3, 4, 5, 6, 15, 37, 116, 28, 0, 0, 3, 120, 120, 24, 6, 2, 0, 1, 28, 53, 90, 51, 11, 11, 2, 12, 14, 8, 6, 4, 30, 9, 1, 4, 22, 25, 79, 120, 66, 5, 0, 0, 6, 42, 120, 91, 43, 15, 2, 4, 39, 12, 9, 9, 12, 15, 5, 24, 36]",4);
create index idx01 using ivfflat on vector_index_07(b) lists=5 op_type "vector_l2_ops";
select * from vector_index_07 order by  L2_DISTANCE(a, "[16, 15, 0, 0, 5, 46, 5, 5, 4, 0, 0, 0, 28, 118, 12, 5, 75, 44, 5, 0, 6, 32, 6, 49, 41, 74, 9, 1, 0, 0, 0, 9, 1, 9, 16, 41, 71, 80, 3, 0, 0, 4, 3, 5, 51, 106, 11, 3, 112, 28, 13, 1, 4, 8, 3, 104, 118, 14, 1, 1, 0, 0, 0, 88, 3, 27, 46, 118, 108, 49, 2, 0, 1, 46, 118, 118, 27, 12, 0, 0, 33, 118, 118, 8, 0, 0, 0, 4, 118, 95, 40, 0, 0, 0, 1, 11, 27, 38, 12, 12, 18, 29, 3, 2, 13, 30, 94, 78, 30, 19, 9, 3, 31, 45, 70, 42, 15, 1, 3, 12, 14, 22, 16, 2, 3, 17, 24, 13]") ASC LIMIT 2;
invalid argument function l2_distance, bad value [INT VARCHAR]
select * from vector_index_07 order by  L2_DISTANCE(b, "[16, 15, 3, 0, 0, 4, 3, 5, 51]") ASC LIMIT 2;
invalid input: vector ops between different dimensions (128, 9) is not permitted.
select * from vector_index_07 order by  L2_DISTANCE(b, "abc") ASC LIMIT 2;
internal error: malformed vector input: abc
create table vector_index_08(a int auto_increment primary key, b vecf32(128),c int,key c_k(c));
insert into vector_index_08 values(9774 ,"[1, 0, 1, 6, 6, 17, 47, 39, 2, 0, 1, 25, 27, 10, 56, 130, 18, 5, 2, 6, 15, 2, 19, 130, 42, 28, 1, 1, 2, 1, 0, 5, 0, 2, 4, 4, 31, 34, 44, 35, 9, 3, 8, 11, 33, 12, 61, 130, 130, 17, 0, 1, 6, 2, 9, 130, 111, 36, 0, 0, 11, 9, 1, 12, 2, 100, 130, 28, 7, 2, 6, 7, 9, 27, 130, 83, 5, 0, 1, 18, 130, 130, 84, 9, 0, 0, 2, 24, 111, 24, 0, 1, 37, 24, 2, 10, 12, 62, 33, 3, 0, 0, 0, 1, 3, 16, 106, 28, 0, 0, 0, 0, 17, 46, 85, 10, 0, 0, 1, 4, 11, 4, 2, 2, 9, 14, 8, 8]",3),(9775,"[0, 1, 1, 3, 0, 3, 46, 20, 1, 4, 17, 9, 1, 17, 108, 15, 0, 3, 37, 17, 6, 15, 116, 16, 6, 1, 4, 7, 7, 7, 9, 6, 0, 8, 10, 4, 26, 129, 27, 9, 0, 0, 5, 2, 11, 129, 129, 12, 103, 4, 0, 0, 2, 31, 129, 129, 94, 4, 0, 0, 0, 3, 13, 42, 0, 15, 38, 2, 70, 129, 1, 0, 5, 10, 40, 12, 74, 129, 6, 1, 129, 39, 6, 1, 2, 22, 9, 33, 122, 13, 0, 0, 0, 0, 5, 23, 4, 11, 9, 12, 45, 38, 1, 0, 0, 4, 36, 38, 57, 32, 0, 0, 82, 22, 9, 5, 13, 11, 3, 94, 35, 3, 0, 0, 0, 1, 16, 97]",5),(9776,"[10, 3, 8, 5, 48, 26, 5, 16, 17, 0, 0, 2, 132, 53, 1, 16, 112, 6, 0, 0, 7, 2, 1, 48, 48, 15, 18, 31, 3, 0, 0, 9, 6, 10, 19, 27, 50, 46, 17, 9, 18, 1, 4, 48, 132, 23, 3, 5, 132, 9, 4, 3, 11, 0, 2, 46, 84, 12, 10, 10, 1, 0, 12, 76, 26, 22, 16, 26, 35, 15, 3, 16, 15, 1, 51, 132, 125, 8, 1, 2, 132, 51, 67, 91, 8, 0, 0, 30, 126, 39, 32, 38, 4, 0, 1, 12, 24, 2, 2, 2, 4, 7, 2, 19, 93, 19, 70, 92, 2, 3, 1, 21, 36, 58, 132, 94, 0, 0, 0, 0, 21, 25, 57, 48, 1, 0, 0, 1]",3);
insert into vector_index_08 values(9777, "[16, 15, 0, 0, 5, 46, 5, 5, 4, 0, 0, 0, 28, 118, 12, 5, 75, 44, 5, 0, 6, 32, 6, 49, 41, 74, 9, 1, 0, 0, 0, 9, 1, 9, 16, 41, 71, 80, 3, 0, 0, 4, 3, 5, 51, 106, 11, 3, 112, 28, 13, 1, 4, 8, 3, 104, 118, 14, 1, 1, 0, 0, 0, 88, 3, 27, 46, 118, 108, 49, 2, 0, 1, 46, 118, 118, 27, 12, 0, 0, 33, 118, 118, 8, 0, 0, 0, 4, 118, 95, 40, 0, 0, 0, 1, 11, 27, 38, 12, 12, 18, 29, 3, 2, 13, 30, 94, 78, 30, 19, 9, 3, 31, 45, 70, 42, 15, 1, 3, 12, 14, 22, 16, 2, 3, 17, 24, 13]",4),(9778,"[41, 0, 0, 7, 1, 1, 20, 67, 9, 0, 0, 0, 0, 31, 120, 61, 25, 0, 0, 0, 0, 10, 120, 90, 32, 0, 0, 1, 13, 11, 22, 50, 4, 0, 2, 93, 40, 15, 37, 18, 12, 2, 2, 19, 8, 44, 120, 25, 120, 5, 0, 0, 0, 2, 48, 97, 102, 14, 3, 3, 11, 9, 34, 41, 0, 0, 4, 120, 56, 3, 4, 5, 6, 15, 37, 116, 28, 0, 0, 3, 120, 120, 24, 6, 2, 0, 1, 28, 53, 90, 51, 11, 11, 2, 12, 14, 8, 6, 4, 30, 9, 1, 4, 22, 25, 79, 120, 66, 5, 0, 0, 6, 42, 120, 91, 43, 15, 2, 4, 39, 12, 9, 9, 12, 15, 5, 24, 36]",4);
create index idx01 using ivfflat on vector_index_08(b) lists=3 op_type "vector_l2_ops";
select * from  vector_index_08 ;
a    b    c
9774    [1, 0, 1, 6, 6, 17, 47, 39, 2, 0, 1, 25, 27, 10, 56, 130, 18, 5, 2, 6, 15, 2, 19, 130, 42, 28, 1, 1, 2, 1, 0, 5, 0, 2, 4, 4, 31, 34, 44, 35, 9, 3, 8, 11, 33, 12, 61, 130, 130, 17, 0, 1, 6, 2, 9, 130, 111, 36, 0, 0, 11, 9, 1, 12, 2, 100, 130, 28, 7, 2, 6, 7, 9, 27, 130, 83, 5, 0, 1, 18, 130, 130, 84, 9, 0, 0, 2, 24, 111, 24, 0, 1, 37, 24, 2, 10, 12, 62, 33, 3, 0, 0, 0, 1, 3, 16, 106, 28, 0, 0, 0, 0, 17, 46, 85, 10, 0, 0, 1, 4, 11, 4, 2, 2, 9, 14, 8, 8]    3
9775    [0, 1, 1, 3, 0, 3, 46, 20, 1, 4, 17, 9, 1, 17, 108, 15, 0, 3, 37, 17, 6, 15, 116, 16, 6, 1, 4, 7, 7, 7, 9, 6, 0, 8, 10, 4, 26, 129, 27, 9, 0, 0, 5, 2, 11, 129, 129, 12, 103, 4, 0, 0, 2, 31, 129, 129, 94, 4, 0, 0, 0, 3, 13, 42, 0, 15, 38, 2, 70, 129, 1, 0, 5, 10, 40, 12, 74, 129, 6, 1, 129, 39, 6, 1, 2, 22, 9, 33, 122, 13, 0, 0, 0, 0, 5, 23, 4, 11, 9, 12, 45, 38, 1, 0, 0, 4, 36, 38, 57, 32, 0, 0, 82, 22, 9, 5, 13, 11, 3, 94, 35, 3, 0, 0, 0, 1, 16, 97]    5
9776    [10, 3, 8, 5, 48, 26, 5, 16, 17, 0, 0, 2, 132, 53, 1, 16, 112, 6, 0, 0, 7, 2, 1, 48, 48, 15, 18, 31, 3, 0, 0, 9, 6, 10, 19, 27, 50, 46, 17, 9, 18, 1, 4, 48, 132, 23, 3, 5, 132, 9, 4, 3, 11, 0, 2, 46, 84, 12, 10, 10, 1, 0, 12, 76, 26, 22, 16, 26, 35, 15, 3, 16, 15, 1, 51, 132, 125, 8, 1, 2, 132, 51, 67, 91, 8, 0, 0, 30, 126, 39, 32, 38, 4, 0, 1, 12, 24, 2, 2, 2, 4, 7, 2, 19, 93, 19, 70, 92, 2, 3, 1, 21, 36, 58, 132, 94, 0, 0, 0, 0, 21, 25, 57, 48, 1, 0, 0, 1]    3
9777    [16, 15, 0, 0, 5, 46, 5, 5, 4, 0, 0, 0, 28, 118, 12, 5, 75, 44, 5, 0, 6, 32, 6, 49, 41, 74, 9, 1, 0, 0, 0, 9, 1, 9, 16, 41, 71, 80, 3, 0, 0, 4, 3, 5, 51, 106, 11, 3, 112, 28, 13, 1, 4, 8, 3, 104, 118, 14, 1, 1, 0, 0, 0, 88, 3, 27, 46, 118, 108, 49, 2, 0, 1, 46, 118, 118, 27, 12, 0, 0, 33, 118, 118, 8, 0, 0, 0, 4, 118, 95, 40, 0, 0, 0, 1, 11, 27, 38, 12, 12, 18, 29, 3, 2, 13, 30, 94, 78, 30, 19, 9, 3, 31, 45, 70, 42, 15, 1, 3, 12, 14, 22, 16, 2, 3, 17, 24, 13]    4
9778    [41, 0, 0, 7, 1, 1, 20, 67, 9, 0, 0, 0, 0, 31, 120, 61, 25, 0, 0, 0, 0, 10, 120, 90, 32, 0, 0, 1, 13, 11, 22, 50, 4, 0, 2, 93, 40, 15, 37, 18, 12, 2, 2, 19, 8, 44, 120, 25, 120, 5, 0, 0, 0, 2, 48, 97, 102, 14, 3, 3, 11, 9, 34, 41, 0, 0, 4, 120, 56, 3, 4, 5, 6, 15, 37, 116, 28, 0, 0, 3, 120, 120, 24, 6, 2, 0, 1, 28, 53, 90, 51, 11, 11, 2, 12, 14, 8, 6, 4, 30, 9, 1, 4, 22, 25, 79, 120, 66, 5, 0, 0, 6, 42, 120, 91, 43, 15, 2, 4, 39, 12, 9, 9, 12, 15, 5, 24, 36]    4
update vector_index_08 set b="[16, 15, 0, 0, 5, 46, 5, 5, 4, 0, 0, 0, 28, 118, 12, 5, 75, 44, 5, 0, 6, 32, 6, 49, 41, 74, 9, 1, 0, 0, 0, 9, 1, 9, 16, 41, 71, 80, 3, 0, 0, 4, 3, 5, 51, 106, 11, 3, 112, 28, 13, 1, 4, 8, 3, 104, 118, 14, 1, 1, 0, 0, 0, 88, 3, 27, 46, 118, 108, 49, 2, 0, 1, 46, 118, 118, 27, 12, 0, 0, 33, 118, 118, 8, 0, 0, 0, 4, 118, 95, 40, 0, 0, 0, 1, 11, 27, 38, 12, 12, 18, 29, 3, 2, 13, 30, 94, 78, 30, 19, 9, 3, 31, 45, 70, 42, 15, 1, 3, 12, 14, 22, 16, 2, 3, 17, 24, 13]" where a=9774;
select * from  vector_index_08 where a=9774;
a    b    c
9774    [16, 15, 0, 0, 5, 46, 5, 5, 4, 0, 0, 0, 28, 118, 12, 5, 75, 44, 5, 0, 6, 32, 6, 49, 41, 74, 9, 1, 0, 0, 0, 9, 1, 9, 16, 41, 71, 80, 3, 0, 0, 4, 3, 5, 51, 106, 11, 3, 112, 28, 13, 1, 4, 8, 3, 104, 118, 14, 1, 1, 0, 0, 0, 88, 3, 27, 46, 118, 108, 49, 2, 0, 1, 46, 118, 118, 27, 12, 0, 0, 33, 118, 118, 8, 0, 0, 0, 4, 118, 95, 40, 0, 0, 0, 1, 11, 27, 38, 12, 12, 18, 29, 3, 2, 13, 30, 94, 78, 30, 19, 9, 3, 31, 45, 70, 42, 15, 1, 3, 12, 14, 22, 16, 2, 3, 17, 24, 13]    3
delete from vector_index_08 where a=9777;
select * from  vector_index_08 where a=9777;
a    b    c
truncate table vector_index_08;
select * from  vector_index_08;
a    b    c
insert into vector_index_08 values(9774 ,"[1, 0, 1, 6, 6, 17, 47, 39, 2, 0, 1, 25, 27, 10, 56, 130, 18, 5, 2, 6, 15, 2, 19, 130, 42, 28, 1, 1, 2, 1, 0, 5, 0, 2, 4, 4, 31, 34, 44, 35, 9, 3, 8, 11, 33, 12, 61, 130, 130, 17, 0, 1, 6, 2, 9, 130, 111, 36, 0, 0, 11, 9, 1, 12, 2, 100, 130, 28, 7, 2, 6, 7, 9, 27, 130, 83, 5, 0, 1, 18, 130, 130, 84, 9, 0, 0, 2, 24, 111, 24, 0, 1, 37, 24, 2, 10, 12, 62, 33, 3, 0, 0, 0, 1, 3, 16, 106, 28, 0, 0, 0, 0, 17, 46, 85, 10, 0, 0, 1, 4, 11, 4, 2, 2, 9, 14, 8, 8]",3),(9775,"[0, 1, 1, 3, 0, 3, 46, 20, 1, 4, 17, 9, 1, 17, 108, 15, 0, 3, 37, 17, 6, 15, 116, 16, 6, 1, 4, 7, 7, 7, 9, 6, 0, 8, 10, 4, 26, 129, 27, 9, 0, 0, 5, 2, 11, 129, 129, 12, 103, 4, 0, 0, 2, 31, 129, 129, 94, 4, 0, 0, 0, 3, 13, 42, 0, 15, 38, 2, 70, 129, 1, 0, 5, 10, 40, 12, 74, 129, 6, 1, 129, 39, 6, 1, 2, 22, 9, 33, 122, 13, 0, 0, 0, 0, 5, 23, 4, 11, 9, 12, 45, 38, 1, 0, 0, 4, 36, 38, 57, 32, 0, 0, 82, 22, 9, 5, 13, 11, 3, 94, 35, 3, 0, 0, 0, 1, 16, 97]",5),(9776,"[10, 3, 8, 5, 48, 26, 5, 16, 17, 0, 0, 2, 132, 53, 1, 16, 112, 6, 0, 0, 7, 2, 1, 48, 48, 15, 18, 31, 3, 0, 0, 9, 6, 10, 19, 27, 50, 46, 17, 9, 18, 1, 4, 48, 132, 23, 3, 5, 132, 9, 4, 3, 11, 0, 2, 46, 84, 12, 10, 10, 1, 0, 12, 76, 26, 22, 16, 26, 35, 15, 3, 16, 15, 1, 51, 132, 125, 8, 1, 2, 132, 51, 67, 91, 8, 0, 0, 30, 126, 39, 32, 38, 4, 0, 1, 12, 24, 2, 2, 2, 4, 7, 2, 19, 93, 19, 70, 92, 2, 3, 1, 21, 36, 58, 132, 94, 0, 0, 0, 0, 21, 25, 57, 48, 1, 0, 0, 1]",3);
alter table vector_index_08 add column d vecf32(3) not null after c;
no such table vector_index.__mo_index_secondary_018e5b40-2df3-7080-8788-e52bf869952d
create index idx02 using ivfflat on vector_index_08(d) lists=3 op_type "vector_l2_ops";
invalid input: column 'd' is not exist
show create table vector_index_08;
Table    Create Table
vector_index_08    CREATE TABLE `vector_index_08` (\n`a` INT NOT NULL AUTO_INCREMENT,\n`b` VECF32(128) DEFAULT NULL,\n`c` INT DEFAULT NULL,\nPRIMARY KEY (`a`),\nKEY `c_k` (`c`),\nKEY `idx01` USING ivfflat (`b`) lists = 3  op_type 'vector_l2_ops' \n)
insert into vector_index_08(d) values ("[2.36,5.021,9.222]");
Unknown column 'd' in 'vector_index_08'
insert into vector_index_08(d) values ("[8.555,2.11,7.22]");
Unknown column 'd' in 'vector_index_08'
select * from vector_index_08 where a>9774 order by  L2_DISTANCE(c,"[1.02,0.2,3.2]") desc limit 3;
invalid argument function l2_distance, bad value [INT VARCHAR]
alter table vector_index_08 rename column d to e;
Unknown column 'd' in 'vector_index_08'
select * from vector_index_08 where a>9775 order by  L2_DISTANCE(c,"[1.02,0.2,3.2]") desc limit 2;
invalid argument function l2_distance, bad value [INT VARCHAR]
alter table vector_index_08 drop column d;
Can't DROP 'd'; check that column/key exists
select * from vector_index_08;
a    b    c
9774    [1, 0, 1, 6, 6, 17, 47, 39, 2, 0, 1, 25, 27, 10, 56, 130, 18, 5, 2, 6, 15, 2, 19, 130, 42, 28, 1, 1, 2, 1, 0, 5, 0, 2, 4, 4, 31, 34, 44, 35, 9, 3, 8, 11, 33, 12, 61, 130, 130, 17, 0, 1, 6, 2, 9, 130, 111, 36, 0, 0, 11, 9, 1, 12, 2, 100, 130, 28, 7, 2, 6, 7, 9, 27, 130, 83, 5, 0, 1, 18, 130, 130, 84, 9, 0, 0, 2, 24, 111, 24, 0, 1, 37, 24, 2, 10, 12, 62, 33, 3, 0, 0, 0, 1, 3, 16, 106, 28, 0, 0, 0, 0, 17, 46, 85, 10, 0, 0, 1, 4, 11, 4, 2, 2, 9, 14, 8, 8]    3
9775    [0, 1, 1, 3, 0, 3, 46, 20, 1, 4, 17, 9, 1, 17, 108, 15, 0, 3, 37, 17, 6, 15, 116, 16, 6, 1, 4, 7, 7, 7, 9, 6, 0, 8, 10, 4, 26, 129, 27, 9, 0, 0, 5, 2, 11, 129, 129, 12, 103, 4, 0, 0, 2, 31, 129, 129, 94, 4, 0, 0, 0, 3, 13, 42, 0, 15, 38, 2, 70, 129, 1, 0, 5, 10, 40, 12, 74, 129, 6, 1, 129, 39, 6, 1, 2, 22, 9, 33, 122, 13, 0, 0, 0, 0, 5, 23, 4, 11, 9, 12, 45, 38, 1, 0, 0, 4, 36, 38, 57, 32, 0, 0, 82, 22, 9, 5, 13, 11, 3, 94, 35, 3, 0, 0, 0, 1, 16, 97]    5
9776    [10, 3, 8, 5, 48, 26, 5, 16, 17, 0, 0, 2, 132, 53, 1, 16, 112, 6, 0, 0, 7, 2, 1, 48, 48, 15, 18, 31, 3, 0, 0, 9, 6, 10, 19, 27, 50, 46, 17, 9, 18, 1, 4, 48, 132, 23, 3, 5, 132, 9, 4, 3, 11, 0, 2, 46, 84, 12, 10, 10, 1, 0, 12, 76, 26, 22, 16, 26, 35, 15, 3, 16, 15, 1, 51, 132, 125, 8, 1, 2, 132, 51, 67, 91, 8, 0, 0, 30, 126, 39, 32, 38, 4, 0, 1, 12, 24, 2, 2, 2, 4, 7, 2, 19, 93, 19, 70, 92, 2, 3, 1, 21, 36, 58, 132, 94, 0, 0, 0, 0, 21, 25, 57, 48, 1, 0, 0, 1]    3
create table vector_index_09(a int primary key, b vecf32(128),c int,key c_k(c));
create index idx01 using ivfflat on vector_index_09(b) lists=3 op_type "vector_l2_ops";
insert into vector_index_09 values(9774 ,NULL,3),(9775,NULL,10);
insert into vector_index_09(a,c) values(9777,4),(9778,9);
select * from vector_index_09;
a    b    c
9774    null    3
9775    null    10
9777    null    4
9778    null    9
select * from vector_index_09 order by  L2_DISTANCE(b,"[1, 0, 1, 6, 6, 17, 47]");
a    b    c
9774    null    3
9775    null    10
9777    null    4
9778    null    9
select * from vector_index_09 order by  L2_DISTANCE(b,NULL);
a    b    c
9774    null    3
9775    null    10
9777    null    4
9778    null    9
drop table vector_index_09;
create table vector_index_09(a int primary key, b vecf32(128),c int,key c_k(c));
insert into vector_index_09 values(9774 ,NULL,3),(9775,NULL,10);
insert into vector_index_09(a,c) values(9777,4),(9778,9);
create index idx01 using ivfflat on vector_index_09(b) lists=3 op_type "vector_l2_ops";
select * from vector_index_09 order by  L2_DISTANCE(b,"[1, 0, 1, 6, 6, 17, 47]");
a    b    c
9774    null    3
9775    null    10
9777    null    4
9778    null    9
insert into vector_index_09 values(97741 ,"[1, 0, 1, 6, 6, 17, 47, 39, 2, 0, 1, 25, 27, 10, 56, 130, 18, 5, 2, 6, 15, 2, 19, 130, 42, 28, 1, 1, 2, 1, 0, 5, 0, 2, 4, 4, 31, 34, 44, 35, 9, 3, 8, 11, 33, 12, 61, 130, 130, 17, 0, 1, 6, 2, 9, 130, 111, 36, 0, 0, 11, 9, 1, 12, 2, 100, 130, 28, 7, 2, 6, 7, 9, 27, 130, 83, 5, 0, 1, 18, 130, 130, 84, 9, 0, 0, 2, 24, 111, 24, 0, 1, 37, 24, 2, 10, 12, 62, 33, 3, 0, 0, 0, 1, 3, 16, 106, 28, 0, 0, 0, 0, 17, 46, 85, 10, 0, 0, 1, 4, 11, 4, 2, 2, 9, 14, 8, 8]",3),(97751,"[0, 1, 1, 3, 0, 3, 46, 20, 1, 4, 17, 9, 1, 17, 108, 15, 0, 3, 37, 17, 6, 15, 116, 16, 6, 1, 4, 7, 7, 7, 9, 6, 0, 8, 10, 4, 26, 129, 27, 9, 0, 0, 5, 2, 11, 129, 129, 12, 103, 4, 0, 0, 2, 31, 129, 129, 94, 4, 0, 0, 0, 3, 13, 42, 0, 15, 38, 2, 70, 129, 1, 0, 5, 10, 40, 12, 74, 129, 6, 1, 129, 39, 6, 1, 2, 22, 9, 33, 122, 13, 0, 0, 0, 0, 5, 23, 4, 11, 9, 12, 45, 38, 1, 0, 0, 4, 36, 38, 57, 32, 0, 0, 82, 22, 9, 5, 13, 11, 3, 94, 35, 3, 0, 0, 0, 1, 16, 97]",5),(9776,"[10, 3, 8, 5, 48, 26, 5, 16, 17, 0, 0, 2, 132, 53, 1, 16, 112, 6, 0, 0, 7, 2, 1, 48, 48, 15, 18, 31, 3, 0, 0, 9, 6, 10, 19, 27, 50, 46, 17, 9, 18, 1, 4, 48, 132, 23, 3, 5, 132, 9, 4, 3, 11, 0, 2, 46, 84, 12, 10, 10, 1, 0, 12, 76, 26, 22, 16, 26, 35, 15, 3, 16, 15, 1, 51, 132, 125, 8, 1, 2, 132, 51, 67, 91, 8, 0, 0, 30, 126, 39, 32, 38, 4, 0, 1, 12, 24, 2, 2, 2, 4, 7, 2, 19, 93, 19, 70, 92, 2, 3, 1, 21, 36, 58, 132, 94, 0, 0, 0, 0, 21, 25, 57, 48, 1, 0, 0, 1]",3);
insert into vector_index_09 values(97771, "[16, 15, 0, 0, 5, 46, 5, 5, 4, 0, 0, 0, 28, 118, 12, 5, 75, 44, 5, 0, 6, 32, 6, 49, 41, 74, 9, 1, 0, 0, 0, 9, 1, 9, 16, 41, 71, 80, 3, 0, 0, 4, 3, 5, 51, 106, 11, 3, 112, 28, 13, 1, 4, 8, 3, 104, 118, 14, 1, 1, 0, 0, 0, 88, 3, 27, 46, 118, 108, 49, 2, 0, 1, 46, 118, 118, 27, 12, 0, 0, 33, 118, 118, 8, 0, 0, 0, 4, 118, 95, 40, 0, 0, 0, 1, 11, 27, 38, 12, 12, 18, 29, 3, 2, 13, 30, 94, 78, 30, 19, 9, 3, 31, 45, 70, 42, 15, 1, 3, 12, 14, 22, 16, 2, 3, 17, 24, 13]",4),(97781,"[41, 0, 0, 7, 1, 1, 20, 67, 9, 0, 0, 0, 0, 31, 120, 61, 25, 0, 0, 0, 0, 10, 120, 90, 32, 0, 0, 1, 13, 11, 22, 50, 4, 0, 2, 93, 40, 15, 37, 18, 12, 2, 2, 19, 8, 44, 120, 25, 120, 5, 0, 0, 0, 2, 48, 97, 102, 14, 3, 3, 11, 9, 34, 41, 0, 0, 4, 120, 56, 3, 4, 5, 6, 15, 37, 116, 28, 0, 0, 3, 120, 120, 24, 6, 2, 0, 1, 28, 53, 90, 51, 11, 11, 2, 12, 14, 8, 6, 4, 30, 9, 1, 4, 22, 25, 79, 120, 66, 5, 0, 0, 6, 42, 120, 91, 43, 15, 2, 4, 39, 12, 9, 9, 12, 15, 5, 24, 36]",4);
alter table vector_index_09 alter reindex idx01 ivfflat lists=2;
select * from vector_index_09 order by  L2_DISTANCE(b,"[1, 0, 1, 6, 6, 17, 47]");
invalid input: vector ops between different dimensions (128, 7) is not permitted.
alter table vector_index_09 drop index idx01;
show create table vector_index_09;
Table    Create Table
vector_index_09    CREATE TABLE `vector_index_09` (\n`a` INT NOT NULL,\n`b` VECF32(128) DEFAULT NULL,\n`c` INT DEFAULT NULL,\nPRIMARY KEY (`a`),\nKEY `c_k` (`c`)\n)
create table vector_index_10(a int primary key, b vecf32(128),c int,key c_k(c));
set autocommit=0;
create index idx01 using ivfflat on vector_index_10(b) lists=3 op_type "vector_l2_ops";
show create table vector_index_10;
Table    Create Table
vector_index_10    CREATE TABLE `vector_index_10` (\n`a` INT NOT NULL,\n`b` VECF32(128) DEFAULT NULL,\n`c` INT DEFAULT NULL,\nPRIMARY KEY (`a`),\nKEY `c_k` (`c`),\nKEY `idx01` USING ivfflat (`b`) lists = 3  op_type 'vector_l2_ops' \n)
insert into vector_index_10 values(97741 ,"[1, 0, 1, 6, 6, 17, 47, 39, 2, 0, 1, 25, 27, 10, 56, 130, 18, 5, 2, 6, 15, 2, 19, 130, 42, 28, 1, 1, 2, 1, 0, 5, 0, 2, 4, 4, 31, 34, 44, 35, 9, 3, 8, 11, 33, 12, 61, 130, 130, 17, 0, 1, 6, 2, 9, 130, 111, 36, 0, 0, 11, 9, 1, 12, 2, 100, 130, 28, 7, 2, 6, 7, 9, 27, 130, 83, 5, 0, 1, 18, 130, 130, 84, 9, 0, 0, 2, 24, 111, 24, 0, 1, 37, 24, 2, 10, 12, 62, 33, 3, 0, 0, 0, 1, 3, 16, 106, 28, 0, 0, 0, 0, 17, 46, 85, 10, 0, 0, 1, 4, 11, 4, 2, 2, 9, 14, 8, 8]",3),(97751,"[0, 1, 1, 3, 0, 3, 46, 20, 1, 4, 17, 9, 1, 17, 108, 15, 0, 3, 37, 17, 6, 15, 116, 16, 6, 1, 4, 7, 7, 7, 9, 6, 0, 8, 10, 4, 26, 129, 27, 9, 0, 0, 5, 2, 11, 129, 129, 12, 103, 4, 0, 0, 2, 31, 129, 129, 94, 4, 0, 0, 0, 3, 13, 42, 0, 15, 38, 2, 70, 129, 1, 0, 5, 10, 40, 12, 74, 129, 6, 1, 129, 39, 6, 1, 2, 22, 9, 33, 122, 13, 0, 0, 0, 0, 5, 23, 4, 11, 9, 12, 45, 38, 1, 0, 0, 4, 36, 38, 57, 32, 0, 0, 82, 22, 9, 5, 13, 11, 3, 94, 35, 3, 0, 0, 0, 1, 16, 97]",5),(9776,"[10, 3, 8, 5, 48, 26, 5, 16, 17, 0, 0, 2, 132, 53, 1, 16, 112, 6, 0, 0, 7, 2, 1, 48, 48, 15, 18, 31, 3, 0, 0, 9, 6, 10, 19, 27, 50, 46, 17, 9, 18, 1, 4, 48, 132, 23, 3, 5, 132, 9, 4, 3, 11, 0, 2, 46, 84, 12, 10, 10, 1, 0, 12, 76, 26, 22, 16, 26, 35, 15, 3, 16, 15, 1, 51, 132, 125, 8, 1, 2, 132, 51, 67, 91, 8, 0, 0, 30, 126, 39, 32, 38, 4, 0, 1, 12, 24, 2, 2, 2, 4, 7, 2, 19, 93, 19, 70, 92, 2, 3, 1, 21, 36, 58, 132, 94, 0, 0, 0, 0, 21, 25, 57, 48, 1, 0, 0, 1]",3);
alter table vector_index_10 alter reindex idx01 ivfflat lists=2;
show create table vector_index_10;
Table    Create Table
vector_index_10    CREATE TABLE `vector_index_10` (\n`a` INT NOT NULL,\n`b` VECF32(128) DEFAULT NULL,\n`c` INT DEFAULT NULL,\nPRIMARY KEY (`a`),\nKEY `c_k` (`c`),\nKEY `idx01` USING ivfflat (`b`) lists = 2  op_type 'vector_l2_ops' \n)
use vector_index;
show create table vector_index_10;
Table    Create Table
vector_index_10    CREATE TABLE `vector_index_10` (\n`a` INT NOT NULL,\n`b` VECF32(128) DEFAULT NULL,\n`c` INT DEFAULT NULL,\nPRIMARY KEY (`a`),\nKEY `c_k` (`c`)\n)
rollback;
show create table vector_index_10;
Table    Create Table
vector_index_10    CREATE TABLE `vector_index_10` (\n`a` INT NOT NULL,\n`b` VECF32(128) DEFAULT NULL,\n`c` INT DEFAULT NULL,\nPRIMARY KEY (`a`),\nKEY `c_k` (`c`)\n)
drop table vector_index_10;
set autocommit=1;
create table vector_index_10(a int primary key, b vecf32(128),c int,key c_k(c));
begin;
create index idx01 using ivfflat on vector_index_10(b) lists=3 op_type "vector_l2_ops";
show create table vector_index_10;
Table    Create Table
vector_index_10    CREATE TABLE `vector_index_10` (\n`a` INT NOT NULL,\n`b` VECF32(128) DEFAULT NULL,\n`c` INT DEFAULT NULL,\nPRIMARY KEY (`a`),\nKEY `c_k` (`c`),\nKEY `idx01` USING ivfflat (`b`) lists = 3  op_type 'vector_l2_ops' \n)
insert into vector_index_10 values(97741 ,"[1, 0, 1, 6, 6, 17, 47, 39, 2, 0, 1, 25, 27, 10, 56, 130, 18, 5, 2, 6, 15, 2, 19, 130, 42, 28, 1, 1, 2, 1, 0, 5, 0, 2, 4, 4, 31, 34, 44, 35, 9, 3, 8, 11, 33, 12, 61, 130, 130, 17, 0, 1, 6, 2, 9, 130, 111, 36, 0, 0, 11, 9, 1, 12, 2, 100, 130, 28, 7, 2, 6, 7, 9, 27, 130, 83, 5, 0, 1, 18, 130, 130, 84, 9, 0, 0, 2, 24, 111, 24, 0, 1, 37, 24, 2, 10, 12, 62, 33, 3, 0, 0, 0, 1, 3, 16, 106, 28, 0, 0, 0, 0, 17, 46, 85, 10, 0, 0, 1, 4, 11, 4, 2, 2, 9, 14, 8, 8]",3),(97751,"[0, 1, 1, 3, 0, 3, 46, 20, 1, 4, 17, 9, 1, 17, 108, 15, 0, 3, 37, 17, 6, 15, 116, 16, 6, 1, 4, 7, 7, 7, 9, 6, 0, 8, 10, 4, 26, 129, 27, 9, 0, 0, 5, 2, 11, 129, 129, 12, 103, 4, 0, 0, 2, 31, 129, 129, 94, 4, 0, 0, 0, 3, 13, 42, 0, 15, 38, 2, 70, 129, 1, 0, 5, 10, 40, 12, 74, 129, 6, 1, 129, 39, 6, 1, 2, 22, 9, 33, 122, 13, 0, 0, 0, 0, 5, 23, 4, 11, 9, 12, 45, 38, 1, 0, 0, 4, 36, 38, 57, 32, 0, 0, 82, 22, 9, 5, 13, 11, 3, 94, 35, 3, 0, 0, 0, 1, 16, 97]",5),(9776,"[10, 3, 8, 5, 48, 26, 5, 16, 17, 0, 0, 2, 132, 53, 1, 16, 112, 6, 0, 0, 7, 2, 1, 48, 48, 15, 18, 31, 3, 0, 0, 9, 6, 10, 19, 27, 50, 46, 17, 9, 18, 1, 4, 48, 132, 23, 3, 5, 132, 9, 4, 3, 11, 0, 2, 46, 84, 12, 10, 10, 1, 0, 12, 76, 26, 22, 16, 26, 35, 15, 3, 16, 15, 1, 51, 132, 125, 8, 1, 2, 132, 51, 67, 91, 8, 0, 0, 30, 126, 39, 32, 38, 4, 0, 1, 12, 24, 2, 2, 2, 4, 7, 2, 19, 93, 19, 70, 92, 2, 3, 1, 21, 36, 58, 132, 94, 0, 0, 0, 0, 21, 25, 57, 48, 1, 0, 0, 1]",3);
alter table vector_index_10 alter reindex idx01 ivfflat lists=2;
show create table vector_index_10;
Table    Create Table
vector_index_10    CREATE TABLE `vector_index_10` (\n`a` INT NOT NULL,\n`b` VECF32(128) DEFAULT NULL,\n`c` INT DEFAULT NULL,\nPRIMARY KEY (`a`),\nKEY `c_k` (`c`),\nKEY `idx01` USING ivfflat (`b`) lists = 2  op_type 'vector_l2_ops' \n)
use vector_index;
show create table vector_index_10;
Table    Create Table
vector_index_10    CREATE TABLE `vector_index_10` (\n`a` INT NOT NULL,\n`b` VECF32(128) DEFAULT NULL,\n`c` INT DEFAULT NULL,\nPRIMARY KEY (`a`),\nKEY `c_k` (`c`)\n)
commit;
show create table vector_index_10;
Table    Create Table
vector_index_10    CREATE TABLE `vector_index_10` (\n`a` INT NOT NULL,\n`b` VECF32(128) DEFAULT NULL,\n`c` INT DEFAULT NULL,\nPRIMARY KEY (`a`),\nKEY `c_k` (`c`),\nKEY `idx01` USING ivfflat (`b`) lists = 2  op_type 'vector_l2_ops' \n)
drop table vector_index_10;
