create database fake_pk;
use fake_pk;
create table fake_pk(id int);
insert into fake_pk(id) values(1);
select * from fake_pk order by id;
id
1
insert into fake_pk(id) values(2);
select * from fake_pk order by id;
id
1
2
insert into fake_pk values(3);
select * from fake_pk order by id;
id
1
2
3
update fake_pk set id = 11 where id = 1;
select * from fake_pk order by id;
id
2
3
11
delete from fake_pk where id = 1;
select * from fake_pk order by id;
id
2
3
11
