drop account if exists bvt_query_type_part1;
create account if not exists `bvt_query_type_part1` ADMIN_NAME 'admin' IDENTIFIED BY '123456';
set session disable_agg_statement = on;
create database statement_query_type;
begin;
commit;
start transaction;
rollback;
drop database if exists test_db;
create database test_db;
use test_db;
drop table if exists test_table;
create table test_table(
col1 int,
col2 varchar
);
create view test_view as select * from test_table;
show create database test_db;
➤ Database[12,5,0]  ¦  Create Database[12,18,0]  𝄀
test_db  ¦  CREATE DATABASE `test_db`
show create table test_table;
➤ Table[12,7,0]  ¦  Create Table[12,69,0]  𝄀
test_table  ¦  CREATE TABLE `test_table` (
  `col1` int DEFAULT NULL,
  `col2` varchar(65535) DEFAULT NULL
)
show create view test_view;
➤ View[12,6,0]  ¦  Create View[12,69,0]  ¦  character_set_client[12,5,0]  ¦  collation_connection[12,13,0]  𝄀
test_view  ¦  create view `test_view` as select `test_table`.`col1`, `test_table`.`col2` from `test_table`  ¦  utf8mb4  ¦  utf8mb4_general_ci
show triggers;
➤ Trigger[12,48,0]  ¦  Event[12,7,0]  ¦  Table[12,48,0]  ¦  Statement[12,0,0]  ¦  Timing[12,7,0]  ¦  Created[93,64,0]  ¦  sql_mode[12,7,0]  ¦  Definer[12,216,0]  ¦  character_set_client[12,48,0]  ¦  collation_connection[12,48,0]  ¦  Database Collation[12,48,0]
show procedure status;
➤ Db[12,75,0]  ¦  Name[12,75,0]  ¦  Type[12,7,0]  ¦  Definer[12,37,0]  ¦  Modified[93,64,0]  ¦  Created[93,64,0]  ¦  Security_type[12,7,0]  ¦  Comment[12,3750,0]  ¦  character_set_client[12,48,0]  ¦  collation_connection[12,48,0]  ¦  Database Collation[12,48,0]
show config;
➤ 1[-5,64,0]
show events;
➤ 1[-5,64,0]
show plugins;
➤ 1[-5,64,0]
show profiles;
➤ 1[-5,64,0]
show privileges;
➤ 1[-5,64,0]
show tables;
➤ Tables_in_test_db[12,3750,0]  𝄀
test_table  𝄀
test_view
show collation like 'utf8mb4_general_ci';
➤ Collation[12,0,0]  ¦  Charset[12,0,0]  ¦  Id[-5,0,0]  ¦  Default[12,0,0]  ¦  Compiled[12,0,0]  ¦  Sortlen[4,0,0]  ¦  Pad_attribute[12,0,0]  𝄀
utf8mb4_general_ci  ¦  utf8mb4  ¦  45  ¦  YES  ¦  Yes  ¦  1  ¦  PAD SPACE
show collation like 'utf8mb4_general_ci%';
➤ Collation[12,0,0]  ¦  Charset[12,0,0]  ¦  Id[-5,0,0]  ¦  Default[12,0,0]  ¦  Compiled[12,0,0]  ¦  Sortlen[4,0,0]  ¦  Pad_attribute[12,0,0]  𝄀
utf8mb4_general_ci  ¦  utf8mb4  ¦  45  ¦  YES  ¦  Yes  ¦  1  ¦  PAD SPACE
show index from test_table;
➤ Table[12,7,0]  ¦  Non_unique[-5,64,0]  ¦  Key_name[12,48,0]  ¦  Seq_in_index[4,32,0]  ¦  Column_name[12,192,0]  ¦  Collation[12,0,0]  ¦  Cardinality[-5,64,0]  ¦  Sub_part[12,3,0]  ¦  Packed[12,3,0]  ¦  Null[12,2,0]  ¦  Index_type[12,8,0]  ¦  Comment[1,0,0]  ¦  Index_comment[12,1536,0]  ¦  Index_params[12,1536,0]  ¦  Visible[12,2,0]  ¦  Expression[12,192,0]
values row(1,1), row(2,2), row(3,3) order by column_0 desc;
➤ column_0[-5,64,0]  ¦  column_1[-5,64,0]  𝄀
3  ¦  3  𝄀
2  ¦  2  𝄀
1  ¦  1
WITH cte1 AS (SELECT 1),cte2 AS (SELECT 2) SELECT * FROM cte1 join cte2;
➤ 1[-5,64,0]  ¦  2[-5,64,0]  𝄀
1  ¦  2
select * from unnest('{"a":1}') as f;
➤ col[12,49151,0]  ¦  seq[4,32,0]  ¦  key[12,49151,0]  ¦  path[12,49151,0]  ¦  index[4,32,0]  ¦  value[-1,2147483647,0]  ¦  this[-1,2147483647,0]  𝄀
UNNEST_DEFAULT  ¦  0  ¦  a  ¦  $.a  ¦  null  ¦  1  ¦  {"a": 1}
insert into test_table values (1,'a'),(2,'b'),(3,'c');
update test_table set col2='xxx' where col1=1;
create account test_account admin_name = 'test_name' identified by '111' open comment 'tenant_test';
internal error: do not have privilege to execute the statement
create role test_role;
create user user_name identified by 'password';
create database if not exists db1;
grant create table,drop table on database *.* to test_role;
revoke test_role from user_name;
drop user user_name;
drop role test_role;
drop account test_account;
internal error: do not have privilege to execute the statement
drop database db1;
create database db2;
create table table_2(
col1 int,
col2 varchar
);
create view view_2 as select * from table_2;
create index index_table_2 on table_2(col1);
drop index index_table_2 on table_2;
drop view view_2;
drop table table_2;
drop database db2;
drop table if exists test_01;
create table test_01(a int, b varchar);
show create table test_01;
➤ Table[12,5,0]  ¦  Create Table[12,63,0]  𝄀
test_01  ¦  CREATE TABLE `test_01` (
  `a` int DEFAULT NULL,
  `b` varchar(65535) DEFAULT NULL
)
explain select * from test_01;
➤ TP QUERY PLAN[12,0,0]  𝄀
Project  𝄀
  ->  Table Scan on test_db.test_01
delete from test_01 where a=1;
truncate table test_01;
drop table test_01;
drop database test_db;
use statement_query_type;
create database test_db;
begin;
use test_db;
create table test_table(
col1 int,
col2 varchar
);
create view test_view as select * from test_table;
show create database test_db;
➤ Database[12,5,0]  ¦  Create Database[12,18,0]  𝄀
test_db  ¦  CREATE DATABASE `test_db`
show create table test_table;
➤ Table[12,7,0]  ¦  Create Table[12,69,0]  𝄀
test_table  ¦  CREATE TABLE `test_table` (
  `col1` int DEFAULT NULL,
  `col2` varchar(65535) DEFAULT NULL
)
show triggers;
➤ Trigger[12,48,0]  ¦  Event[12,7,0]  ¦  Table[12,48,0]  ¦  Statement[12,0,0]  ¦  Timing[12,7,0]  ¦  Created[93,64,0]  ¦  sql_mode[12,7,0]  ¦  Definer[12,216,0]  ¦  character_set_client[12,48,0]  ¦  collation_connection[12,48,0]  ¦  Database Collation[12,48,0]
show procedure status;
➤ Db[12,75,0]  ¦  Name[12,75,0]  ¦  Type[12,7,0]  ¦  Definer[12,37,0]  ¦  Modified[93,64,0]  ¦  Created[93,64,0]  ¦  Security_type[12,7,0]  ¦  Comment[12,3750,0]  ¦  character_set_client[12,48,0]  ¦  collation_connection[12,48,0]  ¦  Database Collation[12,48,0]
show config;
➤ 1[-5,64,0]
show events;
➤ 1[-5,64,0]
show plugins;
➤ 1[-5,64,0]
show profiles;
➤ 1[-5,64,0]
show privileges;
➤ 1[-5,64,0]
show tables;
➤ Tables_in_test_db[12,3750,0]  𝄀
test_table  𝄀
test_view
show index from test_table;
➤ Table[12,7,0]  ¦  Non_unique[-5,64,0]  ¦  Key_name[12,48,0]  ¦  Seq_in_index[4,32,0]  ¦  Column_name[12,192,0]  ¦  Collation[12,0,0]  ¦  Cardinality[-5,64,0]  ¦  Sub_part[12,3,0]  ¦  Packed[12,3,0]  ¦  Null[12,2,0]  ¦  Index_type[12,8,0]  ¦  Comment[1,0,0]  ¦  Index_comment[12,1536,0]  ¦  Index_params[12,1536,0]  ¦  Visible[12,2,0]  ¦  Expression[12,192,0]
values row(1,1), row(2,2), row(3,3) order by column_0 desc;
➤ column_0[-5,64,0]  ¦  column_1[-5,64,0]  𝄀
3  ¦  3  𝄀
2  ¦  2  𝄀
1  ¦  1
WITH cte1 AS (SELECT 1),cte2 AS (SELECT 2) SELECT * FROM cte1 join cte2;
➤ 1[-5,64,0]  ¦  2[-5,64,0]  𝄀
1  ¦  2
select * from unnest('{"a":1}') as f;
➤ col[12,49151,0]  ¦  seq[4,32,0]  ¦  key[12,49151,0]  ¦  path[12,49151,0]  ¦  index[4,32,0]  ¦  value[-1,2147483647,0]  ¦  this[-1,2147483647,0]  𝄀
UNNEST_DEFAULT  ¦  0  ¦  a  ¦  $.a  ¦  null  ¦  1  ¦  {"a": 1}
create account test_account admin_name = 'test_name' identified by '111' open comment 'tenant_test';
internal error: do not have privilege to execute the statement
create role test_role;
internal error: administrative command is unsupported in transactions
create user user_name identified by 'password';
internal error: administrative command is unsupported in transactions
create database if not exists db1;
grant create table,drop table on database *.* to test_role;
internal error: administrative command is unsupported in transactions
revoke test_role from user_name;
internal error: administrative command is unsupported in transactions
drop user user_name;
internal error: administrative command is unsupported in transactions
drop role test_role;
internal error: administrative command is unsupported in transactions
drop account test_account;
internal error: do not have privilege to execute the statement
drop database db1;
create database db2;
create table table_2(
col1 int,
col2 varchar
);
create view view_2 as select * from table_2;
create index index_table_2 on table_2(col1);
drop index index_table_2 on table_2;
drop view view_2;
drop table table_2;
drop database db2;
prepare s1 from select * from test_table where col1=?;
set @a=2;
execute s1 using @a;
➤ col1[4,32,0]  ¦  col2[12,49151,0]
deallocate prepare s1;
rollback;
use system;
drop account if exists bvt_query_type_part1;
