drop account if exists bvt_query_type;
create account if not exists `bvt_query_type` ADMIN_NAME 'admin' IDENTIFIED BY '123456';
create database statement_query_type;
begin;
commit;
start transaction;
rollback;
drop database if exists test_db;
create database test_db;
use test_db;
drop table if exists test_table;
create table test_table(
col1 int,
col2 varchar
);
create view test_view as select * from test_table;
show create database test_db;
Database    Create Database
test_db    CREATE DATABASE `test_db`
show create table test_table;
Table    Create Table
test_table    CREATE TABLE `test_table` (\n`col1` INT DEFAULT NULL,\n`col2` VARCHAR(65535) DEFAULT NULL\n)
show create view test_view;
View    Create View
test_view    create view test_view as select * from test_table;
show triggers;
Trigger    Event    Table    Statement    Timing    Created    sql_mode    Definer    character_set_client    collation_connection    Database Collation
show procedure status;
Db    Name    Type    Definer    Modified    Created    Security_type    Comment    character_set_client    collation_connection    Database Collation
show config;
1
show events;
1
show plugins;
1
show profiles;
1
show privileges;
1
show tables;
Tables_in_test_db
test_table
test_view
show collation like 'utf8mb4_general_ci';
Collation    Charset    Id    Default    Compiled    Sortlen    Pad_attribute
utf8mb4_general_ci    utf8mb4    45        Yes    1    PAD SPACE
show collation like 'utf8mb4_general_ci%';
Collation    Charset    Id    Default    Compiled    Sortlen    Pad_attribute
utf8mb4_general_ci    utf8mb4    45        Yes    1    PAD SPACE
show index from test_table;
Table    Non_unique    Key_name    Seq_in_index    Column_name    Collation    Cardinality    Sub_part    Packed    Null    Index_type    Comment    Index_comment    Visible    Expression
values row(1,1), row(2,2), row(3,3) order by column_0 desc;
column_0    column_1
3    3
2    2
1    1
WITH cte1 AS (SELECT 1),cte2 AS (SELECT 2) SELECT * FROM cte1 join cte2;
1    2
1    2
select * from unnest('{"a":1}') as f;
col    seq    key    path    index    value    this
UNNEST_DEFAULT    0    a    $.a    null    1    {"a": 1}
insert into test_table values (1,'a'),(2,'b'),(3,'c');
update test_table set col2='xxx' where col1=1;
delete from test_table where col1=3;
create account test_account admin_name = 'test_name' identified by '111' open comment 'tenant_test';
internal error: do not have privilege to execute the statement
create role test_role;
create user user_name identified by 'password';
create database if not exists db1;
grant create table,drop table on database *.* to test_role;
revoke test_role from user_name;
drop user user_name;
drop role test_role;
drop account test_account;
internal error: do not have privilege to execute the statement
drop database db1;
create database db2;
create table table_2(
col1 int,
col2 varchar
);
create view view_2 as select * from table_2;
create index index_table_2 on table_2(col1);
drop index index_table_2 on table_2;
drop view view_2;
drop table table_2;
drop database db2;
prepare s1 from select * from test_table where col1=?;
set @a=2;
execute s1 using @a;
col1    col2
2    b
deallocate prepare s1;
drop table if exists test_01;
create table test_01(a int, b varchar);
show create table test_01;
Table    Create Table
test_01    CREATE TABLE `test_01` (\n`a` INT DEFAULT NULL,\n`b` VARCHAR(65535) DEFAULT NULL\n)
insert into test_01 values (1,'a');
insert into test_01 values (2,'b');
update test_01 set a=100 where b='b';
select * from test_01;
a    b
1    a
100    b
select * from test_01;
a    b
1    a
100    b
explain select * from test_01;
QUERY PLAN
Project
  ->  Table Scan on test_db.test_01
delete from test_01 where a=1;
truncate table test_01;
drop table test_01;
drop database test_db;
use statement_query_type;
create database test_db;
begin;
use test_db;
create table test_table(
col1 int,
col2 varchar
);
create view test_view as select * from test_table;
show create database test_db;
Database    Create Database
test_db    CREATE DATABASE `test_db`
show create table test_table;
Table    Create Table
test_table    CREATE TABLE `test_table` (\n`col1` INT DEFAULT NULL,\n`col2` VARCHAR(65535) DEFAULT NULL\n)
show triggers;
Trigger    Event    Table    Statement    Timing    Created    sql_mode    Definer    character_set_client    collation_connection    Database Collation
show procedure status;
Db    Name    Type    Definer    Modified    Created    Security_type    Comment    character_set_client    collation_connection    Database Collation
show config;
1
show events;
1
show plugins;
1
show profiles;
1
show privileges;
1
show tables;
Tables_in_test_db
test_table
test_view
show index from test_table;
Table    Non_unique    Key_name    Seq_in_index    Column_name    Collation    Cardinality    Sub_part    Packed    Null    Index_type    Comment    Index_comment    Visible    Expression
values row(1,1), row(2,2), row(3,3) order by column_0 desc;
column_0    column_1
3    3
2    2
1    1
WITH cte1 AS (SELECT 1),cte2 AS (SELECT 2) SELECT * FROM cte1 join cte2;
1    2
1    2
select * from unnest('{"a":1}') as f;
col    seq    key    path    index    value    this
UNNEST_DEFAULT    0    a    $.a    null    1    {"a": 1}
insert into test_table values (1,'a'),(2,'b'),(3,'c');
insert into test_table values (4,'d');
create account test_account admin_name = 'test_name' identified by '111' open comment 'tenant_test';
internal error: do not have privilege to execute the statement
create role test_role;
internal error: administrative command is unsupported in transactions
create user user_name identified by 'password';
internal error: administrative command is unsupported in transactions
create database if not exists db1;
internal error: CREATE/DROP of database is not supported in transactions
grant create table,drop table on database *.* to test_role;
internal error: administrative command is unsupported in transactions
revoke test_role from user_name;
internal error: administrative command is unsupported in transactions
drop user user_name;
internal error: administrative command is unsupported in transactions
drop role test_role;
internal error: administrative command is unsupported in transactions
drop account test_account;
internal error: do not have privilege to execute the statement
drop database db1;
internal error: CREATE/DROP of database is not supported in transactions
create database db2;
internal error: CREATE/DROP of database is not supported in transactions
create table table_2(
col1 int,
col2 varchar
);
create view view_2 as select * from table_2;
create index index_table_2 on table_2(col1);
drop index index_table_2 on table_2;
drop view view_2;
drop table table_2;
drop database db2;
internal error: CREATE/DROP of database is not supported in transactions
prepare s1 from select * from test_table where col1=?;
set @a=2;
execute s1 using @a;
col1    col2
2    b
deallocate prepare s1;
rollback;
use system;
/* cloud_user */ use statement_query_type;
/* cloud_user */ begin;
/* cloud_user */ commit;
/* cloud_user */ start transaction;
/* cloud_user */ rollback;
/* cloud_user */ drop database if exists test_db;
/* cloud_user */ create database test_db;
/* cloud_user */ use test_db;
/* cloud_user */ drop table if exists test_table;
/* cloud_user */ create table test_table(col1 int,col2 varchar);
/* cloud_user */ create view test_view as select * from test_table;
/* cloud_user */ show create database test_db;
Database    Create Database
test_db    CREATE DATABASE `test_db`
/* cloud_user */ show create table test_table;
Table    Create Table
test_table    CREATE TABLE `test_table` (\n`col1` INT DEFAULT NULL,\n`col2` VARCHAR(65535) DEFAULT NULL\n)
/* cloud_user */ show create view test_view;
View    Create View
test_view    /* cloud_user */ create view test_view as select * from test_table;
/* cloud_user */ show triggers;
Trigger    Event    Table    Statement    Timing    Created    sql_mode    Definer    character_set_client    collation_connection    Database Collation
/* cloud_user */ show procedure status;
Db    Name    Type    Definer    Modified    Created    Security_type    Comment    character_set_client    collation_connection    Database Collation
/* cloud_user */ show config;
1
/* cloud_user */ show events;
1
/* cloud_user */ show plugins;
1
/* cloud_user */ show profiles;
1
/* cloud_user */ show privileges;
1
/* cloud_user */ show tables;
Tables_in_test_db
test_table
test_view
/* cloud_user */ show collation like 'utf8mb4_general_ci';
Collation    Charset    Id    Default    Compiled    Sortlen    Pad_attribute
utf8mb4_general_ci    utf8mb4    45        Yes    1    PAD SPACE
/* cloud_user */ show collation like 'utf8mb4_general_ci%';
Collation    Charset    Id    Default    Compiled    Sortlen    Pad_attribute
utf8mb4_general_ci    utf8mb4    45        Yes    1    PAD SPACE
/* cloud_user */ show index from test_table;
Table    Non_unique    Key_name    Seq_in_index    Column_name    Collation    Cardinality    Sub_part    Packed    Null    Index_type    Comment    Index_comment    Visible    Expression
/* cloud_user */ values row(1,1), row(2,2), row(3,3) order by column_0 desc;
column_0    column_1
3    3
2    2
1    1
/* cloud_user */ WITH cte1 AS (SELECT 1),cte2 AS (SELECT 2) SELECT * FROM cte1 join cte2;
1    2
1    2
/* cloud_user */ insert into test_table values (1,'a'),(2,'b'),(3,'c');
/* cloud_user */ update test_table set col2='xxx' where col1=1;
/* cloud_user */ delete from test_table where col1=3;
/* cloud_user */ create role test_role;
/* cloud_user */ create user user_name identified by 'password';
/* cloud_user */ create database if not exists db1;
/* cloud_user */ grant create table,drop table on database *.* to test_role;
/* cloud_user */ revoke test_role from user_name;
/* cloud_user */ drop user user_name;
/* cloud_user */ drop role test_role;
/* cloud_user */ drop account test_account;
/* cloud_user */ drop database db1;
/* cloud_user */ create database db2;
/* cloud_user */ create table table_2(col1 int,col2 varchar);
/* cloud_user */ create view view_2 as select * from table_2;
/* cloud_user */ create index index_table_2 on table_2(col1);
/* cloud_user */ drop index index_table_2 on table_2;
/* cloud_user */ drop view view_2;
/* cloud_user */ drop table table_2;
/* cloud_user */ drop database db2;
/* cloud_user */ select * from unnest('{"a":1}') as f;
col    seq    key    path    index    value    this
UNNEST_DEFAULT    0    a    $.a    null    1    {"a": 1}
/* cloud_user */ prepare s1 from select * from test_table where col1=?;
/* cloud_user */ set @a=2;
/* cloud_user */ execute s1 using @a;
col1    col2
2    b
/* cloud_user */ deallocate prepare s1;
/* cloud_user */ drop table if exists test_01;
/* cloud_user */ create table test_01(a int, b varchar);
/* cloud_user */ show create table test_01;
Table    Create Table
test_01    CREATE TABLE `test_01` (\n`a` INT DEFAULT NULL,\n`b` VARCHAR(65535) DEFAULT NULL\n)
/* cloud_user */ insert into test_01 values (1,'a');
/* cloud_user */ insert into test_01 values (2,'b');
/* cloud_user */ update test_01 set a=100 where b='b';
/* cloud_user */ select * from test_01;
a    b
1    a
100    b
/* cloud_user */ explain select * from test_01;
QUERY PLAN
Project
  ->  Table Scan on test_db.test_01
/* cloud_user */ delete from test_01 where a=1;
/* cloud_user */ truncate table test_01;
/* cloud_user */ drop table test_01;
/* cloud_user */ use system;
/* cloud_user */ drop database test_db;
/* cloud_nonuser */ use statement_query_type;
/* cloud_nonuser */ begin;
/* cloud_nonuser */ commit;
/* cloud_nonuser */ start transaction;
/* cloud_nonuser */ rollback;
/* cloud_nonuser */ drop database if exists test_db;
/* cloud_nonuser */ create database test_db;
/* cloud_nonuser */ use test_db;
/* cloud_nonuser */ drop table if exists test_table;
/* cloud_nonuser */ create table test_table(col1 int,col2 varchar);
/* cloud_nonuser */ create view test_view as select * from test_table;
/* cloud_nonuser */ show create database test_db;
Database    Create Database
test_db    CREATE DATABASE `test_db`
/* cloud_nonuser */ show create table test_table;
Table    Create Table
test_table    CREATE TABLE `test_table` (\n`col1` INT DEFAULT NULL,\n`col2` VARCHAR(65535) DEFAULT NULL\n)
/* cloud_nonuser */ show create view test_view;
View    Create View
test_view    /* cloud_nonuser */ create view test_view as select * from test_table;
/* cloud_nonuser */ show triggers;
Trigger    Event    Table    Statement    Timing    Created    sql_mode    Definer    character_set_client    collation_connection    Database Collation
/* cloud_nonuser */ show procedure status;
Db    Name    Type    Definer    Modified    Created    Security_type    Comment    character_set_client    collation_connection    Database Collation
/* cloud_nonuser */ show config;
1
/* cloud_nonuser */ show events;
1
/* cloud_nonuser */ show plugins;
1
/* cloud_nonuser */ show profiles;
1
/* cloud_nonuser */ show privileges;
1
/* cloud_nonuser */ show tables;
Tables_in_test_db
test_table
test_view
/* cloud_nonuser */ show collation like 'utf8mb4_general_ci';
Collation    Charset    Id    Default    Compiled    Sortlen    Pad_attribute
utf8mb4_general_ci    utf8mb4    45        Yes    1    PAD SPACE
/* cloud_nonuser */ show collation like 'utf8mb4_general_ci%';
Collation    Charset    Id    Default    Compiled    Sortlen    Pad_attribute
utf8mb4_general_ci    utf8mb4    45        Yes    1    PAD SPACE
/* cloud_nonuser */ show index from test_table;
Table    Non_unique    Key_name    Seq_in_index    Column_name    Collation    Cardinality    Sub_part    Packed    Null    Index_type    Comment    Index_comment    Visible    Expression
/* cloud_nonuser */ values row(1,1), row(2,2), row(3,3) order by column_0 desc;
column_0    column_1
3    3
2    2
1    1
/* cloud_nonuser */ WITH cte1 AS (SELECT 1),cte2 AS (SELECT 2) SELECT * FROM cte1 join cte2;
1    2
1    2
/* cloud_nonuser */ insert into test_table values (1,'a'),(2,'b'),(3,'c');
/* cloud_nonuser */ update test_table set col2='xxx' where col1=1;
/* cloud_nonuser */ delete from test_table where col1=3;
/* cloud_nonuser */ select sleep(1);
sleep(1)
0
/* cloud_nonuser */ create role test_role;
/* cloud_nonuser */ create user user_name identified by 'password';
/* cloud_nonuser */ create database if not exists db1;
/* cloud_nonuser */ grant create table,drop table on database *.* to test_role;
/* cloud_nonuser */ revoke test_role from user_name;
/* cloud_nonuser */ drop user user_name;
/* cloud_nonuser */ drop role test_role;
/* cloud_nonuser */ drop account test_account;
/* cloud_nonuser */ drop database db1;
/* cloud_nonuser */ create database db2;
/* cloud_nonuser */ create table table_2(col1 int,col2 varchar);
/* cloud_nonuser */ create view view_2 as select * from table_2;
/* cloud_nonuser */ create index index_table_2 on table_2(col1);
/* cloud_nonuser */ drop index index_table_2 on table_2;
/* cloud_nonuser */ drop view view_2;
/* cloud_nonuser */ drop table table_2;
/* cloud_nonuser */ drop database db2;
/* cloud_nonuser */ prepare s1 from select * from test_table where col1=?;
/* cloud_nonuser */ set @a=2;
/* cloud_nonuser */ execute s1 using @a;
col1    col2
2    b
/* cloud_nonuser */ deallocate prepare s1;
/* cloud_nonuser */ drop table if exists test_01;
/* cloud_nonuser */ create table test_01(a int, b varchar);
/* cloud_nonuser */ show create table test_01;
Table    Create Table
test_01    CREATE TABLE `test_01` (\n`a` INT DEFAULT NULL,\n`b` VARCHAR(65535) DEFAULT NULL\n)
/* cloud_nonuser */ insert into test_01 values (1,'a');
/* cloud_nonuser */ insert into test_01 values (2,'b');
/* cloud_nonuser */ update test_01 set a=100 where b='b';
/* cloud_nonuser */ select * from unnest('{"a":1}') as f;
col    seq    key    path    index    value    this
UNNEST_DEFAULT    0    a    $.a    null    1    {"a": 1}
/* cloud_nonuser */ select * from test_01;
a    b
1    a
100    b
/* cloud_nonuser */ explain select * from test_01;
QUERY PLAN
Project
  ->  Table Scan on test_db.test_01
/* cloud_nonuser */ delete from test_01 where a=1;
/* cloud_nonuser */ truncate table test_01;
/* cloud_nonuser */ drop table test_01;
/* cloud_nonuser */ use system;
/* cloud_nonuser */ drop database test_db;
drop account if exists bvt_query_type;
