set global enable_privilege_cache = off;
drop role if exists r1;
create role r1;
drop user if exists u1;
create user u1 identified by '111' default role r1;
show tables;
internal error: do not have privilege to execute the statement
use mo_catalog;
internal error: do not have privilege to execute the statement
create database t;
internal error: do not have privilege to execute the statement
grant show databases on account * to r1;
grant show tables on database * to r1;
use mo_catalog;
internal error: do not have privilege to execute the statement
show tables;
not connect to a database
create database t;
internal error: do not have privilege to execute the statement
grant connect on account * to r1;
use mo_catalog;
show tables;
Tables_in_mo_catalog
mo_indexes
mo_database
mo_tables
mo_columns
mo_table_partitions
mo_user
mo_role
mo_user_grant
mo_role_grant
mo_role_privs
mo_user_defined_function
mo_mysql_compatibility_mode
mo_pubs
mo_stored_procedure
mo_stages
mo_sessions
mo_snapshots
mo_configurations
mo_locks
mo_variables
mo_transactions
mo_cache
mo_version
mo_upgrade
mo_upgrade_tenant
mo_account
mo_foreign_keys
create database t;
internal error: do not have privilege to execute the statement
grant create database on account * to r1;
create database t;
use t;
create table A(a int);
drop table A;
grant create table on database * to r1;
use t;
create table A(a int);
insert into A values (1),(1);
grant insert on table t.* to r1;
use t;
insert into A values (1),(1);
select a from A;
a
1
1
1
1
grant select on table t.* to r1;
use t;
select a from A;
a
1
1
1
1
update A set a = 2 where a = 1;
update A set a = 2;
grant update on table t.* to r1;
use t;
update A set a = 2 where a = 1;
update A set a = 2;
delete from A where a = 2;
delete from A;
grant delete on table t.* to r1;
use t;
delete from A where a = 2;
delete from A;
select a from A;
a
drop table A;
grant drop table on database t to r1;
use t;
drop table A;
no such table t.a
create database s;
use s;
create table B(b int);
insert into B values (1),(1);
grant select,insert,update,delete on table s.* to r1;
use s;
insert into B values (1),(1);
select b from B;
b
1
1
1
1
update B set b = 2 where b=1;
update B set b = 2;
delete from B where b = 1;
delete from B;
drop table B;
grant drop table on database s to r1;
use s;
drop table B;
no such table s.b
drop database t;
drop database s;
create database v;
use v;
grant create table,drop table on database v to r1;
use v;
create table A(a int);
create table B(b int);
create table C(c int);
create table D(d int);
create table E(e int);
create table F(f int);
create table G(g int);
create table H(h int);
grant select on table v.A to r1;
use v;
select * from A,B;
internal error: do not have privilege to execute the statement
select * from A,B where A.a = B.b;
internal error: do not have privilege to execute the statement
grant select on table v.B to r1;
use v;
select * from A,B;
a    b
select * from A,B where A.a = B.b;
a    b
update C,D set c = d+1 where c = d;
grant update on table v.C to r1;
use v;
update C,D set c = d+1 where c = d;
grant update on table v.D to r1;
use v;
update C,D set c = d+1 where c = d;
use v;
delete E,F from E,F where E.e = F.f;
grant update on table v.E to r1;
grant delete on table v.F to r1;
use v;
delete E,F from E,F where E.e = F.f;
grant delete on table v.E to r1;
use v;
delete E,F from E,F where E.e = F.f;
use v;
insert into G select A.a from A,B where A.a = B.b;
grant insert on table v.G to r1;
use v;
insert into G select A.a from A,B where A.a = B.b;
drop database if exists t;
internal error: do not have privilege to execute the statement
drop database if exists s;
internal error: do not have privilege to execute the statement
drop database if exists v;
grant drop database on account * to r1;
drop database if exists t;
drop database if exists s;
drop database if exists v;
drop role if exists r1;
drop user if exists u1;
set global enable_privilege_cache = on;