set global enable_privilege_cache = off;
drop role if exists r1;
create role r1;
drop user if exists u1;
create user u1 identified by '111' default role r1;
show tables;
internal error: do not have privilege to execute the statement
use mo_catalog;
internal error: do not have privilege to execute the statement
create database t;
internal error: do not have privilege to execute the statement
grant show databases on account * to r1;
grant show tables on database * to r1;
use mo_catalog;
internal error: do not have privilege to execute the statement
show tables;
No database selected
create database t;
internal error: do not have privilege to execute the statement
grant connect on account * to r1;
use mo_catalog;
show tables;
➤ Tables_in_mo_catalog[12,-1,0]  𝄀
mo_account  𝄀
mo_branch_metadata  𝄀
mo_cache  𝄀
mo_cdc_task  𝄀
mo_cdc_watermark  𝄀
mo_columns  𝄀
mo_configurations  𝄀
mo_data_key  𝄀
mo_database  𝄀
mo_feature_limit  𝄀
mo_feature_registry  𝄀
mo_foreign_keys  𝄀
mo_index_update  𝄀
mo_indexes  𝄀
mo_iscp_log  𝄀
mo_locks  𝄀
mo_merge_settings  𝄀
mo_mysql_compatibility_mode  𝄀
mo_parquet_schema  𝄀
mo_partition_metadata  𝄀
mo_partition_tables  𝄀
mo_pitr  𝄀
mo_pubs  𝄀
mo_role  𝄀
mo_role_grant  𝄀
mo_role_privs  𝄀
mo_sessions  𝄀
mo_shards  𝄀
mo_shards_metadata  𝄀
mo_snapshots  𝄀
mo_stages  𝄀
mo_stored_procedure  𝄀
mo_subs  𝄀
mo_table_partitions  𝄀
mo_table_stats_alpha  𝄀
mo_tables  𝄀
mo_transactions  𝄀
mo_upgrade  𝄀
mo_upgrade_tenant  𝄀
mo_user  𝄀
mo_user_defined_function  𝄀
mo_user_grant  𝄀
mo_variables  𝄀
mo_version
create database t;
internal error: do not have privilege to execute the statement
grant create database on account * to r1;
create database t;
use t;
create table A(a int);
drop table A;
grant create table on database * to r1;
use t;
create table A(a int);
insert into A values (1),(1);
grant insert on table t.* to r1;
use t;
insert into A values (1),(1);
select a from A;
➤ a[4,32,0]  𝄀
1  𝄀
1  𝄀
1  𝄀
1
grant select on table t.* to r1;
use t;
select a from A;
➤ a[4,32,0]  𝄀
1  𝄀
1  𝄀
1  𝄀
1
update A set a = 2 where a = 1;
update A set a = 2;
grant update on table t.* to r1;
use t;
update A set a = 2 where a = 1;
update A set a = 2;
delete from A where a = 2;
delete from A;
grant delete on table t.* to r1;
use t;
delete from A where a = 2;
delete from A;
select a from A;
➤ a[4,32,0]
drop table A;
grant drop table on database t to r1;
use t;
drop table A;
no such table t.a
create database s;
use s;
create table B(b int);
insert into B values (1),(1);
grant select,insert,update,delete on table s.* to r1;
use s;
insert into B values (1),(1);
select b from B;
➤ b[4,32,0]  𝄀
1  𝄀
1  𝄀
1  𝄀
1
update B set b = 2 where b=1;
update B set b = 2;
delete from B where b = 1;
delete from B;
drop table B;
grant drop table on database s to r1;
use s;
drop table B;
no such table s.b
drop database t;
drop database s;
create database v;
use v;
grant create table,drop table on database v to r1;
use v;
create table A(a int);
create table B(b int);
create table C(c int);
create table D(d int);
create table E(e int);
create table F(f int);
create table G(g int);
create table H(h int);
grant select on table v.A to r1;
use v;
select * from A,B;
➤ a[4,32,0]  ¦  b[4,32,0]
select * from A,B where A.a = B.b;
➤ a[4,32,0]  ¦  b[4,32,0]
grant select on table v.B to r1;
use v;
select * from A,B;
➤ a[4,32,0]  ¦  b[4,32,0]
select * from A,B where A.a = B.b;
➤ a[4,32,0]  ¦  b[4,32,0]
update C,D set c = d+1 where c = d;
grant update on table v.C to r1;
use v;
update C,D set c = d+1 where c = d;
grant update on table v.D to r1;
use v;
update C,D set c = d+1 where c = d;
use v;
delete E,F from E,F where E.e = F.f;
grant update on table v.E to r1;
grant delete on table v.F to r1;
use v;
delete E,F from E,F where E.e = F.f;
grant delete on table v.E to r1;
use v;
delete E,F from E,F where E.e = F.f;
use v;
insert into G select A.a from A,B where A.a = B.b;
grant insert on table v.G to r1;
use v;
insert into G select A.a from A,B where A.a = B.b;
drop database if exists t;
internal error: do not have privilege to execute the statement
drop database if exists s;
internal error: do not have privilege to execute the statement
drop database if exists v;
grant drop database on account * to r1;
drop database if exists t;
drop database if exists s;
drop database if exists v;
drop role if exists r1;
drop user if exists u1;
create account `test_create_user` ADMIN_NAME "admin" IDENTIFIED BY "123";
create user if not exists user1 identified by '123';
create role if not exists role1;
grant CONNECT,create user,alter user, drop user on account * to role1;
grant role1 to user1;
create user user2 identified by '123' default role role1;
internal error: do not have privilege to execute the statement
create user user2 identified by '123' default role role1;
internal error: do not have privilege to execute the statement
drop account `test_create_user`;
set global enable_privilege_cache = on;
