set global enable_privilege_cache = off;
drop database if exists priv_db1;
create database priv_db1;
use priv_db1;
show tables;
tables_in_priv_db1
create table A(a int);
create table B(a int);
show tables;
tables_in_priv_db1
a
b
insert into A values (1),(2),(3),(4);
create view v1_on_A as select A.a from A order by A.a;
select * from v1_on_A;
a
1
2
3
4
insert into B select A.a + 1 from A;
select A.a,B.a from A, B where A.a = B.a order by A.a;
a    a
2    2
3    3
4    4
update B set a = a + 1;
select A.a,B.a from A, B where A.a = B.a order by A.a;
a    a
3    3
4    4
delete A from A,B where A.a = B.a;
select A.a from A order by a;
a
1
2
drop database if exists priv_db1;
set global enable_privilege_cache = on;