set global enable_privilege_cache = off;
drop database if exists protected_bvt_sys;
drop database if exists protected_bvt_sys_normal;
drop database if exists protected_bvt_sys_new;
drop user if exists protected_bvt_sys_user;
drop role if exists protected_bvt_sys_writer;
set global protected_databases = 'protected_bvt_sys,protected_bvt_sys_new';
select @@global.protected_databases;
@@protected_databases
protected_bvt_sys,protected_bvt_sys_new
create database protected_bvt_sys;
create table protected_bvt_sys.t1(a int primary key, b int);
insert into protected_bvt_sys.t1 values(1, 1);
create role protected_bvt_sys_writer;
grant create database,drop database on account * to protected_bvt_sys_writer;
grant all on database protected_bvt_sys to protected_bvt_sys_writer;
grant ownership on database protected_bvt_sys to protected_bvt_sys_writer;
grant all on table protected_bvt_sys.* to protected_bvt_sys_writer with grant option;
grant ownership on table protected_bvt_sys.t1 to protected_bvt_sys_writer;
create user protected_bvt_sys_user identified by '111' default role protected_bvt_sys_writer;
set enable_privilege_cache = off;
select a from protected_bvt_sys.t1;
a
1
create database protected_bvt_sys_normal;
drop database protected_bvt_sys_normal;
set global protected_databases = 'protected_bvt_sys_user_try';
internal error: do not have privilege to execute the statement
create database protected_bvt_sys_new;
internal error: do not have privilege to execute the statement
create table protected_bvt_sys.t2(a int);
internal error: do not have privilege to execute the statement
insert into protected_bvt_sys.t1 values(2, 2);
internal error: do not have privilege to execute the statement
drop database protected_bvt_sys;
internal error: do not have privilege to execute the statement
drop user if exists protected_bvt_sys_user;
drop role if exists protected_bvt_sys_writer;
drop database protected_bvt_sys;
set global protected_databases = 'protected_bvt_unused';
drop account if exists protected_bvt_acc;
create account protected_bvt_acc ADMIN_NAME 'admin' IDENTIFIED BY '111';
set enable_privilege_cache = off;
set global protected_databases = 'protected_bvt_db,protected_bvt_new,protected_bvt_clone,CamelDB';
set global protected_databases = '';
internal error: protected_databases cannot be cleared directly
set global protected_databases = ',';
internal error: protected_databases cannot be cleared directly
select @@global.protected_databases;
@@protected_databases
protected_bvt_db,protected_bvt_new,protected_bvt_clone,CamelDB
set global protected_databases = 'protected_bvt_db,protected_bvt_new,protected_bvt_clone,CamelDB';
create database protected_bvt_db;
create database protected_bvt_later;
create table protected_bvt_db.t1(a int primary key, b int);
insert into protected_bvt_db.t1 values(1, 1);
create index protected_bvt_idx on protected_bvt_db.t1(b);
create view protected_bvt_db.v1 as select * from protected_bvt_db.t1;
create table protected_bvt_db.pk_single(id int primary key, v varchar(10));
insert into protected_bvt_db.pk_single values(1, 'a');
create table protected_bvt_db.pk_compound(k1 int, k2 int, v varchar(10), primary key(k1, k2));
insert into protected_bvt_db.pk_compound values(1, 1, 'a');
create table protected_bvt_db.auto_pk(id int auto_increment primary key, v varchar(10));
insert into protected_bvt_db.auto_pk(v) values('a');
create table protected_bvt_db.uk_table(id int primary key, email varchar(20), unique key uk_email(email), key idx_email(email));
insert into protected_bvt_db.uk_table values(1, 'a@b');
create table protected_bvt_db.part_hash(id int, v varchar(10)) partition by hash(id) partitions 4;
insert into protected_bvt_db.part_hash values(1, 'a');
create table protected_bvt_db.part_range(id int, v varchar(10)) partition by range(id)(
partition p0 values less than (10),
partition p1 values less than (maxvalue)
);
insert into protected_bvt_db.part_range values(1, 'a');
create table protected_bvt_db.fk_parent(id int primary key, name varchar(10));
create table protected_bvt_db.fk_child(id int primary key, parent_id int, constraint fk_child_parent foreign key(parent_id) references protected_bvt_db.fk_parent(id));
insert into protected_bvt_db.fk_parent values(1, 'p1');
insert into protected_bvt_db.fk_child values(1, 1);
create table protected_bvt_db.fk_self(id int primary key, parent_id int, constraint fk_self_parent foreign key(parent_id) references protected_bvt_db.fk_self(id));
create table protected_bvt_later.t1(a int);
insert into protected_bvt_later.t1 values(10);
create role protected_bvt_writer;
grant create database,drop database on account * to protected_bvt_writer;
grant all on database protected_bvt_db to protected_bvt_writer;
grant ownership on database protected_bvt_db to protected_bvt_writer;
grant all on table protected_bvt_db.* to protected_bvt_writer with grant option;
grant ownership on table protected_bvt_db.t1 to protected_bvt_writer;
grant all on database protected_bvt_later to protected_bvt_writer;
grant all on table protected_bvt_later.* to protected_bvt_writer;
grant connect on account * to protected_bvt_writer;
create user protected_bvt_user identified by '111' default role protected_bvt_writer;
set enable_privilege_cache = off;
select @@global.protected_databases;
@@protected_databases
protected_bvt_db,protected_bvt_new,protected_bvt_clone,CamelDB
select database();
database()

use protected_bvt_later;
select a from t1;
a
10
set enable_privilege_cache = off;
set global protected_databases = 'protected_bvt_db,protected_bvt_new,protected_bvt_clone,CamelDB,protected_bvt_later';
set enable_privilege_cache = off;
use protected_bvt_db;
show tables;
Tables_in_protected_bvt_db
auto_pk
fk_child
fk_parent
fk_self
part_hash
part_range
pk_compound
pk_single
t1
uk_table
v1
select a from t1;
a
1
select a from protected_bvt_db.t1;
a
1
select a from protected_bvt_db.v1;
a
1
set enable_privilege_cache = off;
create sequence protected_bvt_db.s1;
create function protected_bvt_db.f1(a int) returns int language sql as '$1 + 1';
create procedure protected_bvt_db.p1() 'begin select 1; end';
set enable_privilege_cache = off;
create database protected_bvt_normal;
drop database protected_bvt_normal;
create database protected_bvt_new;
internal error: do not have privilege to execute the statement
create table protected_bvt_db.t2(a int);
internal error: do not have privilege to execute the statement
create external table protected_bvt_db.ext1(a int) infile{"filepath"='$resources/external_table_file/extable.csv'} fields terminated by ',' lines terminated by '\n';
internal error: do not have privilege to execute the statement
create dynamic table protected_bvt_db.dt1 as select * from protected_bvt_db.t1;
internal error: do not have privilege to execute the statement
create view protected_bvt_db.v2 as select * from protected_bvt_db.t1;
internal error: do not have privilege to execute the statement
alter view protected_bvt_db.v1 as select a from protected_bvt_db.t1;
internal error: do not have privilege to execute the statement
drop view protected_bvt_db.v1;
internal error: do not have privilege to execute the statement
alter database protected_bvt_db set mysql_compatibility_mode = '0.8.0';
internal error: do not have privilege to execute the statement
alter table protected_bvt_db.t1 add column c int;
internal error: do not have privilege to execute the statement
rename table protected_bvt_db.t1 to protected_bvt_db.t2;
internal error: do not have privilege to execute the statement
create index protected_bvt_idx2 on protected_bvt_db.t1(b);
internal error: do not have privilege to execute the statement
drop index protected_bvt_idx on protected_bvt_db.t1;
internal error: do not have privilege to execute the statement
create table protected_bvt_db.t_clone clone protected_bvt_db.t1;
internal error: do not have privilege to execute the statement
create database protected_bvt_clone clone protected_bvt_db;
internal error: do not have privilege to execute the statement
create sequence protected_bvt_db.s2;
internal error: do not have privilege to execute the statement
alter sequence protected_bvt_db.s1 increment by 2;
internal error: do not have privilege to execute the statement
drop sequence protected_bvt_db.s1;
internal error: do not have privilege to execute the statement
create function protected_bvt_db.f2(a int) returns int language sql as '$1 + 1';
internal error: do not have privilege to execute the statement
drop function protected_bvt_db.f1(int);
internal error: do not have privilege to execute the statement
create procedure protected_bvt_db.p2() 'begin select 1; end';
internal error: do not have privilege to execute the statement
drop procedure protected_bvt_db.p1;
internal error: do not have privilege to execute the statement
create connector for protected_bvt_db.conn1 with ("type"='kafka', "topic"='t1', "partition"='0', "value"='json', "bootstrap.servers"='127.0.0.1:9092');
internal error: do not have privilege to execute the statement
insert into protected_bvt_db.t1 values(2, 2);
internal error: do not have privilege to execute the statement
replace into protected_bvt_db.t1 values(2, 2);
internal error: do not have privilege to execute the statement
update protected_bvt_db.t1 set a = 3 where a = 1;
internal error: do not have privilege to execute the statement
delete from protected_bvt_db.t1 where a = 1;
internal error: do not have privilege to execute the statement
insert into protected_bvt_db.pk_single values(2, 'b');
internal error: do not have privilege to execute the statement
update protected_bvt_db.pk_compound set v = 'b' where k1 = 1 and k2 = 1;
internal error: do not have privilege to execute the statement
insert into protected_bvt_db.auto_pk(v) values('b');
internal error: do not have privilege to execute the statement
insert into protected_bvt_db.uk_table values(2, 'c@d');
internal error: do not have privilege to execute the statement
insert into protected_bvt_db.part_hash values(2, 'b');
internal error: do not have privilege to execute the statement
truncate table protected_bvt_db.part_range;
internal error: do not have privilege to execute the statement
insert into protected_bvt_db.fk_child values(2, 1);
internal error: do not have privilege to execute the statement
delete from protected_bvt_db.fk_parent where id = 1;
internal error: do not have privilege to execute the statement
alter table protected_bvt_db.fk_child drop foreign key fk_child_parent;
internal error: do not have privilege to execute the statement
drop table protected_bvt_db.fk_child;
internal error: do not have privilege to execute the statement
insert into protected_bvt_db.fk_self values(2, 1);
internal error: do not have privilege to execute the statement
truncate table protected_bvt_db.t1;
internal error: do not have privilege to execute the statement
drop table protected_bvt_db.t1;
internal error: do not have privilege to execute the statement
drop database protected_bvt_db;
internal error: do not have privilege to execute the statement
set enable_privilege_cache = off;
select @@global.protected_databases;
@@protected_databases
protected_bvt_db,protected_bvt_new,protected_bvt_clone,CamelDB,protected_bvt_later
select database();
database()
protected_bvt_later
create table t2(a int);
internal error: do not have privilege to execute the statement
drop table t1;
internal error: do not have privilege to execute the statement
create table t_ctas as select * from t1;
internal error: do not have privilege to execute the statement
set enable_privilege_cache = off;
insert into protected_bvt_later.t1 values(11);
internal error: do not have privilege to execute the statement
drop database protected_bvt_later;
internal error: do not have privilege to execute the statement
create database `CamelDB`;
internal error: do not have privilege to execute the statement
create database `cameldb`;
internal error: do not have privilege to execute the statement
drop database if exists `cameldb`;
internal error: do not have privilege to execute the statement
set enable_privilege_cache = off;
set global lower_case_table_names = 0;
set global protected_databases = 'ProtectedCaseDB';
set enable_privilege_cache = off;
select @@lower_case_table_names;
@@lower_case_table_names
1
create database `protectedcasedb`;
internal error: do not have privilege to execute the statement
drop database `protectedcasedb`;
internal error: do not have privilege to execute the statement
create database `ProtectedCaseDB`;
internal error: do not have privilege to execute the statement
drop database `ProtectedCaseDB`;
internal error: do not have privilege to execute the statement
set enable_privilege_cache = off;
set global lower_case_table_names = 1;
drop user if exists protected_bvt_user;
drop role if exists protected_bvt_writer;
drop database protected_bvt_db;
drop database protected_bvt_later;
drop database if exists `CamelDB`;
set global protected_databases = 'protected_bvt_unused';
set global lower_case_table_names = 1;
drop account protected_bvt_acc;
set global enable_privilege_cache = on;
