drop database if exists vecdb2;
create database vecdb2;
use vecdb2;
SET GLOBAL experimental_ivf_index = 1;
drop table if exists t1;
create table t1(a int primary key,b vecf32(3), c vecf64(5));
insert into t1 values(1, "[1,2,3]" , "[1,2,3,4,5");
internal error: malformed vector input: [1,2,3,4,5
insert into t1 values(2, "[1,2,4]", "[1,2,4,4,5]");
insert into t1 values(3, "[1,2.4,4]", "[1,2.4,4,4,5]");
insert into t1 values(4, "[1,2,5]", "[1,2,5,4,5]");
insert into t1 values(5, "[1,3,5]", "[1,3,5,4,5]");
insert into t1 values(6, "[100,44,50]", "[100,44,50,60,70]");
insert into t1 values(7, "[120,50,70]", "[120,50,70,80,90]");
insert into t1 values(8, "[130,40,90]", "[130,40,90,100,110]");
select a,b,normalize_l2(b) from t1;
a    b    normalize_l2(b)
2    [1, 2, 4]    [0.2182179, 0.4364358, 0.8728716]
3    [1, 2.4, 4]    [0.20961091, 0.5030662, 0.83844364]
4    [1, 2, 5]    [0.18257418, 0.36514837, 0.91287094]
5    [1, 3, 5]    [0.16903085, 0.50709254, 0.8451542]
6    [100, 44, 50]    [0.8322936, 0.36620918, 0.4161468]
7    [120, 50, 70]    [0.81274253, 0.33864272, 0.4740998]
8    [130, 40, 90]    [0.7970811, 0.24525574, 0.5518254]
select cluster_centers(b kmeans '2,vector_l2_ops') from t1;
cluster_centers(b, 2,vector_l2_ops)
[ [116.666664, 44.666668, 70],[1, 2.35, 4.5] ]
select cluster_centers(b kmeans '2,vector_ip_ops') from t1;
internal error: unsupported distance_type 'vector_ip_ops' for cluster_centers
select cluster_centers(b kmeans '2,vector_cosine_ops') from t1;
internal error: unsupported distance_type 'vector_cosine_ops' for cluster_centers
SELECT value FROM  (SELECT cluster_centers(b kmeans '2,vector_l2_ops,kmeansplusplus,false') AS centers FROM t1) AS subquery CROSS JOIN  UNNEST(subquery.centers) AS u;
value
[116.666664, 44.666668, 70]
[1, 2.35, 4.5]
SELECT value FROM  (SELECT cluster_centers(b kmeans '2,vector_l2_ops,kmeansplusplus,true') AS centers FROM t1) AS subquery CROSS JOIN  UNNEST(subquery.centers) AS u;
value
[0.8140391, 0.31670254, 0.4806907]
[0.19485846, 0.45293573, 0.8673351]
select a,c,normalize_l2(c) from t1;
a    c    normalize_l2(c)
2    [1, 2, 4, 4, 5]    [0.1270001270001905, 0.254000254000381, 0.508000508000762, 0.508000508000762, 0.6350006350009525]
3    [1, 2.4, 4, 4, 5]    [0.12523503624640608, 0.3005640869913746, 0.5009401449856243, 0.5009401449856243, 0.6261751812320304]
4    [1, 2, 5, 4, 5]    [0.11867816581938533, 0.23735633163877065, 0.5933908290969266, 0.4747126632775413, 0.5933908290969266]
5    [1, 3, 5, 4, 5]    [0.11470786693528087, 0.3441236008058426, 0.5735393346764044, 0.4588314677411235, 0.5735393346764044]
6    [100, 44, 50, 60, 70]    [0.6602997913373754, 0.29053190818844515, 0.3301498956686877, 0.3961798748024252, 0.46220985393616276]
7    [120, 50, 70, 80, 90]    [0.6298366572977736, 0.262431940540739, 0.3674047167570346, 0.4198911048651824, 0.4723774929733302]
8    [130, 40, 90, 100, 110]    [0.5890862307582768, 0.18125730177177748, 0.40782892898649936, 0.45314325442944375, 0.4984575798723881]
select cluster_centers(c kmeans '2,vector_l2_ops') from t1;
cluster_centers(c, 2,vector_l2_ops)
[ [116.66666666666666, 44.666666666666664, 70, 80, 90],[1, 2.35, 4.5, 4, 5] ]
select cluster_centers(c kmeans '2,vector_ip_ops') from t1;
internal error: unsupported distance_type 'vector_ip_ops' for cluster_centers
select cluster_centers(c kmeans '2,vector_cosine_ops') from t1;
internal error: unsupported distance_type 'vector_cosine_ops' for cluster_centers
SELECT value FROM  (SELECT cluster_centers(c kmeans '2,vector_l2_ops') AS centers FROM t1) AS subquery CROSS JOIN  UNNEST(subquery.centers) AS u;
value
[116.66666666666666, 44.666666666666664, 70, 80, 90]
[1, 2.35, 4.5, 4, 5]
SELECT value FROM  (SELECT cluster_centers(c kmeans '2,vector_l2_ops,kmeansplusplus,true') AS centers FROM t1) AS subquery CROSS JOIN  UNNEST(subquery.centers) AS u;
value
[0.6264075597978086, 0.24474038350032057, 0.3684611804707405, 0.42307141136568377, 0.477681642260627]
[0.1214052990003157, 0.28401106835909223, 0.5439677041899293, 0.4856211960012628, 0.6070264950015785]
drop table if exists tbl;
create table tbl(id int primary key, embedding vecf32(3));
insert into tbl values(1, "[1,2,3]");
insert into tbl values(2, "[1,2,4]");
insert into tbl values(3, "[1,2.4,4]");
insert into tbl values(4, "[1,2,5]");
insert into tbl values(5, "[1,3,5]");
insert into tbl values(6, "[100,44,50]");
insert into tbl values(7, "[120,50,70]");
insert into tbl values(8, "[130,40,90]");
create index idx1 using IVFFLAT on tbl(embedding) lists = 2 op_type 'vector_l2_ops';
show index from tbl;
Table    Non_unique    Key_name    Seq_in_index    Column_name    Collation    Cardinality    Sub_part    Packed    Null    Index_type    Comment    Index_comment    Index_params    Visible    Expression
tbl    0    PRIMARY    1    id    A    0    NULL    NULL                        YES    NULL
tbl    1    idx1    1    embedding    A    0    NULL    NULL    YES    ivfflat            {"lists":"2","op_type":"vector_l2_ops"}    YES    NULL
show create table tbl;
Table    Create Table
tbl    CREATE TABLE `tbl` (\n`id` INT NOT NULL,\n`embedding` VECF32(3) DEFAULT NULL,\nPRIMARY KEY (`id`),\nKEY `idx1` USING ivfflat (`embedding`) lists = 2  op_type 'vector_l2_ops' \n)
select name, type, column_name, algo, algo_table_type,algo_params from mo_catalog.mo_indexes where name="idx1";
name    type    column_name    algo    algo_table_type    algo_params
idx1    MULTIPLE    embedding    ivfflat    metadata    {"lists":"2","op_type":"vector_l2_ops"}
idx1    MULTIPLE    embedding    ivfflat    centroids    {"lists":"2","op_type":"vector_l2_ops"}
idx1    MULTIPLE    embedding    ivfflat    entries    {"lists":"2","op_type":"vector_l2_ops"}
alter table tbl alter reindex idx1 ivfflat lists=3;
show index from tbl;
Table    Non_unique    Key_name    Seq_in_index    Column_name    Collation    Cardinality    Sub_part    Packed    Null    Index_type    Comment    Index_comment    Index_params    Visible    Expression
tbl    0    PRIMARY    1    id    A    0    NULL    NULL                        YES    NULL
tbl    1    idx1    1    embedding    A    0    NULL    NULL    YES    ivfflat            {"lists":"3","op_type":"vector_l2_ops"}    YES    NULL
show create table tbl;
Table    Create Table
tbl    CREATE TABLE `tbl` (\n`id` INT NOT NULL,\n`embedding` VECF32(3) DEFAULT NULL,\nPRIMARY KEY (`id`),\nKEY `idx1` USING ivfflat (`embedding`) lists = 3  op_type 'vector_l2_ops' \n)
select name, type, column_name, algo, algo_table_type,algo_params from mo_catalog.mo_indexes where name="idx1";
name    type    column_name    algo    algo_table_type    algo_params
idx1    MULTIPLE    embedding    ivfflat    metadata    {"lists":"3","op_type":"vector_l2_ops"}
idx1    MULTIPLE    embedding    ivfflat    centroids    {"lists":"3","op_type":"vector_l2_ops"}
idx1    MULTIPLE    embedding    ivfflat    entries    {"lists":"3","op_type":"vector_l2_ops"}
alter table tbl add c vecf32(3);
show index from tbl;
Table    Non_unique    Key_name    Seq_in_index    Column_name    Collation    Cardinality    Sub_part    Packed    Null    Index_type    Comment    Index_comment    Index_params    Visible    Expression
tbl    1    idx1    1    embedding    A    0    NULL    NULL    YES    ivfflat            {"lists":"3","op_type":"vector_l2_ops"}    YES    NULL
tbl    0    PRIMARY    1    id    A    0    NULL    NULL                        YES    NULL
show create table tbl;
Table    Create Table
tbl    CREATE TABLE `tbl` (\n`id` INT NOT NULL,\n`embedding` VECF32(3) DEFAULT NULL,\n`c` VECF32(3) DEFAULT NULL,\nPRIMARY KEY (`id`),\nKEY `idx1` USING ivfflat (`embedding`) lists = 3  op_type 'vector_l2_ops' \n)
select name, type, column_name, algo, algo_table_type,algo_params from mo_catalog.mo_indexes where name="idx1";
name    type    column_name    algo    algo_table_type    algo_params
idx1    MULTIPLE    embedding    ivfflat    metadata    {"lists":"3","op_type":"vector_l2_ops"}
idx1    MULTIPLE    embedding    ivfflat    centroids    {"lists":"3","op_type":"vector_l2_ops"}
idx1    MULTIPLE    embedding    ivfflat    entries    {"lists":"3","op_type":"vector_l2_ops"}
drop table if exists tbl;
create table tbl(a int primary key,b vecf32(3), c vecf64(5));
create index idx2 using IVFFLAT on tbl(b) lists = 2 op_type 'vector_l2_ops';
show index from tbl;
Table    Non_unique    Key_name    Seq_in_index    Column_name    Collation    Cardinality    Sub_part    Packed    Null    Index_type    Comment    Index_comment    Index_params    Visible    Expression
tbl    0    PRIMARY    1    a    A    0    NULL    NULL                        YES    NULL
tbl    1    idx2    1    b    A    0    NULL    NULL    YES    ivfflat            {"lists":"2","op_type":"vector_l2_ops"}    YES    NULL
show create table tbl;
Table    Create Table
tbl    CREATE TABLE `tbl` (\n`a` INT NOT NULL,\n`b` VECF32(3) DEFAULT NULL,\n`c` VECF64(5) DEFAULT NULL,\nPRIMARY KEY (`a`),\nKEY `idx2` USING ivfflat (`b`) lists = 2  op_type 'vector_l2_ops' \n)
select name, type, column_name, algo, algo_table_type,algo_params from mo_catalog.mo_indexes where name="idx2";
name    type    column_name    algo    algo_table_type    algo_params
idx2    MULTIPLE    b    ivfflat    metadata    {"lists":"2","op_type":"vector_l2_ops"}
idx2    MULTIPLE    b    ivfflat    centroids    {"lists":"2","op_type":"vector_l2_ops"}
idx2    MULTIPLE    b    ivfflat    entries    {"lists":"2","op_type":"vector_l2_ops"}
drop table if exists tbl;
create table tbl(a int primary key,b vecf32(3), c vecf32(3));
insert into tbl values(1, "[1,2,3]","[1,2,3]");
insert into tbl values(2, "[1,2,4]","[1,2,4]");
insert into tbl values(3, "[1,2.4,4]","[1,2.4,4]");
insert into tbl values(4, "[1,2,5]","[1,2,5]");
create index idx3 using IVFFLAT on tbl(a) lists = 2 op_type 'vector_l2_ops';
not supported: IVFFLAT only supports VECFXX column types
create index idx4 using IVFFLAT on tbl(b,c) lists = 2 op_type 'vector_l2_ops';
not supported: don't support multi column  IVF vector index
create index idx5 using IVFFLAT on tbl(b) lists = -1;
SQL parser error: You have an error in your SQL syntax; check the manual that corresponds to your MatrixOne server version for the right syntax to use. syntax error at line 1 column 51 near " -1;";
create index idx6 using IVFFLAT on tbl(b) lists = 1 op_type 'vector_l1_ops';
internal error: invalid op_type. not of type 'vector_l2_ops'
drop table if exists tbl;
create table tbl(a int primary key,b vecf32(3), c vecf32(3));
insert into tbl values(1, "[1,2,3]","[1,2,3]");
insert into tbl values(2, "[1,2,4]","[1,2,4]");
insert into tbl values(3, "[1,2.4,4]","[1,2.4,4]");
insert into tbl values(4, "[1,2,5]","[1,2,5]");
create index idx7 using IVFFLAT on tbl(b);
drop table if exists tbl;
create table tbl(a int primary key, b vecf32(3));
insert into tbl values(1, "[1,2,3]");
insert into tbl values(2, "[1,2,4]");
insert into tbl values(3, "[1,2.4,4]");
insert into tbl values(4, "[1,2,5]");
insert into tbl values(5, "[1,3,5]");
insert into tbl values(6, "[100,44,50]"); -- dup
insert into tbl values(7, "[100,44,50]");
insert into tbl values(8, "[130,40,90]");
create index idx8 using IVFFLAT on tbl(b) lists = 2 op_type 'vector_l2_ops';
show index from tbl;
Table    Non_unique    Key_name    Seq_in_index    Column_name    Collation    Cardinality    Sub_part    Packed    Null    Index_type    Comment    Index_comment    Index_params    Visible    Expression
tbl    0    PRIMARY    1    a    A    0    NULL    NULL                        YES    NULL
tbl    1    idx8    1    b    A    0    NULL    NULL    YES    ivfflat            {"lists":"2","op_type":"vector_l2_ops"}    YES    NULL
show create table tbl;
Table    Create Table
tbl    CREATE TABLE `tbl` (\n`a` INT NOT NULL,\n`b` VECF32(3) DEFAULT NULL,\nPRIMARY KEY (`a`),\nKEY `idx8` USING ivfflat (`b`) lists = 2  op_type 'vector_l2_ops' \n)
select name, type, column_name, algo, algo_table_type,algo_params from mo_catalog.mo_indexes where name="idx8";
name    type    column_name    algo    algo_table_type    algo_params
idx8    MULTIPLE    b    ivfflat    metadata    {"lists":"2","op_type":"vector_l2_ops"}
idx8    MULTIPLE    b    ivfflat    centroids    {"lists":"2","op_type":"vector_l2_ops"}
idx8    MULTIPLE    b    ivfflat    entries    {"lists":"2","op_type":"vector_l2_ops"}
drop table if exists tbl;
create table tbl(a int primary key, b vecf32(3), index idx9 using ivfflat (b));
drop table if exists tbl;
create table tbl(a int primary key, b vecf32(3), index idx10 using ivfflat (b));
insert into tbl values(1, "[1,2,3]");
insert into tbl values(2, "[1,2,4]");
show index from tbl;
Table    Non_unique    Key_name    Seq_in_index    Column_name    Collation    Cardinality    Sub_part    Packed    Null    Index_type    Comment    Index_comment    Index_params    Visible    Expression
tbl    1    idx10    1    b    A    0    NULL    NULL    YES    ivfflat            {"lists":"1","op_type":"vector_l2_ops"}    YES    NULL
tbl    0    PRIMARY    1    a    A    0    NULL    NULL                        YES    NULL
show create table tbl;
Table    Create Table
tbl    CREATE TABLE `tbl` (\n`a` INT NOT NULL,\n`b` VECF32(3) DEFAULT NULL,\nPRIMARY KEY (`a`),\nKEY `idx10` USING ivfflat (`b`) lists = 1  op_type 'vector_l2_ops' \n)
select name, type, column_name, algo, algo_table_type,algo_params from mo_catalog.mo_indexes where name="idx10";
name    type    column_name    algo    algo_table_type    algo_params
idx10    MULTIPLE    b    ivfflat    metadata    {"lists":"1","op_type":"vector_l2_ops"}
idx10    MULTIPLE    b    ivfflat    centroids    {"lists":"1","op_type":"vector_l2_ops"}
idx10    MULTIPLE    b    ivfflat    entries    {"lists":"1","op_type":"vector_l2_ops"}
alter table tbl drop column b;
show index from tbl;
Table    Non_unique    Key_name    Seq_in_index    Column_name    Collation    Cardinality    Sub_part    Packed    Null    Index_type    Comment    Index_comment    Index_params    Visible    Expression
tbl    0    PRIMARY    1    a    A    0    NULL    NULL                        YES    NULL
show create table tbl;
Table    Create Table
tbl    CREATE TABLE `tbl` (\n`a` INT NOT NULL,\nPRIMARY KEY (`a`)\n)
select name, type, column_name, algo, algo_table_type,algo_params from mo_catalog.mo_indexes where name="idx10";
name    type    column_name    algo    algo_table_type    algo_params
drop table if exists tbl;
create table tbl(a int primary key, b vecf32(3), index idx11 using ivfflat (b));
insert into tbl values(1, "[1,2,3]");
insert into tbl values(2, "[1,2,4]");
show index from tbl;
Table    Non_unique    Key_name    Seq_in_index    Column_name    Collation    Cardinality    Sub_part    Packed    Null    Index_type    Comment    Index_comment    Index_params    Visible    Expression
tbl    1    idx11    1    b    A    0    NULL    NULL    YES    ivfflat            {"lists":"1","op_type":"vector_l2_ops"}    YES    NULL
tbl    0    PRIMARY    1    a    A    0    NULL    NULL                        YES    NULL
show create table tbl;
Table    Create Table
tbl    CREATE TABLE `tbl` (\n`a` INT NOT NULL,\n`b` VECF32(3) DEFAULT NULL,\nPRIMARY KEY (`a`),\nKEY `idx11` USING ivfflat (`b`) lists = 1  op_type 'vector_l2_ops' \n)
select name, type, column_name, algo, algo_table_type,algo_params from mo_catalog.mo_indexes where name="idx11";
name    type    column_name    algo    algo_table_type    algo_params
idx11    MULTIPLE    b    ivfflat    metadata    {"lists":"1","op_type":"vector_l2_ops"}
idx11    MULTIPLE    b    ivfflat    centroids    {"lists":"1","op_type":"vector_l2_ops"}
idx11    MULTIPLE    b    ivfflat    entries    {"lists":"1","op_type":"vector_l2_ops"}
alter table tbl drop index idx11;
show index from tbl;
Table    Non_unique    Key_name    Seq_in_index    Column_name    Collation    Cardinality    Sub_part    Packed    Null    Index_type    Comment    Index_comment    Index_params    Visible    Expression
tbl    0    PRIMARY    1    a    A    0    NULL    NULL                        YES    NULL
show create table tbl;
Table    Create Table
tbl    CREATE TABLE `tbl` (\n`a` INT NOT NULL,\n`b` VECF32(3) DEFAULT NULL,\nPRIMARY KEY (`a`)\n)
select name, type, column_name, algo, algo_table_type,algo_params from mo_catalog.mo_indexes where name="idx11";
name    type    column_name    algo    algo_table_type    algo_params
drop table if exists tbl;
create table tbl(id int primary key, embedding vecf32(3));
insert into tbl values(1, "[1,2,3]");
insert into tbl values(2, "[1,2,4]");
insert into tbl values(3, "[1,2.4,4]");
insert into tbl values(4, "[1,2,5]");
insert into tbl values(5, "[1,3,5]");
insert into tbl values(6, "[100,44,50]");
insert into tbl values(7, "[120,50,70]");
insert into tbl values(8, "[130,40,90]");
create index idx12 using ivfflat on tbl(embedding) lists=2 op_type "vector_l2_ops";
show index from tbl;
Table    Non_unique    Key_name    Seq_in_index    Column_name    Collation    Cardinality    Sub_part    Packed    Null    Index_type    Comment    Index_comment    Index_params    Visible    Expression
tbl    0    PRIMARY    1    id    A    0    NULL    NULL                        YES    NULL
tbl    1    idx12    1    embedding    A    0    NULL    NULL    YES    ivfflat            {"lists":"2","op_type":"vector_l2_ops"}    YES    NULL
show create table tbl;
Table    Create Table
tbl    CREATE TABLE `tbl` (\n`id` INT NOT NULL,\n`embedding` VECF32(3) DEFAULT NULL,\nPRIMARY KEY (`id`),\nKEY `idx12` USING ivfflat (`embedding`) lists = 2  op_type 'vector_l2_ops' \n)
insert into tbl values(15, "[1,3,5]"); -- inserted to centroid 1 of version 0
insert into tbl values(18, "[130,40,90]"); -- inserted to centroid 2 of version 0
alter table tbl alter reindex idx12 ivfflat lists=2;
insert into tbl values(25, "[2,4,5]"); -- inserted to cluster 1 of version 1
insert into tbl values(28, "[131,41,91]"); -- inserted to cluster 2 of version 1
drop table if exists tbl;
create table tbl(id int, age int, embedding vecf32(3), primary key(id, age));
insert into tbl values(1, 10, "[1,2,3]");
insert into tbl values(2, 20, "[1,2,4]");
insert into tbl values(3, 30, "[1,2.4,4]");
insert into tbl values(4, 40, "[1,2,5]");
insert into tbl values(5, 50, "[1,3,5]");
insert into tbl values(6, 60, "[100,44,50]");
insert into tbl values(7, 70, "[120,50,70]");
insert into tbl values(8, 80, "[130,40,90]");
create index idx13 using ivfflat on tbl(embedding) lists=2 op_type "vector_l2_ops";
show index from tbl;
Table    Non_unique    Key_name    Seq_in_index    Column_name    Collation    Cardinality    Sub_part    Packed    Null    Index_type    Comment    Index_comment    Index_params    Visible    Expression
tbl    0    PRIMARY    1    id    A    0    NULL    NULL                        YES    NULL
tbl    0    PRIMARY    2    age    A    0    NULL    NULL                        YES    NULL
tbl    1    idx13    1    embedding    A    0    NULL    NULL    YES    ivfflat            {"lists":"2","op_type":"vector_l2_ops"}    YES    NULL
show create table tbl;
Table    Create Table
tbl    CREATE TABLE `tbl` (\n`id` INT NOT NULL,\n`age` INT NOT NULL,\n`embedding` VECF32(3) DEFAULT NULL,\nPRIMARY KEY (`id`,`age`),\nKEY `idx13` USING ivfflat (`embedding`) lists = 2  op_type 'vector_l2_ops' \n)
insert into tbl values(15, 90, "[1,3,5]"); -- inserted to centroid 1 of version 0
insert into tbl values(18, 100, "[130,40,90]"); -- inserted to centroid 2 of version 0
alter table tbl alter reindex idx13 ivfflat lists=2;
insert into tbl values(25, 110, "[2,4,5]"); -- inserted to cluster 1 of version 1
insert into tbl values(28, 120, "[131,41,91]"); -- inserted to cluster 2 of version 1
drop table if exists tbl;
create table tbl(id int, embedding vecf32(3));
insert into tbl values(1, "[1,2,3]");
insert into tbl values(2, "[1,2,4]");
insert into tbl values(3, "[1,2.4,4]");
insert into tbl values(4, "[1,2,5]");
insert into tbl values(5, "[1,3,5]");
insert into tbl values(6, "[100,44,50]");
insert into tbl values(7, "[120,50,70]");
insert into tbl values(8, "[130,40,90]");
create index idx14 using ivfflat on tbl(embedding) lists=2 op_type "vector_l2_ops";
show index from tbl;
Table    Non_unique    Key_name    Seq_in_index    Column_name    Collation    Cardinality    Sub_part    Packed    Null    Index_type    Comment    Index_comment    Index_params    Visible    Expression
tbl    1    idx14    1    embedding    A    0    NULL    NULL    YES    ivfflat            {"lists":"2","op_type":"vector_l2_ops"}    YES    NULL
show create table tbl;
Table    Create Table
tbl    CREATE TABLE `tbl` (\n`id` INT DEFAULT NULL,\n`embedding` VECF32(3) DEFAULT NULL,\nKEY `idx14` USING ivfflat (`embedding`) lists = 2  op_type 'vector_l2_ops' \n)
insert into tbl values(15, "[1,3,5]"); -- inserted to centroid 1 of version 0
insert into tbl values(18, "[130,40,90]"); -- inserted to centroid 2 of version 0
alter table tbl alter reindex idx14 ivfflat lists=2;
insert into tbl values(25, "[2,4,5]"); -- inserted to cluster 1 of version 1
insert into tbl values(28, "[131,41,91]"); -- inserted to cluster 2 of version 1
drop table if exists tbl;
create table tbl(id int primary key, embedding vecf32(3));
insert into tbl values(1, "[1,2,3]");
insert into tbl values(2, "[1,2,4]");
insert into tbl values(3, "[1,2.4,4]");
insert into tbl values(4, "[1,2,5]");
insert into tbl values(5, "[1,3,5]");
insert into tbl values(6, "[100,44,50]");
insert into tbl values(7, "[120,50,70]");
insert into tbl values(8, "[130,40,90]");
create index idx15 using ivfflat on tbl(embedding) lists=2 op_type "vector_l2_ops";
insert into tbl values(9, "[130,40,90]");
delete from tbl where id=9; -- delete 9
delete from tbl where embedding="[130,40,90]"; -- delete 8
alter table tbl alter reindex idx15 ivfflat lists=2;
insert into tbl values(10, "[130,40,90]");
delete from tbl where id=6; -- removes both (0,6) and (1,6) entries
delete from tbl where embedding="[1,3,5]"; -- removes both (0,5) and (1,5) entries
delete from tbl where id=10; -- removes (1,10)
drop table if exists tbl;
create table tbl(id int primary key, embedding vecf32(3));
insert into tbl values(1, "[1,2,3]");
insert into tbl values(2, "[1,2,4]");
insert into tbl values(3, "[1,2.4,4]");
insert into tbl values(4, "[1,2,5]");
insert into tbl values(5, "[1,3,5]");
insert into tbl values(6, "[100,44,50]");
insert into tbl values(7, "[120,50,70]");
insert into tbl values(8, "[130,40,90]");
create index idx16 using ivfflat on tbl(embedding) lists=2 op_type "vector_l2_ops";
delete from tbl;
drop table if exists tbl;
create table tbl(id int primary key, embedding vecf32(3));
insert into tbl values(1, "[1,2,3]");
insert into tbl values(2, "[1,2,4]");
insert into tbl values(3, "[1,2.4,4]");
insert into tbl values(4, "[1,2,5]");
insert into tbl values(5, "[1,3,5]");
insert into tbl values(6, "[100,44,50]");
insert into tbl values(7, "[120,50,70]");
insert into tbl values(8, "[130,40,90]");
create index idx16 using ivfflat on tbl(embedding) lists=2 op_type "vector_l2_ops";
truncate table tbl;
drop table if exists tbl;
create table tbl(id int primary key, embedding vecf32(3));
insert into tbl values(1, "[1,2,3]");
insert into tbl values(2, "[1,2,4]");
insert into tbl values(3, "[1,2.4,4]");
insert into tbl values(4, "[1,2,5]");
insert into tbl values(5, "[1,3,5]");
insert into tbl values(6, "[100,44,50]");
insert into tbl values(7, "[120,50,70]");
insert into tbl values(8, "[130,40,90]");
create index idx16 using ivfflat on tbl(embedding) lists=2 op_type "vector_l2_ops";
update tbl set embedding="[1,2,3]" where id=8; -- update 8 to cluster 1 from cluster 2
update tbl set id=9 where id=8; -- update 8 to 9
alter table tbl alter reindex idx16 ivfflat lists=2;
update tbl set embedding="[1,2,3]" where id=7; -- update 7 to cluster 1 from cluster 2 for the latest versions
update tbl set id=10 where id=7; -- update 7 to 10
drop table if exists tbl;
create table tbl(id varchar(20), age varchar(20), embedding vecf32(3), primary key(id, age));
insert into tbl values("1", "10", "[1,2,3]");
insert into tbl values("2", "20", "[1,2,4]");
insert into tbl values("3", "30", "[1,2.4,4]");
insert into tbl values("4", "40", "[1,2,5]");
insert into tbl values("5", "50", "[1,3,5]");
insert into tbl values("6", "60", "[100,44,50]");
insert into tbl values("7", "70", "[120,50,70]");
insert into tbl values("8", "80", "[130,40,90]");
create index idx17 using ivfflat on tbl(embedding) lists=2 op_type "vector_l2_ops";
update tbl set embedding="[1,2,3]" where id="8";
update tbl set embedding="[1,2,3]" where id="7" and age = "70";
update tbl set id="70" where id="7";
alter table tbl alter reindex idx17 ivfflat lists=2;
update tbl set embedding="[1,2,3]" where id="6";
update tbl set id="60" where id="6";
drop table if exists tbl;
create table tbl(id int, embedding vecf32(3));
insert into tbl values(1, "[1,2,3]");
insert into tbl values(2, "[1,2,4]");
insert into tbl values(3, "[1,2.4,4]");
insert into tbl values(4, "[1,2,5]");
insert into tbl values(5, "[1,3,5]");
insert into tbl values(6, "[100,44,50]");
insert into tbl values(7, "[120,50,70]");
insert into tbl values(8, "[130,40,90]");
create index idx17 using ivfflat on tbl(embedding) lists=2 op_type "vector_l2_ops";
update tbl set embedding="[1,2,3]" where id="8";
delete from tbl where id="8";
drop table if exists tbl;
create table tbl(id int primary key, embedding vecf32(3), key idx18 using ivfflat (embedding) lists=2 op_type "vector_l2_ops");
insert into tbl values(1, "[1,2,3]");
insert into tbl values(2, "[1,2,4]");
insert into tbl values(3, "[1,2.4,4]");
insert into tbl values(4, "[1,2,5]");
insert into tbl values(5, "[1,3,5]");
insert into tbl values(6, "[100,44,50]");
insert into tbl values(7, "[120,50,70]");
insert into tbl values(8, "[130,40,90]");
alter table tbl add column id2 VARCHAR(20);
update tbl set id2 = id;
drop table if exists tbl1;
create table tbl1(id int primary key, data vecf32(3));
insert into tbl1 values(1, "[1,2,3]");
insert into tbl1 values(2, "[1,2,4]");
insert into tbl1 values(3, "[1,2.4,4]");
insert into tbl1 values(4, "[1,2,5]");
insert into tbl1 values(5, "[1,3,5]");
insert into tbl1 values(6, "[100,44,50]");
insert into tbl1 values(7, "[120,50,70]");
insert into tbl1 values(8, "[130,40,90]");
create index idx19 using ivfflat on tbl1(data) lists=2 op_type "vector_l2_ops";
insert into tbl1 values(9, "[130,40,90]");
drop table if exists tbl2;
create table tbl2(id int primary key, data vecf32(3), key idx20 using ivfflat (data) lists=2 op_type "vector_l2_ops");
insert into tbl2 select * from tbl1;
drop table if exists tbl1;
create table tbl1(id int primary key, data vecf32(3));
create index idx19 using ivfflat on tbl1(data) lists=2 op_type "vector_l2_ops";
insert into tbl1 values(1, "[1,2,3]");
insert into tbl1 values(2, "[1,2,4]");
insert into tbl1 values(3, "[1,2.4,4]");
insert into tbl1 values(4, "[1,2,5]");
insert into tbl1 values(5, "[1,3,5]");
insert into tbl1 values(6, "[100,44,50]");
insert into tbl1 values(7, "[120,50,70]");
insert into tbl1 values(8, "[130,40,90]");
drop table if exists tbl;
create table tbl(id int primary key, data vecf32(3));
insert into tbl values(1, NULL);
insert into tbl values(2, NULL);
insert into tbl values(3, NULL);
insert into tbl values(4, "[1,2,5]");
insert into tbl values(5, "[1,3,5]");
create index idx20 using ivfflat on tbl(data) lists=2 op_type "vector_l2_ops";
insert into tbl values(6, NULL);
insert into tbl values(7, "[130,40,90]");
drop table if exists tbl;
create table tbl(id int primary key, data vecf32(3));
insert into tbl values(1, "[1,2,3]");
insert into tbl values(2, "[1,2,4]");
create index idx21 using ivfflat on tbl(data) lists=3 op_type "vector_l2_ops";
drop table if exists tbl;
create table tbl(id int primary key, data vecf32(3));
create index idx22 using ivfflat on tbl(data) lists=3 op_type "vector_l2_ops";
insert into tbl values(1, "[1,2,3]");
insert into tbl values(2, "[1,2,4]");
drop table if exists tbl;
create table tbl(id int, embedding vecf32(3));
insert into tbl values(1, "[1,2,3]");
insert into tbl values(2, "[1,2,4]");
insert into tbl values(3, "[1,2.4,4]");
insert into tbl values(4, "[1,2,5]");
insert into tbl values(5, "[1,3,5]");
insert into tbl values(6, "[100,44,50]");
insert into tbl values(7, "[120,50,70]");
insert into tbl values(8, "[130,40,90]");
create index idx23 using ivfflat on tbl(embedding) lists=2 op_type "vector_l2_ops";
alter table tbl alter reindex idx23 ivfflat lists=2;
truncate table tbl;
insert into tbl values(1, "[1,2,3]");
insert into tbl values(2, "[1,2,4]");
insert into tbl values(3, "[1,2.4,4]");
insert into tbl values(4, "[1,2,5]");
insert into tbl values(5, "[1,3,5]");
insert into tbl values(6, "[100,44,50]");
insert into tbl values(7, "[120,50,70]");
insert into tbl values(8, "[130,40,90]");
drop table if exists tbl;
create table tbl(id int, embedding vecf32(3));
insert into tbl values(1, "[1,2,3]");
insert into tbl values(2, "[1,2,4]");
insert into tbl values(3, "[1,2.4,4]");
insert into tbl values(4, "[1,2,5]");
insert into tbl values(5, "[1,3,5]");
insert into tbl values(6, "[100,44,50]");
insert into tbl values(7, "[120,50,70]");
insert into tbl values(8, "[130,40,90]");
create index idx23 using ivfflat on tbl(embedding) lists=2 op_type "vector_l2_ops";
alter table tbl alter reindex idx23 ivfflat lists=2;
delete from tbl;
insert into tbl values(1, "[1,2,3]");
insert into tbl values(2, "[1,2,4]");
insert into tbl values(3, "[1,2.4,4]");
insert into tbl values(4, "[1,2,5]");
insert into tbl values(5, "[1,3,5]");
insert into tbl values(6, "[100,44,50]");
insert into tbl values(7, "[120,50,70]");
insert into tbl values(8, "[130,40,90]");
drop table if exists tbl;
create table tbl(id int primary key, embedding vecf32(3));
insert into tbl values(1, "[1,2,3]");
insert into tbl values(2, "[1,2,4]");
insert into tbl values(3, "[1,2.4,4]");
insert into tbl values(4, "[1,2,5]");
insert into tbl values(5, "[1,3,5]");
insert into tbl values(6, "[100,44,50]");
insert into tbl values(7, "[120,50,70]");
insert into tbl values(8, "[130,40,90]");
create index idx16 using ivfflat on tbl(embedding) lists=2 op_type "vector_l2_ops";
create index idx17 using ivfflat on tbl(embedding) lists=2 op_type "vector_l2_ops";
insert into tbl values(9, "[130,40,90]");
drop table if exists tbl;
SET @PROBE_LIMIT=1;
create table tbl(id int PRIMARY KEY, embedding vecf32(3));
insert into tbl values(1, "[1,2,3]");
insert into tbl values(2, "[1,2,4]");
insert into tbl values(3, "[1,2.4,4]");
insert into tbl values(4, "[1,2,5]");
insert into tbl values(5, "[1,3,5]");
insert into tbl values(6, "[100,44,50]");
insert into tbl values(7, "[120,50,70]");
insert into tbl values(8, "[130,40,90]");
SELECT id, embedding FROM tbl ORDER BY l2_distance(embedding,'[120,51,70]') ASC LIMIT 3;
id    embedding
7    [120, 50, 70]
8    [130, 40, 90]
6    [100, 44, 50]
create index idx using ivfflat on tbl(embedding) lists=2 op_type "vector_l2_ops";
SELECT id, embedding FROM tbl ORDER BY l2_distance(embedding,'[120,51,70]') ASC LIMIT 3;
id    embedding
7    [120, 50, 70]
8    [130, 40, 90]
6    [100, 44, 50]
drop table if exists tbl;
create table tbl(id int, embedding vecf32(3));
insert into tbl values(1, "[1,2,3]");
insert into tbl values(2, "[1,2,4]");
insert into tbl values(3, "[1,2.4,4]");
insert into tbl values(4, "[1,2,5]");
insert into tbl values(5, "[1,3,5]");
insert into tbl values(6, "[100,44,50]");
insert into tbl values(7, "[120,50,70]");
insert into tbl values(8, "[130,40,90]");
SELECT id, embedding FROM tbl ORDER BY l2_distance(embedding,'[120,51,70]') ASC LIMIT 3;
id    embedding
7    [120, 50, 70]
8    [130, 40, 90]
6    [100, 44, 50]
create index idx using ivfflat on tbl(embedding) lists=2 op_type "vector_l2_ops";
SELECT id, embedding FROM tbl ORDER BY l2_distance(embedding,'[120,51,70]') ASC LIMIT 3;
id    embedding
7    [120, 50, 70]
8    [130, 40, 90]
6    [100, 44, 50]
drop table if exists tbl;
create table tbl(id int, id2 int, embedding vecf32(3), primary key(id, id2));
insert into tbl values(1, 0,"[1,2,3]");
insert into tbl values(2, 0, "[1,2,4]");
insert into tbl values(3, 0,"[1,2.4,4]");
insert into tbl values(4, 0, "[1,2,5]");
insert into tbl values(5, 0, "[1,3,5]");
insert into tbl values(6, 0, "[100,44,50]");
insert into tbl values(7, 0, "[120,50,70]");
insert into tbl values(8, 0, "[130,40,90]");
SELECT id,id2, embedding FROM tbl ORDER BY l2_distance(embedding,'[120,51,70]') ASC LIMIT 3;
id    id2    embedding
7    0    [120, 50, 70]
8    0    [130, 40, 90]
6    0    [100, 44, 50]
create index idx using ivfflat on tbl(embedding) lists=2 op_type "vector_l2_ops";
SELECT id,id2, embedding FROM tbl ORDER BY l2_distance(embedding,'[120,51,70]') ASC LIMIT 3;
id    id2    embedding
7    0    [120, 50, 70]
8    0    [130, 40, 90]
6    0    [100, 44, 50]
SET @test_limit = 3;
SELECT id from tbl LIMIT @test_limit;
id
1
2
3
create table vector_index_05(a int primary key, b vecf32(3),c vecf32(4));
create index idx01 using ivfflat on vector_index_05(c) lists=4 op_type "vector_l2_ops";
show create table vector_index_05;
Table    Create Table
vector_index_05    CREATE TABLE `vector_index_05` (\n`a` INT NOT NULL,\n`b` VECF32(3) DEFAULT NULL,\n`c` VECF32(4) DEFAULT NULL,\nPRIMARY KEY (`a`),\nKEY `idx01` USING ivfflat (`c`) lists = 4  op_type 'vector_l2_ops' \n)
alter table vector_index_05 alter reindex idx01 ivfflat lists=5;
show create table vector_index_05;
Table    Create Table
vector_index_05    CREATE TABLE `vector_index_05` (\n`a` INT NOT NULL,\n`b` VECF32(3) DEFAULT NULL,\n`c` VECF32(4) DEFAULT NULL,\nPRIMARY KEY (`a`),\nKEY `idx01` USING ivfflat (`c`) lists = 5  op_type 'vector_l2_ops' \n)
create table vector_index_04(a int primary key, b vecf32(3),c vecf32(4));
insert into vector_index_04 values(1,"[56,23,6]","[0.25,0.14,0.88,0.0001]"),(2,"[77,45,3]","[1.25,5.25,8.699,4.25]"),(3,"[8,56,3]","[9.66,5.22,1.22,7.02]");
create index idx01 using ivfflat on vector_index_04(c) lists=5 op_type "vector_l2_ops";
insert into vector_index_04 values(4,"[156,213,61]","[10.25,0.14,0.88,10.0001]"),(5,"[177,425,30]","[11.25,51.25,80.699,44.25]"),(6,"[80,56,3]","[90.686,5.212,19.22,7.02]");
show create table vector_index_04;
Table    Create Table
vector_index_04    CREATE TABLE `vector_index_04` (\n`a` INT NOT NULL,\n`b` VECF32(3) DEFAULT NULL,\n`c` VECF32(4) DEFAULT NULL,\nPRIMARY KEY (`a`),\nKEY `idx01` USING ivfflat (`c`) lists = 5  op_type 'vector_l2_ops' \n)
alter table vector_index_04 alter reindex idx01 ivfflat lists=8;
show create table vector_index_04;
Table    Create Table
vector_index_04    CREATE TABLE `vector_index_04` (\n`a` INT NOT NULL,\n`b` VECF32(3) DEFAULT NULL,\n`c` VECF32(4) DEFAULT NULL,\nPRIMARY KEY (`a`),\nKEY `idx01` USING ivfflat (`c`) lists = 8  op_type 'vector_l2_ops' \n)
create table vector_index_08(a int primary key, b vecf32(128),c int,key c_k(c));
create index idx01 using ivfflat on vector_index_08(b) lists=3 op_type "vector_l2_ops";
alter table vector_index_08 add column d vecf32(3) not null after c;
create table vector_index_07(a int primary key, b vecf32(128),c int,key c_k(c));
create index idx01 using ivfflat on vector_index_07(b);
create index idx02 using ivfflat on vector_index_07(b) lists=0;
SQL parser error: You have an error in your SQL syntax; check the manual that corresponds to your MatrixOne server version for the right syntax to use. LISTS should be greater than 0 at line 1 column 62 near "0;";
alter table vector_index_07 reindex idx01 ivfflat lists=0;
SQL parser error: You have an error in your SQL syntax; check the manual that corresponds to your MatrixOne server version for the right syntax to use. syntax error at line 1 column 35 near " reindex idx01 ivfflat lists=0;";
alter table vector_index_07 reindex idx01 ivfflat;
SQL parser error: You have an error in your SQL syntax; check the manual that corresponds to your MatrixOne server version for the right syntax to use. syntax error at line 1 column 35 near " reindex idx01 ivfflat;";
create table vector_index_09(a int primary key, b vecf32(128),c int,key c_k(c));
insert into vector_index_09 values(9774 ,NULL,3),(9775,NULL,10);
insert into vector_index_09(a,c) values(9777,4),(9778,9);
create index idx01 using ivfflat on vector_index_09(b) lists=3 op_type "vector_l2_ops";
select * from vector_index_09 order by L2_DISTANCE(b,"[1, 0, 1, 6, 6, 17, 47]");
a    b    c
9774    null    3
9775    null    10
9777    null    4
9778    null    9
insert into vector_index_09 values(97741 ,"[1, 0, 1, 6, 6, 17, 47, 39, 2, 0, 1, 25, 27, 10, 56, 130, 18, 5, 2, 6, 15, 2, 19, 130, 42, 28, 1, 1, 2, 1, 0, 5, 0, 2, 4, 4, 31, 34, 44, 35, 9, 3, 8, 11, 33, 12, 61, 130, 130, 17, 0, 1, 6, 2, 9, 130, 111, 36, 0, 0, 11, 9, 1, 12, 2, 100, 130, 28, 7, 2, 6, 7, 9, 27, 130, 83, 5, 0, 1, 18, 130, 130, 84, 9, 0, 0, 2, 24, 111, 24, 0, 1, 37, 24, 2, 10, 12, 62, 33, 3, 0, 0, 0, 1, 3, 16, 106, 28, 0, 0, 0, 0, 17, 46, 85, 10, 0, 0, 1, 4, 11, 4, 2, 2, 9, 14, 8, 8]",3),(97751,"[0, 1, 1, 3, 0, 3, 46, 20, 1, 4, 17, 9, 1, 17, 108, 15, 0, 3, 37, 17, 6, 15, 116, 16, 6, 1, 4, 7, 7, 7, 9, 6, 0, 8, 10, 4, 26, 129, 27, 9, 0, 0, 5, 2, 11, 129, 129, 12, 103, 4, 0, 0, 2, 31, 129, 129, 94, 4, 0, 0, 0, 3, 13, 42, 0, 15, 38, 2, 70, 129, 1, 0, 5, 10, 40, 12, 74, 129, 6, 1, 129, 39, 6, 1, 2, 22, 9, 33, 122, 13, 0, 0, 0, 0, 5, 23, 4, 11, 9, 12, 45, 38, 1, 0, 0, 4, 36, 38, 57, 32, 0, 0, 82, 22, 9, 5, 13, 11, 3, 94, 35, 3, 0, 0, 0, 1, 16, 97]",5),(9776,"[10, 3, 8, 5, 48, 26, 5, 16, 17, 0, 0, 2, 132, 53, 1, 16, 112, 6, 0, 0, 7, 2, 1, 48, 48, 15, 18, 31, 3, 0, 0, 9, 6, 10, 19, 27, 50, 46, 17, 9, 18, 1, 4, 48, 132, 23, 3, 5, 132, 9, 4, 3, 11, 0, 2, 46, 84, 12, 10, 10, 1, 0, 12, 76, 26, 22, 16, 26, 35, 15, 3, 16, 15, 1, 51, 132, 125, 8, 1, 2, 132, 51, 67, 91, 8, 0, 0, 30, 126, 39, 32, 38, 4, 0, 1, 12, 24, 2, 2, 2, 4, 7, 2, 19, 93, 19, 70, 92, 2, 3, 1, 21, 36, 58, 132, 94, 0, 0, 0, 0, 21, 25, 57, 48, 1, 0, 0, 1]",3);
insert into vector_index_09 values(97771, "[16, 15, 0, 0, 5, 46, 5, 5, 4, 0, 0, 0, 28, 118, 12, 5, 75, 44, 5, 0, 6, 32, 6, 49, 41, 74, 9, 1, 0, 0, 0, 9, 1, 9, 16, 41, 71, 80, 3, 0, 0, 4, 3, 5, 51, 106, 11, 3, 112, 28, 13, 1, 4, 8, 3, 104, 118, 14, 1, 1, 0, 0, 0, 88, 3, 27, 46, 118, 108, 49, 2, 0, 1, 46, 118, 118, 27, 12, 0, 0, 33, 118, 118, 8, 0, 0, 0, 4, 118, 95, 40, 0, 0, 0, 1, 11, 27, 38, 12, 12, 18, 29, 3, 2, 13, 30, 94, 78, 30, 19, 9, 3, 31, 45, 70, 42, 15, 1, 3, 12, 14, 22, 16, 2, 3, 17, 24, 13]",4),(97781,"[41, 0, 0, 7, 1, 1, 20, 67, 9, 0, 0, 0, 0, 31, 120, 61, 25, 0, 0, 0, 0, 10, 120, 90, 32, 0, 0, 1, 13, 11, 22, 50, 4, 0, 2, 93, 40, 15, 37, 18, 12, 2, 2, 19, 8, 44, 120, 25, 120, 5, 0, 0, 0, 2, 48, 97, 102, 14, 3, 3, 11, 9, 34, 41, 0, 0, 4, 120, 56, 3, 4, 5, 6, 15, 37, 116, 28, 0, 0, 3, 120, 120, 24, 6, 2, 0, 1, 28, 53, 90, 51, 11, 11, 2, 12, 14, 8, 6, 4, 30, 9, 1, 4, 22, 25, 79, 120, 66, 5, 0, 0, 6, 42, 120, 91, 43, 15, 2, 4, 39, 12, 9, 9, 12, 15, 5, 24, 36]",4);
alter table vector_index_09 alter reindex idx01 ivfflat lists=2;
drop table if exists vector_index_07;
create table vector_index_07(a int primary key, b vecf32(128),c int,key c_k(c));
create index idx01 using ivfflat on vector_index_07(b) lists=5 op_type "vector_l2_ops";
insert into vector_index_07 values(9774 ,"[1, 0, 1, 6, 6, 17, 47, 39, 2, 0, 1, 25, 27, 10, 56, 130, 18, 5, 2, 6, 15, 2, 19, 130, 42, 28, 1, 1, 2, 1, 0, 5, 0, 2, 4, 4, 31, 34, 44, 35, 9, 3, 8, 11, 33, 12, 61, 130, 130, 17, 0, 1, 6, 2, 9, 130, 111, 36, 0, 0, 11, 9, 1, 12, 2, 100, 130, 28, 7, 2, 6, 7, 9, 27, 130, 83, 5, 0, 1, 18, 130, 130, 84, 9, 0, 0, 2, 24, 111, 24, 0, 1, 37, 24, 2, 10, 12, 62, 33, 3, 0, 0, 0, 1, 3, 16, 106, 28, 0, 0, 0, 0, 17, 46, 85, 10, 0, 0, 1, 4, 11, 4, 2, 2, 9, 14, 8, 8]",3),(9775,"[0, 1, 1, 3, 0, 3, 46, 20, 1, 4, 17, 9, 1, 17, 108, 15, 0, 3, 37, 17, 6, 15, 116, 16, 6, 1, 4, 7, 7, 7, 9, 6, 0, 8, 10, 4, 26, 129, 27, 9, 0, 0, 5, 2, 11, 129, 129, 12, 103, 4, 0, 0, 2, 31, 129, 129, 94, 4, 0, 0, 0, 3, 13, 42, 0, 15, 38, 2, 70, 129, 1, 0, 5, 10, 40, 12, 74, 129, 6, 1, 129, 39, 6, 1, 2, 22, 9, 33, 122, 13, 0, 0, 0, 0, 5, 23, 4, 11, 9, 12, 45, 38, 1, 0, 0, 4, 36, 38, 57, 32, 0, 0, 82, 22, 9, 5, 13, 11, 3, 94, 35, 3, 0, 0, 0, 1, 16, 97]",5),(9776,"[10, 3, 8, 5, 48, 26, 5, 16, 17, 0, 0, 2, 132, 53, 1, 16, 112, 6, 0, 0, 7, 2, 1, 48, 48, 15, 18, 31, 3, 0, 0, 9, 6, 10, 19, 27, 50, 46, 17, 9, 18, 1, 4, 48, 132, 23, 3, 5, 132, 9, 4, 3, 11, 0, 2, 46, 84, 12, 10, 10, 1, 0, 12, 76, 26, 22, 16, 26, 35, 15, 3, 16, 15, 1, 51, 132, 125, 8, 1, 2, 132, 51, 67, 91, 8, 0, 0, 30, 126, 39, 32, 38, 4, 0, 1, 12, 24, 2, 2, 2, 4, 7, 2, 19, 93, 19, 70, 92, 2, 3, 1, 21, 36, 58, 132, 94, 0, 0, 0, 0, 21, 25, 57, 48, 1, 0, 0, 1]",3);
insert into vector_index_07 values(9777, " [16, 15, 0, 0, 5, 46, 5, 5, 4, 0, 0, 0, 28, 118, 12, 5, 75, 44, 5, 0, 6, 32, 6, 49, 41, 74, 9, 1, 0, 0, 0, 9, 1, 9, 16, 41, 71, 80, 3, 0, 0, 4, 3, 5, 51, 106, 11, 3, 112, 28, 13, 1, 4, 8, 3, 104, 118, 14, 1, 1, 0, 0, 0, 88, 3, 27, 46, 118, 108, 49, 2, 0, 1, 46, 118, 118, 27, 12, 0, 0, 33, 118, 118, 8, 0, 0, 0, 4, 118, 95, 40, 0, 0, 0, 1, 11, 27, 38, 12, 12, 18, 29, 3, 2, 13, 30, 94, 78, 30, 19, 9, 3, 31, 45, 70, 42, 15, 1, 3, 12, 14, 22, 16, 2, 3, 17, 24, 13]",4),(9778,"[41, 0, 0, 7, 1, 1, 20, 67, 9, 0, 0, 0, 0, 31, 120, 61, 25, 0, 0, 0, 0, 10, 120, 90, 32, 0, 0, 1, 13, 11, 22, 50, 4, 0, 2, 93, 40, 15, 37, 18, 12, 2, 2, 19, 8, 44, 120, 25, 120, 5, 0, 0, 0, 2, 48, 97, 102, 14, 3, 3, 11, 9, 34, 41, 0, 0, 4, 120, 56, 3, 4, 5, 6, 15, 37, 116, 28, 0, 0, 3, 120, 120, 24, 6, 2, 0, 1, 28, 53, 90, 51, 11, 11, 2, 12, 14, 8, 6, 4, 30, 9, 1, 4, 22, 25, 79, 120, 66, 5, 0, 0, 6, 42, 120, 91, 43, 15, 2, 4, 39, 12, 9, 9, 12, 15, 5, 24, 36]",4);
select * from vector_index_07 order by  L2_DISTANCE(b, "abc") ASC LIMIT 2;
internal error: malformed vector input: abc
drop table if exists vector_index_08;
create table vector_index_08(a int auto_increment primary key, b vecf32(128),c int,key c_k(c));
insert into vector_index_08 values(9774 ,"[1, 0, 1, 6, 6, 17, 47, 39, 2, 0, 1, 25, 27, 10, 56, 130, 18, 5, 2, 6, 15, 2, 19, 130, 42, 28, 1, 1, 2, 1, 0, 5, 0, 2, 4, 4, 31, 34, 44, 35, 9, 3, 8, 11, 33, 12, 61, 130, 130, 17, 0, 1, 6, 2, 9, 130, 111, 36, 0, 0, 11, 9, 1, 12, 2, 100, 130, 28, 7, 2, 6, 7, 9, 27, 130, 83, 5, 0, 1, 18, 130, 130, 84, 9, 0, 0, 2, 24, 111, 24, 0, 1, 37, 24, 2, 10, 12, 62, 33, 3, 0, 0, 0, 1, 3, 16, 106, 28, 0, 0, 0, 0, 17, 46, 85, 10, 0, 0, 1, 4, 11, 4, 2, 2, 9, 14, 8, 8]",3),(9775,"[0, 1, 1, 3, 0, 3, 46, 20, 1, 4, 17, 9, 1, 17, 108, 15, 0, 3, 37, 17, 6, 15, 116, 16, 6, 1, 4, 7, 7, 7, 9, 6, 0, 8, 10, 4, 26, 129, 27, 9, 0, 0, 5, 2, 11, 129, 129, 12, 103, 4, 0, 0, 2, 31, 129, 129, 94, 4, 0, 0, 0, 3, 13, 42, 0, 15, 38, 2, 70, 129, 1, 0, 5, 10, 40, 12, 74, 129, 6, 1, 129, 39, 6, 1, 2, 22, 9, 33, 122, 13, 0, 0, 0, 0, 5, 23, 4, 11, 9, 12, 45, 38, 1, 0, 0, 4, 36, 38, 57, 32, 0, 0, 82, 22, 9, 5, 13, 11, 3, 94, 35, 3, 0, 0, 0, 1, 16, 97]",5),(9776,"[10, 3, 8, 5, 48, 26, 5, 16, 17, 0, 0, 2, 132, 53, 1, 16, 112, 6, 0, 0, 7, 2, 1, 48, 48, 15, 18, 31, 3, 0, 0, 9, 6, 10, 19, 27, 50, 46, 17, 9, 18, 1, 4, 48, 132, 23, 3, 5, 132, 9, 4, 3, 11, 0, 2, 46, 84, 12, 10, 10, 1, 0, 12, 76, 26, 22, 16, 26, 35, 15, 3, 16, 15, 1, 51, 132, 125, 8, 1, 2, 132, 51, 67, 91, 8, 0, 0, 30, 126, 39, 32, 38, 4, 0, 1, 12, 24, 2, 2, 2, 4, 7, 2, 19, 93, 19, 70, 92, 2, 3, 1, 21, 36, 58, 132, 94, 0, 0, 0, 0, 21, 25, 57, 48, 1, 0, 0, 1]",3);
insert into vector_index_08 values(9777, "[16, 15, 0, 0, 5, 46, 5, 5, 4, 0, 0, 0, 28, 118, 12, 5, 75, 44, 5, 0, 6, 32, 6, 49, 41, 74, 9, 1, 0, 0, 0, 9, 1, 9, 16, 41, 71, 80, 3, 0, 0, 4, 3, 5, 51, 106, 11, 3, 112, 28, 13, 1, 4, 8, 3, 104, 118, 14, 1, 1, 0, 0, 0, 88, 3, 27, 46, 118, 108, 49, 2, 0, 1, 46, 118, 118, 27, 12, 0, 0, 33, 118, 118, 8, 0, 0, 0, 4, 118, 95, 40, 0, 0, 0, 1, 11, 27, 38, 12, 12, 18, 29, 3, 2, 13, 30, 94, 78, 30, 19, 9, 3, 31, 45, 70, 42, 15, 1, 3, 12, 14, 22, 16, 2, 3, 17, 24, 13]",4),(9778,"[41, 0, 0, 7, 1, 1, 20, 67, 9, 0, 0, 0, 0, 31, 120, 61, 25, 0, 0, 0, 0, 10, 120, 90, 32, 0, 0, 1, 13, 11, 22, 50, 4, 0, 2, 93, 40, 15, 37, 18, 12, 2, 2, 19, 8, 44, 120, 25, 120, 5, 0, 0, 0, 2, 48, 97, 102, 14, 3, 3, 11, 9, 34, 41, 0, 0, 4, 120, 56, 3, 4, 5, 6, 15, 37, 116, 28, 0, 0, 3, 120, 120, 24, 6, 2, 0, 1, 28, 53, 90, 51, 11, 11, 2, 12, 14, 8, 6, 4, 30, 9, 1, 4, 22, 25, 79, 120, 66, 5, 0, 0, 6, 42, 120, 91, 43, 15, 2, 4, 39, 12, 9, 9, 12, 15, 5, 24, 36]",4);
create index idx01 using ivfflat on vector_index_08(b) lists=3 op_type "vector_l2_ops";
select * from  vector_index_08 ;
a    b    c
9774    [1, 0, 1, 6, 6, 17, 47, 39, 2, 0, 1, 25, 27, 10, 56, 130, 18, 5, 2, 6, 15, 2, 19, 130, 42, 28, 1, 1, 2, 1, 0, 5, 0, 2, 4, 4, 31, 34, 44, 35, 9, 3, 8, 11, 33, 12, 61, 130, 130, 17, 0, 1, 6, 2, 9, 130, 111, 36, 0, 0, 11, 9, 1, 12, 2, 100, 130, 28, 7, 2, 6, 7, 9, 27, 130, 83, 5, 0, 1, 18, 130, 130, 84, 9, 0, 0, 2, 24, 111, 24, 0, 1, 37, 24, 2, 10, 12, 62, 33, 3, 0, 0, 0, 1, 3, 16, 106, 28, 0, 0, 0, 0, 17, 46, 85, 10, 0, 0, 1, 4, 11, 4, 2, 2, 9, 14, 8, 8]    3
9775    [0, 1, 1, 3, 0, 3, 46, 20, 1, 4, 17, 9, 1, 17, 108, 15, 0, 3, 37, 17, 6, 15, 116, 16, 6, 1, 4, 7, 7, 7, 9, 6, 0, 8, 10, 4, 26, 129, 27, 9, 0, 0, 5, 2, 11, 129, 129, 12, 103, 4, 0, 0, 2, 31, 129, 129, 94, 4, 0, 0, 0, 3, 13, 42, 0, 15, 38, 2, 70, 129, 1, 0, 5, 10, 40, 12, 74, 129, 6, 1, 129, 39, 6, 1, 2, 22, 9, 33, 122, 13, 0, 0, 0, 0, 5, 23, 4, 11, 9, 12, 45, 38, 1, 0, 0, 4, 36, 38, 57, 32, 0, 0, 82, 22, 9, 5, 13, 11, 3, 94, 35, 3, 0, 0, 0, 1, 16, 97]    5
9776    [10, 3, 8, 5, 48, 26, 5, 16, 17, 0, 0, 2, 132, 53, 1, 16, 112, 6, 0, 0, 7, 2, 1, 48, 48, 15, 18, 31, 3, 0, 0, 9, 6, 10, 19, 27, 50, 46, 17, 9, 18, 1, 4, 48, 132, 23, 3, 5, 132, 9, 4, 3, 11, 0, 2, 46, 84, 12, 10, 10, 1, 0, 12, 76, 26, 22, 16, 26, 35, 15, 3, 16, 15, 1, 51, 132, 125, 8, 1, 2, 132, 51, 67, 91, 8, 0, 0, 30, 126, 39, 32, 38, 4, 0, 1, 12, 24, 2, 2, 2, 4, 7, 2, 19, 93, 19, 70, 92, 2, 3, 1, 21, 36, 58, 132, 94, 0, 0, 0, 0, 21, 25, 57, 48, 1, 0, 0, 1]    3
9777    [16, 15, 0, 0, 5, 46, 5, 5, 4, 0, 0, 0, 28, 118, 12, 5, 75, 44, 5, 0, 6, 32, 6, 49, 41, 74, 9, 1, 0, 0, 0, 9, 1, 9, 16, 41, 71, 80, 3, 0, 0, 4, 3, 5, 51, 106, 11, 3, 112, 28, 13, 1, 4, 8, 3, 104, 118, 14, 1, 1, 0, 0, 0, 88, 3, 27, 46, 118, 108, 49, 2, 0, 1, 46, 118, 118, 27, 12, 0, 0, 33, 118, 118, 8, 0, 0, 0, 4, 118, 95, 40, 0, 0, 0, 1, 11, 27, 38, 12, 12, 18, 29, 3, 2, 13, 30, 94, 78, 30, 19, 9, 3, 31, 45, 70, 42, 15, 1, 3, 12, 14, 22, 16, 2, 3, 17, 24, 13]    4
9778    [41, 0, 0, 7, 1, 1, 20, 67, 9, 0, 0, 0, 0, 31, 120, 61, 25, 0, 0, 0, 0, 10, 120, 90, 32, 0, 0, 1, 13, 11, 22, 50, 4, 0, 2, 93, 40, 15, 37, 18, 12, 2, 2, 19, 8, 44, 120, 25, 120, 5, 0, 0, 0, 2, 48, 97, 102, 14, 3, 3, 11, 9, 34, 41, 0, 0, 4, 120, 56, 3, 4, 5, 6, 15, 37, 116, 28, 0, 0, 3, 120, 120, 24, 6, 2, 0, 1, 28, 53, 90, 51, 11, 11, 2, 12, 14, 8, 6, 4, 30, 9, 1, 4, 22, 25, 79, 120, 66, 5, 0, 0, 6, 42, 120, 91, 43, 15, 2, 4, 39, 12, 9, 9, 12, 15, 5, 24, 36]    4
update vector_index_08 set b="[16, 15, 0, 0, 5, 46, 5, 5, 4, 0, 0, 0, 28, 118, 12, 5, 75, 44, 5, 0, 6, 32, 6, 49, 41, 74, 9, 1, 0, 0, 0, 9, 1, 9, 16, 41, 71, 80, 3, 0, 0, 4, 3, 5, 51, 106, 11, 3, 112, 28, 13, 1, 4, 8, 3, 104, 118, 14, 1, 1, 0, 0, 0, 88, 3, 27, 46, 118, 108, 49, 2, 0, 1, 46, 118, 118, 27, 12, 0, 0, 33, 118, 118, 8, 0, 0, 0, 4, 118, 95, 40, 0, 0, 0, 1, 11, 27, 38, 12, 12, 18, 29, 3, 2, 13, 30, 94, 78, 30, 19, 9, 3, 31, 45, 70, 42, 15, 1, 3, 12, 14, 22, 16, 2, 3, 17, 24, 13]" where a=9774;
select * from  vector_index_08 where a=9774;
a    b    c
9774    [16, 15, 0, 0, 5, 46, 5, 5, 4, 0, 0, 0, 28, 118, 12, 5, 75, 44, 5, 0, 6, 32, 6, 49, 41, 74, 9, 1, 0, 0, 0, 9, 1, 9, 16, 41, 71, 80, 3, 0, 0, 4, 3, 5, 51, 106, 11, 3, 112, 28, 13, 1, 4, 8, 3, 104, 118, 14, 1, 1, 0, 0, 0, 88, 3, 27, 46, 118, 108, 49, 2, 0, 1, 46, 118, 118, 27, 12, 0, 0, 33, 118, 118, 8, 0, 0, 0, 4, 118, 95, 40, 0, 0, 0, 1, 11, 27, 38, 12, 12, 18, 29, 3, 2, 13, 30, 94, 78, 30, 19, 9, 3, 31, 45, 70, 42, 15, 1, 3, 12, 14, 22, 16, 2, 3, 17, 24, 13]    3
delete from vector_index_08 where a=9777;
select * from  vector_index_08 where a=9777;
a    b    c
truncate table vector_index_08;
select * from  vector_index_08;
a    b    c
insert into vector_index_08 values(9774 ,"[1, 0, 1, 6, 6, 17, 47, 39, 2, 0, 1, 25, 27, 10, 56, 130, 18, 5, 2, 6, 15, 2, 19, 130, 42, 28, 1, 1, 2, 1, 0, 5, 0, 2, 4, 4, 31, 34, 44, 35, 9, 3, 8, 11, 33, 12, 61, 130, 130, 17, 0, 1, 6, 2, 9, 130, 111, 36, 0, 0, 11, 9, 1, 12, 2, 100, 130, 28, 7, 2, 6, 7, 9, 27, 130, 83, 5, 0, 1, 18, 130, 130, 84, 9, 0, 0, 2, 24, 111, 24, 0, 1, 37, 24, 2, 10, 12, 62, 33, 3, 0, 0, 0, 1, 3, 16, 106, 28, 0, 0, 0, 0, 17, 46, 85, 10, 0, 0, 1, 4, 11, 4, 2, 2, 9, 14, 8, 8]",3),(9775,"[0, 1, 1, 3, 0, 3, 46, 20, 1, 4, 17, 9, 1, 17, 108, 15, 0, 3, 37, 17, 6, 15, 116, 16, 6, 1, 4, 7, 7, 7, 9, 6, 0, 8, 10, 4, 26, 129, 27, 9, 0, 0, 5, 2, 11, 129, 129, 12, 103, 4, 0, 0, 2, 31, 129, 129, 94, 4, 0, 0, 0, 3, 13, 42, 0, 15, 38, 2, 70, 129, 1, 0, 5, 10, 40, 12, 74, 129, 6, 1, 129, 39, 6, 1, 2, 22, 9, 33, 122, 13, 0, 0, 0, 0, 5, 23, 4, 11, 9, 12, 45, 38, 1, 0, 0, 4, 36, 38, 57, 32, 0, 0, 82, 22, 9, 5, 13, 11, 3, 94, 35, 3, 0, 0, 0, 1, 16, 97]",5),(9776,"[10, 3, 8, 5, 48, 26, 5, 16, 17, 0, 0, 2, 132, 53, 1, 16, 112, 6, 0, 0, 7, 2, 1, 48, 48, 15, 18, 31, 3, 0, 0, 9, 6, 10, 19, 27, 50, 46, 17, 9, 18, 1, 4, 48, 132, 23, 3, 5, 132, 9, 4, 3, 11, 0, 2, 46, 84, 12, 10, 10, 1, 0, 12, 76, 26, 22, 16, 26, 35, 15, 3, 16, 15, 1, 51, 132, 125, 8, 1, 2, 132, 51, 67, 91, 8, 0, 0, 30, 126, 39, 32, 38, 4, 0, 1, 12, 24, 2, 2, 2, 4, 7, 2, 19, 93, 19, 70, 92, 2, 3, 1, 21, 36, 58, 132, 94, 0, 0, 0, 0, 21, 25, 57, 48, 1, 0, 0, 1]",3);
alter table vector_index_08 add column d vecf32(3) not null after c;
select * from vector_index_08;
a    b    c    d
9774    [1, 0, 1, 6, 6, 17, 47, 39, 2, 0, 1, 25, 27, 10, 56, 130, 18, 5, 2, 6, 15, 2, 19, 130, 42, 28, 1, 1, 2, 1, 0, 5, 0, 2, 4, 4, 31, 34, 44, 35, 9, 3, 8, 11, 33, 12, 61, 130, 130, 17, 0, 1, 6, 2, 9, 130, 111, 36, 0, 0, 11, 9, 1, 12, 2, 100, 130, 28, 7, 2, 6, 7, 9, 27, 130, 83, 5, 0, 1, 18, 130, 130, 84, 9, 0, 0, 2, 24, 111, 24, 0, 1, 37, 24, 2, 10, 12, 62, 33, 3, 0, 0, 0, 1, 3, 16, 106, 28, 0, 0, 0, 0, 17, 46, 85, 10, 0, 0, 1, 4, 11, 4, 2, 2, 9, 14, 8, 8]    3    [0, 0, 0]
9775    [0, 1, 1, 3, 0, 3, 46, 20, 1, 4, 17, 9, 1, 17, 108, 15, 0, 3, 37, 17, 6, 15, 116, 16, 6, 1, 4, 7, 7, 7, 9, 6, 0, 8, 10, 4, 26, 129, 27, 9, 0, 0, 5, 2, 11, 129, 129, 12, 103, 4, 0, 0, 2, 31, 129, 129, 94, 4, 0, 0, 0, 3, 13, 42, 0, 15, 38, 2, 70, 129, 1, 0, 5, 10, 40, 12, 74, 129, 6, 1, 129, 39, 6, 1, 2, 22, 9, 33, 122, 13, 0, 0, 0, 0, 5, 23, 4, 11, 9, 12, 45, 38, 1, 0, 0, 4, 36, 38, 57, 32, 0, 0, 82, 22, 9, 5, 13, 11, 3, 94, 35, 3, 0, 0, 0, 1, 16, 97]    5    [0, 0, 0]
9776    [10, 3, 8, 5, 48, 26, 5, 16, 17, 0, 0, 2, 132, 53, 1, 16, 112, 6, 0, 0, 7, 2, 1, 48, 48, 15, 18, 31, 3, 0, 0, 9, 6, 10, 19, 27, 50, 46, 17, 9, 18, 1, 4, 48, 132, 23, 3, 5, 132, 9, 4, 3, 11, 0, 2, 46, 84, 12, 10, 10, 1, 0, 12, 76, 26, 22, 16, 26, 35, 15, 3, 16, 15, 1, 51, 132, 125, 8, 1, 2, 132, 51, 67, 91, 8, 0, 0, 30, 126, 39, 32, 38, 4, 0, 1, 12, 24, 2, 2, 2, 4, 7, 2, 19, 93, 19, 70, 92, 2, 3, 1, 21, 36, 58, 132, 94, 0, 0, 0, 0, 21, 25, 57, 48, 1, 0, 0, 1]    3    [0, 0, 0]
drop table if exists vector_index_08;
create table vector_index_08(a int primary key, b vecf32(3),c int);
insert into vector_index_08 values(1 ,"[1, 2, 3]",11);
insert into vector_index_08 values(2 ,"[1, 2, 3]",12);
insert into vector_index_08 values(3 ,"[1, 2, 3]",13);
create index idx01 using ivfflat on vector_index_08(b)  lists = 2 op_type 'vector_l2_ops';
alter table vector_index_08 add column d vecf32(3) not null after c;
select * from vector_index_08;
a    b    c    d
1    [1, 2, 3]    11    [0, 0, 0]
2    [1, 2, 3]    12    [0, 0, 0]
3    [1, 2, 3]    13    [0, 0, 0]
drop table if exists vector_index_08;
create table vector_index_08(a int auto_increment primary key, b vecf32(3),c int);
insert into vector_index_08 values(1 ,"[1, 2, 3]",11);
insert into vector_index_08 values(2 ,"[1, 2, 3]",12);
insert into vector_index_08 values(3 ,"[1, 2, 3]",13);
create index idx01 using ivfflat on vector_index_08(b)  lists = 2 op_type 'vector_l2_ops';
alter table vector_index_08 add column d vecf32(3) not null after c;
select * from vector_index_08;
a    b    c    d
1    [1, 2, 3]    11    [0, 0, 0]
2    [1, 2, 3]    12    [0, 0, 0]
3    [1, 2, 3]    13    [0, 0, 0]
drop table if exists vector_index_08;
create table vector_index_08(a int primary key, b vecf32(128),c int,key c_k(c));
create index idx01 using ivfflat on vector_index_08(b) lists=3 op_type "vector_l2_ops";
insert into vector_index_08 values(9774 ,"[1, 0, 1, 6, 6, 17, 47, 39, 2, 0, 1, 25, 27, 10, 56, 130, 18, 5, 2, 6, 15, 2, 19, 130, 42, 28, 1, 1, 2, 1, 0, 5, 0, 2, 4, 4, 31, 34, 44, 35, 9, 3, 8, 11, 33, 12, 61, 130, 130, 17, 0, 1, 6, 2, 9, 130, 111, 36, 0, 0, 11, 9, 1, 12, 2, 100, 130, 28, 7, 2, 6, 7, 9, 27, 130, 83, 5, 0, 1, 18, 130, 130, 84, 9, 0, 0, 2, 24, 111, 24, 0, 1, 37, 24, 2, 10, 12, 62, 33, 3, 0, 0, 0, 1, 3, 16, 106, 28, 0, 0, 0, 0, 17, 46, 85, 10, 0, 0, 1, 4, 11, 4, 2, 2, 9, 14, 8, 8]",3),(9775,"[0, 1, 1, 3, 0, 3, 46, 20, 1, 4, 17, 9, 1, 17, 108, 15, 0, 3, 37, 17, 6, 15, 116, 16, 6, 1, 4, 7, 7, 7, 9, 6, 0, 8, 10, 4, 26, 129, 27, 9, 0, 0, 5, 2, 11, 129, 129, 12, 103, 4, 0, 0, 2, 31, 129, 129, 94, 4, 0, 0, 0, 3, 13, 42, 0, 15, 38, 2, 70, 129, 1, 0, 5, 10, 40, 12, 74, 129, 6, 1, 129, 39, 6, 1, 2, 22, 9, 33, 122, 13, 0, 0, 0, 0, 5, 23, 4, 11, 9, 12, 45, 38, 1, 0, 0, 4, 36, 38, 57, 32, 0, 0, 82, 22, 9, 5, 13, 11, 3, 94, 35, 3, 0, 0, 0, 1, 16, 97]",5),(9776,"[10, 3, 8, 5, 48, 26, 5, 16, 17, 0, 0, 2, 132, 53, 1, 16, 112, 6, 0, 0, 7, 2, 1, 48, 48, 15, 18, 31, 3, 0, 0, 9, 6, 10, 19, 27, 50, 46, 17, 9, 18, 1, 4, 48, 132, 23, 3, 5, 132, 9, 4, 3, 11, 0, 2, 46, 84, 12, 10, 10, 1, 0, 12, 76, 26, 22, 16, 26, 35, 15, 3, 16, 15, 1, 51, 132, 125, 8, 1, 2, 132, 51, 67, 91, 8, 0, 0, 30, 126, 39, 32, 38, 4, 0, 1, 12, 24, 2, 2, 2, 4, 7, 2, 19, 93, 19, 70, 92, 2, 3, 1, 21, 36, 58, 132, 94, 0, 0, 0, 0, 21, 25, 57, 48, 1, 0, 0, 1]",3);
insert into vector_index_08 values(9777, "[16, 15, 0, 0, 5, 46, 5, 5, 4, 0, 0, 0, 28, 118, 12, 5, 75, 44, 5, 0, 6, 32, 6, 49, 41, 74, 9, 1, 0, 0, 0, 9, 1, 9, 16, 41, 71, 80, 3, 0, 0, 4, 3, 5, 51, 106, 11, 3, 112, 28, 13, 1, 4, 8, 3, 104, 118, 14, 1, 1, 0, 0, 0, 88, 3, 27, 46, 118, 108, 49, 2, 0, 1, 46, 118, 118, 27, 12, 0, 0, 33, 118, 118, 8, 0, 0, 0, 4, 118, 95, 40, 0, 0, 0, 1, 11, 27, 38, 12, 12, 18, 29, 3, 2, 13, 30, 94, 78, 30, 19, 9, 3, 31, 45, 70, 42, 15, 1, 3, 12, 14, 22, 16, 2, 3, 17, 24, 13]",4),(9778,"[41, 0, 0, 7, 1, 1, 20, 67, 9, 0, 0, 0, 0, 31, 120, 61, 25, 0, 0, 0, 0, 10, 120, 90, 32, 0, 0, 1, 13, 11, 22, 50, 4, 0, 2, 93, 40, 15, 37, 18, 12, 2, 2, 19, 8, 44, 120, 25, 120, 5, 0, 0, 0, 2, 48, 97, 102, 14, 3, 3, 11, 9, 34, 41, 0, 0, 4, 120, 56, 3, 4, 5, 6, 15, 37, 116, 28, 0, 0, 3, 120, 120, 24, 6, 2, 0, 1, 28, 53, 90, 51, 11, 11, 2, 12, 14, 8, 6, 4, 30, 9, 1, 4, 22, 25, 79, 120, 66, 5, 0, 0, 6, 42, 120, 91, 43, 15, 2, 4, 39, 12, 9, 9, 12, 15, 5, 24, 36]",4);
alter table vector_index_08 add column d vecf32(3) not null after c;
select * from vector_index_08;
a    b    c    d
9774    [1, 0, 1, 6, 6, 17, 47, 39, 2, 0, 1, 25, 27, 10, 56, 130, 18, 5, 2, 6, 15, 2, 19, 130, 42, 28, 1, 1, 2, 1, 0, 5, 0, 2, 4, 4, 31, 34, 44, 35, 9, 3, 8, 11, 33, 12, 61, 130, 130, 17, 0, 1, 6, 2, 9, 130, 111, 36, 0, 0, 11, 9, 1, 12, 2, 100, 130, 28, 7, 2, 6, 7, 9, 27, 130, 83, 5, 0, 1, 18, 130, 130, 84, 9, 0, 0, 2, 24, 111, 24, 0, 1, 37, 24, 2, 10, 12, 62, 33, 3, 0, 0, 0, 1, 3, 16, 106, 28, 0, 0, 0, 0, 17, 46, 85, 10, 0, 0, 1, 4, 11, 4, 2, 2, 9, 14, 8, 8]    3    [0, 0, 0]
9775    [0, 1, 1, 3, 0, 3, 46, 20, 1, 4, 17, 9, 1, 17, 108, 15, 0, 3, 37, 17, 6, 15, 116, 16, 6, 1, 4, 7, 7, 7, 9, 6, 0, 8, 10, 4, 26, 129, 27, 9, 0, 0, 5, 2, 11, 129, 129, 12, 103, 4, 0, 0, 2, 31, 129, 129, 94, 4, 0, 0, 0, 3, 13, 42, 0, 15, 38, 2, 70, 129, 1, 0, 5, 10, 40, 12, 74, 129, 6, 1, 129, 39, 6, 1, 2, 22, 9, 33, 122, 13, 0, 0, 0, 0, 5, 23, 4, 11, 9, 12, 45, 38, 1, 0, 0, 4, 36, 38, 57, 32, 0, 0, 82, 22, 9, 5, 13, 11, 3, 94, 35, 3, 0, 0, 0, 1, 16, 97]    5    [0, 0, 0]
9776    [10, 3, 8, 5, 48, 26, 5, 16, 17, 0, 0, 2, 132, 53, 1, 16, 112, 6, 0, 0, 7, 2, 1, 48, 48, 15, 18, 31, 3, 0, 0, 9, 6, 10, 19, 27, 50, 46, 17, 9, 18, 1, 4, 48, 132, 23, 3, 5, 132, 9, 4, 3, 11, 0, 2, 46, 84, 12, 10, 10, 1, 0, 12, 76, 26, 22, 16, 26, 35, 15, 3, 16, 15, 1, 51, 132, 125, 8, 1, 2, 132, 51, 67, 91, 8, 0, 0, 30, 126, 39, 32, 38, 4, 0, 1, 12, 24, 2, 2, 2, 4, 7, 2, 19, 93, 19, 70, 92, 2, 3, 1, 21, 36, 58, 132, 94, 0, 0, 0, 0, 21, 25, 57, 48, 1, 0, 0, 1]    3    [0, 0, 0]
9777    [16, 15, 0, 0, 5, 46, 5, 5, 4, 0, 0, 0, 28, 118, 12, 5, 75, 44, 5, 0, 6, 32, 6, 49, 41, 74, 9, 1, 0, 0, 0, 9, 1, 9, 16, 41, 71, 80, 3, 0, 0, 4, 3, 5, 51, 106, 11, 3, 112, 28, 13, 1, 4, 8, 3, 104, 118, 14, 1, 1, 0, 0, 0, 88, 3, 27, 46, 118, 108, 49, 2, 0, 1, 46, 118, 118, 27, 12, 0, 0, 33, 118, 118, 8, 0, 0, 0, 4, 118, 95, 40, 0, 0, 0, 1, 11, 27, 38, 12, 12, 18, 29, 3, 2, 13, 30, 94, 78, 30, 19, 9, 3, 31, 45, 70, 42, 15, 1, 3, 12, 14, 22, 16, 2, 3, 17, 24, 13]    4    [0, 0, 0]
9778    [41, 0, 0, 7, 1, 1, 20, 67, 9, 0, 0, 0, 0, 31, 120, 61, 25, 0, 0, 0, 0, 10, 120, 90, 32, 0, 0, 1, 13, 11, 22, 50, 4, 0, 2, 93, 40, 15, 37, 18, 12, 2, 2, 19, 8, 44, 120, 25, 120, 5, 0, 0, 0, 2, 48, 97, 102, 14, 3, 3, 11, 9, 34, 41, 0, 0, 4, 120, 56, 3, 4, 5, 6, 15, 37, 116, 28, 0, 0, 3, 120, 120, 24, 6, 2, 0, 1, 28, 53, 90, 51, 11, 11, 2, 12, 14, 8, 6, 4, 30, 9, 1, 4, 22, 25, 79, 120, 66, 5, 0, 0, 6, 42, 120, 91, 43, 15, 2, 4, 39, 12, 9, 9, 12, 15, 5, 24, 36]    4    [0, 0, 0]
SET GLOBAL experimental_ivf_index = 0;
drop database vecdb2;
