set time_zone='SYSTEM';
drop table if exists t1;
create table t1(col1 bool,col2 int,col3 varchar(100), col4 date,col5 datetime,col6 timestamp,col7 decimal,col8 float);
load data infile {'filepath'='$resources/load_data/jsonline_object.jl','format'='jsonline','jsondata'='object'} into table t1;
select * from t1;
col1	col2	col3	col4	col5	col6	col7	col8
true	1	var	2020-09-07	2020-09-07 00:00:00	2020-09-07 00:00:00	18	121.11
true	1	var	2020-09-07	2020-09-07 00:00:00	2020-09-07 00:00:00	18	121.11
true	1	var	2020-09-07	2020-09-07 00:00:00	2020-09-07 00:00:00	18	121.11
true	1	var	2020-09-07	2020-09-07 00:00:00	2020-09-07 00:00:00	18	121.11
delete from t1;
load data infile {'filepath'='$resources/load_data/jsonline_array.jl','format'='jsonline','jsondata'='array'} into table t1;
select * from t1;
col1	col2	col3	col4	col5	col6	col7	col8
true	1	var	2020-09-07	2020-09-07 00:00:00	2020-09-07 00:00:00	18	121.11
true	1	var	2020-09-07	2020-09-07 00:00:00	2020-09-07 00:00:00	18	121.11