drop table if exists t1;
create table t1(
col1 tinyint,
col2 smallint,
col3 int,
col4 bigint,
col5 tinyint unsigned,
col6 smallint unsigned,
col7 int unsigned,
col8 bigint unsigned
);
load data infile '$resources/load_data/integer_numbers_1.csv' into table t1;
select * from t1;
col1    col2    col3    col4    col5    col6    col7    col8
127    32767    2147483647    9223372036854775807    255    65535    4294967295    18446744073709551615
-128    -32768    -2147483648    -9223372036854775808    0    0    0    0
0    0    0    0    0    0    0    0
null    null    null    null    null    null    null    null
1    null    null    0    0    0    null    null
null    null    null    null    null    null    null    null
127    32767    2147483647    9223372036854775807    255    65535    4294967295    18446744073709551615
select * from t1 into outfile '$resources/into_outfile/outfile_integer_numbers_1.csv';
col1    col2    col3    col4    col5    col6    col7    col8
delete from t1;
load data infile '$resources/into_outfile/outfile_integer_numbers_1.csv' into table t1 ignore 1 lines;
select * from t1;
col1    col2    col3    col4    col5    col6    col7    col8
127    32767    2147483647    9223372036854775807    255    65535    4294967295    18446744073709551615
-128    -32768    -2147483648    -9223372036854775808    0    0    0    0
0    0    0    0    0    0    0    0
null    null    null    null    null    null    null    null
1    null    null    0    0    0    null    null
null    null    null    null    null    null    null    null
127    32767    2147483647    9223372036854775807    255    65535    4294967295    18446744073709551615
delete from t1;
load data infile '$resources/load_data/integer_numbers_2.csv' into table t1 fields terminated by'*';
select * from t1;
col1    col2    col3    col4    col5    col6    col7    col8
127    32767    2147483647    9223372036854775807    255    65535    4294967295    18446744073709551615
-128    -32768    -2147483648    -9223372036854775808    0    0    0    0
0    0    0    0    0    0    0    0
null    null    null    null    null    null    null    null
1    null    null    0    0    0    null    null
null    null    null    null    null    null    null    null
127    32767    2147483647    9223372036854775807    255    65535    4294967295    18446744073709551615
delete from t1;
drop table t1;
drop table if exists t2;
create table t2(
col1 char(225),
col2 varchar(225),
col3 text,
col4 varchar(225)
);
load data infile '$resources/load_data/char_varchar_1.csv' into table t2;
select * from t2;
col1    col2    col3    col4
a    b    c    d
a    b    c    d
'a'    'b'    'c'    'd'
'a'    'b'    'c'    'd'
aa,aa    bb,bb    cc,cc    dd,dd
aa,    bb,    cc,    dd,
aa,,,aa    bb,,,bb    cc,,,cc    dd,,,dd
aa',',,aa    bb',',,bb    cc',',,cc    dd',',,dd
aa"aa    bb"bb    cc"cc    dd"dd
aa"aa    bb"bb    cc"cc    dd"dd
aa"aa    bb"bb    cc"cc    dd"dd
aa""aa    bb""bb    cc""cc    dd""dd
aa""aa    bb""bb    cc""cc    dd""dd
aa",aa    bb",bb    cc",cc    dd",dd
aa"",aa    bb"",bb    cc"",cc    dd"",dd
            
            
null    null    null    null
            
"    "    "    "
""    ""    ""    ""
select * from t2 into outfile '$resources/into_outfile/outfile_char_varchar_1.csv';
col1    col2    col3    col4
delete from t2;

load data infile '$resources/into_outfile/outfile_char_varchar_1.csv' into table t2 ignore 1 lines;

select * from t2;
col1    col2    col3    col4
a    b    c    d
a    b    c    d
'a'    'b'    'c'    'd'
'a'    'b'    'c'    'd'
aa,aa    bb,bb    cc,cc    dd,dd
aa,    bb,    cc,    dd,
aa,,,aa    bb,,,bb    cc,,,cc    dd,,,dd
aa',',,aa    bb',',,bb    cc',',,cc    dd',',,dd
aa"aa    bb"bb    cc"cc    dd"dd
aa"aa    bb"bb    cc"cc    dd"dd
aa"aa    bb"bb    cc"cc    dd"dd
aa""aa    bb""bb    cc""cc    dd""dd
aa""aa    bb""bb    cc""cc    dd""dd
aa",aa    bb",bb    cc",cc    dd",dd
aa"",aa    bb"",bb    cc"",cc    dd"",dd


null    null    null    null

"    "    "    "
""    ""    ""    ""
delete from t2;

load data infile '$resources/load_data/char_varchar_2.csv' into table t2;

select * from t2;
col1    col2    col3    col4
aa""aa    bb""bb    cc""cc    dd""dd
aa"aa    bb"bb    cc"cc    dd"dd
aa"""aa    bb"""bb    cc"""cc    dd"""dd
aa""aa    bb""bb    cc""cc    dd""dd
aa""""aa    bb""""bb    cc""""cc    dd""""dd
aa"""aa    bb""bb    cc""cc    dd""dd
delete from t2;

load data infile '$resources/load_data/char_varchar_3.csv' into table t2;
select * from t2;
col1    col2    col3    col4
aa",aa    bb",bb    cc",cc    dd",dd
aa"    aa"    bb"    bb"
aa"",aa    bb"",bb    cc"",cc    dd"",dd
aa""    aa"    bb"",bb    cc"",cc
delete from t2;
load data infile '$resources/load_data/char_varchar_4.csv' into table t2 fields terminated by'|';
select * from t2;
col1    col2    col3    col4
a    b    c    d
a    b    c    d
'a'    'b'    'c'    'd'
'a'    'b'    'c'    'd'
aa|aa    bb|bb    cc|cc    dd|dd
aa|    bb|    cc|    dd|
aa|||aa    bb|||bb    cc|||cc    dd|||dd
aa'|'||aa    bb'|'||bb    cc'|'||cc    dd'|'||dd
aa"aa    bb"bb    cc"cc    dd"dd
aa"aa    bb"bb    cc"cc    dd"dd
aa"aa    bb"bb    cc"cc    dd"dd
aa""aa    bb""bb    cc""cc    dd""dd
aa""aa    bb""bb    cc""cc    dd""dd
aa"|aa    bb"|bb    cc"|cc    dd"|dd
aa""|aa    bb""|bb    cc""|cc    dd""|dd
            
            
            
"    "    "    "
""    ""    ""    ""
delete from t2;
load data infile '$resources/load_data/char_varchar_5.csv' into table t2 fields terminated by'?';
select * from t2;
col1    col2    col3    col4
a    b    c    d
a    b    c    d
'a'    'b'    'c'    'd'
'a'    'b'    'c'    'd'
aa?aa    bb?bb    cc?cc    dd?dd
aa?    bb?    cc?    dd?
aa???aa    bb???bb    cc???cc    dd???dd
aa'?'??aa    bb'?'??bb    cc'?'??cc    dd'?'??dd
aa"aa    bb"bb    cc"cc    dd"dd
aa"aa    bb"bb    cc"cc    dd"dd
aa"aa    bb"bb    cc"cc    dd"dd
aa""aa    bb""bb    cc""cc    dd""dd
aa""aa    bb""bb    cc""cc    dd""dd
aa"?aa    bb"?bb    cc"?cc    dd"?dd
aa""?aa    bb""?bb    cc""?cc    dd""?dd
            
            
            
"    "    "    "
""    ""    ""    ""
delete from t2;
drop table t2;
drop table if exists t3;
create table t3(
col1 float,
col2 double,
col3 decimal(5,2),
col4 decimal(20,5)
);
insert into t3 values (1.3,1.3,1.3,1.3);
select * from t3;
col1    col2    col3    col4
1.3    1.3    1.30    1.30000
load data infile '$resources/load_data/float_1.csv' into table t3;

select * from t3;
col1    col2    col3    col4
1.3    1.3    1.30    1.30000
1.3    1.3    1.30    1.30000
delete from t3;
load data infile '$resources/load_data/float_2.csv' into table t3;
select * from t3;
col1    col2    col3    col4
1.0    1.0    1.00    1.00000
null    null    null    null
1.23456    1.23456    1.23    1.23456
1.2345679    1.23456789    1.23    1.23457
1.0123457    1.0123456789    1.01    1.01235
1.0E-10    1.0E-10    0.00    0.00000
select * from t3 into outfile '$resources/into_outfile/outfile_float_2.csv';
col1    col2    col3    col4
delete from t3;
load data infile '$resources/into_outfile/outfile_float_2.csv' into table t3 ignore 1 lines;
select * from t3;
col1    col2    col3    col4
1.0    1.0    1.00    1.00000
null    null    null    null
1.23456    1.23456    1.23    1.23456
1.2345679    1.23456789    1.23    1.23457
1.0123457    1.0123456789    1.01    1.01235
1.0E-10    1.0E-10    0.00    0.00000
delete from t3;
load data infile '$resources/load_data/float_3.csv' into table t3;
internal error: the input value '1000.001' is invalid Decimal64 type for column 2

drop table t3;
drop table if exists t4;
create table t4(
col1 date,
col2 datetime,
col3 timestamp,
col4 bool
);
load data infile '$resources/load_data/time_date_1.csv' into table t4;

select * from t4;
col1    col2    col3    col4
1000-01-01    0001-01-01 00:00:00    1970-01-01 00:00:01    false
9999-12-31    9999-12-31 00:00:00    2038-01-19 00:00:00    true
delete from t4;
load data infile '$resources/load_data/time_date_2.csv' into table t4;
select * from t4;
col1    col2    col3    col4
1000-01-01    0001-01-01 00:00:00    null    false
1000-01-01    0001-01-01 00:00:00    null    false
1000-01-01    0001-01-01 00:00:00    null    false
1000-01-01    0001-01-01 00:00:00    null    false
9999-12-31    9999-12-31 00:00:00    null    true
9999-12-31    9999-12-31 00:00:00    null    true
9999-12-31    9999-12-31 23:59:59    null    true
null    null    null    true
null    null    null    true
null    null    null    false
null    null    null    true
null    null    null    null
null    null    null    null
select * from t4 into outfile '$resources/into_outfile/outfile_time_date_2.csv';
col1    col2    col3    col4
delete from t4;
load data infile '$resources/into_outfile/outfile_time_date_2.csv' into table t4 ignore 1 lines;
select * from t4;
col1    col2    col3    col4
1000-01-01    0001-01-01 00:00:00    null    false
1000-01-01    0001-01-01 00:00:00    null    false
1000-01-01    0001-01-01 00:00:00    null    false
1000-01-01    0001-01-01 00:00:00    null    false
9999-12-31    9999-12-31 00:00:00    null    true
9999-12-31    9999-12-31 00:00:00    null    true
9999-12-31    9999-12-31 23:59:59    null    true
null    null    null    true
null    null    null    true
null    null    null    false
null    null    null    true
null    null    null    null
null    null    null    null
delete from t4;
load data infile '$resources/load_data/time_date_3.csv' into table t4;

delete from t4;
load data infile '$resources/load_data/time_date_4.csv' into table t4 fields terminated by';';
select * from t4;
col1    col2    col3    col4
1000-01-01    0001-01-01 00:00:00    null    false
1000-01-01    0001-01-01 00:00:00    null    false
9999-12-31    9999-12-31 00:00:00    null    true
9999-12-31    9999-12-31 00:00:00    null    true
null    null    null    true
null    null    null    true
null    null    null    false
null    null    null    true
null    null    null    null
null    null    null    null
delete from t4;
load data infile '$resources/load_data/time_date_5.csv' into table t4;
internal error: the input value '9999-12-31 23:59:59.999999' is not Datetime type for column 1

select * from t4;
[unknown result because it is related to issue#5118]
delete from t4;
drop table t4;
drop table if exists t5;
create table t5(
col1 int auto_increment primary key,
col2 int,
col3 int
);
insert into t5 values (1,1,1);
load data infile '$resources/load_data/auto_increment_1.csv' into table t5;
tae data: duplicate
select * from t5;
col1    col2    col3
1    1    1
drop table t5;
drop table if exists t6;
create table t6(
col1 int auto_increment primary key,
col2 int,
col3 int
);
load data infile '$resources/load_data/auto_increment_2.csv' into table t6;
tae data: duplicate
select * from t6;
col1    col2    col3
drop table t6;
create table t7 (a uuid);
load data infile '$resources/load_data/uuid.csv' into table t7;
select * from t7;
a
deec3a94-4653-11ed-940e-f6efd850eccd
select * from t7 into outfile '$resources/into_outfile/outfile_uuid.csv';
a
delete from t7;
load data infile '$resources/into_outfile/outfile_uuid.csv' into table t7 ignore 1 lines;
select * from t7;
a
deec3a94-4653-11ed-940e-f6efd850eccd
drop table t7;