drop table if exists t1;
create table t1 (a int, b bit(10));
show create table t1;
➤ Table[12,-1,0]  ¦  Create Table[12,-1,0]  𝄀
t1  ¦  CREATE TABLE `t1` (
  `a` int DEFAULT NULL,
  `b` bit(10) DEFAULT NULL
)
desc t1;
➤ Field[1,0,0]  ¦  Type[1,0,0]  ¦  Null[1,0,0]  ¦  Key[1,0,0]  ¦  Default[1,0,0]  ¦  Extra[1,0,0]  ¦  Comment[1,0,0]  𝄀
a  ¦  INT(32)  ¦  YES  ¦    ¦  null  ¦    ¦    𝄀
b  ¦  BIT(10)  ¦  YES  ¦    ¦  null  ¦    ¦  
insert into t1 values (0, false);
insert into t1 values (1, true);
insert into t1 values (2, 0x2);
insert into t1 values (3, 0b11);
insert into t1 values (4, x'04');
insert into t1 values (5, b'101');
insert into t1 values (6, 'a');
insert into t1 values (6, 'ab');  -- error, data too long, bit_len('ab') = 16 > 10
invalid input: data too long, type width = 10, val = 110000101100010
insert into t1 values (7, 7.4999);  -- round(7.4999) = 7
insert into t1 values (8, 7.5);  -- round(7.5) = 8
insert into t1 values (9, 9);
insert into t1 values (10, 10);
insert into t1 values (10, 10);
insert into t1 values (1023, 0x3ff);
insert into t1 values (1024, 0x4ff);  -- error, data too long, bit_len(0x4ff) = 11 > 10
invalid input: data too long, type width = 10, val = 10011111111
select * from t1;
➤ a[4,32,0]  ¦  b[-7,10,0]  𝄀
0  ¦  0  𝄀
1  ¦  1  𝄀
2  ¦  2  𝄀
3  ¦  3  𝄀
4  ¦  4  𝄀
5  ¦  5  𝄀
6  ¦  97  𝄀
7  ¦  7  𝄀
8  ¦  8  𝄀
9  ¦  9  𝄀
10  ¦  10  𝄀
10  ¦  10  𝄀
1023  ¦  1023
update t1 set b = 6 where b = cast('a' as bit(10));
select * from t1;
➤ a[4,32,0]  ¦  b[-7,10,0]  𝄀
0  ¦  0  𝄀
1  ¦  1  𝄀
2  ¦  2  𝄀
3  ¦  3  𝄀
4  ¦  4  𝄀
5  ¦  5  𝄀
7  ¦  7  𝄀
8  ¦  8  𝄀
9  ¦  9  𝄀
10  ¦  10  𝄀
10  ¦  10  𝄀
1023  ¦  1023  𝄀
6  ¦  6
select * from t1 where b > 3 order by b desc;
➤ a[4,32,0]  ¦  b[-7,10,0]  𝄀
1023  ¦  1023  𝄀
10  ¦  10  𝄀
10  ¦  10  𝄀
9  ¦  9  𝄀
8  ¦  8  𝄀
7  ¦  7  𝄀
6  ¦  6  𝄀
5  ¦  5  𝄀
4  ¦  4
select sum(a), cast(b as unsigned) from t1 group by b having b > 3;
➤ sum(a)[-5,64,0]  ¦  cast(b as unsigned)[-5,64,0]  𝄀
4  ¦  4  𝄀
5  ¦  5  𝄀
7  ¦  7  𝄀
8  ¦  8  𝄀
9  ¦  9  𝄀
20  ¦  10  𝄀
1023  ¦  1023  𝄀
6  ¦  6
delete from t1 where b >= 7 and b <= 10;
select * from t1;
➤ a[4,32,0]  ¦  b[-7,10,0]  𝄀
0  ¦  0  𝄀
1  ¦  1  𝄀
2  ¦  2  𝄀
3  ¦  3  𝄀
4  ¦  4  𝄀
5  ¦  5  𝄀
1023  ¦  1023  𝄀
6  ¦  6
select cast(b as int) from t1;
➤ cast(b as int)[4,32,0]  𝄀
0  𝄀
1  𝄀
2  𝄀
3  𝄀
4  𝄀
5  𝄀
1023  𝄀
6
select count(b) from t1;
➤ count(b)[-5,64,0]  𝄀
8
select sum(b) from t1;
➤ sum(b)[3,38,0]  𝄀
1044
select min(b) from t1;
➤ min(b)[-7,10,0]  𝄀
0
select max(b) from t1;
➤ max(b)[-7,10,0]  𝄀
1023
select avg(b) from t1;
➤ avg(b)[3,24,4]  𝄀
130.5000
select median(b) from t1;
➤ median(b)[8,54,0]  𝄀
3.5
select var_pop(b) from t1;
➤ var_pop(b)[8,54,0]  𝄀
113797.25
select stddev_pop(b) from t1;
➤ stddev_pop(b)[8,54,0]  𝄀
337.33847986851424
ALTER TABLE t1 ADD c BIT(10) DEFAULT 0x1;
select * from t1;
➤ a[4,32,0]  ¦  b[-7,10,0]  ¦  c[-7,10,0]  𝄀
0  ¦  0  ¦  1  𝄀
1  ¦  1  ¦  1  𝄀
2  ¦  2  ¦  1  𝄀
3  ¦  3  ¦  1  𝄀
4  ¦  4  ¦  1  𝄀
5  ¦  5  ¦  1  𝄀
1023  ¦  1023  ¦  1  𝄀
6  ¦  6  ¦  1
ALTER TABLE t1 ADD INDEX (c);
show create table t1;
➤ Table[12,-1,0]  ¦  Create Table[12,-1,0]  𝄀
t1  ¦  CREATE TABLE `t1` (
  `a` int DEFAULT NULL,
  `b` bit(10) DEFAULT NULL,
  `c` bit(10) DEFAULT 0x1,
  KEY `c` (`c`)
)
ALTER TABLE t1 ADD UNIQUE (b);
show create table t1;
➤ Table[12,-1,0]  ¦  Create Table[12,-1,0]  𝄀
t1  ¦  CREATE TABLE `t1` (
  `a` int DEFAULT NULL,
  `b` bit(10) DEFAULT NULL,
  `c` bit(10) DEFAULT 0x1,
  KEY `c` (`c`),
  UNIQUE KEY `b` (`b`)
)
ALTER TABLE t1 ADD PRIMARY KEY (b);
show create table t1;
➤ Table[12,-1,0]  ¦  Create Table[12,-1,0]  𝄀
t1  ¦  CREATE TABLE `t1` (
  `a` int DEFAULT NULL,
  `b` bit(10) NOT NULL,
  `c` bit(10) DEFAULT 0x1,
  PRIMARY KEY (`b`),
  UNIQUE KEY `b` (`b`),
  KEY `c` (`c`)
)
ALTER TABLE t1 DROP INDEX c;
show create table t1;
➤ Table[12,-1,0]  ¦  Create Table[12,-1,0]  𝄀
t1  ¦  CREATE TABLE `t1` (
  `a` int DEFAULT NULL,
  `b` bit(10) NOT NULL,
  `c` bit(10) DEFAULT 0x1,
  PRIMARY KEY (`b`),
  UNIQUE KEY `b` (`b`)
)
ALTER TABLE t1 DROP COLUMN c;
show create table t1;
➤ Table[12,-1,0]  ¦  Create Table[12,-1,0]  𝄀
t1  ¦  CREATE TABLE `t1` (
  `a` int DEFAULT NULL,
  `b` bit(10) NOT NULL,
  PRIMARY KEY (`b`),
  UNIQUE KEY `b` (`b`)
)
ALTER TABLE t1 DROP INDEX b;
show create table t1;
➤ Table[12,-1,0]  ¦  Create Table[12,-1,0]  𝄀
t1  ¦  CREATE TABLE `t1` (
  `a` int DEFAULT NULL,
  `b` bit(10) NOT NULL,
  PRIMARY KEY (`b`)
)
ALTER TABLE t1 DROP PRIMARY KEY;
show create table t1;
➤ Table[12,-1,0]  ¦  Create Table[12,-1,0]  𝄀
t1  ¦  CREATE TABLE `t1` (
  `a` int DEFAULT NULL,
  `b` bit(10) NOT NULL
)
ALTER TABLE t1 MODIFY a bit(9);  -- error, data type length is too short
Data truncation: data out of range: data type int9, value 1023
ALTER TABLE t1 MODIFY a bit(10);
show create table t1;
➤ Table[12,-1,0]  ¦  Create Table[12,-1,0]  𝄀
t1  ¦  CREATE TABLE `t1` (
  `a` bit(10) DEFAULT NULL,
  `b` bit(10) NOT NULL
)
select * from t1;
➤ a[-7,10,0]  ¦  b[-7,10,0]  𝄀
0  ¦  0  𝄀
1  ¦  1  𝄀
2  ¦  2  𝄀
3  ¦  3  𝄀
4  ¦  4  𝄀
5  ¦  5  𝄀
1023  ¦  1023  𝄀
6  ¦  6
ALTER TABLE t1 CHANGE a new_a int;
show create table t1;
➤ Table[12,-1,0]  ¦  Create Table[12,-1,0]  𝄀
t1  ¦  CREATE TABLE `t1` (
  `new_a` int DEFAULT NULL,
  `b` bit(10) NOT NULL
)
select * from t1;
➤ new_a[4,32,0]  ¦  b[-7,10,0]  𝄀
0  ¦  0  𝄀
1  ¦  1  𝄀
2  ¦  2  𝄀
3  ¦  3  𝄀
4  ¦  4  𝄀
5  ¦  5  𝄀
1023  ¦  1023  𝄀
6  ¦  6
DROP TABLE IF EXISTS prepared_bit_null;
CREATE TABLE prepared_bit_null (id INT PRIMARY KEY, b1 BIT(1), b8 BIT(8), b64 BIT(64));
PREPARE prepared_bit_insert FROM 'INSERT INTO prepared_bit_null VALUES (?, ?, ?, ?)';
SET @id = 1, @b1 = NULL, @b8 = NULL, @b64 = NULL;
EXECUTE prepared_bit_insert USING @id, @b1, @b8, @b64;
SET @id = 2, @b1 = 1, @b8 = 165, @b64 = 9223372036854775808;
EXECUTE prepared_bit_insert USING @id, @b1, @b8, @b64;
SET @id = 3, @b1 = NULL, @b8 = NULL, @b64 = NULL;
EXECUTE prepared_bit_insert USING @id, @b1, @b8, @b64;
SELECT id, b1 IS NULL, b8 IS NULL, b64 IS NULL, HEX(b1), HEX(b8), HEX(b64)
FROM prepared_bit_null ORDER BY id;
➤ id[4,32,0]  ¦  b1 is null[-7,1,0]  ¦  b8 is null[-7,1,0]  ¦  b64 is null[-7,1,0]  ¦  HEX(b1)[12,65535,0]  ¦  HEX(b8)[12,65535,0]  ¦  HEX(b64)[12,65535,0]  𝄀
1  ¦  1  ¦  1  ¦  1  ¦  null  ¦  null  ¦  null  𝄀
2  ¦  0  ¦  0  ¦  0  ¦  1  ¦  A5  ¦  8000000000000000  𝄀
3  ¦  1  ¦  1  ¦  1  ¦  null  ¦  null  ¦  null
DEALLOCATE PREPARE prepared_bit_insert;
DROP TABLE prepared_bit_null;
DROP TABLE IF EXISTS issue_28685_bit64;
CREATE TABLE issue_28685_bit64 (id INT PRIMARY KEY, b BIT(64));
INSERT INTO issue_28685_bit64 VALUES
(1, 0),
(2, 9223372036854775807),
(3, 9223372036854775808),
(4, 18446744073709551615),
(5, NULL);
SELECT b * b * b * b * b * b * b * b + 0 AS bit8_derived
FROM (SELECT CAST(255 AS BIT(8)) AS b) AS bit8_source;
➤ bit8_derived[3,38,0]  𝄀
17878103347812890625
SELECT (b + 0) * (b + 0) AS overflow_value
FROM issue_28685_bit64 WHERE id = 4;
Data truncation: data out of range: data type DECIMAL, invalid input: Decimal128 Mul overflow: 18446744073709551615*18446744073709551615
SELECT 1 AS after_overflow;
➤ after_overflow[-5,64,0]  𝄀
1
SELECT id,
b + 0 AS plus_zero,
0 + b AS reverse_plus,
b - 1 AS minus_one,
1 - b AS reverse_minus,
b * 1 AS multiply_one,
1 * b AS reverse_multiply,
b % 2 AS mod_two
FROM issue_28685_bit64 ORDER BY id;
➤ id[4,32,0]  ¦  plus_zero[3,38,0]  ¦  reverse_plus[3,38,0]  ¦  minus_one[3,38,0]  ¦  reverse_minus[3,38,0]  ¦  multiply_one[3,38,0]  ¦  reverse_multiply[3,38,0]  ¦  mod_two[3,38,0]  𝄀
1  ¦  0  ¦  0  ¦  -1  ¦  1  ¦  0  ¦  0  ¦  0  𝄀
2  ¦  9223372036854775807  ¦  9223372036854775807  ¦  9223372036854775806  ¦  -9223372036854775806  ¦  9223372036854775807  ¦  9223372036854775807  ¦  1  𝄀
3  ¦  9223372036854775808  ¦  9223372036854775808  ¦  9223372036854775807  ¦  -9223372036854775807  ¦  9223372036854775808  ¦  9223372036854775808  ¦  0  𝄀
4  ¦  18446744073709551615  ¦  18446744073709551615  ¦  18446744073709551614  ¦  -18446744073709551614  ¦  18446744073709551615  ¦  18446744073709551615  ¦  1  𝄀
5  ¦  null  ¦  null  ¦  null  ¦  null  ¦  null  ¦  null  ¦  null
PREPARE issue_28685_bit64_stmt FROM
'SELECT id, b + ? AS value FROM issue_28685_bit64 ORDER BY id';
SET @issue_28685_bit64_param = 0;
EXECUTE issue_28685_bit64_stmt USING @issue_28685_bit64_param;
➤ id[4,32,0]  ¦  value[3,38,0]  𝄀
1  ¦  0  𝄀
2  ¦  9223372036854775807  𝄀
3  ¦  9223372036854775808  𝄀
4  ¦  18446744073709551615  𝄀
5  ¦  null
SET @issue_28685_bit64_param = -1;
EXECUTE issue_28685_bit64_stmt USING @issue_28685_bit64_param;
➤ id[4,32,0]  ¦  value[3,38,0]  𝄀
1  ¦  -1  𝄀
2  ¦  9223372036854775806  𝄀
3  ¦  9223372036854775807  𝄀
4  ¦  18446744073709551614  𝄀
5  ¦  null
SET @issue_28685_bit64_param = 0;
EXECUTE issue_28685_bit64_stmt USING @issue_28685_bit64_param;
➤ id[4,32,0]  ¦  value[3,38,0]  𝄀
1  ¦  0  𝄀
2  ¦  9223372036854775807  𝄀
3  ¦  9223372036854775808  𝄀
4  ¦  18446744073709551615  𝄀
5  ¦  null
DEALLOCATE PREPARE issue_28685_bit64_stmt;
DROP TABLE IF EXISTS issue_28685_bit64_ctas;
CREATE TABLE issue_28685_bit64_ctas AS
SELECT id, b + 0 AS value FROM issue_28685_bit64;
SELECT column_name, data_type, numeric_precision, numeric_scale
FROM information_schema.columns
WHERE table_schema = DATABASE()
AND table_name = 'issue_28685_bit64_ctas'
ORDER BY ordinal_position;
➤ column_name[12,256,0]  ¦  data_type[12,65535,0]  ¦  numeric_precision[-5,64,0]  ¦  numeric_scale[-5,64,0]  𝄀
id  ¦  int  ¦  10  ¦  0  𝄀
value  ¦  decimal  ¦  38  ¦  0
SELECT id, value FROM issue_28685_bit64_ctas ORDER BY id;
➤ id[4,32,0]  ¦  value[3,38,0]  𝄀
1  ¦  0  𝄀
2  ¦  9223372036854775807  𝄀
3  ¦  9223372036854775808  𝄀
4  ¦  18446744073709551615  𝄀
5  ¦  null
DROP TABLE issue_28685_bit64_ctas;
DROP TABLE issue_28685_bit64;
