DROP TABLE IF EXISTS t1;
create table t1 (a boolean,b bool);
insert into t1 values (0,1),(true,false),(true,1),(0,false),(NULL,NULL);
select * from t1;
a	b
false	true
true	false
true	true
false	false
null	null
SELECT * FROM t1 WHERE IF(a AND 1, 0, 1) order by a asc;
a	b
false	true
false	false
null	null
SELECT * FROM t1 WHERE IF(1 AND a, 0, 1);
a	b
false	true
false	false
null	null
SELECT * FROM t1 where NOT(a AND 1) order by a asc, b desc;
a	b
false	true
false	false
SELECT * FROM t1 where NOT(1 AND a);
a	b
false	true
false	false
SELECT * FROM t1 where (a AND 1)=0;
a	b
false	true
false	false
SELECT * FROM t1 where (1 AND a)=0;
a	b
false	true
false	false
SELECT * FROM t1 where (1 AND a)=1 order by a asc, 2 asc;
a	b
true	false
true	true
SELECT * FROM t1 where (1 AND a) IS NULL order by 1 desc, 2 asc;
a	b
null	null
select not a,a and b,a or b,a xor b from t1;
not a	a and b	a or b	a xor b
true	false	true	true
false	false	true	true
false	true	true	false
true	false	false	false
null	null	null	null
select not a and not b from t1;
not a and not b
false
false
false
true
null
select not a or b xor b from t1;
not a or b xor b
true
false
false
true
null
drop table if exists t2;
create table t2(a int,b int);
insert into t2 values(1,2),(3,4);
select a<2 from t2;
a<2
true
false
select a<2 and b<3 from t2;
a<2 and b<3
true
false
select a=1 or b=3 from t2;
a=1 or b=3
true
false
select a,count(a) from t1 group by a;
a	count(a)
false	2
true	2
null	0
select max(b) from t1;
max(b)
true
select min(a) from t1;
min(a)
false
select max(b)<min(a) from t1;
max(b)<min(a)
false
select distinct a from t1 where a=true;
a
true
select * from t1 where a IS NULL;
a	b
null	null
select * from t1 where b is NOT NULL;
a	b
false	true
true	false
true	true
false	false
select * from t1 where a IS NULL and b is NOT NULL;
a	b
select * from t1 where a>b order by a asc;
a	b
true	false
select * from t2 where a<1 AND NOT b order by b desc;
a	b
select b,max(b) from t1 where b is not NULL group by b order by b;
b	max(b)
false	false
true	true
select * from t1 where a<=b and a is not NULL;
a	b
false	true
true	true
false	false
select t1.a,t2.b from t1 join t2 on t1.a=t2.a order by t1.a desc, 2 desc;
a	b
true	2
true	2
select a,count(a) from t1 group by a having count(a)>1;
a	count(a)
false	2
true	2
select a,any_value(b) from t1 where isnotnull(a) group by a order by a asc;
a	any_value(b)
false	true
true	false
select a,b from t1 where a in (0,1);
a	b
false	true
true	false
true	true
false	false
select a,b from t1 where a not in (0,2);
a    b
true    false
true    true
select distinct t.a from (select * from t1) t where a not in (2) order by t.a asc;
a
false
true
select a and b from t1 where exists (select a from t1 where a is null) order by a desc;
a and b
false
true
false
false
null
update t1 set a=false where b is null;
delete from t1 where a=false;
select * from t1;
a	b
true	false	
true	true
delete from t1 where b=true;
select * from t1;
a	b
true	false