select cast('2000-01-01 00:00:00' as datetime(0));
cast(2000-01-01 00:00:00 as datetime(0))
2000-01-01 00:00:00
select cast('2000-01-01 00:00:00.0011' as datetime(0));
cast(2000-01-01 00:00:00.0011 as datetime(0))
2000-01-01 00:00:00
select cast('2000-01-01 00:00:00.9011' as datetime(0));
cast(2000-01-01 00:00:00.9011 as datetime(0))
2000-01-01 00:00:01
select cast('2000-01-01 00:00:00.001100999' as datetime(6));
cast(2000-01-01 00:00:00.001100999 as datetime(6))
2000-01-01 00:00:00.001101000
select cast('2000-01-01 00:00:00.001109' as datetime(5));
cast(2000-01-01 00:00:00.001109 as datetime(5))
2000-01-01 00:00:00.001110000
select cast('2000-01-01 00:00:00.501109' as datetime(0));
cast(2000-01-01 00:00:00.501109 as datetime(0))
2000-01-01 00:00:01
select cast('2000-01-01 00:00:00.49999' as datetime(0));
cast(2000-01-01 00:00:00.49999 as datetime(0))
2000-01-01 00:00:00
select cast('2000-01-01' as datetime(0));
cast(2000-01-01 as datetime(0))
2000-01-01 00:00:00
select cast('2022-01-01 25:00:00' as datetime(0));
invalid input: invalid datatime value 2022-01-01 25:00:00
select cast('2000-01-01' as datetime(0))+1;
cast(2000-01-01 as datetime(0))+1
20000101000001
select cast('2000-01-01' as datetime(0))*1;
cast(2000-01-01 as datetime(0))*1
20000101000000
select cast('2000-01-01' as datetime(0))*1.1;
cast(2000-01-01 as datetime(0))*1.1
22000111100000.0
SELECT DATE_ADD('2022-02-28 23:59:59.9999', INTERVAL 1 SECOND) '1 second later';
1 second later
2022-03-01 00:00:00.999900000
SELECT DATE_ADD('2022-02-28 23:59:59.9999', INTERVAL 1 MINUTE) '1 minute later';
1 minute later
2022-03-01 00:00:59.999900000
SELECT DATE_ADD('2022-02-28 23:59:59.9999', INTERVAL 1 HOUR) '1 hour later';
1 hour later
2022-03-01 00:59:59.999900000
SELECT DATE_ADD('2022-02-28 23:59:59.9999', INTERVAL 1 DAY) '1 day later';
1 day later
2022-03-01 23:59:59.999900000
SELECT DATE_ADD('2022-02-28 23:59:59.9999', INTERVAL 1 WEEK) '1 week later';
1 week later
2022-03-07 23:59:59.999900000
SELECT DATE_ADD('2022-02-28 23:59:59.9999', INTERVAL 13 MONTH) '1 month earlier';
1 month earlier
2023-03-28 23:59:59.999900000
SELECT DATE_ADD('2022-02-28 23:59:59.9999', INTERVAL 1 YEAR) '1 year earlier';
1 year earlier
2023-02-28 23:59:59.999900000
select cast(cast('2000-12-31' as date) as datetime(0));
cast(cast(2000-12-31 as date) as datetime(0))
2000-12-31 00:00:00
select cast(cast('2000-12-31' as datetime(0)) as date);
cast(cast('2000-12-31' as datetime(0)) as date)
2000-12-31
drop table if exists t1;
create table t1 (a datetime(0) not null, primary key(a));
insert into t1 values ('20200101000000'), ('2022-01-02'), ('2022-01-02 00:00:01'), ('2022-01-02 00:00:01.512345');
select * from t1 order by a asc;
a
2020-01-01 00:00:00
2022-01-02 00:00:00
2022-01-02 00:00:01
2022-01-02 00:00:02
select * from t1 where a='2022-01-02' order by 1 asc;
a
2022-01-02 00:00:00
select * from t1 where a>20220102;
a
2022-01-02 00:00:01
2022-01-02 00:00:02
select * from t1 where a!='2022-01-02';
a
2020-01-01 00:00:00
2022-01-02 00:00:01
2022-01-02 00:00:02
update t1 set a=DATE_ADD(a ,INTERVAL 1 WEEK) where a>'20220102';
select * from t1;
a
2020-01-01 00:00:00
2022-01-02 00:00:00
2022-01-09 00:00:01
2022-01-09 00:00:02
drop table t1;
create table t1 ( a int not null default 1, big datetime(4) primary key);
insert into t1 (big) values ('20220103'),('2022-01-01'),('2022-01-01 00:00:01'),('2022-01-02 00:00:00.000050');
select * from t1;
a	big
1	2022-01-03 00:00:00
1	2022-01-01 00:00:00
1	2022-01-01 00:00:01
1	2022-01-02 00:00:00.000100000
select * from t1 order by big limit 1,3;
a	big
1	2022-01-01 00:00:01
1	2022-01-02 00:00:00.000100000
1	2022-01-03 00:00:00
select * from t1 order by big limit 3 offset 1;
a	big
1	2022-01-01 00:00:01
1	2022-01-02 00:00:00.000100000
1	2022-01-03 00:00:00
select min(big),max(big),max(big)-1 from t1 group by a;
min(big)	max(big)	max(big) - 1
2022-01-01 00:00:00.0000	2022-01-03 00:00:00.0000	20220102999999.0000
select big,count(big) from t1 group by big having count(big)>1 order by 2;
big	count(big)
drop table t1;
create table t1 (id datetime(6) not null default "2022-01-31 00:00:00.0000006", a int, primary key (a));
insert into t1(a) values(1);
select * from t1;
id	a
2022-01-31 00:00:00.000001000	1
drop table if exists t1;
drop table if exists t2;
create table t1 (
dt  datetime(6) not null,
value32  integer not null,
primary key(value32)
);
create table t2 (
dt  datetime(3) not null,
value32  integer not null,
primary key(value32)
);
insert into t1 values('2022-01-01 00:00:00.000050', 1);
insert into t1 values('2022-01-01 00:00:00.000500', 2);
insert into t1 values('2022-01-01 00:00:00.005000', 3);
insert into t2 values('2022-01-01 00:00:00.005', 4);
insert into t2 values('2022-01-01 00:00:00.001', 5);
select * from t1;
dt	value32
2022-01-01 00:00:00.000050	1
2022-01-01 00:00:00.000500	2
2022-01-01 00:00:00.005000	3
select * from t2;
dt	value32
2022-01-01 00:00:00.001	5
2022-01-01 00:00:00.005	4
select * from t1 join t2 on t1.dt=t2.dt order by 1 desc, t2.dt asc;
dt	value32	dt	value32
2022-01-01 00:00:00.005000	3	2022-01-01 00:00:00.005	4
select * from t1 join t2 on t1.dt=t2.dt where t1.value32<>t2.value32;
dt	value32	dt	value32
2022-01-01 00:00:00.005000	3	2022-01-01 00:00:00.005	4
drop table if exists t1;
drop table if exists t2;
CREATE TABLE t_datetime(id datetime(6));
INSERT INTO t_datetime VALUES ('2020-01-01 23:59:59.999999'), ('2022-01-02 00:00:00');
SELECT id, id >= 20200102 FROM t_datetime;
id	id >= 20200102
2020-01-01 23:59:59.999999	false	
2022-01-02 00:00:00.000000	true	
SELECT id, id = 202020101 FROM t_datetime;
id	id = 202020101
2020-01-01 23:59:59.999999	false	
2022-01-02 00:00:00.000000	false	
SELECT id, 20200101 = id FROM t_datetime;
id	20200101 = id
2020-01-01 23:59:59.999999	false	
2022-01-02 00:00:00.000000	false	
SELECT * from t_datetime WHERE id = 20200102;
id
SELECT * from t_datetime WHERE id = 2.0200102e7;
id
SELECT * from t_datetime WHERE id = '20200102';
id
SELECT * from t_datetime WHERE id IN ('2020-01-01','2022-01-02');
id
2022-01-02 00:00:00.000000
SELECT * from t_datetime WHERE id IN (2.0200101e7,2.0200102e7 );
id
SELECT * from t_datetime WHERE id IN ('20220101', 20220102);
id
2022-01-02 00:00:00.000000
SELECT * from t_datetime WHERE id IN ('2.0200101e7','2.0200102e7');
id
SELECT * from t_datetime WHERE id BETWEEN 20191231 AND 20200101;
id
SELECT * from t_datetime WHERE id BETWEEN 2.0200101e7 and 2.0200102e7;
id
2020-01-01 23:59:59.999999
SELECT * from t_datetime WHERE id BETWEEN '2020-01-01' AND '2020-01-02';
id
2020-01-01 23:59:59.999999
SELECT * from t_datetime WHERE id BETWEEN '2022-01-01 00:00:00' AND '2022-01-02 00:00:00.000000';
id
2022-01-02 00:00:00.000000
drop table if exists t1;
CREATE TABLE t1 (a datetime(6));
INSERT INTO t1 VALUES ('2022-03-01 00:00:01.0001');
SELECT * FROM t1 WHERE coalesce(a) not BETWEEN '2022-02-28' and '2022-03-01';
a
2022-03-01 00:00:01.000100
SELECT * FROM t1 WHERE coalesce(a)!=20220301;
a
2022-03-01 00:00:01.000100
SELECT * FROM t1 WHERE coalesce(a) in ('2022-03-01','2022-03-01 00:00:00.0001');
a
drop table t1;
SELECT CAST(20220101 AS datetime(0)) BETWEEN 20220101 AND -1;
CAST(20220101 AS datetime(0)) BETWEEN 20220101 AND -1
false
SELECT CAST(00000501 AS datetime(0)) NOT BETWEEN 100 AND -1;
CAST(00000501 AS datetime(0)) NOT BETWEEN 100 AND -1
true
SELECT CAST(0 AS datetime(0)) BETWEEN 0 AND -1;
CAST(0 AS datetime(0)) BETWEEN 0 AND -1
NULL
SELECT CAST(1000101 as datetime(0)) BETWEEN '1000-01-01' and '1000-01-02';
CAST(1000101 as datetime(0)) BETWEEN '1000-01-01' and '1000-01-02'
false
drop table if exists t1;
drop table if exists t2;
drop table if exists t3;
drop table if exists t21;
drop table if exists t12;
CREATE TABLE t1 (a datetime(0), b int primary key);
INSERT INTO t1 VALUES ('2022-01-01 00:00:00',1),('2022-01-01 00:00:00',2);
update t1 set a='2022-01-02' where a='2022-01-01 00:00:00' limit 1;
select * from t1;
a	b
2022-01-02 00:00:00	1
2022-01-01 00:00:00	2
INSERT INTO t1 VALUES ('2022-01-01 00:00:00',3);
update t1 set a='2022-01-02' where a='2022-01-01 00:00:00';
select * from t1;
a	b
2022-01-02 00:00:00	1
2022-01-02 00:00:00	2
2022-01-02 00:00:00	3
drop table t1;
create table t1 (
a datetime(0) primary key,
b datetime(4) not null default '2000-01-01 00:00:00'
);
insert into t1 (a) values ('2022-01-02'),('2022-01-04'),('2022-01-06'),('2022-01-08'),('2022-01-10 01:01:01.000'),('2022-01-12');
update t1 set a=a+101;
select a,b from t1;
a	b
2022-01-02 00:01:01	2000-01-01 00:00:00.0000
2022-01-04 00:01:01	2000-01-01 00:00:00.0000
2022-01-06 00:01:01	2000-01-01 00:00:00.0000
2022-01-08 00:01:01	2000-01-01 00:00:00.0000
2022-01-10 01:02:02	2000-01-01 00:00:00.0000
2022-01-12 00:01:01	2000-01-01 00:00:00.0000
update t1 set a='2022-01-27 12:12:12.0001' where a='2022-01-08 00:01:01';
select a,b from t1;
a	b
2022-01-02 00:01:01	2000-01-01 00:00:00.0000
2022-01-04 00:01:01	2000-01-01 00:00:00.0000
2022-01-06 00:01:01	2000-01-01 00:00:00.0000
2022-01-10 01:02:02	2000-01-01 00:00:00.0000
2022-01-12 00:01:01	2000-01-01 00:00:00.0000
2022-01-27 12:12:12	2000-01-01 00:00:00.0000
update t1 set a=a-1 where 1 > 2;
select a,b from t1;
a	b
2022-01-02 00:01:01	2000-01-01 00:00:00.0000
2022-01-04 00:01:01	2000-01-01 00:00:00.0000
2022-01-06 00:01:01	2000-01-01 00:00:00.0000
2022-01-10 01:02:02	2000-01-01 00:00:00.0000
2022-01-12 00:01:01	2000-01-01 00:00:00.0000
2022-01-27 12:12:12	2000-01-01 00:00:00.0000
update t1 set a=a-1 where 3 > 2;
select a,b from t1;
a	b
2022-01-02 00:01:00	2000-01-01 00:00:00.0000
2022-01-04 00:01:00	2000-01-01 00:00:00.0000
2022-01-06 00:01:00	2000-01-01 00:00:00.0000
2022-01-10 01:02:01	2000-01-01 00:00:00.0000
2022-01-12 00:01:00	2000-01-01 00:00:00.0000
2022-01-27 12:12:11	2000-01-01 00:00:00.0000
drop table t1;
create table t1 (a datetime(0) primary key, b char(32));
insert into t1 values ('20220101','apple'),('2022-01-02','apple');
select * from t1;
a	b
2022-01-01 00:00:00	apple
2022-01-02 00:00:00	apple
drop table if exists t1;
drop table if exists t2;
drop table if exists t3;
drop table if exists t11;
drop table if exists t12;
CREATE TABLE t1 (a datetime(0), b int primary key);
INSERT INTO t1 VALUES ('2022-01-01 00:00:00',1),('2022-01-01 00:00:00',2);
delete from t1 where a='2022-01-01 00:00:00' limit 1;
select * from t1;
a	b
2022-01-01 00:00:00	2
INSERT INTO t1 VALUES ('2022-01-01 00:00:00',3);
delete from t1 where a='2022-01-01';
select * from t1;
a	b
drop table t1;
create table t1 (
a datetime(0) primary key,
b datetime(4) not null default '2000-01-01 00:00:00');
insert into t1 (a) values ('2022-01-02'),('2022-01-04'),('2022-01-06'),('2022-01-08'),('2022-01-10 01:01:01.000'),('2022-01-12');
delete from t1 where a=20220101+3;
select a,b from t1;
a	b
2022-01-02 00:00:00	2000-01-01 00:00:00.0000
2022-01-06 00:00:00	2000-01-01 00:00:00.0000
2022-01-08 00:00:00	2000-01-01 00:00:00.0000
2022-01-10 01:01:01	2000-01-01 00:00:00.0000
2022-01-12 00:00:00	2000-01-01 00:00:00.0000
delete from t1 where  3 < 2;
select a,b from t1;
a	b
2022-01-02 00:00:00	2000-01-01 00:00:00.0000
2022-01-06 00:00:00	2000-01-01 00:00:00.0000
2022-01-08 00:00:00	2000-01-01 00:00:00.0000
2022-01-10 01:01:01	2000-01-01 00:00:00.0000
2022-01-12 00:00:00	2000-01-01 00:00:00.0000
delete from t1 where  1 < 2;
select a,b from t1;
a	b
drop table t1;
create table t1 (a datetime(0) primary key, b char(32));
insert into t1 values ('20220101','apple'),('2022-01-02 00:00:00','apple');
select * from t1;
a	b
2022-01-01 00:00:00	apple
2022-01-02 00:00:00	apple
drop table t1;
create table t1(a datetime);
insert into t1 values("9999-12-31 23:59:59.999999");
invalid input: invalid datatime value 9999-12-31 23:59:59.999999
