DROP DATABASE IF EXISTS decimal_string_comparison;
CREATE DATABASE decimal_string_comparison;
USE decimal_string_comparison;
CREATE TABLE boundary_values (
id INT PRIMARY KEY,
d64 DECIMAL(18,2),
d128 DECIMAL(20,4)
);
INSERT INTO boundary_values VALUES
(1, NULL, NULL),
(2, 9007199254740991.99, 9007199254740991.9999),
(3, 9007199254740992.00, 9007199254740992.0000),
(4, 9007199254740992.01, 9007199254740992.0001),
(5, 9007199254740993.00, 9007199254740992.9999),
(6, 9007199254740993.01, 9007199254740993.0000);
SELECT GROUP_CONCAT(id ORDER BY id) AS eq_ids
FROM boundary_values WHERE d128 = '9007199254740992.0001';
➤ eq_ids[12,0,0]  𝄀
4
SELECT GROUP_CONCAT(id ORDER BY id) AS null_safe_eq_ids
FROM boundary_values WHERE d128 <=> '9007199254740992.0001';
➤ null_safe_eq_ids[12,0,0]  𝄀
4
SELECT GROUP_CONCAT(id ORDER BY id) AS ne_ids
FROM boundary_values WHERE d128 <> '9007199254740992.0001';
➤ ne_ids[12,0,0]  𝄀
2,3,5,6
SELECT GROUP_CONCAT(id ORDER BY id) AS lt_ids
FROM boundary_values WHERE d128 < '9007199254740992.0001';
➤ lt_ids[12,0,0]  𝄀
2,3
SELECT GROUP_CONCAT(id ORDER BY id) AS le_ids
FROM boundary_values WHERE d128 <= '9007199254740992.0001';
➤ le_ids[12,0,0]  𝄀
2,3,4
SELECT GROUP_CONCAT(id ORDER BY id) AS gt_ids
FROM boundary_values WHERE d128 > '9007199254740992.0001';
➤ gt_ids[12,0,0]  𝄀
5,6
SELECT GROUP_CONCAT(id ORDER BY id) AS ge_ids
FROM boundary_values WHERE d128 >= '9007199254740992.0001';
➤ ge_ids[12,0,0]  𝄀
4,5,6
SELECT GROUP_CONCAT(id ORDER BY id) AS reversed_eq_ids
FROM boundary_values WHERE '9007199254740992.0001' = d128;
➤ reversed_eq_ids[12,0,0]  𝄀
4
SELECT GROUP_CONCAT(id ORDER BY id) AS varchar_cast_eq_ids
FROM boundary_values WHERE d128 <=> CAST('9007199254740992.0001' AS VARCHAR);
➤ varchar_cast_eq_ids[12,0,0]  𝄀
4
SELECT GROUP_CONCAT(id ORDER BY id) AS decimal_cast_eq_ids
FROM boundary_values WHERE d128 <=> CAST('9007199254740992.0001' AS DECIMAL(20,4));
➤ decimal_cast_eq_ids[12,0,0]  𝄀
4
SELECT GROUP_CONCAT(id ORDER BY id) AS decimal64_eq_ids
FROM boundary_values WHERE d64 = '9007199254740992.01';
➤ decimal64_eq_ids[12,0,0]  𝄀
4
SELECT GROUP_CONCAT(id ORDER BY id) AS in_ids
FROM boundary_values WHERE d128 IN ('9007199254740992.0001');
➤ in_ids[12,0,0]  𝄀
4
SELECT GROUP_CONCAT(id ORDER BY id) AS not_in_ids
FROM boundary_values WHERE d128 NOT IN ('9007199254740992.0001');
➤ not_in_ids[12,0,0]  𝄀
2,3,5,6
SELECT GROUP_CONCAT(id ORDER BY id) AS reversed_in_ids
FROM boundary_values WHERE '9007199254740992.0001' IN (d128);
➤ reversed_in_ids[12,0,0]  𝄀
4
SELECT GROUP_CONCAT(id ORDER BY id) AS reversed_not_in_ids
FROM boundary_values WHERE '9007199254740992.0001' NOT IN (d128);
➤ reversed_not_in_ids[12,0,0]  𝄀
2,3,5,6
CREATE TABLE scale_values (
id INT PRIMARY KEY,
d DECIMAL(10,4)
);
INSERT INTO scale_values VALUES (1, 1.2345), (2, 1.2346);
SELECT GROUP_CONCAT(id ORDER BY id) AS higher_scale_lt_ids
FROM scale_values WHERE d < '1.23456';
➤ higher_scale_lt_ids[12,0,0]  𝄀
1
SELECT GROUP_CONCAT(id ORDER BY id) AS higher_scale_decimal_cast_lt_ids
FROM scale_values WHERE d < CAST('1.23456' AS DECIMAL(10,5));
➤ higher_scale_decimal_cast_lt_ids[12,0,0]  𝄀
1
CREATE TABLE numeric_prefix_values (
id INT PRIMARY KEY,
d DECIMAL(10,0)
);
INSERT INTO numeric_prefix_values VALUES (1, 0), (2, 1), (3, 16), (4, 100);
SELECT GROUP_CONCAT(id ORDER BY id) AS hex_looking_prefix_ids
FROM numeric_prefix_values WHERE d = '0x10';
➤ hex_looking_prefix_ids[12,0,0]  𝄀
1
SELECT GROUP_CONCAT(id ORDER BY id) AS embedded_plus_prefix_ids
FROM numeric_prefix_values WHERE d = '1+2';
➤ embedded_plus_prefix_ids[12,0,0]  𝄀
2
SELECT GROUP_CONCAT(id ORDER BY id) AS embedded_space_prefix_ids
FROM numeric_prefix_values WHERE d = '1 2';
➤ embedded_space_prefix_ids[12,0,0]  𝄀
2
SELECT GROUP_CONCAT(id ORDER BY id) AS scientific_notation_ids
FROM numeric_prefix_values WHERE d = '1e2';
➤ scientific_notation_ids[12,0,0]  𝄀
4
CREATE TABLE binary_literal_values (id INT PRIMARY KEY, d DECIMAL(10,0));
INSERT INTO binary_literal_values VALUES (1, 9), (2, 57);
SELECT GROUP_CONCAT(id ORDER BY id) AS raw_hex_bytes_ids
FROM binary_literal_values WHERE d = x'39';
➤ raw_hex_bytes_ids[12,0,0]  𝄀
2
SELECT GROUP_CONCAT(id ORDER BY id) AS raw_bit_bytes_ids
FROM binary_literal_values WHERE d = b'111001';
➤ raw_bit_bytes_ids[12,0,0]  𝄀
2
SELECT GROUP_CONCAT(id ORDER BY id) AS binary_character_text_ids
FROM binary_literal_values WHERE d = _binary'9';
➤ binary_character_text_ids[12,0,0]  𝄀
1
SELECT GROUP_CONCAT(id ORDER BY id) AS zero_large_exponent_ids
FROM numeric_prefix_values WHERE d = '0e10000';
➤ zero_large_exponent_ids[12,0,0]  𝄀
1
SELECT GROUP_CONCAT(id ORDER BY id) AS zero_small_exponent_ids
FROM numeric_prefix_values WHERE d = '0e-10000';
➤ zero_small_exponent_ids[12,0,0]  𝄀
1
SELECT GROUP_CONCAT(id ORDER BY id) AS large_exponent_lt_ids
FROM numeric_prefix_values WHERE d < '1e10000';
➤ large_exponent_lt_ids[12,0,0]  𝄀
1,2,3,4
SELECT GROUP_CONCAT(id ORDER BY id) AS tiny_exponent_eq_ids
FROM numeric_prefix_values WHERE d = '1e-10000';
➤ tiny_exponent_eq_ids[12,0,0]  𝄀
1
SELECT GROUP_CONCAT(id ORDER BY id) AS redundant_leading_zero_ids
FROM numeric_prefix_values
WHERE d = '000000000000000000000000000000000000000000000000000000000000000000000000000000001';
➤ redundant_leading_zero_ids[12,0,0]  𝄀
2
SELECT GROUP_CONCAT(id ORDER BY id) AS trailing_point_ids
FROM numeric_prefix_values WHERE d = '1.';
➤ trailing_point_ids[12,0,0]  𝄀
2
SELECT GROUP_CONCAT(id ORDER BY id) AS redundant_fraction_zero_ids
FROM numeric_prefix_values
WHERE d = '0.00000000000000000000000000000000000000000000000000000000000000000000000000000000';
➤ redundant_fraction_zero_ids[12,0,0]  𝄀
1
SELECT GROUP_CONCAT(id ORDER BY id) AS out_of_domain_scale_ids
FROM numeric_prefix_values
WHERE d = '0.00000000000000000000000000000000000000000000000000000000000000000000000000000001';
➤ out_of_domain_scale_ids[12,0,0]  𝄀
null
SELECT GROUP_CONCAT(id ORDER BY id) AS lower_constant_ids
FROM boundary_values WHERE d128 = LOWER('9007199254740992.0001');
➤ lower_constant_ids[12,0,0]  𝄀
4
SELECT GROUP_CONCAT(id ORDER BY id) AS concat_constant_ids
FROM boundary_values WHERE d128 = CONCAT('9007199254740992.000', '1');
➤ concat_constant_ids[12,0,0]  𝄀
4
SELECT GROUP_CONCAT(id ORDER BY id) AS case_constant_ids
FROM boundary_values
WHERE d128 = CASE WHEN 1 = 1 THEN '9007199254740992.0001' ELSE '0' END;
➤ case_constant_ids[12,0,0]  𝄀
4
SET @runtime_decimal_string = '9007199254740992.0001';
SELECT GROUP_CONCAT(id ORDER BY id) AS variable_real_fallback_ids
FROM boundary_values WHERE d128 = @runtime_decimal_string;
➤ variable_real_fallback_ids[12,0,0]  𝄀
2,3,4,5,6
CREATE TABLE runtime_strings (s VARCHAR(64));
INSERT INTO runtime_strings VALUES ('9007199254740992.0001');
SELECT GROUP_CONCAT(b.id ORDER BY b.id) AS concat_runtime_real_fallback_ids
FROM boundary_values b JOIN runtime_strings r ON b.d128 = CONCAT(r.s, '');
➤ concat_runtime_real_fallback_ids[12,0,0]  𝄀
2,3,4,5,6
SELECT GROUP_CONCAT(id ORDER BY id) AS multi_in_real_fallback_ids
FROM boundary_values
WHERE d128 IN ('9007199254740992.0001', '9007199254740992.9999');
➤ multi_in_real_fallback_ids[12,0,0]  𝄀
2,3,4,5,6
SELECT GROUP_CONCAT(id ORDER BY id) AS multi_not_in_real_fallback_ids
FROM boundary_values
WHERE d128 NOT IN ('9007199254740992.0001', '9007199254740992.9999');
➤ multi_not_in_real_fallback_ids[12,0,0]  𝄀
null
CREATE TABLE multi_in_update LIKE boundary_values;
ALTER TABLE multi_in_update ADD COLUMN matched INT DEFAULT 0;
INSERT INTO multi_in_update (id, d64, d128) SELECT id, d64, d128 FROM boundary_values;
UPDATE multi_in_update SET matched = 1
WHERE d128 IN ('9007199254740992.0001', '9007199254740992.9999');
SELECT GROUP_CONCAT(id ORDER BY id) AS multi_in_update_ids
FROM multi_in_update WHERE matched = 1;
➤ multi_in_update_ids[12,0,0]  𝄀
2,3,4,5,6
DELETE FROM multi_in_update
WHERE d128 NOT IN ('9007199254740992.0001', '9007199254740992.9999');
SELECT GROUP_CONCAT(id ORDER BY id) AS multi_not_in_delete_remaining_ids
FROM multi_in_update;
➤ multi_not_in_delete_remaining_ids[12,0,0]  𝄀
1,2,3,4,5,6
CREATE TABLE negative_values (
id INT PRIMARY KEY,
d DECIMAL(10,2),
KEY idx_d (d)
);
INSERT INTO negative_values VALUES (1, -1.20), (2, 0.00), (3, 1.20);
SELECT GROUP_CONCAT(id ORDER BY id) AS negative_eq_ids
FROM negative_values WHERE d = '-1.200';
➤ negative_eq_ids[12,0,0]  𝄀
1
SELECT GROUP_CONCAT(id ORDER BY id) AS negative_null_safe_eq_ids
FROM negative_values WHERE d <=> '-1.200';
➤ negative_null_safe_eq_ids[12,0,0]  𝄀
1
SELECT GROUP_CONCAT(id ORDER BY id) AS negative_ne_ids
FROM negative_values WHERE d <> '-1.200';
➤ negative_ne_ids[12,0,0]  𝄀
2,3
SELECT GROUP_CONCAT(id ORDER BY id) AS negative_index_eq_ids
FROM negative_values FORCE INDEX (idx_d) WHERE d = '-1.200';
➤ negative_index_eq_ids[12,0,0]  𝄀
1
CREATE TABLE decimal256_boundary (
id INT PRIMARY KEY,
d DECIMAL(38,30),
KEY idx_d (d)
);
INSERT INTO decimal256_boundary VALUES
(1, 12345678.000000000000000000000000000000);
SELECT COUNT(*) AS decimal256_lt_count
FROM decimal256_boundary
WHERE d < '12345678.0000000000000000000000000000001';
➤ decimal256_lt_count[-5,64,0]  𝄀
1
SELECT COUNT(*) AS decimal256_eq_count
FROM decimal256_boundary
WHERE d = '12345678.0000000000000000000000000000001';
➤ decimal256_eq_count[-5,64,0]  𝄀
0
SELECT COUNT(*) AS decimal256_index_lt_count
FROM decimal256_boundary FORCE INDEX (idx_d)
WHERE d < '12345678.0000000000000000000000000000001';
➤ decimal256_index_lt_count[-5,64,0]  𝄀
1
SELECT GROUP_CONCAT(id ORDER BY id) AS lower_single_in_ids
FROM boundary_values WHERE d128 IN (LOWER('9007199254740992.0001'));
➤ lower_single_in_ids[12,0,0]  𝄀
4
SELECT GROUP_CONCAT(id ORDER BY id) AS lower_single_not_in_ids
FROM boundary_values WHERE d128 NOT IN (LOWER('9007199254740992.0001'));
➤ lower_single_not_in_ids[12,0,0]  𝄀
2,3,5,6
SELECT GROUP_CONCAT(id ORDER BY id) AS lower_reversed_single_in_ids
FROM boundary_values WHERE LOWER('9007199254740992.0001') IN (d128);
➤ lower_reversed_single_in_ids[12,0,0]  𝄀
4
SELECT GROUP_CONCAT(id ORDER BY id) AS concat_single_in_ids
FROM boundary_values WHERE d128 IN (CONCAT('9007199254740992.000', '1'));
➤ concat_single_in_ids[12,0,0]  𝄀
4
SELECT GROUP_CONCAT(id ORDER BY id) AS case_single_in_ids
FROM boundary_values
WHERE d128 IN (CASE WHEN 1 = 1 THEN '9007199254740992.0001' ELSE '0' END);
➤ case_single_in_ids[12,0,0]  𝄀
4
CREATE TABLE foldable_in_update LIKE boundary_values;
ALTER TABLE foldable_in_update ADD COLUMN matched INT DEFAULT 0;
INSERT INTO foldable_in_update (id, d64, d128) SELECT id, d64, d128 FROM boundary_values;
UPDATE foldable_in_update SET matched = 1
WHERE d128 IN (LOWER('9007199254740992.0001'));
SELECT GROUP_CONCAT(id ORDER BY id) AS lower_single_in_update_ids
FROM foldable_in_update WHERE matched = 1;
➤ lower_single_in_update_ids[12,0,0]  𝄀
4
SELECT GROUP_CONCAT(id ORDER BY id) AS literal_between_ids
FROM boundary_values
WHERE d128 BETWEEN '9007199254740992.00005' AND '9007199254740992.99995';
➤ literal_between_ids[12,0,0]  𝄀
2,3,4,5,6
SELECT GROUP_CONCAT(id ORDER BY id) AS literal_not_between_ids
FROM boundary_values
WHERE d128 NOT BETWEEN '9007199254740992.00005' AND '9007199254740992.99995';
➤ literal_not_between_ids[12,0,0]  𝄀
null
SELECT GROUP_CONCAT(id ORDER BY id) AS scalar_literal_ids
FROM boundary_values
WHERE d128 = (SELECT '9007199254740992.0001');
➤ scalar_literal_ids[12,0,0]  𝄀
4
SELECT GROUP_CONCAT(id ORDER BY id) AS scalar_concat_ids
FROM boundary_values
WHERE d128 = (SELECT CONCAT('9007199254740992.000', '1'));
➤ scalar_concat_ids[12,0,0]  𝄀
4
CREATE TABLE scalar_foldable_update LIKE boundary_values;
ALTER TABLE scalar_foldable_update ADD COLUMN matched INT DEFAULT 0;
INSERT INTO scalar_foldable_update (id, d64, d128) SELECT id, d64, d128 FROM boundary_values;
UPDATE scalar_foldable_update SET matched = 1
WHERE d128 = (SELECT LOWER('9007199254740992.0001'));
SELECT GROUP_CONCAT(id ORDER BY id) AS scalar_foldable_update_ids
FROM scalar_foldable_update WHERE matched = 1;
➤ scalar_foldable_update_ids[12,0,0]  𝄀
4
SELECT GROUP_CONCAT(id ORDER BY id) AS binary_introducer_ids
FROM boundary_values WHERE d128 = _binary'9007199254740992.0001';
➤ binary_introducer_ids[12,0,0]  𝄀
4
SELECT GROUP_CONCAT(id ORDER BY id) AS binary_operator_ids
FROM boundary_values WHERE d128 = BINARY '9007199254740992.0001';
➤ binary_operator_ids[12,0,0]  𝄀
4
SELECT GROUP_CONCAT(id ORDER BY id) AS binary_cast_ids
FROM boundary_values WHERE d128 = CAST('9007199254740992.0001' AS BINARY);
➤ binary_cast_ids[12,0,0]  𝄀
4
SELECT GROUP_CONCAT(id ORDER BY id) AS cast_between_ids
FROM boundary_values
WHERE d128 BETWEEN CAST('9007199254740992.00005' AS CHAR)
AND CAST('9007199254740992.99995' AS CHAR);
➤ cast_between_ids[12,0,0]  𝄀
2,3,4,5,6
SELECT GROUP_CONCAT(id ORDER BY id) AS cast_not_between_ids
FROM boundary_values
WHERE d128 NOT BETWEEN CAST('9007199254740992.00005' AS CHAR)
AND CAST('9007199254740992.99995' AS CHAR);
➤ cast_not_between_ids[12,0,0]  𝄀
null
SELECT GROUP_CONCAT(id ORDER BY id) AS mixed_numeric_between_ids
FROM boundary_values
WHERE d128 BETWEEN '9007199254740992.00005' AND 9007199254740992.99995;
➤ mixed_numeric_between_ids[12,0,0]  𝄀
2,3,4,5,6
SELECT GROUP_CONCAT(id ORDER BY id) AS mixed_numeric_not_between_ids
FROM boundary_values
WHERE d128 NOT BETWEEN '9007199254740992.00005' AND 9007199254740992.99995;
➤ mixed_numeric_not_between_ids[12,0,0]  𝄀
null
SELECT GROUP_CONCAT(id ORDER BY id) AS quantified_any_concat_ids
FROM boundary_values
WHERE d128 = ANY(SELECT CONCAT('9007199254740992.000', '1'));
➤ quantified_any_concat_ids[12,0,0]  𝄀
4
SELECT GROUP_CONCAT(id ORDER BY id) AS quantified_not_in_concat_ids
FROM boundary_values
WHERE d128 NOT IN (SELECT CONCAT('9007199254740992.000', '1'));
➤ quantified_not_in_concat_ids[12,0,0]  𝄀
2,3,5,6
CREATE TABLE scalar_runtime_strings AS
SELECT s FROM runtime_strings;
SELECT GROUP_CONCAT(b.id ORDER BY b.id) AS scalar_runtime_column_ids
FROM boundary_values b
WHERE b.d128 = (SELECT s FROM scalar_runtime_strings LIMIT 1);
➤ scalar_runtime_column_ids[12,0,0]  𝄀
2,3,4,5,6
DROP DATABASE decimal_string_comparison;
