select -3.402823466E+38,-3.402823467E+38,-1.175494351E-38,-1.175494352E-38;
-3.402823466E+38	-3.402823467E+38	-1.175494351E-38	-1.175494352E-38
-3.402823466e38	-3.402823467e38	-1.175494351e-38	-1.175494352e-38
select 1.175494351E-38,1.175494352E-38,3.402823467E+38,3.402823467E+38;
1.175494351E-38	1.175494352E-38	3.402823467E+38	3.402823467E+38
1.175494351e-38	1.175494352e-38	3.402823467e38	3.402823467e38
select -3.402823466E+38*1,-1.175494351E-38-0.1E-38;
-3.402823466E+38*1	-1.175494351E-38-0.1E-38
-3.402823466e38	-1.275494351e-38
drop table if exists t1;
create table t1 (a float not null, primary key(a));
insert into t1 values(-3.402823466E+38),(-1.175494351E-38),(0),(1.175494351E-38),(3.402823466E+38);
select * from t1 order by 1;
a
-3.40282e38
-1.17549e-38
0
1.17549e-38
3.40282e38
delete from t1 where a>0;
drop table if exists t1;
create table t1(a float(23,22));
insert into t1 values(-3.402823466),(-1.175494351),(0),(1.175494351),(3.402823466);
select * from t1 order by 1 asc;
a
-3.4028234481811523000000
-1.1754943132400513000000
0.0000000000000000000000
1.1754943132400513000000
3.4028234481811523000000
drop table if exists t1;
create table t1(a float(23));
insert into t1 values(-3.402823466),(-1.175494351),(0),(1.175494351),(3.402823466);
select * from t1 order by a asc;
a
-3.40282
-1.17549
0
1.17549
3.40282
drop table t1;
create table t1 ( a float not null default 1, big float(20,5) primary key);
insert into t1 (big) values (-1),(12345678.901234567),(92233720368547.75807);
select * from t1 order by a desc, big asc;
a	big
1	-1.00000
1	12345679.00000
1	92233718038528.00000
select min(big),max(big),max(big)-1 from t1;
min(big)	max(big)	max(big)-1
-1.00000	92233718038528.00000	92233718038527.00000
select min(big),max(big),max(big)-1 from t1 group by a order by 3;
min(big)	max(big)	max(big)-1
-1.00000	92233718038528.00000	92233718038527.00000
drop table t1;
create table t1 ( a float not null default 1, big float);
insert into t1 (big) values (-1),(12345678.901234567),(92233720368547.75807);
select * from t1 order by a asc, big asc;
a	big
1.0	-1.0
1.0	1.2345679E7
1.0	9.223372E13
select * from t1 order by big limit 1,2;
a	big
1.0	1.2345679E7
1.0	9.223372E13
select * from t1 order by big limit 2 offset 1;
a	big
1.0	1.2345679E7
1.0	9.223372E13
select min(big),max(big),max(big)-1 from t1;
min(big)	max(big)	max(big)-1
-1	92233700000000	92233718038527
select min(big),max(big),max(big)-1 from t1 group by a order by 1+2;
min(big)	max(big)	max(big)-1
-1	92233700000000	92233718038527
drop table t1;
create table t1 (id float primary key, a int);
insert into t1 values (1.1,1);
insert into t1 values (2.22,2);
insert into t1 values (3.333,3);
insert into t1 values (4.4444,4);
select * from t1 order by id desc;
id	a
4.4444	4
3.333	3
2.22	2
1.1	1
drop table if exists t1;
drop table if exists t2;
create table t1 (
a float not null,
b float not null,
primary key(a)
);
create table t2 (
a  float  not null,
b  integer  not null,
primary key(a)
);
insert into t1 values(0.123456, 1);
insert into t1 values(1.23456, 2);
insert into t2 values(1.23456e-1, 3);
insert into t2 values(1.23456e1, 4);
insert into t1 values(3,5);
select * from t1;
a	b
0.123456	1
1.23456	2
3	5
select * from t2;
a	b
0.123456	3
12.3456	4
select * from t1 join t2 on t1.a=t2.a order by t1.a asc, t2.b desc;
a	b	a	b
0.123456	1	0.123456	3
select * from t1 join t2 on t1.a=t2.a where t1.a>=0.123456 order by abs(3);
a	b	a	b
0.123456	1	0.123456	3
select * from t1 join t2 on t2.b=t1.a order by 1,2 desc;
a	b	a	b
3	5	0.123456	3
drop table if exists t1;
drop table if exists t2;
create table t1 (a float);
insert into t1 values (17.666);
select * from t1 where a>=17.6660;
a
17.666
select * from t1 where a>='17.6660';
a
17.666
select a  mod 50 as result from t1;
result
17.666000366210938
select cast(a as unsigned) mod 50 as result from t1;
result
18
select cast(a+a as signed) from t1;
cast(a+a as signed)
35
select cast(0-a as signed) from t1;
cast(0-a as signed)
-18
drop table t1;
CREATE TABLE t1 (id INT PRIMARY KEY,
a float(20),
b VARCHAR(20));
INSERT INTO t1 (id,a) VALUES
(1,0),
(2,CAST(0x7FFFFFFFFFFFFFFF AS UNSIGNED)),
(3,CAST(0x8000000000000000 AS UNSIGNED)),
(4,CAST(0xFFFFFFFFFFFFFFFF AS UNSIGNED));
select * from t1;
id	a	b
1	0	NULL
2	9.22337e18	NULL
3	9.22337e18	NULL
4	1.84467e19	NULL
UPDATE t1 SET b = a;
select a,count(a) from t1 where ((a = 9.223372036854776e18) and (b = '9.223372036854776e18')) group by a having count(a)>2 order by count(a);
a	count(a)
select distinct a,b from t1 where ((a != 9.223372036854776e18) and (b != '9.223372036854776e18')) order by 2;
a	b
0	0
1.84467e19	1.844674407370955e19
CREATE TABLE t_float(id float(2,1));
INSERT INTO t_float VALUES (1),(1.1), (2);
SELECT id, id >= 1.1 FROM t_float;
id	id >= 1.1
1.0	false	
1.1	true	
2.0	true	
SELECT id, 1.1 <= id FROM t_float;
id	1.1 <= id
1.0	false	
1.1	true	
2.0	true	
SELECT id, id = 1.1 FROM t_float;
id	id = 1.1
1.0	false	
1.1	true	
2.0	false	
SELECT * from t_float WHERE id = 1.1;
id
1.1
SELECT * from t_float WHERE id = 1.1e0;
id
1.1
SELECT * from t_float WHERE id = '1.1';
id
1.1
SELECT * from t_float WHERE id = '1.1e0';
id
1.1
SELECT * from t_float WHERE id IN (1.1, 2.2);
id
SELECT * from t_float WHERE id IN (1.1e0, 2.2e0);
id
SELECT * from t_float WHERE id IN ('1.1', '2.2');
id
1.1
SELECT * from t_float WHERE id IN ('1.1e0', '2.2e0');
id
1.1
SELECT * from t_float WHERE id BETWEEN 1.1 AND 1.9;
id
1.1
SELECT * from t_float WHERE id BETWEEN 1.1e0 AND 1.9e0;
id
1.1
SELECT * from t_float WHERE id BETWEEN '1.1' AND '1.9';
id
1.1
SELECT * from t_float WHERE id BETWEEN '1.1e0' AND '1.9e0';
id
1.1
drop table t1;
CREATE TABLE t1 (a float(3));
INSERT INTO t1 VALUES (1),(0.00),(0.8);
SELECT * FROM t1 WHERE coalesce(a) BETWEEN 0 and 0.9;
a
0
0.8
SELECT * FROM t1 WHERE coalesce(a)=0.9;
a
SELECT * FROM t1 WHERE coalesce(a) in (0.8,0.9);
a
SELECT * FROM t1 WHERE a BETWEEN 0 AND 0.9;
a
0
0.8
SELECT * FROM t1 WHERE a=0.9;
a
SELECT * FROM t1 WHERE a IN (0.8,0.9);
a
drop table t1;
create table t1 (id float, b int);
insert into t1 values(4.574,1);
insert into t1 values(5.3111,2);
insert into t1 values(177.171,3);
select count(*) from t1
where id>=5.3111 and id <=177.171;
count(*)
1
select count(*) from t1
where id between 5.3111 and 177.171;
count(*)
1
drop table t1;
SELECT (1234.0 BETWEEN 0 AND 1234);
(1234.0 BETWEEN 0 AND 1234)
true
SELECT 0.000 >= 0;
0.000 >= 0
true
SELECT 00.000 <= 0.00001;
00.000 <= 0.00001
true
SELECT CAST(1.00 AS UNSIGNED) BETWEEN 1 AND -1;
CAST(1.00 AS UNSIGNED) BETWEEN 1 AND -1
false
SELECT CAST(1.00 AS UNSIGNED) NOT BETWEEN 1 AND -1;
CAST(1.00 AS UNSIGNED) NOT BETWEEN 1 AND -1
true
SELECT CAST(0.00 AS UNSIGNED) BETWEEN 0 AND -1;
CAST(0.00 AS UNSIGNED) BETWEEN 0 AND -1
false
SELECT CAST(0.00 AS UNSIGNED) NOT BETWEEN 0 AND -1;
CAST(0.00 AS UNSIGNED) NOT BETWEEN 0 AND -1
true
SELECT ( -1 BETWEEN 0 AND 1 );
( -1 BETWEEN 0 AND 1 )
false
SELECT ( 0 BETWEEN  0.000000001 AND 1 );
( 0 BETWEEN  0.000000001 AND 1 )
false
SELECT ( 1 BETWEEN 1.0000001 and 0);
( 1 BETWEEN 1.0000001 and 0)
false
drop table if exists t1;
drop table if exists t2;
drop table if exists t3;
drop table if exists t11;
drop table if exists t12;
CREATE TABLE t1 (a float(3), b float(5) primary key);
INSERT INTO t1 VALUES (1.00,1.0000),(1.00,2.0000);
update t1 set a=2.00 where a=1 limit 1;
select * from t1;
a	b
2.0	1.0
1.0	2.0
INSERT INTO t1 VALUES (1,3);
update t1 set a=2 where a=1.00;
select * from t1;
a	b
2.0	1.0
2.0	2.0
2.0	3.0
drop table t1;
create table t1 (
a float(10,5) not null,
b int not null default 12346,
c float(10,5) not null default 12345.67890,
d float(10,5) not null default 12345.67890,
e float(10,5) not null default 12345.67890,
f float(10,5) not null default 12345.67890,
g float(10,5) not null default 12345.67890,
h float(10,5) not null default 12345.67890,
i float(10,5) not null default 12345.67890,
j float(10,5) not null default 12345.67890,
primary key (a));
insert into t1 (a) values (2),(4),(6),(8),(10),(12),(14),(16),(18),(20),(22),(24),(26),(23);
update t1 set a=a+101;
select a,b from t1;
a	b
103.0	12346
105.0	12346
107.0	12346
109.0	12346
111.0	12346
113.0	12346
115.0	12346
117.0	12346
119.0	12346
121.0	12346
123.0	12346
124.0	12346
125.0	12346
127.0	12346
update t1 set a=27 where a=125;
select a,b from t1;
a	b
27.0	12346
103.0	12346
105.0	12346
107.0	12346
109.0	12346
111.0	12346
113.0	12346
115.0	12346
117.0	12346
119.0	12346
121.0	12346
123.0	12346
124.0	12346
127.0	12346
update t1 set a=a-1 where 1 > 2;
select a,b from t1;
a	b
27.0	12346
103.0	12346
105.0	12346
107.0	12346
109.0	12346
111.0	12346
113.0	12346
115.0	12346
117.0	12346
119.0	12346
121.0	12346
123.0	12346
124.0	12346
127.0	12346
update t1 set a=a-1 where 3 > 2;
select a,b from t1;
a	b
26.0	12346
102.0	12346
104.0	12346
106.0	12346
108.0	12346
110.0	12346
112.0	12346
114.0	12346
116.0	12346
118.0	12346
120.0	12346
122.0	12346
123.0	12346
126.0	12346
drop table t1;
create table t1 (a float(10,5) primary key, b char(32));
insert into t1 values (1,'apple'), (2,'apple');
select * from t1;
a	b
1.0	apple
2.0	apple
drop table if exists t1;
drop table if exists t2;
drop table if exists t3;
drop table if exists t11;
drop table if exists t12;
CREATE TABLE t1 (a float(3), b float(5) primary key);
INSERT INTO t1 VALUES (1,1),(1,2);
delete from t1 where a=1 limit 1;
select * from t1;
a	b
1	2
INSERT INTO t1 VALUES (1,3);
delete from t1 where a=1;
select * from t1;
a	b
drop table t1;
create table t1 (
a float(10,5) not null,
b int not null default 12346,
c float(10,5) not null default 12345.67890,
d float(10,5) not null default 12345.67890,
e float(10,5) not null default 12345.67890,
f float(10,5) not null default 12345.67890,
g float(10,5) not null default 12345.67890,
h float(10,5) not null default 12345.67890,
i float(10,5) not null default 12345.67890,
j float(10,5) not null default 12345.67890,
primary key (a));
insert into t1 (a) values (2.1111),(4),(00006.12311),(8.41231),(24.0000);
delete from t1 where a=2+2.0000;
select a,b from t1;
a	b
2.11110	12346
6.12311	12346
8.41231	12346
24.00000	12346
delete from t1 where  a=24.0000;
select a,b from t1;
a	b
2.11110	12346
6.12311	12346
8.41231	12346
delete from t1 where  3 < 2;
select a,b from t1;
a	b
2.11110	12346
6.12311	12346
8.41231	12346
delete from t1 where  1 < 2;
select a,b from t1;
a	b
drop table t1;
create table t1 (a float(10,5) primary key, b char(32));
insert into t1 values (1,'apple'), (2,'apple');
select * from t1;
a	b
1.00000	apple
2.00000	apple
select cast(1.1 as float(255, 3));
cast(1.1 as float(255, 3))
1.1
