drop database if exists issue_28694_blob_text_limits;
create database issue_28694_blob_text_limits;
use issue_28694_blob_text_limits;
set @issue_28694_old_sql_mode = @@session.sql_mode;
create table limits (
id int primary key,
tinyblob_col tinyblob,
text_col text,
blob_col blob
);
set session sql_mode = 'STRICT_TRANS_TABLES';
insert into limits (id, tinyblob_col) values (1, repeat('a', 256));
invalid input: data too long
insert into limits (id, text_col) values (2, repeat('b', 65536));
invalid input: data too long
insert into limits (id, blob_col) values (3, repeat('c', 65536));
invalid input: data too long
select count(*) as strict_rows from limits;
strict_rows
0
insert into limits values (20, 'ok', 'ok', 'ok');
update limits
set tinyblob_col = repeat('d', 256), text_col = repeat('e', 65536), blob_col = repeat('f', 65536)
where id = 20;
invalid input: data too long
insert into limits (id, tinyblob_col, text_col, blob_col)
values (20, 'ok', 'ok', 'ok')
on duplicate key update
tinyblob_col = repeat('g', 256), text_col = repeat('h', 65536), blob_col = repeat('i', 65536);
invalid input: data too long
select id, octet_length(tinyblob_col), octet_length(text_col), octet_length(blob_col)
from limits where id = 20;
id    octet_length(tinyblob_col)    octet_length(text_col)    octet_length(blob_col)
20    2    2    2
set @issue_28694_id = 21;
set @issue_28694_tinyblob = repeat('j', 256);
set @issue_28694_text = repeat('k', 65536);
set @issue_28694_blob = repeat('l', 65536);
prepare issue_28694_strict_insert from 'insert into limits values (?, ?, ?, ?)';
execute issue_28694_strict_insert using @issue_28694_id, @issue_28694_tinyblob, @issue_28694_text, @issue_28694_blob;
invalid input: data too long
select count(*) as strict_prepared_rows from limits where id = 21;
strict_prepared_rows
0
deallocate prepare issue_28694_strict_insert;
create table ctas_tiny (id int, value tinyblob) as
select id, repeat('m', 256) as value from limits where id = 20;
invalid input: data too long
select count(*) as strict_ctas_tables
from information_schema.tables
where table_schema = database() and table_name = 'ctas_tiny';
strict_ctas_tables
0
create table generated_limits (
source_value longtext,
stored_value text generated always as (cast(source_value as text)) stored
);
insert into generated_limits (source_value) values (repeat('g', 65536));
invalid input: data too long
select count(*) as strict_generated_rows from generated_limits;
strict_generated_rows
0
create table load_limits (id int primary key, value tinytext);
load data inline format='csv', data='1,xxxxxxxxxxxxxxxxxxxxxxxxxxxxxxxxxxxxxxxxxxxxxxxxxxxxxxxxxxxxxxxxxxxxxxxxxxxxxxxxxxxxxxxxxxxxxxxxxxxxxxxxxxxxxxxxxxxxxxxxxxxxxxxxxxxxxxxxxxxxxxxxxxxxxxxxxxxxxxxxxxxxxxxxxxxxxxxxxxxxxxxxxxxxxxxxxxxxxxxxxxxxxxxxxxxxxxxxxxxxxxxxxxxxxxxxxxxxxxxxxxxxxxxxxxxxxxxx' into table load_limits fields terminated by ',';
invalid input: data too long
select count(*) as strict_load_rows from load_limits;
strict_load_rows
0
set session sql_mode = '';
insert into generated_limits (source_value) values (repeat('g', 65536));
select @@warning_count;
@@warning_count
1
select octet_length(source_value), octet_length(stored_value) from generated_limits;
octet_length(source_value)    octet_length(stored_value)
65536    65535
load data inline format='csv', data='2,xxxxxxxxxxxxxxxxxxxxxxxxxxxxxxxxxxxxxxxxxxxxxxxxxxxxxxxxxxxxxxxxxxxxxxxxxxxxxxxxxxxxxxxxxxxxxxxxxxxxxxxxxxxxxxxxxxxxxxxxxxxxxxxxxxxxxxxxxxxxxxxxxxxxxxxxxxxxxxxxxxxxxxxxxxxxxxxxxxxxxxxxxxxxxxxxxxxxxxxxxxxxxxxxxxxxxxxxxxxxxxxxxxxxxxxxxxxxxxxxxxxxxxxxxxxxxxxx' into table load_limits fields terminated by ',';
select @@warning_count;
@@warning_count
1
select id, octet_length(value) from load_limits;
id    octet_length(value)
2    255
insert into limits values (11, repeat('a', 256), repeat('b', 65536), repeat('c', 65536));
select @@warning_count;
@@warning_count
3
select id, octet_length(tinyblob_col), octet_length(text_col), octet_length(blob_col)
from limits where id = 11;
id    octet_length(tinyblob_col)    octet_length(text_col)    octet_length(blob_col)
11    255    65535    65535
update limits
set tinyblob_col = repeat('d', 256), text_col = repeat('e', 65536), blob_col = repeat('f', 65536)
where id = 11;
select @@warning_count;
@@warning_count
3
select id, octet_length(tinyblob_col), octet_length(text_col), octet_length(blob_col)
from limits where id = 11;
id    octet_length(tinyblob_col)    octet_length(text_col)    octet_length(blob_col)
11    255    65535    65535
insert into limits (id, tinyblob_col, text_col, blob_col)
values (11, 'ok', 'ok', 'ok')
on duplicate key update
tinyblob_col = repeat('g', 256), text_col = repeat('h', 65536), blob_col = repeat('i', 65536);
select @@warning_count;
@@warning_count
3
select id, octet_length(tinyblob_col), octet_length(text_col), octet_length(blob_col)
from limits where id = 11;
id    octet_length(tinyblob_col)    octet_length(text_col)    octet_length(blob_col)
11    255    65535    65535
set @issue_28694_id = 14;
set @issue_28694_tinyblob = repeat('j', 256);
set @issue_28694_text = repeat('k', 65536);
set @issue_28694_blob = repeat('l', 65536);
prepare issue_28694_insert from 'insert into limits values (?, ?, ?, ?)';
execute issue_28694_insert using @issue_28694_id, @issue_28694_tinyblob, @issue_28694_text, @issue_28694_blob;
select @@warning_count;
@@warning_count
3
select id, octet_length(tinyblob_col), octet_length(text_col), octet_length(blob_col)
from limits where id = 14;
id    octet_length(tinyblob_col)    octet_length(text_col)    octet_length(blob_col)
14    255    65535    65535
deallocate prepare issue_28694_insert;
create table limits_copy as select * from limits;
select id, octet_length(tinyblob_col), octet_length(text_col), octet_length(blob_col)
from limits_copy where id in (11, 14) order by id;
id    octet_length(tinyblob_col)    octet_length(text_col)    octet_length(blob_col)
11    255    65535    65535
14    255    65535    65535
select
sum(case when lower(data_type) = 'tinyblob' and lower(column_type) = 'tinyblob' and character_maximum_length = 255 and character_octet_length = 255 then 1 else 0 end) as tinyblob_metadata,
sum(case when lower(data_type) = 'text' and lower(column_type) = 'text' and character_maximum_length = 65535 and character_octet_length = 65535 then 1 else 0 end) as text_metadata,
sum(case when lower(data_type) = 'blob' and lower(column_type) = 'blob' and character_maximum_length = 65535 and character_octet_length = 65535 then 1 else 0 end) as blob_metadata
from information_schema.columns
where table_schema = database() and table_name = 'limits';
tinyblob_metadata    text_metadata    blob_metadata
1    1    1
set session sql_mode = 'STRICT_TRANS_TABLES';
load data inline format='csv', data='3,xxxxxxxxxxxxxxxxxxxxxxxxxxxxxxxxxxxxxxxxxxxxxxxxxxxxxxxxxxxxxxxxxxxxxxxxxxxxxxxxxxxxxxxxxxxxxxxxxxxxxxxxxxxxxxxxxxxxxxxxxxxxxxxxxxxxxxxxxxxxxxxxxxxxxxxxxxxxxxxxxxxxxxxxxxxxxxxxxxxxxxxxxxxxxxxxxxxxxxxxxxxxxxxxxxxxxxxxxxxxxxxxxxxxxxxxxxxxxxxxxxxxxxxxxxxxxxxx' ignore into table load_limits fields terminated by ',';
select @@warning_count;
@@warning_count
1
select id, octet_length(value) from load_limits order by id;
id    octet_length(value)
2    255
3    255
set session sql_mode = @issue_28694_old_sql_mode;
drop database issue_28694_blob_text_limits;
