drop database if exists issue_28594_div_precision;
create database issue_28594_div_precision;
use issue_28594_div_precision;
create table operands (a decimal(10,2), b decimal(10,2));
insert into operands values (1, 3);
set session div_precision_increment = 0;
select a / b as q from operands;
➤ q[3,12,2]  𝄀
0.33
create table result_0 as select a / b as q from operands;
show create table result_0;
➤ Table[12,8,0]  ¦  Create Table[12,60,0]  𝄀
result_0  ¦  CREATE TABLE `result_0` (
  `q` decimal(12,2) DEFAULT NULL
)
set session div_precision_increment = 4;
select a / b as q from operands;
➤ q[3,16,6]  𝄀
0.333333
create table result_4 as select a / b as q from operands;
show create table result_4;
➤ Table[12,8,0]  ¦  Create Table[12,60,0]  𝄀
result_4  ¦  CREATE TABLE `result_4` (
  `q` decimal(16,6) DEFAULT NULL
)
set session div_precision_increment = 10;
select a / b as q from operands;
➤ q[3,22,12]  𝄀
0.333333333333
create table ddl_precision (
a decimal(10,2), b decimal(10,2),
q decimal(30,12) generated always as (a / b) stored,
check (a / b > 0.3333333)
);
insert into ddl_precision(a,b) values (1,3);
select q, a / b as direct_q from ddl_precision;
➤ q[3,30,12]  ¦  direct_q[3,22,12]  𝄀
0.333333333333  ¦  0.333333333333
insert into ddl_precision(a,b) values (0,3);
-- @regex("constraint violation", true)
constraint violation: Check constraint '__mo_chk_1' is violated
select count(*) as accepted_rows from ddl_precision;
➤ accepted_rows[-5,64,0]  𝄀
1
set session div_precision_increment = 4;
select q, a / b as direct_q from ddl_precision;
➤ q[3,30,12]  ¦  direct_q[3,16,6]  𝄀
0.333333333333  ¦  0.333333
set session div_precision_increment = 10;
update ddl_precision set a = 2;
select q, a / b as direct_q from ddl_precision;
➤ q[3,30,12]  ¦  direct_q[3,22,12]  𝄀
0.666666666667  ¦  0.666666666667
alter table operands add column q_generated decimal(30,12) generated always as (a / b) stored;
select q_generated, a / b as direct_q from operands;
➤ q_generated[3,30,12]  ¦  direct_q[3,22,12]  𝄀
0.333333333333  ¦  0.333333333333
insert into operands(a,b) values (2,3);
select a, q_generated, a / b as direct_q from operands order by a;
➤ a[3,10,2]  ¦  q_generated[3,30,12]  ¦  direct_q[3,22,12]  𝄀
1.00  ¦  0.333333333333  ¦  0.333333333333  𝄀
2.00  ¦  0.666666666667  ¦  0.666666666667
delete from operands where a = 2;
create table ddl_default (q decimal(30,12) default (1.00 / 3.00));
insert into ddl_default values (default);
select q from ddl_default;
➤ q[3,30,12]  𝄀
0.333333333333
create table ctas_precision_src (
a decimal(10,2), b decimal(10,2),
q decimal(30,12) default (a / b),
d decimal(30,12) default (1.00 / 3.00)
);
insert into ctas_precision_src(a,b) values (1,3);
set session div_precision_increment = 4;
create table ctas_precision_dst as select * from ctas_precision_src;
insert into ctas_precision_dst(a,b) values (2,3);
select a, q, d from ctas_precision_dst order by a;
➤ a[3,10,2]  ¦  q[3,30,12]  ¦  d[3,30,12]  𝄀
1.00  ¦  0.333333333333  ¦  0.333333333333  𝄀
2.00  ¦  0.666666666667  ¦  0.333333333333
create table ctas_precision_alias as select a as x,b as y,q from ctas_precision_src;
insert into ctas_precision_alias(x,y) values (2,3);
select x, q from ctas_precision_alias where x = 2;
➤ x[3,10,2]  ¦  q[3,30,12]  𝄀
2.00  ¦  0.666666666667
create table ctas_precision_rebind(a decimal(12,3)) as select a,b,q from ctas_precision_src;
insert into ctas_precision_rebind(a,b) values (2,3);
select a, q from ctas_precision_rebind where a = 2;
➤ a[3,12,3]  ¦  q[3,30,12]  𝄀
2.000  ¦  0.666666700000
create table ctas_precision_authored (
a decimal(10,2), b decimal(10,2),
q decimal(30,12) default (a / b)
) as select a,b,q from ctas_precision_src;
insert into ctas_precision_authored(a,b) values (2,3);
select a, q from ctas_precision_authored where a = 2;
➤ a[3,10,2]  ¦  q[3,30,12]  𝄀
2.00  ¦  0.666667000000
set session div_precision_increment = 10;
create table ctas_precision_nonnull_src (
a decimal(10,2) not null, b decimal(10,2) not null,
q decimal(30,12) default (a / b)
);
set session div_precision_increment = 4;
create table ctas_precision_nullable(a decimal(10,2) null)
as select a,b,q from ctas_precision_nonnull_src;
insert into ctas_precision_nullable(a,b) values (2,3),(null,3);
select q from ctas_precision_nullable where a = 2;
➤ q[3,30,12]  𝄀
0.666666666667
select q is null as q_is_null from ctas_precision_nullable where a is null;
➤ q_is_null[-7,1,0]  𝄀
1
set session div_precision_increment = 10;
create table ddl_replay (
a decimal(10,2), b decimal(10,2),
q decimal(30,12) generated always as (a / b) stored,
d decimal(30,12) default (1.00 / 3.00),
check (a / b > 0.3333333)
);
insert into ddl_replay(a,b) values (1,3);
set session div_precision_increment = 4;
alter table ddl_replay add column note int first;
select q, d from ddl_replay;
➤ q[3,30,12]  ¦  d[3,30,12]  𝄀
0.333333333333  ¦  0.333333333333
insert into ddl_replay(a,b) values (2,3);
select a, q, d from ddl_replay order by a;
➤ a[3,10,2]  ¦  q[3,30,12]  ¦  d[3,30,12]  𝄀
1.00  ¦  0.333333333333  ¦  0.333333333333  𝄀
2.00  ¦  0.666666666667  ¦  0.333333333333
alter table ddl_replay add column r decimal(30,12) generated always as (a / b) stored;
select q, r from ddl_replay order by a;
➤ q[3,30,12]  ¦  r[3,30,12]  𝄀
0.333333333333  ¦  0.333333000000  𝄀
0.666666666667  ¦  0.666667000000
create table ddl_replay_like like ddl_replay;
insert into ddl_replay_like(a,b) values (1,3);
select q, r, d from ddl_replay_like;
➤ q[3,30,12]  ¦  r[3,30,12]  ¦  d[3,30,12]  𝄀
0.333333333333  ¦  0.333333000000  ¦  0.333333333333
set session div_precision_increment = 10;
create table ddl_rebind (
a decimal(10,2), b decimal(10,2),
q decimal(30,12) generated always as (a / b) stored
);
insert into ddl_rebind(a,b) values (1,3);
set session div_precision_increment = 4;
alter table ddl_rebind modify column a decimal(12,2);
select q from ddl_rebind;
➤ q[3,30,12]  𝄀
0.333333000000
set session div_precision_increment = 10;
create table ddl_reorder (
a decimal(10,2), b decimal(10,2),
q decimal(30,12) generated always as (a / b) stored,
check (a / b > 0.3333333)
);
insert into ddl_reorder(a,b) values (1,3);
set session div_precision_increment = 4;
alter table ddl_reorder add column x int, modify column a decimal(10,2) after x;
select q, a / b as direct_q from ddl_reorder;
➤ q[3,30,12]  ¦  direct_q[3,16,6]  𝄀
0.333333333333  ¦  0.333333
insert into ddl_reorder(a,b) values (1,3);
insert into ddl_reorder(a,b) values (0,3);
-- @regex("constraint violation", true)
constraint violation: Check constraint '__mo_chk_1' is violated
select count(*) as accepted_rows from ddl_reorder;
➤ accepted_rows[-5,64,0]  𝄀
2
insert into ddl_reorder(a,b) values (2,3);
select a, q, a / b as direct_q from ddl_reorder order by a;
➤ a[3,10,2]  ¦  q[3,30,12]  ¦  direct_q[3,16,6]  𝄀
1.00  ¦  0.333333333333  ¦  0.333333  𝄀
1.00  ¦  0.333333333333  ¦  0.333333  𝄀
2.00  ¦  0.666666666667  ¦  0.666667
set session div_precision_increment = 30;
select a / b as q from operands;
➤ q[3,42,30]  𝄀
0.333333333333333333333333333333
create table result_30 as select a / b as q from operands;
show create table result_30;
➤ Table[12,9,0]  ¦  Create Table[12,62,0]  𝄀
result_30  ¦  CREATE TABLE `result_30` (
  `q` decimal(42,30) DEFAULT NULL
)
create table wide_operands (a decimal(50,10), b decimal(10,0));
insert into wide_operands values (1, 3);
set session div_precision_increment = 0;
select a / b as q from wide_operands;
➤ q[3,50,10]  𝄀
0.3333333333
set session div_precision_increment = 4;
select a / b as q from wide_operands;
➤ q[3,54,14]  𝄀
0.33333333333333
set session div_precision_increment = 10;
select a / b as q from wide_operands;
➤ q[3,60,20]  𝄀
0.33333333333333333333
set session div_precision_increment = 30;
select a / b as q from wide_operands;
➤ q[3,65,30]  𝄀
0.333333333333333333333333333333
select cast(99999999999999999999999999999999999999999999999999999999999999999 as decimal(65,0)) /
cast(99999999999999999999999999999999999999999999999999999999999999999 as decimal(65,0)) as q;
➤ q[3,65,30]  𝄀
1.000000000000000000000000000000
select cast(100000000000000000000 as decimal(38,0)) /
cast(1 as decimal(38,30)) as q;
➤ q[3,65,30]  𝄀
100000000000000000000.000000000000000000000000000000
select cast('30000000000000000000000000000000000000000000000' as decimal(47,0)) /
cast('10000000000000000000000000000000000000000000000' as decimal(47,0)) as q;
➤ q[3,65,30]  𝄀
3.000000000000000000000000000000
select cast('28000000000000000000000000000000000000000000000' as decimal(47,0)) /
cast('10000000000000000000000000000000000000000000000' as decimal(47,0)) as q;
➤ q[3,65,30]  𝄀
2.800000000000000000000000000000
set session div_precision_increment = 0;
select cast('99999999999999999999999999999999999999' as decimal(38,0)) /
cast('0.000000000000000000000000001' as decimal(38,27)) as q;
➤ q[3,65,0]  𝄀
99999999999999999999999999999999999999000000000000000000000000000
select cast('10000000000000000000000000000000000000' as decimal(38,0)) /
cast('0.000000000000000000000000000001' as decimal(38,30)) as q;
Data truncation: data out of range: data type decimal256, value '10000000000000000000000000000000000000000000000000000000000000000000' exceeds DECIMAL(65,0)
create table rejected_result as select cast('10000000000000000000000000000000000000' as decimal(38,0)) /
cast('0.000000000000000000000000000001' as decimal(38,30)) as q;
Data truncation: data out of range: data type decimal256, value '10000000000000000000000000000000000000000000000000000000000000000000' exceeds DECIMAL(65,0)
show tables like 'rejected_result';
➤ Tables_in_issue_28594_div_precision[12,5000,0]
set session div_precision_increment = 10;
prepare div_precision_stmt from 'select a / b as q from operands';
execute div_precision_stmt;
➤ q[3,22,12]  𝄀
0.333333333333
set session div_precision_increment = 30;
execute div_precision_stmt;
➤ q[3,42,30]  𝄀
0.333333333333333333333333333333
deallocate prepare div_precision_stmt;
set session div_precision_increment = 4;
select cast('18446744073709551616' as decimal(38,0)) /
cast('-18446744073709551616' as decimal(20,0)) as q;
➤ q[3,42,4]  𝄀
-1.0000
select cast('18446744073709551615' as decimal(38,0)) /
cast('18446744073709551615' as decimal(20,0)) as q;
➤ q[3,42,4]  𝄀
1.0000
set session div_precision_increment = 0;
select cast('00:00:01.000' as time(3)) / cast(3 as decimal(10,0)) as q;
➤ q[3,17,3]  𝄀
0.333
set session div_precision_increment = 10;
select cast('00:00:01.000' as time(3)) / cast(3 as decimal(10,0)) as q;
➤ q[3,27,13]  𝄀
0.3333333333333
select cast(1 as decimal(10,2)) / cast('00:00:03' as time) as q;
➤ q[3,20,12]  𝄀
0.333333333333
prepare temporal_div_stmt from
'select cast(''00:00:01.000'' as time(3)) / cast(3 as decimal(10,0)) as q';
execute temporal_div_stmt;
➤ q[3,27,13]  𝄀
0.3333333333333
set session div_precision_increment = 30;
execute temporal_div_stmt;
➤ q[3,47,30]  𝄀
0.333333333333333333333333333333
deallocate prepare temporal_div_stmt;
set session div_precision_increment = 4;
select cast('2020-01-01 23:59:59.999999' as datetime(6)) / 10 as q;
➤ q[3,24,10]  𝄀
2020010123595.9999999000
create table temporal_result as
select cast('2020-01-01 23:59:59.999999' as datetime(6)) / 10 as q;
show create table temporal_result;
➤ Table[12,15,0]  ¦  Create Table[12,68,0]  𝄀
temporal_result  ¦  CREATE TABLE `temporal_result` (
  `q` decimal(24,10) DEFAULT NULL
)
select cast('2562047787:59:59.999999' as time(6)) / cast(1 as signed) as q;
➤ q[3,24,10]  𝄀
25620477875959.9999990000
select cast(1 as signed) / cast('2562047787:59:59.999999' as time(6)) as q;
➤ q[3,29,4]  𝄀
0.0000
select cast('2020-01-01 23:59:59.999999' as timestamp(6)) / 10 as q;
➤ q[3,24,10]  𝄀
2020010123595.9999999000
set session div_precision_increment = 30;
select cast('2020-01-01 23:59:59.999999' as datetime(6)) / 10 as q;
➤ q[3,50,30]  𝄀
2020010123595.999999900000000000000000000000
select cast('2020-01-01' as date) / cast(2 as decimal(10,0)) as q;
➤ q[3,38,30]  𝄀
10100050.500000000000000000000000000000
select cast(2020 as year) / cast(2 as decimal(10,0)) as q;
➤ q[3,34,30]  𝄀
1010.000000000000000000000000000000
set session div_precision_increment = 4;
drop database issue_28594_div_precision;
