set time_zone = '+00:00';
select cast('0000-00-00' as date) as zero_date,
cast('0000-00-00 00:00:00' as datetime) as zero_datetime,
cast('0000-00-00 00:00:00' as timestamp) as zero_timestamp;
➤ zero_date[91,64,0]  ¦  zero_datetime[93,64,0]  ¦  zero_timestamp[93,64,0]  𝄀
0000-00-00  ¦  0000-00-00 00:00:00  ¦  0000-00-00 00:00:00
select cast('0000-00-00 00:00:00' as date) as zero_datetime_string_to_date;
➤ zero_datetime_string_to_date[91,64,0]  𝄀
0000-00-00
select cast(cast('0000-00-00' as date) as signed) as zero_date_signed,
cast(cast('0000-00-00 00:00:00' as datetime) as decimal(20,6)) as zero_datetime_decimal,
cast(cast('0000-00-00 00:00:00' as timestamp) as decimal(20,6)) as zero_timestamp_decimal;
➤ zero_date_signed[-5,64,0]  ¦  zero_datetime_decimal[3,20,6]  ¦  zero_timestamp_decimal[3,20,6]  𝄀
0  ¦  0.000000  ¦  0.000000
select unix_timestamp('0000-00-00 00:00:00') as zero_unix_timestamp;
➤ zero_unix_timestamp[-5,64,0]  𝄀
null
select unix_timestamp('0000-00-00 00:00:00.000000') as zero_unix_timestamp_fraction;
➤ zero_unix_timestamp_fraction[3,38,6]  𝄀
null
select datediff(cast('0000-00-00' as date), cast('2024-01-01' as date)) as zero_datediff;
➤ zero_datediff[-5,64,0]  𝄀
null
select timestampdiff(day,
cast('0000-00-00 00:00:00' as datetime),
cast('2024-01-01 00:00:00' as datetime)) as zero_timestampdiff_datetime,
timestampdiff(day,
cast('0000-00-00' as date),
cast('2024-01-01' as date)) as zero_timestampdiff_date,
timestampdiff(day,
cast('0000-00-00 00:00:00' as timestamp),
cast('2024-01-01 00:00:00' as timestamp)) as zero_timestampdiff_timestamp,
timestampdiff(day,
'0000-00-00 00:00:00',
'2024-01-01 00:00:00') as zero_timestampdiff_string;
➤ zero_timestampdiff_datetime[-5,64,0]  ¦  zero_timestampdiff_date[-5,64,0]  ¦  zero_timestampdiff_timestamp[-5,64,0]  ¦  zero_timestampdiff_string[-5,64,0]  𝄀
null  ¦  null  ¦  null  ¦  null
select timestampdiff(day,
cast('0000-00-00' as date),
'2024-01-01 00:00:00') as zero_timestampdiff_date_string,
timestampdiff(day,
'0000-00-00 00:00:00',
cast('2024-01-01' as date)) as zero_timestampdiff_string_date,
timestampdiff(day,
cast('0000-00-00 00:00:00' as timestamp),
cast('2024-01-01' as date)) as zero_timestampdiff_timestamp_date,
timestampdiff(day,
cast('0000-00-00' as date),
cast('2024-01-01 00:00:00' as timestamp)) as zero_timestampdiff_date_timestamp;
➤ zero_timestampdiff_date_string[-5,64,0]  ¦  zero_timestampdiff_string_date[-5,64,0]  ¦  zero_timestampdiff_timestamp_date[-5,64,0]  ¦  zero_timestampdiff_date_timestamp[-5,64,0]  𝄀
null  ¦  null  ¦  null  ¦  null
select dayofyear(cast('0000-00-00' as date)) as zero_dayofyear,
week(cast('0000-00-00' as date)) as zero_week_date,
week(cast('0000-00-00 00:00:00' as datetime)) as zero_week_datetime;
➤ zero_dayofyear[5,16,0]  ¦  zero_week_date[-6,8,0]  ¦  zero_week_datetime[-6,8,0]  𝄀
null  ¦  null  ¦  null
select weekofyear(cast('0000-00-00' as date)) as zero_weekofyear_date,
weekofyear(cast('0000-00-00 00:00:00' as datetime)) as zero_weekofyear_datetime,
weekofyear(cast('0000-00-00 00:00:00' as timestamp)) as zero_weekofyear_timestamp;
➤ zero_weekofyear_date[-5,64,0]  ¦  zero_weekofyear_datetime[-5,64,0]  ¦  zero_weekofyear_timestamp[-5,64,0]  𝄀
null  ¦  null  ¦  null
select yearweek(cast('0000-00-00' as date)) as zero_yearweek_date,
yearweek(cast('0000-00-00 00:00:00' as datetime)) as zero_yearweek_datetime,
yearweek(cast('0000-00-00 00:00:00' as timestamp)) as zero_yearweek_timestamp,
yearweek('0000-00-00') as zero_yearweek_string;
➤ zero_yearweek_date[-5,64,0]  ¦  zero_yearweek_datetime[-5,64,0]  ¦  zero_yearweek_timestamp[-5,64,0]  ¦  zero_yearweek_string[-5,64,0]  𝄀
null  ¦  null  ¦  null  ¦  null
select weekday(cast('0000-00-00' as date)) as zero_weekday_date,
weekday(cast('0000-00-00 00:00:00' as datetime)) as zero_weekday_datetime,
dayofweek(cast('0000-00-00' as date)) as zero_dayofweek_date,
dayofweek(cast('0000-00-00 00:00:00' as datetime)) as zero_dayofweek_datetime,
dayofweek(cast('0000-00-00 00:00:00' as timestamp)) as zero_dayofweek_timestamp;
➤ zero_weekday_date[-5,64,0]  ¦  zero_weekday_datetime[-5,64,0]  ¦  zero_dayofweek_date[-5,64,0]  ¦  zero_dayofweek_datetime[-5,64,0]  ¦  zero_dayofweek_timestamp[-5,64,0]  𝄀
null  ¦  null  ¦  null  ¦  null  ¦  null
select dayname(cast('0000-00-00' as date)) as zero_dayname_date,
dayname(cast('0000-00-00 00:00:00' as datetime)) as zero_dayname_datetime,
dayname(cast('0000-00-00 00:00:00' as timestamp)) as zero_dayname_timestamp;
➤ zero_dayname_date[12,-1,0]  ¦  zero_dayname_datetime[12,-1,0]  ¦  zero_dayname_timestamp[12,-1,0]  𝄀
null  ¦  null  ¦  null
select monthname(cast('0000-00-00' as date)) as zero_monthname_date,
monthname(cast('0000-00-00 00:00:00' as datetime)) as zero_monthname_datetime,
monthname(cast('0000-00-00 00:00:00' as timestamp)) as zero_monthname_timestamp;
➤ zero_monthname_date[12,-1,0]  ¦  zero_monthname_datetime[12,-1,0]  ¦  zero_monthname_timestamp[12,-1,0]  𝄀
null  ¦  null  ¦  null
select dayofmonth(cast('0000-00-00' as date)) as zero_dayofmonth_date,
dayofmonth(cast('0000-00-00 00:00:00' as datetime)) as zero_dayofmonth_datetime,
dayofmonth(cast('0000-00-00 00:00:00' as timestamp)) as zero_dayofmonth_timestamp,
month(cast('0000-00-00' as date)) as zero_month_date,
month(cast('0000-00-00 00:00:00' as datetime)) as zero_month_datetime,
quarter(cast('0000-00-00' as date)) as zero_quarter_date,
quarter(cast('0000-00-00 00:00:00' as datetime)) as zero_quarter_datetime,
year(cast('0000-00-00' as date)) as zero_year_date,
year(cast('0000-00-00 00:00:00' as datetime)) as zero_year_datetime;
➤ zero_dayofmonth_date[-6,8,0]  ¦  zero_dayofmonth_datetime[-6,8,0]  ¦  zero_dayofmonth_timestamp[-6,8,0]  ¦  zero_month_date[-6,8,0]  ¦  zero_month_datetime[-6,8,0]  ¦  zero_quarter_date[-6,8,0]  ¦  zero_quarter_datetime[-6,8,0]  ¦  zero_year_date[-5,64,0]  ¦  zero_year_datetime[-5,64,0]  𝄀
0  ¦  0  ¦  0  ¦  0  ¦  0  ¦  0  ¦  0  ¦  0  ¦  0
select cast('0001-01-01' as date) as minimum_date,
cast('0001-01-01 00:00:00' as datetime) as minimum_datetime;
➤ minimum_date[91,64,0]  ¦  minimum_datetime[93,64,0]  𝄀
0001-01-01  ¦  0001-01-01 00:00:00
drop table if exists mysql_compat_temporal_zero;
drop table if exists mysql_compat_temporal_zero_dml;
create table mysql_compat_temporal_zero(d date, dt datetime, ts timestamp);
create table mysql_compat_temporal_zero_dml(
id int primary key,
d date,
dt datetime,
ts timestamp
);
set @old_sql_mode = @@sql_mode;
set sql_mode = 'STRICT_TRANS_TABLES,NO_ZERO_DATE';
insert into mysql_compat_temporal_zero values
('0000-00-00', '0000-00-00 00:00:00', '0000-00-00 00:00:00');
truncated type date value 0000-00-00 for column value, 1
select count(*) as strict_no_zero_date_rows from mysql_compat_temporal_zero;
➤ strict_no_zero_date_rows[-5,64,0]  𝄀
0
set sql_mode = 'STRICT_TRANS_TABLES';
insert into mysql_compat_temporal_zero values
('0000-00-00', '0000-00-00 00:00:00', '0000-00-00 00:00:00');
select d, dt, ts from mysql_compat_temporal_zero;
➤ d[91,64,0]  ¦  dt[93,64,0]  ¦  ts[93,64,0]  𝄀
0000-00-00  ¦  0000-00-00 00:00:00  ¦  0000-00-00 00:00:00
truncate table mysql_compat_temporal_zero;
set sql_mode = 'NO_ZERO_DATE';
insert into mysql_compat_temporal_zero values
('0000-00-00', '0000-00-00 00:00:00', '0000-00-00 00:00:00');
select d, dt, ts from mysql_compat_temporal_zero;
➤ d[91,64,0]  ¦  dt[93,64,0]  ¦  ts[93,64,0]  𝄀
0000-00-00  ¦  0000-00-00 00:00:00  ¦  0000-00-00 00:00:00
set sql_mode = 'STRICT_TRANS_TABLES,NO_ZERO_DATE';
insert into mysql_compat_temporal_zero_dml values
(1, cast('0000-00-00' as date), '2024-01-02 03:04:05', '2024-01-02 03:04:05');
truncated type date value 0000-00-00 for column value, 1
insert into mysql_compat_temporal_zero_dml values
(2, '2024-01-02', cast('0000-00-00 00:00:00' as datetime), '2024-01-02 03:04:05');
truncated type datetime value 0000-00-00 00:00:00 for column value, 1
insert into mysql_compat_temporal_zero_dml values
(3, '2024-01-02', '2024-01-02 03:04:05', cast('0000-00-00 00:00:00' as timestamp));
truncated type datetime value 0000-00-00 00:00:00 for column value, 1
insert into mysql_compat_temporal_zero_dml
select 4,
cast('0000-00-00' as date),
cast('0000-00-00 00:00:00' as datetime),
cast('0000-00-00 00:00:00' as timestamp);
truncated type date value 0000-00-00 for column value, 1
select count(*) as strict_cast_insert_rows from mysql_compat_temporal_zero_dml;
➤ strict_cast_insert_rows[-5,64,0]  𝄀
0
insert into mysql_compat_temporal_zero_dml values
(10, '2024-01-02', '2024-01-02 03:04:05', '2024-01-02 03:04:05');
update mysql_compat_temporal_zero_dml
set d = cast('0000-00-00' as date)
where id = 10;
truncated type date value 0000-00-00 for column value, 1
update mysql_compat_temporal_zero_dml
set dt = cast('0000-00-00 00:00:00' as datetime)
where id = 10;
truncated type datetime value 0000-00-00 00:00:00 for column value, 1
update mysql_compat_temporal_zero_dml
set ts = cast('0000-00-00 00:00:00' as timestamp)
where id = 10;
truncated type datetime value 0000-00-00 00:00:00 for column value, 1
select id, d, dt, ts from mysql_compat_temporal_zero_dml where id = 10;
➤ id[4,32,0]  ¦  d[91,64,0]  ¦  dt[93,64,0]  ¦  ts[93,64,0]  𝄀
10  ¦  2024-01-02  ¦  2024-01-02 03:04:05  ¦  2024-01-02 03:04:05
truncate table mysql_compat_temporal_zero_dml;
set sql_mode = 'STRICT_TRANS_TABLES';
insert into mysql_compat_temporal_zero_dml
select 20,
cast('0000-00-00' as date),
cast('0000-00-00 00:00:00' as datetime),
cast('0000-00-00 00:00:00' as timestamp);
select id, d, dt, ts from mysql_compat_temporal_zero_dml;
➤ id[4,32,0]  ¦  d[91,64,0]  ¦  dt[93,64,0]  ¦  ts[93,64,0]  𝄀
20  ¦  0000-00-00  ¦  0000-00-00 00:00:00  ¦  0000-00-00 00:00:00
truncate table mysql_compat_temporal_zero_dml;
set sql_mode = 'NO_ZERO_DATE';
insert into mysql_compat_temporal_zero_dml
select 30,
cast('0000-00-00' as date),
cast('0000-00-00 00:00:00' as datetime),
cast('0000-00-00 00:00:00' as timestamp);
select id, d, dt, ts from mysql_compat_temporal_zero_dml;
➤ id[4,32,0]  ¦  d[91,64,0]  ¦  dt[93,64,0]  ¦  ts[93,64,0]  𝄀
30  ¦  0000-00-00  ¦  0000-00-00 00:00:00  ¦  0000-00-00 00:00:00
set sql_mode = @old_sql_mode;
drop table mysql_compat_temporal_zero;
drop table mysql_compat_temporal_zero_dml;
