drop database if exists mysql_compat_invalid_utf8;
create database mysql_compat_invalid_utf8;
use mysql_compat_invalid_utf8;
set @old_sql_mode = @@session.sql_mode;
set session sql_mode = 'STRICT_TRANS_TABLES';
create table t_invalid_utf8 (
id int primary key,
c char(10) character set utf8mb4,
v varchar(10) character set utf8mb4,
t text character set utf8mb4,
b binary(2),
vb varbinary(10),
bl blob
);
insert into t_invalid_utf8 (id, c) values (1, unhex('C328'));
Incorrect string value: '\xC3('
insert into t_invalid_utf8 (id, v) values (2, unhex('C328'));
Incorrect string value: '\xC3('
insert into t_invalid_utf8 (id, t) values (3, unhex('C328'));
Incorrect string value: '\xC3('
select count(*) as rejected_text_rows from t_invalid_utf8;
➤ rejected_text_rows[-5,64,0]  𝄀
0
insert into t_invalid_utf8 (id, c, v, t, b, vb, bl)
values (10, 'ok', 'ok', 'ok', unhex('C328'), unhex('C328'), unhex('C328'));
select id, hex(b) as b_hex, hex(vb) as vb_hex, hex(bl) as bl_hex
from t_invalid_utf8 where id = 10;
➤ id[4,32,0]  ¦  b_hex[12,-1,0]  ¦  vb_hex[12,-1,0]  ¦  bl_hex[12,-1,0]  𝄀
10  ¦  C328  ¦  C328  ¦  C328
insert into t_invalid_utf8 (id, c, v, t) values (11, 'old', 'old', 'old');
update t_invalid_utf8 set c = unhex('C328') where id = 11;
Incorrect string value: '\xC3('
update t_invalid_utf8 set v = unhex('C328') where id = 11;
Incorrect string value: '\xC3('
update t_invalid_utf8 set t = unhex('C328') where id = 11;
Incorrect string value: '\xC3('
select id, c, v, t from t_invalid_utf8 where id = 11;
➤ id[4,32,0]  ¦  c[1,10,0]  ¦  v[12,-1,0]  ¦  t[12,0,0]  𝄀
11  ¦  old  ¦  old  ¦  old
set session sql_mode = 'MATRIXONE_NATIVE';
insert into t_invalid_utf8 (id, c, v, t, b, vb, bl)
values (20, unhex('C328'), unhex('C328'), unhex('C328'),
unhex('C328'), unhex('C328'), unhex('C328'));
select id, hex(c) as c_hex, hex(v) as v_hex, hex(t) as t_hex,
hex(b) as b_hex, hex(vb) as vb_hex, hex(bl) as bl_hex
from t_invalid_utf8 where id = 20;
➤ id[4,32,0]  ¦  c_hex[12,-1,0]  ¦  v_hex[12,-1,0]  ¦  t_hex[12,-1,0]  ¦  b_hex[12,-1,0]  ¦  vb_hex[12,-1,0]  ¦  bl_hex[12,-1,0]  𝄀
20  ¦  C328  ¦  C328  ¦  C328  ¦  C328  ¦  C328  ¦  C328
update t_invalid_utf8
set c = unhex('C328'), v = unhex('C328'), t = unhex('C328')
where id = 11;
select id, hex(c) as c_hex, hex(v) as v_hex, hex(t) as t_hex
from t_invalid_utf8 where id = 11;
➤ id[4,32,0]  ¦  c_hex[12,-1,0]  ¦  v_hex[12,-1,0]  ¦  t_hex[12,-1,0]  𝄀
11  ¦  C328  ¦  C328  ¦  C328
set session sql_mode = 'STRICT_TRANS_TABLES';
create table t_invalid_utf8_copy (
id int primary key,
c char(10) character set utf8mb4,
v varchar(10) character set utf8mb4,
t text character set utf8mb4
);
insert into t_invalid_utf8_copy (id, c, v, t)
select id, c, v, t from t_invalid_utf8 where id = 20;
Incorrect string value: '\xC3('
select count(*) as strict_copy_rows from t_invalid_utf8_copy;
➤ strict_copy_rows[-5,64,0]  𝄀
0
insert into t_invalid_utf8_copy values (21, 'old', 'old', 'old');
update t_invalid_utf8_copy
set c = (select c from t_invalid_utf8 where id = 20),
v = (select v from t_invalid_utf8 where id = 20),
t = (select t from t_invalid_utf8 where id = 20)
where id = 21;
Incorrect string value: '\xC3('
select id, c, v, t from t_invalid_utf8_copy where id = 21;
➤ id[4,32,0]  ¦  c[1,10,0]  ¦  v[12,-1,0]  ¦  t[12,0,0]  𝄀
21  ¦  old  ¦  old  ¦  old
insert into t_invalid_utf8_copy (id, c)
select id + 100, c from t_invalid_utf8 where id = 20;
Incorrect string value: '\xC3('
insert into t_invalid_utf8_copy (id, v)
select id + 101, v from t_invalid_utf8 where id = 20;
Incorrect string value: '\xC3('
insert into t_invalid_utf8_copy (id, t)
select id + 102, t from t_invalid_utf8 where id = 20;
Incorrect string value: '\xC3('
create table t_invalid_utf8_cross (
id int primary key,
c char(10) character set utf8mb4,
v varchar(10) character set utf8mb4,
t text character set utf8mb4
);
insert into t_invalid_utf8_cross (id, v)
select id + 110, c from t_invalid_utf8 where id = 20;
Incorrect string value: '\xC3('
insert into t_invalid_utf8_cross (id, t)
select id + 111, v from t_invalid_utf8 where id = 20;
Incorrect string value: '\xC3('
insert into t_invalid_utf8_cross (id, c)
select id + 112, t from t_invalid_utf8 where id = 20;
Incorrect string value: '\xC3('
select count(*) as strict_cross_copy_rows from t_invalid_utf8_cross;
➤ strict_cross_copy_rows[-5,64,0]  𝄀
0
drop table t_invalid_utf8_cross;
set session sql_mode = '';
insert into t_invalid_utf8_copy (id, c) values (30, unhex('41C32842'));
insert into t_invalid_utf8_copy (id, v) values (31, unhex('C328'));
insert into t_invalid_utf8_copy (id, t) values (32, unhex('41C32842'));
set session sql_mode = 'STRICT_TRANS_TABLES';
insert ignore into t_invalid_utf8_copy (id, c) values (40, unhex('41C32842'));
insert ignore into t_invalid_utf8_copy (id, v) values (41, unhex('C328'));
insert ignore into t_invalid_utf8_copy (id, t) values (42, unhex('41C32842'));
insert into t_invalid_utf8_copy values
(50, 'old', 'old', 'old'),
(51, 'old', 'old', 'old'),
(52, 'old', 'old', 'old'),
(60, 'old', 'old', 'old'),
(61, 'old', 'old', 'old'),
(62, 'old', 'old', 'old');
set session sql_mode = '';
update t_invalid_utf8_copy set c = unhex('41C32842') where id = 50;
update t_invalid_utf8_copy set v = unhex('C328') where id = 51;
update t_invalid_utf8_copy set t = unhex('41C32842') where id = 52;
set session sql_mode = 'STRICT_TRANS_TABLES';
update ignore t_invalid_utf8_copy set c = unhex('41C32842') where id = 60;
update ignore t_invalid_utf8_copy set v = unhex('C328') where id = 61;
update ignore t_invalid_utf8_copy set t = unhex('41C32842') where id = 62;
select id, hex(c) as c_hex, hex(v) as v_hex, hex(t) as t_hex
from t_invalid_utf8_copy
where id in (30, 31, 32, 40, 41, 42, 50, 51, 52, 60, 61, 62)
order by id;
➤ id[4,32,0]  ¦  c_hex[12,-1,0]  ¦  v_hex[12,-1,0]  ¦  t_hex[12,-1,0]  𝄀
30  ¦  41  ¦  null  ¦  null  𝄀
31  ¦  null  ¦    ¦  null  𝄀
32  ¦  null  ¦  null  ¦  41  𝄀
40  ¦  41  ¦  null  ¦  null  𝄀
41  ¦  null  ¦    ¦  null  𝄀
42  ¦  null  ¦  null  ¦  41  𝄀
50  ¦  41  ¦  6F6C64  ¦  6F6C64  𝄀
51  ¦  6F6C64  ¦    ¦  6F6C64  𝄀
52  ¦  6F6C64  ¦  6F6C64  ¦  41  𝄀
60  ¦  41  ¦  6F6C64  ¦  6F6C64  𝄀
61  ¦  6F6C64  ¦    ¦  6F6C64  𝄀
62  ¦  6F6C64  ¦  6F6C64  ¦  41
drop table t_invalid_utf8_copy;
drop table t_invalid_utf8;
set session sql_mode = @old_sql_mode;
drop database mysql_compat_invalid_utf8;
