DROP DATABASE IF EXISTS test_set;
CREATE DATABASE test_set;
USE test_set;
CREATE TABLE t_set (
id INT PRIMARY KEY,
options SET('read', 'write', 'execute', 'delete'),
colors SET('red', 'green', 'blue')
);
INSERT INTO t_set VALUES (1, 'read,write', 'red');
INSERT INTO t_set VALUES (2, 'execute', 'green,blue');
INSERT INTO t_set VALUES (3, 'read,write,execute,delete', 'red,green,blue');
INSERT INTO t_set VALUES (4, '', 'red');
SELECT * FROM t_set ORDER BY id;
id    options    colors
1    3    1
2    4    6
3    15    7
4    0    1
UPDATE t_set SET colors = 'blue' WHERE id = 1;
SELECT id, colors FROM t_set WHERE id = 1;
id    colors
1    4
DELETE FROM t_set WHERE id = 4;
SELECT id FROM t_set ORDER BY id;
id
1
2
3
DROP DATABASE test_set;
