drop table if exists t1;
create table t1 (a timestamp(0) not null, primary key(a));
insert into t1 values ('20200101000000'), ('2022-01-02'), ('2022-01-02 00:00:01'), ('2022-01-02 00:00:01.512345');
select * from t1;
a
2020-01-01 00:00:00
2022-01-02 00:00:00
2022-01-02 00:00:01
2022-01-02 00:00:02
select * from t1 where a='2022-01-02';
a
2022-01-02 00:00:00
select * from t1 where a!='2022-01-02';
a
2020-01-01 00:00:00
2022-01-02 00:00:01
2022-01-02 00:00:02
update t1 set a=DATE_ADD(a ,INTERVAL 1 WEEK) where a>'20220102';
select * from t1;
a
2020-01-01 00:00:00
2022-01-02 00:00:00
2022-01-09 00:00:01
2022-01-09 00:00:02
drop table t1;
create table t1 ( a int not null default 1, big timestamp(4) primary key);
insert into t1 (big) values ('20220103'),('2022-01-01'),('2022-01-01 00:00:01'),('2022-01-02 00:00:00.000050');
select * from t1;
a	big
1	2022-01-03 00:00:00
1	2022-01-01 00:00:00
1	2022-01-01 00:00:01
1	2022-01-02 00:00:00.000100000
select * from t1 order by big limit 1,3;
a	big
1	2022-01-01 00:00:01
1	2022-01-02 00:00:00.000100000
1	2022-01-03 00:00:00
select * from t1 order by big limit 3 offset 1;
a	big
1	2022-01-01 00:00:01
1	2022-01-02 00:00:00.000100000
1	2022-01-03 00:00:00
select big,count(big) from t1 group by big having count(big)>1 order by 2;
big	count(big)
drop table t1;
create table t1 (id timestamp(6) not null default "2022-01-31 00:00:00.0000006", a int, primary key (a));
insert into t1(a) values(1);
select * from t1;
id	a
2022-01-31 00:00:00.000001	1
drop table if exists t1;
drop table if exists t2;
create table t1 (
dt  timestamp(6) not null,
value32  integer not null,
primary key(value32)
);
create table t2 (
dt  timestamp(3) not null,
value32  integer not null,
primary key(value32)
);
insert into t1 values('2022-01-01 00:00:00.000050', 1);
insert into t1 values('2022-01-01 00:00:00.000500', 2);
insert into t1 values('2022-01-01 00:00:00.005000', 3);
insert into t2 values('2022-01-01 00:00:00.005', 4);
insert into t2 values('2022-01-01 00:00:00.001', 5);
select * from t1;
dt	value32
2022-01-01 00:00:00.000050000	1
2022-01-01 00:00:00.000500000	2
2022-01-01 00:00:00.005000000	3
select * from t2;
dt	value32
2022-01-01 00:00:00.005000000	4
2022-01-01 00:00:00.001000000	5
select * from t1 join t2 on t1.dt=t2.dt order by 1 desc, t2.dt asc;
dt	value32	dt	value32
2022-01-01 00:00:00.005000000	3	2022-01-01 00:00:00.005000000	4
select * from t1 join t2 on t1.dt=t2.dt where t1.value32<>t2.value32;
dt	value32	dt	value32
2022-01-01 00:00:00.005000000	3	2022-01-01 00:00:00.005000000	4
drop table if exists t1;
drop table if exists t2;
CREATE TABLE t_timestamp(id timestamp(6));
INSERT INTO t_timestamp VALUES ('2020-01-01 23:59:59.999999'), ('2022-01-02 00:00:00');
SELECT id, id = 202020101 FROM t_timestamp;
id	id = 202020101
2020-01-01 23:59:59.999999000	false
2022-01-02 00:00:00	false
SELECT id, 20200101 = id FROM t_timestamp;
id	20200101 = id
2020-01-01 23:59:59.999999000	false
2022-01-02 00:00:00	false
SELECT * from t_timestamp WHERE id = 20200102;
id
SELECT * from t_timestamp WHERE id = 2.0200102e7;
id
SELECT * from t_timestamp WHERE id = '20200102';
id
SELECT * from t_timestamp WHERE id IN ('2020-01-01','2022-01-02');
id
2022-01-02 00:00:00
SELECT * from t_timestamp WHERE id IN (2.0200101e7,2.0200102e7 );
id
SELECT * from t_timestamp WHERE id BETWEEN 2.0200101e7 and 2.0200102e7;
id
2020-01-01 23:59:59.999999
SELECT * from t_timestamp WHERE id BETWEEN '2020-01-01' AND '2020-01-02';
id
2020-01-01 23:59:59.999999000
SELECT * from t_timestamp WHERE id BETWEEN '2022-01-01 00:00:00' AND '2022-01-02 00:00:00.000000';
id
2022-01-02 00:00:00
drop table if exists t1;
CREATE TABLE t1 (a timestamp(6));
INSERT INTO t1 VALUES ('2022-03-01 00:00:01.0001');
SELECT * FROM t1 WHERE coalesce(a) not BETWEEN '2022-02-28' and '2022-03-01';
a
2022-03-01 00:00:01.000100
SELECT * FROM t1 WHERE coalesce(a)!=20220301;
a
2022-03-01 00:00:01.000100
SELECT * FROM t1 WHERE coalesce(a) in ('2022-03-01','2022-03-01 00:00:00.0001');
a
drop table t1;
drop table if exists t1;
drop table if exists t2;
drop table if exists t3;
drop table if exists t21;
drop table if exists t12;
CREATE TABLE t1 (a timestamp, b int primary key);
INSERT INTO t1 VALUES ('2022-01-01 00:00:00',1),('2022-01-01 00:00:00',2);
update t1 set a='2022-01-02' where a='2022-01-01 00:00:00' limit 1;
select * from t1;
a	b
2022-01-02 00:00:00	1
2022-01-01 00:00:00	2
INSERT INTO t1 VALUES ('2022-01-01 00:00:00',3);
update t1 set a='2022-01-02' where a='2022-01-01 00:00:00';
select * from t1;
a	b
2022-01-02 00:00:00	1
2022-01-02 00:00:00	2
2022-01-02 00:00:00	3
drop table t1;
create table t1 (
a timestamp primary key,
b timestamp(4) not null default '2000-01-01 00:00:00'
);
insert into t1 (a) values ('2022-01-02'),('2022-01-04'),('2022-01-06'),('2022-01-08'),('2022-01-10 01:01:01.000'),('2022-01-12');
update t1 set a=a+101;
select a,b from t1;
a	b
2022-01-02 00:01:01	2000-01-01 00:00:00.0000
2022-01-04 00:01:01	2000-01-01 00:00:00.0000
2022-01-06 00:01:01	2000-01-01 00:00:00.0000
2022-01-08 00:01:01	2000-01-01 00:00:00.0000
2022-01-10 01:02:02	2000-01-01 00:00:00.0000
2022-01-12 00:01:01	2000-01-01 00:00:00.0000
update t1 set a='2022-01-27 12:12:12.0001' where a='2022-01-08 00:01:01';
select a,b from t1;
a	b
2022-01-02 00:01:01	2000-01-01 00:00:00.0000
2022-01-04 00:01:01	2000-01-01 00:00:00.0000
2022-01-06 00:01:01	2000-01-01 00:00:00.0000
2022-01-10 01:02:02	2000-01-01 00:00:00.0000
2022-01-12 00:01:01	2000-01-01 00:00:00.0000
2022-01-27 12:12:12	2000-01-01 00:00:00.0000
update t1 set a=a-1 where 1 > 2;
select a,b from t1;
a	b
2022-01-02 00:01:01	2000-01-01 00:00:00.0000
2022-01-04 00:01:01	2000-01-01 00:00:00.0000
2022-01-06 00:01:01	2000-01-01 00:00:00.0000
2022-01-10 01:02:02	2000-01-01 00:00:00.0000
2022-01-12 00:01:01	2000-01-01 00:00:00.0000
2022-01-27 12:12:12	2000-01-01 00:00:00.0000
update t1 set a=a-1 where 3 > 2;
select a,b from t1;
a	b
2022-01-02 00:01:00	2000-01-01 00:00:00.0000
2022-01-04 00:01:00	2000-01-01 00:00:00.0000
2022-01-06 00:01:00	2000-01-01 00:00:00.0000
2022-01-10 01:02:01	2000-01-01 00:00:00.0000
2022-01-12 00:01:00	2000-01-01 00:00:00.0000
2022-01-27 12:12:11	2000-01-01 00:00:00.0000
drop table t1;
create table t1 (a timestamp primary key, b char(32));
insert into t1 values ('20220101','apple'),('2022-01-02','apple');
select * from t1;
a	b
2022-01-01 00:00:00	apple
2022-01-02 00:00:00	apple
drop table if exists t1;
drop table if exists t2;
drop table if exists t3;
drop table if exists t11;
drop table if exists t12;
CREATE TABLE t1 (a timestamp, b int primary key);
INSERT INTO t1 VALUES ('2022-01-01 00:00:00',1),('2022-01-01 00:00:00',2);
delete from t1 where a='2022-01-01 00:00:00' limit 1;
select * from t1;
a	b
2022-01-01 00:00:00	2
INSERT INTO t1 VALUES ('2022-01-01 00:00:00',3);
delete from t1 where a='2022-01-01';
select * from t1;
a	b
drop table t1;
create table t1 (
a timestamp primary key,
b timestamp(4) not null default '2000-01-01 00:00:00');
insert into t1 (a) values ('2022-01-02'),('2022-01-04'),('2022-01-06'),('2022-01-08'),('2022-01-10 01:01:01.000'),('2022-01-12');
delete from t1 where a=20220101+3;
select a,b from t1;
a	b
2022-01-02 00:00:00	2000-01-01 00:00:00.0000
2022-01-06 00:00:00	2000-01-01 00:00:00.0000
2022-01-08 00:00:00	2000-01-01 00:00:00.0000
2022-01-10 01:01:01	2000-01-01 00:00:00.0000
2022-01-12 00:00:00	2000-01-01 00:00:00.0000
delete from t1 where  3 < 2;
select a,b from t1;
a	b
2022-01-02 00:00:00	2000-01-01 00:00:00.0000
2022-01-06 00:00:00	2000-01-01 00:00:00.0000
2022-01-08 00:00:00	2000-01-01 00:00:00.0000
2022-01-10 01:01:01	2000-01-01 00:00:00.0000
2022-01-12 00:00:00	2000-01-01 00:00:00.0000
delete from t1 where  1 < 2;
select a,b from t1;
a	b
drop table t1;
create table t1 (a timestamp primary key, b char(32));
insert into t1 values ('20220101','apple'),('2022-01-02 00:00:00','apple');
select * from t1;
a	b
2022-01-01 00:00:00	apple
2022-01-02 00:00:00	apple
set time_zone = '+8:00';
drop table if exists t1;
create table t1(t timestamp(6));
insert into t1 values('2020-01-01 23:59:59.999999'),('2021-02-03 04:05:06.070809');
select t + 1 from t1;
t + 1
1577894400.999999
1612296307.070809
select t - 1 from t1;
t - 1
1577894398.999999
1612296305.070809
select t * 10 from t1;
t * 10
15778943999.999990
16122963060.708090
select t / 10 from t1;
t / 10
157789439.999999900000
161229630.607080900000
select t % 5 from t1;
t % 5
4.999999
1.070809