drop table if exists time_01;
drop table if exists time_02;
drop table if exists time_03;
drop table if exists time_04;
create table time_01(t1 time,t2 time,t3 time);
insert into time_01 values("-838:59:59.0000","838:59:59.00","22:00:00");
insert into time_01 values("0:00:00.0000","0","0:00");
insert into time_01 values(null,NULL,null);
insert into time_01 values("23","1122","-1122");
insert into time_01 values("101412","4","-101219");
insert into time_01 values("24:59:09.932823","24:02:00.93282332424","24:20:34.00000000");
insert into time_01 values("2022-09-08 12:00:01","019","23403");
select * from time_01;
t1    t2    t3
-838:59:59    838:59:59    22:00:00
00:00:00    00:00:00    00:00:00
null    null    null
00:00:23    00:11:22    00:11:22
10:14:12    00:00:04    -10:12:19
24:59:10    24:02:01    24:20:34
12:00:01    00:00:19    02:34:03
create table time_02(t1 time);
insert into time_02 values("200:60:60");
invalid input: invalid time value 200:60:60
insert into time_02 values("2562047788:00:00");
invalid input: invalid time value 2562047788:00:00
insert into time_02 values("-2562047788:00:00");
invalid input: invalid time value -2562047788:00:00
insert into time_02 values("abc");
invalid input: invalid time value abc
insert into time_02 values("中文");
invalid input: invalid time value 中文
insert into time_02 values(200);
insert into time_02 values("");
select * from time_02;
t1
00:02:00
null
insert into time_02 values("200:50:10");
select '-838:59:59.0000' from time_01 limit 1;
-838:59:59.0000
-838:59:59.0000
select '838:59:59.0000';
838:59:59.0000
838:59:59.0000
select t1-t2,t1+t2 from time_01;
t1-t2    t1+t2
-16771918    0
0    0
null    null
-1099    1145
101408    101416
5709    486111
119982    120020
select t1+2,t1*2,t1/2,t1%2 from time_01;
t1+2    t1*2    t1/2    t1%2
-8385957    -16771918    -4192979.5000    -1
2    0    0.0000    0
null    null    null    null
25    46    11.5000    1
101414    202824    50706.0000    0
245912    491820    122955.0000    0
120003    240002    60000.5000    1
select * from time_01 where t2 is not null;
t1    t2    t3
-838:59:59    838:59:59    22:00:00
00:00:00    00:00:00    00:00:00
00:00:23    00:11:22    00:11:22
10:14:12    00:00:04    -10:12:19
24:59:10    24:02:01    24:20:34
12:00:01    00:00:19    02:34:03
select * from time_01 where t2 is null;
t1    t2    t3
null    null    null
select t1 from time_01 where t2>"23";
t1
-838:59:59
00:00:23
24:59:10
select t1 from time_01 where t1!="24:59:09.932823";
t1
-838:59:59
00:00:00
00:00:23
10:14:12
12:00:01
select * from time_01 where t1="24:59:09.932823" and t2>"24:01:00";
t1    t2    t3
24:59:10    24:02:01    24:20:34
select * from time_01 where t2 between "23" and "24:59:09.932823";
t1    t2    t3
00:00:23    00:11:22    00:11:22
24:59:10    24:02:01    24:20:34
select * from time_01 where t2 not between "23" and "24:59:09.932823";
t1    t2    t3
-838:59:59    838:59:59    22:00:00
00:00:00    00:00:00    00:00:00
10:14:12    00:00:04    -10:12:19
12:00:01    00:00:19    02:34:03
select * from time_01 where t2 in("838:59:59.00","4");
t1    t2    t3
-838:59:59    838:59:59    22:00:00
10:14:12    00:00:04    -10:12:19
select * from time_01 where t2 not in("838:59:59.00","4");
t1    t2    t3
00:00:00    00:00:00    00:00:00
00:00:23    00:11:22    00:11:22
24:59:10    24:02:01    24:20:34
12:00:01    00:00:19    02:34:03
select count(t1) from time_01;
count(t1)
6
select count(t1),t2 from time_01 group by t2 order by t2;
count(t1)    t2
0    null
1    00:00:00
1    00:00:04
1    00:00:19
1    00:11:22
1    24:02:01
1    838:59:59
select min(t1),max(t2) from time_01;
min(t1)    max(t2)
-838:59:59    838:59:59
drop table time_02;
create table time_02 (t1 int,t2 time primary key,t3 varchar(25))partition by hash(t2)partitions 4;
SQL syntax error: type TIME not allowed in partition clause
create table time_03 (t1 int,t2 time primary key,t3 varchar(25));
insert into time_03 values (30,"101412","yellow");
insert into time_03 values (40,"101412","apple");
Duplicate entry '10:14:12.000000' for key 't2'
select * from time_03;
t1    t2    t3
30    10:14:12    yellow
drop table time_03;
create table time_03 (t1 int,t2 time,t3 varchar(25),t4 time default '110034',primary key(t1,t2));
insert into time_03(t1,t2,t3) values (30,"24:59:09.932823","yellow");
insert into time_03(t1,t2,t3) values (30,"24:59:09.932823","oooppppp");
Duplicate entry '3a151e471914f1701380' for key '__mo_cpkey_col'
insert into time_03(t1,t2,t3) values (31,"24:59:09.932823","postttttt");
insert into time_03(t1,t2,t3) values (32,NULL,"vinda");
constraint violation: Column 't2' cannot be null
insert into time_03(t1,t2,t3) values (40,"37","gloooooooge");
select distinct t2 from time_03;
t2
24:59:10
00:00:37
update time_03 set t4="220:00:00" where t1=30;
select * from time_03;
t1    t2    t3    t4
31    24:59:10    postttttt    11:00:34
40    00:00:37    gloooooooge    11:00:34
30    24:59:10    yellow    220:00:00
update time_03 set t4=NULL where t1=30;
select * from time_03;
t1    t2    t3    t4
31    24:59:10    postttttt    11:00:34
40    00:00:37    gloooooooge    11:00:34
30    24:59:10    yellow    null
delete from time_03 where t2 is not null;
select * from time_03;
t1    t2    t3    t4
insert into time_03 values (40,"37","gloooooooge","35:50");
truncate table time_03;
load data infile "$resources/external_table_file/time_ex_table.csv" into table time_03;
create external table time_ex_01(t1 int,t2 time,t3 varchar(25),t4 time)  infile{"filepath"='$resources/external_table_file/time_ex_table.csv'} fields terminated by ',' enclosed by '\"';
select * from time_ex_01;
t1    t2    t3    t4
12    00:00:57    errrror    45:02:00
13    00:00:19    peer    null
14    838:59:59    zzzow    -838:59:59
15    34:00:00    errrror    -10:12:19
select * from time_01 time1 join time_03 time3 on time1.t1=time3.t2;
t1    t2    t3    t1    t2    t3    t4
select * from time_01 time1 left join time_03 time3 on time1.t1=time3.t2;
t1    t2    t3    t1    t2    t3    t4
-838:59:59    838:59:59    22:00:00    null    null    null    null
00:00:00    00:00:00    00:00:00    null    null    null    null
null    null    null    null    null    null    null
00:00:23    00:11:22    00:11:22    null    null    null    null
10:14:12    00:00:04    -10:12:19    null    null    null    null
24:59:10    24:02:01    24:20:34    null    null    null    null
12:00:01    00:00:19    02:34:03    null    null    null    null
select * from time_01 time1 right join time_03 time3 on time1.t1=time3.t2;
t1    t2    t3    t1    t2    t3    t4
null    null    null    12    00:00:57    errrror    45:02:00
null    null    null    13    00:00:19    peer    null
null    null    null    14    838:59:59    zzzow    -838:59:59
null    null    null    15    34:00:00    errrror    -10:12:19
select t1,t2 from time_01 union select t2,t4 from time_03;
t1    t2
-838:59:59    838:59:59
34:00:00    -10:12:19
null    null
24:59:10    24:02:01
00:00:19    null
00:00:00    00:00:00
10:14:12    00:00:04
838:59:59    -838:59:59
00:00:23    00:11:22
00:00:57    45:02:00
12:00:01    00:00:19
select * from (select t1,t2 from time_01 intersect select t2,t4 from time_03) as t;
t1    t2
select t1,t2 from time_01 minus select t2,t4 from time_03;
t1    t2
-838:59:59    838:59:59
null    null
24:59:10    24:02:01
00:00:00    00:00:00
10:14:12    00:00:04
00:00:23    00:11:22
12:00:01    00:00:19
select * from time_01 where t2 in (select t2 from time_03);
t1    t2    t3
-838:59:59    838:59:59    22:00:00
12:00:01    00:00:19    02:34:03
select * from time_01 where t1 > (select t2 from time_03 where t1 = '10:14:12');
invalid argument cast to int, bad value 10:14:12
select t1,t2,t3 from time_01 where t1 < any(select t2 from time_03 where t1 = '10:14:12');
invalid argument cast to int, bad value 10:14:12
select t1,t2,t3 from time_01 where t1 >= all(select t2 from time_03 where t1 = '10:14:12');
invalid argument cast to int, bad value 10:14:12
select t1,t2,t3 from time_01 where t1 >= some(select t2 from time_03 where t1 = '10:14:12');
invalid argument cast to int, bad value 10:14:12
select * from time_01 where exists(select t2 from time_03);
t1    t2    t3
-838:59:59    838:59:59    22:00:00
00:00:00    00:00:00    00:00:00
null    null    null
00:00:23    00:11:22    00:11:22
10:14:12    00:00:04    -10:12:19
24:59:10    24:02:01    24:20:34
12:00:01    00:00:19    02:34:03
select * from time_01 where not exists(select t2 from time_03);
t1    t2    t3
create view time_view_01 as select * from time_01;
select * from time_view_01;
t1    t2    t3
-838:59:59    838:59:59    22:00:00
00:00:00    00:00:00    00:00:00
null    null    null
00:00:23    00:11:22    00:11:22
10:14:12    00:00:04    -10:12:19
24:59:10    24:02:01    24:20:34
12:00:01    00:00:19    02:34:03
create table time_04 (t1 int,t2 time,t3 datetime,t4 timestamp);
insert into time_04 values (1,"344:59:09","2020-09-12","2021-09-22 10:01:23.903");
select * from time_04;
t1    t2    t3    t4
1    344:59:09    2020-09-12 00:00:00    2021-09-22 10:01:24
select timediff(t2,t3) from time_04;
invalid input: timediff function have invalid input args type
select timediff(t1,t2) from time_01;
timediff(t1, t2)
-1677:59:58
00:00:00
null
00:10:59
10:14:08
00:57:09
11:59:42
select timediff(t1,NULL),timediff(NULL,t2)from time_01;
timediff(t1, null)    timediff(null, t2)
null    null
null    null
null    null
null    null
null    null
null    null
null    null
select timediff('20',NULL) , timediff('20','24:59:09.8453');
timediff(20, null)    timediff(20, 24:59:09.8453)
null    -24:58:49.845300000
select timediff('12:00','24:59:09.8453'),timediff('-838:59:59.0000','-1122');
timediff(12:00, 24:59:09.8453)    timediff(-838:59:59.0000, -1122)
-12:59:09.845300000    -838:48:37
select * from (select timediff(t1,t2) from time_01) as t;
timediff(t1, t2)
-1677:59:58
00:00:00
null
00:10:59
10:14:08
00:57:09
11:59:42
select cast('02 10:11:12' as time);
cast(02 10:11:12 as time(26))
58:11:12
select cast('255 10:11:12' as time);
cast(255 10:11:12 as time(26))
6130:11:12