drop table if exists time_01;
drop table if exists time_02;
drop table if exists time_03;
drop table if exists time_04;
create table time_01(t1 time,t2 time,t3 time);
insert into time_01 values("-838:59:59.0000","838:59:59.00","22:00:00");
insert into time_01 values("0:00:00.0000","0","0:00");
insert into time_01 values(null,NULL,null);
insert into time_01 values("23","1122","-1122");
insert into time_01 values("101412","4","-101219");
insert into time_01 values("24:59:09.932823","24:02:00.93282332424","24:20:34.00000000");
insert into time_01 values("2022-09-08 12:00:01","019","23403");
select * from time_01;
➤ t1[92,64,0]  ¦  t2[92,64,0]  ¦  t3[92,64,0]  𝄀
-838:59:59  ¦  838:59:59  ¦  22:00:00  𝄀
00:00:00  ¦  00:00:00  ¦  00:00:00  𝄀
null  ¦  null  ¦  null  𝄀
00:00:23  ¦  00:11:22  ¦  00:11:22  𝄀
10:14:12  ¦  00:00:04  ¦  -10:12:19  𝄀
24:59:10  ¦  24:02:01  ¦  24:20:34  𝄀
12:00:01  ¦  00:00:19  ¦  02:34:03
create table time_02(t1 time);
insert into time_02 values("200:60:60");
invalid input: invalid time value 200:60:60
insert into time_02 values("2562047788:00:00");
invalid input: invalid time value 2562047788:00:00
insert into time_02 values("-2562047788:00:00");
invalid input: invalid time value -2562047788:00:00
insert into time_02 values("abc");
invalid input: invalid time value abc
insert into time_02 values("中文");
invalid input: invalid time value 中文
insert into time_02 values(200);
insert into time_02 values("");
select * from time_02;
➤ t1[92,64,0]  𝄀
00:02:00  𝄀
null
insert into time_02 values("200:50:10");
select '-838:59:59.0000' from time_01 limit 1;
➤ -838:59:59.0000[12,-1,0]  𝄀
-838:59:59.0000
select '838:59:59.0000';
➤ 838:59:59.0000[12,-1,0]  𝄀
838:59:59.0000
select t1-t2,t1+t2 from time_01;
[unknown result because it is related to issue#6168]
select t1+2,t1*2,t1/2,t1%2 from time_01;
[unknown result because it is related to issue#6168]
select * from time_01 where t2 is not null;
➤ t1[92,64,0]  ¦  t2[92,64,0]  ¦  t3[92,64,0]  𝄀
-838:59:59  ¦  838:59:59  ¦  22:00:00  𝄀
00:00:00  ¦  00:00:00  ¦  00:00:00  𝄀
00:00:23  ¦  00:11:22  ¦  00:11:22  𝄀
10:14:12  ¦  00:00:04  ¦  -10:12:19  𝄀
24:59:10  ¦  24:02:01  ¦  24:20:34  𝄀
12:00:01  ¦  00:00:19  ¦  02:34:03
select * from time_01 where t2 is null;
➤ t1[92,64,0]  ¦  t2[92,64,0]  ¦  t3[92,64,0]  𝄀
null  ¦  null  ¦  null
select t1 from time_01 where t2>"23";
➤ t1[92,64,0]  𝄀
-838:59:59  𝄀
00:00:23  𝄀
24:59:10
select t1 from time_01 where t1!="24:59:09.932823";
➤ t1[92,64,0]  𝄀
-838:59:59  𝄀
00:00:00  𝄀
00:00:23  𝄀
10:14:12  𝄀
12:00:01
select * from time_01 where t1="24:59:09.932823" and t2>"24:01:00";
➤ t1[92,64,0]  ¦  t2[92,64,0]  ¦  t3[92,64,0]  𝄀
24:59:10  ¦  24:02:01  ¦  24:20:34
select * from time_01 where t2 between "23" and "24:59:09.932823";
➤ t1[92,64,0]  ¦  t2[92,64,0]  ¦  t3[92,64,0]  𝄀
00:00:23  ¦  00:11:22  ¦  00:11:22  𝄀
24:59:10  ¦  24:02:01  ¦  24:20:34
select * from time_01 where t2 not between "23" and "24:59:09.932823";
➤ t1[92,64,0]  ¦  t2[92,64,0]  ¦  t3[92,64,0]  𝄀
-838:59:59  ¦  838:59:59  ¦  22:00:00  𝄀
00:00:00  ¦  00:00:00  ¦  00:00:00  𝄀
10:14:12  ¦  00:00:04  ¦  -10:12:19  𝄀
12:00:01  ¦  00:00:19  ¦  02:34:03
select * from time_01 where t2 in("838:59:59.00","4");
➤ t1[92,64,0]  ¦  t2[92,64,0]  ¦  t3[92,64,0]  𝄀
-838:59:59  ¦  838:59:59  ¦  22:00:00  𝄀
10:14:12  ¦  00:00:04  ¦  -10:12:19
select * from time_01 where t2 not in("838:59:59.00","4");
➤ t1[92,64,0]  ¦  t2[92,64,0]  ¦  t3[92,64,0]  𝄀
00:00:00  ¦  00:00:00  ¦  00:00:00  𝄀
00:00:23  ¦  00:11:22  ¦  00:11:22  𝄀
24:59:10  ¦  24:02:01  ¦  24:20:34  𝄀
12:00:01  ¦  00:00:19  ¦  02:34:03
select count(t1) from time_01;
➤ count(t1)[-5,64,0]  𝄀
6
select count(t1),t2 from time_01 group by t2 order by t2;
➤ count(t1)[-5,64,0]  ¦  t2[92,64,0]  𝄀
0  ¦  null  𝄀
1  ¦  00:00:00  𝄀
1  ¦  00:00:04  𝄀
1  ¦  00:00:19  𝄀
1  ¦  00:11:22  𝄀
1  ¦  24:02:01  𝄀
1  ¦  838:59:59
select min(t1),max(t2) from time_01;
➤ min(t1)[92,64,0]  ¦  max(t2)[92,64,0]  𝄀
-838:59:59  ¦  838:59:59
drop table time_02;
create table time_02 (t1 int,t2 time primary key,t3 varchar(25))partition by hash(t2)partitions 4;
create table time_03 (t1 int,t2 time primary key,t3 varchar(25));
insert into time_03 values (30,"101412","yellow");
insert into time_03 values (40,"101412","apple");
Duplicate entry ('\d{2}\:\d{2}:\d{2}'|'\d{2}\:\d{2}:\d{2}\.\d{6}') for key 't2'
select * from time_03;
➤ t1[4,32,0]  ¦  t2[92,64,0]  ¦  t3[12,-1,0]  𝄀
30  ¦  10:14:12  ¦  yellow
drop table time_03;
create table time_03 (t1 int,t2 time,t3 varchar(25),t4 time default '110034',primary key(t1,t2));
insert into time_03(t1,t2,t3) values (30,"24:59:09.932823","yellow");
insert into time_03(t1,t2,t3) values (30,"24:59:09.932823","oooppppp");
Duplicate entry ('\(\d{2}\,\d{2}\:\d{2}:\d{2}\)'|'\w{20}') for key '(.*)'
insert into time_03(t1,t2,t3) values (31,"24:59:09.932823","postttttt");
insert into time_03(t1,t2,t3) values (32,NULL,"vinda");
constraint violation: Column 't2' cannot be null
insert into time_03(t1,t2,t3) values (40,"37","gloooooooge");
select distinct t2 from time_03;
➤ t2[92,64,0]  𝄀
24:59:10  𝄀
00:00:37
update time_03 set t4="220:00:00" where t1=30;
select * from time_03;
➤ t1[4,32,0]  ¦  t2[92,64,0]  ¦  t3[12,-1,0]  ¦  t4[92,64,0]  𝄀
31  ¦  24:59:10  ¦  postttttt  ¦  11:00:34  𝄀
40  ¦  00:00:37  ¦  gloooooooge  ¦  11:00:34  𝄀
30  ¦  24:59:10  ¦  yellow  ¦  220:00:00
update time_03 set t4=NULL where t1=30;
select * from time_03;
➤ t1[4,32,0]  ¦  t2[92,64,0]  ¦  t3[12,-1,0]  ¦  t4[92,64,0]  𝄀
31  ¦  24:59:10  ¦  postttttt  ¦  11:00:34  𝄀
40  ¦  00:00:37  ¦  gloooooooge  ¦  11:00:34  𝄀
30  ¦  24:59:10  ¦  yellow  ¦  null
delete from time_03 where t2 is not null;
select * from time_03;
➤ t1[4,32,0]  ¦  t2[92,64,0]  ¦  t3[12,-1,0]  ¦  t4[92,64,0]
insert into time_03 values (40,"37","gloooooooge","35:50");
truncate table time_03;
load data infile "$resources/external_table_file/time_ex_table.csv" into table time_03 fields terminated by ',';
create external table time_ex_01(t1 int,t2 time,t3 varchar(25),t4 time)  infile{"filepath"='$resources/external_table_file/time_ex_table.csv'} fields terminated by ',' enclosed by '\"';
select * from time_ex_01;
➤ t1[4,32,0]  ¦  t2[92,64,0]  ¦  t3[12,-1,0]  ¦  t4[92,64,0]  𝄀
12  ¦  00:00:57  ¦  errrror  ¦  45:02:00  𝄀
13  ¦  00:00:19  ¦  peer  ¦  null  𝄀
14  ¦  838:59:59  ¦  zzzow  ¦  -838:59:59  𝄀
15  ¦  34:00:00  ¦  errrror  ¦  -10:12:19
select * from time_01 time1 join time_03 time3 on time1.t1=time3.t2;
➤ t1[92,64,0]  ¦  t2[92,64,0]  ¦  t3[92,64,0]  ¦  t1[4,32,0]  ¦  t2[92,64,0]  ¦  t3[12,-1,0]  ¦  t4[92,64,0]
select * from time_01 time1 left join time_03 time3 on time1.t1=time3.t2;
➤ t1[92,64,0]  ¦  t2[92,64,0]  ¦  t3[92,64,0]  ¦  t1[4,32,0]  ¦  t2[92,64,0]  ¦  t3[12,-1,0]  ¦  t4[92,64,0]  𝄀
-838:59:59  ¦  838:59:59  ¦  22:00:00  ¦  null  ¦  null  ¦  null  ¦  null  𝄀
00:00:00  ¦  00:00:00  ¦  00:00:00  ¦  null  ¦  null  ¦  null  ¦  null  𝄀
null  ¦  null  ¦  null  ¦  null  ¦  null  ¦  null  ¦  null  𝄀
00:00:23  ¦  00:11:22  ¦  00:11:22  ¦  null  ¦  null  ¦  null  ¦  null  𝄀
10:14:12  ¦  00:00:04  ¦  -10:12:19  ¦  null  ¦  null  ¦  null  ¦  null  𝄀
24:59:10  ¦  24:02:01  ¦  24:20:34  ¦  null  ¦  null  ¦  null  ¦  null  𝄀
12:00:01  ¦  00:00:19  ¦  02:34:03  ¦  null  ¦  null  ¦  null  ¦  null
select * from time_01 time1 right join time_03 time3 on time1.t1=time3.t2;
➤ t1[92,64,0]  ¦  t2[92,64,0]  ¦  t3[92,64,0]  ¦  t1[4,32,0]  ¦  t2[92,64,0]  ¦  t3[12,-1,0]  ¦  t4[92,64,0]  𝄀
null  ¦  null  ¦  null  ¦  12  ¦  00:00:57  ¦  errrror  ¦  45:02:00  𝄀
null  ¦  null  ¦  null  ¦  13  ¦  00:00:19  ¦  peer  ¦  null  𝄀
null  ¦  null  ¦  null  ¦  14  ¦  838:59:59  ¦  zzzow  ¦  -838:59:59  𝄀
null  ¦  null  ¦  null  ¦  15  ¦  34:00:00  ¦  errrror  ¦  -10:12:19
select t1,t2 from time_01 union select t2,t4 from time_03;
➤ t1[92,64,0]  ¦  t2[92,64,0]  𝄀
00:00:57  ¦  45:02:00  𝄀
00:00:19  ¦  null  𝄀
838:59:59  ¦  -838:59:59  𝄀
34:00:00  ¦  -10:12:19  𝄀
-838:59:59  ¦  838:59:59  𝄀
00:00:00  ¦  00:00:00  𝄀
null  ¦  null  𝄀
00:00:23  ¦  00:11:22  𝄀
10:14:12  ¦  00:00:04  𝄀
24:59:10  ¦  24:02:01  𝄀
12:00:01  ¦  00:00:19
select * from (select t1,t2 from time_01 intersect select t2,t4 from time_03) as t;
➤ t1[92,64,0]  ¦  t2[92,64,0]
select t1,t2 from time_01 minus select t2,t4 from time_03;
➤ t1[92,64,0]  ¦  t2[92,64,0]  𝄀
-838:59:59  ¦  838:59:59  𝄀
00:00:00  ¦  00:00:00  𝄀
null  ¦  null  𝄀
00:00:23  ¦  00:11:22  𝄀
10:14:12  ¦  00:00:04  𝄀
24:59:10  ¦  24:02:01  𝄀
12:00:01  ¦  00:00:19
select * from time_01 where t2 in (select t2 from time_03);
➤ t1[92,64,0]  ¦  t2[92,64,0]  ¦  t3[92,64,0]  𝄀
-838:59:59  ¦  838:59:59  ¦  22:00:00  𝄀
12:00:01  ¦  00:00:19  ¦  02:34:03
select * from time_01 where t1 > (select t2 from time_03 where t1 = '10:14:12');
invalid argument cast to int, bad value 10:14:12
select t1,t2,t3 from time_01 where t1 < any(select t2 from time_03 where t1 = '10:14:12');
invalid argument cast to int, bad value 10:14:12
select t1,t2,t3 from time_01 where t1 >= all(select t2 from time_03 where t1 = '10:14:12');
invalid argument cast to int, bad value 10:14:12
select t1,t2,t3 from time_01 where t1 >= some(select t2 from time_03 where t1 = '10:14:12');
invalid argument cast to int, bad value 10:14:12
select * from time_01 where exists(select t2 from time_03);
➤ t1[92,64,0]  ¦  t2[92,64,0]  ¦  t3[92,64,0]  𝄀
-838:59:59  ¦  838:59:59  ¦  22:00:00  𝄀
00:00:00  ¦  00:00:00  ¦  00:00:00  𝄀
null  ¦  null  ¦  null  𝄀
00:00:23  ¦  00:11:22  ¦  00:11:22  𝄀
10:14:12  ¦  00:00:04  ¦  -10:12:19  𝄀
24:59:10  ¦  24:02:01  ¦  24:20:34  𝄀
12:00:01  ¦  00:00:19  ¦  02:34:03
select * from time_01 where not exists(select t2 from time_03);
➤ t1[92,64,0]  ¦  t2[92,64,0]  ¦  t3[92,64,0]
create view time_view_01 as select * from time_01;
select * from time_view_01;
➤ t1[92,64,0]  ¦  t2[92,64,0]  ¦  t3[92,64,0]  𝄀
-838:59:59  ¦  838:59:59  ¦  22:00:00  𝄀
00:00:00  ¦  00:00:00  ¦  00:00:00  𝄀
null  ¦  null  ¦  null  𝄀
00:00:23  ¦  00:11:22  ¦  00:11:22  𝄀
10:14:12  ¦  00:00:04  ¦  -10:12:19  𝄀
24:59:10  ¦  24:02:01  ¦  24:20:34  𝄀
12:00:01  ¦  00:00:19  ¦  02:34:03
create table time_04 (t1 int,t2 time,t3 datetime,t4 timestamp);
insert into time_04 values (1,"344:59:09","2020-09-12","2021-09-22 10:01:23.903");
select * from time_04;
➤ t1[4,32,0]  ¦  t2[92,64,0]  ¦  t3[93,64,0]  ¦  t4[93,64,0]  𝄀
1  ¦  344:59:09  ¦  2020-09-12 00:00:00  ¦  2021-09-22 10:01:24
select timediff(t2,t3) from time_04;
invalid input: timediff function have invalid input args type
select timediff(t1,t2) from time_01;
➤ timediff(t1, t2)[92,64,0]  𝄀
-1677:59:58  𝄀
00:00:00  𝄀
null  𝄀
00:10:59  𝄀
10:14:08  𝄀
00:57:09  𝄀
11:59:42
select timediff(t1,NULL),timediff(NULL,t2)from time_01;
➤ timediff(t1, null)[92,64,0]  ¦  timediff(null, t2)[92,64,0]  𝄀
null  ¦  null  𝄀
null  ¦  null  𝄀
null  ¦  null  𝄀
null  ¦  null  𝄀
null  ¦  null  𝄀
null  ¦  null  𝄀
null  ¦  null
select timediff('20',NULL) , timediff('20','24:59:09.8453');
➤ timediff(20, null)[92,64,0]  ¦  timediff(20, 24:59:09.8453)[92,64,0]  𝄀
null  ¦  -24:58:49.845300000
select timediff('12:00','24:59:09.8453'),timediff('-838:59:59.0000','-1122');
➤ timediff(12:00, 24:59:09.8453)[92,64,0]  ¦  timediff(-838:59:59.0000, -1122)[92,64,0]  𝄀
-12:59:09.845300000  ¦  -838:48:37
select * from (select timediff(t1,t2) from time_01) as t;
➤ timediff(t1, t2)[92,64,0]  𝄀
-1677:59:58  𝄀
00:00:00  𝄀
null  𝄀
00:10:59  𝄀
10:14:08  𝄀
00:57:09  𝄀
11:59:42
select cast('02 10:11:12' as time);
➤ cast(02 10:11:12 as time)[92,64,0]  𝄀
58:11:12
select cast('255 10:11:12' as time);
➤ cast(255 10:11:12 as time)[92,64,0]  𝄀
6130:11:12
create database if not exists test;
use test;
drop table if exists mysql_ts_test;
create table if not exists mysql_ts_test (id int, col_date date, col_time time, col timestamp);
select * from mysql_ts_test;
➤ id[4,32,0]  ¦  col_date[91,64,0]  ¦  col_time[92,64,0]  ¦  col[93,64,0]
insert into mysql_ts_test values (1, '2024-03-13', '11:30:00', '2024-03-13 11:30:00');
insert into mysql_ts_test values (2, DATE '2024-03-14', TIME '2024', TIMESTAMP '2024-03-14 11:30:00');
insert into mysql_ts_test values (3, {d '2024-03-15'}, {t '11:30:30'}, {ts '2024-03-15 11:30:00'});
select * from mysql_ts_test;
➤ id[4,32,0]  ¦  col_date[91,64,0]  ¦  col_time[92,64,0]  ¦  col[93,64,0]  𝄀
1  ¦  2024-03-13  ¦  11:30:00  ¦  2024-03-13 11:30:00  𝄀
2  ¦  2024-03-14  ¦  00:20:24  ¦  2024-03-14 11:30:00  𝄀
3  ¦  2024-03-15  ¦  11:30:30  ¦  2024-03-15 11:30:00
insert into mysql_ts_test values (4, {d '2024-03-16'}, {t '23:59:59'}, {ts now()});
insert into mysql_ts_test values (4, {d '2024-03-16'}, {t '23:59:59'}, {ts current_timestamp});
select * from mysql_ts_test;
➤ id[4,32,0]  ¦  col_date[91,64,0]  ¦  col_time[92,64,0]  ¦  col[93,64,0]  𝄀
1  ¦  2024-03-13  ¦  11:30:00  ¦  2024-03-13 11:30:00  𝄀
2  ¦  2024-03-14  ¦  00:20:24  ¦  2024-03-14 11:30:00  𝄀
3  ¦  2024-03-15  ¦  11:30:30  ¦  2024-03-15 11:30:00  𝄀
4  ¦  2024-03-16  ¦  23:59:59  ¦  2026-07-20 18:38:15  𝄀
4  ¦  2024-03-16  ¦  23:59:59  ¦  2026-07-20 18:38:15
drop table mysql_ts_test;
drop table if exists stockpriceus2_5min_copy1;
create table stockpriceus2_5min_copy1 (
id int auto_increment primary key,
time_1 datetime,
price decimal(10, 2));
insert into stockpriceus2_5min_copy1 (time_1, price) values
('2023-06-25 14:00:00', 150.50),
('2023-06-25 14:05:00', 151.00),
('2022-06-25 14:10:00', 149.75),
('2021-06-25 14:15:00', 148.25),
('2020-06-25 14:20:00', 147.00);
select * from stockpriceus2_5min_copy1;
➤ id[4,32,0]  ¦  time_1[93,64,0]  ¦  price[3,10,2]  𝄀
1  ¦  2023-06-25 14:00:00  ¦  150.50  𝄀
2  ¦  2023-06-25 14:05:00  ¦  151.00  𝄀
3  ¦  2022-06-25 14:10:00  ¦  149.75  𝄀
4  ¦  2021-06-25 14:15:00  ¦  148.25  𝄀
5  ¦  2020-06-25 14:20:00  ¦  147.00
select year(`time_1`) as yr_time_1_ok
from stockpriceus2_5min_copy1
group by year(`time_1`);
➤ yr_time_1_ok[-5,64,0]  𝄀
2023  𝄀
2022  𝄀
2021  𝄀
2020
select year(`time_1`) as yr_time_1_ok
from stockpriceus2_5min_copy1
group by 1;
➤ yr_time_1_ok[-5,64,0]  𝄀
2023  𝄀
2022  𝄀
2021  𝄀
2020
drop table stockpriceus2_5min_copy1;
drop database test;
