DROP DATABASE IF EXISTS test_year;
CREATE DATABASE test_year;
USE test_year;
CREATE TABLE t_year (
id INT PRIMARY KEY,
birth_year YEAR,
grad_year YEAR
);
INSERT INTO t_year VALUES (1, 2024, 2023);
INSERT INTO t_year VALUES (2, 99, 1999);
INSERT INTO t_year VALUES (3, 1901, 2155);
SELECT * FROM t_year ORDER BY id;
id    birth_year    grad_year
1    2024-01-01    2023-01-01
2    1999-01-01    1999-01-01
3    1901-01-01    2155-01-01
SELECT id, CAST(birth_year AS UNSIGNED) AS by_num, CAST(grad_year AS UNSIGNED) AS gy_num
FROM t_year ORDER BY id;
id    by_num    gy_num
1    2024    2023
2    1999    1999
3    1901    2155
SELECT id, CAST(birth_year AS UNSIGNED) AS by_num
FROM t_year ORDER BY birth_year DESC;
id    by_num
1    2024
2    1999
3    1901
UPDATE t_year SET grad_year = 2026 WHERE id = 1;
SELECT id, CAST(grad_year AS UNSIGNED) AS gy_num FROM t_year WHERE id = 1;
id    gy_num
1    2026
DELETE FROM t_year WHERE id = 3;
SELECT id FROM t_year ORDER BY id;
id
1
2
DROP DATABASE test_year;
