drop database if exists temp_operations;
create database temp_operations;
use temp_operations;
drop table if exists t1;
create temporary table t1(
col1 tinyint,
col2 smallint,
col3 int,
col4 bigint,
col5 tinyint unsigned,
col6 smallint unsigned,
col7 int unsigned,
col8 bigint unsigned
);
load data infile '$resources/load_data/integer_numbers_1.csv' into table t1 fields terminated by ',';
select * from t1;
➤ col1[-6,8,0]  ¦  col2[5,16,0]  ¦  col3[4,32,0]  ¦  col4[-5,64,0]  ¦  col5[-6,8,0]  ¦  col6[5,16,0]  ¦  col7[4,32,0]  ¦  col8[-5,64,0]  𝄀
127  ¦  32767  ¦  2147483647  ¦  9223372036854775807  ¦  255  ¦  65535  ¦  4294967295  ¦  18446744073709551615  𝄀
-128  ¦  -32768  ¦  -2147483648  ¦  -9223372036854775808  ¦  0  ¦  0  ¦  0  ¦  0  𝄀
0  ¦  0  ¦  0  ¦  0  ¦  0  ¦  0  ¦  0  ¦  0  𝄀
null  ¦  null  ¦  null  ¦  null  ¦  null  ¦  null  ¦  null  ¦  null  𝄀
1  ¦  null  ¦  null  ¦  0  ¦  0  ¦  0  ¦  null  ¦  null  𝄀
null  ¦  null  ¦  null  ¦  null  ¦  null  ¦  null  ¦  null  ¦  null  𝄀
127  ¦  32767  ¦  2147483647  ¦  9223372036854775807  ¦  255  ¦  65535  ¦  4294967295  ¦  18446744073709551615
delete from t1;
create temporary table t1(
col1 tinyint,
col2 smallint,
col3 int,
col4 bigint,
col5 tinyint unsigned,
col6 smallint unsigned,
col7 int unsigned,
col8 bigint unsigned
);
table t1 already exists
load data infile '$resources/load_data/integer_numbers_1.csv' into table t1 fields terminated by ',';
select * from t1;
➤ col1[-6,8,0]  ¦  col2[5,16,0]  ¦  col3[4,32,0]  ¦  col4[-5,64,0]  ¦  col5[-6,8,0]  ¦  col6[5,16,0]  ¦  col7[4,32,0]  ¦  col8[-5,64,0]  𝄀
127  ¦  32767  ¦  2147483647  ¦  9223372036854775807  ¦  255  ¦  65535  ¦  4294967295  ¦  18446744073709551615  𝄀
-128  ¦  -32768  ¦  -2147483648  ¦  -9223372036854775808  ¦  0  ¦  0  ¦  0  ¦  0  𝄀
0  ¦  0  ¦  0  ¦  0  ¦  0  ¦  0  ¦  0  ¦  0  𝄀
null  ¦  null  ¦  null  ¦  null  ¦  null  ¦  null  ¦  null  ¦  null  𝄀
1  ¦  null  ¦  null  ¦  0  ¦  0  ¦  0  ¦  null  ¦  null  𝄀
null  ¦  null  ¦  null  ¦  null  ¦  null  ¦  null  ¦  null  ¦  null  𝄀
127  ¦  32767  ¦  2147483647  ¦  9223372036854775807  ¦  255  ¦  65535  ¦  4294967295  ¦  18446744073709551615
drop table t1;
drop table if exists t1;
create temporary table t1(a bigint, b vecf32(3), c varchar(10), d double);
insert into t1 values(1, "[-1,-1,-1]", "aaaa", 1.213);
insert into t1 values(2, "[-1, -1, 0]", "bbbb", 11.213);
insert into t1 values(3, "[1,1,1]", "cccc", 111.213);
select count(*) from t1;
➤ count(*)[-5,64,0]  𝄀
3
select * from t1 into outfile '$resources/into_outfile/load_data/temp1.csv';
truncate table t1;
load data infile '$resources/into_outfile/load_data/temp1.csv' into table t1 ignore 1 lines;
select count(*) from t1;
➤ count(*)[-5,64,0]  𝄀
3
select * from t1;
➤ a[-5,64,0]  ¦  b[12,3,0]  ¦  c[12,10,0]  ¦  d[8,53,31]  𝄀
1  ¦  [-1, -1, -1]  ¦  aaaa  ¦  1.213  𝄀
2  ¦  [-1, -1, 0]  ¦  bbbb  ¦  11.213  𝄀
3  ¦  [1, 1, 1]  ¦  cccc  ¦  111.213
drop table t1;
create temporary table temp_export (
id int,
name varchar(50),
salary decimal(10,2)
);
insert into temp_export values (1, 'alice', 60000.00);
insert into temp_export values (2, 'bob', 55000.00);
insert into temp_export values (3, 'charlie', 70000.00);
select * from temp_export
into outfile '$resources/into_outfile/load_data/temp2.csv'
fields terminated by ','
lines terminated by '\n';
drop table temp_export;
create temporary table temp_sales (
sale_id int,
product varchar(50),
amount decimal(10,2),
sale_date date
);
insert into temp_sales values (1, 'laptop', 999.99, '2024-01-15');
insert into temp_sales values (2, 'mouse', 29.99, '2024-01-16');
insert into temp_sales values (3, 'keyboard', 79.99, '2024-01-17');
insert into temp_sales values (4, 'monitor', 299.99, '2024-01-18');
select
product,
sum(amount) as total_sales,
count(*) as sale_count
from temp_sales
group by product
into outfile '$resources/into_outfile/load_data/sales_summary.csv'
fields terminated by ','
lines terminated by '\n';
drop table temp_sales;
create temporary table temp_sales (
product varchar(50),
amount decimal(10,2),
sale_date decimal
);
load data infile '$resources/into_outfile/load_data/sales_summary.csv' into table temp_sales ignore 1 lines;
select * from temp_sales;
➤ product[12,-1,0]  ¦  amount[3,10,2]  ¦  sale_date[3,39,0]  𝄀
laptop  ¦  999.99  ¦  1  𝄀
mouse  ¦  29.99  ¦  1  𝄀
keyboard  ¦  79.99  ¦  1  𝄀
monitor  ¦  299.99  ¦  1
drop table temp_sales;
create temporary table temp_export_format (
id int,
description varchar(100),
price decimal(10,2)
);
insert into temp_export_format values (1, 'product with, comma', 99.99);
insert into temp_export_format values (2, 'product with "quotes"', 149.99);
select * from temp_export_format
into outfile '$resources/into_outfile/load_data/export_formatted.csv'
fields terminated by ','
enclosed by '"'
lines terminated by '\n';
drop table temp_export_format;
create temporary table temp_bulk_insert (
id int,
value varchar(50),
created_at timestamp default current_timestamp
);
insert into temp_bulk_insert (id, value) values
(1, 'value1'),
(2, 'value2'),
(3, 'value3'),
(4, 'value4'),
(5, 'value5'),
(6, 'value6'),
(7, 'value7'),
(8, 'value8'),
(9, 'value9'),
(10, 'value10');
select count(*) from temp_bulk_insert;
➤ count(*)[-5,64,0]  𝄀
10
drop table temp_bulk_insert;
create temporary table temp_bulk_update (
id int,
status varchar(20),
updated_at timestamp
);
insert into temp_bulk_update (id, status) values
(1, 'pending'),
(2, 'pending'),
(3, 'active'),
(4, 'pending'),
(5, 'active');
update temp_bulk_update
set status = 'completed', updated_at = current_timestamp
where status = 'pending';
select * from temp_bulk_update;
➤ id[4,32,0]  ¦  status[12,-1,0]  ¦  updated_at[93,64,0]  𝄀
3  ¦  active  ¦  null  𝄀
5  ¦  active  ¦  null  𝄀
1  ¦  completed  ¦  2026-02-06 15:36:59  𝄀
2  ¦  completed  ¦  2026-02-06 15:36:59  𝄀
4  ¦  completed  ¦  2026-02-06 15:36:59
drop table temp_bulk_update;
create temporary table temp_bulk_delete (
id int,
category varchar(50),
value decimal(10,2)
);
insert into temp_bulk_delete values
(1, 'a', 100.00),
(2, 'b', 200.00),
(3, 'a', 150.00),
(4, 'c', 300.00),
(5, 'b', 250.00);
delete from temp_bulk_delete where category in ('a', 'b');
select * from temp_bulk_delete;
➤ id[4,32,0]  ¦  category[12,-1,0]  ¦  value[3,10,2]  𝄀
4  ¦  c  ¦  300.00
drop table temp_bulk_delete;
create table raw_customer_data (
id int,
full_name varchar(100),
email varchar(100),
phone varchar(20)
);
insert into raw_customer_data values
(1, 'john doe', 'john@example.com', '123-456-7890'),
(2, 'jane smith', 'jane@example.com', '098-765-4321'),
(3, 'bob johnson', 'bob@example.com', '555-123-4567');
create temporary table temp_cleaned_customers as
select
id,
substring_index(full_name, ' ', 1) as first_name,
substring_index(full_name, ' ', -1) as last_name,
lower(email) as email,
replace(phone, '-', '') as phone_clean
from raw_customer_data;
select * from temp_cleaned_customers;
➤ id[4,32,0]  ¦  first_name[12,-1,0]  ¦  last_name[12,-1,0]  ¦  email[12,-1,0]  ¦  phone_clean[12,-1,0]  𝄀
1  ¦  john  ¦  doe  ¦  john@example.com  ¦  1234567890  𝄀
2  ¦  jane  ¦  smith  ¦  jane@example.com  ¦  0987654321  𝄀
3  ¦  bob  ¦  johnson  ¦  bob@example.com  ¦  5551234567
drop table temp_cleaned_customers;
drop table raw_customer_data;
create table transaction_log (
trans_id int,
customer_id int,
product_id int,
amount decimal(10,2),
trans_date date
);
insert into transaction_log values
(1, 1, 101, 99.99, '2024-01-15'),
(2, 1, 102, 149.99, '2024-01-16'),
(3, 2, 101, 99.99, '2024-01-17'),
(4, 2, 103, 199.99, '2024-01-18'),
(5, 1, 101, 99.99, '2024-01-19');
create temporary table temp_customer_summary as
select
customer_id,
count(*) as total_transactions,
sum(amount) as total_spent,
avg(amount) as avg_transaction,
min(trans_date) as first_purchase,
max(trans_date) as last_purchase
from transaction_log
group by customer_id;
select * from temp_customer_summary;
➤ customer_id[4,32,0]  ¦  total_transactions[-5,64,0]  ¦  total_spent[3,38,2]  ¦  avg_transaction[3,38,8]  ¦  first_purchase[91,64,0]  ¦  last_purchase[91,64,0]  𝄀
1  ¦  3  ¦  349.97  ¦  116.65666667  ¦  2024-01-15  ¦  2024-01-19  𝄀
2  ¦  2  ¦  299.98  ¦  149.99000000  ¦  2024-01-17  ¦  2024-01-18
drop table temp_customer_summary;
drop table transaction_log;
create table source_orders (
order_id int,
customer_name varchar(50),
product_name varchar(50),
quantity int,
unit_price decimal(10,2),
order_date date
);
insert into source_orders values
(1, 'alice', 'laptop', 2, 999.99, '2024-01-15'),
(2, 'bob', 'mouse', 5, 29.99, '2024-01-16'),
(3, 'alice', 'keyboard', 3, 79.99, '2024-01-17');
create temporary table temp_transformed_orders as
select
order_id,
customer_name,
product_name,
quantity,
unit_price,
(quantity * unit_price) as total_amount,
order_date,
case
when (quantity * unit_price) > 500 then 'high value'
when (quantity * unit_price) > 100 then 'medium value'
else 'low value'
end as order_category
from source_orders;
select * from temp_transformed_orders;
➤ order_id[4,32,0]  ¦  customer_name[12,-1,0]  ¦  product_name[12,-1,0]  ¦  quantity[4,32,0]  ¦  unit_price[3,10,2]  ¦  total_amount[3,38,2]  ¦  order_date[91,64,0]  ¦  order_category[12,-1,0]  𝄀
1  ¦  alice  ¦  laptop  ¦  2  ¦  999.99  ¦  1999.98  ¦  2024-01-15  ¦  high value  𝄀
2  ¦  bob  ¦  mouse  ¦  5  ¦  29.99  ¦  149.95  ¦  2024-01-16  ¦  medium value  𝄀
3  ¦  alice  ¦  keyboard  ¦  3  ¦  79.99  ¦  239.97  ¦  2024-01-17  ¦  medium value
create table target_orders (
order_id int,
customer_name varchar(50),
product_name varchar(50),
quantity int,
unit_price decimal(10,2),
total_amount decimal(10,2),
order_date date,
order_category varchar(20)
);
insert into target_orders select * from temp_transformed_orders;
select * from target_orders;
➤ order_id[4,32,0]  ¦  customer_name[12,-1,0]  ¦  product_name[12,-1,0]  ¦  quantity[4,32,0]  ¦  unit_price[3,10,2]  ¦  total_amount[3,10,2]  ¦  order_date[91,64,0]  ¦  order_category[12,-1,0]  𝄀
1  ¦  alice  ¦  laptop  ¦  2  ¦  999.99  ¦  1999.98  ¦  2024-01-15  ¦  high value  𝄀
2  ¦  bob  ¦  mouse  ¦  5  ¦  29.99  ¦  149.95  ¦  2024-01-16  ¦  medium value  𝄀
3  ¦  alice  ¦  keyboard  ¦  3  ¦  79.99  ¦  239.97  ¦  2024-01-17  ¦  medium value
drop table temp_transformed_orders;
drop table target_orders;
drop table source_orders;
create table duplicate_data (
id int,
email varchar(100),
name varchar(50)
);
insert into duplicate_data values
(1, 'alice@example.com', 'alice'),
(2, 'bob@example.com', 'bob'),
(3, 'alice@example.com', 'alice smith'),
(4, 'charlie@example.com', 'charlie'),
(5, 'bob@example.com', 'bob johnson');
create temporary table temp_unique_data as
select
min(id) as id,
email,
max(name) as name
from duplicate_data
group by email;
select * from temp_unique_data;
➤ id[4,32,0]  ¦  email[12,-1,0]  ¦  name[12,-1,0]  𝄀
1  ¦  alice@example.com  ¦  alice smith  𝄀
2  ¦  bob@example.com  ¦  bob johnson  𝄀
4  ¦  charlie@example.com  ¦  charlie
drop table temp_unique_data;
drop table duplicate_data;
create table large_dataset (
id int,
value varchar(50)
);
insert into large_dataset values
(1, 'value1'), (2, 'value2'), (3, 'value3'), (4, 'value4'), (5, 'value5'),
(6, 'value6'), (7, 'value7'), (8, 'value8'), (9, 'value9'), (10, 'value10'),
(11, 'value11'), (12, 'value12'), (13, 'value13'), (14, 'value14'), (15, 'value15'),
(16, 'value16'), (17, 'value17'), (18, 'value18'), (19, 'value19'), (20, 'value20');
create temporary table temp_sample as
select * from large_dataset
where id % 5 = 0;
select * from temp_sample;
➤ id[4,32,0]  ¦  value[12,-1,0]  𝄀
5  ¦  value5  𝄀
10  ¦  value10  𝄀
15  ¦  value15  𝄀
20  ¦  value20
drop table temp_sample;
drop table large_dataset;
create table important_data (
id int,
data varchar(100),
last_updated timestamp
);
insert into important_data values
(1, 'important data 1', '2024-01-15 10:00:00'),
(2, 'important data 2', '2024-01-16 11:00:00');
create temporary table temp_backup as
select * from important_data;
update important_data set data = 'modified data' where id = 1;
delete from important_data where id = 2;
select * from important_data;
➤ id[4,32,0]  ¦  data[12,-1,0]  ¦  last_updated[93,64,0]  𝄀
1  ¦  modified data  ¦  2024-01-15 10:00:00
delete from important_data;
insert into important_data select * from temp_backup;
select * from important_data;
➤ id[4,32,0]  ¦  data[12,-1,0]  ¦  last_updated[93,64,0]  𝄀
1  ¦  important data 1  ¦  2024-01-15 10:00:00  𝄀
2  ¦  important data 2  ¦  2024-01-16 11:00:00
drop table temp_backup;
drop table important_data;
create table source1 (
id int,
name varchar(50),
source varchar(20)
);
create table source2 (
id int,
name varchar(50),
source varchar(20)
);
insert into source1 values (1, 'alice', 'source1'), (2, 'bob', 'source1');
insert into source2 values (3, 'charlie', 'source2'), (4, 'david', 'source2');
create temporary table temp_merged as
select * from source1
union all
select * from source2;
select * from temp_merged;
➤ id[4,32,0]  ¦  name[12,-1,0]  ¦  source[12,-1,0]  𝄀
1  ¦  alice  ¦  source1  𝄀
2  ¦  bob  ¦  source1  𝄀
3  ¦  charlie  ¦  source2  𝄀
4  ¦  david  ¦  source2
drop table temp_merged;
drop table source2;
drop table source1;
drop database if exists temp_operations;
