SET experimental_ivfpq_index = 1;
SET ivfpq_threads_build = 6;
SET ivfpq_max_index_capacity = 99999;
SET kmeans_train_percent = 100;
SET probe_limit = 16;
drop database if exists ivfpq_delete;
create database ivfpq_delete;
use ivfpq_delete;
create table t (id bigint primary key, v vecf32(8));
insert into t values
(1, '[10,10,10,10,10,10,10,10]'),     (2, '[20,20,20,20,20,20,20,20]'),
(3, '[40,40,40,40,40,40,40,40]'),     (4, '[80,80,80,80,80,80,80,80]'),
(5, '[160,160,160,160,160,160,160,160]'),     (6, '[320,320,320,320,320,320,320,320]'),
(7, '[640,640,640,640,640,640,640,640]'),     (8, '[1280,1280,1280,1280,1280,1280,1280,1280]'),
(9, '[2560,2560,2560,2560,2560,2560,2560,2560]'),     (10, '[5120,5120,5120,5120,5120,5120,5120,5120]');
create index ix using ivfpq on t (v) op_type 'vector_l2_ops' lists=2 m=8 bits_per_code=8;
select id from t order by l2_distance(v, '[160,160,160,160,160,160,160,160]') asc limit 1;
➤ id[-5,64,0]  𝄀
5
delete from t where id = 5;
select sleep(30);
➤ sleep(30)[-6,8,0]  𝄀
0
select count(*) from t;
➤ count(*)[-5,64,0]  𝄀
9
select id from t order by l2_distance(v, '[160,160,160,160,160,160,160,160]') asc limit 1;
➤ id[-5,64,0]  𝄀
4
select id from t order by l2_distance(v, '[1280,1280,1280,1280,1280,1280,1280,1280]') asc limit 1;
➤ id[-5,64,0]  𝄀
8
drop database ivfpq_delete;
