SET experimental_cagra_index = 1;
SET cagra_threads_build = 7;
SET cagra_max_index_capacity = 99999;
drop database if exists cagra_delete;
create database cagra_delete;
use cagra_delete;
create table t (id bigint primary key, v vecf32(8));
insert into t values
(1, '[10,10,10,10,10,10,10,10]'),     (2, '[20,20,20,20,20,20,20,20]'),
(3, '[40,40,40,40,40,40,40,40]'),     (4, '[80,80,80,80,80,80,80,80]'),
(5, '[160,160,160,160,160,160,160,160]'),     (6, '[320,320,320,320,320,320,320,320]'),
(7, '[640,640,640,640,640,640,640,640]'),     (8, '[1280,1280,1280,1280,1280,1280,1280,1280]'),
(9, '[2560,2560,2560,2560,2560,2560,2560,2560]'),     (10, '[5120,5120,5120,5120,5120,5120,5120,5120]');
create index ix using cagra on t (v) op_type 'vector_l2_ops' intermediate_graph_degree=8 graph_degree=4 itopk_size=16;
select id from t order by l2_distance(v, '[160,160,160,160,160,160,160,160]') asc limit 1;
➤ id[-5,64,0]  𝄀
5
set @stbl = (
select index_table_name from mo_catalog.mo_indexes
where name = 'ix' and algo = 'cagra' and algo_table_type = 'cagra_index'
and table_id in (
select rel_id from mo_catalog.mo_tables
where reldatabase = database() and relname = 't'
)
limit 1
);
set @capture_tail_sql = concat(
'select coalesce(max(chunk_id), -1) into @tail_baseline from `',
database(), '`.`', @stbl,
'` where index_id = ''cdc_tail'' and tag = 1'
);
prepare capture_tail from @capture_tail_sql;
execute capture_tail;
deallocate prepare capture_tail;
delete from t where id = 5;
select count(*) from t;
➤ count(*)[-5,64,0]  𝄀
9
set @wait_tail_sql = concat(
'select coalesce(max(chunk_id), -1) > @tail_baseline as cdc_tail_ready from `',
database(), '`.`', @stbl,
'` where index_id = ''cdc_tail'' and tag = 1'
);
prepare wait_tail from @wait_tail_sql;
execute wait_tail;
➤ cdc_tail_ready[-7,1,0]  𝄀
1
deallocate prepare wait_tail;
select 1 as ready
from (
select 'delete-160' as probe_name, q.id as actual_id, 4 as expected_id
from (select id from t order by l2_distance(v, '[160,160,160,160,160,160,160,160]') asc limit 1) q
union all
select 'untouched-1280' as probe_name, q.id as actual_id, 8 as expected_id
from (select id from t order by l2_distance(v, '[1280,1280,1280,1280,1280,1280,1280,1280]') asc limit 1) q
) readiness
having count(*) = 2
and sum(case when actual_id = expected_id then 1 else 0 end) = 2;
➤ ready[-5,64,0]  𝄀
1
select id from t order by l2_distance(v, '[160,160,160,160,160,160,160,160]') asc limit 1;
➤ id[-5,64,0]  𝄀
4
select id from t order by l2_distance(v, '[1280,1280,1280,1280,1280,1280,1280,1280]') asc limit 1;
➤ id[-5,64,0]  𝄀
8
drop database cagra_delete;
