SELECT to_date('01,5,2013','%d,%m,%Y');
to_date('01,5,2013','%d,%m,%Y')
2013-05-01
SELECT to_date('May 1, 2013','%M %d,%Y');
to_date('May 1, 2013','%M %d,%Y')
2013-05-01
SELECT to_date('a09:30:17','a%h:%i:%s');
to_date('a09:30:17','a%h:%i:%s')
09:30:17
SELECT to_date('a09:30:17','%h:%i:%s');
to_date('a09:30:17','%h:%i:%s')
null
SELECT to_date('09:30:17a','%h:%i:%s');
to_date('09:30:17a','%h:%i:%s')
09:30:17
SELECT to_date('abc','abc');
to_date('abc','abc')
null
SELECT to_date('9','%m');
to_date('9','%m')
null
SELECT to_date('9','%s');
to_date('9','%s')
00:00:09
SELECT to_date('00/00/0000', '%m/%d/%Y');
to_date('00/00/0000', '%m/%d/%Y')
null
SELECT to_date('04/31/2004', '%m/%d/%Y');
to_date('04/31/2004', '%m/%d/%Y')
2004-04-31
SELECT to_date('00/00/0000', '%m/%d/%Y');
to_date('00/00/0000', '%m/%d/%Y')
null
SELECT to_date('200442 Monday', '%X%V %W');
to_date('200442 Monday', '%X%V %W')
2004-10-18
SELECT CAST(to_date('nope','%d-%m-%Y') AS YEAR);
CAST(to_date('nope','%d-%m-%Y') AS YEAR)
null
select to_date(concat_ws(' ','15-01-2001'), ' 2:59:58.999');
to_date(concat_ws(' ','15-01-2001'), ' 2:59:58.999')
null
create table t1 (date char(30), format char(30) not null);
insert into t1 values
('2003-01-02 10:11:12', '%Y-%m-%d %H:%i:%S'),
('03-01-02 8:11:2.123456', '%y-%m-%d %H:%i:%S.%#'),
('0003-01-02 8:11:2.123456', '%Y-%m-%d %H:%i:%S.%#'),
('03-01-02 8:11:2.123456',   '%Y-%m-%d %H:%i:%S.%#'),
('2003-01-02 10:11:12 PM', '%Y-%m-%d %h:%i:%S %p'),
('2003-01-02 01:11:12.12345AM', '%Y-%m-%d %h:%i:%S.%f%p'),
('2003-01-02 02:11:12.12345AM', '%Y-%m-%d %h:%i:%S.%f %p'),
('2003-01-02 12:11:12.12345 am', '%Y-%m-%d %h:%i:%S.%f%p'),
('2003-01-02 11:11:12Pm', '%Y-%m-%d %h:%i:%S%p'),
('10:20:10', '%H:%i:%s'),
('10:20:10', '%h:%i:%s.%f'),
('10:20:10', '%T'),
('10:20:10AM', '%h:%i:%s%p'),
('10:20:10AM', '%r'),
('10:20:10.44AM', '%h:%i:%s.%f%p'),
('15-01-2001 12:59:58', '%d-%m-%Y %H:%i:%S'),
('15 September 2001', '%d %M %Y'),
('15 SEPTEMB 2001', '%d %M %Y'),
('15 MAY 2001', '%d %b %Y'),
('15th May 2001', '%D %b %Y'),
('Sunday 15 MAY 2001', '%W %d %b %Y'),
('Sund 15 MAY 2001', '%W %d %b %Y'),
('Tuesday 00 2002', '%W %U %Y'),
('Thursday 53 1998', '%W %u %Y'),
('Sunday 01 2001', '%W %v %x'),
('Tuesday 52 2001', '%W %V %X'),
('060 2004', '%j %Y'),
('4 53 1998', '%w %u %Y'),
('15-01-2001', '%d-%m-%Y %H:%i:%S'),
('15-01-20', '%d-%m-%y'),
('15-2001-1', '%d-%Y-%c');
select date,format,to_date(date, format) as to_date from t1;
date	format	to_date
2003-01-02 10:11:12	%Y-%m-%d %H:%i:%S	2003-01-02 10:11:12
03-01-02 8:11:2.123456	%y-%m-%d %H:%i:%S.%#	2003-01-02 08:11:02
0003-01-02 8:11:2.123456	%Y-%m-%d %H:%i:%S.%#	0003-01-02 08:11:02
03-01-02 8:11:2.123456	%Y-%m-%d %H:%i:%S.%#	2003-01-02 08:11:02
2003-01-02 10:11:12 PM	%Y-%m-%d %h:%i:%S %p	2003-01-02 22:11:12
2003-01-02 01:11:12.12345AM	%Y-%m-%d %h:%i:%S.%f%p	2003-01-02 01:11:12.123450000
2003-01-02 02:11:12.12345AM	%Y-%m-%d %h:%i:%S.%f %p	2003-01-02 02:11:12.123450000
2003-01-02 12:11:12.12345 am	%Y-%m-%d %h:%i:%S.%f%p	2003-01-02 00:11:12.123450000
2003-01-02 11:11:12Pm	%Y-%m-%d %h:%i:%S%p	2003-01-02 23:11:12
10:20:10	%H:%i:%s	null
10:20:10	%h:%i:%s.%f	null
10:20:10	%T	null
10:20:10AM	%h:%i:%s%p	null
10:20:10AM	%r	null
10:20:10.44AM	%h:%i:%s.%f%p	null
15-01-2001 12:59:58	%d-%m-%Y %H:%i:%S	2001-01-15 12:59:58
15 September 2001	%d %M %Y	2001-09-15 00:00:00
15 SEPTEMB 2001	%d %M %Y	2001-09-15 00:00:00
15 MAY 2001	%d %b %Y	2001-05-15 00:00:00
15th May 2001	%D %b %Y	2001-05-15 00:00:00
Sunday 15 MAY 2001	%W %d %b %Y	2001-05-15 00:00:00
Sund 15 MAY 2001	%W %d %b %Y	2001-05-15 00:00:00
Tuesday 00 2002	%W %U %Y	2002-01-01 00:00:00
Thursday 53 1998	%W %u %Y	1998-12-31 00:00:00
Sunday 01 2001	%W %v %x	2001-01-07 00:00:00
Tuesday 52 2001	%W %V %X	2002-01-01 00:00:00
060 2004	%j %Y	2004-02-29 00:00:00
4 53 1998	%w %u %Y	1998-12-31 00:00:00
15-01-2001	%d-%m-%Y %H:%i:%S	2001-01-15 00:00:00
15-01-20	%d-%m-%y	2020-01-15 00:00:00
15-2001-1	%d-%Y-%c	2001-01-15 00:00:00
select date,format,concat_ws(',',to_date(date, format)) as con from t1;
date	format	con
2003-01-02 10:11:12	%Y-%m-%d %H:%i:%S	2003-01-02 10:11:12.000000
03-01-02 8:11:2.123456	%y-%m-%d %H:%i:%S.%#	2003-01-02 08:11:02.000000
0003-01-02 8:11:2.123456	%Y-%m-%d %H:%i:%S.%#	0003-01-02 08:11:02.000000
03-01-02 8:11:2.123456	%Y-%m-%d %H:%i:%S.%#	2003-01-02 08:11:02.000000
2003-01-02 10:11:12 PM	%Y-%m-%d %h:%i:%S %p	2003-01-02 22:11:12.000000
2003-01-02 01:11:12.12345AM	%Y-%m-%d %h:%i:%S.%f%p	2003-01-02 01:11:12.123450
2003-01-02 02:11:12.12345AM	%Y-%m-%d %h:%i:%S.%f %p	2003-01-02 02:11:12.123450
2003-01-02 12:11:12.12345 am	%Y-%m-%d %h:%i:%S.%f%p	2003-01-02 00:11:12.123450
2003-01-02 11:11:12Pm	%Y-%m-%d %h:%i:%S%p	2003-01-02 23:11:12.000000
10:20:10	%H:%i:%s	
10:20:10	%h:%i:%s.%f	
10:20:10	%T	
10:20:10AM	%h:%i:%s%p	
10:20:10AM	%r	
10:20:10.44AM	%h:%i:%s.%f%p	
15-01-2001 12:59:58	%d-%m-%Y %H:%i:%S	2001-01-15 12:59:58.000000
15 September 2001	%d %M %Y	2001-09-15 00:00:00.000000
15 SEPTEMB 2001	%d %M %Y	2001-09-15 00:00:00.000000
15 MAY 2001	%d %b %Y	2001-05-15 00:00:00.000000
15th May 2001	%D %b %Y	2001-05-15 00:00:00.000000
Sunday 15 MAY 2001	%W %d %b %Y	2001-05-15 00:00:00.000000
Sund 15 MAY 2001	%W %d %b %Y	2001-05-15 00:00:00.000000
Tuesday 00 2002	%W %U %Y	2002-01-01 00:00:00.000000
Thursday 53 1998	%W %u %Y	1998-12-31 00:00:00.000000
Sunday 01 2001	%W %v %x	2001-01-07 00:00:00.000000
Tuesday 52 2001	%W %V %X	2002-01-01 00:00:00.000000
060 2004	%j %Y	2004-02-29 00:00:00.000000
4 53 1998	%w %u %Y	1998-12-31 00:00:00.000000
15-01-2001	%d-%m-%Y %H:%i:%S	2001-01-15 00:00:00.000000
15-01-20	%d-%m-%y	2020-01-15 00:00:00.000000
15-2001-1	%d-%Y-%c	2001-01-15 00:00:00.000000
select date,format,cast(to_date(date, format) as datetime) as datetime from t1;
date	format	datetime
2003-01-02 10:11:12	%Y-%m-%d %H:%i:%S	2003-01-02 10:11:12
03-01-02 8:11:2.123456	%y-%m-%d %H:%i:%S.%#	2003-01-02 08:11:02
0003-01-02 8:11:2.123456	%Y-%m-%d %H:%i:%S.%#	0003-01-02 08:11:02
03-01-02 8:11:2.123456	%Y-%m-%d %H:%i:%S.%#	2003-01-02 08:11:02
2003-01-02 10:11:12 PM	%Y-%m-%d %h:%i:%S %p	2003-01-02 22:11:12
2003-01-02 01:11:12.12345AM	%Y-%m-%d %h:%i:%S.%f%p	2003-01-02 01:11:12
2003-01-02 02:11:12.12345AM	%Y-%m-%d %h:%i:%S.%f %p	2003-01-02 02:11:12
2003-01-02 12:11:12.12345 am	%Y-%m-%d %h:%i:%S.%f%p	2003-01-02 00:11:12
2003-01-02 11:11:12Pm	%Y-%m-%d %h:%i:%S%p	2003-01-02 23:11:12
10:20:10	%H:%i:%s	null
10:20:10	%h:%i:%s.%f	null
10:20:10	%T	null
10:20:10AM	%h:%i:%s%p	null
10:20:10AM	%r	null
10:20:10.44AM	%h:%i:%s.%f%p	null
15-01-2001 12:59:58	%d-%m-%Y %H:%i:%S	2001-01-15 12:59:58
15 September 2001	%d %M %Y	2001-09-15 00:00:00
15 SEPTEMB 2001	%d %M %Y	2001-09-15 00:00:00
15 MAY 2001	%d %b %Y	2001-05-15 00:00:00
15th May 2001	%D %b %Y	2001-05-15 00:00:00
Sunday 15 MAY 2001	%W %d %b %Y	2001-05-15 00:00:00
Sund 15 MAY 2001	%W %d %b %Y	2001-05-15 00:00:00
Tuesday 00 2002	%W %U %Y	2002-01-01 00:00:00
Thursday 53 1998	%W %u %Y	1998-12-31 00:00:00
Sunday 01 2001	%W %v %x	2001-01-07 00:00:00
Tuesday 52 2001	%W %V %X	2002-01-01 00:00:00
060 2004	%j %Y	2004-02-29 00:00:00
4 53 1998	%w %u %Y	1998-12-31 00:00:00
15-01-2001	%d-%m-%Y %H:%i:%S	2001-01-15 00:00:00
15-01-20	%d-%m-%y	2020-01-15 00:00:00
15-2001-1	%d-%Y-%c	2001-01-15 00:00:00
select date,format,DATE(to_date(date, format)) as date2 from t1;
date	format	date2
2003-01-02 10:11:12	%Y-%m-%d %H:%i:%S	2003-01-02
03-01-02 8:11:2.123456	%y-%m-%d %H:%i:%S.%#	2003-01-02
0003-01-02 8:11:2.123456	%Y-%m-%d %H:%i:%S.%#	0003-01-02
03-01-02 8:11:2.123456	%Y-%m-%d %H:%i:%S.%#	2003-01-02
2003-01-02 10:11:12 PM	%Y-%m-%d %h:%i:%S %p	2003-01-02
2003-01-02 01:11:12.12345AM	%Y-%m-%d %h:%i:%S.%f%p	2003-01-02
2003-01-02 02:11:12.12345AM	%Y-%m-%d %h:%i:%S.%f %p	2003-01-02
2003-01-02 12:11:12.12345 am	%Y-%m-%d %h:%i:%S.%f%p	2003-01-02
2003-01-02 11:11:12Pm	%Y-%m-%d %h:%i:%S%p	2003-01-02
10:20:10	%H:%i:%s	null
10:20:10	%h:%i:%s.%f	null
10:20:10	%T	null
10:20:10AM	%h:%i:%s%p	null
10:20:10AM	%r	null
10:20:10.44AM	%h:%i:%s.%f%p	null
15-01-2001 12:59:58	%d-%m-%Y %H:%i:%S	2001-01-15
15 September 2001	%d %M %Y	2001-09-15
15 SEPTEMB 2001	%d %M %Y	2001-09-15
15 MAY 2001	%d %b %Y	2001-05-15
15th May 2001	%D %b %Y	2001-05-15
Sunday 15 MAY 2001	%W %d %b %Y	2001-05-15
Sund 15 MAY 2001	%W %d %b %Y	2001-05-15
Tuesday 00 2002	%W %U %Y	2002-01-01
Thursday 53 1998	%W %u %Y	1998-12-31
Sunday 01 2001	%W %v %x	2001-01-07
Tuesday 52 2001	%W %V %X	2002-01-01
060 2004	%j %Y	2004-02-29
4 53 1998	%w %u %Y	1998-12-31
15-01-2001	%d-%m-%Y %H:%i:%S	2001-01-15
15-01-20	%d-%m-%y	2020-01-15
15-2001-1	%d-%Y-%c	2001-01-15
select concat_ws('',to_date('8:11:2.123456 03-01-02','%H:%i:%S.%f %y-%m-%d'));
concat_ws('',to_date('8:11:2.123456 03-01-02','%H:%i:%S.%f %y-%m-%d'))
2003-01-02 08:11:02.123456
delete from t1;
insert into t1 values
('2003-01-02 10:11:12 PM', '%Y-%m-%d %H:%i:%S %p'),
('2003-01-02 10:11:12.123456', '%Y-%m-%d %h:%i:%S %p'),
('2003-01-02 10:11:12AM', '%Y-%m-%d %h:%i:%S.%f %p'),
('2003-01-02 10:11:12AN', '%Y-%m-%d %h:%i:%S%p'),
('2003-01-02 10:11:12 PM', '%y-%m-%d %H:%i:%S %p'),
('10:20:10AM', '%H:%i:%s%p'),
('15 Septembei 2001', '%d %M %Y'),
('15 Ju 2001', '%d %M %Y'),
('Sund 15 MA', '%W %d %b %Y'),
('Thursdai 12 1998', '%W %u %Y'),
('Sunday 01 2001', '%W %v %X'),
('Tuesday 52 2001', '%W %V %x'),
('Tuesday 52 2001', '%W %V %Y'),
('Tuesday 52 2001', '%W %u %x'),
('7 53 1998', '%w %u %Y');
select date,format,to_date(date, format) as to_date from t1;
date	format	to_date
2003-01-02 10:11:12 PM	%Y-%m-%d %H:%i:%S %p	null
2003-01-02 10:11:12.123456	%Y-%m-%d %h:%i:%S %p	null
2003-01-02 10:11:12AM	%Y-%m-%d %h:%i:%S.%f %p	null
2003-01-02 10:11:12AN	%Y-%m-%d %h:%i:%S%p	null
2003-01-02 10:11:12 PM	%y-%m-%d %H:%i:%S %p	null
10:20:10AM	%H:%i:%s%p	null
15 Septembei 2001	%d %M %Y	null
15 Ju 2001	%d %M %Y	null
Sund 15 MA	%W %d %b %Y	null
Thursdai 12 1998	%W %u %Y	null
Sunday 01 2001	%W %v %X	null
Tuesday 52 2001	%W %V %x	null
Tuesday 52 2001	%W %V %Y	null
Tuesday 52 2001	%W %u %x	null
7 53 1998	%w %u %Y	null
select date,format,concat_ws(" ",to_date(date, format),'') as con from t1;
date	format	con
2003-01-02 10:11:12 PM	%Y-%m-%d %H:%i:%S %p	
2003-01-02 10:11:12.123456	%Y-%m-%d %h:%i:%S %p	
2003-01-02 10:11:12AM	%Y-%m-%d %h:%i:%S.%f %p	
2003-01-02 10:11:12AN	%Y-%m-%d %h:%i:%S%p	
2003-01-02 10:11:12 PM	%y-%m-%d %H:%i:%S %p	
10:20:10AM	%H:%i:%s%p	
15 Septembei 2001	%d %M %Y	
15 Ju 2001	%d %M %Y	
Sund 15 MA	%W %d %b %Y	
Thursdai 12 1998	%W %u %Y	
Sunday 01 2001	%W %v %X	
Tuesday 52 2001	%W %V %x	
Tuesday 52 2001	%W %V %Y	
Tuesday 52 2001	%W %u %x	
7 53 1998	%w %u %Y
drop table t1;
select to_date( 1, NULL );
to_date( 1, NULL )
null
select to_date( NULL, 1 );
to_date( NULL, 1 )
null
select to_date( 1, IF(1=1,NULL,NULL) );
to_date( 1, IF(1=1,NULL,NULL) )
null
select to_date('04 /30/2004', '%m /%d/%Y');
to_date('04 /30/2004', '%m /%d/%Y')
2004-04-30
select to_date('04/30 /2004', '%m /%d /%Y');
to_date('04/30 /2004', '%m /%d /%Y')
2004-04-30
select to_date('04/30/2004 ', '%m/%d/%Y ');
to_date('04/30/2004 ', '%m/%d/%Y ')
2004-04-30
SELECT DATE_SUB(to_date('9999-12-31 00:01:00','%Y-%m-%d %H:%i:%s'), INTERVAL 1 MINUTE);
DATE_SUB(to_date('9999-12-31 00:01:00','%Y-%m-%d %H:%i:%s'), INTERVAL 1 MINUTE)
9999-12-31 00:00:00
SELECT DATE_ADD(to_date('9999-12-30 23:59:00','%Y-%m-%d %H:%i:%s'), INTERVAL 1 MINUTE);
DATE_ADD(to_date('9999-12-30 23:59:00','%Y-%m-%d %H:%i:%s'), INTERVAL 1 MINUTE)
9999-12-31 00:00:00
select month(to_date(null, '%m')), month(to_date(null, '%m'));
month(to_date(null, '%m'))	month(to_date(null, '%m'))
null	null
select to_date('10:00 PM', '%h:%i %p') + INTERVAL 10 MINUTE;
to_date('10:00 PM', '%h:%i %p') + INTERVAL 10 MINUTE
22:10:00
select to_date('2007-10-09','%Y-%m-%d') > '2007/10/01 00:00:00 GMT-6';
to_date('2007-10-09','%Y-%m-%d') > '2007/10/01 00:00:00 GMT-6'
1
select to_date('2007-10-01','%Y-%m-%d') = '2007-10-1 00:00:00 GMT-6';
to_date('2007-10-01','%Y-%m-%d') = '2007-10-1 00:00:00 GMT-6'
1
select to_date('2007-10-01','%Y-%m-%d') = '2007-10-01 x00:00:00 GMT-6';
to_date('2007-10-01','%Y-%m-%d') = '2007-10-01 x00:00:00 GMT-6'
1
select to_date('2007-10-01','%Y-%m-%d %H:%i:%s') = '2007-10-01 00:00:00 GMT-6';
to_date('2007-10-01','%Y-%m-%d %H:%i:%s') = '2007-10-01 00:00:00 GMT-6'
1
select to_date('2007-10-01','%Y-%m-%d %H:%i:%s') = '2007-10-01 00:x00:00 GMT-6';
to_date('2007-10-01','%Y-%m-%d %H:%i:%s') = '2007-10-01 00:x00:00 GMT-6'
1
select to_date('1000-01-01','%Y-%m-%d') between NULL and NULL;
to_date('1000-01-01','%Y-%m-%d') between NULL and NULL
null
select to_date('2007-10-00','%Y-%m-%d') between '' and '2007/10/20';
to_date('2007-10-00','%Y-%m-%d') between '' and '2007/10/20'
null
select to_date('2007-10-00','%Y-%m-%d') between '2007/09/01'
and '2007/10/20';
to_date('2007-10-00','%Y-%m-%d') between '2007/09/01'
and '2007/10/20'
null
select to_date('2007-10-09','%Y-%m-%d') between '2007/10/01 00:00:00 GMT'
and '2007/10/20 00:00:00 GMT';
to_date('2007-10-09','%Y-%m-%d') between '2007/10/01 00:00:00 GMT'
and '2007/10/20 00:00:00 GMT'
1
CREATE TABLE t1 ( a datetime(2) );
CREATE TABLE t2 ( a timestamp(2) );
SELECT to_date('09:22', '%H:%i');
to_date('09:22', '%H:%i')
09:22:00
SELECT to_date('09:22:23.33', '%H:%i:%s.%f');
to_date('09:22:23.33', '%H:%i:%s.%f')
09:22:23.330000000
INSERT INTO t1 select( to_date('09:22', '%H:%i') );
INSERT INTO t1 select( to_date('09:22:23.33', '%H:%i:%s.%f') );
select * from t1;
a
2022-06-10 09:22:00
2022-06-10 09:22:23.330000000
DELETE FROM t1;
INSERT INTO t1 select( to_date('2019-12-31', '%Y-%m-%d') );
INSERT INTO t2 select( to_date('09:22', '%H:%i') );
INSERT INTO t2 select( to_date('09:22:23.33', '%H:%i:%s.%f') );
select * from t1;
a
2019-12-31 00:00:00
select * from t2;
a
2022-06-10 09:22:00
2022-06-10 09:22:23.330000000
DELETE FROM t2;
drop table t1;
drop table t2;
