drop database if exists test;
create database test;
use test;
create table t0(a int, b int, primary key(a));
insert into t0 values(1,1),(2,2);
create table t1 clone t0;
insert into t1 values(3, 3);
create table t2 clone t0;
insert into t2 values(3, 4);
data branch diff t2 against t1;
diff t2 against t1    flag    a    b
t2    INSERT    3    4
t1    INSERT    3    3
data branch merge t2 into t1;
internal error: merge diff conflict happend [t2 INSERT 3 4] <=> [t1 INSERT 3 3]
data branch merge t2 into t1 when conflict skip;
select * from t1 order by a asc;
a    b
1    1
2    2
3    3
data branch merge t2 into t1 when conflict accept;
select * from t1 order by a asc;
a    b
1    1
2    2
3    4
drop table t0;
drop table t1;
drop table t2;
create table t1 (a int, b int, primary key(a));
insert into t1 values(1,1),(2,2);
create table t2 (a int, b int, primary key(a));
insert into t2 values(1,2),(3,3);
data branch diff t2 against t1;
diff t2 against t1    flag    a    b
t1    INSERT    1    1
t2    INSERT    1    2
t1    INSERT    2    2
t2    INSERT    3    3
data branch merge t2 into t1;
internal error: merge diff conflict happend [t2 INSERT 1 2] <=> [t1 INSERT 1 1]
data branch merge t2 into t1 when conflict skip;
select * from t1 order by a asc;
a    b
1    1
2    2
3    3
data branch merge t2 into t1 when conflict accept;
select * from t1 order by a asc;
a    b
1    2
2    2
3    3
drop table t1;
drop table t2;
create table t1 (a int, b int, primary key(a));
insert into t1 values(1,1),(2,2);
create table t2 clone t1;
update t2 set b = b + 2 where a = 1;
update t1 set b = b + 1 where a = 1;
data branch diff t2 against t1;
diff t2 against t1    flag    a    b
t2    UPDATE    1    3
t1    UPDATE    1    2
data branch merge t2 into t1;
internal error: merge diff conflict happend [t2 UPDATE 1 3] <=> [t1 UPDATE 1 2]
data branch merge t2 into t1 when conflict skip;
select * from t1 order by a asc;
a    b
1    2
2    2
data branch merge t2 into t1 when conflict accept;
select * from t1 order by a asc;
a    b
1    3
2    2
drop table t1;
drop table t2;
create table t2 (a int, b int, primary key(a));
insert into t2 values(1,1),(2,2);
create table t1 clone t2;
update t1 set b = b + 1 where a = 1;
update t2 set b = b + 2 where a = 1;
data branch diff t2 against t1;
diff t2 against t1    flag    a    b
t2    UPDATE    1    3
t1    UPDATE    1    2
data branch merge t2 into t1;
internal error: merge diff conflict happend [t2 UPDATE 1 3] <=> [t1 UPDATE 1 2]
data branch merge t2 into t1 when conflict skip;
select * from t1 order by a asc;
a    b
1    2
2    2
data branch merge t2 into t1 when conflict accept;
select * from t1 order by a asc;
a    b
1    3
2    2
drop table t1;
drop table t2;
drop database test;
