drop table if exists t1;
create table t1 (d datetime);
insert into t1 values ('2004-07-14 08:19:30.333333'),('2005-08-15 22:50:59.999999');
select date_format(d,'%a') from t1;
date_format(d,'%a')
Wed
Mon
select date_format(d,'%b') from t1;
date_format(d,'%b')
Jul
Aug
select date_format(d,'%c') from t1;
date_format(d,'%c')
7
8
select date_format(d,'%D') from t1;
date_format(d,'%D')
14th
15th
select date_format(d,'%d') from t1;
date_format(d,'%d')
14
15
select date_format(d,'%e') from t1;
date_format(d,'%e')
14
15
select date_format(d,'%f') from t1;
date_format(d,'%f')
000000
000000
select date_format(d,'%H') from t1;
date_format(d,'%H')
08
22
select date_format(d,'%h') from t1;
date_format(d,'%h')
08
10
select date_format(d,'%I') from t1;
date_format(d,'%I')
08
10
select date_format(d,'%i') from t1;
date_format(d,'%i')
19
51
select date_format(d,'%j') from t1;
date_format(d,'%j')
196
227
select date_format(d,'%k') from t1;
date_format(d,'%k')
8
22
select date_format(d,'%l') from t1;
date_format(d,'%l')
8
10
select date_format(d,'%M') from t1;
date_format(d,'%M')
July
August
select date_format(d,'%m') from t1;
date_format(d,'%m')
07
08
select date_format(d,'%p') from t1;
date_format(d,'%p')
AM
PM
select date_format(d,'%r') from t1;
date_format(d,'%r')
08:19:30 AM
10:51:00 PM
select date_format(d,'%S') from t1;
date_format(d,'%S')
30
00
select date_format(d,'%s') from t1;
date_format(d,'%s')
30
00
select date_format(d,'%T') from t1;
date_format(d,'%T')
08:19:30
22:51:00
select date_format(d,'%U') from t1;
date_format(d,'%U')
28
33
select date_format(d,'%u') from t1;
date_format(d,'%u')
29
33
select date_format(d,'%V') from t1;
date_format(d,'%V')
28
33
select date_format(d,'%v') from t1;
date_format(d,'%v')
29
33
select date_format(d,'%W') from t1;
date_format(d,'%W')
Wednesday
Monday
select date_format(d,'%w') from t1;
date_format(d,'%w')
3
1
select date_format(d,'%X') from t1;
date_format(d,'%X')
2004
2005
select date_format(d,'%x') from t1;
date_format(d,'%x')
2004
2005
select date_format(d,'%Y') from t1;
date_format(d,'%Y')
2004
2005
select date_format(d,'%y') from t1;
date_format(d,'%y')
04
05
drop table t1;
drop table if exists t2;
create table t2 (f1 datetime);
insert into t2 (f1) values ('2005-01-01');
insert into t2 (f1) values ('2005-02-01');
select date_format(f1, "%m") as d1, date_format(f1, "%M") as d2 from t2 order by date_format(f1, "%M");
d1    d2
02    February
01    January
drop table t2;
drop table if exists t3;
create table t3 (d date);
insert into t3 values (date_format('20221214', '%Y-%m-%d'));
drop table t3;
drop table if exists t4;
create table t4 (a int, d date);
insert into t4 values (1, '2002-02-20');
update t4 set d=date_format('20221214', '%Y-%m-%d') where a=1;
delete from t4 where d=date_format('20221214', '%Y-%m-%d');
select * from t4;
a    d
drop table t4;
drop table if exists t5;
create table t5 (a int, b date);
insert into t5 values
(1,'2000-02-05'),(2,'2000-10-08'),(3,'2005-01-03'),(4,'2007-09-01'),(5,'2022-01-01');
select * from t5 where b=date_format('20000205', '%Y-%m-%d');
a    b
1    2000-02-05
select * from t5 where b!=date_format('20000205', '%Y-%m-%d');
a    b
2    2000-10-08
3    2005-01-03
4    2007-09-01
5    2022-01-01
select * from t5 where b<>date_format('20000205', '%Y-%m-%d');
a    b
2    2000-10-08
3    2005-01-03
4    2007-09-01
5    2022-01-01
select * from t5 where b>date_format('20000205', '%Y-%m-%d');
a    b
2    2000-10-08
3    2005-01-03
4    2007-09-01
5    2022-01-01
select * from t5 where b<date_format('20000205', '%Y-%m-%d');
a    b
select * from t5 where b<=date_format('20000205', '%Y-%m-%d');
a    b
1    2000-02-05
select * from t5 where b between date_format('20000205', '%Y-%m-%d') and date_format('20220101', '%Y-%m-%d');
a    b
1    2000-02-05
2    2000-10-08
3    2005-01-03
4    2007-09-01
5    2022-01-01
select * from t5 where b not between date_format('20000205', '%Y-%m-%d') and date_format('20220101', '%Y-%m-%d');
a    b
drop table t5;
SELECT DATE_FORMAT("2009-01-01",'%W %d %M %Y') as valid_date;
valid_date
Thursday 01 January 2009
SELECT DATE_FORMAT('0000-01-01','%W %d %M %Y') as valid_date;
invalid input: invalid datatime value 0000-01-01
SELECT DATE_FORMAT('0000-02-28','%W %d %M %Y') as valid_date;
invalid input: invalid datatime value 0000-02-28
SELECT DATE_FORMAT('9999-02-28','%W %d %M %Y') as valid_date;
valid_date
Sunday 28 February 9999
select date_format('1997-01-02 03:04:05', '%M %W %D %Y %y %m %d %h %i %s %w');
date_format('1997-01-02 03:04:05', '%M %W %D %Y %y %m %d %h %i %s %w')
January Thursday 2nd 1997 97 01 02 03 04 05 4
select date_format('1997-01-02', concat('%M %W %D','%Y %y %m %d %h %i %s %w'));
date_format('1997-01-02', concat('%M %W %D','%Y %y %m %d %h %i %s %w'))
January Thursday 2nd1997 97 01 02 12 00 00 4
select date_format('1998-12-31','%x-%v'),date_format('1999-01-01','%x-%v');
date_format('1998-12-31','%x-%v')    date_format('1999-01-01','%x-%v')
1998-53    1998-53
select date_format('1999-12-31','%x-%v'),date_format('2000-01-01','%x-%v');
date_format('1999-12-31','%x-%v')    date_format('2000-01-01','%x-%v')
1999-52    1999-52
select date_format(concat('19980131',131415),'%H|%I|%k|%l|%i|%p|%r|%S|%T| %M|%W|%D|%Y|%y|%a|%b|%j|%m|%d|%h|%s|%w');
date_format(concat('19980131',131415),'%H|%I|%k|%l|%i|%p|%r|%S|%T| %M|%W|%D|%Y|%y|%a|%b|%j|%m|%d|%h|%s|%w')
13|01|13|1|14|PM|01:14:15 PM|15|13:14:15| January|Saturday|31st|1998|98|Sat|Jan|031|01|31|01|15|6
select date_format(19980021000000,'%H|%I|%k|%l|%i|%p|%r|%S|%T| %M|%W|%D|%Y|%y|%a|%b|%j|%m|%d|%h|%s|%w');
invalid argument function date_format, bad value [BIGINT VARCHAR]
select date_format('19980021000000','%H|%I|%k|%l|%i|%p|%r|%S|%T| %M|%W|%D|%Y|%y|%a|%b|%j|%m|%d|%h|%s|%w');
invalid input: invalid datatime value 19980021000000