CREATE TABLE t3(o_id INT, attribute VARCHAR(20), value VARCHAR(20));
INSERT INTO t3 VALUES
(2,'color','red'),
(2,'fabric','silk'),
(3,'color','green'),
(3,'shape','square');
SELECT o_id, JSON_ARRAYAGG(attribute) AS attributes FROM t3 GROUP BY o_id ORDER BY o_id;
o_id    attributes
2    ["color", "fabric"]
3    ["color", "shape"]
SELECT o_id, JSON_OBJECTAGG(attribute, value) AS details FROM t3 GROUP BY o_id ORDER BY o_id;
o_id    details
2    {"color": "red", "fabric": "silk"}
3    {"color": "green", "shape": "square"}
CREATE TABLE t_dup(c VARCHAR(10), i INT);
INSERT INTO t_dup VALUES ('key',3),('key',4),('key',5);
SELECT JSON_OBJECTAGG(c,i) AS obj1 FROM t_dup;
obj1
{"key": 5}
DELETE FROM t_dup;
INSERT INTO t_dup VALUES ('key',3),('key',5),('key',4);
SELECT JSON_OBJECTAGG(c,i) AS obj2 FROM t_dup;
obj2
{"key": 4}
DROP TABLE t_dup;
DROP TABLE t3;
CREATE TABLE t_obj_numeric(
row_id INT,
signed_key BIGINT,
unsigned_key BIGINT UNSIGNED,
float_key FLOAT,
decimal_key DECIMAL(12,2),
value VARCHAR(20)
);
INSERT INTO t_obj_numeric VALUES
(1, -7, 18446744073709551615, 1.25, 12.30, 'first'),
(2, 7, 2, 2.50, 0.10, 'last');
SELECT JSON_OBJECTAGG(CAST(1 AS SIGNED), value) AS signed_literal FROM t_obj_numeric WHERE row_id = 1;
signed_literal
{"1": "first"}
SELECT JSON_OBJECTAGG(signed_key, value) AS signed_key_object FROM t_obj_numeric WHERE row_id = 1;
signed_key_object
{"-7": "first"}
SELECT JSON_OBJECTAGG(unsigned_key, value) AS unsigned_key_object FROM t_obj_numeric WHERE row_id = 1;
unsigned_key_object
{"18446744073709551615": "first"}
SELECT JSON_OBJECTAGG(float_key, value) AS float_key_object FROM t_obj_numeric WHERE row_id = 1;
float_key_object
{"1.25": "first"}
SELECT JSON_OBJECTAGG(decimal_key, value) AS decimal_key_object FROM t_obj_numeric WHERE row_id = 1;
decimal_key_object
{"12.30": "first"}
SELECT JSON_OBJECTAGG(CAST(1.25 AS DOUBLE), value) AS double_key_object FROM t_obj_numeric WHERE row_id = 1;
double_key_object
{"1.25": "first"}
SELECT JSON_OBJECTAGG(CAST(0 AS SIGNED), value) AS zero_key_object FROM t_obj_numeric WHERE row_id = 2;
zero_key_object
{"0": "last"}
SELECT JSON_OBJECTAGG(row_id, value) AS integer_key_object, JSON_OBJECTAGG(row_id + 1, value) AS expression_key_object FROM t_obj_numeric WHERE row_id = 1;
➤ integer_key_object[-1,2147483647,0]  ¦  expression_key_object[-1,2147483647,0]  𝄀
{"1": "first"}  ¦  {"2": "first"}
SELECT JSON_OBJECTAGG(row_id, value) AS implicit_object, JSON_OBJECTAGG(CAST(row_id AS CHAR), value) AS explicit_object FROM t_obj_numeric WHERE row_id = 1;
➤ implicit_object[-1,2147483647,0]  ¦  explicit_object[-1,2147483647,0]  𝄀
{"1": "first"}  ¦  {"1": "first"}
SELECT JSON_OBJECTAGG(CAST(0 AS SIGNED), NULL) AS null_value_object FROM t_obj_numeric WHERE row_id = 2;
➤ null_value_object[-1,2147483647,0]  𝄀
{"0": null}
SELECT row_id, JSON_OBJECTAGG(signed_key, value) AS limited_object FROM t_obj_numeric GROUP BY row_id ORDER BY row_id LIMIT 1;
➤ row_id[4,32,0]  ¦  limited_object[-1,2147483647,0]  𝄀
1  ¦  {"-7": "first"}
SELECT JSON_CONTAINS(duplicate_object, '{"1":"first"}') OR JSON_CONTAINS(duplicate_object, '{"1":"last"}') AS duplicate_numeric FROM (SELECT JSON_OBJECTAGG(signed_key, value) AS duplicate_object FROM (SELECT CAST(1 AS SIGNED) AS signed_key, value FROM t_obj_numeric) AS unordered_numeric) AS duplicate_check;
duplicate_numeric
1
SET @json_objectagg_key = '-19';
PREPARE json_objectagg_signed_key FROM 'SELECT JSON_OBJECTAGG(CAST(? AS SIGNED), value) AS prepared_signed FROM t_obj_numeric WHERE row_id = 1';
EXECUTE json_objectagg_signed_key USING @json_objectagg_key;
➤ prepared_signed[-1,2147483647,0]  𝄀
{"-19": "first"}
SET @json_objectagg_key = '0';
EXECUTE json_objectagg_signed_key USING @json_objectagg_key;
➤ prepared_signed[-1,2147483647,0]  𝄀
{"0": "first"}
DEALLOCATE PREPARE json_objectagg_signed_key;
PREPARE json_objectagg_any_key FROM 'SELECT JSON_OBJECTAGG(?, value) AS prepared_any FROM t_obj_numeric WHERE row_id = 1';
EXECUTE json_objectagg_any_key USING @json_objectagg_key;
➤ prepared_any[-1,2147483647,0]  𝄀
{"0": "first"}
SET @json_objectagg_key = '-19';
EXECUTE json_objectagg_any_key USING @json_objectagg_key;
➤ prepared_any[-1,2147483647,0]  𝄀
{"-19": "first"}
DEALLOCATE PREPARE json_objectagg_any_key;
SELECT JSON_OBJECTAGG(CAST(NULL AS SIGNED), value) AS null_key FROM t_obj_numeric WHERE row_id = 1;
invalid input: json_objectagg key cannot be NULL
SELECT JSON_OBJECTAGG(CAST(0 AS SIGNED), value) AS recovered_object FROM t_obj_numeric WHERE row_id = 2;
recovered_object
{"0": "last"}
SELECT JSON_OBJECTAGG(signed_key, value) AS empty_object FROM t_obj_numeric WHERE row_id = 999;
empty_object
NULL
DROP TABLE t_obj_numeric;
CREATE TABLE t_arr_ext(g INT, pos INT, v INT);
INSERT INTO t_arr_ext VALUES
(1,1,5),
(1,2,1),
(1,3,5),
(1,4,3),
(1,5,1),
(1,6,2),
(2,1,7),
(2,2,7),
(2,3,8),
(2,4,9),
(2,5,8);
SELECT g, JSON_ARRAYAGG(v) AS ordered_array FROM (SELECT g, pos, v FROM t_arr_ext ORDER BY g, pos) AS s GROUP BY g ORDER BY g;
g    ordered_array
1    [5, 1, 5, 3, 1, 2]
2    [7, 7, 8, 9, 8]
SELECT g, JSON_ARRAYAGG(v) AS distinct_array FROM (SELECT DISTINCT g, v FROM t_arr_ext ORDER BY g, v) AS s GROUP BY g ORDER BY g;
g    distinct_array
1    [1, 2, 3, 5]
2    [7, 8, 9]
DROP TABLE t_arr_ext;
CREATE TABLE t_arr_typed(t0 TIME(0), t6 TIME(6), dt0 DATETIME(0), dt6 DATETIME(6), yr YEAR);
INSERT INTO t_arr_typed VALUES ('04:05:06', '04:05:06.123456', '2024-02-03 04:05:06', '2024-02-03 04:05:06.123456', 2024);
SELECT JSON_TYPE(JSON_EXTRACT(JSON_ARRAYAGG(t0), '$[0]')), JSON_UNQUOTE(JSON_EXTRACT(JSON_ARRAYAGG(t0), '$[0]')), JSON_TYPE(JSON_EXTRACT(JSON_ARRAYAGG(t6), '$[0]')), JSON_UNQUOTE(JSON_EXTRACT(JSON_ARRAYAGG(t6), '$[0]')) FROM t_arr_typed;
➤ JSON_TYPE(JSON_EXTRACT(JSON_ARRAYAGG(t0), $[0]))[12,65535,0]  ¦  JSON_UNQUOTE(JSON_EXTRACT(JSON_ARRAYAGG(t0), $[0]))[12,65535,0]  ¦  JSON_TYPE(JSON_EXTRACT(JSON_ARRAYAGG(t6), $[0]))[12,65535,0]  ¦  JSON_UNQUOTE(JSON_EXTRACT(JSON_ARRAYAGG(t6), $[0]))[12,65535,0]  𝄀
TIME  ¦  04:05:06.000000  ¦  TIME  ¦  04:05:06.123456
SELECT JSON_TYPE(JSON_EXTRACT(JSON_ARRAYAGG(dt0), '$[0]')), JSON_UNQUOTE(JSON_EXTRACT(JSON_ARRAYAGG(dt0), '$[0]')), JSON_TYPE(JSON_EXTRACT(JSON_ARRAYAGG(dt6), '$[0]')), JSON_UNQUOTE(JSON_EXTRACT(JSON_ARRAYAGG(dt6), '$[0]')) FROM t_arr_typed;
➤ JSON_TYPE(JSON_EXTRACT(JSON_ARRAYAGG(dt0), $[0]))[12,65535,0]  ¦  JSON_UNQUOTE(JSON_EXTRACT(JSON_ARRAYAGG(dt0), $[0]))[12,65535,0]  ¦  JSON_TYPE(JSON_EXTRACT(JSON_ARRAYAGG(dt6), $[0]))[12,65535,0]  ¦  JSON_UNQUOTE(JSON_EXTRACT(JSON_ARRAYAGG(dt6), $[0]))[12,65535,0]  𝄀
DATETIME  ¦  2024-02-03 04:05:06.000000  ¦  DATETIME  ¦  2024-02-03 04:05:06.123456
SELECT JSON_TYPE(JSON_EXTRACT(JSON_ARRAYAGG(yr), '$[0]')), JSON_CONTAINS(JSON_ARRAYAGG(yr), '2024'), JSON_CONTAINS(JSON_ARRAYAGG(yr), '"2024"') FROM t_arr_typed;
➤ JSON_TYPE(JSON_EXTRACT(JSON_ARRAYAGG(yr), $[0]))[12,65535,0]  ¦  JSON_CONTAINS(JSON_ARRAYAGG(yr), 2024)[-5,64,0]  ¦  JSON_CONTAINS(JSON_ARRAYAGG(yr), "2024")[-5,64,0]  𝄀
INTEGER  ¦  1  ¦  0
INSERT INTO t_arr_typed VALUES (NULL, NULL, NULL, NULL, NULL), ('04:05:06', '04:05:06.123456', '2024-02-03 04:05:06', '2024-02-03 04:05:06.123456', 2024);
SELECT JSON_LENGTH(JSON_ARRAYAGG(DISTINCT yr)), JSON_CONTAINS(JSON_ARRAYAGG(DISTINCT yr), '2024'), JSON_CONTAINS(JSON_ARRAYAGG(DISTINCT yr), 'null') FROM t_arr_typed;
➤ JSON_LENGTH(JSON_ARRAYAGG(distinct yr))[-5,64,0]  ¦  JSON_CONTAINS(JSON_ARRAYAGG(distinct yr), 2024)[-5,64,0]  ¦  JSON_CONTAINS(JSON_ARRAYAGG(distinct yr), null)[-5,64,0]  𝄀
2  ¦  1  ¦  1
SET @json_arrayagg_year = '2025';
PREPARE json_arrayagg_typed FROM 'SELECT JSON_ARRAYAGG(CAST(? AS YEAR))';
EXECUTE json_arrayagg_typed USING @json_arrayagg_year;
➤ JSON_ARRAYAGG(cast(? as year))[-1,2147483647,0]  𝄀
[2025]
DEALLOCATE PREPARE json_arrayagg_typed;
DROP TABLE t_arr_typed;
CREATE TABLE t_obj_ext(g INT, pos INT, k VARCHAR(20), v INT);
INSERT INTO t_obj_ext VALUES
(1,1,'alpha',10),
(1,2,'beta',20),
(1,3,'alpha',30),
(1,4,'gamma',40),
(2,1,'north',100),
(2,2,'south',200),
(2,3,'north',300),
(2,4,'east',400),
(2,5,'west',500);
SELECT g, JSON_OBJECTAGG(k,v) AS obj_map FROM (SELECT g, pos, k, v FROM t_obj_ext ORDER BY g, pos) AS s GROUP BY g ORDER BY g;
g    obj_map
1    {"alpha": 30, "beta": 20, "gamma": 40}
2    {"east": 400, "north": 300, "south": 200, "west": 500}
DROP TABLE t_obj_ext;
create database test_json;
use test_json;
drop table if exists products;
CREATE TABLE products (
id INT,
name VARCHAR(50),
price DECIMAL(10,2),
category VARCHAR(30)
);
INSERT INTO products VALUES
(1, 'iPhone', 999.99, 'Electronics'),
(2, 'MacBook', 1299.99, 'Electronics'),
(3, 'Coffee Mug', 15.99, 'Home'),
(4, 'Desk Chair', 199.99, 'Furniture');
SELECT JSON_OBJECTAGG(name, price) as products_prices
FROM products;
➤ products_prices[-1,2147483647,0]  𝄀
{"Coffee Mug": 15.99, "Desk Chair": 199.99, "MacBook": 1299.99, "iPhone": 999.99}
SELECT
category,
JSON_OBJECTAGG(name, price) as category_products
FROM products
GROUP BY category;
➤ category[12,-1,0]  ¦  category_products[-1,2147483647,0]  𝄀
Electronics  ¦  {"MacBook": 1299.99, "iPhone": 999.99}  𝄀
Home  ¦  {"Coffee Mug": 15.99}  𝄀
Furniture  ¦  {"Desk Chair": 199.99}
SELECT JSON_OBJECTAGG(
name,
JSON_OBJECT('price', price, 'category', category, 'id', id)
) as detailed_products
FROM products;
➤ detailed_products[-1,2147483647,0]  𝄀
{"Coffee Mug": {"category": "Home", "id": 3, "price": 15.99}, "Desk Chair": {"category": "Furniture", "id": 4, "price": 199.99}, "MacBook": {"category": "Electronics", "id": 2, "price": 1299.99}, "iPhone": {"category": "Electronics", "id": 1, "price": 999.99}}
SELECT
category,
COUNT(*) as product_count,
AVG(price) as avg_price,
JSON_OBJECTAGG(name, price) as products
FROM products
GROUP BY category;
➤ category[12,-1,0]  ¦  product_count[-5,64,0]  ¦  avg_price[3,18,8]  ¦  products[-1,2147483647,0]  𝄀
Electronics  ¦  2  ¦  1149.99000000  ¦  {"MacBook": 1299.99, "iPhone": 999.99}  𝄀
Home  ¦  1  ¦  15.99000000  ¦  {"Coffee Mug": 15.99}  𝄀
Furniture  ¦  1  ¦  199.99000000  ¦  {"Desk Chair": 199.99}
drop table products;
drop table if exists app_configs;
create table app_configs (
app_name VARCHAR(50),
config_key VARCHAR(50),
config_value TEXT
);
INSERT INTO app_configs VALUES
('web_app', 'database_host', '192.168.1.100'),
('web_app', 'database_port', '3306'),
('web_app', 'redis_host', '192.168.1.101'),
('web_app', 'redis_port', '6379'),
('web_app', 'log_level', 'INFO'),
('web_app', 'max_connections', '100'),
('api_service', 'port', '8080'),
('api_service', 'timeout', '30'),
('api_service', 'rate_limit', '1000'),
('api_service', 'auth_enabled', 'true'),
('api_service', 'cors_origins', '*'),
('message_queue', 'broker_url', 'amqp://localhost:5672'),
('message_queue', 'queue_name', 'task_queue'),
('message_queue', 'prefetch_count', '10'),
('message_queue', 'retry_attempts', '3'),
('cache_service', 'redis_cluster', '192.168.1.101:6379,192.168.1.102:6379'),
('cache_service', 'ttl_seconds', '3600'),
('cache_service', 'max_memory', '2GB');
SELECT
app_name,
JSON_OBJECTAGG(config_key, config_value) as app_config
FROM app_configs
GROUP BY app_name;
➤ app_name[12,-1,0]  ¦  app_config[-1,2147483647,0]  𝄀
web_app  ¦  {"database_host": "192.168.1.100", "database_port": "3306", "log_level": "INFO", "max_connections": "100", "redis_host": "192.168.1.101", "redis_port": "6379"}  𝄀
api_service  ¦  {"auth_enabled": "true", "cors_origins": "*", "port": "8080", "rate_limit": "1000", "timeout": "30"}  𝄀
message_queue  ¦  {"broker_url": "amqp://localhost:5672", "prefetch_count": "10", "queue_name": "task_queue", "retry_attempts": "3"}  𝄀
cache_service  ¦  {"max_memory": "2GB", "redis_cluster": "192.168.1.101:6379,192.168.1.102:6379", "ttl_seconds": "3600"}
SELECT
app_name,
JSON_OBJECTAGG(config_key, config_value) as app_config
FROM app_configs
WHERE app_name = 'web_app'
GROUP BY app_name;
➤ app_name[12,-1,0]  ¦  app_config[-1,2147483647,0]  𝄀
web_app  ¦  {"database_host": "192.168.1.100", "database_port": "3306", "log_level": "INFO", "max_connections": "100", "redis_host": "192.168.1.101", "redis_port": "6379"}
SELECT
app_name,
CASE
WHEN config_key LIKE 'database_%' THEN 'database'
WHEN config_key LIKE 'redis_%' THEN 'redis'
ELSE 'general'
END as config_type,
JSON_OBJECTAGG(config_key, config_value) as configs
FROM app_configs
WHERE app_name = 'web_app'
GROUP BY app_name, config_type;
➤ app_name[12,-1,0]  ¦  config_type[12,-1,0]  ¦  configs[-1,2147483647,0]  𝄀
web_app  ¦  database  ¦  {"database_host": "192.168.1.100", "database_port": "3306"}  𝄀
web_app  ¦  redis  ¦  {"redis_host": "192.168.1.101", "redis_port": "6379"}  𝄀
web_app  ¦  general  ¦  {"log_level": "INFO", "max_connections": "100"}
SELECT
app_name,
COUNT(*) as config_count,
JSON_OBJECTAGG(config_key, config_value) as all_configs
FROM app_configs
GROUP BY app_name
ORDER BY config_count DESC;
➤ app_name[12,-1,0]  ¦  config_count[-5,64,0]  ¦  all_configs[-1,2147483647,0]  𝄀
web_app  ¦  6  ¦  {"database_host": "192.168.1.100", "database_port": "3306", "log_level": "INFO", "max_connections": "100", "redis_host": "192.168.1.101", "redis_port": "6379"}  𝄀
api_service  ¦  5  ¦  {"auth_enabled": "true", "cors_origins": "*", "port": "8080", "rate_limit": "1000", "timeout": "30"}  𝄀
message_queue  ¦  4  ¦  {"broker_url": "amqp://localhost:5672", "prefetch_count": "10", "queue_name": "task_queue", "retry_attempts": "3"}  𝄀
cache_service  ¦  3  ¦  {"max_memory": "2GB", "redis_cluster": "192.168.1.101:6379,192.168.1.102:6379", "ttl_seconds": "3600"}
drop table app_configs;
drop table if exists user_attributes;
CREATE TABLE user_attributes (
user_id INT,
attribute_name VARCHAR(50),
attribute_value VARCHAR(255)
);
INSERT INTO user_attributes VALUES
(1, 'name', 'Alice Johnson'),
(1, 'email', 'alice@example.com'),
(1, 'age', '28'),
(1, 'city', 'New York'),
(1, 'department', 'Engineering'),
(1, 'role', 'Senior Developer'),
(1, 'join_date', '2020-03-15'),
(2, 'name', 'Bob Smith'),
(2, 'email', 'bob@example.com'),
(2, 'age', '35'),
(2, 'city', 'San Francisco'),
(2, 'department', 'Marketing'),
(2, 'role', 'Marketing Manager'),
(2, 'join_date', '2019-07-22'),
(3, 'name', 'Carol Davis'),
(3, 'email', 'carol@example.com'),
(3, 'age', '31'),
(3, 'city', 'Chicago'),
(3, 'department', 'Engineering'),
(3, 'role', 'Tech Lead'),
(3, 'join_date', '2018-11-08');
SELECT
user_id,
JSON_OBJECTAGG(attribute_name, attribute_value) as user_profile
FROM user_attributes
GROUP BY user_id;
➤ user_id[4,32,0]  ¦  user_profile[-1,2147483647,0]  𝄀
1  ¦  {"age": "28", "city": "New York", "department": "Engineering", "email": "alice@example.com", "join_date": "2020-03-15", "name": "Alice Johnson", "role": "Senior Developer"}  𝄀
2  ¦  {"age": "35", "city": "San Francisco", "department": "Marketing", "email": "bob@example.com", "join_date": "2019-07-22", "name": "Bob Smith", "role": "Marketing Manager"}  𝄀
3  ¦  {"age": "31", "city": "Chicago", "department": "Engineering", "email": "carol@example.com", "join_date": "2018-11-08", "name": "Carol Davis", "role": "Tech Lead"}
drop table user_attributes;
drop table if exists form_fields;
CREATE TABLE form_fields (
form_name VARCHAR(50),
field_name VARCHAR(50),
field_config TEXT
);
INSERT INTO form_fields VALUES
('user_registration', 'username', '{"type": "text", "required": true, "minLength": 3}'),
('user_registration', 'email', '{"type": "email", "required": true}'),
('user_registration', 'password', '{"type": "password", "required": true, "minLength": 8}'),
('user_registration', 'age', '{"type": "number", "min": 18, "max": 120}');
SELECT
form_name,
JSON_OBJECTAGG(field_name, JSON_EXTRACT(field_config, '$')) as form_schema
FROM form_fields
GROUP BY form_name;
➤ form_name[12,-1,0]  ¦  form_schema[-1,2147483647,0]  𝄀
user_registration  ¦  {"age": {"max": 120, "min": 18, "type": "number"}, "email": {"required": true, "type": "email"}, "password": {"minLength": 8, "required": true, "type": "password"}, "username": {"minLength": 3, "required": true, "type": "text"}}
drop table form_fields;
drop table if exists i18n_texts;
CREATE TABLE i18n_texts (
text_key VARCHAR(100),
language VARCHAR(10),
text_value TEXT
);
INSERT INTO i18n_texts VALUES
('welcome_message', 'en', 'Welcome to our application'),
('welcome_message', 'zh', '欢迎使用我们的应用'),
('welcome_message', 'es', 'Bienvenido a nuestra aplicación'),
('login_button', 'en', 'Login'),
('login_button', 'zh', '登录'),
('login_button', 'es', 'Iniciar sesión');
SELECT
text_key,
JSON_OBJECTAGG(language, text_value) as translations
FROM i18n_texts
GROUP BY text_key;
➤ text_key[12,-1,0]  ¦  translations[-1,2147483647,0]  𝄀
welcome_message  ¦  {"en": "Welcome to our application", "es": "Bienvenido a nuestra aplicación", "zh": "欢迎使用我们的应用"}  𝄀
login_button  ¦  {"en": "Login", "es": "Iniciar sesión", "zh": "登录"}
drop table i18n_texts;
DROP TABLE IF EXISTS t_json_opaque_agg;
CREATE TABLE t_json_opaque_agg (
id INT,
bit_value BIT(8),
binary_value BINARY(3),
varbinary_value VARBINARY(3),
blob_value BLOB
);
INSERT INTO t_json_opaque_agg VALUES
(1, b'10101010', X'00FF41', X'00FF41', X'00'),
(2, NULL, NULL, UNHEX(''), NULL);
SELECT id,
JSON_ARRAYAGG(bit_value) AS bit_array,
JSON_ARRAYAGG(binary_value) AS binary_array,
JSON_ARRAYAGG(varbinary_value) AS varbinary_array,
JSON_ARRAYAGG(blob_value) AS blob_array
FROM t_json_opaque_agg GROUP BY id ORDER BY id;
➤ id[4,32,0]  ¦  bit_array[-1,2147483647,0]  ¦  binary_array[-1,2147483647,0]  ¦  varbinary_array[-1,2147483647,0]  ¦  blob_array[-1,2147483647,0]  𝄀
1  ¦  ["base64:type16:qg=="]  ¦  ["base64:type254:AP9B"]  ¦  ["base64:type15:AP9B"]  ¦  ["base64:type252:AA=="]  𝄀
2  ¦  [null]  ¦  [null]  ¦  ["base64:type15:"]  ¦  [null]
SELECT
JSON_OBJECTAGG(CAST(id AS CHAR), bit_value) AS bit_object,
JSON_OBJECTAGG(CAST(id AS CHAR), binary_value) AS binary_object,
JSON_OBJECTAGG(CAST(id AS CHAR), varbinary_value) AS varbinary_object,
JSON_OBJECTAGG(CAST(id AS CHAR), blob_value) AS blob_object
FROM t_json_opaque_agg WHERE id = 1;
➤ bit_object[-1,2147483647,0]  ¦  binary_object[-1,2147483647,0]  ¦  varbinary_object[-1,2147483647,0]  ¦  blob_object[-1,2147483647,0]  𝄀
{"1": "base64:type16:qg=="}  ¦  {"1": "base64:type254:AP9B"}  ¦  {"1": "base64:type15:AP9B"}  ¦  {"1": "base64:type252:AA=="}
SELECT JSON_ARRAYAGG(varbinary_value) AS empty_array
FROM t_json_opaque_agg WHERE id = 99;
➤ empty_array[-1,2147483647,0]  𝄀
NULL
DROP TABLE t_json_opaque_agg;
drop database test_json;
