CREATE TABLE users (
id INT PRIMARY KEY,
info JSON
);
INSERT INTO users (id, info) VALUES
(1, '{"name": "Alice", "age": 30, "email": "alice@example.com", "address": {"city": "New York", "zip": "10001"}}'),
(2, '{"name": "Bob", "age": 25, "email": "bob@example.com", "address": {"city": "Los Angeles", "zip": "90001"}}'),
(3, '{"name": "Charlie", "age": 28, "email": "charlie@example.com", "address": {"city": "Chicago", "zip": "60601"}, "skills": ["Java", "Python"]}');
SELECT * FROM users;
id    info
1    {"address": {"city": "New York", "zip": "10001"}, "age": 30, "email": "alice@example.com", "name": "Alice"}
2    {"address": {"city": "Los Angeles", "zip": "90001"}, "age": 25, "email": "bob@example.com", "name": "Bob"}
3    {"address": {"city": "Chicago", "zip": "60601"}, "age": 28, "email": "charlie@example.com", "name": "Charlie", "skills": ["Java", "Python"]}
UPDATE users
SET info = JSON_INSERT(info, '$.phone', '123-456-7890')
WHERE id = 1;
SELECT * FROM users;
id    info
2    {"address": {"city": "Los Angeles", "zip": "90001"}, "age": 25, "email": "bob@example.com", "name": "Bob"}
3    {"address": {"city": "Chicago", "zip": "60601"}, "age": 28, "email": "charlie@example.com", "name": "Charlie", "skills": ["Java", "Python"]}
1    {"address": {"city": "New York", "zip": "10001"}, "age": 30, "email": "alice@example.com", "name": "Alice", "phone": "123-456-7890"}
UPDATE users
SET info = JSON_INSERT(info, '$.address.state', 'CA')
WHERE id = 2;
SELECT * FROM users;
id    info
3    {"address": {"city": "Chicago", "zip": "60601"}, "age": 28, "email": "charlie@example.com", "name": "Charlie", "skills": ["Java", "Python"]}
1    {"address": {"city": "New York", "zip": "10001"}, "age": 30, "email": "alice@example.com", "name": "Alice", "phone": "123-456-7890"}
2    {"address": {"city": "Los Angeles", "state": "CA", "zip": "90001"}, "age": 25, "email": "bob@example.com", "name": "Bob"}
UPDATE users
SET info = JSON_INSERT(info, '$.skills[2]', 'SQL')
WHERE id = 3;
SELECT * FROM users;
id    info
1    {"address": {"city": "New York", "zip": "10001"}, "age": 30, "email": "alice@example.com", "name": "Alice", "phone": "123-456-7890"}
2    {"address": {"city": "Los Angeles", "state": "CA", "zip": "90001"}, "age": 25, "email": "bob@example.com", "name": "Bob"}
3    {"address": {"city": "Chicago", "zip": "60601"}, "age": 28, "email": "charlie@example.com", "name": "Charlie", "skills": ["Java", "Python", "SQL"]}
UPDATE users
SET info = JSON_INSERT(info, '$.phone', '123-456-7890', '$.address.state', 'NY')
WHERE id = 1;
SELECT * FROM users;
id    info
2    {"address": {"city": "Los Angeles", "state": "CA", "zip": "90001"}, "age": 25, "email": "bob@example.com", "name": "Bob"}
3    {"address": {"city": "Chicago", "zip": "60601"}, "age": 28, "email": "charlie@example.com", "name": "Charlie", "skills": ["Java", "Python", "SQL"]}
1    {"address": {"city": "New York", "state": "NY", "zip": "10001"}, "age": 30, "email": "alice@example.com", "name": "Alice", "phone": "123-456-7890"}
drop table users;
