set time_zone="+00:00";
SELECT IF(NULL AND 1, 1, 2), IF(1 AND NULL, 1, 2);
➤ IF(null and 1, 1, 2)[-5,64,0]  ¦  IF(1 and null, 1, 2)[-5,64,0]  𝄀
2  ¦  2
create table t1 (a int);
insert into t1 values (0),(1),(NULL);
SELECT * FROM t1 WHERE IF(a AND 1, 0, 1);
➤ a[4,32,0]  𝄀
0  𝄀
null
SELECT * FROM t1 WHERE IF(1 AND a, 0, 1);
➤ a[4,32,0]  𝄀
0  𝄀
null
drop table t1;
drop table if exists t;
CREATE TABLE t (i1 INT,
d1 DOUBLE,
e2 DECIMAL(5,2));
INSERT INTO t VALUES ( 6,    6.0,  10.0/3),
( null, 9.0,  10.0/3),
( 1,    null, 10.0/3),
( 2,    2.0,  null  );
SELECT coalesce(e2,i1) nullif_c, IF(e2 IS NULL,i1,e2) if_c, SUM(d1) FROM t GROUP BY e2,i1 ORDER BY nullif_c, SUM(d1);
➤ nullif_c[3,12,2]  ¦  if_c[3,12,2]  ¦  SUM(d1)[8,54,0]  𝄀
2.00  ¦  2.00  ¦  2.0  𝄀
3.33  ¦  3.33  ¦  null  𝄀
3.33  ¦  3.33  ¦  6.0  𝄀
3.33  ¦  3.33  ¦  9.0
DROP TABLE t;
CREATE TABLE source(bt INTEGER, bf INTEGER, i8u BIGINT UNSIGNED, i8s BIGINT);
INSERT INTO source VALUES
(1,0,0,-9223372036854775808), (1,0,18446744073709551615,9223372036854775807);
SELECT IF(bt,i8u,i8s) AS u, IF(bf,i8u,i8s) AS s
FROM source;
Data truncation: data out of range: data type int64, value '18446744073709551615'
DROP TABLE source;
create table t1 (num  double(12,2));
insert into t1 values (144.54);
select sum(if(num is null,0.00,num)) from t1;
➤ sum(if(num is null, 0.00, num))[8,54,0]  𝄀
144.54
drop table t1;
select if(1, cast(1111111111111111111 as unsigned), 1) i, case when 1 then cast(1111111111111111111 as unsigned) else 1 end c, coalesce(cast(1111111111111111111 as unsigned), 1) co;
➤ i[-5,64,0]  ¦  c[-5,64,0]  ¦  co[-5,64,0]  𝄀
1111111111111111111  ¦  1111111111111111111  ¦  1111111111111111111
create table t1 (a bigint unsigned);
insert into t1 select (if(1, 9223372036854775808, 1));
Data truncation: data out of range: data type int64, value '9223372036854775808'
insert into t1 select (case when 1 then 9223372036854775808 else 1 end);
Data truncation: data out of range: data type int64, value '9223372036854775808'
insert into t1 select (coalesce(9223372036854775808, 1));
Data truncation: data out of range: data type int64, value '9223372036854775808'
select * from t1;
➤ a[-5,64,0]
drop table t1;
drop table if exists t;
CREATE TABLE t (i1 INT,
d1 DOUBLE,
e2 DECIMAL(5,2));
INSERT INTO t VALUES ( 6,    6.0,  10.0/3),
( null, 9.0,  10.0/3),
( 1,    null, 10.0/3),
( 2,    2.0,  null  );
SELECT IF(e2 IS NULL,i1,e2) if_c,
SUM(d1) FROM t
GROUP BY e2,i1 ORDER BY SUM(d1);
➤ if_c[3,12,2]  ¦  SUM(d1)[8,54,0]  𝄀
3.33  ¦  null  𝄀
2.00  ¦  2.0  𝄀
3.33  ¦  6.0  𝄀
3.33  ¦  9.0
DROP TABLE t;
create table t1 (f1 int, f2 int);
insert into t1 values (0,1),(1,2);
select count(distinct if(f1,3,f2)) from t1;
➤ count(distinct if(f1, 3, f2))[-5,64,0]  𝄀
2
drop table t1;
CREATE TABLE `t2` (
`CONCAT_WS(' ',a)` varchar(9) DEFAULT NULL,
`IF(a,a,'')` varchar(9) DEFAULT NULL,
`CASE WHEN a THEN a ELSE '' END` varchar(9) DEFAULT NULL,
`COALESCE(a,'')` varchar(9) NOT NULL DEFAULT ''
);
DROP TABLE t2;
CREATE TABLE t1 (a INT);
SELECT a FROM t1 WHERE a IN(1, (SELECT IF(1=0,1,2/1)));
➤ a[4,32,0]
INSERT INTO t1 VALUES(1);
SELECT a FROM t1 WHERE a IN(1, (SELECT IF(1=0,1,2/1)));
➤ a[4,32,0]  𝄀
1
INSERT INTO t1 VALUES(2),(3);
SELECT a FROM t1 WHERE a IN(1, (SELECT IF(1=0,1,2/1)));
➤ a[4,32,0]  𝄀
1  𝄀
2
DROP TABLE t1;
select IF(0,"ERROR","this"),IF(1,"is","ERROR"),IF(NULL,"ERROR","a"),IF(1,2,3)|0,IF(1,2.0,3.0)+0 ;
➤ IF(0, ERROR, this)[12,-1,0]  ¦  IF(1, is, ERROR)[12,-1,0]  ¦  IF(null, ERROR, a)[12,-1,0]  ¦  IF(1, 2, 3) | 0[-5,64,0]  ¦  IF(1, 2.0, 3.0) + 0[3,38,1]  𝄀
this  ¦  is  ¦  a  ¦  2  ¦  2.0
CREATE TABLE t1 (st varchar(255) NOT NULL, u int(11) NOT NULL);
[unknown result because it is related to issue#3334]
INSERT INTO t1 VALUES ('a',1),('A',1),('aa',1),('AA',1),('a',1),('aaa',0),('BBB',0);
[unknown result because it is related to issue#3334]
select if(1,st,st) s from t1 order by s;
[unknown result because it is related to issue#3334]
select if(u=1,st,st) s from t1 order by s;
[unknown result because it is related to issue#3334]
select if(u=1,st,st) s from t1 where st like "%a%" order by s;
[unknown result because it is related to issue#3334]
drop table t1;
[unknown result because it is related to issue#3334]
create table t1 (num  double(12,2));
insert into t1 values (144.54);
select sum(if(num is null,0.00,num)) from t1;
➤ sum(if(num is null, 0.00, num))[8,54,0]  𝄀
144.54
drop table t1;
create table t1 (x int, y int);
insert into t1 values (0,6),(10,16),(20,26),(30,10),(40,46),(50,56);
select min(if(y -x > 5,y,NULL)), max(if(y - x > 5,y,NULL)) from t1;
➤ min(if(y - x > 5, y, null))[4,32,0]  ¦  max(if(y - x > 5, y, null))[4,32,0]  𝄀
6  ¦  56
drop table t1;
create table t1 (a int);
insert t1 values (1),(2);
select if(1>2,a,avg(a)) from t1;
SQL syntax error: column "t1.a" must appear in the GROUP BY clause or be used in an aggregate function
drop table t1;
CREATE TABLE `t1` (
`id` int(11) NOT NULL ,
`date` int(10) default NULL,
`text` varchar(32) NOT NULL
);
INSERT INTO t1 VALUES (1,1110000000,'Day 1'),(2,1111000000,'Day 2'),(3,1112000000,'Day 3');
SELECT id, IF(date IS NULL, '-', FROM_UNIXTIME(date, '%d-%m-%Y')) AS date_ord, text FROM t1 ORDER BY date_ord ASC;
➤ id[4,32,0]  ¦  date_ord[12,-1,0]  ¦  text[12,-1,0]  𝄀
1  ¦  05-03-2005  ¦  Day 1  𝄀
2  ¦  16-03-2005  ¦  Day 2  𝄀
3  ¦  28-03-2005  ¦  Day 3
SELECT id, IF(date IS NULL, '-', FROM_UNIXTIME(date, '%d-%m-%Y')) AS date_ord, text FROM t1 ORDER BY date_ord DESC;
➤ id[4,32,0]  ¦  date_ord[12,-1,0]  ¦  text[12,-1,0]  𝄀
3  ¦  28-03-2005  ¦  Day 3  𝄀
2  ¦  16-03-2005  ¦  Day 2  𝄀
1  ¦  05-03-2005  ¦  Day 1
DROP TABLE t1;
create table t1 (f1 int, f2 int);
insert into t1 values(1,1),(0,0);
select f1, any_value(f2), if(f1, 40.0, 5.00) from t1 group by f1;
➤ f1[4,32,0]  ¦  any_value(f2)[4,32,0]  ¦  if(f1, 40.0, 5.00)[3,19,2]  𝄀
1  ¦  1  ¦  40.00  𝄀
0  ¦  0  ¦  5.00
drop table t1;
select if(0, 18446744073709551610, 18446744073709551610);
➤ if(0, 18446744073709551610, 18446744073709551610)[-5,64,0]  𝄀
18446744073709551610
CREATE TABLE t1(a DECIMAL(10,3));
SELECT t1.a,
IF((ROUND(t1.a,2)=1), 2,
IF((ROUND(t1.a,2)=1), 2,
IF((ROUND(t1.a,2)=1), 2,
IF((ROUND(t1.a,2)=1), 2,0)))) + 1 FROM t1;
➤ a[3,10,3]  ¦  IF((ROUND(t1.a, 2) = 1), 2, IF((ROUND(t1.a, 2) = 1), 2, IF((ROUND(t1.a, 2) = 1), 2, IF((ROUND(t1.a, 2) = 1), 2, 0)))) + 1[-5,64,0]
DROP TABLE t1;
CREATE TABLE t1 (c varchar(255));
INSERT INTO t1 VALUES(1), (2), (3), (4), ('12345678901234567890');
SELECT * FROM (SELECT MAX(IF(1, CAST(c AS UNSIGNED), 0)) FROM t1) AS te;
Data truncation: data out of range: data type int64, value '12345678901234567890'
DROP TABLE t1;
CREATE TABLE t1 (a int, b DOUBLE);
[unknown result because it is related to issue#3265]
INSERT INTO t1 VALUES (NULL, 0), (NULL, 1);
[unknown result because it is related to issue#3265]
SELECT IF(b, (SELECT a FROM t1 LIMIT 1), b) c FROM t1 GROUP BY c;
[unknown result because it is related to issue#3265]
DROP TABLE t1;
[unknown result because it is related to issue#3265]
SELECT if(0, (SELECT min('hello')), NULL);
➤ if(0, (select min(hello)), null)[12,-1,0]  𝄀
null
SELECT if(1, (SELECT min('hello')), NULL);
➤ if(1, (select min(hello)), null)[12,-1,0]  𝄀
hello
SELECT if(0, NULL, (SELECT min('hello')));
➤ if(0, null, (select min(hello)))[12,-1,0]  𝄀
hello
SELECT if(1, NULL, (SELECT min('hello')));
➤ if(1, null, (select min(hello)))[12,-1,0]  𝄀
null
CREATE TABLE t1(c1 INT);
INSERT INTO t1 VALUES(1);
UPDATE t1 SET c1 = 2 WHERE IF(true, '2015-01-01', '2015-01-01') IS NOT NULL;
DROP TABLE t1;
CREATE TABLE test_grids_1 (
unq_id int(11) NOT NULL DEFAULT 0,
var_fld int(11) DEFAULT 0
);
INSERT INTO test_grids_1 VALUES
(1,4500),
(2,6000);
CREATE TABLE test_grid_dtl_1 (
dtl_id int(11) NOT NULL DEFAULT 0,
unq_id int(11) DEFAULT 0
);
INSERT INTO test_grid_dtl_1 VALUES
(1,1),
(2,1),
(3,2);
SELECT g.calc_var, g.if_var, g.case_var
FROM
(
SELECT unq_id,
IF ( var_fld  > 5000, (     1 / var_fld ) , 5000 ) calc_var,
IF ( var_fld  > 5000, ( 00001 / var_fld ) , 5000 ) if_var,
CASE  var_fld  > 5000 WHEN TRUE THEN ( 1 / var_fld ) ELSE 5000 END case_var
FROM
test_grids_1
) g
JOIN
test_grid_dtl_1 d USING (unq_id)
ORDER BY 1
;
➤ calc_var[8,54,0]  ¦  if_var[8,54,0]  ¦  case_var[8,54,0]  𝄀
1.6666666666666666E-4  ¦  1.6666666666666666E-4  ¦  1.6666666666666666E-4  𝄀
5000.0  ¦  5000.0  ¦  5000.0  𝄀
5000.0  ¦  5000.0  ¦  5000.0
DROP TABLE test_grids_1;
drop table test_grid_dtl_1;
CREATE TABLE t1(a INT,b INT,c INT);
INSERT INTO t1 VALUES(1,0,0),(1,2,0),(1,0,3),(1,2,3);
SELECT if(c = 0, if(b = 0, a, a / b), if(b = 0, a / c, a / b / c)) FROM t1;
➤ if(c = 0, if(b = 0, a, a / b), if(b = 0, a / c, a / b / c))[8,54,0]  𝄀
1.0  𝄀
0.5  𝄀
0.3333333333333333  𝄀
0.16666666666666666
DROP TABLE t1;
SET SESSION sql_mode = '';
SELECT IF(NULL, 'T', 'F') AS if_null_false;
➤ if_null_false[12,-1,0]  𝄀
F
SELECT IF('0', 'T', 'F') AS if_string_zero_false;
➤ if_string_zero_false[12,-1,0]  𝄀
F
SELECT IF('  -2.5 ', 'T', 'F') AS if_string_decimal_true;
➤ if_string_decimal_true[12,-1,0]  𝄀
T
SELECT IF('+0x10', 'T', 'F') AS if_hex_positive_true;
➤ if_hex_positive_true[12,-1,0]  𝄀
T
SELECT IF('-0x10', 'T', 'F') AS if_hex_negative_true;
➤ if_hex_negative_true[12,-1,0]  𝄀
T
SELECT IF('0b1010', 'T', 'F') AS if_binary_prefix_true;
➤ if_binary_prefix_true[12,-1,0]  𝄀
T
SELECT IF('0o17', 'T', 'F') AS if_octal_prefix_true;
➤ if_octal_prefix_true[12,-1,0]  𝄀
T
SELECT IF('NaN', 'T', 'F') AS if_nan_true;
➤ if_nan_true[12,-1,0]  𝄀
T
SELECT IF('Inf', 'T', 'F') AS if_inf_true;
➤ if_inf_true[12,-1,0]  𝄀
T
SELECT IF(CAST(0 AS DOUBLE), 'T', 'F') AS if_double_zero_false;
➤ if_double_zero_false[12,-1,0]  𝄀
F
SELECT IF(CAST(-0.1 AS DOUBLE), 'T', 'F') AS if_double_nonzero_true;
➤ if_double_nonzero_true[12,-1,0]  𝄀
T
SELECT IF(1E0, 'T', 'F') AS if_double_exponent_true;
➤ if_double_exponent_true[12,-1,0]  𝄀
T
SELECT IF(CAST(0 AS DECIMAL(3,1)), 'T', 'F') AS if_decimal_zero_false;
➤ if_decimal_zero_false[12,-1,0]  𝄀
F
SELECT IF(CAST(0.1 AS DECIMAL(3,1)), 'T', 'F') AS if_decimal_nonzero_true;
➤ if_decimal_nonzero_true[12,-1,0]  𝄀
T
CREATE TABLE if_condition_bit(id INT, b BIT(1));
INSERT INTO if_condition_bit VALUES (1, b'0'), (2, b'1'), (3, NULL);
SELECT IF(b, 'T', 'F') AS if_bit_zero_false FROM if_condition_bit WHERE id = 1;
➤ if_bit_zero_false[12,-1,0]  𝄀
F
SELECT IF(b, 'T', 'F') AS if_bit_nonzero_true FROM if_condition_bit WHERE id = 2;
➤ if_bit_nonzero_true[12,-1,0]  𝄀
T
SELECT IF(b, 'T', 'F') AS if_bit_null_false FROM if_condition_bit WHERE id = 3;
➤ if_bit_null_false[12,-1,0]  𝄀
F
DROP TABLE if_condition_bit;
SELECT IF(CAST('0x10' AS VARBINARY), 'T', 'F') AS if_varbinary_hex_true;
➤ if_varbinary_hex_true[12,-1,0]  𝄀
T
SELECT IF(CAST('0x10' AS BLOB), 'T', 'F') AS if_blob_hex_true;
➤ if_blob_hex_true[12,-1,0]  𝄀
T
SELECT IF(X'3136', 'T', 'F') AS if_binary_text_16_true;
➤ if_binary_text_16_true[12,-1,0]  𝄀
T
SELECT IF(X'10', 'T', 'F') AS if_raw_binary_byte_true;
➤ if_raw_binary_byte_true[12,-1,0]  𝄀
T
SELECT IF(CAST('0x10' AS BINARY(8)), 'T', 'F') AS if_fixed_binary_padding_error;
invalid input: "10\x00\x00\x00\x00" is invalid numeric string
SELECT IF('1abc', 'T', 'F') AS if_decimal_prefix_default_true;
➤ if_decimal_prefix_default_true[12,-1,0]  𝄀
T
SELECT IF('abc', 'T', 'F') AS if_invalid_string_default_false;
➤ if_invalid_string_default_false[12,-1,0]  𝄀
F
SELECT IF('  -2.5foo', 'T', 'F') AS if_signed_prefix_default_true;
➤ if_signed_prefix_default_true[12,-1,0]  𝄀
T
SELECT IF('', 'T', 'F') AS if_empty_string_default_false;
➤ if_empty_string_default_false[12,-1,0]  𝄀
F
SELECT IF('   ', 'T', 'F') AS if_whitespace_default_false;
➤ if_whitespace_default_false[12,-1,0]  𝄀
F
SELECT IF('.5xyz', 'T', 'F') AS if_fraction_prefix_default_true;
➤ if_fraction_prefix_default_true[12,-1,0]  𝄀
T
SELECT IF('1e2foo', 'T', 'F') AS if_exponent_prefix_default_true;
➤ if_exponent_prefix_default_true[12,-1,0]  𝄀
T
SELECT IF('1eabc', 'T', 'F') AS if_malformed_exponent_default_true;
➤ if_malformed_exponent_default_true[12,-1,0]  𝄀
T
SELECT IF('-0suffix', 'T', 'F') AS if_signed_zero_prefix_default_false;
➤ if_signed_zero_prefix_default_false[12,-1,0]  𝄀
F
SELECT IF('1e10000', 'T', 'F') AS if_float_overflow_default_true;
➤ if_float_overflow_default_true[12,-1,0]  𝄀
T
SELECT IF('0x', 'T', 'F') AS if_missing_hex_digits_default_error;
invalid input: "0x" is invalid numeric string
SELECT CAST('1abc' AS DOUBLE) AS cast_decimal_prefix_default;
➤ cast_decimal_prefix_default[8,54,0]  𝄀
1.0
SELECT CAST('abc' AS DOUBLE) AS cast_invalid_string_default_zero;
➤ cast_invalid_string_default_zero[8,54,0]  𝄀
0.0
SELECT CAST('  -2.5foo' AS DOUBLE) AS cast_signed_prefix_default;
➤ cast_signed_prefix_default[8,54,0]  𝄀
-2.5
SELECT CAST('' AS DOUBLE) AS cast_empty_string_default_zero;
➤ cast_empty_string_default_zero[8,54,0]  𝄀
0.0
PREPARE if_mode_literal FROM 'SELECT IF(''1abc'', ''T'', ''F'') AS prepared_if_literal';
EXECUTE if_mode_literal;
➤ prepared_if_literal[12,-1,0]  𝄀
T
SET @if_mode_value = '1eabc';
PREPARE if_mode_parameter FROM 'SELECT IF(?, ''T'', ''F'') AS prepared_if_parameter';
EXECUTE if_mode_parameter USING @if_mode_value;
➤ prepared_if_parameter[12,-1,0]  𝄀
T
SET SESSION sql_mode = 'MATRIXONE_NATIVE';
SELECT IF('0x10', 'T', 'F') AS if_hex_native_true;
➤ if_hex_native_true[12,-1,0]  𝄀
T
SELECT IF('0b1010', 'T', 'F') AS if_binary_prefix_native_true;
➤ if_binary_prefix_native_true[12,-1,0]  𝄀
T
SELECT IF('0o17', 'T', 'F') AS if_octal_prefix_native_true;
➤ if_octal_prefix_native_true[12,-1,0]  𝄀
T
SELECT IF('NaN', 'T', 'F') AS if_nan_native_true;
➤ if_nan_native_true[12,-1,0]  𝄀
T
SELECT IF('Inf', 'T', 'F') AS if_inf_native_true;
➤ if_inf_native_true[12,-1,0]  𝄀
T
SELECT IF('1abc', 'T', 'F') AS if_decimal_prefix_native_error;
invalid input: "1abc" is invalid numeric string
SELECT IF('abc', 'T', 'F') AS if_invalid_string_native_error;
invalid input: "abc" is invalid numeric string
SELECT IF('  -2.5foo', 'T', 'F') AS if_signed_suffix_native_error;
invalid input: "-2.5foo" is invalid numeric string
SELECT IF('', 'T', 'F') AS if_empty_string_native_error;
invalid input: "" is invalid numeric string
SELECT IF('   ', 'T', 'F') AS if_whitespace_native_error;
invalid input: "" is invalid numeric string
SELECT IF('.5xyz', 'T', 'F') AS if_fraction_suffix_native_error;
invalid input: ".5xyz" is invalid numeric string
SELECT IF('1e2foo', 'T', 'F') AS if_exponent_suffix_native_error;
invalid input: "1e2foo" is invalid numeric string
SELECT IF('1eabc', 'T', 'F') AS if_malformed_exponent_native_error;
invalid input: "1eabc" is invalid numeric string
SELECT IF('-0suffix', 'T', 'F') AS if_signed_zero_suffix_native_error;
invalid input: "-0suffix" is invalid numeric string
SELECT IF('true', 'T', 'F') AS if_bool_text_native_error;
invalid input: "true" is invalid numeric string
SELECT IF('0x', 'T', 'F') AS if_missing_hex_digits_native_error;
invalid input: "0x" is invalid numeric string
SELECT IF('1e10000', 'T', 'F') AS if_float_overflow_native_error;
invalid input: "1e10000" is invalid numeric string
SELECT CAST('1abc' AS DOUBLE) AS cast_decimal_prefix_native_error;
invalid input: "1abc" is invalid numeric string
SELECT CAST('abc' AS DOUBLE) AS cast_invalid_string_native_error;
invalid input: "abc" is invalid numeric string
SELECT CAST('  -2.5foo' AS DOUBLE) AS cast_signed_suffix_native_error;
invalid input: "-2.5foo" is invalid numeric string
SELECT CAST('' AS DOUBLE) AS cast_empty_string_native_error;
invalid input: "" is invalid numeric string
EXECUTE if_mode_literal;
invalid input: "1abc" is invalid numeric string
EXECUTE if_mode_parameter USING @if_mode_value;
invalid input: "1eabc" is invalid numeric string
SET SESSION sql_mode = '';
SELECT IF('1abc', 'T', 'F') AS if_decimal_prefix_after_reset_true;
➤ if_decimal_prefix_after_reset_true[12,-1,0]  𝄀
T
SELECT IF('abc', 'T', 'F') AS if_invalid_string_after_reset_false;
➤ if_invalid_string_after_reset_false[12,-1,0]  𝄀
F
EXECUTE if_mode_literal;
➤ prepared_if_literal[12,-1,0]  𝄀
T
EXECUTE if_mode_parameter USING @if_mode_value;
➤ prepared_if_parameter[12,-1,0]  𝄀
T
DEALLOCATE PREPARE if_mode_literal;
DEALLOCATE PREPARE if_mode_parameter;
SET SESSION sql_mode = default;
CREATE TABLE t1(id INT);
INSERT INTO t1 VALUES(1),(2),(3);
SELECT CASE WHEN id = 1 THEN 'string' WHEN id = 2 THEN 123 ELSE 'mixed' END AS mixed_case FROM t1 ORDER BY id;
➤ mixed_case[12,-1,0]  𝄀
string  𝄀
123  𝄀
mixed
DROP TABLE t1;
SET SESSION sql_mode = '';
SELECT IF(0, CAST('bad' AS SIGNED), 7) AS if_skip_true_branch,
CASE WHEN 0 THEN CAST('bad' AS SIGNED) ELSE 7 END AS case_skip_then,
COALESCE(5, CAST('bad' AS SIGNED)) AS coalesce_skip_later,
IFNULL(5, CAST('bad' AS SIGNED)) AS ifnull_skip_later;
➤ if_skip_true_branch[-5,64,0]  ¦  case_skip_then[-5,64,0]  ¦  coalesce_skip_later[-5,64,0]  ¦  ifnull_skip_later[-5,64,0]  𝄀
7  ¦  7  ¦  5  ¦  5
SET TIME_ZONE = "SYSTEM";
