select power(exp(10), log(100)),exp(power(2,2)),power(-1,1),power(NULL,0),power(1,1),power(3,9),power(-1,2),power(NULL,2);
power(exp(10), log(100))    exp(power(2, 2))    power(-1, 1)    power(null, 0)    power(1, 1)    power(3, 9)    power(-1, 2)    power(null, 2)
1.0000000000000046E20    54.598150033144236    -1.0    null    1.0    19683.0    1.0    null
SELECT POW(2, 3) AS result1;
result1
8.0
SELECT POW(2, 0) AS result2;
result2
1.0
SELECT POW(4, 0.5) AS result3;
result3
2.0
SELECT POWER(2, 3) AS result4;
result4
8.0
SELECT POWER(2, 0) AS result5;
result5
1.0
SELECT POWER(4, 0.5) AS result6;
result6
2.0
SELECT POW(-2, 0.5);
POW(-2, 0.5)
null
SELECT POWER(0, -1);
POWER(0, -1)
null
SELECT IF(0, POW(-2, 0.5), 1);
IF(0, POW(-2, 0.5), 1)
1.0
SELECT CASE WHEN 0 THEN POWER(0, -1) ELSE 1 END;
case when 0 then POWER(0, -1) else 1 end
1.0
SELECT POW(2, 3) = POWER(2, 3) AS same_result;
same_result
1
SELECT power(2,13);
power(2, 13)
8192.0
SELECT power(-2,-3);
power(-2, -3)
-0.125
SELECT power(2,100);
power(2, 100)
1.2676506002282294E30
SELECT power(10,100);
power(10, 100)
1.0000000000000002E100
SELECT power(1,100);
power(1, 100)
1.0
select power(2,-1);
power(2, -1)
0.5
select power(-2,1);
power(-2, 1)
-2.0
select power(0.00000000000000001,123413);
power(0.00000000000000001, 123413)
0.0
select power(10e100,-39413312);
power(10e100, -39413312)
0.0
select power(0.141241241241313, 124314124124.12412341);
power(0.141241241241313, 124314124124.12412341)
0.0
select power(null,2);
power(null, 2)
null
select power(2, null);
power(2, null)
null
select power(null,null);
power(null, null)
null
CREATE TABLE t1(a DOUBLE);
INSERT INTO t1 select (power(56,124));
INSERT INTO t1 select (power(10,100));
INSERT INTO t1 select (power(2,234));
SELECT * FROM t1 ORDER BY a;
a
2.7606985387162255E70
1.0000000000000002E100
5.96094821228998E216
drop table t1;
create table t1(a tinyint, b SMALLINT, c bigint, d INT, e BIGINT, f FLOAT, g DOUBLE, h decimal(38,19));
insert into t1 values(1, 1, 2, 4, 5, 5.5, 31.13, 14.314);
select power(a,b),power(b,c),power(c,d),power(d,e),power(e,f),power(f,g),power(g,h) from t1;
power(a, b)    power(b, c)    power(c, d)    power(d, e)    power(e, f)    power(f, g)    power(g, h)
1.0    1.0    16.0    1024.0    6987.712429686843    1.1155538103726188E23    2.362467993555654E21
drop table t1;
select power(123.54-123.03, 12-34);
power(123.54 - 123.03, 12 - 34)
2713039.5562672615
select power(123.54*0.34, 1203-1200);
power(123.54 * 0.34, 1203 - 1200)
74107.05283300664
select power(134,34)-power(194,44);
power(134, 34) - power(194, 44)
-4.605492898028417E100
drop table if exists t1;
create table t1(a float,  b float);
insert into t1 values(10, 100), (2, 5);
select distinct * from t1 where power(a, b)>0;
a    b
10.0    100.0
2.0    5.0
drop table t1;
create table t1(a INT, b int);
create table t2(a INT, b int);
insert into t1 values(2,4), (100,23);
insert into t2 values(10,100), (4,41);
SELECT t1.a, t2.a FROM t1 JOIN t2 ON (power(t1.a, t1.b) <> power(t2.a, t2.b));
a    a
2    10
2    4
100    10
100    4
drop table t1;
drop table t2;
SELECT POWER(-1, 0.5), POWER(0, -1), EXP(1000), COT(0);
POWER(-1, 0.5)    POWER(0, -1)    EXP(1000)    COT(0)
null    null    null    null
SELECT POWER(2, 1024) IS NULL, POWER(2, 1023) IS NOT NULL,
POWER(2, -1075) = 0, EXP(710) IS NULL, EXP(709) IS NOT NULL, EXP(-1000) = 0;
POWER(2, 1024) is null    POWER(2, 1023) is not null    POWER(2, -1075) = 0    EXP(710) is null    EXP(709) is not null    EXP(-1000) = 0
1    1    1    1    1    1
SELECT POWER(CAST(-2 AS DECIMAL(10,2)), CAST(0.5 AS DECIMAL(10,2))) IS NULL,
EXP(CAST(710 AS SIGNED)) IS NULL, COT(CAST(0 AS DOUBLE)) IS NULL;
POWER(cast(-2 as decimal(10, 2)), cast(0.5 as decimal(10, 2))) is null    EXP(cast(710 as signed)) is null    COT(cast(0 as double)) is null
1    1    1
DROP TABLE IF EXISTS math_null_src;
DROP TABLE IF EXISTS math_null_dst;
DROP TABLE IF EXISTS math_null_required;
CREATE TABLE math_null_src(id INT PRIMARY KEY, b DOUBLE, e DOUBLE, x DOUBLE, c DOUBLE);
INSERT INTO math_null_src VALUES (1,2,3,0,1), (2,-2,0.5,710,0), (3,4,0.5,-1000,-1), (4,NULL,NULL,NULL,NULL);
SELECT id, POWER(b,e), EXP(x), COT(c) IS NULL FROM math_null_src ORDER BY id;
id    POWER(b, e)    EXP(x)    COT(c) is null
1    8.0    1.0    0
2    null    null    1
3    2.0    0.0    0
4    null    null    1
SELECT id, POWER(b,0.5) IS NULL, POWER(-2,e) IS NULL FROM math_null_src ORDER BY id;
id    POWER(b, 0.5) is null    POWER(-2, e) is null
1    0    0
2    1    1
3    0    1
4    1    1
SELECT COUNT(*), COUNT(POWER(b,e)), SUM(POWER(b,e)), COUNT(EXP(x)), SUM(EXP(x)), COUNT(COT(c)) FROM math_null_src;
COUNT(*)    COUNT(POWER(b, e))    SUM(POWER(b, e))    COUNT(EXP(x))    SUM(EXP(x))    COUNT(COT(c))
4    2    10.0    2    1.0    2
SELECT id FROM math_null_src WHERE POWER(b,e) > 0 ORDER BY id;
id
1
3
SELECT id, IF(id=2, 7, POWER(b,e)), CASE WHEN id=2 THEN 7 ELSE EXP(x) END FROM math_null_src ORDER BY id;
id    IF(id = 2, 7, POWER(b, e))    case when id = 2 then 7 else EXP(x) end
1    8.0    1.0
2    7.0    7.0
3    2.0    0.0
4    null    null
CREATE TABLE math_null_dst(id INT, p DOUBLE, x DOUBLE, c DOUBLE);
INSERT INTO math_null_dst SELECT id, POWER(b,e), EXP(x), COT(c) FROM math_null_src;
SELECT id, p, x, c IS NULL FROM math_null_dst ORDER BY id;
id    p    x    c is null
1    8.0    1.0    0
2    null    null    1
3    2.0    0.0    0
4    null    null    1
UPDATE math_null_dst SET p=POWER(0,-1), x=EXP(710), c=COT(0) WHERE id=1;
SELECT id, p IS NULL, x IS NULL, c IS NULL FROM math_null_dst ORDER BY id;
id    p is null    x is null    c is null
1    1    1    1
2    1    1    1
3    0    0    0
4    1    1    1
CREATE TABLE math_null_required(v DOUBLE NOT NULL);
INSERT INTO math_null_required SELECT POWER(0,-1);
constraint violation: Column 'v' cannot be null
INSERT INTO math_null_required SELECT EXP(710);
constraint violation: Column 'v' cannot be null
INSERT INTO math_null_required SELECT COT(0);
constraint violation: Column 'v' cannot be null
INSERT INTO math_null_required SELECT POWER(b,e) FROM math_null_src;
constraint violation: Column 'v' cannot be null
SELECT COUNT(*) FROM math_null_required;
COUNT(*)
0
PREPARE math_null_stmt FROM 'SELECT POWER(?, ?), EXP(?), COT(?)';
SET @math_b=-2, @math_e=0.5, @math_x=710, @math_c=0;
EXECUTE math_null_stmt USING @math_b, @math_e, @math_x, @math_c;
POWER(?, ?)    EXP(?)    COT(?)
null    null    null
SET @math_b=2, @math_e=3, @math_x=0, @math_c=1;
EXECUTE math_null_stmt USING @math_b, @math_e, @math_x, @math_c;
POWER(?, ?)    EXP(?)    COT(?)
8.0    1.0    0.6420926159343306
DEALLOCATE PREPARE math_null_stmt;
DROP TABLE math_null_required;
DROP TABLE math_null_dst;
DROP TABLE math_null_src;
DROP TABLE IF EXISTS math_null_inputs;
DROP TABLE IF EXISTS math_null_ctas;
CREATE TABLE math_null_inputs(id INT PRIMARY KEY, b DOUBLE NOT NULL, e DOUBLE NOT NULL, x DOUBLE NOT NULL, c DOUBLE NOT NULL);
INSERT INTO math_null_inputs VALUES (1,2,3,0,1), (2,-2,0.5,710,0);
SELECT id FROM math_null_inputs WHERE POWER(b,e) IS NULL ORDER BY id;
id
2
SELECT id FROM math_null_inputs WHERE EXP(x) IS NULL ORDER BY id;
id
2
SELECT id FROM math_null_inputs WHERE COT(c) IS NULL ORDER BY id;
id
2
CREATE TABLE math_null_ctas AS SELECT id, POWER(b,e) AS p, EXP(x) AS x, COT(c) AS c FROM math_null_inputs;
SELECT id, p IS NULL, x IS NULL, c IS NULL FROM math_null_ctas ORDER BY id;
id    p is null    x is null    c is null
1    0    0    0
2    1    1    1
SELECT column_name, is_nullable FROM information_schema.columns WHERE table_schema = DATABASE() AND table_name = 'math_null_ctas' ORDER BY ordinal_position;
column_name    is_nullable
id    NO
p    YES
x    YES
c    YES
DROP TABLE math_null_ctas;
DROP TABLE math_null_inputs;
SELECT COUNT(*) FROM information_schema.tables WHERE table_schema = DATABASE() AND table_name IN ('math_null_src', 'math_null_dst', 'math_null_required', 'math_null_inputs', 'math_null_ctas');
COUNT(*)
0
drop table if exists t1;
create table t1(a float,  b float);
insert into t1 values(14.3, 4.413), (9.123, 9.409);
select b from t1 group by b having power(1,b)>0;
b
4.413
9.409
drop table t1;
