select json_value('{"fname": "Joe", "lname": "Palmer"}', '$.fname');
json_value({"fname": "Joe", "lname": "Palmer"}, $.fname)
Joe
select json_value('{"fname": "Joe", "lname": "Palmer"}', '$.lname');
json_value({"fname": "Joe", "lname": "Palmer"}, $.lname)
Palmer
select json_value('{"item": "shoes", "price": "49.95"}', '$.price');
json_value({"item": "shoes", "price": "49.95"}, $.price)
49.95
select json_value('{"a": {"b": [1,2,3]}}', '$.a.b[1]');
json_value({"a": {"b": [1,2,3]}}, $.a.b[1])
2
select json_value('{"active": true}', '$.active');
json_value({"active": true}, $.active)
true
select json_value('{"x": null}', '$.x');
json_value({"x": null}, $.x)
null
select json_value('{"a": 1}', '$.missing');
json_value({"a": 1}, $.missing)
null
select json_value(null, '$.a');
json_value(null, $.a)
null
select json_value('{"a": 1}', null);
json_value({"a": 1}, null)
null
drop table if exists t1;
create table t1 (a varchar(200));
insert into t1 values ('{"name":"Alice","age":30}'), ('{"name":"Bob","age":25}'), (null);
select json_value(a, '$.name') from t1;
json_value(a, $.name)
Alice
Bob
null
select json_value(a, '$.age') from t1;
json_value(a, $.age)
30
25
null
drop table t1;
select json_value(cast('{"a": 1, "b": 2}' as json), '$.a');
json_value(cast({"a": 1, "b": 2} as json), $.a)
1
select json_value(cast('{"a": 1, "b": 2}' as json), '$.b');
json_value(cast({"a": 1, "b": 2} as json), $.b)
2
select json_value(cast('[1,2,{"x":3}]' as json), '$[2].x');
json_value(cast([1,2,{"x":3}] as json), $[2].x)
3
select json_value(json_object('k1', 'v1', 'k2', 42), '$.k1');
json_value(json_object(k1, v1, k2, 42), $.k1)
v1
select json_value(json_object('k1', 'v1', 'k2', 42), '$.k2');
json_value(json_object(k1, v1, k2, 42), $.k2)
42
select json_value(json_array(1, 2, 3), '$[0]');
json_value(json_array(1, 2, 3), $[0])
1
select json_value(json_array(1, 2, 3), '$[2]');
json_value(json_array(1, 2, 3), $[2])
3
select json_value('{"a":1,"b":2}', '$.*');
json_value({"a":1,"b":2}, $.*)
null
select json_value('{"a":1,"b":2}', '$[*]');
json_value({"a":1,"b":2}, $[*])
null
select json_value('{"a":1,"b":2}', '$**.a');
json_value({"a":1,"b":2}, $**.a)
1
select json_value('{"x":[12],"o":{"k":1},"s":12}', '$.x');
json_value({"x":[12],"o":{"k":1},"s":12}, $.x)
[12]
select json_value('{"x":[12],"o":{"k":1},"s":12}', '$.o');
json_value({"x":[12],"o":{"k":1},"s":12}, $.o)
{"k": 1}
select json_value('{"x":[12],"o":{"k":1},"s":12}', '$.s');
json_value({"x":[12],"o":{"k":1},"s":12}, $.s)
12
select json_value('[1,2,3]', '$');
json_value([1,2,3], $)
[1, 2, 3]
select json_value('{"a":"b"}', '$');
json_value({"a":"b"}, $)
{"a": "b"}
select json_value('{}', '$');
json_value({}, $)
{}
select json_value('[]', '$');
json_value([], $)
[]
select json_value('[{}]', '$[*]');
json_value([{}], $[*])
{}
drop table if exists json_value_generated_idx;
create table json_value_generated_idx (id int primary key, doc json not null, extracted varchar(64) as (json_value(doc, '$.x')) stored, index extracted_idx(extracted));
insert into json_value_generated_idx(id, doc) values (1, '{"x":[12]}'), (2, '{"x":{"k":1}}'), (3, '{"x":"scalar"}');
select id, extracted from json_value_generated_idx order by id;
id	extracted
1	[12]
2	{"k": 1}
3	scalar
select id from json_value_generated_idx force index(extracted_idx) where extracted = '[12]';
id
1
select id from json_value_generated_idx force index(extracted_idx) where extracted = '{"k": 1}';
id
2
update json_value_generated_idx set doc = '{"x":[99]}' where id = 3;
select id, extracted from json_value_generated_idx where id = 3;
id	extracted
3	[99]
select id from json_value_generated_idx force index(extracted_idx) where extracted = 'scalar';
id
select id from json_value_generated_idx force index(extracted_idx) where extracted = '[99]';
id
3
drop table json_value_generated_idx;
