SELECT JSON_REPLACE('{"fruits": ["apple", "banana", "cherry"]}', '$.fruits[1]', 'orange') AS result;
result
{"fruits": ["apple", "orange", "cherry"]}
SELECT JSON_REPLACE('{"fruits": ["apple", "banana"]}', '$.fruits[2]', 'cherry') AS result;
result
{"fruits": ["apple", "banana"]}
SELECT JSON_REPLACE('{"fruits": [{"name": "apple"}, {"name": "banana"}]}', '$.fruits[1].color', 'yellow') AS result;
result
{"fruits": [{"name": "apple"}, {"name": "banana"}]}
SELECT JSON_REPLACE('{"user": {"name": "John", "age": 30}}', '$.user.age', 31, '$.user.city', 'New York') AS result;
result
{"user": {"age": 31, "name": "John"}}
SELECT JSON_REPLACE('{"company": {"name": "Moonshot AI", "employees": [{"id": 1, "name": "John"}, {"id": 2, "name": "Jane"}]}}', '$.company.employees[0].name', 'John Doe', '$.company.employees[1].department', 'HR') AS result;
result
{"company": {"employees": [{"id": 1, "name": "John Doe"}, {"id": 2, "name": "Jane"}], "name": "Moonshot AI"}}
CREATE TABLE users (
id INT PRIMARY KEY,
info JSON
);
INSERT INTO users (id, info) VALUES
(1, '{"name": "Alice", "age": 30, "email": "alice@example.com", "address": {"city": "New York", "zip": "10001"}}'),
(2, '{"name": "Bob", "age": 25, "email": "bob@example.com", "address": {"city": "Los Angeles", "zip": "90001"}}'),
(3, '{"name": "Charlie", "age": 28, "email": "charlie@example.com", "address": {"city": "Chicago", "zip": "60601"}, "skills": ["Java", "Python"]}');
SELECT * FROM users;
id    info
1    {"address": {"city": "New York", "zip": "10001"}, "age": 30, "email": "alice@example.com", "name": "Alice"}
2    {"address": {"city": "Los Angeles", "zip": "90001"}, "age": 25, "email": "bob@example.com", "name": "Bob"}
3    {"address": {"city": "Chicago", "zip": "60601"}, "age": 28, "email": "charlie@example.com", "name": "Charlie", "skills": ["Java", "Python"]}
UPDATE users
SET info = JSON_REPLACE(info, '$.age', 31)
WHERE id = 1;
SELECT * FROM users;
id    info
2    {"address": {"city": "Los Angeles", "zip": "90001"}, "age": 25, "email": "bob@example.com", "name": "Bob"}
3    {"address": {"city": "Chicago", "zip": "60601"}, "age": 28, "email": "charlie@example.com", "name": "Charlie", "skills": ["Java", "Python"]}
1    {"address": {"city": "New York", "zip": "10001"}, "age": 31, "email": "alice@example.com", "name": "Alice"}
UPDATE users
SET info = JSON_REPLACE(info, '$.address.city', 'San Francisco')
WHERE id = 1;
SELECT * FROM users;
id    info
2    {"address": {"city": "Los Angeles", "zip": "90001"}, "age": 25, "email": "bob@example.com", "name": "Bob"}
3    {"address": {"city": "Chicago", "zip": "60601"}, "age": 28, "email": "charlie@example.com", "name": "Charlie", "skills": ["Java", "Python"]}
1    {"address": {"city": "San Francisco", "zip": "10001"}, "age": 31, "email": "alice@example.com", "name": "Alice"}
UPDATE users
SET info = JSON_REPLACE(info, '$.skills[0]', 'JavaScript')
WHERE id = 3;
SELECT * FROM users;
id    info
2    {"address": {"city": "Los Angeles", "zip": "90001"}, "age": 25, "email": "bob@example.com", "name": "Bob"}
1    {"address": {"city": "San Francisco", "zip": "10001"}, "age": 31, "email": "alice@example.com", "name": "Alice"}
3    {"address": {"city": "Chicago", "zip": "60601"}, "age": 28, "email": "charlie@example.com", "name": "Charlie", "skills": ["JavaScript", "Python"]}
UPDATE users
SET info = JSON_REPLACE(info, '$.age', 32, '$.address.city', 'San Francisco')
WHERE id = 1;
SELECT * FROM users;
id    info
2    {"address": {"city": "Los Angeles", "zip": "90001"}, "age": 25, "email": "bob@example.com", "name": "Bob"}
3    {"address": {"city": "Chicago", "zip": "60601"}, "age": 28, "email": "charlie@example.com", "name": "Charlie", "skills": ["JavaScript", "Python"]}
1    {"address": {"city": "San Francisco", "zip": "10001"}, "age": 32, "email": "alice@example.com", "name": "Alice"}
drop table users;
