DROP TABLE IF EXISTS t_div_test;
CREATE TABLE t_div_test (
id INT PRIMARY KEY,
a INT,
b INT,
c DECIMAL(10,2),
d DECIMAL(10,2),
e FLOAT,
f FLOAT
);
SELECT @@sql_mode;
➤ @@sql_mode[12,0,0]  𝄀
ERROR_FOR_DIVISION_BY_ZERO,NO_ENGINE_SUBSTITUTION,NO_ZERO_DATE,NO_ZERO_IN_DATE,ONLY_FULL_GROUP_BY,STRICT_TRANS_TABLES
SELECT 10 / 0;
➤ 10 / 0[8,54,0]  𝄀
null
SELECT 10 DIV 0;
➤ 10 div 0[-5,64,0]  𝄀
null
SELECT 10 % 0;
➤ 10 % 0[-5,64,0]  𝄀
null
SELECT 10 DIV 3;
➤ 10 div 3[-5,64,0]  𝄀
3
SELECT CAST(10 AS DECIMAL(10,2)) DIV CAST(3 AS DECIMAL(10,2));
➤ cast(10 as decimal(10, 2)) div cast(3 as decimal(10, 2))[-5,64,0]  𝄀
3
SELECT CAST(10.5 AS DECIMAL(10,2)) / CAST(0 AS DECIMAL(10,2));
➤ cast(10.5 as decimal(10, 2)) / cast(0 as decimal(10, 2))[3,38,8]  𝄀
null
SELECT CAST(10.5 AS DECIMAL(10,2)) % CAST(0 AS DECIMAL(10,2));
➤ cast(10.5 as decimal(10, 2)) % cast(0 as decimal(10, 2))[3,10,2]  𝄀
null
SELECT CAST(10.5 AS DECIMAL(10,2)) DIV CAST(0 AS DECIMAL(10,2));
➤ cast(10.5 as decimal(10, 2)) div cast(0 as decimal(10, 2))[-5,64,0]  𝄀
null
SELECT 10.5 / 0.0;
➤ 10.5 / 0.0[3,38,7]  𝄀
null
SELECT 10.5 % 0.0;
➤ 10.5 % 0.0[3,18,1]  𝄀
null
SET sql_mode = '';
SELECT @@sql_mode;
➤ @@sql_mode[12,0,0]  𝄀

SELECT 10 / 0;
➤ 10 / 0[8,54,0]  𝄀
null
SELECT 10 DIV 0;
➤ 10 div 0[-5,64,0]  𝄀
null
SELECT 10 % 0;
➤ 10 % 0[-5,64,0]  𝄀
null
SET sql_mode = 'ERROR_FOR_DIVISION_BY_ZERO,NO_ENGINE_SUBSTITUTION,NO_ZERO_DATE,NO_ZERO_IN_DATE,ONLY_FULL_GROUP_BY,STRICT_TRANS_TABLES';
SELECT @@sql_mode;
➤ @@sql_mode[12,0,0]  𝄀
ERROR_FOR_DIVISION_BY_ZERO,NO_ENGINE_SUBSTITUTION,NO_ZERO_DATE,NO_ZERO_IN_DATE,ONLY_FULL_GROUP_BY,STRICT_TRANS_TABLES
INSERT INTO t_div_test (id, a, b) VALUES (1, 10, 0), (2, 10/0, 5);
INSERT INTO t_div_test (id, a, b) VALUES (3, 10 % 0, 5);
SELECT COUNT(*) FROM t_div_test;
➤ COUNT(*)[-5,64,0]  𝄀
3
SET sql_mode = 'ERROR_FOR_DIVISION_BY_ZERO';
SELECT @@sql_mode;
➤ @@sql_mode[12,0,0]  𝄀
ERROR_FOR_DIVISION_BY_ZERO
INSERT INTO t_div_test (id, a, b) VALUES (1, 10/0, 5);
Duplicate entry '1' for key 'id'
INSERT INTO t_div_test (id, a, b) VALUES (2, 10 % 0, 5);
Duplicate entry '2' for key 'id'
SELECT id, a, b FROM t_div_test ORDER BY id;
➤ id[4,32,0]  ¦  a[4,32,0]  ¦  b[4,32,0]  𝄀
1  ¦  10  ¦  0  𝄀
2  ¦  null  ¦  5  𝄀
3  ¦  null  ¦  5
DELETE FROM t_div_test;
SET sql_mode = '';
SELECT @@sql_mode;
➤ @@sql_mode[12,0,0]  𝄀

INSERT INTO t_div_test (id, a, b) VALUES (1, 10/0, 5);
INSERT INTO t_div_test (id, a, b) VALUES (2, 10 % 0, 5);
SELECT id, a, b FROM t_div_test ORDER BY id;
➤ id[4,32,0]  ¦  a[4,32,0]  ¦  b[4,32,0]  𝄀
1  ¦  null  ¦  5  𝄀
2  ¦  null  ¦  5
DELETE FROM t_div_test;
SET sql_mode = 'ERROR_FOR_DIVISION_BY_ZERO,NO_ENGINE_SUBSTITUTION,NO_ZERO_DATE,NO_ZERO_IN_DATE,ONLY_FULL_GROUP_BY,STRICT_TRANS_TABLES';
SELECT @@sql_mode;
➤ @@sql_mode[12,0,0]  𝄀
ERROR_FOR_DIVISION_BY_ZERO,NO_ENGINE_SUBSTITUTION,NO_ZERO_DATE,NO_ZERO_IN_DATE,ONLY_FULL_GROUP_BY,STRICT_TRANS_TABLES
INSERT IGNORE INTO t_div_test (id, a, b) VALUES (1, 10/0, 5);
INSERT IGNORE INTO t_div_test (id, a, b) VALUES (2, 10 % 0, 5);
SELECT id, a, b FROM t_div_test ORDER BY id;
➤ id[4,32,0]  ¦  a[4,32,0]  ¦  b[4,32,0]  𝄀
1  ¦  null  ¦  5  𝄀
2  ¦  null  ¦  5
DELETE FROM t_div_test;
INSERT INTO t_div_test (id, a, b) VALUES (1, 10, 5), (2, 20, 10);
UPDATE t_div_test SET a = 10/0 WHERE id = 1;
UPDATE t_div_test SET a = 10 % 0 WHERE id = 1;
SELECT id, a, b FROM t_div_test ORDER BY id;
➤ id[4,32,0]  ¦  a[4,32,0]  ¦  b[4,32,0]  𝄀
1  ¦  null  ¦  5  𝄀
2  ¦  20  ¦  10
SET sql_mode = '';
SELECT @@sql_mode;
➤ @@sql_mode[12,0,0]  𝄀

UPDATE t_div_test SET a = 10/0 WHERE id = 1;
SELECT id, a, b FROM t_div_test WHERE id = 1;
➤ id[4,32,0]  ¦  a[4,32,0]  ¦  b[4,32,0]  𝄀
1  ¦  null  ¦  5
UPDATE t_div_test SET a = 10 % 0 WHERE id = 2;
SELECT id, a, b FROM t_div_test WHERE id = 2;
➤ id[4,32,0]  ¦  a[4,32,0]  ¦  b[4,32,0]  𝄀
2  ¦  null  ¦  10
DELETE FROM t_div_test;
SET sql_mode = 'ERROR_FOR_DIVISION_BY_ZERO,NO_ENGINE_SUBSTITUTION,NO_ZERO_DATE,NO_ZERO_IN_DATE,ONLY_FULL_GROUP_BY,STRICT_TRANS_TABLES';
SELECT CAST(10.5 AS DECIMAL(10,2)) / CAST(0 AS DECIMAL(10,2));
➤ cast(10.5 as decimal(10, 2)) / cast(0 as decimal(10, 2))[3,38,8]  𝄀
null
SELECT CAST(10.5 AS DECIMAL(10,2)) % CAST(0 AS DECIMAL(10,2));
➤ cast(10.5 as decimal(10, 2)) % cast(0 as decimal(10, 2))[3,10,2]  𝄀
null
INSERT INTO t_div_test (id, c, d) VALUES (1, CAST(10.5 AS DECIMAL(10,2)) / CAST(0 AS DECIMAL(10,2)), 5.0);
SET sql_mode = '';
INSERT INTO t_div_test (id, c, d) VALUES (1, CAST(10.5 AS DECIMAL(10,2)) / CAST(0 AS DECIMAL(10,2)), 5.0);
Duplicate entry '1' for key 'id'
SELECT id, c, d FROM t_div_test WHERE id = 1;
➤ id[4,32,0]  ¦  c[3,10,2]  ¦  d[3,10,2]  𝄀
1  ¦  null  ¦  5.00
DELETE FROM t_div_test;
SET sql_mode = 'ERROR_FOR_DIVISION_BY_ZERO,NO_ENGINE_SUBSTITUTION,NO_ZERO_DATE,NO_ZERO_IN_DATE,ONLY_FULL_GROUP_BY,STRICT_TRANS_TABLES';
SELECT 10.5 / 0.0;
➤ 10.5 / 0.0[3,38,7]  𝄀
null
SELECT 10.5 % 0.0;
➤ 10.5 % 0.0[3,18,1]  𝄀
null
INSERT INTO t_div_test (id, e, f) VALUES (1, 10.5 / 0.0, 5.0);
SET sql_mode = '';
INSERT INTO t_div_test (id, e, f) VALUES (1, 10.5 / 0.0, 5.0);
Duplicate entry '1' for key 'id'
SELECT id, e, f FROM t_div_test WHERE id = 1;
➤ id[4,32,0]  ¦  e[7,24,0]  ¦  f[7,24,0]  𝄀
1  ¦  null  ¦  5.0
DELETE FROM t_div_test;
SET sql_mode = 'ERROR_FOR_DIVISION_BY_ZERO,NO_ENGINE_SUBSTITUTION,NO_ZERO_DATE,NO_ZERO_IN_DATE,ONLY_FULL_GROUP_BY,STRICT_TRANS_TABLES';
SELECT (10 + 20) / (5 - 5);
➤ (10 + 20) / (5 - 5)[8,54,0]  𝄀
null
SELECT CASE WHEN 1=1 THEN 10/0 ELSE 5 END;
➤ case when 1 = 1 then 10 / 0 else 5 end[8,54,0]  𝄀
null
INSERT INTO t_div_test (id, a, b) VALUES (1, 10, 0), (2, 20, 5);
SELECT id, a, b FROM t_div_test WHERE a / b > 0;
➤ id[4,32,0]  ¦  a[4,32,0]  ¦  b[4,32,0]  𝄀
2  ¦  20  ¦  5
DROP TABLE t_div_test;
SELECT CAST(10 AS TINYINT) DIV CAST(3 AS TINYINT);
internal error: panic unsafe slice cast: from length 1 is not enough for length 8: 
github.com/matrixorigin/matrixone/pkg/common/util.UnsafeSliceCastToLength[...]
	/home/xupeng/github/matrixone/pkg/common/util/unsafe.go:85
github.com/matrixorigin/matrixone/pkg/container/vector.toSliceOfLengthNoTypeCheck[...]
	/home/xupeng/github/matrixone/pkg/container/vector/vector.go:77
github.com/matrixorigin/matrixone/pkg/container/vector.ToFixedCol[...]
	/home/xupeng/github/matrixone/pkg/container/vector/tools.go:43
github.com/matrixorigin/matrixone/pkg/container/vector.MustFixedColWithTypeCheck[...]
	/home/xupeng/github/matrixone/pkg/container/vector/tools.go:56
github.com/matrixorigin/matrixone/pkg/container/vector.GenerateFunctionFixedTypeParameter[...]
	/home/xupeng/github/matrixone/pkg/container/vector/functionTools.go:67
github.com/matrixorigin/matrixone/pkg/sql/plan/function.integerDivSigned
	/home/xupeng/github/matrixone/pkg/sql/plan/function/arithmetic.go:508
github.com/matrixorigin/matrixone/pkg/sql/plan/function.integerDivFn
	/home/xupeng/github/matrixone/pkg/sql/plan/function/arithmetic.go:486
github.com/matrixorigin/matrixone/pkg/sql/colexec.(*FunctionExpressionExecutor).doFold
	/home/xupeng/github/matrixone/pkg/sql/colexec/evalExpressionReset.go:171
github.com/matrixorigin/matrixone/pkg/sql/colexec.(*FunctionExpressionExecutor).Eval
	/home/xupeng/github/matrixone/pkg/sql/colexec/evalExpression.go:576
github.com/matrixorigin/matrixone/pkg/sql/colexec.getReadonlyResultFromExpression
	/home/xupeng/github/matrixone/pkg/sql/colexec/evalExpressionOpt.go:67
github.com/matrixorigin/matrixone/pkg/sql/colexec.GetReadonlyResultFromExpression
	/home/xupeng/github/matrixone/pkg/sql/colexec/evalExpressionOpt.go:57
github.com/matrixorigin/matrixone/pkg/sql/plan/rule.(*ConstantFold).constantFold
	/home/xupeng/github/matrixone/pkg/sql/plan/rule/constant_fold.go:200
github.com/matrixorigin/matrixone/pkg/sql/plan/rule.(*ConstantFold).Apply
	/home/xupeng/github/matrixone/pkg/sql/plan/rule/constant_fold.go:77
github.com/matrixorigin/matrixone/pkg/sql/plan.(*BaseOptimizer).exploreNode
	/home/xupeng/github/matrixone/pkg/sql/plan/optimize.go:87
github.com/matrixorigin/matrixone/pkg/sql/plan.(*BaseOptimizer).optimize
	/home/xupeng/github/matrixone/pkg/sql/plan/optimize.go:73
github.com/matrixorigin/matrixone/pkg/sql/plan.(*BaseOptimizer).Optimize
	/home/xupeng/github/matrixone/pkg/sql/plan/optimize.go:65
github.com/matrixorigin/matrixone/pkg/frontend.buildPlan
	/home/xupeng/github/matrixone/pkg/frontend/mysql_cmd_executor.go:2085
github.com/matrixorigin/matrixone/pkg/frontend.(*TxnComputationWrapper).Compile
	/home/xupeng/github/matrixone/pkg/frontend/computation_wrapper.go:210
github.com/matrixorigin/matrixone/pkg/frontend.executeStmt
	/home/xupeng/github/matrixone/pkg/frontend/mysql_cmd_executor.go:2959
github.com/matrixorigin/matrixone/pkg/frontend.dispatchStmt
	/home/xupeng/github/matrixone/pkg/frontend/mysql_cmd_executor.go:2853
github.com/matrixorigin/matrixone/pkg/frontend.executeStmtWithIncrStmt
	/home/xupeng/github/matrixone/pkg/frontend/mysql_cmd_executor.go:2818
github.com/matrixorigin/matrixone/pkg/frontend.executeStmtWithWorkspace
	/home/xupeng/github/matrixone/pkg/frontend/mysql_cmd_executor.go:2762
github.com/matrixorigin/matrixone/pkg/frontend.executeStmtWithTxn
	/home/xupeng/github/matrixone/pkg/frontend/mysql_cmd_executor.go:2637
github.com/matrixorigin/matrixone/pkg/frontend.executeStmtWithResponse
	/home/xupeng/github/matrixone/pkg/frontend/mysql_cmd_executor.go:2600
github.com/matrixorigin/matrixone/pkg/frontend.doComQuery
	/home/xupeng/github/matrixone/pkg/frontend/mysql_cmd_executor.go:3243
github.com/matrixorigin/matrixone/pkg/frontend.ExecRequest
	/home/xupeng/github/matrixone/pkg/frontend/mysql_cmd_executor.go:3323
github.com/matrixorigin/matrixone/pkg/frontend.(*Routine).handleRequest
	/home/xupeng/github/matrixone/pkg/frontend/routine.go:298
github.com/matrixorigin/matrixone/pkg/frontend.(*RoutineManager).Handler
	/home/xupeng/github/matrixone/pkg/frontend/routine_manager.go:386
github.com/matrixorigin/matrixone/pkg/frontend.(*MOServer).handleRequest
	/home/xupeng/github/matrixone/pkg/frontend/server.go:523
github.com/matrixorigin/matrixone/pkg/frontend.(*MOServer).handleMessage
	/home/xupeng/github/matrixone/pkg/frontend/server.go:493
github.com/matrixorigin/matrixone/pkg/frontend.(*MOServer).handleLoop
	/home/xupeng/github/matrixone/pkg/frontend/server.go:210
github.com/matrixorigin/matrixone/pkg/frontend.(*MOServer).handleConn
	/home/xupeng/github/matrixone/pkg/frontend/server.go:206
SELECT CAST(127 AS TINYINT) DIV CAST(1 AS TINYINT);
internal error: panic unsafe slice cast: from length 1 is not enough for length 8: 
github.com/matrixorigin/matrixone/pkg/common/util.UnsafeSliceCastToLength[...]
	/home/xupeng/github/matrixone/pkg/common/util/unsafe.go:85
github.com/matrixorigin/matrixone/pkg/container/vector.toSliceOfLengthNoTypeCheck[...]
	/home/xupeng/github/matrixone/pkg/container/vector/vector.go:77
github.com/matrixorigin/matrixone/pkg/container/vector.ToFixedCol[...]
	/home/xupeng/github/matrixone/pkg/container/vector/tools.go:43
github.com/matrixorigin/matrixone/pkg/container/vector.MustFixedColWithTypeCheck[...]
	/home/xupeng/github/matrixone/pkg/container/vector/tools.go:56
github.com/matrixorigin/matrixone/pkg/container/vector.GenerateFunctionFixedTypeParameter[...]
	/home/xupeng/github/matrixone/pkg/container/vector/functionTools.go:67
github.com/matrixorigin/matrixone/pkg/sql/plan/function.integerDivSigned
	/home/xupeng/github/matrixone/pkg/sql/plan/function/arithmetic.go:508
github.com/matrixorigin/matrixone/pkg/sql/plan/function.integerDivFn
	/home/xupeng/github/matrixone/pkg/sql/plan/function/arithmetic.go:486
github.com/matrixorigin/matrixone/pkg/sql/colexec.(*FunctionExpressionExecutor).doFold
	/home/xupeng/github/matrixone/pkg/sql/colexec/evalExpressionReset.go:171
github.com/matrixorigin/matrixone/pkg/sql/colexec.(*FunctionExpressionExecutor).Eval
	/home/xupeng/github/matrixone/pkg/sql/colexec/evalExpression.go:576
github.com/matrixorigin/matrixone/pkg/sql/colexec.getReadonlyResultFromExpression
	/home/xupeng/github/matrixone/pkg/sql/colexec/evalExpressionOpt.go:67
github.com/matrixorigin/matrixone/pkg/sql/colexec.GetReadonlyResultFromExpression
	/home/xupeng/github/matrixone/pkg/sql/colexec/evalExpressionOpt.go:57
github.com/matrixorigin/matrixone/pkg/sql/plan/rule.(*ConstantFold).constantFold
	/home/xupeng/github/matrixone/pkg/sql/plan/rule/constant_fold.go:200
github.com/matrixorigin/matrixone/pkg/sql/plan/rule.(*ConstantFold).Apply
	/home/xupeng/github/matrixone/pkg/sql/plan/rule/constant_fold.go:77
github.com/matrixorigin/matrixone/pkg/sql/plan.(*BaseOptimizer).exploreNode
	/home/xupeng/github/matrixone/pkg/sql/plan/optimize.go:87
github.com/matrixorigin/matrixone/pkg/sql/plan.(*BaseOptimizer).optimize
	/home/xupeng/github/matrixone/pkg/sql/plan/optimize.go:73
github.com/matrixorigin/matrixone/pkg/sql/plan.(*BaseOptimizer).Optimize
	/home/xupeng/github/matrixone/pkg/sql/plan/optimize.go:65
github.com/matrixorigin/matrixone/pkg/frontend.buildPlan
	/home/xupeng/github/matrixone/pkg/frontend/mysql_cmd_executor.go:2085
github.com/matrixorigin/matrixone/pkg/frontend.(*TxnComputationWrapper).Compile
	/home/xupeng/github/matrixone/pkg/frontend/computation_wrapper.go:210
github.com/matrixorigin/matrixone/pkg/frontend.executeStmt
	/home/xupeng/github/matrixone/pkg/frontend/mysql_cmd_executor.go:2959
github.com/matrixorigin/matrixone/pkg/frontend.dispatchStmt
	/home/xupeng/github/matrixone/pkg/frontend/mysql_cmd_executor.go:2853
github.com/matrixorigin/matrixone/pkg/frontend.executeStmtWithIncrStmt
	/home/xupeng/github/matrixone/pkg/frontend/mysql_cmd_executor.go:2818
github.com/matrixorigin/matrixone/pkg/frontend.executeStmtWithWorkspace
	/home/xupeng/github/matrixone/pkg/frontend/mysql_cmd_executor.go:2762
github.com/matrixorigin/matrixone/pkg/frontend.executeStmtWithTxn
	/home/xupeng/github/matrixone/pkg/frontend/mysql_cmd_executor.go:2637
github.com/matrixorigin/matrixone/pkg/frontend.executeStmtWithResponse
	/home/xupeng/github/matrixone/pkg/frontend/mysql_cmd_executor.go:2600
github.com/matrixorigin/matrixone/pkg/frontend.doComQuery
	/home/xupeng/github/matrixone/pkg/frontend/mysql_cmd_executor.go:3243
github.com/matrixorigin/matrixone/pkg/frontend.ExecRequest
	/home/xupeng/github/matrixone/pkg/frontend/mysql_cmd_executor.go:3323
github.com/matrixorigin/matrixone/pkg/frontend.(*Routine).handleRequest
	/home/xupeng/github/matrixone/pkg/frontend/routine.go:298
github.com/matrixorigin/matrixone/pkg/frontend.(*RoutineManager).Handler
	/home/xupeng/github/matrixone/pkg/frontend/routine_manager.go:386
github.com/matrixorigin/matrixone/pkg/frontend.(*MOServer).handleRequest
	/home/xupeng/github/matrixone/pkg/frontend/server.go:523
github.com/matrixorigin/matrixone/pkg/frontend.(*MOServer).handleMessage
	/home/xupeng/github/matrixone/pkg/frontend/server.go:493
github.com/matrixorigin/matrixone/pkg/frontend.(*MOServer).handleLoop
	/home/xupeng/github/matrixone/pkg/frontend/server.go:210
github.com/matrixorigin/matrixone/pkg/frontend.(*MOServer).handleConn
	/home/xupeng/github/matrixone/pkg/frontend/server.go:206
SELECT CAST(-128 AS TINYINT) DIV CAST(1 AS TINYINT);
internal error: panic unsafe slice cast: from length 1 is not enough for length 8: 
github.com/matrixorigin/matrixone/pkg/common/util.UnsafeSliceCastToLength[...]
	/home/xupeng/github/matrixone/pkg/common/util/unsafe.go:85
github.com/matrixorigin/matrixone/pkg/container/vector.toSliceOfLengthNoTypeCheck[...]
	/home/xupeng/github/matrixone/pkg/container/vector/vector.go:77
github.com/matrixorigin/matrixone/pkg/container/vector.ToFixedCol[...]
	/home/xupeng/github/matrixone/pkg/container/vector/tools.go:43
github.com/matrixorigin/matrixone/pkg/container/vector.MustFixedColWithTypeCheck[...]
	/home/xupeng/github/matrixone/pkg/container/vector/tools.go:56
github.com/matrixorigin/matrixone/pkg/container/vector.GenerateFunctionFixedTypeParameter[...]
	/home/xupeng/github/matrixone/pkg/container/vector/functionTools.go:67
github.com/matrixorigin/matrixone/pkg/sql/plan/function.integerDivSigned
	/home/xupeng/github/matrixone/pkg/sql/plan/function/arithmetic.go:508
github.com/matrixorigin/matrixone/pkg/sql/plan/function.integerDivFn
	/home/xupeng/github/matrixone/pkg/sql/plan/function/arithmetic.go:486
github.com/matrixorigin/matrixone/pkg/sql/colexec.(*FunctionExpressionExecutor).doFold
	/home/xupeng/github/matrixone/pkg/sql/colexec/evalExpressionReset.go:171
github.com/matrixorigin/matrixone/pkg/sql/colexec.(*FunctionExpressionExecutor).Eval
	/home/xupeng/github/matrixone/pkg/sql/colexec/evalExpression.go:576
github.com/matrixorigin/matrixone/pkg/sql/colexec.getReadonlyResultFromExpression
	/home/xupeng/github/matrixone/pkg/sql/colexec/evalExpressionOpt.go:67
github.com/matrixorigin/matrixone/pkg/sql/colexec.GetReadonlyResultFromExpression
	/home/xupeng/github/matrixone/pkg/sql/colexec/evalExpressionOpt.go:57
github.com/matrixorigin/matrixone/pkg/sql/plan/rule.(*ConstantFold).constantFold
	/home/xupeng/github/matrixone/pkg/sql/plan/rule/constant_fold.go:200
github.com/matrixorigin/matrixone/pkg/sql/plan/rule.(*ConstantFold).Apply
	/home/xupeng/github/matrixone/pkg/sql/plan/rule/constant_fold.go:77
github.com/matrixorigin/matrixone/pkg/sql/plan.(*BaseOptimizer).exploreNode
	/home/xupeng/github/matrixone/pkg/sql/plan/optimize.go:87
github.com/matrixorigin/matrixone/pkg/sql/plan.(*BaseOptimizer).optimize
	/home/xupeng/github/matrixone/pkg/sql/plan/optimize.go:73
github.com/matrixorigin/matrixone/pkg/sql/plan.(*BaseOptimizer).Optimize
	/home/xupeng/github/matrixone/pkg/sql/plan/optimize.go:65
github.com/matrixorigin/matrixone/pkg/frontend.buildPlan
	/home/xupeng/github/matrixone/pkg/frontend/mysql_cmd_executor.go:2085
github.com/matrixorigin/matrixone/pkg/frontend.(*TxnComputationWrapper).Compile
	/home/xupeng/github/matrixone/pkg/frontend/computation_wrapper.go:210
github.com/matrixorigin/matrixone/pkg/frontend.executeStmt
	/home/xupeng/github/matrixone/pkg/frontend/mysql_cmd_executor.go:2959
github.com/matrixorigin/matrixone/pkg/frontend.dispatchStmt
	/home/xupeng/github/matrixone/pkg/frontend/mysql_cmd_executor.go:2853
github.com/matrixorigin/matrixone/pkg/frontend.executeStmtWithIncrStmt
	/home/xupeng/github/matrixone/pkg/frontend/mysql_cmd_executor.go:2818
github.com/matrixorigin/matrixone/pkg/frontend.executeStmtWithWorkspace
	/home/xupeng/github/matrixone/pkg/frontend/mysql_cmd_executor.go:2762
github.com/matrixorigin/matrixone/pkg/frontend.executeStmtWithTxn
	/home/xupeng/github/matrixone/pkg/frontend/mysql_cmd_executor.go:2637
github.com/matrixorigin/matrixone/pkg/frontend.executeStmtWithResponse
	/home/xupeng/github/matrixone/pkg/frontend/mysql_cmd_executor.go:2600
github.com/matrixorigin/matrixone/pkg/frontend.doComQuery
	/home/xupeng/github/matrixone/pkg/frontend/mysql_cmd_executor.go:3243
github.com/matrixorigin/matrixone/pkg/frontend.ExecRequest
	/home/xupeng/github/matrixone/pkg/frontend/mysql_cmd_executor.go:3323
github.com/matrixorigin/matrixone/pkg/frontend.(*Routine).handleRequest
	/home/xupeng/github/matrixone/pkg/frontend/routine.go:298
github.com/matrixorigin/matrixone/pkg/frontend.(*RoutineManager).Handler
	/home/xupeng/github/matrixone/pkg/frontend/routine_manager.go:386
github.com/matrixorigin/matrixone/pkg/frontend.(*MOServer).handleRequest
	/home/xupeng/github/matrixone/pkg/frontend/server.go:523
github.com/matrixorigin/matrixone/pkg/frontend.(*MOServer).handleMessage
	/home/xupeng/github/matrixone/pkg/frontend/server.go:493
github.com/matrixorigin/matrixone/pkg/frontend.(*MOServer).handleLoop
	/home/xupeng/github/matrixone/pkg/frontend/server.go:210
github.com/matrixorigin/matrixone/pkg/frontend.(*MOServer).handleConn
	/home/xupeng/github/matrixone/pkg/frontend/server.go:206
SELECT CAST(10 AS TINYINT) DIV CAST(0 AS TINYINT);
internal error: panic unsafe slice cast: from length 1 is not enough for length 8: 
github.com/matrixorigin/matrixone/pkg/common/util.UnsafeSliceCastToLength[...]
	/home/xupeng/github/matrixone/pkg/common/util/unsafe.go:85
github.com/matrixorigin/matrixone/pkg/container/vector.toSliceOfLengthNoTypeCheck[...]
	/home/xupeng/github/matrixone/pkg/container/vector/vector.go:77
github.com/matrixorigin/matrixone/pkg/container/vector.ToFixedCol[...]
	/home/xupeng/github/matrixone/pkg/container/vector/tools.go:43
github.com/matrixorigin/matrixone/pkg/container/vector.MustFixedColWithTypeCheck[...]
	/home/xupeng/github/matrixone/pkg/container/vector/tools.go:56
github.com/matrixorigin/matrixone/pkg/container/vector.GenerateFunctionFixedTypeParameter[...]
	/home/xupeng/github/matrixone/pkg/container/vector/functionTools.go:67
github.com/matrixorigin/matrixone/pkg/sql/plan/function.integerDivSigned
	/home/xupeng/github/matrixone/pkg/sql/plan/function/arithmetic.go:508
github.com/matrixorigin/matrixone/pkg/sql/plan/function.integerDivFn
	/home/xupeng/github/matrixone/pkg/sql/plan/function/arithmetic.go:486
github.com/matrixorigin/matrixone/pkg/sql/colexec.(*FunctionExpressionExecutor).doFold
	/home/xupeng/github/matrixone/pkg/sql/colexec/evalExpressionReset.go:171
github.com/matrixorigin/matrixone/pkg/sql/colexec.(*FunctionExpressionExecutor).Eval
	/home/xupeng/github/matrixone/pkg/sql/colexec/evalExpression.go:576
github.com/matrixorigin/matrixone/pkg/sql/colexec.getReadonlyResultFromExpression
	/home/xupeng/github/matrixone/pkg/sql/colexec/evalExpressionOpt.go:67
github.com/matrixorigin/matrixone/pkg/sql/colexec.GetReadonlyResultFromExpression
	/home/xupeng/github/matrixone/pkg/sql/colexec/evalExpressionOpt.go:57
github.com/matrixorigin/matrixone/pkg/sql/plan/rule.(*ConstantFold).constantFold
	/home/xupeng/github/matrixone/pkg/sql/plan/rule/constant_fold.go:200
github.com/matrixorigin/matrixone/pkg/sql/plan/rule.(*ConstantFold).Apply
	/home/xupeng/github/matrixone/pkg/sql/plan/rule/constant_fold.go:77
github.com/matrixorigin/matrixone/pkg/sql/plan.(*BaseOptimizer).exploreNode
	/home/xupeng/github/matrixone/pkg/sql/plan/optimize.go:87
github.com/matrixorigin/matrixone/pkg/sql/plan.(*BaseOptimizer).optimize
	/home/xupeng/github/matrixone/pkg/sql/plan/optimize.go:73
github.com/matrixorigin/matrixone/pkg/sql/plan.(*BaseOptimizer).Optimize
	/home/xupeng/github/matrixone/pkg/sql/plan/optimize.go:65
github.com/matrixorigin/matrixone/pkg/frontend.buildPlan
	/home/xupeng/github/matrixone/pkg/frontend/mysql_cmd_executor.go:2085
github.com/matrixorigin/matrixone/pkg/frontend.(*TxnComputationWrapper).Compile
	/home/xupeng/github/matrixone/pkg/frontend/computation_wrapper.go:210
github.com/matrixorigin/matrixone/pkg/frontend.executeStmt
	/home/xupeng/github/matrixone/pkg/frontend/mysql_cmd_executor.go:2959
github.com/matrixorigin/matrixone/pkg/frontend.dispatchStmt
	/home/xupeng/github/matrixone/pkg/frontend/mysql_cmd_executor.go:2853
github.com/matrixorigin/matrixone/pkg/frontend.executeStmtWithIncrStmt
	/home/xupeng/github/matrixone/pkg/frontend/mysql_cmd_executor.go:2818
github.com/matrixorigin/matrixone/pkg/frontend.executeStmtWithWorkspace
	/home/xupeng/github/matrixone/pkg/frontend/mysql_cmd_executor.go:2762
github.com/matrixorigin/matrixone/pkg/frontend.executeStmtWithTxn
	/home/xupeng/github/matrixone/pkg/frontend/mysql_cmd_executor.go:2637
github.com/matrixorigin/matrixone/pkg/frontend.executeStmtWithResponse
	/home/xupeng/github/matrixone/pkg/frontend/mysql_cmd_executor.go:2600
github.com/matrixorigin/matrixone/pkg/frontend.doComQuery
	/home/xupeng/github/matrixone/pkg/frontend/mysql_cmd_executor.go:3243
github.com/matrixorigin/matrixone/pkg/frontend.ExecRequest
	/home/xupeng/github/matrixone/pkg/frontend/mysql_cmd_executor.go:3323
github.com/matrixorigin/matrixone/pkg/frontend.(*Routine).handleRequest
	/home/xupeng/github/matrixone/pkg/frontend/routine.go:298
github.com/matrixorigin/matrixone/pkg/frontend.(*RoutineManager).Handler
	/home/xupeng/github/matrixone/pkg/frontend/routine_manager.go:386
github.com/matrixorigin/matrixone/pkg/frontend.(*MOServer).handleRequest
	/home/xupeng/github/matrixone/pkg/frontend/server.go:523
github.com/matrixorigin/matrixone/pkg/frontend.(*MOServer).handleMessage
	/home/xupeng/github/matrixone/pkg/frontend/server.go:493
github.com/matrixorigin/matrixone/pkg/frontend.(*MOServer).handleLoop
	/home/xupeng/github/matrixone/pkg/frontend/server.go:210
github.com/matrixorigin/matrixone/pkg/frontend.(*MOServer).handleConn
	/home/xupeng/github/matrixone/pkg/frontend/server.go:206
SELECT CAST(1000 AS SMALLINT) DIV CAST(3 AS SMALLINT);
internal error: panic unsafe slice cast: from length 2 is not enough for length 8: 
github.com/matrixorigin/matrixone/pkg/common/util.UnsafeSliceCastToLength[...]
	/home/xupeng/github/matrixone/pkg/common/util/unsafe.go:85
github.com/matrixorigin/matrixone/pkg/container/vector.toSliceOfLengthNoTypeCheck[...]
	/home/xupeng/github/matrixone/pkg/container/vector/vector.go:77
github.com/matrixorigin/matrixone/pkg/container/vector.ToFixedCol[...]
	/home/xupeng/github/matrixone/pkg/container/vector/tools.go:43
github.com/matrixorigin/matrixone/pkg/container/vector.MustFixedColWithTypeCheck[...]
	/home/xupeng/github/matrixone/pkg/container/vector/tools.go:56
github.com/matrixorigin/matrixone/pkg/container/vector.GenerateFunctionFixedTypeParameter[...]
	/home/xupeng/github/matrixone/pkg/container/vector/functionTools.go:67
github.com/matrixorigin/matrixone/pkg/sql/plan/function.integerDivSigned
	/home/xupeng/github/matrixone/pkg/sql/plan/function/arithmetic.go:508
github.com/matrixorigin/matrixone/pkg/sql/plan/function.integerDivFn
	/home/xupeng/github/matrixone/pkg/sql/plan/function/arithmetic.go:486
github.com/matrixorigin/matrixone/pkg/sql/colexec.(*FunctionExpressionExecutor).doFold
	/home/xupeng/github/matrixone/pkg/sql/colexec/evalExpressionReset.go:171
github.com/matrixorigin/matrixone/pkg/sql/colexec.(*FunctionExpressionExecutor).Eval
	/home/xupeng/github/matrixone/pkg/sql/colexec/evalExpression.go:576
github.com/matrixorigin/matrixone/pkg/sql/colexec.getReadonlyResultFromExpression
	/home/xupeng/github/matrixone/pkg/sql/colexec/evalExpressionOpt.go:67
github.com/matrixorigin/matrixone/pkg/sql/colexec.GetReadonlyResultFromExpression
	/home/xupeng/github/matrixone/pkg/sql/colexec/evalExpressionOpt.go:57
github.com/matrixorigin/matrixone/pkg/sql/plan/rule.(*ConstantFold).constantFold
	/home/xupeng/github/matrixone/pkg/sql/plan/rule/constant_fold.go:200
github.com/matrixorigin/matrixone/pkg/sql/plan/rule.(*ConstantFold).Apply
	/home/xupeng/github/matrixone/pkg/sql/plan/rule/constant_fold.go:77
github.com/matrixorigin/matrixone/pkg/sql/plan.(*BaseOptimizer).exploreNode
	/home/xupeng/github/matrixone/pkg/sql/plan/optimize.go:87
github.com/matrixorigin/matrixone/pkg/sql/plan.(*BaseOptimizer).optimize
	/home/xupeng/github/matrixone/pkg/sql/plan/optimize.go:73
github.com/matrixorigin/matrixone/pkg/sql/plan.(*BaseOptimizer).Optimize
	/home/xupeng/github/matrixone/pkg/sql/plan/optimize.go:65
github.com/matrixorigin/matrixone/pkg/frontend.buildPlan
	/home/xupeng/github/matrixone/pkg/frontend/mysql_cmd_executor.go:2085
github.com/matrixorigin/matrixone/pkg/frontend.(*TxnComputationWrapper).Compile
	/home/xupeng/github/matrixone/pkg/frontend/computation_wrapper.go:210
github.com/matrixorigin/matrixone/pkg/frontend.executeStmt
	/home/xupeng/github/matrixone/pkg/frontend/mysql_cmd_executor.go:2959
github.com/matrixorigin/matrixone/pkg/frontend.dispatchStmt
	/home/xupeng/github/matrixone/pkg/frontend/mysql_cmd_executor.go:2853
github.com/matrixorigin/matrixone/pkg/frontend.executeStmtWithIncrStmt
	/home/xupeng/github/matrixone/pkg/frontend/mysql_cmd_executor.go:2818
github.com/matrixorigin/matrixone/pkg/frontend.executeStmtWithWorkspace
	/home/xupeng/github/matrixone/pkg/frontend/mysql_cmd_executor.go:2762
github.com/matrixorigin/matrixone/pkg/frontend.executeStmtWithTxn
	/home/xupeng/github/matrixone/pkg/frontend/mysql_cmd_executor.go:2637
github.com/matrixorigin/matrixone/pkg/frontend.executeStmtWithResponse
	/home/xupeng/github/matrixone/pkg/frontend/mysql_cmd_executor.go:2600
github.com/matrixorigin/matrixone/pkg/frontend.doComQuery
	/home/xupeng/github/matrixone/pkg/frontend/mysql_cmd_executor.go:3243
github.com/matrixorigin/matrixone/pkg/frontend.ExecRequest
	/home/xupeng/github/matrixone/pkg/frontend/mysql_cmd_executor.go:3323
github.com/matrixorigin/matrixone/pkg/frontend.(*Routine).handleRequest
	/home/xupeng/github/matrixone/pkg/frontend/routine.go:298
github.com/matrixorigin/matrixone/pkg/frontend.(*RoutineManager).Handler
	/home/xupeng/github/matrixone/pkg/frontend/routine_manager.go:386
github.com/matrixorigin/matrixone/pkg/frontend.(*MOServer).handleRequest
	/home/xupeng/github/matrixone/pkg/frontend/server.go:523
github.com/matrixorigin/matrixone/pkg/frontend.(*MOServer).handleMessage
	/home/xupeng/github/matrixone/pkg/frontend/server.go:493
github.com/matrixorigin/matrixone/pkg/frontend.(*MOServer).handleLoop
	/home/xupeng/github/matrixone/pkg/frontend/server.go:210
github.com/matrixorigin/matrixone/pkg/frontend.(*MOServer).handleConn
	/home/xupeng/github/matrixone/pkg/frontend/server.go:206
SELECT CAST(32767 AS SMALLINT) DIV CAST(1 AS SMALLINT);
internal error: panic unsafe slice cast: from length 2 is not enough for length 8: 
github.com/matrixorigin/matrixone/pkg/common/util.UnsafeSliceCastToLength[...]
	/home/xupeng/github/matrixone/pkg/common/util/unsafe.go:85
github.com/matrixorigin/matrixone/pkg/container/vector.toSliceOfLengthNoTypeCheck[...]
	/home/xupeng/github/matrixone/pkg/container/vector/vector.go:77
github.com/matrixorigin/matrixone/pkg/container/vector.ToFixedCol[...]
	/home/xupeng/github/matrixone/pkg/container/vector/tools.go:43
github.com/matrixorigin/matrixone/pkg/container/vector.MustFixedColWithTypeCheck[...]
	/home/xupeng/github/matrixone/pkg/container/vector/tools.go:56
github.com/matrixorigin/matrixone/pkg/container/vector.GenerateFunctionFixedTypeParameter[...]
	/home/xupeng/github/matrixone/pkg/container/vector/functionTools.go:67
github.com/matrixorigin/matrixone/pkg/sql/plan/function.integerDivSigned
	/home/xupeng/github/matrixone/pkg/sql/plan/function/arithmetic.go:508
github.com/matrixorigin/matrixone/pkg/sql/plan/function.integerDivFn
	/home/xupeng/github/matrixone/pkg/sql/plan/function/arithmetic.go:486
github.com/matrixorigin/matrixone/pkg/sql/colexec.(*FunctionExpressionExecutor).doFold
	/home/xupeng/github/matrixone/pkg/sql/colexec/evalExpressionReset.go:171
github.com/matrixorigin/matrixone/pkg/sql/colexec.(*FunctionExpressionExecutor).Eval
	/home/xupeng/github/matrixone/pkg/sql/colexec/evalExpression.go:576
github.com/matrixorigin/matrixone/pkg/sql/colexec.getReadonlyResultFromExpression
	/home/xupeng/github/matrixone/pkg/sql/colexec/evalExpressionOpt.go:67
github.com/matrixorigin/matrixone/pkg/sql/colexec.GetReadonlyResultFromExpression
	/home/xupeng/github/matrixone/pkg/sql/colexec/evalExpressionOpt.go:57
github.com/matrixorigin/matrixone/pkg/sql/plan/rule.(*ConstantFold).constantFold
	/home/xupeng/github/matrixone/pkg/sql/plan/rule/constant_fold.go:200
github.com/matrixorigin/matrixone/pkg/sql/plan/rule.(*ConstantFold).Apply
	/home/xupeng/github/matrixone/pkg/sql/plan/rule/constant_fold.go:77
github.com/matrixorigin/matrixone/pkg/sql/plan.(*BaseOptimizer).exploreNode
	/home/xupeng/github/matrixone/pkg/sql/plan/optimize.go:87
github.com/matrixorigin/matrixone/pkg/sql/plan.(*BaseOptimizer).optimize
	/home/xupeng/github/matrixone/pkg/sql/plan/optimize.go:73
github.com/matrixorigin/matrixone/pkg/sql/plan.(*BaseOptimizer).Optimize
	/home/xupeng/github/matrixone/pkg/sql/plan/optimize.go:65
github.com/matrixorigin/matrixone/pkg/frontend.buildPlan
	/home/xupeng/github/matrixone/pkg/frontend/mysql_cmd_executor.go:2085
github.com/matrixorigin/matrixone/pkg/frontend.(*TxnComputationWrapper).Compile
	/home/xupeng/github/matrixone/pkg/frontend/computation_wrapper.go:210
github.com/matrixorigin/matrixone/pkg/frontend.executeStmt
	/home/xupeng/github/matrixone/pkg/frontend/mysql_cmd_executor.go:2959
github.com/matrixorigin/matrixone/pkg/frontend.dispatchStmt
	/home/xupeng/github/matrixone/pkg/frontend/mysql_cmd_executor.go:2853
github.com/matrixorigin/matrixone/pkg/frontend.executeStmtWithIncrStmt
	/home/xupeng/github/matrixone/pkg/frontend/mysql_cmd_executor.go:2818
github.com/matrixorigin/matrixone/pkg/frontend.executeStmtWithWorkspace
	/home/xupeng/github/matrixone/pkg/frontend/mysql_cmd_executor.go:2762
github.com/matrixorigin/matrixone/pkg/frontend.executeStmtWithTxn
	/home/xupeng/github/matrixone/pkg/frontend/mysql_cmd_executor.go:2637
github.com/matrixorigin/matrixone/pkg/frontend.executeStmtWithResponse
	/home/xupeng/github/matrixone/pkg/frontend/mysql_cmd_executor.go:2600
github.com/matrixorigin/matrixone/pkg/frontend.doComQuery
	/home/xupeng/github/matrixone/pkg/frontend/mysql_cmd_executor.go:3243
github.com/matrixorigin/matrixone/pkg/frontend.ExecRequest
	/home/xupeng/github/matrixone/pkg/frontend/mysql_cmd_executor.go:3323
github.com/matrixorigin/matrixone/pkg/frontend.(*Routine).handleRequest
	/home/xupeng/github/matrixone/pkg/frontend/routine.go:298
github.com/matrixorigin/matrixone/pkg/frontend.(*RoutineManager).Handler
	/home/xupeng/github/matrixone/pkg/frontend/routine_manager.go:386
github.com/matrixorigin/matrixone/pkg/frontend.(*MOServer).handleRequest
	/home/xupeng/github/matrixone/pkg/frontend/server.go:523
github.com/matrixorigin/matrixone/pkg/frontend.(*MOServer).handleMessage
	/home/xupeng/github/matrixone/pkg/frontend/server.go:493
github.com/matrixorigin/matrixone/pkg/frontend.(*MOServer).handleLoop
	/home/xupeng/github/matrixone/pkg/frontend/server.go:210
github.com/matrixorigin/matrixone/pkg/frontend.(*MOServer).handleConn
	/home/xupeng/github/matrixone/pkg/frontend/server.go:206
SELECT CAST(-32768 AS SMALLINT) DIV CAST(1 AS SMALLINT);
internal error: panic unsafe slice cast: from length 2 is not enough for length 8: 
github.com/matrixorigin/matrixone/pkg/common/util.UnsafeSliceCastToLength[...]
	/home/xupeng/github/matrixone/pkg/common/util/unsafe.go:85
github.com/matrixorigin/matrixone/pkg/container/vector.toSliceOfLengthNoTypeCheck[...]
	/home/xupeng/github/matrixone/pkg/container/vector/vector.go:77
github.com/matrixorigin/matrixone/pkg/container/vector.ToFixedCol[...]
	/home/xupeng/github/matrixone/pkg/container/vector/tools.go:43
github.com/matrixorigin/matrixone/pkg/container/vector.MustFixedColWithTypeCheck[...]
	/home/xupeng/github/matrixone/pkg/container/vector/tools.go:56
github.com/matrixorigin/matrixone/pkg/container/vector.GenerateFunctionFixedTypeParameter[...]
	/home/xupeng/github/matrixone/pkg/container/vector/functionTools.go:67
github.com/matrixorigin/matrixone/pkg/sql/plan/function.integerDivSigned
	/home/xupeng/github/matrixone/pkg/sql/plan/function/arithmetic.go:508
github.com/matrixorigin/matrixone/pkg/sql/plan/function.integerDivFn
	/home/xupeng/github/matrixone/pkg/sql/plan/function/arithmetic.go:486
github.com/matrixorigin/matrixone/pkg/sql/colexec.(*FunctionExpressionExecutor).doFold
	/home/xupeng/github/matrixone/pkg/sql/colexec/evalExpressionReset.go:171
github.com/matrixorigin/matrixone/pkg/sql/colexec.(*FunctionExpressionExecutor).Eval
	/home/xupeng/github/matrixone/pkg/sql/colexec/evalExpression.go:576
github.com/matrixorigin/matrixone/pkg/sql/colexec.getReadonlyResultFromExpression
	/home/xupeng/github/matrixone/pkg/sql/colexec/evalExpressionOpt.go:67
github.com/matrixorigin/matrixone/pkg/sql/colexec.GetReadonlyResultFromExpression
	/home/xupeng/github/matrixone/pkg/sql/colexec/evalExpressionOpt.go:57
github.com/matrixorigin/matrixone/pkg/sql/plan/rule.(*ConstantFold).constantFold
	/home/xupeng/github/matrixone/pkg/sql/plan/rule/constant_fold.go:200
github.com/matrixorigin/matrixone/pkg/sql/plan/rule.(*ConstantFold).Apply
	/home/xupeng/github/matrixone/pkg/sql/plan/rule/constant_fold.go:77
github.com/matrixorigin/matrixone/pkg/sql/plan.(*BaseOptimizer).exploreNode
	/home/xupeng/github/matrixone/pkg/sql/plan/optimize.go:87
github.com/matrixorigin/matrixone/pkg/sql/plan.(*BaseOptimizer).optimize
	/home/xupeng/github/matrixone/pkg/sql/plan/optimize.go:73
github.com/matrixorigin/matrixone/pkg/sql/plan.(*BaseOptimizer).Optimize
	/home/xupeng/github/matrixone/pkg/sql/plan/optimize.go:65
github.com/matrixorigin/matrixone/pkg/frontend.buildPlan
	/home/xupeng/github/matrixone/pkg/frontend/mysql_cmd_executor.go:2085
github.com/matrixorigin/matrixone/pkg/frontend.(*TxnComputationWrapper).Compile
	/home/xupeng/github/matrixone/pkg/frontend/computation_wrapper.go:210
github.com/matrixorigin/matrixone/pkg/frontend.executeStmt
	/home/xupeng/github/matrixone/pkg/frontend/mysql_cmd_executor.go:2959
github.com/matrixorigin/matrixone/pkg/frontend.dispatchStmt
	/home/xupeng/github/matrixone/pkg/frontend/mysql_cmd_executor.go:2853
github.com/matrixorigin/matrixone/pkg/frontend.executeStmtWithIncrStmt
	/home/xupeng/github/matrixone/pkg/frontend/mysql_cmd_executor.go:2818
github.com/matrixorigin/matrixone/pkg/frontend.executeStmtWithWorkspace
	/home/xupeng/github/matrixone/pkg/frontend/mysql_cmd_executor.go:2762
github.com/matrixorigin/matrixone/pkg/frontend.executeStmtWithTxn
	/home/xupeng/github/matrixone/pkg/frontend/mysql_cmd_executor.go:2637
github.com/matrixorigin/matrixone/pkg/frontend.executeStmtWithResponse
	/home/xupeng/github/matrixone/pkg/frontend/mysql_cmd_executor.go:2600
github.com/matrixorigin/matrixone/pkg/frontend.doComQuery
	/home/xupeng/github/matrixone/pkg/frontend/mysql_cmd_executor.go:3243
github.com/matrixorigin/matrixone/pkg/frontend.ExecRequest
	/home/xupeng/github/matrixone/pkg/frontend/mysql_cmd_executor.go:3323
github.com/matrixorigin/matrixone/pkg/frontend.(*Routine).handleRequest
	/home/xupeng/github/matrixone/pkg/frontend/routine.go:298
github.com/matrixorigin/matrixone/pkg/frontend.(*RoutineManager).Handler
	/home/xupeng/github/matrixone/pkg/frontend/routine_manager.go:386
github.com/matrixorigin/matrixone/pkg/frontend.(*MOServer).handleRequest
	/home/xupeng/github/matrixone/pkg/frontend/server.go:523
github.com/matrixorigin/matrixone/pkg/frontend.(*MOServer).handleMessage
	/home/xupeng/github/matrixone/pkg/frontend/server.go:493
github.com/matrixorigin/matrixone/pkg/frontend.(*MOServer).handleLoop
	/home/xupeng/github/matrixone/pkg/frontend/server.go:210
github.com/matrixorigin/matrixone/pkg/frontend.(*MOServer).handleConn
	/home/xupeng/github/matrixone/pkg/frontend/server.go:206
SELECT CAST(100 AS SMALLINT) DIV CAST(0 AS SMALLINT);
internal error: panic unsafe slice cast: from length 2 is not enough for length 8: 
github.com/matrixorigin/matrixone/pkg/common/util.UnsafeSliceCastToLength[...]
	/home/xupeng/github/matrixone/pkg/common/util/unsafe.go:85
github.com/matrixorigin/matrixone/pkg/container/vector.toSliceOfLengthNoTypeCheck[...]
	/home/xupeng/github/matrixone/pkg/container/vector/vector.go:77
github.com/matrixorigin/matrixone/pkg/container/vector.ToFixedCol[...]
	/home/xupeng/github/matrixone/pkg/container/vector/tools.go:43
github.com/matrixorigin/matrixone/pkg/container/vector.MustFixedColWithTypeCheck[...]
	/home/xupeng/github/matrixone/pkg/container/vector/tools.go:56
github.com/matrixorigin/matrixone/pkg/container/vector.GenerateFunctionFixedTypeParameter[...]
	/home/xupeng/github/matrixone/pkg/container/vector/functionTools.go:67
github.com/matrixorigin/matrixone/pkg/sql/plan/function.integerDivSigned
	/home/xupeng/github/matrixone/pkg/sql/plan/function/arithmetic.go:508
github.com/matrixorigin/matrixone/pkg/sql/plan/function.integerDivFn
	/home/xupeng/github/matrixone/pkg/sql/plan/function/arithmetic.go:486
github.com/matrixorigin/matrixone/pkg/sql/colexec.(*FunctionExpressionExecutor).doFold
	/home/xupeng/github/matrixone/pkg/sql/colexec/evalExpressionReset.go:171
github.com/matrixorigin/matrixone/pkg/sql/colexec.(*FunctionExpressionExecutor).Eval
	/home/xupeng/github/matrixone/pkg/sql/colexec/evalExpression.go:576
github.com/matrixorigin/matrixone/pkg/sql/colexec.getReadonlyResultFromExpression
	/home/xupeng/github/matrixone/pkg/sql/colexec/evalExpressionOpt.go:67
github.com/matrixorigin/matrixone/pkg/sql/colexec.GetReadonlyResultFromExpression
	/home/xupeng/github/matrixone/pkg/sql/colexec/evalExpressionOpt.go:57
github.com/matrixorigin/matrixone/pkg/sql/plan/rule.(*ConstantFold).constantFold
	/home/xupeng/github/matrixone/pkg/sql/plan/rule/constant_fold.go:200
github.com/matrixorigin/matrixone/pkg/sql/plan/rule.(*ConstantFold).Apply
	/home/xupeng/github/matrixone/pkg/sql/plan/rule/constant_fold.go:77
github.com/matrixorigin/matrixone/pkg/sql/plan.(*BaseOptimizer).exploreNode
	/home/xupeng/github/matrixone/pkg/sql/plan/optimize.go:87
github.com/matrixorigin/matrixone/pkg/sql/plan.(*BaseOptimizer).optimize
	/home/xupeng/github/matrixone/pkg/sql/plan/optimize.go:73
github.com/matrixorigin/matrixone/pkg/sql/plan.(*BaseOptimizer).Optimize
	/home/xupeng/github/matrixone/pkg/sql/plan/optimize.go:65
github.com/matrixorigin/matrixone/pkg/frontend.buildPlan
	/home/xupeng/github/matrixone/pkg/frontend/mysql_cmd_executor.go:2085
github.com/matrixorigin/matrixone/pkg/frontend.(*TxnComputationWrapper).Compile
	/home/xupeng/github/matrixone/pkg/frontend/computation_wrapper.go:210
github.com/matrixorigin/matrixone/pkg/frontend.executeStmt
	/home/xupeng/github/matrixone/pkg/frontend/mysql_cmd_executor.go:2959
github.com/matrixorigin/matrixone/pkg/frontend.dispatchStmt
	/home/xupeng/github/matrixone/pkg/frontend/mysql_cmd_executor.go:2853
github.com/matrixorigin/matrixone/pkg/frontend.executeStmtWithIncrStmt
	/home/xupeng/github/matrixone/pkg/frontend/mysql_cmd_executor.go:2818
github.com/matrixorigin/matrixone/pkg/frontend.executeStmtWithWorkspace
	/home/xupeng/github/matrixone/pkg/frontend/mysql_cmd_executor.go:2762
github.com/matrixorigin/matrixone/pkg/frontend.executeStmtWithTxn
	/home/xupeng/github/matrixone/pkg/frontend/mysql_cmd_executor.go:2637
github.com/matrixorigin/matrixone/pkg/frontend.executeStmtWithResponse
	/home/xupeng/github/matrixone/pkg/frontend/mysql_cmd_executor.go:2600
github.com/matrixorigin/matrixone/pkg/frontend.doComQuery
	/home/xupeng/github/matrixone/pkg/frontend/mysql_cmd_executor.go:3243
github.com/matrixorigin/matrixone/pkg/frontend.ExecRequest
	/home/xupeng/github/matrixone/pkg/frontend/mysql_cmd_executor.go:3323
github.com/matrixorigin/matrixone/pkg/frontend.(*Routine).handleRequest
	/home/xupeng/github/matrixone/pkg/frontend/routine.go:298
github.com/matrixorigin/matrixone/pkg/frontend.(*RoutineManager).Handler
	/home/xupeng/github/matrixone/pkg/frontend/routine_manager.go:386
github.com/matrixorigin/matrixone/pkg/frontend.(*MOServer).handleRequest
	/home/xupeng/github/matrixone/pkg/frontend/server.go:523
github.com/matrixorigin/matrixone/pkg/frontend.(*MOServer).handleMessage
	/home/xupeng/github/matrixone/pkg/frontend/server.go:493
github.com/matrixorigin/matrixone/pkg/frontend.(*MOServer).handleLoop
	/home/xupeng/github/matrixone/pkg/frontend/server.go:210
github.com/matrixorigin/matrixone/pkg/frontend.(*MOServer).handleConn
	/home/xupeng/github/matrixone/pkg/frontend/server.go:206
SELECT CAST(100000 AS INT) DIV CAST(3 AS INT);
internal error: panic unsafe slice cast: from length 4 is not enough for length 8: 
github.com/matrixorigin/matrixone/pkg/common/util.UnsafeSliceCastToLength[...]
	/home/xupeng/github/matrixone/pkg/common/util/unsafe.go:85
github.com/matrixorigin/matrixone/pkg/container/vector.toSliceOfLengthNoTypeCheck[...]
	/home/xupeng/github/matrixone/pkg/container/vector/vector.go:77
github.com/matrixorigin/matrixone/pkg/container/vector.ToFixedCol[...]
	/home/xupeng/github/matrixone/pkg/container/vector/tools.go:43
github.com/matrixorigin/matrixone/pkg/container/vector.MustFixedColWithTypeCheck[...]
	/home/xupeng/github/matrixone/pkg/container/vector/tools.go:56
github.com/matrixorigin/matrixone/pkg/container/vector.GenerateFunctionFixedTypeParameter[...]
	/home/xupeng/github/matrixone/pkg/container/vector/functionTools.go:67
github.com/matrixorigin/matrixone/pkg/sql/plan/function.integerDivSigned
	/home/xupeng/github/matrixone/pkg/sql/plan/function/arithmetic.go:508
github.com/matrixorigin/matrixone/pkg/sql/plan/function.integerDivFn
	/home/xupeng/github/matrixone/pkg/sql/plan/function/arithmetic.go:486
github.com/matrixorigin/matrixone/pkg/sql/colexec.(*FunctionExpressionExecutor).doFold
	/home/xupeng/github/matrixone/pkg/sql/colexec/evalExpressionReset.go:171
github.com/matrixorigin/matrixone/pkg/sql/colexec.(*FunctionExpressionExecutor).Eval
	/home/xupeng/github/matrixone/pkg/sql/colexec/evalExpression.go:576
github.com/matrixorigin/matrixone/pkg/sql/colexec.getReadonlyResultFromExpression
	/home/xupeng/github/matrixone/pkg/sql/colexec/evalExpressionOpt.go:67
github.com/matrixorigin/matrixone/pkg/sql/colexec.GetReadonlyResultFromExpression
	/home/xupeng/github/matrixone/pkg/sql/colexec/evalExpressionOpt.go:57
github.com/matrixorigin/matrixone/pkg/sql/plan/rule.(*ConstantFold).constantFold
	/home/xupeng/github/matrixone/pkg/sql/plan/rule/constant_fold.go:200
github.com/matrixorigin/matrixone/pkg/sql/plan/rule.(*ConstantFold).Apply
	/home/xupeng/github/matrixone/pkg/sql/plan/rule/constant_fold.go:77
github.com/matrixorigin/matrixone/pkg/sql/plan.(*BaseOptimizer).exploreNode
	/home/xupeng/github/matrixone/pkg/sql/plan/optimize.go:87
github.com/matrixorigin/matrixone/pkg/sql/plan.(*BaseOptimizer).optimize
	/home/xupeng/github/matrixone/pkg/sql/plan/optimize.go:73
github.com/matrixorigin/matrixone/pkg/sql/plan.(*BaseOptimizer).Optimize
	/home/xupeng/github/matrixone/pkg/sql/plan/optimize.go:65
github.com/matrixorigin/matrixone/pkg/frontend.buildPlan
	/home/xupeng/github/matrixone/pkg/frontend/mysql_cmd_executor.go:2085
github.com/matrixorigin/matrixone/pkg/frontend.(*TxnComputationWrapper).Compile
	/home/xupeng/github/matrixone/pkg/frontend/computation_wrapper.go:210
github.com/matrixorigin/matrixone/pkg/frontend.executeStmt
	/home/xupeng/github/matrixone/pkg/frontend/mysql_cmd_executor.go:2959
github.com/matrixorigin/matrixone/pkg/frontend.dispatchStmt
	/home/xupeng/github/matrixone/pkg/frontend/mysql_cmd_executor.go:2853
github.com/matrixorigin/matrixone/pkg/frontend.executeStmtWithIncrStmt
	/home/xupeng/github/matrixone/pkg/frontend/mysql_cmd_executor.go:2818
github.com/matrixorigin/matrixone/pkg/frontend.executeStmtWithWorkspace
	/home/xupeng/github/matrixone/pkg/frontend/mysql_cmd_executor.go:2762
github.com/matrixorigin/matrixone/pkg/frontend.executeStmtWithTxn
	/home/xupeng/github/matrixone/pkg/frontend/mysql_cmd_executor.go:2637
github.com/matrixorigin/matrixone/pkg/frontend.executeStmtWithResponse
	/home/xupeng/github/matrixone/pkg/frontend/mysql_cmd_executor.go:2600
github.com/matrixorigin/matrixone/pkg/frontend.doComQuery
	/home/xupeng/github/matrixone/pkg/frontend/mysql_cmd_executor.go:3243
github.com/matrixorigin/matrixone/pkg/frontend.ExecRequest
	/home/xupeng/github/matrixone/pkg/frontend/mysql_cmd_executor.go:3323
github.com/matrixorigin/matrixone/pkg/frontend.(*Routine).handleRequest
	/home/xupeng/github/matrixone/pkg/frontend/routine.go:298
github.com/matrixorigin/matrixone/pkg/frontend.(*RoutineManager).Handler
	/home/xupeng/github/matrixone/pkg/frontend/routine_manager.go:386
github.com/matrixorigin/matrixone/pkg/frontend.(*MOServer).handleRequest
	/home/xupeng/github/matrixone/pkg/frontend/server.go:523
github.com/matrixorigin/matrixone/pkg/frontend.(*MOServer).handleMessage
	/home/xupeng/github/matrixone/pkg/frontend/server.go:493
github.com/matrixorigin/matrixone/pkg/frontend.(*MOServer).handleLoop
	/home/xupeng/github/matrixone/pkg/frontend/server.go:210
github.com/matrixorigin/matrixone/pkg/frontend.(*MOServer).handleConn
	/home/xupeng/github/matrixone/pkg/frontend/server.go:206
SELECT CAST(2147483647 AS INT) DIV CAST(1 AS INT);
internal error: panic unsafe slice cast: from length 4 is not enough for length 8: 
github.com/matrixorigin/matrixone/pkg/common/util.UnsafeSliceCastToLength[...]
	/home/xupeng/github/matrixone/pkg/common/util/unsafe.go:85
github.com/matrixorigin/matrixone/pkg/container/vector.toSliceOfLengthNoTypeCheck[...]
	/home/xupeng/github/matrixone/pkg/container/vector/vector.go:77
github.com/matrixorigin/matrixone/pkg/container/vector.ToFixedCol[...]
	/home/xupeng/github/matrixone/pkg/container/vector/tools.go:43
github.com/matrixorigin/matrixone/pkg/container/vector.MustFixedColWithTypeCheck[...]
	/home/xupeng/github/matrixone/pkg/container/vector/tools.go:56
github.com/matrixorigin/matrixone/pkg/container/vector.GenerateFunctionFixedTypeParameter[...]
	/home/xupeng/github/matrixone/pkg/container/vector/functionTools.go:67
github.com/matrixorigin/matrixone/pkg/sql/plan/function.integerDivSigned
	/home/xupeng/github/matrixone/pkg/sql/plan/function/arithmetic.go:508
github.com/matrixorigin/matrixone/pkg/sql/plan/function.integerDivFn
	/home/xupeng/github/matrixone/pkg/sql/plan/function/arithmetic.go:486
github.com/matrixorigin/matrixone/pkg/sql/colexec.(*FunctionExpressionExecutor).doFold
	/home/xupeng/github/matrixone/pkg/sql/colexec/evalExpressionReset.go:171
github.com/matrixorigin/matrixone/pkg/sql/colexec.(*FunctionExpressionExecutor).Eval
	/home/xupeng/github/matrixone/pkg/sql/colexec/evalExpression.go:576
github.com/matrixorigin/matrixone/pkg/sql/colexec.getReadonlyResultFromExpression
	/home/xupeng/github/matrixone/pkg/sql/colexec/evalExpressionOpt.go:67
github.com/matrixorigin/matrixone/pkg/sql/colexec.GetReadonlyResultFromExpression
	/home/xupeng/github/matrixone/pkg/sql/colexec/evalExpressionOpt.go:57
github.com/matrixorigin/matrixone/pkg/sql/plan/rule.(*ConstantFold).constantFold
	/home/xupeng/github/matrixone/pkg/sql/plan/rule/constant_fold.go:200
github.com/matrixorigin/matrixone/pkg/sql/plan/rule.(*ConstantFold).Apply
	/home/xupeng/github/matrixone/pkg/sql/plan/rule/constant_fold.go:77
github.com/matrixorigin/matrixone/pkg/sql/plan.(*BaseOptimizer).exploreNode
	/home/xupeng/github/matrixone/pkg/sql/plan/optimize.go:87
github.com/matrixorigin/matrixone/pkg/sql/plan.(*BaseOptimizer).optimize
	/home/xupeng/github/matrixone/pkg/sql/plan/optimize.go:73
github.com/matrixorigin/matrixone/pkg/sql/plan.(*BaseOptimizer).Optimize
	/home/xupeng/github/matrixone/pkg/sql/plan/optimize.go:65
github.com/matrixorigin/matrixone/pkg/frontend.buildPlan
	/home/xupeng/github/matrixone/pkg/frontend/mysql_cmd_executor.go:2085
github.com/matrixorigin/matrixone/pkg/frontend.(*TxnComputationWrapper).Compile
	/home/xupeng/github/matrixone/pkg/frontend/computation_wrapper.go:210
github.com/matrixorigin/matrixone/pkg/frontend.executeStmt
	/home/xupeng/github/matrixone/pkg/frontend/mysql_cmd_executor.go:2959
github.com/matrixorigin/matrixone/pkg/frontend.dispatchStmt
	/home/xupeng/github/matrixone/pkg/frontend/mysql_cmd_executor.go:2853
github.com/matrixorigin/matrixone/pkg/frontend.executeStmtWithIncrStmt
	/home/xupeng/github/matrixone/pkg/frontend/mysql_cmd_executor.go:2818
github.com/matrixorigin/matrixone/pkg/frontend.executeStmtWithWorkspace
	/home/xupeng/github/matrixone/pkg/frontend/mysql_cmd_executor.go:2762
github.com/matrixorigin/matrixone/pkg/frontend.executeStmtWithTxn
	/home/xupeng/github/matrixone/pkg/frontend/mysql_cmd_executor.go:2637
github.com/matrixorigin/matrixone/pkg/frontend.executeStmtWithResponse
	/home/xupeng/github/matrixone/pkg/frontend/mysql_cmd_executor.go:2600
github.com/matrixorigin/matrixone/pkg/frontend.doComQuery
	/home/xupeng/github/matrixone/pkg/frontend/mysql_cmd_executor.go:3243
github.com/matrixorigin/matrixone/pkg/frontend.ExecRequest
	/home/xupeng/github/matrixone/pkg/frontend/mysql_cmd_executor.go:3323
github.com/matrixorigin/matrixone/pkg/frontend.(*Routine).handleRequest
	/home/xupeng/github/matrixone/pkg/frontend/routine.go:298
github.com/matrixorigin/matrixone/pkg/frontend.(*RoutineManager).Handler
	/home/xupeng/github/matrixone/pkg/frontend/routine_manager.go:386
github.com/matrixorigin/matrixone/pkg/frontend.(*MOServer).handleRequest
	/home/xupeng/github/matrixone/pkg/frontend/server.go:523
github.com/matrixorigin/matrixone/pkg/frontend.(*MOServer).handleMessage
	/home/xupeng/github/matrixone/pkg/frontend/server.go:493
github.com/matrixorigin/matrixone/pkg/frontend.(*MOServer).handleLoop
	/home/xupeng/github/matrixone/pkg/frontend/server.go:210
github.com/matrixorigin/matrixone/pkg/frontend.(*MOServer).handleConn
	/home/xupeng/github/matrixone/pkg/frontend/server.go:206
SELECT CAST(-2147483648 AS INT) DIV CAST(1 AS INT);
internal error: panic unsafe slice cast: from length 4 is not enough for length 8: 
github.com/matrixorigin/matrixone/pkg/common/util.UnsafeSliceCastToLength[...]
	/home/xupeng/github/matrixone/pkg/common/util/unsafe.go:85
github.com/matrixorigin/matrixone/pkg/container/vector.toSliceOfLengthNoTypeCheck[...]
	/home/xupeng/github/matrixone/pkg/container/vector/vector.go:77
github.com/matrixorigin/matrixone/pkg/container/vector.ToFixedCol[...]
	/home/xupeng/github/matrixone/pkg/container/vector/tools.go:43
github.com/matrixorigin/matrixone/pkg/container/vector.MustFixedColWithTypeCheck[...]
	/home/xupeng/github/matrixone/pkg/container/vector/tools.go:56
github.com/matrixorigin/matrixone/pkg/container/vector.GenerateFunctionFixedTypeParameter[...]
	/home/xupeng/github/matrixone/pkg/container/vector/functionTools.go:67
github.com/matrixorigin/matrixone/pkg/sql/plan/function.integerDivSigned
	/home/xupeng/github/matrixone/pkg/sql/plan/function/arithmetic.go:508
github.com/matrixorigin/matrixone/pkg/sql/plan/function.integerDivFn
	/home/xupeng/github/matrixone/pkg/sql/plan/function/arithmetic.go:486
github.com/matrixorigin/matrixone/pkg/sql/colexec.(*FunctionExpressionExecutor).doFold
	/home/xupeng/github/matrixone/pkg/sql/colexec/evalExpressionReset.go:171
github.com/matrixorigin/matrixone/pkg/sql/colexec.(*FunctionExpressionExecutor).Eval
	/home/xupeng/github/matrixone/pkg/sql/colexec/evalExpression.go:576
github.com/matrixorigin/matrixone/pkg/sql/colexec.getReadonlyResultFromExpression
	/home/xupeng/github/matrixone/pkg/sql/colexec/evalExpressionOpt.go:67
github.com/matrixorigin/matrixone/pkg/sql/colexec.GetReadonlyResultFromExpression
	/home/xupeng/github/matrixone/pkg/sql/colexec/evalExpressionOpt.go:57
github.com/matrixorigin/matrixone/pkg/sql/plan/rule.(*ConstantFold).constantFold
	/home/xupeng/github/matrixone/pkg/sql/plan/rule/constant_fold.go:200
github.com/matrixorigin/matrixone/pkg/sql/plan/rule.(*ConstantFold).Apply
	/home/xupeng/github/matrixone/pkg/sql/plan/rule/constant_fold.go:77
github.com/matrixorigin/matrixone/pkg/sql/plan.(*BaseOptimizer).exploreNode
	/home/xupeng/github/matrixone/pkg/sql/plan/optimize.go:87
github.com/matrixorigin/matrixone/pkg/sql/plan.(*BaseOptimizer).optimize
	/home/xupeng/github/matrixone/pkg/sql/plan/optimize.go:73
github.com/matrixorigin/matrixone/pkg/sql/plan.(*BaseOptimizer).Optimize
	/home/xupeng/github/matrixone/pkg/sql/plan/optimize.go:65
github.com/matrixorigin/matrixone/pkg/frontend.buildPlan
	/home/xupeng/github/matrixone/pkg/frontend/mysql_cmd_executor.go:2085
github.com/matrixorigin/matrixone/pkg/frontend.(*TxnComputationWrapper).Compile
	/home/xupeng/github/matrixone/pkg/frontend/computation_wrapper.go:210
github.com/matrixorigin/matrixone/pkg/frontend.executeStmt
	/home/xupeng/github/matrixone/pkg/frontend/mysql_cmd_executor.go:2959
github.com/matrixorigin/matrixone/pkg/frontend.dispatchStmt
	/home/xupeng/github/matrixone/pkg/frontend/mysql_cmd_executor.go:2853
github.com/matrixorigin/matrixone/pkg/frontend.executeStmtWithIncrStmt
	/home/xupeng/github/matrixone/pkg/frontend/mysql_cmd_executor.go:2818
github.com/matrixorigin/matrixone/pkg/frontend.executeStmtWithWorkspace
	/home/xupeng/github/matrixone/pkg/frontend/mysql_cmd_executor.go:2762
github.com/matrixorigin/matrixone/pkg/frontend.executeStmtWithTxn
	/home/xupeng/github/matrixone/pkg/frontend/mysql_cmd_executor.go:2637
github.com/matrixorigin/matrixone/pkg/frontend.executeStmtWithResponse
	/home/xupeng/github/matrixone/pkg/frontend/mysql_cmd_executor.go:2600
github.com/matrixorigin/matrixone/pkg/frontend.doComQuery
	/home/xupeng/github/matrixone/pkg/frontend/mysql_cmd_executor.go:3243
github.com/matrixorigin/matrixone/pkg/frontend.ExecRequest
	/home/xupeng/github/matrixone/pkg/frontend/mysql_cmd_executor.go:3323
github.com/matrixorigin/matrixone/pkg/frontend.(*Routine).handleRequest
	/home/xupeng/github/matrixone/pkg/frontend/routine.go:298
github.com/matrixorigin/matrixone/pkg/frontend.(*RoutineManager).Handler
	/home/xupeng/github/matrixone/pkg/frontend/routine_manager.go:386
github.com/matrixorigin/matrixone/pkg/frontend.(*MOServer).handleRequest
	/home/xupeng/github/matrixone/pkg/frontend/server.go:523
github.com/matrixorigin/matrixone/pkg/frontend.(*MOServer).handleMessage
	/home/xupeng/github/matrixone/pkg/frontend/server.go:493
github.com/matrixorigin/matrixone/pkg/frontend.(*MOServer).handleLoop
	/home/xupeng/github/matrixone/pkg/frontend/server.go:210
github.com/matrixorigin/matrixone/pkg/frontend.(*MOServer).handleConn
	/home/xupeng/github/matrixone/pkg/frontend/server.go:206
SELECT CAST(100 AS INT) DIV CAST(0 AS INT);
internal error: panic unsafe slice cast: from length 4 is not enough for length 8: 
github.com/matrixorigin/matrixone/pkg/common/util.UnsafeSliceCastToLength[...]
	/home/xupeng/github/matrixone/pkg/common/util/unsafe.go:85
github.com/matrixorigin/matrixone/pkg/container/vector.toSliceOfLengthNoTypeCheck[...]
	/home/xupeng/github/matrixone/pkg/container/vector/vector.go:77
github.com/matrixorigin/matrixone/pkg/container/vector.ToFixedCol[...]
	/home/xupeng/github/matrixone/pkg/container/vector/tools.go:43
github.com/matrixorigin/matrixone/pkg/container/vector.MustFixedColWithTypeCheck[...]
	/home/xupeng/github/matrixone/pkg/container/vector/tools.go:56
github.com/matrixorigin/matrixone/pkg/container/vector.GenerateFunctionFixedTypeParameter[...]
	/home/xupeng/github/matrixone/pkg/container/vector/functionTools.go:67
github.com/matrixorigin/matrixone/pkg/sql/plan/function.integerDivSigned
	/home/xupeng/github/matrixone/pkg/sql/plan/function/arithmetic.go:508
github.com/matrixorigin/matrixone/pkg/sql/plan/function.integerDivFn
	/home/xupeng/github/matrixone/pkg/sql/plan/function/arithmetic.go:486
github.com/matrixorigin/matrixone/pkg/sql/colexec.(*FunctionExpressionExecutor).doFold
	/home/xupeng/github/matrixone/pkg/sql/colexec/evalExpressionReset.go:171
github.com/matrixorigin/matrixone/pkg/sql/colexec.(*FunctionExpressionExecutor).Eval
	/home/xupeng/github/matrixone/pkg/sql/colexec/evalExpression.go:576
github.com/matrixorigin/matrixone/pkg/sql/colexec.getReadonlyResultFromExpression
	/home/xupeng/github/matrixone/pkg/sql/colexec/evalExpressionOpt.go:67
github.com/matrixorigin/matrixone/pkg/sql/colexec.GetReadonlyResultFromExpression
	/home/xupeng/github/matrixone/pkg/sql/colexec/evalExpressionOpt.go:57
github.com/matrixorigin/matrixone/pkg/sql/plan/rule.(*ConstantFold).constantFold
	/home/xupeng/github/matrixone/pkg/sql/plan/rule/constant_fold.go:200
github.com/matrixorigin/matrixone/pkg/sql/plan/rule.(*ConstantFold).Apply
	/home/xupeng/github/matrixone/pkg/sql/plan/rule/constant_fold.go:77
github.com/matrixorigin/matrixone/pkg/sql/plan.(*BaseOptimizer).exploreNode
	/home/xupeng/github/matrixone/pkg/sql/plan/optimize.go:87
github.com/matrixorigin/matrixone/pkg/sql/plan.(*BaseOptimizer).optimize
	/home/xupeng/github/matrixone/pkg/sql/plan/optimize.go:73
github.com/matrixorigin/matrixone/pkg/sql/plan.(*BaseOptimizer).Optimize
	/home/xupeng/github/matrixone/pkg/sql/plan/optimize.go:65
github.com/matrixorigin/matrixone/pkg/frontend.buildPlan
	/home/xupeng/github/matrixone/pkg/frontend/mysql_cmd_executor.go:2085
github.com/matrixorigin/matrixone/pkg/frontend.(*TxnComputationWrapper).Compile
	/home/xupeng/github/matrixone/pkg/frontend/computation_wrapper.go:210
github.com/matrixorigin/matrixone/pkg/frontend.executeStmt
	/home/xupeng/github/matrixone/pkg/frontend/mysql_cmd_executor.go:2959
github.com/matrixorigin/matrixone/pkg/frontend.dispatchStmt
	/home/xupeng/github/matrixone/pkg/frontend/mysql_cmd_executor.go:2853
github.com/matrixorigin/matrixone/pkg/frontend.executeStmtWithIncrStmt
	/home/xupeng/github/matrixone/pkg/frontend/mysql_cmd_executor.go:2818
github.com/matrixorigin/matrixone/pkg/frontend.executeStmtWithWorkspace
	/home/xupeng/github/matrixone/pkg/frontend/mysql_cmd_executor.go:2762
github.com/matrixorigin/matrixone/pkg/frontend.executeStmtWithTxn
	/home/xupeng/github/matrixone/pkg/frontend/mysql_cmd_executor.go:2637
github.com/matrixorigin/matrixone/pkg/frontend.executeStmtWithResponse
	/home/xupeng/github/matrixone/pkg/frontend/mysql_cmd_executor.go:2600
github.com/matrixorigin/matrixone/pkg/frontend.doComQuery
	/home/xupeng/github/matrixone/pkg/frontend/mysql_cmd_executor.go:3243
github.com/matrixorigin/matrixone/pkg/frontend.ExecRequest
	/home/xupeng/github/matrixone/pkg/frontend/mysql_cmd_executor.go:3323
github.com/matrixorigin/matrixone/pkg/frontend.(*Routine).handleRequest
	/home/xupeng/github/matrixone/pkg/frontend/routine.go:298
github.com/matrixorigin/matrixone/pkg/frontend.(*RoutineManager).Handler
	/home/xupeng/github/matrixone/pkg/frontend/routine_manager.go:386
github.com/matrixorigin/matrixone/pkg/frontend.(*MOServer).handleRequest
	/home/xupeng/github/matrixone/pkg/frontend/server.go:523
github.com/matrixorigin/matrixone/pkg/frontend.(*MOServer).handleMessage
	/home/xupeng/github/matrixone/pkg/frontend/server.go:493
github.com/matrixorigin/matrixone/pkg/frontend.(*MOServer).handleLoop
	/home/xupeng/github/matrixone/pkg/frontend/server.go:210
github.com/matrixorigin/matrixone/pkg/frontend.(*MOServer).handleConn
	/home/xupeng/github/matrixone/pkg/frontend/server.go:206
SELECT CAST(10000000000 AS BIGINT) DIV CAST(3 AS BIGINT);
➤ cast(10000000000 as bigint) div cast(3 as bigint)[-5,64,0]  𝄀
3333333333
SELECT CAST(9223372036854775807 AS BIGINT) DIV CAST(1 AS BIGINT);
➤ cast(9223372036854775807 as bigint) div cast(1 as bigint)[-5,64,0]  𝄀
9223372036854775807
SELECT CAST(-9223372036854775808 AS BIGINT) DIV CAST(1 AS BIGINT);
➤ cast(-9223372036854775808 as bigint) div cast(1 as bigint)[-5,64,0]  𝄀
-9223372036854775808
SELECT CAST(100 AS BIGINT) DIV CAST(0 AS BIGINT);
➤ cast(100 as bigint) div cast(0 as bigint)[-5,64,0]  𝄀
null
SELECT CAST(10 AS TINYINT UNSIGNED) DIV CAST(3 AS TINYINT UNSIGNED);
internal error: panic unsafe slice cast: from length 1 is not enough for length 8: 
github.com/matrixorigin/matrixone/pkg/common/util.UnsafeSliceCastToLength[...]
	/home/xupeng/github/matrixone/pkg/common/util/unsafe.go:85
github.com/matrixorigin/matrixone/pkg/container/vector.toSliceOfLengthNoTypeCheck[...]
	/home/xupeng/github/matrixone/pkg/container/vector/vector.go:77
github.com/matrixorigin/matrixone/pkg/container/vector.ToFixedCol[...]
	/home/xupeng/github/matrixone/pkg/container/vector/tools.go:43
github.com/matrixorigin/matrixone/pkg/container/vector.MustFixedColWithTypeCheck[...]
	/home/xupeng/github/matrixone/pkg/container/vector/tools.go:56
github.com/matrixorigin/matrixone/pkg/container/vector.GenerateFunctionFixedTypeParameter[...]
	/home/xupeng/github/matrixone/pkg/container/vector/functionTools.go:67
github.com/matrixorigin/matrixone/pkg/sql/plan/function.integerDivUnsigned
	/home/xupeng/github/matrixone/pkg/sql/plan/function/arithmetic.go:535
github.com/matrixorigin/matrixone/pkg/sql/plan/function.integerDivFn
	/home/xupeng/github/matrixone/pkg/sql/plan/function/arithmetic.go:489
github.com/matrixorigin/matrixone/pkg/sql/colexec.(*FunctionExpressionExecutor).doFold
	/home/xupeng/github/matrixone/pkg/sql/colexec/evalExpressionReset.go:171
github.com/matrixorigin/matrixone/pkg/sql/colexec.(*FunctionExpressionExecutor).Eval
	/home/xupeng/github/matrixone/pkg/sql/colexec/evalExpression.go:576
github.com/matrixorigin/matrixone/pkg/sql/colexec.getReadonlyResultFromExpression
	/home/xupeng/github/matrixone/pkg/sql/colexec/evalExpressionOpt.go:67
github.com/matrixorigin/matrixone/pkg/sql/colexec.GetReadonlyResultFromExpression
	/home/xupeng/github/matrixone/pkg/sql/colexec/evalExpressionOpt.go:57
github.com/matrixorigin/matrixone/pkg/sql/plan/rule.(*ConstantFold).constantFold
	/home/xupeng/github/matrixone/pkg/sql/plan/rule/constant_fold.go:200
github.com/matrixorigin/matrixone/pkg/sql/plan/rule.(*ConstantFold).Apply
	/home/xupeng/github/matrixone/pkg/sql/plan/rule/constant_fold.go:77
github.com/matrixorigin/matrixone/pkg/sql/plan.(*BaseOptimizer).exploreNode
	/home/xupeng/github/matrixone/pkg/sql/plan/optimize.go:87
github.com/matrixorigin/matrixone/pkg/sql/plan.(*BaseOptimizer).optimize
	/home/xupeng/github/matrixone/pkg/sql/plan/optimize.go:73
github.com/matrixorigin/matrixone/pkg/sql/plan.(*BaseOptimizer).Optimize
	/home/xupeng/github/matrixone/pkg/sql/plan/optimize.go:65
github.com/matrixorigin/matrixone/pkg/frontend.buildPlan
	/home/xupeng/github/matrixone/pkg/frontend/mysql_cmd_executor.go:2085
github.com/matrixorigin/matrixone/pkg/frontend.(*TxnComputationWrapper).Compile
	/home/xupeng/github/matrixone/pkg/frontend/computation_wrapper.go:210
github.com/matrixorigin/matrixone/pkg/frontend.executeStmt
	/home/xupeng/github/matrixone/pkg/frontend/mysql_cmd_executor.go:2959
github.com/matrixorigin/matrixone/pkg/frontend.dispatchStmt
	/home/xupeng/github/matrixone/pkg/frontend/mysql_cmd_executor.go:2853
github.com/matrixorigin/matrixone/pkg/frontend.executeStmtWithIncrStmt
	/home/xupeng/github/matrixone/pkg/frontend/mysql_cmd_executor.go:2818
github.com/matrixorigin/matrixone/pkg/frontend.executeStmtWithWorkspace
	/home/xupeng/github/matrixone/pkg/frontend/mysql_cmd_executor.go:2762
github.com/matrixorigin/matrixone/pkg/frontend.executeStmtWithTxn
	/home/xupeng/github/matrixone/pkg/frontend/mysql_cmd_executor.go:2637
github.com/matrixorigin/matrixone/pkg/frontend.executeStmtWithResponse
	/home/xupeng/github/matrixone/pkg/frontend/mysql_cmd_executor.go:2600
github.com/matrixorigin/matrixone/pkg/frontend.doComQuery
	/home/xupeng/github/matrixone/pkg/frontend/mysql_cmd_executor.go:3243
github.com/matrixorigin/matrixone/pkg/frontend.ExecRequest
	/home/xupeng/github/matrixone/pkg/frontend/mysql_cmd_executor.go:3323
github.com/matrixorigin/matrixone/pkg/frontend.(*Routine).handleRequest
	/home/xupeng/github/matrixone/pkg/frontend/routine.go:298
github.com/matrixorigin/matrixone/pkg/frontend.(*RoutineManager).Handler
	/home/xupeng/github/matrixone/pkg/frontend/routine_manager.go:386
github.com/matrixorigin/matrixone/pkg/frontend.(*MOServer).handleRequest
	/home/xupeng/github/matrixone/pkg/frontend/server.go:523
github.com/matrixorigin/matrixone/pkg/frontend.(*MOServer).handleMessage
	/home/xupeng/github/matrixone/pkg/frontend/server.go:493
github.com/matrixorigin/matrixone/pkg/frontend.(*MOServer).handleLoop
	/home/xupeng/github/matrixone/pkg/frontend/server.go:210
github.com/matrixorigin/matrixone/pkg/frontend.(*MOServer).handleConn
	/home/xupeng/github/matrixone/pkg/frontend/server.go:206
SELECT CAST(255 AS TINYINT UNSIGNED) DIV CAST(1 AS TINYINT UNSIGNED);
internal error: panic unsafe slice cast: from length 1 is not enough for length 8: 
github.com/matrixorigin/matrixone/pkg/common/util.UnsafeSliceCastToLength[...]
	/home/xupeng/github/matrixone/pkg/common/util/unsafe.go:85
github.com/matrixorigin/matrixone/pkg/container/vector.toSliceOfLengthNoTypeCheck[...]
	/home/xupeng/github/matrixone/pkg/container/vector/vector.go:77
github.com/matrixorigin/matrixone/pkg/container/vector.ToFixedCol[...]
	/home/xupeng/github/matrixone/pkg/container/vector/tools.go:43
github.com/matrixorigin/matrixone/pkg/container/vector.MustFixedColWithTypeCheck[...]
	/home/xupeng/github/matrixone/pkg/container/vector/tools.go:56
github.com/matrixorigin/matrixone/pkg/container/vector.GenerateFunctionFixedTypeParameter[...]
	/home/xupeng/github/matrixone/pkg/container/vector/functionTools.go:67
github.com/matrixorigin/matrixone/pkg/sql/plan/function.integerDivUnsigned
	/home/xupeng/github/matrixone/pkg/sql/plan/function/arithmetic.go:535
github.com/matrixorigin/matrixone/pkg/sql/plan/function.integerDivFn
	/home/xupeng/github/matrixone/pkg/sql/plan/function/arithmetic.go:489
github.com/matrixorigin/matrixone/pkg/sql/colexec.(*FunctionExpressionExecutor).doFold
	/home/xupeng/github/matrixone/pkg/sql/colexec/evalExpressionReset.go:171
github.com/matrixorigin/matrixone/pkg/sql/colexec.(*FunctionExpressionExecutor).Eval
	/home/xupeng/github/matrixone/pkg/sql/colexec/evalExpression.go:576
github.com/matrixorigin/matrixone/pkg/sql/colexec.getReadonlyResultFromExpression
	/home/xupeng/github/matrixone/pkg/sql/colexec/evalExpressionOpt.go:67
github.com/matrixorigin/matrixone/pkg/sql/colexec.GetReadonlyResultFromExpression
	/home/xupeng/github/matrixone/pkg/sql/colexec/evalExpressionOpt.go:57
github.com/matrixorigin/matrixone/pkg/sql/plan/rule.(*ConstantFold).constantFold
	/home/xupeng/github/matrixone/pkg/sql/plan/rule/constant_fold.go:200
github.com/matrixorigin/matrixone/pkg/sql/plan/rule.(*ConstantFold).Apply
	/home/xupeng/github/matrixone/pkg/sql/plan/rule/constant_fold.go:77
github.com/matrixorigin/matrixone/pkg/sql/plan.(*BaseOptimizer).exploreNode
	/home/xupeng/github/matrixone/pkg/sql/plan/optimize.go:87
github.com/matrixorigin/matrixone/pkg/sql/plan.(*BaseOptimizer).optimize
	/home/xupeng/github/matrixone/pkg/sql/plan/optimize.go:73
github.com/matrixorigin/matrixone/pkg/sql/plan.(*BaseOptimizer).Optimize
	/home/xupeng/github/matrixone/pkg/sql/plan/optimize.go:65
github.com/matrixorigin/matrixone/pkg/frontend.buildPlan
	/home/xupeng/github/matrixone/pkg/frontend/mysql_cmd_executor.go:2085
github.com/matrixorigin/matrixone/pkg/frontend.(*TxnComputationWrapper).Compile
	/home/xupeng/github/matrixone/pkg/frontend/computation_wrapper.go:210
github.com/matrixorigin/matrixone/pkg/frontend.executeStmt
	/home/xupeng/github/matrixone/pkg/frontend/mysql_cmd_executor.go:2959
github.com/matrixorigin/matrixone/pkg/frontend.dispatchStmt
	/home/xupeng/github/matrixone/pkg/frontend/mysql_cmd_executor.go:2853
github.com/matrixorigin/matrixone/pkg/frontend.executeStmtWithIncrStmt
	/home/xupeng/github/matrixone/pkg/frontend/mysql_cmd_executor.go:2818
github.com/matrixorigin/matrixone/pkg/frontend.executeStmtWithWorkspace
	/home/xupeng/github/matrixone/pkg/frontend/mysql_cmd_executor.go:2762
github.com/matrixorigin/matrixone/pkg/frontend.executeStmtWithTxn
	/home/xupeng/github/matrixone/pkg/frontend/mysql_cmd_executor.go:2637
github.com/matrixorigin/matrixone/pkg/frontend.executeStmtWithResponse
	/home/xupeng/github/matrixone/pkg/frontend/mysql_cmd_executor.go:2600
github.com/matrixorigin/matrixone/pkg/frontend.doComQuery
	/home/xupeng/github/matrixone/pkg/frontend/mysql_cmd_executor.go:3243
github.com/matrixorigin/matrixone/pkg/frontend.ExecRequest
	/home/xupeng/github/matrixone/pkg/frontend/mysql_cmd_executor.go:3323
github.com/matrixorigin/matrixone/pkg/frontend.(*Routine).handleRequest
	/home/xupeng/github/matrixone/pkg/frontend/routine.go:298
github.com/matrixorigin/matrixone/pkg/frontend.(*RoutineManager).Handler
	/home/xupeng/github/matrixone/pkg/frontend/routine_manager.go:386
github.com/matrixorigin/matrixone/pkg/frontend.(*MOServer).handleRequest
	/home/xupeng/github/matrixone/pkg/frontend/server.go:523
github.com/matrixorigin/matrixone/pkg/frontend.(*MOServer).handleMessage
	/home/xupeng/github/matrixone/pkg/frontend/server.go:493
github.com/matrixorigin/matrixone/pkg/frontend.(*MOServer).handleLoop
	/home/xupeng/github/matrixone/pkg/frontend/server.go:210
github.com/matrixorigin/matrixone/pkg/frontend.(*MOServer).handleConn
	/home/xupeng/github/matrixone/pkg/frontend/server.go:206
SELECT CAST(10 AS TINYINT UNSIGNED) DIV CAST(0 AS TINYINT UNSIGNED);
internal error: panic unsafe slice cast: from length 1 is not enough for length 8: 
github.com/matrixorigin/matrixone/pkg/common/util.UnsafeSliceCastToLength[...]
	/home/xupeng/github/matrixone/pkg/common/util/unsafe.go:85
github.com/matrixorigin/matrixone/pkg/container/vector.toSliceOfLengthNoTypeCheck[...]
	/home/xupeng/github/matrixone/pkg/container/vector/vector.go:77
github.com/matrixorigin/matrixone/pkg/container/vector.ToFixedCol[...]
	/home/xupeng/github/matrixone/pkg/container/vector/tools.go:43
github.com/matrixorigin/matrixone/pkg/container/vector.MustFixedColWithTypeCheck[...]
	/home/xupeng/github/matrixone/pkg/container/vector/tools.go:56
github.com/matrixorigin/matrixone/pkg/container/vector.GenerateFunctionFixedTypeParameter[...]
	/home/xupeng/github/matrixone/pkg/container/vector/functionTools.go:67
github.com/matrixorigin/matrixone/pkg/sql/plan/function.integerDivUnsigned
	/home/xupeng/github/matrixone/pkg/sql/plan/function/arithmetic.go:535
github.com/matrixorigin/matrixone/pkg/sql/plan/function.integerDivFn
	/home/xupeng/github/matrixone/pkg/sql/plan/function/arithmetic.go:489
github.com/matrixorigin/matrixone/pkg/sql/colexec.(*FunctionExpressionExecutor).doFold
	/home/xupeng/github/matrixone/pkg/sql/colexec/evalExpressionReset.go:171
github.com/matrixorigin/matrixone/pkg/sql/colexec.(*FunctionExpressionExecutor).Eval
	/home/xupeng/github/matrixone/pkg/sql/colexec/evalExpression.go:576
github.com/matrixorigin/matrixone/pkg/sql/colexec.getReadonlyResultFromExpression
	/home/xupeng/github/matrixone/pkg/sql/colexec/evalExpressionOpt.go:67
github.com/matrixorigin/matrixone/pkg/sql/colexec.GetReadonlyResultFromExpression
	/home/xupeng/github/matrixone/pkg/sql/colexec/evalExpressionOpt.go:57
github.com/matrixorigin/matrixone/pkg/sql/plan/rule.(*ConstantFold).constantFold
	/home/xupeng/github/matrixone/pkg/sql/plan/rule/constant_fold.go:200
github.com/matrixorigin/matrixone/pkg/sql/plan/rule.(*ConstantFold).Apply
	/home/xupeng/github/matrixone/pkg/sql/plan/rule/constant_fold.go:77
github.com/matrixorigin/matrixone/pkg/sql/plan.(*BaseOptimizer).exploreNode
	/home/xupeng/github/matrixone/pkg/sql/plan/optimize.go:87
github.com/matrixorigin/matrixone/pkg/sql/plan.(*BaseOptimizer).optimize
	/home/xupeng/github/matrixone/pkg/sql/plan/optimize.go:73
github.com/matrixorigin/matrixone/pkg/sql/plan.(*BaseOptimizer).Optimize
	/home/xupeng/github/matrixone/pkg/sql/plan/optimize.go:65
github.com/matrixorigin/matrixone/pkg/frontend.buildPlan
	/home/xupeng/github/matrixone/pkg/frontend/mysql_cmd_executor.go:2085
github.com/matrixorigin/matrixone/pkg/frontend.(*TxnComputationWrapper).Compile
	/home/xupeng/github/matrixone/pkg/frontend/computation_wrapper.go:210
github.com/matrixorigin/matrixone/pkg/frontend.executeStmt
	/home/xupeng/github/matrixone/pkg/frontend/mysql_cmd_executor.go:2959
github.com/matrixorigin/matrixone/pkg/frontend.dispatchStmt
	/home/xupeng/github/matrixone/pkg/frontend/mysql_cmd_executor.go:2853
github.com/matrixorigin/matrixone/pkg/frontend.executeStmtWithIncrStmt
	/home/xupeng/github/matrixone/pkg/frontend/mysql_cmd_executor.go:2818
github.com/matrixorigin/matrixone/pkg/frontend.executeStmtWithWorkspace
	/home/xupeng/github/matrixone/pkg/frontend/mysql_cmd_executor.go:2762
github.com/matrixorigin/matrixone/pkg/frontend.executeStmtWithTxn
	/home/xupeng/github/matrixone/pkg/frontend/mysql_cmd_executor.go:2637
github.com/matrixorigin/matrixone/pkg/frontend.executeStmtWithResponse
	/home/xupeng/github/matrixone/pkg/frontend/mysql_cmd_executor.go:2600
github.com/matrixorigin/matrixone/pkg/frontend.doComQuery
	/home/xupeng/github/matrixone/pkg/frontend/mysql_cmd_executor.go:3243
github.com/matrixorigin/matrixone/pkg/frontend.ExecRequest
	/home/xupeng/github/matrixone/pkg/frontend/mysql_cmd_executor.go:3323
github.com/matrixorigin/matrixone/pkg/frontend.(*Routine).handleRequest
	/home/xupeng/github/matrixone/pkg/frontend/routine.go:298
github.com/matrixorigin/matrixone/pkg/frontend.(*RoutineManager).Handler
	/home/xupeng/github/matrixone/pkg/frontend/routine_manager.go:386
github.com/matrixorigin/matrixone/pkg/frontend.(*MOServer).handleRequest
	/home/xupeng/github/matrixone/pkg/frontend/server.go:523
github.com/matrixorigin/matrixone/pkg/frontend.(*MOServer).handleMessage
	/home/xupeng/github/matrixone/pkg/frontend/server.go:493
github.com/matrixorigin/matrixone/pkg/frontend.(*MOServer).handleLoop
	/home/xupeng/github/matrixone/pkg/frontend/server.go:210
github.com/matrixorigin/matrixone/pkg/frontend.(*MOServer).handleConn
	/home/xupeng/github/matrixone/pkg/frontend/server.go:206
SELECT CAST(1000 AS SMALLINT UNSIGNED) DIV CAST(3 AS SMALLINT UNSIGNED);
internal error: panic unsafe slice cast: from length 2 is not enough for length 8: 
github.com/matrixorigin/matrixone/pkg/common/util.UnsafeSliceCastToLength[...]
	/home/xupeng/github/matrixone/pkg/common/util/unsafe.go:85
github.com/matrixorigin/matrixone/pkg/container/vector.toSliceOfLengthNoTypeCheck[...]
	/home/xupeng/github/matrixone/pkg/container/vector/vector.go:77
github.com/matrixorigin/matrixone/pkg/container/vector.ToFixedCol[...]
	/home/xupeng/github/matrixone/pkg/container/vector/tools.go:43
github.com/matrixorigin/matrixone/pkg/container/vector.MustFixedColWithTypeCheck[...]
	/home/xupeng/github/matrixone/pkg/container/vector/tools.go:56
github.com/matrixorigin/matrixone/pkg/container/vector.GenerateFunctionFixedTypeParameter[...]
	/home/xupeng/github/matrixone/pkg/container/vector/functionTools.go:67
github.com/matrixorigin/matrixone/pkg/sql/plan/function.integerDivUnsigned
	/home/xupeng/github/matrixone/pkg/sql/plan/function/arithmetic.go:535
github.com/matrixorigin/matrixone/pkg/sql/plan/function.integerDivFn
	/home/xupeng/github/matrixone/pkg/sql/plan/function/arithmetic.go:489
github.com/matrixorigin/matrixone/pkg/sql/colexec.(*FunctionExpressionExecutor).doFold
	/home/xupeng/github/matrixone/pkg/sql/colexec/evalExpressionReset.go:171
github.com/matrixorigin/matrixone/pkg/sql/colexec.(*FunctionExpressionExecutor).Eval
	/home/xupeng/github/matrixone/pkg/sql/colexec/evalExpression.go:576
github.com/matrixorigin/matrixone/pkg/sql/colexec.getReadonlyResultFromExpression
	/home/xupeng/github/matrixone/pkg/sql/colexec/evalExpressionOpt.go:67
github.com/matrixorigin/matrixone/pkg/sql/colexec.GetReadonlyResultFromExpression
	/home/xupeng/github/matrixone/pkg/sql/colexec/evalExpressionOpt.go:57
github.com/matrixorigin/matrixone/pkg/sql/plan/rule.(*ConstantFold).constantFold
	/home/xupeng/github/matrixone/pkg/sql/plan/rule/constant_fold.go:200
github.com/matrixorigin/matrixone/pkg/sql/plan/rule.(*ConstantFold).Apply
	/home/xupeng/github/matrixone/pkg/sql/plan/rule/constant_fold.go:77
github.com/matrixorigin/matrixone/pkg/sql/plan.(*BaseOptimizer).exploreNode
	/home/xupeng/github/matrixone/pkg/sql/plan/optimize.go:87
github.com/matrixorigin/matrixone/pkg/sql/plan.(*BaseOptimizer).optimize
	/home/xupeng/github/matrixone/pkg/sql/plan/optimize.go:73
github.com/matrixorigin/matrixone/pkg/sql/plan.(*BaseOptimizer).Optimize
	/home/xupeng/github/matrixone/pkg/sql/plan/optimize.go:65
github.com/matrixorigin/matrixone/pkg/frontend.buildPlan
	/home/xupeng/github/matrixone/pkg/frontend/mysql_cmd_executor.go:2085
github.com/matrixorigin/matrixone/pkg/frontend.(*TxnComputationWrapper).Compile
	/home/xupeng/github/matrixone/pkg/frontend/computation_wrapper.go:210
github.com/matrixorigin/matrixone/pkg/frontend.executeStmt
	/home/xupeng/github/matrixone/pkg/frontend/mysql_cmd_executor.go:2959
github.com/matrixorigin/matrixone/pkg/frontend.dispatchStmt
	/home/xupeng/github/matrixone/pkg/frontend/mysql_cmd_executor.go:2853
github.com/matrixorigin/matrixone/pkg/frontend.executeStmtWithIncrStmt
	/home/xupeng/github/matrixone/pkg/frontend/mysql_cmd_executor.go:2818
github.com/matrixorigin/matrixone/pkg/frontend.executeStmtWithWorkspace
	/home/xupeng/github/matrixone/pkg/frontend/mysql_cmd_executor.go:2762
github.com/matrixorigin/matrixone/pkg/frontend.executeStmtWithTxn
	/home/xupeng/github/matrixone/pkg/frontend/mysql_cmd_executor.go:2637
github.com/matrixorigin/matrixone/pkg/frontend.executeStmtWithResponse
	/home/xupeng/github/matrixone/pkg/frontend/mysql_cmd_executor.go:2600
github.com/matrixorigin/matrixone/pkg/frontend.doComQuery
	/home/xupeng/github/matrixone/pkg/frontend/mysql_cmd_executor.go:3243
github.com/matrixorigin/matrixone/pkg/frontend.ExecRequest
	/home/xupeng/github/matrixone/pkg/frontend/mysql_cmd_executor.go:3323
github.com/matrixorigin/matrixone/pkg/frontend.(*Routine).handleRequest
	/home/xupeng/github/matrixone/pkg/frontend/routine.go:298
github.com/matrixorigin/matrixone/pkg/frontend.(*RoutineManager).Handler
	/home/xupeng/github/matrixone/pkg/frontend/routine_manager.go:386
github.com/matrixorigin/matrixone/pkg/frontend.(*MOServer).handleRequest
	/home/xupeng/github/matrixone/pkg/frontend/server.go:523
github.com/matrixorigin/matrixone/pkg/frontend.(*MOServer).handleMessage
	/home/xupeng/github/matrixone/pkg/frontend/server.go:493
github.com/matrixorigin/matrixone/pkg/frontend.(*MOServer).handleLoop
	/home/xupeng/github/matrixone/pkg/frontend/server.go:210
github.com/matrixorigin/matrixone/pkg/frontend.(*MOServer).handleConn
	/home/xupeng/github/matrixone/pkg/frontend/server.go:206
SELECT CAST(65535 AS SMALLINT UNSIGNED) DIV CAST(1 AS SMALLINT UNSIGNED);
internal error: panic unsafe slice cast: from length 2 is not enough for length 8: 
github.com/matrixorigin/matrixone/pkg/common/util.UnsafeSliceCastToLength[...]
	/home/xupeng/github/matrixone/pkg/common/util/unsafe.go:85
github.com/matrixorigin/matrixone/pkg/container/vector.toSliceOfLengthNoTypeCheck[...]
	/home/xupeng/github/matrixone/pkg/container/vector/vector.go:77
github.com/matrixorigin/matrixone/pkg/container/vector.ToFixedCol[...]
	/home/xupeng/github/matrixone/pkg/container/vector/tools.go:43
github.com/matrixorigin/matrixone/pkg/container/vector.MustFixedColWithTypeCheck[...]
	/home/xupeng/github/matrixone/pkg/container/vector/tools.go:56
github.com/matrixorigin/matrixone/pkg/container/vector.GenerateFunctionFixedTypeParameter[...]
	/home/xupeng/github/matrixone/pkg/container/vector/functionTools.go:67
github.com/matrixorigin/matrixone/pkg/sql/plan/function.integerDivUnsigned
	/home/xupeng/github/matrixone/pkg/sql/plan/function/arithmetic.go:535
github.com/matrixorigin/matrixone/pkg/sql/plan/function.integerDivFn
	/home/xupeng/github/matrixone/pkg/sql/plan/function/arithmetic.go:489
github.com/matrixorigin/matrixone/pkg/sql/colexec.(*FunctionExpressionExecutor).doFold
	/home/xupeng/github/matrixone/pkg/sql/colexec/evalExpressionReset.go:171
github.com/matrixorigin/matrixone/pkg/sql/colexec.(*FunctionExpressionExecutor).Eval
	/home/xupeng/github/matrixone/pkg/sql/colexec/evalExpression.go:576
github.com/matrixorigin/matrixone/pkg/sql/colexec.getReadonlyResultFromExpression
	/home/xupeng/github/matrixone/pkg/sql/colexec/evalExpressionOpt.go:67
github.com/matrixorigin/matrixone/pkg/sql/colexec.GetReadonlyResultFromExpression
	/home/xupeng/github/matrixone/pkg/sql/colexec/evalExpressionOpt.go:57
github.com/matrixorigin/matrixone/pkg/sql/plan/rule.(*ConstantFold).constantFold
	/home/xupeng/github/matrixone/pkg/sql/plan/rule/constant_fold.go:200
github.com/matrixorigin/matrixone/pkg/sql/plan/rule.(*ConstantFold).Apply
	/home/xupeng/github/matrixone/pkg/sql/plan/rule/constant_fold.go:77
github.com/matrixorigin/matrixone/pkg/sql/plan.(*BaseOptimizer).exploreNode
	/home/xupeng/github/matrixone/pkg/sql/plan/optimize.go:87
github.com/matrixorigin/matrixone/pkg/sql/plan.(*BaseOptimizer).optimize
	/home/xupeng/github/matrixone/pkg/sql/plan/optimize.go:73
github.com/matrixorigin/matrixone/pkg/sql/plan.(*BaseOptimizer).Optimize
	/home/xupeng/github/matrixone/pkg/sql/plan/optimize.go:65
github.com/matrixorigin/matrixone/pkg/frontend.buildPlan
	/home/xupeng/github/matrixone/pkg/frontend/mysql_cmd_executor.go:2085
github.com/matrixorigin/matrixone/pkg/frontend.(*TxnComputationWrapper).Compile
	/home/xupeng/github/matrixone/pkg/frontend/computation_wrapper.go:210
github.com/matrixorigin/matrixone/pkg/frontend.executeStmt
	/home/xupeng/github/matrixone/pkg/frontend/mysql_cmd_executor.go:2959
github.com/matrixorigin/matrixone/pkg/frontend.dispatchStmt
	/home/xupeng/github/matrixone/pkg/frontend/mysql_cmd_executor.go:2853
github.com/matrixorigin/matrixone/pkg/frontend.executeStmtWithIncrStmt
	/home/xupeng/github/matrixone/pkg/frontend/mysql_cmd_executor.go:2818
github.com/matrixorigin/matrixone/pkg/frontend.executeStmtWithWorkspace
	/home/xupeng/github/matrixone/pkg/frontend/mysql_cmd_executor.go:2762
github.com/matrixorigin/matrixone/pkg/frontend.executeStmtWithTxn
	/home/xupeng/github/matrixone/pkg/frontend/mysql_cmd_executor.go:2637
github.com/matrixorigin/matrixone/pkg/frontend.executeStmtWithResponse
	/home/xupeng/github/matrixone/pkg/frontend/mysql_cmd_executor.go:2600
github.com/matrixorigin/matrixone/pkg/frontend.doComQuery
	/home/xupeng/github/matrixone/pkg/frontend/mysql_cmd_executor.go:3243
github.com/matrixorigin/matrixone/pkg/frontend.ExecRequest
	/home/xupeng/github/matrixone/pkg/frontend/mysql_cmd_executor.go:3323
github.com/matrixorigin/matrixone/pkg/frontend.(*Routine).handleRequest
	/home/xupeng/github/matrixone/pkg/frontend/routine.go:298
github.com/matrixorigin/matrixone/pkg/frontend.(*RoutineManager).Handler
	/home/xupeng/github/matrixone/pkg/frontend/routine_manager.go:386
github.com/matrixorigin/matrixone/pkg/frontend.(*MOServer).handleRequest
	/home/xupeng/github/matrixone/pkg/frontend/server.go:523
github.com/matrixorigin/matrixone/pkg/frontend.(*MOServer).handleMessage
	/home/xupeng/github/matrixone/pkg/frontend/server.go:493
github.com/matrixorigin/matrixone/pkg/frontend.(*MOServer).handleLoop
	/home/xupeng/github/matrixone/pkg/frontend/server.go:210
github.com/matrixorigin/matrixone/pkg/frontend.(*MOServer).handleConn
	/home/xupeng/github/matrixone/pkg/frontend/server.go:206
SELECT CAST(100 AS SMALLINT UNSIGNED) DIV CAST(0 AS SMALLINT UNSIGNED);
internal error: panic unsafe slice cast: from length 2 is not enough for length 8: 
github.com/matrixorigin/matrixone/pkg/common/util.UnsafeSliceCastToLength[...]
	/home/xupeng/github/matrixone/pkg/common/util/unsafe.go:85
github.com/matrixorigin/matrixone/pkg/container/vector.toSliceOfLengthNoTypeCheck[...]
	/home/xupeng/github/matrixone/pkg/container/vector/vector.go:77
github.com/matrixorigin/matrixone/pkg/container/vector.ToFixedCol[...]
	/home/xupeng/github/matrixone/pkg/container/vector/tools.go:43
github.com/matrixorigin/matrixone/pkg/container/vector.MustFixedColWithTypeCheck[...]
	/home/xupeng/github/matrixone/pkg/container/vector/tools.go:56
github.com/matrixorigin/matrixone/pkg/container/vector.GenerateFunctionFixedTypeParameter[...]
	/home/xupeng/github/matrixone/pkg/container/vector/functionTools.go:67
github.com/matrixorigin/matrixone/pkg/sql/plan/function.integerDivUnsigned
	/home/xupeng/github/matrixone/pkg/sql/plan/function/arithmetic.go:535
github.com/matrixorigin/matrixone/pkg/sql/plan/function.integerDivFn
	/home/xupeng/github/matrixone/pkg/sql/plan/function/arithmetic.go:489
github.com/matrixorigin/matrixone/pkg/sql/colexec.(*FunctionExpressionExecutor).doFold
	/home/xupeng/github/matrixone/pkg/sql/colexec/evalExpressionReset.go:171
github.com/matrixorigin/matrixone/pkg/sql/colexec.(*FunctionExpressionExecutor).Eval
	/home/xupeng/github/matrixone/pkg/sql/colexec/evalExpression.go:576
github.com/matrixorigin/matrixone/pkg/sql/colexec.getReadonlyResultFromExpression
	/home/xupeng/github/matrixone/pkg/sql/colexec/evalExpressionOpt.go:67
github.com/matrixorigin/matrixone/pkg/sql/colexec.GetReadonlyResultFromExpression
	/home/xupeng/github/matrixone/pkg/sql/colexec/evalExpressionOpt.go:57
github.com/matrixorigin/matrixone/pkg/sql/plan/rule.(*ConstantFold).constantFold
	/home/xupeng/github/matrixone/pkg/sql/plan/rule/constant_fold.go:200
github.com/matrixorigin/matrixone/pkg/sql/plan/rule.(*ConstantFold).Apply
	/home/xupeng/github/matrixone/pkg/sql/plan/rule/constant_fold.go:77
github.com/matrixorigin/matrixone/pkg/sql/plan.(*BaseOptimizer).exploreNode
	/home/xupeng/github/matrixone/pkg/sql/plan/optimize.go:87
github.com/matrixorigin/matrixone/pkg/sql/plan.(*BaseOptimizer).optimize
	/home/xupeng/github/matrixone/pkg/sql/plan/optimize.go:73
github.com/matrixorigin/matrixone/pkg/sql/plan.(*BaseOptimizer).Optimize
	/home/xupeng/github/matrixone/pkg/sql/plan/optimize.go:65
github.com/matrixorigin/matrixone/pkg/frontend.buildPlan
	/home/xupeng/github/matrixone/pkg/frontend/mysql_cmd_executor.go:2085
github.com/matrixorigin/matrixone/pkg/frontend.(*TxnComputationWrapper).Compile
	/home/xupeng/github/matrixone/pkg/frontend/computation_wrapper.go:210
github.com/matrixorigin/matrixone/pkg/frontend.executeStmt
	/home/xupeng/github/matrixone/pkg/frontend/mysql_cmd_executor.go:2959
github.com/matrixorigin/matrixone/pkg/frontend.dispatchStmt
	/home/xupeng/github/matrixone/pkg/frontend/mysql_cmd_executor.go:2853
github.com/matrixorigin/matrixone/pkg/frontend.executeStmtWithIncrStmt
	/home/xupeng/github/matrixone/pkg/frontend/mysql_cmd_executor.go:2818
github.com/matrixorigin/matrixone/pkg/frontend.executeStmtWithWorkspace
	/home/xupeng/github/matrixone/pkg/frontend/mysql_cmd_executor.go:2762
github.com/matrixorigin/matrixone/pkg/frontend.executeStmtWithTxn
	/home/xupeng/github/matrixone/pkg/frontend/mysql_cmd_executor.go:2637
github.com/matrixorigin/matrixone/pkg/frontend.executeStmtWithResponse
	/home/xupeng/github/matrixone/pkg/frontend/mysql_cmd_executor.go:2600
github.com/matrixorigin/matrixone/pkg/frontend.doComQuery
	/home/xupeng/github/matrixone/pkg/frontend/mysql_cmd_executor.go:3243
github.com/matrixorigin/matrixone/pkg/frontend.ExecRequest
	/home/xupeng/github/matrixone/pkg/frontend/mysql_cmd_executor.go:3323
github.com/matrixorigin/matrixone/pkg/frontend.(*Routine).handleRequest
	/home/xupeng/github/matrixone/pkg/frontend/routine.go:298
github.com/matrixorigin/matrixone/pkg/frontend.(*RoutineManager).Handler
	/home/xupeng/github/matrixone/pkg/frontend/routine_manager.go:386
github.com/matrixorigin/matrixone/pkg/frontend.(*MOServer).handleRequest
	/home/xupeng/github/matrixone/pkg/frontend/server.go:523
github.com/matrixorigin/matrixone/pkg/frontend.(*MOServer).handleMessage
	/home/xupeng/github/matrixone/pkg/frontend/server.go:493
github.com/matrixorigin/matrixone/pkg/frontend.(*MOServer).handleLoop
	/home/xupeng/github/matrixone/pkg/frontend/server.go:210
github.com/matrixorigin/matrixone/pkg/frontend.(*MOServer).handleConn
	/home/xupeng/github/matrixone/pkg/frontend/server.go:206
SELECT CAST(100000 AS INT UNSIGNED) DIV CAST(3 AS INT UNSIGNED);
internal error: panic unsafe slice cast: from length 4 is not enough for length 8: 
github.com/matrixorigin/matrixone/pkg/common/util.UnsafeSliceCastToLength[...]
	/home/xupeng/github/matrixone/pkg/common/util/unsafe.go:85
github.com/matrixorigin/matrixone/pkg/container/vector.toSliceOfLengthNoTypeCheck[...]
	/home/xupeng/github/matrixone/pkg/container/vector/vector.go:77
github.com/matrixorigin/matrixone/pkg/container/vector.ToFixedCol[...]
	/home/xupeng/github/matrixone/pkg/container/vector/tools.go:43
github.com/matrixorigin/matrixone/pkg/container/vector.MustFixedColWithTypeCheck[...]
	/home/xupeng/github/matrixone/pkg/container/vector/tools.go:56
github.com/matrixorigin/matrixone/pkg/container/vector.GenerateFunctionFixedTypeParameter[...]
	/home/xupeng/github/matrixone/pkg/container/vector/functionTools.go:67
github.com/matrixorigin/matrixone/pkg/sql/plan/function.integerDivUnsigned
	/home/xupeng/github/matrixone/pkg/sql/plan/function/arithmetic.go:535
github.com/matrixorigin/matrixone/pkg/sql/plan/function.integerDivFn
	/home/xupeng/github/matrixone/pkg/sql/plan/function/arithmetic.go:489
github.com/matrixorigin/matrixone/pkg/sql/colexec.(*FunctionExpressionExecutor).doFold
	/home/xupeng/github/matrixone/pkg/sql/colexec/evalExpressionReset.go:171
github.com/matrixorigin/matrixone/pkg/sql/colexec.(*FunctionExpressionExecutor).Eval
	/home/xupeng/github/matrixone/pkg/sql/colexec/evalExpression.go:576
github.com/matrixorigin/matrixone/pkg/sql/colexec.getReadonlyResultFromExpression
	/home/xupeng/github/matrixone/pkg/sql/colexec/evalExpressionOpt.go:67
github.com/matrixorigin/matrixone/pkg/sql/colexec.GetReadonlyResultFromExpression
	/home/xupeng/github/matrixone/pkg/sql/colexec/evalExpressionOpt.go:57
github.com/matrixorigin/matrixone/pkg/sql/plan/rule.(*ConstantFold).constantFold
	/home/xupeng/github/matrixone/pkg/sql/plan/rule/constant_fold.go:200
github.com/matrixorigin/matrixone/pkg/sql/plan/rule.(*ConstantFold).Apply
	/home/xupeng/github/matrixone/pkg/sql/plan/rule/constant_fold.go:77
github.com/matrixorigin/matrixone/pkg/sql/plan.(*BaseOptimizer).exploreNode
	/home/xupeng/github/matrixone/pkg/sql/plan/optimize.go:87
github.com/matrixorigin/matrixone/pkg/sql/plan.(*BaseOptimizer).optimize
	/home/xupeng/github/matrixone/pkg/sql/plan/optimize.go:73
github.com/matrixorigin/matrixone/pkg/sql/plan.(*BaseOptimizer).Optimize
	/home/xupeng/github/matrixone/pkg/sql/plan/optimize.go:65
github.com/matrixorigin/matrixone/pkg/frontend.buildPlan
	/home/xupeng/github/matrixone/pkg/frontend/mysql_cmd_executor.go:2085
github.com/matrixorigin/matrixone/pkg/frontend.(*TxnComputationWrapper).Compile
	/home/xupeng/github/matrixone/pkg/frontend/computation_wrapper.go:210
github.com/matrixorigin/matrixone/pkg/frontend.executeStmt
	/home/xupeng/github/matrixone/pkg/frontend/mysql_cmd_executor.go:2959
github.com/matrixorigin/matrixone/pkg/frontend.dispatchStmt
	/home/xupeng/github/matrixone/pkg/frontend/mysql_cmd_executor.go:2853
github.com/matrixorigin/matrixone/pkg/frontend.executeStmtWithIncrStmt
	/home/xupeng/github/matrixone/pkg/frontend/mysql_cmd_executor.go:2818
github.com/matrixorigin/matrixone/pkg/frontend.executeStmtWithWorkspace
	/home/xupeng/github/matrixone/pkg/frontend/mysql_cmd_executor.go:2762
github.com/matrixorigin/matrixone/pkg/frontend.executeStmtWithTxn
	/home/xupeng/github/matrixone/pkg/frontend/mysql_cmd_executor.go:2637
github.com/matrixorigin/matrixone/pkg/frontend.executeStmtWithResponse
	/home/xupeng/github/matrixone/pkg/frontend/mysql_cmd_executor.go:2600
github.com/matrixorigin/matrixone/pkg/frontend.doComQuery
	/home/xupeng/github/matrixone/pkg/frontend/mysql_cmd_executor.go:3243
github.com/matrixorigin/matrixone/pkg/frontend.ExecRequest
	/home/xupeng/github/matrixone/pkg/frontend/mysql_cmd_executor.go:3323
github.com/matrixorigin/matrixone/pkg/frontend.(*Routine).handleRequest
	/home/xupeng/github/matrixone/pkg/frontend/routine.go:298
github.com/matrixorigin/matrixone/pkg/frontend.(*RoutineManager).Handler
	/home/xupeng/github/matrixone/pkg/frontend/routine_manager.go:386
github.com/matrixorigin/matrixone/pkg/frontend.(*MOServer).handleRequest
	/home/xupeng/github/matrixone/pkg/frontend/server.go:523
github.com/matrixorigin/matrixone/pkg/frontend.(*MOServer).handleMessage
	/home/xupeng/github/matrixone/pkg/frontend/server.go:493
github.com/matrixorigin/matrixone/pkg/frontend.(*MOServer).handleLoop
	/home/xupeng/github/matrixone/pkg/frontend/server.go:210
github.com/matrixorigin/matrixone/pkg/frontend.(*MOServer).handleConn
	/home/xupeng/github/matrixone/pkg/frontend/server.go:206
SELECT CAST(4294967295 AS INT UNSIGNED) DIV CAST(1 AS INT UNSIGNED);
internal error: panic unsafe slice cast: from length 4 is not enough for length 8: 
github.com/matrixorigin/matrixone/pkg/common/util.UnsafeSliceCastToLength[...]
	/home/xupeng/github/matrixone/pkg/common/util/unsafe.go:85
github.com/matrixorigin/matrixone/pkg/container/vector.toSliceOfLengthNoTypeCheck[...]
	/home/xupeng/github/matrixone/pkg/container/vector/vector.go:77
github.com/matrixorigin/matrixone/pkg/container/vector.ToFixedCol[...]
	/home/xupeng/github/matrixone/pkg/container/vector/tools.go:43
github.com/matrixorigin/matrixone/pkg/container/vector.MustFixedColWithTypeCheck[...]
	/home/xupeng/github/matrixone/pkg/container/vector/tools.go:56
github.com/matrixorigin/matrixone/pkg/container/vector.GenerateFunctionFixedTypeParameter[...]
	/home/xupeng/github/matrixone/pkg/container/vector/functionTools.go:67
github.com/matrixorigin/matrixone/pkg/sql/plan/function.integerDivUnsigned
	/home/xupeng/github/matrixone/pkg/sql/plan/function/arithmetic.go:535
github.com/matrixorigin/matrixone/pkg/sql/plan/function.integerDivFn
	/home/xupeng/github/matrixone/pkg/sql/plan/function/arithmetic.go:489
github.com/matrixorigin/matrixone/pkg/sql/colexec.(*FunctionExpressionExecutor).doFold
	/home/xupeng/github/matrixone/pkg/sql/colexec/evalExpressionReset.go:171
github.com/matrixorigin/matrixone/pkg/sql/colexec.(*FunctionExpressionExecutor).Eval
	/home/xupeng/github/matrixone/pkg/sql/colexec/evalExpression.go:576
github.com/matrixorigin/matrixone/pkg/sql/colexec.getReadonlyResultFromExpression
	/home/xupeng/github/matrixone/pkg/sql/colexec/evalExpressionOpt.go:67
github.com/matrixorigin/matrixone/pkg/sql/colexec.GetReadonlyResultFromExpression
	/home/xupeng/github/matrixone/pkg/sql/colexec/evalExpressionOpt.go:57
github.com/matrixorigin/matrixone/pkg/sql/plan/rule.(*ConstantFold).constantFold
	/home/xupeng/github/matrixone/pkg/sql/plan/rule/constant_fold.go:200
github.com/matrixorigin/matrixone/pkg/sql/plan/rule.(*ConstantFold).Apply
	/home/xupeng/github/matrixone/pkg/sql/plan/rule/constant_fold.go:77
github.com/matrixorigin/matrixone/pkg/sql/plan.(*BaseOptimizer).exploreNode
	/home/xupeng/github/matrixone/pkg/sql/plan/optimize.go:87
github.com/matrixorigin/matrixone/pkg/sql/plan.(*BaseOptimizer).optimize
	/home/xupeng/github/matrixone/pkg/sql/plan/optimize.go:73
github.com/matrixorigin/matrixone/pkg/sql/plan.(*BaseOptimizer).Optimize
	/home/xupeng/github/matrixone/pkg/sql/plan/optimize.go:65
github.com/matrixorigin/matrixone/pkg/frontend.buildPlan
	/home/xupeng/github/matrixone/pkg/frontend/mysql_cmd_executor.go:2085
github.com/matrixorigin/matrixone/pkg/frontend.(*TxnComputationWrapper).Compile
	/home/xupeng/github/matrixone/pkg/frontend/computation_wrapper.go:210
github.com/matrixorigin/matrixone/pkg/frontend.executeStmt
	/home/xupeng/github/matrixone/pkg/frontend/mysql_cmd_executor.go:2959
github.com/matrixorigin/matrixone/pkg/frontend.dispatchStmt
	/home/xupeng/github/matrixone/pkg/frontend/mysql_cmd_executor.go:2853
github.com/matrixorigin/matrixone/pkg/frontend.executeStmtWithIncrStmt
	/home/xupeng/github/matrixone/pkg/frontend/mysql_cmd_executor.go:2818
github.com/matrixorigin/matrixone/pkg/frontend.executeStmtWithWorkspace
	/home/xupeng/github/matrixone/pkg/frontend/mysql_cmd_executor.go:2762
github.com/matrixorigin/matrixone/pkg/frontend.executeStmtWithTxn
	/home/xupeng/github/matrixone/pkg/frontend/mysql_cmd_executor.go:2637
github.com/matrixorigin/matrixone/pkg/frontend.executeStmtWithResponse
	/home/xupeng/github/matrixone/pkg/frontend/mysql_cmd_executor.go:2600
github.com/matrixorigin/matrixone/pkg/frontend.doComQuery
	/home/xupeng/github/matrixone/pkg/frontend/mysql_cmd_executor.go:3243
github.com/matrixorigin/matrixone/pkg/frontend.ExecRequest
	/home/xupeng/github/matrixone/pkg/frontend/mysql_cmd_executor.go:3323
github.com/matrixorigin/matrixone/pkg/frontend.(*Routine).handleRequest
	/home/xupeng/github/matrixone/pkg/frontend/routine.go:298
github.com/matrixorigin/matrixone/pkg/frontend.(*RoutineManager).Handler
	/home/xupeng/github/matrixone/pkg/frontend/routine_manager.go:386
github.com/matrixorigin/matrixone/pkg/frontend.(*MOServer).handleRequest
	/home/xupeng/github/matrixone/pkg/frontend/server.go:523
github.com/matrixorigin/matrixone/pkg/frontend.(*MOServer).handleMessage
	/home/xupeng/github/matrixone/pkg/frontend/server.go:493
github.com/matrixorigin/matrixone/pkg/frontend.(*MOServer).handleLoop
	/home/xupeng/github/matrixone/pkg/frontend/server.go:210
github.com/matrixorigin/matrixone/pkg/frontend.(*MOServer).handleConn
	/home/xupeng/github/matrixone/pkg/frontend/server.go:206
SELECT CAST(100 AS INT UNSIGNED) DIV CAST(0 AS INT UNSIGNED);
internal error: panic unsafe slice cast: from length 4 is not enough for length 8: 
github.com/matrixorigin/matrixone/pkg/common/util.UnsafeSliceCastToLength[...]
	/home/xupeng/github/matrixone/pkg/common/util/unsafe.go:85
github.com/matrixorigin/matrixone/pkg/container/vector.toSliceOfLengthNoTypeCheck[...]
	/home/xupeng/github/matrixone/pkg/container/vector/vector.go:77
github.com/matrixorigin/matrixone/pkg/container/vector.ToFixedCol[...]
	/home/xupeng/github/matrixone/pkg/container/vector/tools.go:43
github.com/matrixorigin/matrixone/pkg/container/vector.MustFixedColWithTypeCheck[...]
	/home/xupeng/github/matrixone/pkg/container/vector/tools.go:56
github.com/matrixorigin/matrixone/pkg/container/vector.GenerateFunctionFixedTypeParameter[...]
	/home/xupeng/github/matrixone/pkg/container/vector/functionTools.go:67
github.com/matrixorigin/matrixone/pkg/sql/plan/function.integerDivUnsigned
	/home/xupeng/github/matrixone/pkg/sql/plan/function/arithmetic.go:535
github.com/matrixorigin/matrixone/pkg/sql/plan/function.integerDivFn
	/home/xupeng/github/matrixone/pkg/sql/plan/function/arithmetic.go:489
github.com/matrixorigin/matrixone/pkg/sql/colexec.(*FunctionExpressionExecutor).doFold
	/home/xupeng/github/matrixone/pkg/sql/colexec/evalExpressionReset.go:171
github.com/matrixorigin/matrixone/pkg/sql/colexec.(*FunctionExpressionExecutor).Eval
	/home/xupeng/github/matrixone/pkg/sql/colexec/evalExpression.go:576
github.com/matrixorigin/matrixone/pkg/sql/colexec.getReadonlyResultFromExpression
	/home/xupeng/github/matrixone/pkg/sql/colexec/evalExpressionOpt.go:67
github.com/matrixorigin/matrixone/pkg/sql/colexec.GetReadonlyResultFromExpression
	/home/xupeng/github/matrixone/pkg/sql/colexec/evalExpressionOpt.go:57
github.com/matrixorigin/matrixone/pkg/sql/plan/rule.(*ConstantFold).constantFold
	/home/xupeng/github/matrixone/pkg/sql/plan/rule/constant_fold.go:200
github.com/matrixorigin/matrixone/pkg/sql/plan/rule.(*ConstantFold).Apply
	/home/xupeng/github/matrixone/pkg/sql/plan/rule/constant_fold.go:77
github.com/matrixorigin/matrixone/pkg/sql/plan.(*BaseOptimizer).exploreNode
	/home/xupeng/github/matrixone/pkg/sql/plan/optimize.go:87
github.com/matrixorigin/matrixone/pkg/sql/plan.(*BaseOptimizer).optimize
	/home/xupeng/github/matrixone/pkg/sql/plan/optimize.go:73
github.com/matrixorigin/matrixone/pkg/sql/plan.(*BaseOptimizer).Optimize
	/home/xupeng/github/matrixone/pkg/sql/plan/optimize.go:65
github.com/matrixorigin/matrixone/pkg/frontend.buildPlan
	/home/xupeng/github/matrixone/pkg/frontend/mysql_cmd_executor.go:2085
github.com/matrixorigin/matrixone/pkg/frontend.(*TxnComputationWrapper).Compile
	/home/xupeng/github/matrixone/pkg/frontend/computation_wrapper.go:210
github.com/matrixorigin/matrixone/pkg/frontend.executeStmt
	/home/xupeng/github/matrixone/pkg/frontend/mysql_cmd_executor.go:2959
github.com/matrixorigin/matrixone/pkg/frontend.dispatchStmt
	/home/xupeng/github/matrixone/pkg/frontend/mysql_cmd_executor.go:2853
github.com/matrixorigin/matrixone/pkg/frontend.executeStmtWithIncrStmt
	/home/xupeng/github/matrixone/pkg/frontend/mysql_cmd_executor.go:2818
github.com/matrixorigin/matrixone/pkg/frontend.executeStmtWithWorkspace
	/home/xupeng/github/matrixone/pkg/frontend/mysql_cmd_executor.go:2762
github.com/matrixorigin/matrixone/pkg/frontend.executeStmtWithTxn
	/home/xupeng/github/matrixone/pkg/frontend/mysql_cmd_executor.go:2637
github.com/matrixorigin/matrixone/pkg/frontend.executeStmtWithResponse
	/home/xupeng/github/matrixone/pkg/frontend/mysql_cmd_executor.go:2600
github.com/matrixorigin/matrixone/pkg/frontend.doComQuery
	/home/xupeng/github/matrixone/pkg/frontend/mysql_cmd_executor.go:3243
github.com/matrixorigin/matrixone/pkg/frontend.ExecRequest
	/home/xupeng/github/matrixone/pkg/frontend/mysql_cmd_executor.go:3323
github.com/matrixorigin/matrixone/pkg/frontend.(*Routine).handleRequest
	/home/xupeng/github/matrixone/pkg/frontend/routine.go:298
github.com/matrixorigin/matrixone/pkg/frontend.(*RoutineManager).Handler
	/home/xupeng/github/matrixone/pkg/frontend/routine_manager.go:386
github.com/matrixorigin/matrixone/pkg/frontend.(*MOServer).handleRequest
	/home/xupeng/github/matrixone/pkg/frontend/server.go:523
github.com/matrixorigin/matrixone/pkg/frontend.(*MOServer).handleMessage
	/home/xupeng/github/matrixone/pkg/frontend/server.go:493
github.com/matrixorigin/matrixone/pkg/frontend.(*MOServer).handleLoop
	/home/xupeng/github/matrixone/pkg/frontend/server.go:210
github.com/matrixorigin/matrixone/pkg/frontend.(*MOServer).handleConn
	/home/xupeng/github/matrixone/pkg/frontend/server.go:206
SELECT CAST(10000000000 AS BIGINT UNSIGNED) DIV CAST(3 AS BIGINT UNSIGNED);
internal error: panic wrong type for FunctionResultWrapper: 
github.com/matrixorigin/matrixone/pkg/container/vector.MustFunctionResult[...]
	/home/xupeng/github/matrixone/pkg/container/vector/functionTools.go:509
github.com/matrixorigin/matrixone/pkg/sql/plan/function.integerDivUnsigned
	/home/xupeng/github/matrixone/pkg/sql/plan/function/arithmetic.go:537
github.com/matrixorigin/matrixone/pkg/sql/plan/function.integerDivFn
	/home/xupeng/github/matrixone/pkg/sql/plan/function/arithmetic.go:489
github.com/matrixorigin/matrixone/pkg/sql/colexec.(*FunctionExpressionExecutor).doFold
	/home/xupeng/github/matrixone/pkg/sql/colexec/evalExpressionReset.go:171
github.com/matrixorigin/matrixone/pkg/sql/colexec.(*FunctionExpressionExecutor).Eval
	/home/xupeng/github/matrixone/pkg/sql/colexec/evalExpression.go:576
github.com/matrixorigin/matrixone/pkg/sql/colexec.getReadonlyResultFromExpression
	/home/xupeng/github/matrixone/pkg/sql/colexec/evalExpressionOpt.go:67
github.com/matrixorigin/matrixone/pkg/sql/colexec.GetReadonlyResultFromExpression
	/home/xupeng/github/matrixone/pkg/sql/colexec/evalExpressionOpt.go:57
github.com/matrixorigin/matrixone/pkg/sql/plan/rule.(*ConstantFold).constantFold
	/home/xupeng/github/matrixone/pkg/sql/plan/rule/constant_fold.go:200
github.com/matrixorigin/matrixone/pkg/sql/plan/rule.(*ConstantFold).Apply
	/home/xupeng/github/matrixone/pkg/sql/plan/rule/constant_fold.go:77
github.com/matrixorigin/matrixone/pkg/sql/plan.(*BaseOptimizer).exploreNode
	/home/xupeng/github/matrixone/pkg/sql/plan/optimize.go:87
github.com/matrixorigin/matrixone/pkg/sql/plan.(*BaseOptimizer).optimize
	/home/xupeng/github/matrixone/pkg/sql/plan/optimize.go:73
github.com/matrixorigin/matrixone/pkg/sql/plan.(*BaseOptimizer).Optimize
	/home/xupeng/github/matrixone/pkg/sql/plan/optimize.go:65
github.com/matrixorigin/matrixone/pkg/frontend.buildPlan
	/home/xupeng/github/matrixone/pkg/frontend/mysql_cmd_executor.go:2085
github.com/matrixorigin/matrixone/pkg/frontend.(*TxnComputationWrapper).Compile
	/home/xupeng/github/matrixone/pkg/frontend/computation_wrapper.go:210
github.com/matrixorigin/matrixone/pkg/frontend.executeStmt
	/home/xupeng/github/matrixone/pkg/frontend/mysql_cmd_executor.go:2959
github.com/matrixorigin/matrixone/pkg/frontend.dispatchStmt
	/home/xupeng/github/matrixone/pkg/frontend/mysql_cmd_executor.go:2853
github.com/matrixorigin/matrixone/pkg/frontend.executeStmtWithIncrStmt
	/home/xupeng/github/matrixone/pkg/frontend/mysql_cmd_executor.go:2818
github.com/matrixorigin/matrixone/pkg/frontend.executeStmtWithWorkspace
	/home/xupeng/github/matrixone/pkg/frontend/mysql_cmd_executor.go:2762
github.com/matrixorigin/matrixone/pkg/frontend.executeStmtWithTxn
	/home/xupeng/github/matrixone/pkg/frontend/mysql_cmd_executor.go:2637
github.com/matrixorigin/matrixone/pkg/frontend.executeStmtWithResponse
	/home/xupeng/github/matrixone/pkg/frontend/mysql_cmd_executor.go:2600
github.com/matrixorigin/matrixone/pkg/frontend.doComQuery
	/home/xupeng/github/matrixone/pkg/frontend/mysql_cmd_executor.go:3243
github.com/matrixorigin/matrixone/pkg/frontend.ExecRequest
	/home/xupeng/github/matrixone/pkg/frontend/mysql_cmd_executor.go:3323
github.com/matrixorigin/matrixone/pkg/frontend.(*Routine).handleRequest
	/home/xupeng/github/matrixone/pkg/frontend/routine.go:298
github.com/matrixorigin/matrixone/pkg/frontend.(*RoutineManager).Handler
	/home/xupeng/github/matrixone/pkg/frontend/routine_manager.go:386
github.com/matrixorigin/matrixone/pkg/frontend.(*MOServer).handleRequest
	/home/xupeng/github/matrixone/pkg/frontend/server.go:523
github.com/matrixorigin/matrixone/pkg/frontend.(*MOServer).handleMessage
	/home/xupeng/github/matrixone/pkg/frontend/server.go:493
github.com/matrixorigin/matrixone/pkg/frontend.(*MOServer).handleLoop
	/home/xupeng/github/matrixone/pkg/frontend/server.go:210
github.com/matrixorigin/matrixone/pkg/frontend.(*MOServer).handleConn
	/home/xupeng/github/matrixone/pkg/frontend/server.go:206
runtime.goexit
	/usr/local/go/src/runtime/asm_amd64.s:1693
SELECT CAST(18446744073709551615 AS BIGINT UNSIGNED) DIV CAST(1 AS BIGINT UNSIGNED);
internal error: panic wrong type for FunctionResultWrapper: 
github.com/matrixorigin/matrixone/pkg/container/vector.MustFunctionResult[...]
	/home/xupeng/github/matrixone/pkg/container/vector/functionTools.go:509
github.com/matrixorigin/matrixone/pkg/sql/plan/function.integerDivUnsigned
	/home/xupeng/github/matrixone/pkg/sql/plan/function/arithmetic.go:537
github.com/matrixorigin/matrixone/pkg/sql/plan/function.integerDivFn
	/home/xupeng/github/matrixone/pkg/sql/plan/function/arithmetic.go:489
github.com/matrixorigin/matrixone/pkg/sql/colexec.(*FunctionExpressionExecutor).doFold
	/home/xupeng/github/matrixone/pkg/sql/colexec/evalExpressionReset.go:171
github.com/matrixorigin/matrixone/pkg/sql/colexec.(*FunctionExpressionExecutor).Eval
	/home/xupeng/github/matrixone/pkg/sql/colexec/evalExpression.go:576
github.com/matrixorigin/matrixone/pkg/sql/colexec.getReadonlyResultFromExpression
	/home/xupeng/github/matrixone/pkg/sql/colexec/evalExpressionOpt.go:67
github.com/matrixorigin/matrixone/pkg/sql/colexec.GetReadonlyResultFromExpression
	/home/xupeng/github/matrixone/pkg/sql/colexec/evalExpressionOpt.go:57
github.com/matrixorigin/matrixone/pkg/sql/plan/rule.(*ConstantFold).constantFold
	/home/xupeng/github/matrixone/pkg/sql/plan/rule/constant_fold.go:200
github.com/matrixorigin/matrixone/pkg/sql/plan/rule.(*ConstantFold).Apply
	/home/xupeng/github/matrixone/pkg/sql/plan/rule/constant_fold.go:77
github.com/matrixorigin/matrixone/pkg/sql/plan.(*BaseOptimizer).exploreNode
	/home/xupeng/github/matrixone/pkg/sql/plan/optimize.go:87
github.com/matrixorigin/matrixone/pkg/sql/plan.(*BaseOptimizer).optimize
	/home/xupeng/github/matrixone/pkg/sql/plan/optimize.go:73
github.com/matrixorigin/matrixone/pkg/sql/plan.(*BaseOptimizer).Optimize
	/home/xupeng/github/matrixone/pkg/sql/plan/optimize.go:65
github.com/matrixorigin/matrixone/pkg/frontend.buildPlan
	/home/xupeng/github/matrixone/pkg/frontend/mysql_cmd_executor.go:2085
github.com/matrixorigin/matrixone/pkg/frontend.(*TxnComputationWrapper).Compile
	/home/xupeng/github/matrixone/pkg/frontend/computation_wrapper.go:210
github.com/matrixorigin/matrixone/pkg/frontend.executeStmt
	/home/xupeng/github/matrixone/pkg/frontend/mysql_cmd_executor.go:2959
github.com/matrixorigin/matrixone/pkg/frontend.dispatchStmt
	/home/xupeng/github/matrixone/pkg/frontend/mysql_cmd_executor.go:2853
github.com/matrixorigin/matrixone/pkg/frontend.executeStmtWithIncrStmt
	/home/xupeng/github/matrixone/pkg/frontend/mysql_cmd_executor.go:2818
github.com/matrixorigin/matrixone/pkg/frontend.executeStmtWithWorkspace
	/home/xupeng/github/matrixone/pkg/frontend/mysql_cmd_executor.go:2762
github.com/matrixorigin/matrixone/pkg/frontend.executeStmtWithTxn
	/home/xupeng/github/matrixone/pkg/frontend/mysql_cmd_executor.go:2637
github.com/matrixorigin/matrixone/pkg/frontend.executeStmtWithResponse
	/home/xupeng/github/matrixone/pkg/frontend/mysql_cmd_executor.go:2600
github.com/matrixorigin/matrixone/pkg/frontend.doComQuery
	/home/xupeng/github/matrixone/pkg/frontend/mysql_cmd_executor.go:3243
github.com/matrixorigin/matrixone/pkg/frontend.ExecRequest
	/home/xupeng/github/matrixone/pkg/frontend/mysql_cmd_executor.go:3323
github.com/matrixorigin/matrixone/pkg/frontend.(*Routine).handleRequest
	/home/xupeng/github/matrixone/pkg/frontend/routine.go:298
github.com/matrixorigin/matrixone/pkg/frontend.(*RoutineManager).Handler
	/home/xupeng/github/matrixone/pkg/frontend/routine_manager.go:386
github.com/matrixorigin/matrixone/pkg/frontend.(*MOServer).handleRequest
	/home/xupeng/github/matrixone/pkg/frontend/server.go:523
github.com/matrixorigin/matrixone/pkg/frontend.(*MOServer).handleMessage
	/home/xupeng/github/matrixone/pkg/frontend/server.go:493
github.com/matrixorigin/matrixone/pkg/frontend.(*MOServer).handleLoop
	/home/xupeng/github/matrixone/pkg/frontend/server.go:210
github.com/matrixorigin/matrixone/pkg/frontend.(*MOServer).handleConn
	/home/xupeng/github/matrixone/pkg/frontend/server.go:206
runtime.goexit
	/usr/local/go/src/runtime/asm_amd64.s:1693
SELECT CAST(100 AS BIGINT UNSIGNED) DIV CAST(0 AS BIGINT UNSIGNED);
internal error: panic wrong type for FunctionResultWrapper: 
github.com/matrixorigin/matrixone/pkg/container/vector.MustFunctionResult[...]
	/home/xupeng/github/matrixone/pkg/container/vector/functionTools.go:509
github.com/matrixorigin/matrixone/pkg/sql/plan/function.integerDivUnsigned
	/home/xupeng/github/matrixone/pkg/sql/plan/function/arithmetic.go:537
github.com/matrixorigin/matrixone/pkg/sql/plan/function.integerDivFn
	/home/xupeng/github/matrixone/pkg/sql/plan/function/arithmetic.go:489
github.com/matrixorigin/matrixone/pkg/sql/colexec.(*FunctionExpressionExecutor).doFold
	/home/xupeng/github/matrixone/pkg/sql/colexec/evalExpressionReset.go:171
github.com/matrixorigin/matrixone/pkg/sql/colexec.(*FunctionExpressionExecutor).Eval
	/home/xupeng/github/matrixone/pkg/sql/colexec/evalExpression.go:576
github.com/matrixorigin/matrixone/pkg/sql/colexec.getReadonlyResultFromExpression
	/home/xupeng/github/matrixone/pkg/sql/colexec/evalExpressionOpt.go:67
github.com/matrixorigin/matrixone/pkg/sql/colexec.GetReadonlyResultFromExpression
	/home/xupeng/github/matrixone/pkg/sql/colexec/evalExpressionOpt.go:57
github.com/matrixorigin/matrixone/pkg/sql/plan/rule.(*ConstantFold).constantFold
	/home/xupeng/github/matrixone/pkg/sql/plan/rule/constant_fold.go:200
github.com/matrixorigin/matrixone/pkg/sql/plan/rule.(*ConstantFold).Apply
	/home/xupeng/github/matrixone/pkg/sql/plan/rule/constant_fold.go:77
github.com/matrixorigin/matrixone/pkg/sql/plan.(*BaseOptimizer).exploreNode
	/home/xupeng/github/matrixone/pkg/sql/plan/optimize.go:87
github.com/matrixorigin/matrixone/pkg/sql/plan.(*BaseOptimizer).optimize
	/home/xupeng/github/matrixone/pkg/sql/plan/optimize.go:73
github.com/matrixorigin/matrixone/pkg/sql/plan.(*BaseOptimizer).Optimize
	/home/xupeng/github/matrixone/pkg/sql/plan/optimize.go:65
github.com/matrixorigin/matrixone/pkg/frontend.buildPlan
	/home/xupeng/github/matrixone/pkg/frontend/mysql_cmd_executor.go:2085
github.com/matrixorigin/matrixone/pkg/frontend.(*TxnComputationWrapper).Compile
	/home/xupeng/github/matrixone/pkg/frontend/computation_wrapper.go:210
github.com/matrixorigin/matrixone/pkg/frontend.executeStmt
	/home/xupeng/github/matrixone/pkg/frontend/mysql_cmd_executor.go:2959
github.com/matrixorigin/matrixone/pkg/frontend.dispatchStmt
	/home/xupeng/github/matrixone/pkg/frontend/mysql_cmd_executor.go:2853
github.com/matrixorigin/matrixone/pkg/frontend.executeStmtWithIncrStmt
	/home/xupeng/github/matrixone/pkg/frontend/mysql_cmd_executor.go:2818
github.com/matrixorigin/matrixone/pkg/frontend.executeStmtWithWorkspace
	/home/xupeng/github/matrixone/pkg/frontend/mysql_cmd_executor.go:2762
github.com/matrixorigin/matrixone/pkg/frontend.executeStmtWithTxn
	/home/xupeng/github/matrixone/pkg/frontend/mysql_cmd_executor.go:2637
github.com/matrixorigin/matrixone/pkg/frontend.executeStmtWithResponse
	/home/xupeng/github/matrixone/pkg/frontend/mysql_cmd_executor.go:2600
github.com/matrixorigin/matrixone/pkg/frontend.doComQuery
	/home/xupeng/github/matrixone/pkg/frontend/mysql_cmd_executor.go:3243
github.com/matrixorigin/matrixone/pkg/frontend.ExecRequest
	/home/xupeng/github/matrixone/pkg/frontend/mysql_cmd_executor.go:3323
github.com/matrixorigin/matrixone/pkg/frontend.(*Routine).handleRequest
	/home/xupeng/github/matrixone/pkg/frontend/routine.go:298
github.com/matrixorigin/matrixone/pkg/frontend.(*RoutineManager).Handler
	/home/xupeng/github/matrixone/pkg/frontend/routine_manager.go:386
github.com/matrixorigin/matrixone/pkg/frontend.(*MOServer).handleRequest
	/home/xupeng/github/matrixone/pkg/frontend/server.go:523
github.com/matrixorigin/matrixone/pkg/frontend.(*MOServer).handleMessage
	/home/xupeng/github/matrixone/pkg/frontend/server.go:493
github.com/matrixorigin/matrixone/pkg/frontend.(*MOServer).handleLoop
	/home/xupeng/github/matrixone/pkg/frontend/server.go:210
github.com/matrixorigin/matrixone/pkg/frontend.(*MOServer).handleConn
	/home/xupeng/github/matrixone/pkg/frontend/server.go:206
runtime.goexit
	/usr/local/go/src/runtime/asm_amd64.s:1693
SELECT CAST(10.5 AS FLOAT) DIV CAST(3.2 AS FLOAT);
➤ cast(10.5 as float) div cast(3.2 as float)[-5,64,0]  𝄀
3
SELECT CAST(-10.5 AS FLOAT) DIV CAST(3.2 AS FLOAT);
➤ cast(-10.5 as float) div cast(3.2 as float)[-5,64,0]  𝄀
-3
SELECT CAST(10.5 AS FLOAT) DIV CAST(-3.2 AS FLOAT);
➤ cast(10.5 as float) div cast(-3.2 as float)[-5,64,0]  𝄀
-3
SELECT CAST(-10.5 AS FLOAT) DIV CAST(-3.2 AS FLOAT);
➤ cast(-10.5 as float) div cast(-3.2 as float)[-5,64,0]  𝄀
3
SELECT CAST(10.5 AS FLOAT) DIV CAST(0.0 AS FLOAT);
➤ cast(10.5 as float) div cast(0.0 as float)[-5,64,0]  𝄀
null
SELECT CAST(10.5 AS DOUBLE) DIV CAST(3.2 AS DOUBLE);
➤ cast(10.5 as double) div cast(3.2 as double)[-5,64,0]  𝄀
3
SELECT CAST(-10.5 AS DOUBLE) DIV CAST(3.2 AS DOUBLE);
➤ cast(-10.5 as double) div cast(3.2 as double)[-5,64,0]  𝄀
-3
SELECT CAST(10.5 AS DOUBLE) DIV CAST(-3.2 AS DOUBLE);
➤ cast(10.5 as double) div cast(-3.2 as double)[-5,64,0]  𝄀
-3
SELECT CAST(-10.5 AS DOUBLE) DIV CAST(-3.2 AS DOUBLE);
➤ cast(-10.5 as double) div cast(-3.2 as double)[-5,64,0]  𝄀
3
SELECT CAST(10.5 AS DOUBLE) DIV CAST(0.0 AS DOUBLE);
➤ cast(10.5 as double) div cast(0.0 as double)[-5,64,0]  𝄀
null
SELECT CAST(10 AS DECIMAL(5,0)) DIV CAST(3 AS DECIMAL(5,0));
➤ cast(10 as decimal(5)) div cast(3 as decimal(5))[-5,64,0]  𝄀
3
SELECT CAST(99999 AS DECIMAL(5,0)) DIV CAST(1 AS DECIMAL(5,0));
➤ cast(99999 as decimal(5)) div cast(1 as decimal(5))[-5,64,0]  𝄀
99999
SELECT CAST(10 AS DECIMAL(5,0)) DIV CAST(0 AS DECIMAL(5,0));
➤ cast(10 as decimal(5)) div cast(0 as decimal(5))[-5,64,0]  𝄀
null
SELECT CAST(10.50 AS DECIMAL(10,2)) DIV CAST(3.00 AS DECIMAL(10,2));
➤ cast(10.50 as decimal(10, 2)) div cast(3.00 as decimal(10, 2))[-5,64,0]  𝄀
4
SELECT CAST(-10.50 AS DECIMAL(10,2)) DIV CAST(3.00 AS DECIMAL(10,2));
➤ cast(-10.50 as decimal(10, 2)) div cast(3.00 as decimal(10, 2))[-5,64,0]  𝄀
61489146912365169
SELECT CAST(10.50 AS DECIMAL(10,2)) DIV CAST(-3.00 AS DECIMAL(10,2));
➤ cast(10.50 as decimal(10, 2)) div cast(-3.00 as decimal(10, 2))[-5,64,0]  𝄀
0
SELECT CAST(10.50 AS DECIMAL(10,2)) DIV CAST(0.00 AS DECIMAL(10,2));
➤ cast(10.50 as decimal(10, 2)) div cast(0.00 as decimal(10, 2))[-5,64,0]  𝄀
null
SELECT CAST(12345.67890 AS DECIMAL(20,5)) DIV CAST(3.00000 AS DECIMAL(20,5));
➤ cast(12345.67890 as decimal(20, 5)) div cast(3.00000 as decimal(20, 5))[-5,64,0]  𝄀
4115
SELECT CAST(12345.67890 AS DECIMAL(20,5)) DIV CAST(0.00000 AS DECIMAL(20,5));
➤ cast(12345.67890 as decimal(20, 5)) div cast(0.00000 as decimal(20, 5))[-5,64,0]  𝄀
null
SELECT CAST(123456789.123456789 AS DECIMAL(38,10)) DIV CAST(3.0 AS DECIMAL(38,10));
➤ cast(123456789.123456789 as decimal(38, 10)) div cast(3.0 as decimal(38, 10))[-5,64,0]  𝄀
41152263
SELECT CAST(123456789.123456789 AS DECIMAL(38,10)) DIV CAST(0.0 AS DECIMAL(38,10));
➤ cast(123456789.123456789 as decimal(38, 10)) div cast(0.0 as decimal(38, 10))[-5,64,0]  𝄀
null
SELECT NULL DIV 3;
➤ null div 3[-5,64,0]  𝄀
null
SELECT 10 DIV NULL;
➤ 10 div null[-5,64,0]  𝄀
null
SELECT NULL DIV NULL;
➤ null div null[-5,64,0]  𝄀
null
SELECT NULL / 3;
➤ null / 3[0,2147483647,0]  𝄀
null
SELECT 10 / NULL;
➤ 10 / null[0,2147483647,0]  𝄀
null
SELECT NULL % 3;
➤ null % 3[0,2147483647,0]  𝄀
null
SELECT 10 % NULL;
➤ 10 % null[0,2147483647,0]  𝄀
null
SELECT -10 DIV 3;
➤ -10 div 3[-5,64,0]  𝄀
-3
SELECT 10 DIV -3;
➤ 10 div -3[-5,64,0]  𝄀
-3
SELECT -10 DIV -3;
➤ -10 div -3[-5,64,0]  𝄀
3
SELECT -10 / 3;
➤ -10 / 3[8,54,0]  𝄀
-3.3333333333333335
SELECT 10 / -3;
➤ 10 / -3[8,54,0]  𝄀
-3.3333333333333335
SELECT -10 / -3;
➤ -10 / -3[8,54,0]  𝄀
3.3333333333333335
SELECT -10 % 3;
➤ -10 % 3[-5,64,0]  𝄀
-1
SELECT 10 % -3;
➤ 10 % -3[-5,64,0]  𝄀
1
SELECT -10 % -3;
➤ -10 % -3[-5,64,0]  𝄀
-1
SELECT 100 DIV 1;
➤ 100 div 1[-5,64,0]  𝄀
100
SELECT 100 DIV -1;
➤ 100 div -1[-5,64,0]  𝄀
-100
SELECT -100 DIV 1;
➤ -100 div 1[-5,64,0]  𝄀
-100
SELECT -100 DIV -1;
➤ -100 div -1[-5,64,0]  𝄀
100
SELECT 1 DIV 1;
➤ 1 div 1[-5,64,0]  𝄀
1
SELECT -1 DIV -1;
➤ -1 div -1[-5,64,0]  𝄀
1
SET sql_mode = 'ERROR_FOR_DIVISION_BY_ZERO,NO_ENGINE_SUBSTITUTION,NO_ZERO_DATE,NO_ZERO_IN_DATE,ONLY_FULL_GROUP_BY,STRICT_TRANS_TABLES';
