drop table if exists spatial_idx_t1;
create table spatial_idx_t1(
id int primary key,
g point not null
);
create spatial index idx_g on spatial_idx_t1(g);
show create table spatial_idx_t1;
➤ Table[12,-1,0]  ¦  Create Table[12,-1,0]  𝄀
spatial_idx_t1  ¦  CREATE TABLE `spatial_idx_t1` (
  `id` int NOT NULL,
  `g` point NOT NULL,
  PRIMARY KEY (`id`),
  SPATIAL KEY `idx_g` (`g`)
)
show index from spatial_idx_t1;
➤ Table[12,-1,0]  ¦  Non_unique[-5,64,0]  ¦  Key_name[12,-1,0]  ¦  Seq_in_index[4,32,0]  ¦  Column_name[12,-1,0]  ¦  Collation[12,-1,0]  ¦  Cardinality[-5,64,0]  ¦  Sub_part[12,-1,0]  ¦  Packed[12,-1,0]  ¦  Null[12,-1,0]  ¦  Index_type[12,-1,0]  ¦  Comment[1,0,0]  ¦  Index_comment[12,-1,0]  ¦  Index_params[12,-1,0]  ¦  Visible[12,-1,0]  ¦  Expression[12,-1,0]  𝄀
spatial_idx_t1  ¦  0  ¦  PRIMARY  ¦  1  ¦  id  ¦  A  ¦  0  ¦  NULL  ¦  NULL  ¦    ¦    ¦    ¦    ¦    ¦  YES  ¦  id  𝄀
spatial_idx_t1  ¦  1  ¦  idx_g  ¦  1  ¦  g  ¦  A  ¦  0  ¦  NULL  ¦  NULL  ¦    ¦  rtree  ¦    ¦    ¦    ¦  YES  ¦  g
select name, type, algo, column_name
from mo_catalog.mo_indexes
where name = 'idx_g'
and table_id = (
select rel_id
from mo_catalog.mo_tables
where reldatabase = database()
and relname = 'spatial_idx_t1'
)
order by column_name;
➤ name[12,-1,0]  ¦  type[12,-1,0]  ¦  algo[12,-1,0]  ¦  column_name[12,-1,0]  𝄀
idx_g  ¦  SPATIAL  ¦  rtree  ¦  __mo_alias_id  𝄀
idx_g  ¦  SPATIAL  ¦  rtree  ¦  g
insert into spatial_idx_t1 values
(1, st_geomfromtext('POINT(1 1)')),
(2, st_geomfromtext('POINT(1 1)'));
select count(*) as row_count from spatial_idx_t1;
➤ row_count[-5,64,0]  𝄀
2
drop index idx_g on spatial_idx_t1;
show create table spatial_idx_t1;
➤ Table[12,-1,0]  ¦  Create Table[12,-1,0]  𝄀
spatial_idx_t1  ¦  CREATE TABLE `spatial_idx_t1` (
  `id` int NOT NULL,
  `g` point NOT NULL,
  PRIMARY KEY (`id`)
)
drop table spatial_idx_t1;
drop table if exists spatial_idx_path;
create table spatial_idx_path(
id int primary key,
g point not null,
payload int
);
create spatial index idx_g on spatial_idx_path(g);
insert into spatial_idx_path values
(1, st_geomfromtext('POINT(1 1)'), 10),
(2, st_geomfromtext('POINT(2 2)'), 20),
(3, st_geomfromtext('POINT(5 5)'), 30);
explain select id from spatial_idx_path where st_intersects(g, st_geomfromtext('POINT(1 1)'));
➤ TP QUERY PLAN[12,0,0]  𝄀
Project  𝄀
  ->  Index Table Scan on spatial_idx_path.idx_g  𝄀
        Filter Cond: st_intersects(__mo_index_idx_col, 'POINT(1 1)')
explain select payload from spatial_idx_path where st_intersects(g, st_geomfromtext('POINT(1 1)'));
➤ TP QUERY PLAN[12,0,0]  𝄀
Project  𝄀
  ->  Join  𝄀
        Join Type: INDEX  𝄀
        Join Cond: (spatial_idx_path.id = __mo_index_pri_col)  𝄀
        Runtime Filter Build: #[-1,0]  𝄀
        ->  Table Scan on func_geometry_spatial_index.spatial_idx_path [ForceOneCN]  𝄀
              Filter Cond: st_intersects(spatial_idx_path.g, 'POINT(1 1)')  𝄀
              Runtime Filter Probe: spatial_idx_path.id  𝄀
        ->  Index Table Scan on spatial_idx_path.idx_g [ForceOneCN]  𝄀
              Filter Cond: st_intersects(__mo_index_idx_col, 'POINT(1 1)')
explain select id from spatial_idx_path where st_distance(g, st_geomfromtext('POINT(1 1)')) <= 0;
➤ TP QUERY PLAN[12,0,0]  𝄀
Project  𝄀
  ->  Index Table Scan on spatial_idx_path.idx_g  𝄀
        Filter Cond: (st_distance(__mo_index_idx_col, 'POINT(1 1)') <= 0)
explain select payload from spatial_idx_path where st_distance(g, st_geomfromtext('POINT(1 1)')) <= 0;
➤ TP QUERY PLAN[12,0,0]  𝄀
Project  𝄀
  ->  Join  𝄀
        Join Type: INDEX  𝄀
        Join Cond: (spatial_idx_path.id = __mo_index_pri_col)  𝄀
        Runtime Filter Build: #[-1,0]  𝄀
        ->  Table Scan on func_geometry_spatial_index.spatial_idx_path [ForceOneCN]  𝄀
              Filter Cond: (st_distance(spatial_idx_path.g, 'POINT(1 1)') <= 0)  𝄀
              Runtime Filter Probe: spatial_idx_path.id  𝄀
        ->  Index Table Scan on spatial_idx_path.idx_g [ForceOneCN]  𝄀
              Filter Cond: (st_distance(__mo_index_idx_col, 'POINT(1 1)') <= 0)
select id from spatial_idx_path where st_intersects(g, st_geomfromtext('POINT(1 1)')) order by id;
➤ id[4,32,0]  𝄀
1
select id from spatial_idx_path where st_distance(g, st_geomfromtext('POINT(1 1)')) <= 0 order by id;
➤ id[4,32,0]  𝄀
1
update spatial_idx_path set g = st_geomfromtext('POINT(3 3)') where id = 2;
select id from spatial_idx_path where st_intersects(g, st_geomfromtext('POINT(2 2)')) order by id;
➤ id[4,32,0]
select id from spatial_idx_path where st_intersects(g, st_geomfromtext('POINT(3 3)')) order by id;
➤ id[4,32,0]  𝄀
2
replace into spatial_idx_path values (2, st_geomfromtext('POINT(4 4)'), 40);
select id from spatial_idx_path where st_intersects(g, st_geomfromtext('POINT(3 3)')) order by id;
➤ id[4,32,0]
select id from spatial_idx_path where st_intersects(g, st_geomfromtext('POINT(4 4)')) order by id;
➤ id[4,32,0]  𝄀
2
delete from spatial_idx_path where id = 1;
select id from spatial_idx_path where st_intersects(g, st_geomfromtext('POINT(1 1)')) order by id;
➤ id[4,32,0]
drop table spatial_idx_path;
drop table if exists spatial_idx_t2;
create table spatial_idx_t2(
id int primary key,
a int
);
create spatial index idx_a on spatial_idx_t2(a);
-- @regex("SPATIAL INDEX can only be created on GEOMETRY column", true)
not supported: SPATIAL INDEX can only be created on GEOMETRY column 'a'
drop table spatial_idx_t2;
drop table if exists spatial_idx_multi;
create table spatial_idx_multi(
id int primary key,
g1 point,
g2 point
);
create spatial index idx_g on spatial_idx_multi(g1, g2);
-- @regex("SPATIAL INDEX only supports a single GEOMETRY column", true)
not supported: SPATIAL INDEX only supports a single GEOMETRY column
drop table spatial_idx_multi;
drop table if exists spatial_idx_nullable;
create table spatial_idx_nullable(
id int primary key,
g point
);
create spatial index idx_g on spatial_idx_nullable(g);
-- @regex("All parts of a SPATIAL index must be declared NOT NULL", true)
invalid input: All parts of a SPATIAL index must be declared NOT NULL
drop table spatial_idx_nullable;
