drop database if exists group_concat_strict_write_28664;
create database group_concat_strict_write_28664;
use group_concat_strict_write_28664;
create table src (id int primary key, v varchar(20));
insert into src values (1, 'aa'), (2, 'bbb'), (3, 'cccc');
create table dst (id int primary key, gc varchar(100));
create table dst_insert (gc varchar(100));
create table dst_ignore (gc varchar(100));
create table dst_nonstrict (gc varchar(100));
insert into dst values (1, 'sentinel');
set @group_concat_strict_saved_mode = @@sql_mode;
set @group_concat_strict_saved_max_len = @@group_concat_max_len;
set session group_concat_max_len = 4;
set session sql_mode = 'STRICT_TRANS_TABLES';
select group_concat(v order by id separator '|') from src;
group_concat(v, |,order by id)
aa|b
show warnings;
➤ Level[12,0,0]  ¦  Code[5,0,0]  ¦  Message[12,0,0]  𝄀
Warning  ¦  1260  ¦  Row 2 was cut by GROUP_CONCAT()
insert into dst_insert select group_concat(v order by id separator '|') from src;
Row 2 was cut by GROUP_CONCAT()
select count(*) from dst_insert;
count(*)
0
create table ctas_strict as
select group_concat(v order by id separator '|') as gc from src;
Row 2 was cut by GROUP_CONCAT()
select count(*) from information_schema.tables
where table_schema = 'group_concat_strict_write_28664' and table_name = 'ctas_strict';
count(*)
0
update dst set gc = (select group_concat(v order by id separator '|') from src) where id = 1;
Row 2 was cut by GROUP_CONCAT()
select gc from dst where id = 1;
gc
sentinel
replace into dst select 1, group_concat(v order by id separator '|') from src;
Row 2 was cut by GROUP_CONCAT()
select gc from dst where id = 1;
gc
sentinel
insert into dst select 1, group_concat(v order by id separator '|') from src
on duplicate key update gc = values(gc);
Row 2 was cut by GROUP_CONCAT()
select gc from dst where id = 1;
gc
sentinel
insert ignore into dst_ignore
select group_concat(v order by id separator '|') from src;
select gc from dst_ignore;
gc
aa|b
show warnings;
➤ Level[12,0,0]  ¦  Code[5,0,0]  ¦  Message[12,0,0]  𝄀
Warning  ¦  1260  ¦  Row 2 was cut by GROUP_CONCAT()
set session sql_mode = '';
insert into dst_nonstrict
select group_concat(v order by id separator '|') from src;
select gc from dst_nonstrict;
gc
aa|b
set session sql_mode = @group_concat_strict_saved_mode;
set session group_concat_max_len = @group_concat_strict_saved_max_len;
drop database group_concat_strict_write_28664;
