drop database if exists integer_parameter_coercion;
create database integer_parameter_coercion;
use integer_parameter_coercion;
create table sources(id int, d decimal(38,18), v double, s varchar(32), bits bit(8));
insert into sources values (1,2.5,2.5,'1.9tail',b'10'),(2,1.5,1.5,'-1.9tail',b'1'),(3,null,null,null,null);
select id,substring_index('a.b.c.d','.',d),substring_index('a.b.c.d','.',v),substring_index('a.b.c.d','.',cast(v as double)),substring_index('a.b.c.d','.',s),substring_index('a.b.c.d','.',bits) from sources order by id;
➤ id[4,32,0]  ¦  substring_index(a.b.c.d, ., d)[12,7,0]  ¦  substring_index(a.b.c.d, ., v)[12,7,0]  ¦  substring_index(a.b.c.d, ., cast(v as double))[12,7,0]  ¦  substring_index(a.b.c.d, ., s)[12,7,0]  ¦  substring_index(a.b.c.d, ., bits)[12,7,0]  𝄀
1  ¦  a.b.c  ¦  a.b  ¦  a.b  ¦  a  ¦  a.b  𝄀
2  ¦  a.b  ¦  a.b  ¦  a  ¦  d  ¦  a  𝄀
3  ¦  null  ¦  null  ¦  null  ¦  null  ¦  null
select substring_index('a.b.c.d','.',2.5),substring_index('a.b.c.d','.',2.5e0),substring_index('a.b.c.d','.',cast(1.5 as double));
➤ substring_index(a.b.c.d, ., 2.5)[12,7,0]  ¦  substring_index(a.b.c.d, ., 2.5e0)[12,7,0]  ¦  substring_index(a.b.c.d, ., cast(1.5 as double))[12,7,0]  𝄀
a.b.c  ¦  a.b  ¦  a
select id,substring_index('a.b.c.d','.',if(id=1,d,v)),substring_index('a.b.c.d','.',case when id=1 then d else v end),substring_index('a.b.c.d','.',if(id=2,cast(v as double),v)) from sources order by id;
➤ id[4,32,0]  ¦  substring_index(a.b.c.d, ., if(id = 1, d, v))[12,7,0]  ¦  substring_index(a.b.c.d, ., case when id = 1 then d else v end)[12,7,0]  ¦  substring_index(a.b.c.d, ., if(id = 2, cast(v as double), v))[12,7,0]  𝄀
1  ¦  a.b.c  ¦  a.b.c  ¦  a.b  𝄀
2  ¦  a.b  ¦  a.b  ¦  a  𝄀
3  ¦  null  ¦  null  ¦  null
select id,substring_index('a.b.c.d','.',cast(v as double)+0e0),substring_index('a.b.c.d','.',abs(cast(v as double))),substring_index('a.b.c.d','.',coalesce(cast(v as double),0e0)),substring_index('a.b.c.d','.',ifnull(cast(v as double),0e0)),substring_index('a.b.c.d','.',nullif(cast(v as double),-1e0)) from sources order by id;
➤ id[4,32,0]  ¦  substring_index(a.b.c.d, ., cast(v as double) + 0e0)[12,7,0]  ¦  substring_index(a.b.c.d, ., abs(cast(v as double)))[12,7,0]  ¦  substring_index(a.b.c.d, ., coalesce(cast(v as double), 0e0))[12,7,0]  ¦  substring_index(a.b.c.d, ., ifnull(cast(v as double), 0e0))[12,7,0]  ¦  substring_index(a.b.c.d, ., nullif(cast(v as double), -1e0))[12,7,0]  𝄀
1  ¦  a.b  ¦  a.b  ¦  a.b  ¦  a.b  ¦  a.b  𝄀
2  ¦  a.b  ¦  a.b  ¦  a.b  ¦  a.b  ¦  a  𝄀
3  ¦  null  ¦  null  ¦    ¦    ¦  null
select substring_index('a.b.c','.',if(true,1,cast('9223372036854775808' as decimal(20,0))));
➤ substring_index(a.b.c, ., if(true, 1, cast(9223372036854775808 as decimal(20))))[12,5,0]  𝄀
a
select substring_index('a.b.c','.',case when false then cast('9223372036854775808' as decimal(20,0)) else 1 end);
➤ substring_index(a.b.c, ., case when false then cast(9223372036854775808 as decimal(20)) else 1 end)[12,5,0]  𝄀
a
select substring_index('a.b.c','.',true),substring_index('a.b.c','.',false),substring_index('a.b.c','.', '  +2tail'),substring_index('a.b.c','.', '1e2'),substring_index('a.b.c','.', 'bad');
➤ substring_index(a.b.c, ., true)[12,5,0]  ¦  substring_index(a.b.c, ., false)[12,5,0]  ¦  substring_index(a.b.c, .,   +2tail)[12,5,0]  ¦  substring_index(a.b.c, ., 1e2)[12,5,0]  ¦  substring_index(a.b.c, ., bad)[12,5,0]  𝄀
a  ¦    ¦  a.b  ¦  a  ¦  
select substring_index('a.b.c','.',cast('9007199254740993.5' as decimal(38,1)));
➤ substring_index(a.b.c, ., cast(9007199254740993.5 as decimal(38, 1)))[12,5,0]  𝄀
a.b.c
select substring_index('a.b.c','.',cast('9223372036854775807.4' as decimal(38,1)));
➤ substring_index(a.b.c, ., cast(9223372036854775807.4 as decimal(38, 1)))[12,5,0]  𝄀
a.b.c
select substring_index('a.b.c','.',cast('9223372036854775807.5' as decimal(38,1)));
Data truncation: data out of range: data type int64, integer argument
select substring_index('a.b.c','.',18446744073709551615);
Data truncation: data out of range: data type int64, integer argument
select substring_index('a.b.c','.', '-9223372036854775809');
Data truncation: data out of range: data type int64, integer argument
select substring_index('a.b.c','.',null);
➤ substring_index(a.b.c, ., null)[12,5,0]  𝄀
null
create table defaults_t(a varchar(32) default (substring_index('a.b.c.d','.',2.5)),b varchar(32) default (substring_index('a.b.c.d','.',cast(1.5 as double))));
insert into defaults_t values (default,default);
select * from defaults_t;
➤ a[12,32,0]  ¦  b[12,32,0]  𝄀
a.b.c  ¦  a
create table generated_t(v double,g varchar(32) generated always as (substring_index('a.b.c.d','.',v)) stored,h varchar(32) generated always as (substring_index('a.b.c.d','.',cast(v as double))) stored,check(length(substring_index('a.b.c.d','.',v))>=0));
insert into generated_t(v) values (1.5),(2.5),(null);
select * from generated_t order by v;
➤ v[8,53,31]  ¦  g[12,32,0]  ¦  h[12,32,0]  𝄀
null  ¦  null  ¦  null  𝄀
1.5  ¦  a.b  ¦  a  𝄀
2.5  ¦  a.b  ¦  a.b
update generated_t set v=3.5 where v=1.5;
select * from generated_t order by v;
➤ v[8,53,31]  ¦  g[12,32,0]  ¦  h[12,32,0]  𝄀
null  ¦  null  ¦  null  𝄀
2.5  ¦  a.b  ¦  a.b  𝄀
3.5  ¦  a.b.c.d  ¦  a.b.c
prepare integer_source from 'select substring_index("a.b.c.d",".",?),substring_index("a.b.c.d",".",cast(? as double))';
set @v=1.5e0;
execute integer_source using @v,@v;
➤ substring_index(a.b.c.d, ., ?)[12,7,0]  ¦  substring_index(a.b.c.d, ., cast(? as double))[12,7,0]  𝄀
a.b  ¦  a
set @v=2.5;
execute integer_source using @v,@v;
➤ substring_index(a.b.c.d, ., ?)[12,7,0]  ¦  substring_index(a.b.c.d, ., cast(? as double))[12,7,0]  𝄀
a.b.c  ¦  a.b
set @v='1.9tail';
execute integer_source using @v,@v;
➤ substring_index(a.b.c.d, ., ?)[12,7,0]  ¦  substring_index(a.b.c.d, ., cast(? as double))[12,7,0]  𝄀
a  ¦  a
set @v=null;
execute integer_source using @v,@v;
➤ substring_index(a.b.c.d, ., ?)[12,7,0]  ¦  substring_index(a.b.c.d, ., cast(? as double))[12,7,0]  𝄀
null  ¦  null
set @v='9223372036854775808';
execute integer_source using @v,@v;
Data truncation: data out of range: data type int64, integer argument
set @v=1.5e0;
execute integer_source using @v,@v;
➤ substring_index(a.b.c.d, ., ?)[12,7,0]  ¦  substring_index(a.b.c.d, ., cast(? as double))[12,7,0]  𝄀
a.b  ¦  a
deallocate prepare integer_source;
drop database integer_parameter_coercion;
