SET @hash_saved_sql_mode=@@session.sql_mode;
SET @hash_saved_optimizer_hints=@@session.optimizer_hints;
SET SESSION sql_mode='';
SET SESSION optimizer_hints='';
DROP DATABASE IF EXISTS mo_statement_hash_bvt;
CREATE DATABASE mo_statement_hash_bvt;
USE mo_statement_hash_bvt;
SELECT MO_STATEMENT_HASH('SELECT 1') AS hash_value;
➤ hash_value[12,64,0]  𝄀
822ae07d4783158bc1912bb623e5107cc9002d519e1143a9c200ed6ee18b6d0f
SELECT MO_STATEMENT_HASH(' select /* ordinary comment */ 1; ') = MO_STATEMENT_HASH('SELECT 1') AS same_format,
MO_STATEMENT_HASH('SELECT 1') <> MO_STATEMENT_HASH('SELECT 2') AS distinct_literal,
MO_STATEMENT_HASH('SELECT a') <> MO_STATEMENT_HASH('SELECT ''a''') AS identifier_not_literal;
➤ same_format[-7,1,0]  ¦  distinct_literal[-7,1,0]  ¦  identifier_not_literal[-7,1,0]  𝄀
1  ¦  1  ¦  1
SELECT MO_STATEMENT_HASH('SELECT @MiXeD') = MO_STATEMENT_HASH('SELECT @`mixed`') AS same_variable,
MO_STATEMENT_HASH('SELECT @mixed') <> MO_STATEMENT_HASH('SELECT @other') AS distinct_variable,
MO_STATEMENT_HASH(NULL) IS NULL AS null_input;
➤ same_variable[-7,1,0]  ¦  distinct_variable[-7,1,0]  ¦  null_input[-7,1,0]  𝄀
1  ¦  1  ¦  1
CREATE TABLE inputs(id INT PRIMARY KEY, sql_text TEXT);
INSERT INTO inputs VALUES (1,'SELECT 1'),(2,'SELECT FROM'),(3,NULL);
SELECT id, CASE WHEN id=2 THEN 'masked' ELSE MO_STATEMENT_HASH(sql_text) END AS hash_value FROM inputs ORDER BY id;
➤ id[4,32,0]  ¦  hash_value[12,64,0]  𝄀
1  ¦  822ae07d4783158bc1912bb623e5107cc9002d519e1143a9c200ed6ee18b6d0f  𝄀
2  ¦  masked  𝄀
3  ¦  null
SELECT id, CASE WHEN id=1 THEN MO_STATEMENT_HASH('SELECT 1') ELSE 'masked' END AS hash_value FROM inputs ORDER BY id;
➤ id[4,32,0]  ¦  hash_value[12,64,0]  𝄀
1  ¦  822ae07d4783158bc1912bb623e5107cc9002d519e1143a9c200ed6ee18b6d0f  𝄀
2  ¦  masked  𝄀
3  ¦  masked
SELECT id, CASE WHEN id<0 THEN MO_STATEMENT_HASH('SELECT FROM') ELSE 'masked' END AS hash_value FROM inputs ORDER BY id;
➤ id[4,32,0]  ¦  hash_value[12,64,0]  𝄀
1  ¦  masked  𝄀
2  ¦  masked  𝄀
3  ¦  masked
SELECT MO_STATEMENT_HASH(sql_text) AS hash_value FROM inputs WHERE id<0;
➤ hash_value[12,64,0]
SELECT MO_STATEMENT_HASH('SELECT FROM');
You have an error in your SQL syntax; check the manual that corresponds to your MatrixOne server version for the right syntax to use. syntax error at line 1 column 11 near " FROM";
SELECT MO_STATEMENT_HASH('SELECT 1; SELECT 2');
SQL parser error: MO_STATEMENT_HASH requires exactly one statement
SELECT MO_STATEMENT_HASH('/* comment only */');
SQL parser error: MO_STATEMENT_HASH requires a non-empty statement
SELECT MO_STATEMENT_HASH('SELECT 1') = '822ae07d4783158bc1912bb623e5107cc9002d519e1143a9c200ed6ee18b6d0f' AS recovered;
➤ recovered[-7,1,0]  𝄀
1
PREPARE hash_probe FROM 'SELECT MO_STATEMENT_HASH(?) AS parameter_hash, MO_STATEMENT_HASH(''SELECT "name"'') AS constant_hash';
SET @hash_input='SELECT "name"';
EXECUTE hash_probe USING @hash_input;
➤ parameter_hash[12,64,0]  ¦  constant_hash[12,64,0]  𝄀
2db8b511dcca609c62d155b36ad8785289252b0be823ad26a7239093c4b57fab  ¦  2db8b511dcca609c62d155b36ad8785289252b0be823ad26a7239093c4b57fab
SET SESSION sql_mode='ANSI_QUOTES';
EXECUTE hash_probe USING @hash_input;
➤ parameter_hash[12,64,0]  ¦  constant_hash[12,64,0]  𝄀
5cdeb409afe225d497548d81edc1b7f27e90149d459871fc4e6595395567c407  ¦  5cdeb409afe225d497548d81edc1b7f27e90149d459871fc4e6595395567c407
SET SESSION sql_mode='';
EXECUTE hash_probe USING @hash_input;
➤ parameter_hash[12,64,0]  ¦  constant_hash[12,64,0]  𝄀
2db8b511dcca609c62d155b36ad8785289252b0be823ad26a7239093c4b57fab  ¦  2db8b511dcca609c62d155b36ad8785289252b0be823ad26a7239093c4b57fab
SET @hash_input='SELECT FROM';
EXECUTE hash_probe USING @hash_input;
You have an error in your SQL syntax; check the manual that corresponds to your MatrixOne server version for the right syntax to use. syntax error at line 1 column 11 near " FROM";
SET @hash_input=NULL;
EXECUTE hash_probe USING @hash_input;
➤ parameter_hash[12,64,0]  ¦  constant_hash[12,64,0]  𝄀
null  ¦  2db8b511dcca609c62d155b36ad8785289252b0be823ad26a7239093c4b57fab
SET @hash_input='SELECT 1';
EXECUTE hash_probe USING @hash_input;
➤ parameter_hash[12,64,0]  ¦  constant_hash[12,64,0]  𝄀
822ae07d4783158bc1912bb623e5107cc9002d519e1143a9c200ed6ee18b6d0f  ¦  2db8b511dcca609c62d155b36ad8785289252b0be823ad26a7239093c4b57fab
DEALLOCATE PREPARE hash_probe;
UPDATE inputs SET sql_text='SELECT "name"' WHERE id=1;
SET SESSION optimizer_hints='execType=2';
SET SESSION sql_mode='ANSI_QUOTES';
SELECT GROUP_CONCAT(CASE WHEN id=2 THEN 'masked' ELSE MO_STATEMENT_HASH(sql_text) END ORDER BY id) AS ap_hashes FROM inputs;
➤ ap_hashes[-1,16383,0]  𝄀
5cdeb409afe225d497548d81edc1b7f27e90149d459871fc4e6595395567c407,masked
SET SESSION sql_mode='';
SELECT GROUP_CONCAT(CASE WHEN id=2 THEN 'masked' ELSE MO_STATEMENT_HASH(sql_text) END ORDER BY id) AS ap_hashes FROM inputs;
➤ ap_hashes[-1,16383,0]  𝄀
2db8b511dcca609c62d155b36ad8785289252b0be823ad26a7239093c4b57fab,masked
SELECT GROUP_CONCAT(MO_STATEMENT_HASH(sql_text)) AS empty_hashes FROM inputs WHERE id<0;
➤ empty_hashes[-1,16383,0]  𝄀
null
SET SESSION optimizer_hints=@hash_saved_optimizer_hints;
SET SESSION sql_mode=@hash_saved_sql_mode;
SET @hash_input=NULL,@hash_saved_sql_mode=NULL,@hash_saved_optimizer_hints=NULL;
DROP DATABASE mo_statement_hash_bvt;
SELECT COUNT(*) AS leftover_databases FROM mo_catalog.mo_database WHERE datname='mo_statement_hash_bvt';
➤ leftover_databases[-5,64,0]  𝄀
0
