select * from metadata_scan('table_func_metadata_scan_idx_tb.no_exist_table', '*') g;
no such table table_func_metadata_scan_idx_tb.no_exist_table
drop table if exists t;
create table t(a int, b varchar, c float, d decimal(10, 8), e float(5, 2));
insert into t values(1, null, 1.1, 1, 1.11);
insert into t values(2, "abc", 2.0, 2, 2.22);
insert into t select * from t;
insert into t select * from t;
insert into t select * from t;
insert into t select * from t;
insert into t select * from t;
insert into t select * from t;
insert into t select * from t;
insert into t select * from t;
insert into t select * from t;
insert into t select * from t;
insert into t select * from t;
insert into t select * from t;
select count(*) from t;
count(*)
8192
select mo_ctl("dn", "flush", "table_func_metadata_scan_idx_tb.t");
mo_ctl(dn, flush, table_func_metadata_scan_idx_tb.t)
{\n  "method": "Flush",\n  "result": [\n    {\n      "returnStr": "OK"\n    }\n  ]\n}\n
CREATE INDEX idx_a ON t(a);
select distinct(col_name) from metadata_scan("table_func_metadata_scan_idx_tb.t.?idx_a", "*")g;
col_name
__mo_index_idx_col
__mo_index_pri_col
CREATE INDEX idx_c_d ON t(c, d);
select distinct(col_name) from metadata_scan("table_func_metadata_scan_idx_tb.t.?idx_c_d", "*")g;
col_name
__mo_index_idx_col
__mo_index_pri_col
select distinct(col_name) from metadata_scan("table_func_metadata_scan_idx_tb.t.?idx_invalid", "*")g;
internal error: check whether the index "idx_invalid" really exists
select distinct(col_name) from metadata_scan("table_func_metadata_scan_idx_tb.t.idx_invalid", "*")g;
internal error: index name must start with ? and follow identifier rules
select distinct(col_name) from metadata_scan("table_func_metadata_scan_idx_tb.t.?idx_invalid.#", "*")g;
internal error: check whether the index "idx_invalid" really exists
select distinct(col_name) from metadata_scan("table_func_metadata_scan_idx_tb.t.?idx_a.#", "*")g;
col_name
select distinct(col_name) from metadata_scan("table_func_metadata_scan_idx_tb.t.#", "*")g;
col_name
delete from t where a = 1;
select count(*) from t;
count(*)
4096
select distinct(col_name) from metadata_scan("table_func_metadata_scan_idx_tb.t.#", "*")g;
col_name
a
b
c
d
e
select distinct(col_name) from metadata_scan("table_func_metadata_scan_idx_tb.t.?idx_a.#", "*")g;
col_name
__mo_index_idx_col
__mo_index_pri_col
