drop database if exists db1;
create database db1;
create table db1.b(b int);
insert into db1.b values (0),(1),(2),(3);
drop account if exists account_test;
create account account_test admin_name = 'root' identified by '111' open comment 'account_test';
use mo_catalog;
drop table if exists a;
create cluster table a(a int);
insert into a values(0,0),(1,0),(2,0),(3,0);
insert into a values(0,1),(1,1),(2,1),(3,1);
update a set account_id=(select account_id from mo_account where account_name="account_test") where account_id=1;
select a from a;
a
0
1
2
3
0
1
2
3
use mo_catalog;
select * from a;
a
0
1
2
3
delete from a;
use mo_catalog;
select * from a;
a
insert into a select b,0 from db1.b;
insert into a select b,1 from db1.b;
update a set account_id=(select account_id from mo_account where account_name="account_test") where account_id=1;
select a from a;
a
0
1
2
3
0
1
2
3
use mo_catalog;
select * from a;
a
0
1
2
3
delete from a;
load data infile '$resources/load_data/cluster_table1.csv' into table a;
update a set account_id=(select account_id from mo_account where account_name="account_test") where account_id=1;
select a from a;
a
0
0
0
0
0
0
0
0
use mo_catalog;
select * from a;
a
0
0
0
0
delete from a;
use mo_catalog;
select * from a;
a
delete from a;
truncate table a;
use mo_catalog;
delete from a;
internal error: only the sys account can insert/update/delete the cluster table
drop table a;
internal error: do not have privilege to execute the statement
truncate table a;
internal error: only the sys account can truncate the cluster table
drop account if exists account_test;
select a from a;
a
drop table if exists a;
drop account if exists account_test;
drop database if exists db1;
use mo_catalog;
CREATE CLUSTER TABLE `mo_instance` (`id` varchar(128) NOT NULL,`name` VARCHAR(255) NOT NULL,`account_name` varchar(128) NOT NULL,`provider` longtext NOT NULL,`provider_id` longtext,`region` longtext NOT NULL,`plan_type` longtext NOT NULL,`version` longtext,`status` longtext,`quota` longtext,`network_policy` longtext,`created_by` longtext,`created_at` datetime(3) NULL,PRIMARY KEY (`id`, `account_id`),UNIQUE INDEX `uniq_acc` (`account_name`));
desc mo_catalog.mo_instance;
Field    Type    Null    Key    Default    Extra    Comment
id    VARCHAR(128)    NO    PRI    null        
name    VARCHAR(255)    NO        null        
account_name    VARCHAR(128)    NO        null        
provider    TEXT(0)    NO        null        
provider_id    TEXT(0)    YES        null        
region    TEXT(0)    NO        null        
plan_type    TEXT(0)    NO        null        
version    TEXT(0)    YES        null        
status    TEXT(0)    YES        null        
quota    TEXT(0)    YES        null        
network_policy    TEXT(0)    YES        null        
created_by    TEXT(0)    YES        null        
created_at    DATETIME(0)    YES        null        
account_id    INT UNSIGNED(32)    NO    PRI    null        the account_id added by the mo
create account acc_idx ADMIN_NAME 'root' IDENTIFIED BY '123456';
desc mo_catalog.mo_instance;
Field    Type    Null    Key    Default    Extra    Comment
id    VARCHAR(128)    NO    PRI    null        
name    VARCHAR(255)    NO        null        
account_name    VARCHAR(128)    NO        null        
provider    TEXT(0)    NO        null        
provider_id    TEXT(0)    YES        null        
region    TEXT(0)    NO        null        
plan_type    TEXT(0)    NO        null        
version    TEXT(0)    YES        null        
status    TEXT(0)    YES        null        
quota    TEXT(0)    YES        null        
network_policy    TEXT(0)    YES        null        
created_by    TEXT(0)    YES        null        
created_at    DATETIME(0)    YES        null        
account_id    INT UNSIGNED(32)    NO    PRI    null        the account_id added by the mo
drop table mo_instance;
drop account if exists acc_idx;