drop database if exists db1;
create database db1;
create table db1.b(b int);
insert into db1.b values (0),(1),(2),(3);
drop account if exists account_test;
create account account_test admin_name = 'root' identified by '111' open comment 'account_test';
use mo_catalog;
drop table if exists a;
create cluster table a(a int);
insert into a values(0,0),(1,0),(2,0),(3,0);
insert into a values(0,1),(1,1),(2,1),(3,1);
update a set account_id=(select account_id from mo_account where account_name="account_test") where account_id=1;
select a from a;
a
0
1
2
3
0
1
2
3
use mo_catalog;
select * from a;
a
0
1
2
3
delete from a;
use mo_catalog;
select * from a;
a
insert into a select b,0 from db1.b;
insert into a select b,1 from db1.b;
update a set account_id=(select account_id from mo_account where account_name="account_test") where account_id=1;
select a from a;
a
0
1
2
3
0
1
2
3
use mo_catalog;
select * from a;
a
0
1
2
3
delete from a;
load data infile '$resources/load_data/cluster_table1.csv' into table a;
update a set account_id=(select account_id from mo_account where account_name="account_test") where account_id=1;
select a from a;
a
0
0
0
0
0
0
0
0
use mo_catalog;
select * from a;
a
0
0
0
0
delete from a;
use mo_catalog;
select * from a;
a
delete from a;
truncate table a;
use mo_catalog;
delete from a;
internal error: only the sys account can insert/update/delete the cluster table
drop table a;
internal error: do not have privilege to execute the statement
truncate table a;
internal error: only the sys account can truncate the cluster table
drop account if exists account_test;
select a from a;
a
drop table if exists a;
drop account if exists account_test;
drop database if exists db1;
