select 'test',"test";
test	test
test	test
select 'aaaaaaaaaaaaaaaaaaaaaaaaaaaaaaaaaaaaaaaaaaaaaaaaaaaaaaaaaaaaaaaaaaaaaaaaaaaaaaaaaaaaaaaaaaaaaaaaaaaaaaaaaaaaaaaaaaaaaaaaaaaaaaaaaaaaaaaaaaaaaaaaaaaaaaaaaaaaaaaaaaaaaaaaaaaaaaaaaaaaaaaaaaaaaaaaaaaaaaaaaaaaaaaaaaaaaaaaaaaaaaaaaaaaaaaaaaaaaaaaaaaaaaaaaaaaaaaaaaaaaaaaaaaaaaaaaaaaaaaaaaaaaaaaaaaaaaaaa';
aaaaaaaaaaaaaaaaaaaaaaaaaaaaaaaaaaaaaaaaaaaaaaaaaaaaaaaaaaaaaaaaaaaaaaaaaaaaaaaaaaaaaaaaaaaaaaaaaaaaaaaaaaaaaaaaaaaaaaaaaaaaaaaaaaaaaaaaaaaaaaaaaaaaaaaaaaaaaaaaaaaaaaaaaaaaaaaaaaaaaaaaaaaaaaaaaaaaaaaaaaaaaaaaaaaaaaaaaaaaaaaaaaaaaaaaaaaaaaaaaaaaaaaaaaaaaaaaaaaaaaaaaaaaaaaaaaaaaaaaaaaaaaaaaaaaaaaaa
aaaaaaaaaaaaaaaaaaaaaaaaaaaaaaaaaaaaaaaaaaaaaaaaaaaaaaaaaaaaaaaaaaaaaaaaaaaaaaaaaaaaaaaaaaaaaaaaaaaaaaaaaaaaaaaaaaaaaaaaaaaaaaaaaaaaaaaaaaaaaaaaaaaaaaaaaaaaaaaaaaaaaaaaaaaaaaaaaaaaaaaaaaaaaaaaaaaaaaaaaaaaaaaaaaaaaaaaaaaaaaaaaaaaaaaaaaaaaaaaaaaaaaaaaaaaaaaaaaaaaaaaaaaaaaaaaaaaaaaaaaaaaaaaaaaaaaaaa
SELECT CONCAT_WS(2,' test');
CONCAT_WS(2,' test')
2 test
SELECT 38.8, CAST(38.8 AS CHAR);
38.8	CAST(38.8 AS CHAR)
38.8	38.8
SELECT '9223372036854775807' = 9223372036854775807;
'9223372036854775807' = 9223372036854775807
true
SELECT '9223372036854775807' = "9223372036854775807";
'9223372036854775807' = "9223372036854775807"
true
SELECT CAST('9223372036854775807' AS UNSIGNED) = 9223372036854775806;
CAST('9223372036854775807' AS UNSIGNED) = 9223372036854775806
false
SELECT CAST("2017-08-29" AS DATE);
CAST("2017-08-29" AS DATE)
2017-08-29
SELECT CAST(150 AS CHAR);
CAST(150 AS CHAR)
150
SELECT CAST(5-10 AS CHAR);
CAST(5-10 AS CHAR)
-5
SELECT CONCAT_WS('My', 'S', 'QL');
CONCAT_WS('My', 'S', 'QL')
SMyQL
SELECT CONCAT_WS('My', NULL, 'QL');
CONCAT_WS('My', NULL, 'QL')
QL
SELECT CONCAT_WS(14,'.3');
CONCAT_WS(14,'.3') 
14.3 
-- SELECT (CAST(0x7FFFFFFFFFFFFFFF AS char));
-- (CAST(0x7FFFFFFFFFFFFFFF AS char))
-- ������� 
SELECT (CAST(0x61616161 AS char));
(CAST(0x0x61616161 AS char))
aaaa
drop table if exists t1;
create table t1 (a char(10));
insert into t1 values('abcdef');
insert into t1 values('_bcdef');
insert into t1 values('a_cdef');
insert into t1 values('ab_def');
insert into t1 values('abc_ef');
insert into t1 values('abcd_f');
insert into t1 values('abcde_');
select * from t1 where a like 'ab\_def' order by a desc;
a
ab_def
select * from t1 where a not like 'a%' order by 1 asc;
a
_bcdef
select * from t1 where a like "\__cdef" order by 1 desc;
a
_bcdef
select * from t1 where a not like "%d_\_";
a
abcdef
_bcdef
a_cdef
ab_def
abc_ef
abcd_f
CREATE TABLE Demochar
(
LastName char(10) primary key,
FirstName char(10),
Gender char(1),
DepartmentName char(20),
Age int
);
INSERT INTO Demochar VALUES('Gilbert', 'Kevin','M','Tool Design',33);
INSERT INTO Demochar VALUES('Tamburello', 'Andrea','F','Marketing',45);
INSERT INTO Demochar VALUES('Johnson', 'David','M','Engineering',66);
INSERT INTO Demochar VALUES('Sharma', 'Bradley','M','Production',27);
INSERT INTO Demochar VALUES('Rapier', 'Abigail','F',	'Human Resources',38);
INSERT INTO Demochar VALUES('Martin', 'Kelly','F','Information Services',54);
INSERT INTO Demochar VALUES('Poland', 'Carole','F','Production Control',29);
SELECT * FROM Demochar;
LastName	FirstName	Gender	DepartmentName	Age
Gilbert	Kevin	M	Tool Design	33
Johnson	David	M	Engineering	66
Martin	Kelly	F	Information Services	54
Poland	Carole	F	Production Control	29
Rapier	Abigail	F	Human Resources	38
Sharma	Bradley	M	Production	27
Tamburello	Andrea	F	Marketing	45
select concat_ws(LastName,FirstName) from Demochar where Age > 40 order by 1 asc;
concat_ws(lastname, firstname)
Andrea
David
Kelly
select concat_ws(LastName,FirstName) as fullname from Demochar where Age > 40 order by fullname desc;
fullname
Kelly
David
Andrea
select concat_ws(LastName,FirstName),Gender,Age from Demochar where Gender='F' order by Age asc;
concat_ws(lastname, firstname)	gender	age
Carole	F	29
Abigail	F	38
Andrea	F	45
Kelly	F	54
select cast(Age as char) as cAge from Demochar where cast(Age as char) like '2_' order by 1;
cage
27
29
select cast(Age as char) and Age as cAge from Demochar where Age>=50 order by cAge asc;
cage
1
1
CREATE TABLE employees (
employeeNumber int(11) NOT NULL,
lastName char(50) NOT NULL,
firstName char(50) NOT NULL,
extension char(10) NOT NULL,
email char(100) NOT NULL,
officeCode char(10) NOT NULL,
reportsTo int(11) DEFAULT NULL,
jobTitle char(50) NOT NULL,
PRIMARY KEY (employeeNumber)
);
insert  into employees(employeeNumber,lastName,firstName,extension,email,officeCode,reportsTo,jobTitle) values
(1002,'Murphy','Diane','x5800','dmurphy@classicmodelcars.com','1',NULL,'President'),
(1056,'Patterson','Mary','x4611','mpatterso@classicmodelcars.com','1',1002,'VP Sales'),
(1076,'Firrelli','Jeff','x9273','jfirrelli@classicmodelcars.com','1',1002,'VP Marketing'),
(1088,'Patterson','William','x4871','wpatterson@classicmodelcars.com','6',1056,'Sales Manager (APAC)'),
(1102,'Bondur','Gerard','x5408','gbondur@classicmodelcars.com','4',1056,'Sale Manager (EMEA)'),
(1143,'Bow','Anthony','x5428','abow@classicmodelcars.com','1',1056,'Sales Manager (NA)'),
(1165,'Jennings','Leslie','x3291','ljennings@classicmodelcars.com','1',1143,'Sales Rep'),
(1166,'Thompson','Leslie','x4065','lthompson@classicmodelcars.com','1',1143,'Sales Rep'),
(1188,'Firrelli','Julie','x2173','jfirrelli@classicmodelcars.com','2',1143,'Sales Rep'),
(1216,'Patterson','Steve','x4334','spatterson@classicmodelcars.com','2',1143,'Sales Rep'),
(1286,'Tseng','Foon Yue','x2248','ftseng@classicmodelcars.com','3',1143,'Sales Rep'),
(1323,'Vanauf','George','x4102','gvanauf@classicmodelcars.com','3',1143,'Sales Rep'),
(1337,'Bondur','Loui','x6493','lbondur@classicmodelcars.com','4',1102,'Sales Rep'),
(1370,'Hernandez','Gerard','x2028','ghernande@classicmodelcars.com','4',1102,'Sales Rep'),
(1401,'Castillo','Pamela','x2759','pcastillo@classicmodelcars.com','4',1102,'Sales Rep'),
(1501,'Bott','Larry','x2311','lbott@classicmodelcars.com','7',1102,'Sales Rep'),
(1504,'Jones','Barry','x102','bjones@classicmodelcars.com','7',1102,'Sales Rep'),
(1611,'Fixter','Andy','x101','afixter@classicmodelcars.com','6',1088,'Sales Rep');
select officeCode,count(officeCode) from employees group by officeCode having count(officeCode)>2 order by 1 asc,2 desc;
officecode	count(officecode)
1	6
4	4
select lastName,firstName from employees where cast(officeCode as unsigned)>5 limit 2 offset 1;
lastname	firstname
Bott	Larry
Jones	Barry
select max(lastName),min(lastName) from employees;
max(lastname)	min(lastname)
Vanauf	Bondur
select max(lastName),min(lastName),JobTitle from employees group by JobTitle;
max(lastname)	min(lastname)	jobtitle
Murphy	Murphy	President
Patterson	Patterson	VP Sales
Firrelli	Firrelli	VP Marketing
Patterson	Patterson	Sales Manager (APAC)
Bondur	Bondur	Sale Manager (EMEA)
Bow	Bow	Sales Manager (NA)
Vanauf	Bondur	Sales Rep
select lastName,firstName from employees where lastName>=firstName;
lastname	firstname
Murphy	Diane
Patterson	Mary
Bow	Anthony
Thompson	Leslie
Tseng	Foon Yue
Vanauf	George
Hernandez	Gerard
Jones	Barry
Fixter	Andy
select lastName,firstName from employees where lastName between firstName and JobTitle;
lastname	firstname
Murphy	Diane
Patterson	Mary
Bow	Anthony
Hernandez	Gerard
Jones	Barry
Fixter	Andy
select * from employees where officeCode in ('2','3','4') order by 1 asc,3 desc limit 1,2;
employeenumber	lastname	firstname	extension	email	officecode	reportsto	jobtitle
1188	Firrelli	Julie	x2173	jfirrelli@classicmodelcars.com	2	1143	Sales Rep
1216	Patterson	Steve	x4334	spatterson@classicmodelcars.com	2	1143	Sales Rep
select * from employees where officeCode not in ('5','7','1');
employeenumber	lastname	firstname	extension	email	officecode	reportsto	jobtitle
1088	Patterson	William	x4871	wpatterson@classicmodelcars.com	6	1056	Sales Manager (APAC)
1102	Bondur	Gerard	x5408	gbondur@classicmodelcars.com	4	1056	Sale Manager (EMEA)
1188	Firrelli	Julie	x2173	jfirrelli@classicmodelcars.com	2	1143	Sales Rep
1216	Patterson	Steve	x4334	spatterson@classicmodelcars.com	2	1143	Sales Rep
1286	Tseng	Foon Yue	x2248	ftseng@classicmodelcars.com	3	1143	Sales Rep
1323	Vanauf	George	x4102	gvanauf@classicmodelcars.com	3	1143	Sales Rep
1337	Bondur	Loui	x6493	lbondur@classicmodelcars.com	4	1102	Sales Rep
1370	Hernandez	Gerard	x2028	ghernande@classicmodelcars.com	4	1102	Sales Rep
1401	Castillo	Pamela	x2759	pcastillo@classicmodelcars.com	4	1102	Sales Rep
1611	Fixter	Andy	x101	afixter@classicmodelcars.com	6	1088	Sales Rep
select officeCode,sum(cast(officeCode as unsigned)) from employees group by officeCode;
officecode	sum(cast(officecode as unsigned))
1	6
6	12
4	16
2	4
3	6
7	14
select employeeNumber,officeCode,reportsTo from employees where employeeNumber>1400 and reportsTo is not null order by officeCode+1,employeeNumber;
employeenumber	officecode	reportsto
1401	4	1102
1611	6	1088
1501	7	1102
1504	7	1102
create table job(
jobid int primary key,
jobTitle char(50)
);
insert into job values
(1,'President'),
(2,'VP Sales'),
(3,'VP Marketing'),
(4,'Sales Manager (APAC)'),
(5,'Sale Manager (EMEA)'),
(6,'Sales Manager (NA)'),
(7,'Sales Rep'),
(8,'Marketing');
select employeeNumber,e.jobTitle,j.jobid from employees e join job j on e.jobTitle=j.jobTitle;
employeenumber	jobtitle	jobid
1002	President	1
1056	VP Sales	2
1076	VP Marketing	3
1088	Sales Manager (APAC)	4
1102	Sale Manager (EMEA)	5
1143	Sales Manager (NA)	6
1165	Sales Rep	7
1166	Sales Rep	7
1188	Sales Rep	7
1216	Sales Rep	7
1286	Sales Rep	7
1323	Sales Rep	7
1337	Sales Rep	7
1370	Sales Rep	7
1401	Sales Rep	7
1501	Sales Rep	7
1504	Sales Rep	7
1611	Sales Rep	7
select distinct e.jobTitle,j.jobid from employees e join job j on e.jobTitle=j.jobTitle;
jobtitle	jobid
President	1
VP Sales	2
VP Marketing	3
Sales Manager (APAC)	4
Sale Manager (EMEA)	5
Sales Manager (NA)	6
Sales Rep	7
select e.jobTitle,sum(jobid) from employees e join job j on e.jobTitle=j.jobTitle group by e.jobTitle having sum(jobid)>5;
jobTitle	sum(jobid)
Sales Manager (NA)	6
Sales Rep	84
select e.jobTitle,sum(jobid) from employees e join job j on e.jobTitle=j.jobTitle group by e.jobTitle having sum(jobid)>5 order by 2 desc;
jobTitle	sum(jobid)
Sales Rep	84
Sales Manager (NA)	6
drop table if exists t1;
drop table if exists t2;
drop table if exists t3;
drop table if exists t11;
drop table if exists t12;
CREATE TABLE t1 (a char(3), b int primary key);
INSERT INTO t1 VALUES ('1',1),('1',2);
update t1 set a=2 where a='1' limit 1;
select * from t1;
a	b
2	1
1	2
INSERT INTO t1 VALUES ('1',3);
update t1 set a='a' where a='1';
select * from t1;
a	b
2	1
a	2
a	3
drop table t1;
create table t1 (
a char(10) not null,
b char(10) not null default '0',
c char(10) not null default '0',
d char(10) not null default '0',
e char(10) not null default '0',
f char(10) not null default '0',
g char(10) not null default '0',
h char(10) not null default '0',
i char(10) not null default '0',
j char(10) not null default '0',
primary key (a));
insert into t1 (a) values ('2'),('4'),('6'),('8'),('10'),('12'),('14'),('16'),('18'),('20'),('22'),('24'),('26'),('23');
update t1 set a=a+'101';
select a,b from t1;
a	b
103	0
105	0
107	0
109	0
111	0
113	0
115	0
117	0
119	0
121	0
123	0
124	0
125	0
127	0
update t1 set a='127' where a='25';
select a,b from t1;
a	b
2	0
4	0
6	0
8	0
10	0
12	0
14	0
16	0
18	0
20	0
22	0
24	0
26	0
23	0
update t1 set a=a+'a' where 1 > 2;
select a,b from t1;
a	b
2	0
4	0
6	0
8	0
10	0
12	0
14	0
16	0
18	0
20	0
22	0
24	0
26	0
23	0
update t1 set a=a+a where 3 > 2;
select a,b from t1;
a	b
2	0
4	0
6	0
8	0
10	0
12	0
14	0
16	0
18	0
20	0
22	0
24	0
26	0
23	0
drop table t1;
create table t1 (a char(10) primary key, b char(32));
insert into t1 values ('abc','apple'), ('ab','apple');
select * from t1;
a	b
ab	apple
abc	apple
drop table if exists t1;
drop table if exists t2;
drop table if exists t3;
drop table if exists t11;
drop table if exists t12;
CREATE TABLE t1 (a char(3), b char(5) primary key);
INSERT INTO t1 VALUES ('1','1'),('1','2');
delete from t1 where a=1 limit 1;
select * from t1;
a	b
1	2
INSERT INTO t1 VALUES ('1','3');
delete from t1 where a=1;
select * from t1;
a	b
drop table t1;
create table t1 (
a char(10) not null,
b char(10) not null default '0',
c char(10) not null default '0',
d char(10) not null default '0',
e char(10) not null default '0',
f char(10) not null default '0',
g char(10) not null default '0',
h char(10) not null default '0',
i char(10) not null default '0',
j char(10) not null default '0',
primary key (a));
insert into t1 (a) values ('2'),('4'),('6'),('8'),('10'),('12'),('14'),('16'),('18'),('20'),('22'),('24'),('26'),('23');
delete from t1 where a=2+2;
select a,b from t1;
a	b
10	0
12	0
14	0
16	0
18	0
2	0
20	0
22	0
23	0
24	0
26	0
6	0
8	0
delete from t1 where  a=24;
select a,b from t1;
a	b
10	0
12	0
14	0
16	0
18	0
2	0
20	0
22	0
23	0
26	0
6	0
8	0
delete from t1 where  3 < 2;
select a,b from t1;
a	b
10	0
12	0
14	0
16	0
18	0
2	0
20	0
22	0
23	0
26	0
6	0
8	0
delete from t1 where  1 < 2;
select a,b from t1;
a	b
drop table t1;
create table t1 (a char(10) primary key, b char(32));
insert into t1 values ('abc','apple'), ('ab','apple');
select * from t1;
a	b
ab	apple
abc	apple
