DROP TABLE IF EXISTS t1;
create table t1 (a json,b int);
insert into t1 values ('{"t1":"a"}',1),('{"t1":"b"}',2);
select * from t1;
a	b
{"t1": "a"}	1
{"t1": "b"}	2
select * from t1 where b=1;
a	b
{"t1": "a"}	1
select * from t1 where b=2;
a	b
{"t1": "b"}	2
update t1 set a='{"t1":"qaq"}' where b=1;
delete from t1 where b=2;
select * from t1;
a	b
{"t1": "qaq"}	1
delete from t1 where b=1;
select * from t1;
a	b