DROP TABLE IF EXISTS t1;
create table t1 (a json,b int);
insert into t1 values ('{"t1":"a"}',1),('{"t1":"b"}',2);
select * from t1;
a	b
{"t1": "a"}	1
{"t1": "b"}	2
select * from t1 where b=1;
a	b
{"t1": "a"}	1
select * from t1 where b=2;
a	b
{"t1": "b"}	2
update t1 set a='{"t1":"qaq"}' where b=1;
delete from t1 where b=2;
select * from t1;
a	b
{"t1": "qaq"}	1
delete from t1 where b=1;
select * from t1;
a	b
drop table if exists t2;
create table t2 (a json,b int);
delete from t1;
insert into t1 values ('{"t1":"a"}',1),('{"t1":"b"}',2);
select * from t1 into outfile '/tmp/tmp_xadadwhfefef.csv' fields enclosed by '"' force_quote(a);
open /tmp/tmp_xadadwhfefef.csv: file exists
load data infile '/tmp/tmp_xadadwhfefef.csv' into table t1 ignore 1 lines;
load data infile '/tmp/tmp_xadadwhfefef.csv' into table t2 ignore 1 lines;
select * from t1;
a	b
{"t1": "a"}	1
{"t1": "b"}	2
{"t1": "a"}	1
{"t1": "b"}	2
select * from t2;
a	b
{"t1": "a"}	1
{"t1": "b"}	2
select * from t1 into outfile '/tmp/tmp_daiufwihwidhqiwfhei.csv' fields terminated by '\t';
open /tmp/tmp_daiufwihwidhqiwfhei.csv: file exists
load data local infile '/tmp/tmp_daiufwihwidhqiwfhei.csv' into table t1 fields terminated by '\t' ignore 1 lines;
load data local infile '/tmp/tmp_daiufwihwidhqiwfhei.csv' into table t2 fields terminated by '\t' ignore 1 lines;
select * from t1;
a	b
{"t1": "a"}	1
{"t1": "b"}	2
{"t1": "a"}	1
{"t1": "b"}	2
{"t1": "a"}	1
{"t1": "b"}	2
{"t1": "a"}	1
{"t1": "b"}	2
select * from t2;
a	b
{"t1": "a"}	1
{"t1": "b"}	2
{"t1": "a"}	1
{"t1": "b"}	2
{"t1": "a"}	1
{"t1": "b"}	2