SET experimental_fulltext_index = 1;
SET experimental_ivf_index = 1;
SET experimental_hnsw_index = 1;
drop database if exists db;
create database db;
use db;
DROP TABLE IF EXISTS stress_alter_table;
CREATE TABLE `stress_alter_table` (
`md5_id` int NOT NULL,
`b` varchar(65535) DEFAULT NULL,
`delete_flag` int DEFAULT NULL,
PRIMARY KEY (`md5_id`),
FULLTEXT `fb`(`b`) WITH PARSER ngram,
KEY `delete_flag_idx` (`delete_flag`)
);
INSERT INTO stress_alter_table VALUES (1, 'this is a one', 0);
DELETE FROM `stress_alter_table` WHERE delete_flag = 0;
INSERT INTO `stress_alter_table` (`md5_id`,`b`,`delete_flag`) VALUES (1,'this is a one',0);
ALTER TABLE `stress_alter_table` MODIFY COLUMN delete_flag INT DEFAULT 0;
select mo_ctl('dn','checkpoint','');
mo_ctl(dn, checkpoint, )
{\n  "method": "Checkpoint",\n  "result": [\n    {\n      "returnStr": "OK"\n    }\n  ]\n}\n
SELECT COUNT(*) FROM `stress_alter_table`;
COUNT(*)
1
UPDATE `stress_alter_table` SET delete_flag = 1 WHERE md5_id = '1';
SELECT COUNT(*) FROM `stress_alter_table`;
COUNT(*)
1
drop table stress_alter_table;
create table t1 (id bigint primary key, delete_flag int, a int, body varchar(10), title text, FULLTEXT (title, body), key(delete_flag));
insert into t1 values(1,1,1, "body", "title");
ALTER TABLE t1 MODIFY COLUMN a int DEFAULT NULL;
SET @inner_sql = (
SELECT GROUP_CONCAT(
CONCAT(
'SELECT ''', meta.index_key,
''' AS index_key, COUNT(*) AS cnt FROM `',
meta.index_table_name, '`'
) ORDER BY meta.index_key SEPARATOR ' UNION ALL '
)
FROM (
SELECT mi.index_table_name,
CONCAT(mi.type, ':', MIN(mi.column_name)) AS index_key
FROM mo_catalog.mo_indexes mi
JOIN mo_catalog.mo_tables mt ON mi.table_id = mt.rel_id
WHERE mt.relname = 't1'
AND mt.reldatabase = 'db'
AND mi.type IN ('MULTIPLE', 'UNIQUE', 'FULLTEXT')
AND mi.index_table_name IS NOT NULL
AND mi.index_table_name != ''
AND mi.column_name <> 'question'
AND mi.column_name <> 'keyword'
AND mi.column_name <> '__mo_alias_id'
GROUP BY mi.index_table_name, mi.type
) meta
);
SET @sql = CONCAT(
'SELECT * FROM (',
@inner_sql,
') AS t ORDER BY index_key'
);
PREPARE stmt FROM @sql;
EXECUTE stmt;
index_key    cnt
FULLTEXT:body    3
MULTIPLE:delete_flag    1
DEALLOCATE PREPARE stmt;
drop table t1;
create table t2 (id int primary key, a int, b int, c int, key(a), key(b));
insert into t2 values(1,1,1,1);
ALTER TABLE t2 MODIFY COLUMN c int DEFAULT NULL;
SET @inner_sql = (
SELECT GROUP_CONCAT(
CONCAT(
'SELECT ''', meta.index_key,
''' AS index_key, COUNT(*) AS cnt FROM `',
meta.index_table_name, '`'
) ORDER BY meta.index_key SEPARATOR ' UNION ALL '
)
FROM (
SELECT mi.index_table_name,
CONCAT(mi.type, ':', MIN(mi.column_name)) AS index_key
FROM mo_catalog.mo_indexes mi
JOIN mo_catalog.mo_tables mt ON mi.table_id = mt.rel_id
WHERE mt.relname = 't2'
AND mt.reldatabase = 'db'
AND mi.type IN ('MULTIPLE', 'UNIQUE', 'FULLTEXT')
AND mi.index_table_name IS NOT NULL
AND mi.index_table_name != ''
AND mi.column_name <> 'question'
AND mi.column_name <> 'keyword'
AND mi.column_name <> '__mo_alias_id'
GROUP BY mi.index_table_name, mi.type
) meta
);
SET @sql = CONCAT(
'SELECT * FROM (',
@inner_sql,
') AS t ORDER BY index_key'
);
PREPARE stmt FROM @sql;
EXECUTE stmt;
index_key    cnt
MULTIPLE:a    1
MULTIPLE:b    1
DEALLOCATE PREPARE stmt;
drop table t2;
create table t3 (
id bigint primary key,
delete_flag int,
a vecf32(3),
b vecf32(3),
body varchar(10),
title text,
FULLTEXT (title, body),
key(delete_flag),
key ivf using ivfflat (a),
key idx using hnsw(b) op_type 'vector_l2_ops'
);
insert into t3 values(1,1, '[0.1,0.2,0.3]','[0.1,0.2,0.3]', "body", "title");
ALTER TABLE t3 MODIFY COLUMN delete_flag int DEFAULT NULL;
SET @inner_sql = (
SELECT GROUP_CONCAT(
DISTINCT CONCAT(
'SELECT ''', mi.index_table_name,
''' AS index_table_name, COUNT(*) AS cnt FROM `',
mi.index_table_name, '`'
) SEPARATOR ' UNION ALL '
)
FROM mo_catalog.mo_indexes mi
JOIN mo_catalog.mo_tables mt ON mi.table_id = mt.rel_id
WHERE mt.relname = 't3'
AND mt.reldatabase = 'db'
AND mi.type IN ('MULTIPLE', 'UNIQUE')
AND mi.index_table_name IS NOT NULL
AND mi.index_table_name != ''
AND mi.column_name <> 'question'
AND mi.column_name <> 'keyword'
);
SET @sql = CONCAT(
'SELECT * FROM (',
@inner_sql,
') AS t ORDER BY cnt DESC'
);
PREPARE stmt FROM @sql;
EXECUTE stmt;
index_table_name    cnt
__mo_index_secondary_019dc4bc-ee0d-735b-bbcf-139a64655cd2    7
__mo_index_secondary_019dc4bc-ee0d-739d-9fb3-748a2a909f7d    1
__mo_index_secondary_019dc4bc-ee0d-7386-87ec-315bceef24fc    1
__mo_index_secondary_019dc4bc-ee0d-737e-af92-f1d0929e9d62    1
__mo_index_secondary_019dc4bc-ee0d-7372-8903-22ce7e914251    1
__mo_index_secondary_019dc4bc-ee0d-734b-ae5d-d0fba568e241    1
DEALLOCATE PREPARE stmt;
drop table t3;
SET experimental_fulltext_index = 0;
SET experimental_ivf_index = 0;
SET experimental_hnsw_index = 0;
drop database db;
