SET experimental_fulltext_index = 1;
SET experimental_ivf_index = 1;
SET experimental_hnsw_index = 1;
drop database if exists db;
create database db;
use db;
DROP TABLE IF EXISTS stress_alter_table;
CREATE TABLE `stress_alter_table` (
`md5_id` int NOT NULL,
`b` varchar(65535) DEFAULT NULL,
`delete_flag` int DEFAULT NULL,
PRIMARY KEY (`md5_id`),
FULLTEXT `fb`(`b`) WITH PARSER ngram,
KEY `delete_flag_idx` (`delete_flag`)
);
INSERT INTO stress_alter_table VALUES (1, 'this is a one', 0);
DELETE FROM `stress_alter_table` WHERE delete_flag = 0;
INSERT INTO `stress_alter_table` (`md5_id`,`b`,`delete_flag`) VALUES (1,'this is a one',0);
ALTER TABLE `stress_alter_table` MODIFY COLUMN delete_flag INT DEFAULT 0;
select mo_ctl('dn','checkpoint','');
➤ mo_ctl(dn, checkpoint, )[12,-1,0]  𝄀
{
  "method": "Checkpoint",
  "result": [
    {
      "returnStr": "OK"
    }
  ]
}

SELECT COUNT(*) FROM `stress_alter_table`;
➤ COUNT(*)[-5,64,0]  𝄀
1
UPDATE `stress_alter_table` SET delete_flag = 1 WHERE md5_id = '1';
SELECT COUNT(*) FROM `stress_alter_table`;
➤ COUNT(*)[-5,64,0]  𝄀
1
drop table stress_alter_table;
create table t1 (id bigint primary key, delete_flag int, a int, body varchar(10), title text, FULLTEXT (title, body), key(delete_flag));
insert into t1 values(1,1,1, "body", "title");
ALTER TABLE t1 MODIFY COLUMN a int DEFAULT NULL;
SET @inner_sql = (
SELECT GROUP_CONCAT(
CONCAT(
'SELECT ''', meta.index_key,
''' AS index_key, COUNT(*) AS cnt FROM `',
meta.index_table_name, '`'
) ORDER BY meta.index_key SEPARATOR ' UNION ALL '
)
FROM (
SELECT mi.index_table_name,
CONCAT(mi.type, ':', MIN(mi.column_name)) AS index_key
FROM mo_catalog.mo_indexes mi
JOIN mo_catalog.mo_tables mt ON mi.table_id = mt.rel_id
WHERE mt.relname = 't1'
AND mt.reldatabase = 'db'
AND mi.type IN ('MULTIPLE', 'UNIQUE', 'FULLTEXT')
AND mi.index_table_name IS NOT NULL
AND mi.index_table_name != ''
AND mi.column_name <> 'question'
AND mi.column_name <> 'keyword'
AND mi.column_name <> '__mo_alias_id'
GROUP BY mi.index_table_name, mi.type
) meta
);
SET @sql = CONCAT(
'SELECT * FROM (',
@inner_sql,
') AS t ORDER BY index_key'
);
PREPARE stmt FROM @sql;
EXECUTE stmt;
➤ index_key[12,-1,0]  ¦  cnt[-5,64,0]  𝄀
FULLTEXT:body  ¦  3  𝄀
MULTIPLE:delete_flag  ¦  1
DEALLOCATE PREPARE stmt;
drop table t1;
create table t2 (id int primary key, a int, b int, c int, key(a), key(b));
insert into t2 values(1,1,1,1);
ALTER TABLE t2 MODIFY COLUMN c int DEFAULT NULL;
SET @inner_sql = (
SELECT GROUP_CONCAT(
CONCAT(
'SELECT ''', meta.index_key,
''' AS index_key, COUNT(*) AS cnt FROM `',
meta.index_table_name, '`'
) ORDER BY meta.index_key SEPARATOR ' UNION ALL '
)
FROM (
SELECT mi.index_table_name,
CONCAT(mi.type, ':', MIN(mi.column_name)) AS index_key
FROM mo_catalog.mo_indexes mi
JOIN mo_catalog.mo_tables mt ON mi.table_id = mt.rel_id
WHERE mt.relname = 't2'
AND mt.reldatabase = 'db'
AND mi.type IN ('MULTIPLE', 'UNIQUE', 'FULLTEXT')
AND mi.index_table_name IS NOT NULL
AND mi.index_table_name != ''
AND mi.column_name <> 'question'
AND mi.column_name <> 'keyword'
AND mi.column_name <> '__mo_alias_id'
GROUP BY mi.index_table_name, mi.type
) meta
);
SET @sql = CONCAT(
'SELECT * FROM (',
@inner_sql,
') AS t ORDER BY index_key'
);
PREPARE stmt FROM @sql;
EXECUTE stmt;
➤ index_key[12,-1,0]  ¦  cnt[-5,64,0]  𝄀
MULTIPLE:a  ¦  1  𝄀
MULTIPLE:b  ¦  1
DEALLOCATE PREPARE stmt;
drop table t2;
create table t3 (
k varchar(32) not null,
s varchar(32) not null,
body text not null,
key idx_k_s (k, s)
);
insert into t3 (k, s, body) values ('a', 'x', '{}');
select count(*) from t3 where k = 'a' and s = 'x';
➤ count(*)[-5,64,0]  𝄀
1
begin;
alter table t3 add column c int not null default 0;
alter table t3 modify column body longtext not null;
commit;
select count(*) from t3 where k = 'a' and s = 'x';
➤ count(*)[-5,64,0]  𝄀
1
select count(*) from t3 where binary k = binary 'a' and binary s = binary 'x';
➤ count(*)[-5,64,0]  𝄀
1
begin;
alter table t3 add column rollback_flag int not null default 9;
alter table t3 modify column body text not null;
rollback;
select count(*) from t3 where k = 'a' and s = 'x';
➤ count(*)[-5,64,0]  𝄀
1
select count(*) from t3 where binary k = binary 'a' and binary s = binary 'x';
➤ count(*)[-5,64,0]  𝄀
1
insert into t3 (k, s, body, c) values ('a', 'x', '{new}', 0);
select count(*) from t3 where k = 'a' and s = 'x';
➤ count(*)[-5,64,0]  𝄀
2
select count(*) from t3 where binary k = binary 'a' and binary s = binary 'x';
➤ count(*)[-5,64,0]  𝄀
2
drop table t3;
create table t4 (
id int not null,
tenant varchar(16) not null,
doc_code varchar(32) not null,
shard varchar(16) not null,
account_id int not null,
category int not null,
tag varchar(32) not null,
title varchar(128) not null,
doc_body text not null,
embedding vecf32(3),
primary key(id),
unique key uk_tenant_doc (tenant, doc_code),
key idx_tenant_shard (tenant, shard),
key idx_account_category (account_id, category),
fulltext key ft_title_body (title, doc_body),
key idx_embedding using ivfflat (embedding) lists = 2 op_type 'vector_cosine_ops'
);
insert into t4 values
(1, 'mo', 'doc-001', 's1', 10, 1, 'database', 'matrixone storage', 'matrixone clone keeps index data', '[1,2,3]'),
(2, 'mo', 'doc-002', 's1', 10, 2, 'database', 'matrixone transaction', 'transaction alter table clone index', '[1,2,4]'),
(3, 'mo', 'doc-003', 's2', 11, 1, 'vector', 'vector search', 'ivfflat vector index clone coverage', '[1,3,5]'),
(4, 'mo', 'doc-004', 's2', 11, 2, 'search', 'fulltext search', 'fulltext index clone coverage', '[100,44,50]'),
(5, 'cn', 'doc-005', 's1', 12, 1, 'database', 'cn storage', 'secondary index should survive clone', '[120,50,70]'),
(6, 'cn', 'doc-006', 's1', 12, 2, 'vector', 'cn vector', 'vector reindex should survive clone', '[130,40,90]');
select count(*) from t4 where tenant = 'mo' and shard = 's1';
➤ count(*)[-5,64,0]  𝄀
2
select count(*) from t4 where binary tenant = binary 'mo' and binary shard = binary 's1';
➤ count(*)[-5,64,0]  𝄀
2
select count(*) from t4 where match(title, doc_body) against('matrixone');
➤ count(*)[-5,64,0]  𝄀
2
select id from t4 order by cosine_distance(embedding, '[1,2,3]') asc limit 3;
➤ id[4,32,0]  𝄀
1  𝄀
3  𝄀
2
begin;
alter table t4 add column status int not null default 1;
alter table t4 modify column doc_body longtext not null;
alter table t4 alter reindex idx_embedding ivfflat lists = 3;
alter table t4 drop index idx_account_category;
alter table t4 add index idx_account_status (account_id, status);
alter table t4 add fulltext index ft_tag_body (tag, doc_body);
commit;
select count(*) from t4 where tenant = 'mo' and shard = 's1';
➤ count(*)[-5,64,0]  𝄀
2
select count(*) from t4 where binary tenant = binary 'mo' and binary shard = binary 's1';
➤ count(*)[-5,64,0]  𝄀
2
select count(*) from t4 where tenant = 'mo' and doc_code = 'doc-002';
➤ count(*)[-5,64,0]  𝄀
1
select count(*) from t4 where account_id = 10 and status = 1;
➤ count(*)[-5,64,0]  𝄀
2
select count(*) from t4 where match(title, doc_body) against('matrixone');
➤ count(*)[-5,64,0]  𝄀
2
select count(*) from t4 where match(tag, doc_body) against('vector');
➤ count(*)[-5,64,0]  𝄀
2
select id from t4 order by cosine_distance(embedding, '[1,2,3]') asc limit 3;
➤ id[4,32,0]  𝄀
1  𝄀
3  𝄀
2
insert into t4 (id, tenant, doc_code, shard, account_id, category, tag, title, doc_body, embedding, status)
values (7, 'mo', 'doc-007', 's1', 10, 3, 'database', 'matrixone append', 'append after repeated alter clone', '[1,2,5]', 1);
select count(*) from t4 where tenant = 'mo' and shard = 's1';
➤ count(*)[-5,64,0]  𝄀
3
select count(*) from t4 where binary tenant = binary 'mo' and binary shard = binary 's1';
➤ count(*)[-5,64,0]  𝄀
3
select count(*) from t4 where account_id = 10 and status = 1;
➤ count(*)[-5,64,0]  𝄀
3
select count(*) from t4 where match(title, doc_body) against('matrixone');
➤ count(*)[-5,64,0]  𝄀
3
select id from t4 order by cosine_distance(embedding, '[1,2,3]') asc limit 3;
➤ id[4,32,0]  𝄀
1  𝄀
3  𝄀
2
select mi.name,
mi.type,
group_concat(distinct mi.column_name order by mi.column_name) as columns,
mi.algo,
group_concat(distinct mi.algo_table_type order by mi.algo_table_type) as algo_tables,
case when mi.algo_params is null or mi.algo_params = '' then '-' else mi.algo_params end as algo_params
from mo_catalog.mo_indexes mi
join mo_catalog.mo_tables mt on mi.table_id = mt.rel_id
where mt.relname = 't4'
and mt.reldatabase = 'db'
and mi.name in ('uk_tenant_doc', 'idx_tenant_shard', 'idx_account_category', 'idx_account_status', 'ft_title_body', 'ft_tag_body', 'idx_embedding')
and mi.column_name not in ('question', 'keyword', '__mo_alias_id')
group by mi.name, mi.type, mi.algo, case when mi.algo_params is null or mi.algo_params = '' then '-' else mi.algo_params end
order by mi.name;
➤ name[12,-1,0]  ¦  type[12,-1,0]  ¦  columns[12,0,0]  ¦  algo[12,-1,0]  ¦  algo_tables[12,0,0]  ¦  algo_params[12,-1,0]  𝄀
ft_tag_body  ¦  FULLTEXT  ¦  doc_body,tag  ¦  fulltext  ¦    ¦  -  𝄀
ft_title_body  ¦  FULLTEXT  ¦  doc_body,title  ¦  fulltext  ¦    ¦  -  𝄀
idx_account_status  ¦  MULTIPLE  ¦  account_id,status  ¦    ¦    ¦  -  𝄀
idx_embedding  ¦  MULTIPLE  ¦  embedding  ¦  ivfflat  ¦  centroids,entries,metadata  ¦  {"lists":"3","op_type":"vector_cosine_ops"}  𝄀
idx_tenant_shard  ¦  MULTIPLE  ¦  tenant  ¦    ¦    ¦  -  𝄀
uk_tenant_doc  ¦  UNIQUE  ¦  doc_code,tenant  ¦    ¦    ¦  -
drop table t4;
SET experimental_fulltext_index = 0;
SET experimental_ivf_index = 0;
SET experimental_hnsw_index = 0;
drop database db;
