drop database if exists fk_clone_alter_child_src;
drop database if exists fk_clone_alter_child_dst;
create database fk_clone_alter_child_src;
use fk_clone_alter_child_src;
create table fk_clone_alter_child_src.parent (
id int primary key,
name varchar(32) not null
);
create table fk_clone_alter_child_src.child (
id int primary key,
parent_id int,
payload varchar(32),
constraint fk_child_parent foreign key (parent_id)
references fk_clone_alter_child_src.parent(id)
);
insert into fk_clone_alter_child_src.parent values (1, 'p1'), (2, 'p2');
insert into fk_clone_alter_child_src.child values (10, 1, 'c1'), (20, 2, 'c2');
alter table fk_clone_alter_child_src.child add column note varchar(32) default 'n';
alter table fk_clone_alter_child_src.child modify column payload varchar(64);
alter table fk_clone_alter_child_src.child rename column note to remark;
alter table fk_clone_alter_child_src.child add index idx_payload(payload);
alter table fk_clone_alter_child_src.child drop index idx_payload;
alter table fk_clone_alter_child_src.child drop column remark;
select table_name, refer_table_name
from mo_catalog.mo_foreign_keys
where db_name = 'fk_clone_alter_child_src'
order by constraint_name;
➤ table_name[12,-1,0]  ¦  refer_table_name[12,-1,0]  𝄀
child  ¦  parent
delete from fk_clone_alter_child_src.parent where id = 1;
internal error: Cannot delete or update a parent row: a foreign key constraint fails
create database fk_clone_alter_child_dst clone fk_clone_alter_child_src;
select * from fk_clone_alter_child_dst.child order by id;
➤ id[4,32,0]  ¦  parent_id[4,32,0]  ¦  payload[12,-1,0]  𝄀
10  ¦  1  ¦  c1  𝄀
20  ¦  2  ¦  c2
show create table fk_clone_alter_child_dst.child;
➤ Table[12,-1,0]  ¦  Create Table[12,-1,0]  𝄀
child  ¦  CREATE TABLE `child` (
  `id` int NOT NULL,
  `parent_id` int DEFAULT NULL,
  `payload` varchar(64) DEFAULT NULL,
  PRIMARY KEY (`id`),
  CONSTRAINT `fk_child_parent` FOREIGN KEY (`parent_id`) REFERENCES `parent` (`id`) ON DELETE RESTRICT ON UPDATE RESTRICT
)
delete from fk_clone_alter_child_dst.parent where id = 1;
internal error: Cannot delete or update a parent row: a foreign key constraint fails
insert into fk_clone_alter_child_dst.child values (30, 999, 'invalid');
internal error: Cannot add or update a child row: a foreign key constraint fails
insert into fk_clone_alter_child_dst.child values (30, 1, 'valid');
select count(*) from fk_clone_alter_child_dst.child;
➤ count(*)[-5,64,0]  𝄀
3
drop database fk_clone_alter_child_dst;
drop database fk_clone_alter_child_src;
drop database if exists fk_clone_alter_both_src;
drop database if exists fk_clone_alter_both_dst;
create database fk_clone_alter_both_src;
use fk_clone_alter_both_src;
create table fk_clone_alter_both_src.parent (
id int primary key,
code varchar(16) unique
);
create table fk_clone_alter_both_src.child (
id int primary key,
parent_id int,
constraint fk_both foreign key (parent_id)
references fk_clone_alter_both_src.parent(id)
);
insert into fk_clone_alter_both_src.parent values (1, 'a');
insert into fk_clone_alter_both_src.child values (1, 1);
alter table fk_clone_alter_both_src.parent add column description varchar(64);
alter table fk_clone_alter_both_src.parent modify column description varchar(128);
alter table fk_clone_alter_both_src.child add column created_at datetime;
create database fk_clone_alter_both_dst clone fk_clone_alter_both_src;
show create table fk_clone_alter_both_dst.parent;
➤ Table[12,-1,0]  ¦  Create Table[12,-1,0]  𝄀
parent  ¦  CREATE TABLE `parent` (
  `id` int NOT NULL,
  `code` varchar(16) DEFAULT NULL,
  `description` varchar(128) DEFAULT NULL,
  PRIMARY KEY (`id`),
  UNIQUE KEY `code` (`code`)
)
show create table fk_clone_alter_both_dst.child;
➤ Table[12,-1,0]  ¦  Create Table[12,-1,0]  𝄀
child  ¦  CREATE TABLE `child` (
  `id` int NOT NULL,
  `parent_id` int DEFAULT NULL,
  `created_at` datetime DEFAULT NULL,
  PRIMARY KEY (`id`),
  CONSTRAINT `fk_both` FOREIGN KEY (`parent_id`) REFERENCES `parent` (`id`) ON DELETE RESTRICT ON UPDATE RESTRICT
)
insert into fk_clone_alter_both_dst.child(id, parent_id) values (2, 404);
internal error: Cannot add or update a child row: a foreign key constraint fails
select count(*) from fk_clone_alter_both_dst.child;
➤ count(*)[-5,64,0]  𝄀
1
drop database fk_clone_alter_both_dst;
drop database fk_clone_alter_both_src;
drop database if exists fk_clone_siblings_src;
drop database if exists fk_clone_siblings_dst;
create database fk_clone_siblings_src;
use fk_clone_siblings_src;
create table fk_clone_siblings_src.parent (id int primary key);
create table fk_clone_siblings_src.child_a (
id int primary key,
parent_id int,
constraint fk_sibling_a foreign key (parent_id)
references fk_clone_siblings_src.parent(id)
);
create table fk_clone_siblings_src.child_b (
id int primary key,
parent_id int,
constraint fk_sibling_b foreign key (parent_id)
references fk_clone_siblings_src.parent(id)
);
alter table fk_clone_siblings_src.child_a add column a1 int default 1;
alter table fk_clone_siblings_src.child_b add column b1 int default 2;
alter table fk_clone_siblings_src.child_a add column a2 int default 3;
create database fk_clone_siblings_dst clone fk_clone_siblings_src;
show create table fk_clone_siblings_dst.child_a;
➤ Table[12,-1,0]  ¦  Create Table[12,-1,0]  𝄀
child_a  ¦  CREATE TABLE `child_a` (
  `id` int NOT NULL,
  `parent_id` int DEFAULT NULL,
  `a1` int DEFAULT 1,
  `a2` int DEFAULT 3,
  PRIMARY KEY (`id`),
  CONSTRAINT `fk_sibling_a` FOREIGN KEY (`parent_id`) REFERENCES `parent` (`id`) ON DELETE RESTRICT ON UPDATE RESTRICT
)
show create table fk_clone_siblings_dst.child_b;
➤ Table[12,-1,0]  ¦  Create Table[12,-1,0]  𝄀
child_b  ¦  CREATE TABLE `child_b` (
  `id` int NOT NULL,
  `parent_id` int DEFAULT NULL,
  `b1` int DEFAULT 2,
  PRIMARY KEY (`id`),
  CONSTRAINT `fk_sibling_b` FOREIGN KEY (`parent_id`) REFERENCES `parent` (`id`) ON DELETE RESTRICT ON UPDATE RESTRICT
)
insert into fk_clone_siblings_dst.child_a values (1, 100, 1, 3);
internal error: Cannot add or update a child row: a foreign key constraint fails
insert into fk_clone_siblings_dst.child_b values (1, 100, 2);
internal error: Cannot add or update a child row: a foreign key constraint fails
drop database fk_clone_siblings_dst;
drop database fk_clone_siblings_src;
drop database if exists fk_clone_chain_src;
drop database if exists fk_clone_chain_dst;
create database fk_clone_chain_src;
use fk_clone_chain_src;
create table fk_clone_chain_src.root (id int primary key);
create table fk_clone_chain_src.middle (
id int primary key,
root_id int,
constraint fk_middle_root foreign key (root_id)
references fk_clone_chain_src.root(id)
);
create table fk_clone_chain_src.leaf (
id int primary key,
middle_id int,
constraint fk_leaf_middle foreign key (middle_id)
references fk_clone_chain_src.middle(id)
);
insert into fk_clone_chain_src.root values (1);
insert into fk_clone_chain_src.middle values (1, 1);
insert into fk_clone_chain_src.leaf values (1, 1);
alter table fk_clone_chain_src.root add column root_value varchar(20);
alter table fk_clone_chain_src.middle add column middle_value varchar(20);
alter table fk_clone_chain_src.leaf add column leaf_value varchar(20);
create database fk_clone_chain_dst clone fk_clone_chain_src;
select leaf.id, middle.id, root.id
from fk_clone_chain_dst.leaf leaf
join fk_clone_chain_dst.middle middle on leaf.middle_id = middle.id
join fk_clone_chain_dst.root root on middle.root_id = root.id;
➤ id[4,32,0]  ¦  id[4,32,0]  ¦  id[4,32,0]  𝄀
1  ¦  1  ¦  1
insert into fk_clone_chain_dst.leaf(id, middle_id) values (2, 999);
internal error: Cannot add or update a child row: a foreign key constraint fails
drop database fk_clone_chain_dst;
drop database fk_clone_chain_src;
drop database if exists fk_clone_composite_src;
drop database if exists fk_clone_composite_dst;
create database fk_clone_composite_src;
use fk_clone_composite_src;
create table fk_clone_composite_src.parent (
tenant_id int,
object_id int,
primary key (tenant_id, object_id)
);
create table fk_clone_composite_src.child (
id int primary key,
tenant_id int,
object_id int,
constraint fk_composite foreign key (tenant_id, object_id)
references fk_clone_composite_src.parent(tenant_id, object_id)
);
insert into fk_clone_composite_src.parent values (1, 1);
insert into fk_clone_composite_src.child values (1, 1, 1);
alter table fk_clone_composite_src.child add column payload varchar(32);
alter table fk_clone_composite_src.child modify column payload varchar(64);
create database fk_clone_composite_dst clone fk_clone_composite_src;
show create table fk_clone_composite_dst.child;
➤ Table[12,-1,0]  ¦  Create Table[12,-1,0]  𝄀
child  ¦  CREATE TABLE `child` (
  `id` int NOT NULL,
  `tenant_id` int DEFAULT NULL,
  `object_id` int DEFAULT NULL,
  `payload` varchar(64) DEFAULT NULL,
  PRIMARY KEY (`id`),
  CONSTRAINT `fk_composite` FOREIGN KEY (`tenant_id`,`object_id`) REFERENCES `parent` (`tenant_id`,`object_id`) ON DELETE RESTRICT ON UPDATE RESTRICT
)
insert into fk_clone_composite_dst.child(id, tenant_id, object_id) values (2, 1, 999);
internal error: Cannot add or update a child row: a foreign key constraint fails
drop database fk_clone_composite_dst;
drop database fk_clone_composite_src;
drop database if exists fk_clone_multi_parent_src;
drop database if exists fk_clone_multi_parent_dst;
create database fk_clone_multi_parent_src;
use fk_clone_multi_parent_src;
create table fk_clone_multi_parent_src.parent_a (id int primary key);
create table fk_clone_multi_parent_src.parent_b (id int primary key);
create table fk_clone_multi_parent_src.child (
id int primary key,
parent_a_id int,
parent_b_id int,
constraint fk_multi_a foreign key (parent_a_id)
references fk_clone_multi_parent_src.parent_a(id),
constraint fk_multi_b foreign key (parent_b_id)
references fk_clone_multi_parent_src.parent_b(id)
);
alter table fk_clone_multi_parent_src.child add column payload int default 0;
alter table fk_clone_multi_parent_src.child add column note varchar(32);
create database fk_clone_multi_parent_dst clone fk_clone_multi_parent_src;
show create table fk_clone_multi_parent_dst.child;
➤ Table[12,-1,0]  ¦  Create Table[12,-1,0]  𝄀
child  ¦  CREATE TABLE `child` (
  `id` int NOT NULL,
  `parent_a_id` int DEFAULT NULL,
  `parent_b_id` int DEFAULT NULL,
  `payload` int DEFAULT 0,
  `note` varchar(32) DEFAULT NULL,
  PRIMARY KEY (`id`),
  CONSTRAINT `fk_multi_a` FOREIGN KEY (`parent_a_id`) REFERENCES `parent_a` (`id`) ON DELETE RESTRICT ON UPDATE RESTRICT,
  CONSTRAINT `fk_multi_b` FOREIGN KEY (`parent_b_id`) REFERENCES `parent_b` (`id`) ON DELETE RESTRICT ON UPDATE RESTRICT
)
insert into fk_clone_multi_parent_dst.child(id, parent_a_id, parent_b_id) values (1, 1, 1);
internal error: Cannot add or update a child row: a foreign key constraint fails
drop database fk_clone_multi_parent_dst;
drop database fk_clone_multi_parent_src;
drop database if exists fk_clone_self_src;
drop database if exists fk_clone_self_dst;
create database fk_clone_self_src;
use fk_clone_self_src;
create table fk_clone_self_src.node (
id int primary key,
parent_id int,
constraint fk_node_parent foreign key (parent_id)
references fk_clone_self_src.node(id)
);
insert into fk_clone_self_src.node values (1, null), (2, 1);
alter table fk_clone_self_src.node add column label varchar(32);
alter table fk_clone_self_src.node add index idx_label(label);
create database fk_clone_self_dst clone fk_clone_self_src;
select id, parent_id from fk_clone_self_dst.node order by id;
➤ id[4,32,0]  ¦  parent_id[4,32,0]  𝄀
1  ¦  null  𝄀
2  ¦  1
show create table fk_clone_self_dst.node;
➤ Table[12,-1,0]  ¦  Create Table[12,-1,0]  𝄀
node  ¦  CREATE TABLE `node` (
  `id` int NOT NULL,
  `parent_id` int DEFAULT NULL,
  `label` varchar(32) DEFAULT NULL,
  PRIMARY KEY (`id`),
  KEY `idx_label` (`label`),
  CONSTRAINT `fk_node_parent` FOREIGN KEY (`parent_id`) REFERENCES `node` (`id`) ON DELETE RESTRICT ON UPDATE RESTRICT
)
insert into fk_clone_self_dst.node(id, parent_id) values (3, 999);
Cannot add or update a child row: a foreign key constraint fails
drop database fk_clone_self_dst;
drop database fk_clone_self_src;
drop database if exists fk_clone_recreate_fk_src;
drop database if exists fk_clone_recreate_fk_dst;
create database fk_clone_recreate_fk_src;
use fk_clone_recreate_fk_src;
create table fk_clone_recreate_fk_src.parent (id int primary key);
create table fk_clone_recreate_fk_src.child (
id int primary key,
parent_id int,
constraint fk_recreated foreign key (parent_id)
references fk_clone_recreate_fk_src.parent(id)
);
alter table fk_clone_recreate_fk_src.child drop foreign key fk_recreated;
alter table fk_clone_recreate_fk_src.child add column payload varchar(32);
alter table fk_clone_recreate_fk_src.child
add constraint fk_recreated foreign key (parent_id)
references fk_clone_recreate_fk_src.parent(id);
alter table fk_clone_recreate_fk_src.child add column note varchar(32);
create database fk_clone_recreate_fk_dst clone fk_clone_recreate_fk_src;
show create table fk_clone_recreate_fk_dst.child;
➤ Table[12,-1,0]  ¦  Create Table[12,-1,0]  𝄀
child  ¦  CREATE TABLE `child` (
  `id` int NOT NULL,
  `parent_id` int DEFAULT NULL,
  `payload` varchar(32) DEFAULT NULL,
  `note` varchar(32) DEFAULT NULL,
  PRIMARY KEY (`id`),
  CONSTRAINT `fk_recreated` FOREIGN KEY (`parent_id`) REFERENCES `parent` (`id`) ON DELETE RESTRICT ON UPDATE RESTRICT
)
insert into fk_clone_recreate_fk_dst.child(id, parent_id) values (1, 999);
internal error: Cannot add or update a child row: a foreign key constraint fails
drop database fk_clone_recreate_fk_dst;
drop database fk_clone_recreate_fk_src;
drop database if exists fk_clone_forward_src;
create database fk_clone_forward_src;
use fk_clone_forward_src;
set foreign_key_checks = 0;
create table fk_clone_forward_src.child (
id int primary key,
parent_id int,
constraint fk_forward foreign key (parent_id)
references fk_clone_forward_src.parent(id)
);
alter table fk_clone_forward_src.child add column payload int;
select table_name, constraint_name, refer_table_name
from mo_catalog.mo_foreign_keys
where db_name = 'fk_clone_forward_src'
order by constraint_name;
➤ table_name[12,-1,0]  ¦  constraint_name[12,-1,0]  ¦  refer_table_name[12,-1,0]  𝄀
child  ¦  fk_forward  ¦  parent
create table fk_clone_forward_src.parent (id int primary key);
set foreign_key_checks = 1;
show create table fk_clone_forward_src.child;
➤ Table[12,-1,0]  ¦  Create Table[12,-1,0]  𝄀
child  ¦  CREATE TABLE `child` (
  `id` int NOT NULL,
  `parent_id` int DEFAULT NULL,
  `payload` int DEFAULT NULL,
  PRIMARY KEY (`id`),
  CONSTRAINT `fk_forward` FOREIGN KEY (`parent_id`) REFERENCES `parent` (`id`) ON DELETE NO ACTION ON UPDATE NO ACTION
)
insert into fk_clone_forward_src.child values (1, 404, 0);
internal error: Cannot add or update a child row: a foreign key constraint fails
drop database fk_clone_forward_src;
drop database if exists fk_clone_forward_drop_src;
create database fk_clone_forward_drop_src;
use fk_clone_forward_drop_src;
create table fk_clone_forward_drop_src.parent (id int primary key);
create table fk_clone_forward_drop_src.child (
id int primary key,
parent_id int,
constraint fk_forward_drop foreign key (parent_id)
references fk_clone_forward_drop_src.parent(id)
);
set foreign_key_checks = 0;
drop table fk_clone_forward_drop_src.parent;
alter table fk_clone_forward_drop_src.child add column payload int;
select table_name, constraint_name, refer_table_name
from mo_catalog.mo_foreign_keys
where db_name = 'fk_clone_forward_drop_src'
order by constraint_name;
➤ table_name[12,-1,0]  ¦  constraint_name[12,-1,0]  ¦  refer_table_name[12,-1,0]  𝄀
child  ¦  fk_forward_drop  ¦  parent
create table fk_clone_forward_drop_src.parent (id int primary key);
set foreign_key_checks = 1;
show create table fk_clone_forward_drop_src.child;
➤ Table[12,-1,0]  ¦  Create Table[12,-1,0]  𝄀
child  ¦  CREATE TABLE `child` (
  `id` int NOT NULL,
  `parent_id` int DEFAULT NULL,
  `payload` int DEFAULT NULL,
  PRIMARY KEY (`id`),
  CONSTRAINT `fk_forward_drop` FOREIGN KEY (`parent_id`) REFERENCES `parent` (`id`) ON DELETE NO ACTION ON UPDATE NO ACTION
)
insert into fk_clone_forward_drop_src.child values (1, 404, 0);
internal error: Cannot add or update a child row: a foreign key constraint fails
drop database fk_clone_forward_drop_src;
drop database if exists fk_clone_self_external_src;
create database fk_clone_self_external_src;
use fk_clone_self_external_src;
create table fk_clone_self_external_src.parent (
id int primary key,
parent_id int,
constraint fk_self_external_self foreign key (parent_id)
references fk_clone_self_external_src.parent(id)
);
create table fk_clone_self_external_src.child (
id int primary key,
parent_id int,
constraint fk_self_external_child foreign key (parent_id)
references fk_clone_self_external_src.parent(id)
);
alter table fk_clone_self_external_src.parent add column payload int;
select table_name, constraint_name, refer_table_name
from mo_catalog.mo_foreign_keys
where db_name = 'fk_clone_self_external_src'
order by table_name, constraint_name;
➤ table_name[12,-1,0]  ¦  constraint_name[12,-1,0]  ¦  refer_table_name[12,-1,0]  𝄀
child  ¦  fk_self_external_child  ¦  parent  𝄀
parent  ¦  fk_self_external_self  ¦  parent
drop table fk_clone_self_external_src.child;
drop table fk_clone_self_external_src.parent;
drop database fk_clone_self_external_src;
drop database if exists fk_clone_rename_columns_src;
drop database if exists fk_clone_rename_columns_dst;
create database fk_clone_rename_columns_src;
use fk_clone_rename_columns_src;
create table fk_clone_rename_columns_src.parent (old_id int primary key);
create table fk_clone_rename_columns_src.child (
id int primary key,
old_parent_id int,
constraint fk_rename_columns foreign key (old_parent_id)
references fk_clone_rename_columns_src.parent(old_id)
);
alter table fk_clone_rename_columns_src.child
rename column old_parent_id to parent_id;
alter table fk_clone_rename_columns_src.parent
rename column old_id to id;
select table_name, column_name, refer_table_name, refer_column_name
from mo_catalog.mo_foreign_keys
where db_name = 'fk_clone_rename_columns_src'
order by constraint_name;
➤ table_name[12,-1,0]  ¦  column_name[12,-1,0]  ¦  refer_table_name[12,-1,0]  ¦  refer_column_name[12,-1,0]  𝄀
child  ¦  parent_id  ¦  parent  ¦  id
create database fk_clone_rename_columns_dst clone fk_clone_rename_columns_src;
show create table fk_clone_rename_columns_dst.child;
➤ Table[12,-1,0]  ¦  Create Table[12,-1,0]  𝄀
child  ¦  CREATE TABLE `child` (
  `id` int NOT NULL,
  `parent_id` int DEFAULT NULL,
  PRIMARY KEY (`id`),
  CONSTRAINT `fk_rename_columns` FOREIGN KEY (`parent_id`) REFERENCES `parent` (`id`) ON DELETE RESTRICT ON UPDATE RESTRICT
)
insert into fk_clone_rename_columns_dst.child values (1, 404);
internal error: Cannot add or update a child row: a foreign key constraint fails
drop database fk_clone_rename_columns_dst;
drop database fk_clone_rename_columns_src;
drop snapshot if exists fk_clone_alter_snapshot;
drop database if exists fk_clone_snapshot_src;
drop database if exists fk_clone_snapshot_dst;
create database fk_clone_snapshot_src;
use fk_clone_snapshot_src;
create table fk_clone_snapshot_src.parent (id int primary key);
create table fk_clone_snapshot_src.child (
id int primary key,
parent_id int,
constraint fk_snapshot foreign key (parent_id)
references fk_clone_snapshot_src.parent(id)
);
insert into fk_clone_snapshot_src.parent values (1);
insert into fk_clone_snapshot_src.child values (1, 1);
alter table fk_clone_snapshot_src.child add column before_snapshot varchar(32);
create snapshot fk_clone_alter_snapshot for database fk_clone_snapshot_src;
alter table fk_clone_snapshot_src.child add column after_snapshot varchar(32);
insert into fk_clone_snapshot_src.parent values (2);
insert into fk_clone_snapshot_src.child(id, parent_id) values (2, 2);
create database fk_clone_snapshot_dst clone fk_clone_snapshot_src
{snapshot = 'fk_clone_alter_snapshot'};
show create table fk_clone_snapshot_dst.child;
➤ Table[12,-1,0]  ¦  Create Table[12,-1,0]  𝄀
child  ¦  CREATE TABLE `child` (
  `id` int NOT NULL,
  `parent_id` int DEFAULT NULL,
  `before_snapshot` varchar(32) DEFAULT NULL,
  PRIMARY KEY (`id`),
  CONSTRAINT `fk_snapshot` FOREIGN KEY (`parent_id`) REFERENCES `parent` (`id`) ON DELETE RESTRICT ON UPDATE RESTRICT
)
select id, parent_id from fk_clone_snapshot_dst.child order by id;
➤ id[4,32,0]  ¦  parent_id[4,32,0]  𝄀
1  ¦  1
insert into fk_clone_snapshot_dst.child(id, parent_id) values (3, 999);
internal error: Cannot add or update a child row: a foreign key constraint fails
drop database fk_clone_snapshot_dst;
drop database fk_clone_snapshot_src;
drop snapshot fk_clone_alter_snapshot;
drop database if exists fk_clone_chain_clone_src;
drop database if exists fk_clone_chain_clone_mid;
drop database if exists fk_clone_chain_clone_dst;
create database fk_clone_chain_clone_src;
use fk_clone_chain_clone_src;
create table fk_clone_chain_clone_src.parent (id int primary key);
create table fk_clone_chain_clone_src.child (
id int primary key,
parent_id int,
constraint fk_clone_chain foreign key (parent_id)
references fk_clone_chain_clone_src.parent(id)
);
alter table fk_clone_chain_clone_src.child add column source_value int;
create database fk_clone_chain_clone_mid clone fk_clone_chain_clone_src;
use fk_clone_chain_clone_mid;
alter table fk_clone_chain_clone_mid.child add column middle_value int;
create database fk_clone_chain_clone_dst clone fk_clone_chain_clone_mid;
show create table fk_clone_chain_clone_dst.child;
➤ Table[12,-1,0]  ¦  Create Table[12,-1,0]  𝄀
child  ¦  CREATE TABLE `child` (
  `id` int NOT NULL,
  `parent_id` int DEFAULT NULL,
  `source_value` int DEFAULT NULL,
  `middle_value` int DEFAULT NULL,
  PRIMARY KEY (`id`),
  CONSTRAINT `fk_clone_chain` FOREIGN KEY (`parent_id`) REFERENCES `parent` (`id`) ON DELETE RESTRICT ON UPDATE RESTRICT
)
insert into fk_clone_chain_clone_dst.child(id, parent_id) values (1, 999);
internal error: Cannot add or update a child row: a foreign key constraint fails
drop database fk_clone_chain_clone_dst;
drop database fk_clone_chain_clone_mid;
drop database fk_clone_chain_clone_src;
drop database if exists fk_clone_rename_src;
drop database if exists fk_clone_rename_dst;
create database fk_clone_rename_src;
use fk_clone_rename_src;
create table fk_clone_rename_src.parent (id int primary key);
create table fk_clone_rename_src.child (
id int primary key,
parent_id int,
constraint fk_rename foreign key (parent_id)
references fk_clone_rename_src.parent(id)
);
alter table fk_clone_rename_src.parent rename column id to parent_key;
alter table fk_clone_rename_src.child rename column parent_id to parent_key;
rename table fk_clone_rename_src.parent to fk_clone_rename_src.renamed_parent;
rename table fk_clone_rename_src.child to fk_clone_rename_src.renamed_child;
alter table fk_clone_rename_src.renamed_child add column payload varchar(32);
create database fk_clone_rename_dst clone fk_clone_rename_src;
show create table fk_clone_rename_dst.renamed_child;
➤ Table[12,-1,0]  ¦  Create Table[12,-1,0]  𝄀
renamed_child  ¦  CREATE TABLE `renamed_child` (
  `id` int NOT NULL,
  `parent_key` int DEFAULT NULL,
  `payload` varchar(32) DEFAULT NULL,
  PRIMARY KEY (`id`),
  CONSTRAINT `fk_rename` FOREIGN KEY (`parent_key`) REFERENCES `renamed_parent` (`parent_key`) ON DELETE RESTRICT ON UPDATE RESTRICT
)
insert into fk_clone_rename_dst.renamed_child(id, parent_key) values (1, 999);
internal error: Cannot add or update a child row: a foreign key constraint fails
drop database fk_clone_rename_dst;
drop database fk_clone_rename_src;
