set global enable_privilege_cache = off;
drop account if exists acc_clone_copy_grants_complex;
drop database if exists cg_sys_copy_grants;
create account acc_clone_copy_grants_complex admin_name "root1" identified by "111";
drop snapshot if exists sp_cg_src;
drop database if exists cg_src;
drop database if exists cg_dst;
create database cg_src;
create database cg_dst;
create table cg_src.src(a int primary key, b varchar(20));
insert into cg_src.src values(1, 'one'), (2, 'two');
create role cg_r_select, cg_r_insert, cg_r_delete, cg_r_all, cg_r_parent, cg_r_child;
grant connect on account * to cg_r_select;
grant connect on account * to cg_r_insert;
grant connect on account * to cg_r_delete;
grant connect on account * to cg_r_all;
grant connect on account * to cg_r_child;
create user cg_u_select identified by '111' default role cg_r_select;
create user cg_u_insert identified by '111' default role cg_r_insert;
create user cg_u_delete identified by '111' default role cg_r_delete;
create user cg_u_all identified by '111' default role cg_r_all;
create user cg_u_child identified by '111' default role cg_r_child;
grant select on table cg_src.src to cg_r_select with grant option;
grant select, insert on table cg_src.src to cg_r_insert;
grant delete on table cg_src.src to cg_r_delete;
grant all on table cg_src.src to cg_r_all with grant option;
grant select on table cg_src.src to cg_r_parent;
grant cg_r_parent to cg_r_child;
create table cg_src.dst_plain clone cg_src.src;
create table cg_src.dst_copy clone cg_src.src copy grants;
create table cg_dst.dst_cross clone cg_src.src copy grants;
create snapshot sp_cg_src for table cg_src src;
create table cg_dst.dst_snapshot clone cg_src.src {snapshot = "sp_cg_src"} copy grants;
select t.reldatabase, t.relname, count(rp.role_name) as copied_grants
from mo_catalog.mo_tables t
left join mo_catalog.mo_role_privs rp
on rp.obj_type = 'table'
and rp.obj_id = t.rel_logical_id
and rp.role_name like 'cg_r_%'
where t.reldatabase in ('cg_src', 'cg_dst')
and t.relname in ('src', 'dst_plain', 'dst_copy', 'dst_cross', 'dst_snapshot')
group by t.reldatabase, t.relname
order by t.reldatabase, t.relname;
➤ reldatabase[12,-1,0]  ¦  relname[12,-1,0]  ¦  copied_grants[-5,64,0]  𝄀
cg_dst  ¦  dst_cross  ¦  6  𝄀
cg_dst  ¦  dst_snapshot  ¦  6  𝄀
cg_src  ¦  dst_copy  ¦  6  𝄀
cg_src  ¦  dst_plain  ¦  0  𝄀
cg_src  ¦  src  ¦  6
select t.reldatabase, t.relname, rp.role_name, rp.privilege_name, rp.privilege_level, rp.with_grant_option
from mo_catalog.mo_tables t
join mo_catalog.mo_role_privs rp
on rp.obj_type = 'table'
and rp.obj_id = t.rel_logical_id
where t.reldatabase in ('cg_src', 'cg_dst')
and t.relname in ('src', 'dst_copy', 'dst_cross', 'dst_snapshot')
and rp.role_name like 'cg_r_%'
order by t.reldatabase, t.relname, rp.role_name, rp.privilege_name;
➤ reldatabase[12,-1,0]  ¦  relname[12,-1,0]  ¦  role_name[12,-1,0]  ¦  privilege_name[12,-1,0]  ¦  privilege_level[12,-1,0]  ¦  with_grant_option[-7,1,0]  𝄀
cg_dst  ¦  dst_cross  ¦  cg_r_all  ¦  table all  ¦  d.t  ¦  1  𝄀
cg_dst  ¦  dst_cross  ¦  cg_r_delete  ¦  delete  ¦  d.t  ¦  0  𝄀
cg_dst  ¦  dst_cross  ¦  cg_r_insert  ¦  insert  ¦  d.t  ¦  0  𝄀
cg_dst  ¦  dst_cross  ¦  cg_r_insert  ¦  select  ¦  d.t  ¦  0  𝄀
cg_dst  ¦  dst_cross  ¦  cg_r_parent  ¦  select  ¦  d.t  ¦  0  𝄀
cg_dst  ¦  dst_cross  ¦  cg_r_select  ¦  select  ¦  d.t  ¦  1  𝄀
cg_dst  ¦  dst_snapshot  ¦  cg_r_all  ¦  table all  ¦  d.t  ¦  1  𝄀
cg_dst  ¦  dst_snapshot  ¦  cg_r_delete  ¦  delete  ¦  d.t  ¦  0  𝄀
cg_dst  ¦  dst_snapshot  ¦  cg_r_insert  ¦  insert  ¦  d.t  ¦  0  𝄀
cg_dst  ¦  dst_snapshot  ¦  cg_r_insert  ¦  select  ¦  d.t  ¦  0  𝄀
cg_dst  ¦  dst_snapshot  ¦  cg_r_parent  ¦  select  ¦  d.t  ¦  0  𝄀
cg_dst  ¦  dst_snapshot  ¦  cg_r_select  ¦  select  ¦  d.t  ¦  1  𝄀
cg_src  ¦  dst_copy  ¦  cg_r_all  ¦  table all  ¦  d.t  ¦  1  𝄀
cg_src  ¦  dst_copy  ¦  cg_r_delete  ¦  delete  ¦  d.t  ¦  0  𝄀
cg_src  ¦  dst_copy  ¦  cg_r_insert  ¦  insert  ¦  d.t  ¦  0  𝄀
cg_src  ¦  dst_copy  ¦  cg_r_insert  ¦  select  ¦  d.t  ¦  0  𝄀
cg_src  ¦  dst_copy  ¦  cg_r_parent  ¦  select  ¦  d.t  ¦  0  𝄀
cg_src  ¦  dst_copy  ¦  cg_r_select  ¦  select  ¦  d.t  ¦  1  𝄀
cg_src  ¦  src  ¦  cg_r_all  ¦  table all  ¦  d.t  ¦  1  𝄀
cg_src  ¦  src  ¦  cg_r_delete  ¦  delete  ¦  d.t  ¦  0  𝄀
cg_src  ¦  src  ¦  cg_r_insert  ¦  insert  ¦  d.t  ¦  0  𝄀
cg_src  ¦  src  ¦  cg_r_insert  ¦  select  ¦  d.t  ¦  0  𝄀
cg_src  ¦  src  ¦  cg_r_parent  ¦  select  ¦  d.t  ¦  0  𝄀
cg_src  ¦  src  ¦  cg_r_select  ¦  select  ¦  d.t  ¦  1
revoke delete on table cg_src.src from cg_r_delete;
select t.reldatabase, t.relname, rp.role_name, rp.privilege_name
from mo_catalog.mo_tables t
join mo_catalog.mo_role_privs rp
on rp.obj_type = 'table'
and rp.obj_id = t.rel_logical_id
where t.reldatabase in ('cg_src', 'cg_dst')
and t.relname in ('src', 'dst_copy', 'dst_cross', 'dst_snapshot')
and rp.role_name = 'cg_r_delete'
order by t.reldatabase, t.relname, rp.role_name, rp.privilege_name;
➤ reldatabase[12,-1,0]  ¦  relname[12,-1,0]  ¦  role_name[12,-1,0]  ¦  privilege_name[12,-1,0]  𝄀
cg_dst  ¦  dst_cross  ¦  cg_r_delete  ¦  delete  𝄀
cg_dst  ¦  dst_snapshot  ¦  cg_r_delete  ¦  delete  𝄀
cg_src  ¦  dst_copy  ¦  cg_r_delete  ¦  delete
select * from cg_src.src order by a;
➤ a[4,32,0]  ¦  b[12,-1,0]  𝄀
1  ¦  one  𝄀
2  ¦  two
select * from cg_src.dst_plain order by a;
internal error: do not have privilege to execute the statement
select * from cg_src.dst_copy order by a;
➤ a[4,32,0]  ¦  b[12,-1,0]  𝄀
1  ¦  one  𝄀
2  ¦  two
select * from cg_dst.dst_cross order by a;
➤ a[4,32,0]  ¦  b[12,-1,0]  𝄀
1  ¦  one  𝄀
2  ¦  two
select * from cg_dst.dst_snapshot order by a;
➤ a[4,32,0]  ¦  b[12,-1,0]  𝄀
1  ¦  one  𝄀
2  ¦  two
insert into cg_src.dst_copy values(3, 'copy');
insert into cg_dst.dst_cross values(4, 'cross');
insert into cg_dst.dst_snapshot values(5, 'snapshot');
insert into cg_src.dst_plain values(6, 'plain');
internal error: do not have privilege to execute the statement
delete from cg_src.src where a = 1;
internal error: do not have privilege to execute the statement
delete from cg_src.dst_copy where a = 1;
delete from cg_dst.dst_cross where a = 1;
delete from cg_dst.dst_snapshot where a = 1;
select * from cg_src.dst_copy order by a;
➤ a[4,32,0]  ¦  b[12,-1,0]  𝄀
2  ¦  two  𝄀
3  ¦  copy
select * from cg_src.dst_plain order by a;
internal error: do not have privilege to execute the statement
update cg_src.dst_copy set b = 'all-copy' where a = 2;
select * from cg_src.dst_copy order by a;
➤ a[4,32,0]  ¦  b[12,-1,0]  𝄀
2  ¦  all-copy  𝄀
3  ¦  copy
select * from cg_src.src order by a;
➤ a[4,32,0]  ¦  b[12,-1,0]  𝄀
1  ¦  one  𝄀
2  ¦  two
select * from cg_src.dst_plain order by a;
➤ a[4,32,0]  ¦  b[12,-1,0]  𝄀
1  ¦  one  𝄀
2  ¦  two
select * from cg_src.dst_copy order by a;
➤ a[4,32,0]  ¦  b[12,-1,0]  𝄀
2  ¦  all-copy  𝄀
3  ¦  copy
select * from cg_dst.dst_cross order by a;
➤ a[4,32,0]  ¦  b[12,-1,0]  𝄀
2  ¦  two  𝄀
4  ¦  cross
select * from cg_dst.dst_snapshot order by a;
➤ a[4,32,0]  ¦  b[12,-1,0]  𝄀
2  ¦  two  𝄀
5  ¦  snapshot
drop snapshot if exists sp_cg_src;
drop user cg_u_select, cg_u_insert, cg_u_delete, cg_u_all, cg_u_child;
drop role cg_r_select, cg_r_insert, cg_r_delete, cg_r_all, cg_r_child, cg_r_parent;
drop database cg_src;
drop database cg_dst;
create database cg_sys_copy_grants;
create table cg_sys_copy_grants.src(a int);
create table cg_sys_copy_grants.dst clone cg_sys_copy_grants.src copy grants to account acc_clone_copy_grants_complex;
invalid input: COPY GRANTS cannot be used with TO ACCOUNT
drop database cg_sys_copy_grants;
drop account if exists acc_clone_copy_grants_complex;
set global enable_privilege_cache = on;
