drop database if exists prep_update_join;
create database prep_update_join;
use prep_update_join;
create table parent(pid int primary key, code varchar(16) unique);
create table acct(
tenant int not null,
acct_id int not null,
status varchar(16),
amount decimal(12,2),
parent_id int,
primary key(tenant, acct_id),
key idx_status_amount(status, amount),
key idx_parent_status(parent_id, status),
constraint fk_acct_parent foreign key(parent_id) references parent(pid)
);
insert into parent values (1,'p1'),(2,'p2');
insert into acct values (1,101,'open',10.50,1),(2,201,'open',30.75,2);
prepare s1 from 'update acct a join parent p on a.parent_id=p.pid set a.amount=a.amount+?, a.status=? where p.code=? and a.status=?';
set @delta1='3.33';
set @delta2='4.44';
set @closed='closed';
set @open='open';
set @code1='p1';
set @code2='p2';
execute s1 using @delta1, @closed, @code1, @open;
execute s1 using @delta2, @closed, @code2, @open;
select tenant, acct_id, status, amount, parent_id from acct order by tenant;
➤ tenant[4,32,0]  ¦  acct_id[4,32,0]  ¦  status[12,-1,0]  ¦  amount[3,12,2]  ¦  parent_id[4,32,0]  𝄀
1  ¦  101  ¦  closed  ¦  13.83  ¦  1  𝄀
2  ¦  201  ¦  closed  ¦  35.19  ¦  2
update acct set status='open';
execute s1 using @delta1, @closed, @code1, @open;
execute s1 using @delta2, @closed, @code2, @open;
select tenant, acct_id, status, amount, parent_id from acct order by tenant;
➤ tenant[4,32,0]  ¦  acct_id[4,32,0]  ¦  status[12,-1,0]  ¦  amount[3,12,2]  ¦  parent_id[4,32,0]  𝄀
1  ¦  101  ¦  closed  ¦  17.16  ¦  1  𝄀
2  ¦  201  ¦  closed  ¦  39.63  ¦  2
deallocate prepare s1;
drop database prep_update_join;
