drop table if exists pri01;
create table pri01 (col1 int, col2 decimal);
insert into pri01 (col1, col2) values (1,2378.328839842);
insert into pri01 values (234, -3923.2342342);
select * from pri01;
col1    col2
1    2378
234    -3923
show create table pri01;
Table    Create Table
pri01    CREATE TABLE `pri01` (\n  `col1` INT DEFAULT NULL,\n  `col2` DECIMAL(38,0) DEFAULT NULL\n)
alter table pri01 add constraint primary key(col1);
insert into pri01 values (23423, 32432543.3242);
insert into pri01 values (234, -3923.2342342);
Duplicate entry '234' for key 'col1'
show columns from pri01;
Field    Type    Null    Key    Default    Extra    Comment
col1    INT(32)    NO    PRI    null        
col2    DECIMAL(38)    YES        null        
select table_name,COLUMN_NAME, data_type,is_nullable from information_schema.columns where table_name like 'pri01' and COLUMN_NAME not like '__mo%';
table_name    COLUMN_NAME    data_type    is_nullable
pri01    col1    INT    NO
pri01    col2    DECIMAL    YES
drop table pri01;
drop table if exists pri02;
create table pri02 (col1 char, col2 bigint unsigned);
insert into pri02 (col1, col2) values ('a', 327349284903284032);
insert into pri02 values ('*', 3289323423);
insert into pri02 values ('*', 328932342342424);
select * from pri02;
col1    col2
a    327349284903284032
*    3289323423
*    328932342342424
alter table pri02 add constraint primary key (col1);
Duplicate entry '*' for key 'col1'
show create table pri02;
Table    Create Table
pri02    CREATE TABLE `pri02` (\n  `col1` CHAR(1) DEFAULT NULL,\n  `col2` BIGINT UNSIGNED DEFAULT NULL\n)
show columns from pri02;
Field    Type    Null    Key    Default    Extra    Comment
col1    CHAR(1)    YES        null        
col2    BIGINT UNSIGNED(64)    YES        null        
select table_name,COLUMN_NAME, data_type,is_nullable from information_schema.columns where table_name like 'pri02' and COLUMN_NAME not like '__mo%';
table_name    COLUMN_NAME    data_type    is_nullable
pri02    col1    CHAR    YES
pri02    col2    BIGINT UNSIGNED    YES
drop table pri02;
drop table if exists pri03;
create table pri03 (col1 char, col2 bigint unsigned);
insert into pri03 (col1, col2) values ('a', 327349284903284032);
insert into pri03 values ('*', 3289323423);
select * from pri03;
col1    col2
a    327349284903284032
*    3289323423
alter table pri03 add constraint primary key (col1);
show create table pri03;
Table    Create Table
pri03    CREATE TABLE `pri03` (\n  `col1` CHAR(1) NOT NULL,\n  `col2` BIGINT UNSIGNED DEFAULT NULL,\n  PRIMARY KEY (`col1`)\n)
show columns from pri03;
Field    Type    Null    Key    Default    Extra    Comment
col1    CHAR(1)    NO    PRI    null        
col2    BIGINT UNSIGNED(64)    YES        null        
select table_name,COLUMN_NAME, data_type,is_nullable from information_schema.columns where table_name like 'pri03' and COLUMN_NAME not like '__mo%';
table_name    COLUMN_NAME    data_type    is_nullable
pri03    col1    CHAR    NO
pri03    col2    BIGINT UNSIGNED    YES
drop table pri03;
drop table if exists pri04;
create table pri04 (col1 varchar(100), col2 float);
insert into pri04 (col1, col2) values ('databaseDATABASE 数据库数据库系统', -32734928490.3284032);
insert into pri04 values ('3782973804u2databasejnwfhui34数据库endfcioc', 3289323423);
insert into pri04 values (null, 378270389824324);
select * from pri04;
col1    col2
databaseDATABASE 数据库数据库系统    -3.2734929E10
3782973804u2databasejnwfhui34数据库endfcioc    3.2893235E9
null    3.782704E14
alter table pri04 add constraint primary key (col1);
constraint violation: Column 'col1' cannot be null
show create table pri04;
Table    Create Table
pri04    CREATE TABLE `pri04` (\n  `col1` VARCHAR(100) DEFAULT NULL,\n  `col2` FLOAT DEFAULT NULL\n)
show columns from pri04;
Field    Type    Null    Key    Default    Extra    Comment
col1    VARCHAR(100)    YES        null        
col2    FLOAT(0)    YES        null        
select table_name,COLUMN_NAME, data_type,is_nullable from information_schema.columns where table_name like 'pri04' and COLUMN_NAME not like '__mo%';
table_name    COLUMN_NAME    data_type    is_nullable
pri04    col1    VARCHAR    YES
pri04    col2    FLOAT    YES
drop table pri04;
drop table if exists pri05;
create table pri05 (col1 date, col2 double);
insert into pri05 (col1, col2) values ('1997-01-13', -32734928490.3284032);
insert into pri05 values ('2023-08-18', 3289323423);
select * from pri05;
col1    col2
1997-01-13    -3.2734928490328403E10
2023-08-18    3.289323423E9
alter table pri05 add constraint primary key (col1);
show create table pri05;
Table    Create Table
pri05    CREATE TABLE `pri05` (\n  `col1` DATE NOT NULL,\n  `col2` DOUBLE DEFAULT NULL,\n  PRIMARY KEY (`col1`)\n)
show columns from pri05;
Field    Type    Null    Key    Default    Extra    Comment
col1    DATE(0)    NO    PRI    null        
col2    DOUBLE(0)    YES        null        
select table_name,COLUMN_NAME, data_type,is_nullable from information_schema.columns where table_name like 'pri05' and COLUMN_NAME not like '__mo%';
table_name    COLUMN_NAME    data_type    is_nullable
pri05    col1    DATE    NO
pri05    col2    DOUBLE    YES
drop table pri05;
drop table if exists pri06;
create table pri06 (col1 smallint default null, col2 double);
insert into pri06 (col1, col2) values (100, -32734928490.3284032);
insert into pri06 values (200, 3289323423);
select * from pri06;
col1    col2
100    -3.2734928490328403E10
200    3.289323423E9
alter table pri06 add constraint primary key (col1);
show create table pri06;
Table    Create Table
pri06    CREATE TABLE `pri06` (\n  `col1` SMALLINT NOT NULL,\n  `col2` DOUBLE DEFAULT NULL,\n  PRIMARY KEY (`col1`)\n)
select table_name,COLUMN_NAME, data_type,is_nullable from information_schema.columns where table_name like 'pri06' and COLUMN_NAME not like '__mo%';
table_name    COLUMN_NAME    data_type    is_nullable
pri06    col1    SMALLINT    NO
pri06    col2    DOUBLE    YES
show columns from pri06;
Field    Type    Null    Key    Default    Extra    Comment
col1    SMALLINT(16)    NO    PRI    null        
col2    DOUBLE(0)    YES        null        
drop table pri06;
drop table if exists pri07;
create table pri07 (col1 decimal, col2 double);
insert into pri07 (col1, col2) values (12.213231000021312, -32734928490.3284032);
insert into pri07 values (32784234.4234243243243242, 3289323423);
select * from pri07;
col1    col2
12    -3.2734928490328403E10
32784234    3.289323423E9
alter table pri07 add constraint primary key (col1);
show create table pri07;
Table    Create Table
pri07    CREATE TABLE `pri07` (\n  `col1` DECIMAL(38,0) NOT NULL,\n  `col2` DOUBLE DEFAULT NULL,\n  PRIMARY KEY (`col1`)\n)
show columns from pri07;
Field    Type    Null    Key    Default    Extra    Comment
col1    DECIMAL(38)    NO    PRI    null        
col2    DOUBLE(0)    YES        null        
update pri07 set col1 = 1000000 where col2 = 3289323423;
update pri07 set col1 = 12.213231000021312 where col2 = 3289323423;
Duplicate entry '12' for key 'col1'
delete from pri07 where col1 = 12.213231000021312;
select * from pri07;
col1    col2
12    -3.2734928490328403E10
1000000    3.289323423E9
select table_name,COLUMN_NAME, data_type,is_nullable from information_schema.columns where table_name like 'pri07' and COLUMN_NAME not like '__mo%';
table_name    COLUMN_NAME    data_type    is_nullable
pri07    col1    DECIMAL    NO
pri07    col2    DOUBLE    YES
drop table pri07;
drop table if exists pri08;
create table pri08 (col1 binary, col2 int unsigned);
insert into pri08 values ('ewfijew', 372984324);
insert into pri08 values ('ew8u3ejkfcwev', 2147483647);
select * from pri08;
col1    col2
ewfijew    372984324
ew8u3ejkfcwev    2147483647
alter table pri08 add constraint primary key (col1);
show create table pri08;
Table    Create Table
pri08    CREATE TABLE `pri08` (\n  `col1` BINARY(1) NOT NULL,\n  `col2` INT UNSIGNED DEFAULT NULL,\n  PRIMARY KEY (`col1`)\n)
show columns from pri08;
Field    Type    Null    Key    Default    Extra    Comment
col1    BINARY(1)    NO    PRI    null        
col2    INT UNSIGNED(32)    YES        null        
alter table pri08 add constraint primary key (col2);
Multiple primary key defined
show create table pri08;
Table    Create Table
pri08    CREATE TABLE `pri08` (\n  `col1` BINARY(1) NOT NULL,\n  `col2` INT UNSIGNED DEFAULT NULL,\n  PRIMARY KEY (`col1`)\n)
show columns from pri08;
Field    Type    Null    Key    Default    Extra    Comment
col1    BINARY(1)    NO    PRI    null        
col2    INT UNSIGNED(32)    YES        null        
select table_name,COLUMN_NAME, data_type,is_nullable from information_schema.columns where table_name like 'pri08' and COLUMN_NAME not like '__mo%';
table_name    COLUMN_NAME    data_type    is_nullable
pri08    col1    BINARY    NO
pri08    col2    INT UNSIGNED    YES
drop table pri08;
drop table if exists pri09;
create table pri09 (col1 binary, col2 int unsigned);
insert into pri09 values ('a', 372893243);
insert into pri09 values (null, 2147483647);
select * from pri09;
col1    col2
a    372893243
null    2147483647
alter table pri09 add constraint primary key (col1, col2);
constraint violation: Column 'col1' cannot be null
show create table pri09;
Table    Create Table
pri09    CREATE TABLE `pri09` (\n  `col1` BINARY(1) DEFAULT NULL,\n  `col2` INT UNSIGNED DEFAULT NULL\n)
show columns from pri09;
Field    Type    Null    Key    Default    Extra    Comment
col1    BINARY(1)    YES        null        
col2    INT UNSIGNED(32)    YES        null        
select table_name,COLUMN_NAME, data_type,is_nullable from information_schema.columns where table_name like 'pri09' and COLUMN_NAME not like '__mo%';
table_name    COLUMN_NAME    data_type    is_nullable
pri09    col1    BINARY    YES
pri09    col2    INT UNSIGNED    YES
drop table pri09;
drop table if exists pri10;
create table pri10 (col1 int, col2 char(1));
insert into pri10 (col1, col2) values (1, 'a');
insert into pri10 values (-2, '*');
select * from pri10;
col1    col2
1    a
-2    *
alter table pri10 add constraint primary key (col1, col2);
show create table pri10;
Table    Create Table
pri10    CREATE TABLE `pri10` (\n  `col1` INT NOT NULL,\n  `col2` CHAR(1) NOT NULL,\n  PRIMARY KEY (`col1`,`col2`)\n)
show columns from pri10;
Field    Type    Null    Key    Default    Extra    Comment
col1    INT(32)    NO    PRI    null        
col2    CHAR(1)    NO    PRI    null        
insert into pri10 (col1, col2) values (1, null);
constraint violation: Column 'col2' cannot be null
insert into pri10 values (-2, 'p');
insert into pri10 (col1, col2) values (1, 'a');
Duplicate entry ('\(1\,a\)'|'\d\w\d{12}') for key '__mo_cpkey_col'
select * from pri10;
col1    col2
1    a
-2    *
-2    p
select table_name,COLUMN_NAME, data_type,is_nullable from information_schema.columns where table_name like 'pri10' and COLUMN_NAME not like '__mo%';
table_name    COLUMN_NAME    data_type    is_nullable
pri10    col1    INT    NO
pri10    col2    CHAR    NO
drop table pri10;
drop table if exists pri11;
create table pri11 (col1 int primary key , col2 decimal, col3 char);
insert into pri11 (col1, col2, col3) values (1, 3289034.3232, 'q');
insert into pri11 values (2, 3829.3232, 'a');
alter table pri11 add constraint primary key (col1, col2);
Multiple primary key defined
show create table pri11;
Table    Create Table
pri11    CREATE TABLE `pri11` (\n  `col1` INT NOT NULL,\n  `col2` DECIMAL(38,0) DEFAULT NULL,\n  `col3` CHAR(1) DEFAULT NULL,\n  PRIMARY KEY (`col1`)\n)
show columns from pri11;
Field    Type    Null    Key    Default    Extra    Comment
col1    INT(32)    NO    PRI    null        
col2    DECIMAL(38)    YES        null        
col3    CHAR(1)    YES        null        
select * from pri11;
col1    col2    col3
1    3289034    q
2    3829    a
select table_name,COLUMN_NAME, data_type,is_nullable from information_schema.columns where table_name like 'pri11' and COLUMN_NAME not like '__mo%';
table_name    COLUMN_NAME    data_type    is_nullable
pri11    col1    INT    NO
pri11    col2    DECIMAL    YES
pri11    col3    CHAR    YES
drop table pri11;
drop table if exists temp01;
create temporary table temp01 (col1 datetime, col2 blob);
insert into temp01 values ('1997-01-13 00:00:00', '342ewfyuehcdeiuopwu4jo3lekwdfhiu48woi3jrdnefrbwui34f');
insert into temp01 values ('2012-01-13 23:23:59', '63298ufh3jcweuiv4h32jhf432ouy4hu3enjwfnwje4n3bj24f34573');
select * from temp01;
col1    col2
1997-01-13 00:00:00    342ewfyuehcdeiuopwu4jo3lekwdfhiu48woi3jrdnefrbwui34f
2012-01-13 23:23:59    63298ufh3jcweuiv4h32jhf432ouy4hu3enjwfnwje4n3bj24f34573
alter table temp01 add constraint primary key (col2);
alter table for temporary table is not yet implemented
select * from temp01;
col1    col2
1997-01-13 00:00:00    342ewfyuehcdeiuopwu4jo3lekwdfhiu48woi3jrdnefrbwui34f
2012-01-13 23:23:59    63298ufh3jcweuiv4h32jhf432ouy4hu3enjwfnwje4n3bj24f34573
show create table temp01;
Table    Create Table
temp01    CREATE TABLE `temp01` (\n  `col1` DATETIME DEFAULT NULL,\n  `col2` BLOB DEFAULT NULL\n)
show columns from temp01;
Field    Type    Null    Key    Default    Extra    Comment
select table_name,COLUMN_NAME, data_type,is_nullable from information_schema.columns where table_name like 'temp01' and COLUMN_NAME not like '__mo%';
table_name    COLUMN_NAME    data_type    is_nullable
drop table temp01;
drop table if exists ex_table_2_1;
create external table ex_table_2_1(num_col1 tinyint,num_col2 smallint,num_col3 int,num_col4 bigint,num_col5 tinyint unsigned,num_col6 smallint unsigned,num_col7 int unsigned,num_col8 bigint unsigned ,num_col9 float(5,3),num_col10 double(6,5),num_col11 decimal(38,19))infile{"filepath"='$resources/external_table_file/ex_table_2_1.csv'} fields terminated by ',' enclosed by '\"' lines terminated by '\n';
alter table ex_table_2_1 add constraint primary key (num_col1, num_col2);
invalid input: cannot insert/update/delete from external table
show create table ex_table_2_1;
Table    Create Table
ex_table_2_1    CREATE EXTERNAL TABLE `ex_table_2_1` (\n  `num_col1` TINYINT DEFAULT NULL,\n  `num_col2` SMALLINT DEFAULT NULL,\n  `num_col3` INT DEFAULT NULL,\n  `num_col4` BIGINT DEFAULT NULL,\n  `num_col5` TINYINT UNSIGNED DEFAULT NULL,\n  `num_col6` SMALLINT UNSIGNED DEFAULT NULL,\n  `num_col7` INT UNSIGNED DEFAULT NULL,\n  `num_col8` BIGINT UNSIGNED DEFAULT NULL,\n  `num_col9` FLOAT(5,3) DEFAULT NULL,\n  `num_col10` DOUBLE(6,5) DEFAULT NULL,\n  `num_col11` DECIMAL(38,19) DEFAULT NULL\n) INFILE{'FILEPATH'='','COMPRESSION'='','FORMAT'='csv','JSONDATA'=''} FIELDS TERMINATED BY ',' ENCLOSED BY '"' LINES TERMINATED BY '\n'
select * from ex_table_2_1;
internal error: the input value 'abc' is not int8 type for column 0
drop table if exists droppri01;
create table droppri01 (col1 int primary key , col2 decimal);
insert into droppri01 (col1, col2) values (1, 234324234.234242);
insert into droppri01 values (32894324,4234294023.4324324234);
alter table droppri01 drop primary key;
show create table droppri01;
Table    Create Table
droppri01    CREATE TABLE `droppri01` (\n  `col1` INT NOT NULL,\n  `col2` DECIMAL(38,0) DEFAULT NULL\n)
show columns from droppri01;
Field    Type    Null    Key    Default    Extra    Comment
col1    INT(32)    NO        null        
col2    DECIMAL(38)    YES        null        
insert into droppri01 (col1, col2) values (1, 3489372843);
truncate table droppri01;
alter table droppri01 add constraint primary key (col2);
show create table droppri01;
Table    Create Table
droppri01    CREATE TABLE `droppri01` (\n  `col1` INT NOT NULL,\n  `col2` DECIMAL(38,0) NOT NULL,\n  PRIMARY KEY (`col2`)\n)
alter table droppri01 drop primary key;
show create table droppri01;
Table    Create Table
droppri01    CREATE TABLE `droppri01` (\n  `col1` INT NOT NULL,\n  `col2` DECIMAL(38,0) NOT NULL\n)
show columns from droppri01;
Field    Type    Null    Key    Default    Extra    Comment
col1    INT(32)    NO        null        
col2    DECIMAL(38)    NO        null        
select * from droppri01;
col1    col2
select table_name,COLUMN_NAME, data_type,is_nullable from information_schema.columns where table_name like 'droppri01' and COLUMN_NAME not like '__mo%';
table_name    COLUMN_NAME    data_type    is_nullable
droppri01    col1    INT    NO
droppri01    col2    DECIMAL    NO
drop table droppri01;
drop table if exists pri01;
create table pri01(col1 int, col2 decimal);
alter table pri01 add constraint primary key(col1);
show create table pri01;
Table    Create Table
pri01    CREATE TABLE `pri01` (\n  `col1` INT NOT NULL,\n  `col2` DECIMAL(38,0) DEFAULT NULL,\n  PRIMARY KEY (`col1`)\n)
alter table pri01 drop primary key;
show create table pri01;
Table    Create Table
pri01    CREATE TABLE `pri01` (\n  `col1` INT NOT NULL,\n  `col2` DECIMAL(38,0) DEFAULT NULL\n)
alter table pri01 add constraint primary key(col2);
show create table pri01;
Table    Create Table
pri01    CREATE TABLE `pri01` (\n  `col1` INT NOT NULL,\n  `col2` DECIMAL(38,0) NOT NULL,\n  PRIMARY KEY (`col2`)\n)
show columns from pri01;
Field    Type    Null    Key    Default    Extra    Comment
col1    INT(32)    NO        null        
col2    DECIMAL(38)    NO    PRI    null        
select table_name,COLUMN_NAME, data_type,is_nullable from information_schema.columns where table_name like 'pri01' and COLUMN_NAME not like '__mo%';
table_name    COLUMN_NAME    data_type    is_nullable
pri01    col1    INT    NO
pri01    col2    DECIMAL    NO
drop table pri01;
drop table if exists droppri02;
create table droppri02 (col1 int auto_increment, col2 decimal, col3 char, col4 varchar not null, col5 float, primary key (col1, col2, col3));
show create table droppri02;
Table    Create Table
droppri02    CREATE TABLE `droppri02` (\n  `col1` INT NOT NULL AUTO_INCREMENT,\n  `col2` DECIMAL(38,0) NOT NULL,\n  `col3` CHAR(1) NOT NULL,\n  `col4` VARCHAR(65535) NOT NULL,\n  `col5` FLOAT DEFAULT NULL,\n  PRIMARY KEY (`col1`,`col2`,`col3`)\n)
show columns from droppri02;
Field    Type    Null    Key    Default    Extra    Comment
col1    INT(32)    NO    PRI    null    auto_increment    
col2    DECIMAL(38)    NO    PRI    null        
col3    CHAR(1)    NO    PRI    null        
col4    VARCHAR(65535)    NO        null        
col5    FLOAT(0)    YES        null        
alter table droppri02 drop primary key;
show create table droppri02;
Table    Create Table
droppri02    CREATE TABLE `droppri02` (\n  `col1` INT NOT NULL AUTO_INCREMENT,\n  `col2` DECIMAL(38,0) NOT NULL,\n  `col3` CHAR(1) NOT NULL,\n  `col4` VARCHAR(65535) NOT NULL,\n  `col5` FLOAT DEFAULT NULL\n)
show columns from droppri02;
Field    Type    Null    Key    Default    Extra    Comment
col1    INT(32)    NO        null    auto_increment    
col2    DECIMAL(38)    NO        null        
col3    CHAR(1)    NO        null        
col4    VARCHAR(65535)    NO        null        
col5    FLOAT(0)    YES        null        
drop table droppri02;
drop table if exists prepare01;
create table prepare01(col1 int primary key , col2 char);
insert into prepare01 values (1,'a'),(2,'b'),(3,'c');
show create table prepare01;
Table    Create Table
prepare01    CREATE TABLE `prepare01` (\n  `col1` INT NOT NULL,\n  `col2` CHAR(1) DEFAULT NULL,\n  PRIMARY KEY (`col1`)\n)
show columns from prepare01;
Field    Type    Null    Key    Default    Extra    Comment
col1    INT(32)    NO    PRI    null        
col2    CHAR(1)    YES        null        
prepare s1 from 'alter table prepare01 drop primary key';
execute s1;
show create table prepare01;
Table    Create Table
prepare01    CREATE TABLE `prepare01` (\n  `col1` INT NOT NULL,\n  `col2` CHAR(1) DEFAULT NULL\n)
show columns from prepare01;
Field    Type    Null    Key    Default    Extra    Comment
col1    INT(32)    NO        null        
col2    CHAR(1)    YES        null        
prepare s2 from 'alter table prepare01 add constraint primary key(col2) ';
execute s2;
show create table prepare01;
Table    Create Table
prepare01    CREATE TABLE `prepare01` (\n  `col1` INT NOT NULL,\n  `col2` CHAR(1) NOT NULL,\n  PRIMARY KEY (`col2`)\n)
show columns from prepare01;
Field    Type    Null    Key    Default    Extra    Comment
col1    INT(32)    NO        null        
col2    CHAR(1)    NO    PRI    null        
drop table prepare01;
drop role if exists role_r1;
drop user if exists role_u1;
drop table if exists test01;
create role role_r1;
create user role_u1 identified by '111' default role role_r1;
create table test01(col1 int, col2 varchar(10));
insert into test01 values(1, 'ewuijernf');
insert into test01 values(2, 'abscde');
grant create database on account * to role_r1;
grant show databases on account * to role_r1;
grant connect on account * to role_r1;
grant select on table * to role_r1;
grant show tables on database * to role_r1;
use alter_table_add_drop_primary_key;
alter table test01 add constraint primary key(col1);
internal error: do not have privilege to execute the statement
grant alter table on database * to role_r1;
use alter_table_add_drop_primary_key;
alter table test01 add constraint primary key(col1);
show create table test01;
Table    Create Table
test01    CREATE TABLE `test01` (\n  `col1` INT NOT NULL,\n  `col2` VARCHAR(10) DEFAULT NULL,\n  PRIMARY KEY (`col1`)\n)
show columns from test01;
Field    Type    Null    Key    Default    Extra    Comment
col1    INT(32)    NO    PRI    null        
col2    VARCHAR(10)    YES        null        
alter table test01 drop primary key;
show create table test01;
Table    Create Table
test01    CREATE TABLE `test01` (\n  `col1` INT NOT NULL,\n  `col2` VARCHAR(10) DEFAULT NULL\n)
show columns from test01;
Field    Type    Null    Key    Default    Extra    Comment
col1    INT(32)    NO        null        
col2    VARCHAR(10)    YES        null        
show create table test01;
Table    Create Table
test01    CREATE TABLE `test01` (\n  `col1` INT NOT NULL,\n  `col2` VARCHAR(10) DEFAULT NULL\n)
show columns from test01;
Field    Type    Null    Key    Default    Extra    Comment
col1    INT(32)    NO        null        
col2    VARCHAR(10)    YES        null        
drop table test01;
drop role role_r1;
drop user role_u1;
drop table if exists mix01;
create table mix01 (col1 int, col2 decimal, col3 char, col4 varchar(100));
insert into mix01 (col1, col2, col3, col4) values (1, 2, 'a', 'w3uir34jn2k48ujf4');
insert into mix01 (col1, col2, col3, col4) values (2, 3, 'd', '3289u3ji2dff43');
alter table mix01 modify col1 float after col3, change column col2 col2New double, rename column col3 to newCol3, add constraint primary key(col1);
insert into mix01 (col1, col2, col3, col4) values (3, 'w', 37283.323, 'dswhjkfrewr');
Unknown column 'col2' in 'mix01'
alter table mix01 add column col5 int after col1, rename column col2new to newnewCol2;
select * from mix01;
newnewcol2    newcol3    col1    col5    col4
2.0    a    1.0    null    w3uir34jn2k48ujf4
3.0    d    2.0    null    3289u3ji2dff43
alter table mix01 rename column col2new to newnewCol2, drop primary key;
Unknown column 'col2new' in 'mix01'
show create table mix01;
Table    Create Table
mix01    CREATE TABLE `mix01` (\n  `newnewCol2` DOUBLE DEFAULT NULL,\n  `newCol3` CHAR(1) DEFAULT NULL,\n  `col1` FLOAT NOT NULL,\n  `col5` INT DEFAULT NULL,\n  `col4` VARCHAR(100) DEFAULT NULL,\n  PRIMARY KEY (`col1`)\n)
delete from mix01 where newnewcol2 = 2;
update mix01 set newnewcol2 = 8290432.324 where newcol3 = 'd';
select * from mix01;
newnewcol2    newcol3    col1    col5    col4
8290432.324    d    2.0    null    3289u3ji2dff43
show create table mix01;
Table    Create Table
mix01    CREATE TABLE `mix01` (\n  `newnewCol2` DOUBLE DEFAULT NULL,\n  `newCol3` CHAR(1) DEFAULT NULL,\n  `col1` FLOAT NOT NULL,\n  `col5` INT DEFAULT NULL,\n  `col4` VARCHAR(100) DEFAULT NULL,\n  PRIMARY KEY (`col1`)\n)
show columns from mix01;
Field    Type    Null    Key    Default    Extra    Comment
newnewCol2    DOUBLE(0)    YES        null        
newCol3    CHAR(1)    YES        null        
col1    FLOAT(0)    NO    PRI    null        
col5    INT(32)    YES        null        
col4    VARCHAR(100)    YES        null        
drop table mix01;
drop table if exists table01;
begin;
create table table01(col1 int, col2 decimal);
insert into table01 values(100,200);
insert into table01 values(200,300);
alter table table01 add constraint primary key (col2);
commit;
select * from table01;
col1    col2
100    200
200    300
select col1 from table01;
col1
100
200
drop table table01;
drop table if exists table01;
begin;
create table table01(col1 int primary key, col2 decimal);
insert into table01 values(100,200);
insert into table01 values(200,300);
alter table table01 drop primary key;
commit;
select * from table01;
col1    col2
100    200
200    300
select col1 from table01;
col1
100
200
drop table table01;
drop table if exists t1;
create table t1(a int primary key, b int);
insert into t1 select result ,result from generate_series(1, 20000000) g;
alter table t1 drop primary key;
begin;
create table t2(a int, b int);
insert into t2 select a,b from t1;
select count(*) from t2;
count(*)
20000000
drop table t2;
commit;