drop database if exists test;
create database test;
use test;
drop table if exists samecolumn01;
create table samecolumn01 (col1 int, col2 char);
alter table samecolumn01 rename column col1 to newColumn;
alter table samecolumn01 rename column col2 to newcolumn;
Duplicate column name 'newcolumn'
show create table samecolumn01;
Table    Create Table
samecolumn01    CREATE TABLE `samecolumn01` (\n`newcolumn` INT DEFAULT NULL,\n`col2` CHAR(1) DEFAULT NULL\n)
show columns from samecolumn01;
Field    Type    Null    Key    Default    Extra    Comment
newcolumn    INT(32)    YES        null        
col2    CHAR(1)    YES        null        
drop table samecolumn01;
drop table if exists rename01;
create table rename01 (col1 int, col2 decimal);
alter table rename01 rename column col1 to col1New;
show create table rename01;
Table    Create Table
rename01    CREATE TABLE `rename01` (\n`col1new` INT DEFAULT NULL,\n`col2` DECIMAL(38,0) DEFAULT NULL\n)
show columns from rename01;
Field    Type    Null    Key    Default    Extra    Comment
col1new    INT(32)    YES        null        
col2    DECIMAL128(38)    YES        null        
select table_name,COLUMN_NAME, data_type,is_nullable from information_schema.columns where table_name like 'name01' and COLUMN_NAME not like '__mo%';
table_name    column_name    data_type    is_nullable
drop table rename01;
drop table if exists rename02;
create table rename02 (`colcolcol1` int, `colcolcol2` binary);
insert into rename02 values (1, '2');
insert into rename02 values (2, 'g');
alter table rename02 rename column `colcolcol1` to `colcolcol1`;
show create table rename02;
Table    Create Table
rename02    CREATE TABLE `rename02` (\n`colcolcol1` INT DEFAULT NULL,\n`colcolcol2` BINARY(1) DEFAULT NULL\n)
insert into rename02 (colcolcol1, colcolcol2) values (3, '7');
delete from rename02 where colcolcol1 = 1;
update rename02 set colcolcol2 = '&' where colcolcol1 = 2;
select * from rename02;
colcolcol1    colcolcol2
3    7
2    &
show columns from rename02;
Field    Type    Null    Key    Default    Extra    Comment
colcolcol1    INT(32)    YES        null        
colcolcol2    BINARY(1)    YES        null        
select table_name,COLUMN_NAME, data_type,is_nullable from information_schema.columns where table_name like 'rename02' and COLUMN_NAME not like '__mo%';
table_name    column_name    data_type    is_nullable
rename02    colcolcol1    INT    YES
rename02    colcolcol2    BINARY    YES
drop table rename02;
drop table if exists rename03;
create table rename03(col1 int, col2 int, col3 varchar(20));
insert into rename03 values (1,2,'cfewquier');
insert into rename03 values (2,3,'329382');
insert into rename03 values (3, 10, null);
select * from rename03;
col1    col2    col3
1    2    cfewquier
2    3    329382
3    10    null
alter table rename03 rename column col1 to col1New;
alter table rename03 rename column col3 to col3New;
show create table rename03;
Table    Create Table
rename03    CREATE TABLE `rename03` (\n`col1new` INT DEFAULT NULL,\n`col2` INT DEFAULT NULL,\n`col3new` VARCHAR(20) DEFAULT NULL\n)
insert into rename03 (col1, col2, col3) values (3,4,'121131312');
Unknown column 'col1' in 'rename03'
insert into rename03 (col1New, col2, col3New) values (3,4,'121131312');
select * from rename03;
col1new    col2    col3new
1    2    cfewquier
2    3    329382
3    10    null
3    4    121131312
update rename03 set col1New = 100 where col1New = 1;
update rename03 set col3New = '2798u3d3frew' where col3New = '6';
delete from rename03 where col3New is null;
select * from rename03;
col1new    col2    col3new
2    3    329382
3    4    121131312
100    2    cfewquier
show columns from rename03;
Field    Type    Null    Key    Default    Extra    Comment
col1new    INT(32)    YES        null        
col2    INT(32)    YES        null        
col3new    VARCHAR(20)    YES        null        
select table_name,COLUMN_NAME, data_type,is_nullable from information_schema.columns where table_name like 'rename03' and COLUMN_NAME not like '__mo%';
table_name    column_name    data_type    is_nullable
rename03    col1new    INT    YES
rename03    col2    INT    YES
rename03    col3new    VARCHAR    YES
drop table rename03;
drop table if exists rename04;
create table rename04(a int,b int);
insert into rename04 values(1,1);
alter table rename04 rename column a to newA;
show create table rename04;
Table    Create Table
rename04    CREATE TABLE `rename04` (\n`newa` INT DEFAULT NULL,\n`b` INT DEFAULT NULL\n)
update rename04 set newA = 100 where b = 1;
select * from rename04;
newa    b
100    1
alter table rename04 rename column newA to newnewA;
show create table rename04;
Table    Create Table
rename04    CREATE TABLE `rename04` (\n`newnewa` INT DEFAULT NULL,\n`b` INT DEFAULT NULL\n)
insert into rename04 values (1, 3);
insert into rename04 values (1289,232);
update rename04 set a = 10000 where b = 1;
internal error: column 'a' not found in table 
update rename04 set newnewA = 10000 where b = 1;
select * from rename04;
newnewa    b
1    3
1289    232
10000    1
delet from rename04 where newnewa = 10000;
SQL parser error: You have an error in your SQL syntax; check the manual that corresponds to your MatrixOne server version for the right syntax to use. syntax error at line 1 column 5 near "delet from rename04 where newnewa = 10000;";
select * from rename04;
newnewa    b
1    3
1289    232
10000    1
show columns from rename04;
Field    Type    Null    Key    Default    Extra    Comment
newnewa    INT(32)    YES        null        
b    INT(32)    YES        null        
select table_name,COLUMN_NAME, data_type,is_nullable from information_schema.columns where table_name like 'rename04' and COLUMN_NAME not like '__mo%';
table_name    column_name    data_type    is_nullable
rename04    b    INT    YES
rename04    newnewa    INT    YES
drop table rename04;
drop table if exists rename06;
create table rename06(col1 int);
insert into rename06 values(1),(2);
alter table rename06 rename column col1 to '';
SQL parser error: You have an error in your SQL syntax; check the manual that corresponds to your MatrixOne server version for the right syntax to use. syntax error at line 1 column 45 near " '';";
alter table rename06 rename column col1 to ' ';
SQL parser error: You have an error in your SQL syntax; check the manual that corresponds to your MatrixOne server version for the right syntax to use. syntax error at line 1 column 46 near " ' ';";
alter table rename06 rename column col1 to 数据库系统;
SQL parser error: You have an error in your SQL syntax; check the manual that corresponds to your MatrixOne server version for the right syntax to use. syntax error at line 1 column 44 near " 数据库系统;";
alter table rename06 rename column col1 to 7327323467dhhjfkrnfe;
alter table rename06 rename column col1 to **&&^^%%^&**;
SQL parser error: You have an error in your SQL syntax; check the manual that corresponds to your MatrixOne server version for the right syntax to use. syntax error at line 1 column 44 near " **&&^^%^&**;";
drop table rename06;
drop table if exists rename06;
create table rename06(col1 int);
insert into rename06 values(1),(2);
alter table rename06 rename column col1 to `数据库系统`;
alter table rename06 rename column col1 to `数据操作，数据收集7327323467dhhjfkrnfe`;
Unknown column 'col1' in 'rename06'
select table_name,COLUMN_NAME, data_type,is_nullable from information_schema.columns where table_name like 'rename06' and COLUMN_NAME not like '__mo%';
table_name    column_name    data_type    is_nullable
rename06    数据库系统    INT    YES
show columns from rename06;
Field    Type    Null    Key    Default    Extra    Comment
数据库系统    INT(32)    YES        null        
drop table rename06;
alter table system.statement_info rename column role_id to role_idNew;
internal error: do not have privilege to execute the statement
alter table mo_catalog.mo_database rename column dat_type to newdat_type;
internal error: do not have privilege to execute the statement
alter table mysql.procs_priv rename column grantor to newGrantor;
internal error: do not have privilege to execute the statement
drop table if exists primary01;
create table primary01 (col1 int primary key , col2 decimal);
insert into primary01 values (2389324, 32784329.4309403);
insert into primary01 values (3287, 89384038);
alter table primary01 rename column col1 to col1New;
show create table primary01;
Table    Create Table
primary01    CREATE TABLE `primary01` (\n`col1new` INT NOT NULL,\n`col2` DECIMAL(38,0) DEFAULT NULL,\nPRIMARY KEY (`col1new`)\n)
insert into primary01 values (-2839, 8239802839.00000000);
insert into primary01 (col1New, col2) values (3287, 3293892.3232);
Duplicate entry '3287' for key 'col1new'
delete from primary01 where col1New = -2839;
update primary01 set col1 = 2873892 where col1New = 2389324;
internal error: column 'col1' not found in table 
update primary01 set col1New = 2873892 where col1New = 2389324;
select * from primary01;
col1new    col2
3287    89384038
2873892    32784329
show columns from primary01;
Field    Type    Null    Key    Default    Extra    Comment
col1new    INT(32)    NO    PRI    null        
col2    DECIMAL128(38)    YES        null        
select table_name,COLUMN_NAME, data_type,is_nullable from information_schema.columns where table_name like 'primary01' and COLUMN_NAME not like '__mo%';
table_name    column_name    data_type    is_nullable
primary01    col1new    INT    NO
primary01    col2    DECIMAL128    YES
drop table primary01;
drop table if exists foreign01;
create table foreign01(col1 int primary key,
col2 varchar(20),
col3 int,
col4 bigint);
drop table if exists foreign02;
create table foreign02(col1 int,
col2 int,
col3 int primary key,
constraint `c1` foreign key(col1) references foreign01(col1));
show create table foreign01;
Table    Create Table
foreign01    CREATE TABLE `foreign01` (\n`col1` INT NOT NULL,\n`col2` VARCHAR(20) DEFAULT NULL,\n`col3` INT DEFAULT NULL,\n`col4` BIGINT DEFAULT NULL,\nPRIMARY KEY (`col1`)\n)
show create table foreign02;
Table    Create Table
foreign02    CREATE TABLE `foreign02` (\n`col1` INT DEFAULT NULL,\n`col2` INT DEFAULT NULL,\n`col3` INT NOT NULL,\nPRIMARY KEY (`col3`),\nCONSTRAINT `c1` FOREIGN KEY (`col1`) REFERENCES `foreign01` (`col1`) ON DELETE RESTRICT ON UPDATE RESTRICT\n)
insert into foreign01 values(1,'sfhuwe',1,1);
insert into foreign01 values(2,'37829901k3d',2,2);
insert into foreign02 values(1,1,1);
insert into foreign02 values(2,2,2);
select * from foreign01;
col1    col2    col3    col4
1    sfhuwe    1    1
2    37829901k3d    2    2
select * from foreign02;
col1    col2    col3
1    1    1
2    2    2
alter table foreign01 rename column col1 to col1New;
alter table foreign02 rename column col1 to `Colnewcolumn`;
show create table foreign01;
Table    Create Table
foreign01    CREATE TABLE `foreign01` (\n`col1new` INT NOT NULL,\n`col2` VARCHAR(20) DEFAULT NULL,\n`col3` INT DEFAULT NULL,\n`col4` BIGINT DEFAULT NULL,\nPRIMARY KEY (`col1new`)\n)
show create table foreign02;
Table    Create Table
foreign02    CREATE TABLE `foreign02` (\n`colnewcolumn` INT DEFAULT NULL,\n`col2` INT DEFAULT NULL,\n`col3` INT NOT NULL,\nPRIMARY KEY (`col3`),\nCONSTRAINT `c1` FOREIGN KEY (`colnewcolumn`) REFERENCES `foreign01` (`col1new`) ON DELETE RESTRICT ON UPDATE RESTRICT\n)
alter table foreign01 change col2 col2New varchar(100);
alter table foreign02 change col2 col2new double after col3;
insert into foreign01 values(3,'bcguwgheinwqneku678',2,2);
insert into foreign02 values(6,6,6);
internal error: Cannot add or update a child row: a foreign key constraint fails
delete from foreign01 where col2New = 'sfhuwe';
internal error: Cannot delete or update a parent row: a foreign key constraint fails
delete from foreign02 where col2New = 2;
update foreign01 set col2 = 'database ewueh ' where col1 = 1;
internal error: column 'col2' not found in table 
update foreign01 set col1new = 9283923 where col1new = 1;
internal error: Cannot delete or update a parent row: a foreign key constraint fails
select * from foreign01;
col1new    col2new    col3    col4
1    sfhuwe    1    1
2    37829901k3d    2    2
3    bcguwgheinwqneku678    2    2
select * from foreign02;
colnewcolumn    col3    col2new
1    1    1.0
show create table foreign01;
Table    Create Table
foreign01    CREATE TABLE `foreign01` (\n`col1new` INT NOT NULL,\n`col2new` VARCHAR(100) DEFAULT NULL,\n`col3` INT DEFAULT NULL,\n`col4` BIGINT DEFAULT NULL,\nPRIMARY KEY (`col1new`)\n)
show create table foreign02;
Table    Create Table
foreign02    CREATE TABLE `foreign02` (\n`colnewcolumn` INT DEFAULT NULL,\n`col3` INT NOT NULL,\n`col2new` DOUBLE DEFAULT NULL,\nPRIMARY KEY (`col3`),\nCONSTRAINT `c1` FOREIGN KEY (`colnewcolumn`) REFERENCES `foreign01` (`col1new`) ON DELETE RESTRICT ON UPDATE RESTRICT\n)
show columns from foreign01;
Field    Type    Null    Key    Default    Extra    Comment
col1new    INT(32)    NO    PRI    null        
col2new    VARCHAR(100)    YES        null        
col3    INT(32)    YES        null        
col4    BIGINT(64)    YES        null        
show columns from foreign02;
Field    Type    Null    Key    Default    Extra    Comment
colnewcolumn    INT(32)    YES    MUL    null        
col3    INT(32)    NO    PRI    null        
col2new    DOUBLE(0)    YES        null        
select table_name,COLUMN_NAME, data_type,is_nullable from information_schema.columns where table_name like 'foreign01' and COLUMN_NAME not like '__mo%';
table_name    column_name    data_type    is_nullable
foreign01    col1new    INT    NO
foreign01    col2new    VARCHAR    YES
foreign01    col3    INT    YES
foreign01    col4    BIGINT    YES
select table_name,COLUMN_NAME, data_type,is_nullable from information_schema.columns where table_name like 'foreign02' and COLUMN_NAME not like '__mo%';
table_name    column_name    data_type    is_nullable
foreign02    col2new    DOUBLE    YES
foreign02    col3    INT    NO
foreign02    colnewcolumn    INT    YES
drop table foreign02;
drop table foreign01;
drop table if exists index01;
CREATE TABLE index01(a INTEGER not null , b CHAR(10), c date, d decimal(7,2), UNIQUE KEY(a, b));
show create table index01;
Table    Create Table
index01    CREATE TABLE `index01` (\n`a` INT NOT NULL,\n`b` CHAR(10) DEFAULT NULL,\n`c` DATE DEFAULT NULL,\n`d` DECIMAL(7,2) DEFAULT NULL,\nUNIQUE KEY `a` (`a`,`b`)\n)
insert into index01 values(1, 'ab', '1980-12-17', 800);
insert into index01 values(2, 'ac', '1981-02-20', 1600);
insert into index01 values(3, 'ad', '1981-02-22', 500);
select * from index01;
a    b    c    d
1    ab    1980-12-17    800.00
2    ac    1981-02-20    1600.00
3    ad    1981-02-22    500.00
alter table index01 rename column b to bNew;
show create table index01;
Table    Create Table
index01    CREATE TABLE `index01` (\n`a` INT NOT NULL,\n`bnew` CHAR(10) DEFAULT NULL,\n`c` DATE DEFAULT NULL,\n`d` DECIMAL(7,2) DEFAULT NULL,\nUNIQUE KEY `a` (`a`,`bnew`)\n)
show index from index01;
Table    Non_unique    Key_name    Seq_in_index    Column_name    Collation    Cardinality    Sub_part    Packed    Null    Index_type    Comment    Index_comment    Index_params    Visible    Expression
index01    0    a    1    a    A    0    NULL    NULL                        YES    NULL
index01    0    a    2    bnew    A    0    NULL    NULL    YES                    YES    NULL
insert into index01 (a, b, c, d) values (5, 'bh', '1999-01-01', 3000);
Unknown column 'b' in 'index01'
insert into index01 (a, bnew, c, d) values (5, 'bh', '1999-01-01', 3000);
select * from index01;
a    bnew    c    d
1    ab    1980-12-17    800.00
2    ac    1981-02-20    1600.00
3    ad    1981-02-22    500.00
5    bh    1999-01-01    3000.00
delete from index01 where b = 'ab';
invalid input: column b does not exist
delete from index01 where bneW = 'ab';
select * from index01;
a    bnew    c    d
2    ac    1981-02-20    1600.00
3    ad    1981-02-22    500.00
5    bh    1999-01-01    3000.00
update index01 set c = '2022-12-12' where bNew = 'ac';
select * from index01;
a    bnew    c    d
3    ad    1981-02-22    500.00
5    bh    1999-01-01    3000.00
2    ac    2022-12-12    1600.00
show columns from index01;
Field    Type    Null    Key    Default    Extra    Comment
a    INT(32)    NO    UNI    null        
bnew    CHAR(10)    YES    UNI    null        
c    DATE(0)    YES        null        
d    DECIMAL64(7)    YES        null        
select table_name,COLUMN_NAME, data_type,is_nullable from information_schema.columns where table_name like 'index01' and COLUMN_NAME not like '__mo%';
table_name    column_name    data_type    is_nullable
index01    a    INT    NO
index01    bnew    CHAR    YES
index01    c    DATE    YES
index01    d    DECIMAL64    YES
drop table index01;
drop table if exists index02;
CREATE TABLE index02(a INTEGER PRIMARY KEY, b CHAR(10), c date, d decimal(7,2), INDEX(a, b), KEY(c));
insert into index02 values(1, 'ab', '1980-12-17', 800);
insert into index02 values(2, 'ac', '1981-02-20', 1600);
insert into index02 values(3, 'ad', '1981-02-22', 500);
select * from index02;
a    b    c    d
1    ab    1980-12-17    800.00
2    ac    1981-02-20    1600.00
3    ad    1981-02-22    500.00
alter table index02 rename column b to bNewNew;
show create table index02;
Table    Create Table
index02    CREATE TABLE `index02` (\n`a` INT NOT NULL,\n`bnewnew` CHAR(10) DEFAULT NULL,\n`c` DATE DEFAULT NULL,\n`d` DECIMAL(7,2) DEFAULT NULL,\nPRIMARY KEY (`a`),\nKEY `a` (`a`,`bnewnew`),\nKEY `c` (`c`)\n)
insert into index02 values (4, 'ab', '2000-10-10', 10000);
insert into index02 values (5, 'gh', '1999-12-31', 20000);
delete from index02 where bnewnew = 'ab';
update index02 set bnewnew = 'database' where bnewnEW = 'ad';
select * from index02;
a    bnewnew    c    d
2    ac    1981-02-20    1600.00
5    gh    1999-12-31    20000.00
3    database    1981-02-22    500.00
show index from index02;
Table    Non_unique    Key_name    Seq_in_index    Column_name    Collation    Cardinality    Sub_part    Packed    Null    Index_type    Comment    Index_comment    Index_params    Visible    Expression
index02    1    a    1    a    A    0    NULL    NULL                        YES    NULL
index02    1    a    2    bnewnew    A    0    NULL    NULL    YES                    YES    NULL
index02    1    c    1    c    A    0    NULL    NULL    YES                    YES    NULL
index02    0    PRIMARY    1    a    A    0    NULL    NULL                        YES    NULL
show columns from index02;
Field    Type    Null    Key    Default    Extra    Comment
a    INT(32)    NO    PRI    null        
bnewnew    CHAR(10)    YES    MUL    null        
c    DATE(0)    YES    MUL    null        
d    DECIMAL64(7)    YES        null        
select table_name,COLUMN_NAME, data_type,is_nullable from information_schema.columns where table_name like 'index02' and COLUMN_NAME not like '__mo%';
table_name    column_name    data_type    is_nullable
index02    a    INT    NO
index02    bnewnew    CHAR    YES
index02    c    DATE    YES
index02    d    DECIMAL64    YES
select * from index02;
a    bnewnew    c    d
2    ac    1981-02-20    1600.00
5    gh    1999-12-31    20000.00
3    database    1981-02-22    500.00
drop table if exists cluster01;
create table cluster01(a tinyint primary key, b smallint signed, c int unsigned,d bigint not null);
insert into cluster01 (a, b, c, d) values (1, 255, 438, 7328832832);
alter table cluster01 rename column a to `NewA`;
alter table cluster01 rename column `newa` to `NewAAAAAAAA`;
show create table cluster01;
Table    Create Table
cluster01    CREATE TABLE `cluster01` (\n`newaaaaaaaa` TINYINT NOT NULL,\n`b` SMALLINT DEFAULT NULL,\n`c` INT UNSIGNED DEFAULT NULL,\n`d` BIGINT NOT NULL,\nPRIMARY KEY (`newaaaaaaaa`)\n)
insert into cluster01 (a, b, c, d) values (-32, 32832, 8329, 893434);
Unknown column 'a' in 'cluster01'
insert into cluster01 (NewAAAAAAAA, b, c, d) values (-32, 32, 8329, 893434);
select * from cluster01;
newaaaaaaaa    b    c    d
1    255    438    7328832832
-32    32    8329    893434
show columns from cluster01;
Field    Type    Null    Key    Default    Extra    Comment
newaaaaaaaa    TINYINT(8)    NO    PRI    null        
b    SMALLINT(16)    YES        null        
c    INT UNSIGNED(32)    YES        null        
d    BIGINT(64)    NO        null        
select table_name,COLUMN_NAME, data_type,is_nullable from information_schema.columns where table_name like 'cluster01' and COLUMN_NAME not like '__mo%';
table_name    column_name    data_type    is_nullable
cluster01    b    SMALLINT    YES
cluster01    c    INT UNSIGNED    YES
cluster01    d    BIGINT    NO
cluster01    newaaaaaaaa    TINYINT    NO
drop table cluster01;
drop table if exists temporary01;
create table temporary01 (col1 int, col2 decimal);
insert into temporary01 (col1, col2) values (3728937, 37283.3232);
alter table temporary01 rename column col1 to `UUUYGGBBJBJ`;
insert into temporary01 (col1, col2) values (-32893, -89232);
Unknown column 'col1' in 'temporary01'
insert into temporary01 (`UUUYGGBBJBJ`, col2) values (-32893, -89232);
select * from temporary01;
uuuyggbbjbj    col2
3728937    37283
-32893    -89232
show columns from temporary01;
Field    Type    Null    Key    Default    Extra    Comment
uuuyggbbjbj    INT(32)    YES        null        
col2    DECIMAL128(38)    YES        null        
select table_name,COLUMN_NAME, data_type,is_nullable from information_schema.columns where table_name like 'temporary01' and COLUMN_NAME not like '__mo%';
table_name    column_name    data_type    is_nullable
temporary01    col2    DECIMAL128    YES
temporary01    uuuyggbbjbj    INT    YES
drop table temporary01;
drop table if exists ex_table_2_1;
create external table ex_table_2_1(num_col1 tinyint,num_col2 smallint,num_col3 int,num_col4 bigint,num_col5 tinyint unsigned,num_col6 smallint unsigned,num_col7 int unsigned,num_col8 bigint unsigned ,num_col9 float(5,3),num_col10 double(6,5),num_col11 decimal(38,19))infile{"filepath"='$resources/external_table_file/ex_table_2_1.csv'} fields terminated by ',' enclosed by '\"' lines terminated by '\n';
alter table ex_table_2_1 rename column num_col1 to newnum_col1;
You have an error in your SQL syntax; check the manual that corresponds to your MatrixOne server version for the right syntax to use. error field terminator at line 13 column 109 near " '""' LINES TERMINATED BY '\\n'";
alter table ex_table_2_1 rename column num_col2 to `shurhenwjkrferveg`;
You have an error in your SQL syntax; check the manual that corresponds to your MatrixOne server version for the right syntax to use. error field terminator at line 13 column 109 near " '""' LINES TERMINATED BY '\\n'";
show create table ex_table_2_1;
Table    Create Table
ex_table_2_1    CREATE EXTERNAL TABLE `ex_table_2_1` (\n`num_col1` TINYINT DEFAULT NULL,\n`num_col2` SMALLINT DEFAULT NULL,\n`num_col3` INT DEFAULT NULL,\n`num_col4` BIGINT DEFAULT NULL,\n`num_col5` TINYINT UNSIGNED DEFAULT NULL,\n`num_col6` SMALLINT UNSIGNED DEFAULT NULL,\n`num_col7` INT UNSIGNED DEFAULT NULL,\n`num_col8` BIGINT UNSIGNED DEFAULT NULL,\n`num_col9` FLOAT(5,3) DEFAULT NULL,\n`num_col10` DOUBLE(6,5) DEFAULT NULL,\n`num_col11` DECIMAL(38,19) DEFAULT NULL\n) INFILE{'FILEPATH'='','COMPRESSION'='','FORMAT'='','JSONDATA'=''} FIELDS TERMINATED BY ',' ENCLOSED BY '"' LINES TERMINATED BY '\n'
select * from ex_table_2_1;
internal error: the input value 'abc' is not int8 type for column 0
drop table if exists view01;
drop table if exists view02;
drop view if exists v0;
create table view01 (a int);
insert into view01 values (1),(2);
create table view02 (a int);
insert into view02 values (1);
alter table view01 rename column a to `cwhuenwjfdwcweffcfwef`;
alter table view02 rename column a to `cwhuenwjfdwcweffcfwef`;
show columns from view01;
Field    Type    Null    Key    Default    Extra    Comment
cwhuenwjfdwcweffcfwef    INT(32)    YES        null        
show columns from view02;
Field    Type    Null    Key    Default    Extra    Comment
cwhuenwjfdwcweffcfwef    INT(32)    YES        null        
show create table view01;
Table    Create Table
view01    CREATE TABLE `view01` (\n`cwhuenwjfdwcweffcfwef` INT DEFAULT NULL\n)
show create table view02;
Table    Create Table
view02    CREATE TABLE `view02` (\n`cwhuenwjfdwcweffcfwef` INT DEFAULT NULL\n)
create view v0 as select view01.a, view02.a as b from view01 left join view02 using(a);
invalid input: column 'a' specified in USING clause does not exist in left table
create view v0 as select view01.cwhuenwjfdwcweffcfwef, view02.cwhuenwjfdwcweffcfwef as b from view01 left join view02 using(cwhuenwjfdwcweffcfwef);
show create view v0;
View    Create View    character_set_client    collation_connection
v0    create view v0 as select view01.cwhuenwjfdwcweffcfwef, view02.cwhuenwjfdwcweffcfwef as b from view01 left join view02 using(cwhuenwjfdwcweffcfwef);    utf8mb4    utf8mb4_general_ci
drop table view01;
drop table view02;
drop role if exists role_r1;
drop user if exists role_u1;
create role role_r1;
create user role_u1 identified by '111' default role role_r1;
drop table if exists rename01;
create table rename01(col1 int);
insert into rename01 values(1);
insert into rename01 values(2);
grant create database on account * to role_r1;
grant show databases on account * to role_r1;
grant connect on account * to role_r1;
grant select on table * to role_r1;
grant show tables on database * to role_r1;
use test;
alter table rename01 rename column col1 to newCol1;
internal error: do not have privilege to execute the statement
grant alter table on database * to role_r1;
use test;
alter table rename01 rename column col1 to newRename;
alter table rename01 rename column newRename to `newNewRename`;
show create table rename01;
Table    Create Table
rename01    CREATE TABLE `rename01` (\n`newnewrename` INT DEFAULT NULL\n)
show columns from rename01;
Field    Type    Null    Key    Default    Extra    Comment
newnewrename    INT(32)    YES        null        
drop table rename01;
drop role role_r1;
drop user role_u1;
drop table if exists prepare01;
create table prepare01(col1 int, col2 char);
insert into prepare01 values (1,'a'),(2,'b'),(3,'c');
prepare s1 from 'alter table prepare01 rename column col1 to col1dheuwhvcer';
execute s1;
show create table prepare01;
Table    Create Table
prepare01    CREATE TABLE `prepare01` (\n`col1dheuwhvcer` INT DEFAULT NULL,\n`col2` CHAR(1) DEFAULT NULL\n)
prepare s2 from 'alter table prepare01 rename column col1dheuwhvcer to col1';
execute s2;
show create table prepare01;
Table    Create Table
prepare01    CREATE TABLE `prepare01` (\n`col1` INT DEFAULT NULL,\n`col2` CHAR(1) DEFAULT NULL\n)
show columns from prepare01;
Field    Type    Null    Key    Default    Extra    Comment
col1    INT(32)    YES        null        
col2    CHAR(1)    YES        null        
update prepare01 set col1 = 2147483647 where col2 = 'c';
delete from prepare01 where col2 = 'b';
insert into prepare01 values (42342, '3');
select * from prepare01;
col1    col2
1    a
2147483647    c
42342    3
drop table prepare01;
drop database test;
