drop database if exists expression_default_colref_28450;
create database expression_default_colref_28450;
use expression_default_colref_28450;
create table t_chain (
id int primary key,
a int,
b int default (a + 1),
c int default (b + 1),
key idx_b (b)
);
insert into t_chain (id, a) values (1, 10), (2, 20);
insert into t_chain (id, a, b, c) values (3, 30, default, default);
prepare expression_default_insert from 'insert into t_chain (id, a, b, c) values (?, ?, default, default)';
set @expression_default_id = 4;
set @expression_default_a = 40;
execute expression_default_insert using @expression_default_id, @expression_default_a;
deallocate prepare expression_default_insert;
select id, a, b, c from t_chain order by id;
id    a    b    c
1    10    11    12
2    20    21    22
3    30    31    32
4    40    41    42
select id, b from t_chain where b between 11 and 41 order by id;
id    b
1    11
2    21
3    31
4    41
create table t_volatile (
id int primary key,
a double default (rand()),
b double default (a)
);
insert into t_volatile (id) values (1), (2);
insert into t_volatile (id, b) values (3, default), (4, 7);
select id,
case when a = b then 'same-source' else 're-evaluated' end as dependency,
case when b = 7 then 'explicit' else 'default' end as b_origin
from t_volatile order by id;
id    dependency    b_origin
1    same-source    default
2    same-source    default
3    same-source    default
4    re-evaluated    explicit
create table t_generated_volatile (
id int primary key,
a double default (rand()),
g double generated always as (a) stored
);
insert into t_generated_volatile (id) values (1), (2);
select id,
case when a = g then 'same-source' else 're-evaluated' end as dependency
from t_generated_volatile order by id;
id    dependency
1    same-source
2    same-source
replace into t_generated_volatile (id) values (1);
select id,
case when a = g then 'same-source' else 're-evaluated' end as dependency
from t_generated_volatile order by id;
id    dependency
1    same-source
2    same-source
create table t_rows (
id int primary key,
a int,
b int default (a + 1)
);
insert into t_rows (id, a, b) values (1, 10, default), (2, 20, 99), (3, null, default);
insert into t_rows (b, id, a) values (default, 4, 40);
select id, a, b from t_rows order by id;
id    a    b
1    10    11
2    20    99
3    null    null
4    40    41
create table t_select_source (id int, a int);
insert into t_select_source values (5, 50), (6, null);
create table t_select (
id int primary key,
a int,
b int default (a + 1)
);
insert into t_select (id, a) select id, a from t_select_source;
select id, a, b from t_select order by id;
id    a    b
5    50    51
6    null    null
create table t_update (
id int primary key,
a int default 5,
b int default (a + 1)
);
insert into t_update values (1, 10, 20);
update t_update set a = 100 where id = 1;
select id, a, b from t_update;
id    a    b
1    100    20
update t_update set a = default, b = default where id = 1;
select id, a, b from t_update;
id    a    b
1    5    6
create table t_replace (
id int primary key,
a int default 7,
b int default (a + 1)
);
insert into t_replace values (1, 10, 20);
replace into t_replace (id) values (1);
select id, a, b from t_replace;
id    a    b
1    7    8
create table t_odku (
id int primary key,
a int default 8,
b int default (a + 1)
);
insert into t_odku values (1, 10, 20);
insert into t_odku (id) values (1) on duplicate key update a = default, b = default;
select id, a, b from t_odku;
id    a    b
1    8    9
create table t_alter (a int, c int);
insert into t_alter values (1, 10), (2, 20);
alter table t_alter add column b int default (a + c);
select a, b, c from t_alter order by a;
a    b    c
1    11    10
2    22    20
alter table t_alter modify column b int default (c + 1) first;
insert into t_alter (a, c) values (10, 20);
select b, a, c from t_alter order by a;
b    a    c
11    1    10
22    2    20
21    10    20
create table t_ctas (
a int,
b int default (a + 1)
) as select 10 as a;
insert into t_ctas (a) values (20);
select a, b from t_ctas order by a;
a    b
10    11
20    21
create table t_ctas_expression (
a int default (1 + 1),
b int default (a + 1)
) as select 10 as a;
invalid input: default expression for column 'b' cannot refer to column 'a' defined after it when that column has an expression default
select count(*) as unpublished from information_schema.tables where table_schema = database() and table_name = 't_ctas_expression';
unpublished
0
create table t_ctas_source (a int, b int default (a + 1));
insert into t_ctas_source (a) values (10);
create table t_ctas_source_reordered as select b, a from t_ctas_source;
insert into t_ctas_source_reordered (a) values (20);
select b, a from t_ctas_source_reordered order by a;
b    a
11    10
21    20
create table t_ctas_explicit_override_source (a int, b int default (a + 1));
insert into t_ctas_explicit_override_source (a) values (10);
create table t_ctas_explicit_override (b int default 0)
as select b from t_ctas_explicit_override_source;
select b from t_ctas_explicit_override;
b
11
insert into t_ctas_explicit_override values ();
select b from t_ctas_explicit_override order by b;
b
0
11
create table t_ctas_explicit_reference_source (a int, b int default (a + 1), c int);
insert into t_ctas_explicit_reference_source (a, c) values (10, 30);
create table t_ctas_explicit_reference (
b int default (c + 10),
c int,
x int default (100)
) as select b, c from t_ctas_explicit_reference_source;
select x, b, c from t_ctas_explicit_reference;
x    b    c
100    11    30
insert into t_ctas_explicit_reference (c) values (50);
select x, b, c from t_ctas_explicit_reference order by c;
x    b    c
100    11    30
100    60    50
create table t_ctas_missing_source as select b from t_ctas_explicit_override_source;
invalid input: cannot inherit default for CTAS column 'b': source column position 0 is not in the SELECT output
create table t_move (a int, b int default (a + 1), c int);
insert into t_move (a, c) values (10, 30);
alter table t_move modify column a int after b;
insert into t_move (a, c) values (20, 40);
select a, b, c from t_move order by a;
a    b    c
10    11    30
20    21    40
create table t_like like t_chain;
insert into t_like (id, a) values (10, 50);
select id, a, b, c from t_like;
id    a    b    c
10    50    51    52
create table t_load(a bigint, b bigint, c bigint default (a+1), d bigint default (c+1));
load data inline format='csv', data='20,10\n40,30\n' into table t_load fields terminated by ',' (b,a);
select a,b,c,d from t_load order by a;
a    b    c    d
10    20    11    12
30    40    31    32
load data inline format='csv', data='50\n' into table t_load fields terminated by ',' (b);
select b, c is null as null_c, d is null as null_d from t_load where b=50;
b    null_c    null_d
50    1    1
create table t_load_volatile(id int, a double default (rand()), b double default (a));
load data inline format='csv', data='1\n2\n' into table t_load_volatile fields terminated by ',' (id);
select id, a=b as same_source from t_load_volatile order by id;
id    same_source
1    1
2    1
load data inline format='csv', data='3,7\n' into table t_load_volatile fields terminated by ',' (id,b);
select id,b from t_load_volatile where id=3;
id    b
3    7
create table t_ctas_src(a bigint, b bigint default (a+a));
insert into t_ctas_src(a) values(3);
create table t_ctas_type(a varchar(20)) as select a,b from t_ctas_src;
insert into t_ctas_type(a) values('10');
select a,b from t_ctas_type order by b;
a    b
3    6
10    1010
create table t_ctas_alias as select a as x,b from t_ctas_src;
create table t_ctas_alias_copy like t_ctas_alias;
insert into t_ctas_alias_copy(x) values(7);
select x,b from t_ctas_alias_copy;
x    b
7    14
drop database expression_default_colref_28450;
