drop database if exists test_generated_col;
create database test_generated_col;
use test_generated_col;
create table t1 (a int, b int, c int generated always as (a + b) stored);
show create table t1;
➤ Table[12,-1,0]  ¦  Create Table[12,-1,0]  𝄀
t1  ¦  CREATE TABLE `t1` (
  `a` int DEFAULT NULL,
  `b` int DEFAULT NULL,
  `c` int GENERATED ALWAYS AS ((a + b)) STORED
)
desc t1;
➤ Field[1,0,0]  ¦  Type[1,0,0]  ¦  Null[1,0,0]  ¦  Key[1,0,0]  ¦  Default[1,0,0]  ¦  Extra[1,0,0]  ¦  Comment[1,0,0]  𝄀
a  ¦  INT(32)  ¦  YES  ¦    ¦  null  ¦    ¦    𝄀
b  ¦  INT(32)  ¦  YES  ¦    ¦  null  ¦    ¦    𝄀
c  ¦  INT(32)  ¦  YES  ¦    ¦  null  ¦  STORED GENERATED  ¦  
insert into t1(a, b) values (1, 2);
insert into t1(a, b) values (10, 20), (100, 200);
select * from t1 order by a;
➤ a[4,32,0]  ¦  b[4,32,0]  ¦  c[4,32,0]  𝄀
1  ¦  2  ¦  3  𝄀
10  ¦  20  ¦  30  𝄀
100  ¦  200  ¦  300
insert into t1 values (5, 6);
select * from t1 order by a;
➤ a[4,32,0]  ¦  b[4,32,0]  ¦  c[4,32,0]  𝄀
1  ¦  2  ¦  3  𝄀
5  ¦  6  ¦  11  𝄀
10  ¦  20  ¦  30  𝄀
100  ¦  200  ¦  300
insert into t1(a, b) values (null, 3);
select * from t1 order by a;
➤ a[4,32,0]  ¦  b[4,32,0]  ¦  c[4,32,0]  𝄀
null  ¦  3  ¦  null  𝄀
1  ¦  2  ¦  3  𝄀
5  ¦  6  ¦  11  𝄀
10  ¦  20  ¦  30  𝄀
100  ¦  200  ¦  300
insert into t1(a, b, c) values (1, 2, 3);
invalid input: the value specified for generated column 'c' in table 't1' is not allowed
update t1 set c = 999 where a = 1;
invalid input: the value specified for generated column 'c' in table 't1' is not allowed
update t1 set a = 50, b = 60 where a = 10;
select * from t1 order by a;
➤ a[4,32,0]  ¦  b[4,32,0]  ¦  c[4,32,0]  𝄀
null  ¦  3  ¦  null  𝄀
1  ¦  2  ¦  3  𝄀
5  ¦  6  ¦  11  𝄀
50  ¦  60  ¦  110  𝄀
100  ¦  200  ¦  300
create table t2 (a int, b int, c int generated always as (a + b) stored, d int generated always as (a * b) stored);
insert into t2(a, b) values (3, 4);
select * from t2;
➤ a[4,32,0]  ¦  b[4,32,0]  ¦  c[4,32,0]  ¦  d[4,32,0]  𝄀
3  ¦  4  ¦  7  ¦  12
create table t3 (a int, b int, c int generated always as (a + b) stored, d int generated always as (c * 2) stored);
insert into t3(a, b) values (5, 10);
select * from t3;
➤ a[4,32,0]  ¦  b[4,32,0]  ¦  c[4,32,0]  ¦  d[4,32,0]  𝄀
5  ¦  10  ¦  15  ¦  30
create table t4 (x int, y int, z int as (x - y) stored);
show create table t4;
➤ Table[12,-1,0]  ¦  Create Table[12,-1,0]  𝄀
t4  ¦  CREATE TABLE `t4` (
  `x` int DEFAULT NULL,
  `y` int DEFAULT NULL,
  `z` int GENERATED ALWAYS AS ((x - y)) STORED
)
insert into t4(x, y) values (100, 30);
select * from t4;
➤ x[4,32,0]  ¦  y[4,32,0]  ¦  z[4,32,0]  𝄀
100  ¦  30  ¦  70
create table t5 (first_name varchar(50), last_name varchar(50), full_name varchar(101) generated always as (concat(first_name, ' ', last_name)) stored);
insert into t5(first_name, last_name) values ('John', 'Doe'), ('Jane', 'Smith');
select * from t5 order by first_name;
➤ first_name[12,-1,0]  ¦  last_name[12,-1,0]  ¦  full_name[12,-1,0]  𝄀
Jane  ¦  Smith  ¦  Jane Smith  𝄀
John  ¦  Doe  ¦  John Doe
create table t6 (id int primary key, val int, doubled int generated always as (val * 2) stored);
insert into t6(id, val) values (1, 10), (2, 20);
select * from t6 order by id;
➤ id[4,32,0]  ¦  val[4,32,0]  ¦  doubled[4,32,0]  𝄀
1  ¦  10  ¦  20  𝄀
2  ¦  20  ¦  40
update t6 set val = 15 where id = 1;
select * from t6 order by id;
➤ id[4,32,0]  ¦  val[4,32,0]  ¦  doubled[4,32,0]  𝄀
1  ¦  15  ¦  30  𝄀
2  ¦  20  ¦  40
create table t7 (a int, b int, c int generated always as (a + b) virtual);
show create table t7;
➤ Table[12,-1,0]  ¦  Create Table[12,-1,0]  𝄀
t7  ¦  CREATE TABLE `t7` (
  `a` int DEFAULT NULL,
  `b` int DEFAULT NULL,
  `c` int GENERATED ALWAYS AS ((a + b)) VIRTUAL
)
insert into t7(a, b) values (1, 2);
insert into t7(a, b) values (10, 20), (100, 200);
select * from t7 order by a;
➤ a[4,32,0]  ¦  b[4,32,0]  ¦  c[4,32,0]  𝄀
1  ¦  2  ¦  3  𝄀
10  ¦  20  ¦  30  𝄀
100  ¦  200  ¦  300
insert into t7 values (5, 6);
select * from t7 order by a;
➤ a[4,32,0]  ¦  b[4,32,0]  ¦  c[4,32,0]  𝄀
1  ¦  2  ¦  3  𝄀
5  ¦  6  ¦  11  𝄀
10  ¦  20  ¦  30  𝄀
100  ¦  200  ¦  300
insert into t7(a, b, c) values (1, 2, 3);
invalid input: the value specified for generated column 'c' in table 't7' is not allowed
update t7 set c = 999 where a = 1;
invalid input: the value specified for generated column 'c' in table 't7' is not allowed
update t7 set a = 50, b = 60 where a = 10;
select * from t7 order by a;
➤ a[4,32,0]  ¦  b[4,32,0]  ¦  c[4,32,0]  𝄀
1  ¦  2  ¦  3  𝄀
5  ¦  6  ¦  11  𝄀
50  ¦  60  ¦  110  𝄀
100  ¦  200  ¦  300
create table t8 (x int, y int, z int as (x * y));
show create table t8;
➤ Table[12,-1,0]  ¦  Create Table[12,-1,0]  𝄀
t8  ¦  CREATE TABLE `t8` (
  `x` int DEFAULT NULL,
  `y` int DEFAULT NULL,
  `z` int GENERATED ALWAYS AS ((x * y)) VIRTUAL
)
insert into t8(x, y) values (3, 7);
select * from t8;
➤ x[4,32,0]  ¦  y[4,32,0]  ¦  z[4,32,0]  𝄀
3  ¦  7  ¦  21
create table t9 (first_name varchar(50), last_name varchar(50), full_name varchar(101) generated always as (concat(first_name, ' ', last_name)) virtual);
insert into t9(first_name, last_name) values ('Alice', 'Bob');
select * from t9;
➤ first_name[12,-1,0]  ¦  last_name[12,-1,0]  ¦  full_name[12,-1,0]  𝄀
Alice  ¦  Bob  ¦  Alice Bob
create table t10 (a int, b int, c int as (a + b) virtual, d int as (c * 2) virtual);
insert into t10(a, b) values (5, 10);
select * from t10;
➤ a[4,32,0]  ¦  b[4,32,0]  ¦  c[4,32,0]  ¦  d[4,32,0]  𝄀
5  ¦  10  ¦  15  ¦  30
create table t11 (a int, b int, c int generated always as (a + b) stored, d varchar(100) as (concat(cast(a as varchar), '-', cast(b as varchar))) virtual);
desc t11;
➤ Field[1,0,0]  ¦  Type[1,0,0]  ¦  Null[1,0,0]  ¦  Key[1,0,0]  ¦  Default[1,0,0]  ¦  Extra[1,0,0]  ¦  Comment[1,0,0]  𝄀
a  ¦  INT(32)  ¦  YES  ¦    ¦  null  ¦    ¦    𝄀
b  ¦  INT(32)  ¦  YES  ¦    ¦  null  ¦    ¦    𝄀
c  ¦  INT(32)  ¦  YES  ¦    ¦  null  ¦  STORED GENERATED  ¦    𝄀
d  ¦  VARCHAR(100)  ¦  YES  ¦    ¦  null  ¦  VIRTUAL GENERATED  ¦  
show full columns from t11;
➤ Field[1,0,0]  ¦  Type[1,0,0]  ¦  Collation[1,0,0]  ¦  Null[1,0,0]  ¦  Key[1,0,0]  ¦  Default[1,0,0]  ¦  Extra[1,0,0]  ¦  Privileges[1,0,0]  ¦  Comment[1,0,0]  𝄀
a  ¦  INT(32)  ¦  null  ¦  YES  ¦    ¦  null  ¦    ¦  select,insert,update,references  ¦    𝄀
b  ¦  INT(32)  ¦  null  ¦  YES  ¦    ¦  null  ¦    ¦  select,insert,update,references  ¦    𝄀
c  ¦  INT(32)  ¦  null  ¦  YES  ¦    ¦  null  ¦  STORED GENERATED  ¦  select,insert,update,references  ¦    𝄀
d  ¦  VARCHAR(100)  ¦  null  ¦  YES  ¦    ¦  null  ¦  VIRTUAL GENERATED  ¦  select,insert,update,references  ¦  
select column_name, extra, generation_expression from information_schema.columns where table_schema = 'test_generated_col' and table_name = 't11' and column_name in ('a','b','c','d') order by ordinal_position;
➤ column_name[12,-1,0]  ¦  extra[12,-1,0]  ¦  generation_expression[12,-1,0]  𝄀
a  ¦    ¦    𝄀
b  ¦    ¦    𝄀
c  ¦  STORED GENERATED  ¦  (a + b)  𝄀
d  ¦  VIRTUAL GENERATED  ¦  concat(cast(a as varchar), '-', cast(b as varchar))
create table t12 (a int, b int, c int generated always as (a + b) stored);
alter table t12 drop column a;
internal error: Column 'a' has a generated column dependency on column 'c'
alter table t12 drop column b;
internal error: Column 'b' has a generated column dependency on column 'c'
create table t13 (a int, b int);
insert into t13 values (1,2),(3,4);
alter table t13 add column c int generated always as (a + b) stored;
desc t13;
➤ Field[1,0,0]  ¦  Type[1,0,0]  ¦  Null[1,0,0]  ¦  Key[1,0,0]  ¦  Default[1,0,0]  ¦  Extra[1,0,0]  ¦  Comment[1,0,0]  𝄀
a  ¦  INT(32)  ¦  YES  ¦    ¦  null  ¦    ¦    𝄀
b  ¦  INT(32)  ¦  YES  ¦    ¦  null  ¦    ¦    𝄀
c  ¦  INT(32)  ¦  YES  ¦    ¦  null  ¦  STORED GENERATED  ¦  
create table t14 (id int primary key, a int, b int, c int generated always as (a * b) stored);
replace into t14 (id, a, b) values (1, 3, 4);
select * from t14;
➤ id[4,32,0]  ¦  a[4,32,0]  ¦  b[4,32,0]  ¦  c[4,32,0]  𝄀
1  ¦  3  ¦  4  ¦  12
replace into t14 (id, a, b) values (1, 5, 6);
select * from t14;
➤ id[4,32,0]  ¦  a[4,32,0]  ¦  b[4,32,0]  ¦  c[4,32,0]  𝄀
1  ¦  5  ¦  6  ¦  30
create table t15 like t11;
show create table t15;
➤ Table[12,-1,0]  ¦  Create Table[12,-1,0]  𝄀
t15  ¦  CREATE TABLE `t15` (
  `a` int DEFAULT NULL,
  `b` int DEFAULT NULL,
  `c` int GENERATED ALWAYS AS ((a + b)) STORED,
  `d` varchar(100) GENERATED ALWAYS AS (concat(cast(a as varchar), '-', cast(b as varchar))) VIRTUAL
)
insert into t15 (a, b) values (10, 20);
select * from t15;
➤ a[4,32,0]  ¦  b[4,32,0]  ¦  c[4,32,0]  ¦  d[12,-1,0]  𝄀
10  ¦  20  ¦  30  ¦  10-20
create table t16 (a int, b int, c int generated always as (a + b) stored, index idx_c (c));
insert into t16 (a, b) values (1,2),(3,4),(5,6);
select * from t16 where c = 7;
➤ a[4,32,0]  ¦  b[4,32,0]  ¦  c[4,32,0]  𝄀
3  ¦  4  ¦  7
select * from t16 where c > 5 order by c;
➤ a[4,32,0]  ¦  b[4,32,0]  ¦  c[4,32,0]  𝄀
3  ¦  4  ¦  7  𝄀
5  ¦  6  ¦  11
create table t17 (a int, b int, c int, d int generated always as (a + b) stored);
alter table t17 drop column d;
desc t17;
➤ Field[1,0,0]  ¦  Type[1,0,0]  ¦  Null[1,0,0]  ¦  Key[1,0,0]  ¦  Default[1,0,0]  ¦  Extra[1,0,0]  ¦  Comment[1,0,0]  𝄀
a  ¦  INT(32)  ¦  YES  ¦    ¦  null  ¦    ¦    𝄀
b  ¦  INT(32)  ¦  YES  ¦    ¦  null  ¦    ¦    𝄀
c  ¦  INT(32)  ¦  YES  ¦    ¦  null  ¦    ¦  
create table t18 (a int, b int, c int not null generated always as (a + b) stored);
desc t18;
➤ Field[1,0,0]  ¦  Type[1,0,0]  ¦  Null[1,0,0]  ¦  Key[1,0,0]  ¦  Default[1,0,0]  ¦  Extra[1,0,0]  ¦  Comment[1,0,0]  𝄀
a  ¦  INT(32)  ¦  YES  ¦    ¦  null  ¦    ¦    𝄀
b  ¦  INT(32)  ¦  YES  ¦    ¦  null  ¦    ¦    𝄀
c  ¦  INT(32)  ¦  NO  ¦    ¦  null  ¦  STORED GENERATED  ¦  
insert into t18 (a, b) values (1, 2);
select * from t18;
➤ a[4,32,0]  ¦  b[4,32,0]  ¦  c[4,32,0]  𝄀
1  ¦  2  ¦  3
create table t19 (a int, b int);
alter table t19 change column a a int generated always as (a + 1) stored;
invalid input: generated column 'a' cannot refer to itself
drop database test_generated_col;
