create table p_table_01(col1 int,col2 varchar(25),col3 decimal(6,2))partition by key(col2)partitions 4;
insert into p_table_01 values (1,'mod',78.9),(2,'proto',0.34),(3,'mod',6.5),(4,'mode',9.0),(5,'make',662.9),(6,'io',88.92);
select * from `%!%p0%!%p_table_01`;
col1    col2    col3
5    make    662.90
select * from `%!%p1%!%p_table_01`;
col1    col2    col3
2    proto    0.34
select * from `%!%p2%!%p_table_01`;
col1    col2    col3
1    mod    78.90
3    mod    6.50
4    mode    9.00
select * from `%!%p3%!%p_table_01`;
col1    col2    col3
6    io    88.92
show create table p_table_01;
Table    Create Table
p_table_01    CREATE TABLE `p_table_01` (\n`col1` INT DEFAULT NULL,\n`col2` VARCHAR(25) DEFAULT NULL,\n`col3` DECIMAL(6,2) DEFAULT NULL\n) partition by key algorithm = 2 (col2) partitions 4
create table p_table_02(col1 int,col2 char(25),col3 decimal(6,3),primary key(col1,col2))partition by key(col2)partitions 2;
insert into p_table_02 values (1,'mod',78.9),(2,'proto',0.34),(3,'mod',6.5),(4,'mode',9.0),(5,'make',662.9),(6,'io',88.92);
select * from `%!%p0%!%p_table_02`;
col1    col2    col3
1    mod    78.900
3    mod    6.500
4    mode    9.000
5    make    662.900
select * from `%!%p1%!%p_table_02`;
col1    col2    col3
2    proto    0.340
6    io    88.920
create table p_table_03(col1 int,col2 char(25),col3 decimal(4,2),primary key(col1,col2))partition by key(col2)partitions 4;
insert into p_table_03 values (1,'',78.9),(2,'proto',0.34),(3,'',6.5),(4,'mode',9.0),(5,'make',62.9),(6,'io',88.92);
select * from `%!%p0%!%p_table_03`;
col1    col2    col3
5    make    62.90
select * from `%!%p1%!%p_table_03`;
col1    col2    col3
1        78.90
2    proto    0.34
3        6.50
select * from `%!%p2%!%p_table_03`;
col1    col2    col3
4    mode    9.00
select * from `%!%p3%!%p_table_03`;
col1    col2    col3
6    io    88.92
show create table p_table_03;
Table    Create Table
p_table_03    CREATE TABLE `p_table_03` (\n`col1` INT NOT NULL,\n`col2` CHAR(25) NOT NULL,\n`col3` DECIMAL(4,2) DEFAULT NULL,\nPRIMARY KEY (`col1`,`col2`)\n) partition by key algorithm = 2 (col2) partitions 4
create table p_table_04(col1 int,col2 char(25) primary key,col3 decimal(4,2))partition by key()partitions 8;
insert into p_table_04 values (1,'mod',78.9),(2,'proto',0.34),(3,'mod',6.5),(4,'mode',9.0),(5,'make',62.9),(6,'io',88.92);
Duplicate entry 'mod' for key 'col2'
insert into p_table_04 values (1,'mod',78.9),(2,'proto',0.34),(3,'rep',6.5),(4,'test',9.0),(5,'make',62.9),(6,'io',88.92);
select * from `%!%p0%!%p_table_04`;
col1    col2    col3
5    make    62.90
select * from `%!%p1%!%p_table_04`;
col1    col2    col3
select * from `%!%p2%!%p_table_04`;
col1    col2    col3
1    mod    78.90
3    rep    6.50
select * from `%!%p3%!%p_table_04`;
col1    col2    col3
6    io    88.92
select * from `%!%p4%!%p_table_04`;
col1    col2    col3
select * from `%!%p5%!%p_table_04`;
col1    col2    col3
2    proto    0.34
4    test    9.00
select * from `%!%p6%!%p_table_04`;
col1    col2    col3
select * from `%!%p7%!%p_table_04`;
col1    col2    col3
create table p_table_05(col1 int,col2 char(25),col3 decimal(4,2),unique key k2(col2))partition by key()partitions 6;
invalid input: Field in list of fields for partition function not found in table
create table p_table_06(col1 int,col2 char(25),col3 decimal(6,3),unique key k2(col1,col2))partition by key(col2)partitions 4;
insert into p_table_06 values (1,'mod',78.9),(2,'proto',0.34),(3,'mod',6.5),(4,'mode',9.0),(5,'make',662.9),(6,'io',88.92);
select * from `%!%p0%!%p_table_06`;
col1    col2    col3
5    make    662.900
select * from `%!%p1%!%p_table_06`;
col1    col2    col3
2    proto    0.340
select * from `%!%p2%!%p_table_06`;
col1    col2    col3
1    mod    78.900
3    mod    6.500
4    mode    9.000
select * from `%!%p3%!%p_table_06`;
col1    col2    col3
6    io    88.920
create table p_table_07(col1 int,col2 char(25),col3 decimal(4,2),unique key k2(col1,col2))partition by key()partitions 8;
invalid input: Field in list of fields for partition function not found in table
create table p_table_07(col1 int,col2 char(25),col3 decimal(4,2))partition by key()partitions 8;
invalid input: Field in list of fields for partition function not found in table
create table p_table_07(col1 int,col2 char(25),col3 decimal(4,2),unique key k2(col1))partition by key(col2)partitions 8;
A PRIMARY KEY must include all columns in the table's partitioning function
create table p_table_07(col1 int unsigned,col2 date, col3 varchar(25),primary key(col1,col2) ,unique key k1(col3))partition by key(col1)partitions 4;
A PRIMARY KEY must include all columns in the table's partitioning function
create table p_table_08(col1 tinyint,col2 varchar(25),col3 decimal(6,2))partition by key(col1)partitions 4;
insert into p_table_08 values (34,'mod',78.9),(34,'proto',0.34),(-80,'mod',6.5),(-80,'mode',9.0),(59,'make',62.9),(59,'io',88.92);
select * from `%!%p0%!%p_table_08`;
col1    col2    col3
59    make    62.90
59    io    88.92
select * from `%!%p1%!%p_table_08`;
col1    col2    col3
select * from `%!%p2%!%p_table_08`;
col1    col2    col3
-80    mod    6.50
-80    mode    9.00
select * from `%!%p3%!%p_table_08`;
col1    col2    col3
34    mod    78.90
34    proto    0.34
drop table p_table_08;
create table p_table_08(col1 tinyint unsigned,col2 varchar(25),col3 decimal(6,2))partition by key(col1)partitions 4;
insert into p_table_08 values (34,'mod',78.9),(34,'proto',0.34),(80,'mod',6.5),(80,'mode',9.0),(59,'make',62.9),(59,'io',88.92);
select * from `%!%p0%!%p_table_08`;
col1    col2    col3
59    make    62.90
59    io    88.92
select * from `%!%p1%!%p_table_08`;
col1    col2    col3
select * from `%!%p2%!%p_table_08`;
col1    col2    col3
select * from `%!%p3%!%p_table_08`;
col1    col2    col3
34    mod    78.90
34    proto    0.34
80    mod    6.50
80    mode    9.00
drop table p_table_08;
create table p_table_08(col1 smallint ,col2 varchar(25),col3 decimal(6,2))partition by key(col1)partitions 4;
insert into p_table_08 values (34,'mod',78.9),(34,'proto',0.34),(80,'mod',6.5),(80,'mode',9.0),(59,'make',62.9),(59,'io',88.92);
select * from `%!%p0%!%p_table_08`;
col1    col2    col3
59    make    62.90
59    io    88.92
select * from `%!%p1%!%p_table_08`;
col1    col2    col3
select * from `%!%p2%!%p_table_08`;
col1    col2    col3
select * from `%!%p3%!%p_table_08`;
col1    col2    col3
34    mod    78.90
34    proto    0.34
80    mod    6.50
80    mode    9.00
drop table p_table_08;
create table p_table_08(col1 smallint unsigned ,col2 varchar(25),col3 decimal(6,2))partition by key(col1)partitions 4;
insert into p_table_08 values (34,'mod',78.9),(34,'proto',0.34),(80,'mod',6.5),(80,'mode',9.0),(59,'make',62.9),(59,'io',88.92);
select * from `%!%p0%!%p_table_08`;
col1    col2    col3
59    make    62.90
59    io    88.92
select * from `%!%p1%!%p_table_08`;
col1    col2    col3
select * from `%!%p2%!%p_table_08`;
col1    col2    col3
select * from `%!%p3%!%p_table_08`;
col1    col2    col3
34    mod    78.90
34    proto    0.34
80    mod    6.50
80    mode    9.00
create table p_table_09(col1 int,col2 date, col3 varchar(25))partition by key(col1,col2)partitions 4;
insert into p_table_09 values (72,'1999-09-29','res1'),(60,'1999-10-01','opt1'),(72,'1999-09-29','res2'),(60,'1999-10-01','opt2'), (200,'1999-10-29','oop1'),(200,'1999-10-29','oop1');
select * from `%!%p0%!%p_table_09`;
col1    col2    col3
60    1999-10-01    opt1
60    1999-10-01    opt2
select * from `%!%p1%!%p_table_09`;
col1    col2    col3
200    1999-10-29    oop1
200    1999-10-29    oop1
select * from `%!%p2%!%p_table_09`;
col1    col2    col3
72    1999-09-29    res1
72    1999-09-29    res2
select * from `%!%p3%!%p_table_09`;
col1    col2    col3
insert into p_table_09 values (900,'1999-09-29','res1'),(900,'1999-09-29','opt1'),(1000,'1999-10-01','res2'),(1000,'1999-10-01','opt2'), (200,'1999-10-29','oop1'),(200,'1999-10-29','oop1');
select * from `%!%p0%!%p_table_09`;
col1    col2    col3
60    1999-10-01    opt1
60    1999-10-01    opt2
select * from `%!%p1%!%p_table_09`;
col1    col2    col3
200    1999-10-29    oop1
200    1999-10-29    oop1
1000    1999-10-01    res2
1000    1999-10-01    opt2
200    1999-10-29    oop1
200    1999-10-29    oop1
select * from `%!%p2%!%p_table_09`;
col1    col2    col3
72    1999-09-29    res1
72    1999-09-29    res2
select * from `%!%p3%!%p_table_09`;
col1    col2    col3
900    1999-09-29    res1
900    1999-09-29    opt1
show create table p_table_09;
Table    Create Table
p_table_09    CREATE TABLE `p_table_09` (\n`col1` INT DEFAULT NULL,\n`col2` DATE DEFAULT NULL,\n`col3` VARCHAR(25) DEFAULT NULL\n) partition by key algorithm = 2 (col1, col2) partitions 4
create table p_table_10(col1 int unsigned,col2 date, col3 varchar(25),primary key(col1,col2))partition by key(col1)partitions 4;
insert into p_table_10 values (72,'1999-09-29','res1'),(60,'1999-10-01','opt1'),(72,'1999-10-02','res2'),(72,'1999-10-03','opt2'), (60,'1999-10-29','oop1'),(206,'1999-10-30','oop1');
select * from `%!%p0%!%p_table_10`;
col1    col2    col3
206    1999-10-30    oop1
select * from `%!%p1%!%p_table_10`;
col1    col2    col3
select * from `%!%p2%!%p_table_10`;
col1    col2    col3
select * from `%!%p3%!%p_table_10`;
col1    col2    col3
72    1999-09-29    res1
60    1999-10-01    opt1
72    1999-10-02    res2
72    1999-10-03    opt2
60    1999-10-29    oop1
select * from p_table_10 where col1<70;
col1    col2    col3
60    1999-10-01    opt1
60    1999-10-29    oop1
create table p_table_11(col1 int unsigned,col2 date, col3 varchar(25),unique key k1(col1,col2))partition by key(col1)partitions 4;
insert into p_table_11 values (72,'1999-09-29','res1'),(60,'1999-10-01','opt1'),(72,'1999-10-02','res2'),(72,'1999-10-03','opt2'), (60,'1999-10-29','oop1'),(206,'1999-10-30','oop1');
select * from `%!%p0%!%p_table_11`;
col1    col2    col3
206    1999-10-30    oop1
select * from `%!%p1%!%p_table_11`;
col1    col2    col3
select * from `%!%p2%!%p_table_11`;
col1    col2    col3
select * from `%!%p3%!%p_table_11`;
col1    col2    col3
72    1999-09-29    res1
60    1999-10-01    opt1
72    1999-10-02    res2
72    1999-10-03    opt2
60    1999-10-29    oop1
select * from p_table_11;
col1    col2    col3
206    1999-10-30    oop1
72    1999-09-29    res1
60    1999-10-01    opt1
72    1999-10-02    res2
72    1999-10-03    opt2
60    1999-10-29    oop1
create table p_table_12(col1 int unsigned,col2 date, col3 varchar(25),unique key k1(col1,col2))partition by key(col1)partitions 4;
insert into p_table_12 values (72,'1999-09-29','res1'),(NULL,'1999-10-01','opt1'),(72,'1999-10-02','res2'),(72,'1999-10-03','opt2'), (NULL,'1999-10-29','oop1'),(206,'1999-10-30','oop1');
select * from `%!%p0%!%p_table_12`;
col1    col2    col3
206    1999-10-30    oop1
select * from `%!%p1%!%p_table_12`;
col1    col2    col3
select * from `%!%p2%!%p_table_12`;
col1    col2    col3
null    1999-10-01    opt1
null    1999-10-29    oop1
select * from `%!%p3%!%p_table_12`;
col1    col2    col3
72    1999-09-29    res1
72    1999-10-02    res2
72    1999-10-03    opt2
select * from p_table_12 where col2='1999-09-29';
col1    col2    col3
72    1999-09-29    res1
create table p_table_13(col1 int primary key auto_increment,col2 char(25),col3 decimal(4,2))partition by key()partitions 2;
insert into p_table_13(col2,col3) values ('mod',78.9),('proto',0.34),('mod',6.5),('mode',9.0),('make',62.9),('io',88.92);
select * from `%!%p0%!%p_table_13`;
col1    col2    col3
3    mod    6.50
6    io    88.92
select * from `%!%p1%!%p_table_13`;
col1    col2    col3
1    mod    78.90
2    proto    0.34
4    mode    9.00
5    make    62.90
create table p_table_14(col1 bigint,col2 date,col3 varchar(25),col4 decimal(6,4))partition by key(col1,col2,col3)partitions 8;
insert into p_table_14 values (1000,'1999-09-29','res1',0.12),(6000,'1999-10-01','opt1',0.89),(729,'1999-10-02','res2',0.32),(6000,'1999-10-01','opt1',0.64), (6000,'1999-10-01','opt1',0.55),(206,'1999-10-30','oop1',0.87);
insert into p_table_14 values (1000,'1999-09-29','res1',0.12),(6000,'1999-10-01','opt1',0.89),(1000,'1999-09-29','res1',0.32),(206,'1999-10-30','oop1',0.64), (1000,'1999-09-29','res1',0.55),(206,'1999-10-30','oop1',0.87);
select * from `%!%p0%!%p_table_14`;
col1    col2    col3    col4
select * from `%!%p1%!%p_table_14`;
col1    col2    col3    col4
select * from `%!%p2%!%p_table_14`;
col1    col2    col3    col4
select * from `%!%p3%!%p_table_14`;
col1    col2    col3    col4
select * from `%!%p4%!%p_table_14`;
col1    col2    col3    col4
729    1999-10-02    res2    0.3200
select * from `%!%p5%!%p_table_14`;
col1    col2    col3    col4
206    1999-10-30    oop1    0.8700
206    1999-10-30    oop1    0.6400
206    1999-10-30    oop1    0.8700
select * from `%!%p6%!%p_table_14`;
col1    col2    col3    col4
1000    1999-09-29    res1    0.1200
6000    1999-10-01    opt1    0.8900
6000    1999-10-01    opt1    0.6400
6000    1999-10-01    opt1    0.5500
1000    1999-09-29    res1    0.1200
6000    1999-10-01    opt1    0.8900
1000    1999-09-29    res1    0.3200
1000    1999-09-29    res1    0.5500
select * from `%!%p7%!%p_table_14`;
col1    col2    col3    col4
select * from p_table_14 where col3 in ('opt1','res1');
col1    col2    col3    col4
1000    1999-09-29    res1    0.1200
6000    1999-10-01    opt1    0.8900
6000    1999-10-01    opt1    0.6400
6000    1999-10-01    opt1    0.5500
1000    1999-09-29    res1    0.1200
6000    1999-10-01    opt1    0.8900
1000    1999-09-29    res1    0.3200
1000    1999-09-29    res1    0.5500
insert into p_table_14 values (30,'1970-01-01','use',5.7), (30,'1970-01-01','kkk',9.8);
select * from `%!%p0%!%p_table_14`;
col1    col2    col3    col4
30    1970-01-01    kkk    9.8000
select * from `%!%p1%!%p_table_14`;
col1    col2    col3    col4
select * from `%!%p2%!%p_table_14`;
col1    col2    col3    col4
select * from `%!%p3%!%p_table_14`;
col1    col2    col3    col4
select * from `%!%p4%!%p_table_14`;
col1    col2    col3    col4
729    1999-10-02    res2    0.3200
select * from `%!%p5%!%p_table_14`;
col1    col2    col3    col4
206    1999-10-30    oop1    0.8700
206    1999-10-30    oop1    0.6400
206    1999-10-30    oop1    0.8700
select * from `%!%p6%!%p_table_14`;
col1    col2    col3    col4
1000    1999-09-29    res1    0.1200
6000    1999-10-01    opt1    0.8900
6000    1999-10-01    opt1    0.6400
6000    1999-10-01    opt1    0.5500
1000    1999-09-29    res1    0.1200
6000    1999-10-01    opt1    0.8900
1000    1999-09-29    res1    0.3200
1000    1999-09-29    res1    0.5500
select * from `%!%p7%!%p_table_14`;
col1    col2    col3    col4
30    1970-01-01    use    5.7000
update p_table_14 set col2='1999-01-01' where col2<'1999-10-02';
select * from p_table_14;
col1    col2    col3    col4
1000    1999-01-01    res1    0.1200
1000    1999-01-01    res1    0.1200
1000    1999-01-01    res1    0.3200
1000    1999-01-01    res1    0.5500
729    1999-10-02    res2    0.3200
206    1999-10-30    oop1    0.8700
206    1999-10-30    oop1    0.6400
206    1999-10-30    oop1    0.8700
6000    1999-01-01    opt1    0.8900
6000    1999-01-01    opt1    0.6400
6000    1999-01-01    opt1    0.5500
6000    1999-01-01    opt1    0.8900
30    1999-01-01    use    5.7000
30    1999-01-01    kkk    9.8000
select * from `%!%p0%!%p_table_14`;
col1    col2    col3    col4
select * from `%!%p1%!%p_table_14`;
col1    col2    col3    col4
select * from `%!%p2%!%p_table_14`;
col1    col2    col3    col4
select * from `%!%p3%!%p_table_14`;
col1    col2    col3    col4
1000    1999-01-01    res1    0.1200
1000    1999-01-01    res1    0.1200
1000    1999-01-01    res1    0.3200
1000    1999-01-01    res1    0.5500
select * from `%!%p4%!%p_table_14`;
col1    col2    col3    col4
729    1999-10-02    res2    0.3200
select * from `%!%p5%!%p_table_14`;
col1    col2    col3    col4
206    1999-10-30    oop1    0.8700
206    1999-10-30    oop1    0.6400
206    1999-10-30    oop1    0.8700
6000    1999-01-01    opt1    0.8900
6000    1999-01-01    opt1    0.6400
6000    1999-01-01    opt1    0.5500
6000    1999-01-01    opt1    0.8900
30    1999-01-01    use    5.7000
select * from `%!%p6%!%p_table_14`;
col1    col2    col3    col4
select * from `%!%p7%!%p_table_14`;
col1    col2    col3    col4
30    1999-01-01    kkk    9.8000
update p_table_14 set col4=0.999 where col1=1000;
select * from p_table_14 where col1>1000 ;
col1    col2    col3    col4
6000    1999-01-01    opt1    0.8900
6000    1999-01-01    opt1    0.6400
6000    1999-01-01    opt1    0.5500
6000    1999-01-01    opt1    0.8900
delete from p_table_14 where col3 in ('res1','res2');
select * from p_table_14;
col1    col2    col3    col4
206    1999-10-30    oop1    0.8700
206    1999-10-30    oop1    0.6400
206    1999-10-30    oop1    0.8700
6000    1999-01-01    opt1    0.8900
6000    1999-01-01    opt1    0.6400
6000    1999-01-01    opt1    0.5500
6000    1999-01-01    opt1    0.8900
30    1999-01-01    use    5.7000
30    1999-01-01    kkk    9.8000
select * from `%!%p0%!%p_table_14`;
col1    col2    col3    col4
select * from `%!%p1%!%p_table_14`;
col1    col2    col3    col4
select * from `%!%p2%!%p_table_14`;
col1    col2    col3    col4
select * from `%!%p3%!%p_table_14`;
col1    col2    col3    col4
select * from `%!%p4%!%p_table_14`;
col1    col2    col3    col4
select * from `%!%p5%!%p_table_14`;
col1    col2    col3    col4
206    1999-10-30    oop1    0.8700
206    1999-10-30    oop1    0.6400
206    1999-10-30    oop1    0.8700
6000    1999-01-01    opt1    0.8900
6000    1999-01-01    opt1    0.6400
6000    1999-01-01    opt1    0.5500
6000    1999-01-01    opt1    0.8900
30    1999-01-01    use    5.7000
select * from `%!%p6%!%p_table_14`;
col1    col2    col3    col4
select * from `%!%p7%!%p_table_14`;
col1    col2    col3    col4
30    1999-01-01    kkk    9.8000
truncate table p_table_14;
create table p_table_15(col1 bigint auto_increment,col2 date,col3 varchar(25),col4 decimal(6,4),primary key(col1,col2,col3))partition by key(col2)partitions 4;
insert into p_table_15(col2,col3,col4) values ('1999-09-29','res1',0.12),('1999-10-02','res2',0.32),('1999-10-01','opt1',0.64), ('1999-10-01','opt2',0.55),('1999-09-29','oop1',0.87);
insert into p_table_15(col2,col3,col4) values ('1999-09-29','res1',0.12),('1999-10-02','res2',0.32),('1999-10-01','opt1',0.64), ('1999-10-01','opt2',0.55),('1999-09-29','oop1',0.87);
select * from p_table_15;
col1    col2    col3    col4
2    1999-10-02    res2    0.3200
7    1999-10-02    res2    0.3200
3    1999-10-01    opt1    0.6400
4    1999-10-01    opt2    0.5500
8    1999-10-01    opt1    0.6400
9    1999-10-01    opt2    0.5500
1    1999-09-29    res1    0.1200
5    1999-09-29    oop1    0.8700
6    1999-09-29    res1    0.1200
10    1999-09-29    oop1    0.8700
select * from `%!%p0%!%p_table_15`;
col1    col2    col3    col4
2    1999-10-02    res2    0.3200
7    1999-10-02    res2    0.3200
select * from `%!%p1%!%p_table_15`;
col1    col2    col3    col4
3    1999-10-01    opt1    0.6400
4    1999-10-01    opt2    0.5500
8    1999-10-01    opt1    0.6400
9    1999-10-01    opt2    0.5500
select * from `%!%p2%!%p_table_15`;
col1    col2    col3    col4
select * from `%!%p3%!%p_table_15`;
col1    col2    col3    col4
1    1999-09-29    res1    0.1200
5    1999-09-29    oop1    0.8700
6    1999-09-29    res1    0.1200
10    1999-09-29    oop1    0.8700
truncate table p_table_15;
insert into p_table_15(col2,col3,col4) values ('1999-09-29','res1',0.12),('1999-10-02','res2',0.32),('1999-10-01','opt1',0.64), ('1999-10-01','opt2',0.55),('1999-09-29','oop1',0.87);
insert into p_table_15(col2,col3,col4) values ('1999-09-29','res1',0.12),('1999-10-02','res2',0.32),('1999-10-01','opt1',0.64), ('1999-10-01','opt2',0.55),('1999-09-29','oop1',0.87);
select * from p_table_15;
col1    col2    col3    col4
2    1999-10-02    res2    0.3200
7    1999-10-02    res2    0.3200
3    1999-10-01    opt1    0.6400
4    1999-10-01    opt2    0.5500
8    1999-10-01    opt1    0.6400
9    1999-10-01    opt2    0.5500
1    1999-09-29    res1    0.1200
5    1999-09-29    oop1    0.8700
6    1999-09-29    res1    0.1200
10    1999-09-29    oop1    0.8700
select * from `%!%p0%!%p_table_15`;
col1    col2    col3    col4
2    1999-10-02    res2    0.3200
7    1999-10-02    res2    0.3200
select * from `%!%p1%!%p_table_15`;
col1    col2    col3    col4
3    1999-10-01    opt1    0.6400
4    1999-10-01    opt2    0.5500
8    1999-10-01    opt1    0.6400
9    1999-10-01    opt2    0.5500
select * from `%!%p2%!%p_table_15`;
col1    col2    col3    col4
select * from `%!%p3%!%p_table_15`;
col1    col2    col3    col4
1    1999-09-29    res1    0.1200
5    1999-09-29    oop1    0.8700
6    1999-09-29    res1    0.1200
10    1999-09-29    oop1    0.8700
update  p_table_15 set col1=100 where col2='1999-09-29';
Duplicate entry '(100,1999-09-29,res1)' for key '__mo_cpkey_col'
update  p_table_15 set col2='2022-10-01' where col1>4;
select * from p_table_15;
col1    col2    col3    col4
2    1999-10-02    res2    0.3200
3    1999-10-01    opt1    0.6400
4    1999-10-01    opt2    0.5500
1    1999-09-29    res1    0.1200
7    2022-10-01    res2    0.3200
8    2022-10-01    opt1    0.6400
9    2022-10-01    opt2    0.5500
5    2022-10-01    oop1    0.8700
6    2022-10-01    res1    0.1200
10    2022-10-01    oop1    0.8700
select * from `%!%p0%!%p_table_15`;
col1    col2    col3    col4
2    1999-10-02    res2    0.3200
select * from `%!%p1%!%p_table_15`;
col1    col2    col3    col4
3    1999-10-01    opt1    0.6400
4    1999-10-01    opt2    0.5500
select * from `%!%p2%!%p_table_15`;
col1    col2    col3    col4
select * from `%!%p3%!%p_table_15`;
col1    col2    col3    col4
1    1999-09-29    res1    0.1200
7    2022-10-01    res2    0.3200
8    2022-10-01    opt1    0.6400
9    2022-10-01    opt2    0.5500
5    2022-10-01    oop1    0.8700
6    2022-10-01    res1    0.1200
10    2022-10-01    oop1    0.8700
delete from p_table_15 where col2='1999-09-29';
select * from p_table_15;
col1    col2    col3    col4
2    1999-10-02    res2    0.3200
3    1999-10-01    opt1    0.6400
4    1999-10-01    opt2    0.5500
7    2022-10-01    res2    0.3200
8    2022-10-01    opt1    0.6400
9    2022-10-01    opt2    0.5500
5    2022-10-01    oop1    0.8700
6    2022-10-01    res1    0.1200
10    2022-10-01    oop1    0.8700
select * from `%!%p0%!%p_table_15`;
col1    col2    col3    col4
2    1999-10-02    res2    0.3200
select * from `%!%p1%!%p_table_15`;
col1    col2    col3    col4
3    1999-10-01    opt1    0.6400
4    1999-10-01    opt2    0.5500
select * from `%!%p2%!%p_table_15`;
col1    col2    col3    col4
select * from `%!%p3%!%p_table_15`;
col1    col2    col3    col4
7    2022-10-01    res2    0.3200
8    2022-10-01    opt1    0.6400
9    2022-10-01    opt2    0.5500
5    2022-10-01    oop1    0.8700
6    2022-10-01    res1    0.1200
10    2022-10-01    oop1    0.8700
delete from p_table_15;
select * from p_table_15;
col1    col2    col3    col4
select * from `%!%p0%!%p_table_15`;
col1    col2    col3    col4
select * from `%!%p1%!%p_table_15`;
col1    col2    col3    col4
select * from `%!%p2%!%p_table_15`;
col1    col2    col3    col4
select * from `%!%p3%!%p_table_15`;
col1    col2    col3    col4
create table p_table_16(col1 bigint,col2 date,col3 varchar(25),col4 decimal(6,4),primary key(col1,col2,col3))partition by key(col2)partitions 8;
insert into p_table_16 values (1000,'1999-09-29','res1',0.12),(6000,'1999-10-01','opt1',0.89),(729,'1999-10-02','res2',0.32),(6000,'1999-10-01','opt1',0.64), (6000,'1999-10-01','opt1',0.55),(206,'1999-10-30','oop1',0.87);
Duplicate entry '(6000,1999-10-01,opt1)' for key '__mo_cpkey_col'
insert into p_table_16 values (1000,'0001-09-29','res1',0.12),(6000,'1999-10-11','opt1',0.89);
select * from p_table_16;
col1    col2    col3    col4
6000    1999-10-11    opt1    0.8900
1000    0001-09-29    res1    0.1200
create table p_table_temp(col1 bigint unsigned auto_increment,col2 date,col3 varchar(25),col4 decimal(6,4),primary key(col1,col2,col3));
insert into p_table_temp(col2,col3,col4) values ('1999-09-29','res1',0.12),('1999-10-02','res2',0.32),('1999-10-01','opt1',0.64), ('1999-10-01','opt2',0.55),('1999-09-29','oop1',0.87);
insert into p_table_temp(col2,col3,col4) values ('1999-09-29','res1',0.12),('1999-10-02','res2',0.32),('1999-10-01','opt1',0.64), ('1999-10-01','opt2',0.55),('1999-09-29','oop1',0.87);
create table p_table_17(col1 bigint unsigned auto_increment,col2 date,col3 varchar(25),col4 decimal(6,4),primary key(col1,col2,col3))partition by key(col2)partitions 4;
insert into p_table_17 select col1,col2,col3,col4 from p_table_temp;
select * from p_table_17;
col1    col2    col3    col4
2    1999-10-02    res2    0.3200
7    1999-10-02    res2    0.3200
3    1999-10-01    opt1    0.6400
4    1999-10-01    opt2    0.5500
8    1999-10-01    opt1    0.6400
9    1999-10-01    opt2    0.5500
1    1999-09-29    res1    0.1200
5    1999-09-29    oop1    0.8700
6    1999-09-29    res1    0.1200
10    1999-09-29    oop1    0.8700
select * from `%!%p0%!%p_table_17`;
col1    col2    col3    col4
2    1999-10-02    res2    0.3200
7    1999-10-02    res2    0.3200
select * from `%!%p1%!%p_table_17`;
col1    col2    col3    col4
3    1999-10-01    opt1    0.6400
4    1999-10-01    opt2    0.5500
8    1999-10-01    opt1    0.6400
9    1999-10-01    opt2    0.5500
select * from `%!%p2%!%p_table_17`;
col1    col2    col3    col4
select * from `%!%p3%!%p_table_17`;
col1    col2    col3    col4
1    1999-09-29    res1    0.1200
5    1999-09-29    oop1    0.8700
6    1999-09-29    res1    0.1200
10    1999-09-29    oop1    0.8700
create table p_table_18(col1 bigint,col2 varchar(25),col3 decimal(6,4))partition by key(col3)partitions 2;
insert into p_table_18 values(932,'rel',0.98),(76,'opp',8.94),(823,'var',0.98);
select * from p_table_18;
col1    col2    col3
932    rel    0.9800
823    var    0.9800
76    opp    8.9400
select * from `%!%p0%!%p_table_18`;
col1    col2    col3
932    rel    0.9800
823    var    0.9800
select * from `%!%p1%!%p_table_18`;
col1    col2    col3
76    opp    8.9400
drop table p_table_18;
create table p_table_18(col1 bigint,col2 varchar(25),col3 float)partition by key(col3)partitions 2;
insert into p_table_18 values(932,'rel',0.98),(76,'opp',8.94),(823,'var',0.98);
select * from p_table_18;
col1    col2    col3
932    rel    0.98
823    var    0.98
76    opp    8.94
select * from `%!%p0%!%p_table_18`;
col1    col2    col3
932    rel    0.98
823    var    0.98
select * from `%!%p1%!%p_table_18`;
col1    col2    col3
76    opp    8.94
drop table p_table_18;
create table p_table_18(col1 bigint,col2 varchar(25),col3 double)partition by key(col3)partitions 2;
insert into p_table_18 values(932,'rel',0.98),(76,'opp',8.94),(823,'var',0.98);
select * from p_table_18;
col1    col2    col3
932    rel    0.98
76    opp    8.94
823    var    0.98
select * from `%!%p0%!%p_table_18`;
col1    col2    col3
select * from `%!%p1%!%p_table_18`;
col1    col2    col3
932    rel    0.98
76    opp    8.94
823    var    0.98
create table p_table_19(col1 int,col2 date,col3 varchar(25))partition by key(col2)partitions 6;
load data infile '$resources/load_data/key_partition_data.csv' into table p_table_19 fields terminated by ',';
select * from p_table_19 where col1>1500;
col1    col2    col3
2300    2022-07-22    mnsef
9842    2023-08-12    yyyyyyssssss
8760    1995-02-02    ttt
6730    2010-02-02    ooopppppppptttttt
8972    2005-02-02    ttt
select * from `%!%p0%!%p_table_19`;
col1    col2    col3
select * from `%!%p1%!%p_table_19`;
col1    col2    col3
1000    1990-02-02    ooopppppppptttttt
1080    2010-09-19    sf
select * from `%!%p2%!%p_table_19`;
col1    col2    col3
90    2011-07-22    mnsef
176    2000-09-19    sf
1452    2000-08-12    yss
select * from `%!%p3%!%p_table_19`;
col1    col2    col3
1050    2010-08-12    yyyyyyssssss
2300    2022-07-22    mnsef
9842    2023-08-12    yyyyyyssssss
select * from `%!%p4%!%p_table_19`;
col1    col2    col3
1050    1995-08-12    yss
8760    1995-02-02    ttt
6730    2010-02-02    ooopppppppptttttt
select * from `%!%p5%!%p_table_19`;
col1    col2    col3
8972    2005-02-02    ttt
select count(*) from p_table_19;
count(*)
12
drop table p_table_19;
create table p_table_19(col1 int auto_increment,col2 date,col3 varchar(25),primary key(col1,col2))partition by key(col2)partitions 3;
load data infile '$resources/load_data/key_partition_data.csv' into table p_table_19 fields terminated by ',';
select * from p_table_19 where col1>1500;
col1    col2    col3
2300    2022-07-22    mnsef
9842    2023-08-12    yyyyyyssssss
8760    1995-02-02    ttt
6730    2010-02-02    ooopppppppptttttt
8972    2005-02-02    ttt
select * from `%!%p0%!%p_table_19`;
col1    col2    col3
1050    2010-08-12    yyyyyyssssss
2300    2022-07-22    mnsef
9842    2023-08-12    yyyyyyssssss
select * from `%!%p1%!%p_table_19`;
col1    col2    col3
1000    1990-02-02    ooopppppppptttttt
1080    2010-09-19    sf
1050    1995-08-12    yss
8760    1995-02-02    ttt
6730    2010-02-02    ooopppppppptttttt
select * from `%!%p2%!%p_table_19`;
col1    col2    col3
90    2011-07-22    mnsef
176    2000-09-19    sf
1452    2000-08-12    yss
8972    2005-02-02    ttt
drop table p_table_19;
create table p_table_19(col1 int auto_increment,col2 date,col3 varchar(25),primary key(col1,col2,col3))partition by key()partitions 3;
insert into p_table_19(col2,col3) values('2023-01-01','a'),('2023-01-02','b'),('2023-01-03','c'),('2023-01-04','d');
select * from p_table_19;
col1    col2    col3
4    2023-01-04    d
1    2023-01-01    a
2    2023-01-02    b
3    2023-01-03    c
select * from `%!%p0%!%p_table_19`;
col1    col2    col3
select * from `%!%p1%!%p_table_19`;
col1    col2    col3
4    2023-01-04    d
select * from `%!%p2%!%p_table_19`;
col1    col2    col3
1    2023-01-01    a
2    2023-01-02    b
3    2023-01-03    c
create table p_table_001(col1 int,col2 binary(50))partition by key(col2)partitions 4;
insert into p_table_001 values (12,'var1'),(56,'sstt'),(78,'var2'),(90,'lop');
select * from `%!%p0%!%p_table_001`;
col1    col2
78    var2                                              
select * from `%!%p1%!%p_table_001`;
col1    col2
56    sstt                                              
select * from `%!%p2%!%p_table_001`;
col1    col2
12    var1                                              
select * from `%!%p3%!%p_table_001`;
col1    col2
90    lop                                               
create table p_table_002(col1 int,col2 varbinary(50))partition by key(col2)partitions 4;
insert into p_table_002 values (12,'var1'),(56,'sstt'),(78,'var2'),(90,'lop');
select * from `%!%p0%!%p_table_002`;
col1    col2
12    var1
select * from `%!%p1%!%p_table_002`;
col1    col2
78    var2
90    lop
select * from `%!%p2%!%p_table_002`;
col1    col2
56    sstt
select * from `%!%p3%!%p_table_002`;
col1    col2
create table p_table_003(col1 int,col2 blob)partition by key(col2)partitions 4;
A BLOB field is not allowed in partition function
create table p_table_non(col1 int,col2 json)partition by key(col2)partitions 4;
A BLOB field is not allowed in partition function
create table p_table_004(col1 int,col2 text)partition by key(col2)partitions 4;
A BLOB field is not allowed in partition function
create temporary table p_table_non(col1 int,col2 varchar(25))partition by key(col2)partitions 4;
Cannot create temporary table with partitions
create view p_view as select * from p_table_19;
select * from p_view;
col1    col2    col3
4    2023-01-04    d
1    2023-01-01    a
2    2023-01-02    b
3    2023-01-03    c
drop view p_view;
CREATE TABLE IF NOT EXISTS p_table_20(
`id` INT,
`act_name` VARCHAR(20) NOT NULL,
`spu_id` VARCHAR(30) NOT NULL,
`uv`  BIGINT NOT NULL,
`update_time` date default '2020-10-10' COMMENT 'lastest time',
PRIMARY KEY ( `id`, `act_name`)
)partition by key(`act_name`) partitions 3;
insert into p_table_20 values (1,'beijing','001',1,'2021-01-03'),(2,'beijing','002',2,'2022-09-23'),(3,'guangzhou','003',3,'2022-09-23'),(3,'shanghai','003',3,'2022-09-23');
insert into p_table_20 values (4,'shenzheng','004',4,'2021-05-28'),(1,'beijing','010',5,'2022-10-23') on duplicate key update id=id*10;
select * from p_table_20;
id    act_name    spu_id    uv    update_time
2    beijing    002    2    2022-09-23
10    beijing    001    1    2021-01-03
3    guangzhou    003    3    2022-09-23
4    shenzheng    004    4    2021-05-28
3    shanghai    003    3    2022-09-23
select * from `%!%p0%!%p_table_20`;
id    act_name    spu_id    uv    update_time
2    beijing    002    2    2022-09-23
10    beijing    001    1    2021-01-03
select * from `%!%p1%!%p_table_20`;
id    act_name    spu_id    uv    update_time
3    guangzhou    003    3    2022-09-23
4    shenzheng    004    4    2021-05-28
select * from `%!%p2%!%p_table_20`;
id    act_name    spu_id    uv    update_time
3    shanghai    003    3    2022-09-23
drop table p_table_20;
create table p_table_20(col1 int,col2 date, col3 varchar(25))partition by key(col1,col2)partitions 4;
start transaction;
insert into p_table_20 values (72,'1999-09-29','res1'),(60,'1999-10-01','opt1'),(72,'1999-09-29','res2'),(60,'1999-10-01','opt2'), (200,'1999-10-29','oop1'),(200,'1999-10-29','oop1');
use hash_key_partition;
select * from p_table_20;
col1    col2    col3
select * from `%!%p0%!%p_table_20`;
col1    col2    col3
60    1999-10-01    opt1
60    1999-10-01    opt2
select * from `%!%p1%!%p_table_20`;
col1    col2    col3
200    1999-10-29    oop1
200    1999-10-29    oop1
select * from `%!%p2%!%p_table_20`;
col1    col2    col3
72    1999-09-29    res1
72    1999-09-29    res2
select * from `%!%p3%!%p_table_20`;
col1    col2    col3
rollback;
select * from p_table_20;
col1    col2    col3
select * from `%!%p0%!%p_table_20`;
col1    col2    col3
select * from `%!%p1%!%p_table_20`;
col1    col2    col3
select * from `%!%p2%!%p_table_20`;
col1    col2    col3
select * from `%!%p3%!%p_table_20`;
col1    col2    col3
drop table p_table_20;
create table p_table_20(col1 int,col2 date, col3 varchar(25))partition by key(col1,col2)partitions 4;
begin;
insert into p_table_20 values (72,'1999-09-29','res1'),(60,'1999-10-01','opt1'),(72,'1999-09-29','res2'),(60,'1999-10-01','opt2'), (200,'1999-10-29','oop1'),(200,'1999-10-29','oop1');
select * from p_table_20;
col1    col2    col3
select * from `%!%p0%!%p_table_20`;
col1    col2    col3
60    1999-10-01    opt1
60    1999-10-01    opt2
select * from `%!%p1%!%p_table_20`;
col1    col2    col3
200    1999-10-29    oop1
200    1999-10-29    oop1
select * from `%!%p2%!%p_table_20`;
col1    col2    col3
72    1999-09-29    res1
72    1999-09-29    res2
select * from `%!%p3%!%p_table_20`;
col1    col2    col3
commit;
select * from p_table_20;
col1    col2    col3
60    1999-10-01    opt1
60    1999-10-01    opt2
200    1999-10-29    oop1
200    1999-10-29    oop1
72    1999-09-29    res1
72    1999-09-29    res2
select * from `%!%p0%!%p_table_20`;
col1    col2    col3
60    1999-10-01    opt1
60    1999-10-01    opt2
select * from `%!%p1%!%p_table_20`;
col1    col2    col3
200    1999-10-29    oop1
200    1999-10-29    oop1
select * from `%!%p2%!%p_table_20`;
col1    col2    col3
72    1999-09-29    res1
72    1999-09-29    res2
select * from `%!%p3%!%p_table_20`;
col1    col2    col3
create table p_hash_table_01(col1 int not null,col2 varchar(30),col3 date not null default '1970-01-01',col4 int)partition by hash(col4) partitions 4;
insert into p_hash_table_01 values (-120,'78',NULL,90);
constraint violation: Column 'col3' cannot be null
insert into p_hash_table_01 values (-120,'78','2020-12-15',90),(84,'334','2021-01-01',34),(20,'55','2021-01-01',72),(-120,'45','2023-10-09',99),(84,'3','2022-11-01',34),(200,'55','2021-08-11',72);
select * from `%!%p0%!%p_hash_table_01`;
col1    col2    col3    col4
-120    45    2023-10-09    99
select * from `%!%p1%!%p_hash_table_01`;
col1    col2    col3    col4
-120    78    2020-12-15    90
select * from `%!%p2%!%p_hash_table_01`;
col1    col2    col3    col4
select * from `%!%p3%!%p_hash_table_01`;
col1    col2    col3    col4
84    334    2021-01-01    34
20    55    2021-01-01    72
84    3    2022-11-01    34
200    55    2021-08-11    72
show create table p_hash_table_01;
Table    Create Table
p_hash_table_01    CREATE TABLE `p_hash_table_01` (\n`col1` INT NOT NULL,\n`col2` VARCHAR(30) DEFAULT NULL,\n`col3` DATE DEFAULT '1970-01-01',\n`col4` INT DEFAULT NULL\n) partition by hash (col4) partitions 4
create table p_hash_table_02(col1 int not null,col2 varchar(30),col3 date default '1970-01-01',col4 int,primary key(col1,col2))partition by hash(col1) partitions 4;
insert into p_hash_table_02 values (-120,'78',NULL,90),(84,'334','2021-01-01',34),(20,'55','2021-01-01',72),(-120,'45',NULL,99),(84,'3','2022-11-01',34),(200,'55','2021-08-11',72);
select * from `%!%p0%!%p_hash_table_02`;
col1    col2    col3    col4
20    55    2021-01-01    72
select * from `%!%p1%!%p_hash_table_02`;
col1    col2    col3    col4
select * from `%!%p2%!%p_hash_table_02`;
col1    col2    col3    col4
-120    78    null    90
84    334    2021-01-01    34
-120    45    null    99
84    3    2022-11-01    34
select * from `%!%p3%!%p_hash_table_02`;
col1    col2    col3    col4
200    55    2021-08-11    72
create table p_hash_table_03(col1 bigint auto_increment,col2 varchar(30),col3 date default '1970-01-01',col4 int,unique key k1(col1,col2))partition by hash(col1) partitions 4;
insert into p_hash_table_03 values (-120,'78',NULL,90),(84,'334','2021-01-01',34),(20,'55','2021-01-01',72),(-120,'45',NULL,99),(84,'3','2022-11-01',34),(200,'55','2021-08-11',72);
select * from `%!%p0%!%p_hash_table_03`;
col1    col2    col3    col4
-120    78    null    90
20    55    2021-01-01    72
-120    45    null    99
select * from `%!%p1%!%p_hash_table_03`;
col1    col2    col3    col4
select * from `%!%p2%!%p_hash_table_03`;
col1    col2    col3    col4
84    334    2021-01-01    34
84    3    2022-11-01    34
select * from `%!%p3%!%p_hash_table_03`;
col1    col2    col3    col4
200    55    2021-08-11    72
show create table p_hash_table_03;
Table    Create Table
p_hash_table_03    CREATE TABLE `p_hash_table_03` (\n`col1` BIGINT NOT NULL AUTO_INCREMENT,\n`col2` VARCHAR(30) DEFAULT NULL,\n`col3` DATE DEFAULT '1970-01-01',\n`col4` INT DEFAULT NULL,\nUNIQUE KEY `k1` (`col1`,`col2`)\n) partition by hash (col1) partitions 4
create table p_hash_table_04(col1 bigint ,col2 date,col3 varchar(30))partition by hash(year(col2)) partitions 4;
load data infile '$resources/load_data/key_partition_data.csv' into table p_hash_table_04 fields terminated by ',';
select * from `%!%p0%!%p_hash_table_04`;
col1    col2    col3
1050    2010-08-12    yyyyyyssssss
2300    2022-07-22    mnsef
1080    2010-09-19    sf
6730    2010-02-02    ooopppppppptttttt
select * from `%!%p1%!%p_hash_table_04`;
col1    col2    col3
176    2000-09-19    sf
1452    2000-08-12    yss
select * from `%!%p2%!%p_hash_table_04`;
col1    col2    col3
1000    1990-02-02    ooopppppppptttttt
9842    2023-08-12    yyyyyyssssss
select * from `%!%p3%!%p_hash_table_04`;
col1    col2    col3
1050    1995-08-12    yss
8760    1995-02-02    ttt
90    2011-07-22    mnsef
8972    2005-02-02    ttt
select * from p_hash_table_04 where col1>1050;
col1    col2    col3
2300    2022-07-22    mnsef
1080    2010-09-19    sf
6730    2010-02-02    ooopppppppptttttt
1452    2000-08-12    yss
9842    2023-08-12    yyyyyyssssss
8760    1995-02-02    ttt
8972    2005-02-02    ttt
update p_hash_table_04 set col2='2023-09-05' where col1=1000;
update p_hash_table_04 set col1=999 where col2='2010-08-12';
select * from `%!%p0%!%p_hash_table_04`;
col1    col2    col3
2300    2022-07-22    mnsef
1080    2010-09-19    sf
6730    2010-02-02    ooopppppppptttttt
999    2010-08-12    yyyyyyssssss
select * from `%!%p1%!%p_hash_table_04`;
col1    col2    col3
176    2000-09-19    sf
1452    2000-08-12    yss
select * from `%!%p2%!%p_hash_table_04`;
col1    col2    col3
9842    2023-08-12    yyyyyyssssss
1000    2023-09-05    ooopppppppptttttt
select * from `%!%p3%!%p_hash_table_04`;
col1    col2    col3
1050    1995-08-12    yss
8760    1995-02-02    ttt
90    2011-07-22    mnsef
8972    2005-02-02    ttt
delete from p_hash_table_04 where col2='2010-08-12';
select * from `%!%p0%!%p_hash_table_04`;
col1    col2    col3
2300    2022-07-22    mnsef
1080    2010-09-19    sf
6730    2010-02-02    ooopppppppptttttt
select * from `%!%p1%!%p_hash_table_04`;
col1    col2    col3
176    2000-09-19    sf
1452    2000-08-12    yss
select * from `%!%p2%!%p_hash_table_04`;
col1    col2    col3
9842    2023-08-12    yyyyyyssssss
1000    2023-09-05    ooopppppppptttttt
select * from `%!%p3%!%p_hash_table_04`;
col1    col2    col3
1050    1995-08-12    yss
8760    1995-02-02    ttt
90    2011-07-22    mnsef
8972    2005-02-02    ttt
truncate table p_hash_table_04;
select * from p_hash_table_04;
col1    col2    col3
select * from `%!%p0%!%p_hash_table_04`;
col1    col2    col3
select * from `%!%p1%!%p_hash_table_04`;
col1    col2    col3
create table p_hash_table_05(col1 bigint unsigned,col2 varchar(30),col3 datetime)partition by hash(year(col3)) partitions 3;
insert into p_hash_table_05 values(1,'a','2023-04-24 23:00:00'), (8,'b','2023-04-24 13:00:00'),(8,'b',NULL);
select * from `%!%p0%!%p_hash_table_05`;
col1    col2    col3
select * from `%!%p1%!%p_hash_table_05`;
col1    col2    col3
8    b    null
select * from `%!%p2%!%p_hash_table_05`;
col1    col2    col3
1    a    2023-04-24 23:00:00
8    b    2023-04-24 13:00:00
select * from p_hash_table_05;
col1    col2    col3
8    b    null
1    a    2023-04-24 23:00:00
8    b    2023-04-24 13:00:00
create table p_hash_table_06(col1 tinyint,col2 varchar(30))partition by hash(col1) partitions 2;
insert into p_hash_table_06 values (10,'nb'),(10,'bv'),(12,'nb'),(12,'bv'),(13,'nb'),(14,'bv');
select * from `%!%p0%!%p_hash_table_06`;
col1    col2
10    nb
10    bv
13    nb
14    bv
select * from `%!%p1%!%p_hash_table_06`;
col1    col2
12    nb
12    bv
create table p_hash_table_07(col1 tinyint unsigned,col2 varchar(30))partition by hash(col1) partitions 2;
insert into p_hash_table_07 values (10,'nb'),(10,'bv'),(12,'nb'),(12,'bv'),(13,'nb'),(14,'bv');
select * from `%!%p0%!%p_hash_table_07`;
col1    col2
10    nb
10    bv
13    nb
14    bv
select * from `%!%p1%!%p_hash_table_07`;
col1    col2
12    nb
12    bv
select * from p_hash_table_07;
col1    col2
10    nb
10    bv
13    nb
14    bv
12    nb
12    bv
create table p_hash_table_08(col1 tinyint,col2 varchar(30),col3 decimal(6,3))partition by hash(ceil(col3)) partitions 2;
The PARTITION function returns the wrong type
insert into p_hash_table_08 values (10,'nb',35.5),(10,'bv',35.45),(12,'nb',30.09),(12,'nb',30.23);
no such table hash_key_partition.p_hash_table_08
select * from `%!%p0%!%p_hash_table_08`;
SQL parser error: table "%!%p0%!%p_hash_table_08" does not exist
select * from `%!%p1%!%p_hash_table_08`;
SQL parser error: table "%!%p1%!%p_hash_table_08" does not exist
select * from p_hash_table_08;
SQL parser error: table "p_hash_table_08" does not exist
drop table if exists p_hash_table_08;
create table p_hash_table_08(col1 tinyint,col2 varchar(30),col3 decimal(6,3))partition by hash(col1*100)partitions 2;
insert into p_hash_table_08 values (10,'nb',35.5),(10,'bv',35.45),(12,'nb',30.09),(12,'nb',30.23);
select * from `%!%p0%!%p_hash_table_08`;
col1    col2    col3
12    nb    30.090
12    nb    30.230
select * from `%!%p1%!%p_hash_table_08`;
col1    col2    col3
10    nb    35.500
10    bv    35.450
select * from p_hash_table_08;
col1    col2    col3
12    nb    30.090
12    nb    30.230
10    nb    35.500
10    bv    35.450
drop table if exists p_hash_table_03;
create table p_hash_table_03(col1 bigint auto_increment,col2 varchar(30),col3 date default '1970-01-01',col4 int,primary key(col1,col2),unique key k1(col4))partition by hash(col1) partitions 4;
A PRIMARY KEY must include all columns in the table's partitioning function
create table p_hash_table_03(col1 bigint ,col2 date default '1970-01-01',col3 varchar(30))partition by hash(year(col3)) partitions 8;
Constant, random or timezone-dependent expressions in (sub)partitioning function are not allowed
create table p_hash_table_06(col1 tinyint,col2 varchar(30),col3 decimal(6,3))partition by hash(col3) partitions 2;
Field 'col3' is of a not allowed type for this type of partitioning
create table p_hash_table_06(col1 tinyint,col2 varchar(30),col3 blob)partition by hash(col3) partitions 2;
Field 'col3' is of a not allowed type for this type of partitioning
create table p_hash_table_06(col1 tinyint,col2 varchar(30))partition by hash(col2) partitions 2;
Field 'col2' is of a not allowed type for this type of partitioning
create table p_hash_table_06(col1 tinyint,col2 varchar(30),col3 json)partition by hash(col3) partitions 2;
Field 'col3' is of a not allowed type for this type of partitioning
create table p_hash_table_06(col1 tinyint,col2 varchar(30),col3 Binary)partition by hash(col3) partitions 2;
Field 'col3' is of a not allowed type for this type of partitioning
create table p_hash_table_06(col1 tinyint,col2 varchar(30),col3 varbinary(25))partition by hash(col3) partitions 2;
Field 'col3' is of a not allowed type for this type of partitioning
create table p_hash_table_06(col1 tinyint,col2 varchar(30),col3 date)partition by hash(col3) partitions 2;
Field 'col3' is of a not allowed type for this type of partitioning
create table p_hash_table_06(col1 tinyint,col2 varchar(30),col3 datetime)partition by hash(col3) partitions 2;
Field 'col3' is of a not allowed type for this type of partitioning
create table p_hash_table_06(col1 tinyint,col2 varchar(30),col3 timestamp)partition by hash(col3) partitions 2;
Field 'col3' is of a not allowed type for this type of partitioning
create table p_hash_table_06(col1 tinyint,col2 varchar(30),col3 varchar(25))partition by hash(col3) partitions 2;
Field 'col3' is of a not allowed type for this type of partitioning
create table p_hash_table_06(col1 tinyint,col2 varchar(30),col3 char(25))partition by hash(col3) partitions 2;
Field 'col3' is of a not allowed type for this type of partitioning
create table p_hash_table_06(col1 tinyint,col2 varchar(30),col3 bool)partition by hash(col3) partitions 2;
Field 'col3' is of a not allowed type for this type of partitioning
create table p_hash_table_08(col1 tinyint,col2 varchar(30),col3 decimal(6,3))partition by hash(col1*100/3)partitions 2;
This partition function is not allowed
create table p_hash_table_09(col1 bigint auto_increment,col2 varchar(30),col3 date default '1970-01-01',col4 int,unique key k1(col1,col2))partition by hash(col1) partitions 4;
start transaction ;
insert into p_hash_table_09 values (-120,'78',NULL,90),(84,'334','2021-01-01',34),(20,'55','2021-01-01',72),(-120,'45',NULL,99),(84,'3','2022-11-01',34),(200,'55','2021-08-11',72);
use hash_key_partition;
select * from p_hash_table_09;
col1    col2    col3    col4
select * from p_hash_table_09;
col1    col2    col3    col4
-120    78    null    90
20    55    2021-01-01    72
-120    45    null    99
84    334    2021-01-01    34
84    3    2022-11-01    34
200    55    2021-08-11    72
select * from `%!%p0%!%p_hash_table_09`;
col1    col2    col3    col4
-120    78    null    90
20    55    2021-01-01    72
-120    45    null    99
select * from `%!%p1%!%p_hash_table_09`;
col1    col2    col3    col4
select * from `%!%p2%!%p_hash_table_09`;
col1    col2    col3    col4
84    334    2021-01-01    34
84    3    2022-11-01    34
select * from `%!%p3%!%p_hash_table_09`;
col1    col2    col3    col4
200    55    2021-08-11    72
rollback;
select * from p_hash_table_09;
col1    col2    col3    col4
select * from `%!%p0%!%p_hash_table_09`;
col1    col2    col3    col4
select * from `%!%p1%!%p_hash_table_09`;
col1    col2    col3    col4
select * from `%!%p2%!%p_hash_table_09`;
col1    col2    col3    col4
select * from `%!%p3%!%p_hash_table_09`;
col1    col2    col3    col4
drop table p_hash_table_09;
create table p_hash_table_09(col1 bigint auto_increment,col2 varchar(30),col3 date default '1970-01-01',col4 int,unique key k1(col1,col2))partition by hash(col1) partitions 4;
start transaction ;
insert into p_hash_table_09 values (-120,'78',NULL,90),(84,'334','2021-01-01',34),(20,'55','2021-01-01',72),(-120,'45',NULL,99),(84,'3','2022-11-01',34),(200,'55','2021-08-11',72);
use hash_key_partition;
select * from p_hash_table_09;
col1    col2    col3    col4
select * from p_hash_table_09;
col1    col2    col3    col4
-120    78    null    90
20    55    2021-01-01    72
-120    45    null    99
84    334    2021-01-01    34
84    3    2022-11-01    34
200    55    2021-08-11    72
select * from `%!%p0%!%p_hash_table_09`;
col1    col2    col3    col4
-120    78    null    90
20    55    2021-01-01    72
-120    45    null    99
select * from `%!%p1%!%p_hash_table_09`;
col1    col2    col3    col4
select * from `%!%p2%!%p_hash_table_09`;
col1    col2    col3    col4
84    334    2021-01-01    34
84    3    2022-11-01    34
select * from `%!%p3%!%p_hash_table_09`;
col1    col2    col3    col4
200    55    2021-08-11    72
commit;
select * from p_hash_table_09;
col1    col2    col3    col4
-120    78    null    90
20    55    2021-01-01    72
-120    45    null    99
84    334    2021-01-01    34
84    3    2022-11-01    34
200    55    2021-08-11    72
select * from `%!%p0%!%p_hash_table_09`;
col1    col2    col3    col4
-120    78    null    90
20    55    2021-01-01    72
-120    45    null    99
select * from `%!%p1%!%p_hash_table_09`;
col1    col2    col3    col4
select * from `%!%p2%!%p_hash_table_09`;
col1    col2    col3    col4
84    334    2021-01-01    34
84    3    2022-11-01    34
select * from `%!%p3%!%p_hash_table_09`;
col1    col2    col3    col4
200    55    2021-08-11    72
create table p_hash_table_10(col1 bigint ,col2 date,col3 varchar(30))partition by hash(to_days(col2)) partitions 4;
load data infile '$resources/load_data/key_partition_data.csv' into table p_hash_table_10 fields terminated by ',';
select * from `%!%p0%!%p_hash_table_10`;
col1    col2    col3
1050    2010-08-12    yyyyyyssssss
2300    2022-07-22    mnsef
176    2000-09-19    sf
select * from `%!%p1%!%p_hash_table_10`;
col1    col2    col3
8760    1995-02-02    ttt
9842    2023-08-12    yyyyyyssssss
90    2011-07-22    mnsef
1452    2000-08-12    yss
select * from `%!%p2%!%p_hash_table_10`;
col1    col2    col3
1000    1990-02-02    ooopppppppptttttt
6730    2010-02-02    ooopppppppptttttt
select * from `%!%p3%!%p_hash_table_10`;
col1    col2    col3
1080    2010-09-19    sf
1050    1995-08-12    yss
8972    2005-02-02    ttt
drop table p_hash_table_10;
create table p_hash_table_10(col1 bigint ,col2 date,col3 varchar(30))partition by hash(to_seconds(col2)) partitions 4;
load data infile '$resources/load_data/key_partition_data.csv' into table p_hash_table_10 fields terminated by ',';
select * from `%!%p0%!%p_hash_table_10`;
col1    col2    col3
1000    1990-02-02    ooopppppppptttttt
8760    1995-02-02    ttt
6730    2010-02-02    ooopppppppptttttt
1452    2000-08-12    yss
select * from `%!%p1%!%p_hash_table_10`;
col1    col2    col3
1080    2010-09-19    sf
1050    1995-08-12    yss
176    2000-09-19    sf
8972    2005-02-02    ttt
select * from `%!%p2%!%p_hash_table_10`;
col1    col2    col3
9842    2023-08-12    yyyyyyssssss
90    2011-07-22    mnsef
select * from `%!%p3%!%p_hash_table_10`;
col1    col2    col3
1050    2010-08-12    yyyyyyssssss
2300    2022-07-22    mnsef
