DROP DATABASE IF EXISTS TEST01;
CREATE DATABASE TEST01;
show CREATE DATABASE test01;
Database    Create Database
test01    CREATE DATABASE `test01`
DROP DATABASE test01;
DROP DATABASE IF EXISTS test02;
CREATE DATABASE test02;
show CREATE DATABASE TEST02;
Database    Create Database
test02    CREATE DATABASE `test02`
DROP DATABASE test02;
DROP DATABASE IF EXISTS mysql_TEST;
CREATE DATABASE mysql_TEST;
show CREATE DATABASE mysql_TEST;
Database    Create Database
mysql_test    CREATE DATABASE `mysql_test`
DROP DATABASE mysql_TEST;
DROP DATABASE IF EXISTS test03;
DROP TABLE IF EXISTS t1;
CREATE DATABASE test03;
USE test03;
CREATE TEMPORARY TABLE t1(a float);
INSERT INTO T1 VALUES(213823.12);
INSERT INTO t1 VALUES(-45412.38920);
SELECT * FROM t1;
a
-45412.39
213823.12
DROP TABLE T1;
drop table IF EXISTS table01;
CREATE external table table01(clo1 int,clo2 bigint)infile{"filepath"='$resources/external_table_file/aaa.csv'} fields terminated by ',';
SELECT * FROM Table01;
clo1    clo2
1    2131420000000000
2    325465476
3    -1
SELECT Clo1 FROM table01;
clo1
1
2
3
DROP table table01;
DROP TABLE IF EXISTS t1;
CREATE TABLE t1(id int PRIMARY KEY, Word VARCHAR(40) NOT NULL, INDEX(Word));
show CREATE TABLE t1;
Table    Create Table
t1    CREATE TABLE `t1` (\n`id` INT NOT NULL,\n`word` VARCHAR(40) NOT NULL,\nPRIMARY KEY (`id`),\nKEY `word` (`word`)\n)
INSERT INTO t1 VALUES (1, 'a');
INSERT INTO t1 VALUES (2, 'b');
INSERT INTO t1 VALUES (3, 'c');
INSERT INTO T1 VALUES (4, 'd');
SELECT * FROM t1;
id    word
1    a
2    b
3    c
4    d
SELECT * FROM T1;
id    word
1    a
2    b
3    c
4    d
SELECT T1.id FROM T1 LIMIT 1;
id
1
SELECT T1.id FROM t1 LIMIT 1;
id
1
SELECT id FROM T1;
id
1
2
3
4
select ID FROM t1;
id
1
2
3
4
SELECT Id FROM t1;
id
1
2
3
4
SELECT COUNT(*) FROM t1;
count(*)
4
SELECT COUNT(*) FROM T1;
count(*)
4
SELECT COUNT(t1.id) FROM t1;
count(t1.id)
4
SELECT COUNT(T1.Id) FROM t1;
count(t1.id)
4
SELECT * FROM t1 WHERE Id = 2;
id    word
2    b
DROP TABLE IF EXISTS t2;
CREATE table t2(id int PRIMARY KEY, Word VARCHAR(40) NOT NULL, INDEX(Word));
INSERT INTO T2 SELECT * from T1;
SELECT * FROM T2;
id    word
1    a
2    b
3    c
4    d
DROP TABLE t1;
DROP TABLE IF EXISTS t2;
DROP TABLE IF EXISTS t3;
CREATE TABLE T2(id int PRIMARY KEY, Word VARCHAR(40) NOT NULL, INDEX(Word));
CREATE TABLE t3(id int primary key, Word varchar(40) NOT NULL);
show CREATE TABLE t2;
Table    Create Table
t2    CREATE TABLE `t2` (\n`id` INT NOT NULL,\n`word` VARCHAR(40) NOT NULL,\nPRIMARY KEY (`id`),\nKEY `word` (`word`)\n)
show CREATE TABLE t3;
Table    Create Table
t3    CREATE TABLE `t3` (\n`id` INT NOT NULL,\n`word` VARCHAR(40) NOT NULL,\nPRIMARY KEY (`id`)\n)
INSERT INTO T2 VALUES (1, 'a');
INSERT INTO t2 VALUES (2, 'b');
INSERT INTO t2 VALUES (3, 'c');
INSERT INTO T2 VALUES (4, 'd');
INSERT INTO t3 VALUES (1,'match');
DELETE FROM t2 WHERE id = 1;
DELETE FROM T2 WHERE ID = 2;
SELECT * FROM T2;
id    word
3    c
4    d
SELECT * FROM t3;
id    word
1    match
SELECT T2.id FROM T2 LIMIT 1;
id
3
SELECT Id, WORD FROM t2;
id    word
3    c
4    d
SELECT * FROM t3 WHERE WORD = 'match';
id    word
1    match
SELECT t3.id AS t3_ID FROM T3 LIMIT 1;
t3_ID
1
SELECT t3.ID AS t3_ID FROM t3 LIMIT 1;
t3_ID
1
SELECT * FROM t2 left join t3 ON (test.t2.id= TEST.t3.id) WHERE t2.id >= t3.id;
id    word    id    word
DROP TABLE t2;
DROP TABLE t3;
DROP TABLE IF EXISTS t4;
DROP TABLE IF EXISTS t5;
CREATE TABLE t4(a int primary key,b varchar(5));
CREATE TABLE t5(a int ,b varchar(5), C int, constraint fc foreign key(C) references t4(a));
ALTER table t5 DROP FOREIGN KEY fC;
ALTER table t5 ADD constraint fC foreign key(c) REFERENCES t4(a);
show CREATE TABLE t4;
Table    Create Table
t4    CREATE TABLE `t4` (\n`a` INT NOT NULL,\n`b` VARCHAR(5) DEFAULT NULL,\nPRIMARY KEY (`a`)\n)
show CREATE TABLE T5;
Table    Create Table
t5    CREATE TABLE `t5` (\n`a` INT DEFAULT NULL,\n`b` VARCHAR(5) DEFAULT NULL,\n`c` INT DEFAULT NULL,\nCONSTRAINT `fc` FOREIGN KEY (`c`) REFERENCES `t4` (`a`) ON DELETE RESTRICT ON UPDATE RESTRICT\n)
DROP table t5;
DROP table t4;
DROP USER IF EXISTS u_name;
CREATE USER u_name IDENTIFIED BY '123456';
CREATE USER U_NAME IDENTIFIED BY '123456';
internal error: the user u_name exists
CREATE USER U_name IDENTIFIED BY '123456';
internal error: the user u_name exists
SELECT user_host,user_name,status FROM mo_catalog.mo_user WHERE user_name = 'U_name';
user_host    user_name    status
SELECT user_host,user_name,status FROM mo_catalog.mo_user;
user_host    user_name    status
localhost    u_name    unlock
localhost    root    unlock
localhost    dump    unlock
DROP USER u_name;
DROP DATABASE test03;
DROP database IF EXISTS test03;
create database test03;
use test03;
create table t6 (a int);
INSERT INTO t6 VALUES(1);
INSERT INTO t6 VALUES(24845615);
INSERT INTO T6 VALUES(-289173);
select T6.a from test03.T6;
a
1
24845615
-289173
select t6.a from test03.T6;
a
1
24845615
-289173
select test03.t6.a from TEST03.t6;
a
1
24845615
-289173
select TEST03.t6.a from TEST03.t6;
a
1
24845615
-289173
select TEST03.T6.a from TEST03.T6;
a
1
24845615
-289173
select TEST03.T6.a from T6;
a
1
24845615
-289173
select TEST03.t6.a from TEST03.t6;
a
1
24845615
-289173
DROP TABLE t6;
DROP TABLE IF EXISTS t7;
DROP TABLE IF EXISTS t8;
create table t7 (a int);
create table t8 (a int);
INSERT INTO t7 VALUES(1);
INSERT INTO t8 VALUES(1);
update t7 as p1, t8 as p2 SET p1.a=1,p2.a=1 where p1.a=p2.a;
update t7 as P1, t8 as P2 SET P1.a=10,p2.a=100 where P1.a=p2.a;
SELECT * FROM t7;
a
10
SELECT * FROM t8;
a
100
DROP TABLE t7;
DROP TABLE t8;
drop database test03;
DROP DATABASE IF EXISTS test04;
CREATE DATABASE test04;
USE test04;
DROP table IF EXISTS t9;
DROP table IF EXISTS t10;
CREATE TABLE t9 (a int);
CREATE TABLE t10(a int);
INSERT INTO t9 VALUES(100);
INSERT INTO t10 VALUES(1000);
SELECT t9.a AS a,t10.A as B from t9,t10;
a    B
100    1000
DROP TABLE t9;
DROP TABLE t10;
DROP TABLE if EXISTS t10;
create table t10(id int PRIMARY KEY,name VARCHAR(255),age int);
insert into t10 values(1,"Abby", 24);
insert into t10 values(2,"Bob", 25);
create unique index idx on t10(name);
select * from t10;
id    name    age
1    Abby    24
2    Bob    25
show CREATE TABLE t10;
Table    Create Table
t10    CREATE TABLE `t10` (\n`id` INT NOT NULL,\n`name` VARCHAR(255) DEFAULT NULL,\n`age` INT DEFAULT NULL,\nPRIMARY KEY (`id`),\nUNIQUE KEY `idx` (`name`)\n)
DROP TABLE t10;
DROP table IF EXISTS t11;
CREATE table t11(col1 int PRIMARY KEY,col2 CHAR,col3 float);
INSERT INTO t11 VALUES(1,'a',898021.8392);
INSERT INTO t11 VALUES(2, NULL, 213145.45);
select * from t11;
col1    col2    col3
1    a    898021.8
2    null    213145.45
show CREATE table t11;
Table    Create Table
t11    CREATE TABLE `t11` (\n`col1` INT NOT NULL,\n`col2` CHAR(1) DEFAULT NULL,\n`col3` FLOAT DEFAULT NULL,\nPRIMARY KEY (`col1`)\n)
DROP TABLE t11;
DROP TABLE IF EXISTS t12;
CREATE TABLE t12(col1 int,col2 varchar(20),col3 double);
CREATE INDEX ABc ON t12(col2);
DROP INDEX abc on t12;
select * from t12;
col1    col2    col3
show CREATE table t12;
Table    Create Table
t12    CREATE TABLE `t12` (\n`col1` INT DEFAULT NULL,\n`col2` VARCHAR(20) DEFAULT NULL,\n`col3` DOUBLE DEFAULT NULL\n)
DROP TABLE t12;
DROP ACCOUNT IF EXISTS tenant_test;
CREATE ACCOUNT tenant_test admin_name = 'root' identified by '111' open comment 'tenant_test';
ALTER ACCOUNT tenant_TEST comment 'abcddddddfsfafaffsefsfsefljofiseosfjosisssssssssssssssssssssssssssssssssssssssssssssssssssssssssssss24444444444444444444444444222222222@fffffffffffffffffffffffffffffffffffffffffffffffffffff';
CREATE ACCOUNT tenant_TEST admin_name = 'root' identified by '111' open comment 'tenant_test';
internal error: the tenant tenant_test exists
CREATE ACCOUNT TENANT_TEST admin_name = 'root' identified by '111' open comment 'tenant_test';
internal error: the tenant tenant_test exists
SELECT account_name,status,comments FROM mo_catalog.mo_account WHERE account_name = 'tenant_test';
account_name    status    comments
tenant_test    open    abcddddddfsfafaffsefsfsefljofiseosfjosisssssssssssssssssssssssssssssssssssssssssssssssssssssssssssss24444444444444444444444444222222222@fffffffffffffffffffffffffffffffffffffffffffffffffffff
DROP ACCOUNT IF EXISTS TENANT_TEST;
DROP ROLE IF EXISTS rolex;
CREATE ROLE rolex;
CREATE ROLE Rolex;
internal error: the role rolex exists
CREATE ROLE ROLEX;
internal error: the role rolex exists
SELECT role_name,COmments FROM mo_catalog.mo_role;
role_name    comments
rolex    
moadmin    
public    
SELECT role_name,COmments FROM mo_catalog.mo_role WHERE role_name = 'Rolex';
role_name    comments
DROP ROLE rolex;
DROP SEQUENCE IF EXISTS SEQ;
CREATE SEQUENCE SEQ increment 100 start 30;
CREATE SEQUENCE seq increment 100 start 30;
table seq already exists
SELECT * FROM SEQ;
last_seq_num    min_value    max_value    start_value    increment_value    cycle    is_called
30    1    9223372036854775807    30    100    false    false
SELECT laSt_seq_nuM,min_value,start_value FROM Seq;
last_seq_num    min_value    start_value
30    1    30
DROP SEQUENCE SEQ;
DROP TABLE IF EXISTS t12;
DROP TABLE IF EXISTS t13;
DROP view IF EXISTS view1;
CREATE TABLE t12(a INTEGER);
INSERT INTO t12 VALUES (1),(2);
CREATE TABLE t13(a INTEGER);
INSERT INTO t13 VALUES (1);
CREATE VIEW view1 AS SELECT t12.a, t13.a AS b FROM t12 LEFT JOIN t13 USING(a);
CREATE VIEW VIEW1 AS SELECT t12.a, t13.a AS b FROM t12 LEFT JOIN t13 USING(a);
table view1 already exists
DROP VIEW view1;
DROP TABLE t12;
DROP TABLE t13;
DROP TABLE IF EXISTS TaB;
DROP VIEW IF EXISTS vie;
CREATE TABLE TaB(Field int);
CREATE VIEW ViE AS SELECT * FROM TAb;
show CREATE TABLE VIe;
View    Create View
vie    CREATE VIEW ViE AS SELECT * FROM TAb;
DROP VIEW vie;
DROP table TAB;
DROP TABLE IF EXISTS t13;
DROP VIEW IF EXISTS view01;
CREATE TABLE t13 (a int);
INSERT INTO t13 VALUES(1),(2),(3),(4);
CREATE VIEW view01 AS SELECT * FROM t13;
ALTER VIEW VIEW01 AS SELECT * FROM t13 WHERE a=1 or a = 2;
show CREATE TABLE vieW01;
View    Create View
view01    CREATE VIEW VIEW01 AS SELECT * FROM t13 WHERE a=1 or a = 2;
SELECT * FROM view01;
a
1
2
SELECT * FROM vieW01 WHERE A = 1 OR a = 2;
a
1
2
DROP view view01;
drop table t13;
drop database test04;
DROP DATABASE IF EXISTS `TEST01`;
CREATE DATABASE `TEST01`;
show CREATE DATABASE `test01`;
Database    Create Database
test01    CREATE DATABASE `test01`
DROP DATABASE `test01`;
DROP DATABASE IF EXISTS `test02`;
CREATE DATABASE `test02`;
show CREATE DATABASE `TEST02`;
Database    Create Database
test02    CREATE DATABASE `test02`
DROP DATABASE `test02`;
DROP DATABASE IF EXISTS `mysql_TEST`;
CREATE DATABASE `mysql_TEST`;
show CREATE DATABASE `mysql_TEST`;
Database    Create Database
mysql_test    CREATE DATABASE `mysql_test`
DROP DATABASE `mysql_TEST`;
DROP DATABASE IF EXISTS `test05`;
CREATE DATABASE `test05`;
use `Test05`;
CREATE TABLE `t11`(aa float);
INSERT INTO `t11` VALUES(12.322);
INSERT INTO `T11` VALUES(-56.23);
SELECT * FROM `t11`;
aa
12.322
-56.23
DROP table t11;
DROP TABLE IF EXISTS `t12`;
create table `t12` (a int);
INSERT INTO `t12` VALUES(1);
INSERT INTO `t12` VALUES(24845615);
INSERT INTO `T12` VALUES(-289173);
select `T12`.a from `test05`.T12;
a
1
24845615
-289173
select `t12`.a from `test05`.T12;
a
1
24845615
-289173
select test05.t12.a from `TEST05`.t12;
a
1
24845615
-289173
select `TEST05`.t12.a from TEST05.t12;
a
1
24845615
-289173
select TEST05.T12.a from TEST05.`T12`;
a
1
24845615
-289173
select TEST05.T12.a from `T12`;
a
1
24845615
-289173
select TEST05.t12.a from `TEST05`.t12;
a
1
24845615
-289173
DROP TABLE t12;
DROP DATABASE TEST05;
DROP DATABASE IF EXISTS `test06`;
CREATE DATABASE `test06`;
USE test06;
DROP table IF EXISTS `t13`;
DROP table IF EXISTS `t14`;
CREATE TABLE `t13` (a int);
CREATE TABLE `t14` (a int);
INSERT INTO `t13` VALUES(100);
INSERT INTO `t14` VALUES(1000);
SELECT `t13`.a AS a,`t14`.A as B from `t13`,`t14`;
a    B
100    1000
DROP TABLE `t13`;
DROP TABLE `t14`;
DROP TABLE IF EXISTS `t15`;
DROP TABLE IF EXISTS `t16`;
create table `t15` (a int);
create table `t16` (a int);
INSERT INTO `t15` VALUES(1);
INSERT INTO `t16` VALUES(1);
update `t15` as p1, `t16` as p2 SET p1.a=1,P2.a=1 where p1.a=P2.a;
update `t15` as P1, `t16` as P2 SET P1.a=10,p2.a=100 where P1.a=p2.a;
SELECT * FROM `t15`;
a
10
SELECT * FROM `T16`;
a
100
DROP TABLE `t15`;
DROP TABLE `t16`;
DROP TABLE if EXISTS `t17`;
create table `t17`(id int PRIMARY KEY,name VARCHAR(255),age int);
insert into `t17` values(1,"Abby", 24);
insert into `t17` values(2,"Bob", 25);
create unique index `Idx` on t17(name);
select * from `t17`;
id    name    age
1    Abby    24
2    Bob    25
show CREATE TABLE `t17`;
Table    Create Table
t17    CREATE TABLE `t17` (\n`id` INT NOT NULL,\n`name` VARCHAR(255) DEFAULT NULL,\n`age` INT DEFAULT NULL,\nPRIMARY KEY (`id`),\nUNIQUE KEY `idx` (`name`)\n)
DROP TABLE `t17`;
DROP SEQUENCE IF EXISTS `SEQ`;
CREATE SEQUENCE `SEQ` increment 100 start 30;
CREATE SEQUENCE `seq` increment 100 start 30;
table seq already exists
SELECT * FROM `SEQ`;
last_seq_num    min_value    max_value    start_value    increment_value    cycle    is_called
30    1    9223372036854775807    30    100    false    false
SELECT `laSt_seq_nuM`,`min_value`,`start_value` FROM Seq;
last_seq_num    min_value    start_value
30    1    30
DROP SEQUENCE `SEQ`;
DROP table IF EXISTS `t18`;
CREATE table `t18`(col1 int PRIMARY KEY,col2 CHAR,col3 float);
INSERT INTO `t18` VALUES(1,'a',898021.8392);
INSERT INTO `t18` VALUES(2, NULL, 213145.45);
select * from `t18`;
col1    col2    col3
1    a    898021.8
2    null    213145.45
show CREATE table `t18`;
Table    Create Table
t18    CREATE TABLE `t18` (\n`col1` INT NOT NULL,\n`col2` CHAR(1) DEFAULT NULL,\n`col3` FLOAT DEFAULT NULL,\nPRIMARY KEY (`col1`)\n)
DROP TABLE `t18`;
DROP TABLE IF EXISTS `t19`;
CREATE TABLE `t19`(col1 int,col2 varchar(20),col3 double);
CREATE INDEX `ABc` ON t19(col2);
DROP INDEX `abc` ON t19;
select * from `t19`;
col1    col2    col3
show CREATE table `t19`;
Table    Create Table
t19    CREATE TABLE `t19` (\n`col1` INT DEFAULT NULL,\n`col2` VARCHAR(20) DEFAULT NULL,\n`col3` DOUBLE DEFAULT NULL\n)
DROP TABLE `t19`;
DROP ACCOUNT IF EXISTS `tenant_test`;
CREATE ACCOUNT `tenant_test` admin_name = 'root' identified by '111' open comment 'tenant_test';
ALTER ACCOUNT `tenant_TEST` comment 'abcddddddfsfafaffsefsfsefljofiseosfjosisssssssssssssssssssssssssssssssssssssssssssssssssssssssssssss24444444444444444444444444222222222@fffffffffffffffffffffffffffffffffffffffffffffffffffff';
CREATE ACCOUNT `tenant_TEST` admin_name = 'root' identified by '111' open comment 'tenant_test';
internal error: the tenant tenant_test exists
CREATE ACCOUNT `TENANT_TEST` admin_name = 'root' identified by '111' open comment 'tenant_test';
internal error: the tenant tenant_test exists
SELECT `account_name`,`status`,`comments` FROM `mo_catalog`.`mo_account` WHERE `account_name` = 'tenant_test';
account_name    status    comments
tenant_test    open    abcddddddfsfafaffsefsfsefljofiseosfjosisssssssssssssssssssssssssssssssssssssssssssssssssssssssssssss24444444444444444444444444222222222@fffffffffffffffffffffffffffffffffffffffffffffffffffff
DROP ACCOUNT IF EXISTS TENANT_TEST;
DROP ROLE IF EXISTS `rolex`;
CREATE ROLE `rolex`;
CREATE ROLE `Rolex`;
internal error: the role rolex exists
CREATE ROLE `ROLEX`;
internal error: the role rolex exists
SELECT role_name,comments FROM `mo_catalog`.`mo_role`;
role_name    comments
rolex    
moadmin    
public    
SELECT role_name,COmments FROM `mo_catalog`.`mo_role` WHERE `role_name` = 'Rolex';
role_name    comments
DROP ROLE `Rolex`;
DROP USER IF EXISTS `user_name`;
CREATE USER `user_name` IDENTIFIED BY '123456';
CREATE USER `USER_NAME` IDENTIFIED BY '123456';
internal error: the user user_name exists
CREATE USER `USER_name` IDENTIFIED BY '123456';
internal error: the user user_name exists
SELECT `user_host`,`user_name`,`status` FROM `mo_catalog`.`mo_user`;
user_host    user_name    status
localhost    user_name    unlock
localhost    root    unlock
localhost    dump    unlock
SELECT `user_host`,`user_name`,`status` FROM `mo_catalog`.`mo_user` WHERE user_name = 'User_name';
user_host    user_name    status
DROP USER `user_name`;
DROP DATABASE `test06`;
drop database if exists `test10`;
create database `test10`;
use `test10`;
DROP TABLE IF EXISTS `t20`;
DROP TABLE IF EXISTS `t21`;
DROP VIEW IF EXISTS `view1`;
CREATE TABLE `t20`(a INTEGER);
INSERT INTO `t20` VALUES (1),(2);
CREATE TABLE `t21`(a INTEGER);
INSERT INTO `t21` VALUES (1);
CREATE VIEW `view1` AS SELECT t20.a, T21.a AS b FROM t20 LEFT JOIN t21 USING(a);
CREATE VIEW `VIEW1` AS SELECT t20.a, t21.a AS b FROM t20 LEFT JOIN t21 USING(a);
table view1 already exists
SELECT * FROM `view1`;
a    b
1    1
2    null
DROP VIEW `view1`;
DROP TABLE `t20`;
DROP TABLE `t21`;
DROP TABLE IF EXISTS `TaB`;
DROP VIEW IF EXISTS `ViE`;
CREATE TABLE `TaB`(Field int);
INSERT INTO TAB VALUES(10);
CREATE VIEW `ViE` AS SELECT * FROM `TAb`;
show CREATE TABLE `VIe`;
View    Create View
vie    CREATE VIEW `ViE` AS SELECT * FROM `TAb`;
DROP view `VIE`;
DROP table `TAB`;
DROP TABLE IF EXISTS `t22`;
DROP VIEW IF EXISTS `view01`;
CREATE TABLE `t22` (a int);
INSERT INTO `t22` VALUES(1),(2),(3),(4);
CREATE VIEW `view01` AS SELECT * FROM `t22`;
ALTER VIEW `VIEW01` AS SELECT * FROM `t22` WHERE a=1;
SELECT * FROM `view01`;
a
1
SELECT * FROM `view01` WHERE A = 1;
a
1
DROP view `vieW01`;
drop database if exists `test10`;
DROP DATABASE IF EXISTS `test07`;
DROP TABLE IF EXISTS `t1`;
CREATE DATABASE `test07`;
USE `test07`;
CREATE TEMPORARY TABLE `t1`(a float);
INSERT INTO `T1` VALUES(213823.12);
INSERT INTO `t1` VALUES(-45412.38920);
SELECT * FROM `t1`;
a
213823.12
-45412.39
DROP TABLE `t1`;
DROP DATABASE `TEST07`;
drop database if exists `test11`;
create database `test11`;
use `test11`;
DROP TABLE IF EXISTS `t4`;
DROP TABLE IF EXISTS `t5`;
CREATE TABLE `t4`(a int primary key,b varchar(5));
CREATE TABLE `t5`(a int ,b varchar(5), C int, constraint fc foreign key(C) references t4(a));
ALTER table `t5` DROP FOREIGN KEY fC;
ALTER table `t5` ADD constraint fC foreign key(c) REFERENCES t4(a);
show CREATE TABLE `t4`;
Table    Create Table
t4    CREATE TABLE `t4` (\n`a` INT NOT NULL,\n`b` VARCHAR(5) DEFAULT NULL,\nPRIMARY KEY (`a`)\n)
show CREATE TABLE `T5`;
Table    Create Table
t5    CREATE TABLE `t5` (\n`a` INT DEFAULT NULL,\n`b` VARCHAR(5) DEFAULT NULL,\n`c` INT DEFAULT NULL,\nCONSTRAINT `fc` FOREIGN KEY (`c`) REFERENCES `t4` (`a`) ON DELETE RESTRICT ON UPDATE RESTRICT\n)
DROP table `t5`;
DROP table `t4`;
drop database if exists `test11`;
DROP DATABASE IF EXISTS `test08`;
CREATE DATABASE `test08`;
use  `test08`;
DROP table IF EXISTS `table02`;
CREATE external table `table02`(clo1 int,clo2 bigint)infile{"filepath"='$resources/external_table_file/aaa.csv'} fields terminated by ',';
SELECT * FROM `Table02`;
clo1    clo2
1    2131420000000000
2    325465476
3    -1
drop table table02;
DROP DATABASE `TEST08`;
