drop table if exists t1;
CREATE TABLE t1 (
col1 INT NOT NULL,
col2 DATE NOT NULL,
col3 INT NOT NULL UNIQUE
)
PARTITION BY KEY(col3)
PARTITIONS 4;
insert into t1 values
(1, '1980-12-17', 7369),
(2, '1981-02-20', 7499),
(3, '1981-02-22', 7521),
(4, '1981-04-02', 7566),
(5, '1981-09-28', 7654),
(6, '1981-05-01', 7698),
(7, '1981-06-09', 7782),
(8, '0087-07-13', 7788),
(9, '1981-11-17', 7839),
(10, '1981-09-08', 7844),
(11, '2007-07-13', 7876),
(12, '1981-12-03', 7900),
(13, '1987-07-13', 7980),
(14, '2001-11-17', 7981),
(15, '1951-11-08', 7982),
(16, '1927-10-13', 7983),
(17, '1671-12-09', 7984),
(18, '1981-11-06', 7985),
(19, '1771-12-06', 7986),
(20, '1985-10-06', 7987),
(21, '1771-10-06', 7988),
(22, '1981-10-05', 7989),
(23, '2001-12-04', 7990),
(24, '1999-08-01', 7991),
(25, '1951-11-08', 7992),
(26, '1927-10-13', 7993),
(27, '1971-12-09', 7994),
(28, '1981-12-09', 7995),
(29, '2001-11-17', 7996),
(30, '1981-12-09', 7997),
(31, '2001-11-17', 7998),
(32, '2001-11-17', 7999);
select * from `%!%p0%!%t1` order by col1;
col1    col2    col3
9    1981-11-17    7839
12    1981-12-03    7900
20    1985-10-06    7987
23    2001-12-04    7990
25    1951-11-08    7992
27    1971-12-09    7994
28    1981-12-09    7995
29    2001-11-17    7996
31    2001-11-17    7998
select * from `%!%p1%!%t1` order by col1;
col1    col2    col3
1    1980-12-17    7369
19    1771-12-06    7986
21    1771-10-06    7988
22    1981-10-05    7989
select * from `%!%p2%!%t1` order by col1;
col1    col2    col3
5    1981-09-28    7654
6    1981-05-01    7698
10    1981-09-08    7844
16    1927-10-13    7983
17    1671-12-09    7984
24    1999-08-01    7991
26    1927-10-13    7993
30    1981-12-09    7997
32    2001-11-17    7999
select * from `%!%p3%!%t1` order by col1;
col1    col2    col3
2    1981-02-20    7499
3    1981-02-22    7521
4    1981-04-02    7566
7    1981-06-09    7782
8    0087-07-13    7788
11    2007-07-13    7876
13    1987-07-13    7980
14    2001-11-17    7981
15    1951-11-08    7982
18    1981-11-06    7985
select * from t1 where col1 > 5 order by col3;
col1    col2    col3
6    1981-05-01    7698
7    1981-06-09    7782
8    0087-07-13    7788
9    1981-11-17    7839
10    1981-09-08    7844
11    2007-07-13    7876
12    1981-12-03    7900
13    1987-07-13    7980
14    2001-11-17    7981
15    1951-11-08    7982
16    1927-10-13    7983
17    1671-12-09    7984
18    1981-11-06    7985
19    1771-12-06    7986
20    1985-10-06    7987
21    1771-10-06    7988
22    1981-10-05    7989
23    2001-12-04    7990
24    1999-08-01    7991
25    1951-11-08    7992
26    1927-10-13    7993
27    1971-12-09    7994
28    1981-12-09    7995
29    2001-11-17    7996
30    1981-12-09    7997
31    2001-11-17    7998
32    2001-11-17    7999
delete from t1 where col1 > 20;
select * from t1 order by col1;
col1    col2    col3
1    1980-12-17    7369
2    1981-02-20    7499
3    1981-02-22    7521
4    1981-04-02    7566
5    1981-09-28    7654
6    1981-05-01    7698
7    1981-06-09    7782
8    0087-07-13    7788
9    1981-11-17    7839
10    1981-09-08    7844
11    2007-07-13    7876
12    1981-12-03    7900
13    1987-07-13    7980
14    2001-11-17    7981
15    1951-11-08    7982
16    1927-10-13    7983
17    1671-12-09    7984
18    1981-11-06    7985
19    1771-12-06    7986
20    1985-10-06    7987
select * from `%!%p0%!%t1` order by col1;
col1    col2    col3
9    1981-11-17    7839
12    1981-12-03    7900
20    1985-10-06    7987
select * from `%!%p1%!%t1` order by col1;
col1    col2    col3
1    1980-12-17    7369
19    1771-12-06    7986
select * from `%!%p2%!%t1` order by col1;
col1    col2    col3
5    1981-09-28    7654
6    1981-05-01    7698
10    1981-09-08    7844
16    1927-10-13    7983
17    1671-12-09    7984
select * from `%!%p3%!%t1` order by col1;
col1    col2    col3
2    1981-02-20    7499
3    1981-02-22    7521
4    1981-04-02    7566
7    1981-06-09    7782
8    0087-07-13    7788
11    2007-07-13    7876
13    1987-07-13    7980
14    2001-11-17    7981
15    1951-11-08    7982
18    1981-11-06    7985
drop table t1;
drop table if exists t2;
CREATE TABLE t2 (
col1 INT NOT NULL,
col2 INT NOT NULL,
col3 DATE NOT NULL,
UNIQUE KEY (col1, col3)
)
PARTITION BY HASH(col1 + col3)
PARTITIONS 6;
insert into t2 values
(1, 7369, '1980-12-17'),
(2, 7499, '1981-02-20'),
(3, 7521, '1981-02-22'),
(4, 7566, '1981-04-02'),
(5, 7654, '1981-09-28'),
(6, 7698, '1981-05-01'),
(7, 7782, '1981-06-09'),
(8, 7788, '0087-07-13'),
(9, 7839, '1981-11-17'),
(10, 7844, '1981-09-08'),
(11, 7876, '2007-07-13'),
(12, 7900, '1981-12-03'),
(13, 7980, '1987-07-13'),
(14, 7981, '2001-11-17'),
(15, 7982, '1951-11-08'),
(16, 7983, '1927-10-13'),
(17, 7984, '1671-12-09'),
(18, 7985, '1981-11-06'),
(19, 7986, '1771-12-06'),
(20, 7987, '1985-10-06'),
(21, 7988, '1771-10-06'),
(22, 7989, '1981-10-05'),
(23, 7990, '2001-12-04'),
(24, 7991, '1999-08-01'),
(25, 7992, '1951-11-08'),
(26, 7993, '1927-10-13'),
(27, 7994, '1971-12-09'),
(28, 7995, '1981-12-09'),
(29, 7996, '2001-11-17'),
(30, 7997, '1981-12-09'),
(31, 7998, '2001-11-17'),
(32, 7999, '2001-11-17'),
(33, 7980, '1987-07-13'),
(34, 7981, '2001-11-17'),
(35, 7982, '1951-11-08'),
(36, 7983, '1927-10-13'),
(37, 7984, '1671-12-09'),
(38, 7985, '1981-11-06'),
(39, 7986, '1771-12-06'),
(40, 7987, '1985-10-06');
SELECT * from t2 WHERE col1 BETWEEN 0 and 25 order by col1;
col1    col2    col3
1    7369    1980-12-17
2    7499    1981-02-20
3    7521    1981-02-22
4    7566    1981-04-02
5    7654    1981-09-28
6    7698    1981-05-01
7    7782    1981-06-09
8    7788    0087-07-13
9    7839    1981-11-17
10    7844    1981-09-08
11    7876    2007-07-13
12    7900    1981-12-03
13    7980    1987-07-13
14    7981    2001-11-17
15    7982    1951-11-08
16    7983    1927-10-13
17    7984    1671-12-09
18    7985    1981-11-06
19    7986    1771-12-06
20    7987    1985-10-06
21    7988    1771-10-06
22    7989    1981-10-05
23    7990    2001-12-04
24    7991    1999-08-01
25    7992    1951-11-08
SELECT * from t2 WHERE col1 BETWEEN 26 and 30 order by col1;
col1    col2    col3
26    7993    1927-10-13
27    7994    1971-12-09
28    7995    1981-12-09
29    7996    2001-11-17
30    7997    1981-12-09
select * from `%!%p0%!%t2` order by col1;
col1    col2    col3
7    7782    1981-06-09
17    7984    1671-12-09
20    7987    1985-10-06
25    7992    1951-11-08
29    7996    2001-11-17
33    7980    1987-07-13
select * from `%!%p1%!%t2` order by col1;
col1    col2    col3
1    7369    1980-12-17
5    7654    1981-09-28
21    7988    1771-10-06
23    7990    2001-12-04
select * from `%!%p2%!%t2` order by col1;
col1    col2    col3
3    7521    1981-02-22
4    7566    1981-04-02
10    7844    1981-09-08
26    7993    1927-10-13
27    7994    1971-12-09
36    7983    1927-10-13
select * from `%!%p3%!%t2` order by col1;
col1    col2    col3
6    7698    1981-05-01
12    7900    1981-12-03
14    7981    2001-11-17
15    7982    1951-11-08
16    7983    1927-10-13
22    7989    1981-10-05
24    7991    1999-08-01
31    7998    2001-11-17
delete from t2 where col1 > 30;
select * from t2 order by col1;
col1    col2    col3
1    7369    1980-12-17
2    7499    1981-02-20
3    7521    1981-02-22
4    7566    1981-04-02
5    7654    1981-09-28
6    7698    1981-05-01
7    7782    1981-06-09
8    7788    0087-07-13
9    7839    1981-11-17
10    7844    1981-09-08
11    7876    2007-07-13
12    7900    1981-12-03
13    7980    1987-07-13
14    7981    2001-11-17
15    7982    1951-11-08
16    7983    1927-10-13
17    7984    1671-12-09
18    7985    1981-11-06
19    7986    1771-12-06
20    7987    1985-10-06
21    7988    1771-10-06
22    7989    1981-10-05
23    7990    2001-12-04
24    7991    1999-08-01
25    7992    1951-11-08
26    7993    1927-10-13
27    7994    1971-12-09
28    7995    1981-12-09
29    7996    2001-11-17
30    7997    1981-12-09
select * from `%!%p0%!%t2` order by col1;
col1    col2    col3
7    7782    1981-06-09
17    7984    1671-12-09
20    7987    1985-10-06
25    7992    1951-11-08
29    7996    2001-11-17
select * from `%!%p1%!%t2` order by col1;
col1    col2    col3
1    7369    1980-12-17
5    7654    1981-09-28
21    7988    1771-10-06
23    7990    2001-12-04
select * from `%!%p2%!%t2` order by col1;
col1    col2    col3
3    7521    1981-02-22
4    7566    1981-04-02
10    7844    1981-09-08
26    7993    1927-10-13
27    7994    1971-12-09
select * from `%!%p3%!%t2` order by col1;
col1    col2    col3
6    7698    1981-05-01
12    7900    1981-12-03
14    7981    2001-11-17
15    7982    1951-11-08
16    7983    1927-10-13
22    7989    1981-10-05
24    7991    1999-08-01
drop table t2;
drop table if exists t3;
CREATE TABLE t3 (
id int NOT NULL AUTO_INCREMENT,
key_num int NOT NULL DEFAULT '0',
hiredate date NOT NULL,
PRIMARY KEY (id),
KEY key_num (key_num)
)
PARTITION BY RANGE COLUMNS(id) (
PARTITION p0 VALUES LESS THAN(10),
PARTITION p1 VALUES LESS THAN(20),
PARTITION p2 VALUES LESS THAN(30),
PARTITION p3 VALUES LESS THAN(MAXVALUE)
);
insert into t3 values
(1, 7369, '1980-12-17'),
(2, 7499, '1981-02-20'),
(3, 7521, '1981-02-22'),
(4, 7566, '1981-04-02'),
(5, 7654, '1981-09-28'),
(6, 7698, '1981-05-01'),
(7, 7782, '1981-06-09'),
(8, 7788, '0087-07-13'),
(9, 7839, '1981-11-17'),
(10, 7844, '1981-09-08'),
(11, 7876, '2007-07-13'),
(12, 7900, '1981-12-03'),
(13, 7980, '1987-07-13'),
(14, 7981, '2001-11-17'),
(15, 7982, '1951-11-08'),
(16, 7983, '1927-10-13'),
(17, 7984, '1671-12-09'),
(18, 7985, '1981-11-06'),
(19, 7986, '1771-12-06'),
(20, 7987, '1985-10-06'),
(21, 7988, '1771-10-06'),
(22, 7989, '1981-10-05'),
(23, 7990, '2001-12-04'),
(24, 7991, '1999-08-01'),
(25, 7992, '1951-11-08'),
(26, 7993, '1927-10-13'),
(27, 7994, '1971-12-09'),
(28, 7995, '1981-12-09'),
(29, 7996, '2001-11-17'),
(30, 7997, '1981-12-09'),
(31, 7998, '2001-11-17'),
(32, 7999, '2001-11-17'),
(33, 7980, '1987-07-13'),
(34, 7981, '2001-11-17'),
(35, 7982, '1951-11-08'),
(36, 7983, '1927-10-13'),
(37, 7984, '1671-12-09'),
(38, 7985, '1981-11-06'),
(39, 7986, '1771-12-06'),
(40, 7987, '1985-10-06');
SELECT * from t3 WHERE id BETWEEN 0 and 9 order by id;
id    key_num    hiredate
1    7369    1980-12-17
2    7499    1981-02-20
3    7521    1981-02-22
4    7566    1981-04-02
5    7654    1981-09-28
6    7698    1981-05-01
7    7782    1981-06-09
8    7788    0087-07-13
9    7839    1981-11-17
SELECT * from t3 WHERE id BETWEEN 20 and 29 order by id;
id    key_num    hiredate
20    7987    1985-10-06
21    7988    1771-10-06
22    7989    1981-10-05
23    7990    2001-12-04
24    7991    1999-08-01
25    7992    1951-11-08
26    7993    1927-10-13
27    7994    1971-12-09
28    7995    1981-12-09
29    7996    2001-11-17
select * from `%!%p0%!%t3` order by id;
id    key_num    hiredate
1    7369    1980-12-17
2    7499    1981-02-20
3    7521    1981-02-22
4    7566    1981-04-02
5    7654    1981-09-28
6    7698    1981-05-01
7    7782    1981-06-09
8    7788    0087-07-13
9    7839    1981-11-17
select * from `%!%p1%!%t3` order by id;
id    key_num    hiredate
10    7844    1981-09-08
11    7876    2007-07-13
12    7900    1981-12-03
13    7980    1987-07-13
14    7981    2001-11-17
15    7982    1951-11-08
16    7983    1927-10-13
17    7984    1671-12-09
18    7985    1981-11-06
19    7986    1771-12-06
select * from `%!%p2%!%t3` order by id;
id    key_num    hiredate
20    7987    1985-10-06
21    7988    1771-10-06
22    7989    1981-10-05
23    7990    2001-12-04
24    7991    1999-08-01
25    7992    1951-11-08
26    7993    1927-10-13
27    7994    1971-12-09
28    7995    1981-12-09
29    7996    2001-11-17
select * from `%!%p3%!%t3` order by id;
id    key_num    hiredate
30    7997    1981-12-09
31    7998    2001-11-17
32    7999    2001-11-17
33    7980    1987-07-13
34    7981    2001-11-17
35    7982    1951-11-08
36    7983    1927-10-13
37    7984    1671-12-09
38    7985    1981-11-06
39    7986    1771-12-06
40    7987    1985-10-06
delete from t3 where id > 30;
select * from t3 order by id;
id    key_num    hiredate
1    7369    1980-12-17
2    7499    1981-02-20
3    7521    1981-02-22
4    7566    1981-04-02
5    7654    1981-09-28
6    7698    1981-05-01
7    7782    1981-06-09
8    7788    0087-07-13
9    7839    1981-11-17
10    7844    1981-09-08
11    7876    2007-07-13
12    7900    1981-12-03
13    7980    1987-07-13
14    7981    2001-11-17
15    7982    1951-11-08
16    7983    1927-10-13
17    7984    1671-12-09
18    7985    1981-11-06
19    7986    1771-12-06
20    7987    1985-10-06
21    7988    1771-10-06
22    7989    1981-10-05
23    7990    2001-12-04
24    7991    1999-08-01
25    7992    1951-11-08
26    7993    1927-10-13
27    7994    1971-12-09
28    7995    1981-12-09
29    7996    2001-11-17
30    7997    1981-12-09
select * from `%!%p0%!%t3` order by id;
id    key_num    hiredate
1    7369    1980-12-17
2    7499    1981-02-20
3    7521    1981-02-22
4    7566    1981-04-02
5    7654    1981-09-28
6    7698    1981-05-01
7    7782    1981-06-09
8    7788    0087-07-13
9    7839    1981-11-17
select * from `%!%p1%!%t3` order by id;
id    key_num    hiredate
10    7844    1981-09-08
11    7876    2007-07-13
12    7900    1981-12-03
13    7980    1987-07-13
14    7981    2001-11-17
15    7982    1951-11-08
16    7983    1927-10-13
17    7984    1671-12-09
18    7985    1981-11-06
19    7986    1771-12-06
select * from `%!%p2%!%t3` order by id;
id    key_num    hiredate
20    7987    1985-10-06
21    7988    1771-10-06
22    7989    1981-10-05
23    7990    2001-12-04
24    7991    1999-08-01
25    7992    1951-11-08
26    7993    1927-10-13
27    7994    1971-12-09
28    7995    1981-12-09
29    7996    2001-11-17
select * from `%!%p3%!%t3` order by id;
id    key_num    hiredate
30    7997    1981-12-09
drop table t3;
drop table if exists titles;
CREATE TABLE titles (
emp_no      INT             NOT NULL,
title       VARCHAR(50)     NOT NULL,
from_date   DATE            NOT NULL,
to_date     DATE,
PRIMARY KEY (emp_no, title, from_date)
)
partition by range (to_days(from_date))
(
partition p01 values less than (to_days('1985-12-31')),
partition p02 values less than (to_days('1986-12-31')),
partition p03 values less than (to_days('1987-12-31')),
partition p04 values less than (to_days('1988-12-31')),
partition p05 values less than (to_days('1989-12-31')),
partition p06 values less than (to_days('1990-12-31')),
partition p07 values less than (to_days('1991-12-31')),
partition p08 values less than (to_days('1992-12-31')),
partition p09 values less than (to_days('1993-12-31')),
partition p10 values less than (to_days('1994-12-31')),
partition p11 values less than (to_days('1995-12-31')),
partition p12 values less than (to_days('1996-12-31')),
partition p13 values less than (to_days('1997-12-31')),
partition p14 values less than (to_days('1998-12-31')),
partition p15 values less than (to_days('1999-12-31')),
partition p16 values less than (to_days('2000-12-31')),
partition p17 values less than (to_days('2001-12-31')),
partition p18 values less than (to_days('2002-12-31')),
partition p19 values less than (to_days('3000-12-31'))
);
INSERT INTO `titles` VALUES
(10001,'Senior Engineer','1986-06-26','9999-01-01'),
(10002,'Staff','1996-08-03','9999-01-01'),
(10003,'Senior Engineer','1995-12-03','9999-01-01'),
(10004,'Engineer','1986-12-01','1995-12-01'),
(10004,'Senior Engineer','1995-12-01','9999-01-01'),
(10005,'Senior Staff','1996-09-12','9999-01-01'),
(10005,'Staff','1989-09-12','1996-09-12'),
(10006,'Senior Engineer','1990-08-05','9999-01-01'),
(10007,'Senior Staff','1996-02-11','9999-01-01'),
(10007,'Staff','1989-02-10','1996-02-11'),
(10008,'Assistant Engineer','1998-03-11','2000-07-31'),
(10009,'Assistant Engineer','1985-02-18','1990-02-18'),
(10009,'Engineer','1990-02-18','1995-02-18'),
(10009,'Senior Engineer','1995-02-18','9999-01-01'),
(10010,'Engineer','1996-11-24','9999-01-01'),
(10011,'Staff','1990-01-22','1996-11-09'),
(10012,'Engineer','1992-12-18','2000-12-18'),
(10012,'Senior Engineer','2000-12-18','9999-01-01'),
(10013,'Senior Staff','1985-10-20','9999-01-01'),
(10014,'Engineer','1993-12-29','9999-01-01'),
(10015,'Senior Staff','1992-09-19','1993-08-22'),
(10016,'Staff','1998-02-11','9999-01-01'),
(10017,'Senior Staff','2000-08-03','9999-01-01'),
(10017,'Staff','1993-08-03','2000-08-03'),
(10018,'Engineer','1987-04-03','1995-04-03'),
(10018,'Senior Engineer','1995-04-03','9999-01-01'),
(10019,'Staff','1999-04-30','9999-01-01'),
(10020,'Engineer','1997-12-30','9999-01-01'),
(10021,'Technique Leader','1988-02-10','2002-07-15'),
(10022,'Engineer','1999-09-03','9999-01-01'),
(10023,'Engineer','1999-09-27','9999-01-01'),
(10024,'Assistant Engineer','1998-06-14','9999-01-01'),
(10025,'Technique Leader','1987-08-17','1997-10-15'),
(10026,'Engineer','1995-03-20','2001-03-19'),
(10026,'Senior Engineer','2001-03-19','9999-01-01'),
(10027,'Engineer','1995-04-02','2001-04-01'),
(10027,'Senior Engineer','2001-04-01','9999-01-01'),
(10028,'Engineer','1991-10-22','1998-04-06'),
(10029,'Engineer','1991-09-18','2000-09-17'),
(10029,'Senior Engineer','2000-09-17','9999-01-01'),
(10030,'Engineer','1994-02-17','2001-02-17'),
(10030,'Senior Engineer','2001-02-17','9999-01-01');
select * from titles order by emp_no;
emp_no    title    from_date    to_date
10001    Senior Engineer    1986-06-26    9999-01-01
10002    Staff    1996-08-03    9999-01-01
10003    Senior Engineer    1995-12-03    9999-01-01
10004    Engineer    1986-12-01    1995-12-01
10004    Senior Engineer    1995-12-01    9999-01-01
10005    Staff    1989-09-12    1996-09-12
10005    Senior Staff    1996-09-12    9999-01-01
10006    Senior Engineer    1990-08-05    9999-01-01
10007    Staff    1989-02-10    1996-02-11
10007    Senior Staff    1996-02-11    9999-01-01
10008    Assistant Engineer    1998-03-11    2000-07-31
10009    Assistant Engineer    1985-02-18    1990-02-18
10009    Engineer    1990-02-18    1995-02-18
10009    Senior Engineer    1995-02-18    9999-01-01
10010    Engineer    1996-11-24    9999-01-01
10011    Staff    1990-01-22    1996-11-09
10012    Engineer    1992-12-18    2000-12-18
10012    Senior Engineer    2000-12-18    9999-01-01
10013    Senior Staff    1985-10-20    9999-01-01
10014    Engineer    1993-12-29    9999-01-01
10015    Senior Staff    1992-09-19    1993-08-22
10016    Staff    1998-02-11    9999-01-01
10017    Staff    1993-08-03    2000-08-03
10017    Senior Staff    2000-08-03    9999-01-01
10018    Engineer    1987-04-03    1995-04-03
10018    Senior Engineer    1995-04-03    9999-01-01
10019    Staff    1999-04-30    9999-01-01
10020    Engineer    1997-12-30    9999-01-01
10021    Technique Leader    1988-02-10    2002-07-15
10022    Engineer    1999-09-03    9999-01-01
10023    Engineer    1999-09-27    9999-01-01
10024    Assistant Engineer    1998-06-14    9999-01-01
10025    Technique Leader    1987-08-17    1997-10-15
10026    Engineer    1995-03-20    2001-03-19
10026    Senior Engineer    2001-03-19    9999-01-01
10027    Engineer    1995-04-02    2001-04-01
10027    Senior Engineer    2001-04-01    9999-01-01
10028    Engineer    1991-10-22    1998-04-06
10029    Engineer    1991-09-18    2000-09-17
10029    Senior Engineer    2000-09-17    9999-01-01
10030    Engineer    1994-02-17    2001-02-17
10030    Senior Engineer    2001-02-17    9999-01-01
select * from `%!%p01%!%titles` order by emp_no;
emp_no    title    from_date    to_date
10009    Assistant Engineer    1985-02-18    1990-02-18
10013    Senior Staff    1985-10-20    9999-01-01
select * from `%!%p02%!%titles` order by emp_no;
emp_no    title    from_date    to_date
10001    Senior Engineer    1986-06-26    9999-01-01
10004    Engineer    1986-12-01    1995-12-01
select * from `%!%p03%!%titles` order by emp_no;
emp_no    title    from_date    to_date
10018    Engineer    1987-04-03    1995-04-03
10025    Technique Leader    1987-08-17    1997-10-15
select * from `%!%p04%!%titles` order by emp_no;
emp_no    title    from_date    to_date
10021    Technique Leader    1988-02-10    2002-07-15
select * from `%!%p05%!%titles` order by emp_no;
emp_no    title    from_date    to_date
10005    Staff    1989-09-12    1996-09-12
10007    Staff    1989-02-10    1996-02-11
select * from `%!%p06%!%titles` order by emp_no;
emp_no    title    from_date    to_date
10006    Senior Engineer    1990-08-05    9999-01-01
10009    Engineer    1990-02-18    1995-02-18
10011    Staff    1990-01-22    1996-11-09
select * from `%!%p07%!%titles` order by emp_no;
emp_no    title    from_date    to_date
10028    Engineer    1991-10-22    1998-04-06
10029    Engineer    1991-09-18    2000-09-17
select * from `%!%p08%!%titles` order by emp_no;
emp_no    title    from_date    to_date
10012    Engineer    1992-12-18    2000-12-18
10015    Senior Staff    1992-09-19    1993-08-22
select * from `%!%p09%!%titles` order by emp_no;
emp_no    title    from_date    to_date
10014    Engineer    1993-12-29    9999-01-01
10017    Staff    1993-08-03    2000-08-03
select * from `%!%p10%!%titles` order by emp_no;
emp_no    title    from_date    to_date
10030    Engineer    1994-02-17    2001-02-17
select * from `%!%p11%!%titles` order by emp_no;
emp_no    title    from_date    to_date
10003    Senior Engineer    1995-12-03    9999-01-01
10004    Senior Engineer    1995-12-01    9999-01-01
10009    Senior Engineer    1995-02-18    9999-01-01
10018    Senior Engineer    1995-04-03    9999-01-01
10026    Engineer    1995-03-20    2001-03-19
10027    Engineer    1995-04-02    2001-04-01
select * from `%!%p12%!%titles` order by emp_no;
emp_no    title    from_date    to_date
10002    Staff    1996-08-03    9999-01-01
10005    Senior Staff    1996-09-12    9999-01-01
10007    Senior Staff    1996-02-11    9999-01-01
10010    Engineer    1996-11-24    9999-01-01
select * from `%!%p13%!%titles` order by emp_no;
emp_no    title    from_date    to_date
10020    Engineer    1997-12-30    9999-01-01
select * from `%!%p14%!%titles` order by emp_no;
emp_no    title    from_date    to_date
10008    Assistant Engineer    1998-03-11    2000-07-31
10016    Staff    1998-02-11    9999-01-01
10024    Assistant Engineer    1998-06-14    9999-01-01
select * from `%!%p15%!%titles` order by emp_no;
emp_no    title    from_date    to_date
10019    Staff    1999-04-30    9999-01-01
10022    Engineer    1999-09-03    9999-01-01
10023    Engineer    1999-09-27    9999-01-01
select * from `%!%p16%!%titles` order by emp_no;
emp_no    title    from_date    to_date
10012    Senior Engineer    2000-12-18    9999-01-01
10017    Senior Staff    2000-08-03    9999-01-01
10029    Senior Engineer    2000-09-17    9999-01-01
select * from `%!%p17%!%titles` order by emp_no;
emp_no    title    from_date    to_date
10026    Senior Engineer    2001-03-19    9999-01-01
10027    Senior Engineer    2001-04-01    9999-01-01
10030    Senior Engineer    2001-02-17    9999-01-01
select * from `%!%p18%!%titles` order by emp_no;
emp_no    title    from_date    to_date
select * from `%!%p19%!%titles` order by emp_no;
emp_no    title    from_date    to_date
select to_days(from_date) from titles order by emp_no;
to_days(from_date)
725548
729239
728995
725706
728993
726722
729279
727049
726508
729065
729824
725055
726881
728707
729352
726854
727915
730837
725299
728291
727825
729796
728143
730700
725829
728751
730239
729753
726142
730365
730389
729919
725965
728737
730928
728750
730941
727492
727458
730745
728341
730898
select * from titles where to_days(from_date) between to_days('1988-12-31') and to_days('1992-12-31');
emp_no    title    from_date    to_date
10005    Staff    1989-09-12    1996-09-12
10007    Staff    1989-02-10    1996-02-11
10006    Senior Engineer    1990-08-05    9999-01-01
10009    Engineer    1990-02-18    1995-02-18
10011    Staff    1990-01-22    1996-11-09
10028    Engineer    1991-10-22    1998-04-06
10029    Engineer    1991-09-18    2000-09-17
10012    Engineer    1992-12-18    2000-12-18
10015    Senior Staff    1992-09-19    1993-08-22
delete from titles where to_days(from_date) between to_days('1988-12-31') and to_days('1992-12-31');
select * from titles order by emp_no;
emp_no    title    from_date    to_date
10001    Senior Engineer    1986-06-26    9999-01-01
10002    Staff    1996-08-03    9999-01-01
10003    Senior Engineer    1995-12-03    9999-01-01
10004    Engineer    1986-12-01    1995-12-01
10004    Senior Engineer    1995-12-01    9999-01-01
10005    Senior Staff    1996-09-12    9999-01-01
10007    Senior Staff    1996-02-11    9999-01-01
10008    Assistant Engineer    1998-03-11    2000-07-31
10009    Assistant Engineer    1985-02-18    1990-02-18
10009    Senior Engineer    1995-02-18    9999-01-01
10010    Engineer    1996-11-24    9999-01-01
10012    Senior Engineer    2000-12-18    9999-01-01
10013    Senior Staff    1985-10-20    9999-01-01
10014    Engineer    1993-12-29    9999-01-01
10016    Staff    1998-02-11    9999-01-01
10017    Staff    1993-08-03    2000-08-03
10017    Senior Staff    2000-08-03    9999-01-01
10018    Engineer    1987-04-03    1995-04-03
10018    Senior Engineer    1995-04-03    9999-01-01
10019    Staff    1999-04-30    9999-01-01
10020    Engineer    1997-12-30    9999-01-01
10021    Technique Leader    1988-02-10    2002-07-15
10022    Engineer    1999-09-03    9999-01-01
10023    Engineer    1999-09-27    9999-01-01
10024    Assistant Engineer    1998-06-14    9999-01-01
10025    Technique Leader    1987-08-17    1997-10-15
10026    Engineer    1995-03-20    2001-03-19
10026    Senior Engineer    2001-03-19    9999-01-01
10027    Engineer    1995-04-02    2001-04-01
10027    Senior Engineer    2001-04-01    9999-01-01
10029    Senior Engineer    2000-09-17    9999-01-01
10030    Engineer    1994-02-17    2001-02-17
10030    Senior Engineer    2001-02-17    9999-01-01
drop table titles;
drop table if exists employees;
CREATE TABLE employees (
id INT NOT NULL,
fname VARCHAR(30),
lname VARCHAR(30),
hired DATE NOT NULL DEFAULT '1970-01-01',
separated DATE NOT NULL DEFAULT '9999-12-31',
job_code INT,
store_id INT
)
PARTITION BY LIST(store_id) (
PARTITION pNorth VALUES IN (3,5,6,9,17),
PARTITION pEast VALUES IN (1,2,10,11,19,20),
PARTITION pWest VALUES IN (4,12,13,14,18),
PARTITION pCentral VALUES IN (7,8,15,16)
);
INSERT INTO employees VALUES
(10001, 'Georgi', 'Facello', '1953-09-02','1986-06-26',120, 1),
(10002, 'Bezalel', 'Simmel', '1964-06-02','1985-11-21',150, 7),
(10003, 'Parto', 'Bamford', '1959-12-03','1986-08-28',140, 3),
(10004, 'Chirstian', 'Koblick', '1954-05-01','1986-12-01',150, 3),
(10005, 'Kyoichi', 'Maliniak', '1955-01-21','1989-09-12',150, 18),
(10006, 'Anneke', 'Preusig', '1953-04-20','1989-06-02',150, 15),
(10007, 'Tzvetan', 'Zielinski', '1957-05-23','1989-02-10',110, 6),
(10008, 'Saniya', 'Kalloufi', '1958-02-19','1994-09-15',170, 10),
(10009, 'Sumant', 'Peac', '1952-04-19','1985-02-18',110, 13),
(10010, 'Duangkaew', 'Piveteau', '1963-06-01','1989-08-24',160, 10),
(10011, 'Mary', 'Sluis', '1953-11-07','1990-01-22',120, 8),
(10012, 'Patricio', 'Bridgland', '1960-10-04','1992-12-18',120, 7),
(10013, 'Eberhardt', 'Terkki', '1963-06-07','1985-10-20',160, 17),
(10014, 'Berni', 'Genin', '1956-02-12','1987-03-11',120, 15),
(10015, 'Guoxiang', 'Nooteboom', '1959-08-19','1987-07-02',140, 8),
(10016, 'Kazuhito', 'Cappelletti', '1961-05-02','1995-01-27',140, 2),
(10017, 'Cristinel', 'Bouloucos', '1958-07-06','1993-08-03',170, 10),
(10018, 'Kazuhide', 'Peha', '1954-06-19','1987-04-03',170, 2),
(10019, 'Lillian', 'Haddadi', '1953-01-23','1999-04-30',170, 13),
(10020, 'Mayuko', 'Warwick', '1952-12-24','1991-01-26',120, 1),
(10021, 'Ramzi', 'Erde', '1960-02-20','1988-02-10',120, 9),
(10022, 'Shahaf', 'Famili', '1952-07-08','1995-08-22',130, 10),
(10023, 'Bojan', 'Montemayor', '1953-09-29','1989-12-17',120, 5),
(10024, 'Suzette', 'Pettey', '1958-09-05','1997-05-19',130, 4),
(10025, 'Prasadram', 'Heyers', '1958-10-31','1987-08-17',180, 8),
(10026, 'Yongqiao', 'Berztiss', '1953-04-03','1995-03-20',170, 4),
(10027, 'Divier', 'Reistad', '1962-07-10','1989-07-07',180, 10),
(10028, 'Domenick', 'Tempesti', '1963-11-26','1991-10-22',110, 11),
(10029, 'Otmar', 'Herbst', '1956-12-13','1985-11-20',110, 12),
(10030, 'Elvis', 'Demeyer', '1958-07-14','1994-02-17',110, 1),
(10031, 'Karsten', 'Joslin', '1959-01-27','1991-09-01',110, 10),
(10032, 'Jeong', 'Reistad', '1960-08-09','1990-06-20',120, 19),
(10033, 'Arif', 'Merlo', '1956-11-14','1987-03-18',120, 14),
(10034, 'Bader', 'Swan', '1962-12-29','1988-09-21',130, 16),
(10035, 'Alain', 'Chappelet', '1953-02-08','1988-09-05',130, 3),
(10036, 'Adamantios', 'Portugali', '1959-08-10','1992-01-03',130, 14),
(10037, 'Pradeep', 'Makrucki', '1963-07-22','1990-12-05',140, 12),
(10038, 'Huan', 'Lortz', '1960-07-20','1989-09-20',140, 7),
(10039, 'Alejandro', 'Brender', '1959-10-01','1988-01-19',110, 20),
(10040, 'Weiyi', 'Meriste', '1959-09-13','1993-02-14',140, 17);
select * from employees order by id;
id    fname    lname    hired    separated    job_code    store_id
10001    Georgi    Facello    1953-09-02    1986-06-26    120    1
10002    Bezalel    Simmel    1964-06-02    1985-11-21    150    7
10003    Parto    Bamford    1959-12-03    1986-08-28    140    3
10004    Chirstian    Koblick    1954-05-01    1986-12-01    150    3
10005    Kyoichi    Maliniak    1955-01-21    1989-09-12    150    18
10006    Anneke    Preusig    1953-04-20    1989-06-02    150    15
10007    Tzvetan    Zielinski    1957-05-23    1989-02-10    110    6
10008    Saniya    Kalloufi    1958-02-19    1994-09-15    170    10
10009    Sumant    Peac    1952-04-19    1985-02-18    110    13
10010    Duangkaew    Piveteau    1963-06-01    1989-08-24    160    10
10011    Mary    Sluis    1953-11-07    1990-01-22    120    8
10012    Patricio    Bridgland    1960-10-04    1992-12-18    120    7
10013    Eberhardt    Terkki    1963-06-07    1985-10-20    160    17
10014    Berni    Genin    1956-02-12    1987-03-11    120    15
10015    Guoxiang    Nooteboom    1959-08-19    1987-07-02    140    8
10016    Kazuhito    Cappelletti    1961-05-02    1995-01-27    140    2
10017    Cristinel    Bouloucos    1958-07-06    1993-08-03    170    10
10018    Kazuhide    Peha    1954-06-19    1987-04-03    170    2
10019    Lillian    Haddadi    1953-01-23    1999-04-30    170    13
10020    Mayuko    Warwick    1952-12-24    1991-01-26    120    1
10021    Ramzi    Erde    1960-02-20    1988-02-10    120    9
10022    Shahaf    Famili    1952-07-08    1995-08-22    130    10
10023    Bojan    Montemayor    1953-09-29    1989-12-17    120    5
10024    Suzette    Pettey    1958-09-05    1997-05-19    130    4
10025    Prasadram    Heyers    1958-10-31    1987-08-17    180    8
10026    Yongqiao    Berztiss    1953-04-03    1995-03-20    170    4
10027    Divier    Reistad    1962-07-10    1989-07-07    180    10
10028    Domenick    Tempesti    1963-11-26    1991-10-22    110    11
10029    Otmar    Herbst    1956-12-13    1985-11-20    110    12
10030    Elvis    Demeyer    1958-07-14    1994-02-17    110    1
10031    Karsten    Joslin    1959-01-27    1991-09-01    110    10
10032    Jeong    Reistad    1960-08-09    1990-06-20    120    19
10033    Arif    Merlo    1956-11-14    1987-03-18    120    14
10034    Bader    Swan    1962-12-29    1988-09-21    130    16
10035    Alain    Chappelet    1953-02-08    1988-09-05    130    3
10036    Adamantios    Portugali    1959-08-10    1992-01-03    130    14
10037    Pradeep    Makrucki    1963-07-22    1990-12-05    140    12
10038    Huan    Lortz    1960-07-20    1989-09-20    140    7
10039    Alejandro    Brender    1959-10-01    1988-01-19    110    20
10040    Weiyi    Meriste    1959-09-13    1993-02-14    140    17
select * from `%!%pnorth%!%employees` order by id;
id    fname    lname    hired    separated    job_code    store_id
10003    Parto    Bamford    1959-12-03    1986-08-28    140    3
10004    Chirstian    Koblick    1954-05-01    1986-12-01    150    3
10007    Tzvetan    Zielinski    1957-05-23    1989-02-10    110    6
10013    Eberhardt    Terkki    1963-06-07    1985-10-20    160    17
10021    Ramzi    Erde    1960-02-20    1988-02-10    120    9
10023    Bojan    Montemayor    1953-09-29    1989-12-17    120    5
10035    Alain    Chappelet    1953-02-08    1988-09-05    130    3
10040    Weiyi    Meriste    1959-09-13    1993-02-14    140    17
select * from `%!%peast%!%employees` order by id;
id    fname    lname    hired    separated    job_code    store_id
10001    Georgi    Facello    1953-09-02    1986-06-26    120    1
10008    Saniya    Kalloufi    1958-02-19    1994-09-15    170    10
10010    Duangkaew    Piveteau    1963-06-01    1989-08-24    160    10
10016    Kazuhito    Cappelletti    1961-05-02    1995-01-27    140    2
10017    Cristinel    Bouloucos    1958-07-06    1993-08-03    170    10
10018    Kazuhide    Peha    1954-06-19    1987-04-03    170    2
10020    Mayuko    Warwick    1952-12-24    1991-01-26    120    1
10022    Shahaf    Famili    1952-07-08    1995-08-22    130    10
10027    Divier    Reistad    1962-07-10    1989-07-07    180    10
10028    Domenick    Tempesti    1963-11-26    1991-10-22    110    11
10030    Elvis    Demeyer    1958-07-14    1994-02-17    110    1
10031    Karsten    Joslin    1959-01-27    1991-09-01    110    10
10032    Jeong    Reistad    1960-08-09    1990-06-20    120    19
10039    Alejandro    Brender    1959-10-01    1988-01-19    110    20
select * from `%!%pwest%!%employees` order by id;
id    fname    lname    hired    separated    job_code    store_id
10005    Kyoichi    Maliniak    1955-01-21    1989-09-12    150    18
10009    Sumant    Peac    1952-04-19    1985-02-18    110    13
10019    Lillian    Haddadi    1953-01-23    1999-04-30    170    13
10024    Suzette    Pettey    1958-09-05    1997-05-19    130    4
10026    Yongqiao    Berztiss    1953-04-03    1995-03-20    170    4
10029    Otmar    Herbst    1956-12-13    1985-11-20    110    12
10033    Arif    Merlo    1956-11-14    1987-03-18    120    14
10036    Adamantios    Portugali    1959-08-10    1992-01-03    130    14
10037    Pradeep    Makrucki    1963-07-22    1990-12-05    140    12
select * from `%!%pcentral%!%employees` order by id;
id    fname    lname    hired    separated    job_code    store_id
10002    Bezalel    Simmel    1964-06-02    1985-11-21    150    7
10006    Anneke    Preusig    1953-04-20    1989-06-02    150    15
10011    Mary    Sluis    1953-11-07    1990-01-22    120    8
10012    Patricio    Bridgland    1960-10-04    1992-12-18    120    7
10014    Berni    Genin    1956-02-12    1987-03-11    120    15
10015    Guoxiang    Nooteboom    1959-08-19    1987-07-02    140    8
10025    Prasadram    Heyers    1958-10-31    1987-08-17    180    8
10034    Bader    Swan    1962-12-29    1988-09-21    130    16
10038    Huan    Lortz    1960-07-20    1989-09-20    140    7
delete from employees where id > 10030;
select * from employees order by id;
id    fname    lname    hired    separated    job_code    store_id
10001    Georgi    Facello    1953-09-02    1986-06-26    120    1
10002    Bezalel    Simmel    1964-06-02    1985-11-21    150    7
10003    Parto    Bamford    1959-12-03    1986-08-28    140    3
10004    Chirstian    Koblick    1954-05-01    1986-12-01    150    3
10005    Kyoichi    Maliniak    1955-01-21    1989-09-12    150    18
10006    Anneke    Preusig    1953-04-20    1989-06-02    150    15
10007    Tzvetan    Zielinski    1957-05-23    1989-02-10    110    6
10008    Saniya    Kalloufi    1958-02-19    1994-09-15    170    10
10009    Sumant    Peac    1952-04-19    1985-02-18    110    13
10010    Duangkaew    Piveteau    1963-06-01    1989-08-24    160    10
10011    Mary    Sluis    1953-11-07    1990-01-22    120    8
10012    Patricio    Bridgland    1960-10-04    1992-12-18    120    7
10013    Eberhardt    Terkki    1963-06-07    1985-10-20    160    17
10014    Berni    Genin    1956-02-12    1987-03-11    120    15
10015    Guoxiang    Nooteboom    1959-08-19    1987-07-02    140    8
10016    Kazuhito    Cappelletti    1961-05-02    1995-01-27    140    2
10017    Cristinel    Bouloucos    1958-07-06    1993-08-03    170    10
10018    Kazuhide    Peha    1954-06-19    1987-04-03    170    2
10019    Lillian    Haddadi    1953-01-23    1999-04-30    170    13
10020    Mayuko    Warwick    1952-12-24    1991-01-26    120    1
10021    Ramzi    Erde    1960-02-20    1988-02-10    120    9
10022    Shahaf    Famili    1952-07-08    1995-08-22    130    10
10023    Bojan    Montemayor    1953-09-29    1989-12-17    120    5
10024    Suzette    Pettey    1958-09-05    1997-05-19    130    4
10025    Prasadram    Heyers    1958-10-31    1987-08-17    180    8
10026    Yongqiao    Berztiss    1953-04-03    1995-03-20    170    4
10027    Divier    Reistad    1962-07-10    1989-07-07    180    10
10028    Domenick    Tempesti    1963-11-26    1991-10-22    110    11
10029    Otmar    Herbst    1956-12-13    1985-11-20    110    12
10030    Elvis    Demeyer    1958-07-14    1994-02-17    110    1
select * from `%!%pnorth%!%employees` order by id;
id    fname    lname    hired    separated    job_code    store_id
10003    Parto    Bamford    1959-12-03    1986-08-28    140    3
10004    Chirstian    Koblick    1954-05-01    1986-12-01    150    3
10007    Tzvetan    Zielinski    1957-05-23    1989-02-10    110    6
10013    Eberhardt    Terkki    1963-06-07    1985-10-20    160    17
10021    Ramzi    Erde    1960-02-20    1988-02-10    120    9
10023    Bojan    Montemayor    1953-09-29    1989-12-17    120    5
select * from `%!%peast%!%employees` order by id;
id    fname    lname    hired    separated    job_code    store_id
10001    Georgi    Facello    1953-09-02    1986-06-26    120    1
10008    Saniya    Kalloufi    1958-02-19    1994-09-15    170    10
10010    Duangkaew    Piveteau    1963-06-01    1989-08-24    160    10
10016    Kazuhito    Cappelletti    1961-05-02    1995-01-27    140    2
10017    Cristinel    Bouloucos    1958-07-06    1993-08-03    170    10
10018    Kazuhide    Peha    1954-06-19    1987-04-03    170    2
10020    Mayuko    Warwick    1952-12-24    1991-01-26    120    1
10022    Shahaf    Famili    1952-07-08    1995-08-22    130    10
10027    Divier    Reistad    1962-07-10    1989-07-07    180    10
10028    Domenick    Tempesti    1963-11-26    1991-10-22    110    11
10030    Elvis    Demeyer    1958-07-14    1994-02-17    110    1
select * from `%!%pwest%!%employees` order by id;
id    fname    lname    hired    separated    job_code    store_id
10005    Kyoichi    Maliniak    1955-01-21    1989-09-12    150    18
10009    Sumant    Peac    1952-04-19    1985-02-18    110    13
10019    Lillian    Haddadi    1953-01-23    1999-04-30    170    13
10024    Suzette    Pettey    1958-09-05    1997-05-19    130    4
10026    Yongqiao    Berztiss    1953-04-03    1995-03-20    170    4
10029    Otmar    Herbst    1956-12-13    1985-11-20    110    12
select * from `%!%pcentral%!%employees` order by id;
id    fname    lname    hired    separated    job_code    store_id
10002    Bezalel    Simmel    1964-06-02    1985-11-21    150    7
10006    Anneke    Preusig    1953-04-20    1989-06-02    150    15
10011    Mary    Sluis    1953-11-07    1990-01-22    120    8
10012    Patricio    Bridgland    1960-10-04    1992-12-18    120    7
10014    Berni    Genin    1956-02-12    1987-03-11    120    15
10015    Guoxiang    Nooteboom    1959-08-19    1987-07-02    140    8
10025    Prasadram    Heyers    1958-10-31    1987-08-17    180    8
drop table employees;
drop table if exists customers;
CREATE TABLE customers (
first_name VARCHAR(25),
last_name VARCHAR(25),
city VARCHAR(15),
renewal DATE
)
PARTITION BY LIST COLUMNS(renewal) (
PARTITION pWeek_1 VALUES IN('2010-02-01', '2010-02-02', '2010-02-03', '2010-02-04', '2010-02-05', '2010-02-06', '2010-02-07'),
PARTITION pWeek_2 VALUES IN('2010-02-08', '2010-02-09', '2010-02-10', '2010-02-11', '2010-02-12', '2010-02-13', '2010-02-14'),
PARTITION pWeek_3 VALUES IN('2010-02-15', '2010-02-16', '2010-02-17', '2010-02-18', '2010-02-19', '2010-02-20', '2010-02-21'),
PARTITION pWeek_4 VALUES IN('2010-02-22', '2010-02-23', '2010-02-24', '2010-02-25', '2010-02-26', '2010-02-27', '2010-02-28')
);
INSERT INTO customers VALUES
('Georgi', 'Facello', 'NEW YORK', '2010-02-01'),
('Bezalel', 'Simmel', 'San Francisco', '2010-02-08'),
('Parto', 'Bamford', 'NEW YORK', '2010-02-15'),
('Chirstian', 'Koblick', 'NEW YORK', '2010-02-22'),
('Kyoichi', 'Maliniak', 'NEW YORK', '2010-02-02'),
('Anneke', 'Preusig', 'BOSTON', '2010-02-09'),
('Tzvetan', 'Zielinski', 'BOSTON', '2010-02-16'),
('Saniya', 'Kalloufi', 'NEW YORK', '2010-02-23'),
('Sumant', 'Peac', 'Houston', '2010-02-03'),
('Duangkaew', 'Piveteau', 'NEW YORK', '2010-02-10'),
('Mary', 'Sluis', 'BOSTON', '2010-02-17'),
('Patricio', 'Bridgland', 'NEW YORK', '2010-02-24'),
('Eberhardt', 'Terkki', 'San Francisco', '2010-02-04'),
('Berni', 'Genin', 'San Francisco', '2010-02-11'),
('Guoxiang', 'Nooteboom', 'Houston', '2010-02-18'),
('Kazuhito', 'Cappelletti', 'San Francisco', '2010-02-25'),
('Cristinel', 'Bouloucos', 'San Francisco', '2010-02-05'),
('Kazuhide', 'Peha', 'Houston', '2010-02-12'),
('Lillian', 'Haddadi', 'San Francisco', '2010-02-19'),
('Mayuko', 'Warwick', 'DALLAS', '2010-02-26'),
('Ramzi', 'Erde', 'DALLAS', '2010-02-06'),
('Shahaf', 'Famili', 'San Francisco', '2010-02-13'),
('Bojan', 'Montemayor', 'DALLAS', '2010-02-20'),
('Suzette', 'Pettey', 'DALLAS', '2010-02-27'),
('Prasadram', 'Heyers', 'CHICAGO', '2010-02-07'),
('Yongqiao', 'Berztiss', 'San Francisco', '2010-02-14'),
('Divier', 'Reistad', 'CHICAGO', '2010-02-21'),
('Domenick', 'Tempesti', 'CHICAGO', '2010-02-28'),
('Otmar', 'Herbst', 'Houston', '2010-02-01'),
('Elvis', 'Demeyer', 'BOSTON', '2010-02-02'),
('Karsten', 'Joslin', 'BOSTON', '2010-02-03'),
('Jeong', 'Reistad', 'San Francisco', '2010-02-04'),
('Arif', 'Merlo', 'San Francisco', '2010-02-05'),
('Bader', 'Swan', 'San Francisco', '2010-02-06'),
('Alain', 'Chappelet', 'Houston', '2010-02-07'),
('Adamantios', 'Portugali', 'BOSTON', '2010-02-15'),
('Pradeep', 'Makrucki', 'San Francisco', '2010-02-16'),
('Huan', 'Lortz', 'BOSTON', '2010-02-17'),
('Alejandro',   'Brender', 'DALLAS', '2010-02-18'),
('Weiyi', 'Meriste', 'San Francisco', '2010-02-19');
select * from customers order by first_name;
first_name    last_name    city    renewal
Adamantios    Portugali    BOSTON    2010-02-15
Alain    Chappelet    Houston    2010-02-07
Alejandro    Brender    DALLAS    2010-02-18
Anneke    Preusig    BOSTON    2010-02-09
Arif    Merlo    San Francisco    2010-02-05
Bader    Swan    San Francisco    2010-02-06
Berni    Genin    San Francisco    2010-02-11
Bezalel    Simmel    San Francisco    2010-02-08
Bojan    Montemayor    DALLAS    2010-02-20
Chirstian    Koblick    NEW YORK    2010-02-22
Cristinel    Bouloucos    San Francisco    2010-02-05
Divier    Reistad    CHICAGO    2010-02-21
Domenick    Tempesti    CHICAGO    2010-02-28
Duangkaew    Piveteau    NEW YORK    2010-02-10
Eberhardt    Terkki    San Francisco    2010-02-04
Elvis    Demeyer    BOSTON    2010-02-02
Georgi    Facello    NEW YORK    2010-02-01
Guoxiang    Nooteboom    Houston    2010-02-18
Huan    Lortz    BOSTON    2010-02-17
Jeong    Reistad    San Francisco    2010-02-04
Karsten    Joslin    BOSTON    2010-02-03
Kazuhide    Peha    Houston    2010-02-12
Kazuhito    Cappelletti    San Francisco    2010-02-25
Kyoichi    Maliniak    NEW YORK    2010-02-02
Lillian    Haddadi    San Francisco    2010-02-19
Mary    Sluis    BOSTON    2010-02-17
Mayuko    Warwick    DALLAS    2010-02-26
Otmar    Herbst    Houston    2010-02-01
Parto    Bamford    NEW YORK    2010-02-15
Patricio    Bridgland    NEW YORK    2010-02-24
Pradeep    Makrucki    San Francisco    2010-02-16
Prasadram    Heyers    CHICAGO    2010-02-07
Ramzi    Erde    DALLAS    2010-02-06
Saniya    Kalloufi    NEW YORK    2010-02-23
Shahaf    Famili    San Francisco    2010-02-13
Sumant    Peac    Houston    2010-02-03
Suzette    Pettey    DALLAS    2010-02-27
Tzvetan    Zielinski    BOSTON    2010-02-16
Weiyi    Meriste    San Francisco    2010-02-19
Yongqiao    Berztiss    San Francisco    2010-02-14
select * from `%!%pweek_1%!%customers` order by first_name;
first_name    last_name    city    renewal
Alain    Chappelet    Houston    2010-02-07
Arif    Merlo    San Francisco    2010-02-05
Bader    Swan    San Francisco    2010-02-06
Cristinel    Bouloucos    San Francisco    2010-02-05
Eberhardt    Terkki    San Francisco    2010-02-04
Elvis    Demeyer    BOSTON    2010-02-02
Georgi    Facello    NEW YORK    2010-02-01
Jeong    Reistad    San Francisco    2010-02-04
Karsten    Joslin    BOSTON    2010-02-03
Kyoichi    Maliniak    NEW YORK    2010-02-02
Otmar    Herbst    Houston    2010-02-01
Prasadram    Heyers    CHICAGO    2010-02-07
Ramzi    Erde    DALLAS    2010-02-06
Sumant    Peac    Houston    2010-02-03
select * from `%!%pweek_2%!%customers` order by first_name;
first_name    last_name    city    renewal
Anneke    Preusig    BOSTON    2010-02-09
Berni    Genin    San Francisco    2010-02-11
Bezalel    Simmel    San Francisco    2010-02-08
Duangkaew    Piveteau    NEW YORK    2010-02-10
Kazuhide    Peha    Houston    2010-02-12
Shahaf    Famili    San Francisco    2010-02-13
Yongqiao    Berztiss    San Francisco    2010-02-14
select * from `%!%pweek_3%!%customers` order by first_name;
first_name    last_name    city    renewal
Adamantios    Portugali    BOSTON    2010-02-15
Alejandro    Brender    DALLAS    2010-02-18
Bojan    Montemayor    DALLAS    2010-02-20
Divier    Reistad    CHICAGO    2010-02-21
Guoxiang    Nooteboom    Houston    2010-02-18
Huan    Lortz    BOSTON    2010-02-17
Lillian    Haddadi    San Francisco    2010-02-19
Mary    Sluis    BOSTON    2010-02-17
Parto    Bamford    NEW YORK    2010-02-15
Pradeep    Makrucki    San Francisco    2010-02-16
Tzvetan    Zielinski    BOSTON    2010-02-16
Weiyi    Meriste    San Francisco    2010-02-19
select * from `%!%pweek_4%!%customers` order by first_name;
first_name    last_name    city    renewal
Chirstian    Koblick    NEW YORK    2010-02-22
Domenick    Tempesti    CHICAGO    2010-02-28
Kazuhito    Cappelletti    San Francisco    2010-02-25
Mayuko    Warwick    DALLAS    2010-02-26
Patricio    Bridgland    NEW YORK    2010-02-24
Saniya    Kalloufi    NEW YORK    2010-02-23
Suzette    Pettey    DALLAS    2010-02-27
delete from customers where city = 'NEW YORK';
select * from customers order by first_name;
first_name    last_name    city    renewal
Adamantios    Portugali    BOSTON    2010-02-15
Alain    Chappelet    Houston    2010-02-07
Alejandro    Brender    DALLAS    2010-02-18
Anneke    Preusig    BOSTON    2010-02-09
Arif    Merlo    San Francisco    2010-02-05
Bader    Swan    San Francisco    2010-02-06
Berni    Genin    San Francisco    2010-02-11
Bezalel    Simmel    San Francisco    2010-02-08
Bojan    Montemayor    DALLAS    2010-02-20
Cristinel    Bouloucos    San Francisco    2010-02-05
Divier    Reistad    CHICAGO    2010-02-21
Domenick    Tempesti    CHICAGO    2010-02-28
Eberhardt    Terkki    San Francisco    2010-02-04
Elvis    Demeyer    BOSTON    2010-02-02
Guoxiang    Nooteboom    Houston    2010-02-18
Huan    Lortz    BOSTON    2010-02-17
Jeong    Reistad    San Francisco    2010-02-04
Karsten    Joslin    BOSTON    2010-02-03
Kazuhide    Peha    Houston    2010-02-12
Kazuhito    Cappelletti    San Francisco    2010-02-25
Lillian    Haddadi    San Francisco    2010-02-19
Mary    Sluis    BOSTON    2010-02-17
Mayuko    Warwick    DALLAS    2010-02-26
Otmar    Herbst    Houston    2010-02-01
Pradeep    Makrucki    San Francisco    2010-02-16
Prasadram    Heyers    CHICAGO    2010-02-07
Ramzi    Erde    DALLAS    2010-02-06
Shahaf    Famili    San Francisco    2010-02-13
Sumant    Peac    Houston    2010-02-03
Suzette    Pettey    DALLAS    2010-02-27
Tzvetan    Zielinski    BOSTON    2010-02-16
Weiyi    Meriste    San Francisco    2010-02-19
Yongqiao    Berztiss    San Francisco    2010-02-14
select * from `%!%pweek_1%!%customers` order by first_name;
first_name    last_name    city    renewal
Alain    Chappelet    Houston    2010-02-07
Arif    Merlo    San Francisco    2010-02-05
Bader    Swan    San Francisco    2010-02-06
Cristinel    Bouloucos    San Francisco    2010-02-05
Eberhardt    Terkki    San Francisco    2010-02-04
Elvis    Demeyer    BOSTON    2010-02-02
Jeong    Reistad    San Francisco    2010-02-04
Karsten    Joslin    BOSTON    2010-02-03
Otmar    Herbst    Houston    2010-02-01
Prasadram    Heyers    CHICAGO    2010-02-07
Ramzi    Erde    DALLAS    2010-02-06
Sumant    Peac    Houston    2010-02-03
select * from `%!%pweek_2%!%customers` order by first_name;
first_name    last_name    city    renewal
Anneke    Preusig    BOSTON    2010-02-09
Berni    Genin    San Francisco    2010-02-11
Bezalel    Simmel    San Francisco    2010-02-08
Kazuhide    Peha    Houston    2010-02-12
Shahaf    Famili    San Francisco    2010-02-13
Yongqiao    Berztiss    San Francisco    2010-02-14
select * from `%!%pweek_3%!%customers` order by first_name;
first_name    last_name    city    renewal
Adamantios    Portugali    BOSTON    2010-02-15
Alejandro    Brender    DALLAS    2010-02-18
Bojan    Montemayor    DALLAS    2010-02-20
Divier    Reistad    CHICAGO    2010-02-21
Guoxiang    Nooteboom    Houston    2010-02-18
Huan    Lortz    BOSTON    2010-02-17
Lillian    Haddadi    San Francisco    2010-02-19
Mary    Sluis    BOSTON    2010-02-17
Pradeep    Makrucki    San Francisco    2010-02-16
Tzvetan    Zielinski    BOSTON    2010-02-16
Weiyi    Meriste    San Francisco    2010-02-19
select * from `%!%pweek_4%!%customers` order by first_name;
first_name    last_name    city    renewal
Domenick    Tempesti    CHICAGO    2010-02-28
Kazuhito    Cappelletti    San Francisco    2010-02-25
Mayuko    Warwick    DALLAS    2010-02-26
Suzette    Pettey    DALLAS    2010-02-27
drop table customers;
