drop table if exists prefix_idx_dml_sk;
create table prefix_idx_dml_sk(id int primary key, a varchar(32), b int, index idx_a(a(4)));
insert into prefix_idx_dml_sk values (1, 'abcdef-long', 10);
update prefix_idx_dml_sk set a = 'uvwxyz-long' where id = 1;
select id, a, b from prefix_idx_dml_sk where a = 'uvwxyz-long';
➤ id[4,32,0]  ¦  a[12,32,0]  ¦  b[4,32,0]  𝄀
1  ¦  uvwxyz-long  ¦  10
delete from prefix_idx_dml_sk where id = 1;
select count(*) from prefix_idx_dml_sk where a = 'uvwxyz-long';
➤ count(*)[-5,64,0]  𝄀
0
drop table prefix_idx_dml_sk;
drop table if exists prefix_idx_dml_uk;
create table prefix_idx_dml_uk(id int primary key, a varchar(32), b int, unique index uq_a(a(4)));
insert into prefix_idx_dml_uk values (1, 'abcdef-long', 10);
insert into prefix_idx_dml_uk values (2, 'abcdzz-conflict', 20);
Duplicate entry 'abcd' for key '(a|__mo_index_idx_col)'
update prefix_idx_dml_uk set a = 'uvwxyz-long' where id = 1;
insert into prefix_idx_dml_uk values (2, 'abcdef-new', 20);
delete from prefix_idx_dml_uk where id = 1;
insert into prefix_idx_dml_uk values (3, 'uvwxyz-new', 30);
select id, a, b from prefix_idx_dml_uk order by id;
➤ id[4,32,0]  ¦  a[12,32,0]  ¦  b[4,32,0]  𝄀
2  ¦  abcdef-new  ¦  20  𝄀
3  ¦  uvwxyz-new  ¦  30
select a from prefix_idx_dml_uk force index(uq_a) where a = 'abcdef-new';
➤ a[12,32,0]  𝄀
abcdef-new
drop table prefix_idx_dml_uk;
drop table if exists prefix_idx_dml_create_backfill;
create table prefix_idx_dml_create_backfill(id int primary key, a varchar(32), b int);
insert into prefix_idx_dml_create_backfill values (1, 'abcdef-long', 10), (2, 'lmnopq-long', 20);
create index idx_a on prefix_idx_dml_create_backfill(a(4));
update prefix_idx_dml_create_backfill set a = 'uvwxyz-long' where id = 1;
select id, a, b from prefix_idx_dml_create_backfill where a = 'uvwxyz-long';
➤ id[4,32,0]  ¦  a[12,32,0]  ¦  b[4,32,0]  𝄀
1  ¦  uvwxyz-long  ¦  10
delete from prefix_idx_dml_create_backfill where id = 2;
select count(*) from prefix_idx_dml_create_backfill where a = 'lmnopq-long';
➤ count(*)[-5,64,0]  𝄀
0
drop table prefix_idx_dml_create_backfill;
drop table if exists prefix_idx_dml_alter_add;
create table prefix_idx_dml_alter_add(id int primary key, a varchar(32), b int);
insert into prefix_idx_dml_alter_add values (1, 'abcdef-long', 10), (2, 'lmnopq-long', 20);
alter table prefix_idx_dml_alter_add add index idx_a(a(4));
update prefix_idx_dml_alter_add set a = 'uvwxyz-long' where id = 1;
select id, a, b from prefix_idx_dml_alter_add where a = 'uvwxyz-long';
➤ id[4,32,0]  ¦  a[12,32,0]  ¦  b[4,32,0]  𝄀
1  ¦  uvwxyz-long  ¦  10
delete from prefix_idx_dml_alter_add where id = 2;
select count(*) from prefix_idx_dml_alter_add where a = 'lmnopq-long';
➤ count(*)[-5,64,0]  𝄀
0
drop table prefix_idx_dml_alter_add;
drop table if exists prefix_idx_covering_scan;
create table prefix_idx_covering_scan(id int primary key, a varchar(32), b int, index idx_a(a(4)));
insert into prefix_idx_covering_scan values
(1, 'abc', 10),
(2, 'abcd', 20),
(3, 'abcdx', 30),
(4, 'abcdy', 40),
(5, '中中中中甲', 50),
(6, '中中中中乙', 60);
select count(*) from prefix_idx_covering_scan force index(idx_a) where a = 'abc';
➤ count(*)[-5,64,0]  𝄀
1
select count(*) from prefix_idx_covering_scan ignore index(idx_a) where a = 'abc';
➤ count(*)[-5,64,0]  𝄀
1
select count(*) from prefix_idx_covering_scan force index(idx_a) where a = 'abcd';
➤ count(*)[-5,64,0]  𝄀
1
select count(*) from prefix_idx_covering_scan ignore index(idx_a) where a = 'abcd';
➤ count(*)[-5,64,0]  𝄀
1
select count(*) from prefix_idx_covering_scan force index(idx_a) where a = 'abcdx';
➤ count(*)[-5,64,0]  𝄀
1
select count(*) from prefix_idx_covering_scan ignore index(idx_a) where a = 'abcdx';
➤ count(*)[-5,64,0]  𝄀
1
select a from prefix_idx_covering_scan force index(idx_a) where a = 'abcdx';
➤ a[12,32,0]  𝄀
abcdx
select a from prefix_idx_covering_scan ignore index(idx_a) where a = 'abcdx';
➤ a[12,32,0]  𝄀
abcdx
select a from prefix_idx_covering_scan force index(idx_a) where a = '中中中中甲';
➤ a[12,32,0]  𝄀
中中中中甲
select a from prefix_idx_covering_scan ignore index(idx_a) where a = '中中中中甲';
➤ a[12,32,0]  𝄀
中中中中甲
select id, a, b from prefix_idx_covering_scan force index(idx_a) where a = 'abcdx';
➤ id[4,32,0]  ¦  a[12,32,0]  ¦  b[4,32,0]  𝄀
3  ¦  abcdx  ¦  30
select mo_ctl('dn', 'flush', 'prefix_index_dml.prefix_idx_covering_scan');
➤ mo_ctl(dn, flush, prefix_index_dml.prefix_idx_covering_scan)[12,65535,0]  𝄀
{
  "method": "Flush",
  "result": [
    {
      "returnStr": "OK"
    }
  ]
}

select a from prefix_idx_covering_scan force index(idx_a) where a = 'abcdx';
➤ a[12,32,0]  𝄀
abcdx
select a from prefix_idx_covering_scan force index(idx_a) where a = '中中中中甲';
➤ a[12,32,0]  𝄀
中中中中甲
drop table prefix_idx_covering_scan;
