drop table if exists t1;
create table t1(id int PRIMARY KEY,name VARCHAR(255),age int);
create index idx1 on t1(name);
insert into t1 values(1,"Abby", 24);
insert into t1 values(2,"Deb", 26);
select * from t1;
id    name    age
1    Abby    24
2    Deb    26
update t1 set name = "Dora" where id = 2;
select * from t1;
id    name    age
1    Abby    24
2    Dora    26
update t1 set id=3 where id=2;
update t1 set name = "Abby" where id = 3;
select * from t1;
id    name    age
1    Abby    24
3    Abby    26
show index from t1;
Table    Non_unique    Key_name    Seq_in_index    Column_name    Collation    Cardinality    Sub_part    Packed    Null    Index_type    Comment    Index_comment    Index_params    Visible    Expression
t1    0    PRIMARY    1    id    A    0    NULL    NULL                        YES    NULL
t1    1    idx1    1    name    A    0    NULL    NULL    YES                    YES    NULL
show create table t1;
Table    Create Table
t1    CREATE TABLE `t1` (\n  `id` int NOT NULL,\n  `name` varchar(255) DEFAULT NULL,\n  `age` int DEFAULT NULL,\n  PRIMARY KEY (`id`),\n  KEY `idx1` (`name`)\n)
select name, type, column_name from mo_catalog.mo_indexes mi where name="idx1";
name    type    column_name
idx1    MULTIPLE    name
idx1    MULTIPLE    __mo_alias_id
drop table if exists t1;
create table t1(id int PRIMARY KEY,name VARCHAR(255),age int);
create index idx2 on t1(name);
insert into t1 values(1,"Abby", 24);
insert into t1 values(2,"Abby", 26);
select * from t1;
id    name    age
1    Abby    24
2    Abby    26
drop table if exists t1;
create table t1(id int PRIMARY KEY,name VARCHAR(255),age int);
create index idx3 on t1(name);
insert into t1 values(1,"Abby", 24);
insert into t1 values(2,"Dora", 25);
update t1 set name = "Abby" where id = 2;
select * from t1;
id    name    age
1    Abby    24
2    Abby    25
drop table if exists t1;
create table t1(id int PRIMARY KEY,name VARCHAR(255),age int);
create index idx4 on t1(name);
insert into t1 values(1,"Abby", 24);
insert into t1 values(2,"Dora", 25);
update t1 set name = null where id = 2;
select * from t1;
id    name    age
1    Abby    24
2    null    25
drop table if exists t1;
create table t1(id int PRIMARY KEY,name VARCHAR(255),age int);
create index idx5 on t1(name);
insert into t1 values(1,"Abby", 24);
insert into t1 (id, age) values(2, 25);
select * from t1;
id    name    age
1    Abby    24
2    null    25
drop table if exists t1;
create table t1(id VARCHAR(255) PRIMARY KEY,name VARCHAR(255),age VARCHAR(255));
create  index idx6 on t1(name);
insert into t1 values("a","Abby", "twenty four");
insert into t1 values("b","Debby", "twenty six");
select * from t1;
id    name    age
a    Abby    twenty four
b    Debby    twenty six
update t1 set name = null where id = "b";
select * from t1;
id    name    age
a    Abby    twenty four
b    null    twenty six
update t1 set name = "Cia" where id = "b";
select * from t1;
id    name    age
a    Abby    twenty four
b    Cia    twenty six
update t1 set name = null where id = "b";
select * from t1;
id    name    age
a    Abby    twenty four
b    null    twenty six
delete from t1 where id = "b";
select * from t1;
id    name    age
a    Abby    twenty four
