drop table if exists t1;
create table t1(id VARCHAR(20) PRIMARY KEY,name VARCHAR(255),age int);
create index idx1 on t1(name);
insert into t1 values("a","Abby", 24);
insert into t1 values("b","Deb", 26);
select * from t1;
id    name    age
a    Abby    24
b    Deb    26
show index from t1;
Table    Non_unique    Key_name    Seq_in_index    Column_name    Collation    Cardinality    Sub_part    Packed    Null    Index_type    Comment    Index_comment    Index_params    Visible    Expression
t1    0    PRIMARY    1    id    A    0    NULL    NULL                        YES    NULL
t1    1    idx1    1    name    A    0    NULL    NULL    YES                    YES    NULL
show create table t1;
Table    Create Table
t1    CREATE TABLE `t1` (\n  `id` varchar(20) NOT NULL,\n  `name` varchar(255) DEFAULT NULL,\n  `age` int DEFAULT NULL,\n  PRIMARY KEY (`id`),\n  KEY `idx1` (`name`)\n)
select name, type, column_name from mo_catalog.mo_indexes mi where name="idx1";
name    type    column_name
idx1    MULTIPLE    name
idx1    MULTIPLE    __mo_alias_id
alter table t1 add column id2 VARCHAR(20);
update t1 set id2 = id;
ALTER TABLE t1 DROP PRIMARY KEY, ADD PRIMARY KEY (id, id2);
show index from t1;
Table    Non_unique    Key_name    Seq_in_index    Column_name    Collation    Cardinality    Sub_part    Packed    Null    Index_type    Comment    Index_comment    Index_params    Visible    Expression
t1    1    idx1    1    name    A    0    NULL    NULL    YES                    YES    NULL
t1    0    PRIMARY    1    id    A    0    NULL    NULL                        YES    NULL
t1    0    PRIMARY    2    id2    A    0    NULL    NULL                        YES    NULL
show create table t1;
Table    Create Table
t1    CREATE TABLE `t1` (\n  `id` varchar(20) NOT NULL,\n  `name` varchar(255) DEFAULT NULL,\n  `age` int DEFAULT NULL,\n  `id2` varchar(20) NOT NULL,\n  PRIMARY KEY (`id`,`id2`),\n  KEY `idx1` (`name`)\n)
select name, type, column_name from mo_catalog.mo_indexes mi where name="idx1";
name    type    column_name
idx1    MULTIPLE    name
idx1    MULTIPLE    __mo_alias___mo_cpkey_col
insert into t1 values("d","Abby", 24,"d2");
alter table t1 drop column id2;
desc t1;
Field    Type    Null    Key    Default    Extra    Comment
id    VARCHAR(20)    NO    PRI    null        
name    VARCHAR(255)    YES    MUL    null        
age    INT(32)    YES        null        
show index from t1;
Table    Non_unique    Key_name    Seq_in_index    Column_name    Collation    Cardinality    Sub_part    Packed    Null    Index_type    Comment    Index_comment    Index_params    Visible    Expression
t1    1    idx1    1    name    A    0    NULL    NULL    YES                    YES    NULL
t1    0    PRIMARY    1    id    A    0    NULL    NULL                        YES    NULL
show create table t1;
Table    Create Table
t1    CREATE TABLE `t1` (\n  `id` varchar(20) NOT NULL,\n  `name` varchar(255) DEFAULT NULL,\n  `age` int DEFAULT NULL,\n  PRIMARY KEY (`id`),\n  KEY `idx1` (`name`)\n)
select name, type, column_name from mo_catalog.mo_indexes mi where name="idx1";
name    type    column_name
idx1    MULTIPLE    name
idx1    MULTIPLE    __mo_alias_id
drop table if exists t1;
create table t1(id int PRIMARY KEY,name VARCHAR(255),age int);
create index idx2 on t1(name);
insert into t1 values(1,"Abby", 24);
insert into t1 values(2,"Dora", 25);
show index from t1;
Table    Non_unique    Key_name    Seq_in_index    Column_name    Collation    Cardinality    Sub_part    Packed    Null    Index_type    Comment    Index_comment    Index_params    Visible    Expression
t1    0    PRIMARY    1    id    A    0    NULL    NULL                        YES    NULL
t1    1    idx2    1    name    A    0    NULL    NULL    YES                    YES    NULL
select name, type, column_name from mo_catalog.mo_indexes mi where name="idx2";
name    type    column_name
idx2    MULTIPLE    name
idx2    MULTIPLE    __mo_alias_id
alter table t1 drop column name;
show index from t1;
Table    Non_unique    Key_name    Seq_in_index    Column_name    Collation    Cardinality    Sub_part    Packed    Null    Index_type    Comment    Index_comment    Index_params    Visible    Expression
t1    0    PRIMARY    1    id    A    0    NULL    NULL                        YES    NULL
select name, type, column_name from mo_catalog.mo_indexes mi where name="idx2";
name    type    column_name
drop table if exists t1;
create table t1(id int PRIMARY KEY,name VARCHAR(255),age int);
create index idx3 on t1(name,age);
insert into t1 values(1,"Abby", 24);
insert into t1 values(2,"Dora", 25);
show index from t1;
Table    Non_unique    Key_name    Seq_in_index    Column_name    Collation    Cardinality    Sub_part    Packed    Null    Index_type    Comment    Index_comment    Index_params    Visible    Expression
t1    0    PRIMARY    1    id    A    0    NULL    NULL                        YES    NULL
t1    1    idx3    1    name    A    0    NULL    NULL    YES                    YES    NULL
t1    1    idx3    2    age    A    0    NULL    NULL    YES                    YES    NULL
select name, type, column_name from mo_catalog.mo_indexes mi where name="idx3";
name    type    column_name
idx3    MULTIPLE    name
idx3    MULTIPLE    age
idx3    MULTIPLE    __mo_alias_id
alter table t1 drop column name;
show index from t1;
Table    Non_unique    Key_name    Seq_in_index    Column_name    Collation    Cardinality    Sub_part    Packed    Null    Index_type    Comment    Index_comment    Index_params    Visible    Expression
t1    1    idx3    1    age    A    0    NULL    NULL    YES                    YES    NULL
t1    0    PRIMARY    1    id    A    0    NULL    NULL                        YES    NULL
select name, type, column_name from mo_catalog.mo_indexes mi where name="idx3";
name    type    column_name
idx3    MULTIPLE    age
idx3    MULTIPLE    __mo_alias_id
drop table if exists t1;
create table t1(id VARCHAR(255) PRIMARY KEY,name VARCHAR(255),age int);
create index idx4 on t1(id,name);
insert into t1 values("a","Abby", 24);
insert into t1 values("b","Bob", 25);
insert into t1 values("c","Carol", 23);
select * from t1;
id    name    age
a    Abby    24
b    Bob    25
c    Carol    23
show index from t1;
Table    Non_unique    Key_name    Seq_in_index    Column_name    Collation    Cardinality    Sub_part    Packed    Null    Index_type    Comment    Index_comment    Index_params    Visible    Expression
t1    0    PRIMARY    1    id    A    0    NULL    NULL                        YES    NULL
t1    1    idx4    1    id    A    0    NULL    NULL                        YES    NULL
t1    1    idx4    2    name    A    0    NULL    NULL    YES                    YES    NULL
select name, type, column_name from mo_catalog.mo_indexes mi where name="idx4";
name    type    column_name
idx4    MULTIPLE    id
idx4    MULTIPLE    name
alter table t1 drop column id;
show index from t1;
Table    Non_unique    Key_name    Seq_in_index    Column_name    Collation    Cardinality    Sub_part    Packed    Null    Index_type    Comment    Index_comment    Index_params    Visible    Expression
t1    1    idx4    1    name    A    0    NULL    NULL    YES                    YES    NULL
select name, type, column_name from mo_catalog.mo_indexes mi where name="idx4";
name    type    column_name
idx4    MULTIPLE    name
idx4    MULTIPLE    __mo_alias___mo_fake_pk_col
insert into t1 values("Dora", 29);
alter table t1 drop column name;
show index from t1;
Table    Non_unique    Key_name    Seq_in_index    Column_name    Collation    Cardinality    Sub_part    Packed    Null    Index_type    Comment    Index_comment    Index_params    Visible    Expression
select name, type, column_name from mo_catalog.mo_indexes mi where name="idx4";
name    type    column_name
insert into t1 values(29);
