drop database if exists database01;
drop database if exists test02;
drop database if exists test03;
drop database if exists procedure_test;
drop account if exists test_tenant_1;
create account test_tenant_1 admin_name 'test_account' identified by '111';
show databases;
Database
information_schema
mo_catalog
mo_debug
mo_task
mysql
pub_sub_improvment
system
system_metrics
create database database01;
use database01;
create table table01(col1 int, col2 decimal);
insert into table01 values (1, 2);
insert into table01 values (234, 2413242);
select * from table01;
col1    col2
1    2
234    2413242
create publication publication01 database database01 account test_tenant_1 comment 'publish database to account01';
show publications;
publication    database    create_time    update_time    sub_account    comments
publication01    database01    2024-05-09 16:47:46    null    test_tenant_1    publish database to account01
create database sub_database01 from sys publication publication01;
show databases;
Database
information_schema
mo_catalog
mysql
sub_database01
system
system_metrics
use sub_database01;
show tables;
Tables_in_sub_database01
table01
select * from table01;
col1    col2
1    2
234    2413242
truncate table table01;
internal error: can not truncate table 'table01' which is published by other account
delete from table01 where col1 = 1;
internal error: cannot insert/update/delete from public table
update table01 set col1 = 100 where col2 = 2413242;
internal error: cannot insert/update/delete from public table
show table status;
Name    Engine    Row_format    Rows    Avg_row_length    Data_length    Max_data_length    Index_length    Data_free    Auto_increment    Create_time    Update_time    Check_time    Collation    Checksum    Create_options    Comment    Role_id    Role_name
table01    Tae    Dynamic    2    0    104    0    0    NULL    0    2024-05-09 16:47:45    NULL    NULL    utf-8    NULL            0    moadmin
drop table table01;
internal error: can not drop subscription table table01
show subscriptions;
pub_name    pub_account    pub_database    pub_time    sub_name    sub_time
publication01    sys    database01    2024-05-09 16:47:46    sub_database01    2024-05-09 16:47:46
drop publication publication01;
drop database database01;
drop database if exists database01;
create database database01;
use database01;
create table t1(a int, b int);
insert into t1 values (1, 1), (2, 2), (3, 3);
create publication publication01 database database01;
show publications;
publication    database    create_time    update_time    sub_account    comments
publication01    database01    2024-05-09 16:47:46    null    *
drop account if exists test_tenant_1;
drop account if exists test_tenant_2;
create account test_tenant_1 admin_name 'test_account' identified by '111';
create account test_tenant_2 admin_name 'test_account' identified by '111';
drop database if exists sub_database01;
create database sub_database01 from sys publication publication01;
show subscriptions;
pub_name    pub_account    pub_database    pub_time    sub_name    sub_time
publication01    sys    database01    2024-05-09 16:47:46    sub_database01    2024-05-09 16:47:48
use sub_database01;
show tables;
Tables_in_sub_database01
t1
select * from t1;
a    b
1    1
2    2
3    3
drop table if exists t2;
create table t2(col1 int primary key );
insert into t2 values (1),(2),(3);
use sub_database01;
show tables;
Tables_in_sub_database01
t1
t2
select * from t2;
col1
1
2
3
drop database if exists sub_database01;
create database sub_database01 from sys publication publication01;
show subscriptions;
pub_name    pub_account    pub_database    pub_time    sub_name    sub_time
publication01    sys    database01    2024-05-09 16:47:46    sub_database01    2024-05-09 16:47:48
use sub_database01;
show tables;
Tables_in_sub_database01
t1
t2
select * from t1;
a    b
1    1
2    2
3    3
select * from t2;
col1
1
2
3
drop publication publication01;
drop database if exists database02;
create database database02;
use database02;
create table table03(col1 char, col2 varchar(100));
insert into table03 values ('1', 'database');
insert into table03 values ('a', 'data warehouse');
create publication publication02 database database02;
show publications;
publication    database    create_time    update_time    sub_account    comments
publication02    database02    2024-05-09 16:47:49    null    *
drop database if exists sub_database02;
create database sub_database02 from sys publication publication02;
show subscriptions all;
pub_name    pub_account    pub_database    pub_time    sub_name    sub_time
publication02    sys    database02    2024-05-09 16:47:49    sub_database02    2024-05-09 16:47:49
use sub_database02;
show tables;
Tables_in_sub_database02
table03
select * from table03;
col1    col2
1    database
a    data warehouse
drop database if exists sub_database02;
create database sub_database02 from sys publication publication02;
show subscriptions all;
pub_name    pub_account    pub_database    pub_time    sub_name    sub_time
publication02    sys    database02    2024-05-09 16:47:49    sub_database02    2024-05-09 16:47:49
use sub_database02;
show tables;
Tables_in_sub_database02
table03
select * from table03;
col1    col2
1    database
a    data warehouse
show table status;
Name    Engine    Row_format    Rows    Avg_row_length    Data_length    Max_data_length    Index_length    Data_free    Auto_increment    Create_time    Update_time    Check_time    Collation    Checksum    Create_options    Comment    Role_id    Role_name
table03    Tae    Dynamic    2    0    160    0    0    NULL    0    2024-05-09 16:47:49    NULL    NULL    utf-8    NULL            0    moadmin
drop publication publication02;
drop database if exists database03;
create database database03;
use database03;
drop table if exists table01;
create table table01(col1 int);
insert into table01 values (-1),(1),(2);
create publication publication03 database database03 account test_tenant_1;
show publications;
publication    database    create_time    update_time    sub_account    comments
publication03    database03    2024-05-09 16:47:49    null    test_tenant_1
drop database if exists sub_database03;
create database sub_database03 from sys publication publication03;
show subscriptions all;
pub_name    pub_account    pub_database    pub_time    sub_name    sub_time
publication03    sys    database03    2024-05-09 16:47:49    sub_database03    2024-05-09 16:47:49
use sub_database03;
show tables;
Tables_in_sub_database03
table01
select * from table01;
col1
-1
1
2
desc table01;
Field    Type    Null    Key    Default    Extra    Comment
col1    INT(32)    YES        null
show table status;
Name    Engine    Row_format    Rows    Avg_row_length    Data_length    Max_data_length    Index_length    Data_free    Auto_increment    Create_time    Update_time    Check_time    Collation    Checksum    Create_options    Comment    Role_id    Role_name
table01    Tae    Dynamic    3    0    108    0    0    NULL    0    2024-05-09 16:47:49    NULL    NULL    utf-8    NULL            0    moadmin
show subscriptions all;
pub_name    pub_account    pub_database    pub_time    sub_name    sub_time
alter publication publication03 account all;
show publications;
publication    database    create_time    update_time    sub_account    comments
publication03    database03    2024-05-09 16:47:49    2024-05-09 16:47:49    *
show subscriptions all;
pub_name    pub_account    pub_database    pub_time    sub_name    sub_time
publication03    sys    database03    2024-05-09 16:47:49    null    null
create database sub_database03 from sys publication publication03;
use sub_database03;
show tables;
Tables_in_sub_database03
table01
show columns from table01;
Field    Type    Null    Key    Default    Extra    Comment
col1    INT(32)    YES        null
desc table01;
Field    Type    Null    Key    Default    Extra    Comment
col1    INT(32)    YES        null
select * from table01;
col1
-1
1
2
drop publication publication03;
show publications;
publication    database    create_time    update_time    sub_account    comments
use sub_database01;
internal error: there is no publication publication01
drop database sub_database01;
drop database sub_database02;
drop database sub_database03;
drop database sub_database01;
Can't drop database 'sub_database01'; database doesn't exist
drop database sub_database02;
Can't drop database 'sub_database02'; database doesn't exist
drop database database01;
drop database database02;
drop database database03;
drop account test_tenant_1;
drop account test_tenant_2;
