SELECT @@session.autocommit;
@@autocommit
1
SET @@session.autocommit=1;
SELECT @@session.autocommit;
@@autocommit
1
SET @@session.autocommit= 0;
SELECT @@session.autocommit;
@@autocommit
0
rollback;
SET @@session.autocommit=OFF;
SELECT @@session.autocommit;
@@autocommit
0
rollback;
SET @@session.autocommit=ON;
SELECT @@session.autocommit;
@@autocommit
1
SET @@session.autocommit=foo;
internal error: convert to the system variable bool type failed
SELECT @@session.autocommit;
@@autocommit
1
commit;
SET @@session.autocommit=OFF;
SELECT @@session.autocommit;
@@autocommit
0
commit;
SET @@session.autocommit=ON;
SELECT @@session.autocommit;
@@autocommit
1
commit;
SET @@session.autocommit=foo;
internal error: convert to the system variable bool type failed
SELECT @@session.autocommit;
@@autocommit
1
commit;
set autocommit=0;
select @@autocommit;
@@autocommit
0
commit;
drop database if exists db;
create database db;
show databases like 'db';
Database
db
use db;
create table tab1(a int, b int);
create view view_tab1 as select * from tab1;
insert into tab1 values (2000, 3000);
rollback;
select * from tab1;
not connect to a database
Previous DML conflicts with existing constraints or data format. This transaction has to be aborted
commit;
drop database if exists db;
create database db;
show databases like 'db';
Database
db
use db;
create table tab1(a int, b int);
insert into tab1 values (2000, 3000);
insert into tab1 values (10, 10);
commit;
select * from tab1;
a    b
2000    3000
10    10
update tab1 set a=100000 where b=3000;
select * from tab1;
a    b
100000    3000
10    10
rollback;
select * from tab1;
a    b
2000    3000
10    10
update tab1 set a=100000 where b=3000;
commit;
select * from tab1;
a    b
10    10
100000    3000
delete from tab1 where a=10;
rollback;
select * from tab1;
a    b
10    10
100000    3000
delete from tab1 where a=10;
commit;
select * from tab1;
a    b
100000    3000
create view view_tab1 as select * from tab1;
select * from view_tab1;
a    b
100000    3000
commit;
insert into view_tab1 values (200, 300);
invalid input: cannot insert/update/delete from view
Previous DML conflicts with existing constraints or data format. This transaction has to be aborted
commit;
drop database db;
use autocommit_1;
commit;
drop table if exists t1;
create table t1(col1 varchar(255));
insert into t1 values ('helloworld');
rollback;
select * from t1;
SQL parser error: table "t1" does not exist
Previous DML conflicts with existing constraints or data format. This transaction has to be aborted
commit;
drop table if exists t2;
create table t2 (a varchar(255));
insert into t2 values ('hello');
commit;
select * from t2;
a
hello
commit;
drop table t2;
drop table if exists t3;
create table t3(a int);
insert into t3 values (10),(20),(30);
set @@autocommit=ON;
select @@autocommit;
@@autocommit
1
set @@autocommit=OFF;
select @@autocommit;
@@autocommit
0
set @@autocommit=1;
select @@autocommit;
@@autocommit
1
set @@autocommit=0;
select @@autocommit;
@@autocommit
0
rollback;
drop table if exists tab3;
create table tab3 (a int, b varchar(25));
insert into tab3 values (10, 'aa'),(20, 'bb'),(30, 'cc');
set @@autocommit=ON;
select @@autocommit;
@@autocommit
1
set @@autocommit=OFF;
select @@autocommit;
@@autocommit
0
set @@autocommit=1;
select @@autocommit;
@@autocommit
1
set @@autocommit=0;
commit;
select * from tab3;
a    b
10    aa
20    bb
30    cc
update tab3 set a=1000 where b='aa';
select * from tab3;
a    b
1000    aa
20    bb
30    cc
rollback;
delete from tab3 where b='cc';
select * from tab3;
a    b
10    aa
20    bb
commit;
select * from tab3;
a    b
10    aa
20    bb
commit;
drop table tab3;
drop table if exists t4;
create table t4(a varchar(225), b int);
insert into t4 values ('aa', 1000),('bb', 2000);
begin;
select * from t4;
a    b
aa    1000
bb    2000
update t4 set a='xxxx' where b=1000;
select * from t4;
a    b
xxxx    1000
bb    2000
rollback;
select * from t4;
a    b
aa    1000
bb    2000
update t4 set a='xxxx' where b=1000;
select * from t4;
a    b
xxxx    1000
bb    2000
commit;
select * from t4;
a    b
bb    2000
xxxx    1000
create view view_t4 as select * from t4;
begin;
select * from view_t4;
a    b
bb    2000
xxxx    1000
delete from t4 where a='bb';
rollback;
select * from t4;
a    b
bb    2000
xxxx    1000
select * from view_t4;
a    b
bb    2000
xxxx    1000
commit;
set autocommit=1;
select @@autocommit;
@@autocommit
1
drop database if exists test_xx;
begin;
create database test_xx;
internal error: CREATE/DROP of database is not supported in transactions
SET @@session.autocommit=1;
SELECT @@session.autocommit;
@@autocommit
1
SET @@session.autocommit= 0;
SELECT @@session.autocommit;
@@autocommit
0
SET @@session.autocommit=OFF;
SELECT @@session.autocommit;
@@autocommit
0
SET @@session.autocommit=ON;
SELECT @@session.autocommit;
@@autocommit
1
commit;
show databases like 'test_xx';
Database
commit;
drop database test_xx;
Can't drop database 'test_xx'; database doesn't exist
drop database if exists db;
begin;
create database db;
internal error: CREATE/DROP of database is not supported in transactions
show databases like 'db';
Database
use db;
invalid database db
Previous DML conflicts with existing constraints or data format. This transaction has to be aborted
begin;
create table table3(a int, b int);
insert into table3 values (2000, 3000);
create view view_table3 as select * from table3;
select * from table3;
a    b
2000    3000
select * from view_table3;
a    b
2000    3000
rollback;
select * from table3;
SQL parser error: table "table3" does not exist
select * from view_table3;
SQL parser error: table "view_table3" does not exist
drop database if exists db;
begin;
create database db;
internal error: CREATE/DROP of database is not supported in transactions
show databases like 'db';
Database
use db;
invalid database db
Previous DML conflicts with existing constraints or data format. This transaction has to be aborted
create table table3(a int, b int);
insert into table3 values (2000, 3000);
insert into table3 values (10, 10);
commit;
select * from table3;
a    b
2000    3000
10    10
begin;
update table3 set a=100000 where b=3000;
select * from table3;
a    b
100000    3000
10    10
rollback;
select * from table3;
a    b
2000    3000
10    10
begin;
update table3 set a=100000 where b=3000;
commit;
select * from table3;
a    b
10    10
100000    3000
begin;
delete from table3 where a=10;
rollback;
select * from table3;
a    b
10    10
100000    3000
begin;
delete from table3 where a=10;
commit;
select * from table3;
a    b
100000    3000
drop table if exists t3;
start transaction;
create table t3 (b varchar(255));
insert into t3 values ('helloworld');
rollback ;
select * from t3;
SQL parser error: table "t3" does not exist
drop table if exists t4;
start transaction;
create table t4 (a int);
insert into t4 values (10),(20);
commit;
select * from t4;
a
10
20
drop table t4;
drop table if exists t5;
start transaction;
create table t5(a int);
insert into t5 values(10),(20),(30);
drop table t5;
start transaction;
insert into t5 values(100),(2000),(3000);
no such table autocommit_1.t5
Previous DML conflicts with existing constraints or data format. This transaction has to be aborted
set @autocommit=0;
begin;
select * from t5;
SQL parser error: table "t5" does not exist
Previous DML conflicts with existing constraints or data format. This transaction has to be aborted
insert into t5 values(1),(2),(3);
no such table autocommit_1.t5
rollback;
select * from t5;
SQL parser error: table "t5" does not exist
begin;
select * from t5;
SQL parser error: table "t5" does not exist
Previous DML conflicts with existing constraints or data format. This transaction has to be aborted
insert into t5 values(100),(2000),(3000);
no such table autocommit_1.t5
delete from t5;
no such table autocommit_1.t5
begin;
select * from t5;
SQL parser error: table "t5" does not exist
Previous DML conflicts with existing constraints or data format. This transaction has to be aborted
rollback;
select * from t5;
SQL parser error: table "t5" does not exist
drop table t5
start transaction;
SQL parser error: You have an error in your SQL syntax; check the manual that corresponds to your MatrixOne server version for the right syntax to use. syntax error at line 2 column 6 near "
start transaction;";
set @@a=0;
internal error: the system variable does not exist
rollback;
set @@b=0;
internal error: the system variable does not exist
commit;
select @@b;
internal error: the system variable does not exist
drop database if exists db;
create database db;
show databases like 'db';
Database
db
use db;
create table t6(a int, b int);
insert into t6 values (2000, 3000);
insert into t6 values (10, 10);
select * from t6;
a    b
2000    3000
10    10
update t6 set a=100000 where b=3000;
select * from t6;
a    b
10    10
100000    3000
delete from t6 where a=10;
select * from t6;
a    b
100000    3000
create view view_t6 as select * from t6;
select * from view_t6;
a    b
100000    3000
insert into view_t6 values (200, 300);
invalid input: cannot insert/update/delete from view
insert into view_t6 values (10, 10);
invalid input: cannot insert/update/delete from view
select * from view_t6;
a    b
100000    3000
update view_t6 set a=100000 where b=3000;
invalid input: cannot insert/update/delete from view
select * from view_t6;
a    b
100000    3000
delete from view_t6 where a=10;
invalid input: cannot insert/update/delete from view
select * from view_t6;
a    b
100000    3000
drop database db;
use autocommit_1;
set @@autocommit=0;
select @@autocommit;
@@autocommit
0
create table t7(a int);
insert into t7 values (500);
commit;
begin;
insert into t7 values (1000);
commit;
insert into t7 values (2000);
rollback;
select * from t7;
a
500
1000
drop table t7;
commit;
drop table t7;
no such table autocommit_1.t7
Previous DML conflicts with existing constraints or data format. This transaction has to be aborted
create table t8(a int);
insert into t8 values (500);
rollback;
begin;
insert into t8 values (1000);
no such table autocommit_1.t8
Previous DML conflicts with existing constraints or data format. This transaction has to be aborted
create table t9 (a char(25));
commit;
insert into t9 values ('hello');
rollback;
select * from t9;
a
commit;
drop table t9;
rollback;
set @@autocommit=on;
