drop table if exists dis_table_01;
drop table if exists dis_table_02;
drop table if exists dis_table_03;
drop table if exists dis_table_04;
drop table if exists dis_table_05;
drop table if exists dis_table_06;
drop table if exists dis_table_07;
drop table if exists dis_view_01;
drop table if exists dis_view_02;
drop table if exists dis_temp_01;
drop table if exists iso_table_0001;
create table dis_table_01(a int,b varchar(25));
insert into dis_table_01 select 20,'apple';
insert into dis_table_01 select 21,'orange';
start transaction;
create view dis_view_01 as select * from dis_table_01;
use isolation_2;
begin;
insert into dis_table_01 values (22,'pear');
select * from dis_table_01;
a    b
22    pear
20    apple
21    orange
update dis_table_01 set b='bens' where a=20;
select * from dis_table_01;
a    b
22    pear
20    bens
21    orange
rollback ;
select * from dis_view_01;
a    b
20    apple
21    orange
use isolation_2;
select * from dis_table_01;
a    b
20    apple
21    orange
update dis_table_01 set a=19 where b='apple';
select * from dis_table_01;
a    b
21    orange
19    apple
commit;
select * from dis_view_01;
a    b
21    orange
19    apple
select * from dis_table_01;
a    b
21    orange
19    apple
create table dis_table_02(a int not null auto_increment,b varchar(25) not null,c datetime,primary key(a),key bstr (b),key cdate (c) );
insert into dis_table_02(b,c) values ('aaaa','2020-09-08');
insert into dis_table_02(b,c) values ('aaaa','2020-09-08');
create table dis_table_03(b varchar(25) primary key,c datetime);
begin ;
insert into dis_table_03 select b,c from dis_table_02;
Duplicate entry 'aaaa' for key 'b'
select * from dis_table_03;
b    c
insert into dis_table_03 select 'bbb','2012-09-30';
update dis_table_03 set b='aaa';
select * from dis_table_03;
b    c
aaa    2012-09-30 00:00:00
select * from dis_table_03;
b    c
aaa    2012-09-30 00:00:00
truncate table dis_table_03;
insert into dis_table_03 select 'bbb','2012-09-30';
select * from dis_table_03;
b    c
bbb    2012-09-30 00:00:00
commit;
w-w conflict
select * from dis_table_03;
b    c
begin ;
insert into dis_table_02 values (null,'ccc',null);
select * from dis_table_02;
a    b    c
3    ccc    null
1    aaaa    2020-09-08 00:00:00
2    aaaa    2020-09-08 00:00:00
start transaction ;
insert into dis_table_02 values (5,null,'1345-09-23');
constraint violation: Column 'b' cannot be null
select * from dis_table_02;
a    b    c
1    aaaa    2020-09-08 00:00:00
2    aaaa    2020-09-08 00:00:00
commit;
update dis_table_02 set a=90;
Duplicate entry '([^']*)' for key '([^']*)'
commit;
select * from dis_table_02;
a    b    c
1    aaaa    2020-09-08 00:00:00
2    aaaa    2020-09-08 00:00:00
3    ccc    null
start transaction ;
create database dis_db_01;
internal error: CREATE/DROP of database is not supported in transactions
use dis_db_01;
invalid database dis_db_01
begin;
create table dis_table_04(a int);
insert into dis_table_04 values (4);
create table dis_table_04(a int);
insert into dis_table_04 values (4);
drop database dis_db_01;
Can't drop database 'dis_db_01'; database doesn't exist
delete from dis_table_04 where a=4;
select * from dis_table_04;
a
rollback ;
select * from dis_db_01.dis_table_04;
invalid database dis_db_01
drop database dis_db_01;
Can't drop database 'dis_db_01'; database doesn't exist
drop table isolation_2.dis_table_04;
begin;
use isolation_2;
create external table ex_table_dis(num_col1 tinyint,num_col2 smallint,num_col3 int,num_col4 bigint,num_col5 tinyint unsigned,num_col6 smallint unsigned,num_col7 int unsigned,num_col8 bigint unsigned ,num_col9 float(5,3),num_col10 double(6,5),num_col11 decimal(38,19)) infile{"filepath"='$resources/external_table_file/ex_table_number.csv'} fields terminated by ',' enclosed by '\"' lines terminated by '\n';
select num_col1,num_col2 from ex_table_dis;
num_col1    num_col2
60    -1000
-128    -32768
127    32767
null    null
select * from ex_table_dis;
SQL parser error: table "ex_table_dis" does not exist
update ex_table_dis set num_col1=1000;
invalid input: cannot insert/update/delete from external table
select num_col1,num_col2 from ex_table_dis;
num_col1    num_col2
60    -1000
-128    -32768
127    32767
null    null
commit;
select num_col1,num_col2 from ex_table_dis;
num_col1    num_col2
60    -1000
-128    -32768
127    32767
null    null
insert into dis_table_01 select num_col1,'fffff' from ex_table_dis;
select * from dis_table_01;
a    b
21    orange
19    apple
60    fffff
-128    fffff
127    fffff
null    fffff
select num_col1,num_col2 from ex_table_dis;
num_col1    num_col2
60    -1000
-128    -32768
127    32767
null    null
drop table ex_table_dis;
select * from dis_table_01;
a    b
21    orange
19    apple
60    fffff
-128    fffff
127    fffff
null    fffff
begin;
create view  aaa as select * from dis_table_02;
show create table aaa ;
View    Create View    character_set_client    collation_connection
aaa    create view  aaa as select * from dis_table_02;    utf8mb4    utf8mb4_general_ci
insert into  dis_table_02(b,c) values ('vvv','2000-09-08');
begin ;
select b, c from dis_table_02;
b    c
aaaa    2020-09-08 00:00:00
aaaa    2020-09-08 00:00:00
vvv    2000-09-08 00:00:00
ccc    null
delete from dis_table_02 where a=1;
rollback ;
commit ;
select b, c from aaa;
b    c
aaaa    2020-09-08 00:00:00
aaaa    2020-09-08 00:00:00
vvv    2000-09-08 00:00:00
ccc    null
select b, c from aaa;
b    c
aaaa    2020-09-08 00:00:00
aaaa    2020-09-08 00:00:00
vvv    2000-09-08 00:00:00
ccc    null
drop view aaa ;
start transaction ;
insert into dis_table_02(b,c) values ('','1999-06-04');
prepare stmt1 from "update dis_table_02 set c='2222-07-12' where a=2";
execute stmt1;
select b, c from dis_table_02;
b    c
aaaa    2020-09-08 00:00:00
vvv    2000-09-08 00:00:00
aaaa    2222-07-12 00:00:00
ccc    null
update dis_table_02 set c='2000-09-02' where a=2;
select b, c from dis_table_02;
b    c
    1999-06-04 00:00:00
aaaa    2000-09-02 00:00:00
aaaa    2020-09-08 00:00:00
vvv    2000-09-08 00:00:00
ccc    null
begin ;
create database dis_db_02;
internal error: CREATE/DROP of database is not supported in transactions
rollback ;
commit;
w-w conflict
select b, c from dis_table_02;
b    c
aaaa    2020-09-08 00:00:00
vvv    2000-09-08 00:00:00
aaaa    2222-07-12 00:00:00
ccc    null
begin ;
prepare stmt1 from "insert into dis_table_02(b,c) values('oppo','1009-11-11')";
execute stmt1;
select b, c from dis_table_02;
b    c
oppo    1009-11-11 00:00:00
aaaa    2020-09-08 00:00:00
vvv    2000-09-08 00:00:00
aaaa    2222-07-12 00:00:00
ccc    null
select b, c from dis_table_02;
b    c
aaaa    2020-09-08 00:00:00
vvv    2000-09-08 00:00:00
aaaa    2222-07-12 00:00:00
ccc    null
prepare stmt2 from "update dis_table_02 set a=null";
constraint violation: Column 'a' cannot be null
execute stmt2;
invalid state prepared statement 'stmt2' does not exist
commit;
deallocate prepare stmt1;
deallocate prepare stmt2;
select b, c from dis_table_02;
b    c
aaaa    2020-09-08 00:00:00
vvv    2000-09-08 00:00:00
aaaa    2222-07-12 00:00:00
ccc    null
oppo    1009-11-11 00:00:00
use dis_db_02;
invalid database dis_db_02
select b, c from dis_table_02;
b    c
aaaa    2020-09-08 00:00:00
vvv    2000-09-08 00:00:00
aaaa    2222-07-12 00:00:00
ccc    null
oppo    1009-11-11 00:00:00
insert into dis_table_02(b,c) values ('','1999-06-04');
create temporary table dis_temp_01(a int,b varchar(100),primary key(a));
begin ;
insert into dis_temp_01 values (233,'uuuu');
select * from dis_temp_01;
SQL parser error: table "dis_temp_01" does not exist
select * from dis_temp_01;
a    b
233    uuuu
truncate table dis_temp_01;
no such table isolation_2.dis_temp_01
rollback ;
select * from dis_temp_01;
a    b
drop table dis_temp_01;
start transaction;
load data infile '$resources/external_table_file/isolation_01.csv' into table dis_table_02;
update dis_table_02 set b='pppp';
select b, c from dis_table_02;
b    c
pppp    2020-09-08 00:00:00
pppp    2000-09-08 00:00:00
pppp    2222-07-12 00:00:00
pppp    1999-06-04 00:00:00
pppp    null
pppp    1009-11-11 00:00:00
select b, c from dis_table_02;
b    c
    1897-04-29 00:00:00
vvvvv    2030-12-29 00:00:00
aaaa    2020-09-08 00:00:00
vvv    2000-09-08 00:00:00
aaaa    2222-07-12 00:00:00
    1999-06-04 00:00:00
ccc    null
oppo    1009-11-11 00:00:00
begin ;
create view dis_view_02 as select * from dis_table_02;
insert into dis_table_02 values (2,'oooo','1802-03-20');
select b, c from dis_table_02;
b    c
oooo    1802-03-20 00:00:00
pppp    2020-09-08 00:00:00
pppp    null
pppp    2000-09-08 00:00:00
pppp    2222-07-12 00:00:00
pppp    1009-11-11 00:00:00
pppp    1999-06-04 00:00:00
use isolation_2;
select * from dis_view_02;
SQL parser error: table "dis_view_02" does not exist
select * from dis_view_02;
SQL parser error: table "dis_view_02" does not exist
insert into dis_table_02 values (2,'oooo','1802-03-20');
commit;
select b, c from dis_table_02;
b    c
pppp    2020-09-08 00:00:00
pppp    null
pppp    2000-09-08 00:00:00
pppp    2222-07-12 00:00:00
pppp    1009-11-11 00:00:00
pppp    1999-06-04 00:00:00
    1897-04-29 00:00:00
vvvvv    2030-12-29 00:00:00
select * from dis_view_02;
SQL parser error: table "dis_view_02" does not exist
drop table dis_view_02;
no such table isolation_2.dis_view_02
begin ;
select * from dis_table_01;
a    b
21    orange
19    apple
60    fffff
-128    fffff
127    fffff
null    fffff
truncate table dis_table_01;
insert into dis_table_01 select 9999,'abcdefg';
select * from dis_table_01;
a    b
explain select * from dis_table_01;
QUERY PLAN
Project
  ->  Table Scan on isolation_2.dis_table_01
commit ;
select * from dis_table_01;
a    b
begin ;
delete from dis_table_02 where a>1;
select b, c from dis_table_02;
b    c
pppp    2020-09-08 00:00:00
select b, c from dis_table_02;
b    c
pppp    2020-09-08 00:00:00
pppp    null
pppp    2000-09-08 00:00:00
pppp    2222-07-12 00:00:00
pppp    1009-11-11 00:00:00
pppp    1999-06-04 00:00:00
    1897-04-29 00:00:00
vvvvv    2030-12-29 00:00:00
update dis_table_02 set b='tittttt' where a>1;
select b, c from dis_table_02;
b    c
pppp    2020-09-08 00:00:00
tittttt    null
tittttt    2000-09-08 00:00:00
tittttt    2222-07-12 00:00:00
tittttt    1009-11-11 00:00:00
tittttt    1999-06-04 00:00:00
tittttt    1897-04-29 00:00:00
tittttt    2030-12-29 00:00:00
select b, c from dis_table_02;
b    c
pppp    2020-09-08 00:00:00
rollback;
start transaction ;
update dis_table_02 set b='catttteee' where a>1;
select b, c from dis_table_02;
b    c
catttteee    null
catttteee    2000-09-08 00:00:00
catttteee    2222-07-12 00:00:00
catttteee    1009-11-11 00:00:00
catttteee    1999-06-04 00:00:00
catttteee    1897-04-29 00:00:00
catttteee    2030-12-29 00:00:00
pppp    2020-09-08 00:00:00
commit;
commit;
w-w conflict
select b, c from dis_table_02;
b    c
pppp    2020-09-08 00:00:00
catttteee    null
catttteee    2000-09-08 00:00:00
catttteee    2222-07-12 00:00:00
catttteee    1009-11-11 00:00:00
catttteee    1999-06-04 00:00:00
catttteee    1897-04-29 00:00:00
catttteee    2030-12-29 00:00:00
select b, c from dis_table_02;
b    c
pppp    2020-09-08 00:00:00
catttteee    null
catttteee    2000-09-08 00:00:00
catttteee    2222-07-12 00:00:00
catttteee    1009-11-11 00:00:00
catttteee    1999-06-04 00:00:00
catttteee    1897-04-29 00:00:00
catttteee    2030-12-29 00:00:00
create database if not exists iso_db_02;
start transaction ;
use iso_db_02;
show tables;
tables_in_iso_db_02
begin ;
use iso_db_02;
create table iso_table_0001(a int);
insert into iso_table_0001 values (2);
no such table iso_db_02.iso_table_0001
use iso_db_02;
create table iso_table_0001(a int);
drop database iso_db_02;
commit;
w-w conflict
create table iso_table_0001(a int);
commit;
w-w conflict
use iso_db_02;
invalid database iso_db_02
select * from iso_table_0001;
not connect to a database
use isolation_2;
create table dis_table_04(a int,b varchar(25) not null,c datetime,primary key(a),unique key bstr (b),key cdate (c));
insert into dis_table_04 values (6666,'kkkk','2010-11-25');
insert into dis_table_04 values (879,'oopp','2011-11-26');
select * from dis_table_01;
a    b
start transaction ;
use isolation_2;
update dis_table_04 set b=(select 'ccccool' from dis_table_01 limit 1)  where a=879;
constraint violation: Column 'b' cannot be null
select * from dis_table_04 ;
a    b    c
6666    kkkk    2010-11-25 00:00:00
879    oopp    2011-11-26 00:00:00
begin ;
use isolation_2;
update dis_table_04 set b='uuyyy' where a=879;
select * from dis_table_04;
a    b    c
879    uuyyy    2011-11-26 00:00:00
6666    kkkk    2010-11-25 00:00:00
commit;
commit;
update dis_table_04 set b=(select 'kkkk')  where a=879;
Duplicate entry 'kkkk' for key '__mo_index_idx_col'
select * from dis_table_04;
a    b    c
6666    kkkk    2010-11-25 00:00:00
879    uuyyy    2011-11-26 00:00:00
begin ;
use isolation_2;
create temporary table dis_table_05(a int,b varchar(25) not null,c datetime,primary key(a),unique key bstr (b),key cdate (c));
load data infile 'fff.csv' to dis_table_05;
SQL parser error: You have an error in your SQL syntax; check the manual that corresponds to your MatrixOne server version for the right syntax to use. syntax error at line 1 column 29 near " to dis_table_05;";
use isolation_2;
select * from dis_table_05;
SQL parser error: table "dis_table_05" does not exist
insert into dis_table_05 values (8900,'kkkk77','1772-04-20');
commit;
select * from dis_table_05;
a    b    c
8900    kkkk77    1772-04-20 00:00:00
select * from dis_table_05;
SQL parser error: table "dis_table_05" does not exist
drop table dis_table_05;
use isolation_2;
create table dis_table_06(a int auto_increment primary key,b varchar(25),c double default 0.0);
insert into dis_table_06(a,b) values(2,'moon');
insert into dis_table_06(b) values('sun');
begin;
use isolation_2;
insert into dis_table_06(a,b) values (3,'llllp');
select * from dis_table_06;
a    b    c
3    llllp    0.0
2    moon    0.0
3    sun    0.0
use isolation_2;
insert into dis_table_06 values (3,'uuubbb',12.02);
Duplicate entry '3' for key 'a'
select * from dis_table_06;
a    b    c
2    moon    0.0
3    sun    0.0
insert into dis_table_06(a,b) values (4,'cookie');
commit;
Duplicate entry '3' for key 'a'
select * from dis_table_06;
a    b    c
2    moon    0.0
3    sun    0.0
begin;
use isolation_2;
insert into dis_table_06(a,b) values (5,'leetio');
select * from dis_table_06;
a    b    c
5    leetio    0.0
2    moon    0.0
3    sun    0.0
update dis_table_06 set a=5 where b='sun';
select * from dis_table_06;
a    b    c
2    moon    0.0
5    sun    0.0
commit;
w-w conflict
select * from dis_table_06;
a    b    c
2    moon    0.0
5    sun    0.0
drop table dis_table_06;
create table dis_table_07(a int,b varchar(25),c double,d datetime,primary key(a,b,d));
insert into dis_table_07 values (1,'yellow',20.09,'2020-09-27');
begin;
insert into dis_table_07 values (2,'blue',10.00,'2021-01-20');
use isolation_2;
insert into dis_table_07 values (2,'blue',11.00,'2021-01-20');
select * from dis_table_07;
a    b    c    d
1    yellow    20.09    2020-09-27 00:00:00
2    blue    11.0    2021-01-20 00:00:00
select * from dis_table_07;
a    b    c    d
2    blue    10.0    2021-01-20 00:00:00
1    yellow    20.09    2020-09-27 00:00:00
commit;
w-w conflict
select * from dis_table_07;
a    b    c    d
1    yellow    20.09    2020-09-27 00:00:00
2    blue    11.0    2021-01-20 00:00:00
insert into dis_table_07 values (2,'blue',12.00,'2024-01-20');
begin;
update dis_table_07 set d='2024-01-20' where a=2 and b='blue';
Duplicate entry '(2,blue,2024-01-20 00:00:00)' for key '__mo_cpkey_col'
select * from dis_table_07;
a    b    c    d
1    yellow    20.09    2020-09-27 00:00:00
2    blue    11.0    2021-01-20 00:00:00
2    blue    12.0    2024-01-20 00:00:00
select * from dis_table_07;
a    b    c    d
1    yellow    20.09    2020-09-27 00:00:00
2    blue    11.0    2021-01-20 00:00:00
2    blue    12.0    2024-01-20 00:00:00
commit;
select * from dis_table_07;
a    b    c    d
1    yellow    20.09    2020-09-27 00:00:00
2    blue    11.0    2021-01-20 00:00:00
2    blue    12.0    2024-01-20 00:00:00
drop table dis_table_07;