drop database if exists special;
create database special;
use special;
create table ct_07(a int,b varchar(25),c date, d double,primary key(a,c));
insert into ct_07 values (1,'901','2011-09-29',0.01),(2,'187','2011-09-29',1.31),(3,'90','2111-02-09',10.01);
begin;
insert into ct_07 values (3,'90','2111-02-09',10.01);
insert into ct_07 values (4,'11','2011-09-29',7.00),(2,'567','2011-09-29',1.31),(4,'90','2011-09-29',89.3);
(Duplicate entry) '\((\d+),(\d{4}-\d{2}-\d{2})\)' (for key '__mo_cpkey_col')
select * from ct_07;
a    b    c    d
3    90    2111-02-09    10.01
1    901    2011-09-29    0.01
2    187    2011-09-29    1.31
3    90    2111-02-09    10.01
commit;
Duplicate entry '3a150341170bc28c' for key '__mo_cpkey_col'
select * from ct_07;
a    b    c    d
1    901    2011-09-29    0.01
2    187    2011-09-29    1.31
3    90    2111-02-09    10.01
create table dis_table_02(a int not null auto_increment,b varchar(25) not null,c datetime,primary key(a),key bstr (b),key cdate (c) );
insert into dis_table_02(b,c) values ('aaaa','2020-09-08');
insert into dis_table_02(b,c) values ('aaaa','2020-09-08');
create table dis_table_03(b varchar(25) primary key,c datetime);
begin ;
insert into dis_table_03 select b,c from dis_table_02;
Duplicate entry 'aaaa' for key 'b'
select * from dis_table_03;
b    c
use special;
insert into dis_table_03 select 'bbb','2012-09-30';
update dis_table_03 set b='aaa';
select * from dis_table_03;
b    c
aaa    2012-09-30 00:00:00
use special;
select * from dis_table_03;
b    c
aaa    2012-09-30 00:00:00
truncate table dis_table_03;
insert into dis_table_03 select 'bbb','2012-09-30';
select * from dis_table_03;
b    c
bbb    2012-09-30 00:00:00
commit;
w-w conflict
select * from dis_table_03;
b    c
create database if not exists iso_db_02;
start transaction ;
use special;
show tables;
Tables_in_special
ct_07
dis_table_02
dis_table_03
begin ;
use special;
create table iso_table_0001(a int);
insert into iso_table_0001 values (2);
no such table special.iso_table_0001
use special;
create table iso_table_0001(a int);
drop database iso_db_02;
commit;
w-w conflict
create table iso_table_0001(a int);
commit;
w-w conflict
use special;
select * from iso_table_0001;
a
drop database if exists special;
