drop table if exists atomic_table_10;
create table atomic_table_10(c1 int,c2 varchar(25));
insert into atomic_table_10 values (3,"a"),(4,"b"),(5,"c");
start transaction ;
truncate table atomic_table_10;
use transaction_enhance;
select * from atomic_table_10;
c1    c2
3    a
4    b
5    c
select * from atomic_table_10;
c1    c2
commit;
select * from atomic_table_10;
c1    c2
drop table if exists atomic_table_10;
create table atomic_table_10(c1 int,c2 varchar(25));
insert into atomic_table_10 values (3,"a"),(4,"b"),(5,"c");
start transaction ;
truncate table atomic_table_10;
select * from atomic_table_10;
c1    c2
3    a
4    b
5    c
select * from atomic_table_10;
c1    c2
rollback;
select * from atomic_table_10;
c1    c2
3    a
4    b
5    c
drop table if exists atomic_table_10;
create table atomic_table_10(c1 int,c2 varchar(25));
insert into atomic_table_10 values (3,"a"),(4,"b"),(5,"c");
begin ;
truncate table atomic_table_10;
insert into atomic_table_10 values (6,"a"),(7,"b"),(8,"c");
select * from atomic_table_10;
c1    c2
3    a
4    b
5    c
6    a
7    b
8    c
select * from atomic_table_10;
c1    c2
commit;
select * from atomic_table_10;
c1    c2
drop table if exists atomic_table_11;
create table atomic_table_11(c1 int,c2 varchar(25));
insert into atomic_table_11 values (3,"a"),(4,"b"),(5,"c");
begin;
drop table atomic_table_11;
insert into atomic_table_11 values (6,"a");
select * from atomic_table_11;
c1    c2
3    a
4    b
5    c
6    a
commit;
select * from atomic_table_11;
SQL parser error: table "atomic_table_11" does not exist
drop table if exists atomic_table_11;
create table atomic_table_11(c1 int,c2 varchar(25));
insert into atomic_table_11 values (3,"a"),(4,"b"),(5,"c");
begin;
drop table atomic_table_11;
insert into atomic_table_11 values (6,"a");
select * from atomic_table_11;
c1    c2
3    a
4    b
5    c
6    a
rollback ;
select * from atomic_table_11;
c1    c2
3    a
4    b
5    c
6    a
drop table if exists atomic_table_11;
create table atomic_table_11(c1 int,c2 varchar(25));
insert into atomic_table_11 values (3,"a"),(4,"b"),(5,"c");
begin;
drop table atomic_table_11;
drop table atomic_table_11;
commit;
w-w conflict
drop table if exists atomic_table_12;
create table atomic_table_12(c1 int,c2 varchar(25));
insert into atomic_table_12 values (3,"a"),(4,"b"),(5,"c");
begin;
alter table atomic_table_12 add index key1(c1);
alter table atomic_table_12 alter index key1 visible;
show create table atomic_table_12;
Table    Create Table
atomic_table_12    CREATE TABLE `atomic_table_12` (\n`c1` INT DEFAULT NULL,\n`c2` VARCHAR(25) DEFAULT NULL\n)
commit;
show create table atomic_table_12;
Table    Create Table
atomic_table_12    CREATE TABLE `atomic_table_12` (\n`c1` INT DEFAULT NULL,\n`c2` VARCHAR(25) DEFAULT NULL,\nKEY `key1` (`c1`)\n)
show index from atomic_table_12;
Table    Non_unique    Key_name    Seq_in_index    Column_name    Collation    Cardinality    Sub_part    Packed    Null    Index_type    Comment    Index_comment    Visible    Expression
atomic_table_12    1    key1    1    c1    A    0    NULL    NULL    YES                YES    NULL
use transaction_enhance;
drop table if exists atomic_table_12_1;
create table atomic_table_12_1(c1 int,c2 varchar(25));
insert into atomic_table_12_1 values (3,"a"),(4,"b"),(5,"c");
begin;
alter table atomic_table_12_1 add index key1(c1);
alter table atomic_table_12_1 alter index key1 visible;
show create table atomic_table_12_1;
Table    Create Table
atomic_table_12_1    CREATE TABLE `atomic_table_12_1` (\n`c1` INT DEFAULT NULL,\n`c2` VARCHAR(25) DEFAULT NULL\n)
rollback;
show create table atomic_table_12_1;
Table    Create Table
atomic_table_12_1    CREATE TABLE `atomic_table_12_1` (\n`c1` INT DEFAULT NULL,\n`c2` VARCHAR(25) DEFAULT NULL\n)
show index from atomic_table_12_1;
Table    Non_unique    Key_name    Seq_in_index    Column_name    Collation    Cardinality    Sub_part    Packed    Null    Index_type    Comment    Index_comment    Visible    Expression
use transaction_enhance;
drop table if exists atomic_table_12_2;
drop table if exists atomic_table_13;
create table atomic_table_12_2(c1 int primary key,c2 varchar(25));
insert into atomic_table_12_2 values (3,"a"),(4,"b"),(5,"c");
create table atomic_table_13(c1 int primary key,c2 varchar(25));
insert into atomic_table_13 values (3,"d"),(4,"e"),(5,"f");
begin;
alter table atomic_table_13 add constraint ffa foreign key f_a(c1) references atomic_table_12_2(c1);
show create table atomic_table_12_2;
Table    Create Table
atomic_table_12_2    CREATE TABLE `atomic_table_12_2` (\n`c1` INT NOT NULL,\n`c2` VARCHAR(25) DEFAULT NULL,\nPRIMARY KEY (`c1`)\n)
insert into atomic_table_13 values (8,"h");
select * from atomic_table_13;
c1    c2
3    d
4    e
5    f
8    h
insert into atomic_table_13 values (6,"h");
internal error: Cannot add or update a child row: a foreign key constraint fails
Previous DML conflicts with existing constraints or data format. This transaction has to be aborted
commit;
show create table atomic_table_13;
Table    Create Table
atomic_table_13    CREATE TABLE `atomic_table_13` (\n`c1` INT NOT NULL,\n`c2` VARCHAR(25) DEFAULT NULL,\nPRIMARY KEY (`c1`)\n)
drop table if exists atomic_table_12_3;
drop table if exists atomic_table_13;
create table atomic_table_12_3(c1 int primary key,c2 varchar(25));
insert into atomic_table_12_3 values (3,"a"),(4,"b"),(5,"c");
create table atomic_table_13(c1 int primary key,c2 varchar(25));
insert into atomic_table_13 values (3,"d"),(4,"e"),(5,"f");
alter table atomic_table_13 add constraint ffa foreign key f_a(c1) references atomic_table_12_3(c1);
begin;
alter table atomic_table_13 drop foreign key ffa;
insert into atomic_table_13 values (8,"h");
internal error: Cannot add or update a child row: a foreign key constraint fails
select * from atomic_table_13;
c1    c2
3    d
4    e
5    f
commit;
show create table atomic_table_13;
Table    Create Table
atomic_table_13    CREATE TABLE `atomic_table_13` (\n`c1` INT NOT NULL,\n`c2` VARCHAR(25) DEFAULT NULL,\nPRIMARY KEY (`c1`)\n)
drop table if exists atomic_table_12_4;
drop table if exists atomic_table_13;
create table atomic_table_12_4(c1 int primary key,c2 varchar(25));
insert into atomic_table_12_4 values (3,"a"),(4,"b"),(5,"c");
create table atomic_table_13(c1 int primary key,c2 varchar(25));
insert into atomic_table_13 values (3,"d"),(4,"e"),(5,"f");
alter table atomic_table_13 add constraint ffa foreign key f_a(c1) references atomic_table_12_4(c1);
begin;
alter table atomic_table_13 drop foreign key ffa;
insert into atomic_table_13 values (8,"h");
internal error: Cannot add or update a child row: a foreign key constraint fails
select * from atomic_table_13;
c1    c2
3    d
4    e
5    f
rollback ;
show create table atomic_table_13;
Table    Create Table
atomic_table_13    CREATE TABLE `atomic_table_13` (\n`c1` INT NOT NULL,\n`c2` VARCHAR(25) DEFAULT NULL,\nPRIMARY KEY (`c1`),\nCONSTRAINT `ffa` FOREIGN KEY (`c1`) REFERENCES `atomic_table_12_4` (`c1`) ON DELETE RESTRICT ON UPDATE RESTRICT\n)
drop table if exists atomic_table_12_5;
drop table if exists atomic_table_13;
create table atomic_table_12_5(c1 int,c2 varchar(25));
insert into atomic_table_12_5 values (3,"a"),(4,"b"),(5,"c");
alter table atomic_table_12_5 add index key1(c1);
begin;
alter table atomic_table_12_5 drop index key1;
show create table atomic_table_12_5;
Table    Create Table
atomic_table_12_5    CREATE TABLE `atomic_table_12_5` (\n`c1` INT DEFAULT NULL,\n`c2` VARCHAR(25) DEFAULT NULL,\nKEY `key1` (`c1`)\n)
select * from atomic_table_12_5;
c1    c2
3    a
4    b
5    c
commit;
show index from atomic_table_12_5;
Table    Non_unique    Key_name    Seq_in_index    Column_name    Collation    Cardinality    Sub_part    Packed    Null    Index_type    Comment    Index_comment    Visible    Expression
drop table if exists atomic_table_14;
create table atomic_table_14(c1 int,c2 varchar(25));
insert into atomic_table_14 values (3,"a"),(4,"b"),(5,"c");
start transaction ;
alter table atomic_table_14 add  index key1(c1);
drop table atomic_table_14;
insert into atomic_table_14 values (6,"a"),(7,"b");
select * from atomic_table_14;
commit;
w-w conflict
select * from atomic_table_14;
SQL parser error: table "atomic_table_14" does not exist
drop table if exists atomic_table_15;
create table atomic_table_15(c1 int,c2 varchar(25));
begin;
insert into atomic_table_15 values (6,"a"),(7,"b");
truncate table atomic_table_15;
drop table atomic_table_15;
select * from atomic_table_15;
c1    c2
commit;
internal error: w-w conflict: truncate error
select * from atomic_table_15;
SQL parser error: table "atomic_table_15" does not exist
drop table if exists atomic_table_16;
create table atomic_table_16(c1 int,c2 varchar(25));
begin;
insert into atomic_table_16 values (6,"a"),(7,"b");
drop table atomic_table_16;
drop table atomic_table_16;
commit;
w-w conflict
select * from atomic_table_16;
SQL parser error: table "atomic_table_16" does not exist
drop table if exists atomic_table_17;
create table atomic_table_17(c1 int,c2 varchar(25));
begin;
insert into atomic_table_17 values (6,"a"),(7,"b");
drop table atomic_table_17;
alter table atomic_table_17 add constraint unique key (c1);
update atomic_table_17 set c1=8 where c2="b";
commit;
w-w conflict
select * from atomic_table_17;
c1    c2
start transaction ;
create database tdb;
internal error: CREATE/DROP of database is not supported in transactions
use tdb;
invalid database tdb
drop database tdb;
internal error: CREATE/DROP of database is not supported in transactions
commit;
begin;
create sequence seq_01 as int start 30;
internal error: Only CREATE of DDL is supported in transactions
select nextval('seq_01');
SQL parser error: table "seq_01" does not exist
commit;
select nextval('seq_01');
SQL parser error: table "seq_01" does not exist
drop table if exists atomic_table_11;
drop account if exists trans_acc1;
create account trans_acc1 admin_name "admin" identified by "111";
begin;
drop account trans_acc1;
internal error: administrative command is unsupported in transactions
select count(*) from mo_catalog.mo_account where account_name='trans_acc1';
count(*)
1
commit;
select count(*) from mo_catalog.mo_account where account_name='trans_acc1';
count(*)
1
drop table if exists atomic_table_18;
create table atomic_table_18(c1 int,c2 varchar(25));
insert into atomic_table_18 values (6,"a"),(7,"b");
set autocommit=0;
alter table atomic_table_18 add index key1(c1);
alter table atomic_table_18 alter index key1 visible;
show create table atomic_table_18;
Table    Create Table
atomic_table_18    CREATE TABLE `atomic_table_18` (\n`c1` INT DEFAULT NULL,\n`c2` VARCHAR(25) DEFAULT NULL\n)
rollback;
show create table atomic_table_18;
Table    Create Table
atomic_table_18    CREATE TABLE `atomic_table_18` (\n`c1` INT DEFAULT NULL,\n`c2` VARCHAR(25) DEFAULT NULL\n)
show index from atomic_table_18;
Table    Non_unique    Key_name    Seq_in_index    Column_name    Collation    Cardinality    Sub_part    Packed    Null    Index_type    Comment    Index_comment    Visible    Expression
truncate table atomic_table_18;
drop table atomic_table_18;
select * from atomic_table_18;
c1    c2
commit;
internal error: w-w conflict: truncate error
select * from atomic_table_18;
SQL parser error: table "atomic_table_18" does not exist
Previous DML conflicts with existing constraints or data format. This transaction has to be aborted
create table atomic_table_18(c1 int,c2 varchar(25));
insert into atomic_table_18 values (6,"a"),(7,"b");
drop table atomic_table_18;
drop table atomic_table_18;
no such table transaction_enhance.atomic_table_18
select * from atomic_table_18;
SQL parser error: table "atomic_table_18" does not exist
Previous DML conflicts with existing constraints or data format. This transaction has to be aborted
commit;
select * from atomic_table_18;
SQL parser error: table "atomic_table_18" does not exist
Previous DML conflicts with existing constraints or data format. This transaction has to be aborted
set autocommit=1;
drop account if exists trans_acc1;
