drop database if exists test_gc_diff;
create database test_gc_diff;
use test_gc_diff;
create table c2_src (a int primary key, b int);
insert into c2_src select *, * from generate_series(1, 200000) g;
data branch create table c2_tar from c2_src;
update c2_tar set b = b + 1 where a mod 1119 = 0;
data branch diff c2_tar against c2_src output summary;
➤ metric[12,0,0]  ¦  c2_tar[-5,0,0]  ¦  c2_src[-5,0,0]  𝄀
INSERTED  ¦  0  ¦  0  𝄀
DELETED  ¦  0  ¦  0  𝄀
UPDATED  ¦  178  ¦  0
select count(*) as updated_rows_before_gc from c2_tar where b != a;
➤ updated_rows_before_gc[-5,64,0]  𝄀
178
select mo_ctl('dn', 'flush', 'test_gc_diff.c2_tar');
➤ mo_ctl(dn, flush, test_gc_diff.c2_tar)[12,-1,0]  𝄀
{
  "method": "Flush",
  "result": [
    {
      "returnStr": "OK"
    }
  ]
}

select mo_ctl('dn', 'flush', 'test_gc_diff.c2_src');
➤ mo_ctl(dn, flush, test_gc_diff.c2_src)[12,-1,0]  𝄀
{
  "method": "Flush",
  "result": [
    {
      "returnStr": "OK"
    }
  ]
}

select mo_ctl('dn', 'globalcheckpoint', '');
➤ mo_ctl(dn, globalcheckpoint, )[12,-1,0]  𝄀
{
  "method": "GlobalCheckpoint",
  "result": [
    {
      "returnStr": "OK"
    }
  ]
}

select mo_ctl('dn', 'globalcheckpoint', '');
➤ mo_ctl(dn, globalcheckpoint, )[12,-1,0]  𝄀
{
  "method": "GlobalCheckpoint",
  "result": [
    {
      "returnStr": "OK"
    }
  ]
}

select mo_ctl('dn', 'diskcleaner', 'force_gc');
➤ mo_ctl(dn, diskcleaner, force_gc)[12,-1,0]  𝄀
{
  "method": "DiskCleaner",
  "result": [
    {
      "returnStr": "OK"
    }
  ]
}

select mo_ctl('dn', 'globalcheckpoint', '');
➤ mo_ctl(dn, globalcheckpoint, )[12,-1,0]  𝄀
{
  "method": "GlobalCheckpoint",
  "result": [
    {
      "returnStr": "OK"
    }
  ]
}

select mo_ctl('dn', 'diskcleaner', 'force_gc');
➤ mo_ctl(dn, diskcleaner, force_gc)[12,-1,0]  𝄀
{
  "method": "DiskCleaner",
  "result": [
    {
      "returnStr": "OK"
    }
  ]
}

data branch diff c2_tar against c2_src output summary;
➤ metric[12,0,0]  ¦  c2_tar[-5,0,0]  ¦  c2_src[-5,0,0]  𝄀
INSERTED  ¦  0  ¦  0  𝄀
DELETED  ¦  0  ¦  0  𝄀
UPDATED  ¦  178  ¦  0
data branch diff c2_tar against c2_src output count;
➤ COUNT(*)[-5,0,0]  𝄀
178
select count(*) as updated_rows_after_gc from c2_tar where b != a;
➤ updated_rows_after_gc[-5,64,0]  𝄀
178
drop table c2_src;
drop table c2_tar;
create table c3_src (a int, b int);
insert into c3_src select *, * from generate_series(1, 200000) g;
data branch create table c3_tar from c3_src;
update c3_tar set b = b + 1 where a mod 1119 = 0;
data branch diff c3_tar against c3_src output summary;
➤ metric[12,0,0]  ¦  c3_tar[-5,0,0]  ¦  c3_src[-5,0,0]  𝄀
INSERTED  ¦  0  ¦  0  𝄀
DELETED  ¦  0  ¦  0  𝄀
UPDATED  ¦  178  ¦  0
select mo_ctl('dn', 'flush', 'test_gc_diff.c3_tar');
➤ mo_ctl(dn, flush, test_gc_diff.c3_tar)[12,-1,0]  𝄀
{
  "method": "Flush",
  "result": [
    {
      "returnStr": "OK"
    }
  ]
}

select mo_ctl('dn', 'flush', 'test_gc_diff.c3_src');
➤ mo_ctl(dn, flush, test_gc_diff.c3_src)[12,-1,0]  𝄀
{
  "method": "Flush",
  "result": [
    {
      "returnStr": "OK"
    }
  ]
}

select mo_ctl('dn', 'globalcheckpoint', '');
➤ mo_ctl(dn, globalcheckpoint, )[12,-1,0]  𝄀
{
  "method": "GlobalCheckpoint",
  "result": [
    {
      "returnStr": "OK"
    }
  ]
}

select mo_ctl('dn', 'globalcheckpoint', '');
➤ mo_ctl(dn, globalcheckpoint, )[12,-1,0]  𝄀
{
  "method": "GlobalCheckpoint",
  "result": [
    {
      "returnStr": "OK"
    }
  ]
}

select mo_ctl('dn', 'diskcleaner', 'force_gc');
➤ mo_ctl(dn, diskcleaner, force_gc)[12,-1,0]  𝄀
{
  "method": "DiskCleaner",
  "result": [
    {
      "returnStr": "OK"
    }
  ]
}

select mo_ctl('dn', 'globalcheckpoint', '');
➤ mo_ctl(dn, globalcheckpoint, )[12,-1,0]  𝄀
{
  "method": "GlobalCheckpoint",
  "result": [
    {
      "returnStr": "OK"
    }
  ]
}

select mo_ctl('dn', 'diskcleaner', 'force_gc');
➤ mo_ctl(dn, diskcleaner, force_gc)[12,-1,0]  𝄀
{
  "method": "DiskCleaner",
  "result": [
    {
      "returnStr": "OK"
    }
  ]
}

data branch diff c3_tar against c3_src output summary;
➤ metric[12,0,0]  ¦  c3_tar[-5,0,0]  ¦  c3_src[-5,0,0]  𝄀
INSERTED  ¦  0  ¦  0  𝄀
DELETED  ¦  0  ¦  0  𝄀
UPDATED  ¦  178  ¦  0
data branch diff c3_tar against c3_src output count;
➤ COUNT(*)[-5,0,0]  𝄀
178
drop table c3_src;
drop table c3_tar;
create table t1(a int, b int, primary key(a));
insert into t1 values(1, 1), (2, 2), (3, 3);
data branch create table t2 from t1;
insert into t2 values(4, 4), (5, 5);
data branch diff t2 against t1;
➤ diff t2 against t1[12,0,0]  ¦  flag[12,0,0]  ¦  a[4,0,0]  ¦  b[4,0,0]  𝄀
t2  ¦  INSERT  ¦  4  ¦  4  𝄀
t2  ¦  INSERT  ¦  5  ¦  5
data branch merge t2 into t1;
data branch diff t2 against t1;
➤ diff t2 against t1[12,0,0]  ¦  flag[12,0,0]  ¦  a[4,0,0]  ¦  b[4,0,0]
update t1 set b = b + 1 where a = 4;
data branch diff t2 against t1;
➤ diff t2 against t1[12,0,0]  ¦  flag[12,0,0]  ¦  a[4,0,0]  ¦  b[4,0,0]  𝄀
t2  ¦  INSERT  ¦  4  ¦  4  𝄀
t1  ¦  INSERT  ¦  4  ¦  5
update t1 set b = b + 1 where a = 1;
data branch diff t2 against t1;
➤ diff t2 against t1[12,0,0]  ¦  flag[12,0,0]  ¦  a[4,0,0]  ¦  b[4,0,0]  𝄀
t1  ¦  UPDATE  ¦  1  ¦  2  𝄀
t2  ¦  INSERT  ¦  4  ¦  4  𝄀
t1  ¦  INSERT  ¦  4  ¦  5
select mo_ctl('dn', 'flush', 'test_gc_diff.t2');
➤ mo_ctl(dn, flush, test_gc_diff.t2)[12,-1,0]  𝄀
{
  "method": "Flush",
  "result": [
    {
      "returnStr": "OK"
    }
  ]
}

select mo_ctl('dn', 'flush', 'test_gc_diff.t1');
➤ mo_ctl(dn, flush, test_gc_diff.t1)[12,-1,0]  𝄀
{
  "method": "Flush",
  "result": [
    {
      "returnStr": "OK"
    }
  ]
}

select mo_ctl('dn', 'globalcheckpoint', '');
➤ mo_ctl(dn, globalcheckpoint, )[12,-1,0]  𝄀
{
  "method": "GlobalCheckpoint",
  "result": [
    {
      "returnStr": "OK"
    }
  ]
}

select mo_ctl('dn', 'globalcheckpoint', '');
➤ mo_ctl(dn, globalcheckpoint, )[12,-1,0]  𝄀
{
  "method": "GlobalCheckpoint",
  "result": [
    {
      "returnStr": "OK"
    }
  ]
}

select mo_ctl('dn', 'diskcleaner', 'force_gc');
➤ mo_ctl(dn, diskcleaner, force_gc)[12,-1,0]  𝄀
{
  "method": "DiskCleaner",
  "result": [
    {
      "returnStr": "OK"
    }
  ]
}

select mo_ctl('dn', 'globalcheckpoint', '');
➤ mo_ctl(dn, globalcheckpoint, )[12,-1,0]  𝄀
{
  "method": "GlobalCheckpoint",
  "result": [
    {
      "returnStr": "OK"
    }
  ]
}

select mo_ctl('dn', 'diskcleaner', 'force_gc');
➤ mo_ctl(dn, diskcleaner, force_gc)[12,-1,0]  𝄀
{
  "method": "DiskCleaner",
  "result": [
    {
      "returnStr": "OK"
    }
  ]
}

data branch diff t2 against t1;
➤ diff t2 against t1[12,0,0]  ¦  flag[12,0,0]  ¦  a[4,0,0]  ¦  b[4,0,0]  𝄀
t1  ¦  UPDATE  ¦  1  ¦  2  𝄀
t2  ¦  INSERT  ¦  4  ¦  4  𝄀
t1  ¦  INSERT  ¦  4  ¦  5
drop table t1;
drop table t2;
create table c4_root(id int primary key, v int, note varchar(20));
insert into c4_root select result, result, concat('v-', result) from generate_series(1, 2000) g;
select mo_ctl('dn', 'flush', 'test_gc_diff.c4_root');
➤ mo_ctl(dn, flush, test_gc_diff.c4_root)[12,65535,0]  𝄀
{
  "method": "Flush",
  "result": [
    {
      "returnStr": "OK"
    }
  ]
}

insert into c4_root select result, result, concat('v-', result) from generate_series(2001, 4000) g;
select mo_ctl('dn', 'flush', 'test_gc_diff.c4_root');
➤ mo_ctl(dn, flush, test_gc_diff.c4_root)[12,65535,0]  𝄀
{
  "method": "Flush",
  "result": [
    {
      "returnStr": "OK"
    }
  ]
}

insert into c4_root select result, result, concat('v-', result) from generate_series(4001, 6000) g;
select mo_ctl('dn', 'flush', 'test_gc_diff.c4_root');
➤ mo_ctl(dn, flush, test_gc_diff.c4_root)[12,65535,0]  𝄀
{
  "method": "Flush",
  "result": [
    {
      "returnStr": "OK"
    }
  ]
}

insert into c4_root select result, result, concat('v-', result) from generate_series(6001, 8000) g;
select mo_ctl('dn', 'flush', 'test_gc_diff.c4_root');
➤ mo_ctl(dn, flush, test_gc_diff.c4_root)[12,65535,0]  𝄀
{
  "method": "Flush",
  "result": [
    {
      "returnStr": "OK"
    }
  ]
}

insert into c4_root select result, result, concat('v-', result) from generate_series(8001, 10000) g;
select mo_ctl('dn', 'flush', 'test_gc_diff.c4_root');
➤ mo_ctl(dn, flush, test_gc_diff.c4_root)[12,65535,0]  𝄀
{
  "method": "Flush",
  "result": [
    {
      "returnStr": "OK"
    }
  ]
}

insert into c4_root select result, result, concat('v-', result) from generate_series(10001, 12000) g;
select mo_ctl('dn', 'flush', 'test_gc_diff.c4_root');
➤ mo_ctl(dn, flush, test_gc_diff.c4_root)[12,65535,0]  𝄀
{
  "method": "Flush",
  "result": [
    {
      "returnStr": "OK"
    }
  ]
}

data branch create table c4_leaf from c4_root;
update c4_root set v = 100001, note = 'root-update' where id = 1;
delete from c4_root where id = 2;
update c4_leaf set v = 300003, note = 'leaf-update' where id = 3;
insert into c4_leaf values (13001, 13001, 'leaf-insert');
data branch diff c4_leaf against c4_root;
➤ diff c4_leaf against c4_root[12,0,0]  ¦  flag[12,0,0]  ¦  id[4,32,0]  ¦  v[4,32,0]  ¦  note[12,20,0]  𝄀
c4_root  ¦  UPDATE  ¦  1  ¦  100001  ¦  root-update  𝄀
c4_root  ¦  DELETE  ¦  2  ¦  2  ¦  v-2  𝄀
c4_leaf  ¦  UPDATE  ¦  3  ¦  300003  ¦  leaf-update  𝄀
c4_leaf  ¦  INSERT  ¦  13001  ¦  13001  ¦  leaf-insert
data branch diff c4_leaf against c4_root output count;
➤ COUNT(*)[-5,0,0]  𝄀
4
select count(*) as root_rows_before_gc from c4_root;
➤ root_rows_before_gc[-5,64,0]  𝄀
11999
select count(*) as leaf_rows_before_gc from c4_leaf;
➤ leaf_rows_before_gc[-5,64,0]  𝄀
12001
select count(*) as branch_protect_before_gc
from mo_catalog.mo_snapshots
where kind = 'branch' and database_name = 'test_gc_diff' and table_name = 'c4_root';
➤ branch_protect_before_gc[-5,64,0]  𝄀
1
select mo_ctl('dn', 'flush', 'test_gc_diff.c4_root');
➤ mo_ctl(dn, flush, test_gc_diff.c4_root)[12,65535,0]  𝄀
{
  "method": "Flush",
  "result": [
    {
      "returnStr": "OK"
    }
  ]
}

select mo_ctl('dn', 'flush', 'test_gc_diff.c4_leaf');
➤ mo_ctl(dn, flush, test_gc_diff.c4_leaf)[12,65535,0]  𝄀
{
  "method": "Flush",
  "result": [
    {
      "returnStr": "OK"
    }
  ]
}

select mo_ctl('cn', 'mergeobjects', 't:test_gc_diff.c4_leaf:overlap');
➤ mo_ctl(cn, mergeobjects, t:test_gc_diff.c4_leaf:overlap)[12,65535,0]  𝄀

nmerged success
01a024f7-bc90-7bf6-b9ac-86a98dfacbc9_00000, rows 12001, blks 2, osize 393.2KiB, csize 171.4KiB


data branch diff c4_leaf against c4_root;
➤ diff c4_leaf against c4_root[12,0,0]  ¦  flag[12,0,0]  ¦  id[4,32,0]  ¦  v[4,32,0]  ¦  note[12,20,0]  𝄀
c4_root  ¦  UPDATE  ¦  1  ¦  100001  ¦  root-update  𝄀
c4_root  ¦  DELETE  ¦  2  ¦  2  ¦  v-2  𝄀
c4_leaf  ¦  UPDATE  ¦  3  ¦  300003  ¦  leaf-update  𝄀
c4_leaf  ¦  INSERT  ¦  13001  ¦  13001  ¦  leaf-insert
select mo_ctl('dn', 'globalcheckpoint', '');
➤ mo_ctl(dn, globalcheckpoint, )[12,65535,0]  𝄀
{
  "method": "GlobalCheckpoint",
  "result": [
    {
      "returnStr": "OK"
    }
  ]
}

select mo_ctl('dn', 'diskcleaner', 'force_gc');
➤ mo_ctl(dn, diskcleaner, force_gc)[12,65535,0]  𝄀
{
  "method": "DiskCleaner",
  "result": [
    {
      "returnStr": "OK"
    }
  ]
}

data branch diff c4_leaf against c4_root;
➤ diff c4_leaf against c4_root[12,0,0]  ¦  flag[12,0,0]  ¦  id[4,32,0]  ¦  v[4,32,0]  ¦  note[12,20,0]  𝄀
c4_root  ¦  UPDATE  ¦  1  ¦  100001  ¦  root-update  𝄀
c4_root  ¦  DELETE  ¦  2  ¦  2  ¦  v-2  𝄀
c4_leaf  ¦  UPDATE  ¦  3  ¦  300003  ¦  leaf-update  𝄀
c4_leaf  ¦  INSERT  ¦  13001  ¦  13001  ¦  leaf-insert
select mo_ctl('dn', 'globalcheckpoint', '');
➤ mo_ctl(dn, globalcheckpoint, )[12,65535,0]  𝄀
{
  "method": "GlobalCheckpoint",
  "result": [
    {
      "returnStr": "OK"
    }
  ]
}

select mo_ctl('dn', 'diskcleaner', 'force_gc');
➤ mo_ctl(dn, diskcleaner, force_gc)[12,65535,0]  𝄀
{
  "method": "DiskCleaner",
  "result": [
    {
      "returnStr": "OK"
    }
  ]
}

data branch diff c4_leaf against c4_root;
➤ diff c4_leaf against c4_root[12,0,0]  ¦  flag[12,0,0]  ¦  id[4,32,0]  ¦  v[4,32,0]  ¦  note[12,20,0]  𝄀
c4_root  ¦  UPDATE  ¦  1  ¦  100001  ¦  root-update  𝄀
c4_root  ¦  DELETE  ¦  2  ¦  2  ¦  v-2  𝄀
c4_leaf  ¦  UPDATE  ¦  3  ¦  300003  ¦  leaf-update  𝄀
c4_leaf  ¦  INSERT  ¦  13001  ¦  13001  ¦  leaf-insert
select mo_ctl('dn', 'globalcheckpoint', '');
➤ mo_ctl(dn, globalcheckpoint, )[12,65535,0]  𝄀
{
  "method": "GlobalCheckpoint",
  "result": [
    {
      "returnStr": "OK"
    }
  ]
}

select mo_ctl('dn', 'diskcleaner', 'force_gc');
➤ mo_ctl(dn, diskcleaner, force_gc)[12,65535,0]  𝄀
{
  "method": "DiskCleaner",
  "result": [
    {
      "returnStr": "OK"
    }
  ]
}

data branch diff c4_leaf against c4_root;
➤ diff c4_leaf against c4_root[12,0,0]  ¦  flag[12,0,0]  ¦  id[4,32,0]  ¦  v[4,32,0]  ¦  note[12,20,0]  𝄀
c4_root  ¦  UPDATE  ¦  1  ¦  100001  ¦  root-update  𝄀
c4_root  ¦  DELETE  ¦  2  ¦  2  ¦  v-2  𝄀
c4_leaf  ¦  UPDATE  ¦  3  ¦  300003  ¦  leaf-update  𝄀
c4_leaf  ¦  INSERT  ¦  13001  ¦  13001  ¦  leaf-insert
data branch diff c4_leaf against c4_root output count;
➤ COUNT(*)[-5,0,0]  𝄀
4
select count(*) as root_rows_after_gc from c4_root;
➤ root_rows_after_gc[-5,64,0]  𝄀
11999
select count(*) as leaf_rows_after_gc from c4_leaf;
➤ leaf_rows_after_gc[-5,64,0]  𝄀
12001
select count(*) as branch_protect_after_gc
from mo_catalog.mo_snapshots
where kind = 'branch' and database_name = 'test_gc_diff' and table_name = 'c4_root';
➤ branch_protect_after_gc[-5,64,0]  𝄀
1
drop table c4_leaf;
drop table c4_root;
drop database test_gc_diff;
