drop database if exists test_gc_diff;
create database test_gc_diff;
use test_gc_diff;
create table c1_src (
`memory_id` varchar(64) not null,
`user_id` varchar(64) not null,
`session_id` varchar(64) default null,
`memory_type` varchar(20) not null,
`content` text not null,
`initial_confidence` float not null,
`trust_tier` varchar(10) default null,
`source_event_ids` json not null,
`superseded_by` varchar(64) default null,
`is_active` smallint not null default '1',
`observed_at` datetime(6) not null,
`created_at` datetime(6) not null,
`updated_at` datetime(6) default null,
primary key (`memory_id`)
);
insert into c1_src
(memory_id, user_id, content, memory_type, trust_tier, is_active,
initial_confidence, source_event_ids, observed_at, created_at, updated_at)
values ('base-001', 'user1', 'base content', 'semantic', 'T1', 1, 0.9, '[]',
'2025-01-01 00:00:00.000000', '2025-01-01 00:00:00.000000', '2025-01-01 00:00:00.000000');
select mo_ctl('dn', 'flush', 'test_gc_diff.c1_src');
mo_ctl(dn, flush, test_gc_diff.c1_src)
{\n  "method": "Flush",\n  "result": [\n    {\n      "returnStr": "OK"\n    }\n  ]\n}\n
data branch create table c1_tar from c1_src;
insert into c1_tar
(memory_id, user_id, content, memory_type, trust_tier, is_active,
initial_confidence, source_event_ids, observed_at, created_at, updated_at)
values ('test-mem-001', 'test', 'content', 'semantic', 'T2', 1, 0.8, '[]',
'2025-01-01 00:00:00.000000', '2025-01-01 00:00:00.000000', '2025-01-01 00:00:00.000000');
data branch diff c1_tar against c1_src output summary;
metric    c1_tar    c1_src
INSERTED    1    0
DELETED    0    0
UPDATED    0    0
select mo_ctl('dn', 'flush', 'test_gc_diff.c1_tar');
mo_ctl(dn, flush, test_gc_diff.c1_tar)
{\n  "method": "Flush",\n  "result": [\n    {\n      "returnStr": "OK"\n    }\n  ]\n}\n
select mo_ctl('dn', 'flush', 'test_gc_diff.c1_src');
mo_ctl(dn, flush, test_gc_diff.c1_src)
{\n  "method": "Flush",\n  "result": [\n    {\n      "returnStr": "OK"\n    }\n  ]\n}\n
select mo_ctl('dn', 'globalcheckpoint', '');
mo_ctl(dn, globalcheckpoint, )
{\n  "method": "GlobalCheckpoint",\n  "result": [\n    {\n      "returnStr": "OK"\n    }\n  ]\n}\n
select mo_ctl('dn', 'globalcheckpoint', '');
mo_ctl(dn, globalcheckpoint, )
{\n  "method": "GlobalCheckpoint",\n  "result": [\n    {\n      "returnStr": "OK"\n    }\n  ]\n}\n
select mo_ctl('dn', 'diskcleaner', 'force_gc');
mo_ctl(dn, diskcleaner, force_gc)
{\n  "method": "DiskCleaner",\n  "result": [\n    {\n      "returnStr": "OK"\n    }\n  ]\n}\n
select mo_ctl('dn', 'globalcheckpoint', '');
mo_ctl(dn, globalcheckpoint, )
{\n  "method": "GlobalCheckpoint",\n  "result": [\n    {\n      "returnStr": "OK"\n    }\n  ]\n}\n
select mo_ctl('dn', 'diskcleaner', 'force_gc');
mo_ctl(dn, diskcleaner, force_gc)
{\n  "method": "DiskCleaner",\n  "result": [\n    {\n      "returnStr": "OK"\n    }\n  ]\n}\n
data branch diff c1_tar against c1_src output summary;
metric    c1_tar    c1_src
INSERTED    1    0
DELETED    0    0
UPDATED    0    0
data branch merge c1_tar into c1_src when conflict accept;
select count(*) from c1_src;
count(*)
2
drop table c1_src;
drop table c1_tar;
create table c2_src (a int primary key, b int);
insert into c2_src select *, * from generate_series(1, 200000) g;
data branch create table c2_tar from c2_src;
update c2_tar set b = b + 1 where a mod 1119 = 0;
data branch diff c2_tar against c2_src output summary;
metric    c2_tar    c2_src
INSERTED    0    0
DELETED    0    0
UPDATED    178    0
select count(*) as updated_rows_before_gc from c2_tar where b != a;
updated_rows_before_gc
178
select mo_ctl('dn', 'flush', 'test_gc_diff.c2_tar');
mo_ctl(dn, flush, test_gc_diff.c2_tar)
{\n  "method": "Flush",\n  "result": [\n    {\n      "returnStr": "OK"\n    }\n  ]\n}\n
select mo_ctl('dn', 'flush', 'test_gc_diff.c2_src');
mo_ctl(dn, flush, test_gc_diff.c2_src)
{\n  "method": "Flush",\n  "result": [\n    {\n      "returnStr": "OK"\n    }\n  ]\n}\n
select mo_ctl('dn', 'globalcheckpoint', '');
mo_ctl(dn, globalcheckpoint, )
{\n  "method": "GlobalCheckpoint",\n  "result": [\n    {\n      "returnStr": "OK"\n    }\n  ]\n}\n
select mo_ctl('dn', 'globalcheckpoint', '');
mo_ctl(dn, globalcheckpoint, )
{\n  "method": "GlobalCheckpoint",\n  "result": [\n    {\n      "returnStr": "OK"\n    }\n  ]\n}\n
select mo_ctl('dn', 'diskcleaner', 'force_gc');
mo_ctl(dn, diskcleaner, force_gc)
{\n  "method": "DiskCleaner",\n  "result": [\n    {\n      "returnStr": "OK"\n    }\n  ]\n}\n
select mo_ctl('dn', 'globalcheckpoint', '');
mo_ctl(dn, globalcheckpoint, )
{\n  "method": "GlobalCheckpoint",\n  "result": [\n    {\n      "returnStr": "OK"\n    }\n  ]\n}\n
select mo_ctl('dn', 'diskcleaner', 'force_gc');
mo_ctl(dn, diskcleaner, force_gc)
{\n  "method": "DiskCleaner",\n  "result": [\n    {\n      "returnStr": "OK"\n    }\n  ]\n}\n
data branch diff c2_tar against c2_src output summary;
metric    c2_tar    c2_src
INSERTED    0    0
DELETED    0    0
UPDATED    178    0
data branch diff c2_tar against c2_src output count;
COUNT(*)
178
select count(*) as updated_rows_after_gc from c2_tar where b != a;
updated_rows_after_gc
178
drop table c2_src;
drop table c2_tar;
create table c3_src (a int, b int);
insert into c3_src select *, * from generate_series(1, 200000) g;
data branch create table c3_tar from c3_src;
update c3_tar set b = b + 1 where a mod 1119 = 0;
data branch diff c3_tar against c3_src output summary;
metric    c3_tar    c3_src
INSERTED    0    0
DELETED    0    0
UPDATED    178    0
select mo_ctl('dn', 'flush', 'test_gc_diff.c3_tar');
mo_ctl(dn, flush, test_gc_diff.c3_tar)
{\n  "method": "Flush",\n  "result": [\n    {\n      "returnStr": "OK"\n    }\n  ]\n}\n
select mo_ctl('dn', 'flush', 'test_gc_diff.c3_src');
mo_ctl(dn, flush, test_gc_diff.c3_src)
{\n  "method": "Flush",\n  "result": [\n    {\n      "returnStr": "OK"\n    }\n  ]\n}\n
select mo_ctl('dn', 'globalcheckpoint', '');
mo_ctl(dn, globalcheckpoint, )
{\n  "method": "GlobalCheckpoint",\n  "result": [\n    {\n      "returnStr": "OK"\n    }\n  ]\n}\n
select mo_ctl('dn', 'globalcheckpoint', '');
mo_ctl(dn, globalcheckpoint, )
{\n  "method": "GlobalCheckpoint",\n  "result": [\n    {\n      "returnStr": "OK"\n    }\n  ]\n}\n
select mo_ctl('dn', 'diskcleaner', 'force_gc');
mo_ctl(dn, diskcleaner, force_gc)
{\n  "method": "DiskCleaner",\n  "result": [\n    {\n      "returnStr": "OK"\n    }\n  ]\n}\n
select mo_ctl('dn', 'globalcheckpoint', '');
mo_ctl(dn, globalcheckpoint, )
{\n  "method": "GlobalCheckpoint",\n  "result": [\n    {\n      "returnStr": "OK"\n    }\n  ]\n}\n
select mo_ctl('dn', 'diskcleaner', 'force_gc');
mo_ctl(dn, diskcleaner, force_gc)
{\n  "method": "DiskCleaner",\n  "result": [\n    {\n      "returnStr": "OK"\n    }\n  ]\n}\n
data branch diff c3_tar against c3_src output summary;
metric    c3_tar    c3_src
INSERTED    0    0
DELETED    0    0
UPDATED    178    0
data branch diff c3_tar against c3_src output count;
COUNT(*)
178
drop table c3_src;
drop table c3_tar;
create table t1(a int, b int, primary key(a));
insert into t1 values(1, 1), (2, 2), (3, 3);
data branch create table t2 from t1;
insert into t2 values(4, 4), (5, 5);
data branch diff t2 against t1;
diff t2 against t1    flag    a    b
t2    INSERT    4    4
t2    INSERT    5    5
data branch merge t2 into t1;
data branch diff t2 against t1;
diff t2 against t1    flag    a    b
update t1 set b = b + 1 where a = 4;
data branch diff t2 against t1;
diff t2 against t1    flag    a    b
t2    INSERT    4    4
t1    INSERT    4    5
update t1 set b = b + 1 where a = 1;
data branch diff t2 against t1;
diff t2 against t1    flag    a    b
t1    UPDATE    1    2
t2    INSERT    4    4
t1    INSERT    4    5
select mo_ctl('dn', 'flush', 'test_gc_diff.t2');
mo_ctl(dn, flush, test_gc_diff.t2)
{\n  "method": "Flush",\n  "result": [\n    {\n      "returnStr": "OK"\n    }\n  ]\n}\n
select mo_ctl('dn', 'flush', 'test_gc_diff.t1');
mo_ctl(dn, flush, test_gc_diff.t1)
{\n  "method": "Flush",\n  "result": [\n    {\n      "returnStr": "OK"\n    }\n  ]\n}\n
select mo_ctl('dn', 'globalcheckpoint', '');
mo_ctl(dn, globalcheckpoint, )
{\n  "method": "GlobalCheckpoint",\n  "result": [\n    {\n      "returnStr": "OK"\n    }\n  ]\n}\n
select mo_ctl('dn', 'globalcheckpoint', '');
mo_ctl(dn, globalcheckpoint, )
{\n  "method": "GlobalCheckpoint",\n  "result": [\n    {\n      "returnStr": "OK"\n    }\n  ]\n}\n
select mo_ctl('dn', 'diskcleaner', 'force_gc');
mo_ctl(dn, diskcleaner, force_gc)
{\n  "method": "DiskCleaner",\n  "result": [\n    {\n      "returnStr": "OK"\n    }\n  ]\n}\n
select mo_ctl('dn', 'globalcheckpoint', '');
mo_ctl(dn, globalcheckpoint, )
{\n  "method": "GlobalCheckpoint",\n  "result": [\n    {\n      "returnStr": "OK"\n    }\n  ]\n}\n
select mo_ctl('dn', 'diskcleaner', 'force_gc');
mo_ctl(dn, diskcleaner, force_gc)
{\n  "method": "DiskCleaner",\n  "result": [\n    {\n      "returnStr": "OK"\n    }\n  ]\n}\n
data branch diff t2 against t1;
diff t2 against t1    flag    a    b
t1    UPDATE    1    2
t2    INSERT    4    4
t1    INSERT    4    5
drop table t1;
drop table t2;
drop database test_gc_diff;
