drop database if exists test_diff_output_as_dst;
drop database if exists test_diff_output_as;
create database test_diff_output_as;
use test_diff_output_as;
create table base_full(
id int primary key,
source varchar(20),
flag varchar(20),
amount decimal(12,2),
payload json,
event_time timestamp
);
insert into base_full values
(1, 'base-1', 'old', 10.50, '{"v": 1}', '2024-01-01 01:02:03'),
(2, 'base-2', 'delete', null, null, null),
(3, 'base-3', 'keep', 30.00, '{"v": 3}', '2024-01-03 01:02:03');
data branch create table branch_full from base_full;
update branch_full
set source = 'branch-1', flag = 'updated', amount = 11.75,
payload = '{"v": 11}', event_time = '2024-02-01 01:02:03'
where id = 1;
delete from branch_full where id = 2;
insert into branch_full values
(4, 'branch-4', 'inserted', 40.25, '{"v": 4}', '2024-04-01 01:02:03');
data branch diff branch_full against base_full output as diff_full;
➤ TABLE CREATED[12,0,0]  𝄀
`test_diff_output_as`.`diff_full`
show create table diff_full;
➤ Table[12,-1,0]  ¦  Create Table[12,-1,0]  𝄀
diff_full  ¦  CREATE TABLE `diff_full` (
  `__mo_diff_source` varchar(255) DEFAULT NULL,
  `__mo_diff_flag` varchar(16) DEFAULT NULL,
  `id` int NOT NULL,
  `source` varchar(20) DEFAULT NULL,
  `flag` varchar(20) DEFAULT NULL,
  `amount` decimal(12,2) DEFAULT NULL,
  `payload` json DEFAULT NULL,
  `event_time` timestamp NULL DEFAULT NULL
)
select __mo_diff_source, __mo_diff_flag, id, source, flag, amount, payload, event_time
from diff_full order by id;
➤ __mo_diff_source[12,-1,0]  ¦  __mo_diff_flag[12,-1,0]  ¦  id[4,32,0]  ¦  source[12,-1,0]  ¦  flag[12,-1,0]  ¦  amount[3,12,2]  ¦  payload[-1,2147483647,0]  ¦  event_time[93,64,0]  𝄀
branch_full  ¦  UPDATE  ¦  1  ¦  branch-1  ¦  updated  ¦  11.75  ¦  {"v": 11}  ¦  2024-02-01 01:02:03  𝄀
branch_full  ¦  DELETE  ¦  2  ¦  base-2  ¦  delete  ¦  null  ¦  null  ¦  null  𝄀
branch_full  ¦  INSERT  ¦  4  ¦  branch-4  ¦  inserted  ¦  40.25  ¦  {"v": 4}  ¦  2024-04-01 01:02:03
select count(*) as diff_full_branch_metadata_rows
from mo_catalog.mo_branch_metadata
where table_id = (
select rel_id from mo_catalog.mo_tables
where reldatabase = 'test_diff_output_as' and relname = 'diff_full'
);
➤ diff_full_branch_metadata_rows[-5,64,0]  𝄀
0
select __mo_diff_source, __mo_diff_flag, id
from test_diff_output_as.diff_full order by id;
➤ __mo_diff_source[12,-1,0]  ¦  __mo_diff_flag[12,-1,0]  ¦  id[4,32,0]  𝄀
branch_full  ¦  UPDATE  ¦  1  𝄀
branch_full  ¦  DELETE  ¦  2  𝄀
branch_full  ¦  INSERT  ¦  4
data branch diff branch_full against base_full
columns (flag, id, amount) output as diff_projected;
➤ TABLE CREATED[12,0,0]  𝄀
`test_diff_output_as`.`diff_projected`
show create table diff_projected;
➤ Table[12,-1,0]  ¦  Create Table[12,-1,0]  𝄀
diff_projected  ¦  CREATE TABLE `diff_projected` (
  `__mo_diff_source` varchar(255) DEFAULT NULL,
  `__mo_diff_flag` varchar(16) DEFAULT NULL,
  `flag` varchar(20) DEFAULT NULL,
  `id` int NOT NULL,
  `amount` decimal(12,2) DEFAULT NULL
)
select __mo_diff_source, __mo_diff_flag, flag, id, amount
from diff_projected order by id;
➤ __mo_diff_source[12,-1,0]  ¦  __mo_diff_flag[12,-1,0]  ¦  flag[12,-1,0]  ¦  id[4,32,0]  ¦  amount[3,12,2]  𝄀
branch_full  ¦  UPDATE  ¦  updated  ¦  1  ¦  11.75  𝄀
branch_full  ¦  DELETE  ¦  delete  ¦  2  ¦  null  𝄀
branch_full  ¦  INSERT  ¦  inserted  ¦  4  ¦  40.25
data branch diff branch_full against base_full
columns (amount, amount, source) output as diff_projected_dedup;
➤ TABLE CREATED[12,0,0]  𝄀
`test_diff_output_as`.`diff_projected_dedup`
show create table diff_projected_dedup;
➤ Table[12,-1,0]  ¦  Create Table[12,-1,0]  𝄀
diff_projected_dedup  ¦  CREATE TABLE `diff_projected_dedup` (
  `__mo_diff_source` varchar(255) DEFAULT NULL,
  `__mo_diff_flag` varchar(16) DEFAULT NULL,
  `amount` decimal(12,2) DEFAULT NULL,
  `source` varchar(20) DEFAULT NULL
)
select __mo_diff_source, __mo_diff_flag, amount, source
from diff_projected_dedup order by amount, source;
➤ __mo_diff_source[12,-1,0]  ¦  __mo_diff_flag[12,-1,0]  ¦  amount[3,12,2]  ¦  source[12,-1,0]  𝄀
branch_full  ¦  DELETE  ¦  null  ¦  base-2  𝄀
branch_full  ¦  UPDATE  ¦  11.75  ¦  branch-1  𝄀
branch_full  ¦  INSERT  ¦  40.25  ¦  branch-4
data branch diff branch_full against base_full
columns (missing) output as diff_missing_column;
-- @regex("column \"missing\" not found", true)
invalid input: column "missing" not found in table "branch_full"
select count(*) as diff_missing_column_tables
from mo_catalog.mo_tables
where reldatabase = 'test_diff_output_as' and relname = 'diff_missing_column';
➤ diff_missing_column_tables[-5,64,0]  𝄀
0
create table base_empty(id int primary key, note varchar(20), amount decimal(10,2));
insert into base_empty values (1, 'one', 1.00), (2, null, null);
data branch create table branch_empty from base_empty;
data branch diff branch_empty against base_empty output as diff_empty;
➤ TABLE CREATED[12,0,0]  𝄀
`test_diff_output_as`.`diff_empty`
show create table diff_empty;
➤ Table[12,-1,0]  ¦  Create Table[12,-1,0]  𝄀
diff_empty  ¦  CREATE TABLE `diff_empty` (
  `__mo_diff_source` varchar(255) DEFAULT NULL,
  `__mo_diff_flag` varchar(16) DEFAULT NULL,
  `id` int NOT NULL,
  `note` varchar(20) DEFAULT NULL,
  `amount` decimal(10,2) DEFAULT NULL
)
select count(*) as diff_empty_rows from diff_empty;
➤ diff_empty_rows[-5,64,0]  𝄀
0
create table base_metadata_names(
id int primary key,
__mo_diff_source varchar(20),
__mo_diff_flag varchar(20)
);
insert into base_metadata_names values (1, 'before-source', 'before-flag');
data branch create table branch_metadata_names from base_metadata_names;
update branch_metadata_names
set __mo_diff_source = 'after-source', __mo_diff_flag = 'after-flag'
where id = 1;
data branch diff branch_metadata_names against base_metadata_names
output as diff_metadata_names;
➤ TABLE CREATED[12,0,0]  𝄀
`test_diff_output_as`.`diff_metadata_names`
show create table diff_metadata_names;
➤ Table[12,-1,0]  ¦  Create Table[12,-1,0]  𝄀
diff_metadata_names  ¦  CREATE TABLE `diff_metadata_names` (
  `__mo_diff_source_1` varchar(255) DEFAULT NULL,
  `__mo_diff_flag_1` varchar(16) DEFAULT NULL,
  `id` int NOT NULL,
  `__mo_diff_source` varchar(20) DEFAULT NULL,
  `__mo_diff_flag` varchar(20) DEFAULT NULL
)
select __mo_diff_source_1, __mo_diff_flag_1,
id, __mo_diff_source, __mo_diff_flag
from diff_metadata_names order by id;
➤ __mo_diff_source_1[12,-1,0]  ¦  __mo_diff_flag_1[12,-1,0]  ¦  id[4,32,0]  ¦  __mo_diff_source[12,-1,0]  ¦  __mo_diff_flag[12,-1,0]  𝄀
branch_metadata_names  ¦  UPDATE  ¦  1  ¦  after-source  ¦  after-flag
create table base_no_pk(
id int,
note varchar(20),
amount decimal(10,2),
payload json
);
insert into base_no_pk values
(1, 'before', 1.00, '{"k": "one"}'),
(2, null, null, null),
(3, 'delete', 3.00, '{"k": "three"}');
data branch create table branch_no_pk from base_no_pk;
update branch_no_pk set note = 'after', amount = 1.25, payload = '{"k": "updated"}' where id = 1;
delete from branch_no_pk where id = 3;
insert into branch_no_pk values (4, 'insert', 4.00, '{"k": "four"}');
create database test_diff_output_as_dst;
data branch diff branch_no_pk against base_no_pk
columns (payload, id, note, amount)
output as test_diff_output_as_dst.diff_no_pk;
➤ TABLE CREATED[12,0,0]  𝄀
`test_diff_output_as_dst`.`diff_no_pk`
show create table test_diff_output_as_dst.diff_no_pk;
➤ Table[12,-1,0]  ¦  Create Table[12,-1,0]  𝄀
diff_no_pk  ¦  CREATE TABLE `diff_no_pk` (
  `__mo_diff_source` varchar(255) DEFAULT NULL,
  `__mo_diff_flag` varchar(16) DEFAULT NULL,
  `payload` json DEFAULT NULL,
  `id` int DEFAULT NULL,
  `note` varchar(20) DEFAULT NULL,
  `amount` decimal(10,2) DEFAULT NULL
)
select __mo_diff_source, __mo_diff_flag, payload, id, note, amount
from test_diff_output_as_dst.diff_no_pk order by id;
➤ __mo_diff_source[12,-1,0]  ¦  __mo_diff_flag[12,-1,0]  ¦  payload[-1,2147483647,0]  ¦  id[4,32,0]  ¦  note[12,-1,0]  ¦  amount[3,10,2]  𝄀
branch_no_pk  ¦  UPDATE  ¦  {"k": "updated"}  ¦  1  ¦  after  ¦  1.25  𝄀
branch_no_pk  ¦  DELETE  ¦  {"k": "three"}  ¦  3  ¦  delete  ¦  3.00  𝄀
branch_no_pk  ¦  INSERT  ¦  {"k": "four"}  ¦  4  ¦  insert  ¦  4.00
select count(*) as diff_no_pk_branch_metadata_rows
from mo_catalog.mo_branch_metadata
where table_id = (
select rel_id from mo_catalog.mo_tables
where reldatabase = 'test_diff_output_as_dst' and relname = 'diff_no_pk'
);
➤ diff_no_pk_branch_metadata_rows[-5,64,0]  𝄀
0
create table diff_existing(sentinel int);
insert into diff_existing values (7);
data branch diff branch_full against base_full output as diff_existing;
-- @regex("already exists", true)
table diff_existing already exists
select * from diff_existing;
➤ sentinel[4,32,0]  𝄀
7
data branch diff branch_empty against base_empty columns (id, note)
output as `diff-output-quoted`;
➤ TABLE CREATED[12,0,0]  𝄀
`test_diff_output_as`.`diff-output-quoted`
show create table `diff-output-quoted`;
➤ Table[12,-1,0]  ¦  Create Table[12,-1,0]  𝄀
diff-output-quoted  ¦  CREATE TABLE `diff-output-quoted` (
  `__mo_diff_source` varchar(255) DEFAULT NULL,
  `__mo_diff_flag` varchar(16) DEFAULT NULL,
  `id` int NOT NULL,
  `note` varchar(20) DEFAULT NULL
)
select __mo_diff_source, __mo_diff_flag, id, note
from `diff-output-quoted` order by id;
➤ __mo_diff_source[12,-1,0]  ¦  __mo_diff_flag[12,-1,0]  ¦  id[4,32,0]  ¦  note[12,-1,0]
data branch diff branch_empty against base_empty
output as diff_snapshot_destination{snapshot="unused_snapshot"};
-- @regex("destination snapshot option is not supported", true)
invalid input: destination snapshot option is not supported for DATA BRANCH DIFF OUTPUT AS
select count(*) as diff_snapshot_destination_tables
from mo_catalog.mo_tables
where reldatabase = 'test_diff_output_as' and relname = 'diff_snapshot_destination';
➤ diff_snapshot_destination_tables[-5,64,0]  𝄀
0
create table source_snapshot(id int primary key, note varchar(20));
insert into source_snapshot values (1, 'before');
create snapshot diff_output_as_source_sp for table test_diff_output_as source_snapshot;
update source_snapshot set note = 'after' where id = 1;
insert into source_snapshot values (2, 'inserted');
data branch diff source_snapshot against source_snapshot{snapshot="diff_output_as_source_sp"}
output as diff_source_snapshot;
➤ TABLE CREATED[12,0,0]  𝄀
`test_diff_output_as`.`diff_source_snapshot`
select __mo_diff_source, __mo_diff_flag, id, note
from diff_source_snapshot order by id;
➤ __mo_diff_source[12,-1,0]  ¦  __mo_diff_flag[12,-1,0]  ¦  id[4,32,0]  ¦  note[12,-1,0]  𝄀
source_snapshot  ¦  UPDATE  ¦  1  ¦  after  𝄀
source_snapshot  ¦  INSERT  ¦  2  ¦  inserted
drop snapshot diff_output_as_source_sp;
create table base_binary(
id int primary key,
text_value varchar(20),
binary_value varbinary(8),
blob_value blob
);
insert into base_binary values (1, 'before', x'00ff', x'00fe');
data branch create table branch_binary from base_binary;
update branch_binary
set text_value = 'after', binary_value = x'00275c0a', blob_value = x'000102ff'
where id = 1;
data branch diff branch_binary against base_binary output as diff_binary;
➤ TABLE CREATED[12,0,0]  𝄀
`test_diff_output_as`.`diff_binary`
show create table diff_binary;
➤ Table[12,-1,0]  ¦  Create Table[12,-1,0]  𝄀
diff_binary  ¦  CREATE TABLE `diff_binary` (
  `__mo_diff_source` varchar(255) DEFAULT NULL,
  `__mo_diff_flag` varchar(16) DEFAULT NULL,
  `id` int NOT NULL,
  `text_value` varchar(20) DEFAULT NULL,
  `binary_value` varbinary(8) DEFAULT NULL,
  `blob_value` blob DEFAULT NULL
)
select __mo_diff_source, __mo_diff_flag, id,
hex(text_value), hex(binary_value), hex(blob_value)
from diff_binary order by id;
➤ __mo_diff_source[12,-1,0]  ¦  __mo_diff_flag[12,-1,0]  ¦  id[4,32,0]  ¦  hex(text_value)[12,-1,0]  ¦  hex(binary_value)[12,-1,0]  ¦  hex(blob_value)[12,-1,0]  𝄀
branch_binary  ¦  UPDATE  ¦  1  ¦  6166746572  ¦  00275C0A  ¦  000102FF
drop database test_diff_output_as_dst;
drop database test_diff_output_as;
