set experimental_fulltext_index=1;
set ft_relevancy_algorithm="TF-IDF";
SET experimental_hnsw_index = 1;
drop database if exists test01;
create database test01;
use test01;
drop table if exists src;
create table src (id bigint primary key, body varchar, title text);
insert into src values (0, 'color is red', 't1'), (1, 'car is yellow', 'crazy car'), (2, 'sky is blue', 'no limit'), (3, 'blue is not red', 'colorful'),
(4, '遠東兒童中文是針對6到9歲的小朋友精心設計的中文學習教材，共三冊，目前已出版一、二冊。', '遠東兒童中文'),
(5, '每冊均採用近百張全幅彩圖及照片，生動活潑、自然真實，加深兒童學習印象，洋溢學習樂趣。', '遠東兒童中文'),
(6, '各個單元主題內容涵蓋中華文化及生活應用的介紹。本套教材含課本、教學指引、生字卡、學生作業本與CD，中英對照，精美大字版。本系列有繁體字及簡體字兩種版本印行。', '中文短篇小說'),
(7, '59個簡單的英文和中文短篇小說', '適合初學者'),
(8, NULL, 'NOT INCLUDED'),
(9, 'NOT INCLUDED BODY', NULL),
(10, NULL, NULL);
create fulltext index ftidx on src (body, title);
select * from src;
id    body    title
0    color is red    t1
1    car is yellow    crazy car
2    sky is blue    no limit
3    blue is not red    colorful
4    遠東兒童中文是針對6到9歲的小朋友精心設計的中文學習教材，共三冊，目前已出版一、二冊。    遠東兒童中文
5    每冊均採用近百張全幅彩圖及照片，生動活潑、自然真實，加深兒童學習印象，洋溢學習樂趣。    遠東兒童中文
6    各個單元主題內容涵蓋中華文化及生活應用的介紹。本套教材含課本、教學指引、生字卡、學生作業本與CD，中英對照，精美大字版。本系列有繁體字及簡體字兩種版本印行。    中文短篇小說
7    59個簡單的英文和中文短篇小說    適合初學者
8    null    NOT INCLUDED
9    NOT INCLUDED BODY    null
10    null    null
drop snapshot if exists sp01;
create snapshot sp01 for account;
drop database if exists test02;
create database test02;
use test02;
drop table if exists vector_test;
create table `vector_test` (id INT PRIMARY KEY AUTO_INCREMENT, vector vecf32(3));
INSERT INTO `vector_test` VALUES(1,"[1,2,4]");
INSERT INTO `vector_test` VALUES(2,"[1,2,6]");
INSERT INTO `vector_test` VALUES(3,"[1,3,6]");
INSERT INTO `vector_test` VALUES(4,"[1,3,6]");
INSERT INTO `vector_test` VALUES(5,"[1,3,6]");
INSERT INTO `vector_test` VALUES(6,"[1,3,6]");
select * from vector_test;
id    vector
1    [1, 2, 4]
2    [1, 2, 6]
3    [1, 3, 6]
4    [1, 3, 6]
5    [1, 3, 6]
6    [1, 3, 6]
drop snapshot if exists sp02;
create snapshot sp02 for account;
drop database if exists test03;
create database test03;
use test03;
drop table if exists vector_index_01;
create table vector_index_01(a bigint primary key, b vecf32(128),c int,key c_k(c));
create index idx01 using hnsw on vector_index_01(b) op_type "vector_l2_ops" M 48 EF_CONSTRUCTION 64 EF_SEARCH 64;
insert into vector_index_01 values(9774 ,"[1, 0, 1, 6, 6, 17, 47, 39, 2, 0, 1, 25, 27, 10, 56, 130, 18, 5, 2, 6, 15, 2, 19, 130, 42, 28, 1, 1, 2, 1, 0, 5, 0, 2, 4, 4, 31, 34, 44, 35, 9, 3, 8, 11, 33, 12, 61, 130, 130, 17, 0, 1, 6, 2, 9, 130, 111, 36, 0, 0, 11, 9, 1, 12, 2, 100, 130, 28, 7, 2, 6, 7, 9, 27, 130, 83, 5, 0, 1, 18, 130, 130, 84, 9, 0, 0, 2, 24, 111, 24, 0, 1, 37, 24, 2, 10, 12, 62, 33, 3, 0, 0, 0, 1, 3, 16, 106, 28, 0, 0, 0, 0, 17, 46, 85, 10, 0, 0, 1, 4, 11, 4, 2, 2, 9, 14, 8, 8]",3),(9775,"[0, 1, 1, 3, 0, 3, 46, 20, 1, 4, 17, 9, 1, 17, 108, 15, 0, 3, 37, 17, 6, 15, 116, 16, 6, 1, 4, 7, 7, 7, 9, 6, 0, 8, 10, 4, 26, 129, 27, 9, 0, 0, 5, 2, 11, 129, 129, 12, 103, 4, 0, 0, 2, 31, 129, 129, 94, 4, 0, 0, 0, 3, 13, 42, 0, 15, 38, 2, 70, 129, 1, 0, 5, 10, 40, 12, 74, 129, 6, 1, 129, 39, 6, 1, 2, 22, 9, 33, 122, 13, 0, 0, 0, 0, 5, 23, 4, 11, 9, 12, 45, 38, 1, 0, 0, 4, 36, 38, 57, 32, 0, 0, 82, 22, 9, 5, 13, 11, 3, 94, 35, 3, 0, 0, 0, 1, 16, 97]",5),(9776,"[10, 3, 8, 5, 48, 26, 5, 16, 17, 0, 0, 2, 132, 53, 1, 16, 112, 6, 0, 0, 7, 2, 1, 48, 48, 15, 18, 31, 3, 0, 0, 9, 6, 10, 19, 27, 50, 46, 17, 9, 18, 1, 4, 48, 132, 23, 3, 5, 132, 9, 4, 3, 11, 0, 2, 46, 84, 12, 10, 10, 1, 0, 12, 76, 26, 22, 16, 26, 35, 15, 3, 16, 15, 1, 51, 132, 125, 8, 1, 2, 132, 51, 67, 91, 8, 0, 0, 30, 126, 39, 32, 38, 4, 0, 1, 12, 24, 2, 2, 2, 4, 7, 2, 19, 93, 19, 70, 92, 2, 3, 1, 21, 36, 58, 132, 94, 0, 0, 0, 0, 21, 25, 57, 48, 1, 0, 0, 1]",3);
insert into vector_index_01 values(9777, " [16, 15, 0, 0, 5, 46, 5, 5, 4, 0, 0, 0, 28, 118, 12, 5, 75, 44, 5, 0, 6, 32, 6, 49, 41, 74, 9, 1, 0, 0, 0, 9, 1, 9, 16, 41, 71, 80, 3, 0, 0, 4, 3, 5, 51, 106, 11, 3, 112, 28, 13, 1, 4, 8, 3, 104, 118, 14, 1, 1, 0, 0, 0, 88, 3, 27, 46, 118, 108, 49, 2, 0, 1, 46, 118, 118, 27, 12, 0, 0, 33, 118, 118, 8, 0, 0, 0, 4, 118, 95, 40, 0, 0, 0, 1, 11, 27, 38, 12, 12, 18, 29, 3, 2, 13, 30, 94, 78, 30, 19, 9, 3, 31, 45, 70, 42, 15, 1, 3, 12, 14, 22, 16, 2, 3, 17, 24, 13]",4),(9778,"[41, 0, 0, 7, 1, 1, 20, 67, 9, 0, 0, 0, 0, 31, 120, 61, 25, 0, 0, 0, 0, 10, 120, 90, 32, 0, 0, 1, 13, 11, 22, 50, 4, 0, 2, 93, 40, 15, 37, 18, 12, 2, 2, 19, 8, 44, 120, 25, 120, 5, 0, 0, 0, 2, 48, 97, 102, 14, 3, 3, 11, 9, 34, 41, 0, 0, 4, 120, 56, 3, 4, 5, 6, 15, 37, 116, 28, 0, 0, 3, 120, 120, 24, 6, 2, 0, 1, 28, 53, 90, 51, 11, 11, 2, 12, 14, 8, 6, 4, 30, 9, 1, 4, 22, 25, 79, 120, 66, 5, 0, 0, 6, 42, 120, 91, 43, 15, 2, 4, 39, 12, 9, 9, 12, 15, 5, 24, 36]",4);
select * from vector_index_01;
a    b    c
9774    [1, 0, 1, 6, 6, 17, 47, 39, 2, 0, 1, 25, 27, 10, 56, 130, 18, 5, 2, 6, 15, 2, 19, 130, 42, 28, 1, 1, 2, 1, 0, 5, 0, 2, 4, 4, 31, 34, 44, 35, 9, 3, 8, 11, 33, 12, 61, 130, 130, 17, 0, 1, 6, 2, 9, 130, 111, 36, 0, 0, 11, 9, 1, 12, 2, 100, 130, 28, 7, 2, 6, 7, 9, 27, 130, 83, 5, 0, 1, 18, 130, 130, 84, 9, 0, 0, 2, 24, 111, 24, 0, 1, 37, 24, 2, 10, 12, 62, 33, 3, 0, 0, 0, 1, 3, 16, 106, 28, 0, 0, 0, 0, 17, 46, 85, 10, 0, 0, 1, 4, 11, 4, 2, 2, 9, 14, 8, 8]    3
9775    [0, 1, 1, 3, 0, 3, 46, 20, 1, 4, 17, 9, 1, 17, 108, 15, 0, 3, 37, 17, 6, 15, 116, 16, 6, 1, 4, 7, 7, 7, 9, 6, 0, 8, 10, 4, 26, 129, 27, 9, 0, 0, 5, 2, 11, 129, 129, 12, 103, 4, 0, 0, 2, 31, 129, 129, 94, 4, 0, 0, 0, 3, 13, 42, 0, 15, 38, 2, 70, 129, 1, 0, 5, 10, 40, 12, 74, 129, 6, 1, 129, 39, 6, 1, 2, 22, 9, 33, 122, 13, 0, 0, 0, 0, 5, 23, 4, 11, 9, 12, 45, 38, 1, 0, 0, 4, 36, 38, 57, 32, 0, 0, 82, 22, 9, 5, 13, 11, 3, 94, 35, 3, 0, 0, 0, 1, 16, 97]    5
9776    [10, 3, 8, 5, 48, 26, 5, 16, 17, 0, 0, 2, 132, 53, 1, 16, 112, 6, 0, 0, 7, 2, 1, 48, 48, 15, 18, 31, 3, 0, 0, 9, 6, 10, 19, 27, 50, 46, 17, 9, 18, 1, 4, 48, 132, 23, 3, 5, 132, 9, 4, 3, 11, 0, 2, 46, 84, 12, 10, 10, 1, 0, 12, 76, 26, 22, 16, 26, 35, 15, 3, 16, 15, 1, 51, 132, 125, 8, 1, 2, 132, 51, 67, 91, 8, 0, 0, 30, 126, 39, 32, 38, 4, 0, 1, 12, 24, 2, 2, 2, 4, 7, 2, 19, 93, 19, 70, 92, 2, 3, 1, 21, 36, 58, 132, 94, 0, 0, 0, 0, 21, 25, 57, 48, 1, 0, 0, 1]    3
9777    [16, 15, 0, 0, 5, 46, 5, 5, 4, 0, 0, 0, 28, 118, 12, 5, 75, 44, 5, 0, 6, 32, 6, 49, 41, 74, 9, 1, 0, 0, 0, 9, 1, 9, 16, 41, 71, 80, 3, 0, 0, 4, 3, 5, 51, 106, 11, 3, 112, 28, 13, 1, 4, 8, 3, 104, 118, 14, 1, 1, 0, 0, 0, 88, 3, 27, 46, 118, 108, 49, 2, 0, 1, 46, 118, 118, 27, 12, 0, 0, 33, 118, 118, 8, 0, 0, 0, 4, 118, 95, 40, 0, 0, 0, 1, 11, 27, 38, 12, 12, 18, 29, 3, 2, 13, 30, 94, 78, 30, 19, 9, 3, 31, 45, 70, 42, 15, 1, 3, 12, 14, 22, 16, 2, 3, 17, 24, 13]    4
9778    [41, 0, 0, 7, 1, 1, 20, 67, 9, 0, 0, 0, 0, 31, 120, 61, 25, 0, 0, 0, 0, 10, 120, 90, 32, 0, 0, 1, 13, 11, 22, 50, 4, 0, 2, 93, 40, 15, 37, 18, 12, 2, 2, 19, 8, 44, 120, 25, 120, 5, 0, 0, 0, 2, 48, 97, 102, 14, 3, 3, 11, 9, 34, 41, 0, 0, 4, 120, 56, 3, 4, 5, 6, 15, 37, 116, 28, 0, 0, 3, 120, 120, 24, 6, 2, 0, 1, 28, 53, 90, 51, 11, 11, 2, 12, 14, 8, 6, 4, 30, 9, 1, 4, 22, 25, 79, 120, 66, 5, 0, 0, 6, 42, 120, 91, 43, 15, 2, 4, 39, 12, 9, 9, 12, 15, 5, 24, 36]    4
drop snapshot if exists sp03;
create snapshot sp03 for account;
drop database if exists test04;
create database test04;
use test04;
drop table if exists fk_01;
drop table if exists fk_02;
create table fk_01(col1 varchar(30) not null primary key,col2 int);
create table fk_02(col1 int,col2 varchar(25),col3 tinyint,constraint ck foreign key(col2) REFERENCES fk_01(col1));
show create table fk_02;
Table    Create Table
fk_02    CREATE TABLE `fk_02` (\n  `col1` int DEFAULT NULL,\n  `col2` varchar(25) DEFAULT NULL,\n  `col3` tinyint DEFAULT NULL,\n  CONSTRAINT `ck` FOREIGN KEY (`col2`) REFERENCES `fk_01` (`col1`) ON DELETE RESTRICT ON UPDATE RESTRICT\n)
insert into fk_01 values ('90',5983),('100',734),('190',50);
insert into fk_02(col2,col3) values ('90',5),('90',4),('100',0),(NULL,80);
drop table if exists enum01;
create table enum01 (col1 enum('red','blue','green'));
insert into enum01 values ('red'),('blue'),('green');
desc enum01;
Field    Type    Null    Key    Default    Extra    Comment
col1    ENUM('red','blue','green')    YES        null        
select * from enum01;
col1
red
blue
green
show create table enum01;
Table    Create Table
enum01    CREATE TABLE `enum01` (\n  `col1` enum('red','blue','green') DEFAULT NULL\n)
drop snapshot if exists sp04;
create snapshot sp04 for account;
drop database if exists test01_new;
drop database if exists test02_new;
drop database if exists test03_new;
drop database if exists test04_new;
create database test01_new clone test01 {snapshot = 'sp01'};
create database test02_new clone test02 {snapshot = 'sp02'};
create database test03_new clone test03 {snapshot = 'sp03'};
create database test04_new clone test04 {snapshot = 'sp04'};
show databases;
Database
clone
information_schema
mo_catalog
mo_debug
mo_task
mysql
system
system_metrics
test01
test01_new
test02
test02_new
test03
test03_new
test04
test04_new
use test01_new;
show tables;
Tables_in_test01_new
src
select * from src;
id    body    title
0    color is red    t1
1    car is yellow    crazy car
2    sky is blue    no limit
3    blue is not red    colorful
4    遠東兒童中文是針對6到9歲的小朋友精心設計的中文學習教材，共三冊，目前已出版一、二冊。    遠東兒童中文
5    每冊均採用近百張全幅彩圖及照片，生動活潑、自然真實，加深兒童學習印象，洋溢學習樂趣。    遠東兒童中文
6    各個單元主題內容涵蓋中華文化及生活應用的介紹。本套教材含課本、教學指引、生字卡、學生作業本與CD，中英對照，精美大字版。本系列有繁體字及簡體字兩種版本印行。    中文短篇小說
7    59個簡單的英文和中文短篇小說    適合初學者
8    null    NOT INCLUDED
9    NOT INCLUDED BODY    null
10    null    null
show create table src;
Table    Create Table
src    CREATE TABLE `src` (\n  `id` bigint NOT NULL,\n  `body` varchar(65535) DEFAULT NULL,\n  `title` text DEFAULT NULL,\n  PRIMARY KEY (`id`),\n FULLTEXT `ftidx`(`body`,`title`)\n)
use test02_new;
select count(*) from vector_test;
count(*)
6
desc vector_test;
Field    Type    Null    Key    Default    Extra    Comment
id    INT(32)    NO    PRI    null    auto_increment    
vector    VECF32(3)    YES        null        
use test03_new;
select * from vector_index_01;
a    b    c
9774    [1, 0, 1, 6, 6, 17, 47, 39, 2, 0, 1, 25, 27, 10, 56, 130, 18, 5, 2, 6, 15, 2, 19, 130, 42, 28, 1, 1, 2, 1, 0, 5, 0, 2, 4, 4, 31, 34, 44, 35, 9, 3, 8, 11, 33, 12, 61, 130, 130, 17, 0, 1, 6, 2, 9, 130, 111, 36, 0, 0, 11, 9, 1, 12, 2, 100, 130, 28, 7, 2, 6, 7, 9, 27, 130, 83, 5, 0, 1, 18, 130, 130, 84, 9, 0, 0, 2, 24, 111, 24, 0, 1, 37, 24, 2, 10, 12, 62, 33, 3, 0, 0, 0, 1, 3, 16, 106, 28, 0, 0, 0, 0, 17, 46, 85, 10, 0, 0, 1, 4, 11, 4, 2, 2, 9, 14, 8, 8]    3
9775    [0, 1, 1, 3, 0, 3, 46, 20, 1, 4, 17, 9, 1, 17, 108, 15, 0, 3, 37, 17, 6, 15, 116, 16, 6, 1, 4, 7, 7, 7, 9, 6, 0, 8, 10, 4, 26, 129, 27, 9, 0, 0, 5, 2, 11, 129, 129, 12, 103, 4, 0, 0, 2, 31, 129, 129, 94, 4, 0, 0, 0, 3, 13, 42, 0, 15, 38, 2, 70, 129, 1, 0, 5, 10, 40, 12, 74, 129, 6, 1, 129, 39, 6, 1, 2, 22, 9, 33, 122, 13, 0, 0, 0, 0, 5, 23, 4, 11, 9, 12, 45, 38, 1, 0, 0, 4, 36, 38, 57, 32, 0, 0, 82, 22, 9, 5, 13, 11, 3, 94, 35, 3, 0, 0, 0, 1, 16, 97]    5
9776    [10, 3, 8, 5, 48, 26, 5, 16, 17, 0, 0, 2, 132, 53, 1, 16, 112, 6, 0, 0, 7, 2, 1, 48, 48, 15, 18, 31, 3, 0, 0, 9, 6, 10, 19, 27, 50, 46, 17, 9, 18, 1, 4, 48, 132, 23, 3, 5, 132, 9, 4, 3, 11, 0, 2, 46, 84, 12, 10, 10, 1, 0, 12, 76, 26, 22, 16, 26, 35, 15, 3, 16, 15, 1, 51, 132, 125, 8, 1, 2, 132, 51, 67, 91, 8, 0, 0, 30, 126, 39, 32, 38, 4, 0, 1, 12, 24, 2, 2, 2, 4, 7, 2, 19, 93, 19, 70, 92, 2, 3, 1, 21, 36, 58, 132, 94, 0, 0, 0, 0, 21, 25, 57, 48, 1, 0, 0, 1]    3
9777    [16, 15, 0, 0, 5, 46, 5, 5, 4, 0, 0, 0, 28, 118, 12, 5, 75, 44, 5, 0, 6, 32, 6, 49, 41, 74, 9, 1, 0, 0, 0, 9, 1, 9, 16, 41, 71, 80, 3, 0, 0, 4, 3, 5, 51, 106, 11, 3, 112, 28, 13, 1, 4, 8, 3, 104, 118, 14, 1, 1, 0, 0, 0, 88, 3, 27, 46, 118, 108, 49, 2, 0, 1, 46, 118, 118, 27, 12, 0, 0, 33, 118, 118, 8, 0, 0, 0, 4, 118, 95, 40, 0, 0, 0, 1, 11, 27, 38, 12, 12, 18, 29, 3, 2, 13, 30, 94, 78, 30, 19, 9, 3, 31, 45, 70, 42, 15, 1, 3, 12, 14, 22, 16, 2, 3, 17, 24, 13]    4
9778    [41, 0, 0, 7, 1, 1, 20, 67, 9, 0, 0, 0, 0, 31, 120, 61, 25, 0, 0, 0, 0, 10, 120, 90, 32, 0, 0, 1, 13, 11, 22, 50, 4, 0, 2, 93, 40, 15, 37, 18, 12, 2, 2, 19, 8, 44, 120, 25, 120, 5, 0, 0, 0, 2, 48, 97, 102, 14, 3, 3, 11, 9, 34, 41, 0, 0, 4, 120, 56, 3, 4, 5, 6, 15, 37, 116, 28, 0, 0, 3, 120, 120, 24, 6, 2, 0, 1, 28, 53, 90, 51, 11, 11, 2, 12, 14, 8, 6, 4, 30, 9, 1, 4, 22, 25, 79, 120, 66, 5, 0, 0, 6, 42, 120, 91, 43, 15, 2, 4, 39, 12, 9, 9, 12, 15, 5, 24, 36]    4
show create table vector_index_01;
Table    Create Table
vector_index_01    CREATE TABLE `vector_index_01` (\n  `a` bigint NOT NULL,\n  `b` vecf32(128) DEFAULT NULL,\n  `c` int DEFAULT NULL,\n  PRIMARY KEY (`a`),\n  KEY `c_k` (`c`),\n  KEY `idx01` USING hnsw (`b`) m = 48  ef_construction = 64  ef_search = 64  op_type 'vector_l2_ops' \n)
use test04_new;
select * from enum01;
col1
red
blue
green
desc enum01;
Field    Type    Null    Key    Default    Extra    Comment
col1    ENUM('red','blue','green')    YES        null        
use test01;
drop table src;
use test02;
alter table vector_test drop column vector;
use test03;
truncate vector_index_01;
use test04;
delete from enum01 where col1 = 'blue';
update enum01 set col1 ='blue' where col1 = 'green';
use test01_new;
show tables;
Tables_in_test01_new
src
select * from src;
id    body    title
0    color is red    t1
1    car is yellow    crazy car
2    sky is blue    no limit
3    blue is not red    colorful
4    遠東兒童中文是針對6到9歲的小朋友精心設計的中文學習教材，共三冊，目前已出版一、二冊。    遠東兒童中文
5    每冊均採用近百張全幅彩圖及照片，生動活潑、自然真實，加深兒童學習印象，洋溢學習樂趣。    遠東兒童中文
6    各個單元主題內容涵蓋中華文化及生活應用的介紹。本套教材含課本、教學指引、生字卡、學生作業本與CD，中英對照，精美大字版。本系列有繁體字及簡體字兩種版本印行。    中文短篇小說
7    59個簡單的英文和中文短篇小說    適合初學者
8    null    NOT INCLUDED
9    NOT INCLUDED BODY    null
10    null    null
show create table src;
Table    Create Table
src    CREATE TABLE `src` (\n  `id` bigint NOT NULL,\n  `body` varchar(65535) DEFAULT NULL,\n  `title` text DEFAULT NULL,\n  PRIMARY KEY (`id`),\n FULLTEXT `ftidx`(`body`,`title`)\n)
use test02_new;
select count(*) from vector_test;
count(*)
6
desc vector_test;
Field    Type    Null    Key    Default    Extra    Comment
id    INT(32)    NO    PRI    null    auto_increment    
vector    VECF32(3)    YES        null        
use test03_new;
select * from vector_index_01;
a    b    c
9774    [1, 0, 1, 6, 6, 17, 47, 39, 2, 0, 1, 25, 27, 10, 56, 130, 18, 5, 2, 6, 15, 2, 19, 130, 42, 28, 1, 1, 2, 1, 0, 5, 0, 2, 4, 4, 31, 34, 44, 35, 9, 3, 8, 11, 33, 12, 61, 130, 130, 17, 0, 1, 6, 2, 9, 130, 111, 36, 0, 0, 11, 9, 1, 12, 2, 100, 130, 28, 7, 2, 6, 7, 9, 27, 130, 83, 5, 0, 1, 18, 130, 130, 84, 9, 0, 0, 2, 24, 111, 24, 0, 1, 37, 24, 2, 10, 12, 62, 33, 3, 0, 0, 0, 1, 3, 16, 106, 28, 0, 0, 0, 0, 17, 46, 85, 10, 0, 0, 1, 4, 11, 4, 2, 2, 9, 14, 8, 8]    3
9775    [0, 1, 1, 3, 0, 3, 46, 20, 1, 4, 17, 9, 1, 17, 108, 15, 0, 3, 37, 17, 6, 15, 116, 16, 6, 1, 4, 7, 7, 7, 9, 6, 0, 8, 10, 4, 26, 129, 27, 9, 0, 0, 5, 2, 11, 129, 129, 12, 103, 4, 0, 0, 2, 31, 129, 129, 94, 4, 0, 0, 0, 3, 13, 42, 0, 15, 38, 2, 70, 129, 1, 0, 5, 10, 40, 12, 74, 129, 6, 1, 129, 39, 6, 1, 2, 22, 9, 33, 122, 13, 0, 0, 0, 0, 5, 23, 4, 11, 9, 12, 45, 38, 1, 0, 0, 4, 36, 38, 57, 32, 0, 0, 82, 22, 9, 5, 13, 11, 3, 94, 35, 3, 0, 0, 0, 1, 16, 97]    5
9776    [10, 3, 8, 5, 48, 26, 5, 16, 17, 0, 0, 2, 132, 53, 1, 16, 112, 6, 0, 0, 7, 2, 1, 48, 48, 15, 18, 31, 3, 0, 0, 9, 6, 10, 19, 27, 50, 46, 17, 9, 18, 1, 4, 48, 132, 23, 3, 5, 132, 9, 4, 3, 11, 0, 2, 46, 84, 12, 10, 10, 1, 0, 12, 76, 26, 22, 16, 26, 35, 15, 3, 16, 15, 1, 51, 132, 125, 8, 1, 2, 132, 51, 67, 91, 8, 0, 0, 30, 126, 39, 32, 38, 4, 0, 1, 12, 24, 2, 2, 2, 4, 7, 2, 19, 93, 19, 70, 92, 2, 3, 1, 21, 36, 58, 132, 94, 0, 0, 0, 0, 21, 25, 57, 48, 1, 0, 0, 1]    3
9777    [16, 15, 0, 0, 5, 46, 5, 5, 4, 0, 0, 0, 28, 118, 12, 5, 75, 44, 5, 0, 6, 32, 6, 49, 41, 74, 9, 1, 0, 0, 0, 9, 1, 9, 16, 41, 71, 80, 3, 0, 0, 4, 3, 5, 51, 106, 11, 3, 112, 28, 13, 1, 4, 8, 3, 104, 118, 14, 1, 1, 0, 0, 0, 88, 3, 27, 46, 118, 108, 49, 2, 0, 1, 46, 118, 118, 27, 12, 0, 0, 33, 118, 118, 8, 0, 0, 0, 4, 118, 95, 40, 0, 0, 0, 1, 11, 27, 38, 12, 12, 18, 29, 3, 2, 13, 30, 94, 78, 30, 19, 9, 3, 31, 45, 70, 42, 15, 1, 3, 12, 14, 22, 16, 2, 3, 17, 24, 13]    4
9778    [41, 0, 0, 7, 1, 1, 20, 67, 9, 0, 0, 0, 0, 31, 120, 61, 25, 0, 0, 0, 0, 10, 120, 90, 32, 0, 0, 1, 13, 11, 22, 50, 4, 0, 2, 93, 40, 15, 37, 18, 12, 2, 2, 19, 8, 44, 120, 25, 120, 5, 0, 0, 0, 2, 48, 97, 102, 14, 3, 3, 11, 9, 34, 41, 0, 0, 4, 120, 56, 3, 4, 5, 6, 15, 37, 116, 28, 0, 0, 3, 120, 120, 24, 6, 2, 0, 1, 28, 53, 90, 51, 11, 11, 2, 12, 14, 8, 6, 4, 30, 9, 1, 4, 22, 25, 79, 120, 66, 5, 0, 0, 6, 42, 120, 91, 43, 15, 2, 4, 39, 12, 9, 9, 12, 15, 5, 24, 36]    4
show create table vector_index_01;
Table    Create Table
vector_index_01    CREATE TABLE `vector_index_01` (\n  `a` bigint NOT NULL,\n  `b` vecf32(128) DEFAULT NULL,\n  `c` int DEFAULT NULL,\n  PRIMARY KEY (`a`),\n  KEY `c_k` (`c`),\n  KEY `idx01` USING hnsw (`b`) m = 48  ef_construction = 64  ef_search = 64  op_type 'vector_l2_ops' \n)
use test04_new;
select * from enum01;
col1
red
blue
green
drop snapshot sp01;
drop snapshot sp02;
drop snapshot sp03;
drop snapshot sp04;
drop database test01;
drop database test02;
drop database test03;
drop database test04;
drop database test01_new;
drop database test02_new;
drop database test03_new;
drop database test04_new;
drop account if exists acc01;
create account acc01 admin_name = 'test_account' identified by '111';
drop database if exists test05;
create database test05;
use test05;
drop table if exists t1;
drop table if exists t2;
CREATE TABLE t1 (
id int,
token varchar(100) DEFAULT '' NOT NULL,
count int DEFAULT 0 NOT NULL,
qty int,
phone char(1) DEFAULT '' NOT NULL,
times datetime DEFAULT '2000-01-01 00:00:00' NOT NULL
);
INSERT INTO t1 VALUES (21,'e45703b64de71482360de8fec94c3ade',3,7800,'n','1999-12-23 17:22:21');
INSERT INTO t1 VALUES (22,'e45703b64de71482360de8fec94c3ade',4,5000,'y','1999-12-23 17:22:21');
INSERT INTO t1 VALUES (18,'346d1cb63c89285b2351f0ca4de40eda',3,13200,'b','1999-12-23 11:58:04');
INSERT INTO t1 VALUES (17,'ca6ddeb689e1b48a04146b1b5b6f936a',4,15000,'b','1999-12-23 11:36:53');
INSERT INTO t1 VALUES (16,'ca6ddeb689e1b48a04146b1b5b6f936a',3,13200,'b','1999-12-23 11:36:53');
INSERT INTO t1 VALUES (26,'a71250b7ed780f6ef3185bfffe027983',5,1500,'b','1999-12-27 09:44:24');
INSERT INTO t1 VALUES (24,'4d75906f3c37ecff478a1eb56637aa09',3,5400,'y','1999-12-23 17:29:12');
CREATE TABLE t2 (
id int,
category int DEFAULT 0 NOT NULL,
county int DEFAULT 0 NOT NULL,
state int DEFAULT 0 NOT NULL,
phones int DEFAULT 0 NOT NULL,
nophones int DEFAULT 0 NOT NULL
);
INSERT INTO t2 VALUES (3,2,11,12,5400,7800);
INSERT INTO t2 VALUES (4,2,25,12,6500,11200);
INSERT INTO t2 VALUES (5,1,37,6,10000,12000);
drop database if exists test06;
create database test06;
use test06;
create publication publication01 database republication01 account acc01 comment 'republish';
internal error: database 'republication01' does not exist
create table repub01(col1 int);
insert into repub01 values (1);
drop database if exists test07;
create database test07;
use test07;
drop table if exists t1;
create table t1(
col1 date not null,
col2 datetime,
col3 timestamp,
col4 bool
);
set time_zone = 'SYSTEM';
load data infile '$resources/load_data/time_date_1.csv' into table t1 fields terminated by ',';
select * from t1;
col1    col2    col3    col4
1000-01-01    0001-01-01 00:00:00    1970-01-01 00:00:01    false
9999-12-31    9999-12-31 00:00:00    2038-01-19 00:00:00    true
drop database if exists test08;
create database test08;
use test08;
create table vtab32(id int primary key auto_increment,`vecf32_3` vecf32(3),`vecf32_5` vecf32(5));
create table vtab64(id int primary key auto_increment,`vecf64_3` vecf64(3),`vecf64_5` vecf64(5));
insert into vtab32(vecf32_3,vecf32_5) values(NULL,NULL);
insert into vtab32(vecf32_3,vecf32_5) values("[0.8166459,0.66616553,0.4886152]",NULL);
insert into vtab64(vecf64_3,vecf64_5) values(NULL,NULL);
insert into vtab64(vecf64_3,vecf64_5) values("[0.8166459,0.66616553,0.4886152]",NULL);
insert into vtab64(vecf64_3,vecf64_5) values ("[8.5606893,6.7903588,821.977768]","[0.46323407,23.49801546,563.9229458,56.07673508,8732.9583881]");
insert into vtab64(vecf64_3,vecf64_5) values ("[0.9260021,0.26637346,0.06567037]","[0.45756745,65.2996871,321.623636,3.60082066,87.58445764]");
use test05;
show tables;
Tables_in_test05
t1
t2
select * from t1;
id    token    count    qty    phone    times
21    e45703b64de71482360de8fec94c3ade    3    7800    n    1999-12-23 17:22:21
22    e45703b64de71482360de8fec94c3ade    4    5000    y    1999-12-23 17:22:21
18    346d1cb63c89285b2351f0ca4de40eda    3    13200    b    1999-12-23 11:58:04
17    ca6ddeb689e1b48a04146b1b5b6f936a    4    15000    b    1999-12-23 11:36:53
16    ca6ddeb689e1b48a04146b1b5b6f936a    3    13200    b    1999-12-23 11:36:53
26    a71250b7ed780f6ef3185bfffe027983    5    1500    b    1999-12-27 09:44:24
24    4d75906f3c37ecff478a1eb56637aa09    3    5400    y    1999-12-23 17:29:12
select * from t2;
id    category    county    state    phones    nophones
3    2    11    12    5400    7800
4    2    25    12    6500    11200
5    1    37    6    10000    12000
show create table t1;
Table    Create Table
t1    CREATE TABLE `t1` (\n  `id` int DEFAULT NULL,\n  `token` varchar(100) NOT NULL DEFAULT '',\n  `count` int NOT NULL DEFAULT 0,\n  `qty` int DEFAULT NULL,\n  `phone` char(1) NOT NULL DEFAULT '',\n  `times` datetime NOT NULL DEFAULT '2000-01-01 00:00:00'\n)
show create table t2;
Table    Create Table
t2    CREATE TABLE `t2` (\n  `id` int DEFAULT NULL,\n  `category` int NOT NULL DEFAULT 0,\n  `county` int NOT NULL DEFAULT 0,\n  `state` int NOT NULL DEFAULT 0,\n  `phones` int NOT NULL DEFAULT 0,\n  `nophones` int NOT NULL DEFAULT 0\n)
desc t1;
Field    Type    Null    Key    Default    Extra    Comment
id    INT(32)    YES        null        
token    VARCHAR(100)    NO                
count    INT(32)    NO        0        
qty    INT(32)    YES        null        
phone    CHAR(1)    NO                
times    DATETIME(0)    NO        2000-01-01 00:00:00        
desc t2;
Field    Type    Null    Key    Default    Extra    Comment
id    INT(32)    YES        null        
category    INT(32)    NO        0        
county    INT(32)    NO        0        
state    INT(32)    NO        0        
phones    INT(32)    NO        0        
nophones    INT(32)    NO        0        
use test06;
show tables;
Tables_in_test06
repub01
select * from repub01;
col1
1
use test07;
select * from t1;
col1    col2    col3    col4
1000-01-01    0001-01-01 00:00:00    1970-01-01 00:00:01    false
9999-12-31    9999-12-31 00:00:00    2038-01-19 00:00:00    true
use test08;
select * from vtab32;
id    vecf32_3    vecf32_5
1    null    null
2    [0.8166459, 0.66616553, 0.4886152]    null
select * from vtab64;
id    vecf64_3    vecf64_5
1    null    null
2    [0.8166459, 0.66616553, 0.4886152]    null
3    [8.5606893, 6.7903588, 821.977768]    [0.46323407, 23.49801546, 563.9229458, 56.07673508, 8732.9583881]
4    [0.9260021, 0.26637346, 0.06567037]    [0.45756745, 65.2996871, 321.623636, 3.60082066, 87.58445764]
drop database if exists test05_new;
drop database if exists test06_new;
drop database if exists test07_new;
drop database if exists test08_new;
create database test05_new clone test05;
create database test06_new clone test06;
create database test07_new clone test07;
create database test08_new clone test08;
show databases;
Database
clone
information_schema
mo_catalog
mo_debug
mo_task
mysql
system
system_metrics
test05
test05_new
test06
test06_new
test07
test07_new
test08
test08_new
drop database test05;
use test06;
drop publication publication01;
internal error: publication 'publication01' does not exist
drop table repub01;
drop database test07;
use test08;
truncate vtab32;
show databases;
Database
clone
information_schema
mo_catalog
mo_debug
mo_task
mysql
system
system_metrics
test05_new
test06
test06_new
test07_new
test08
test08_new
use test05_new;
show tables;
Tables_in_test05_new
t1
t2
select * from t1;
id    token    count    qty    phone    times
21    e45703b64de71482360de8fec94c3ade    3    7800    n    1999-12-23 17:22:21
22    e45703b64de71482360de8fec94c3ade    4    5000    y    1999-12-23 17:22:21
18    346d1cb63c89285b2351f0ca4de40eda    3    13200    b    1999-12-23 11:58:04
17    ca6ddeb689e1b48a04146b1b5b6f936a    4    15000    b    1999-12-23 11:36:53
16    ca6ddeb689e1b48a04146b1b5b6f936a    3    13200    b    1999-12-23 11:36:53
26    a71250b7ed780f6ef3185bfffe027983    5    1500    b    1999-12-27 09:44:24
24    4d75906f3c37ecff478a1eb56637aa09    3    5400    y    1999-12-23 17:29:12
select * from t2;
id    category    county    state    phones    nophones
3    2    11    12    5400    7800
4    2    25    12    6500    11200
5    1    37    6    10000    12000
show create table t1;
Table    Create Table
t1    CREATE TABLE `t1` (\n  `id` int DEFAULT NULL,\n  `token` varchar(100) NOT NULL DEFAULT '',\n  `count` int NOT NULL DEFAULT 0,\n  `qty` int DEFAULT NULL,\n  `phone` char(1) NOT NULL DEFAULT '',\n  `times` datetime NOT NULL DEFAULT '2000-01-01 00:00:00'\n)
show create table t2;
Table    Create Table
t2    CREATE TABLE `t2` (\n  `id` int DEFAULT NULL,\n  `category` int NOT NULL DEFAULT 0,\n  `county` int NOT NULL DEFAULT 0,\n  `state` int NOT NULL DEFAULT 0,\n  `phones` int NOT NULL DEFAULT 0,\n  `nophones` int NOT NULL DEFAULT 0\n)
desc t1;
Field    Type    Null    Key    Default    Extra    Comment
id    INT(32)    YES        null        
token    VARCHAR(100)    NO                
count    INT(32)    NO        0        
qty    INT(32)    YES        null        
phone    CHAR(1)    NO                
times    DATETIME(0)    NO        2000-01-01 00:00:00        
desc t2;
Field    Type    Null    Key    Default    Extra    Comment
id    INT(32)    YES        null        
category    INT(32)    NO        0        
county    INT(32)    NO        0        
state    INT(32)    NO        0        
phones    INT(32)    NO        0        
nophones    INT(32)    NO        0        
use test06_new;
use test07_new;
select * from t1;
col1    col2    col3    col4
1000-01-01    0001-01-01 00:00:00    1970-01-01 00:00:01    false
9999-12-31    9999-12-31 00:00:00    2038-01-19 00:00:00    true
use test08_new;
select * from vtab32;
id    vecf32_3    vecf32_5
1    null    null
2    [0.8166459, 0.66616553, 0.4886152]    null
select * from vtab64;
id    vecf64_3    vecf64_5
1    null    null
2    [0.8166459, 0.66616553, 0.4886152]    null
3    [8.5606893, 6.7903588, 821.977768]    [0.46323407, 23.49801546, 563.9229458, 56.07673508, 8732.9583881]
4    [0.9260021, 0.26637346, 0.06567037]    [0.45756745, 65.2996871, 321.623636, 3.60082066, 87.58445764]
desc vtab32;
Field    Type    Null    Key    Default    Extra    Comment
id    INT(32)    NO    PRI    null    auto_increment    
vecf32_3    VECF32(3)    YES        null        
vecf32_5    VECF32(5)    YES        null        
show create table vtab64;
Table    Create Table
vtab64    CREATE TABLE `vtab64` (\n  `id` int NOT NULL AUTO_INCREMENT,\n  `vecf64_3` vecf64(3) DEFAULT NULL,\n  `vecf64_5` vecf64(5) DEFAULT NULL,\n  PRIMARY KEY (`id`)\n)
drop database test05;
Can't drop database 'test05'; database doesn't exist
drop database test06;
drop database test07;
Can't drop database 'test07'; database doesn't exist
drop database test08;
drop database test05_new;
drop database test06_new;
drop database test07_new;
drop database test08_new;
drop account if exists acc02;
create account acc02 admin_name = 'test_account' identified by '111';
drop account if exists acc03;
create account acc03 admin_name = 'test_account' identified by '111';
drop account if exists acc04;
create account acc04 admin_name = 'test_account' identified by '111';
drop database if exists test09;
create database test09;
use test09;
drop table if exists t1;
create table t1(a int);
create view v1 as select * from t1;
SELECT relname, rel_createsql,relkind FROM mo_catalog.mo_tables WHERE reldatabase='test' order by relname;
relname    rel_createsql    relkind
create table t2(a int not null, b varchar(20), c char(20));
create view v2 as select * from t2;
desc v2;
Field    Type    Null    Key    Default    Extra    Comment
a    INT(32)    NO        null        
b    VARCHAR(20)    YES        null        
c    CHAR(20)    YES        null        
drop snapshot if exists sp09;
create snapshot sp09 for account;
drop database if exists test10;
create database test10;
use test10;
drop table if exists vector_index_07;
create table vector_index_07(a bigint primary key, b vecf32(128),c int,key c_k(c));
insert into vector_index_07 values(9774 ,"[1, 0, 1, 6, 6, 17, 47, 39, 2, 0, 1, 25, 27, 10, 56, 130, 18, 5, 2, 6, 15, 2, 19, 130, 42, 28, 1, 1, 2, 1, 0, 5, 0, 2, 4, 4, 31, 34, 44, 35, 9, 3, 8, 11, 33, 12, 61, 130, 130, 17, 0, 1, 6, 2, 9, 130, 111, 36, 0, 0, 11, 9, 1, 12, 2, 100, 130, 28, 7, 2, 6, 7, 9, 27, 130, 83, 5, 0, 1, 18, 130, 130, 84, 9, 0, 0, 2, 24, 111, 24, 0, 1, 37, 24, 2, 10, 12, 62, 33, 3, 0, 0, 0, 1, 3, 16, 106, 28, 0, 0, 0, 0, 17, 46, 85, 10, 0, 0, 1, 4, 11, 4, 2, 2, 9, 14, 8, 8]",3),(9775,"[0, 1, 1, 3, 0, 3, 46, 20, 1, 4, 17, 9, 1, 17, 108, 15, 0, 3, 37, 17, 6, 15, 116, 16, 6, 1, 4, 7, 7, 7, 9, 6, 0, 8, 10, 4, 26, 129, 27, 9, 0, 0, 5, 2, 11, 129, 129, 12, 103, 4, 0, 0, 2, 31, 129, 129, 94, 4, 0, 0, 0, 3, 13, 42, 0, 15, 38, 2, 70, 129, 1, 0, 5, 10, 40, 12, 74, 129, 6, 1, 129, 39, 6, 1, 2, 22, 9, 33, 122, 13, 0, 0, 0, 0, 5, 23, 4, 11, 9, 12, 45, 38, 1, 0, 0, 4, 36, 38, 57, 32, 0, 0, 82, 22, 9, 5, 13, 11, 3, 94, 35, 3, 0, 0, 0, 1, 16, 97]",5),(9776,"[10, 3, 8, 5, 48, 26, 5, 16, 17, 0, 0, 2, 132, 53, 1, 16, 112, 6, 0, 0, 7, 2, 1, 48, 48, 15, 18, 31, 3, 0, 0, 9, 6, 10, 19, 27, 50, 46, 17, 9, 18, 1, 4, 48, 132, 23, 3, 5, 132, 9, 4, 3, 11, 0, 2, 46, 84, 12, 10, 10, 1, 0, 12, 76, 26, 22, 16, 26, 35, 15, 3, 16, 15, 1, 51, 132, 125, 8, 1, 2, 132, 51, 67, 91, 8, 0, 0, 30, 126, 39, 32, 38, 4, 0, 1, 12, 24, 2, 2, 2, 4, 7, 2, 19, 93, 19, 70, 92, 2, 3, 1, 21, 36, 58, 132, 94, 0, 0, 0, 0, 21, 25, 57, 48, 1, 0, 0, 1]",3);
insert into vector_index_07 values(9777, " [16, 15, 0, 0, 5, 46, 5, 5, 4, 0, 0, 0, 28, 118, 12, 5, 75, 44, 5, 0, 6, 32, 6, 49, 41, 74, 9, 1, 0, 0, 0, 9, 1, 9, 16, 41, 71, 80, 3, 0, 0, 4, 3, 5, 51, 106, 11, 3, 112, 28, 13, 1, 4, 8, 3, 104, 118, 14, 1, 1, 0, 0, 0, 88, 3, 27, 46, 118, 108, 49, 2, 0, 1, 46, 118, 118, 27, 12, 0, 0, 33, 118, 118, 8, 0, 0, 0, 4, 118, 95, 40, 0, 0, 0, 1, 11, 27, 38, 12, 12, 18, 29, 3, 2, 13, 30, 94, 78, 30, 19, 9, 3, 31, 45, 70, 42, 15, 1, 3, 12, 14, 22, 16, 2, 3, 17, 24, 13]",4),(9778,"[41, 0, 0, 7, 1, 1, 20, 67, 9, 0, 0, 0, 0, 31, 120, 61, 25, 0, 0, 0, 0, 10, 120, 90, 32, 0, 0, 1, 13, 11, 22, 50, 4, 0, 2, 93, 40, 15, 37, 18, 12, 2, 2, 19, 8, 44, 120, 25, 120, 5, 0, 0, 0, 2, 48, 97, 102, 14, 3, 3, 11, 9, 34, 41, 0, 0, 4, 120, 56, 3, 4, 5, 6, 15, 37, 116, 28, 0, 0, 3, 120, 120, 24, 6, 2, 0, 1, 28, 53, 90, 51, 11, 11, 2, 12, 14, 8, 6, 4, 30, 9, 1, 4, 22, 25, 79, 120, 66, 5, 0, 0, 6, 42, 120, 91, 43, 15, 2, 4, 39, 12, 9, 9, 12, 15, 5, 24, 36]",4);
create index idx01 using hnsw on vector_index_07(b) op_type "vector_l2_ops";
drop table if exists employees;
create table employees (
employeeNumber int(11) NOT NULL,
lastName varchar(50) NOT NULL,
firstName varchar(50) NOT NULL,
extension varchar(10) NOT NULL,
email varchar(100) NOT NULL,
officeCode varchar(10) NOT NULL,
reportsTo int(11) DEFAULT NULL,
jobTitle varchar(50) NOT NULL,
PRIMARY KEY (employeeNumber)
);
insert into employees(employeeNumber,lastName,firstName,extension,email,officeCode,reportsTo,jobTitle) values
(1002,'Murphy','Diane','x5800','dmurphy@classicmodelcars.com','1',NULL,'President'),
(1056,'Patterson','Mary','x4611','mpatterso@classicmodelcars.com','1',1002,'VP Sales'),
(1076,'Firrelli','Jeff','x9273','jfirrelli@classicmodelcars.com','1',1002,'VP Marketing');
drop table if exists src;
create table src (id bigint primary key, json1 json, json2 json);
insert into src values  (0, '{"a":1, "b":"redredredredredredredredredredrerr"}', '{"d": "happybirthdayhappybirthdayhappybirthday", "f":"winterautumnsummerspring"}'),
(1, '{"a":2, "b":"中文學習教材"}', '["apple", "orange", "banana", "指引"]'),
(2, '{"a":3, "b":"redbluebrownyelloworange"}', '{"d":"兒童中文"}');
drop snapshot if exists sp10;
create snapshot sp10 for account;
drop database if exists test11;
create database test11;
use test11;
drop table if exists t1;
create table t1(a smallint unsigned auto_increment);
insert into t1 values(null), (3), (null), (6), (null), (65535);
select * from t1;
a
1
3
4
6
7
65535
drop table if exists dense_rank01;
create table dense_rank01 (id integer, sex char(1));
insert into dense_rank01 values (1, 'm');
insert into dense_rank01 values (2, 'f');
insert into dense_rank01 values (3, 'f');
insert into dense_rank01 values (4, 'f');
insert into dense_rank01 values (5, 'm');
drop table if exists text_01;
create table text_01(t1 text,t2 text,t3 text);
insert into text_01 values ('中文123abcd','',NULL);
insert into text_01 values ('yef&&190',' wwww ',983);
insert into text_01 select '',null,'中文';
insert into text_01 select '123','7834','commmmmmment';
insert into text_01 values ('789',' 23:50:00','20');
drop table if exists t1;
create table t1 (a json,b int);
insert into t1 values ('{"t1":"a"}',1),('{"t1":"b"}',2);
select * from t1;
a    b
{"t1": "a"}    1
{"t1": "b"}    2
drop table if exists test05;
create table test05 (col1 int, col2 datalink);
insert into test05 values (1, 'file://$resources/load_data/test_columnlist_01.csv?offset=5');
insert into test05 values (2, 'file://$resources/load_data/test_columnlist_02.csv?offset=10');
select col1, load_file(col2) from test05;
col1    load_file(col2)
1    on, 32\n2, ben, 35\n3, cindy, 22\n4, david, 33\n5, emma, 18\n6, frank, 59
2     ben\n3, cindy\n4, david\n5, emma\n6, frank
drop snapshot if exists sp11;
create snapshot sp11 for account;
show databases;
Database
clone
information_schema
mo_catalog
mo_debug
mo_task
mysql
system
system_metrics
test09
test10
test11
use test09;
select count(*) from t1;
count(*)
0
select * from v1;
a
show create table v1;
View    Create View    character_set_client    collation_connection
v1    create view v1 as select * from t1;    utf8mb4    utf8mb4_general_ci
select * from v2;
a    b    c
show tables;
Tables_in_test09
t1
t2
v1
v2
use test10;
show tables;
Tables_in_test10
employees
src
vector_index_07
select * from employees;
employeenumber    lastname    firstname    extension    email    officecode    reportsto    jobtitle
1002    Murphy    Diane    x5800    dmurphy@classicmodelcars.com    1    null    President
1056    Patterson    Mary    x4611    mpatterso@classicmodelcars.com    1    1002    VP Sales
1076    Firrelli    Jeff    x9273    jfirrelli@classicmodelcars.com    1    1002    VP Marketing
desc src;
Field    Type    Null    Key    Default    Extra    Comment
id    BIGINT(64)    NO    PRI    null        
json1    JSON(0)    YES        null        
json2    JSON(0)    YES        null        
select count(*) from vector_index_07;
count(*)
5
use test11;
select * from dense_rank01;
id    sex
1    m
2    f
3    f
4    f
5    m
select * from t1;
a    b
{"t1": "a"}    1
{"t1": "b"}    2
select count(*) from test05;
count(*)
2
select * from text_01;
t1    t2    t3
中文123abcd        null
yef&&190     wwww     983
    null    中文
123    7834    commmmmmment
789     23:50:00    20
show tables;
Tables_in_test11
dense_rank01
t1
test05
text_01
drop database if exists test09_new;
drop database if exists test09_table;
create database test09_table;
drop database if exists test10_new;
drop database if exists test10_table;
create database test10_table;
drop database if exists test11_new;
drop database if exists test11_table;
create database test11_table;
create database test09_new clone test09 {snapshot = 'sp09'} to account acc02;
create database test10_new clone test10 {snapshot = 'sp10'} to account acc03;
create database test11_new clone test11 {snapshot = 'sp11'} to account acc04;
create table test09_table.t1 clone test09.t1 {snapshot = 'sp09'} to account acc02;
create table test10_table.employees clone test10.employees {snapshot = 'sp10'} to account acc03;
create table test10_table.employees clone test10.employees {snapshot = 'sp10'} to account acc03;
table employees already exists
create table test11_table.dense_rank01 clone test11.dense_rank01 {snapshot = 'sp11'} to account acc04;
use test09_new;
select count(*) from t1;
count(*)
0
select * from v1;
a
show create table v1;
View    Create View    character_set_client    collation_connection
v1    create view v1 as select * from t1;    utf8mb4    utf8mb4_general_ci
select * from v2;
a    b    c
use test09_table;
select * from t1;
a
use test10_new;
show tables;
Tables_in_test10_new
employees
src
vector_index_07
select * from employees;
employeenumber    lastname    firstname    extension    email    officecode    reportsto    jobtitle
1002    Murphy    Diane    x5800    dmurphy@classicmodelcars.com    1    null    President
1056    Patterson    Mary    x4611    mpatterso@classicmodelcars.com    1    1002    VP Sales
1076    Firrelli    Jeff    x9273    jfirrelli@classicmodelcars.com    1    1002    VP Marketing
desc src;
Field    Type    Null    Key    Default    Extra    Comment
id    BIGINT(64)    NO    PRI    null        
json1    JSON(0)    YES        null        
json2    JSON(0)    YES        null        
select count(*) from vector_index_07;
count(*)
5
use test10_table;
select * from employees;
employeenumber    lastname    firstname    extension    email    officecode    reportsto    jobtitle
1002    Murphy    Diane    x5800    dmurphy@classicmodelcars.com    1    null    President
1056    Patterson    Mary    x4611    mpatterso@classicmodelcars.com    1    1002    VP Sales
1076    Firrelli    Jeff    x9273    jfirrelli@classicmodelcars.com    1    1002    VP Marketing
insert into employees(employeeNumber,lastName,firstName,extension,email,officeCode,reportsTo,jobTitle) values
(1012,'Murphy','Diane','x5800','dmurphy@classicmodelcars.com','1',NULL,'President');
use test11_new;
select * from dense_rank01;
id    sex
1    m
2    f
3    f
4    f
5    m
select * from t1;
a    b
{"t1": "a"}    1
{"t1": "b"}    2
select count(*) from test05;
count(*)
2
select * from text_01;
t1    t2    t3
中文123abcd        null
yef&&190     wwww     983
    null    中文
123    7834    commmmmmment
789     23:50:00    20
use test11_table;
select * from dense_rank01;
id    sex
1    m
2    f
3    f
4    f
5    m
delete from dense_rank01 where id < 5;
drop database test09;
drop database test10;
drop database test11;
use test09_new;
select count(*) from t1;
count(*)
0
select * from v1;
a
show create table v1;
View    Create View    character_set_client    collation_connection
v1    create view v1 as select * from t1;    utf8mb4    utf8mb4_general_ci
select * from v2;
a    b    c
use test09_table;
select * from t1;
a
drop database test09_new;
drop database test09_table;
use test10_new;
show tables;
Tables_in_test10_new
employees
src
vector_index_07
select * from employees;
employeenumber    lastname    firstname    extension    email    officecode    reportsto    jobtitle
1002    Murphy    Diane    x5800    dmurphy@classicmodelcars.com    1    null    President
1056    Patterson    Mary    x4611    mpatterso@classicmodelcars.com    1    1002    VP Sales
1076    Firrelli    Jeff    x9273    jfirrelli@classicmodelcars.com    1    1002    VP Marketing
desc src;
Field    Type    Null    Key    Default    Extra    Comment
id    BIGINT(64)    NO    PRI    null        
json1    JSON(0)    YES        null        
json2    JSON(0)    YES        null        
select count(*) from vector_index_07;
count(*)
5
drop database test10_new;
use test10_table;
select * from employees;
employeenumber    lastname    firstname    extension    email    officecode    reportsto    jobtitle
1012    Murphy    Diane    x5800    dmurphy@classicmodelcars.com    1    null    President
1002    Murphy    Diane    x5800    dmurphy@classicmodelcars.com    1    null    President
1056    Patterson    Mary    x4611    mpatterso@classicmodelcars.com    1    1002    VP Sales
1076    Firrelli    Jeff    x9273    jfirrelli@classicmodelcars.com    1    1002    VP Marketing
drop database test10_table;
use test11_new;
select * from dense_rank01;
id    sex
1    m
2    f
3    f
4    f
5    m
select * from t1;
a    b
{"t1": "a"}    1
{"t1": "b"}    2
select count(*) from test05;
count(*)
2
select * from text_01;
t1    t2    t3
中文123abcd        null
yef&&190     wwww     983
    null    中文
123    7834    commmmmmment
789     23:50:00    20
drop database test11_new;
use test11_table;
select * from dense_rank01;
id    sex
5    m
drop database test11_table;
drop snapshot sp09;
drop snapshot sp10;
drop snapshot sp11;
drop account if exists acc05;

create account acc05 admin_name = 'test_account' identified by '111';

drop database if exists test12;

create database test12;

use test12;

drop table if exists t1;

create table t1 (
a bigint not null,
b bigint not null default 0,
c bigint not null default 0,
d bigint not null default 0,
e bigint not null default 0,
f bigint not null default 0,
g bigint not null default 0,
h bigint not null default 0,
i bigint not null default 0,
j bigint not null default 0,
primary key (a));

insert into t1 (a) values (2),(4),(6),(8),(10),(12),(14),(16),(18),(20),(22),(24),(26),(23);

drop table if exists bit01;

create table bit01(id char(1), b binary(10));

insert into bit01 values('a', '111');

insert into bit01 values('a', '110');

insert into bit01 values('a', '143');

insert into bit01 values('a', '000');

insert into bit01 values('b', '001');

insert into bit01 values('b', '011');

insert into bit01 values('c', '010');

insert into bit01 values('d', null);

select * from bit01;
id    b
a    111       
a    110       
a    143       
a    000       
b    001       
b    011       
c    010       
d    null
drop table if exists time01;

create table time01 (a datetime(0) not null, primary key(a));

insert into time01 values ('20200101000000'), ('2022-01-02'), ('2022-01-02 00:00:01'), ('2022-01-02 00:00:01.512345');

drop table if exists double01;

create table double01 (a double not null, primary key(a));

insert into double01 values(-1.7976931348623157E+308),(-2.2250738585072014E-308),(0),(2.2250738585072014E-308),(1.7976931348623157E+308);

drop table if exists tinyint01;

create table tinyint01 (a tinyint unsigned not null, primary key(a));

insert into tinyint01 values (255), (0xFC), (254), (253);

SET experimental_hnsw_index = 1;

drop database if exists test13;

create database test13;

use test13;

drop table if exists vector_index_09;

create table vector_index_09(a bigint primary key, b vecf32(128),c int,key c_k(c));

create index idx01 using hnsw on vector_index_09(b) op_type "vector_l2_ops";

insert into vector_index_09 values(9774 ,NULL,3),(9775,NULL,10);

insert into vector_index_09(a,c) values(9777,4),(9778,9);

drop table if exists vector_ip_01;

create table vector_ip_01(a bigint primary key, b vecf32(128), c int, key c_k(c));

insert into vector_ip_01 values(9774 ,normalize_l2("[1, 0, 1, 6, 6, 17, 47, 39, 2, 0, 1, 25, 27, 10, 56, 130, 18, 5, 2, 6, 15, 2, 19, 130, 42, 28, 1, 1, 2, 1, 0, 5, 0, 2, 4, 4, 31, 34, 44, 35, 9, 3, 8, 11, 33, 12, 61, 130, 130, 17, 0, 1, 6, 2, 9, 130, 111, 36, 0, 0, 11, 9, 1, 12, 2, 100, 130, 28, 7, 2, 6, 7, 9, 27, 130, 83, 5, 0, 1, 18, 130, 130, 84, 9, 0, 0, 2, 24, 111, 24, 0, 1, 37, 24, 2, 10, 12, 62, 33, 3, 0, 0, 0, 1, 3, 16, 106, 28, 0, 0, 0, 0, 17, 46, 85, 10, 0, 0, 1, 4, 11, 4, 2, 2, 9, 14, 8, 8]"),3),(9775,normalize_l2("[0, 1, 1, 3, 0, 3, 46, 20, 1, 4, 17, 9, 1, 17, 108, 15, 0, 3, 37, 17, 6, 15, 116, 16, 6, 1, 4, 7, 7, 7, 9, 6, 0, 8, 10, 4, 26, 129, 27, 9, 0, 0, 5, 2, 11, 129, 129, 12, 103, 4, 0, 0, 2, 31, 129, 129, 94, 4, 0, 0, 0, 3, 13, 42, 0, 15, 38, 2, 70, 129, 1, 0, 5, 10, 40, 12, 74, 129, 6, 1, 129, 39, 6, 1, 2, 22, 9, 33, 122, 13, 0, 0, 0, 0, 5, 23, 4, 11, 9, 12, 45, 38, 1, 0, 0, 4, 36, 38, 57, 32, 0, 0, 82, 22, 9, 5, 13, 11, 3, 94, 35, 3, 0, 0, 0, 1, 16, 97]"),5),(9776,normalize_l2("[10, 3, 8, 5, 48, 26, 5, 16, 17, 0, 0, 2, 132, 53, 1, 16, 112, 6, 0, 0, 7, 2, 1, 48, 48, 15, 18, 31, 3, 0, 0, 9, 6, 10, 19, 27, 50, 46, 17, 9, 18, 1, 4, 48, 132, 23, 3, 5, 132, 9, 4, 3, 11, 0, 2, 46, 84, 12, 10, 10, 1, 0, 12, 76, 26, 22, 16, 26, 35, 15, 3, 16, 15, 1, 51, 132, 125, 8, 1, 2, 132, 51, 67, 91, 8, 0, 0, 30, 126, 39, 32, 38, 4, 0, 1, 12, 24, 2, 2, 2, 4, 7, 2, 19, 93, 19, 70, 92, 2, 3, 1, 21, 36, 58, 132, 94, 0, 0, 0, 0, 21, 25, 57, 48, 1, 0, 0, 1]"),3);

insert into vector_ip_01 values(9777, normalize_l2("[16, 15, 0, 0, 5, 46, 5, 5, 4, 0, 0, 0, 28, 118, 12, 5, 75, 44, 5, 0, 6, 32, 6, 49, 41, 74, 9, 1, 0, 0, 0, 9, 1, 9, 16, 41, 71, 80, 3, 0, 0, 4, 3, 5, 51, 106, 11, 3, 112, 28, 13, 1, 4, 8, 3, 104, 118, 14, 1, 1, 0, 0, 0, 88, 3, 27, 46, 118, 108, 49, 2, 0, 1, 46, 118, 118, 27, 12, 0, 0, 33, 118, 118, 8, 0, 0, 0, 4, 118, 95, 40, 0, 0, 0, 1, 11, 27, 38, 12, 12, 18, 29, 3, 2, 13, 30, 94, 78, 30, 19, 9, 3, 31, 45, 70, 42, 15, 1, 3, 12, 14, 22, 16, 2, 3, 17, 24, 13]"),4),(9778,normalize_l2("[41, 0, 0, 7, 1, 1, 20, 67, 9, 0, 0, 0, 0, 31, 120, 61, 25, 0, 0, 0, 0, 10, 120, 90, 32, 0, 0, 1, 13, 11, 22, 50, 4, 0, 2, 93, 40, 15, 37, 18, 12, 2, 2, 19, 8, 44, 120, 25, 120, 5, 0, 0, 0, 2, 48, 97, 102, 14, 3, 3, 11, 9, 34, 41, 0, 0, 4, 120, 56, 3, 4, 5, 6, 15, 37, 116, 28, 0, 0, 3, 120, 120, 24, 6, 2, 0, 1, 28, 53, 90, 51, 11, 11, 2, 12, 14, 8, 6, 4, 30, 9, 1, 4, 22, 25, 79, 120, 66, 5, 0, 0, 6, 42, 120, 91, 43, 15, 2, 4, 39, 12, 9, 9, 12, 15, 5, 24, 36]"),4);

create index idx01 using hnsw on vector_ip_01(b) op_type "vector_ip_ops";

show create table vector_ip_01;
Table    Create Table
vector_ip_01    CREATE TABLE `vector_ip_01` (\n  `a` bigint NOT NULL,\n  `b` vecf32(128) DEFAULT NULL,\n  `c` int DEFAULT NULL,\n  PRIMARY KEY (`a`),\n  KEY `c_k` (`c`),\n  KEY `idx01` USING hnsw (`b`) op_type 'vector_ip_ops' \n)
drop database if exists test14;

create database test14;

use test14;

drop table if exists index03;

create table index03 (
emp_no      int             not null,
birth_date  date            not null,
first_name  varchar(14)     not null,
last_name   varchar(16)     not null,
gender      varchar(5)      not null,
hire_date   date            not null,
primary key (emp_no)
) partition by range columns (emp_no)(
partition p01 values less than (100001),
partition p02 values less than (200001),
partition p03 values less than (300001),
partition p04 values less than (400001)
);

insert into index03 values (9001,'1980-12-17', 'SMITH', 'CLERK', 'F', '2008-12-17'),
(9002,'1981-02-20', 'ALLEN', 'SALESMAN', 'F', '2008-02-20'),
(9003,'1991-02-20', 'Bob', 'TEACHER', 'M', '2008-02-20'),
(9004,'1999-02-20', 'MARY', 'PROGRAMMER', 'M', '2008-02-20');

select * from index03;
emp_no    birth_date    first_name    last_name    gender    hire_date
9001    1980-12-17    SMITH    CLERK    F    2008-12-17
9002    1981-02-20    ALLEN    SALESMAN    F    2008-02-20
9003    1991-02-20    Bob    TEACHER    M    2008-02-20
9004    1999-02-20    MARY    PROGRAMMER    M    2008-02-20
drop database if exists test15;

create database test15;

use test15;

drop table if exists departments;

create table departments (
department_id INT primary key auto_increment,
department_name varchar(100)
);

show create table departments;
Table    Create Table
departments    CREATE TABLE `departments` (\n  `department_id` int NOT NULL AUTO_INCREMENT,\n  `department_name` varchar(100) DEFAULT NULL,\n  PRIMARY KEY (`department_id`)\n)
insert into departments (department_id, department_name)
values (1, 'HR'),(2, 'Engineering');

drop table if exists employees;

create table employees (
employee_id INT primary key,
first_name varchar(50),
last_name varchar(50),
department_id INT,
FOREIGN KEY (department_id) REFERENCES departments(department_id)
);

insert into employees values
(1, 'John', 'Doe', 1),
(2, 'Jane', 'Smith', 2),
(3, 'Bob', 'Johnson', 1);

drop view if exists employee_view;

create view employee_view as select employee_id, first_name, last_name, department_id from employees;

drop database if exists test12_new;

drop database if exists test13_new;

drop database if exists test14_new;

drop database if exists test15_new;

create database test12_new clone test12;

create database test13_new clone test13;

use test12_new;

drop table t1;

drop table bit01;

drop database if exists test12_new_new;

drop database if exists test13_new_new;

drop database if exists test14_new_new;

drop database if exists test15_new_new;

create database test12_new_new clone test12_new;

create database test13_new_new clone test13_new;

use test12_new_new;

show tables;
Tables_in_test12_new_new
double01
time01
tinyint01
select * from double01;
a
-1.7976931348623157E308
-2.2250738585072014E-308
0.0
2.2250738585072014E-308
1.7976931348623157E308
show create table time01;
Table    Create Table
time01    CREATE TABLE `time01` (\n  `a` datetime NOT NULL,\n  PRIMARY KEY (`a`)\n)
select * from tinyint01;
a
252
253
254
255
create database test14_new clone test14;

create database test15_new clone test15;

drop database test14;

use test15_new;

drop table employees;

create database test14_new_new clone test14_new;

create database test15_new_new clone test15_new;
SQL parser error: table "employees" does not exist
drop database test12;

use test13;

drop table if exists vector_index_09;

drop table if exists vector_ip_01;

drop database test15;

drop database test12_new;

use test13_new;

drop table if exists vector_index_09;

drop table if exists vector_ip_01;

use test14_new;

truncate index03;

drop database test15_new;

use test12_new_new;

select * from time01;
a
2020-01-01 00:00:00
2022-01-02 00:00:00
2022-01-02 00:00:01
2022-01-02 00:00:02
select count(*) from tinyint01;
count(*)
4
use test13_new_new;

select * from vector_index_09;
a    b    c
9774    null    3
9775    null    10
9777    null    4
9778    null    9
select * from vector_ip_01;
a    b    c
9774    [0.0019665654, 0, 0.0019665654, 0.011799393, 0.011799393, 0.033431612, 0.09242858, 0.07669605, 0.0039331308, 0, 0.0019665654, 0.04916414, 0.053097267, 0.019665655, 0.110127665, 0.2556535, 0.035398178, 0.009832827, 0.0039331308, 0.011799393, 0.029498482, 0.0039331308, 0.037364744, 0.2556535, 0.08259575, 0.055063833, 0.0019665654, 0.0019665654, 0.0039331308, 0.0019665654, 0, 0.009832827, 0, 0.0039331308, 0.0078662615, 0.0078662615, 0.06096353, 0.066863224, 0.08652888, 0.06882979, 0.017699089, 0.0058996966, 0.015732523, 0.02163222, 0.06489666, 0.023598786, 0.119960494, 0.2556535, 0.2556535, 0.033431612, 0, 0.0019665654, 0.011799393, 0.0039331308, 0.017699089, 0.2556535, 0.21828876, 0.070796356, 0, 0, 0.02163222, 0.017699089, 0.0019665654, 0.023598786, 0.0039331308, 0.19665655, 0.2556535, 0.055063833, 0.013765958, 0.0039331308, 0.011799393, 0.013765958, 0.017699089, 0.053097267, 0.2556535, 0.16322494, 0.009832827, 0, 0.0019665654, 0.035398178, 0.2556535, 0.2556535, 0.1651915, 0.017699089, 0, 0, 0.0039331308, 0.047197573, 0.21828876, 0.047197573, 0, 0.0019665654, 0.07276292, 0.047197573, 0.0039331308, 0.019665655, 0.023598786, 0.12192706, 0.06489666, 0.0058996966, 0, 0, 0, 0.0019665654, 0.0058996966, 0.031465046, 0.20845594, 0.055063833, 0, 0, 0, 0, 0.033431612, 0.090462014, 0.16715807, 0.019665655, 0, 0, 0.0019665654, 0.0078662615, 0.02163222, 0.0078662615, 0.0039331308, 0.0039331308, 0.017699089, 0.027531916, 0.015732523, 0.015732523]    3
9775    [0, 0.0019629742, 0.0019629742, 0.0058889226, 0, 0.0058889226, 0.09029681, 0.039259482, 0.0019629742, 0.007851897, 0.033370562, 0.017666768, 0.0019629742, 0.033370562, 0.2120012, 0.029444613, 0, 0.0058889226, 0.07263005, 0.033370562, 0.011777845, 0.029444613, 0.227705, 0.031407587, 0.011777845, 0.0019629742, 0.007851897, 0.013740819, 0.013740819, 0.013740819, 0.017666768, 0.011777845, 0, 0.015703794, 0.019629741, 0.007851897, 0.051037326, 0.25322366, 0.0530003, 0.017666768, 0, 0, 0.009814871, 0.0039259484, 0.021592716, 0.25322366, 0.25322366, 0.02355569, 0.20218635, 0.007851897, 0, 0, 0.0039259484, 0.0608522, 0.25322366, 0.25322366, 0.18451957, 0.007851897, 0, 0, 0, 0.0058889226, 0.025518663, 0.08244491, 0, 0.029444613, 0.074593015, 0.0039259484, 0.1374082, 0.25322366, 0.0019629742, 0, 0.009814871, 0.019629741, 0.078518964, 0.02355569, 0.1452601, 0.25322366, 0.011777845, 0.0019629742, 0.25322366, 0.07655599, 0.011777845, 0.0019629742, 0.0039259484, 0.04318543, 0.017666768, 0.06477815, 0.23948285, 0.025518663, 0, 0, 0, 0, 0.009814871, 0.045148406, 0.007851897, 0.021592716, 0.017666768, 0.02355569, 0.08833384, 0.074593015, 0.0019629742, 0, 0, 0.007851897, 0.07066707, 0.074593015, 0.111889526, 0.062815174, 0, 0, 0.16096388, 0.04318543, 0.017666768, 0.009814871, 0.025518663, 0.021592716, 0.0058889226, 0.18451957, 0.0687041, 0.0058889226, 0, 0, 0, 0.0019629742, 0.031407587, 0.1904085]    5
9776    [0.01968958, 0.005906874, 0.015751664, 0.00984479, 0.09450998, 0.051192906, 0.00984479, 0.031503327, 0.033472285, 0, 0, 0.003937916, 0.25990245, 0.10435477, 0.001968958, 0.031503327, 0.2205233, 0.011813748, 0, 0, 0.013782706, 0.003937916, 0.001968958, 0.09450998, 0.09450998, 0.02953437, 0.035441242, 0.061037697, 0.005906874, 0, 0, 0.017720621, 0.011813748, 0.01968958, 0.0374102, 0.053161863, 0.0984479, 0.09057207, 0.033472285, 0.017720621, 0.035441242, 0.001968958, 0.007875832, 0.09450998, 0.25990245, 0.045286033, 0.005906874, 0.00984479, 0.25990245, 0.017720621, 0.007875832, 0.005906874, 0.021658538, 0, 0.003937916, 0.09057207, 0.16539247, 0.023627495, 0.01968958, 0.01968958, 0.001968958, 0, 0.023627495, 0.1496408, 0.051192906, 0.043317076, 0.031503327, 0.051192906, 0.06891353, 0.02953437, 0.005906874, 0.031503327, 0.02953437, 0.001968958, 0.100416854, 0.25990245, 0.24611974, 0.015751664, 0.001968958, 0.003937916, 0.25990245, 0.100416854, 0.13192019, 0.17917517, 0.015751664, 0, 0, 0.05906874, 0.2480887, 0.07678936, 0.063006654, 0.0748204, 0.007875832, 0, 0.001968958, 0.023627495, 0.04725499, 0.003937916, 0.003937916, 0.003937916, 0.007875832, 0.013782706, 0.003937916, 0.0374102, 0.18311308, 0.0374102, 0.13782705, 0.18114413, 0.003937916, 0.005906874, 0.001968958, 0.04134812, 0.070882484, 0.114199564, 0.25990245, 0.18508205, 0, 0, 0, 0, 0.04134812, 0.04922395, 0.11223061, 0.09450998, 0.001968958, 0, 0, 0.001968958]    3
9777    [0.03149466, 0.029526243, 0, 0, 0.009842081, 0.090547144, 0.009842081, 0.009842081, 0.007873665, 0, 0, 0, 0.055115655, 0.23227312, 0.023620995, 0.009842081, 0.14763121, 0.08661032, 0.009842081, 0, 0.011810497, 0.06298932, 0.011810497, 0.09645239, 0.08070506, 0.1456628, 0.017715747, 0.0019684162, 0, 0, 0, 0.017715747, 0.0019684162, 0.017715747, 0.03149466, 0.08070506, 0.13975756, 0.1574733, 0.0059052487, 0, 0, 0.007873665, 0.0059052487, 0.009842081, 0.10038923, 0.20865212, 0.02165258, 0.0059052487, 0.22046262, 0.055115655, 0.02558941, 0.0019684162, 0.007873665, 0.01574733, 0.0059052487, 0.20471528, 0.23227312, 0.027557828, 0.0019684162, 0.0019684162, 0, 0, 0, 0.17322063, 0.0059052487, 0.053147238, 0.090547144, 0.23227312, 0.21258895, 0.09645239, 0.0039368323, 0, 0.0019684162, 0.090547144, 0.23227312, 0.23227312, 0.053147238, 0.023620995, 0, 0, 0.06495774, 0.23227312, 0.23227312, 0.01574733, 0, 0, 0, 0.007873665, 0.23227312, 0.18699954, 0.07873665, 0, 0, 0, 0.0019684162, 0.02165258, 0.053147238, 0.07479981, 0.023620995, 0.023620995, 0.035431493, 0.05708407, 0.0059052487, 0.0039368323, 0.02558941, 0.059052486, 0.18503113, 0.15353647, 0.059052486, 0.037399907, 0.017715747, 0.0059052487, 0.061020903, 0.08857873, 0.13778913, 0.08267348, 0.029526243, 0.0019684162, 0.0059052487, 0.023620995, 0.027557828, 0.04330516, 0.03149466, 0.0039368323, 0.0059052487, 0.033463076, 0.04724199, 0.02558941]    4
9778    [0.08063698, 0, 0, 0.01376729, 0.0019667556, 0.0019667556, 0.039335113, 0.13177262, 0.0177008, 0, 0, 0, 0, 0.060969424, 0.23601067, 0.119972095, 0.049168892, 0, 0, 0, 0, 0.019667557, 0.23601067, 0.177008, 0.06293618, 0, 0, 0.0019667556, 0.025567824, 0.021634312, 0.043268625, 0.098337784, 0.007867022, 0, 0.003933511, 0.18290828, 0.078670226, 0.029501334, 0.07276996, 0.0354016, 0.023601068, 0.003933511, 0.003933511, 0.037368357, 0.015734045, 0.08653725, 0.23601067, 0.049168892, 0.23601067, 0.009833778, 0, 0, 0, 0.003933511, 0.09440427, 0.1907753, 0.20060907, 0.02753458, 0.005900267, 0.005900267, 0.021634312, 0.0177008, 0.06686969, 0.08063698, 0, 0, 0.007867022, 0.23601067, 0.11013832, 0.005900267, 0.007867022, 0.009833778, 0.011800534, 0.029501334, 0.07276996, 0.22814366, 0.05506916, 0, 0, 0.005900267, 0.23601067, 0.23601067, 0.047202136, 0.011800534, 0.003933511, 0, 0.0019667556, 0.05506916, 0.10423805, 0.177008, 0.10030454, 0.021634312, 0.021634312, 0.003933511, 0.023601068, 0.02753458, 0.015734045, 0.011800534, 0.007867022, 0.059002668, 0.0177008, 0.0019667556, 0.007867022, 0.043268625, 0.049168892, 0.15537369, 0.23601067, 0.12980588, 0.009833778, 0, 0, 0.011800534, 0.08260374, 0.23601067, 0.17897476, 0.08457049, 0.029501334, 0.003933511, 0.007867022, 0.076703474, 0.023601068, 0.0177008, 0.0177008, 0.023601068, 0.029501334, 0.009833778, 0.047202136, 0.0708032]    4
use test14_new_new;

show create table index03;
Table    Create Table
index03    CREATE TABLE `index03` (\n  `emp_no` int NOT NULL,\n  `birth_date` date NOT NULL,\n  `first_name` varchar(14) NOT NULL,\n  `last_name` varchar(16) NOT NULL,\n  `gender` varchar(5) NOT NULL,\n  `hire_date` date NOT NULL,\n  PRIMARY KEY (`emp_no`)\n)
use test15_new_new;
Unknown database test15_new_new
select * from departments;
SQL parser error: table "departments" does not exist
show create table departments;
no such table test14_new_new.departments
drop account acc05;

show databases;
Database
clone
information_schema
mo_catalog
mo_debug
mo_task
mysql
system
system_metrics
