drop account if exists acc01;
create account acc01 admin_name = 'test_account' identified by '111';
drop database if exists test;
create database test;
use test;
drop table if exists t1;
create table t1(
col1 date not null,
col2 datetime,
col3 timestamp,
col4 bool
);
set time_zone = 'SYSTEM';
load data infile '$resources/load_data/time_date_1.csv' into table t1 fields terminated by ',';
select * from t1;
➤ col1[91,64,0]  ¦  col2[93,64,0]  ¦  col3[93,64,0]  ¦  col4[-7,1,0]  𝄀
1000-01-01  ¦  0001-01-01 00:00:00  ¦  1970-01-02 00:00:01  ¦  0  𝄀
9999-12-31  ¦  9999-12-31 00:00:00  ¦  2038-01-19 00:00:00  ¦  1
drop stage if exists stage01;
create stage stage01 url = 'file:///$resources/into_outfile/stage';
select * from mo_catalog.mo_stages;
➤ stage_id[4,32,0]  ¦  stage_name[12,-1,0]  ¦  url[12,0,0]  ¦  stage_credentials[12,0,0]  ¦  stage_status[12,-1,0]  ¦  created_time[93,64,0]  ¦  comment[12,0,0]  𝄀
20017  ¦  stage01  ¦  file:////mnt/fastdata/temp/matrixone/test/distributed/resources/into_outfile/stage  ¦    ¦  in_use  ¦  2026-07-27 03:38:29  ¦  
show stages;
➤ STAGE_NAME[12,-1,0]  ¦  URL[12,0,0]  ¦  STATUS[12,-1,0]  ¦  COMMENT[12,0,0]  𝄀
stage01  ¦  file:////mnt/fastdata/temp/matrixone/test/distributed/resources/into_outfile/stage  ¦  in_use  ¦  
select col1, col2 from t1 into outfile 'stage://stage01/local_stage_table001.csv';
drop table t1;
create table t1(
col1 date not null,
col2 datetime
);
load data infile 'stage://stage01/local_stage_table001.csv' into table t1 fields terminated by ',' ignore 1 lines;
select * from t1;
➤ col1[91,64,0]  ¦  col2[93,64,0]  𝄀
1000-01-01  ¦  0001-01-01 00:00:00  𝄀
9999-12-31  ¦  9999-12-31 00:00:00
show create table t1;
➤ Table[12,-1,0]  ¦  Create Table[12,-1,0]  𝄀
t1  ¦  CREATE TABLE `t1` (
  `col1` date NOT NULL,
  `col2` datetime DEFAULT NULL
)
drop table t1;
drop stage stage01;
drop table if exists t2;
create table t2(
col1 float,
col2 double,
col3 decimal(5,2),
col4 decimal(20,5)
);
load data infile '$resources/load_data/float_1.csv' into table t2 fields terminated by ',';
select * from t2;
➤ col1[7,24,0]  ¦  col2[8,54,0]  ¦  col3[3,5,2]  ¦  col4[3,20,5]  𝄀
1.3  ¦  1.3  ¦  1.30  ¦  1.30000
drop stage if exists stage02;
create stage stage02 url = 'file:///$resources/into_outfile/stage';
select * from mo_catalog.mo_stages;
➤ stage_id[4,32,0]  ¦  stage_name[12,-1,0]  ¦  url[12,0,0]  ¦  stage_credentials[12,0,0]  ¦  stage_status[12,-1,0]  ¦  created_time[93,64,0]  ¦  comment[12,0,0]  𝄀
20018  ¦  stage02  ¦  file:////mnt/fastdata/temp/matrixone/test/distributed/resources/into_outfile/stage  ¦    ¦  in_use  ¦  2026-07-27 03:38:29  ¦  
show stages;
➤ STAGE_NAME[12,-1,0]  ¦  URL[12,0,0]  ¦  STATUS[12,-1,0]  ¦  COMMENT[12,0,0]  𝄀
stage02  ¦  file:////mnt/fastdata/temp/matrixone/test/distributed/resources/into_outfile/stage  ¦  in_use  ¦  
select col3, col4 from t2 into outfile 'stage://stage02/local_stage_table002.csv';
drop table t2;
create table t2(
col3 decimal(5,2),
col4 decimal(20,5)
);
load data infile 'stage://stage02/local_stage_table002.csv' into table t2 fields terminated by ',' ignore 1 lines;
select * from t2;
➤ col3[3,5,2]  ¦  col4[3,20,5]  𝄀
1.30  ¦  1.30000
show create table t2;
➤ Table[12,-1,0]  ¦  Create Table[12,-1,0]  𝄀
t2  ¦  CREATE TABLE `t2` (
  `col3` decimal(5,2) DEFAULT NULL,
  `col4` decimal(20,5) DEFAULT NULL
)
drop table t2;
drop stage stage02;
drop table if exists t3;
create table t3(
col1 char(225) default 'a',
col2 varchar(225),
col3 text,
col4 varchar(225)
);
load data infile '$resources/load_data/char_varchar_1.csv' into table t3 fields terminated by ',';
select * from t3;
➤ col1[1,225,0]  ¦  col2[12,-1,0]  ¦  col3[12,0,0]  ¦  col4[12,-1,0]  𝄀
a  ¦  b  ¦  c  ¦  d  𝄀
a  ¦  b  ¦  c  ¦  d  𝄀
'a'  ¦  'b'  ¦  'c'  ¦  'd'  𝄀
'a'  ¦  'b'  ¦  'c'  ¦  'd'  𝄀
aa,aa  ¦  bb,bb  ¦  cc,cc  ¦  dd,dd  𝄀
aa,  ¦  bb,  ¦  cc,  ¦  dd,  𝄀
aa,,,aa  ¦  bb,,,bb  ¦  cc,,,cc  ¦  dd,,,dd  𝄀
aa',',,aa  ¦  bb',',,bb  ¦  cc',',,cc  ¦  dd',',,dd  𝄀
aa"aa  ¦  bb"bb  ¦  cc"cc  ¦  dd"dd  𝄀
aa"aa  ¦  bb"bb  ¦  cc"cc  ¦  dd"dd  𝄀
aa"aa  ¦  bb"bb  ¦  cc"cc  ¦  dd"dd  𝄀
aa""aa  ¦  bb""bb  ¦  cc""cc  ¦  dd""dd  𝄀
aa""aa  ¦  bb""bb  ¦  cc""cc  ¦  dd""dd  𝄀
aa",aa  ¦  bb",bb  ¦  cc",cc  ¦  dd",dd  𝄀
aa"",aa  ¦  bb"",bb  ¦  cc"",cc  ¦  dd"",dd  𝄀
  ¦    ¦    ¦    𝄀
  ¦    ¦    ¦    𝄀
null  ¦  null  ¦  null  ¦  null  𝄀
  ¦    ¦    ¦    𝄀
"  ¦  "  ¦  "  ¦  "  𝄀
""  ¦  ""  ¦  ""  ¦  ""
drop stage if exists stage03;
create stage stage03 url = 'file:///$resources/into_outfile/stage';
select * from mo_catalog.mo_stages;
➤ stage_id[4,32,0]  ¦  stage_name[12,-1,0]  ¦  url[12,0,0]  ¦  stage_credentials[12,0,0]  ¦  stage_status[12,-1,0]  ¦  created_time[93,64,0]  ¦  comment[12,0,0]  𝄀
20019  ¦  stage03  ¦  file:////mnt/fastdata/temp/matrixone/test/distributed/resources/into_outfile/stage  ¦    ¦  in_use  ¦  2026-07-27 03:38:29  ¦  
show stages;
➤ STAGE_NAME[12,-1,0]  ¦  URL[12,0,0]  ¦  STATUS[12,-1,0]  ¦  COMMENT[12,0,0]  𝄀
stage03  ¦  file:////mnt/fastdata/temp/matrixone/test/distributed/resources/into_outfile/stage  ¦  in_use  ¦  
select col1, col3 from t3 into outfile 'stage://stage03/local_stage_table003.csv';
drop table t3;
create table t3(
col1 char(225) default 'a',
col3 text
);
load data infile 'stage://stage03/local_stage_table003.csv' into table t3 fields terminated by ',' ignore 1 lines;
select * from t3;
➤ col1[1,225,0]  ¦  col3[12,0,0]  𝄀
a  ¦  c  𝄀
a  ¦  c  𝄀
'a'  ¦  'c'  𝄀
'a'  ¦  'c'  𝄀
aa,aa  ¦  cc,cc  𝄀
aa,  ¦  cc,  𝄀
aa,,,aa  ¦  cc,,,cc  𝄀
aa',',,aa  ¦  cc',',,cc  𝄀
aa"aa  ¦  cc"cc  𝄀
aa"aa  ¦  cc"cc  𝄀
aa"aa  ¦  cc"cc  𝄀
aa""aa  ¦  cc""cc  𝄀
aa""aa  ¦  cc""cc  𝄀
aa",aa  ¦  cc",cc  𝄀
aa"",aa  ¦  cc"",cc  𝄀
  ¦    𝄀
  ¦    𝄀
null  ¦  null  𝄀
  ¦    𝄀
"  ¦  "  𝄀
""  ¦  ""
show create table t3;
➤ Table[12,-1,0]  ¦  Create Table[12,-1,0]  𝄀
t3  ¦  CREATE TABLE `t3` (
  `col1` char(225) DEFAULT 'a',
  `col3` text DEFAULT NULL
)
drop table t3;
drop stage stage03;
drop table if exists t4;
create table t4(
col1 tinyint,
col2 smallint,
col3 int,
col4 bigint,
col5 tinyint unsigned,
col6 smallint unsigned,
col7 int unsigned,
col8 bigint unsigned
);
load data infile '$resources/load_data/integer_numbers_1.csv' into table t4 fields terminated by ',';
select * from t4;
➤ col1[-6,8,0]  ¦  col2[5,16,0]  ¦  col3[4,32,0]  ¦  col4[-5,64,0]  ¦  col5[-6,8,0]  ¦  col6[5,16,0]  ¦  col7[4,32,0]  ¦  col8[-5,64,0]  𝄀
127  ¦  32767  ¦  2147483647  ¦  9223372036854775807  ¦  255  ¦  65535  ¦  4294967295  ¦  18446744073709551615  𝄀
-128  ¦  -32768  ¦  -2147483648  ¦  -9223372036854775808  ¦  0  ¦  0  ¦  0  ¦  0  𝄀
0  ¦  0  ¦  0  ¦  0  ¦  0  ¦  0  ¦  0  ¦  0  𝄀
null  ¦  null  ¦  null  ¦  null  ¦  null  ¦  null  ¦  null  ¦  null  𝄀
1  ¦  null  ¦  null  ¦  0  ¦  0  ¦  0  ¦  null  ¦  null  𝄀
null  ¦  null  ¦  null  ¦  null  ¦  null  ¦  null  ¦  null  ¦  null  𝄀
127  ¦  32767  ¦  2147483647  ¦  9223372036854775807  ¦  255  ¦  65535  ¦  4294967295  ¦  18446744073709551615
drop stage if exists stage04;
create stage stage04 url = 'file:///$resources/into_outfile/stage';
select * from mo_catalog.mo_stages;
➤ stage_id[4,32,0]  ¦  stage_name[12,-1,0]  ¦  url[12,0,0]  ¦  stage_credentials[12,0,0]  ¦  stage_status[12,-1,0]  ¦  created_time[93,64,0]  ¦  comment[12,0,0]  𝄀
20020  ¦  stage04  ¦  file:////mnt/fastdata/temp/matrixone/test/distributed/resources/into_outfile/stage  ¦    ¦  in_use  ¦  2026-07-27 03:38:29  ¦  
show stages;
➤ STAGE_NAME[12,-1,0]  ¦  URL[12,0,0]  ¦  STATUS[12,-1,0]  ¦  COMMENT[12,0,0]  𝄀
stage04  ¦  file:////mnt/fastdata/temp/matrixone/test/distributed/resources/into_outfile/stage  ¦  in_use  ¦  
select col1, col3, col5, col7 from t4 into outfile 'stage://stage04/local_stage_table004.csv';
drop table if exists t4;
create table t4(
col1 tinyint,
col3 int,
col5 tinyint unsigned,
col7 int unsigned
);
load data infile 'stage://stage04/local_stage_table004.csv' into table t4 fields terminated by ',' ignore 1 lines;
select * from t4;
➤ col1[-6,8,0]  ¦  col3[4,32,0]  ¦  col5[-6,8,0]  ¦  col7[4,32,0]  𝄀
127  ¦  2147483647  ¦  255  ¦  4294967295  𝄀
-128  ¦  -2147483648  ¦  0  ¦  0  𝄀
0  ¦  0  ¦  0  ¦  0  𝄀
null  ¦  null  ¦  null  ¦  null  𝄀
1  ¦  null  ¦  0  ¦  null  𝄀
null  ¦  null  ¦  null  ¦  null  𝄀
127  ¦  2147483647  ¦  255  ¦  4294967295
show create table t4;
➤ Table[12,-1,0]  ¦  Create Table[12,-1,0]  𝄀
t4  ¦  CREATE TABLE `t4` (
  `col1` tinyint DEFAULT NULL,
  `col3` int DEFAULT NULL,
  `col5` tinyint unsigned DEFAULT NULL,
  `col7` int unsigned DEFAULT NULL
)
drop table t4;
drop stage stage04;
drop table if exists t5;
create table t5(
col1 int auto_increment primary key,
col2 int,
col3 int
);
load data infile '$resources/load_data/auto_increment_1.csv' into table t5 fields terminated by ',';
select * from t5;
➤ col1[4,32,0]  ¦  col2[4,32,0]  ¦  col3[4,32,0]  𝄀
1  ¦  1  ¦  1  𝄀
2  ¦  2  ¦  2  𝄀
3  ¦  3  ¦  3  𝄀
4  ¦  4  ¦  4  𝄀
5  ¦  5  ¦  5
drop stage if exists stage05;
create stage stage05 url = 'file:///$resources/into_outfile/stage';
select * from mo_catalog.mo_stages;
➤ stage_id[4,32,0]  ¦  stage_name[12,-1,0]  ¦  url[12,0,0]  ¦  stage_credentials[12,0,0]  ¦  stage_status[12,-1,0]  ¦  created_time[93,64,0]  ¦  comment[12,0,0]  𝄀
20021  ¦  stage05  ¦  file:////mnt/fastdata/temp/matrixone/test/distributed/resources/into_outfile/stage  ¦    ¦  in_use  ¦  2026-07-27 03:38:29  ¦  
show stages;
➤ STAGE_NAME[12,-1,0]  ¦  URL[12,0,0]  ¦  STATUS[12,-1,0]  ¦  COMMENT[12,0,0]  𝄀
stage05  ¦  file:////mnt/fastdata/temp/matrixone/test/distributed/resources/into_outfile/stage  ¦  in_use  ¦  
select col1,col2,col3 from t5 into outfile 'stage://stage05/local_stage_table005.csv';
truncate t5;
insert into t5 values (1,1,1);
delete from t5;
load data infile 'stage://stage05/local_stage_table005.csv' into table t5 fields terminated by ',' ignore 1 lines;
select * from t5;
➤ col1[4,32,0]  ¦  col2[4,32,0]  ¦  col3[4,32,0]  𝄀
1  ¦  1  ¦  1  𝄀
2  ¦  2  ¦  2  𝄀
3  ¦  3  ¦  3  𝄀
4  ¦  4  ¦  4  𝄀
5  ¦  5  ¦  5
show create table t5;
➤ Table[12,-1,0]  ¦  Create Table[12,-1,0]  𝄀
t5  ¦  CREATE TABLE `t5` (
  `col1` int NOT NULL AUTO_INCREMENT,
  `col2` int DEFAULT NULL,
  `col3` int DEFAULT NULL,
  PRIMARY KEY (`col1`)
)
drop table t5;
drop stage stage05;
drop table if exists t6;
create table t6 (col1 varchar(20), col2 varchar(20));
load data infile '$resources/load_data/test_enclosed_by01.csv' into table t6 fields terminated by ',' enclosed by '`' lines terminated by '\n';
select * from t6;
➤ col1[12,-1,0]  ¦  col2[12,-1,0]  𝄀
"Hello""  ¦  "Hi"  𝄀
"database"  ¦  ""db"
drop stage if exists stage06;
create stage stage06 url = 'file:///$resources/into_outfile/stage';
select * from mo_catalog.mo_stages;
➤ stage_id[4,32,0]  ¦  stage_name[12,-1,0]  ¦  url[12,0,0]  ¦  stage_credentials[12,0,0]  ¦  stage_status[12,-1,0]  ¦  created_time[93,64,0]  ¦  comment[12,0,0]  𝄀
20022  ¦  stage06  ¦  file:////mnt/fastdata/temp/matrixone/test/distributed/resources/into_outfile/stage  ¦    ¦  in_use  ¦  2026-07-27 03:38:29  ¦  
show stages;
➤ STAGE_NAME[12,-1,0]  ¦  URL[12,0,0]  ¦  STATUS[12,-1,0]  ¦  COMMENT[12,0,0]  𝄀
stage06  ¦  file:////mnt/fastdata/temp/matrixone/test/distributed/resources/into_outfile/stage  ¦  in_use  ¦  
select col2 from t6 into outfile 'stage://stage06/local_stage_table006.csv' fields terminated by ',' enclosed by '' lines terminated by '\n' header 'false';
drop table if exists t6;
create table t6 (col2 varchar(20));
load data infile 'stage://stage06/local_stage_table006.csv' into table t6 fields terminated by ',' enclosed by '`' lines terminated by '\n' ignore 1 lines;
select * from t6;
➤ col2[12,-1,0]  𝄀
""db"
show create table t6;
➤ Table[12,-1,0]  ¦  Create Table[12,-1,0]  𝄀
t6  ¦  CREATE TABLE `t6` (
  `col2` varchar(20) DEFAULT NULL
)
drop table t6;
drop stage stage06;
drop table if exists t7;
create table t7(col1 text, col2 text);
load data infile {'filepath'='$resources/load_data/text.csv.tar.gz', 'compression'='tar.gz'} into table t7 FIELDS  ENCLOSED BY '"' TERMINATED BY "," LINES TERMINATED BY '\n' parallel 'true';
select * from t7;
➤ col1[12,0,0]  ¦  col2[12,0,0]  𝄀
hello  ¦  1  𝄀
hello  ¦  2
drop stage if exists stage07;
create stage stage07 url = 'file:///$resources/into_outfile/stage';
select * from mo_catalog.mo_stages;
➤ stage_id[4,32,0]  ¦  stage_name[12,-1,0]  ¦  url[12,0,0]  ¦  stage_credentials[12,0,0]  ¦  stage_status[12,-1,0]  ¦  created_time[93,64,0]  ¦  comment[12,0,0]  𝄀
20023  ¦  stage07  ¦  file:////mnt/fastdata/temp/matrixone/test/distributed/resources/into_outfile/stage  ¦    ¦  in_use  ¦  2026-07-27 03:38:29  ¦  
show stages;
➤ STAGE_NAME[12,-1,0]  ¦  URL[12,0,0]  ¦  STATUS[12,-1,0]  ¦  COMMENT[12,0,0]  𝄀
stage07  ¦  file:////mnt/fastdata/temp/matrixone/test/distributed/resources/into_outfile/stage  ¦  in_use  ¦  
select col2 from t7 into outfile 'stage://stage07/local_stage_table007.csv';
drop table if exists t7;
create table t7(col1 text);
load data infile 'stage://stage07/local_stage_table007.csv' into table t7 FIELDS ENCLOSED BY '"' TERMINATED BY "," LINES TERMINATED BY '\n' ignore 1 lines parallel 'true';
select * from t7;
➤ col1[12,0,0]  𝄀
1  𝄀
2
show create table t7;
➤ Table[12,-1,0]  ¦  Create Table[12,-1,0]  𝄀
t7  ¦  CREATE TABLE `t7` (
  `col1` text DEFAULT NULL
)
drop table t7;
drop stage stage07;
drop database if exists db01;
create database db01;
use db01;
drop table if exists t11;
create table t11 (col1 int);
load data infile '$resources/load_data/test_character.csv' into table t11 CHARACTER SET utf8 FIELDS TERMINATED BY ',' ENCLOSED BY '"' LINES TERMINATED BY '\n';
select * from t11;
➤ col1[4,32,0]  𝄀
1  𝄀
2  𝄀
3
drop stage if exists stage11;
create stage stage11 url = 'file:///$resources/into_outfile/stage' comment = 'this is a stage';
select * from mo_catalog.mo_stages;
➤ stage_id[4,32,0]  ¦  stage_name[12,-1,0]  ¦  url[12,0,0]  ¦  stage_credentials[12,0,0]  ¦  stage_status[12,-1,0]  ¦  created_time[93,64,0]  ¦  comment[12,0,0]  𝄀
1  ¦  stage11  ¦  file:////mnt/fastdata/temp/matrixone/test/distributed/resources/into_outfile/stage  ¦    ¦  in_use  ¦  2026-07-27 03:38:30  ¦  this is a stage
show stages;
➤ STAGE_NAME[12,-1,0]  ¦  URL[12,0,0]  ¦  STATUS[12,-1,0]  ¦  COMMENT[12,0,0]  𝄀
stage11  ¦  file:////mnt/fastdata/temp/matrixone/test/distributed/resources/into_outfile/stage  ¦  in_use  ¦  this is a stage
select col1 from t11 into outfile 'stage://stage11/local_stage_table011.csv';
drop table if exists t11;
create table t11 (col1 int);
load data infile 'stage://stage11/local_stage_table011.csv' into table t11 CHARACTER SET utf8 FIELDS TERMINATED BY ',' ENCLOSED BY '"' LINES TERMINATED BY '\n' ignore 1 lines;
select * from t11;
➤ col1[4,32,0]  𝄀
1  𝄀
2  𝄀
3
drop table t11;
drop stage stage11;
drop database db01;
drop table if exists ex_table_01;
create table ex_table_01(
col1 tinyint,
col2 smallint,
col3 int,
col4 bigint,
col5 tinyint unsigned,
col6 smallint unsigned,
col7 int unsigned,
col8 bigint unsigned,
col9 float,
col10 double,
col11 varchar(255),
col12 Date,
col13 DateTime,
col14 timestamp,
col15 bool,
col16 decimal(5,2),
col17 text,
col18 varchar(255),
col19 varchar(255),
col20 varchar(255));
load data infile '$resources/external_table_file/ex_table_sep_10.csv' into table ex_table_01 fields terminated by ',' enclosed by '\"' lines terminated by '\r\n';
select col1, col2, col3, col4, col5, col6, col7, col8, col9, col10 from ex_table_01;
➤ col1[-6,8,0]  ¦  col2[5,16,0]  ¦  col3[4,32,0]  ¦  col4[-5,64,0]  ¦  col5[-6,8,0]  ¦  col6[5,16,0]  ¦  col7[4,32,0]  ¦  col8[-5,64,0]  ¦  col9[7,24,0]  ¦  col10[8,54,0]  𝄀
-62  ¦  5807  ¦  -1889972806  ¦  7769629822818484334  ¦  154  ¦  8113  ¦  2658450361  ¦  14999475422109240954  ¦  3.4365  ¦  5.559  𝄀
91  ¦  19514  ¦  -179559641  ¦  1234138289513302348  ¦  122  ¦  44115  ¦  625429347  ¦  6204822205090614210  ¦  7.2914  ¦  6.5836
drop stage if exists ex_stage;
create stage ex_stage url = 'file:///$resources/into_outfile/stage' comment = 'file stage';
select col1, col2, col3, col4, col5, col6, col7, col8, col9, col10 from ex_table_01 into outfile 'stage://ex_stage/ttttable01.csv';
select * from mo_catalog.mo_stages;
➤ stage_id[4,32,0]  ¦  stage_name[12,-1,0]  ¦  url[12,0,0]  ¦  stage_credentials[12,0,0]  ¦  stage_status[12,-1,0]  ¦  created_time[93,64,0]  ¦  comment[12,0,0]  𝄀
20024  ¦  ex_stage  ¦  file:////mnt/fastdata/temp/matrixone/test/distributed/resources/into_outfile/stage  ¦    ¦  in_use  ¦  2026-07-27 03:38:30  ¦  file stage
show stages;
➤ STAGE_NAME[12,-1,0]  ¦  URL[12,0,0]  ¦  STATUS[12,-1,0]  ¦  COMMENT[12,0,0]  𝄀
ex_stage  ¦  file:////mnt/fastdata/temp/matrixone/test/distributed/resources/into_outfile/stage  ¦  in_use  ¦  file stage
drop table ex_table_01;
create external table ex_table_01(
col1 tinyint,
col2 smallint,
col3 int,
col4 bigint,
col5 tinyint unsigned,
col6 smallint unsigned,
col7 int unsigned,
col8 bigint unsigned,
col9 float,
col10 double)
infile 'stage://ex_stage/ttttable01.csv' fields terminated by ',' enclosed by '\"' lines terminated by '\r\n' ignore 1 lines;
select * from ex_table_01;
➤ col1[-6,8,0]  ¦  col2[5,16,0]  ¦  col3[4,32,0]  ¦  col4[-5,64,0]  ¦  col5[-6,8,0]  ¦  col6[5,16,0]  ¦  col7[4,32,0]  ¦  col8[-5,64,0]  ¦  col9[7,24,0]  ¦  col10[8,54,0]  𝄀
-62  ¦  5807  ¦  -1889972806  ¦  7769629822818484334  ¦  154  ¦  8113  ¦  2658450361  ¦  14999475422109240954  ¦  3.4365  ¦  5.559  𝄀
91  ¦  19514  ¦  -179559641  ¦  1234138289513302348  ¦  122  ¦  44115  ¦  625429347  ¦  6204822205090614210  ¦  7.2914  ¦  6.5836
drop table ex_table_01;
drop stage ex_stage;
drop database test;
drop account acc01;
