drop database if exists test;
create database test;
use test;
drop table if exists t1;
create table t1(
col1 date not null,
col2 datetime,
col3 timestamp,
col4 bool
);
set time_zone = 'SYSTEM';
load data infile '$resources/load_data/time_date_1.csv' into table t1 fields terminated by ',';
select * from t1;
col1    col2    col3    col4
1000-01-01    0001-01-01 00:00:00    1970-01-01 00:00:01    false
9999-12-31    9999-12-31 00:00:00    2038-01-19 00:00:00    true
drop stage if exists stage01;
create stage stage01 url = 'file:///$resources/into_outfile';
drop stage if exists substage01;
create stage substage01 url = 'stage://stage01/stage/';
select * from mo_catalog.mo_stages;
stage_id    stage_name    url    stage_credentials    stage_status    created_time    comment
933    stage01    file:////Users/ariznawl/matrixone/test/distributed/resources/into_outfile        disabled    2024-09-12 08:10:05    
934    substage01    stage://stage01/stage/        disabled    2024-09-12 08:10:05    
show stages;
STAGE_NAME    URL    STATUS    COMMENT
stage01    file:////Users/ariznawl/matrixone/test/distributed/resources/into_outfile    DISABLED    
substage01    stage://stage01/stage/    DISABLED    
select col1, col3 from t1 into outfile 'stage://substage01/local_stage_t001.csv';
drop table t1;
create table t1(
col1 date not null,
col3 timestamp
);
load data infile '$resources/into_outfile/stage/local_stage_t001.csv' into table t1 fields terminated by ',' ignore 1 lines;
select * from t1;
col1    col3
1000-01-01    1970-01-01 00:00:01
9999-12-31    2038-01-19 00:00:00
show create table t1;
Table    Create Table
t1    CREATE TABLE `t1` (\n  `col1` date NOT NULL,\n  `col3` timestamp NULL DEFAULT NULL\n)
drop table t1;
drop stage stage01;
drop stage substage01;
drop table if exists t2;
create table t2(
col1 float,
col2 double,
col3 decimal(5,2),
col4 decimal(20,5)
);
load data infile '$resources/load_data/float_1.csv' into table t2 fields terminated by ',';
select * from t2;
col1    col2    col3    col4
1.3    1.3    1.30    1.30000
drop stage if exists stage02;
create stage stage02 url = 'file:///$resources/into_outfile';
drop stage if exists substage02;
create stage substage02 url = 'stage://stage02/stage';
select * from mo_catalog.mo_stages;
stage_id    stage_name    url    stage_credentials    stage_status    created_time    comment
935    stage02    file:////Users/ariznawl/matrixone/test/distributed/resources/into_outfile        disabled    2024-09-12 08:10:05    
936    substage02    stage://stage02/stage        disabled    2024-09-12 08:10:05    
show stages;
STAGE_NAME    URL    STATUS    COMMENT
stage02    file:////Users/ariznawl/matrixone/test/distributed/resources/into_outfile    DISABLED    
substage02    stage://stage02/stage    DISABLED    
select col3, col4 from t2 into outfile 'stage://substage02/local_stage_t002.csv';
drop table t2;
create table t2(
col3 decimal(5,2),
col4 decimal(20,5)
);
load data infile '$resources/into_outfile/stage/local_stage_t002.csv' into table t2 fields terminated by ',' ignore 1 lines;
select * from t2;
col3    col4
1.30    1.30000
show create table t2;
Table    Create Table
t2    CREATE TABLE `t2` (\n  `col3` decimal(5,2) DEFAULT NULL,\n  `col4` decimal(20,5) DEFAULT NULL\n)
drop table t2;
drop stage stage02;
drop stage substage02;
drop table if exists t3;
create table t3(
col1 char(225) default 'a',
col2 varchar(225),
col3 text,
col4 varchar(225)
);
load data infile '$resources/load_data/char_varchar_1.csv' into table t3 fields terminated by ',';
select * from t3;
col1    col2    col3    col4
a    b    c    d
a    b    c    d
'a'    'b'    'c'    'd'
'a'    'b'    'c'    'd'
aa,aa    bb,bb    cc,cc    dd,dd
aa,    bb,    cc,    dd,
aa,,,aa    bb,,,bb    cc,,,cc    dd,,,dd
aa',',,aa    bb',',,bb    cc',',,cc    dd',',,dd
aa"aa    bb"bb    cc"cc    dd"dd
aa"aa    bb"bb    cc"cc    dd"dd
aa"aa    bb"bb    cc"cc    dd"dd
aa""aa    bb""bb    cc""cc    dd""dd
aa""aa    bb""bb    cc""cc    dd""dd
aa",aa    bb",bb    cc",cc    dd",dd
aa"",aa    bb"",bb    cc"",cc    dd"",dd
            
            
null    null    null    null
            
"    "    "    "
""    ""    ""    ""
drop stage if exists stage03;
create stage stage03 url = 'file:///$resources/into_outfile';
drop stage if exists substage03;
create stage substage03 url = 'stage://stage03/stage';
select * from mo_catalog.mo_stages;
stage_id    stage_name    url    stage_credentials    stage_status    created_time    comment
937    stage03    file:////Users/ariznawl/matrixone/test/distributed/resources/into_outfile        disabled    2024-09-12 08:10:06    
938    substage03    stage://stage03/stage        disabled    2024-09-12 08:10:06    
show stages;
STAGE_NAME    URL    STATUS    COMMENT
stage03    file:////Users/ariznawl/matrixone/test/distributed/resources/into_outfile    DISABLED    
substage03    stage://stage03/stage    DISABLED    
select col2, col3 from t3 into outfile 'stage://substage03/local_stage_t003.csv';
drop table t3;
create table t3(
col2 varchar(225),
col3 text
);
load data infile '$resources/into_outfile/stage/local_stage_t003.csv' into table t3 fields terminated by ',' ignore 1 lines;
select * from t3;
col2    col3
b    c
b    c
'b'    'c'
'b'    'c'
bb,bb    cc,cc
bb,    cc,
bb,,,bb    cc,,,cc
bb',',,bb    cc',',,cc
bb"bb    cc"cc
bb"bb    cc"cc
bb"bb    cc"cc
bb""bb    cc""cc
bb""bb    cc""cc
bb",bb    cc",cc
bb"",bb    cc"",cc
    
    
null    null
    
"    "
""    ""
show create table t3;
Table    Create Table
t3    CREATE TABLE `t3` (\n  `col2` varchar(225) DEFAULT NULL,\n  `col3` text DEFAULT NULL\n)
drop table t3;
drop stage stage03;
drop stage substage03;
drop table if exists t4;
create table t4(
col1 tinyint,
col2 smallint,
col3 int,
col4 bigint,
col5 tinyint unsigned,
col6 smallint unsigned,
col7 int unsigned,
col8 bigint unsigned
);
load data infile '$resources/load_data/integer_numbers_1.csv' into table t4 fields terminated by ',';
select * from t4;
col1    col2    col3    col4    col5    col6    col7    col8
127    32767    2147483647    9223372036854775807    255    65535    4294967295    18446744073709551615
-128    -32768    -2147483648    -9223372036854775808    0    0    0    0
0    0    0    0    0    0    0    0
null    null    null    null    null    null    null    null
1    null    null    0    0    0    null    null
null    null    null    null    null    null    null    null
127    32767    2147483647    9223372036854775807    255    65535    4294967295    18446744073709551615
drop stage if exists stage04;
create stage stage04 url = 'file:///$resources/into_outfile';
drop stage if exists substage04;
create stage substage04 url = 'stage://stage04/stage';
select * from mo_catalog.mo_stages;
stage_id    stage_name    url    stage_credentials    stage_status    created_time    comment
939    stage04    file:////Users/ariznawl/matrixone/test/distributed/resources/into_outfile        disabled    2024-09-12 08:10:06    
940    substage04    stage://stage04/stage        disabled    2024-09-12 08:10:06    
show stages;
STAGE_NAME    URL    STATUS    COMMENT
stage04    file:////Users/ariznawl/matrixone/test/distributed/resources/into_outfile    DISABLED    
substage04    stage://stage04/stage    DISABLED    
select col2, col4, col6, col8 from t4 into outfile 'stage://substage04/local_stage_t004.csv';
drop table t4;
create table t4(
col2 smallint,
col4 bigint,
col6 smallint unsigned,
col8 bigint unsigned
);
load data infile '$resources/into_outfile/stage/local_stage_t004.csv' into table t4 fields terminated by ',' ignore 1 lines;
select * from t4;
col2    col4    col6    col8
32767    9223372036854775807    65535    18446744073709551615
-32768    -9223372036854775808    0    0
0    0    0    0
null    null    null    null
null    0    0    null
null    null    null    null
32767    9223372036854775807    65535    18446744073709551615
show create table t4;
Table    Create Table
t4    CREATE TABLE `t4` (\n  `col2` smallint DEFAULT NULL,\n  `col4` bigint DEFAULT NULL,\n  `col6` smallint unsigned DEFAULT NULL,\n  `col8` bigint unsigned DEFAULT NULL\n)
drop table t4;
drop stage stage04;
drop stage substage04;
drop table if exists t5;
create table t5(
col1 int auto_increment primary key,
col2 int,
col3 int
);
load data infile '$resources/load_data/auto_increment_1.csv' into table t5 fields terminated by ',';
select * from t5;
col1    col2    col3
1    1    1
2    2    2
3    3    3
4    4    4
5    5    5
drop stage if exists stage05;
create stage stage05 url = 'file:///$resources/into_outfile';
drop stage if exists substage05;
create stage substage05 url = 'stage://stage05/stage';
select * from mo_catalog.mo_stages;
stage_id    stage_name    url    stage_credentials    stage_status    created_time    comment
941    stage05    file:////Users/ariznawl/matrixone/test/distributed/resources/into_outfile        disabled    2024-09-12 08:10:07    
942    substage05    stage://stage05/stage        disabled    2024-09-12 08:10:07    
show stages;
STAGE_NAME    URL    STATUS    COMMENT
stage05    file:////Users/ariznawl/matrixone/test/distributed/resources/into_outfile    DISABLED    
substage05    stage://stage05/stage    DISABLED    
select col1 from t5 into outfile 'stage://substage05/local_stage_t005.csv';
drop table t5;
create table t5 (col1 int auto_increment primary key);
insert into t5 values (1);
load data infile '$resources/into_outfile/stage/local_stage_t005.csv' into table t5 fields terminated by ',' ignore 1 lines;
Duplicate entry '1' for key 'col1'
delete from t5;
load data infile '$resources/into_outfile/stage/local_stage_t005.csv' into table t5 fields terminated by ',' ignore 1 lines;
select * from t5;
col1
1
2
3
4
5
show create table t5;
Table    Create Table
t5    CREATE TABLE `t5` (\n  `col1` int NOT NULL AUTO_INCREMENT,\n  PRIMARY KEY (`col1`)\n)
drop table t5;
drop stage stage05;
drop stage substage05;
drop table if exists t6;

create table t6 (col1 varchar(20), col2 varchar(20));

load data infile '$resources/load_data/test_enclosed_by01.csv' into table t6 fields terminated by ',' enclosed by '`' lines terminated by '\n';

select * from t6;

drop stage if exists stage06;

create stage stage06 url = 'file:///$resources/into_outfile';

drop stage if exists substage06;

create stage substage06 url = 'stage://stage06/stage';

select * from mo_catalog.mo_stages;

show stages;

select col2 from t6 into outfile 'stage://substage06/local_stage_t006.csv';

drop table t6;

create table t6 (col2 varchar(20));

load data infile '$resources/into_outfile/stage/local_stage_t006.csv' into table t6 fields terminated by ',' enclosed by '`' lines terminated by '\n' ignore 1 lines;

select * from t6;

show create table t6;

drop table t6;

drop stage stage06;

drop stage substage06;

drop table if exists t7;
create table t7(col1 text, col2 text);
load data infile {'filepath'='$resources/load_data/text.csv.tar.gz', 'compression'='tar.gz'} into table t7 FIELDS  ENCLOSED BY '"' TERMINATED BY "," LINES TERMINATED BY '\n' parallel 'true';
select * from t7;
col1    col2
hello    1
hello    2
drop stage if exists stage07;
create stage stage07 url = 'file:///$resources/into_outfile';
drop stage if exists substage07;
create stage substage07 url = 'stage://stage07/stage';
select * from mo_catalog.mo_stages;
stage_id    stage_name    url    stage_credentials    stage_status    created_time    comment
943    stage07    file:////Users/ariznawl/matrixone/test/distributed/resources/into_outfile        disabled    2024-09-12 08:10:07    
944    substage07    stage://stage07/stage        disabled    2024-09-12 08:10:07    
show stages;
STAGE_NAME    URL    STATUS    COMMENT
stage07    file:////Users/ariznawl/matrixone/test/distributed/resources/into_outfile    DISABLED    
substage07    stage://stage07/stage    DISABLED    
select col1 from t7 into outfile 'stage://substage07/local_stage_t007.csv';
drop table t7;
create table t7(col1 text);
load data infile '$resources/into_outfile/stage/local_stage_t007.csv' into table t7 FIELDS ENCLOSED BY '"' TERMINATED BY "," LINES TERMINATED BY '\n' ignore 1 lines parallel 'true';
select * from t7;
col1
hello
hello
show create table t7;
Table    Create Table
t7    CREATE TABLE `t7` (\n  `col1` text DEFAULT NULL\n)
drop table t7;
drop stage stage07;
drop stage substage07;
drop table if exists t9;
create table t9(col1 int unique key, col2 bigint, col3 varchar(30));
load data infile '$resources/load_data/test_starting_by03.csv' into table t9 fields terminated by '|' lines terminated by '\n';
select * from t9;
col1    col2    col3
11    2    2342424124312
1234    242324    3243vevewvw
1000    123123    32424234234
1110    234323    csrvevreerev
drop stage if exists stage09;
create stage stage09 url = 'file:///$resources/into_outfile' comment = '这是一个基于file system创建的stage';
drop stage if exists substage09;
create stage substage09 url = 'stage://stage09/stage';
select * from mo_catalog.mo_stages;
stage_id    stage_name    url    stage_credentials    stage_status    created_time    comment
945    stage09    file:////Users/ariznawl/matrixone/test/distributed/resources/into_outfile        disabled    2024-09-12 08:10:08    这是一个基于file system创建的stage
946    substage09    stage://stage09/stage        disabled    2024-09-12 08:10:08    
show stages;
STAGE_NAME    URL    STATUS    COMMENT
stage09    file:////Users/ariznawl/matrixone/test/distributed/resources/into_outfile    DISABLED    这是一个基于file system创建的stage
substage09    stage://stage09/stage    DISABLED    
select col1, col3 from t9 into outfile 'stage://substage09/local_stage_t009.csv';
drop table t9;
create table t9(col1 int unique key, col3 varchar(30));
load data infile '$resources/into_outfile/stage/local_stage_t009.csv' into table t9 fields terminated by ',' lines terminated by '\n' ignore 1 lines;
select * from t9;
col1    col3
11    2342424124312
1234    3243vevewvw
1000    32424234234
1110    csrvevreerev
show create table t9;
Table    Create Table
t9    CREATE TABLE `t9` (\n  `col1` int DEFAULT NULL,\n  `col3` varchar(30) DEFAULT NULL,\n  UNIQUE KEY `col1` (`col1`)\n)
drop table t9;
drop stage stage09;
select * from mo_catalog.mo_stages;
stage_id    stage_name    url    stage_credentials    stage_status    created_time    comment
946    substage09    stage://stage09/stage        disabled    2024-09-12 08:10:08    
show stages;
STAGE_NAME    URL    STATUS    COMMENT
substage09    stage://stage09/stage    DISABLED    
drop stage substage09;
drop table if exists ex_table_1;
create table ex_table_1(
col1 tinyint default 8,
col2 smallint null,
col3 int,
col4 bigint,
col5 tinyint unsigned,
col6 smallint unsigned,
col7 int unsigned,
col8 bigint unsigned,
col9 float,
col10 double,
col11 varchar(255),
col12 Date,
col13 DateTime,
col14 timestamp,
col15 bool,
col16 decimal(5,2),
col17 text,
col18 varchar(255),
col19 varchar(255),
col20 varchar(255),
primary key(col1));
load data infile '$resources/external_table_file/ex_table_3_6.csv'into table ex_table_1 fields terminated by ',';
select * from ex_table_1;
col1    col2    col3    col4    col5    col6    col7    col8    col9    col10    col11    col12    col13    col14    col15    col16    col17    col18    col19    col20
1    11    1    2    15    600    700    56    3.4365    5.559    math    2020-04-30    1998-08-07 00:00:00    1975-09-09 23:59:59    true    602.53    abcdefg    message    s@126.com    comment balabalabalabalabala
2    20    3    4    21    220    1    3    7.2914    6.5836    art    2020-02-22    1998-06-04 00:00:00    1985-01-12 23:59:59    false    878.09    abcdefg    message    r@sina.com    aaaabbbbbbccccc
3    9    null    20    1    500    2    4    1.1559    6.5635    english    2020-02-16    1998-01-21 23:59:59    2034-02-10 00:00:00    true    439.95    EF,GHI,G;KL/MN?OPQR.STU-_+=VWXYZabcdefgh    OPQR.STU-_+=VWXYZa    U-_+=VWXYZabcdefghigklmno    .STU-_+=VWXYZab
3    20    null    7    1    700    600    20    7.2914    1.1732    science    2020-05-08    1998-12-30 00:00:00    1985-01-12 23:59:59    false    428.14    U-_+=VWXYZabcdefghigklmnopqrstuvwxy    L/MN?OPQR.STU-_+=VWXYZabcdefghigklmnopqrstuvwxyz012    r@sina.com    bbbbbbccccc
drop stage if exists ex_stage01;
create stage ex_stage01 url = 'file:///$resources/into_outfile' comment = '这是一个基于file system创建的stage';
drop stage if exists substage01;
create stage substage01 url = 'stage://ex_stage01/stage';
select col1, col3, col5, col7, col9, col11, col13, col15 from ex_table_1 into outfile 'stage://substage01/sub_stage001.csv';
drop table ex_table_1;
create external table ex_table_1(
col1 tinyint default 8,
col3 int,
col5 tinyint unsigned,
col7 int unsigned,
col9 float,
col11 varchar(255),
col13 DateTime,
col15 bool,
primary key(col1)
)infile 'stage://substage01/sub_stage001.csv' fields terminated by ',' ignore 1 lines;;
select * from ex_table_1;
col1    col3    col5    col7    col9    col11    col13    col15
1    1    15    700    3.4365    math    1998-08-07 00:00:00    true
2    3    21    1    7.2914    art    1998-06-04 00:00:00    false
3    null    1    2    1.1559    english    1998-01-21 23:59:59    true
3    null    1    600    7.2914    science    1998-12-30 00:00:00    false
drop table ex_table_1;
drop stage ex_stage01;
drop stage substage01;
drop database test;