drop database if exists br_float_special_values;
create database br_float_special_values;
use br_float_special_values;
create table base_t(
id int primary key,
f32 float,
f64 double
);
insert into base_t values (1, 1.25, -2.5);
data branch create table src_t from base_t;
data branch create table dst_t from base_t;
insert into src_t values
(2, cast('NaN' as float), cast('NaN' as double)),
(3, cast('Inf' as float), cast('Inf' as double)),
(4, cast('-Inf' as float), cast('-Inf' as double));
data branch diff src_t against dst_t output as diff_out;
➤ TABLE CREATED[12,0,0]  𝄀
`br_float_special_values`.`diff_out`
select __mo_diff_flag, id, f32, f64 from diff_out order by id;
➤ __mo_diff_flag[12,-1,0]  ¦  id[4,32,0]  ¦  f32[7,24,0]  ¦  f64[8,54,0]  𝄀
INSERT  ¦  2  ¦  NaN  ¦  NaN  𝄀
INSERT  ¦  3  ¦  Infinity  ¦  Infinity  𝄀
INSERT  ¦  4  ¦  -Infinity  ¦  -Infinity
data branch merge src_t into dst_t;
select id, f32, f64 from dst_t order by id;
➤ id[4,32,0]  ¦  f32[7,24,0]  ¦  f64[8,54,0]  𝄀
1  ¦  1.25  ¦  -2.5  𝄀
2  ¦  NaN  ¦  NaN  𝄀
3  ¦  Infinity  ¦  Infinity  𝄀
4  ¦  -Infinity  ¦  -Infinity
data branch create table pick_src from base_t;
data branch create table pick_dst from base_t;
insert into pick_src values
(2, cast('NaN' as float), cast('NaN' as double)),
(3, cast('Inf' as float), cast('Inf' as double)),
(4, cast('-Inf' as float), cast('-Inf' as double));
data branch pick pick_src into pick_dst keys(2, 3, 4);
select id, f32, f64 from pick_dst order by id;
➤ id[4,32,0]  ¦  f32[7,24,0]  ¦  f64[8,54,0]  𝄀
1  ¦  1.25  ¦  -2.5  𝄀
2  ¦  NaN  ¦  NaN  𝄀
3  ¦  Infinity  ¦  Infinity  𝄀
4  ¦  -Infinity  ¦  -Infinity
create table no_pk_base(f double, note varchar(16));
insert into no_pk_base values
(cast('NaN' as double), 'remove'),
(cast('Inf' as double), 'update'),
(cast('-Inf' as double), 'keep');
data branch create table no_pk_src from no_pk_base;
data branch create table no_pk_dst from no_pk_base;
delete from no_pk_src where note = 'remove';
update no_pk_src set note = 'updated' where note = 'update';
data branch merge no_pk_src into no_pk_dst;
select f, note from no_pk_dst order by note;
➤ f[8,54,0]  ¦  note[12,-1,0]  𝄀
-Infinity  ¦  keep  𝄀
Infinity  ¦  updated
create table portable_base(f32 float, f64 double, marker double, note varchar(16));
insert into portable_base values
(cast('NaN' as float), cast('NaN' as double), null, 'remove'),
(cast('NaN' as float), cast('NaN' as double), cast('Inf' as double), 'update'),
(cast('Inf' as float), cast('-Inf' as double), null, 'keep');
data branch create table portable_src from portable_base;
data branch create table portable_dst from portable_base;
delete from portable_src where note = 'remove';
update portable_src set marker = cast('-Inf' as double), note = 'updated' where note = 'update';
data branch diff portable_src against portable_dst output file '/tmp/';
➤ FILE SAVED TO[12,0,0]  ¦  HINT[12,0,0]  𝄀
/tmp/diff_portable_src_portable_dst_20260803_020539_9045ebc2-f2d8-42be-8855-8404c91492b6.sql  ¦  DELETE FROM `br_float_special_values`.`portable_dst`, INSERT INTO `br_float_special_values`.`portable_dst`
delete from portable_dst
where f32 != f32 and f64 != f64 and marker is null and note = 'remove'
limit 1;
delete from portable_dst
where f32 != f32 and f64 != f64 and marker = cast('Inf' as double) and note = 'update'
limit 1;
insert into portable_dst values
(cast('NaN' as float), cast('NaN' as double), cast('-Inf' as double), 'updated');
select f32, f64, marker, note from portable_dst order by note;
➤ f32[7,24,0]  ¦  f64[8,54,0]  ¦  marker[8,54,0]  ¦  note[12,-1,0]  𝄀
Infinity  ¦  -Infinity  ¦  null  ¦  keep  𝄀
NaN  ¦  NaN  ¦  -Infinity  ¦  updated
drop database br_float_special_values;
