drop database if exists br_index;
create database br_index;
use br_index;
create table base(
id int primary key,
u int,
k int,
v varchar(20),
unique key uk_u(u),
key idx_k(k)
);
insert into base values
(1, 101, 10, 'one'),
(2, 102, 20, 'two'),
(3, 103, 30, 'three');
data branch create table dst from base;
data branch create table src from base;
insert into src values (4, 104, 20, 'four');
update src set k = 40, v = 'two-src' where id = 2;
data branch pick src into dst keys(2, 4) when conflict accept;
select id, u, k, v from dst where k = 20 order by id;
id    u    k    v
4    104    20    four
select id, u, k, v from dst where k = 40 order by id;
id    u    k    v
2    102    40    two-src
insert into dst values (5, 104, 50, 'dup-u');
-- @regex("Duplicate entry '104' for key '(u|__mo_index_idx_col)'(\[[0-9,]+\])?", true)
Duplicate entry '104' for key 'u'
data branch create table merge_dst from base;
data branch create table merge_src from base;
insert into merge_src values (4, 104, 40, 'four');
data branch merge merge_src into merge_dst;
select id, u, k, v from merge_dst where u = 104;
id    u    k    v
4    104    40    four
data branch create table conflict_dst from base;
data branch create table conflict_src from base;
insert into conflict_dst values (4, 104, 40, 'dst-four');
insert into conflict_src values (5, 104, 50, 'src-five');
data branch merge conflict_src into conflict_dst when conflict accept;
-- @regex("Duplicate entry '104' for key '(u|__mo_index_idx_col)'(\[[0-9,]+\])?", true)
Duplicate entry '104' for key 'u'
select id, u, k, v from conflict_dst order by id;
id    u    k    v
1    101    10    one
2    102    20    two
3    103    30    three
4    104    40    dst-four
drop database br_index;
drop database if exists br_schema_drift;
create database br_schema_drift;
use br_schema_drift;
create table base(a int primary key, b int);
insert into base values (1, 10), (2, 20), (3, 30);
data branch create table left_add from base;
data branch create table right_add from base;
alter table left_add add column c varchar(20) default 'left-only';
insert into right_add values (4, 40);
data branch diff left_add against right_add;
diff left_add against right_add    flag    a    b    c
right_add    INSERT    4    40    null
data branch create table both_add_left from base;
data branch create table both_add_right from base;
alter table both_add_left add column c varchar(20) default 'same';
alter table both_add_right add column c varchar(20) default 'same';
update both_add_left set c = 'left' where a = 2;
update both_add_right set c = 'right' where a = 3;
data branch diff both_add_left against both_add_right columns (a, c);
diff both_add_left against both_add_right    flag    a    c
both_add_left    UPDATE    2    left
both_add_right    UPDATE    3    right
data branch create table type_left from base;
data branch create table type_right from base;
alter table type_left add column c int default 0;
alter table type_right add column c varchar(20) default 'x';
data branch diff type_left against type_right;
-- @regex("schema compatibility check: column 'c' exists in both schemas but has different types", true)
internal error: schema compatibility check: column 'c' exists in both schemas but has different types (target: 22, base: 61)
data branch create table rename_left from base;
data branch create table rename_right from base;
alter table rename_left rename column b to bb;
data branch diff rename_left against rename_right;
-- @regex("schema compatibility check: base column 'b' is not present in target schema",true)
internal error: schema compatibility check: base column 'b' is not present in target schema
drop snapshot if exists history_owner_s;
create table history_owner_base(a int primary key, b int);
create snapshot history_owner_s for table br_schema_drift history_owner_base;
alter table history_owner_base add column c int default 0;
set @history_owner_tid = (
select rel_id from mo_catalog.mo_tables
where reldatabase = 'br_schema_drift' and relname = 'history_owner_base'
);
select count(*) as lineage_before_source_drop
from mo_catalog.mo_branch_metadata
where table_id = @history_owner_tid and level = 'alter';
lineage_before_source_drop
1
drop snapshot history_owner_s;
select count(*) as snapshots_after_source_drop
from mo_catalog.mo_snapshots
where kind = 'branch' and table_name = 'history_owner_base';
snapshots_after_source_drop
0
select count(*) as lineage_after_source_drop
from mo_catalog.mo_branch_metadata
where table_id = @history_owner_tid and level = 'alter';
lineage_after_source_drop
0
alter table history_owner_base add column d int default 0;
set @history_owner_second_tid = (
select rel_id from mo_catalog.mo_tables
where reldatabase = 'br_schema_drift' and relname = 'history_owner_base'
);
select count(*) as lineage_after_second_alter
from mo_catalog.mo_branch_metadata
where table_id = @history_owner_second_tid and level = 'alter';
lineage_after_second_alter
0
drop table history_owner_base;
create table history_live_base(a int primary key, b int);
data branch create table history_live_child from history_live_base;
alter table history_live_base add column c int default 0;
set @history_live_tid = (
select rel_id from mo_catalog.mo_tables
where reldatabase = 'br_schema_drift' and relname = 'history_live_base'
);
select count(*) as lineage_with_live_branch
from mo_catalog.mo_branch_metadata
where table_id = @history_live_tid and level = 'alter';
lineage_with_live_branch
1
data branch delete table history_live_child;
select count(*) as snapshots_after_branch_drop
from mo_catalog.mo_snapshots
where kind = 'branch' and table_name = 'history_live_base';
snapshots_after_branch_drop
0
select count(*) as lineage_after_branch_drop
from mo_catalog.mo_branch_metadata
where table_id = @history_live_tid and level = 'alter';
lineage_after_branch_drop
0
drop table history_live_base;
drop database br_schema_drift;
drop database if exists br_txn_src;
drop database if exists br_txn_dst;
create database br_txn_src;
use br_txn_src;
create table base(a int primary key, b varchar(20));
insert into base values (1, 'one'), (2, 'two');
create table alter_begin(a int primary key, b int);
insert into alter_begin values (1, 10);
create table alter_autocommit(a int primary key, b int);
insert into alter_autocommit values (1, 10);
create snapshot br_alter_begin_s for table br_txn_src alter_begin;
create snapshot br_alter_autocommit_s for table br_txn_src alter_autocommit;
begin;
alter table alter_begin add column c int default 7;
commit;
select a, b, c from alter_begin order by a;
a    b    c
1    10    7
set autocommit=0;
alter table alter_autocommit add column c int default 9;
commit;
set autocommit=1;
select a, b, c from alter_autocommit order by a;
a    b    c
1    10    9
drop snapshot br_alter_begin_s;
drop snapshot br_alter_autocommit_s;
begin;
data branch create table br_commit from base;
commit;
select count(*) as br_commit_rows from br_commit;
br_commit_rows
2
begin;
data branch create table br_rollback from base;
rollback;
select count(*) as br_rollback_tables
from mo_catalog.mo_tables
where reldatabase = 'br_txn_src' and relname = 'br_rollback';
br_rollback_tables
0
begin;
data branch delete table br_txn_src.br_commit;
rollback;
select count(*) as br_commit_after_rollback
from mo_catalog.mo_tables
where reldatabase = 'br_txn_src' and relname = 'br_commit';
br_commit_after_rollback
1
begin;
data branch delete table br_txn_src.br_commit;
commit;
select count(*) as br_commit_after_commit
from mo_catalog.mo_tables
where reldatabase = 'br_txn_src' and relname = 'br_commit';
br_commit_after_commit
0
data branch create table pick_dst from base;
data branch create table pick_src from base;
insert into pick_src values (3, 'three');
begin;
data branch pick pick_src into pick_dst keys(3) when conflict accept;
-- @regex("(DATA BRANCH MERGE/PICK is not supported in transactions|Write conflicts detected|txn need retry|deadlock detected)", true)
internal error: DATA BRANCH MERGE/PICK is not supported in transactions
rollback;
select count(*) as pick_dst_rows from pick_dst;
pick_dst_rows
2
data branch create table txn_merge_dst from base;
data branch create table txn_merge_src from base;
update txn_merge_src set b = 'two-txn' where a = 2;
insert into txn_merge_src values (3, 'three');
delete from txn_merge_src where a = 1;
begin;
data branch diff txn_merge_src against txn_merge_dst output count;
COUNT(*)
3
rollback;
begin;
data branch merge txn_merge_src into txn_merge_dst when conflict accept;
rollback;
select a, b from txn_merge_dst order by a;
a    b
1    one
2    two
begin;
data branch merge txn_merge_src into txn_merge_dst when conflict accept;
commit;
select a, b from txn_merge_dst order by a;
a    b
2    two-txn
3    three
data branch create database br_txn_dst from br_txn_src;
select count(*) as dst_tables
from mo_catalog.mo_tables
where reldatabase = 'br_txn_dst'
and relname in ('base', 'pick_dst', 'pick_src');
dst_tables
3
begin;
data branch delete database br_txn_dst;
rollback;
select count(*) as dst_tables_after_rollback
from mo_catalog.mo_tables
where reldatabase = 'br_txn_dst'
and relname in ('base', 'pick_dst', 'pick_src');
dst_tables_after_rollback
3
begin;
data branch delete database br_txn_dst;
commit;
select count(*) as dst_tables_after_commit
from mo_catalog.mo_tables
where reldatabase = 'br_txn_dst';
dst_tables_after_commit
0
drop database if exists br_txn_dst;
drop database br_txn_src;
