drop database if exists br_set_lca;
create database br_set_lca;
use br_set_lca;
create table base(
id int primary key,
v set('a','b','c')
);
insert into base values (1,'a'),(2,null);
data branch create table src from base;
data branch create table pick_dst from base;
data branch create table merge_dst from base;
update src set v='b,c' where id=1;
insert into src values(3,'a,c');
delete from src where id=2;
data branch diff src against base output count;
➤ COUNT(*)[-5,0,0]  𝄀
3
data branch diff src against base;
➤ diff src against base[12,0,0]  ¦  flag[12,0,0]  ¦  id[4,32,0]  ¦  v[-5,64,0]  𝄀
src  ¦  UPDATE  ¦  1  ¦  6  𝄀
src  ¦  DELETE  ¦  2  ¦  null  𝄀
src  ¦  INSERT  ¦  3  ¦  5
data branch pick src into pick_dst keys(1,3);
select id, cast(v as char) as v, v is null as is_null from pick_dst order by id;
➤ id[4,32,0]  ¦  v[12,-1,0]  ¦  is_null[-7,1,0]  𝄀
1  ¦  b,c  ¦  0  𝄀
2  ¦  null  ¦  1  𝄀
3  ¦  a,c  ¦  0
data branch merge src into merge_dst;
select id, cast(v as char) as v, v is null as is_null from merge_dst order by id;
➤ id[4,32,0]  ¦  v[12,-1,0]  ¦  is_null[-7,1,0]  𝄀
1  ¦  b,c  ¦  0  𝄀
3  ¦  a,c  ¦  0
data branch diff src against merge_dst output count;
➤ COUNT(*)[-5,0,0]  𝄀
0
create table boundary_base(
id int primary key,
v set('a','b','c')
);
insert into boundary_base values (1,''),(2,null);
data branch create table boundary_src from boundary_base;
data branch create table boundary_dst from boundary_base;
update boundary_src set v='a,b' where id=1;
update boundary_src set v='' where id=2;
data branch diff boundary_src against boundary_base output count;
➤ COUNT(*)[-5,0,0]  𝄀
2
data branch merge boundary_src into boundary_dst;
select id, cast(v as char) as v, v is null as is_null from boundary_dst order by id;
➤ id[4,32,0]  ¦  v[12,-1,0]  ¦  is_null[-7,1,0]  𝄀
1  ¦  a,b  ¦  0  𝄀
2  ¦    ¦  0
data branch diff boundary_src against boundary_dst output count;
➤ COUNT(*)[-5,0,0]  𝄀
0
create table empty_member_base(
id int primary key,
v set('','a')
);
insert into empty_member_base values (1,1);
data branch create table empty_member_src from empty_member_base;
data branch create table empty_member_dst from empty_member_base;
update empty_member_src set v=0 where id=1;
select cast(v as unsigned) as bitmap from empty_member_base;
➤ bitmap[-5,64,0]  𝄀
1
select cast(v as unsigned) as bitmap from empty_member_src;
➤ bitmap[-5,64,0]  𝄀
0
data branch diff empty_member_src against empty_member_base output count;
➤ COUNT(*)[-5,0,0]  𝄀
1
data branch merge empty_member_src into empty_member_dst;
select cast(v as unsigned) as bitmap from empty_member_dst;
➤ bitmap[-5,64,0]  𝄀
0
data branch diff empty_member_src against empty_member_dst output count;
➤ COUNT(*)[-5,0,0]  𝄀
0
drop database br_set_lca;
