drop database if exists br_float_special_values;
create database br_float_special_values;
use br_float_special_values;
create table base_t(
id int primary key,
f32 float,
f64 double
);
insert into base_t values (1, 1.25, -2.5);
data branch create table src_t from base_t;
data branch create table dst_t from base_t;
insert into src_t values
(2, cast('NaN' as float), cast('NaN' as double)),
(3, cast('Inf' as float), cast('Inf' as double)),
(4, cast('-Inf' as float), cast('-Inf' as double));
data branch diff src_t against dst_t output as diff_out;
➤ TABLE CREATED[12,0,0]  𝄀
`br_float_special_values`.`diff_out`
select __mo_diff_flag, id, f32, f64 from diff_out order by id;
➤ __mo_diff_flag[12,-1,0]  ¦  id[4,32,0]  ¦  f32[7,24,0]  ¦  f64[8,54,0]  𝄀
INSERT  ¦  2  ¦  NaN  ¦  NaN  𝄀
INSERT  ¦  3  ¦  Infinity  ¦  Infinity  𝄀
INSERT  ¦  4  ¦  -Infinity  ¦  -Infinity
data branch merge src_t into dst_t;
select id, f32, f64 from dst_t order by id;
➤ id[4,32,0]  ¦  f32[7,24,0]  ¦  f64[8,54,0]  𝄀
1  ¦  1.25  ¦  -2.5  𝄀
2  ¦  NaN  ¦  NaN  𝄀
3  ¦  Infinity  ¦  Infinity  𝄀
4  ¦  -Infinity  ¦  -Infinity
data branch create table pick_src from base_t;
data branch create table pick_dst from base_t;
insert into pick_src values
(2, cast('NaN' as float), cast('NaN' as double)),
(3, cast('Inf' as float), cast('Inf' as double)),
(4, cast('-Inf' as float), cast('-Inf' as double));
data branch pick pick_src into pick_dst keys(2, 3, 4);
select id, f32, f64 from pick_dst order by id;
➤ id[4,32,0]  ¦  f32[7,24,0]  ¦  f64[8,54,0]  𝄀
1  ¦  1.25  ¦  -2.5  𝄀
2  ¦  NaN  ¦  NaN  𝄀
3  ¦  Infinity  ¦  Infinity  𝄀
4  ¦  -Infinity  ¦  -Infinity
create table no_pk_base(f double, note varchar(16));
insert into no_pk_base values
(cast('NaN' as double), 'remove'),
(cast('Inf' as double), 'update'),
(cast('-Inf' as double), 'keep');
data branch create table no_pk_src from no_pk_base;
data branch create table no_pk_dst from no_pk_base;
delete from no_pk_src where note = 'remove';
update no_pk_src set note = 'updated' where note = 'update';
data branch diff no_pk_src against no_pk_dst;
➤ diff no_pk_src against no_pk_dst[12,0,0]  ¦  flag[12,0,0]  ¦  f[8,53,31]  ¦  note[12,16,0]  𝄀
no_pk_src  ¦  DELETE  ¦  NaN  ¦  remove  𝄀
no_pk_src  ¦  UPDATE  ¦  Infinity  ¦  updated
data branch merge no_pk_src into no_pk_dst;
select f, note from no_pk_dst order by note;
➤ f[8,54,0]  ¦  note[12,-1,0]  𝄀
-Infinity  ¦  keep  𝄀
Infinity  ¦  updated
create table portable_base(f32 float, f64 double, marker double, note varchar(16));
insert into portable_base values
(cast('NaN' as float), cast('NaN' as double), null, 'remove'),
(cast('NaN' as float), cast('NaN' as double), cast('Inf' as double), 'update'),
(cast('Inf' as float), cast('-Inf' as double), null, 'keep');
data branch create table portable_src from portable_base;
data branch create table portable_dst from portable_base;
delete from portable_src where note = 'remove';
update portable_src set marker = cast('-Inf' as double), note = 'updated' where note = 'update';
data branch diff portable_src against portable_dst output file '/tmp/';
➤ FILE SAVED TO[12,0,0]  ¦  HINT[12,0,0]  𝄀
/tmp/diff_portable_src_portable_dst_20260803_132724_19045738-30c4-40e5-88e8-bca47f2f792f.sql  ¦  DELETE FROM `br_float_special_values`.`portable_dst`, INSERT INTO `br_float_special_values`.`portable_dst`
delete from portable_dst
where serial(f32) = serial(cast('NaN' as float))
and serial(f64) = serial(cast('NaN' as double))
and marker is null and note = 'remove'
limit 1;
delete from portable_dst
where serial(f32) = serial(cast('NaN' as float))
and serial(f64) = serial(cast('NaN' as double))
and serial(marker) = serial(cast('Inf' as double)) and note = 'update'
limit 1;
insert into portable_dst values
(cast('NaN' as float), cast('NaN' as double), cast('-Inf' as double), 'updated');
select f32, f64, marker, note from portable_dst order by note;
➤ f32[7,24,0]  ¦  f64[8,54,0]  ¦  marker[8,54,0]  ¦  note[12,-1,0]  𝄀
Infinity  ¦  -Infinity  ¦  null  ¦  keep  𝄀
NaN  ¦  NaN  ¦  -Infinity  ¦  updated
create table real_float_base(k float primary key, note varchar(24));
insert into real_float_base values
(cast('NaN' as float), 'update'),
(cast('Inf' as float), 'remove'),
(cast('-Inf' as float), 'keep'),
(1.5, 'finite');
data branch create table real_float_src from real_float_base;
data branch create table real_float_dst from real_float_base;
update real_float_src set note = 'updated' where k != k;
delete from real_float_src where k = cast('Inf' as float);
data branch merge real_float_src into real_float_dst;
select k, note from real_float_dst order by note;
➤ k[7,24,0]  ¦  note[12,-1,0]  𝄀
1.5  ¦  finite  𝄀
-Infinity  ¦  keep  𝄀
NaN  ¦  updated
create table real_composite_base(
f32 float,
f64 double,
tag int,
note varchar(24),
primary key(f32, f64, tag)
);
insert into real_composite_base values
(cast('NaN' as float), 1.0, 1, 'update_f32'),
(1.0, cast('NaN' as double), 2, 'update_f64'),
(cast('Inf' as float), cast('-Inf' as double), 3, 'remove_inf'),
(cast('-Inf' as float), cast('Inf' as double), 4, 'keep_inf'),
(2.0, 3.0, 5, 'finite');
data branch create table real_composite_src from real_composite_base;
data branch create table real_composite_dst from real_composite_base;
update real_composite_src set note = 'updated_f32' where f32 != f32;
update real_composite_src set note = 'updated_f64' where f64 != f64;
delete from real_composite_src where tag = 3;
data branch merge real_composite_src into real_composite_dst;
select f32, f64, tag, note from real_composite_dst order by tag;
➤ f32[7,24,0]  ¦  f64[8,54,0]  ¦  tag[4,32,0]  ¦  note[12,-1,0]  𝄀
NaN  ¦  1.0  ¦  1  ¦  update_f32  𝄀
1.0  ¦  NaN  ¦  2  ¦  update_f64  𝄀
-Infinity  ¦  Infinity  ¦  4  ¦  keep_inf  𝄀
2.0  ¦  3.0  ¦  5  ¦  finite
data branch create table real_portable_src from real_composite_base;
data branch create table real_portable_dst from real_composite_base;
update real_portable_src set note = 'updated_f32' where f32 != f32;
update real_portable_src set note = 'updated_f64' where f64 != f64;
delete from real_portable_src where tag = 3;
data branch diff real_portable_src against real_portable_dst output file '/tmp/';
➤ FILE SAVED TO[12,0,0]  ¦  HINT[12,0,0]  𝄀
/tmp/diff_real_portable_src_real_portable_dst_20260803_132724_280baa78-31f9-48d9-b8bd-1c002226ae5f.sql  ¦  DELETE FROM `br_float_special_values`.`real_portable_dst`, INSERT INTO `br_float_special_values`.`real_portable_dst`
create table real_portable_delete_stage as
select f32 as branch_apply_key_0, f64 as branch_apply_key_1, tag as branch_apply_key_2
from real_portable_dst where 1 = 0;
insert into real_portable_delete_stage values
(cast('NaN' as float), 1.0, 1),
(1.0, cast('NaN' as double), 2),
(cast('Inf' as float), cast('-Inf' as double), 3);
delete branch_apply_base
from real_portable_dst as branch_apply_base
join real_portable_delete_stage as branch_apply_stage on
serial(branch_apply_base.f32) = serial(branch_apply_stage.branch_apply_key_0)
and serial(branch_apply_base.f64) = serial(branch_apply_stage.branch_apply_key_1)
and branch_apply_base.tag = branch_apply_stage.branch_apply_key_2;
insert into real_portable_dst values
(cast('NaN' as float), 1.0, 1, 'updated_f32'),
(1.0, cast('NaN' as double), 2, 'updated_f64');
drop table real_portable_delete_stage;
select f32, f64, tag, note from real_portable_dst order by tag;
➤ f32[7,24,0]  ¦  f64[8,54,0]  ¦  tag[4,32,0]  ¦  note[12,-1,0]  𝄀
NaN  ¦  1.0  ¦  1  ¦  updated_f32  𝄀
1.0  ¦  NaN  ¦  2  ¦  updated_f64  𝄀
-Infinity  ¦  Infinity  ¦  4  ¦  keep_inf  𝄀
2.0  ¦  3.0  ¦  5  ¦  finite
create table bit_float_base(k float primary key, note varchar(24));
insert into bit_float_base values(bit_cast(unhex('0000c07f') as float), 'nan0');
insert into bit_float_base values(bit_cast(unhex('0100c07f') as float), 'nan1');
insert into bit_float_base values(0.0, 'poszero');
insert into bit_float_base values(bit_cast(unhex('00000080') as float), 'negzero');
data branch create table bit_float_src from bit_float_base;
data branch create table bit_float_dst from bit_float_base;
update bit_float_src set note = 'nan1_updated'
where serial(k) = serial(bit_cast(unhex('0100c07f') as float));
update bit_float_src set note = 'negzero_updated'
where serial(k) = serial(bit_cast(unhex('00000080') as float));
data branch merge bit_float_src into bit_float_dst;
select note, hex(serial(k)) from bit_float_dst order by note;
➤ note[12,-1,0]  ¦  hex(serial(k))[12,-1,0]  𝄀
nan0  ¦  20FFC00000  𝄀
nan1_updated  ¦  20FFC00001  𝄀
negzero_updated  ¦  207FFFFFFF  𝄀
poszero  ¦  2080000000
create table bit_double_base(k double primary key, note varchar(24));
insert into bit_double_base values(bit_cast(unhex('000000000000f87f') as double), 'nan0');
insert into bit_double_base values(bit_cast(unhex('010000000000f87f') as double), 'nan1');
insert into bit_double_base values(0.0, 'poszero');
insert into bit_double_base values(bit_cast(unhex('0000000000000080') as double), 'negzero');
data branch create table bit_double_src from bit_double_base;
data branch create table bit_double_dst from bit_double_base;
update bit_double_src set note = 'nan1_updated'
where serial(k) = serial(bit_cast(unhex('010000000000f87f') as double));
update bit_double_src set note = 'negzero_updated'
where serial(k) = serial(bit_cast(unhex('0000000000000080') as double));
data branch merge bit_double_src into bit_double_dst;
select note, hex(serial(k)) from bit_double_dst order by note;
➤ note[12,-1,0]  ¦  hex(serial(k))[12,-1,0]  𝄀
nan0  ¦  21FFF8000000000000  𝄀
nan1_updated  ¦  21FFF8000000000001  𝄀
negzero_updated  ¦  217FFFFFFFFFFFFFFF  𝄀
poszero  ¦  218000000000000000
data branch create table bit_float_pick_dst from bit_float_base;
data branch pick bit_float_src into bit_float_pick_dst
keys(select k from bit_float_src where note in ('nan1_updated', 'negzero_updated'))
when conflict accept;
select note, hex(serial(k)) from bit_float_pick_dst order by note;
➤ note[12,-1,0]  ¦  hex(serial(k))[12,-1,0]  𝄀
nan0  ¦  20FFC00000  𝄀
nan1_updated  ¦  20FFC00001  𝄀
negzero_updated  ¦  207FFFFFFF  𝄀
poszero  ¦  2080000000
data branch create table bit_double_pick_dst from bit_double_base;
data branch pick bit_double_src into bit_double_pick_dst
keys(select k from bit_double_src where note in ('nan1_updated', 'negzero_updated'))
when conflict accept;
select note, hex(serial(k)) from bit_double_pick_dst order by note;
➤ note[12,-1,0]  ¦  hex(serial(k))[12,-1,0]  𝄀
nan0  ¦  21FFF8000000000000  𝄀
nan1_updated  ¦  21FFF8000000000001  𝄀
negzero_updated  ¦  217FFFFFFFFFFFFFFF  𝄀
poszero  ¦  218000000000000000
create table bit_composite_base(
f32 float,
f64 double,
tag int,
note varchar(32),
primary key(f32, f64, tag)
);
insert into bit_composite_base values
(bit_cast(unhex('0000c07f') as float), 2.0, 1, 'keep_f32_nan0');
insert into bit_composite_base values
(bit_cast(unhex('0100c07f') as float), 2.0, 1, 'update_f32_nan1');
insert into bit_composite_base values
(3.0, bit_cast(unhex('000000000000f87f') as double), 2, 'keep_f64_nan0');
insert into bit_composite_base values
(3.0, bit_cast(unhex('010000000000f87f') as double), 2, 'update_f64_nan1');
insert into bit_composite_base values(0.0, 0.0, 3, 'keep_poszero');
insert into bit_composite_base values(
bit_cast(unhex('00000080') as float),
bit_cast(unhex('0000000000000080') as double), 3, 'update_negzero');
data branch create table bit_composite_src from bit_composite_base;
data branch create table bit_composite_dst from bit_composite_base;
update bit_composite_src set note = 'updated_f32_nan1'
where serial(f32, f64, tag) = serial(
bit_cast(unhex('0100c07f') as float), 2.0, 1);
update bit_composite_src set note = 'updated_f64_nan1'
where serial(f32, f64, tag) = serial(
3.0, bit_cast(unhex('010000000000f87f') as double), 2);
update bit_composite_src set note = 'updated_negzero'
where serial(f32, f64, tag) = serial(
bit_cast(unhex('00000080') as float),
bit_cast(unhex('0000000000000080') as double), 3);
data branch merge bit_composite_src into bit_composite_dst;
select note, hex(serial(f32)), hex(serial(f64)), tag
from bit_composite_dst order by note;
➤ note[12,-1,0]  ¦  hex(serial(f32))[12,-1,0]  ¦  hex(serial(f64))[12,-1,0]  ¦  tag[4,32,0]  𝄀
keep_f32_nan0  ¦  20FFC00000  ¦  21C000000000000000  ¦  1  𝄀
keep_f64_nan0  ¦  20C0400000  ¦  21FFF8000000000000  ¦  2  𝄀
keep_poszero  ¦  2080000000  ¦  218000000000000000  ¦  3  𝄀
update_f32_nan1  ¦  20FFC00001  ¦  21C000000000000000  ¦  1  𝄀
update_f64_nan1  ¦  20C0400000  ¦  21FFF8000000000001  ¦  2  𝄀
update_negzero  ¦  207FFFFFFF  ¦  217FFFFFFFFFFFFFFF  ¦  3
data branch create table bit_composite_pick_dst from bit_composite_base;
data branch pick bit_composite_src into bit_composite_pick_dst
keys(select f32, f64, tag from bit_composite_src
where note in ('updated_f32_nan1', 'updated_f64_nan1', 'updated_negzero'))
when conflict accept;
select note, hex(serial(f32)), hex(serial(f64)), tag
from bit_composite_pick_dst order by note;
➤ note[12,-1,0]  ¦  hex(serial(f32))[12,-1,0]  ¦  hex(serial(f64))[12,-1,0]  ¦  tag[4,32,0]  𝄀
keep_f32_nan0  ¦  20FFC00000  ¦  21C000000000000000  ¦  1  𝄀
keep_f64_nan0  ¦  20C0400000  ¦  21FFF8000000000000  ¦  2  𝄀
keep_poszero  ¦  2080000000  ¦  218000000000000000  ¦  3  𝄀
update_f32_nan1  ¦  20FFC00001  ¦  21C000000000000000  ¦  1  𝄀
update_f64_nan1  ¦  20C0400000  ¦  21FFF8000000000001  ¦  2  𝄀
update_negzero  ¦  207FFFFFFF  ¦  217FFFFFFFFFFFFFFF  ¦  3
data branch create table bit_portable_src from bit_double_base;
data branch create table bit_portable_dst from bit_double_base;
update bit_portable_src set note = 'nan1_updated'
where serial(k) = serial(bit_cast(unhex('010000000000f87f') as double));
update bit_portable_src set note = 'negzero_updated'
where serial(k) = serial(bit_cast(unhex('0000000000000080') as double));
data branch diff bit_portable_src against bit_portable_dst output file '/tmp/';
➤ FILE SAVED TO[12,0,0]  ¦  HINT[12,0,0]  𝄀
/tmp/diff_bit_portable_src_bit_portable_dst_20260803_132725_357651cf-fbc1-4705-812b-17e7514ce0bf.sql  ¦  DELETE FROM `br_float_special_values`.`bit_portable_dst`, INSERT INTO `br_float_special_values`.`bit_portable_dst`
update bit_portable_dst set note = 'nan1_updated'
where serial(k) = serial(bit_cast(unhex('010000000000f87f') as double)) limit 1;
update bit_portable_dst set note = 'negzero_updated'
where serial(k) = serial(bit_cast(unhex('0000000000000080') as double)) limit 1;
select note, hex(serial(k)) from bit_portable_dst order by note;
➤ note[12,-1,0]  ¦  hex(serial(k))[12,-1,0]  𝄀
nan0  ¦  21FFF8000000000000  𝄀
nan1_updated  ¦  21FFF8000000000001  𝄀
negzero_updated  ¦  217FFFFFFFFFFFFFFF  𝄀
poszero  ¦  218000000000000000
create table bit_missing_zero_base(k double primary key, note varchar(32));
insert into bit_missing_zero_base values(0.0, 'poszero');
insert into bit_missing_zero_base values(
bit_cast(unhex('0000000000000080') as double), 'negzero');
create table bit_missing_nan_base(k double primary key, note varchar(32));
insert into bit_missing_nan_base values(
bit_cast(unhex('000000000000f87f') as double), 'nan0');
insert into bit_missing_nan_base values(
bit_cast(unhex('010000000000f87f') as double), 'nan1');
data branch create table bit_zero_merge_src from bit_missing_zero_base;
data branch create table bit_zero_merge_dst from bit_missing_zero_base;
update bit_zero_merge_src set note = 'negzero_restored'
where serial(k) = serial(bit_cast(unhex('0000000000000080') as double));
delete from bit_zero_merge_dst
where serial(k) = serial(bit_cast(unhex('0000000000000080') as double));
data branch merge bit_zero_merge_src into bit_zero_merge_dst when conflict accept;
select note, hex(serial(k)) from bit_zero_merge_dst order by note;
➤ note[12,-1,0]  ¦  hex(serial(k))[12,-1,0]  𝄀
negzero_restored  ¦  217FFFFFFFFFFFFFFF  𝄀
poszero  ¦  218000000000000000
data branch create table bit_nan_merge_src from bit_missing_nan_base;
data branch create table bit_nan_merge_dst from bit_missing_nan_base;
update bit_nan_merge_src set note = 'nan1_restored'
where serial(k) = serial(bit_cast(unhex('010000000000f87f') as double));
delete from bit_nan_merge_dst
where serial(k) = serial(bit_cast(unhex('010000000000f87f') as double));
data branch merge bit_nan_merge_src into bit_nan_merge_dst when conflict accept;
select note, hex(serial(k)) from bit_nan_merge_dst order by note;
➤ note[12,-1,0]  ¦  hex(serial(k))[12,-1,0]  𝄀
nan0  ¦  21FFF8000000000000  𝄀
nan1_restored  ¦  21FFF8000000000001
data branch create table bit_zero_pick_src from bit_missing_zero_base;
data branch create table bit_zero_pick_dst from bit_missing_zero_base;
update bit_zero_pick_src set note = 'negzero_restored'
where serial(k) = serial(bit_cast(unhex('0000000000000080') as double));
delete from bit_zero_pick_dst
where serial(k) = serial(bit_cast(unhex('0000000000000080') as double));
data branch pick bit_zero_pick_src into bit_zero_pick_dst
keys(select k from bit_zero_pick_src where note = 'negzero_restored')
when conflict accept;
select note, hex(serial(k)) from bit_zero_pick_dst order by note;
➤ note[12,-1,0]  ¦  hex(serial(k))[12,-1,0]  𝄀
negzero_restored  ¦  217FFFFFFFFFFFFFFF  𝄀
poszero  ¦  218000000000000000
data branch create table bit_nan_pick_src from bit_missing_nan_base;
data branch create table bit_nan_pick_dst from bit_missing_nan_base;
update bit_nan_pick_src set note = 'nan1_restored'
where serial(k) = serial(bit_cast(unhex('010000000000f87f') as double));
delete from bit_nan_pick_dst
where serial(k) = serial(bit_cast(unhex('010000000000f87f') as double));
data branch pick bit_nan_pick_src into bit_nan_pick_dst
keys(select k from bit_nan_pick_src where note = 'nan1_restored')
when conflict accept;
select note, hex(serial(k)) from bit_nan_pick_dst order by note;
➤ note[12,-1,0]  ¦  hex(serial(k))[12,-1,0]  𝄀
nan0  ¦  21FFF8000000000000  𝄀
nan1_restored  ¦  21FFF8000000000001
data branch create table bit_zero_portable_src from bit_missing_zero_base;
data branch create table bit_zero_portable_dst from bit_missing_zero_base;
update bit_zero_portable_src set note = 'negzero_restored'
where serial(k) = serial(bit_cast(unhex('0000000000000080') as double));
delete from bit_zero_portable_dst
where serial(k) = serial(bit_cast(unhex('0000000000000080') as double));
data branch diff bit_zero_portable_src against bit_zero_portable_dst output file '/tmp/';
➤ FILE SAVED TO[12,0,0]  ¦  HINT[12,0,0]  𝄀
/tmp/diff_bit_zero_portable_src_bit_zero_portable_dst_20260803_151923_48b7be14-bb7d-48c4-a7c4-98a4aa54ee4d.sql  ¦  DELETE FROM `br_float_special_values`.`bit_zero_portable_dst`, INSERT INTO `br_float_special_values`.`bit_zero_portable_dst`
insert into bit_zero_portable_dst(k, note) values
(bit_cast(unhex('0000000000000080') as double), 'negzero_restored');
select note, hex(serial(k)) from bit_zero_portable_dst order by note;
➤ note[12,-1,0]  ¦  hex(serial(k))[12,-1,0]  𝄀
negzero_restored  ¦  217FFFFFFFFFFFFFFF  𝄀
poszero  ¦  218000000000000000
data branch create table bit_nan_portable_src from bit_missing_nan_base;
data branch create table bit_nan_portable_dst from bit_missing_nan_base;
update bit_nan_portable_src set note = 'nan1_restored'
where serial(k) = serial(bit_cast(unhex('010000000000f87f') as double));
delete from bit_nan_portable_dst
where serial(k) = serial(bit_cast(unhex('010000000000f87f') as double));
data branch diff bit_nan_portable_src against bit_nan_portable_dst output file '/tmp/';
➤ FILE SAVED TO[12,0,0]  ¦  HINT[12,0,0]  𝄀
/tmp/diff_bit_nan_portable_src_bit_nan_portable_dst_20260803_151923_cb57436e-4e70-41fc-980d-2eb94a016f39.sql  ¦  DELETE FROM `br_float_special_values`.`bit_nan_portable_dst`, INSERT INTO `br_float_special_values`.`bit_nan_portable_dst`
insert into bit_nan_portable_dst(k, note) values
(bit_cast(unhex('010000000000f87f') as double), 'nan1_restored');
select note, hex(serial(k)) from bit_nan_portable_dst order by note;
➤ note[12,-1,0]  ¦  hex(serial(k))[12,-1,0]  𝄀
nan0  ¦  21FFF8000000000000  𝄀
nan1_restored  ¦  21FFF8000000000001
create table missing_float_base(k float primary key, note varchar(32));
insert into missing_float_base values
(1.5, 'base'), (9.5, 'keep');
data branch create table missing_float_src from missing_float_base;
data branch create table missing_float_fail_dst from missing_float_base;
data branch create table missing_float_skip_dst from missing_float_base;
data branch create table missing_float_accept_dst from missing_float_base;
update missing_float_src set note = 'source_updated' where k = 1.5;
delete from missing_float_fail_dst where k = 1.5;
delete from missing_float_skip_dst where k = 1.5;
delete from missing_float_accept_dst where k = 1.5;
data branch pick missing_float_src into missing_float_fail_dst
keys(select k from missing_float_src where note = 'source_updated') when conflict fail;
internal error: conflict: missing_float_src INSERT and missing_float_fail_dst INSERT on pk(1.5) with different values
select count(*) from missing_float_fail_dst;
➤ count(*)[-5,64,0]  𝄀
1
data branch pick missing_float_src into missing_float_skip_dst
keys(select k from missing_float_src where note = 'source_updated') when conflict skip;
select count(*) from missing_float_skip_dst;
➤ count(*)[-5,64,0]  𝄀
1
data branch pick missing_float_src into missing_float_accept_dst
keys(select k from missing_float_src where note = 'source_updated') when conflict accept;
select note, hex(serial(k)) from missing_float_accept_dst order by note;
➤ note[12,-1,0]  ¦  hex(serial(k))[12,-1,0]  𝄀
keep  ¦  20C1180000  𝄀
source_updated  ¦  20BFC00000
create table missing_double_base(k double primary key, note varchar(32));
insert into missing_double_base values
(1.5, 'base'), (9.5, 'keep');
data branch create table missing_double_src from missing_double_base;
data branch create table missing_double_fail_dst from missing_double_base;
data branch create table missing_double_skip_dst from missing_double_base;
data branch create table missing_double_accept_dst from missing_double_base;
update missing_double_src set note = 'source_updated' where k = 1.5;
delete from missing_double_fail_dst where k = 1.5;
delete from missing_double_skip_dst where k = 1.5;
delete from missing_double_accept_dst where k = 1.5;
data branch merge missing_double_src into missing_double_fail_dst when conflict fail;
internal error: conflict: missing_double_src DELETE and missing_double_fail_dst DELETE on pk(1.5) with different values
select count(*) from missing_double_fail_dst;
➤ count(*)[-5,64,0]  𝄀
1
data branch merge missing_double_src into missing_double_skip_dst when conflict skip;
select count(*) from missing_double_skip_dst;
➤ count(*)[-5,64,0]  𝄀
1
data branch merge missing_double_src into missing_double_accept_dst when conflict accept;
select note, hex(serial(k)) from missing_double_accept_dst order by note;
➤ note[12,-1,0]  ¦  hex(serial(k))[12,-1,0]  𝄀
keep  ¦  21C023000000000000  𝄀
source_updated  ¦  21BFF8000000000000
create table missing_composite_base(
f32 float,
tag int,
note varchar(32),
primary key(f32, tag)
);
insert into missing_composite_base values
(2.5, 7, 'base'), (9.5, 9, 'keep');
data branch create table missing_composite_src from missing_composite_base;
data branch create table missing_composite_dst from missing_composite_base;
update missing_composite_src set note = 'source_updated' where tag = 7;
delete from missing_composite_dst where tag = 7;
data branch merge missing_composite_src into missing_composite_dst when conflict accept;
select note, hex(serial(f32)), tag from missing_composite_dst order by tag;
➤ note[12,-1,0]  ¦  hex(serial(f32))[12,-1,0]  ¦  tag[4,32,0]  𝄀
source_updated  ¦  20C0200000  ¦  7  𝄀
keep  ¦  20C1180000  ¦  9
create table cross_zero_base(k float primary key, note varchar(32));
insert into cross_zero_base values(0.0, 'poszero');
insert into cross_zero_base values(bit_cast(unhex('00000080') as float), 'negzero');
data branch create table cross_zero_src from cross_zero_base;
data branch create table cross_zero_fail_dst from cross_zero_base;
data branch create table cross_zero_skip_dst from cross_zero_base;
data branch create table cross_zero_accept_dst from cross_zero_base;
update cross_zero_src set note = 'negzero_cross_updated'
where serial(k) = serial(bit_cast(unhex('00000080') as float));
delete from cross_zero_fail_dst
where serial(k) = serial(cast(0.0 as float));
delete from cross_zero_skip_dst
where serial(k) = serial(cast(0.0 as float));
delete from cross_zero_accept_dst
where serial(k) = serial(cast(0.0 as float));
data branch merge cross_zero_src into cross_zero_fail_dst when conflict fail;
select note, hex(serial(k)) from cross_zero_fail_dst order by note;
➤ note[12,-1,0]  ¦  hex(serial(k))[12,-1,0]  𝄀
negzero_cross_updated  ¦  207FFFFFFF
data branch merge cross_zero_src into cross_zero_skip_dst when conflict skip;
select note, hex(serial(k)) from cross_zero_skip_dst order by note;
➤ note[12,-1,0]  ¦  hex(serial(k))[12,-1,0]  𝄀
negzero_cross_updated  ¦  207FFFFFFF
data branch merge cross_zero_src into cross_zero_accept_dst when conflict accept;
select note, hex(serial(k)) from cross_zero_accept_dst order by note;
➤ note[12,-1,0]  ¦  hex(serial(k))[12,-1,0]  𝄀
negzero_cross_updated  ¦  207FFFFFFF
data branch create table cross_nan_src from bit_missing_nan_base;
data branch create table cross_nan_fail_dst from bit_missing_nan_base;
data branch create table cross_nan_skip_dst from bit_missing_nan_base;
data branch create table cross_nan_accept_dst from bit_missing_nan_base;
update cross_nan_src set note = 'nan1_cross_updated'
where serial(k) = serial(bit_cast(unhex('010000000000f87f') as double));
delete from cross_nan_fail_dst
where serial(k) = serial(bit_cast(unhex('000000000000f87f') as double));
delete from cross_nan_skip_dst
where serial(k) = serial(bit_cast(unhex('000000000000f87f') as double));
delete from cross_nan_accept_dst
where serial(k) = serial(bit_cast(unhex('000000000000f87f') as double));
data branch pick cross_nan_src into cross_nan_fail_dst
keys(select k from cross_nan_src where note = 'nan1_cross_updated') when conflict fail;
select note, hex(serial(k)) from cross_nan_fail_dst order by note;
➤ note[12,-1,0]  ¦  hex(serial(k))[12,-1,0]  𝄀
nan1_cross_updated  ¦  21FFF8000000000001
data branch pick cross_nan_src into cross_nan_skip_dst
keys(select k from cross_nan_src where note = 'nan1_cross_updated') when conflict skip;
select note, hex(serial(k)) from cross_nan_skip_dst order by note;
➤ note[12,-1,0]  ¦  hex(serial(k))[12,-1,0]  𝄀
nan1_cross_updated  ¦  21FFF8000000000001
data branch pick cross_nan_src into cross_nan_accept_dst
keys(select k from cross_nan_src where note = 'nan1_cross_updated') when conflict accept;
select note, hex(serial(k)) from cross_nan_accept_dst order by note;
➤ note[12,-1,0]  ¦  hex(serial(k))[12,-1,0]  𝄀
nan1_cross_updated  ¦  21FFF8000000000001
create table cross_composite_base(
k double,
tag int,
note varchar(32),
primary key(k, tag)
);
insert into cross_composite_base values(0.0, 7, 'poszero');
insert into cross_composite_base values(
bit_cast(unhex('0000000000000080') as double), 7, 'negzero');
data branch create table cross_composite_src from cross_composite_base;
data branch create table cross_composite_merge_dst from cross_composite_base;
data branch create table cross_composite_pick_dst from cross_composite_base;
update cross_composite_src set note = 'negzero_cross_updated'
where serial(k) = serial(bit_cast(unhex('0000000000000080') as double));
delete from cross_composite_merge_dst where serial(k) = serial(cast(0.0 as double));
delete from cross_composite_pick_dst where serial(k) = serial(cast(0.0 as double));
data branch merge cross_composite_src into cross_composite_merge_dst when conflict accept;
select note, hex(serial(k)), tag from cross_composite_merge_dst order by note;
➤ note[12,-1,0]  ¦  hex(serial(k))[12,-1,0]  ¦  tag[4,32,0]  𝄀
negzero_cross_updated  ¦  217FFFFFFFFFFFFFFF  ¦  7
data branch pick cross_composite_src into cross_composite_pick_dst
keys(select k, tag from cross_composite_src where note = 'negzero_cross_updated')
when conflict accept;
select note, hex(serial(k)), tag from cross_composite_pick_dst order by note;
➤ note[12,-1,0]  ¦  hex(serial(k))[12,-1,0]  ¦  tag[4,32,0]  𝄀
negzero_cross_updated  ¦  217FFFFFFFFFFFFFFF  ¦  7
create table missing_portable_base(k double primary key, note varchar(32));
insert into missing_portable_base values
(1.5, 'base'), (9.5, 'keep');
data branch create table missing_portable_src from missing_portable_base;
data branch create table missing_portable_dst from missing_portable_base;
update missing_portable_src set note = 'source_updated' where k = 1.5;
delete from missing_portable_dst where k = 1.5;
data branch diff missing_portable_src against missing_portable_dst output file '/tmp/';
➤ FILE SAVED TO[12,0,0]  ¦  HINT[12,0,0]  𝄀
/tmp/diff_missing_portable_src_missing_portable_dst_20260803_132726_1435dfcc-41c4-4f79-80e5-55a523637d81.sql  ¦  DELETE FROM `br_float_special_values`.`missing_portable_dst`, INSERT INTO `br_float_special_values`.`missing_portable_dst`
insert into missing_portable_dst(k, note) values
(cast(1.5 as double), 'source_updated');
select note, hex(serial(k)) from missing_portable_dst order by note;
➤ note[12,-1,0]  ¦  hex(serial(k))[12,-1,0]  𝄀
keep  ¦  21C023000000000000  𝄀
source_updated  ¦  21BFF8000000000000
drop database br_float_special_values;
