drop database if exists br_lca_quoted_pk;
create database br_lca_quoted_pk;
use br_lca_quoted_pk;
create table diff_base(`select` int primary key, payload varchar(20));
insert into diff_base values (1, 'one'), (2, 'two');
data branch create table diff_left from diff_base;
data branch create table diff_right from diff_base;
delete from diff_left where `select` = 1;
update diff_right set payload = 'two-right' where `select` = 2;
data branch diff diff_left against diff_right;
➤ diff diff_left against diff_right[12,0,0]  ¦  flag[12,0,0]  ¦  select[4,32,0]  ¦  payload[12,-1,0]  𝄀
diff_left  ¦  DELETE  ¦  1  ¦  one  𝄀
diff_right  ¦  UPDATE  ¦  2  ¦  two-right
create table composite_base(
`left` int,
`a-b` varchar(10),
payload varchar(20),
primary key(`left`, `a-b`)
);
insert into composite_base values (1, 'x', 'one'), (2, 'y', 'two');
data branch create table composite_left from composite_base;
data branch create table composite_right from composite_base;
delete from composite_left where `left` = 1 and `a-b` = 'x';
update composite_right set payload = 'two-right' where `left` = 2 and `a-b` = 'y';
data branch diff composite_left against composite_right;
➤ diff composite_left against composite_right[12,0,0]  ¦  flag[12,0,0]  ¦  left[4,32,0]  ¦  a-b[12,-1,0]  ¦  payload[12,-1,0]  𝄀
composite_left  ¦  DELETE  ¦  1  ¦  x  ¦  one  𝄀
composite_right  ¦  UPDATE  ¦  2  ¦  y  ¦  two-right
create table merge_base(`select` int primary key, payload varchar(20));
insert into merge_base values (1, 'one'), (2, 'two');
data branch create table merge_src from merge_base;
data branch create table merge_dst from merge_base;
delete from merge_src where `select` = 1;
data branch merge merge_src into merge_dst;
select * from merge_dst order by `select`;
➤ select[4,32,0]  ¦  payload[12,-1,0]  𝄀
2  ¦  two
create table pick_base(`select` int primary key, payload varchar(20));
insert into pick_base values (1, 'one'), (2, 'two');
data branch create table pick_src from pick_base;
data branch create table pick_dst from pick_base;
delete from pick_src where `select` = 1;
data branch pick pick_src into pick_dst keys(1);
select * from pick_dst order by `select`;
➤ select[4,32,0]  ¦  payload[12,-1,0]  𝄀
2  ¦  two
create table idx_base(`__idx_` int primary key, payload varchar(20));
insert into idx_base values (1, 'one'), (2, 'two');
data branch create table idx_left from idx_base;
data branch create table idx_right from idx_base;
delete from idx_left where `__idx_` = 1;
update idx_right set payload = 'two-right' where `__idx_` = 2;
data branch diff idx_left against idx_right;
➤ diff idx_left against idx_right[12,0,0]  ¦  flag[12,0,0]  ¦  __idx_[4,32,0]  ¦  payload[12,-1,0]  𝄀
idx_left  ¦  DELETE  ¦  1  ¦  one  𝄀
idx_right  ¦  UPDATE  ¦  2  ¦  two-right
create table idx_merge_base(`__idx_` int primary key, payload varchar(20));
insert into idx_merge_base values (1, 'one'), (2, 'two');
data branch create table idx_merge_src from idx_merge_base;
data branch create table idx_merge_dst from idx_merge_base;
delete from idx_merge_src where `__idx_` = 1;
data branch merge idx_merge_src into idx_merge_dst;
select * from idx_merge_dst order by `__idx_`;
➤ __idx_[4,32,0]  ¦  payload[12,-1,0]  𝄀
2  ¦  two
create table idx_pick_base(`__idx_` int primary key, payload varchar(20));
insert into idx_pick_base values (1, 'one'), (2, 'two');
data branch create table idx_pick_src from idx_pick_base;
data branch create table idx_pick_dst from idx_pick_base;
delete from idx_pick_src where `__idx_` = 1;
data branch pick idx_pick_src into idx_pick_dst keys(1);
select * from idx_pick_dst order by `__idx_`;
➤ __idx_[4,32,0]  ¦  payload[12,-1,0]  𝄀
2  ¦  two
drop database br_lca_quoted_pk;
