drop database if exists db1;
drop database if exists db2;
create database db1;
create database db2;
use db2;
drop table if exists t1;
create table t1 (a int);
insert into t1 values (1),(2),(4);
use db1;
drop table if exists t2;
create table t2 (b int);
insert into t2 values(1),(2),(3);
delete from db1.t2, db2.t1 using db1.t2 join db2.t1 on db1.t2.b = db2.t1.a where 2 > 1;
select * from db1.t2;
b
3
select * from db2.t1;
a
4
drop table if exists t1;
drop table if exists t2;
drop database if exists db1;
drop database if exists db2;
create database db1;
create database db2;
use db1;
drop table if exists t1;
create table t1 (a char(20));
insert into t1 values ('a'), ('b'), ('c');
use db2;
drop table if exists t2;
create table t2 (b char(20));
insert into t2 values('a'),('b'),('d');
delete from db1.t1, db2.t2 using db1.t1 join db2.t2 on db1.t1.a = db2.t2.b where db1.t1.a = 'a';
select * from db1.t1;
a
b
c
select * from db2.t2;
b
b
d
drop table if exists t1;
drop table if exists t2;
drop database if exists db1;
drop database if exists db2;
create database db1;
use db1;
drop table if exists t1;
drop table if exists t2;
create table t1 (a int);
insert into t1 values(1), (2), (3);
create table t2 (b int);
insert into t2 values(1), (2), (3);
with t11 as ( select * from t1) delete t2 from t11 join t2 on t11.a = t2.b where t2.b = 3;
select * from t2;
b
1
2
drop table if exists t1;
drop table if exists t2;
create table t1 (a int);
insert into t1 values(1), (2), (4);
create table t2 (b int);
insert into t2 values(1), (2), (5);
delete t1 from t1 join t2 where t1.a = 2;
select * from t1;
a
1
4
drop table if exists t1;
create table t1 (a int);
insert into t1 values(1), (2), (3);
delete from t1 as a1 where a1.a = 1;
select * from t1;
a
2
3
drop table if exists t1;
drop table if exists t2;
create table t1 (a int);
insert into t1 values(1), (2), (4);
create table t2 (b int);
insert into t2 values(1), (2), (5);
DELETE a1, a2 FROM t1 AS a1 INNER JOIN t2 AS a2 WHERE a1.a = a2.b;
select * from t1;
a
4
drop table if exists t1;
create table t1 (a char(20));
insert into t1 values (null), (null), ('hello');
delete from t1 where a is null;
select * from t1;
a
hello
drop table if exists t1;
create table t1 (a int, b int);
insert into t1 values (1, 2), (3, 4), (5, 6);
delete from t1 where a > 1;
select * from t1;
a	b
1	2
drop table if exists t2;
create table t2 (a int primary key, b int);
insert into t2 values (1, 2), (3, 4), (5, 6);
delete from t2 where a > 1 order by a limit 1;
select * from t2;
a	b
1	2
5	6
drop table if exists t1;
create table t1(a int primary key);
delete from t1;
select * from t1;
a
drop table if exists t1;
create table t1 (a char(20));
insert into t1 values ('heelo'), ('sub'), ('none'), (null);
delete from t1 where a is not null;
select * from t1;
a
null
drop table if exists t1;
drop table if exists t2;
create table t1 (a int);
insert into t1 values(1), (2), (3);
create table t2 (b int primary key);
insert into t2 values(1), (2), (3);
delete t1, t2 from t1 join t2 on t1.a = t2.b where t1.a = 1;
select * from t2;
b
2
3
drop table if exists t1;
create table t1(a int auto_increment, b bigint auto_increment);
insert into t1 values(null, 2), (3, null), (null, null);
select * from t1;
a    b
1    2
3    3
4    4
insert into t1 values(100, 2), (null, null), (null, null);
select * from t1;
a    b
1    2
3    3
4    4
100    2
101    5
102    6
delete from t1 where a >= 100;
select * from t1;
a    b
1    2
3    3
4    4
insert into t1 values(null, null), (null, null), (null, null);
select * from t1;
a    b
1    2
3    3
4    4
103    7
104    8
105    9
drop table if exists t1;
create table t1(a int, b int, primary key(a, b));
insert into t1 values(1, 2);
insert into t1 values(1, 3);
insert into t1 values(2, 2);
insert into t1 values(2, 3);
select * from t1;
a    b
1    2
1    3
2    2
2    3
delete from t1 where a = 1;
select * from t1;
a    b
2    2
2    3
drop database if exists db1;