drop user if exists user1,user2,user3,user4,user5,user11,user12,testuser,user_grant_1,user_grant_3,user_grant_4,user_grant_5,user_grant_6,user_grant_7,user_grant_8,user_grant_9,user_grant_10,user_prepare_01;
drop role if exists u_role,test_role,grant_role_1,role_sys_priv,role_account_priv_2,role_account_priv_3,role_account_priv_4,role_account_priv_5,role_account_priv_6,role_account_priv_7,role_account_priv_8,role_account_priv_9,role_account_priv_10,role_prepare_1;
drop database if exists grant_db;
drop database if exists testdb;
drop database if exists testdb4;
drop database if exists testdb5;
drop database if exists grant_db4;
drop database if exists grant_db5;
drop account if exists grant_account01;
drop table if exists table_4;
drop table if exists grant_table_10;
drop table if exists grant_table_30;
create account grant_account01 admin_name='admin' identified by '123456';
create database grant_db;
create role test_role;
create database testdb;
create user testuser IDENTIFIED BY '123456';
grant select,insert,update on table testdb.* to test_role with grant option;
select privilege_name,obj_type,privilege_level,with_grant_option from mo_catalog.mo_role_privs where role_name='test_role';
privilege_name    obj_type    privilege_level    with_grant_option
select    table    d.*    true
insert    table    d.*    true
update    table    d.*    true
grant all on account * to test_role;
select privilege_name,obj_type,privilege_level,with_grant_option from mo_catalog.mo_role_privs where role_name='test_role';
privilege_name    obj_type    privilege_level    with_grant_option
select    table    d.*    true
insert    table    d.*    true
update    table    d.*    true
account all    account    *    false
grant OWNERSHIP on database *.* to test_role;
grant OWNERSHIP on table *.* to test_role;
select privilege_name,obj_type,privilege_level,with_grant_option from mo_catalog.mo_role_privs where role_name='test_role';
privilege_name    obj_type    privilege_level    with_grant_option
select    table    d.*    true
insert    table    d.*    true
update    table    d.*    true
account all    account    *    false
database ownership    database    *.*    false
table ownership    table    *.*    false
grant select,insert,update on testdb.* to test_role;
SQL parser error: You have an error in your SQL syntax; check the manual that corresponds to your MatrixOne server version for the right syntax to use. syntax error at line 1 column 36 near " testdb.* to test_role;";
grant select,insert,update on account * to 'test_role';
internal error: the privilege "select" can only be granted to the object type "table"
grant show tables,create,drop,alter on  testdb.* to 'test_role';
SQL parser error: You have an error in your SQL syntax; check the manual that corresponds to your MatrixOne server version for the right syntax to use. syntax error at line 1 column 30 near ",alter on  testdb.* to 'test_role';";
grant show tables,create,drop,alter on  table testdb.* to 'test_role';
SQL parser error: You have an error in your SQL syntax; check the manual that corresponds to your MatrixOne server version for the right syntax to use. syntax error at line 1 column 30 near ",alter on  table testdb.* to 'test_role';";
grant select,insert,create database on table testdb.* to test_role;
internal error: the privilege "create database" can only be granted to the object type "account"
grant select,insert,update on table to 'test_role';
SQL parser error: You have an error in your SQL syntax; check the manual that corresponds to your MatrixOne server version for the right syntax to use. syntax error at line 1 column 38 near " to 'test_role';";
grant select,insert,update on table testdb.* to 'trole';
internal error: there is no role trole
grant select,insert,create database on account * to test_role;
internal error: the privilege "select" can only be granted to the object type "table"
grant select,insert,create database on account *.* to testuser;
internal error: there is no role testuser
grant role_not_exists to dump;
internal error: there is no role role_not_exists
grant moadmin to user_not_exists;
internal error: there is no role or user user_not_exists
create role grant_role_1;
grant  create account, drop account, alter account on *  to 'grant_role_1' with grant option;
SQL parser error: You have an error in your SQL syntax; check the manual that corresponds to your MatrixOne server version for the right syntax to use. syntax error at line 1 column 55 near " *  to 'grant_role_1' with grant option;";
grant grant_role_1 to grant_role_1;
cannot grant role grant_role_1 to grant_role_1
grant show tables,create table,drop table on database * to moadmin;
internal error: the privilege can not be granted to the role moadmin
create user 'user_grant_1' identified by '123456';
create role 'role_sys_priv';
grant  create account, drop account, alter account on account *  to role_sys_priv;
internal error: the privilege create account can not be granted
grant role_sys_priv to user_grant_1;
create account account01 admin_name='admin' identified by '123456';
internal error: do not have privilege to execute the statement
drop account account01 ;
internal error: do not have privilege to execute the statement
create user if not exists user_grant_2 identified by '123456';
create role if not exists 'role_account_priv_1';
grant  create user, drop user, alter user, create role, drop role, create database,drop database,show databases,connect,manage grants on account *  to role_account_priv_1 with grant option;
grant select on table *.* to role_account_priv_1;
grant role_account_priv_1 to user_grant_2;
select user_name,role_name,obj_type,privilege_name,privilege_level from mo_catalog.mo_user_grant,mo_catalog.mo_user,mo_catalog.mo_role_privs where mo_user_grant.user_id=mo_user.user_id and mo_role_privs.role_id=mo_user_grant.role_id and role_name='role_account_priv_1';
user_name    role_name    obj_type    privilege_name    privilege_level
user_grant_2    role_account_priv_1    account    create user    *
user_grant_2    role_account_priv_1    account    drop user    *
user_grant_2    role_account_priv_1    account    alter user    *
user_grant_2    role_account_priv_1    account    create role    *
user_grant_2    role_account_priv_1    account    drop role    *
user_grant_2    role_account_priv_1    account    create database    *
user_grant_2    role_account_priv_1    account    drop database    *
user_grant_2    role_account_priv_1    account    show databases    *
user_grant_2    role_account_priv_1    account    connect    *
user_grant_2    role_account_priv_1    account    manage grants    *
user_grant_2    role_account_priv_1    table    select    *.*
create user user_test_2 identified by '123456';
select user_name,authentication_string from mo_catalog.mo_user where user_name='user_test_2';
user_name    authentication_string
user_test_2    *6BB4837EB74329105EE4568DDA7DC67ED2CA2AD9
create role if not exists role_test_01;
select role_name from mo_catalog.mo_role where role_name='role_test_01';
role_name
role_test_01
grant create user, drop user on account * to role_test_01;
grant insert,select on table *.* to role_test_01;
internal error: do not have privilege to execute the statement
grant role_test_01 to user_test_2;
select user_name,role_name,obj_type,privilege_name,privilege_level from mo_catalog.mo_user_grant,mo_catalog.mo_user,mo_catalog.mo_role_privs where mo_user_grant.user_id=mo_user.user_id and mo_role_privs.role_id=mo_user_grant.role_id and role_name='role_test_01';
user_name    role_name    obj_type    privilege_name    privilege_level
user_test_2    role_test_01    account    create user    *
user_test_2    role_test_01    account    drop user    *
drop role role_test_01;
select role_name from mo_catalog.mo_role where role_name='role_test_01';
role_name
drop user user_test_2;
select user_name,authentication_string from mo_catalog.mo_user where user_name='user_test_2';
user_name    authentication_string
create database db_test_01;
use db_test_01;
drop database db_test_01;
create user 'user_grant_3' identified by '123456';
create role 'role_account_priv_2';
grant  all on account *  to 'role_account_priv_2';
grant role_account_priv_2 to user_grant_3;
select user_name,role_name,obj_type,privilege_name,privilege_level from mo_catalog.mo_user_grant,mo_catalog.mo_user,mo_catalog.mo_role_privs where mo_user_grant.user_id=mo_user.user_id and mo_role_privs.role_id=mo_user_grant.role_id and role_name='role_account_priv_2' with grant option ;
SQL parser error: You have an error in your SQL syntax; check the manual that corresponds to your MatrixOne server version for the right syntax to use. syntax error at line 1 column 273 near " with grant option ;";
create user 'user_test_3' identified by '123456';
create role if not exists role_test_02;
grant all on account * to role_test_02;
internal error: do not have privilege to execute the statement
grant role_test_02 to user_test_3;
drop role role_test_02;
create database db_test_01;
use db_test_01;
drop database db_test_01;
drop user user_test_3;
create user 'user_grant_4' identified by '123456';
create role 'role_account_priv_3';
grant show tables,create table ,drop table,alter table on database grant_db to role_account_priv_3;
grant connect on account * to role_account_priv_3;
grant role_account_priv_3 to user_grant_4;
select user_name,role_name,obj_type,privilege_name,privilege_level from mo_catalog.mo_user_grant,mo_catalog.mo_user,mo_catalog.mo_role_privs where mo_user_grant.user_id=mo_user.user_id and mo_role_privs.role_id=mo_user_grant.role_id and role_name='role_account_priv_3';
user_name    role_name    obj_type    privilege_name    privilege_level
user_grant_4    role_account_priv_3    database    show tables    d
user_grant_4    role_account_priv_3    database    create table    d
user_grant_4    role_account_priv_3    database    drop table    d
user_grant_4    role_account_priv_3    database    alter table    d
user_grant_4    role_account_priv_3    account    connect    *
use grant_db;
show tables;
tables_in_grant_db
create table grant_table_03 (id int,name varchar(50),num double)PARTITION BY KEY(id) PARTITIONS 4;
show create table grant_table_03;
Table    Create Table
grant_table_03    CREATE TABLE `grant_table_03` (\n`id` INT DEFAULT NULL,\n`name` VARCHAR(50) DEFAULT NULL,\n`num` DOUBLE DEFAULT NULL\n) partition by key algorithm = 2 (id) partitions 4
create view grant_v_1 as select * from grant_table_03;
internal error: do not have privilege to execute the statement
drop table grant_table_03;
drop view  grant_v_1;
internal error: do not have privilege to execute the statement
create user 'user_grant_5' identified by '123456';
create role 'role_account_priv_4';
create database grant_db4;
create database grant_db5;
grant all on database grant_db4 to role_account_priv_4;
grant connect on account * to role_account_priv_4;
grant role_account_priv_4 to user_grant_5;
select user_name,role_name,obj_type,privilege_name,privilege_level from mo_catalog.mo_user_grant,mo_catalog.mo_user,mo_catalog.mo_role_privs where mo_user_grant.user_id=mo_user.user_id and mo_role_privs.role_id=mo_user_grant.role_id and role_name='role_account_priv_4';
user_name    role_name    obj_type    privilege_name    privilege_level
user_grant_5    role_account_priv_4    database    database all    d
user_grant_5    role_account_priv_4    account    connect    *
use grant_db4;
show tables;
tables_in_grant_db4
create table grant_table_04 (id int,name varchar(50),num double)PARTITION BY KEY(id) PARTITIONS 4;
show create table grant_table_04;
Table    Create Table
grant_table_04    CREATE TABLE `grant_table_04` (\n`id` INT DEFAULT NULL,\n`name` VARCHAR(50) DEFAULT NULL,\n`num` DOUBLE DEFAULT NULL\n) partition by key algorithm = 2 (id) partitions 4
create view grant_v_2 as select * from grant_table_04;
drop table grant_table_04;
drop view grant_v_2;
use grant_db5;
show tables;
internal error: do not have privilege to execute the statement
create table grant_table_04 (id int,name varchar(50),num double)PARTITION BY KEY(id) PARTITIONS 4;
internal error: do not have privilege to execute the statement
create user 'user_grant_6' identified by '123456';
create role 'role_account_priv_5',role_account_priv_6;
grant ownership on database * to role_account_priv_5;
grant create role,connect on account * to role_account_priv_5;
grant role_account_priv_5 to user_grant_6;
select user_name,role_name,obj_type,privilege_name,privilege_level from mo_catalog.mo_user_grant,mo_catalog.mo_user,mo_catalog.mo_role_privs where mo_user_grant.user_id=mo_user.user_id and mo_role_privs.role_id=mo_user_grant.role_id and role_name='role_account_priv_5';
user_name    role_name    obj_type    privilege_name    privilege_level
user_grant_6    role_account_priv_5    database    database ownership    *
user_grant_6    role_account_priv_5    account    create role    *
user_grant_6    role_account_priv_5    account    connect    *
use grant_db;
show tables;
tables_in_grant_db
create table grant_table_05 (id int,name varchar(50),num double)PARTITION BY KEY(id) PARTITIONS 4;
create role 'role_account_priv_10';
grant create table,drop table on database * to role_account_priv_10;
drop role role_account_priv_6;
create database testdb4;
create database testdb5;
create table testdb4.table_1(id int,name varchar(50),num double);
insert into testdb4.table_1 values (1,'banana',83.98),(2,'apple',0.003);
create table testdb5.table_2(id int,name varchar(50),num double);
insert into testdb5.table_2 values (3,'pear',3.8),(4,'orange',5.03);
create table testdb5.table_3(id int,name varchar(50),num double);
insert into testdb5.table_3 values (5,'aaa',3.8),(6,'bbb',5.03);
create table table_4(id int,name varchar(50),num double);
insert into table_4 values (7,'ccc',1.8),(8,'ddd',5.3);
create user 'user_grant_7' identified by '123456';
create role 'role_account_priv_6';
grant select ,insert ,update on table *.* to role_account_priv_6;
grant role_account_priv_6 to user_grant_7;
select user_name,role_name,obj_type,privilege_name,privilege_level from mo_catalog.mo_user_grant,mo_catalog.mo_user,mo_catalog.mo_role_privs where mo_user_grant.user_id=mo_user.user_id and mo_role_privs.role_id=mo_user_grant.role_id and role_name='role_account_priv_6';
user_name    role_name    obj_type    privilege_name    privilege_level
user_grant_7    role_account_priv_6    table    select    *.*
user_grant_7    role_account_priv_6    table    insert    *.*
user_grant_7    role_account_priv_6    table    update    *.*
select * from testdb5.table_2;
id    name    num
3    pear    3.8
4    orange    5.03
insert into testdb5.table_2 values (9,'',8.00);
select * from testdb5.table_2;
id    name    num
3    pear    3.8
4    orange    5.03
9        8.0
update testdb4.table_1 set name='uuu' where id=2;
select * from testdb4.table_1;
id    name    num
1    banana    83.98
2    uuu    0.003
delete from testdb4.table_1;
internal error: do not have privilege to execute the statement
create user 'user_grant_8' identified by '123456';
create role 'role_account_priv_7';
grant truncate ,delete ,reference ,index on table testdb4.* to role_account_priv_7;
grant role_account_priv_7 to user_grant_8;
select user_name,role_name,obj_type,privilege_name,privilege_level from mo_catalog.mo_user_grant,mo_catalog.mo_user,mo_catalog.mo_role_privs where mo_user_grant.user_id=mo_user.user_id and mo_role_privs.role_id=mo_user_grant.role_id and role_name='role_account_priv_7';
user_name    role_name    obj_type    privilege_name    privilege_level
user_grant_8    role_account_priv_7    table    truncate    d.*
user_grant_8    role_account_priv_7    table    delete    d.*
user_grant_8    role_account_priv_7    table    reference    d.*
user_grant_8    role_account_priv_7    table    index    d.*
delete from testdb4.table_1;
select * from testdb4.table_1;
internal error: do not have privilege to execute the statement
truncate table testdb5.table_2;
internal error: do not have privilege to execute the statement
create user 'user_grant_9' identified by '123456';
create role 'role_account_priv_8';
grant ownership on table testdb5.table_2 to role_account_priv_8;
grant role_account_priv_8 to user_grant_9;
select user_name,role_name,obj_type,privilege_name,privilege_level from mo_catalog.mo_user_grant,mo_catalog.mo_user,mo_catalog.mo_role_privs where mo_user_grant.user_id=mo_user.user_id and mo_role_privs.role_id=mo_user_grant.role_id and role_name='role_account_priv_8';
user_name    role_name    obj_type    privilege_name    privilege_level
user_grant_9    role_account_priv_8    table    table ownership    d.t
select * from testdb4.table_1;
internal error: do not have privilege to execute the statement
delete from testdb4.table_1;
insert into testdb5.table_2 values(20,'yeah',10.20);
internal error: do not have privilege to execute the statement
update testdb5.table_2 set name='bread' where id=20;
internal error: do not have privilege to execute the statement
select * from testdb5.table_2;
internal error: do not have privilege to execute the statement
create user 'user_grant_10' identified by '123456';
create role 'role_account_priv_9';
create table grant_table_10(a int);
grant all on table testdb4.* to role_account_priv_9;
grant role_account_priv_9 to user_grant_10;
select user_name,role_name,obj_type,privilege_name,privilege_level from mo_catalog.mo_user_grant,mo_catalog.mo_user,mo_catalog.mo_role_privs where mo_user_grant.user_id=mo_user.user_id and mo_role_privs.role_id=mo_user_grant.role_id and role_name='role_account_priv_9';
user_name    role_name    obj_type    privilege_name    privilege_level
user_grant_10    role_account_priv_9    table    table all    d.*
insert into testdb4.table_1 values (10,'ccc',1.8),(11,'ddd',5.3);
internal error: do not have privilege to execute the statement
select * from testdb4.table_1;
internal error: do not have privilege to execute the statement
update testdb4.table_1 set name='oppo' where id=10;
internal error: do not have privilege to execute the statement
delete from testdb4.table_1;
select * from testdb4.table_1;
internal error: do not have privilege to execute the statement
delete from testdb5.table_2;
internal error: do not have privilege to execute the statement
show tables;
internal error: do not have privilege to execute the statement
create database ttt;
internal error: do not have privilege to execute the statement
create account `test@123456` ADMIN_NAME 'admin' IDENTIFIED BY '123456';
internal error: do not have privilege to execute the statement
drop table testdb4.table_1;
internal error: do not have privilege to execute the statement
drop role if exists r1,r2,r3,r4,r5,r6,r7,r8,r9,r10;
create role r1,r2,r3,r4,r5,r6,r7,r8,r9,r10;
grant select,insert ,update on table *.* to r1,r2,r3,r4,r5;
select role_name,obj_type,privilege_name,privilege_level from mo_catalog.mo_role_privs where role_name in ('r1','r2','r3','r4','r5');
role_name    obj_type    privilege_name    privilege_level
r1    table    select    *.*
r2    table    select    *.*
r3    table    select    *.*
r4    table    select    *.*
r5    table    select    *.*
r1    table    insert    *.*
r2    table    insert    *.*
r3    table    insert    *.*
r4    table    insert    *.*
r5    table    insert    *.*
r1    table    update    *.*
r2    table    update    *.*
r3    table    update    *.*
r4    table    update    *.*
r5    table    update    *.*
grant create table on database *.* to r1,r2,r3,r4,r5;
select role_name,obj_type,privilege_name,privilege_level from mo_catalog.mo_role_privs where role_name in ('r1','r2','r3','r4','r5') and obj_type="database";
role_name    obj_type    privilege_name    privilege_level
r1    database    create table    *.*
r2    database    create table    *.*
r3    database    create table    *.*
r4    database    create table    *.*
r5    database    create table    *.*
grant create table on database *.* to r1,r2,r15,r4,r5;
internal error: there is no role r15
grant select on database *.* to r1,r2,r3,r4,r5;
internal error: the privilege "select" can only be granted to the object type "table"
create user user1 identified by '12345678',user2 identified by '12345678',user3 identified by '12345678',user4 identified by '12345678',user5 identified by '12345678';
grant r1,r2,r3,r4,r5 to user1,user2,user3,user4,user5;
select count(*) from mo_catalog.mo_user_grant,mo_catalog.mo_user,mo_catalog.mo_role_privs where mo_user_grant.user_id=mo_user.user_id and mo_role_privs.role_id=mo_user_grant.role_id and role_name in ('r1','r2','r3','r4','r5');
count(*)
99
create table grant_table_10(a int);
internal error: do not have privilege to execute the statement
grant create role on account * to r5;
grant r5 to user1,user2,user3,user4,user5;
select user_name,role_name,obj_type,privilege_name,privilege_level from mo_catalog.mo_user_grant,mo_catalog.mo_user,mo_catalog.mo_role_privs where mo_user_grant.user_id=mo_user.user_id and mo_role_privs.role_id=mo_user_grant.role_id and role_name in ('r5');
user_name    role_name    obj_type    privilege_name    privilege_level
user1    r5    table    select    *.*
user1    r5    table    insert    *.*
user1    r5    table    update    *.*
user1    r5    database    create table    *.*
user1    r5    account    create role    *
user2    r5    table    select    *.*
user2    r5    table    insert    *.*
user2    r5    table    update    *.*
user2    r5    database    create table    *.*
user2    r5    account    create role    *
user3    r5    table    select    *.*
user3    r5    table    insert    *.*
user3    r5    table    update    *.*
user3    r5    database    create table    *.*
user3    r5    account    create role    *
user4    r5    table    select    *.*
user4    r5    table    insert    *.*
user4    r5    table    update    *.*
user4    r5    database    create table    *.*
user4    r5    account    create role    *
user5    r5    table    select    *.*
user5    r5    table    insert    *.*
user5    r5    table    update    *.*
user5    r5    database    create table    *.*
user5    r5    account    create role    *
create role test_role;
internal error: do not have privilege to execute the statement
select count(*) from mo_catalog.mo_role where role_name='test_role';
internal error: do not have privilege to execute the statement
create user user11 identified by '12345678';
grant select ,insert ,update on table *.* to r1,r2 with grant option;
grant r1,r2 to r6,r7;
select mr.role_name,mp.role_name,obj_type,privilege_name,privilege_level from mo_catalog.mo_role_grant mg,mo_catalog.mo_role mr ,mo_catalog.mo_role_privs mp where  mg.grantee_id=mr.role_id and mg.granted_id = mp.role_id and mr.role_name in ('r6','r7');
role_name    role_name    obj_type    privilege_name    privilege_level
r6    r1    database    create table    *.*
r7    r1    database    create table    *.*
r6    r2    database    create table    *.*
r7    r2    database    create table    *.*
r6    r1    table    select    *.*
r7    r1    table    select    *.*
r6    r2    table    select    *.*
r7    r2    table    select    *.*
r6    r1    table    insert    *.*
r7    r1    table    insert    *.*
r6    r2    table    insert    *.*
r7    r2    table    insert    *.*
r6    r1    table    update    *.*
r7    r1    table    update    *.*
r6    r2    table    update    *.*
r7    r2    table    update    *.*
create user user12 identified by '12345678';
grant r2 to r8,r9,r10;
select mr.role_name,mp.role_name,obj_type,privilege_name,privilege_level from mo_role_grant mg,mo_role mr ,mo_role_privs mp where  mg.grantee_id=mr.role_id and mg.granted_id = mp.role_id and mr.role_name in ('r8','r9','10');
SQL parser error: table "mo_role_grant" does not exist
grant select ,insert ,update on table *.* to r1,r2 with grant option;
grant select ,insert ,update on table *.* to r1,r2 with grant option;
select role_name,obj_type,privilege_name,privilege_level,with_grant_option from mo_catalog.mo_role_privs where role_name in ('r1','r2');
role_name    obj_type    privilege_name    privilege_level    with_grant_option
r1    database    create table    *.*    false
r2    database    create table    *.*    false
r1    table    select    *.*    true
r2    table    select    *.*    true
r1    table    insert    *.*    true
r2    table    insert    *.*    true
r1    table    update    *.*    true
r2    table    update    *.*    true
grant r1,r2 to user1,user2;
grant r1,r2 to user1,user2;
select user_name,role_name,obj_type,privilege_name,privilege_level from mo_catalog.mo_user_grant,mo_catalog.mo_user,mo_catalog.mo_role_privs where mo_user_grant.user_id=mo_user.user_id and mo_role_privs.role_id=mo_user_grant.role_id and user_name in ('user1','user2') and role_name in ('r1','r2');
user_name    role_name    obj_type    privilege_name    privilege_level
user1    r1    database    create table    *.*
user1    r1    table    select    *.*
user1    r1    table    insert    *.*
user1    r1    table    update    *.*
user2    r1    database    create table    *.*
user2    r1    table    select    *.*
user2    r1    table    insert    *.*
user2    r1    table    update    *.*
user1    r2    database    create table    *.*
user1    r2    table    select    *.*
user1    r2    table    insert    *.*
user1    r2    table    update    *.*
user2    r2    database    create table    *.*
user2    r2    table    select    *.*
user2    r2    table    insert    *.*
user2    r2    table    update    *.*
grant r1,r2 to r6,r7;
grant r1,r2 to r6,r7;
select mr.role_name,mp.role_name,obj_type,privilege_name,privilege_level from mo_catalog.mo_role_grant mg,mo_catalog.mo_role mr ,mo_catalog.mo_role_privs mp where  mg.grantee_id=mr.role_id and mg.granted_id = mp.role_id and mr.role_name in ('r6','r7');
role_name    role_name    obj_type    privilege_name    privilege_level
r6    r1    database    create table    *.*
r7    r1    database    create table    *.*
r6    r2    database    create table    *.*
r7    r2    database    create table    *.*
r6    r1    table    select    *.*
r7    r1    table    select    *.*
r6    r2    table    select    *.*
r7    r2    table    select    *.*
r6    r1    table    insert    *.*
r7    r1    table    insert    *.*
r6    r2    table    insert    *.*
r7    r2    table    insert    *.*
r6    r1    table    update    *.*
r7    r1    table    update    *.*
r6    r2    table    update    *.*
r7    r2    table    update    *.*
drop user if exists user1,user2,user3,user4,user5,user11,user12,testuser,user_grant_1,user_grant_3,user_grant_4,user_grant_5,user_grant_6,user_grant_7,user_grant_8,user_grant_9,user_grant_10,user_prepare_01;
drop role if exists u_role,test_role,grant_role_1,role_sys_priv,role_account_priv_2,role_account_priv_3,role_account_priv_4,role_account_priv_5,role_account_priv_6,role_account_priv_7,role_account_priv_8,role_account_priv_9,role_account_priv_10,role_prepare_1;
drop database if exists grant_db;
drop database if exists testdb;
drop database if exists testdb4;
drop database if exists testdb5;
drop database if exists grant_db4;
drop database if exists grant_db5;
drop account if exists grant_account01;
drop table if exists table_4;
drop table if exists grant_table_10;
drop table if exists grant_table_30;
drop role if exists r1,r2,r3,r4,r5,r6,r7,r8,r9,r10;
