drop account if exists account1;
drop account if exists inner_account;
drop role if exists revoke_role_1;
select user_name,owner from mo_catalog.mo_user where user_name="root";
user_name    owner
root    0
select role_id,role_name,owner from mo_catalog.mo_role where role_name in ("moadmin","public");
role_id    role_name    owner
0    moadmin    0
1    public    0
create account account1 ADMIN_NAME 'admin' IDENTIFIED BY '123456';
select role_id,role_name,owner from mo_catalog.mo_role;
role_id    role_name    owner
2    accountadmin    0
1    public    0
show databases;
Database
mo_catalog
system
system_metrics
information_schema
mysql
update mo_catalog.mo_tables set relname='mo_aaaa';
internal error: do not have privilege to execute the statement
insert into mo_catalog.mo_role values (1763,'apple',0,1,'2022-09-22 06:53:34','');
internal error: do not have privilege to execute the statement
delete from mo_catalog.mo_user;
internal error: do not have privilege to execute the statement
drop table mo_catalog.mo_account;
internal error: do not have privilege to execute the statement
delete from mo_catalog.mo_user_grant;
internal error: do not have privilege to execute the statement
delete from mo_catalog.mo_role_grant;
internal error: do not have privilege to execute the statement
delete from mo_catalog.mo_role_privs;
internal error: do not have privilege to execute the statement
delete from mo_catalog.mo_database;
internal error: do not have privilege to execute the statement
delete from mo_catalog.mo_columns;
internal error: do not have privilege to execute the statement
drop database information_schema;
internal error: do not have privilege to execute the statement
drop database mo_catalog;
internal error: do not have privilege to execute the statement
drop database system;
internal error: do not have privilege to execute the statement
drop database system_metrics;
internal error: do not have privilege to execute the statement
revoke moadmin,public from root;
internal error: the role moadmin can not be revoked
select count(*) from mo_catalog.mo_role_privs where role_name in ('moadmin','public');
count(*)
34
drop role if exists moadmin,public;

select role_name from mo_role where role_name in('moadmin','public');
SQL parser error: table "mo_role" does not exist
drop user if exists admin,root;

create account inner_account ADMIN_NAME 'admin' IDENTIFIED BY '111';
revoke accountadmin from admin;
internal error: the role accountadmin can not be revoked
select count(*) from mo_catalog.mo_role_privs where role_name in ('accountadmin');
count(*)
30
drop role if exists accountadmin;

select role_name from mo_catalog.mo_role where role_name in('accountadmin');
role_name
accountadmin
drop account if exists account1;
drop account if exists inner_account;
drop role if exists revoke_role_1;
