set global enable_privilege_cache = off;
drop account if exists account1;
drop account if exists inner_account;
drop role if exists revoke_role_1;
select user_name,owner from mo_catalog.mo_user where user_name="root";
user_name    owner
root    0
select role_id,role_name,owner from mo_catalog.mo_role where role_name in ("moadmin","public");
role_id    role_name    owner
0    moadmin    0
1    public    0
create account account1 ADMIN_NAME 'admin' IDENTIFIED BY '123456';
select role_id,role_name,owner from mo_catalog.mo_role;
role_id    role_name    owner
2    accountadmin    2
1    public    2
show databases;
Database
system
system_metrics
information_schema
mysql
mo_catalog
show grants;
Grants for admin@localhost
GRANT create user ON account  `admin`@`localhost`
GRANT drop user ON account  `admin`@`localhost`
GRANT alter user ON account  `admin`@`localhost`
GRANT create role ON account  `admin`@`localhost`
GRANT drop role ON account  `admin`@`localhost`
GRANT create database ON account  `admin`@`localhost`
GRANT drop database ON account  `admin`@`localhost`
GRANT show databases ON account  `admin`@`localhost`
GRANT connect ON account  `admin`@`localhost`
GRANT manage grants ON account  `admin`@`localhost`
GRANT account all ON account  `admin`@`localhost`
GRANT show tables ON database * `admin`@`localhost`
GRANT create table ON database * `admin`@`localhost`
GRANT drop table ON database * `admin`@`localhost`
GRANT alter table ON database * `admin`@`localhost`
GRANT create view ON database * `admin`@`localhost`
GRANT drop view ON database * `admin`@`localhost`
GRANT alter view ON database * `admin`@`localhost`
GRANT database all ON database * `admin`@`localhost`
GRANT database ownership ON database * `admin`@`localhost`
GRANT select ON table *.* `admin`@`localhost`
GRANT insert ON table *.* `admin`@`localhost`
GRANT update ON table *.* `admin`@`localhost`
GRANT truncate ON table *.* `admin`@`localhost`
GRANT delete ON table *.* `admin`@`localhost`
GRANT reference ON table *.* `admin`@`localhost`
GRANT index ON table *.* `admin`@`localhost`
GRANT table all ON table *.* `admin`@`localhost`
GRANT table ownership ON table *.* `admin`@`localhost`
GRANT values ON table *.* `admin`@`localhost`
GRANT connect ON account  `admin`@`localhost`
use system;
show triggers;
Trigger    Event    Table    Statement    Timing    Created    sql_mode    Definer    character_set_client    collation_connection    Database Collation
use mo_catalog;
show columns from mo_tables;
Field    Type    Null    Key    Default    Extra    Comment
rel_id    BIGINT UNSIGNED(0)    YES    PRI    null        
relname    VARCHAR(5000)    YES        null        
reldatabase    VARCHAR(5000)    YES        null        
reldatabase_id    BIGINT UNSIGNED(0)    YES        null        
relpersistence    VARCHAR(5000)    YES        null        
relkind    VARCHAR(5000)    YES        null        
rel_comment    VARCHAR(5000)    YES        null        
rel_createsql    TEXT(0)    YES        null        
created_time    TIMESTAMP(0)    YES        null        
creator    INT UNSIGNED(0)    YES        null        
owner    INT UNSIGNED(0)    YES        null        
account_id    INT UNSIGNED(0)    YES        null        
partitioned    TINYINT(0)    YES        null        
partition_info    BLOB(0)    YES        null        
viewdef    VARCHAR(5000)    YES        null        
constraint    VARCHAR(5000)    YES        null        
rel_version    INT UNSIGNED(0)    YES        null
catalog_version    INT UNSIGNED(0)    YES        null
select datname, dat_createsql from mo_database;
datname    dat_createsql
system    create database system
system_metrics    create database system_metrics
information_schema    create database information_schema
mysql    create database mysql
mo_catalog    
select relname from mo_tables where relname="sql_statement_total";
relname
sql_statement_total
select relname from mo_tables where relname="mo_user";
relname
mo_user
select relname from mo_tables where relname="tables";
relname
tables
select user_name,authentication_string from mo_user;
user_name    authentication_string
admin    *6BB4837EB74329105EE4568DDA7DC67ED2CA2AD9
select role_name from mo_role;
role_name
accountadmin
public
create database account_db;
use account_db;
show tables;
Tables_in_account_db
create table a(col int);
show create table a;
Table    Create Table
a    CREATE TABLE `a` (\n`col` INT DEFAULT NULL\n)
show tables;
Tables_in_account_db
a
show databases;
Database
system
system_metrics
information_schema
mysql
mo_catalog
account_db
update mo_catalog.mo_tables set relname='mo_aaaa';
internal error: do not have privilege to execute the statement
insert into mo_catalog.mo_role values (1763,'apple',0,1,'2022-09-22 06:53:34','');
internal error: do not have privilege to execute the statement
delete from mo_catalog.mo_user;
internal error: do not have privilege to execute the statement
drop table mo_catalog.mo_account;
internal error: do not have privilege to execute the statement
delete from mo_catalog.mo_user_grant;
internal error: do not have privilege to execute the statement
delete from mo_catalog.mo_role_grant;
internal error: do not have privilege to execute the statement
delete from mo_catalog.mo_role_privs;
internal error: do not have privilege to execute the statement
delete from mo_catalog.mo_database;
internal error: do not have privilege to execute the statement
delete from mo_catalog.mo_columns;
internal error: do not have privilege to execute the statement
delete from mo_catalog.mo_indexes;
internal error: do not have privilege to execute the statement
drop database information_schema;
internal error: do not have privilege to execute the statement
drop database mo_catalog;
internal error: do not have privilege to execute the statement
drop database system;
internal error: do not have privilege to execute the statement
drop database system_metrics;
internal error: do not have privilege to execute the statement
revoke moadmin,public from root;
internal error: the role moadmin can not be revoked
select count(*) from mo_catalog.mo_role_privs where role_name in ('moadmin','public');
count(*)
34
drop role if exists moadmin,public;
internal error: can not delete the role moadmin
select role_name from mo_role where role_name in('moadmin','public');
SQL parser error: table "mo_role" does not exist
drop user if exists admin,root;
internal error: can not delete the user root
create account inner_account ADMIN_NAME 'admin' IDENTIFIED BY '111';
revoke accountadmin from admin;
internal error: the role accountadmin can not be revoked
select count(*) from mo_catalog.mo_role_privs where role_name in ('accountadmin');
count(*)
30
drop role if exists accountadmin;
internal error: can not delete the role accountadmin
select role_name from mo_catalog.mo_role where role_name in('accountadmin');
role_name
accountadmin
create table tb1(
deptno int unsigned,
dname varchar(15),
loc varchar(50),
unique key(deptno)
);
select `name`,`type`,`name`,`is_visible`,`hidden`,`comment`,`column_name`,`ordinal_position`,`options` from mo_catalog.mo_indexes where table_id = (select rel_id from mo_catalog.mo_tables where relname = 'tb1');
name    type    name    is_visible    hidden    comment    column_name    ordinal_position    options
deptno    UNIQUE    deptno    1    0        deptno    1    null
desc mo_catalog.mo_indexes;
Field    Type    Null    Key    Default    Extra    Comment
id    BIGINT UNSIGNED(64)    NO    PRI    null        
table_id    BIGINT UNSIGNED(64)    NO        null        
database_id    BIGINT UNSIGNED(64)    NO        null        
name    VARCHAR(64)    NO        null        
type    VARCHAR(11)    NO        null        
is_visible    TINYINT(8)    NO        null        
hidden    TINYINT(8)    NO        null        
comment    VARCHAR(2048)    NO        null        
column_name    VARCHAR(256)    NO    PRI    null        
ordinal_position    INT UNSIGNED(32)    NO        null        
options    TEXT(0)    YES        null        
index_table_name    VARCHAR(5000)    YES        null        
create account accx11 ADMIN_NAME 'admin' IDENTIFIED BY '111';
select `name`,`type`,`name`,`is_visible`,`hidden`,`comment`,`column_name`,`ordinal_position`,`options` from mo_catalog.mo_indexes where table_id = (select rel_id from mo_catalog.mo_tables where relname = 'tb1');
name    type    name    is_visible    hidden    comment    column_name    ordinal_position    options
desc mo_catalog.mo_indexes;
Field    Type    Null    Key    Default    Extra    Comment
id    BIGINT UNSIGNED(64)    NO    PRI    null        
table_id    BIGINT UNSIGNED(64)    NO        null        
database_id    BIGINT UNSIGNED(64)    NO        null        
name    VARCHAR(64)    NO        null        
type    VARCHAR(11)    NO        null        
is_visible    TINYINT(8)    NO        null        
hidden    TINYINT(8)    NO        null        
comment    VARCHAR(2048)    NO        null        
column_name    VARCHAR(256)    NO    PRI    null        
ordinal_position    INT UNSIGNED(32)    NO        null        
options    TEXT(0)    YES        null        
index_table_name    VARCHAR(5000)    YES        null        
drop account if exists account1;
drop account if exists inner_account;
drop account if exists accx11;
drop role if exists revoke_role_1;
set global enable_privilege_cache = on;
desc mo_catalog.mo_stages;
Field    Type    Null    Key    Default    Extra    Comment
stage_id    INT UNSIGNED(32)    NO    PRI    null
stage_name    VARCHAR(64)    YES        null
url    TEXT(0)    YES        null
credentials    TEXT(0)    YES        null
stage_status    VARCHAR(64)    YES        null
created_time    TIMESTAMP(0)    YES        null
comment    TEXT(0)    YES        null