drop database if exists db1;
drop database if exists db2;
create database db1;
create database db2;
use db2;
drop table if exists t1;
create table t1 (a int);
insert into t1 values (1),(2),(4);
use db1;
drop table if exists t2;
create table t2 (b int);
insert into t2 values(1),(2),(3);
delete from db1.t2, db2.t1 using db1.t2 join db2.t1 on db1.t2.b = db2.t1.a where 2 > 1;
select * from db1.t2;
➤ b[4,32,0]  𝄀
3
select * from db2.t1;
➤ a[4,32,0]  𝄀
4
drop table if exists t1;
drop table if exists t2;
drop database if exists db1;
drop database if exists db2;
create database db1;
create database db2;
use db1;
drop table if exists t1;
create table t1 (a char(20));
insert into t1 values ('a'), ('b'), ('c');
use db2;
drop table if exists t2;
create table t2 (b char(20));
insert into t2 values('a'),('b'),('d');
delete from db1.t1, db2.t2 using db1.t1 join db2.t2 on db1.t1.a = db2.t2.b where db1.t1.a = 'a';
select * from db1.t1;
➤ a[1,20,0]  𝄀
b  𝄀
c
select * from db2.t2;
➤ b[1,20,0]  𝄀
b  𝄀
d
drop table if exists t1;
drop table if exists t2;
drop database if exists db1;
drop database if exists db2;
create database db1;
use db1;
drop table if exists t1;
drop table if exists t2;
create table t1 (a int);
insert into t1 values(1), (2), (3);
create table t2 (b int);
insert into t2 values(1), (2), (3);
with t11 as ( select * from t1) delete t2 from t11 join t2 on t11.a = t2.b where t2.b = 3;
select * from t2;
➤ b[4,32,0]  𝄀
1  𝄀
2
drop table if exists t1;
drop table if exists t2;
create table t1 (a int);
insert into t1 values(1), (2), (4);
create table t2 (b int);
insert into t2 values(1), (2), (5);
delete t1 from t1 join t2 where t1.a = 2;
select * from t1;
➤ a[4,32,0]  𝄀
1  𝄀
4
drop table if exists t1;
create table t1 (a int);
insert into t1 values(1), (2), (3);
delete from t1 as a1 where a1.a = 1;
select * from t1;
➤ a[4,32,0]  𝄀
2  𝄀
3
drop table if exists t1;
drop table if exists t2;
create table t1 (a int);
insert into t1 values(1), (2), (4);
create table t2 (b int);
insert into t2 values(1), (2), (5);
DELETE a1, a2 FROM t1 AS a1 INNER JOIN t2 AS a2 WHERE a1.a = a2.b;
select * from t1;
➤ a[4,32,0]  𝄀
4
drop table if exists t1;
create table t1 (a int, b float, c varchar);
insert into t1 values(1, 1.5, 'a');
insert into t1 values(1, 1.5, 'b');
delete from t1 where (a, b) in ((1, 1.5));
select * from t1;
➤ a[4,32,0]  ¦  b[7,24,0]  ¦  c[12,-1,0]
insert into t1 values(2, 2.5, 'a');
insert into t1 values(2, 2.5, 'b');
delete from t1 where (a, b) in ((2.0, 2.5), (2.1, 2.5));
select * from t1;
➤ a[4,32,0]  ¦  b[7,24,0]  ¦  c[12,-1,0]
drop table if exists t1;
create table t1 (a char(20));
insert into t1 values (null), (null), ('hello');
delete from t1 where a is null;
select * from t1;
➤ a[1,20,0]  𝄀
hello
drop table if exists t1;
create table t1 (a int, b int);
insert into t1 values (1, 2), (3, 4), (5, 6);
delete from t1 where a > 1;
select * from t1;
➤ a[4,32,0]  ¦  b[4,32,0]  𝄀
1  ¦  2
drop table if exists t2;
create table t2 (a int primary key, b int);
insert into t2 values (1, 2), (3, 4), (5, 6);
delete from t2 where a > 1 order by a limit 1;
select * from t2;
➤ a[4,32,0]  ¦  b[4,32,0]  𝄀
1  ¦  2  𝄀
5  ¦  6
drop table if exists t1;
create table t1(a int primary key);
delete from t1;
select * from t1;
➤ a[4,32,0]
select count(*) from t1;
➤ count(*)[-5,64,0]  𝄀
0
drop table if exists t1;
create table t1 (a char(20));
insert into t1 values ('heelo'), ('sub'), ('none'), (null);
delete from t1 where a is not null;
select * from t1;
➤ a[1,20,0]  𝄀
null
drop table if exists t1;
drop table if exists t2;
create table t1 (a int);
insert into t1 values(1), (2), (3);
create table t2 (b int primary key);
insert into t2 values(1), (2), (3);
delete t1, t2 from t1 join t2 on t1.a = t2.b where t1.a = 1;
select * from t2;
➤ b[4,32,0]  𝄀
2  𝄀
3
drop table if exists t1;
create table t1(a int auto_increment, b bigint auto_increment);
insert into t1 values(null, 2), (3, null), (null, null);
select * from t1;
➤ a[4,32,0]  ¦  b[-5,64,0]  𝄀
1  ¦  2  𝄀
3  ¦  3  𝄀
4  ¦  4
insert into t1 values(100, 2), (null, null), (null, null);
select * from t1;
➤ a[4,32,0]  ¦  b[-5,64,0]  𝄀
1  ¦  2  𝄀
3  ¦  3  𝄀
4  ¦  4  𝄀
100  ¦  2  𝄀
101  ¦  5  𝄀
102  ¦  6
delete from t1 where a >= 100;
select * from t1;
➤ a[4,32,0]  ¦  b[-5,64,0]  𝄀
1  ¦  2  𝄀
3  ¦  3  𝄀
4  ¦  4
insert into t1 values(null, null), (null, null), (null, null);
select * from t1;
➤ a[4,32,0]  ¦  b[-5,64,0]  𝄀
1  ¦  2  𝄀
3  ¦  3  𝄀
4  ¦  4  𝄀
103  ¦  7  𝄀
104  ¦  8  𝄀
105  ¦  9
drop table if exists t1;
create table t1(a int, b int, primary key(a, b));
insert into t1 values(1, 2);
insert into t1 values(1, 3);
insert into t1 values(2, 2);
insert into t1 values(2, 3);
select * from t1;
➤ a[4,32,0]  ¦  b[4,32,0]  𝄀
1  ¦  2  𝄀
1  ¦  3  𝄀
2  ¦  2  𝄀
2  ¦  3
delete from t1 where a = 1;
select * from t1;
➤ a[4,32,0]  ¦  b[4,32,0]  𝄀
2  ¦  2  𝄀
2  ¦  3
drop table if exists t1;
[unknown result because it is related to issue#5790]
create table t1(a int, b int, unique key(a));
[unknown result because it is related to issue#5790]
insert into t1 values(1, 1);
[unknown result because it is related to issue#5790]
insert into t1 values(2, 2);
[unknown result because it is related to issue#5790]
insert into t1 values(3, 3);
[unknown result because it is related to issue#5790]
insert into t1 values(4, 4);
[unknown result because it is related to issue#5790]
select * from t1;
[unknown result because it is related to issue#5790]
delete from t1 where a = 1;
[unknown result because it is related to issue#5790]
select * from t1;
[unknown result because it is related to issue#5790]
insert into t1 values(1, 2);
[unknown result because it is related to issue#5790]
drop table if exists t1;
[unknown result because it is related to issue#5790]
create table t1(a int, b int, unique key(a, b));
[unknown result because it is related to issue#5790]
insert into t1 values(1, 2);
[unknown result because it is related to issue#5790]
insert into t1 values(1, 3);
[unknown result because it is related to issue#5790]
insert into t1 values(2, 2);
[unknown result because it is related to issue#5790]
insert into t1 values(2, 3);
[unknown result because it is related to issue#5790]
select * from t1;
[unknown result because it is related to issue#5790]
delete from t1 where a = 1;
[unknown result because it is related to issue#5790]
select * from t1;
[unknown result because it is related to issue#5790]
insert into t1 values(1, 2);
[unknown result because it is related to issue#5790]
insert into t1 values(1, null);
[unknown result because it is related to issue#5790]
delete from t1 where a = 1;
[unknown result because it is related to issue#5790]
drop database if exists db1;
use `delete`;
create table temp(a int);
insert into temp select * from generate_series(1,8192) g;
create table t(a int);
insert into t select * from temp;
insert into t select * from t;
insert into t select * from t;
insert into t select * from t;
insert into t select * from t;
insert into t select * from t;
insert into t select * from t;
insert into t select * from t;
insert into t select * from t;
insert into t select * from t;
[unknown result because it is related to issue#9447]
begin;
[unknown result because it is related to issue#9447]
insert into t select * from t;
[unknown result because it is related to issue#9447]
delete from t where a = 1;
[unknown result because it is related to issue#9447]
select count(*) from t;
[unknown result because it is related to issue#9447]
rollback;
[unknown result because it is related to issue#9447]
begin;
[unknown result because it is related to issue#9447]
insert into t select * from t;
[unknown result because it is related to issue#9447]
delete from t where a = 1;
[unknown result because it is related to issue#9447]
select count(*) from t;
[unknown result because it is related to issue#9447]
commit;
[unknown result because it is related to issue#9447]
select count(*) from t;
[unknown result because it is related to issue#9447]
drop table if exists temp;
drop table if exists t;
create table temp(a int);
insert into temp select * from generate_series(1,8192) g;
create table t(a int);
insert into t select * from temp;
insert into t select * from t;
select count(*) from t;
➤ count(*)[-5,64,0]  𝄀
16384
begin;
insert into t select * from t;
select count(*) from t;
➤ count(*)[-5,64,0]  𝄀
32768
delete from t where a > 1;
select count(*) from t;
➤ count(*)[-5,64,0]  𝄀
4
rollback;
select count(*) from t;
➤ count(*)[-5,64,0]  𝄀
16384
begin;
insert into t select * from t;
select count(*) from t;
➤ count(*)[-5,64,0]  𝄀
32768
delete from t where a > 1;
select count(*) from t;
➤ count(*)[-5,64,0]  𝄀
4
delete from t where a = 1;
select count(*) from t;
➤ count(*)[-5,64,0]  𝄀
0
commit;
select count(*) from t;
➤ count(*)[-5,64,0]  𝄀
0
drop table if exists t2;
create table t2 (a int, b int unique key, c int, d int, primary key(c,d));
insert into t2 values (1,2,1,2);
delete from t2 where b in (c in (select 1) and d in (select 1));
select * from t2;
➤ a[4,32,0]  ¦  b[4,32,0]  ¦  c[4,32,0]  ¦  d[4,32,0]  𝄀
1  ¦  2  ¦  1  ¦  2
drop table if exists t7;
create table t7(a int primary key, b int unique key, c varchar(20) unique key);
insert into t7 select result, result, "a"||result from generate_series(1,20000) g;
select count(*) from t7;
➤ count(*)[-5,64,0]  𝄀
20000
delete from t7 where a <= 2000;
select count(*) from t7;
➤ count(*)[-5,64,0]  𝄀
18000
delete from t7 where a <= 10000;
select count(*) from t7;
➤ count(*)[-5,64,0]  𝄀
10000
delete from t7 where a <= 18000;
select count(*) from t7;
➤ count(*)[-5,64,0]  𝄀
2000
delete from t7;
select count(*) from t7;
➤ count(*)[-5,64,0]  𝄀
0
explain analyze select count(*) from t7;
-- @regex("(?s)Table Scan.*Aggregate Functions: starcount\(1\)", true)
➤ tp query plan[12,-1,0]  𝄀
Project  𝄀
  Analyze: timeConsumed=0ms waitTime=0ms inputRows=1 outputRows=1 (min=1, max=1) InputSize=8 bytes OutputSize=8 bytes ReadSize=0 bytes|0 bytes|0 bytes MemorySize=8 bytes (min=8 bytes, max=8 bytes)  𝄀
  ->  Aggregate  𝄀
        Analyze: timeConsumed=0ms waitTime=0ms inputRows=1 outputRows=1 (min=1, max=1) InputSize=0 bytes OutputSize=8 bytes ReadSize=0 bytes|0 bytes|0 bytes MemorySize=0 bytes (min=0 bytes, max=0 bytes)  𝄀
        Aggregate Functions: starcount(1)  𝄀
        ->  Table Scan on delete.t7  𝄀
              Analyze: timeConsumed=0ms waitTime=0ms inputBlocks=0 inputRows=0 outputRows=0 (min=0, max=0) InputSize=0 bytes OutputSize=0 bytes ReadSize=0 bytes|0 bytes|0 bytes MemorySize=0 bytes (min=0 bytes, max=0 bytes)  𝄀
              Aggregate Functions: starcount(1)
drop database if exists `delete`;
drop database if exists db1;
drop database if exists db2;
create database db1;
create database db2;
use db2;
drop table if exists t1;
create table t1 (a int);
insert into t1 values (1),(2),(4);
use db1;
drop table if exists t2;
create table t2 (b int);
insert into t2 values(1),(2),(3);
delete from db1.t2, db2.t1 using db1.t2 join db2.t1 on db1.t2.b = db2.t1.a;
select * from db1.t2;
➤ b[4,32,0]  𝄀
3
select * from db2.t1;
➤ a[4,32,0]  𝄀
4
drop table if exists t3;
create table t3 (a int primary key, b int unique key, c int, key(c));
insert into t3 (a, b, c) values (1, 100, 1000);
insert into t3 (a, b, c) values (2, 200, 2000);
insert into t3 (a, b, c) values (3, 300, 3000);
insert into t3 (a, b, c) values (4, 400, 4000);
delete from t3 where a > 3;
select * from t3;
➤ a[4,32,0]  ¦  b[4,32,0]  ¦  c[4,32,0]  𝄀
1  ¦  100  ¦  1000  𝄀
2  ¦  200  ¦  2000  𝄀
3  ¦  300  ¦  3000
delete from t3 limit 1;
select * from t3;
➤ a[4,32,0]  ¦  b[4,32,0]  ¦  c[4,32,0]  𝄀
2  ¦  200  ¦  2000  𝄀
3  ¦  300  ¦  3000
delete from t3;
select * from t3;
➤ a[4,32,0]  ¦  b[4,32,0]  ¦  c[4,32,0]
drop table if exists t4;
create table t4 (a int, b int, c int);
insert into t4 (a, b, c) values (1, 100, 1000);
insert into t4 (a, b, c) values (2, 200, 2000);
insert into t4 (a, b, c) values (3, 300, 3000);
insert into t4 (a, b, c) values (4, 400, 4000);
delete from t4 where a > 3;
select * from t4;
➤ a[4,32,0]  ¦  b[4,32,0]  ¦  c[4,32,0]  𝄀
1  ¦  100  ¦  1000  𝄀
2  ¦  200  ¦  2000  𝄀
3  ¦  300  ¦  3000
delete from t4 limit 1;
select * from t4;
➤ a[4,32,0]  ¦  b[4,32,0]  ¦  c[4,32,0]  𝄀
2  ¦  200  ¦  2000  𝄀
3  ¦  300  ¦  3000
delete from t4;
select * from t4;
➤ a[4,32,0]  ¦  b[4,32,0]  ¦  c[4,32,0]
create table t5 (id int primary key, c int);
create table t6 (id int primary key, t5_id int, foreign KEY (t5_id) references t5(id) on delete cascade);
insert into t5 (id, c) values (1, 100);
insert into t5 (id, c) values (2, 200);
insert into t5 (id, c) values (3, 300);
insert into t5 (id, c) values (4, 400);
insert into t6 (id, t5_id) values (4, 1);
insert into t6 (id, t5_id) values (5, 2);
insert into t6 (id, t5_id) values (6, 3);
insert into t6 (id, t5_id) values (7, 4);
delete from t5 where id > 3;
select * from t6;
➤ id[4,32,0]  ¦  t5_id[4,32,0]  𝄀
4  ¦  1  𝄀
5  ¦  2  𝄀
6  ¦  3
delete from t5 limit 1;
select * from t6;
➤ id[4,32,0]  ¦  t5_id[4,32,0]  𝄀
5  ¦  2  𝄀
6  ¦  3
delete from t5;
select * from t6;
➤ id[4,32,0]  ¦  t5_id[4,32,0]
drop table if exists t6;
drop table if exists t5;
create table t5 (id int primary key, c int);
create table t6 (id int primary key, t5_id int, foreign KEY (t5_id) references t5(id) on delete set null);
insert into t5 (id, c) values (1, 100);
insert into t5 (id, c) values (2, 200);
insert into t5 (id, c) values (3, 300);
insert into t5 (id, c) values (4, 400);
insert into t6 (id, t5_id) values (4, 1);
insert into t6 (id, t5_id) values (5, 2);
insert into t6 (id, t5_id) values (6, 3);
insert into t6 (id, t5_id) values (7, 4);
delete from t5 where id > 3;
select * from t6;
➤ id[4,32,0]  ¦  t5_id[4,32,0]  𝄀
4  ¦  1  𝄀
5  ¦  2  𝄀
6  ¦  3  𝄀
7  ¦  null
delete from t5 limit 1;
select * from t6;
➤ id[4,32,0]  ¦  t5_id[4,32,0]  𝄀
5  ¦  2  𝄀
6  ¦  3  𝄀
7  ¦  null  𝄀
4  ¦  null
delete from t5;
select * from t6;
➤ id[4,32,0]  ¦  t5_id[4,32,0]  𝄀
7  ¦  null  𝄀
4  ¦  null  𝄀
5  ¦  null  𝄀
6  ¦  null
drop table if exists t1;
create table t1(c1 int primary key, c2 int, c3 int, key(c2));
insert into t1 select *,*,* from generate_series(1,100000)g;
select count(*) from t1;
➤ count(*)[-5,64,0]  𝄀
100000
delete from t1 where c3>50000;
select count(*) from t1;
➤ count(*)[-5,64,0]  𝄀
50000
update t1 set c1=c1+100000, c2=c2+100000 where c3<40000;
delete from t1 where c1>100000;
select count(*) from t1;
➤ count(*)[-5,64,0]  𝄀
10001
DROP TABLE IF EXISTS `t3`;
CREATE TABLE t3 ( id INT PRIMARY KEY,col1 INT,key idx_col1 (col1));
INSERT INTO t3 (SELECT *,1 FROM generate_series(0,8192,1)g);
DELETE FROM t3 WHERE col1=1;
SELECT COUNT(*) FROM t3 WHERE col1=1;
➤ COUNT(*)[-5,64,0]  𝄀
0
drop table if exists t1;
drop table if exists t2;
drop table if exists t3;
drop table if exists t4;
drop table if exists t6;
drop table if exists t5;
drop table if exists t7;
create table t7 (i int, j int);
insert into t7 values(1,1),(2,2),(3,3);
insert into t7 select * from t7;
insert into t7 select * from t7;
insert into t7 select * from t7;
insert into t7 select * from t7;
insert into t7 select * from t7;
insert into t7 select * from t7;
insert into t7 select * from t7;
insert into t7 select * from t7;
insert into t7 select * from t7;
insert into t7 select * from t7;
insert into t7 select * from t7;
insert into t7 select * from t7;
insert into t7 select * from t7;
insert into t7 select * from t7;
select count(*) from t7;
➤ count(*)[-5,64,0]  𝄀
49152
delete from t7 where i=1;
select count(*) from t7 where i=1;
➤ count(*)[-5,64,0]  𝄀
0
delete from t7 where i=2;
select count(*) from t7 where i=2;
➤ count(*)[-5,64,0]  𝄀
0
drop table if exists t7;
use db1;
drop table if exists repro_delete_error;
create table repro_delete_error(a int primary key);
begin;
insert into repro_delete_error values (1),(2),(3);
delete from repro_delete_error where a=1;
select * from repro_delete_error;
➤ a[4,32,0]  𝄀
2  𝄀
3
commit;
select * from repro_delete_error;
➤ a[4,32,0]  𝄀
2  𝄀
3
select count(*) from repro_delete_error;
➤ count(*)[-5,64,0]  𝄀
2
drop database if exists db1;
drop database if exists db2;
