drop database if exists test_db1;
create database test_db1;
use test_db1;
drop table if exists t1;
create cluster table t1(a int, b int);
internal error: do not have privilege to execute the statement
drop database test_db1;
use mo_task;
drop table if exists t2;
internal error: do not have privilege to execute the statement
create cluster table t2(a int, b int);
internal error: do not have privilege to execute the statement
use information_schema;
drop table if exists t3;
internal error: do not have privilege to execute the statement
create cluster table t3(a int, b int);
internal error: do not have privilege to execute the statement
desc t3;
no such table information_schema.t3
drop table t3;
internal error: do not have privilege to execute the statement
use mysql;
drop table if exists t4;
internal error: do not have privilege to execute the statement
create cluster table t4(a int, b int);
internal error: do not have privilege to execute the statement
desc t4;
no such table mysql.t4
drop table t4;
internal error: do not have privilege to execute the statement
use system_metrics;
drop table if exists t5;
internal error: do not have privilege to execute the statement
create cluster table t5(a int, b int);
internal error: do not have privilege to execute the statement
desc t5;
no such table system_metrics.t5
drop table t5;
internal error: do not have privilege to execute the statement
use system;
drop table if exists t6;
internal error: do not have privilege to execute the statement
create cluster table t6(a int, b int);
internal error: do not have privilege to execute the statement
desc t6;
no such table system.t6
drop table t6;
internal error: do not have privilege to execute the statement
use mo_catalog;
drop table if exists t7;
create cluster table t7(a int, b int);
desc t7;
Field    Type    Null    Key    Default    Extra    Comment
a    INT(32)    YES        null
b    INT(32)    YES        null
account_id    INT UNSIGNED(32)    NO        null        the account_id added by the mo
drop table t7;
use mo_catalog;
drop table if exists cluster_table_1;
create cluster table cluster_table_1(a int, b int);
drop account if exists test_account1;
create account test_account1 admin_name = 'test_user' identified by '111';
drop account if exists test_account2;
create account test_account2 admin_name = 'test_user' identified by '111';
insert into cluster_table_1 values(0,0,0),(1,1,0);
insert into cluster_table_1 values(0,0,1),(1,1,1);
insert into cluster_table_1 values(0,0,2),(1,1,2);
update cluster_table_1 set account_id=(select account_id from mo_account where account_name="test_account1") where account_id=1;
update cluster_table_1 set account_id=(select account_id from mo_account where account_name="test_account2") where account_id=2;
select a,b from cluster_table_1;
a    b
0    0
1    1
0    0
1    1
0    0
1    1
use mo_catalog;
select * from cluster_table_1;
a    b
0    0
1    1
use mo_catalog;
select * from cluster_table_1;
a    b
0    0
1    1
insert into cluster_table_1 values(200,200, 0);
insert into cluster_table_1 values(100,100, 0);
insert into cluster_table_1 values(50,50, 0);
select a,b from cluster_table_1;
a    b
0    0
1    1
0    0
1    1
0    0
1    1
200    200
100    100
50    50
use mo_catalog;
select * from cluster_table_1;
a    b
0    0
1    1
use mo_catalog;
select * from cluster_table_1;
a    b
0    0
1    1
drop table cluster_table_1;
drop table if exists cluster_table_2;
create cluster table cluster_table_2(
col1 int,
col2 float,
col3 decimal,
col4 date,
col5 bool,
col6 json,
col7 blob,
col8 text,
col9 varchar
);
load data infile '$resources/load_data/cluster_table.csv' into table cluster_table_2;
update cluster_table_2 set account_id=(select account_id from mo_account where account_name="test_account1") where account_id=1;
update cluster_table_2 set account_id=(select account_id from mo_account where account_name="test_account2") where account_id=2;
select col1,col2,col3,col4,col5,col6,col7,col8,col9 from cluster_table_2;
col1    col2    col3    col4    col5    col6    col7    col8    col9
1    1.09    1    2022-10-02    false    {"a": 1}    ä½ å¥½    text    varchar
2    10.9    13    2022-10-02    true    {"b": 2}    nihao    文本    字符
1    1.09    1    2022-10-02    false    {"a": 1}    ä½ å¥½    text    varchar
2    10.9    13    2022-10-02    true    {"b": 2}    nihao    文本    字符
1    1.09    1    2022-10-02    false    {"a": 1}    ä½ å¥½    text    varchar
2    10.9    13    2022-10-02    true    {"b": 2}    nihao    文本    字符
use mo_catalog;
select * from cluster_table_2;
col1    col2    col3    col4    col5    col6    col7    col8    col9
1    1.09    1    2022-10-02    false    {"a": 1}    ä½ å¥½    text    varchar
2    10.9    13    2022-10-02    true    {"b": 2}    nihao    文本    字符
use mo_catalog;
select * from cluster_table_2;
col1    col2    col3    col4    col5    col6    col7    col8    col9
1    1.09    1    2022-10-02    false    {"a": 1}    ä½ å¥½    text    varchar
2    10.9    13    2022-10-02    true    {"b": 2}    nihao    文本    字符
drop table cluster_table_2;
drop table if exists cluster_table_3;
create cluster table cluster_table_3(
col1 int,
col2 float,
col3 decimal,
col4 date,
col5 bool,
col6 json,
col7 blob,
col8 text,
col9 varchar
);
insert into cluster_table_3 values (1,1.09,1.345,"2022-10-02",0,'{"a":1}',"你好","text","varchar", 0);
insert into cluster_table_3 values (1,1.09,1.345,"2022-10-02",0,'{"a":1}',"你好","text","varchar", 1);
insert into cluster_table_3 values (1,1.09,1.345,"2022-10-02",0,'{"a":1}',"你好","text","varchar", 2);
insert into cluster_table_3 values (2,10.9,13.45,"2022-10-02",1,'{"b":2}',"nihao","文本","字符", 0);
insert into cluster_table_3 values (2,10.9,13.45,"2022-10-02",1,'{"b":2}',"nihao","文本","字符", 1);
insert into cluster_table_3 values (2,10.9,13.45,"2022-10-02",1,'{"b":2}',"nihao","文本","字符", 2);
update cluster_table_3 set account_id=(select account_id from mo_account where account_name="test_account1") where account_id=1;
update cluster_table_3 set account_id=(select account_id from mo_account where account_name="test_account2") where account_id=2;
select col1,col2,col3,col4,col5,col6,col7,col8,col9 from cluster_table_3;
col1    col2    col3    col4    col5    col6    col7    col8    col9
1    1.09    1    2022-10-02    false    {"a": 1}    ä½ å¥½    text    varchar
1    1.09    1    2022-10-02    false    {"a": 1}    ä½ å¥½    text    varchar
1    1.09    1    2022-10-02    false    {"a": 1}    ä½ å¥½    text    varchar
2    10.9    13    2022-10-02    true    {"b": 2}    nihao    文本    字符
2    10.9    13    2022-10-02    true    {"b": 2}    nihao    文本    字符
2    10.9    13    2022-10-02    true    {"b": 2}    nihao    文本    字符
update cluster_table_3 set col1=100 where account_id=0 and col1=1;
select col1,col2,col3,col4,col5,col6,col7,col8,col9 from cluster_table_3;
col1    col2    col3    col4    col5    col6    col7    col8    col9
1    1.09    1    2022-10-02    false    {"a": 1}    ä½ å¥½    text    varchar
1    1.09    1    2022-10-02    false    {"a": 1}    ä½ å¥½    text    varchar
2    10.9    13    2022-10-02    true    {"b": 2}    nihao    文本    字符
2    10.9    13    2022-10-02    true    {"b": 2}    nihao    文本    字符
2    10.9    13    2022-10-02    true    {"b": 2}    nihao    文本    字符
100    1.09    1    2022-10-02    false    {"a": 1}    ä½ å¥½    text    varchar
use mo_catalog;
select * from cluster_table_3;
col1    col2    col3    col4    col5    col6    col7    col8    col9
1    1.09    1    2022-10-02    false    {"a": 1}    ä½ å¥½    text    varchar
2    10.9    13    2022-10-02    true    {"b": 2}    nihao    文本    字符
use mo_catalog;
select * from cluster_table_3;
col1    col2    col3    col4    col5    col6    col7    col8    col9
1    1.09    1    2022-10-02    false    {"a": 1}    ä½ å¥½    text    varchar
2    10.9    13    2022-10-02    true    {"b": 2}    nihao    文本    字符
update cluster_table_3 set col1=100 where account_id=(select account_id from mo_account where account_name="test_account1") and col1=1;
select col1,col2,col3,col4,col5,col6,col7,col8,col9 from cluster_table_3;
col1    col2    col3    col4    col5    col6    col7    col8    col9
1    1.09    1    2022-10-02    false    {"a": 1}    ä½ å¥½    text    varchar
2    10.9    13    2022-10-02    true    {"b": 2}    nihao    文本    字符
2    10.9    13    2022-10-02    true    {"b": 2}    nihao    文本    字符
2    10.9    13    2022-10-02    true    {"b": 2}    nihao    文本    字符
100    1.09    1    2022-10-02    false    {"a": 1}    ä½ å¥½    text    varchar
100    1.09    1    2022-10-02    false    {"a": 1}    ä½ å¥½    text    varchar
use mo_catalog;
select * from cluster_table_3;
col1    col2    col3    col4    col5    col6    col7    col8    col9
2    10.9    13    2022-10-02    true    {"b": 2}    nihao    文本    字符
100    1.09    1    2022-10-02    false    {"a": 1}    ä½ å¥½    text    varchar
use mo_catalog;
select * from cluster_table_3;
col1    col2    col3    col4    col5    col6    col7    col8    col9
1    1.09    1    2022-10-02    false    {"a": 1}    ä½ å¥½    text    varchar
2    10.9    13    2022-10-02    true    {"b": 2}    nihao    文本    字符
update cluster_table_3 set col1=100 where account_id=(select account_id from mo_account where account_name="test_account2") and col1=1;
select col1,col2,col3,col4,col5,col6,col7,col8,col9 from cluster_table_3;
col1    col2    col3    col4    col5    col6    col7    col8    col9
2    10.9    13    2022-10-02    true    {"b": 2}    nihao    文本    字符
2    10.9    13    2022-10-02    true    {"b": 2}    nihao    文本    字符
2    10.9    13    2022-10-02    true    {"b": 2}    nihao    文本    字符
100    1.09    1    2022-10-02    false    {"a": 1}    ä½ å¥½    text    varchar
100    1.09    1    2022-10-02    false    {"a": 1}    ä½ å¥½    text    varchar
100    1.09    1    2022-10-02    false    {"a": 1}    ä½ å¥½    text    varchar
use mo_catalog;
select * from cluster_table_3;
col1    col2    col3    col4    col5    col6    col7    col8    col9
2    10.9    13    2022-10-02    true    {"b": 2}    nihao    文本    字符
100    1.09    1    2022-10-02    false    {"a": 1}    ä½ å¥½    text    varchar
use mo_catalog;
select * from cluster_table_3;
col1    col2    col3    col4    col5    col6    col7    col8    col9
2    10.9    13    2022-10-02    true    {"b": 2}    nihao    文本    字符
100    1.09    1    2022-10-02    false    {"a": 1}    ä½ å¥½    text    varchar
delete from cluster_table_3 where account_id=0;
select col1,col2,col3,col4,col5,col6,col7,col8,col9 from cluster_table_3;
col1    col2    col3    col4    col5    col6    col7    col8    col9
2    10.9    13    2022-10-02    true    {"b": 2}    nihao    文本    字符
2    10.9    13    2022-10-02    true    {"b": 2}    nihao    文本    字符
100    1.09    1    2022-10-02    false    {"a": 1}    ä½ å¥½    text    varchar
100    1.09    1    2022-10-02    false    {"a": 1}    ä½ å¥½    text    varchar
use mo_catalog;
select * from cluster_table_3;
col1    col2    col3    col4    col5    col6    col7    col8    col9
2    10.9    13    2022-10-02    true    {"b": 2}    nihao    文本    字符
100    1.09    1    2022-10-02    false    {"a": 1}    ä½ å¥½    text    varchar
use mo_catalog;
select * from cluster_table_3;
col1    col2    col3    col4    col5    col6    col7    col8    col9
2    10.9    13    2022-10-02    true    {"b": 2}    nihao    文本    字符
100    1.09    1    2022-10-02    false    {"a": 1}    ä½ å¥½    text    varchar
delete from cluster_table_3 where account_id=(select account_id from mo_account where account_name="test_account1");
select col1,col2,col3,col4,col5,col6,col7,col8,col9 from cluster_table_3;
col1    col2    col3    col4    col5    col6    col7    col8    col9
2    10.9    13    2022-10-02    true    {"b": 2}    nihao    文本    字符
100    1.09    1    2022-10-02    false    {"a": 1}    ä½ å¥½    text    varchar
use mo_catalog;
select * from cluster_table_3;
col1    col2    col3    col4    col5    col6    col7    col8    col9
use mo_catalog;
select * from cluster_table_3;
col1    col2    col3    col4    col5    col6    col7    col8    col9
2    10.9    13    2022-10-02    true    {"b": 2}    nihao    文本    字符
100    1.09    1    2022-10-02    false    {"a": 1}    ä½ å¥½    text    varchar
delete from cluster_table_3 where account_id=(select account_id from mo_account where account_name="test_account2");
select col1,col2,col3,col4,col5,col6,col7,col8,col9 from cluster_table_3;
col1    col2    col3    col4    col5    col6    col7    col8    col9
use mo_catalog;
select * from cluster_table_3;
col1    col2    col3    col4    col5    col6    col7    col8    col9
use mo_catalog;
select * from cluster_table_3;
col1    col2    col3    col4    col5    col6    col7    col8    col9
truncate table cluster_table_3;
select col1,col2,col3,col4,col5,col6,col7,col8,col9 from cluster_table_3;
col1    col2    col3    col4    col5    col6    col7    col8    col9
use mo_catalog;
select * from cluster_table_3;
col1    col2    col3    col4    col5    col6    col7    col8    col9
use mo_catalog;
select * from cluster_table_3;
col1    col2    col3    col4    col5    col6    col7    col8    col9
drop table cluster_table_3;
create cluster table cluster_table_xx(account_id int);
invalid input: the attribute account_id in the cluster table can not be defined directly by the user
drop table if exists cluster_table_4;
create cluster table cluster_table_4(
col1 int,
col2 varchar
);
insert into cluster_table_4 values (1,'a',0),(2,'b',0);
insert into cluster_table_4 values (1,'a',1),(2,'b',1);
insert into cluster_table_4 values (1,'a',2),(2,'b',2);
update cluster_table_4 set account_id=(select account_id from mo_account where account_name="test_account1") where account_id=1;
update cluster_table_4 set account_id=(select account_id from mo_account where account_name="test_account2") where account_id=2;
select col1,col2 from cluster_table_4;
col1    col2
1    a
2    b
1    a
2    b
1    a
2    b
use mo_catalog;
desc cluster_table_4;
Field    Type    Null    Key    Default    Extra    Comment
col1    INT(32)    YES        null        
col2    VARCHAR(65535)    YES        null        
account_id    INT UNSIGNED(32)    NO        null        the account_id added by the mo
show create table cluster_table_4;
Table    Create Table
cluster_table_4    CREATE CLUSTER TABLE `cluster_table_4` (\n`col1` INT DEFAULT NULL,\n`col2` VARCHAR(65535) DEFAULT NULL\n)
drop table cluster_table_4;
internal error: do not have privilege to execute the statement
use mo_catalog;
insert into cluster_table_4 values (3, 'c');
internal error: only the sys account can insert/update/delete the cluster table
update cluster_table_4 set col1=10 where col2='a';
internal error: only the sys account can insert/update/delete the cluster table
delete from cluster_table_4 where col1=2;
internal error: only the sys account can insert/update/delete the cluster table
truncate table cluster_table_4;
internal error: only the sys account can truncate the cluster table
drop table cluster_table_4;
drop table if exists cluster_table_5;
create cluster table cluster_table_5(
col1 int,
col2 varchar
);
insert into cluster_table_5  values (1,'a',0),(2,'b',0),(3,'c',0),(4,'d',0),(5,'f',0),(6,'g',0);
insert into cluster_table_5  values (1,'a',1),(2,'b',1),(3,'c',1),(4,'d',1),(5,'f',1),(6,'g',1);
insert into cluster_table_5  values (1,'a',2),(2,'b',2),(3,'c',2),(4,'d',2),(5,'f',2),(6,'g',2);
update cluster_table_5 set account_id=(select account_id from mo_account where account_name="test_account1") where account_id=1;
update cluster_table_5 set account_id=(select account_id from mo_account where account_name="test_account2") where account_id=2;
drop table if exists cluster_table_6;
create cluster table cluster_table_6(
a int,
b varchar
);
insert into cluster_table_6 values (100,'a',0),(200,'a',0),(300,'a',0);
insert into cluster_table_6 values (100,'a',1),(200,'a',1),(300,'a',1);
insert into cluster_table_6 values (100,'a',2),(200,'a',2),(300,'a',2);
update cluster_table_6 set account_id=(select account_id from mo_account where account_name="test_account1") where account_id=1;
update cluster_table_6 set account_id=(select account_id from mo_account where account_name="test_account2") where account_id=2;
select a1.col1,a1.col2,a2.a,a2.b from cluster_table_5 a1 left join cluster_table_6 a2 on a1.col2=a2.b;
col1    col2    a    b
1    a    100    a
1    a    200    a
1    a    300    a
1    a    100    a
1    a    200    a
1    a    300    a
1    a    100    a
1    a    200    a
1    a    300    a
2    b    null    null
3    c    null    null
4    d    null    null
5    f    null    null
6    g    null    null
1    a    100    a
1    a    200    a
1    a    300    a
1    a    100    a
1    a    200    a
1    a    300    a
1    a    100    a
1    a    200    a
1    a    300    a
2    b    null    null
3    c    null    null
4    d    null    null
5    f    null    null
6    g    null    null
1    a    100    a
1    a    200    a
1    a    300    a
1    a    100    a
1    a    200    a
1    a    300    a
1    a    100    a
1    a    200    a
1    a    300    a
2    b    null    null
3    c    null    null
4    d    null    null
5    f    null    null
6    g    null    null
select a1.col1,a1.col2,a2.a,a2.b from cluster_table_5 a1 right join cluster_table_6 a2 on a1.col2=a2.b;
col1    col2    a    b
1    a    100    a
1    a    100    a
1    a    100    a
1    a    200    a
1    a    200    a
1    a    200    a
1    a    300    a
1    a    300    a
1    a    300    a
1    a    100    a
1    a    100    a
1    a    100    a
1    a    200    a
1    a    200    a
1    a    200    a
1    a    300    a
1    a    300    a
1    a    300    a
1    a    100    a
1    a    100    a
1    a    100    a
1    a    200    a
1    a    200    a
1    a    200    a
1    a    300    a
1    a    300    a
1    a    300    a
select a1.col1,a1.col2,a2.a,a2.b from cluster_table_5 a1 inner join cluster_table_6 a2 on a1.col2=a2.b;
col1    col2    a    b
1    a    100    a
1    a    200    a
1    a    300    a
1    a    100    a
1    a    200    a
1    a    300    a
1    a    100    a
1    a    200    a
1    a    300    a
1    a    100    a
1    a    200    a
1    a    300    a
1    a    100    a
1    a    200    a
1    a    300    a
1    a    100    a
1    a    200    a
1    a    300    a
1    a    100    a
1    a    200    a
1    a    300    a
1    a    100    a
1    a    200    a
1    a    300    a
1    a    100    a
1    a    200    a
1    a    300    a
select col1,col2 from cluster_table_5 union select a,b from cluster_table_6;
col1    col2
100    a
200    a
300    a
1    a
2    b
3    c
4    d
5    f
6    g
select col1,col2 from cluster_table_5 union all select a,b from cluster_table_6;
col1    col2
100    a
200    a
300    a
100    a
200    a
300    a
100    a
200    a
300    a
1    a
2    b
3    c
4    d
5    f
6    g
1    a
2    b
3    c
4    d
5    f
6    g
1    a
2    b
3    c
4    d
5    f
6    g
select col1,col2 from cluster_table_5 intersect select a,b from cluster_table_6;
col1    col2
SELECT col1,col2 FROM cluster_table_5 MINUS SELECT a,b FROM cluster_table_6;
col1    col2
1    a
2    b
3    c
4    d
5    f
6    g
SELECT a,b FROM cluster_table_6 MINUS SELECT col1,col2 FROM cluster_table_5;
a    b
100    a
200    a
300    a
use mo_catalog;
select * from cluster_table_5  left join cluster_table_6 on cluster_table_5.col2=cluster_table_6.b;
col1    col2    a    b
1    a    100    a
1    a    200    a
1    a    300    a
2    b    null    null
3    c    null    null
4    d    null    null
5    f    null    null
6    g    null    null
select * from cluster_table_5  right join cluster_table_6 on cluster_table_5.col2=cluster_table_6.b;
col1    col2    a    b
1    a    100    a
1    a    200    a
1    a    300    a
select * from cluster_table_5  inner join cluster_table_6 on cluster_table_5.col2=cluster_table_6.b;
col1    col2    a    b
1    a    100    a
1    a    200    a
1    a    300    a
select * from cluster_table_5 union select * from cluster_table_6;
col1    col2
100    a
200    a
300    a
1    a
2    b
3    c
4    d
5    f
6    g
select * from cluster_table_5 union all select * from cluster_table_6;
col1    col2
100    a
200    a
300    a
1    a
2    b
3    c
4    d
5    f
6    g
select * from cluster_table_5 intersect select * from cluster_table_6;
col1    col2
SELECT * FROM cluster_table_5 MINUS SELECT * FROM cluster_table_6;
col1    col2
1    a
2    b
3    c
4    d
5    f
6    g
SELECT * FROM cluster_table_6 MINUS SELECT * FROM cluster_table_5;
a    b
100    a
200    a
300    a
use mo_catalog;
select * from cluster_table_5  left join cluster_table_6 on cluster_table_5.col2=cluster_table_6.b;
col1    col2    a    b
1    a    100    a
1    a    200    a
1    a    300    a
2    b    null    null
3    c    null    null
4    d    null    null
5    f    null    null
6    g    null    null
select * from cluster_table_5  right join cluster_table_6 on cluster_table_5.col2=cluster_table_6.b;
col1    col2    a    b
1    a    100    a
1    a    200    a
1    a    300    a
select * from cluster_table_5  inner join cluster_table_6 on cluster_table_5.col2=cluster_table_6.b;
col1    col2    a    b
1    a    100    a
1    a    200    a
1    a    300    a
select * from cluster_table_5 union select * from cluster_table_6;
col1    col2
100    a
200    a
300    a
1    a
2    b
3    c
4    d
5    f
6    g
select * from cluster_table_5 union all select * from cluster_table_6;
col1    col2
100    a
200    a
300    a
1    a
2    b
3    c
4    d
5    f
6    g
select * from cluster_table_5 intersect select * from cluster_table_6;
col1    col2
SELECT * FROM cluster_table_5 MINUS SELECT * FROM cluster_table_6;
col1    col2
1    a
2    b
3    c
4    d
5    f
6    g
SELECT * FROM cluster_table_6 MINUS SELECT * FROM cluster_table_5;
a    b
100    a
200    a
300    a
drop table cluster_table_5;
drop table cluster_table_6;
drop table if exists cluster_table_7;
create cluster table cluster_table_7(
col1 int,
col2 varchar
);
insert into cluster_table_7 values (1,'a',0),(2,'b',0);
insert into cluster_table_7 values (1,'a',1),(2,'b',1);
insert into cluster_table_7 values (1,'a',2),(2,'b',2);
update cluster_table_7 set account_id=(select account_id from mo_account where account_name="test_account1") where account_id=1;
update cluster_table_7 set account_id=(select account_id from mo_account where account_name="test_account2") where account_id=2;
select col1,col2 from cluster_table_7;
col1    col2
1    a
2    b
1    a
2    b
1    a
2    b
drop account test_account1;
select col1,col2 from cluster_table_7;
col1    col2
1    a
2    b
1    a
2    b
drop account test_account2;
select col1,col2 from cluster_table_7;
col1    col2
1    a
2    b
drop table cluster_table_7;
